date,title,content
20250622,"""손흥민이 얼마나 떠나고 싶어 하는지 들어볼 때""…끝까지 SON에게 미루는 토트넘 ""프랭크 감독과 솔직한 대화 나눠야""","▲ 손흥민의 거취를 고민하는 토트넘을 향해 이 정도 금액이라면 매각에 무게를 둬야 한다는 조언이 나왔다. 과거 에버턴 회장직을 역임했던 키스 와이니스는 ""토트넘이 손흥민의 가치를 극대화하려면 지금이 적기""라며 ""손흥민은 현재 33세다. 이보다 더 늦게 매각하려고 한다면 좋은 금액을 얻지 못할 것""이라고 주장했다


[스포티비뉴스=조용운 기자] 토트넘 홋스퍼가 손흥민(33)에게 거취를 결정해달라고 요청하고 있다. 자신들의 손을 더럽히지 않겠다는 의미로도 해석된다.

영국 언론 '풋볼런던'은 22일(한국시간) 토마스 프랭크 신임 감독이 당장 할 일들을 나열했다. 토트넘의 환경을 파악하는 것부터 다음 시즌 계획을 이행하는데 필요한 선수단 구성까지 시간이 부족한 나날을 보내야 한다고 강조했다.

이중 손흥민과 속내를 모두 털어놓는 대화도 필요하다고 조언했다. 풋볼런던은 ""프랭크 감독은 토트넘의 주장인 손흥민과 이야기를 나눠야 한다. 손흥민은 현재 토트넘과 계약 마지막 12개월을 앞두고 있다""며 ""오랫동안 꿈꿔왔던 트로피를 마침내 들어올린 후 올여름 떠나는 것에 대해 어느 때보다 적극적으로 의사를 밝힐 것으로 보인다""고 내다봤다.

영국 현지는 손흥민이 올여름 새로운 출발에 나설 것으로 믿고 있다. 10년이면 동행을 마무리하는데 충분하다는 입장이다. 손흥민과 걸어온 한 세대의 마침표를 찍기에 최고점까지 도달했다는 평이다. 손흥민과 토트넘은 지난 시즌 유럽 무대에서 우승 트로피를 합작했다.

▲ 와이니스는 손흥민의 시장성을 아주 높게 바라봤다. 30대 중반을 향해가는 나이에도 당장 매물로 나오면 4,000만 파운드(약 737억 원)에서 최대 5,000만 파운드까지 받을 수 있다고 단언한다. 그는 ""아주 놀라운 이적이 될 것이다. 나는 충분히 거래가 이뤄질 수 있다고 생각한다. 올여름 손흥민이 사우디아라비아로 가는 것이 모두에게 이익이 될 것""이라고 강조했다.


토트넘은 유로파리그 결승에서 승리하며 41년 만의 유럽대항전 트로피를 품에 안았고, 손흥민은 주장으로서 구단에 역사적인 순간을 선물했다. 동료들이 하나둘 타이틀을 위해 떠나는 와중에도 10년을 꾹 참고 뛴 결과다.

손흥민은 그간 여러 이적설을 부인해왔다. 토트넘에 충성심이 강하고, 잉글랜드 프리미어리그를 누비려는 목표 의식이 강했다. 토트넘은 우승하지 못하는 곳이라는 비평에도 자신의 힘으로 역사를 바꿔보려는 의지도 상당했다. 아직 해야할 일이 많다며 미뤄왔던 토트넘과 이별의 시간이 점차 다가오고 있다.

무엇보다 숙원을 말끔하게 풀어냈다. 손흥민 역시 유럽축구연맹(UEFA) 유로파리그를 우승한 직후 ""17년간 아무도 해내지 못한 일을 해냈다""며 ""오늘만큼은 나를 토트넘의 전설이라 불러도 좋다""라고 감격했다. 그의 발언에서 보듯이 손흥민은 토트넘에서 커리어의 정점을 썼다.

▲ 손흥민이 토트넘의 미래 자원까지 확보해줄 수 있다. 지난 2015년 토트넘 유니폼을 입은 뒤 지금까지 항상 구단의 현재를 대표했던 인물이다. 10년 동안 총 398경기에 출전해 160골 이상을 기록, 아시아 선수로는 유례없는 커리어를 쌓았다. 프리미어리그 득점왕, FIFA 푸스카스상, 프리미어리그 이달의 선수 등 수많은 영예를 안으며 팀의 간판이자 프리미어리그 대표 공격수로 군림했다.


토트넘은 이제 세대교체를 원한다. 유로파리그 우승으로 한 챕터를 마무리했다는 시선이 강하다. 그래서 우승 감독인 엔제 포스테코글루 감독도 경질하고, 토마스 프랭크 감독을 선임했다. 새로운 사령탑에게 이전의 영광을 뒤로하고 자신만의 색채를 스며들게 만들어야 할 임무를 부여했다. 이럴 경우 직전 체제의 간판을 정리하는 것이 일반적이다.

토트넘은 손흥민이 미래 자원까지 확보해주길 바라고 있다. 사우디아라비아 이적설이 상당한 가운데, 오일머니로 무장한 곳이라 큰 이적료 수입을 기대하게 만드는 곳이다. 소문대로 사우디아라비아 클럽이 3,000만 유로(약 475억 원)의 이적료를 제시하면 토트넘 입장에서는 다음 시즌 전력 보강에 도움이 되는 금액을 손에 넣게 된다.

토트넘은 손흥민과 계약이 만료되기 전 현금화를 목표로 하고 있다. 영국 '더 타임즈'도 ""토트넘은 손흥민에게 장기 계약을 제안했으나 거절당했다. 이제 다니엘 레비 회장은 손흥민을 통해 최대한 수익을 내야 한다""며 ""선수와 구단 모두에게 이익이 되는 실용적 접근이 필수다. 올해 여름이 이적료를 제대로 받을 수 있는 마지막 기회""라고 했다.

▲ 무관의 꼬리표도 뗐다. 지난 2017-18시즌 잉글랜드 프리미어리그 2위, 2018-19시즌 유럽축구연맹(UEFA) 챔피언스리그 준우승, 2020-21시즌 영국풋볼리그(EFL) 카라바오컵 준우승으로 반복된 아쉬움을 마침내 털어냈다. 지난달 유로파리그 트로피를 품에 안으며 환희의 눈물을 흘렸다. 유로파리그 우승으로 손흥민의 토트넘 커리어는 완벽하게 방점을 찍었다고 보여진다.


거취를 결정하는 자리는 프리시즌 시작 전 손흥민과 프랭크 감독의 면담이 될 전망이다. 양측이 미래를 두고 솔직한 입장을 표할 것으로 보인다. 풋볼런던도 ""프랭크 감독은 손흥민이 얼마나 팀을 떠나고 싶어 하는지 정확하게 들어야 한다. 그리고 만약 그가 잔류한다면 손흥민을 위한 어떤 계획이 있는지 잘 설명해야 한다""고 말했다.

이어 ""손흥민은 10년간 토트넘에서 맹활약한 레전드다. 자신의 운명을 스스로 결정해야 할 권리가 있다""며 ""그에 앞서 프랭크 감독이 자신을 어떻게, 어디에 활용하지 듣는 것도 중요하다""고 둘의 미팅을 주목했다.

▲ 그동안 토트넘의 가치를 끌어올리기 위해 매진했던 손흥민이 어쩌면 사우디아라비아로 향하면서 미래의 전력 구성에도 영향을 줄 수 있다. 와이너스 전 회장의 예상대로 5,000만 파운드를 이적료로 남겨주면 토트넘은 다음 시즌 챔피언스리그를 대비하는 영입전에 아주 큰 이점을 얻게 된다. 토트넘만 생각해온 손흥민으로선 마지막까지 열매를 안기고 떠나는 셈이다."
20250622,"'장사꾼' 레비 회장은 결단 내렸다 ""손흥민 이적료 462억원 넘으면 감독 상관없이 이적 협상""","▲ 손흥민은 그간 여러 이적설을 부인해왔다. 토트넘에 충성심이 강하고, 잉글랜드 프리미어리그를 누비려는 목표 의식이 강했다. 토트넘은 우승하지 못하는 곳이라는 비평에도 자신의 힘으로 역사를 바꿔보려는 의지도 상당했다. 아직 해야할 일이 많다며 미뤄왔던 토트넘과 이별의 시간이 점차 다가오고 있다.


[스포티비뉴스=조용운 기자] 토트넘 홋스퍼가 손흥민(33)에게 거취 결정권을 위임한다면서도 특정 금액만 넘으면 이적 협상을 진행할 전망이다.

영국 언론 '풋볼 인사이더'는 22일(한국시간) ""토트넘은 손흥민을 향한 이적 제안이 2,500만 파운드(약 462억 원)만 넘으면 토마스 프랭크 신임 감독의 의견과 무관하게 협상에 나설 것""이라고 내다봤다.

재정 전문가 스테판 보르손의 예상을 곁들인 풋볼 인사이더는 ""손흥민의 나이와 연봉, 기량을 고려하면 2,500만 파운드가 현실적인 몸값""이라며 ""이 정도면 다니엘 레비 회장이 투자금을 회수하는 아주 매력적인 제안이 될 것""으로 밝혔다.
손흥민은 계약 만료를 1년 앞두고 있다. 그러나 에이징커브 신호가 보이는 상황에서 손흥민을 1년 더 남겨두는 것이 손해라는 입장이다. 풋볼 인사이더는 ""손흥민은 유지 비용이 상당한 선수다. 지금 수준을 다음 시즌에도 보여줄 수 있다고 단언할 수 없다. 어쩌면 부담 요소가 될 수 있다""고 경고했다.

전문가의 의견에 발맞춘 예상도 나오고 있다. 토트넘 소식을 주로 전하는 '토트넘 홋스퍼 뉴스'도 ""레비 회장은 손흥민 이적에 열려 있는 입장""이라고 했다. 평소 이적시장에서 수익 창출을 최우선으로 하는 레비 회장이기에 손흥민을 현금화할 수 있는 올여름 마지막 기회를 놓치지 않을 것이라는 예상이다.

▲ 무엇보다 숙원을 말끔하게 풀어냈다. 손흥민 역시 유럽축구연맹(UEFA) 유로파리그를 우승한 직후 ""17년간 아무도 해내지 못한 일을 해냈다""며 ""오늘만큼은 나를 토트넘의 전설이라 불러도 좋다""라고 감격했다. 그의 발언에서 보듯이 손흥민은 토트넘에서 커리어의 정점을 썼다.


레비 회장이 바라는 이적료는 현재 소문만 따졌을 때 충분히 받을 법하다. 손흥민 영입을 강력하게 희망하는 곳은 오일머니를 앞세운 사우디아라비아다. 유럽축구 이적시장 전문가 파브리시오 로마노에 따르면 사우디아라비아 복수의 구단이 손흥민 영입에 관심을 보인다. 손흥민의 에이전트도 사우디아라비아 팀들과 좋은 관계를 맺고 있어 단순한 대화로 끝나지 않을 것이라는 분석도 따른다.

토트넘은 확실하게 손흥민을 이적 불가 대상으로 보지 않는다. 토트넘의 자세는 이전 보도에서도 여러차례 확인됐다. 이달 초에도 영국 언론 '스카이스포츠'는 ""토트넘은 손흥민에 대한 중대한 수준의 제안이 들어오면 이적 논의에 나설 것""이라며 ""손흥민은 33살이며 계약기간도 1년밖에 남지 않았다. 토트넘은 손흥민이 새로운 도전을 원할 경우 이적을 막을 생각이 없다""고 강조했다.

토트넘은 손흥민을 통해 벌어들인 돈을 새로운 출발의 원동력으로 삼으려고 한다. 지난 시즌 유럽축구연맹(UEFA) 유로파리그 우승으로 새 시즌 챔피언스리그 진출권을 확보하면서 전력 강화가 중요해졌다. 손흥민을 이적 자금 마련을 위해 활용할 가능성이 크다. 스카이스포츠는 ""토트넘은 챔피언스리그 복귀를 앞두고 있다. 이적 자금을 마련하는 데 손흥민의 이적을 활용해 스쿼드를 재편하고자 한다""고 바라봤다.

▲ 토트넘은 이제 세대교체를 원한다. 유로파리그 우승으로 한 챕터를 마무리했다는 시선이 강하다. 그래서 우승 감독인 엔제 포스테코글루 감독도 경질하고, 토마스 프랭크 감독을 선임했다. 새로운 사령탑에게 이전의 영광을 뒤로하고 자신만의 색채를 스며들게 만들어야 할 임무를 부여했다. 이럴 경우 직전 체제의 간판을 정리하는 것이 일반적이다.


토트넘은 다른 클럽의 제안에 앞서 손흥민의 의견을 물을 계획이다. '풋볼런던'은 ""토마스 프랭크 신임 감독은 토트넘의 주장인 손흥민과 이야기를 나눠야 한다. 손흥민은 현재 토트넘과 계약 마지막 12개월을 앞두고 있다""며 ""오랫동안 꿈꿔왔던 트로피를 마침내 들어올린 후 올여름 떠나는 것에 대해 어느 때보다 적극적으로 의사를 밝힐 것으로 보인다""고 내다봤다.

거취를 결정하는 자리는 프리시즌 시작 전 손흥민과 프랭크 감독의 면담이 될 전망이다. 양측이 미래를 두고 솔직한 입장을 표할 것으로 보인다. 풋볼런던도 ""프랭크 감독은 손흥민이 얼마나 팀을 떠나고 싶어 하는지 정확하게 들어야 한다. 그리고 만약 그가 잔류한다면 손흥민을 위한 어떤 계획이 있는지 잘 설명해야 한다""고 말했다.

▲ 토트넘은 손흥민이 미래 자원까지 확보해주길 바라고 있다. 사우디아라비아 이적설이 상당한 가운데, 오일머니로 무장한 곳이라 큰 이적료 수입을 기대하게 만드는 곳이다. 소문대로 사우디아라비아 클럽이 3,000만 유로의 이적료를 제시하면 토트넘 입장에서는 다음 시즌 전력 보강에 도움이 되는 금액을 손에 넣게 된다.


이어 ""손흥민은 10년간 토트넘에서 맹활약한 레전드다. 자신의 운명을 스스로 결정해야 할 권리가 있다""며 ""그에 앞서 프랭크 감독이 자신을 어떻게, 어디에 활용하지 듣는 것도 중요하다""고 둘의 미팅을 주목했다.

그런데 레비 회장은 손흥민을 향한 제안이 매력적이면 프랭크 감독의 의견조차 무시할 수 있는 인물이다. 토트넘이 바라는 최소한의 이적료인 2,500만 파운드는 사우디아라비아에 부담되는 금액이 아니어서 현실화 확률이 아주 높다.

▲ 토트넘은 손흥민과 계약이 만료되기 전 현금화를 목표로 하고 있다. 영국 '더 타임즈'도 ""토트넘은 손흥민에게 장기 계약을 제안했으나 거절당했다. 이제 다니엘 레비 회장은 손흥민을 통해 최대한 수익을 내야 한다""며 ""선수와 구단 모두에게 이익이 되는 실용적 접근이 필수다. 올해 여름이 이적료를 제대로 받을 수 있는 마지막 기회""라고 했다."
20250622,"주전 자리 보장해달라!…英 국대 원하는 리버풀, ‘반다이크-코나테 챔피언 듀오’ 깨지나","수비 보강을 꾀하는 리버풀이 마크 게히(크리스털 팰리스) 영입에 열을 올리고 있다. 다만 게히는 주전 자리를 보장받길 원한다. 영국 현지 언론은 게히의 리버풀 이적 가능성이 점차 줄어들고 있다고 전망했다.

영국 매체 ‘스카이 스포츠’는 21일(한국시간) “리버풀이 게히에 대해 장기적인 관심을 보였지만, 올여름 그가 리버풀로 이적할 가능성은 희박해 보인다”라고 보도했다. 이어 “게히는 리버풀 외에도 여러 팀과 연결되고 있다. 그는 이적 시 주전 자리를 확보하길 원하고 있다”라고 전했다.

게히는 2000년생 잉글랜드 출신 수비수다. 첼시에서 성장해 스완지 시티(임대)를 거쳐 2021년부터 크리스털 팰리스에서 활약 중이다. 팀의 핵심 수비수다. 빠른 발과 탄탄한 수비력을 자랑한다. 여기에 빌드업 능력까지 갖추고 있다. 2024-25시즌 팰리스의 잉글랜드축구협회(FA)컵 우승 주역이다. 게히는 잉글랜드 연령별 대표팀을 두루 거친 뒤 2022년 5월에는 A대표팀 데뷔전을 치렀다. 꾸준히 소집 명단에 이름을 올리고 있으며, 차기 잉글랜드 핵심 수비수로 평가받고 있다.

사진=파브리지오 로마노 기자 SNS
사진=REUTERS=연합뉴스 제공
전성기를 향해 달려가는 나이, 프리미어리그에 검증된 수비수라는 점은 빅클럽이 군침을 안 흘릴 수 없다. 리버풀을 비롯해 아스널, 뉴캐슬 유나이티드, 첼시, 토트넘 등 게히를 주목했다. 더욱이 팰리스와 계약기간은 2026년 6월까지, 1년 남은 상황에서 비교적 싼 이적료로 그를 품길 바라고 있다.

팰리스의 요구 이적료도 점차 내려갔다. 2023-24시즌을 앞두고 뉴캐슬이 게히 영입을 위해 팰리스와 접촉했다. 당시 팰리스는 7,000만 파운드(한화 약 1,294억 원)를 요구했다. 현재 리버풀이 팰리스와 영입 합의에 도달했다. 이적료는 3,400만 파운드(약 628억 원)로 추정되고 있다. 게히는 재계약 의사가 없다. 팰리스는 올여름 게히를 매각하지 못하면 내년 여름 자유계약(FA)으로 이적료 없이 떠나보내야 한다.

사진=REUTERS=연합뉴스 제공
리버풀 주전 수비수 버질 반다이크(왼쪽)와 이브라히마 코나테(오른쪽). 사진=AFPBBNews=News1
리버풀 주전 수비수 버질 반다이크. 사진=AFPBBNews=News1
관건은 게히의 주전 자리 보장이다. 리버풀은 2003년생 유망주 수비수 자렐 콴사가 바이얼 레버쿠젠 이적을 앞두고 있다. 수비 보강을 통해 옵션을 늘리고자 한다. 다만 주전 자리를 보장해 줄 수 있을지 미지수다. 현재 리버풀에는 2024-25시즌 프리미어리그 우승을 이끈 버질 반다이크-이브라히마 코나테가 버티고 있기 때문이다.

리버풀이 게히 영입에 적극적으로 나서는 또 다른 이유는 코나테의 이탈 대비 차원이기도 하다. 코나테는 2026년 6월 계약이 종료된다. 벌써 레알 마드리드가 FA로 영입할 것이라는 예상이 이어지고 있다. 이에 리버풀은 올여름 게히 영입을 통해 수비 공백을 최소화하겠다는 심산이다.

영국 ‘더 가디언’은 게히가 내년 여름 이적을 선택할 수 있다고 주장했다. 매체는 “내년 1월부터 게히는 타 팀과 협상할 수 있다. 그는 미래에 대한 결정을 서두르지 않을 것이다. 적절한 조건이 없다면, 1년 더 팰리스에 머물 준비도 되어 있다”라고 전했다.

[김영훈 MK스포츠 기자]"
20250622,"너무하네! 프랭크 감독, 손흥민에게 입장 전달...""벤치에 머무는 시간 감수한다면 남을 수 있어""","토마스 프랭크 감독이 손흥민에게 자신의 계획을 설명했다는 주장이 제기됐다.

토트넘 훗스퍼 소식통인 '스퍼스 웹'은 21일(한국시간) ""프랭크 감독은 손흥민의 거취에 대해 토트넘 측에 이미 명확한 입장을 전달한 것으로 보인다. 새 보도에 따르면 손흥민은 오직 한 가지 조건 아래에서만 다가오는 시즌에도 팀에 남을 수 있다고 한다""라고 보도했다.
현재 손흥민의 거취에 많은 관심이 집중되고 있는 상황이다. 우선 원하는 팀은 공개됐다. 사우디아라비아가 유력하다. 영국 '토크 스포츠'는 ""사우디의 알 아흘리, 알 나스르, 알 카디시야 세 구단이 손흥민 영입에 관심을 보이고 있다. 이들은 4,000만 유로(약 634억 원) 이적료를 제시할 준비가 되어 있는 것으로 알려졌다""라고 전했다.

사우디뿐만 아니라 튀르키예의 페네르바체까지 연결됐다. 튀르키예 축구 이적시장 전문가인 야지즈 샤본추글루 기자는 ""페네르바체의 조세 무리뉴 감독이 손흥민과 직접 대화를 나눈 것으로 전해졌다. 손흥민은 무리뉴 감독과의 관계가 매우 깊으며, 이적에 긍정적인 반응을 보이고 있다. 그러나 이적료가 3,000만 유로(약 472억 원)에 달하기 때문에 이적이 성사될 가능성은 매우 낮다""라고 했다.



최근 여러 현지 보도를 종합하면 페네르바체는 손흥민의 이적료와 연봉을 감당하기 어려운 것으로 알려졌다. 그렇다면 남은 팀은 사우디 클럽. 사우디는 막대한 연봉을 준비했다. '토크 스포츠'는 ""사우디 측은 손흥민에게 연봉 3,000만 유로(약 475억 원)를 제안할 준비가 되어 있다. 만약 손흥민이 이적에 동의한다면, 한국 방송사와의 중계권 계약도 동반될 것으로 예상된다. 이는 구단 입장에서도 즉각적인 수익으로 이어질 수 있다는 평가다""라고 내다봤다.

여기서 의문점이 드는 것은 과연 손흥민이 사우디의 제안을 받아들이는지다. 과거 손흥민은 여러 차례 사우디 이적 질문에 ""(기)성용이 형이 대한민국 축구대표팀 주장은 중국에 가지 않는다고 말한 적이 있다. 나 역시 돈보다 좋아하는 리그에서 뛰는 게 가장 중요한 부분이다""라며 딱 잘라 선을 그었기 때문.

우선 확실한 건 그 어느 때보다 이번 여름 손흥민이 팀을 떠날 가능성이 높다는 것이다. '풋볼 런던' 소속 알레스데어 골드 기자는 ""결국 손흥민의 미래는 본인이 결정해야 할 문제다. 그는 클럽에서 10년간 헌신하며 트로피를 들어 올린 레전드다. 그런 결정을 스스로 내릴 자격이 있다. 이번 여름은 손흥민이 이적할 가능성이 그 어느 때보다 높다. 무엇보다도 그는 프랭크 감독과 대화를 나눠야 한다. 감독이 손흥민을 어떻게 계획하고 있는지에 대해서 말이다. 이미 그 얘기가 오갔는지는 확실하지 않다""라고 설명했다.



두 주장이 충돌한다. 골드 기자는 아직 손흥민과 프랭크 감독이 대화를 나누지 않았다고 밝혔다. 그런데 이와 반대로 '스퍼스 웹'은 ""프랭크 감독은 올여름 스쿼드 리빌딩을 계획 중이다. 이 과정에서 손흥민의 이적을 받아들일 준비가 되어 있다. 다만 잔류 조건도 있다. 손흥민은 다음 시즌 벤치에 머무는 시간을 감수한다면 팀에 남을 수 있다는 입장을 이미 전달받은 것으로 알려졌다""라고 주장했다.

다만 공신력만 놓고 따지면 골드 기자의 보도가 더욱 신뢰가 가는 것이 사실이다. 보통 '스퍼스 웹', '토트넘 훗스퍼 뉴스', '더 보이 훗스퍼', 'TBR 풋볼' 등 이러한 매체들은 본인들의 주장을 뒷받침할 신빙성 있는 자료가 없다. 주로 사견이 기사 내용을 덮는 경우가 대부분이다. 따라서 아직까지는 손흥민이 프랭크 감독과 만나지 않았다고 보는 것이 맞는 판단으로 보인다."
20250622,"한국어로 ""안녕하세요"" 인사한 토트넘 신임 감독…""그를 처음 만난 모든 이들 깊은 감명"" 호평일색","사진=토트넘


[포포투=박진우]

토마스 프랭크 감독을 향한 호평이 여기저기서 날아 들고 있다.
영국 'TBR 풋볼'은 21일(이하 한국시간) ""지금까지 프랭크 감독을 직접 만난 모든 이들은 깊은 인상을 받았다. 그는 매우 세심한 성향의 감독일 뿐만 아니라, 성격적으로도 훌륭한 인물이라는 평가를 받고 있다고 한다""고 보도했다.

토트넘 홋스퍼는 큰 결단을 내렸다. 유럽축구연맹(UEFA) 유로파리그(UEL) 우승을 안긴 포스테코글루 감독을 경질하고, 브렌트포드에서 가능성을 보였던 프랭크 감독을 선임한 것. 다니엘 레비 회장은 18일 ""포스테코글루 감독 경질은 감정적으로 힘들었다. 결정은 구단 전체의 판단이었고, 우리는 구단을 위한 올바른 선택을 했다고 믿는다""고 말했다.

하루 뒤 프랭크 감독의 '첫 번째 인터뷰'가 공개됐다. 그는 포스테코글루 감독과 UEL 우승에 관한 질문에 ""포스테코글루 감독에게 축하 인사를 전하고 싶다. 그는 영원히 토트넘의 전설로 남을 것이며, 축하받을 자격이 있다. 나는 포스테코글루 감독과 그의 코치진이 만들어 놓은 토대를 기반으로 이 자리에 오게 됐다. 그 점에 대해 매우 겸허한 마음을 가지고 있다. 그들이 쏟아부은 훌륭한 노력들을 이어가기 위해 나 역시 최선을 다할 것이다""라며 감사한 마음을 전했다.

이어 프랭크 감독은 본인의 축구 스타일을 말했다. 그는 ""말보다는 보여주는 것이 중요하다고 생각한다. 몇 마디로 요약하자면, 나는 공격적이고 전진적인 축구를 하고자 한다. 이 구단의 철학과 역사 자체가 공격적인 축구에 뿌리를 두고 있다는 사실을 잘 알고 있고, 현 선수단에는 공격 재능이 넘치는 선수가 많다. 그 부분이 정말 기대된다""며 향후 본인이 지휘할 토트넘의 전술 색채를 밝혔다.

첫 번째 인터뷰가 공개된 이후, 프랭크 감독을 향한 호평이 날아 들었다. 영국 '풋볼 런던' 소속으로 토트넘을 전담하는 알레스데어 골드 기자 전언이었다. 골드 기자는 ""내가 들은 바로는, 이번 주 토트넘 훈련장에서 그를 처음 만난 모든 사람들이 매우 깊은 인상을 받았다고 한다""며 운을 띄웠다.

이어 골드 기자는 ""지금까지는 기대했던 모습 그대로다. 정말 좋은 사람이자, 아주 세심한 감독이다. 아무래도 이전에 있던 팀(브렌트포드)과 비교하면 훨씬 더 큰 조직에 발을 들인 셈이니, 그만큼 집중하고 있는 것 같다""고 전했다.

한편 프랭크 감독은 한국 팬들에게도 인사를 전했다. 그는 구단 공식 채널을 통해 ""안녕하세요 한국, 저는 토마스 프랭크 감독입니다""라며 한국어로 인사했다. 아울러 영어로 ""제 한국어가 마음에 드셨기를 바랍니다. 모든 성원에 감사드립니다. 이번 여름, 한국에서 빨리 만나뵙기를 바랍니다""라고 덧붙였다. 

사진=토트넘"
