date,title,content
20250417,"[속보] 손흥민, 프랑크푸르트전 2차전에도 결장...감독이 직접 언급 [공식발표]","[사진] ⓒGettyimages(무단전재 및 재배포 금지)


[OSEN=정승우 기자] 토트넘 홋스퍼의 최대 위기다. 손흥민(33, 토트넘)이 독일 원정 명단에서 제외됐다.

토트넘 홋스퍼는 17일(이하 한국시간) 공식 홈페이지를 통해 ""엔지 포스테코글루 감독은 손흥민이 독일 원정에 동행하지 않았으며, 유로파리그 8강 2차전 아인트라흐트 프랑크프루트 원정에 결장한다고 직접 밝혔다""라고 공식 발표했다.

토트넘은 13일 영국 울버햄튼의 몰리뉴 스타디움에서 열린 2024-2025시즌 프리미어리그 32라운드 원정경기에서 울버햄튼 원더러스에 2-4로 패했다.
토트넘은 4-3-3 포메이션으로 나섰고, 손흥민은 발 부상으로 결장했다.

경기 시작 2분 만에 라얀 아이트 누리가 선제골을 넣었고, 전반 38분 제드 스펜스의 자책골이 나오면서 토트넘은 0-2로 끌려갔다.

후반 들어 토트넘은 루카스 베리발과 로드리고 벤탄쿠르를 투입했고, 후반 14분 마티스 텔이 브레넌 존슨의 크로스를 마무리해 한 골을 만회했다. 그러나 아이트 누리의 크로스를 예르겐 스트란 라르센이 골로 연결하며 울버햄튼이 다시 두 골 차로 달아났다.

후반 40분 히샬리송이 코너킥 상황에서 밀어넣어 2-3으로 추격했지만, 직후 베리발의 실수로 마테우스 쿠냐에게 추가 실점을 허용했다. 경기는 그대로 토트넘의 2-4 패배로 종료됐다.

[사진] ⓒGettyimages(무단전재 및 재배포 금지)
이 경기에서는 손흥민이 출전 명단에 아예 제외되는 흔치 않은 상황이 연출됐다. 킥오프 직전 토트넘 구단은 공식 홈페이지를 통해 ""포스테코글루 감독은 지난 아인트라흐트 프랑크푸르트전 무승부 후 선발 명단에서 6명의 변화를 줬다. 최전방에는 텔이 손흥민을 대신해 선발로 복귀했으며, 손흥민은 아예 이번 경기 출전 명단에서 제외됐다""라고 전했다.

구단에 따르면 포스테코글루 감독은 ""손흥민이 발에 충격을 입었다. 그래서 조심하고 있다""라며 부상 방지를 위한 명단 제외라고 직접 설명했다.

토트넘은 리그 15위에 자리하고 있으며 FA컵과 카라바오컵(EFL컵)에서 모두 탈락했다. 다음 시즌 유럽 대항전에 출전할 수 있는 유일한 방법은 유로파리그 우승이다.

쉽진 않아 보인다. 당장 프랑크푸르트 원정이라는 고비부터 넘겨야 한다. 프랑크푸르트는 토트넘전 이후 치른 하이덴하임과 맞대결에서 3-0으로 완승을 거두며 기세를 올렸다. 

[사진] ⓒGettyimages(무단전재 및 재배포 금지)
유로파리그 2차전에서 손흥민이 뛸 수 있을 것이라는 전망이 나왔다. 데일리 메일은 ""리그 15위로 추락한 토트넘에 유로파리그는 사실상 이번 시즌 마지막 희망""이라고 알리며 ""이번 시즌 손흥민은 토트넘 소속으로 모든 대회를 통틀어 43경기에 출전해 11골 12도움을 기록 중이다""라고 설명했다.

포스테코글루 감독 역시 당시에는 ""손흥민은 발에 타박상을 입어 조심스럽게 접근하고 있다. 윌손 오도베르도 마찬가지다. 둘 다 프랑크푸르트전엔 복귀할 수 있을 것""이라고 이야기했다.

[사진] ⓒGettyimages(무단전재 및 재배포 금지)
하지만 상황이 변했다. 토트넘은 ""손흥민은 지난 울버햄튼과의 프리미어리그 경기에서도 발 부상으로 결장했으며 이번 유럽 대회(프랑크푸르트전) 출전을 기했으나 여전히 통증이 남아 있다. 2차전 출전을 불가능한 상황""이라며 손흥민의 결장 소식을 공식적으로 알렸다. 

구단은 포스테코글루 감독의 말도 전했는데, 그는 ""결국 손흥민은 함께하지 못했다. 그는 이번 경기에서 빠지는 유일한 선수""라고 이야기했다. /reccos23@osen.co.kr"
20250417,"[속보] 英 'BBC' 비피셜 떴다…""토트넘 UEL 탈락→포스테코글루 경질될 듯"" 손흥민 결장 확정","[스포티비뉴스=박대성 기자] 토트넘 입장에서 유로파리그가 미래를 결정할 분수령이다. 유로파리그 8강에서 떨어진다면 엔지 포스테코글루 감독 경질 카드를 만질 수 있다. 이번에는 손흥민(33, 토트넘 홋스퍼)까지 부상으로 뛰지 못한다. 어쩌면 최악이다.

17일(한국시간) 영국 공영방송 'BBC'는 유럽축구연맹(UEFA) 유로파리그(UEL) 8강 2차전을 앞두고 ""포스테코글루 감독 입지가 점점 줄어들고 있다. 프리미어리그 15위에 이어 FA컵과 카라바오컵까지 탈락했다. 유로파리그에서 탈락한다면 미래에 대한 의심이 더 커질 것""이라며 유로파리그 유무에 따라 경질 가능성을 내비쳤다.

무엇보다 큰 타격은 주장 손흥민의 결장이다. 토트넘은 경기 전날 구단 홈페이지를 통해 ""손흥민은 발 부상으로 이번 원정에 동행하지 않았으며, 프랑크푸르트전에도 결장한다""고 발표했다. 손흥민은 최근 몇 주 동안 오른발 통증을 안고 경기를 소화해왔으며, 지난 프리미어리그 울버햄프턴전에도 결장한 바 있다.
포스테코글루 감독은 기자회견에서 ""손흥민은 며칠 전부터 훈련에 참여했지만 여전히 통증이 남아 있었다. 손흥민의 회복이 최우선이라는 판단 아래 독일 원정에서 제외했다""고 설명했다. 감독은 ""이번 원정에 동행하지 않은 1군 선수는 손흥민이 유일하다""고 덧붙이며 손흥민의 결장이 전술적으로 얼마나 중요한 요소인지를 시사했다.

손흥민은 이번 시즌 공식전 43경기에서 11골 12도움을 기록하며 토트넘 공격의 핵심으로 활약해왔다. 특히 유로파리그에서만 3골을 기록하며 브레넌 존슨과 함께 팀 내 최다 득점자다. 손흥민의 프랑크푸르트전 결장은 단순한 한 명의 공백을 넘어선다.



이번 경기를 앞두고 포스테코글루 감독의 거취를 둘러싼 불확실성도 점점 커지고 있다. 'BBC'까지 포스테코글루 감독 입지를 집중적으로 지켜보고 있는 상황이다. 실제로 토트넘은 올 시즌 프리미어리그 32경기에서 무려 17패를 당하며 리그 15위로 추락했다.

이에 대해 포스테코글루 감독은 ""나는 내 커리어나 향후 계획을 전혀 고려하지 않는다""며 ""내게 중요한 것은 이 경기다. 이 팀이 4강이라는 큰 기회를 잡을 수 있다는 점이 가장 중요하다""고 말했다. 이어 ""내가 좋은 감독인지 아닌지의 평가는 경기 하나로 결정되는 것이 아니라고 생각한다. 어떤 결과가 나오든, 그것은 나의 자존감과는 무관하다""고 덧붙였다.

그는 ""팬들의 시선이나 외부의 소문은 중요하지 않다. 나는 내 방식대로 팀을 이끌고 있고, 지금은 오직 프랑크푸르트와의 경기에만 집중하고 있다""고 말했다. 다만 이 발언은 일각에서는 해명보다는 무책임한 태도로도 읽힐 수 있어 논란의 여지를 남겼다.

손흥민의 공백은 당장 공격 조합에도 큰 변화를 요구한다. 포스테코글루 감독은 좌우 측면에 메티스 텔과 브레넌 존슨, 중앙에는 제임스 매디슨이나 도미닉 솔란케를 배치할 가능성이 크다. 특히 텔은 울버햄프턴전에서 선발로 나서 득점을 기록하며 기대감을 높였다.



하지만 손흥민 특유의 침투 능력과 결단력, 그리고 리더십은 단순히 수치로 대체할 수 없는 부분이다. 실제로 '풋볼인사이더'는 ""손흥민은 최근 경기력 저하를 겪었지만, 그를 완전히 대체할 자원은 없다""며 ""그의 결장은 토트넘의 공격 흐름 전체에 영향을 줄 것""이라고 분석했다.

이번 유로파리그는 단순한 컵대회가 아니다. 챔피언스리그 직행 티켓이 걸려 있는 만큼, 토트넘에게는 명운이 걸린 대회다. 리그에서의 부진과 무관하게 유럽 무대 성적이 팀 운영의 핵심 지표가 될 수 있기 때문이다.

토트넘은 2008년 리그컵 이후 무관 상태를 이어가고 있으며, 팬들의 실망도 갈수록 커지고 있다. 특히 다니엘 레비 회장을 비롯한 구단 수뇌부는 이번 유로파리그 성적에 따라 포스테코글루 감독의 거취를 논의할 수 있다는 보도가 잇따르고 있다.

포스테코글루 감독이 시즌 초반의 기대를 살리지 못한 채 유럽 무대마저 결과를 내지 못한다면, 토트넘은 또다시 감독 교체라는 카드를 꺼낼 가능성이 높다. 이미 영국 언론들은 포스테코글루 감독 후임으로 몇몇 감독의 이름을 언급하기 시작했다."
20250417,'대참사' 레알 마드리드 모든 걸 잃었다... 아스널에 1-2 또 패배 '합계 스코어 1-5' 탈락→아스널 16년 만에 UCL 4강행,"<저작권자(c) 연합뉴스, 무단 전재-재배포, AI 학습 및 활용 금지>
[스포츠조선 김대식 기자]레알 마드리드가 기적을 만들지 못했다.

레알은 17일 오전 4시(한국시각) 스페인 마드리드의 산티아고 베르나베우에서 열린 아스널과의 2024~2025시즌 유럽 챔피언스리그(UCL) 8강 2차전에서 1대2로 패배했다. 레알은 1차전 0대3 패배를 극복하지 못하고 탈락했다.

레알은 킬리안 음바페, 비니시우스 주니오르, 주드 벨링엄, 호드리구, 오랠리엥 추아메니, 페데리코 발베르데, 다비드 알라바, 안토니오 뤼디거, 라울 아센시오, 루카스 바스케스, 티보 쿠르투아를 선발로 내보냈다.
<저작권자(c) 연합뉴스, 무단 전재-재배포, AI 학습 및 활용 금지>
아스널은 가브리엘 마르티넬리, 미켈 메리노, 부카요 사카, 데클란 라이스, 토마스 파티, 마르틴 외데고르, 마일스 루이스-스켈리, 야콥 키비오르, 윌리엄 살리바, 위리옌 팀버, 다비드 라야로 선발 명단을 구성했다.
<저작권자(c) 연합뉴스, 무단 전재-재배포, AI 학습 및 활용 금지>
전반 2분 만에 레알이 역습에서 득점을 터트렸지만 음바페의 명백한 오프사이드였다. 아스널도 마냥 웅크리지 않았다. 전반 8분 마르티넬리의 역습에서 사카가 공을 받았다. 중앙으로 치고 들어와 슈팅을 시도했지만 쿠르투아가 쳐냈다.

아스널이 선제골 기회를 만들었다. 전반 11분 주심이 온필드리뷰를 진행하기 시작했다. 앞선 코너킥에서 아센시오가 메리노를 잡아당기는 모습이 나왔기 때문이다. 주심은 페널티킥을 선언했다. 사카가 키커로 나섰지만 쿠르투아가 사카의 파넨카킥을 막아내면서 레알을 구해냈다.
<저작권자(c) 연합뉴스, 무단 전재-재배포, AI 학습 및 활용 금지>
레알이 더 기세가 올라서 공격을 연이어 퍼붓기 시작했다. 전반 22분 레알이 페널티킥을 얻어냈다. 바스케스의 크로스 과정에서 라이스가 음바페를 잡아당겼다는 주심의 판정이었다. 라이스는 강하게 항의했다. 온필드 리뷰 끝에 페널티킥은 취소됐다. 라이스가 반칙을 범하지 않았다는 판정이었다.

레알이 완벽하게 경기를 주도하는 양상이었지만 아스널의 수비가 쉽게 흔들리지 않았다. 아스널도 역습으로 레알을 위협했다. 전반 추가시간 5분 아스널의 역습에서 마르티넬리가 사각에서 과감하게 슈팅을 시도했지만 쿠르투아가 또 막아냈다. 전반전은 무득점으로 종료됐다.

후반 9분 코너킥에서 음바페한테 정확하게 공이 왔지만 헤더가 골대 위로 향했다. 레알의 공격 패턴에 아스널이 적응하면서 경기는 다소 답답해졌다.
사진=UCL
오히려 아스널이 앞서갔다. 후반 20분 메리노가 경합한 후 사카가 공을 받았다. 다시 메리노가 패스를 받은 뒤 사카에게 넘겨줬고, 사카가 침착한 마무리로 득점에 성공했다.

레알이 1분 만에 추격골을 터트렸다. 후반 22분 살리바가 비니시우스에게 허무하게 공을 내줬고, 비니시우스가 빈 골대로 밀어 넣었다.
<저작권자(c) 연합뉴스, 무단 전재-재배포, AI 학습 및 활용 금지>
레알은 후반 29분 음바페가 발목이 돌아가는 부상까지 당하고 말았다. 음바페는 곧바로 교체됐다. 아스널은 후반 35분 외데고르의 슈팅으로 승리까지 노렸지만 벗어났다. 레알은 후반 막판에도 별다른 공격을 보여주지 못했다. 아스널은 후반 추가시간 막판 마르티넬리의 역습을 막아내지 못해 실점하며 승리까지 거뒀다. 레알은 홈에서도 패배하면서 자존심까지 박살났다. 아스널은 16년 만에 UCL 4강에 진출해 파리 생제르맹(PSG)과 대결한다.

김대식 기자 rlaeotlr2024@sportschosun.com"
20250417,"'SON 불쌍해서 안되겠다' 무리뉴, 경질 4년 만 토트넘 복귀한다! ""센세이셔널한 사건 될 것"" (伊 매체)","[SPORTALKOREA] 배웅기 기자= 주제 무리뉴(62) 페네르바흐체 SK 감독이 토트넘 핫스퍼로 돌아올 수 있다는 충격적 소식이다.

한때 세계 최고의 명장으로 이름을 날린 무리뉴는 포르투, 첼시, 인테르, 레알 마드리드, 맨체스터 유나이티드 등을 거치며 우승 트로피를 쓸어 담다시피 했다. 특유의 카리스마는 수많은 팬을 양산했고, 바르셀로나 시절 펩 과르디올라(맨체스터 시티) 감독과 라이벌리는 십수 년이 지난 지금까지도 회자되고 있다.

어느덧 60대에 접어든 무리뉴는 현대 축구 흐름에 뒤처진 감독이라는 오명을 썼다. 특히 지난 2019년 겨울 부임한 토트넘에서는 오랜 '무관'의 설움을 깨뜨리지 못한 채 경질되는 수모를 겪었다. 다니엘 레비 회장은 2020/21 카라바오컵 결승을 앞두고 무리뉴를 경질하는 납득할 수 없는 판단으로 여론의 뭇매를 맞았다. 당시 라이언 메이슨(現 코치) 감독대행이 이끈 토트넘은 시쳇말로 쪽 한번 제대로 쓰지 못하고 맨체스터 시티에 패했다.


이후 AS 로마에서 2021/22 유럽축구연맹(UEFA) 컨퍼런스리그 우승, 2022/23 UEFA 유로파리그 준우승 등 괄목할 만한 성적을 내며 부활의 신호탄을 쏘아 올린 무리뉴는 현재 페네르바흐체에서 튀르키예 무대 도전기를 이어가고 있다. '숙명의 라이벌' 갈라타사라이 SK의 그늘에 가려진 터라 적응기가 쉽지만은 않으나 올 시즌 여전히 쉬페르리그 우승 경쟁을 벌이고 있다.

이러한 상황에서 토트넘이 무리뉴의 복귀를 꾀한다는 충격적 소식이 나왔다. 이번 시즌 전례 없는 부진에 허덕이는 토트넘은 올여름 엔지 포스테코글루 감독의 경질을 대비해 다양한 사령탑 후보를 물색하고 있다. 애초 유력한 후임자로 여겨진 안도니 이라올라 감독은 본머스와 재계약에 근접한 상황이다.



영국 매체 '풋볼365'는 16일(한국시간) 이탈리아 매체 '투토칼치오에스테로' 보도를 인용, ""무리뉴가 토트넘으로 돌아오는 문이 열릴 수 있다. 성사된다면 센세이셔널한 사건이 될 것""이라며 ""페네르바흐체에서 격동의 모험을 해온 그 역시 토트넘 부임에 관심을 가질 수 있다""고 밝혔다.

현재로서 가능성이 높은 편은 아니지만 무리뉴가 토트넘 시절 제자들과 좋은 관계를 유지해 온 점을 생각하면 이뤄지지 말라는 법도 없어 보인다. 벤 데이비스, 손흥민 등이 여전히 토트넘에서 활약하는 가운데 이 중에서 손흥민의 경우 무리뉴 밑에서 기량이 꽃을 피우며 세계 최고의 공격수로 우뚝 선 바 있다.


사진=토트넘 핫스퍼, 게티이미지코리아

취재문의 sportal@sportalkorea.co.kr"
20250417,"로메로가 옳았다...'철강왕' 손흥민까지 박살 낸 토트넘 의료진, 팬들도 분노 폭발→""대체 왜 계속 뛰게 한 거야!""","사진=토트넘 SNS 캡처
로이터연합뉴스
로이터연합뉴스
로이터연합뉴스
[스포츠조선 이현석 기자]손흥민이 부상으로 경기에 나설 수 없는 상황에 놓였다. 토트넘 팬들은 의료진에게 분노했다.

토트넘은 18일 오전 4시(한국시각) 독일 프랑크푸르트의 프랑크푸르트 슈타디온에서 열리는 아인트라흐트 프랑크푸르트와의 2024~2025시즌 유로파리그(UEL) 8강 2차전을 앞두고 있다.

경기 전 충격적인 소식이 등장했다. 바로 손흥민의 결장이었다. 엔제 포스테코글루 감독은 사전 기자회견에 참석해 ""손흥민은 원정을 떠나지 못했다. 그가 유일하게 원정을 놓친 선수다. 그는 몇 주 동안 발 문제로 고생해왔고 잘 견뎌왔지만 지난 며칠간 너무 고통스러워 했다. 어제 훈련을 하려고 했는데 상태가 좋지 않아서 회복할 수 있는 최선의 방법을 찾기 위해 집에서 쉬게 하기로 결정했다""라며 손흥민이 이번 경기에 나설 수 없음을 명확히 밝혔다.

로이터연합뉴스
손흥민의 결장에 포스테코글루도 안타까움을 표했다. 그는 ""타격이 있긴 하지만 올해 일어난 다른 모든 일과 마찬가지로 우리가 극복해야 할 또 다른 도전""이라며 ""그에게는 안타까운 일이고, 정말 열심히 노력했다. 주말 경기에 그를 제외시킨 이유는 그가 몇 주 동안 발 문제로 고생하고 있었기 때문에 회복할 시간을 주기 위해서였지만, 회복할 수 없었다. 올 한해 내내 이런 어려움을 겪어왔다""라고 설명했다.

토트넘 구단도 공식 홈페이지를 통해 '손흥민은 8강 2차전 경기에 뛸 수 없다'며 '손흥민이 독일에 가지 않아 목요일 열리는 유로파리그에 출전할 수 없다. 발 부상으로 직전 리그 경기도 출전하지 못했다. 이번 경기는 출전할 수 있을 것이라 희망했지만, 여전히 경기에 나서기엔 불편함을 느끼고 있어 어려웠다'고 평가했다.

앞서 손흥민은 지난 13일 영국 울버햄튼의 몰리뉴 스타디움에서 열린 울버햄튼과의 리그 경기에도 명단 제외되며 팬들을 놀라게 했다. 당시 프랑크푸르와의 1차전 부상으로 문제가 생기며 경기에 나서지 못했다고 알려졌다.

로이터연합뉴스
다만 당시 경기 후에는 손흥민이 이번 프랑크푸르트와의 2차전을 앞두고는 돌아올 것이라는 희망적인 전망이 우세했다. 영국의 이브닝스탠더드는 손흥민에 대해 '손흥민은 아인트라흐트 프랑크푸르트전 부상으로 울버햄튼전에 출전하지 못했다. 이 경기는 2024년 10월 이후 손흥민이 잉글랜드 프리미어리그(EPL)에서 결장한 첫 경기다. 좋은 소식은 프랑크푸르트와의 2차전에 경기 출전이 예상된다는 점이다'라고 전했다.

토트넘에게도 중요한 경기였기에 손흥민의 복귀가 절실했다. 토트넘은 프랑크푸르트를 꺾지 못한다면 올 시즌을 다시 한번 무관으로 마무리하게 되며, 포스테코글루 감독은 경질이 유력하다. 하지만 이번 발표로 손흥민의 공백을 극복하며 승리까지 노려야 하는 상황에 놓이게 됐다.

로이터연합뉴스
이런 상황에서 토트넘 팬들은 손흥민의 상태에 대해 의료진의 대처가 미흡했음을 지적했다. 일부 팬들은 손흥민이 몇 주 동안 부상 문제를 겪었다는 소식에 대해 ""대체 왜 부상인 선수를 계속 뛰게 한 것인가"", ""왜 중요 경기에 기용하는 것을 생각하지 않았나"", ""시즌 내내 부상 위험이 있었을 수 있다"", ""불쌍한 손흥민이 계속 쉴 수 있기를 바란다""라고 비판했다.

토트넘 의료진에 대한 비판은 이번이 처음이 아니다. 지난 3월 토트넘 부주장인 크리스티안 로메로가 직접적으로 토트넘 의료진을 지적한 바 있다. 당시 로메로는 아르헨티나의 TyC스포츠와의 인터뷰에서 ""나는 훨씬 더 빨리 복귀할 수 있었지만 그렇지 못했다. 아무 일도 일어나지 않았고 부상을 당한 채로 몇 달이 지났다. 그렇기에 모든 것들이 아주 복잡해졌다. 아르헨티나 대표팀의 의무팀이 나를 나쁜 순간에서 구해줬다. 그들에게 감사하다""라며 토트넘 의료진의 무능함을 대놓고 비판했다.

이후 로메로가 토트넘 의료진에 불만이 크고, 재활 과정에서도 의견을 겪었다는 소식까지 전해지며, 토트넘의 의료 체계에 대한 우려가 제기됐다. 만약 손흥민 또한 로메로처럼 제대로 치료 받지 못했다면, 토트넘 의료진의 부상 관리에 심각한 문제가 있음을 시사하는 것일 수 있다. 손흥민은 이번 시즌을 포함해 토트넘 합류 이후 모든 시즌을 36경 이상 소화할 정도로 철강왕 면모를 보였기에 우려는 더 크다. 앞서 글로벌 스포츠 매체 디 어슬레틱은 지난 1월 토트넘의 전임 의무팀 및 스포츠사이언스 팀장이 엔제 포스테코글루 감독과 충돌한 이후 물러났다고 밝히기도 했다.

로이터연합뉴스
한편 손흥민의 빈자리를 채울 선수로는 5명의 선수가 이름을 올렸다. 영국의 스퍼스웹은 '토트넘은 프랑크푸르트전을 앞두고 부상 소식이 들려왔다. 손흥민이 완전히 결장하게 됐고, 이제 왼쪽에 큰 공백을 채워야 한다'라며 5명의 후보를 거론했다.

스퍼스웹은 '마티스 텔이 왼쪽으로 나서는 것은 놀라운 일이 아니다. 울버햄튼전에서 그는 골대 앞에서 좋은 활약을 펼쳤고, 수비에서도 적극적으로 나섰다. 선발 명단에 오를 유력한 후보다'라며 텔을 가장 유력한 대체자로 꼽았고, 이외에도 윌손 오도베르, 브레넌 존슨, 히샬리송, 데얀 쿨루셉스키를 후보로 평가했다.

이현석 기자 digh1229@sportschosun.com"
