date,title,content
20250305,"양민혁 비상! 英 매체가 ""미친 잠재력"" 극찬했는데...토트넘은 쓸 생각이 없다!→'930억' FW 또 영입한다","[SPORTALKOREA] 황보동혁 기자= 양민혁(19·퀸즈 파크 레인저스)의 활약에도 불구하고 토트넘 핫스퍼는 또 유망주 영입 계획을 세우고 있다.


양민혁은 지난 2일(이하 한국시간) 셰필드 유나이티드전에 선발 출전하며 퀸즈파크레인저스(이하 QPR) 합류 후 두 번째로 선발 출전했다. 이날 경기에 나선 양민혁은 팀의 패배를 막지 못했지만, 좋은 경기력을 선보였다. 영국 매체 '런던월드'는 경기 종료 후 양민혁에게 평점 8점을 줬다.


선수가 QPR 임대에서 좋은 활약을 보이자 토트넘의 팬들도 기쁨을 표현했다.

토트넘 소식을 전문으로 하는 '더 스퍼스 웹'은 4일 '양민혁은 미친 잠재력을 보유했다. 토트넘의 팬들은 지난 경기에 나선 양민혁에 경기력에 매우 기뻐하고 있다'라며 팬들의 반응을 전했다.

특히 토트넘이 양민혁과 같은 포지션인 티모 베르너(29)의 완전 영입을 포기할 거란 소식까지 들렸다. 계속해서 좋은 활약을 이어간다면 다음 시즌 토트넘에서 기회가 생길 가능성이 높아 보였다.


그러나 구단은 양민혁에게 기회를 줄 생각이 없어 보인다.

영국 매체 '팀 토크'는 5일 '토트넘이 5,000만 파운드(약 930억 원)의 몸값을 가진 타일러 디블링(19·사우샘프턴)의 영입을 자신하고 있다. 구단은 영입 경쟁에서 자신들의 우위를 확신하고 있다'라고 보도했다.


디블링은 리그 꼴찌 팀인 사우샘프턴의 '소년 가장'역할을 하고 있다. 19살이라는 어린 나이에도 높은 전술 이해도와 축구 지능으로 상대 수비수를 곤란하게 만들었다. 그리고 상황에 따라 최전방 공격수에도 위치하며 팀이 필요로 할 때마다 큰 도움을 주고 있다.

만약 토트넘이 디블링을 영입한다면 양민혁의 주전 경쟁에 적신호가 들어올 예정이다. 두 선수는 나이와 소화할 수 있는 포지션이 모두 동일하기 때문이다.


게다가 이제 막 잉글랜드 무대에 적응해 가는 양민혁과 다르게 디블링은 1군 무대에서 경험이 풍부하다. 이번 시즌 28경기에 나서 4골 2도움을 기록하고 있다.


다만 토트넘이 디블링 영입을 무조건 성공시킬 거란 보장은 없다. '선수의 영입전에 앞서 있다'라는 주장은 어디까지나 구단의 입장이기 때문이다.

팀 토크는 이적 시장 전문가인 독일 매체 '스카이스포츠' 소속 플로리안 플레텐버그기자의 인터뷰를 인용 '디블링은 이번 시즌 리버풀과 맨체스터 유나이티드를 상대로 뛰어난 활약을 펼친 이후로 대다수 클럽의 관심을 받고 있다'라며 토트넘의 선수 영입 전망이 좋지 않다고 밝혔다.

사진= 팀토크, 게티이미지코리아

취재문의 sportal@sportalkorea.co.kr"
20250305,"손흥민 초대박! ""SON 오라, 2021년부터 원했어""…뮌헨 뚝심 그대로 밀고 나간다→토트넘 SON 방출 없다? NO 상관","(엑스포츠뉴스 김환 기자) 토트넘 홋스퍼가 올여름 손흥민을 매각하지 않으려고 한다고 해도 바이에른 뮌헨은 개의치 않는다.

바이에른 뮌헨은 지난 2021년 높은 몸값으로 인해 영입하지 못한 손흥민 영입에 다시 한번 도전하겠다는 생각이다.

독일 남부지역 매체 'TZ'는 5일(한국시간) ""바이에른 뮌헨은 영입 명단에 새로운 스타 플레이어를 추가했다. 아마도 해리 케인이 기뻐할 것""이라며 ""바이에른 뮌헨은 현재 공격진을 강화할 높은 퀄리티의 선수를 찾고 있다. 새로 영입될 가능성이 있는 선수 중 한 명은 적어도 해리 케인가 함께 뛰는 것이 어떠한 일인지 알고 있다""고 보도했다.

'TZ'가 언급한 선수는 바로 손흥민이다.

과거 토트넘 시절 케인과 함께 프리미어리그(PL) 최고 수준의 호흡을 자랑하며 프리미어리그를 대표하는 공격 듀오로 꼽혔던 손흥민과 케인이 바이에른 뮌헨에서 재회할 가능성에 주목한 것이다. 두 사람은 토트넘에서 함께 뛰던 시절 프리미어리그에서만 47골을 기록한 바 있다.



그만큼 손흥민의 바이에른 뮌헨 이적설은 현재 축구계에서 가장 많은 관심을 받고 있는 루머이기도 하다.

손흥민이 바이에른 뮌헨으로 이적할 수 있다는 소식을 가장 먼저 전한 것은 스페인의 축구 매체 '피차헤스'였다. 언론은 지난달 26일 현재 토트넘에서의 미래가 불안한 손흥민이 다가오는 여름 이적시장에서 바이에른 뮌헨과 계약을 맺을 수 있다며 바이에른 뮌헨이 손흥민에게 매력적인 행선지로 꼽힌다고 보도했다.
'피차헤스'는 ""바이에른 뮌헨은 다음 시즌이 시작되기 전 공격을 강화할 계획이다. 손흥민의 스타일은 바이에른 뮌헨과 잘 어울린다""면서 ""바이에른 뮌헨은 손흥민이 자신의 커리어 마지막 단계에서 우승 트로피에 도전할 수 있는 팀이 될 것""이라며 손흥민의 바이에른 뮌헨 이적이 선수와 구단에 모두 이익이 될 수 있을 거라고 내다봤다.

사실 언론의 공신력을 생각하면 '피차헤스'가 손흥민의 바이에른 뮌헨 이적설을 보도할 때까지만 하더라도 손흥민이 정말 토트넘을 떠날 거라고 생각하는 팬들은 많지 않았다.



그러나 27일 영국 최고의 정론지 '더 타임스'가 손흥민의 상황을 보도하면서 분위기가 급변했다.

손흥민과 토트넘이 현재 재계약 협상에서 난항을 겪고 있으며, 심지어 손흥민의 재계약 여부가 불투명한 이유가 토트넘이 손흥민을 밀어내는 게 아닌 손흥민이 토트넘과의 협상을 거절하고 있다는 것이었다.

언론은 ""토트넘은 손흥민과 재계약을 맺고 그를 구단 역사상 최고의 선수 중 하나로 남기길 원한다. 하지만 손흥민이 토트넘과의 계약 연장에 대해 회의적인 태도를 보여 협상에 어려움을 겪고 있다""고 했다.

'더 타임스'와 같은 수준은 아니지만, 여전히 높은 공신력을 자랑하는 글로벌 스포츠 매체 'ESPN' 역시 손흥민의 현 상황이 좋지 않아 보인다면서 손흥민이 이번 시즌을 마지막으로 토트넘을 떠나는 결정을 내릴 수 있다고 주장했다.

'ESPN'은 지난 1일 ""손흥민에게 무슨 일이 일어난 걸까? 손흥민이 이번 시즌에 언제 편안한 모습을 보였는지 기억이 나지 않는다. 정말 걱정된다""면서 ""손흥민은 잡음을 만드는 선수가 아니지만, 손흥민 측은 토트넘이 새로운 계약에 대한 논의를 하지 않은 것에 대해 상당히 실망했다. 손흥민의 계약을 1년 연장시키는 건 토트넘 입장에서는 논리적인 선택이었으나, 손흥민과 팬들에게는 이해하기 힘든 일이었다""고 짚었다.

그러면서 ""만약 손흥민이 이적하기를 원한다면 완벽한 마무리가 될 수 있을 것""이라며 손흥민이 이번 시즌을 끝으로 다른 팀으로 이적하더라도 이상하지 않을 것이라고 했다.



다만 손흥민의 입장과 별개로 토트넘은 손흥민을 적어도 계약이 끝날 때까지 데리고 있겠다는 생각으로 보인다.

영국의 수도 런던을 연고로 하는 구단들을 취재하는 언론 '풋볼 런던'에서 오랜 기간 토트넘 전담 기자로 활동한 알레스데어 골드에 따르면 손흥민은 토트넘이 구상하고 있는 방출 명단에서 제외됐다.

골드는 히샬리송과 티모 베르너, 브리안 힐, 이브 비수마, 세르히오 레길론, 프레이저 포스터, 알피 화이트먼이 토트넘의 방출 명단에 포함됐다고 전했다. 손흥민을 비롯해 최근 타 구단들의 관심을 받는 것으로 알려진 크리스티안 로메로나 미키 판 더 펜 등도 모두 명단에서 제외된 게 눈에 띈다.

손흥민의 전술적 및 마케팅적 가치를 생각하면 토트넘이 당장 손흥민을 내보내지 않으려는 건 이해가 된다. 손흥민은 지난 10년 동안 경기장 안팎에서 토트넘에 막대한 이익을 안긴 선수다. 경기장 위에서는 팀의 핵심 공격수로 활약하며 토트넘이 위기에 처할 때마다 팀을 구했고, 밖에서는 아시아 최고의 선수로서 엄청난 수익을 끌고 왔다.



그러나 손흥민의 거취를 결정하는 주체는 토트넘이 아닌 손흥민이라는 점을 확실하게 해야 한다.

토트넘의 리빙 레전드로 통하는 손흥민이 팀을 떠나겠다고 선언하면 구단 입장에서는 그를 막을 길이 없다. 바이에른 뮌헨이 진정 손흥민을 영입할 생각이 있다면 손흥민에게 집중하면 되는 것이다.

'TZ'도 이를 아는 듯 ""손흥민은 지난 1월 토트넘과의 계약을 연장했지만, 바이에른 뮌헨의 관심이 구체화되면 바이에른 뮌헨과 같은 유명 구단과 고액의 계약을 맺는 걸 두 번 생각할 것""이라며 만약 바이에른 뮌헨이 구체적으로 관심을 드러낸다면 손흥민도 흔들릴 거라고 했다.

매체는 그러면서 ""바이에른 뮌헨은 이미 손흥민에게 관심을 가졌던 적이 있다. 구단이 손흥민에게 관심을 보이는 건 처음 있는 일이 아니""라면서 ""바이에른 뮌헨은 2021년 봄부터 당시 29세였던 손흥민을 주목했다. 그러나 당시 토트넘과의 계약 연장과 높은 이적료로 인해 이적은 실패로 끝났다. 당시 바이에른 뮌헨은 손흥민을 영입하기 위해 8500만 유로(약 1314억원)를 내놓아야 했을 것""이라며 바이에른 뮌헨이 이전에도 손흥민을 영입하려고 했었다고 돌아봤다.

사진=연합뉴스"
20250305,[속보] 손흥민 핵충격! 끝내 토트넘과 결별하는 안타까운…핵심 FW 부상 OUT→우승 물거품 위기,"(엑스포츠뉴스 김현기 기자) 손흥민의 우승 꿈이 물거품 위기를 맞았다.

토트넘의 이번 시즌 유일한 희망인 유럽축구연맹(UEFA) 유로파리그 토너먼트를 앞두고 손흥민의 파트너인 핵심 공격수가 부상으로 낙마하는 일을 겪었다.

마침 손흥민의 올여름 거취 논란이 한창이고, 토트넘이 유로파리그 우승에 실패해 다음 시즌 UEFA 클럽대항전에 출전하지 못하면 토트넘을 어떻게든 떠나려고 할 것이란 예상이 나오는 가운데 토트넘에 날벼락 같은 일이 터졌다.

최근 손흥민은 유럽 언론에서 적지 않은 혹평, 더 나아가 악담 수준의 발언을 듣고 있다.

프랑스 축구 매체인 '풋메르카토'가 손흥민을 가리켜 실패의 상징이라고 저격했다.

매체는 지난 2일 ""손흥민은 지난 1월 현 계약을 (1년) 연장한 뒤에도 토트넘에서 여전히 하락세를 타고 있다""며 ""그의 팀 내 지위에 의문이 제기되고 있는데 문제는 더 깊을 수도 있다""고 했다.

이어 ""토트넘은 현재 잉글리시 프리미어리그 13위에 머무르고 있다. 국내 컵대회에서도 전부 탈락했다""며 ""특히 손흥민은 토트넘의 새로운 실패를 상징한다""며 ""손흥민은 계약 연장을 한 뒤 단 한 골만 넣었다""며 ""위고 요리스(골키퍼)와 해리 케인이 토트넘을 떠난 뒤 한국 선수는 더욱 고립돼 보인다. 케인이 떠난 뒤 손흥민의 얼굴에서 미소가 사라지기 시작했다""고 했다.

손흥민은 올해 6월 계약이 만료될 예정이었으나 토트넘이 1년 연장 옵션을 지난 1월7일 활성화하면서 최대 내년 6월까지 북런던 구단에 머무를 수 있게 됐다.



계약 연장 이후 부진이 더욱 깊어졌다는 게 '풋메르카토'의 주장이다.

매체는 ""토트넘에서 새 계약을 제안받지 못하고 현 계약을 연장한 것에 손흥민이 매우 실망했을 것 같다. 올해 북런던 구단에서 활약한지 10년이 되는 그는 이제 토트넘에서의 장(챕터)을 마무리할 때가 됐다""며 계약 연장 뒤 도움을 쏟아내는 것은 간과하고 한 골에 그친 것만 주목했다.
틀린 주장이긴 하다. 손흥민이 지난 1월 말 유럽축구연맹(UEFA) 유로파리그 호펜하임과의 원정 경기에서 멀티골을 넣었기 때문이다. 유로파리그에 출전하는 팀들, 특히 독일 분데스리가 팀들은 만만한 상대가 아니다.

영국 축구 전문 매체 '풋볼팬캐스트'는 손흥민이 개혁의 대상이라는 얼토당토 않은 주장을 서슴 없이 했다.

""시간이 다 됐다. 포스테코글루 감독은 손흥민의 커리어를 결정할 중대한 선택을 해야 한다""면서 손흥민이 팀을 떠날 시점이 다가오고 있다고 주장한 것이다.

매체는 이어 ""토트넘은 최근 몇 년간 다양한 스타일의 감독을 거치며 우여곡절을 겪었고, 현재는 공격적인 축구를 구사하는 포스테코글루 체제에 정착했다. 그러나 개혁은 아직 끝나지 않았으며, 또 한 명의 레전드가 팀을 떠날 가능성이 크다""고 손흥민의 팀 내 역할 축소 가능성을 제기했다.

토트넘이 세대교체를 해야하는 것은 맞지만 지금 어린 선수들이 손흥민을 멘토 삼아 따르고 있다. 팀의 중심을 손흥민이 잘 잡아주고 있는데 망언 같은 발언을 했다.



같은 날 영국 매체 'ESPN UK'도 손흥민을 도마 위에 올렸다.

매체는 ""손흥민은 단순한 윙어가 아닌 중앙 공격수로도 기용되고 있으며, 이는 해리 케인의 이적과 포스테코글루 감독의 전술적 요구로 인해 불가피한 변화였다""며 ""더 넓은 범위에서 더 많은 활동량을 소화해야 하는 부담이 가중됐다""고 설명했다.

이 매체 역시 손흥민의 표정 변화에 주목했다.

""그는 항상 환한 미소로 팬들에게 긍정적인 에너지를 전하던 선수였다. 하지만 최근 경기 후 그의 얼굴에는 피로와 부담이 묻어나고 있다""며, 팀의 부진을 주장으로서 개인적인 책임으로 받아들이고 있을 가능성을 제기했다.

손흥민의 거취는 최근 영국 유력지인 '더 타임스'는 손흥민이 토트넘의 재계약 제안을 받아들이지 않고 있음을 공개하면서 활활 타올랐다.

토트넘이 손흥민을 거부하는 것이 아니라 손흥민이 토트넘 잔류를 장고하고 있다는 얘기다.

토트넘이 손흥민을 붙잡을 방법은 결국 금전적인 대우를 최대한 맞춰주는 것과 함께 팀의 비전을 드러내는 것이다.

그런 측면에서 이번 시즌 유로파리그 우승 여부가 관건인데 16강 앞두고 팀의 핵심 공격 자원인 데얀 쿨루세브스키가 다친 것이다.



영국 스카이스포츠는 4일 ""쿨루세브스키가 발을 다쳐 당분간 결장이 불가피하다""며 ""현재 정밀 검사를 받고 있다. 결과가 나와야 복귀일이 결정될 것""이라고 했다.

토트넘은 5일 오전 2시45분 네덜란드 알크마르와 16강 원정 경기를 치르는데 토트넘 입장에선 우승 꿈이 토너먼트 초반에 무너질 수 있는 위기에 직면했다.

손흥민이 토트넘과 결별을 하게 되면 그에게 러브콜을 보낼 것으로 예상되는 팀까지 나온 상황에서 쿨루세브스키의 부상이 심상치 않다. 쿨루세브스키는 이번 시즌 프리미어리그 최고의 플레이메이커로 각광을 받고 있다.

토트넘 전문 매체 '스퍼스웹'이 2일 손흥민의 바이에른 뮌헨 이적 가능성을 알린 것이다.

""케인의 영입은 뮌헨의 확실한 투자로 입증됐고, 그는 분데스리가에서 각종 기록을 갈아치우고 있다. 또한, 영입 당시 많은 의문을 낳았던 다이어 역시 경험과 노련함을 발휘하며 팀에 성공적으로 안착했다""는 매체는 ""이제 뮌헨은 또 다른 토트넘 핵심 선수, 손흥민을 영입할 가능성을 검토하고 있다""고 보도했다.

매체는 ""올해 32세가 된 손흥민이 새로운 도전을 원할 수도 있으며, 우승을 노릴 수 있는 뮌헨의 제안을 반길 가능성이 있다""면서 ""뱅상 콤파니 감독이 공격진 강화를 원하고 있으며, 손흥민의 스타일이 그의 전술에 완벽하게 맞아떨어진다는 평가를 받고 있다""고 덧붙였다.



토트넘은 지난달 막말 수준의 강도 높은 비판을 계속 듣고 있으나 그라운드에서 골과 어시스트로 답하고 있다.

2008년 10월부터 2012년 6월까지 토트넘 지휘봉을 잡았던 70대 해리 레드냅 감독의 발언이 압권이었다.

그는 ""지금 주장 완장을 가진 손흥민을 사랑하지만 주장으로서 내게 인상을 준 적이 없다""라며 ""포스테코글루는 용감하게 행동해야 하며, 지금 아치 그레이에게 완장을 넘겨주면 10년 동안 돌려주지 않을 것""이라고 말했다.

그레이는 지난해 여름에 합류한 2006년생 유망주이다. 올시즌 많은 경기를 뛰긴 했지만 아직 20세도 안 됐고, 토트넘에서 1년도 뛰지 않은 선수에게 10년째 뛰고 있는 손흥민의 주장 완장을 넘겨야 한다는 충격적인 주장을 한 것이다.

그럼에도 손흥민은 컨디션 관리에 만전을 기하며 묵묵히 앞으로 나아가고 있는데 쿨루세브스키 부상이란 악재가 토트넘 우승 가도에 걸림돌이 되고 말았다.

사진=엑스포츠뉴스DB / 연합뉴스"
20250305,"""손흥민 180억 줄게 남아! 방출 없다"" 토트넘 강경 입장 나왔다 '물귀신?'…살생부 등장→ ""SON 남기고, 히샬리송+베르너 OUT""","(엑스포츠뉴스 권동환 기자) 손흥민이 바이에른 뮌헨의 관심을 받고 있는 가운데 토트넘 홋스퍼의 살생부가 공개됐다.

앞서 손흥민 거취 논쟁이 다시 한 번 불거졌다.

특히 그간 마이너 매체 위주로 거론됐으나 지난달 27일 영국 '더 타임스'가 끼어들면서 불이 붙었다.

신문은 ""토트넘은 손흥민과 재계약을 통해 그가 구단 역사상 최고의 선수 중 한 명으로 남길 원하고 있다. 그러나 손흥민이 계약 연장에 회의적인 태도를 보이면서 협상에 난항을 겪고 있다""라고 보도했다.

매체에 따르면 토트넘은 손흥민을 매각할 생각이 없으며 토트넘에서 은퇴하기를 바라지만 오히려 손흥민이 토트넘의 재계약 제안을 받아들이지 않고 있다는 얘기다. 

토트넘 팬들이 놀랄 수밖에 없는 내용이다. '더 타임스'는 영국 최고의 정론지로, 전세계 많은 사람들이 구독한다.

같은 날 토트넘도 손흥민과의 결별을 각오하고 있다는 보도가 나왔다.
영국 매체 '풋볼 인사이더'는 ""토트넘 직원들 사이에서 손흥민에 대한 우려가 나오고 있다""며 ""그래서 손흥민의 잠재적인 대체자를 고르고 있는 상황이다. 대안도 나왔다""고 했다.

크리스털 팰리스의 에체베리 에제, FC바르셀로나 페란 토레스 등이 매체가 꼽은 손흥민 대안이다.

토트넘은 올여름에 손흥민을 팔지 못하면 내년 여름에 한 푼도 받지 못하고 잃어버릴 수 있어 그를 원하는 팀의 제안을 들어볼 가능성이 크다. 손흥민의 이적 의지가 굳건하다면 토트넘도 놔줄 수밖에 없다.

그런 상황에서 영국 매체 '풋볼 런던'은 5일 토트넘 공격수 15명의 미래에 대해 논의했다. 이때 히샬리송, 티모 베르너 등 7명의 선수가 팀을 떠날 수 있다고 주장했다.

매체는 손흥민의 미래에 대해서도 생각을 드러냈다.

언론은 ""토트넘은 7월 초에 33세가 되는 손흥민의 계약을 더 연장할지 결정해야 한다""라며 ""손흥민은 프리미어리그에서 매우 높은 수준을 유지하며 조용한 시즌을 보냈을지 모르지만 지금부터 5월까지 여전히 팀에 큰 영향을 끼칠 수 있다""라고 주장했다.



이어 ""손흥민을 지키고 다음 시즌 이후 계약을 연장할지 결정하라""라고 덧붙였다.

매체는 손흥민을 지키는 것을 추천했다. 손흥민 연봉이 180억원으로 토트넘 최고 수준이어서 최근엔 ""비싸다""는 의견이 나왔지만 '풋볼 런던'은 1년 더 유지하는 것에 동의했다.

다만 손흥민 거취는 엄밀히 말하면 토트넘에 달린 문제가 아니다. 특히 손흥민은 토트넘의 장기 재계약 제안을 거절한 것으로 알려져 화제가 되면서 1년 남은 그가 토트넘과 협상 신경전 등에서 주도권 놓치지 않갰다는 의지는 나타냈다.

영국 매체 '90min'은 ""토트넘과 손흥민은 맨유 이적설에 미래 계획을 놓고 충돌했다""라며 ""토트넘은 올해 초 손흥민의 계약을 1년 연장 조항을 발동해 2026년까지 늘렸지만, 손흥민은 토트넘의 장기 계약 제안을 거부했다""라고 전했다.

손흥민이 재계약을 거부했다면 여름에 이적할 가능성이 더욱 높아질 것으로 예상된다. 매체도 ""손흥민의 하락세는 구혼자 수를 줄이지 않았다""라며 ""맨체스터 유나이티드는 손흥민에 대한 충격적인 이적과 연결됐고, 바르셀로나도 이전에 손흥민에게 관심이 있다는 소문이 돌았다""라고 밝혔다.



또 손흥민은 최근 독일 분데스리가 최고의 클럽 바이에른 뮌헨의 러브콜을 받고 있다.

영국 매체 '스포츠몰'은 ""토트넘 공격수 손흥민은 바이에른 뮌헨의 관심을 받고 있으며, 그는 더 큰 야망을 가진 클럽으로 이적하고 싶어하는 것으로 전해졌다""라고 보도했다.

매체는 ""뮌헨은 토트넘의 야망 부족에 좌절감을 느끼고 있는 것으로 알려진 레전드 손흥민을 영입할 수도 있다""라며 손흥민이 우승을 위해 토트넘을 떠나 뮌헨으로 향할 수 있다고 주장했다.



더불어 손흥민과 해리 케인의 재회에도 관심을 모았다. 언론은 ""전 토트넘 공격수 해리 케인은 토트넘에서 11시즌을 보내며 프리미어리그에서 213골을 넣은 뒤 2023년 여름 뮌헨으로 이적했다""라며 ""손흥민은 프리미어리그에서 126골을 기록했고, 통산 득점 공동 17위에 올라와 있지만 현재까지 우승과 거리가 멀다""라고 전했다.

그러면서 ""손흥민이 여름 이적시장에서 뮌헨으로 이적한다면 그는 트로피 가뭄을 끝낼 수 있는 기회가 있다""라며 ""특히 뮌헨은 분데스리가를 장악하고 있어, 최근 12시즌 동안 11번을 우승했다""라고 밝혔다.

손흥민은 지난해 12월에도 뮌헨과 연결된 적이 있다. 당시 손흥민의 최고의 파트너였던 해리 케인이 뮌헨에 데려오고 싶은 토트넘 선수로 손흥민을 지목해 화제가 됐다.



손흥민을 데려오고 싶은 이유에 대해 케인은 ""쏘니와 나의 관계는 정말 좋다. 우리는 토트넘에서 훌륭한 파트너십을 구축했고, 경기장 밖에서도 좋은 친구 사이로 지냈다""며 ""나와 손흥민은 분데스리가에서 함께 잘할 수 있을 것""이라고 말했다.

케인이 손흥민과의 재회를 원하자 독일 언론이 들썩였다. 독일 'TZ'는 ""케인의 생각은 그리 터무니없는 것이 아니다""라며 손흥민 영입 가능성을 주목했다.

스페인 '피차헤스'도 ""손흥민은 최근 몇 년 동안 토트넘의 핵심 중 한 명이었지만, 타이틀 부족과 탄탄한 스포츠 프로젝트로 인해 떠나기로 결정할 수 있다""라며 ""뮌헨은 손흥민의 커리어 마지막 단계에서 주요 트로피를 노릴 수 있는 기회를 줄 수 있다""라며 손흥민이 트로피를 위해 토트넘을 떠날 수 있다고 주장했다.

글로벌 매체 'ESPN'에 따르면 마크 오그덴 기자 역시 ""토트넘이라면 확실히 계약 연장을 고려할 것 같지만 내가 손흥민이라는 기회를 원할 것 같다""라며 ""케인이 뮌헨에 가서 우승 기회를 잡았듯이, 손흥민도 어딘가에 가서 우승할 권리가 있다""라며 손흥민의 이적 가능성을 거론했다.



또 ""난 손흥민이 최고 클럽에 갈 자격이 있다고 생각한다. 토트넘도 빅클럽이지만 당연히 트로피를 차지하지는 못한다""라며 ""손흥민은 지금 당장 최고의 클럽에 가서 트로피를 얻을 자격이 있다고 생각한다""라고 전했다.

토트넘이 손흥민의 잔류를 원해도, 손흥민이 우승을 위해 이적을 택한다면 토트넘은 결정을 내려야 한다. '토트넘 홋스퍼 뉴스'도 ""손흥민을 설득하는데 실패한다면 2025년 여름 이적시장에서 손흥민을 파는 게 현명한 선택이 될 수 있다""라고 밝혔다.

매체는 ""32세임에도 손흥민의 시장 가치는 여전히 괜찮지만 계약 기간이 끝나며 폭락해 2026년에 자유롭게 떠날 위험이 있다""라고 주장했다.



사진=연합뉴스"
