date,title,content
20251003,"""SON 동상 만들어 줘!"" 외쳤던 히샬리송, 또또또또또 한국 온다...브라질 대표팀 승선→손흥민과 2달 만에 재회","[OSEN=고성환 기자] 히샬리송(28, 토트넘 홋스퍼)이 또 한 번 한국 땅을 밟는다. 그는 브라질 대표팀의 일원으로서 자신이 언제나 애정을 표현해 왔던 손흥민(33, LAFC)을 상대하게 됐다.

브라질 축구협회(CBF)는 2일(이하 한국시간) 공식 홈페이지를 통해 10월 A매치 두 경기에 출전할 국가대표 26인 명단을 발표했다. 카를로 안첼로티 감독이 이끄는 브라질 축구대표팀은 오는 10일 서울월드컵경기장에서 한국을 상대한 뒤 14일 일본을 방문해 친선경기를 치른다.
안첼로티 감독은 유럽에서 활약하는 선수들을 대거 발탁했다. 그는 아시아에서 경기가 열리는 만큼 브라질보다 이동 거리도 짧고 시차도 적은 유럽파 위주로 선수단을 꾸렸다고 밝혔다.

비니시우스 주니오르와 호드리구, 카세미루, 루카스 파케타 등 세계적인 선수들이 여럿 이름을 올렸다. 다만 네이마르와 하피냐, 주전 골키퍼 알리송은 부상으로 제외됐다.

이로써 많은 팬들의 기대를 받았던 네이마르와 손흥민의 재대결은 볼 수 없게 됐다. 네이마르는 약 2주 전 오른쪽 허벅지 대퇴직근 을 다쳐 쓰러졌다. 'TNT 스포츠'에 따르면 최소 4주에서 최대 12주 정도 재활이 필요할 전망이다

[OSEN=이대선 기자] 브라질 히샬리송 2022.06.02 /sunday@osen.co.kr


[OSEN=서울월드컵경기장, 지형준 기자] 토트넘 홋스퍼이 13일 오후 8시 서울월드컵경기장에서 김상식 감독이 이끄는 '팀 K리그'와 친선경기에서 맞붙어 6-3 승리를 거뒀다.후반 토트넘 손흥민이 PK골을 성공시키며 히샬리송과 기뻐하고 있다. 2022.07.13 /jpnews@osen.co.kr


그 대신 히샬리송이 다시 한번 한국 팬들과 만난다. 그는 2022년 여름을 시작으로 꾸준히 한국을 방문하고 있다. 당시 브라질 대표팀은 카타르 월드컵을 앞두고 한국을 방문해 친선전을 소화했다. 히샬리송도 선발 출전해 선제골을 터트리며 브라질의 5-1 대승을 이끌었다.

히샬리송과 한국의 연은 계속 이어졌다. 토트넘이 올해 여름까지 포함해 3차례나 프리시즌 '쿠팡플레이 시리즈'에 참가하면서 한국 투어에 나섰기 때문. 히샬리송은 2025년 8월에도 한국 팬들 앞에서 경기를 펼치며 손흥민의 고별전을 함께했다.

이번 10월 A매치가 벌써 3년간 5번째 방한인 히샬리송. 2022년 여름 단체로 남산 타워와 에버랜드를 방문해 즐거운 시간을 보냈던 히샬리송과 브라질 선수들이 이번엔 어떤 모습을 보여줄지 팬들의 시선이 쏠리고 있다.

특히 히샬리송은 한국을 상대로 강했다. 그는 2022년 열렸던 친선경기에서도 2023 카타르 월드컵 16강전에서도 한국의 골망을 흔들었다. 이번만큼은 히샬리송의 발끝을 막아야 하는 홍명보호다.



히샬리송과 손흥민의 맞대결도 관심을 모은다. 둘은 오랫동안 서로에 대한 애정을 드러내 왔다. 토트넘에선 득점한 뒤 히샬리송의 시그니처 세리머니인 '비둘기 댄스'를 함께 췄고, 카타르 월드컵 16강전에서 적으로 만나 포옹하기도 했다. 경기장 밖에서도 서로를 챙기는 모습이었다.

둘의 인연은 지난 8월 손흥민이 미국 메이저리그 사커(MLS) LAFC로 떠나면서 잠시 막을 내렸다. 다행히 토트넘은 지난 시즌 유럽축구연맹(UEFA) 유로파리그(UEL) 정상에 오르면서 손흥민을 미소로 떠나보낼 수 있었다. 

히샬리송도 손흥민을 향해 헌사를 보냈다. 그는 소셜 미디어를 통해 ""경기장에서 옆을 돌아봤는데 손흥민 당신이 보이지 않는다면 조금 어색할 거다. 당신은 훌륭한 친구일 뿐만 아니라 훌륭한 프로 선수, 리더, 한 사람으로서 본보기다. 당신은 토트넘 유니폼을 입고 역사를 만들었고, 그렇게 중요한 우승을 함께할 수 있어서 정말 기쁘다. 당신은 정말로 그럴 자격이 있었다""라며 ""정말 영관이었다. 우리가 다시 만날 날이 올 거라고 확신한다""라고 마지막 인사를 남겼다.



히샬리송은 '데일리 메일'과 인터뷰에서도 손흥민을 향한 마음을 숨기지 않았다. 그는 ""손흥민은 토트넘 역사상 가장 위대한 아이돌이자 훌륭한 친구가 됐다. 경기 중에 옆을 보면 그가 보이지 않는다는 게 아직도 어색하다. 그는 팬들과 클럽 내부에서도 전설이다. 훌륭한 선수일 뿐만 아니라 정말 좋은 사람이기 때문""이라고 말했다.

또한 히샬리송은 ""손흥민이 어디에 있든 항상 그를 응원할 거다. 그가 트로피를 들어 올릴 수 있도록 도울 수 있어서 정말 기쁘다. 그는 매우 큰 업적을 남기고 토트넘을 떠날 자격이 충분했으니까 말이다""라고 덧붙였다.

이제 한국 땅에서 다시 만나게 된 히샬리송과 손흥민. 둘은 토트넘에서 작별한 지 약 2달 만에 경기장 위에서 적으로 부딪치게 됐다. 또 다시 한국을 상대로 득점하려는 히샬리송과 설욕을 꿈꾸는 손흥민이다.

한국과 브라질의 역대 전적에서는 브라질이 7승 1패로 크게 앞서고 있다. 홍명보 감독이 이끄는 한국으로선 세계적 강팀을 상대로 현재 전력과 스리백 카드를 시험할 좋은 무대가 될 전망이다.



■ 브라질 축구대표팀 10월 친선경기 소집 명단(26인)

GK: 벤투(알 나스르), 에데르송(페네르바체), 우구 소자(코린치안스)

DF: 카이우 엔히키, 반데르송(이상 AS 모나코), 카를로스 아우구스투(인터 밀란), 더글라스 산토스(제니트), 에데르 밀리탕(레알 마드리드), 파브리시우 브루누(크루제이루), 가브리엘 마갈량이스(아스날), 루카스 베랄두(PSG), 웨슬리(AS 로마)

MF: 안드레, 주앙 고메스(이상 울버햄튼), 브루누 기마랑이스, 조엘린통(이상뉴캐슬), 카세미루(맨체스터 유나이티드), 루카스 파케타(웨스트햄)

FW: 이스테방(첼시), 가브리엘 마르티넬리(아스날), 이고르 제주스(노팅엄), 루이스 엔히키(제니트), 마테우스 쿠냐(맨체스터 유나이티드), 히샬리송(토트넘), 호드리구, 비니시우스 주니오르(이상 레알 마드리드)

/finekosh@osen.co.kr

[사진] ⓒGettyimages(무단전재 및 재배포 금지), ESPN UK, 히샬리송, 브라질 축구협회 소셜 미디어."
20251003,"동료 위해 '해트트릭 기회' 거절한 SON, 부앙가는 ""손흥민과 함께해 정말 좋아""... '역대급 듀오' 맞다!","[인터풋볼=이주엽 기자] 그야말로 '역대급 듀오'가 탄생했다.

LAFC는 28일 오전 9시 30분(이하 한국시간) 미국 세인트루이스에 위치한 에너자이저 파크에서 펼쳐진 미국 메이저리그사커(MLS) 경기에서 세인트루이스를 상대로 3-0 완승을 거뒀다.

이날 경기에서도 '흥부 듀오'가 맹활약을 펼쳤다. 전반 15분 드니 부앙가의 득점이 나왔고, 이후 손흥민이 빛나기 시작했다. 손흥민은 전반 추가시간 4분 페널티 박스를 파고든 뒤 가볍게 슈팅했고, 팀에 두 골 차 리드를 안겼다.

후반전에는 멀티 득점을 완성했다. 후반 15분 상대 수비가 밀집되어 있었으나 손흥민은 기회를 포착했고, 곧장 오른발 슈팅으로 연결하며 득점을 기록했다. 부앙가와 손흥민의 연속 득점에 힘입어 LAFC는 세인트루이스를 제압해 냈다.

경기 종료 후 손흥민과 부앙가의 '양보'에 이목이 쏠렸다. 후반 중반 LAFC는 페널티킥 기회를 얻었는데 손흥민과 부앙가는 서로에게 득점 기회를 양보했다. 손흥민은 해트트릭을 달성할 수 있는 상황이었고, 부앙가로서는 페널티킥을 통해 리그 득점왕에 한 발 다가설 수 있었다. 페널티킥은 아쉽게도 비디오 판독(VAR) 끝 취소됐는데, 서로를 위하는 마음을 확인할 수 있었던 장면이었다.



부앙가는 손흥민을 향한 애정을 드러내기도 했다. 영국 '가디언'은 지난달 30일 부앙가와 진행한 인터뷰를 공개했다. 부앙가는 ""손흥민과 함께 뛰는 게 정말 좋다. 보이다시피 우리는 정말 잘 맞고, 그래서 공격 상황에서 팀 전체가 더 좋은 결과를 가져오는 것 같다. 손흥민은 정말 대단한 선수고, 엄청난 명성도 지니고 있다""라고 말했다.

한편, '흥부 듀오'를 향한 극찬은 계속해서 이어지고 있다. '가디언'은 이어 ""부앙가와 손흥민은 현재 MLS에서 가장 치명적인 공격 듀오다. 델러스전을 시작으로 놀라운 득점 행진이 시작됐다. 이들은 17골을 연속해 작렬하며 MLS의 그 어떤 공격 듀오보다도 가장 길게 팀 득점을 독점했다""라고 극찬했다."
20251003,"'1조 6,518억' 사나이 비니시우스, A매치 한국전 앞두고 ""한국에서 만나"" 기대감 드러내","사진=비니시우스 인스타그램


[인터풋볼=김현수 기자] 비니시우스 주니오르가 한국전에 대한 기대를 드러냈다.

비니시우스는 2일(한국시간) 자신의 SNS에 브라질 국가대표팀 유니폼을 입은 사진과 함께 ""한국과 일본에서 만나자""라는 글을 올렸다.

홍명보 감독이 이끄는 대한민국 축구 국가대표팀은 오는 10일 오후 8시 서울월드컵경기장에서 열리는 친선전에서 브라질과 상대한다. 이후 브라질은 14일 일본으로 건너가 경기를 치른다.

브라질은 최정예 선수들을 데리고 한국을 찾는다. '슈퍼 스타' 네이마르 주니오르는 제외됐지만 거의 '완전체 전력'이나 다름 없다. 선수단 면면을 보면 비니시우스, 호드리구, 카세미루, 마테우스 쿠냐, 히샬리송, 조엘링톤 등으로 화려하다.



최고의 선수들로 가득 찬 브라질이지만 '에이스'는 단연 비니시우스다. 자국 리그 CR 플라멩구에서 성장한 비니시우스. 장점인 화려한 드리블을 앞세워 수비진을 무너뜨리고 골문을 사냥한다. 2018년 레알 마드리드 입단 후 최정상급 공격수로 성장했다.

2021-22시즌 52경기 22골 16도움을 올리며 잠재력을 폭발했다. 이후부터는 4시즌 연속 35개 이상의 공격 포인트를 기록하며 레알 공격의 '핵심'으로 자리매김했다. 더불어 레알에서 14번 우승을 포함해 2024 발롱도르 2위까지 거머쥔 '스타 플레이어'다. 올 시즌도 레알의 최전방을 책임질 것이라 예상됐지만, 사비 알론소 감독 부임 이후 상황이 바뀌었다.

알론소 감독은 측면 공격을 선호하는 비니시우스와 달리 중앙으로 파고드는 공격 패턴을 선호한다. 이에 '붙박이 주전'이었던 비니시우스는 최근 교체로도 자주 나오고 있는 상황. 그런 가운데 사우디아라비아 알 힐랄이 비니시우스의 이적료로 레알에 10억 유로(약 1조 6,518억 원)를 제시했다는 소식이 전해져 화제가 됐다."
20251003,"리버풀 비상! '살라 대체자' 1,894억 윙어, 맨시티+레알도 노린다…""뮌헨은 재계약 제안 예정""","사진=365 스코어


[포포투=김재연]

리버풀이 노리고 있는 마이클 올리세에게 맨체스터 시티와 레알 마드리드도 관심이 있다.

축구 이적시장 소식을 전문적으로 다루는 '트랜스퍼 뉴스 라이브'는 3일(이하 한국시간) 영국 '데일리 메일'의 보도를 인용해 ""맨시티와 레알이 최근 올리세에게 관심을 보였다. 리버풀 역시 그에게 관심이 있으며, 그의 소속팀 바이에른 뮌헨은 다른 구단의 관심을 막기 위해 재계약을 제안할 예정이다""라고 전했다.

올리세는 2001년생 프랑스 국적의 윙어다. 레딩 유스를 거쳐 1군 무대에 데뷔한 그는 크리스탈 팰리스에서 재능을 만개했다. 첫 시즌부터 31경기 4골 8도움으로 준수한 활약을 펼쳤다. 팰리스에서의 세 시즌동 기록은 90경기 16골 25도움.

2023년 여름 첼시 이적을 눈앞에 뒀었지만 '불법 접촉 논란'으로 거래가 무산되면서 잔류했다. 이후 2024-25시즌을 앞두고 4,500만 파운드(약 852억 원)의 이적료를 기록하면서 '독일 명문' 바이에른 뮌헨에 입단했다.

사진=게티이미지


독일 무대에서도 올리세의 활약은 빛났다. 데뷔 시즌이었던 지난 시즌부터 50경기 17골 18도움을 기록하면서 맹활약했다. 이번 시즌 역시 해리 케인, 자말 무시알라와 함께 뮌헨의 공격을 이끌 것으로 기대를 받고 있다.

이러한 올리세의 성장세에 리버풀이 관심을 보였다. 지난 시즌 도중 재계약을 체결한 '에이스' 모하메드 살라의 에이징 커브를 대비해야 하기 때문. 이번 여름 이적시장에서 알렉산더 이삭, 플로리안 비르츠 등을 영입하면서 막대한 이적료를 지출한 리버풀이 내년 여름에도 지갑을 열면서 올리세까지 노리고 있는 것이다.

하지만 맨시티와 레알도 그를 노리고 있다. 과연 리버풀이 이들과의 경쟁에서 승리하면서 살라의 대체자로 점찍은 올리세를 영입할 수 있을지 관심이 집중된다."
20251003,"메시 보유한 감독 조차 '손흥민 이름'에 벌벌 떤다...""LAFC, SON 합류 후 매우 매우 매우 큰 발전"" 우승 경쟁자 인식","▲ LAFC SNS


[스포티비뉴스=신인섭 기자] 인터 마이애미를 이끌고 있는 하비에르 마스체라노 감독이 손흥민을 경계했다.

인터 마이애미는 미국메이저리그사커(MLS) 동부 컨퍼런스 4위를 달리고 있다. 1위 필라델피아와의 승점 격차는 7점 차.

그만큼 지난 1일 패배가 뼈아팠다. 인터 마이애미는 미국 플로리다에 위치한 체이스 스타디움에서 열린 2025 MLS 정규시즌 32라운드에서 시카고파이어FC에 3-5로 무릎을 꿇었다. 이날 패배로 3경기를 남겨 놓고 1위와의 격차를 좁히지 못했다.
수비에서 아쉬움이 컸다. 인터 마이애미는 먼저 선제골을 내준 이후 추가골까지 허용하면서 끌려갔다. 전반 39분 토마스 야빌레스가 한 골을 만회했지만, 하프타임을 앞두고 한 점을 더 내주면서 1-3으로 첫 45분을 마무리했다.

후반에 반등에 성공하기도 했다. 루이스 수아레스가 멀티골을 뽑아내면서 역전의 불씨를 지폈다. 하지만 이후 수비 불안을 야기하며 결국 3-5로 패했다.



주전 자원들을 모두 내세웠음에도 충격적인 결과를 받아들여야 했다. 리오넬 메시를 비롯해 수아레스, 세르히오 부스케츠, 로드리고 데 파울, 호르디 알바 등이 나섰지만, 패배를 막지는 못했다.

마스체라노 감독은 자신의 탓이라며 좌절했다. 경기 종료 후 ""일관성을 유지하고 싶었는데 결국 같은 결론에 다다랐다. 우리가 그동안 치른 경기 수를 생각하면, 피로와 번아웃, 여러 가지 상황들 때문에 꾸준함을 유지하기란 쉽지 않다. 리그 전체가 정말 박빙이다""라고 밝혔다.

그러면서 여러 팀들을 경계 대상으로 언급했다. 다가올 MLS컵 우승을 위해서는 반드시 넘어야 할 팀들이다. 마스체라노 감독은 ""벤쿠버 화이트캡스는 우리가 상대했던 강한 팀 중 하나다. 시애틀과 샌디에고도 마찬가지다""라고 평가했다.



손흥민이 활약 중인 LAFC에 대해서도 입을 열었다. 마스체라노 감독은 ""손흥민의 합류 이후 LAFC는 매우, 매우, 매우 큰 발전을 이루었다고 생각한다""라고 경계했다. 직접 'very(매우)'라는 단어를 세 번이나 사용할 만큼 위협적인 대상으로 여겼다.

실제로 LAFC는 손흥민 합류 이후 전혀 다른 팀이 됐다고 해도 과언이 아니다. 손흥민 합류 직전 리그 22경기에서 10승 6무 6패의 성적을 거뒀으나, 손흥민 입단 이후 8경기에서 5승 2무 1패로 상승세를 타고 있다.

자연스럽게 MLS컵 우승 후보로 떠올랐다. 미국 '디 애슬래틱'은 ""LAFC는 가장 유력한 후보다. 손흥민은 확실한 클래스뿐 아니라 부안가의 능력까지 극대화시키고 있다""라며 ""공격 의존도가 높다는 지적도 있지만, MLS에서는 공격진에 집중 투자하는 게 일반적이다. 게다가 인터 마이애미가 메시에게 의존하는 수준이 LAFC가 손흥민-부앙가에게 기대는 것보다 훨씬 크다""라고 평가했다.

더불어 ""인터 마이애미는 모든 전개가 메시를 중심으로 돌아간다. 메시가 공을 잡지 못하면 리듬이 깨지고, 공격이 멈춘다""라면서 ""LAFC는 다르다. 공이 없어도 편안하고, 역습과 일대일 돌파 상황에서 진가를 발휘한다. 손흥민과 부앙가는 점유율에 의존하지 않고도 경기를 뒤집을 수 있는 창의적이고 폭발적인 유형의 선수들""이라고 조명했다."
20251003,"[오피셜] 시원하게 빗나간 '태극 전사' 카스트로프 향한 獨 매체 망언 ""입지 잃을 것"" 이라더니 소속팀서 에이스 등극 9월 이달의 선수 수상!","[SPORTALKOREA] 황보동혁 기자= 독일 매체가 옌스 카스트로프(보루시아 묀헨글라드바흐)를 향해 망언에 가까운 추측을 내놨지만 그는 외려 팀의 핵심 선수로 급부상했다.

묀헨글라트바흐는 2일(한국시간) 구단 공식 채널을 통해 ""치혼 퍼스널매니지먼트가 주관한 팬 투표에서 카스트로프가 로빈 하크와 하리스 타바코비치를 제치고 1위를 차지했다""며 ""전체 투표의 약 45%를 득표하며 9월의 선수상을 수상했다. 하크가 29%로 2위, 타바코비치가 26%로 3위를 기록했다""고 발표했다.



이 결과는 놀라운 일이 아니다. 카스트로프는 지난달 22일 레버쿠젠전(1-1 무)에서 선발로 나서 인상적인 활약을 펼쳤고, 이어 프랑크푸르트전(4-6 패)에서는 풀타임을 소화하며 데뷔골을 포함해 유효 슈팅 2회, 태클 6회, 경합 승리 8회를 기록했다. 통계 매체 '풋몹'으로부터 팀 내 최고 평점인 8.2점을 받으며 공수에서 모두 눈부신 활약을 선보였다.

그는 '이달의 선수' 선정 소감에서도 성숙한 태도를 보였다. 프라이부르크전을 앞두고 구단 채널과의 인터뷰에서 카스트로프는 ""뭐라 말하기 어렵다. 프랑크푸르트전에서 첫 분데스리가 골을 넣었을 때 '기쁘냐'는 질문을 받았을 때와 비슷하다. 개인적인 발전이 인정받는 건 기분 좋은 일이지만, 팀의 성공이 그보다 우선""이라며 ""첫 골을 넣었을 때도 그랬고, 이번 수상도 마찬가지""라고 담담하게 밝혔다.



이는 불과 한 달 전 독일 매체 '빌트'가 내놓았던 전망과는 정반대다. 당시 매체는 한국 국가대표팀을 선택한 카스트로프가 A매치 일정으로 팀 훈련과 샬케전(2-0 승)을 건너뛰었고, 장거리 이동으로 시차 적응 문제가 생길 수 있다고 지적했다.

또한 브라질(10월), 아시아 원정(11월) 등 대표팀 일정이 이어지면 클럽과의 충돌이 불가피하다며 입지 줄어들 가능성을 언급했다.



심지어 빌트는 ""묀헨글라트바흐는 오른쪽 수비 공백이 크다. 조 스캐리가 부상으로 이탈한 가운데 샬케전에는 오스카르 프라울로가 대신 뛰었고, 케빈 딕스도 옵션으로 있다. 카스트로프는 슈투트가르트전에서 교체로 나와 실점 장면에 관여하는 등 점수를 잃었다""며 출전 경쟁에서 밀릴 수 있다고 내다봤다.

그러나 현실은 정반대였다. 카스트로프는 9월 한 달 동안 꾸준히 출전하며 팀의 중심으로 자리 잡았고, 지금은 묀헨글라트바흐에 없어서는 안 될 핵심 자원으로 떠올랐다.

한편, 카스트로프는 홍명보 감독이 이끄는 대한민국의 10월 A매치 명단에도 이름을 올렸다. 오는 10일 브라질, 14일 파라과이와의 평가전에서 어떤 활약을 펼칠지 한국 팬들의 관심이 집중된다.

사진= 보루시아 묀헨글라트바흐, 게티이미지코리아 

취재문의 sportal@sportalkorea.co.kr"
20251003,"'떠났으니 할 말은 하겠습니다'…안토니 폭탄 발언 ""맨유는 무례했고 존중이 없었다""","사진=게티이미지


[포포투=박진우]

안토니가 맨체스터 유나이티드를 향해 폭탄 발언을 뱉었다.
글로벌 매체 'ESPN'은 3일(한국시간) ""안토니는 레알 베티스 이적 이후, 맨유에서의 마지막 시절 존중을 받지 못했다며 심경을 고백했다""고 보도했다.

안토니는 맨유의 대표적인 실패작이다. 에릭 텐 하흐 감독은 지난 2022-23시즌을 앞두고 아약스 시절 '애제자'였던 안토니를 데려왔다. 이적료는 무려 9,500만 유로(약 1,440억 원). 안토니는 맨유 데뷔 시즌 44경기 3골 8도움으로 나쁘지 않은 공격 포인트를 남겼다.

다만 이후 완전히 무너졌다. 불필요한 드리블과 개인기, 잦은 턴 오버가 지속됐다. 결국 '맨유 역사상 최악의 영입'이라는 꼬리표가 붙었다. 텐 하흐 감독이 경질된 이후, 완전히 자리를 잃었다. 후벵 아모림 감독은 안토니를 구상에서 제외했고, 베티스로 임대를 보냈다.

대반전 서사를 쓴 안토니였다. 안토니는 베티스에 입성하자마자 공격 포인트를 쌓았고, 공식전 26경기 9골 5도움을 올렸다. 베티스는 안토니 임대 연장을 위해 노력했지만, 끝내 안토니는 맨유로 복귀했다. 그럼에도 안토니를 향한 구애를 멈추지 않았다.

결국 안토니는 베티스 완전 이적에 성공했다. 이번 시즌 극초반에는 지난 시즌 만큼의 임팩트를 보여주지 못하며 의심의 눈초리를 받았지만, 지난달 25일 열린 유럽축구연맹(UEFA) 유로파리그(UEL) 리그 페이즈 1차전 노팅엄 포레스트를 상대로 1골 1도움을 올리며 극적인 2-2 무승부를 견인했다. 

맨유를 떠나 베티스에서 '행복 축구'를 하고 있는 안토니. 맨유를 향해 폭탄 발언을 뱉었다. 그는 ""나는 논란을 만들거나 특정 인물을 지목하는 스타일은 아니다. 하지만 약간의 무례함이 있었고, 존중이 부족했다고 생각한다. 아침이나 오후 인사조차 건네지 않았다. 아무도 '좋은 아침', '좋은 오후' 인사를 하지 않았다""며 서운함을 토로했다.

그러면서도 ""어쨌든 그건 다 지난 일이고, 더 이상 크게 중요하게 생각하지 않는다. 지금은 베티스에 있고, 여기서 생활하는 게 내게 가장 중요한 일이다. 맨유에서 원하는 만큼 활약하지 못한 건 내 책임도 분명히 있다. 하지만 나는 항상 긍정적인 면을 보려 한다. 맨유에서 보낸 그 시간과 과정을 겪으면서 스스로를 돌아볼 수 있었고, 그것이 내게 꼭 필요한 경험이었다고 생각한다""고 말했다.

사진=게티이미지"
