date,title,content
20250910,토트넘 대성통곡! '손흥민 트로피 수호신' 레알이 강탈…'프리미어리그 최고' 눈부신 성장→미래 준비,"사진=UEFA 유로파리그
[스포츠조선 강우진 기자]레알 마드리드가 토트넘의 기둥 미키 반더벤 영입에 관심을 보이고 있다는 소식이다.

영국 더하드태클은 10일(한국시각) 스페인 피차헤스의 보도를 인용해 ""사비 알론소가 이끄는 레알 마드리드가 토트넘의 수비수 미키 반더벤 영입에 관심을 보이고 있다""라고 전했다.

매체는 ""레알 마드리드는 유망한 센터백을 영입해 수비를 강화하려 하며, 목표를 토트넘의 미키 판 더 펜으로 정했다""라며 ""그는 토트넘에 합류한 이후 눈부신 성장을 이뤘고, 레알 마드리드는 그를 자신들의 계획에 합류시키길 원한다""라고 했다.

<저작권자(c) 연합뉴스, 무단 전재-재배포, AI 학습 및 활용 금지>
<저작권자(c) 연합뉴스, 무단 전재-재배포, AI 학습 및 활용 금지>
반더벤은 독일 분데스리가 볼프스부르크에서 이름을 알린 뒤 2023년 여름 토트넘으로 이적했다. 네덜란드 대표팀 소속인 그는 잉글랜드 프리미어리그(EPL)에 빠르게 적응했고, 토트넘 1군에서 핵심 선수로 자리 잡았다.

반더벤은 크리스티안 로메로와 안정적인 호흡을 보이고 있으며 그 안에서도 최고의 활약으로 레알 마드리드 눈에까지 들었다. 강한 피지컬과 위치선정 능력뿐 아니라, 뛰어난 스피드가 핵심이다. 이미 프리미어리그 최고의 수비수 중 한 명으로 평가받고 있으며, 세계적인 관심이 끊이질 않고 있다.
올해 토트넘이 유럽축구연맹(UEFA) 유로파리그에서 우승하는데도 혁혁한 공을 세웠다. 맨유와의 결승전에서 1-0으로 앞선 후반 23분 토트넘이 위기를 맞았다. 골문이 빈 상황에서 호일룬이 헤더 슈팅을 시도한 것. 반더벤은 빠르게 반응해 날아올랐고 공을 골문 밖으로 걷어내는데 성공했다.

결정적인 수비에 힘 입어 토트넘은 유로파리그에서 우승했다. 당시 토트넘의 주장이었던 손흥민도 반더벤의 결정적인 세이브를 칭찬했다.

<저작권자(c) 연합뉴스, 무단 전재-재배포, AI 학습 및 활용 금지>
<저작권자(c) 연합뉴스, 무단 전재-재배포, AI 학습 및 활용 금지>
레알 마드리드는 이번 여름 딘 후이센을 영입했지만, 여전히 수비에서 더 많은 퀄리티와 뎁스를 원한다. 데이비드 알라바와 안토니오 뤼디거의 커리어가 막바지에 접어든 상황에서, 미래를 준비하고 있다.

레알 마드리드는 처음에 크리스티안 로메로 영입에 관심을 가졌으나, 반더벤으로 타깃을 변경했다고 한다. 영입 시도는 내년 여름이 돼서야 이뤄질 것으로 보인다.

하지만 토트넘과의 협상은 쉽지 않을 것으로 전망된다. 반더벤의 계약 기간은 아직 4년 남아 있으며, 토트넘은 그를 헐값에 내보내지 않을 전망이다. 토트넘은 반더벤의 가치를 약 8000만 유로(약 1300억원)로 평가하고 있으며, 이 금액에 근접한 제안이 들어와야 협상에 나설 것으로 보인다.

레알 마드리드가 팀의 미래를 위해 막대한 투자를 단행할지 이목이 집중되고 있다."
20250910,"'소속팀 복귀 이후' 걱정하는 獨 빌트, ""옌스 카스트로프, 월드컵 딜레마 빠져… 과연 주전 가능?""","(베스트 일레븐)

대표팀에 가기 위해선 소속팀에서의 활약이 필수다. 홍명보 대한민국 축구 국가대표팀 감독도 소속팀에서 얼마나 꾸준히 뛰는지를 중요한 발탁 기준으로 삼고 있다.

보루시아 묀헨글라트바흐에서 뛰는 옌스 카스트로프는 9월 미국, 멕시코와의 A매치를 치른 대한민국 축구 국가대표팀에 발탁됐다. 8월 FIFA에 소속 협회 변경을 승인받은 카스트로프는 독일에서 대한민국으로 소속을 변경해 태극마크를 달 수 있었다.
그러나 독일 현지에선 소속팀에서의 활약을 걱정하는 분위기다. 독일 <빌트>지는 카스트로프가 대표팀에서 소집 해제된 이후 소속팀에 복귀해 겪을 어려움들에 대해 예상하고 있다.

우선, 카스트로프가 유럽과 미대륙을 오가는 장거리 원정을 해본 적이 없다는 사실에 주목했다. ""A매치 출장으로 인해 휴식기 동안 열린 훈련, 샬케 04와의 평가전에서 감독에게 눈도장을 찍을 기회를 놓쳤다""라고 평가한 <빌트>는 ""시차 적응 문제까지 안은 채, 금요일이 돼서야 묀헨글라트바흐의 훈련에 복귀할 거로 예상된다""라고 우려 섞인 관점을 제시했다.

또한 해당 매체는 ""아시아로 떠나는 긴 여정의 A매치들이 기다리고 있다""라며 앞으로 다가올 경기들에 대한 걱정도 늘어놓았다.

홍명보호는 오는 10월 10일과 14일 서울 월드컵경기장에서 브라질, 파라과이와의 평가전을 치를 예정이다. 다음달에도 대표팀에 소집될 경우, 카스트로프는 다른 해외파 선수들과 마찬가지로 원거리 이동을 해야 한다. 카스트로프만이 겪는 문제는 아니지만, 익숙하지 않은 환경이 주는 어려움이 발생할 수도 있다.

현재 묀헨글라트바흐는 오른쪽 풀백이 공석이다. 조 스컬리가 부상을 당하면서 카스트로프와 오스카르 프라울로가 경쟁을 벌여야 한다. 케빈 딕스 등도 옵션이 될 수 있다. 100% 몸 상태가 아니라면, 카스트로프가 다가오는 15일 베르더 브레멘전에 선발 출장할지는 미지수다. 카스트로프는 중앙 및 우측 미드필더, 우측 풀백으로 두루 활용 가능하다.

그럼에도 불구하고 카스트로프는 대한민국 국가대표로 좋은 퍼포먼스를 보였다. 7일 미국전에선 후반 18분 교체 출전해 A매치 데뷔전을 치렀고, 10일 멕시코전에는 선발 출전해 45분간 뛰며 태클, 리커버리, 패스 등 여러 지표에서 기대 이상의 활약을 펼쳤다.

헤라르도 세오아네 묀헨글라트바흐 감독은 ""스스로 집중해야 한다는 사실을 알고 있을 거다. 이것은 학습 과정이며, 옌스가 그 과정을 잘 마무리할 거라 믿는다""라고 이야기했다.

앞으로 월드컵 개막까지 남은 기간은 약 9개월. 이 기간 동안 카스트로프가 소속팀에서, 또 대표팀에서도 감독의 선택을 받을 수 있는 경기력을 보여줄 수 있을지 주목된다."
20250910,"'SON 너도? 나도' 케인, 진짜 보살이네...'신사 협정' 깼던 레비 향해 헌사 ""20년 넘게 환상적인 회장이었다""","[OSEN=고성환 기자] '토트넘 홋스퍼 전설' 해리 케인(32, 바이에른 뮌헨)이 개인적인 악연은 잊고 다니엘 레비 회장에게 헌사를 바쳤다.

토트넘 팬 커뮤니티 '스퍼스 웹'은 9일(한국시간) ""케인은 '환상적인' 레비 회장이 충격적으로 토트넘에서 퇴장한 뒤 그에게 경의를 표했다. 그는 레비 회장의 사임 소식에 충격을 받았다고 인정하며 그가 지난 25년간 클럽을 어떻게 성장시켰는지 칭찬했다""라고 보도했다.
매체는 ""레비의 퇴사 소식에 모두가 깜짝 놀란 가운데 토트넘과 관련된 모든 사람들로부터 그를 향한 헌사가 쏟아지고 있다. 마우시리오 포체티노는 어떻게 그가 팀을 떠나게 됐는지 모르겠다고 고백했고, 손흥민도 품격 있는 메시지를 보내며 감사를 표했다. 이제 손흥민의 파트너였던 케인도 여기에 힘을 보탰다""라고 전했다.

레비 회장은 최근 토트넘과 작별을 선언했다. 그는 지난 2001년 에닉(ENIC) 그룹이 토트넘을 인수한 후로 쭉 토트넘 회장을 맡아왔으나 자리에서 물러나게 됐다. 공식적으로는 레비 회장의 자진 사임이지만, 구단 차원의 선택으로 알려졌다. 영국 '텔레그래프'에 따르면 그는 공식 발표 몇 시간 전에야 이 사실을 통보받았다.

레비 회장은 공도 과도 뚜렷한 인물이다. 그는 훌륭한 구단 재정 운영을 바탕으로 토트넘을 명실상부한 빅클럽 반열에 올려뒀다. 또한 62000석 규모의 토트넘 홋스퍼 스타디움을 완공하는 등 토트넘을 프리미어리그 최고 시설을 갖춘 팀으로 만들었다.



다만 돈을 너무 아꼈다는 비판도 적지 않았다. 선수단 내에서조차 레비 회장이 우승을 원하지 않는 것 같다는 비판이 나왔을 정도. 토트넘의 주장이자 수문장으로 활약했던 위고 요리스가 팀을 떠난 뒤 그의 야망 부족을 공개적으로 지적하기도 했다.

'디 애슬레틱' 역시 ""제한된 임금 구조와 영입 자금 사용이 팬들의 가장 큰 불만이었다. 감독도 25년 동안 14번이나 바뀌었다""라며 ""대부분 팬들이 레비의 사임에 환호할 거다. 그가 충분한 야망을 보여주지 않았다고 생각하는 사람이 많기 때문""이라고 짚었다.

하지만 레비 회장이 토트넘에 진심이었던 것만은 분명하다. 텔레그래프는 ""레비의 측근들은 그의 사임과 그 방식이 큰 충격을 줄 것이라고 주장했다. 한 소식통은 토트넘은 레비의 삶 그 자체였다며 그가 당연히 비통할 것이라고 말했다""라고 전했다. 그럼에도 레비 회장은 평생 토트넘을 응원하겠다고 밝혔다.



주장 손흥민과 엔지 포스테코글루 감독에 이어 레비 회장까지 떠나보내며 새로운 시대를 준비 중인 토트넘. 스퍼스 웹은 ""토트넘은 레비 이후 시대가 열리고 있는 가운데 미지의 세계로 모험을 떠나고 있다. 그의 갑작스러운 사임 소식은 많은 이들에게 충격으로 다가왔지만, 토트넘 팬들은 이제 루이스 가문이 새로운 성공 시대를 열고 싶어 한다는 소식에 기대할 것""이라고 전했다.

케인은 레비 회장이 토트넘이라는 팀을 바꿔놨다고 박수를 보냈다. 그는 ""솔직히 말해서 조금 놀랐다. 전혀 예상하지 못했고, 그런 일이 일어날 줄 몰랐다. 레비는 토트넘에 20년 넘게 있었고, 환상적인 회장이었다. 클럽이 예전 위치와 지금 위치를 고려할 때 경기장뿐만 아니라 경기장 밖에서도 큰 변화가 있었다고 생각한다""라고 말했다.

이어 케인은 ""어느 단계에서든 클럽엔 언제나 변화가 있다. 고위직에서는 더더욱 그렇다. 솔직히 왜 그런 일이 일어났는지, 무슨 일이 일어났는지는 나도 잘 모른다""라며 ""내가 말할 수 있는 건 레비가 앞으로 무슨 일을 하든 행운이 가득하길 바란다는 것뿐이다. 우리는 함께한 시간 동안 분명히 관계를 쌓아왔고, 언젠가 다시 만나게 될 거라 확신한다. 토트넘은 전반적으로 지금 새로운 장을 만들어 나가려 하고 있다""라고 덧붙였다.



실제로 레비 회장은 토트넘의 많은 부분을 발전시켰다. 다만 케인은 2018년 그와 맺은 신사 협정을 근거로 맨체스터 시티 이적을 추진하다가 어쩔 수 없이 토트넘에 잔류했던 기억도 있다. 개인적으로는 감정이 안 좋을 법도 하지만, 레비 회장이 경기장 안팎에서 모두 성공했다고 높이 평가한 케인이다.

한편 손흥민도 떠나는 레비 회장을 향해 마지막 인사를 건넸다. 그는 지난 7일 미국전을 마친 뒤 믹스트존에서 ""이 자리가 레비 회장의 퇴임에 대해 이야기하기엔 적절한 자리는 아니다. 하지만 난 10년 동안 그곳에 있었다. 난 그가 그냥 여기서 말하는 것보다 더 많은 걸 받을 자격이 있다고 생각한다""라고 말했다.

또한 손흥민은 ""레비 회장은 25년 동안 토트넘에 있었다. 믿을 수 없을 정도로 훌륭한 일을 해냈다고 생각한다. 앞으로 그가 걸어갈 길에 최고의 행운이 따르길 바란다. 난 그가 나를 위해 해준 일에 정말 정말로 감사하게 생각한다""라고 덧붙였다.

/finekosh@osen.co.kr

[사진] ⓒGettyimages(무단전재 및 재배포 금지), 토트넘, 프리미어리그, 토트넘 뉴스."
20250910,"대한민국, 간판 공격수, ""세상이 무너지는 것 같았다"" 계속 누워 있어도 14kg 빠져...조규성이 밝힌 15개월의 재활 스토리","[SPORTALKOREA] 박윤서 기자= 얼마나 큰 고통과 인내로 15개월을 보냈을지 차마 헤아리기조차 어렵다.

FC 미트윌란은 9일(한국시간) 공식 사회관계망서비스(SNS)를 통해 ""조규성, 나의 귀환""이라는 제목의 다큐멘터리 영상을 올렸다.

여기엔 근 15개월 동안 조규성의 재활 장면과 그 과정 속 비하인드 스토리 등이 담겼다.



조규성에게 지난 몇 년은 그야말로 꿈과 같은 나날이었다. 혜성같이 등장해 한국 축구의 희망으로 불렸다. 수준급 9번 유형의 공격수가 손에 꼽는 대표팀에서 핵심 역할을 도맡았고 나날이 기대되는 선수로 성장했다.

2022 시즌 전북현대 소속으로 17골을 기록하며 득점왕을 차지했고 2022 국제축구연맹(FIFA) 카타르 월드컵서 2골을 터트린 후 곧바로 유럽 무대 진출에 성공했다.

미트윌란서도 별다른 적응 기간 없이 주전으로 활약하며 37경기 13골 4도움을 올리는 등 대형 공격수의 탄생을 예고했다. 다만 부상이 발목을 잡았다. 조규성은 지난해 5월 오른쪽 무릎 반월상 연골판 절제 수술을 받았다. 문제는 수술 부위가 감염되며 합병증을 앓았다는 점에 있다.



결국 조규성은 한 시즌을 통째로 날린 후 지난 17일 리그 경기에 교체 출전하며 복귀에 성공했다. 

당시를 회상한 조규성은 ""수술 이후 합병증이 생겼다. 정말 세상이 무너지는 것 같았다. 계속 누워만 있었다""라며 ""솔직히 힘든 시간이었다. 특히 병원에 있었을 때 그랬다. 너무 견디기 힘들었고 어떻게 하면 다시 뛸 수 있을까 하는 생각만 들었다. 당시에는 몸무게가 14KG이나 빠졌다. 근육도 다 빠졌고 뼈밖에 남지 않았었다. 너무 괴로웠다""라고 이야기했다.



이어 ""아직 신체적으로는 시간이 필요하다. 그러나 내 정신 상태는 그 어느 때보다 건강하다. 이전보다 강해졌다고 생각한다. 한 단계 더 발전한 느낌이다. 다시 득점하는 날엔 울 것 같지는 않은데 상상이 가진 않는다. 팀원, 코치진 모두에게 감사하다는 말을 전하고 싶다. 정말 많이 도와줬고 나를 행복하게 만들어줬다. 그들은 내게 긍정적인 에너지를 채워줬다. 나는 절대 포기하지 않는다""라고 덧붙였다.

사진=미트윌란 SNS, 게티이미지코리아

취재문의 sportal@sportalkorea.co.kr"
20250910,이 맛에 돈 쓴다! 1만 번 시뮬레이션 돌렸다! 리버풀 UCL 우승 확률 20.4% 1위…반면 토트넘은 1% PL 구단 중 꼴찌,"2018-19시즌 UCL 우승 당시 리버풀 선수단./게티이미지코리아

[마이데일리 = 김건호 기자] 리버풀이 올 시즌 유럽축구연맹(UEFA) 챔피언스리그(UCL) 유력한 우승 후보로 뽑혔다.

영국 '데일리 메일'은 10일(한국시각) ""옵타(Opta)의 최신 슈퍼컴퓨터 예측이 다음 주 개막하는 UCL 우승 후보를 공개했는데, 한 잉글랜드 프리미어리그(PL) 구단에 그리 반가운 소식이 아니다""고 전했다.
오는 17일 UCL 리그페이즈가 시작된다. 총 36개 구단이 토너먼트 진출을 위해 경쟁한다. 상위 8개 구단은 16강으로 직행한다. 9위부터 24위는 16강으로 가기 위한 플레이오프 맞대결을 펼칠 예정이다.

지난 시즌 우승 팀인 파리 생제르맹(PSG)과 준우승 팀 인터 밀란, 아스널, 첼시, 리버풀, 맨체스터 시티, 뉴캐슬 유나이티드, 토트넘 홋스퍼와 같은 PL 구단들, 아틀레티코 마드리드, 바르셀로나, 레알 마드리드, 바이어 레버쿠젠, 바이에른 뮌헨, 보루시아 도르트문트, 유벤투스, SSC 나폴리 등의 이름도 눈에 띈다.

일주일 뒤 UCL 리그페이즈가 시작되는데, '옵타'는 1만 번의 슈퍼컴퓨터 시뮬레이션을 돌려 UCL 우승 가능성이 가장 높은 팀을 발표했다.
알렉산더 이삭./리버풀

'옵타'가 선정한 가장 강력한 우승 후보는 지난 시즌 PL 우승 팀인 리버풀이었다. 리버풀은 올 시즌을 앞두고 플로리안 비르츠, 제레미 프림퐁, 밀로시 케르케즈, 위고 에키티케, 지오바니 레오니, 알렉산더 이삭 등을 영입했다.

옵타에 따르면 리버풀이 우승할 가능성은 20.4%다. 결승 진출 확률은 34%였으며 8강 진출 확률은 72.7%였다.

리버풀에 이어서 또 다른 PL 구단이 2위를 차지했다. 바로 아스널이다. 아스널의 우승 확률은 16%다. 아스널은 지난 시즌 UCL 4강까지 올랐으며 올 시즌 4강 진출 확률은 44.8%였다. 이어 PSG가 12.7%의 우승 확률을 기록했다.

맨시티의 우승 확률은 8.4%다. 바르셀로나, 첼시가 뒤를 이었다.
토마스 프랭크./게티이미지코리아

영국 '미러'는 ""상위 6개 우승 후보 중 4개가 PL 구단인 셈이다""면서도 ""하지만 다른 PL 팀들에는 그리 좋지 않은 전망이 나왔다. 1년 만에 UCL에 복귀한 뉴캐슬은 우승 확률이 3%로, 10번째로 높은 평가를 받았다. 그러나 토트넘은 그보다 더 낮다""고 했다.

토트넘의 우승 확률은 1%였다. 8강 진출 확률은 22.9%다."
20250910,"살 빼고 근육질로 부활…맨유 월클 MF 카세미루, 결국 리빌딩 속 작별 수순 ""5개 구단 관심""","[SPORTALKOREA] 황보동혁 기자= 명실상부한 월드클래스 미드필더 카세미루(맨체스터 유나이티드FC)가 이번 시즌을 끝으로 유럽 무대를 떠날 가능성이 커지고 있다.

영국 매체 '팀토크'는 9일(한국시간) ""카세미루의 맨유 생활이 사실상 마무리 수순에 접어들었다. 벌써 다섯 개 클럽이 2026년 여름을 겨냥해 영입을 노리고 있다""고 보도했다.



매체에 따르면 사우디아라비아에서는 알힐랄과 알나스르가 영입전에 뛰어들 준비를 하고 있다. 특히 알나스르행이 성사될 경우 카세미루는 레알 마드리드와 맨유에 이어 크리스티아누 호날두와 다시 한 번 한솥밥을 먹게 된다.

브라질에서는 플라멩구와 파우메이라스가 관심을 보이고 있으며, 카세미루의 친정팀 상파울루도 유력한 행선지 후보로 거론된다.

카세미루는 한때 루카 모드리치, 토니 크로스와 함께 '크카모' 라인을 구축하며 레알 마드리드CF의 황금기를 이끌었다.



이 시기 레알은 UEFA 챔피언스리그 3연패와 라리가 5회 우승을 달성했다. 그는 레알 통산 336경기에 출전해 31골 29도움을 기록했으며, 브라질 대표팀에서도 주전 미드필더로 활약하며 2019년 코파 아메리카 우승을 들어 올렸다.

2022/23시즌 6천만 파운드(약 1,128억 원)의 이적료로 맨체스터 유나이티드 유니폼을 입은 뒤 첫 시즌에는 리그 3위를 이끌며 핵심 역할을 했다. 당시 공식전 53경기에 출전해 7골 7도움을 기록했다.

그러나 2023/24 시즌에는 잦은 부상과 기량 저하로 많은 비판을 받았고, 과체중 논란에도 휩싸였다. 여기에 수비진 부상 공백 속에 센터백으로까지 나서며 부진을 면치못했다. 



그러나 2024/25시즌 들어 완벽한 몸 관리를 통해 과체중 논란을 잠재우고 다시금 예전의 몸 상태를 회복했다. 이 시즌 유로파리그 우승에는 실패했지만 토너먼트에서 맹활약하며 맨유의 결승 진출을 이끌면서 여전한 존재감을 증명했다.

그럼에도 이번 시즌 들어 체력적 한계가 드러나며 풀타임 소화가 어려운 상황이다. 결국 시즌 종료 후 카세미루가 유럽 무대에서의 커리어를 마감하고 새로운 도전에 나설 것이란 전망이 힘을 얻고 있다.

사진= FootyRoom, 게티이미지코리아 

취재문의 sportal@sportalkorea.co.kr"
20250910,"""상습지각, 공개저격"" 손흥민 떠나자 눈물 '펑펑' 비수마, 결국 토트넘서 짐 싼다...""며칠 내 혹은 1월 이적 예상""","[SPORTALKOREA] 황보동혁 기자= 이브 비수마(토트넘 홋스퍼)가 어떤 방식으로든 팀을 떠날 가능성이 점점 커지고 있다.

영국 매체 '더 하드 태클'은 9일(한국시간) ""비수마가 토트넘에서의 입지가 달라지지 않는다면, 꾸준한 출전 기회를 위해 팀을 떠날 준비를 하고 있다""고 보도했다.

이어 ""비수마는 현재 상황이 바뀌지 않는다면 앞으로 며칠 내 혹은 1월 이적시장에서라도 토트넘을 떠날 수 있다는 입장""이라며 ""토마스 프랑크 감독은 프리시즌 경기에서 비수마를 명단에서 제외하며 강한 메시지를 보냈다. 그 이유가 반복된 훈련 지각 때문이라고 공개적으로 저격했고, 비수마는 새 감독에게 첫인상부터 좋지 못했다. 게다가 토트넘은 이번 여름 바이에른 뮌헨에서 주앙 팔리냐를 임대로 데려오며 중원에 여유를 더했다""고 덧붙였다.



실제 프랑크 감독은 파리 생제르맹과의 UEFA 슈퍼컵을 앞두고 열린 기자회견에서 비수마의 지각 문제를 직접 꼬집었다.

그는 ""비수마가 최근 훈련에 여러 차례 지각했고, 가장 최근에는 그 시간이 지나치게 길었다""며 ""코칭스태프는 때로는 선수를 감싸줄 수도 있지만 동시에 필요한 부분을 요구할 수도 있다. 이런 행동에는 반드시 책임이 뒤따른다""고 목소리를 높였다.

토트넘은 2022년 여름, 당시 브라이턴 소속으로 프리미어리그 최고의 수비형 미드필더 중 하나로 평가받던 비수마를 3,000만 파운드(약 563억 원)에 영입하며 호평을 받았다. 그러나 그는 안토니오 콘테 감독 체제에서 브라이턴 시절의 활약을 보여주지 못하며 점점 입지를 잃었다.



이후 엔지 포스테코글루 감독 부임 직후에는 좋은 경기력을 선보이며 반등의 가능성을 보였지만, 시즌이 진행될수록 급격히 폼이 떨어졌다. 이번 시즌 들어서는 더욱 실망스러운 모습을 보였고, 여러 경기에서 선발로 나섰음에도 전반 종료 후 교체되는 일이 반복됐다.

결국 지난 시즌부터 이어진 부진에 더해 시즌 초반부터 새로 부임한 프랭크 감독에게 태도 논란으로 찍히면서, 비수마는 토트넘에서 입지가 나아지기 어렵다고 판단해 이적을 결심한 것으로 보인다.



'더 하드 태클'은 ""만약 단기간 내 이적을 택하지 않는다면, 9월 12일 전까지는 사우디아라비아 혹은 갈라타사라이로 떠날 수 있고, 그렇지 않다면 1월 겨울 이적시장을 기다리며 상황을 지켜볼 수도 있다""고 전망했다.

한편 비수마는 국내 팬들에게도 익숙한 이름이다. 그는 한국에서 열린 프리시즌 오픈 트레이닝 도중 돌연 눈시울을 붉혀 손흥민의 이별 소식을 듣고 눈물을 흘린 것이 아니냐는 추측을 낳기도 했다.



또 뉴캐슬전에서는 손흥민이 교체되자 가장 먼저 달려가 포옹했고, 경기 후 자신의 SNS를 통해 ""손흥민은 내 인생에서 만난 최고의 사람이었다. 경기장 안팎에서 보여준 모든 배려에 감사한다. 그는 진정한 롤모델이자 본보기였다. 함께한 시간은 정말 소중했고 많은 것을 배웠다. 분명 그리울 것""이라며 아쉬움을 드러냈다.

사진= 이브 비수마 SNS, 게티이미지코리아, 쿠팡플레이 

취재문의 sportal@sportalkorea.co.kr"
