date,title,content
20250626,"韓 축구 초대박 소식! '골든 보이' 이강인, 드디어 PSG 탈출?...아스널,유벤투스,AC밀란,나폴리 관심↑","[SPORTALKOREA] 황보동혁 기자= 파리 생제르맹의 이강인이 이번 여름 이적 시장에서 팀을 떠날 가능성이 커지고 있다. 최근에는 그의 구체적인 행선지까지 언급되기 시작했다.

프랑스 매체 '풋 수르 7'은 25일(한국시간) ""이강인이 여러 클럽의 관심을 받고 있으며, 많은 팀들이 영입을 위한 제안을 준비 중""이라고 보도했다.

매체는 '풋 메르카토'와 이적시장 전문가 에크렘 코누르 기자의 보도를 인용해, 아스널, AC밀란, 유벤투스, 나폴리가 이강인을 영입 후보로 올려놨다고 전했다.



이강인은 2024/25시즌 PSG의 리그1, 쿠프 드 프랑스, 트로페 데 샹피옹, UEFA 챔피언스리그 우승에 모두 기여하며 구단 역사상 첫 '4관왕'의 여정을 함께했다.

비록 주요 결승 무대에 직접 나서지는 못했지만, 대회 엔트리에 포함돼 아시아 선수 최초로 UEFA 주관 대회 트레블을 달성한 선수로 이름을 남겼다.

중앙 미드필더, 공격형 미드필더, 측면 공격수는 물론 가짜 9번, 수비형 미드필더까지 소화하며 다재다능함을 선보인 이강인은 올 시즌 공식전 45경기에서 6골 6도움을 기록하며 팀에 분명한 기여를 했다.



그러나 흐비차 크바라츠헬리아와 데지레 두에 등 새로운 경쟁자들의 등장으로 주전 경쟁이 한층 치열해졌고, 이강인의 출전 기회는 점점 줄어들었다.

실제로 그는 챔피언스리그 결승전을 비롯해 16강 리버풀전 1차전, 8강 애스턴 빌라전, 4강 아스널전 등 핵심 경기들에서 한 차례도 출전하지 못했다.

꾸준한 활약에도 불구하고 중요한 순간마다 외면받는 상황이라면 이강인도 이적을 진지하게 고려할 수밖에 없다.



게다가 아스널, 유벤투스, 밀란, 나폴리 등 유럽의 명문 구단들이 관심을 보내고 있는 만큼, 이강인 입장에서도 새로운 도전에 나설 가능성은 충분하다.

특히 2026년 북중미 월드컵을 앞두고 있는 상황에서, 꾸준한 출전 기회를 보장받을 수 있는 팀으로의 이적은 더 나은 선택이 될 수 있다.

한편, 매체에 따르면 이강인은 클럽 월드컵이 끝난 뒤 자신의 거취를 결정할 예정이다. '풋 수르 7'은 ""PSG는 3,000만 유로(약 476억 원) 수준의 제안이 들어올 경우 이강인을 매각할 수 있다는 입장""이라고 전했다.

사진= 게티이미지코리아 

취재문의 sportal@sportalkorea.co.kr"
20250626,"'대박' 이강인 원한 최종 1팀, 아스널이었다! 아르테타 감독이 직접 '꼭 데려와'... 이적료 477억 구체화","[스타뉴스 | 박재호 기자]
팀 훈련에 참여한 이강인의 모습. /사진=PSG 공식 홈페이지 갈무리
파리 생제르맹(PSG) 공격수 이강인(24)이 잉글리시 프리미어리그(EPL)로 갈 가능성이 커졌다.

프랑스 '라이브풋'은 26일(한국시간) ""PSG는 이강인을 원하는 아스널과 나폴리가 영입 경쟁을 더 해 주길 원한다. 이적료를 더 받길 원하기 때문이다""라고 보도했다.

매체는 ""PSG는 2년 전 여름 이적료 2200만 유로(약 350억원)로 이강인을 영입했다. 여전히 이강인을 원하는 팀들이 많고 PSG는 몇 주 내로 매각을 성사시킬 수 있다""며 이강인의 이적 가능성을 높게 점쳤다.
그러면서 ""PSG는 이강인을 2년 전보다 1000만 유로(약 157억원)가 오른 3000만 유로(약 477억원)에 팔 계획이다. 현재 아스널이 이강인을 영입할 가능성이 가장 크다""고 전했다.

매체는 이강인에 대해 ""뛰어난 기술과 왼발, 다재다능을 갖췄다. 루이스 엔리케 감독 밑에서 핵심 선수가 될 자질을 갖추고 있었다""고 평했다. 그러면서도 ""그동안 이강인은 주전을 꿰찰 만한 자신감과 꾸준함이 부족했다. 효율설도 떨어졌다. 결국 '럭셔리 조커'로 전락했다""며 이적설이 나오게 된 배경을 설명했다.

이강인이 킥을 시도하고 있다. /AFPBBNews=뉴스1
이강인이 아스널과 연결된 건 처음이 아니다. 영국 '더선'은 지난 5월 ""아스널이 이강인 영입을 위해 움직이고 있다""고 보도했다. 지난 5월 영국 '더선'은 ""미켈 아르테타 감독이 지난 1월 이강인에게 관심을 보였다""며 ""아스널의 새 스포츠 디렉터 안드리아 베르타도 이강인을 위한 스쿼드를 만들기 위해 노력 중이다""라고 설명했다.

이어 ""베르타는 2년 전 아틀레티코 마드리드에 있을 때 이강인에게 관심을 보인 바 있다. 하지만 당시 이강인은 PSG로 이적했다""고 덧붙였다.

이강인은 지난 시즌 후반기부터 주전 경쟁에서 완전히 밀려났다. 루이스 엔리케 감독은 이강인 대신 흐비차 크바라츠헬리아, 우스만 뎀벨레, 브래들리 바르콜라, 데지레 두에 등으로 공격진을 꾸렸다. 미드필더 라인도 파비안 루이스, 비티냐, 주앙 네베스 라인이 자리 잡아 이강인이 들어갈 틈이 없었다. 지난 시즌부터 이강인 이적설이 불거진 이유는 주전 경쟁에서 밀린 것과 관련이 깊다.

PSG 공격수 이강인. /AFPBBNews=뉴스1
이런 가운데 이강인이 직접 자신의 소셜미디어(SNS)에서 PSG 소속을 지워 이목을 끌었다. 그는 지난달 6일 자신의 SNS 프로필에 PSG 소속이라는 설명과 PSG를 상징하는 붉은색과 파란색 동그라미를 모두 삭제해 이적설을 더욱 부추겼다.

최근 이강인은 자신의 거취에 대해 ""전혀 모른다""고 직접 밝힌 바 있다. 지난 10일 서울월드컵경기장에서 열린 쿠웨이트와 '국제축구연맹(FIFA) 2026 북중미 월드컵' 아시아 3차 예선 B조 최종 10차전에서 '거취에 변화를 줄 생각이 있냐'고 묻자 이강인은 ""앞으로 어떤 일이 벌어질지 솔직히 나도 잘 모른다""면서 ""분명히 얘기하고 싶은 건 내가 어디에 있든지 항상 최고의 모습으로 팀에 보탬이 되고 싶다""고 말했다.

'향후 거취에 대한 조금의 힌트를 달라'고 하자 ""힌트를 드리고 싶어도 이적 시장이 안 열려서 아직 구단과 얘기한 부분이 없다. 진짜 아무것도 아는 게 없다. 저도 기사로 보고 있다. 모르겠다""고 말했다.

경기 전 몸을 푸는 이강인. /AFPBBNews=뉴스1"
20250626,"‘대충격’ 이강인, 나폴리행 무산? 차기 행선지는 EPL+LONDON?","이강인(24)의 나폴리행이 사실상 무산됐다. 차기 행선지로 EPL에서 런던을 연고지로 하는 팀들이 떠오르고 있다.

유럽 축구 이적 사정에 정통한 복수 유럽 언론 기자들이 23일(이하 한국시간)과 24일 일제히 “나폴리가 이강인 영입을 위한 PSG(파리생제르맹)와의 협상을 중단했다”고 보도했다. 복수의 보도를 종합하면 결국 이강인에게 이번 이적 시장 가장 큰 관심을 보였던 나폴리는 영입전서 철수한 모습이다.

스페인 언론 ‘렐레보’ 등에서 활동하는 마테오 모레토 기자는 23일 “이강인과 PSG와의 재계약 협상이 멈췄다. 그런 도중에 이강인이 나폴리로 이적할 가능성 역시 현저하게 낮아졌다”면서 “이강인은 프랑스(리그1)과, 이탈리아(세리에A)를 제외한 해외 리그로 이적할 가능성이 높다.EPL 구단이 관심 높게 그를 살펴보고 있다”는 소식을 전했다.

나폴리와의 이적 가능성이 사실상 없어진 이강인의 차기 행선지로 아스널 등이 거론되고 있다. 사진=365 Scores sns
모레토 기자는 앞서 지난달 27일 이강인이 PSG와 재계약에 난항을 겪고 있음을 보도하며 나폴리와 사우디아라비아클럽이 영입에 관심을 보이고 있다고 전하기도 했다. 앞서 이강인의 PSG 이적 소식 가장 먼저 보도했던 모레토 기자인만큼 이강인 측의 내부 소식에 정통한 소식으로 여겨진다.

이탈리아 축구 이적 사정에 정통한 잔루카 디 마르지오 스카이스포츠 기자 역시 이강인이 나폴리의 영입 리스트에 없다는 것을 확인했다. 디 마르지오 기자는 자신의 이름과 같은 매체 ‘디 마르지오’를 통해 23일 “나폴리가 노아 랑의 영입에 합의했다. 관련 이름은 그뿐만이 아니다. 나폴리는 유벤투스의 영입 리스트엔 제이든 산초, 단 은도예, 페데리코 키에사가 포함되어 있다”고 설명했다.
결국 PSG의 태도가 가장 큰 문제였던 것으로 보인다. 앞서 이적시장에서 오랜 기간 EPL의 패스마스터로 군림했던 벨기에의 미드필더 케빈 더 브라위너를 영입한 나폴리는 이강인의 추가 영입을 통해 전력 보강을 하려는 의욕적인 모습을 보였다.

하지만 PSG는 이강인의 이적을 굳이 서두르지 않았고, 높은 이적료를 받을 경우에만 이적하겠다는 입장을 고수하고 있는 모습이다. 복수의 보도를 종합하면 PSG는 이강인의 이적료로 2,500만 유로(약 396억 원) 이상을 지속적으로 원하고 있는 모습이다. 동시에 PSG가 이강인의 적정 이적료로 4,000만 유로(약 634억 원)~5,000만 유로(약 792억 원)를 원하고 있다는 소식까지 나온다.

이토록 PSG가 강경한 입장인 것은 이강인의 마케팅 가치 또한 높이 평가하고 있기 때문이다. 앞서 PSG는 한국 투어와 늘어난 유니폼 판매 수식과 PSG 홈구장 수익 등을 이유로 이강인을 매각 불가 대상으로 꼽기도 했다. 현재는 이강인이 PSG의 사실상 벤치 멤버로 분류되고 있는 만큼 매각 가능성을 열어두고 있지만, 급할 것도 없다. 이강인과의 계약이 2028년까지 남은 만큼 PSG는 굳이 매각을 서두를 이유가 없다는 입장이다.

이강인은 최근 클럽 월드컵에서 페널티킥을 성공시키기도 했지만 사실상 PSG의 차기 시즌 주전 멤버 구상에서 멀어진 모습이다. 사진(美 패서디나)=ⓒAFPBBNews = News1
달라진 나폴리의 내부 사정도 이강인과의 연결을 끊은 핵심적인 이유다. 앞서 이적이 유력했던 나폴리의 주전 미드필더 잠보 앙귀사가 최근 잔류를 결정했다. 앞서 이탈리아의 투토 나폴리 역시 지난 17일 “잠보 앙귀사가 자신의 미래를 신중하게 생각 중”이라며 “이때문에 이강인과의 접촉 역시 잠시 멈춘 상태”라고 전하기도 했다.

동시에 현재 PSG에서 700만 유로(약 90억원)을 받고 있는 이강인의 몸값도 걸림돌이 됐다. 모든 유럽 축구 리그를 통틀어서도 비교적 고액 연봉군에 속하는 이강인의 연봉을 나폴리는 감당할 수 있을 것으로 보였지만, 제안은 그 수준을 만족하지 못했던 것으로 보인다.

나폴리와의 이적 가능성이 사실상 결렬된 가운데 EPL 복수 구단이 이강인의 차기 행선지로 다시 거론되기 시작했다. 최근 영국 언론 등에선 그중에서도 런던을 연고지로 삼고 있는 PL의 명문 클럽인 아스널이이강인 영입에 가장 관심 있는 PL클럽으로 꼽히고 있다.

아스널의 경우엔 지난해 시즌을 앞둔 여름 이적시장 상황이나 지난해 12월부터 열린 겨울 이적 시장에서도 이강인과 연결되기도 했다. 공격진 보강이 필수적인 아스널이고 동시에 다재다능한 기술적인 선수를 선호하는 미켈 아르테타 감독의 성향과 기술 보드진의 성향이 이강인과 궁합이 잘 맞는 상황이다.

동시에 이강인의 몸값을 충분히 감당할 수 있는 빅클럽이란 점에서도 차기 영입 1순위 후보로 다시 이름이 거론되고 있는 모양새다. 하지만 앞서 나폴리의 이적설과는 달리 구체적인 협상 진척 내용이나 전개 등의 소식이 아직 알려지진 않은 모습이다.

런던을 연고로 하는 또 다른 PL팀인 크리스탈팰리스 역시 이강인 영입설에 꽤 오랫동안 이름이 나오고 있는 구단이다. 차기 시즌 유럽축구연맹(UEFA) 유로파리그(UEL)에 나서는 크리스탈 팰리스의 올리버 글라스너 감독이 창의적인 2선 자원을 영입하고 싶어하고 이강인을 높이 평가한다는 것이 영입 소식의 골자다.

결국 이강인의 차기 행선지는 영국이 될 가능성이 점차 높아지고 있는 모양새. PSG와의 인연이 점점 옅어지고 있는 이강인이 다음 시즌 어디에서 뛰게 될까?

[김원익 MK스포츠 기자]"
20250626,"이강인 이적 데드라인 공개→'단 두 팀 남았다' 최종 영입 경쟁 '활활'... ""PSG, 475억 요구 중""","[스타뉴스 | 박건도 기자]
이강인이 2024~2025시즌 유럽축구연맹(UEFA) 챔피언스리그(UCL) 우승 트로피를 왼손에 쥐고 있다. /사진=이강인 개인 사회관계망서비스(SNS) 갈무리
이강인. /사진=파리 생제르망(PSG) 공식 사회관계망서비스(SNS)
이강인(24)이 파리 생제르망(PSG)을 떠날 날은 얼마 남지 않았다. 유력한 행선지와 이적료까지 좁혀졌다.

프랑스 매체 '라이브풋'은 26일(한국시간) ""이강인은 루이스 엔리케 감독 체제의 PSG에서 핵심 선수로 뛸 자질을 갖추고 있었다""며 ""하지만 이강인은 주전을 차지할 만큼의 자신감과 꾸준함, 효율성이 부족했다. 럭셔리 조커로 분류된 그는 올여름 새로운 팀으로 떠날 것""이라고 보도했다.
유력한 다음 구단도 공개했다. 매체는 ""PSG는 이번 거래로 상당한 이적료를 벌고 싶을 것이다. 3000만 유로(약 475억 원)에 이강인 매각을 원한다""며 ""아스널(잉글랜드)과 나폴리(이탈리아)가 PSG와 계약을 성사시킬 가능성이 가장 크다. PSG의 목표액에 근접할 수 있는 최적의 조건""이라고 밝혔다.

여기에 유럽축구 소식에 밝은 마테오 모레토는 이강인의 이적 시기에 대해 ""몇 주 안에 결정될 것""이라고 말했다. 모레토는 이강인의 PSG행을 맞춘 기자로 저명하다.

이강인이 2024~2025시즌 유럽축구연맹(UEFA) 챔피언스리그(UCL) 3라운드 PSV에인트호번(네덜란드)과 경기 전 기자회견에서 취재진의 질문에 답하고 있다. /AFPBBNews=뉴스1
올 시즌 말부터 이적설에 휩싸인 이강인은 현재 PSG 선수단에 참가해 2025 국제축구연맹(FIFA) 클럽월드컵을 뛰고 있다. 지난 16일 아틀레티코 마드리드(스페인)와 1차전 경기에서는 후반전 교체 투입돼 페널티킥 골을 넣기도 했다. 20일 보타포구(브라질)전에서는 후반전 11분만 뛰었다.

다만 이강인의 PSG 내 입지는 갈수록 좁아진 것으로 파악됐다. 프랑스 현지 매체 '겟 프렌치 풋볼 뉴스'는 2024~2025시즌이 끝난 뒤 ""곤살루 하무스(23)와 이강인은 올여름 PSG의 매각 대상""이라며 ""이강인은 올 시즌 45경기에 출전했지만, 선발로 나선 경우는 거의 없었다. 이번 여름 적절한 가격에 떠날 수 있다""고 알렸다.

심지어 이 소식은 프랑스 유력지 '레퀴프'에서 처음 보도된 것으로 알려졌다. 해당 매체는 2024~2025시즌 PSG 주전 경쟁에서 밀린 하무스와 이강인이 올여름 팀을 떠날 수 있다고 설명했다. 다만 PSG는 이강인을 헐값에 보낼 생각은 없다. ""적절한 제안이 들어오면 하무스와 이강인 모두 팀을 떠날 것""이라고 전했다.

파리 생제르맹(PSG) 이강인이 1일(한국시간) 독일 뮌헨의 알리안츠 아레나에서 2024~2025 유럽축구연맹(UEFA) 챔피언스리그 우승 트로피를 잡고 기념 사진을 촬영하고 있다. /사진=이강인 SNS 캡처
이강인(왼쪽)이 아틀레티코 마드리드와 2025 국제축구연맹(FIFA) 클럽월드컵 경기서 후반 추가시간 페널티킥 골을 넣고 동료들과 기뻐하고 있다. /AFPBBNews=뉴스1
이탈리아 현지에서는 이강인의 다재다능함에 거는 기대가 크다. 이탈리아 매체 '코리엘레 델로 스포르트'는 ""나폴리는 이적시장에 눈을 돌렸다""며 ""이강인을 영입하기 위해 빠르게 움직일 것이다. 메짤라와 오른쪽 윙어까지 뛸 수 있는 이강인은 나폴리의 관심을 받고 있다. 안토니오 콘테(56) 감독의 전술에 강렬함을 선사해야 할 것""이라고 설명했다.

이강인은 2024~2025시즌 PSG 역사를 함께 썼다. PSG는 구단 사상 첫 챔피언스리그 우승이자 프랑스 최초 트레블(프랑스 리그1, 쿠프 드 프랑스, 챔피언스리그 우승)을 달성했다. 박지성(전 맨체스터 유나이티드) 이후 17년 만의 한국인 챔피언스리그 챔피언이 되기도 했다.

이강인의 2025 국제축구연맹(FIFA) 클럽월드컵 조별리그 아틀레티코 마드리드전 쐐기골 장면. /AFPBBNews=뉴스1"
20250626,"'Here we go'급 기자도 인정! '韓 최고 재능' 이강인 차기 행선지 등장→'EPL행 재점화' 아스널 뜨거운 관심 도착...""이미 제의 준비 중""","로이터연합뉴스
로이터연합뉴스
[스포츠조선 이현석 기자]이강인을 향한 잉글랜드 프리미어리그(EPL)의 관심이 뜨겁다.

프랑스의 스포르트는 26일(한국시각) '아스널이 이강인을 부활시킬 준비를 완료했다'라고 보도했다.

스포르트는 '이강인은 파리 생제르맹(PSG)에 큰 기대를 안고 합류했지만, 주전으로 자리 잡지 못하며, 출전 시간을 확보하기 위해 짐을 쌀 가능성이 크다. 그의 상황은 점점 어려워지고 있으며, 클럽 월드컵 이후 이적할 가능성이 커 보인다. 이강인은 여전히 유럽 이적시장에서 높은 평가를 받고 있다. 아스널이 그를 주시하고 있다'라고 전했다.

로이터연합뉴스
프랑스의 풋수르7은 '이강인은 이번 여름 엄청난 제안을 받고 있다. 수많은 구단이 그에게 제의를 준비 중이다. 소식에 따르면 아스널이 여름 이적시장에서 이강인 영입을 고려하고 있다. 또한 이탈리아로 향할 가능성도 있다'라고 설명했다.

유럽축구 이적시장 전문가 마테오 모레토 또한 최근 SNS를 통해 '이강인과 PSG와의 재계약 협상이 멈췄다. 다만 나폴리로 이적할 가능성 역시 현저하게 낮아졌다. 이강인은 프랑스(리그1)과, 이탈리아(세리에A)를 제외한 해외 리그로 이적할 가능성이 높다. EPL 구단이 관심 높게 그를 살펴보고 있다'라고 밝힌 바 있다.

로이터연합뉴스
2024~2025시즌 이강인은 기세가 좋았던 시즌 초반과 달리 시즌 막판에 갈수록 어려운 시간을 보내며 아쉬운 시즌 마무리를 앞두고 있다. 직전 겨울 이적시장에서 상황이 뒤바뀌었다. 흐비차 크바라츠헬리아 합류 이후 입지가 완전히 달라졌다.

엔리케 감독은 흐비차 영입 이후 중요 경기에서 공격진을 사실상 고정했다. 흐비차, 브래들리 바르콜라, 우스만 뎀벨레를 확실한 주전 선수로 기용했다. 이강인이 자리를 차지했던 중원도 비티냐, 주앙 네베스, 데지레 두에가 확고하게 주전으로 도약하며 이강인의 출전 시간이 급감했다. 지난 3월 A매치 이후에는 부상으로 자리를 비우기도 하며, 최근 중요 경기에서는 출전 시간을 거의 얻지 못했다. 리그 최종전과 직전 쿠프 드 프랑스 결승전 경기에서도 이강인을 위한 자리는 없었다. 현재 진앵되는 클럽 월드컵에서도 상황은 크게 반전되지 않았다.

로이터연합뉴스
이적 가능성은 겨울 이적시장 이후 꾸준히 거론되던 상황이다. 프랑스 유력지인 레퀴프도 '이강인은 지금 완전히 교체 자원이다. PSG는 그의 이적을 허용할 생각이 있다. 헐값에 매각할 계획은 아니지만, 시즌 종료 후 선수 측과 만나 결정을 내릴 것이다'라고 주장했다.

이미 EPL을 포함해 여러 리그에서 관심을 보인다고 알려졌다. 프랑스의 풋01은 '이강인의 이적은 불가피하다. 그의 플레이 스타일이 이적시장에서 관심을 끌고 있다. 이미 잉글랜드 프리미어리그(EPL)에서 이강인의 상황을 주시하고 있다'고 밝혔었다. 아스널, 맨체스터 유나이티드, 크리스털 팰리스 등이 이강인 영입에 관심을 보인 구단으로 거론됐다. 이런 상황에서 아스널의 관심이 다시 한번 등장하며, 이강인이 EPL 우승 후보 중 한 팀으로 향할 가능성에 관심이 쏠리고 있다.

사우디아라비아도 관심을 보였다. 프랑스의 VIPSG는 지난 5월 '이강인은 시간이 지나면서 설득하는 데 어려움을 겪고 있다. 몇 차례 뛰어난 활약에도, 이강인은 선발 명단에 자리잡지 못했다. 사우디아라비아로부터 확실한 제안이 이미 접수됐다'고 했다.

PSG에서 큰 기대를 받았던 이강인이 이제 다시 새로운 팀을 찾아 떠날 가능성이 커지고 있다. 이강인의 차기 행선지가 EPL이 될지도 귀추가 주목된다."
