date,title,content
20250829,"[PL POINT] ""LAFC 떠난 손흥민+시즌아웃 부상 매디슨 동시 대체 가능""...토트넘이 시몬스 노리는 이유","사진=스퍼스 웹


[인터풋볼=신동훈 기자] 토트넘 홋스퍼는 사비 시몬스 영입에 사활을 건다. 이번엔 실패하지 않겠다는 각오다.

독일 '스카이 스포츠'는 28일(이하 한국시간) ""첼시는 시몬스 영입 경쟁을 이어가고 있다. 토트넘이 합류했다. 토트넘은 공식 제안을 했고 라이프치히가 원하는 수준에 도달했다. 첼시는 아직 공식 제안을 하지 않았다. 라이프치히는 시몬스 이적료로 7,000만 유로(약 1,131억 원)를 원한다. 런던 내부에서 시몬스 영입 경쟁이 치열하다""고 보도했다.
영국 '풋볼 런던'의 토트넘 전담 기자 알라스데어 골드도 ""토트넘은 시몬스를 영입 대상으로 선택했다. 토마스 프랭크 감독은 중원에 창의성을 더할 예정이다. 첼시의 영입 참전이 변수다""고 이야기했다.

토트넘은 모건 깁스-화이트, 에베레치 에제 영입에 실패한 후 새로운 10번 유형 선수를 영입하기 위해 노력 중이다. 에제가 아스널로 떠난 후 니코 파스, 모건 로저스, 루카스 파케타와 연결은 됐는데 실질적인 움직임으로 이어지진 않았다. 시몬스 영입은 매우 진지하다.

시몬스는 파리 생제르맹(PSG)을 떠나 라이프치히 에이스로 떠올랐다. 득점력과 더불어 창의성 있는 패스를 공격진에 불어넣을 수 있다. 토트넘이 시몬스 영입을 원하는 이유다. 골드 기자는 ""손흥민이 LAFC로 떠나고 제임스 매디슨이 전방십자인대 부상으로 거의 시즌아웃을 당하게 되면서 전력 공백이 크다. 최우선 선택지는 깁스-화이트였는데 무산됐고 에제도 놓쳤다""고 토트넘 상황을 전했다.

사진=스퍼스 글로벌 


시몬스를 두고는 ""중앙 미드필더, 좌측 윙어 소화도 가능하다. 매디슨, 손흥민을 동시에 대체할 수 있는 것이다. 라이프치히는 시몬스에게 훈련 불참까지 허용하면서 런던으로 가 협상을 할 수 있도록 했다. 토트넘은 구두 제안을 했는데 시몬스 주급이 20만 파운드(약 3억 7,447만 원)를 넘어 토트넘 임금 체계에 문제가 생길 수 있다. 첼시로 가면 콜 팔머가 있지만 토트넘에선 바로 주전으로 도약할 수 있다. 이번 영입도 실패한다면 토마스 프랭크 감독은 어려울 것이다""고 했다.

시몬스도 프리미어리그 이적을 원하는 듯하다. 라이프치히가 이번 시즌 유럽축구연맹(UEFA) 주관 대회에 나가지 못해 UEFA 챔피언스리그(UCL)에 나가는 첼시, 토트넘 모두 시몬스에게 매력적이다. 토트넘이 이번에는 타깃을 놓치지 않을지 지켜볼 일이다."
20250829,"""손흥민 이후 이런 감정은 처음""…토트넘 입성하자마자 팬들 반했다","사진=토트넘


[포포투=박진우]

토트넘 홋스퍼 팬들은 손흥민이 떠난 아쉬움을 모하메드 쿠두스로 채우고 있다.

2025-26시즌을 앞두고 토트넘에 입성한 쿠두스. 토마스 프랭크 감독이 열렬히 원한 영입이었다. 공격형 미드필더는 물론 좌우측 윙어 모두 소화 가능한 멀티 플레이어였고, 가장 중요시 여기는 전방 압박 또한 성실히 수행하는 선수다.

무엇보다 웨스트햄 유나이티드에서 이미 검증된 선수였다. 쿠두스는 지난 2023-24시즌 웨스트햄에 입성했다. 데뷔 시즌 45경기 14골 6도움, 지난 시즌 35경기 5골 4도움을 올렸다. 웨스트햄이 쿠두스를 보내는 건 시간 문제였고, 결국 토트넘이 그를 품게 됐다. 

벌써부터 프랭크 감독의 '믿을맨'이 되어가고 있다. 프리미어리그(PL) 2라운드가 진행된 현재, 쿠두스는 2경기 모두 선발 출전했고 2도움을 올렸다. 1R 번리전에서는 히샬리송에게 정확한 크로스로 2도움을 기록했고, 2R 맨체스터 시티전에서도 우측 측면을 지배하며 좋은 모습을 보였다.

손흥민의 공백을 잘 메우고 있다. 물론 쿠두스는 손흥민이 뛰던 좌측 윙어가 아닌, 우측 윙어로 나선다. 프랭크 감독은 공격 전개의 비중을 우측면에 뒀다. 과거 토트넘이 손흥민을 중심으로 좌측면에서 공격을 진행하던 상황과 비슷한 것.

제 역할을 100% 수행하고 있다. 토트넘의 빠른 역습을 이끌고 있고, 우측면에서 안으로 접는 플레이와 직선적으로 치고 들어가는 움직임까지 보인다. 특히 기술이 좋아 수비 한 두 명을 쉽게 제친다. 여기에 성실한 압박까지 수행하며 토트넘의 새로운 에이스가 됐다.

토트넘 팬들은 손흥민이 떠난 아쉬움을 쿠두스로 채우고 있다. 영국 'TBR 풋볼'은 지난 맨시티전 직후, 쿠두스를 향한 팬들의 헌사를 전했다. 팬들은 ""새로운 영입 선수를 보고 이런 느낌을 받은 건 손흥민 이후 처음이다"", ""쿠두스가 이렇게 잘할 줄 정말 몰랐다. 신입생에게 감동받은 적이 언제였는지 모르겠다""며 찬사를 보냈다.

사진=게티이미지"
20250829,"'韓 괴물 수비답다!' 김민재, 이적시장 마감 목전에 '빅클럽 러브콜' 연쇄 터졌다→'伊 명가' 두 라이벌 구단, 동시 영입 시도...""단, 뮌헨 측 단호히 거절""","[SPORTALKOREA] 김경태 기자=그야말로 '전화위복(轉禍爲福)'이다. 한때 FC 바이에른 뮌헨에서 매각 명단에 이름을 올렸던 김민재였지만, 이젠 없어서는 안 될 핵심 전력이 됐다. 최근에는 AC 밀란이 영입 시도를 했지만, 이에 대해 구단은 칼 같이 거절했다. 

뮌헨 소식을 주로 전하는 독일 매체 '바바리안 풋볼 워크스'는 29일(한국시간) 이적시장 소식에 정통한 마테오 모레토 기자의 보도를 인용해 ""AC 밀란이 뮌헨의 센터백 김민재 이적 가능성을 타진했지만, 뮌헨 측은 단호히 거절했다""고 전했다.



이어 ""AC 밀란의 스포츠 디렉터 이글리 타레는 김민재의 열렬한 팬이다. AC 밀란은 김민재를 두고 접촉했지만, 뮌헨은 '김민재는 판매 대상이 아니다'고 답변했다""고 밝혔다.

뮌헨은 현재 김민재에게 큰 기대를 걸고 있는 상황이다. 이는 올 여름 간 김민재를 매각 대상으로 올렸었던 기조와는 정반대의 태도다. 

지난 시즌 김민재는 아킬레스건 통증과 더불어 컨디션 저하를 겪어 인터 밀란과의 유럽축구연맹(UEFA) 챔피언스리그 8강전에서 대형 실수를 범하기도 했다.



그럼에도 김민재는 우여곡절 끝에 분데스리가 우승을 차지하며 시즌을 잘 마무리 하는 듯 했다. 그러나 충격적이게도 뮌헨은 김민재가 없는 수비진을 구상하기 시작했다. 이를 증명하듯 독일 무대를 호령하고 있던 바이어 04 레버쿠젠의 요나탄 타를 영입했다.

여기에 더해 현지 매체들 또한 김민재의 입지를 불안하게 만들었다. 연일 구단이 김민재를 팔길 원하고 있다는 식의 보도를 내기 시작했고, 그의 대체자로 헤나투 베이가, 막심 에스테브 등 다양한 선수들의 영입을 노리고 있다고 소식을 전했다.



설상가상 김민재의 경쟁자 타의 입지 마저 급격히 상승했다. 뮌헨 수뇌부는 2025 국제축구연맹(FIFA) 클럽 월드컵에서 타의 활약에 큰 만족을 한 것으로 알려진 가운데, 올 시즌 타를 상당한 영향력과 지위를 가진 주장단에 까지 올렸다.

이에 따라 김민재의 매각 가능성이 높아지기 시작했다. 이를 유럽 유수의 구단들이 놓칠리 만무했다. 특히 최근 인터 밀란까지 영입에 가세했다.



이탈리아 매체 '가제타 익스프레스'에 따르면 인터 밀란은 뱅자맹 파바르의 거취가 변수로 떠오르자, 김민재를 우선 영입 순위로 삼았다. 김민재에게도 세리에 A 복귀는 매력적인 선택지였기에 기대감이 증폭되고 있었다. 

뮌헨은 별안간 김민재를 판매할 의사가 없음을 공개적으로 밝히기 시작했다. 크리스토프 프로인트 단장은 26일 독일축구연맹(DFB) 포칼 1 라운드를 앞두고 인터뷰에서 김민재의 이적 가능성을 언급하며 ""축구에서는 어떤 일도 100% 배제할 수는 없다. 하지만 그건 우리의 계획이 아니다. 김민재가 다시 완전히 몸 상태를 끌어올린 것에 매우 만족하고 있으며, 우리가 그가 얼마나 뛰어난 선수이고 어떤 장점을 지녔는지 잘 알고 있다""고 의견을 피력했다.



이들은 김민재가 폼을 되찾았다는 것에 큰 만족감을 느끼고 있었다. 실제 김민재는 RB 라이프치히와의 2025/26 분데스리가 개막전에서 엄청난 퍼포먼스를 선보였다. 

안정적인 수비는 물론 후반 32분 수비수라곤 믿을 수 없는 드리블 돌파로 50M 가량을 내달렸고, 해리 케인에게 감각적인 패스까지 찔러 득점을 뽑아내는 데 크게 이바지했다. 뮌헨은 김민재의 노고 덕에 6-0 대승을 이뤄낼 수 있었다.

이후로도 SV 베헨 비스바덴과의 포칼 1라운드에 선발 출격해 풀타임을 소화했다. 그는 통계 매체 'FotMob' 기준 패스 정확도 115/119 (97%), 차단 2회, 걷어내기 3회, 가로채기 2회, 리커버리 7회 등의 수치를 쌓으며 좋은 경기력을 펼쳤다. 이에 매체는 김민재에게 수비진 전체 최고 평점인 7.5를 부여하기도 했다.

이에 따라 뮌헨은 김민재에게 큰 신뢰를 보냈고, AC 밀란의 영입 시도에도 칼같이 거절하며 올 시즌 그와의 동행을 꿈꾸고 있다.

사진=FC 바이에른 뮌헨, 셈프레 밀란, 게티이미지코리아, 스포츠존 

취재문의 sportal@sportalkorea.co.kr"
20250829,"[속보] '배신자 66번' 아놀드, 안필드 돌아온다...레알 마드리드vs리버풀 UCL 대결 성사","사진=스포츠키다 


[인터풋볼=신동훈 기자] 트렌트 알렉산더-아놀드가 안필드로 돌아온다.

유럽축구연맹(UEFA)은 29일 오전 1시(한국시간) 모나코에서 UEFA 챔피언스리그(UCL) 리그 페이즈 추첨식을 진행했다. 지난 시즌부터 UCL 조 운영 방식은 바뀌었다. 36개 팀이 단일 리그제처럼 운영을 하며 한 팀당 8경기를 치러 성적을 기반으로 상위 8개 팀은 16강에 자동 진출하고 9위부터 24위까지 플레이오프를 치러 남은 8팀을 정한다. 25위부터 36위는 바로 탈락된다.

레알 마드리드는 맨체스터 시티, 리버풀, 유벤투스, 벤피카, 마르세유, 올림피아코스, AS모나코, 카이라트 알마티와 대결한다. 레알, 리버풀 경기가 관심을 끈다. 리버풀 홈 구장 안필드에서 대결하는데 아놀드가 안필드로 돌아온다.

아놀드는 리버풀 원클럽맨이었다. 2004년 유스에 입단해 현재까지 뛰고 있다. 다른 팀 임대 없이 오직 리버풀에서만 뛰었다. 혜성 같이 등장해 주전 라이트백이 됐고 위르겐 클롭 시대 핵심 선수로 활약해 프리미어리그, 유럽축구연맹(UEFA) 챔피언스리그(UCL) 우승 등 수많은 트로피를 들어올렸다. 잉글랜드 국가대표이기도 하며 미드필더로도 활용이 가능해 높은 평가를 받았다.

지난 시즌을 끝으로 리버풀과 계약이 종료되는 시점에서 레알과 연결됐다. 리버풀 팬들의 분노가 커 보인다. 성골 유스가 이적료를 기록하지 않고 떠나는 것에 대한 분노가 있는 듯했다. 유니폼 화형식까지 하면서 분노를 표출했다. 레알과 협상하는 과정에서 아놀드 태도도 문제가 됐다.

결국 아놀드를 리버풀을 떠나 레알로 갔다. 레알에서 활약 중인 아놀드는 리버풀로 돌아온다. 리버풀과 처음으로 적으로 만나는 아놀드를 안필드 팬들이 어떻게 맞을지 벌써 기대감이 높다."
20250829,"'바이에른 뮌헨, 김민재 헌신 고마움 잊지 않았다'…방출 후보→클럽 운영진이 잔류 선언","김민재와 케인/게티이미지코리아
김민재/게티이미지코리아

[마이데일리 = 김종국 기자] 바이에른 뮌헨의 김민재 잔류 선언이 주목받고 있다.

바이에른 뮌헨의 콤파니 감독과 프로인트 디렉터는 28일 열린 2025-26시즌 DFB포칼 1라운드를 앞둔 기자회견에 참석해 김민재에 대해 이야기했다. 김민재는 올 여름 이적시장에서 다양한 이적설과 함께 거취에 대한 다양한 추측이 이어졌다.
바이에른 뮌헨의 프로인트 디렉터는 ""김민재가 다시 완전히 회복해서 기쁘다. 김민재가 우리에게 얼마나 중요한지 알고 있다""며 김민재가 팀에서 미치는 영향력을 언급했다.

콤파니 감독은 ""김민재는 우리에게 매우 중요한 선수다. 김민재는 정말 잘 훈련했고 지난 경기에서 교체 출전했을 때도 아주 잘해냈다""는 뜻을 나타냈다.

독일 매체 AF는 27일 바이에른 뮌헨의 김민재 잔류 선언에 대해 '바이에른 뮌헨의 방출 후보로는 콤파니 감독의 시스템에 부합하지 않거나 바이에른 뮌헨이 요구하는 수준에 도달하지 못하는 선수들과 연봉이 높은 선수들이 지목됐다. 다이어, 팔리냐, 보이는 콤파니 감독의 시스템에 부합하지 않았고 나브리, 고레츠카, 자네, 코망은 수준 이하라는 평가를 받았다'고 전했다. 또한 '김민재, 우파메카노, 스타니시치는 바이에른 뮌헨 경영진이 더 이상 잠재력을 신뢰하지 않는 선수로 여겨졌다'면서도 '김민재의 장점은 콤파니 감독의 시스템에 완벽하게 부합한다. 투헬 감독은 김민재가 욕심이 많다고 비난했지만 김민재가 컨디션이 좋을 때는 수비 라인에서 자신의 역할을 훌륭하게 수행하는 선수'라고 덧붙였다.

이 매체는 '김민재는 여러가지 이유로 바이에른 뮌헨에서 필요한 체력을 갖추지 못했다. 바이에른 뮌헨 데뷔 시즌에는 프리시즌 훈련을 거의 하지 못한 채 팀에 합류했고 두 번째 시즌에는 고질적인 아킬레스건 문제로 어려움을 겪었다. 김민재는 통증이 있었지만 팀을 위해 희생했고 클럽은 김민재의 헌신에 감사하고 있다'고 전했다.

바이에른 뮌헨은 28일 독일 비스바덴에 위치한 브리타아레나에서 열린 비스바덴과의 2025-26시즌 DFB포칼 1라운드 원정 경기에서 3-2로 이겼다. 올 시즌 초반 2경기에서 교체 출전한 김민재는 이날 경기에서 요나단 타와 함께 풀타임 활약하며 수비진을 이끌었다.

바이에른 뮌헨은 3부리그 클럽 비스바덴을 상대로 난타전을 치며 2골을 실점했지만 케인의 극적인 결승골과 함께 승리를 거뒀다. 독일 매체 스폭스는 요나단 타에 대해 '요나단 타의 불안하고 위험한 패스를 받은 파블로비치는 경고를 받았고 첫 번째 실점 상황에서 요나단 타는 깊은 잠에 빠져 있었다. 카야가 자신의 뒤로 빠져나가도록 내버려 뒀다. 동점골 실점 상황에서도 플로토가 카야에게 헤더 패스를 했을 때 상황을 제대로 파악하지 못했다. 이런 경기력은 콤파니 감독에게 큰 걱정거리가 될 것'이라며 바이에른 뮌헨의 2실점 책임이 요나단 타에게 있다는 뜻을 나타냈다. 반면 김민재에 대해선 '전반전에 카야를 막아내며 비스바덴의 동점골 기회를 저지했다. 동점골 실점 상황에서 플로토에게 접근했지만 플로토의 헤더 패스를 막지는 못했다'고 언급했다. 이 매체는 요나단 타에게 팀내 최저 평점 5등급을 부여한 반면 김민재에게는 3등급을 부여하며 다소 엇갈린 평가를 내렸다.
김민재/게티이미지코리아
김민재/게티이미지코리아"
20250829,"'韓 역대급 캡틴' 손흥민, 정말 딱 이것만 없다...21세기 리그 우승 없는 스타 'TOP 5' 선정→그리즈만 1위 '불운'","[OSEN=고성환 기자] 프리미어리그 득점왕과 유럽축구연맹(UEFA) 유로파리그(UEL) 우승, 국제축구연맹(FIFA) 푸스카스상까지 많은 걸 손에 넣었으나 딱 하나가 없다. 손흥민(33, LAFC)이 리그 우승 트로피가 없는 스타 선수 10명 중 한 명으로 뽑혔다.

축구 콘텐츠 매체 '스코어 90'은 27일(한국시간) 소셜 미디어를 통해 '21세기 리그 우승 트로피가 없는 선수 TOP 10'을 선정해 발표했다.

1위는 바로 프랑스와 아틀레티코 마드리드를 대표하는 공격수 앙투안 그리즈만이다. 그는 축구선수 최고의 명예인 발롱도르 시상식에서 두 차례나 포디움(3위)에 올랐을 정도로 뛰어난 선수다. 레알 소시에다드와 아틀레티코, 바르셀로나 등에서 활약하며 700경기 이상 뛰었고, 280골을 넘게 기록했다.

하지만 리그 우승만큼은 연이 없었다. 그리즈만은 라리가 우승을 위해 2019년 여름 바르셀로나로 이적했다. 그러나 공교롭게도 연속 우승을 기록하던 바르셀로나는 미끄러지기 시작했고, 2020-2021시즌 아틀레티코가 리그 정상에 올랐다. 그리즈만은 2023년 아틀레티코로 복귀한 후에도 준우승에 만족해야 했다.
2위는 올 가을 한국을 찾을 스티븐 제라드다. 그는 리버풀의 심장으로 불리며 굵직한 업적을 남겼지만, 프리미어리그 우승과는 인연이 없었다. 발롱도르 3위, UEFA 올해의 선수, 잉글랜드 올해의 선수 등 수많은 개인 타이틀도 그의 아쉬움을 달래지 못했다.

3위도 리버풀에서 활약했던 페르난도 토레스다. 그는 리버풀 시절 제라드와 찰떡 호흡을 자랑하며 월드클래스 공격수로 발돋움했고, 이후 월드컵과 UEFA 유로, UEFA 챔피언스리그(UCL)를 모두 제패했다. 그러나 리그 우승만은 손에 넣지 못했다. 첼시 이적 후에는 커리어도 추락하고 말았다.

'보루시아 도르트문트의 전설' 마르코 로이스가 4위에 이름을 올렸다. 공격형 미드필더인 그는 분데스리가 올해의 선수를 비롯해 리그 도움왕, UEFA 올해의 팀 선정 등 여러 족적을 남겼다.

다만 로이스 역시 리그 우승이 없는 비운의 선수다. 게다가 도르트문트는 그가 합류하기 전 두 시즌 연속 리그 우승을 이뤘기에 더욱 아쉬움이 크다. 특히 로이스는 2022-2023시즌 생애 첫 분데스리가 우승을 눈앞에 두고 있었지만, 마지막 라운드에서 도르트문트의 패배를 막지 못하며 자력 우승을 놓치고 말았다.





아시아 역대 최고 선수이자 한국 역대급 주장으로 거론되는 손흥민은 5위에 선정됐다. 그는 독일 함부르크에서 프로에 데뷔한 뒤 레버쿠젠, 토트넘 등을 거치며 활약했다. 약 15년간 유럽 무대를 누빈 것.

하지만 손흥민은 유독 우승 트로피와 연이 닿지 않았다. 그는 해리 케인과 크리스티안 에릭센, 델리 알리와 'DESK 라인'을 구축하며 토트넘의 전성기를 이끌었으나 매번 2위가 최고 성적이었다. 2016-2017시즌 프리미어리그 2위에 만족해야 했고, 리그컵(2020-2021시즌)과 UCL(2018-2019시즌) 둘 다 준우승에 그쳤다.

다행히 손흥민은 지난 시즌 길고 길었던 무관의 설움을 품었다. 지난 5월 토트넘이 맨체스터 유나이티드를 꺾고 UEL 우승 트로피를 들어 올리는 데 힘을 보탠 것. 토트넘으로서도 17년 만의 무관 탈출이자 41년 만의 유럽대항전 우승이었다. 마지막 퍼즐 조각을 손에 넣은 손흥민은 올여름 미국 로스엔젤레스(LA)FC로 이적하며 토트넘과 10년 동행에 마침표를 찍었다.

손흥민의 뒤로는 다니엘 데 로시(이탈리아), 호아킨 산체스(스페인), 브루누 페르난데스(포르투갈), 안토니오 디 나탈레(이탈리아), 게리 리네커(잉글랜드)가 순서대로 이름을 올렸다. 손흥민도 이들과 마찬가지로 엄청난 커리어를 쓰고도 리그 정상에는 도달하지 못한 아쉬운 스타로 남게 됐지만, UEL 우승이라는 메이저 타이틀 덕분에 웃으며 토트넘 생활을 마무리할 수 있었다.

/finekosh@osen.co.kr

[사진] ⓒGettyimages(무단전재 및 재배포 금지), 스코어 90, 토트넘 소셜 미디어."
20250829,"손흥민(23·리버풀) 아깝다!…살라 대신 '리버풀 왕' 될 뻔했는데 ""로저스 감독 반대로 무산""","(엑스포츠뉴스 나승우 기자) 손흥민이 모하메드 살라보다 먼저 리버풀의 왕이 될 수 있었다. 과거 리버풀 관계자가 당시 일화를 밝혔다.

미국 매체 애슬론스포츠는 29일(한국시간) ""리버풀은 손흥민 영입이 임박했었다. 비밀 이적 계약이 공개됐다""고 보도했다.

매체는 ""리버풀에서 리서치 디렉터로 일했던 이언 그레이엄은 최근 리버풀 역사상 가장 큰 가정 중 하나를 밝혔다. 그건 바로 '손흥민이 토트넘 홋스퍼에 합류하기 전에 그를 영입했으면 어땠을까?'다""라고 소개했다.

애슬론스포츠에 따르면 그레이엄은 축구 경영진들을 소개하는 맨 인 블레이저스의 새로운 시리즈 '러닝 더 게임'에 출연해 과거 리버풀 영입팀이 브랜던 로저스 감독 시절 호베르투 피르미누와 손흥민을 영입하려고 했다고 주장했다.



그러나 피르미누가 리버풀로 이적한 반면, 손흥민은 토트넘으로 이적했다. 손흥민을 눈여겨 본 리버풀 전력 분석팀과 로저스 감독의 의견이 일치하지 않았기 때문이다.

애슬론스포츠는 ""이 이야기는 리버풀 전력 분석팀과 로저스 감독 사이에 이적을 둘러싼 잘 알려진 갈등과 맞아떨어진다""면서 ""로저스 감독은 크리스티안 벤테케가 팀에 적합한 자원이 아니라는 경고에도 불구하고 그를 영입하기 위해 적극적으로 나섰다""고 설명했다.
이어 ""벤테케는 크리스털 팰리스로 이적하기 전까지 한 시즌을 보냈고, 영입팀이 선호했던 선수들은 다른 곳으로 갔다""고 덧붙였다.

그러면서 손흥민의 리버풀 이적이 거의 성사될 뻔했던 과정을 풀었다.

2023년까지 10년 넘게 리버풀 구단의 데이터 운영을 주도했던 그레이엄은 당시 일화를 떠올리면서 ""다른 시나리오가 쓰였다면 손흥민과 피르미누가 리버풀의 최전방 공격수가 됐을 것""이라며 ""피르미누와 손흥민은 우리의 유일한 선택지였다. 손흥민은 결국 토트넘으로 갔고, 우리는 대신 벤테케를 영입했다""고 말했다.

이어 ""벤테케는 손흥민과 다른 유형의 선수였다. 괜찮다. 당시 로저스 감독은 그런 스타일을 원했다. 손흥민이 토트넘에 가서도 난 그를 좋아했다""고 덧붙였다.



손흥민은 2015년 여름 독일 분데스리가 바이엘 레버쿠젠에서 토트넘 홋스퍼로 이적했다. 만약 이때 로저스 감독이 손흥민을 영입했다면 손흥민은 모하메드 살라보다 먼저 리버풀 에이스로 등극했을지도 모른다.

리버풀 이적은 아쉽게 성사되지 않았지만 손흥민은 토트넘에서 성공적인 커리어를 쌓았다. 2021-2022시즌 리그 득점왕을 차지하며 프리미어리그에서 가장 믿음직한 공격수 중 한 명으로 성장했다.

매체는 ""토트넘에서 150골 이상 기록하고 리그 득점왕까지 수상한 손흥민의 성공은 리버풀 팬들을 더욱 안타깝게 만든다""면서 ""그레이엄 외에도 위르겐 클롭 감독도 손흥민을 좋아했다. 보루시아 도르트문트 시절 그는 레버쿠젠을 선택한 손흥민과 계약하지 않은 걸 후회한다고 인정했다""고 했다.

그러면서 ""상황이 달랐다면 살라와 사디오 마네가 파트너가 되기 전인 2010년대 중반에 피르미누, 손흥민이 리버풀의 공격을 이끌었을 수도 있다""면서 ""손흥민은 토트넘을 상징하는 아이콘이 됐다. 그러나 리버풀은 로저스 감독 시절 고르지 못한 성적을 거뒀다""고 상반된 결과에 주목하기도 했다.

사진=엑스포츠뉴스DB / 연합뉴스"
