date,title,content
20251124,"英 깜짝 단독! ""양민혁 토트넘 돌려보내라""→갑작스런 '벤치 신세' 3경기 동안 고작 7분 뛰었다…""다시 좋은 흐름 탈 것""","사진=토트넘 홋스퍼
<저작권자(c) 연합뉴스, 무단 전재-재배포, AI 학습 및 활용 금지>
[스포츠조선 강우진 기자]양민혁이 최근 포츠머스에서 출전 시간을 보장 받지 못하고 있어 팬들의 우려가 커지고 있다.

영국 토트넘 홋스퍼 뉴스는 24일(한국시각) ""양민혁은 최근 리그 3경기 동안 총 7분만 뛰었고, 지난 밀월전에서는 벤치만 지켰다""라며 ""이로 인해 토트넘 팬들의 걱정이 커지고 있다""라고 보도했다.

양민혁은 올여름 여러 유망주들과 임대를 떠났고, 최근에는 출전 기회를 받지 못하고 있다. 비슷하게 떠난 제이미 돈리와 애슐리 필립스는 출전 시간이 부족해 토트넘이 스토크시티에서의 임대 복귀를 고려하는 단계에 이르렀다.

사진=포츠머스
사진=포츠머스
양민혁은 초반에 좋은 출발을 보였지만, 지금의 상황에서는 앞선 두 선수와 똑같이 실패하는 것이 아니냐는 우려의 목소리가 나온다. 양민혁은 지난 시즌 퀸스파크레인저스(QPR)로 임대되면서 좋은 활약을 보였다. 잉글랜드 풋볼리그 챔피언십(2부리그)에서 어느 정도 적응했기에 포츠머스에서의 2번째 도전은 수월할 것으로 여겨졌다. 그러나 주전 경쟁에서 고전하는 모습을 보이며 후반기 팀 내 입지를 가늠할 수 없는 상태다.

<저작권자(c) 연합뉴스, 무단 전재-재배포, AI 학습 및 활용 금지>
그러나 토트넘 소식을 주로 전하는 존 웬햄은 양민혁이 곧 다시 꾸준히 출전할 것으로 전망했다.

웬햄은 ""크게 걱정하지 않는다. 시즌 초반에는 '팬들이 돌려보내라'라고 소리쳤을 정도였다""라며 ""그러다 양민혁은 출전 기회를 잡았고, 골도 넣었다. 최근엔 교체로 나서고 있지만, 조만간 다시 좋은 흐름을 탈 것이라 본다""라고 주장했다.

또 웬햄은 ""양민혁이 7경기 연속 선발 출전을 한 이유가 있다. 성과가 없는 선수에게 그런 꾸준한 출전 시간을 줄 리 없다""라며 ""아마 작은 부상 같은 게 있을 수 있다. 내 생각엔 곧 돌아올 거다. 포츠머스에서도 그를 좋아한다고 들었다""라고 전했다.

사진=포츠머스
<저작권자(c) 연합뉴스, 무단 전재-재배포, AI 학습 및 활용 금지>
토트넘은 양민혁의 성장이 멈추지 않도록 예의주시해야 한다.

매체는 ""토트넘이 가장 원치 않는 것은 양민혁의 성장이 가로막히는 상황""이라며 ""비슷한 사례로는 알레호 벨리즈가 있다. 그는 에스파뇰 임대 기간 한 골에 그쳤고, 그 전 시즌 세비야에서는 고작 6경기 출전에 그쳤다""라고 했다.

이어 ""만약 양민혁의 상황이 포츠머스에서 계속 악화한다면, 토트넘은 올겨울 그를 복귀시키는 방안을 고려해야 할 것""이라며 ""그러나 지금으로서는 상황이 비교적 초기 단계인 만큼 토트넘이 할 수 있는 것은 잘 지켜보는 것뿐""이라고 덧붙였다."
20251124,"'멀티골 대활약→PK 실축' 손흥민, 우승 놓친 이유 있었다...'문어' 이영표가 '친정팀 승리 예측'","사진=벤쿠버 SNS 캡처
사진=벤쿠버 SNS 캡처


[포포투=김아인]

이영표는 손흥민을 응원하면서도, 친정팀 벤쿠버 화이트캡스의 승리를 기원했다.

LAFC는 23일 오전 11시 30분(한국시간) 미국 벤쿠버에 위치한 BC 플레이스에서 열린 2025시즌 미국 메이저리그 사커(MLS) 플레이오프 서부 컨퍼런스 준결승전에서 벤쿠버 화이트캡스와 2-2로 무승부를 거뒀다. 승부차기 접전 끝에 LAFC가 3-4로 패했고, 결승 진출이 무산됐다.

우승이 결정되는 단판 승부인 만큼 경기는 치열했다. 벤쿠버가 전반에만 2골을 넣으며 격차를 벌렸지만, 손흥민이 후반 15분 추격골을 넣었다. 후반 종료 직전엔 벤쿠버에 퇴장자가 발생해 프리킥 기회를 얻었고, 손흥민이 환상적인 프리킥 골로 극적인 동점골을 터뜨려 연장전으로 접어들었다. 끝내 승부를 내지 못하고 승부차기가 시작됐는데 첫 번째 키커로 나선 손흥민이 실축했다. 결과는 3-4가 되면서 LAFC의 결승 진출이 무산됐다.

손흥민에게 뼈아픈 날이었다. 멀티골을 넣으면서 극적으로 결승 희망의 불씨를 살렸지만, 승부차기에서 시도한 오른발 슈팅이 골대를 강타했다. 결정적인 활약을 하고도 팀의 패배를 막지 못한 손흥민은 경기 후 ""연장 후반전 막판에 근육 경련이 있었다. 느낌이 좋지 않았다. 승부차기에서 슈팅을 하려는 순간 경련을 다시 느꼈다. 그래서 정확하게 차지 못했다. 어쨌든 모두 나의 책임이다""고 아쉬움을 감추지 못했다.

사진=게티이미지


손흥민과의 맞대결을 치르는 만큼 벤쿠버는 경기 직전 구단과 한국 선수들과의 인연을 소개했다. 벤쿠버는 공식 홈페이지를 통해 ""벤쿠버 한인 사회에서도 이번 경기에 대한 관심과 열기가 어느 때보다 뜨겁다. 벤쿠버는 이영표와 황인범 등 대한민국 국가대표 선수들이 활약했던 팀으로, 한국 팬들에게도 잘 알려져 있다""고 이야기했다.

특히 한국 축구 레전드 이영표는 직접 영상 메시지까지 남겼다. 경기가 열리기 전 벤쿠버가 공개한 영상에서 이영표는 ""안녕하세요, 저는 벤쿠버에서 뛰었던 전 선수 이영표입니다. 오늘 경기 즐겨 주시고, 벤쿠버를 응원해 주세요""라고 한국어로 입을 열었다.

이어 영어로 ""손흥민은 내 친구다. 내가 벤쿠버에서 뛰었기 때문에 벤쿠버를 응원하지만 손흥민이 잘하길 바란다. 하지만 벤쿠버가 당연히 이길 거라고 예상한다""고 손흥민의 선전과 벤쿠버의 승리를 동시에 바란다고 말했다.

사진=게티이미지


이영표에게 이 경기는 특별했다. 손흥민이 있기 전 그는 프리미어리그(PL) 토트넘 홋스퍼에 입단한 최초의 한국인이었다. 이영표는 2005-06시즌부터 세 시즌 동안 토트넘에서 주전급 활약을 했고, 이후엔 보루시아 도르트문트, 알 힐랄을 거쳐 2012시즌 벤쿠버에서 뛰다가 현역 생활을 마무리했다. 국가대표팀과 토트넘 후배 손흥민과 친정팀 벤쿠버가 우승을 걸고 8강전을 치르면서 둘 모두를 응원했다.

이영표의 바람은 현실이 됐다. 손흥민은 비록 페널티킥을 실축했지만, 0-2로 끌려가는 상황에서도 팀을 승부차기까지 이끌 수 있었던 중요한 두 골을 터뜨렸다. 그러나 승리의 몫은 벤쿠버에 돌아갔다. 과거 해설위원으로 활동하면서 여러 차례 경기 결과나 우승팀 예측 적중률이 뛰어났던 '문어 영표'의 명성이 빛난 순간이었다."
20251124,"“다시 EPL로 돌아가게 된다면 오로지…” ‘오피셜’ 공식성명 발표했던 클롭 감독, 1년 만에 리버풀 복귀 ‘급부상’","[골닷컴] 강동훈 기자 = ‘디펜딩 챔피언’ 리버풀이 지난여름 거액의 이적료를 지출하고도 벌써 6패(6승)째를 기록, 순위표 11위로 떨어지자 아르네 슬롯(47·네덜란드) 감독을 경질할 거란 전망이 나오고 있다. 슬롯 감독이 경질될 경우 차기 사령탑으로는 리버풀의 ‘황금기’를 이끌었던 위르겐 클롭(58·독일) 감독이 거론되고 있다.

24일(한국시간) 메트로, 미러 등 영국 매체들에 따르면 리버풀은 현재 거센 비판을 받고 있는 슬롯 감독을 해임할 경우 지난해 지휘봉을 내려놓으면서 떠난 클롭 감독을 다시 선임하는 것을 진지하게 고려하고 있다. 물론 리버풀은 당장 슬롯 감독을 경질할 계획은 아직까진 없지만 상황을 바꾸지 못한다면 과감하게 칼을 빼 들을 거로 예상되고 있다.

앞서 슬롯 감독이 이끄는 리버풀은 지난 23일 영국 리버풀의 안필드에서 펼쳐진 노팅엄 포레스트와 잉글랜드 프리미어리그(EPL) 12라운드 홈경기에서 0대 3으로 완패했다. 최근 EPL 7경기에서 6패를 기록한 리버풀은 승점 18(6승6패)에 머무르면서 순위표 11로 추락, 10년 만에 10위권 밖으로 벗어났다. ‘디펜딩 챔피언’ 위용은 전혀 찾아볼 수 없을 정도로 부진이다.


특히 지난 시즌 25승9무4패, 승점 84로 여유롭게 EPL 왕좌에 올랐던 리버풀은 올 시즌 이미 지난 시즌 기록한 패수를 넘어섰다. 1992년 EPL 출범 이래 33년 동안 개막 후 12경기에서 6패를 기록한 것도 10년 만이자, 이번이 두 번째다. 암흑기 시절에도 쉽게 볼 수 없었던 ‘불명예’ 기록들이 슬롯 감독 체제에서 나오고 있는 셈이다.

결국 슬롯 감독을 향한 비판 여론이 거세지고 있다. 특히 지난여름 알렉산더 이삭과 위고 에키티케, 제레미 프림퐁, 플로리안 비르츠 등을 영입하면서 이적료 무려 4억5000만 파운드(약 8680억 원)를 지출하고도 성적을 내지 못하자 인내심이 한계에 다다른 리버풀 팬들은 슬롯 감독 경질을 촉구하고 있다.


그리고 동시에 ‘황금기’를 이끌었던 클롭 감독이 다시 돌아오길 바라고 있다. 클롭 감독은 지난 2015년 리버풀 사령탑으로 부임해 지휘봉을 내려놓기 전까지 9년 동안 이끌면서 리버풀의 명성을 되찾았다. EPL 1회, 유럽축구연맹(UEFA) 챔피언스리그(UCL) 1회, 잉글랜드축구협회(FA)컵 1회, 잉글랜드 풋볼리그(EFL)컵 2회 등 수많은 우승을 차지했다.

공교롭게도 현재 도박사들 사이에선 차기 리버풀 사령탑으로 클롭 감독을 전망하고 있다. 스포츠 베팅 전문 매체 벳 빅터에 따르면 클롭 감독이 4/1(20%)로 가장 높았고 올리버 글라스너 감독이 5/1(16.7%)로 2위였다. 각각 6/1(14.3%)과 12/1(7.7%) 배당률을 받은 안도니 이라올라 감독과 우나이 에메리 감독이 그 뒤를 이었다.

특히 클롭 감독이 지난달 세계적인 기업가 스티븐 바틀렛이 진행하는 팟캐스트 The Diary Of A CEO에 출연해 “EPL에서 다른 팀을 감독하는 일은 절대 없을 거라고 누누이 말했다. 만약 제가 EPL로 다시 복귀한다면, 그건 리버풀 사령탑으로 부임하는 것이다. 이론적으로는 가능할 수도 있겠다”고 복귀 가능성을 배제하지 않은 터라 기대감이 쏠리고 있다.


사진 = 게티이미지"
20251124,"2골 넣고도 고개 숙인 손흥민...""다 내 책임...2026년엔 모든 대회 우승할 수 있는 모습으로 돌아오겠다""","(MHN 금윤호 기자) 미국프로축구 메이저리그사커(MLS) 플레이오프(PO) 서부 콘퍼런스 결승 진출이 좌절되자 손흥민(LAFC)이 실망감을 감추지 못하고 패배 책임을 모두 자신에게 돌렸다.

LAFC는 23일(한국시간) 캐나다 밴쿠버의 BC 플레이스에서 열린 2025 MLS컵 8강전(PO 서부 콘퍼런스 준결승)에서 밴쿠버 화이트캡스와 맞붙어 연장전까지 2-2로 비긴 뒤 승부차기까지 혈투 끝에 3-4로 패했다.

이로써 LAFC는 PO 콘퍼런스 결승에 오르지 못하고 2025시즌 일정을 모두 마쳤다.

이날 경기에서 손흥민은 0-2로 뒤지던 후반 15분 끝까지 집중력을 놓치지 않고 공을 밀어 넣으면서 만회골을 기록했고, 후반 추가시간에는 극적인 프리킥 골을 터뜨리면서 멀티골을 작성하며 경기를 연장전으로 끌고 갔다.



그러나 LAFC는 밴쿠버가 한 명이 퇴장 당하고 또 한 명이 부상으로 그라운드를 벗어나 9명으로 힘겹게 싸우는 상황을 활용하지 못하고 득점하지 못하면서 승부차기로 향했다.

피말리는 승부차기에서 LAFC 첫 번째 키커로는 2골을 넣은 손흥민이 나섰다. 하지만 손흥민이 강하게 찬 슈팅은 오른쪽 골포스트를 맞고 튀어나왔고, 결국 LAFC는 승부차기 결과 3-4로 졌다.

경기를 마친 뒤 손흥민은 ""결정적일 때 (프리킥) 골을 넣어서 정말 좋았다""면서도 ""연장전 막판 약간의 근육 경련이 일어났고, 승부차기를 차려고 할 때도 느꼈다. (하지만 결국) 모든 것은 내 책임""이라며 아쉬움을 감추지 못했다.

손흥민은 2024-2025시즌을 끝으로 10년간 몸담았던 잉글랜드 프리미어리그 토트넘 홋스퍼를 떠나 지난 여름 LAFC로 전격 이적해 미국 무대에 도전장을 내밀었다.



비록 길지 않은 데뷔 시즌이었지만 손흥민은 13경기 12골 4도움을 기록하며 여전한 기량을 자랑하며 리오넬 메시(인터 마이애미), 토마스 뮐러(밴쿠버) 등과 MLS 대표 선수 중 한 명으로 떠올랐다.

이날 경기를 끝으로 MLS 데뷔 시즌을 마무리지은 것에 대해서는 ""정말 환상적이었다. 따뜻한 환대가 있었고, 매 순간 즐거웠다""며 ""이 유니폼을 입고 모든 것을 다 쏟아내고자 노력한 것이 자랑스러웠다""고 밝혔다.

이어 손흥민은 ""새로운 환경과 리그에 적응하고 새로운 선수들을 만나면서 선수로나 사람으로나 성장하는 계기가 됐다. 부족하지만 많은 사람들의 사랑을 받아 더 큰 책임감을 가져야 한다고 느꼈다""고 덧붙였다.

그러면서 이날 멀티골을 넣고도 결승에 오르지 못한 아쉬움을 쉽게 털어내지 못한 손흥민은 ""사람들이 '임팩트'에 대해서 말하지만, 결국 나는 트로피를 들기 위해 여기에 왔다""면서 ""내년에는 모든 대회에서 성공을 거두고 싶다. 우승할 수 있는 컨디션을 만들어서 돌아오겠다""며 더 강해진 모습을 보여줄 것을 예고했다.

사진=AFP/연합뉴스, LAFC SNS"
20251124,"토트넘 감독, ""손흥민 떠날 완벽한 시기""라고 했지만...전혀 그렇지 않았다! 13년 만 3점 차 패배","[인터풋볼=박윤서 기자] 토마스 프랭크 감독이 첫 북런던 더비에서 참패를 겪었다.

토트넘 홋스퍼는 24일 오전 1시 30분(한국시간) 영국 런던에 위치한 에미레이츠 스타디움에서 열린 2025-26시즌 프리미어리그 12라운드에서 아스널에 1-4로 패배했다.

토트넘은 전반전부터 와르르 무너졌다. 전반 중반까지 팽팽한 균형을 잘 이어오다가 레안드로 트로사르에게 선제골을 허용하면서 급격하게 흔들렸다. 에베레치 에제에게 5분 만에 또 실점하면서 0-2로 전반전을 마쳤다. 후반전 시작과 함께 에제의 왼발 슈팅에 또 실점했고 3점 차까지 벌어졌다. 히샬리송의 원더골로 한 골 추격했지만 후반 중반 에제의 해트트릭을 완성하는 슈팅에 울었다. 토트넘은 1-4로 패배했다.

충격적인 4실점, 3점 차 패배다. 토트넘은 그동안 북런던 더비에서 호락호락하지 않은 모습을 보여왔다. 최근 맞대결 4연패를 기록하고 있긴 하나 2020년 7월과 2021년 3월에는 2연승을 거두기도 했고 2022년에는 3-0 완승을 가져온 적도 있다.



토트넘의 북런던 더비 마지막 4실점 패배는 2018년 12월 2일(2-4 패배, 아스널 홈)였으며 마지막 3점 차 패배는 2012년 11월 17일(2-5 패배, 아스널 홈)이었다. 손흥민이 있는 동안 6승 6무 10패로 토트넘이 아스널에 열세긴 했으나 이번처럼 경기 내용부터 스코어까지 완벽하게 패배한 적은 손에 꼽는다.

프랭크 감독은 이번 시즌 개막 전 손흥민의 고별전이었던 뉴캐슬 유나이티드전을 앞두고서 ""손흥민이 트로피를 들어올렸고 지금이 떠나기 적절한 타이밍이라 생각한다""라고 말한 바 있다. 그러면서 ""감독으로서 최근에 합류하게 됐고 손흥민을 안 기간이 길지 않지만 짧은 기간 동안 손흥민이 훌륭한 태도를 갖고 있었고 선수이자 사람으로서 본받을 점이 많다고 생각했다. 단순히 10년을 보낸 것이 아니고 환상적인 10년이었다""라고 칭찬했다.

손흥민 개인을 고려했을 때는 토트넘을 떠나기 좋은 시기였을지 모르지만, 토트넘 전체로 본다면 손흥민을 떠나보낸 것이 두고두고 아쉬울 지도 모르겠다."
20251124,"'징역 1년·집행유예 2년→KFA 준 영구제명' 황의조, 튀르키예서 두 달 만에 득점포","사진 = 알란야스포르


[인터풋볼=박윤서 기자] 황의조가 대략 두 달 만에 골을 터뜨렸다.

황의조가 뛰고 있는 알란야스포르는 23일 오후 11시(한국시간) 튀르키예 안탈리야에 위치한 게인 파크 스타디움에서 열린 2025-26시즌 튀르키예 쉬페르리가 13라운드에서 카심파샤에 1-2로 패배했다.

이날 황의조는 선발 출전하여 선제골을 터뜨렸다. 전반 추가시간 2분 스로인 상황에서 상대 수비를 잘 등져 공간을 만들었고 페널티 박스 안에서 오른발 슈팅으로 골망을 갈랐다. 알란야스포르는 황의조의 선제골을 지키지 못하고 후반전 2실점하면서 무너졌다.
황의조는 87분 동안 패스 성공률 91%(10/11), 유효 슈팅 1회, 기회 창출 1회, 파이널 써드 패스 1회 등을 기록했다.

두 달 만에 터진 득점포였다. 황의조는 10월 4일 겐칠레르빌리이전 득점 이후 골이 없었다. 오랜만에 골을 터뜨리면서 감을 끌어 올렸다.

사진 = 알란야스포르


한편 황의조는 최근 대한축구협회의 공식 발표로 국내에서 뛰는 것은 불가능해졌다. 대한축구협회는 이미 9월 말에 성폭력범죄를 저지른 자로서 금고 이상의 형을 선고받고 집행이 유예된 날로부터 20년이 지나지 않은 자는 국가대표로 선발될 수 없다는 점, 또한 선수, 지도자, 심판, 선수관리담당자로도 등록될 수 없다는 점을 규정을 근거로 이야기하며 황의조가 사실상 준 영구제명 상태라고 밝혔다.

황의조는 성폭력범죄의 처벌 등에 관한 특례법 위반(카메라 등 이용 촬영) 혐의로 재판을 받았고 2심에서 징역 1년에 집행유예 2년과 200시간의 사회봉사, 400시간의 성폭력 치료 강의 수강 명령을 선고받았다. 검찰 측과 황의조 측 모두 항소하지 않아 유죄가 확정됐다.

대한축구협회는 ""FIFA Regulations on the Status and Transfer of Players에 의하면 선수는 프로 또는 아마추어로 클럽에서 뛰기 위하여는 특정 협회에 등록되어야 한다. 즉, 해당 협회에서 주최 주관하는 리그에 참가하는 팀에 소속되기 위해서는 해당 협회에 선수로 등록이 되어야 하는데 황의조는 FIFA의 등록규정상 협회 소속이 아닌 해외 리그 소속 선수다. 따라서 협회에 등록된 선수가 아닌 선수에게 체육회 및 협회 공정위원회 규정을 적용하여 징계를 적용하는 것은 규정상 불가능하다""라며 황의조에게 직접적인 징계는 불가능하나 ""황의조는 사실상 '준 영구제명' 상태로 국내에서의 축구 선수, 지도자. 심판 등의 활동이 불가함을 안내한다""라고 덧붙였다."
20251124,"첫 인상은 최악이었지만...'쏘니 정말 고마워!' 체룬돌로 감독, 졌지만 박수 속 퇴장 ""정말 자랑스러운 것 많다""","[SPORTALKOREA] 황보동혁 기자= 로스앤젤레스FC가 밴쿠버 화이트캡스와의 혈투 끝에 패배하며 스티브 체룬돌로 감독과의 여정도 아쉽게 막을 내리게 됐다.

LAFC는 23일(한국시간) 캐나다 밴쿠버 BC 플레이스에서 열린 2025 메이저리그사커(MLS) 컵 서부 콘퍼런스 준결승에서 손흥민의 극적인 프리킥 동점골을 앞세워 승부차기까지 끌고 갔지만 결국 패하며 결승 진출이 좌절됐다.

체룬돌로 감독은 2022년 1월 부임 이후 LAFC 역사에 굵직한 발자취를 남겼다. 2022년 MLS컵, 서포터스 실드를 동시에 우승했고, 2024년 US오픈컵 우승까지 더하며 구단 역사상 가장 성공적인 감독으로 자리매김했다. 올 시즌 역시 팀을 서부 콘퍼런스 3위로 이끌며 좋은 지도력을 보여줬다. 



하지만 체룬돌로 감독과 LAFC의 동행은 이미 지난 4월 종료가 예고돼 있었다. 시즌 종료 후 계약이 만료되며 감독이 팀을 떠난다는 사실이 일찌감치 발표됐고, 체룬돌로 감독 역시 선수 시절 대부분을 보냈던 독일로 돌아가 가족과 시간을 보내겠다고 밝힌 바 있다. 다만 이별의 순간은 다소 씁쓸한 패배로 장식되고 말았다. 그럼에도 체룬돌로 감독은 박수 받았다.

그리고 이 같은 아름다운 퇴장은 어쩌면 손흥민 덕이다.  손흥민이 합류하기 전 LAFC는 중위권에 머물며 다소 힘겨운 시즌을 보내고 있었다. 에이스 드니 부앙가가 고군분투했지만, 전체적인 팀 경쟁력은 부족했다. 그러나 손흥민이 팀에 합류한 뒤 LAFC는 완전히 180도 달라졌다.



지난 8월 토트넘 홋스퍼를 떠나 MLS 무대에 입성한 손흥민은 10경기 중 9경기에 선발로 출전해 9골 3도움을 기록했다. 경기당 1개 이상의 공격포인트를 올리며 단기간에 MLS를 뒤흔들었고, 그의 합류와 함께 LAFC는 잔여 리그에서 단 1패만을 기록한 채 정규 시즌을 3위로 마쳤다.

강팀 밴쿠버를 상대로 승부차기까지 가는 승부를 펼친 것도 손흥민의 존재감이 있었기에 가능했다.



미국 '애슬론 스포츠'에 따르면 경기 종료후 체룬돌로 감독은 ""받아들이기 힘든 패배다. 오늘 우리는 더 나았다고 생각하지만, 축구가 원래 이런 날도 있는 법이다. 오늘은 우리 날이 아니었다는 것이 모두에게 분명했다. 지난 4년을 돌아보면 정말 자랑스러운 것들이 많다. 다 설명하긴 어렵지만, 정말 많은 걸 이뤘다""며 진한 여운을 남겼다. 

흥미로운 점은 올 시즌 체룬돌로 감독에게 사실상 '은인'이나 다름없었던 손흥민의 첫인상은 최악이었다는 사실이다.

2012년 체룬돌로 감독의 선수 시절 하노버96의 라이트백으로 뛰던 그는 만 19세였던 함부르크의 손흥민에게 굴욕적인 장면을 허용했다. 



왼쪽 측면에서 치고 들어온 손흥민이 방향 전환으로 체룬돌로를 속수무책으로 만들었고, 손흥민은 침착한 오른발 마무리로 골망을 흔들었다. 미국 국가대표 출신 베테랑 수비수가 10대 신예에게 완전히 뚫리며 수비수 입장에서는 다소 창피할만한 실점이었다.

그러나 13년이 지난 지금 손흥민은 MLS 최고의 슈퍼스타로 성장했고 체룬돌로 감독의 마지막 시즌을 누구보다 강렬하게 빛낸 존재가 됐다.

사진= 쿠팡플레이 캡처, 게티이미지코리아, LAFC, ESPN 

취재문의 sportal@sportalkorea.co.kr"
