date,title,content
20250310,"""초유의 사태"" 포스테코글루 해임→프리미어리그 최초의 대기록 타이틀 얻나...""이달의 감독상과 동시에 경질되는 감독""","[SPORTALKOREA] 박윤서 기자= 엔제 포스테코글루 감독이 흥미로운 기록의 보유자가 될 수 있단 주장이 제기됐다.

영국 '기브미스포츠'는 8일(한국시간) 토트넘 홋스퍼 소식에 밝은 찰리 에클셰어의 발언을 조명했다. 그는 ""포스테코글루 감독은 경질됨과 동시에 프리미어리그(PL) 이달의 감독상을 받을 수 있다""라며 ""그는 AZ알크마르와의 2차전에 패할 경우 경질될 가능성이 높다. 더불어 PL 이달의 감독상을 얻는 희한한 상황이 벌어질 수 있다""라고 전했다.


매체는 ""만일 다니엘 레비 회장이 포스테코글루를 해임하고 동시에 그가 이달의 감독상을 수상한다면 이는 PL 역사상 초유의 사태로 기록될 것이다. 토트넘은 2021년 8월 이달의 상을 받은 누누 산투를 단 3개월 만에 경질한 바 있다. 구단은 이례적인 상황을 다시 한번 재현할 가능성이 있다""라고 보도했다.

토트넘은 지난 7일 네덜란드 알크마르 AFAS 스타디온에서 열린 2024/25 시즌 유럽축구연맹(UEFA) 유로파리그(UEL) 16강 1차전에서 AZ알크마르와의 일전에서 0-1로 패했다.


이는 토트넘과 포스테코글루 감독에게 단순한 1패, 의미 그 이상으로 다가올 확률이 높다. 현재 토트넘은 카라바오컵, FA컵에서 연달아 떨어지며 무관 위기에 놓였다.

리그 성적 또한 중하위권 수준으로 최악의 여론을 뒤집기 위해선 UEL 무대에서 선전하는 수밖에 없다. 포스테코글루 감독을 옹호하는 여론의 대다수 역시 토너먼트 무대 생존을 이야기하고 있다.


와중에 토트넘이 2차전 경기마저 그르칠 경우 포스테코글루 감독을 경질할 가능성은 충분하다. 그러나 아이러니하게도 포스테코글루 감독은 PL 2월 이달의 감독상 후보로 선정됐다.


PL 무대로 한정 지을 경우 지난 2월 한 달 동안 3승 1패를 기록하며 훌륭한 모습을 선보였다. 과정이 좋다고 보긴 어려웠으나 결과만큼은 확실히 챙기는 데 성공했다. 함께 후보에 오른 감독은 올리버 글라스너(4경기 3승 1패), 데이비드 모예스 (5경기 2승 3무), 마르코 실바 (4경기 3승 1패), 아르네 슬롯 (6경기 4승 2무)이다.

사진=게티이미지코리아, 프리미어리그 사무국

취재문의 sportal@sportalkorea.co.kr"
20250310,"[속보]'황희찬 동료에게 목 졸리고 폭행'→액땜 제대로 했다! 초대형 이적 주인공 당첨, Here we go 기자도 ""감독이 영입 승인 완료""","사진=트위터 캡처
로이터연합뉴스
로이터연합뉴스
[스포츠조선 이현석 기자]황희찬의 울버햄튼 동료에게 폭행을 당했던 밀로스 케르케즈가 올여름 대형 이적의 주인공이 될 전망이다.

유럽축구 이적시장 전문가 파브리치오 로마노 기자는 10일(한국시각) 영국의 기브미스포츠를 통해 케르케즈의 리버풀 이적 가능성을 보도했다. 로마노는 '세계적인 스타를 영입하기 위해 아르네 슬롯 감독이 이를 스인했다. 케르케즈는 아마도 여름 이적시장에서 주목해야 할 선수이며, 그가 앞으로 받게 될 제안을 본머스가 막기는 불가능할 것이다'라고 전했다.

이어 '리버풀은 2024년부터 케르케즈에게 관심을 갖고 있었다. 케르케즈는 새 에이전트와 계약을 체결했고, 이는 이적을 원하는 선수에게 분명한 메시지다. 새 에이전트는 페데리코 키에사의 에이전트로 그의 리버풀 이적을 담당했었다. 리버풀은 2025년 여름에도 케르케즈에게 매우 관심이 있으며 슬롯 감독도 이적을 승인했다. 아직 합의된 것은 아니지만, 케르케즈는 슬롯이 승인한 최종 후바 3인 중 한 명이다'라고 설명했다.

로이터연합뉴스
2003년생의 헝가리 출신 수비수 케르케즈는 AC밀란 유소년팀을 거쳐 AZ알크마르에서 본격적으로 프로 무대에서 이름을 알리기 시작했다. 2023년 본머스 유니폼을 입으며 잉글랜드 프리미어리그(EPL) 무대로 입성한 케르케즈는 이적 첫 시즌부터 뛰어난 활약을 보여주며 빅클럽들의 시선을 사로잡았다.

올 시즌에도 정확한 수비와 헌신적인 플레이, 뛰어난 기동력을 선보이며 본머스 돌풍의 핵심 중 한 명으로 평가받고 있다. 31경기에 출전해 2골 5도움을 기록했다. 리버풀은 최근 앤디 로버트슨의 이적 가능성이 거론되고 있는 상황에서 왼쪽 풀백 포지션의 세대교체를 위해 케르케즈 영입에 뛰어들었다.

로이터연합뉴스
당초 맨유도 관심이 있었던 것으로 보였지만 선회했다. 로마노는 '맨유도 케르케즈를 1월에 영입할 수 있었지만, 본머스를 설득하는 것이 불가능했고, 패트릭 도르구 영입을 결정했다'라고 언급했다.

한편 케르케즈는 지난 울버햄튼과 본머스의 경기에서 폭행의 피해자가 되기도 했다. 당시 울버햄튼 공격수 마테우스 쿠냐가 울버햄튼이 1-1로 균형을 이룬 연장 후반 15분 상대 수비수 밀로시 케르케즈와 충돌했다. 케르케즈가 먼저 쿠냐의 옷을 잡아당겼지만, 쿠냐의 대응이 과했다 .쿠냐는 곧바로 손으로 케르케즈의 목을 잡았고, 이후 팔까지 휘둘렀다. 얼굴을 마주한 후에는 박치기까지 시도했다. 쿠냐의 행동을 확인한 주심은 곧바로 퇴장을 선언했다.

이현석 기자 digh1229@sportschosun.com"
20250310,"[속보] '와' 김민재 이걸 하네! 지성-흥민 못했던 '초대박', KIM 합니다…뮌헨, 월클 MF 영입 급물살→세계 최초 3번째 '트레블' 시동 걸었다","(엑스포츠뉴스 용환주 기자) 김민재 소속팀 바이에른 뮌헨(독일)은 이미 마음 먹었다. 몇 천억원이라도 투자할 계획이다.

독일 매체 'TZ'는 9일 ""뮌헨은 매우 구체적으로 대화했다. 플로리안 비르츠 영입을 위해 모든 각오를 마쳤다""라고 보도했다. 
매체에 따르면 ""뮌헨은 비르츠 영입을 위해 최선을 다하고 있다. 영국 '스카이스포츠'도 알린 것처럼 선수와 뮌헨 사이 아주 구체적인 논의가 진행 중이다""라며 ""뮌헨이 비르츠가 반드시 필요한 선수라고 생각 중이다""라고 밝혔다. 

이어 ""레버쿠젠은 비르츠 몸값으로 1억 유로(약 1500억원) 훨씬 넘는 금액을 요구 중이다. 그런데도 뮌헨은 원한다. 기존 선수들 급여를 삭감하는 일이 있어도 비르츠를 영입을 시도한다""라고 주장했다. 





엄청난 소식이다. 만약 성사되면 그야말로 '대규모' 이적이다. 독일을 넘어 축구 역사에 남을 것이다.

뮌헨은 이미 기존 선수들 급여 삭감하는 칼을 들었다. 영국 매체 '커트오프사이드'는 7일 ""뮌헨 소속 레로이 자네는 최근 매우 좋은 활약을 보여줬다. 하지만, 구단은 클럽 전체 급여 삭감을 진행하고 있다""라며 ""특히 플로리안 비르츠 영입을 위해 자네의 연봉을 재조정하기를 원한다""라고 보도했다. 

이어 ""자네의 연봉은 약 2000만 유로(313억원)다. 뮌헨은 1300만 유로(약 204억원)으로 조정하길 원한다""라고 하며 ""만약 자네가 이를 수락하면 계약은 연장된다. 거절하면 뮌헨은 사네에게 투자될 자금을 보존해 플로리안 비르츠 영입에 사용할 것이다""라고 설명했다. 



뮌헨이 천문학적 금액을 지불해도 영입하길 원하는 비르츠는 2003년생 독일 국적의 공격형 미드필더다.

자네의 주 포지션인 윙어도 뛸 수 있다. 지난 시즌(2023-2024)부터 전 세계 축구 팬들에게 자신의 이름을 알렸다. 바로 분데스리가를 레버쿠젠 소속으로 '무패우승'을 해낸 주역 중 한 명이다. 

단 한 번도 패배하지 않고 해낸 것도 놀랍지만, 다른 의미도 있다. 뮌헨의 독주가 무너졌다는 것이다. 뮌헨은 지난 2012-2013시즌부터 무려 11시즌 연속으로 리그 우승을 독식했다. 이 연패가 깨진 것도 큰 의미가 있었다. 

비르츠 영입에 최소 2000억원 이상 들어갈 전망이다. 독일 이적시장 전문 사이트 '트란스퍼마르크트'에 따르면 현재 비르츠의 몸값은 1억 4000만 유로(약 2197억원) 안팎으로 추정된다.



여기서 더 올라갈 가능성도 있다. 지금 비르츠는 매 순간이 고점이다. 지난 2020년부터 현재까지 몸값이 하락한 적이 없다. 

비르츠의 몸값이 비싼 이유는 당연히 실력이다. 특히 천부적인 센스와 축구 지능이 매우 뛰어나다. 공을 소유했을 때 너무 오래 소유해 타이밍을 놓치거나 의미 없는 패스 따위 하지 않는다. 간결하게 패스를 구사하는데 극한의 효율을 뽑아주는 게 비르츠다. 또 독일 대표팀이라는 점도 무시할 수 없는 요소다.

뮌헨이 비르츠를 품으면 적수가 없어진다. 비르츠는 레버쿠젠 소속이다. 레버쿠젠은 현재 리그 24라운드 기준 2위다. 1위 뮌헨을 우승 라이벌이다. 지난 시즌 뮌헨의 분데스리가 독주를 끊은 유일한 팀이다. 

비르츠가 뮌헨에 합류하면 레버쿠젠은 큰 전력 손실이다.

뮌헨은 그만큼 강해진다. 최전방에 유럽 최고의 스트라이커 해리 케인, 중원에 비르츠와 자말 무시알라 등 독일 최고의 테크니션 2명, 수비라인데 세리에A 올해의 수비수 김민재, 골문은 월드클래스 마누엘 노이어가 지키는 '무적 군단'이 탄생한다. 



해당 소식을 접한 독일 축구 팬들은 ""다시 분데스리가 독주가 시작될까"", ""뮌헨이 UCL 우승을 넘어 유러피언 트레블 가능성도 있다"", ""독일 대표팀 핵심 선수 비르츠와 무시알라가 다 뮌헨 선수면 너무 사기다""라는 반응을 드러냈다.

뮌헨은 자국 리그와 FA컵, 유럽축구연맹(UEFA) 챔피언스리그(UCL) 우승을 한 시즌에 경험하는 '유러피언 트레블'을 2번이나 해낸 구단이다. 이 기록을 가지고 있는 팀은 FC 바르셀로나(스페인)와 함께 뮌헨이 유일하다. 

한 번 더 하면 3번이다. 사상 최초다. UCL 최다 우승 레알 마드리드(스페인) 조차 1번도 못 한 걸 3번이나 해낸 구단이 탄생할 수 있다. 축구 팬들이 비르츠의 뮌헨 합류를 괜히 기대하는 것이 아니다. 또 한국 대표팀 수비수 김민재도 트레블을 경험하는 선수가 될 수 있다.

김민재가 유러피언 트레블을 일궈내면 아시아 최초의 위업이 된다. 박지성도 맨유에서 챔피언스리그와 프리미어리그 우승을 동시에 하는 더블까지 했다.

사진=연합뉴스 / X / 트란스퍼마르크트 캡처"
20250310,"'충격! 이러니 개그프로가 망하지' EPL 사상 첫 '경질 후 감독상' 촌극, 포스테코글루 토트넘 감독이 유력후보","<저작권자(c) 연합뉴스, 무단 전재-재배포, AI 학습 및 활용 금지>
[스포츠조선 이원만 기자] '성적 부진 해고 감독이 월간 최고 감독상?'

도대체 아무리 생각해도 서로 공존할 수 없는 것처럼 보이는 두 개의 수식어가 한 사람에게 따라붙는다. '성적부진 해고'와 '월간 최고지도자'. 코미디 프로그램의 콩트 같은 상황이 실제로 벌어질 수도 있다. 그걸 해낼 수 있는 구단이 바로 토트넘 홋스퍼이고, 그런 황당한 일을 충분히 해낼 법한 인물이 바로 엔제 포스테코글루 감독이다.

영국 현지에서 황당한 가설이 등장했다. '이 달의 감독' 유력 후보가 성적 부진으로 해고될 위험이라는 경고다. 독특한 축구 철학으로 무장한 포스테코글루 토트넘 감독에 대한 전망이다.

영국 매체 기브미스포츠는 지난 8일(이하 한국시각) '포스테코글루 감독이 성적 부진으로 경질된 이후 EPL 이달의 감독상을 받을 수도 있는 상황'이라며 토트넘 내부 소식에 정통한 찰리 에클셰어의 말을 전했다.

<저작권자(c) 연합뉴스, 무단 전재-재배포, AI 학습 및 활용 금지>
상당히 희한한 상황인데, 또 묘하게 설득력이 있다. 일단 현재 포스테코글루 감독이 처한 상황. 굉장히 좋지 못하다. 포스테코글루 감독은 지난 시즌 처음으로 토트넘 지휘봉을 잡고 리그 5위의 돌풍을 일으켰다. 유럽축구연맹(UEFA) 챔피언스리그 진출은 아쉽게 실패했지만, 리그 톱5에 팀을 올려놓으며 유로파리그 진출에 성공했다. EPL 구단을 처음 지휘하는 감독치고는 상당한 성과다.

이때 얻은 자신감을 바탕으로 2024~2025에 좀 욕심을 냈다. 여러 선수들을 야심차게 영입해 리그 우승을 노린다는 목표를 거침없이 밝혔다. 하지만 성적은 좋지 못했다. 시즌 초반부터 부상자가 계속 나왔다. 전 포지션에 걸쳐 대부분 주전 선수들이 부상을 겪었다. 부상 선수들만으로 베스트 11을 짤 수 있을 정도였다.
여기에 포스테코글루 감독의 공격전술이 너무 노출되는 바람에 상대 팀들도 철저히 공략법을 들고 나오기 시작했다. 그 결과 토트넘은 현재 리그 13위로 추락한 상태다. 우승은 커녕 톱10 진입도 낙관할 수 없다. 한때는 강등을 걱정해야 할 정도였다.

컵대회 성적도 좋지 못하다. 카라바오컵은 준결승까지 올라갔지만, 리버풀에 1차전 승리 후 2차전 대패를 당하며 결승행이 좌절됐다. FA컵은 16강에서 탈락했다. 유로파리그도 AZ 알크마르를 상대로 1차전에서 0-1로 졌다. 2차전에서 2골차 이상 이겨야만 8강에 오를 수 있다.

이쯤 되면 다니엘 레비 감독도 인내심을 유지하기 어렵다. 현지에서는 알크마르와의 2차전에서도 지면 곧바로 포스테코글루 감독이 경질될 것으로 예상하고 있다.

이런 상황에 포스테코글루 감독은 EPL 2월 '이 달의 감독상' 후보에 올라와 있다. 2월에 잠깐 성적이 좋았다. 3승 1패를 기록했다. 성적 기준이라 포스테코글루 감독이 충분히 후보에 들어갈 수 있다. 다른 후보들은 올리버 글라스너 크리스탈 팰리스 감독(3승 1패), 데이비드 모예스 에버튼 감독(2승 3무), 마르코 실바 풀럼 감독(3승 1패), 아르네 슬롯 리버풀 감독(6경기 4승 2무)이다.

성적으로 보면 슬롯 감독이 좀 유리하다. 하지만 포스테코글루가 받을 가능성도 없진 않다.

<저작권자(c) 연합뉴스, 무단 전재-재배포, AI 학습 및 활용 금지>
여기서 희한한 시나리오가 등장한다. 기브미스포츠는 '다니엘 레비 회장이 포스테코글루를 해고한 뒤에 2월 이 달의 감독상이 수여되면 EPL 사상 초유의 일이 될 것이다. 토트넘은 2021년 8월에도 이달의 상을 받은 누누 산투 감독을 3개월 뒤에 경질했다'고 보도했다.

즉, 포스테코글루 감독이 14일로 예정된 알크마르와의 2차전 패배 후 해고를 당하고, 그 시기를 즈음해 발표되는 이 달의 감독상을 받는 상황을 가정한 것이다. 물론 실현가능성이 크진 않다. 변수가 많다. 일단 토트넘이 2차전에서 승리할 수도 있다. 또 성적으로 볼때 포스테코글루 보다는 슬롯이 앞선다.

하지만 '토트넘이라면' 그리고 '레비회장이라면'이라는 희한한 전제조건이 있다. 워낙 상식 밖의 일이 자주 벌어지는 토트넘이라면 이런 촌극도 충분히 나올 수 있다는 게 현지의 시각이다.

이원만 기자 wman@sportschosun.com"
20250310,"뮌헨, 케인 ‘방출’→아스널 합류…이적료 1260억 빅딜 충격 주장","해리 케인이 자신의 동상 옆에서 밝게 웃고 있다. 사진=AP 연합뉴스

독일 ‘거함’ 바이에른 뮌헨이 주전 공격수인 해리 케인을 매각할 수 있다는 주장이 나왔다.

영국 매체 트리뷰나는 지난 9일(한국시간) “뮌헨이 올여름 케인을 이적시장에 내놓을 준비를 하고 있다”면서 “아스널과 맨체스터 유나이티드가 공격력 강화를 위해 케인을 눈여겨보고 있다”며 스페인 피차헤스를 인용 보도했다.

공신력에는 물음표가 붙지만, 충격적인 주장이다. 연결되는 클럽이 아스널이기 때문이다. 케인은 아스널 ‘맞수’ 토트넘의 리빙 레전드로 꼽힌다.
케인은 2023년 8월 뮌헨과 4년 계약을 맺었다. 당시 8000만 유로(1260억원)의 방출 조항을 삽입한 것으로 알려졌다. 이 금액만 제시하면, 어느 팀도 케인과 개인 협상을 통해 데려갈 수 있는 것이다.

영국 90MIN 역시 이적 가십을 소개하면서 아스널과 맨유뿐만 아니라 토트넘도 케인 영입에 관심을 보인다고 짚었다.

20일 알리안츠 아레나에서 열린 2024~25 분데스리가 7라운드 뮌헨과 슈투트가르트의 경기. 뮌헨이 4-0으로 크게 이기며 공식전 3경기 무승을 끊었다. 케인(사진)은 해트트릭을 기록하며 최근의 부진에서 깨어났다. 사진=뮌헨 SNS

케인의 활약을 고려하면, 뮌헨이 실제 오는 여름 이적시장에 그를 내놓을지가 미지수다. 현시점에도 케인보다 빼어난 활약을 펼치는 스트라이커를 꼽기 어려운 탓이다.

32세에 접어든 케인이지만, 여전한 득점력을 자랑한다. 올 시즌 분데스리가 23경기에 나서 21골 6도움을 수확했고, 유럽축구연맹(UEFA) 챔피언스리그(UCL) 10경기에 출전해 9골 1도움을 올렸다. 경기 수보다 공격포인트가 더 많다.

물론 방출 조항을 발동하면, 잉글랜드 프리미어리그(EPL) 팀들이 충분히 케인 영입을 노릴 수 있다. 다만 케인 역시 커리어 내내 한이었던 ‘우승’을 할 수 있는 팀에서 적을 옮길지 알 수 없다.

뮌헨의 UCL 결승행 실패에 좌절한 해리 케인. 사진=로이터 연합뉴스

케인에게 구미가 당길 요소는 있다. 익숙한 EPL로 돌아가 영국 생활을 할 수 있다는 게 가장 큰 장점이다. 아울러 EPL 득점 기록을 새로 쓸 가능성이 생긴다는 것도 케인에게 이적 이유로 작용할 만하다.

EPL 역대 최다 득점 기록은 앨런 시어러(260골)가 보유하고 있다. 케인은 그보다 47골 뒤져 있다. 2년 전 토트넘을 떠난 뒤 케인의 기록은 멈춰 있다.

득점력을 유지한다는 가정하에 케인이 EPL 팀으로 이적한다면, 시어러 기록을 두 시즌 안에 깰 가능성이 크다.

김희웅 기자"
20250310,구단 직원과 바람→임신 중 아내와 이혼→경기력 급락 '먹튀 논란'→충격 퇴장+오심 취소…'김민재 호위무사' 인생 이렇게 꼬이나,"(엑스포츠뉴스 용환주 기자) 불륜 뒤 인생이 역동적으로 변하고 있다.

지난해 여름 프리미어리그 풀럼에서 김민재 소속팀인 독일 최고 명문 바이에른 뮌헨으로 이적한 포르투갈 미드필더 주앙 팔리냐 얘기다.

뱅상 콤파니 감독이 이끄는 뮌헨은 8일(한국시간) 독일 뮌헨에 있는 알리안츠 아레나에서 열린 2024-2025시즌 독일 분데스리가 25라운드에서 보훔에 2-3으로 패했다. 심지어 2-0으로 이기고 있다가 레드카드 판정 이후 2-3으로 역전패를 당했다. 
이날 홈팀 뮌헨은 4-2-3-1 포메이션을 가동했다. 김민재는 벤치에서 시작했다. 요나스 우르비히가 골문을 지켰고, 이토 히로키, 에릭 다이어, 요시프 스타니시치, 사샤 보이가 백4를 구성했다. 3선은 레온 고레츠카와 주앙 팔리냐가 지켰고, 2선에 세르주 그나브리, 하파엘 게헤이루, 레로이 자네가 배치됐다. 최전방 원톱 자리에 토마스 뮐러가 이름을 올렸다.

12일 유럽축구연맹(UEFA) 챔피언스리그 16강 2차전 레버쿠젠과의 원정 경기를 대비해 김민재와 다요 우파메카노, 해리 케인, 마이클 올리세, 자말 무시알라 등 주전급 선수들이 모두 빠졌다. 로테이션을 돌렸다.



뮌헨은 이날 선취골을 터트리며 경기를 순조롭게 풀어나갔다. 전반 14분 그나브리가 패스로 공을 넘겼다. 이를 게헤이루가 받았다. 이어 골문 앞에서 왼발로 슈팅해 골문 상단을 흔들어 득점을 만들었다. 

뮌헨이 격차를 벌렸다. 전반 28분 왼쪽 측면에서 이토가 박스 안으로 크로스를 올렸다. 이를 뮐러가 헤더로 떨궜다. 이어 게헤이루가 골문 앞에서 헤더로 왼쪽 아래 골망을 흔들었다. 

뮌헨에 쐐기를 박을 기회가 왔다. 보훔 센터백 메디치가 박스 안으로 드리블을 시도하는 사네를 저지하는 과정에서 반칙을 범해 뮌헨에 페널티 킥을 내줬다. 페널티 킥 키커로 나선 건 그나브리였다. 그나브리는 골키퍼를 속이는데 성공했지만, 슈팅이 골대를 때리면서 추가골을 터트리는데 실패했다.

보훔이 추격했다. 전반 31분 코너킥 상황에서 흘러나온 공을 메디치가 페널티 박스 중앙에서 오른발로 슈팅해 득점을 터트렸다. 





뮌헨에 위기가 왔다. 전반 43분 팔리냐가 다이렉트 퇴장을 당했다. 뮌헨은 남은 시간 10명으로 경기를 진행했다. 이후 전반전 2-1 뮌헨이 앞선 상황으로 종료됐다. 

한 명 부족한 뮌헨은 결국 무너졌다. 후반 6분 오른쪽 측면에서 파슬라크가 올린 크로스를 시소코가 헤더에 동점고을 허용했다. 이후 후반 26분에는 베로가 슈팅으로 연결해 역전을 허용했다. 결국 뮌헨은 2-3으로 패했다. 

경기 종료 후 논란이 터졌다. 팔리냐 퇴장이 올바른 판정인지 많은 축구 팬들이 의문을 보였다. 결론은 '오심'이었다. 



독일 축구 매체 '키커'는 8일 ""DFB를 통해 우리는 확인했다. 이번 보훔전에서 크리스티안 딩게르트 주심이 뮌헨에게 내린 레드카드 판정은 잘못된 판정이다. 팔리냐에 전혀 도움이 되지 않았다""라고 보도했다. 

이어 ""팔리냐는 상대 진영에서 불필요하고 조심성 없는 태클을 시도했다. 비록 공을 먼저 건드려 반칙은 아니지만, 위험한 플레이라는 것은 변함없다""라고 밝혔다.

뮌헨 입장에선 억울하게 됐다. 팔리냐도 황당한 심정을 감출 수 없을 것으로 보인다.

프리미어리그 정상급 미드필더로 꼽히며 뮌헨에 왔으나 인생이 꼬일대로 꼬이고 있다.

팔리냐는 1995년생 포르투갈 국적의 수비형 미드필더다. 2024년 7월부터 뮌헨 선수로 활약 중이다. 소속팀 합류 3개월만에 사생활 문제가 터졌다. 가수 출신인 아내 파트리시아 팔라레스와 이혼 절차를 밟고 있는 것으로 알려졌다.



독일 매체 '스포르트1'은 지난 10월 ""팔리냐는 아내와 이혼 절차를 밟고 있는 것으로 알려졌다. 며칠 전 법원 심리에 모습을 드러냈다""라며 ""이러한 이유는 그는 포르투갈 국가대표팀 훈련에서 빠져 폴란드와의 A매치를 놓쳤다""라고 설명했다.

팔리냐는 팔라레스와 5년간 교제하다가 2021년에 결혼했다. 아내는 2022년 1월에 아들을 낳았고 당시 둘째를 임신 중이였다. 그러나 팔리냐가 바람을 피우면서 두 사람은 이혼 절차를 밟게 됐다. 

입단 직후 새 팀인 뮌헨 구단 직원과 외도를 해서 독일은 물론 전세계적으로 화제가 됐다. 그야말로 망신을 당했다. 아내는 팔리냐와 이혼 도장을 찍고 출산했다.

매체는 ""파트리시아는 팔리냐가 독일로 이적할 때 모든 노력을 다하고 있었다""라며 ""그러나 팔리냐가 이웃이자 뮌헨 직원과 함께 자신을 배신했다는 사실을 알게 됐다""라고 밝혔다.

팔리냐는 뮌헨 합류 후 여러 구설수에 오르고 있다. 가정에 혼란을 일으켰고, 형편 없는 경기력으로 ""뮌헨이 속았다""는 평도 듣고 있다. 경기에서는 오심으로 억울한 퇴장을 당했다. 독일 무대에서 첫 시즌이 순탄하지 않은 팔리냐가 과연 무사히 시즌을 마무리할 수 있을지 많은 축구 팬들의 관심이 집중될 전망이다.

사진=연합뉴스 / 팔리냐 SNS 캡처"
