date,title,content
20251124,"쏘니 캡틴, 작심발언! ""하부리그도 여기보다 낫다, MLS 개선 고민해야"" 요리스, LAFC 패배 후 밴쿠버 인조 잔디 지적...과거 김문환도 어려움 토로","[SPORTALKOREA] 김경태 기자= 로스앤젤레스 FC(LAFC) 패배의 요인은 인조 잔디 때문이었을까.

LAFC의 '캡틴' 위고 요리스는 23일(한국시간) 열린 밴쿠버 화이트캡스 FC와의 2025 메이저리그사커(MLS) 컵 서부 콘퍼런스 준결승전 종료 후 인터뷰에서 강하게 불만을 드러냈다. 그는 ""이런 곳에서 경기를 한다는 건 받아들이기 어렵다. MLS도, 밴쿠버 구단주도 이 문제를 진지하게 고민해야 한다""고 직설적으로 말했다.



요리스 발언의 취지는 다름 아닌 밴쿠버의 홈구장 BC 플레이스의 잔디 상태. 해당 경기장은 특이하게 천연 잔디가 아닌 인조 잔디를 사용하고 있다.  

이날 LAFC는 거의 승리에 도달한 상태였다. 엠마누엘 사비(전반 38분)와 마티아스 라보다(전반 추가시간)에게 골을 헌납하며 0-2로 뒤처기도 했지만, 후반전에 손흥민이 멀티골(후반 14분, 후반 추가시간)을 뽑아내며 흐름을 바꿨다. 

여기에 더해 트리스탄 블랙먼의 경고 누적 퇴장, 벨랄 할부니의 통증 호소로 인해 수적 우위(11-9)까지 점했다. 다만 LAFC는 연장전에서 끝내 추가 득점에 실패했고 승부차기에서 패배, 준결승에서 탈락하며 고배를 마셔야 했다.



요리스는 패배의 요인으로 인조 잔디를 꼽은 듯 비판의 목소리를 높였다. 그는 ""이런 경기장, 분위기를 가진 곳이라면 더 좋은 장소가 될 수 있어야 한다. 프랑스 하부리그에도 이 정도보다 더 나은 인조 잔디가 있다""며 ""MLS가 이 부분을 개선할 수 있다면, 다시 한번 논의해 볼만한 문제라고 생각한다""고 의견을 피력했다.

인조 잔디 특성상 천연 잔디처럼 자연스럽게 구르지 않는 문제가 존재한다. 특히 인조 잔디는 비교적 충격 흡수가 약해 무릎, 발목 부상의 위험이 크다는 지적도 꾸준히 나오고 있다.



BC 플레이스의 잔디 논란은 이번이 처음이 아니다. 캐나다 매체 '시티뉴스 에브리웨어'에 따르면 디디에 드록바는 앵팍트 드 몽레알(現 CF 몽레알·2015~2016) 시절 인조잔디가 자신의 만성 무릎 상태를 악화시킬 수 있다며 출전을 거부한 전례가 있다.

또한 지난 2021년부터 2022년까지 LAFC에서 뛰었던 김문환 역시 밴쿠버 원정 당시 인조잔디를 두고 어려움을 토로한 바 있다.

사진=호세 아르만도 X, 게티이미지코리아, 셀소 올리베이라 X

취재문의 sportal@sportalkorea.co.kr"
20251124,"손흥민 뼈 때리는 충격 발언 ""쏘니가 PL 최고? 60년 살면서 토트넘 우승 본 적도 없는데?""","사진 = 프리미어리그


[인터풋볼=박윤서 기자] 손흥민이 프리미어리그 역사상 최고 공격 트리오 중 한 명이라는 주장에 아스널 팬으로 잘 알려진 영국 언론인 피어스 모건이 반박했다.

토트넘 홋스퍼는 24일 오전 1시 30분(한국시간) 영국 런던에 위치한 에미레이츠 스타디움에서 열린 2025-26시즌 프리미어리그 12라운드에서 아스널에 1-4로 패배했다.

토트넘은 전반전부터 와르르 무너졌다. 전반 중반까지 팽팽한 균형을 잘 이어오다가 레안드로 트로사르에게 선제골을 허용하면서 급격하게 흔들렸다. 에베레치 에제에게 5분 만에 또 실점하면서 0-2로 전반전을 마쳤다. 후반전 시작과 함께 에제의 왼발 슈팅에 또 실점했고 3점 차까지 벌어졌다. 히샬리송의 원더골로 한 골 추격했지만 후반 중반 에제의 해트트릭을 완성하는 슈팅에 울었다.

경기 전부터 북런던 더비는 치열했다. 영국 '토크 스포츠'가 진행한 팟캐스트에서 토트넘 출신 오하라는 흥미로운 견해를 내놨다. 오하라는 자신의 친정팀 토트넘 공격 트리오가 아스널보다 낫다고 평가했다.

사진 = 더 보이 홋스퍼


오하라는 ""토트넘이 프리미어리그에서 아스널보다 더 나은 공격 트리오를 갖고 있다고 생각한다. 전성기 선수들에 대해 말하는 거다. 손흥민, 해리 케인, 가레스 베일은 프리미어리그 역사상 최고의 공격 트리오다. 아스널보다 낫다""라고 말했다.

모건은 이에 반격했다. ""세 단어로 요약한다. 티에리 앙리, 데니스 베르캄프, 로베르 피레스다. 우리 팀 트리오와 토트넘 트리오의 차이가 무엇인가. 토트넘은 내가 살아온 동안 프리미어리그에서 우승한 적이 없다. 난 60살이다. 아스널 이 트리오가 있을 때는 아스널은 무패 우승을 했다. 다른 어떤 팀도 해내지 못한 일이다. 우리가 역사상 가장 위대한 트리오를 보유했다는 건 통계적으로도 반박할 수 없는 사실이다""라고 말했다.

토트넘은 모건의 발언대로 프리미어리그 우승은 없다. 1992-93시즌부터 개편됐는데 이후 최고 성적은 2016-17시즌 2위다. 이전에 풋볼 리그 디비전(프리미어리그 전신) 때에는 우승 기록이 있긴 하다. 1960-61시즌이 마지막이다. 모건은 1965년생이니 정말 그의 발언 대로 살면서 토트넘의 리그 우승은 보지 못했던 것이 맞다."
20251124,"'진정한 패자 클래스'.. LAFC 손흥민, ""가서 우승해"" 한마디로 밴쿠버 팬들까지 사로잡았다","[사진] MLS SNS


[OSEN=강필주 기자] 손흥민(33, LAFC)이 진정한 패자의 품격을 보여주며 상대 팀 밴쿠버 팬들의 마음까지 훔쳤다.

손흥민은 23일(한국시간) 캐나다 밴쿠버 BC 플레이스에서 열린 밴쿠버 화이트캡스와의 2025 미국 메이저리그사커(MLS) 컵 서부 컨퍼런스 준결승(플레이오프 8강)에 선발 출전해 멀티골을 터뜨렸지만, 팀의 탈락을 막지는 못했다.

손흥민은 팀이 0-2로 뒤진 상황에서 후반 14분 문전 앞 혼전 중, 세 차례 연속 슈팅 끝에 추격골을 넣었다. 이어 후반 추가시간에는 박스 근처에서 얻은 프리킥을 환상적인 오른발 감아차기 골로 연결하며 극적인 2-2 동점을 만들었다.

[사진] ⓒGettyimages(무단전재 및 재배포 금지)


그러나 승부차기에서 승리는 LAFC가 아니라 밴쿠버로 향했다. 1번 키커로 나선 손흥민이 근육 경련으로 순간 균형을 잃었다. 결국 그가 찬 공이 오른쪽 골대를 맞고 나왔다. 이후 LAFC는 3번 키커까지 실축, 끝내 시즌을 마감했다.

손흥민에게 아쉬움이 더 큰 경기였다. 팀이 탈락 위기에 몰린 상황에서 자신의 클래스와 집중력으로 승부를 연장까지 끌고 갔지만, 마지막 PK 실축으로 고개를 숙여야 했기 때문이다. 

이런 가운데 미국 메이저리그사커(MLS)는 경기 직후 공식 소셜 미디어(SNS)에 동영상 하나를 올렸다. 이 영상에는 손흥민이 경기 직후 미국 대표팀과 밴쿠버의 핵심 미드필더 세바스찬 버홀터(24)와 짧은 인사를 나누는 모습이 담겼다. 

[사진] ⓒGettyimages(무단전재 및 재배포 금지)


손흥민은 버홀터와 포옹한 뒤 가볍게 등을 두드렸다. 그리고 ""Go win it(가서 우승해)""이라고 말했다. 자신에게 아픈 패배를 안긴 팀 선수에게 축하와 함께 앞으로 있을 경기에 대한 격려이기도 했다. 

손흥민의 이 짧은 한마디는 상대 팬들의 마음까지 움직였다. 현지 팬들은 손흥민의 태도와 품격을 두고 ""존경스럽다"", ""MLS가 이런 선수를 보유한 건 행운""이라고 반응했다. 경기에서 철저한 적이었지만 경기 후 그의 자세에 대한 감탄이 쏟아진 것이다.

[사진] ⓒGettyimages(무단전재 및 재배포 금지)


손흥민은 공식 인터뷰에서도 상대 팀을 향한 존중을 잊지 않았다. MLS 홈페이지에 따르면 그는 경기 후 인터뷰에서 ""가끔은 축구가 이렇게 미친다. 그래서 우리가 축구를 사랑하는 것""이라며 ""밴쿠버에 큰 축하를 보낸다. 다음 시즌에 다시 보자""고 말했다. /letmeout@osen.co.kr"
20251124,"""이래서 손흥민, 손흥민 합니다"" 결승行 뮐러, '월클' 무한 찬사! '멀티골→PK 실축' 슬퍼도 빛난 SONNY…유로파 우승→이적→MLS 접수, '최고의 해' 마침표","AP 연합뉴스
<저작권자(c) 연합뉴스, 무단 전재-재배포, AI 학습 및 활용 금지>
AP 연합뉴스
[스포츠조선 김성원 기자]손흥민(33·LA FC)이 축구 인생에 잊지 못할 2025년을 마감했다.

토트넘에서 출발한 그는 프로 데뷔 후 첫 우승컵을 품에 안았다. 2024~2025시즌 토트넘 주장으로 유로파리그(UEL)에서 정상에 올랐다. 토트넘에는 2007~2008시즌 리그컵 정상 이후 17년 만의 환희를 선물했다. 유럽대항전은 1983~1984시즌 이후 41년 만의 우승이었다.

손흥민은 8월 토트넘과의 10년 동행을 끝냈다. 미국 메이저리그사커(MLS)에 둥지를 틀었다. MLS 역대 최고 이적료가 경신됐다. LA FC는 손흥민을 영입하는 조건으로 2650만달러(약 382억원)를 토트넘에 지급했다. 연봉은 1115만달러(약 169억원)로 2045만달러(약 301억원)인 리오넬 메시(인터마이애미) 그 다음이다. LA FC에선 독보적이었다.

LA FC는 이미 그 효과를 봤다. 손흥민의 전과 후가 달랐다. LA FC의 존재감이 폭발했다. 동부에는 메시, 서부에는 손흥민이라는 등호가 성립됐다.

그러나 손흥민의 2025년 여정은 23일(한국시각) 멈췄다. 그는 이날 캐나다 밴쿠버의 BC플레이스에서 열린 밴쿠버 화이트캡스와의 2025년 MLS컵 플레이오프(PO) 서부 컨퍼런스 4강전서 만회골에서 이어 후반 추가시간 극장 동점골을 터트리는 원맨쇼를 펼쳤다.

2-2, 승부는 30분 연장 혈투에도 승부가 나지 않았다. 명암은 승부차기에서 엇갈렸다. 손흥민에게는 고통이었다. 그는 첫 번째 키커로 나섰지만 실축했고, LA FC는 3-4로 패했다. 밴쿠버가 구단 역사상 처음으로 서부 컨퍼런스 결승에 진출했다.

<저작권자(c) 연합뉴스, 무단 전재-재배포, AI 학습 및 활용 금지>
AFP 연합뉴스
손흥민은 '월드클래스' 가치를 또 증명했다. 예스페르 쇠렌센 밴쿠버 감독은 ""LA FC는 이번 시즌 MLS에서 우리가 맞붙었던 최고의 팀이다. 두 팀 모두 정말 훌륭했고, 수준높은 경기였다. 손흥민의 멋진 골도 볼 수 있었다""며 ""내 커리어에서 이런 경기를 본 적이 없는 것 같다""고 말했다.

LA FC는 전반에만 2골을 헌납했다. 손흥민이 LA FC를 수렁에서 건져냈다. 그는 후반 15분 집념의 만회골을 터트렸다. 마크 델가도의 패스가 앤드류 모란의 헤더를 거쳐 손흥민에게 연결됐다. 그는 문전 혼전 상황에서 3차례의 슈팅 끝에 골망을 흔들었다. 첫 번째 슈팅은 골키퍼, 두 번째 슈팅은 골라인을 통과하기 직전 마티아스 라보르다의 머리를 맞고 흘러나왔다. 이를 왼발 슈팅으로 재차 응수해 골망을 흔들었다.
후반 추가시간인 50분 극적인 '손흥민 쇼'가 또 펼쳐졌다. 미국 메이저리그사커(MLS) '올해의 골'이 재연됐다. 지난 14일 볼리비아와의 A매치 친선경기 프리킥골이 복사됐다. 손흥민의 오른발 프리킥은 그림같은 궤적을 그리며 밴쿠버 골문 구석을 찔렀다.

밴쿠버는 악재가 쏟아졌다. 프리킥을 내주는 과정에서 트리스탄 블랙먼이 경고 2회로 퇴장당했다. 토마스 뮐러는 근육 경련으로 연장 전반 2분 교체됐다. 연장 후반 5분에는 교체투입된 벨랄 할부니가 부상으로 아웃됐다. 밴쿠버는 교체 카드를 모두 소진해 9명으로 싸웠다.

AFP 연합뉴스
<저작권자(c) 연합뉴스, 무단 전재-재배포, AI 학습 및 활용 금지>
하지만 '승리의 여신'은 끝내 LA FC를 향해 미소짓지 않았다. 골대 불운에 울며 역전골을 터트리는 데 실패했다. 손흥민과의 대결로 관심을 모았던 뮐러는 ""잔혹한 축구의 아름다움이다. 우리는 고전했지만 정말 자랑스럽다""면서도 ""손흥민의 놀라운 프리킥 골이 나왔다. 그는 정말 대단한 선수""라고 치켜세웠다.

그러나 손흥민은 슬펐다. 승부차기 후 엎드려 한동안 일어나지 못했다. 좀처럼 고개를 들지 못한 그는 라커룸으로 직행했다.

그는 경기 후 공식 기자회견에서 동점골 상황에 대해 ""2-1을 만들고 분위기를 가져오던 중요한 순간이었다. 밴쿠버도 긴장할 거라는 걸 알고 있었다. 축구는 늘 그렇다. 2-0으로 앞설 때는 잡았다고 생각하지만 2-1이 되면 상황이 달라진다""며 ""나는 이런 순간들을 정말 좋아한다. 슈팅을 잘했고, 운좋게도 골이 들어갔다. 하지만 이런 골을 넣는 것만으로 경기를 이기기엔 부족했다. 정말 아쉽다""고 말했다.

그리고 ""사람들은 내가 팀을 연장까지 끌고 갔다고 말하지만 나는 더 책임이 있는 것처럼 느껴진다. 팀이 연장까지 잘 싸운 점은 자랑스럽다""고 말했다.

밴쿠버 SNS
<저작권자(c) 연합뉴스, 무단 전재-재배포, AI 학습 및 활용 금지>
손흥민은 뮐러와 대결에 대해선 ""축구에서 개인에게 너무 초점을 맞출 필요가 없다. 물론 개인 능력이 상활을 바꾸기도 하지만 팀 전체를 봐야 한다. 아쉽게도 밴쿠버가 이겨, 컨퍼런스 결승에 진출했다. 우리는 받아들여야 하고 축하의 말을 전한다. 나와 뮐러, 개인의 대결이 아니었다. 중요한 부분도 아니었다""고 말했다.

실축 상황에 대해서도 ""그 순간에는 당연히 나서야 한다. 이런 상황을 정말 좋아하고, 팀을 위해 언제나 책임지고 싶다. 연장 후반 막판에 근육 경련이 와서 느낌이 좋지 않았다. 그래도 차려고 했다. 페널티킥을 차려는 순간 다시 경련이 왔고, 최대치의 정확도를 내지 못했다""면서도 ""내가 어떤 상태였는지를 설명하는 거다. 전적으로 내 책임이다. 내가 감당해야 한다. 내년에는 더 강해져 돌아올 것""이라고 강조했다.

손흥민 효과에 밴쿠버는 새 역사를 작성했다. 역대 최다 관중을 달성했다. 지난 4월 열린 메시가 포진한 인터마이애미와의 북중미챔피언스컵 4강 1차전의 5만3837명보다 많은 5만3957명이 운집했다.

손흥민은 ""경기가 재미있었다는 점은 인정해야 한다. 팬들이 경기장을 찾고, 좋은 골을 보고, 승리를 기대하는 이유가 이런 경기다. 안타깝게도 밴쿠버가 이겼지만 MLS에는 도움이 되는 큰 경기였다. 축구가 이렇게 미친 듯이 흘러간다. 그래서 우리가 축구를 사랑하는 것""이라고 했다.

<저작권자(c) 연합뉴스, 무단 전재-재배포, AI 학습 및 활용 금지>
AFP 연합뉴스
비록 정상 등극에는 실패했지만 손흥민은 13경기에서 12골 4도움을 올리며 MLS를 완벽하게 접수했다. 손흥민은 ""정말 환상적인 시즌이었다. 모든 분들이 정말 따뜻했고, 매 순간을 즐겼다. 이 유니폼을 입는 것이 자랑스러웠고, 모든 것을 쏟아내려고 노력했다. 그러나 나는 우승 트로피를 들기 위해 여기에 왔다. 오늘은 원하는 결과를 얻지 못했지만 내년에는 우리가 치르는 모든 대회에서 성공하고 싶다""고 했다.

그는 이어 ""MLS라는 새로운 환경과 리그에 적응하면서 성장할 수 있는 기회였다. 부족하지만 많은 사랑을 받고 더 많은 책임감을 가져야 한다는 걸 배운 시즌이었다. 하지만 임팩트를 떠나 실망스러운 시즌이었다. 내년에는 좋은 모습으로 우승할 수 있는 컨디션을 만들어 돌아올 수 있는 것이 목표""라고 덧붙였다.

밴쿠버전을 끝으로 LA FC와 이별하는 스티브 체룬돌로 감독은 ""손흥민의 동점골은 월드클래스였다. 그는 우리 팀과 대표팀, 이전 팀에서 그런 장면을 보여줬다. 손흥민은 월드클래스고, 그를 보유하고 있어 정말 기쁘다""며 ""시즌 초부터 함께했다면 정말 좋았을 것이다. 관계도 정말 좋았다. 개인적으로는 앞으로도 연락을 이어갈 것 같은 선수""라고 미소지었다."
20251124,"대충격! 손흥민, 2골 넣고도 '상상초월' 조롱 받다니…우승 실패하자 ""무관 토트넘 루틴 못 벗어나""→팬들 반발","(엑스포츠뉴스 권동환 기자) 손흥민(LAFC)이 멀티골을 터트리며 맹활약했음에도 캐나다 언론인으로부터 조롱을 받아 충격을 줬다.

손흥민은 23일(한국시간) 캐나다 밴쿠버에 있는 BC플레이스에서 열린 밴쿠버 화이트캡스와의 2025 미국 메이저리그사커(MLS)컵 플레이오프 서부 콘퍼런스 준결승에서 2골을 터트리며 분투했지만 승부차기 끝에 패했다.

이날 선발로 출전한 손흥민은 0-2로 뒤져 있던 후반 15분 만회골을 터트리면서 추격의 불씨를 살렸고, 후반 추가시간에 환상적인 프리킥으로 밴쿠버 골망을 갈라 동점골을 넣으면서 경기 균형을 맞췄다.

손흥민 덕에 연장전에 돌입한 LAFC는 좀처럼 역전골을 만들지 못했다. 앞서 후반 추가시간 밴쿠버 수비수 트리스탄 블랙먼이 경고 누적으로 퇴장을 당해 수적 우위를 점하고도 밴쿠버 골문을 여는데 어려움을 겪었다.



결국 경기는 승부차기에 돌입했는데, LAFC 1번 키커로 나선 손흥민의 슈팅이 골대를 때렸다. 결국 승부차기에서 손흥민을 포함해 2명이 실축한 LAFC가 승부차기에서 3-4로 패하면서 결승 진출에 실패했다.

승부차기에서 실축해 결승 진출이 좌절됐지만 이날 멀티골을 터트려 LAFC를 패배 위기에서 구한 손흥민은 많은 찬사를 받았다.

그러나 'CBS스포츠'의 캐나다 언론인 벤 슈타이너가 자신의 사회관계망서비스(SNS)를 통해 손흥민을 조롱해 눈길을 끌었다.

슈타니어는 SNS에서 ""손흥민, 알잖아? 그는 토트넘을 떠날 수 있지만, 토트넘에서 벗어날 수 없다""라며 ""어쨌든 밴쿠버는 클럽 역사상 처음으로 콘퍼런스 결승에 진출한다""라고 전했다.



이는 잉글리시 프리미어리그 토트넘 홋스퍼에서 뛰던 선수들이 이적 후에도 우승에 실패하면 종종 듣는 조롱이다. 해리 케인도 토트넘을 떠난 후 바이에른 뮌헨 데뷔 시즌을 무관으로 마치자 각종 매체로부터 같은 조롱을 들었다.

손흥민이 2골을 터트리고도 조롱을 받자 팬들은 크게 반발했다.

이들은 댓글을 통해 ""2골을 넣은 최고의 선수를 비난하는 건가?"", ""손흥민은 노력했고, LAFC를 연장까지 끌고 가는 것은 쉽지 않았다"", ""손흥민을 탓하고, 아무것도 못 한 나머지 10명의 선수들은 내버려 두다니 부끄러운 줄 알아라""라고 비판했다.

더불어 한 팬은 ""손흥민은 토트넘에서 트로피 얻었다""라며 손흥민이 다른 토트넘 선수들과 달리 우승을 하고 이적한 점을 강조했다. 손흥민은 지난 시즌 유럽축구연맹(UEFA) 유로파리그에서 우승해 커리어 첫 메이저 대회 트로피를 들어 올렸다.

사진=연합뉴스"
20251124,美 충격 주장! '손흥민 영웅에서 악당됐다'…실축에 가려진 멀티골 맹활약→'12골 4도움' 데뷔 시즌 마감,"<저작권자(c) 연합뉴스, 무단 전재-재배포, AI 학습 및 활용 금지>
[스포츠조선 강우진 기자]손흥민과 토마스 뮐러의 맞대결이 드라마 같은 결말로 끝이 났다. 9명이 싸운 뮐러의 밴쿠버 화이트캡스는 승부차기 끝에 손흥민의 LAFC(로스앤젤레스 FC)를 꺾었다.

손흥민은 23일(한국시각) 캐나다 밴쿠버 BC 플레이스에서 열린 미국 메이저리그사커(MLS) 서부 콘퍼런스 준결승 경기에 선발 출전해 2골을 넣으며 맹활약했다. LAFC는 밴쿠버 화이트캡스와 2대2로 비겼지만, 승부차기(3대4)에서 무너지면서 탈락했다.

<저작권자(c) 연합뉴스, 무단 전재-재배포, AI 학습 및 활용 금지>
<저작권자(c) 연합뉴스, 무단 전재-재배포, AI 학습 및 활용 금지>
손흥민은 이날 주인공이 될 뻔했다.

0-2로 뒤지고 있던 후반 15분 손흥민이 문전 앞 혼전 상황에서 세 차례 연속 슈팅으로 득점에 성공했다. 종료 직전에는 그림 같은 프리킥골을 성공시키면서 영웅이 됐다. 손흥민은 골을 넣은 직후 벤치로 달려가며 포효했다.

연장전에서 LAFC의 승리 가능성이 컸다. 경고 누적과 부상으로 밴쿠버 화이트캡스가 9명만 뛰었기 때문이다. 하지만, LAFC는 11명이 뛰면서도 연장전에 추가골을 성공시키지 못했다.

<저작권자(c) 연합뉴스, 무단 전재-재배포, AI 학습 및 활용 금지>
<저작권자(c) 연합뉴스, 무단 전재-재배포, AI 학습 및 활용 금지>
손흥민은 승부차기에서 첫번째 키커로 나섰다. 손흥민의 슈팅은 오른쪽 골대를 맞고 튀어 나왔다. 골 결정력만큼은 여전히 최고 수준인 손흥민이었기에 팬들의 좌절감은 컸다. LAFC에서 마르코 델가도의 실축까지 나오면서 밴쿠버가 서부 콘퍼런스 결승으로 향했다.

손흥민은 MLS 합류 이후 13경기에서 12골 4도움을 기록했다. 최고의 활약을 보였지만, 결정적인 실수로 우승 도전에는 실패하고 말았다.

<저작권자(c) 연합뉴스, 무단 전재-재배포, AI 학습 및 활용 금지>
경기 후 미국 스포츠 일러스트레이티드는 이 경기를 플레이오프 역사에 남을 경기라고 평가하면서 '손흥민, 영웅에서 빌런으로'라는 제목을 게재했다.

매체는 ""극적 프리킥으로 팀을 살린 손흥민이었지만 승부차기에서는 명성을 이어가지 못했다""라며 ""첫 번째 키커로 나선 그는 골대를 맞히며 실축했다. 이어 마크 델가도도 같은 방식으로 실축했다""라고 전했다.

이어 ""LAFC의 시즌은 끝났고, 스티브 체룬돌로 감독의 임기도 종료됐다""라며 ""반면 밴쿠버는 2023년, 2024년 플레이오프에서 LAFC에게 패했던 아픔을 극복하고 마침내 그들을 넘어섰다""라고 덧붙였다."
