date,title,content
20250925,"""내가 함께 뛴 선수 중 최고다!"" 극찬 받았는데…맨체스터 유나이티드서 살아남기 쉽지 않다→'5경기 0골' 고전","사진=게티이미지


[포포투=이종관]

메이슨 마운트는 여전히 살아날 기미가 보이지 않는다.
맨체스터 유나이티드 소식을 전하는 '유나이티드 인 포커스'는 24일(한국시간) ""2년 전, 데클란 라이스는 마운트에 대해 '그는 내가 함께 뛴 선수 중 최고다'라고 극찬한 바 있다. 하지만 마운트는 여전히 맨유에서 최고의 모습을 보여주지 못하고 있다""라고 보도했다.

1999년생, 잉글랜드 국적의 미드필더 마운트는 첼시가 큰 기대를 품었던 차세대 중원 자원이다. 줄곧 첼시 아카데미에서만 성장해온 그는 SBV 피테서, 더비 카운티 임대를 통해 프로 경험을 쌓았고 2019-20시즌부터 본격적으로 첼시 1군에 합류하며 경쟁력을 드러냈다.

그러나 2022-23시즌을 기점으로 내리막을 걷는 중이다. 2020-21시즌과 2021-22시즌, 2년 연속 구단 '올해의 선수'로 선정된 그는 2022-23시즌에 접어들어 부상과 부진을 이어갔고 높은 주급으로 인해 '매각 1순위 자원'으로 등극했다. 결국 2023-24시즌을 앞두고 맨유로 이적, 유년기를 함께 해 온 첼시와의 동행을 마무리했다.

무려 5,500만 파운드(약 900억 원)의 이적료로 맨유에 입성한 마운트. 활약은 최악이다. 시즌 초반부터 부상을 당하며 자취를 감췄고 복귀 이후에도 영향력을 발휘하지 못하며 팬들의 비판을 받았다. 또한 11월 이후엔 완전한 벤치 자원으로 전락했고, 또다시 부상으로 쓰러지며 4달간 경기에 나서지 못했다. 2023-24시즌 최종 기록은 20경기 1골 1도움.

지난 시즌 역시 부상의 굴레를 벗어나지 못했다. 프리시즌부터 좋은 경기력을 보여줬으나 개막 2경기 만에 햄스트링 부상이 재발하며 한 달간 결장했고, 토트넘 홋스퍼와의 복귀전에서 머리 부상을 당하며 다시 쓰러졌다. 그리고 지난 12월, 맨체스터 시티와의 경기에서 시작 11분 만에 주저앉으며 또다시 팀을 이탈했다. 지난 시즌 기록은 26경기 3골.

올 시즌도 부활의 기미는 보이지 않는다. 현재까지 5경기에 출전했지만 공격포인트는 하나도 없다. 이에 매체는 ""맨유는 그가 첼시에서 보여줬던 자질을 더 보고 싶어 할 것이다""라고 보도했다.

사진=게티이미지"
20250925,"""2,186억 비르츠-1,225억 볼테마데, 돈의 광기일 뿐""…루메니게 뮌헨 전 의장, 리버풀·뉴캐슬에 직격탄","(베스트 일레븐)

카를 하인츠 루메니게 바이에른 뮌헨 전 의장이 리버풀과 뉴캐슬의 이적 시장 행보를 두고 쓴소리를 했다.

리버풀은 지난여름 이적 시장에서 바이엘 04 레버쿠젠에서 활약하던 플로리안 비르츠를 1억 1,600만 파운드(약 2,186억 원)를 지불하며 영입했고, 뉴캐슬 유나이티드는 닉 볼테마데를 6,500만 파운드(약 1,225억 원)을 쓰며 리버풀로 떠난 알렉산데르 이사크의 공백을 메웠다. 프리미어리그 이적 시장에서 독일 국가대표 선수들이 실로 '억소리'나는 금액으로 입성하는 사례가 속출했다.

이를 두고 루메니게 전 의장은 독일 매체 <빌트>와 인터뷰에서 비판을 가했다. 루메니게 전 의장은 ""솔직히 나는 여전히 플로리안 비르츠가 리버풀로 간 것이 안타깝다. 그는 바이에른 뮌헨에서 뛰는 것이 더 나았을 것이라고 생각한다"")고 말했다. 이어 ""볼테마데도 영입할 수 있엇다. 하지만 나는 물론이며 바이에른 뮌헨은 이러한 금전적 광기를 따라가는 건 현명하지 않다고 판단했다""라고 덧붙였다.



두 선수에 대한 욕심이 있었다는 점을 숨기지 않으면서도, 프리미어리그 클럽들의 막대한 이적료 지불 경향을 쫓아갈 이유가 없었다는 것을 강조한 것이다.

루메니게 전 의장은 ""우리는 스포츠적 성공을 원하지만, 반드시 진지하고 건전한 재정 운영 속에서 이뤄져야 한다는 점을 늘 강조해왔다""라며 ""우리는 훌륭한 팀을 보유하고 있다. 부상 중인 자말 무시알라, 알폰소 데이비스, 이토 히로키가 돌아온다면 더할 나위 없이 완벽한 전력이 될 것""이라고 자부심을 드러냈다.

한편 비르츠는 리버풀 이적 후 아직 공격 포인트를 올리지 못하고 있다. 이와 관련해 비르츠는 ""골이나 공격 포인트를 올렸다면 좋았을 것이지만, 나는 지금 침착하다. 그저 매번 더 잘하려고 노력할 뿐""이라며 차분히 다음 도전에 임하겠다는 의지를 보였다."
20250925,"韓 축구 역대급 사건! ""손흥민, 두 달 만에 메시 밀어내…"" LAFC 인터마이애미 '파워랭킹' 추월","▲ 손흥민이 레알 솔트레이크와 2연전 승리, 홈에서 1골 1도움 1기점 이후 포효하고 있다 ⓒLAFC


[스포티비뉴스=박대성 기자] 한국 축구의 간판스타 손흥민(33, LAFC)이 연일 미국 무대에서 '역사'를 만들고 있다. 불과 두 달 전 MLS에 입성했는데 단기간에 리그 판도를 흔들고 있다.

손흥민이 뛰고 있는 LAFC는 24일(한국시간) MLS 사무국이 발표한 2025시즌 35라운드 파워랭킹에서 6위에 올랐다. 직전 10위에서 무려 네 계단을 뛰어오른 결과다. 메시가 버티는 인터 마이애미는 7위로 밀려났다. 동부 최강이라 불리던 마이애미가 손흥민이 이끄는 LAFC에 순위에서 밀린 것이다.

파워랭킹은 각 팀의 최근 경기력, 흐름, 컨디션, 공격력 등을 종합적으로 반영해 산출된다. 순위가 높을수록 플레이오프와 우승 가능성이 크다는 의미다. 이번 발표에서 LAFC의 급부상은 '흥부 듀오' 손흥민과 드니 부앙가(30)의 합작품이다.

MLS 사무국은 LAFC의 공격력을 두고 ""최근 다섯 경기에서 14골을 기록했는데 모두 손흥민과 부앙가가 책임졌다""고 강조하면서 ""솔트레이크 원정에서 손흥민은 해트트릭을 기록했고, 홈 리턴 매치에서는 부앙가가 해트트릭을 터뜨렸다""며 두 선수의 파괴력을 집중 조명했다.
글로벌스포츠매체 'ESPN'은 ""최근 세 경기에서 LAFC의 12골은 전부 손흥민과 부앙가의 합작""이라고 분석했다. 현재 손흥민의 LAFC에서 활약상은 국제축구연맹(FIFA)까지 집중 조명하고 있다.

'흥부 듀오' 한 축인 부앙가는 올 시즌 리그 22득점에 도달하며 메시와 함께 득점 공동 선두에 올랐다. MLS 역사상 최초로 3시즌 연속 20골 이상을 기록한 선수로 이름을 남겼다. 또 이날 해트트릭으로 구단 통산 97골째를 기록, 카를로스 벨라를 넘어 LAFC 최다 득점자가 됐다.



손흥민도 만만치 않다. MLS 데뷔 두 달 만에 7경기에서 6골 3도움을 기록했다. 레알 솔트레이크 원정에서는 MLS 첫 해트트릭을 달성했고, 이어진 홈경기에서는 1골 2도움으로 부앙가의 해트트릭을 거들었다. 이로써 최근 3경기 연속 공격포인트를 기록하며 팀 상승세의 중심에 섰다.

메시 역시 최근 두 경기에서 3골 2도움으로 건재함을 과시했지만, MLS 사무국은 손흥민의 기여도를 더 높게 평가하고 있다. 이주의 팀에 꾸준히 손흥민을 올리고 있다. 실제 MLS 사무국도 ""손흥민의 영향력이 메시보다 크다""라고 인정했다. 결과적으로 마이애미가 7위, LAFC가 6위에 오른 것은 손흥민의 '리그 지배력'을 인정한 결과로 볼 수 있다.

손흥민의 MLS 적응 속도는 놀랍다. 독일 분데스리가 함부르크와 레버쿠젠, 잉글랜드 프리미어리그 토트넘에서 이미 톱 클래스 공격수로 활약했다. 10년 넘게 치열한 유럽 생활을 끝내고 미국으로 넘어와서도 똑같은 클래스를 증명하고 있다. MLS 수비가 상대적으로 허술하다는 평가가 있지만, 손흥민은 단순한 골잡이가 아니라 경기 흐름 전체를 바꾸는 플레이메이커다. 해결사와 조력자를 자유롭게 오가며 팀 공격의 중심축이 되고 있다.

토트넘 시절 해리 케인과 '손케 듀오'로 프리미어리그를 주름잡던 손흥민은 LAFC에서 부앙가와 '흥부 듀오'를 결성했다. 현지 언론들은 ""MLS 역사를 바꾸는 듀오""라 평한다. MLS 사무국도 ""손흥민과 부앙가 콤비가 MLS의 무게중심을 바꿔놓고 있다""며 극찬을 보냈다.

'흥부 듀오' 활약은 팀 성적으로 직결됐다. LAFC는 최근 3연승을 달리며 승점 50점 고지에 올랐다. MLS 서부 콘퍼런스 4위를 지켰고, 이미 MLS컵 플레이오프 진출을 확정했다. 이제 남은 목표는 가능한 높은 순위로 올라 홈 어드밴티지를 확보하는 것이다.



현재 LAFC 홈 구장 BMO 스타디움에는 손흥민의 유니폼을 입은 팬들이 급격히 늘어났고, LA 현지 교민들의 응원 열기도 뜨겁다. 손흥민은 경기 후 ""이곳에서 한국 팬들의 응원을 들으면 정말 미칠 것 같다""며 감격에 젖기도 했다. 토트넘 시절과 다름없이, 팀을 위해 뛰고 팬들에게 보답하는 손흥민의 프로페셔널리즘이 미국 팬들에게도 깊은 인상을 남기고 있다.

불과 두 달 전만 해도 MLS는 메시의 리그로 불렸다. 하지만 지금은 손흥민이라는 새로운 변수가 리그를 흔들고 있다. 메시와 어깨를 나란히 하며 건재한 톱 클래스 공격수 입지를 다지고 있고, 때로는 메시를 넘어서는 영향력을 보여주고 있다.

손흥민은 MLS 입성 첫해부터 강력한 발자취를 남기고 있다. 골, 도움, 화제성, 흥행까지 모두 잡았다. '흥부 듀오'와 함께하는 LAFC는 이제 플레이오프를 넘어 MLS컵 우승까지 노리고 있다. 한국 축구가 배출한 최고의 스타는 미국에서도 여전히 빛나고 있다."
20250925,"""난 손흥민 정말 싫었다!"" 이탈리아 레전드 월클 DF '충격 고백'…""SON 도대체 뭐 할지 예측 못했거든""","(엑스포츠뉴스 김환 기자) 과거 유벤투스에서 뛸 당시 '빗장수비' 이탈리아를 대표하는 월드클래스 센터백으로 명성을 떨쳤던 수비수 조르지오 키엘리니가 손흥민을 떠올리며 ""정말 상대하기 싫었다""고 고백해 눈길을 끈다.

손흥민보다 먼저 로스앤젤레스FC(LAFC)를 경험하기도 했던 키엘리니는 유벤투스 시절 손흥민을 상대하는 게 너무 까다로워서 그가 싫을 정도였다고 말했다. 그만큼 손흥민이 뛰어난 선수였다는, 사실상 손흥민을 향한 키엘리니의 극찬이었다.

키엘리니는 또 손흥민이 경기장 안에서뿐만 아니라 경기장 밖에서도 LAFC에 상당한 영향력을 끼치고 있다면서 손흥민 덕에 LAFC의 라커룸 분위기가 전반적으로 밝아진 것 같다고 했다. 미국 전역에서 주목하고 있는 '손흥민 효과'를 키엘리니도 확인한 것이다.

키엘리니는 24일(한국시간) 미국프로축구 메이저리그사커(MLS) 사무국의 공식 유튜브 채널에서 진행하는 프로그램 '디스 이즈 MLS'에서 최근 흐름이 좋은 LAFC, 그리고 그 중심에 있는 손흥민과 드니 부앙가 듀오에 대해 이야기했다.



그는 LAFC의 포스트시즌을 기대할 만하다는 패널의 이야기에 동의하면서 ""최근 부앙가의 활약과 함께 자신감과 분위기를 찾기 시작했다""며 ""이 특별한 듀오는 플레이오프에서 우리에게 상당한 희망을 줄 수 있을 것이다. 만약 미드필더와 수비가 균형을 잧는다면 이 둘은 MLS에서 '괴물 듀오'가 될 것""이라고 말했다.

키엘리니가 언급한 듀오는 당연하게도 손흥민과 부앙가를 지칭하는 것이었다.
키엘리니는 ""나는 언제나 손흥민을 상대하는 걸 싫어했다. 그가 무엇을 할지 예측하기 어렵기 때문""이라면서 ""그는 오른쪽, 왼쪽으로 갈 수 있고, 뒷공간으로 침투하는 것도 가능하고, 라인 사이에서 공을 연결하고 25m 밖에서도 슈팅을 할 수 있다. 정말 막기 힘든 선수""라며 혀를 내둘렀다.

키엘리니는 지난 2018년 유럽축구연맹(UEFA) 챔피언스리그에서 손흥민을 상대한 경험이 있다. 당시 키엘리니의 소속팀 유벤투스는 UEFA 챔피언스리그 16강 1차전에서 2-2로 비긴 뒤 2차전 원정 경기에서 전반전 손흥민에게 선제 실점을 허용했으나, 후반전 터진 파울로 디발라와 곤살로 이과인의 연속 득점에 힘입어 경기를 뒤집고 8강에 진출했다.



그러나 전성기에 있었던 손흥민의 존재감은 뚜렷했다. 선발 출전해 손흥민을 상대했고, 심지어 실점까지 허용했던 키엘리니가 손흥민을 기억하지 못하는 게 더 이상할 터다.

키엘리니는 한때 적으로 만났지만, 지금은 자신의 친정팀인 LAFC에 새로운 바람을 일으키고 있는 손흥민을 향해 칭찬을 아끼지 않았다.

그는 ""나는 지난 여름 투어 때부터 손흥민이 라커룸 분위기를 바꿀 수 있는 선수라고 생각해서 그렇게 말했다""며 ""LAFC는 롤러코스터 같은 시즌 초반을 보내면서 많은 승점을 잃었고, 팀에서 기쁨과 즐거움이 사라졌다. 그런데 손흥민이 다시 팀에 기쁨과 행복을 가져왔다. 팬들뿐만 아니라 라커룸 안에 모든 선수들에게 말이다. 세리머니를 할 때마다 이것을 느길 수 있다. 이 긍정적인 분위기는 손흥민이 가져온 것""이라고 말했다.

키엘리니는 끝으로 ""스티브 체룬돌로 감독은 이제 마지막 몇 달 만을 남겨놓고 있는데, 그가 시즌 말미에 트로피를 들어올릴 수 있길 모두가 바라고 있다""며 LAFC가 손흥민을 앞세워 우승을 차지하길 기대했다. 

사진=연합뉴스"
20250925,"'손흥민 후계자', 황당 헛발질+빅찬스미스…'호러쇼' 속출에도 토트넘 3-0 완승→카라바오컵 16강 진출","(엑스포츠뉴스 윤준석 기자) 토트넘 홋스퍼가 리그원(3부 리그) 팀을 상대로 무난한 승리를 거뒀다.

덴마크 국적 토마스 프랑크 감독이 이끄는 토트넘은 25일(한국시간) 영국 런던의 토트넘 홋스퍼 스타디움에서 열린 2025-2026시즌 카라바오컵 3라운드(32강)에서 동커스터 로버스를 상대로 3-0 완승을 챙기면서 4라운드(16강) 진출에 성공했다.

경기 초반 마티스 텔의 헛발질로 불안한 출발을 보인 토트넘은 이후 주앙 팔리냐의 환상적인 오버헤드킥을 시작으로, 상대 자책골과 브레넌 존슨의 쐐기골이 더해지면서 3점 차 무실점 승리를 기록했다.



이날 토트넘은 직전 브라이턴 앤드 호브 앨비언과의 리그 맞대결 (2-2 무승부)과 비교해 무려 7명의 선수를 교체했다.

토마스 프랑크 토트넘 감독은 4-3-3 포메이션을 선택했다. 안토니 킨스키가 골문을 지킨채, 제드 스펜스, 케빈 단소, 주앙 팔리냐, 페드로 포로가 백4를 구성했다. 중원에는 사비 시몬스, 로드리고 벤탕쿠르, 아치 그레이가 배치됐으며, 최전방 스리톱에는 윌슨 오보베르, 마티스 텔, 브레넌 존슨이 선발 출격했다. 

벤치에는 히샬리송, 미키 판더펜, 루카스 베리발 등 주전급 자원들이 대기했고, 구단 아카데미 출신인 루카 윌리엄스-바넷, 주나이 바이필드, 타이난 톰슨 등도 포함됐다.



전반 초반은 동커스터의 저항이 만만치 않았다. 경기 시작 1분 만에 왼쪽 윙어 글렌 미들턴이 박스 안에서 날린 슈팅을 포로가 몸을 던져 막아내며 토트넘이 먼저 위기를 맞았다.

이후 토트넘도 곧바로 반격에 나섰다. 전반 2분 시몬스가 이끄는 역습 상황에서 오도베르가 왼쪽을 파고든 뒤 낮은 크로스를 올렸고, 이를 텔이 마무리하려 했으나 슈팅이 허공을 향했다.

이어 3분 존슨의 빠른 돌파에 이은 정확한 크로스가 텔에게 연결됐지만, 텔은 또 다시 공을 제대로 맞추지 못하고 헛발질을 했다. '포스트 손흥민'으로 불리며 토트넘이 바이에른 뮌헨에서 임대료와 이적료 합쳐 1000억원 가까운 돈을 주고 데려온 텔은 가까운 거리에서 완전히 공을 놓치며 전반 3분 만에 절호의 기회를 두 번이나 놓쳤다.

토트넘의 답답한 흐름을 끊은 건 이날 센터백으로 출전한 팔리냐였다.
전반 14분 시몬스의 코너킥을 상대 골키퍼 이안 롤러가 불안하게 쳐냈고, 이어 세안 그리한의 불완전한 헤딩 클리어가 팔리냐 앞에 떨어졌다. 팔리냐는 이를 곧바로 환상적인 오버헤드킥으로 연결해 골망을 흔들었다. 

불과 3분 뒤 토트넘은 추가골을 얻었다. 오도베르가 왼쪽 측면에서 스피드를 활용해 수비수를 따돌린 뒤 낮게 올린 크로스가 그대로 맥그라스의 발을 맞고 자책골로 이어졌다. 전반 17분 만에 2-0으로 앞서 나가며 토트넘은 일찌감치 주도권을 잡았다.

하지만 동커스터도 쉽게 물러서지 않았다. 전반 39분 주장 오언 베일리가 페널티박스 안에서 감각적인 발리슛을 시도했고, 킨스키가 몸을 날려 손끝으로 쳐내며 토트넘이 간신히 실점 위기를 넘겼다.



후반 초반 동커스터는 공격 템포를 높이며 반격을 시도했다. 베일리의 중거리 슈팅이 나왔으나 킨스키 정면으로 향했고, 조 스바라가 활발히 움직이며 토트넘 수비진을 흔들었다.

토트넘은 후반 16분 시몬스와 오도베르를 빼고 히샬리송과 베리발을 투입하며 공격진 변화를 꾀했다. 그러나 기대와 달리 경기력이 살아나지 않았고, 특히 텔의 부진이 이어졌다.

후반 23분 존슨이 날카로운 크로스를 올려줬지만 텔은 또다시 슈팅 타이밍을 놓치며 기회를 무산시켰다. 이 장면 이후 홈 팬들의 탄식이 터져 나왔다.

동커스터는 후반 29분 미들턴의 프리킥이 골문 측면을 강타하며 잠시 환호를 불러일으켰지만, 끝내 골로 이어지지 않았다.

프랑크 감독은 후반 30분 스펜스를 빼고 데스티니 우도기를 투입하며 수비에 변화를 주었고, 후반 41분에는 경기 내내 이렇다 할 기회를 살리지 못한 텔을 교체 아웃시키며 16세 유망주 윌리엄스-바넷에게 데뷔전을 선물했다.

경기 종료 직전 토트넘은 한 차례 오프사이드 판정으로 골이 취소되었지만, 추가 시간 4분에 존슨이 마침내 득점에 성공했다. 베리발이 절묘한 침투 패스를 넣었고, 존슨이 침착하게 골키퍼를 넘기는 칩슛으로 마무리했다. 사실상 마지막 터치로 나온 이 골은 토트넘의 3-0 완승을 완성했다.



토트넘은 이날 승리로 카라바오컵 16강 진출을 확정지었다.

프랑크 감독은 로테이션 속에서도 팔리냐, 벤탄쿠르, 오도베르 등 주축을 기용하며 대회를 소홀히 하지 않겠다는 의지를 분명히 했다. 

하지만 리그 대부분의 경기에서 로테이션 자원으로 출전했던 텔은 오랜만에 선발 기회를 잡았지만, 이날 역시 최악의 활약을 펼쳤다.

올여름 그의 완전영입을 선택한 토트넘의 결정에 의문부호를 계속해서 남기고 있는 모습이다.

토트넘은 이제 28일 펼쳐지는 울버햄프턴 원더러스와와의 리그 맞대결 준비에 집중한다. 리그 3위에 위치해있지만, 지난 브라이턴전 무승부와 함께 경기력에 비판이 더해지고 있어 반드시 반등이 필요하다.

한편 3부 리그 소속팀 동커스터는 경기 내내 적극적인 자세로 맞섰으나 결정력 부족과 수비 실수로 고배를 마셨다. 최근 리그 투에서 리그 원까지 빠르게 승격하며 보여준 상승세를 감안할 때, 이번 경험은 그들에게 또 다른 자극제가 될 전망이다.

사진=토트넘 홋스퍼/연합뉴스"
20250925,"'흥부 듀오? 가소롭네' 천하의 손흥민-부앙가 콤비도 쉽지 않다...메시는 메시, 홀로 2골 넣으며 부앙가 추격 차단","[스포티비뉴스=장하준 기자] 천하의 '흥부 듀오'도 쉽지 않다. 따라가려 하니 금방 도망간다.

인터 마이애미는 25일(한국시간) 미국 뉴욕주 뉴욕의 시티 필드에서 열린 2025시즌 미국메이저리그사커(MLS) 19라운드 순연 경기에서 뉴욕 시티에 4-0 대승을 거뒀다.

이날 승리의 주역은 마이애미의 '에이스' 리오넬 메시였다. 마이애미는 전반 종료 직전 발타사르 로드리게스의 선제골로 앞서갔다. 이어 후반전에는 메시가 홀로 2골을 작렬했고, 후반 38분에는 루이스 수아레즈가 페널티킥 추가골을 넣었다.

이로써 메시는 이번 시즌 MLS 24골 고지를 밟으며 득점 단독 선두로 올라섰다. 단숨에 득점 2위 드니 부앙가(22골)와 격차를 2로 벌렸다.



최근 MLS의 득점왕 경쟁이 흥미롭다. 지난달 토트넘 홋스퍼를 떠나 로스앤젤레스(LA)FC로 이적한 손흥민이 득점왕 경쟁에 불을 붙였다. 시즌 도중에 합류한 그이기에 득점왕 경쟁에는 직접 참여할 수 없지만, 현재까지 7경기에 6골을 넣으며 좋은 퍼포먼스를 선보이는 중이다.

이번 시즌 득점왕 경쟁에는 손흥민 대신 그의 동료인 부앙가가 참여하고 있다. 부앙가는 손흥민이 합류하기 전까지 LAFC의 핵심 공격수로 활약하고 있었다. 그리고 손흥민이 합류한 뒤 어마어마한 득점력을 과시 중이다. 그는 최근 6경기에서 11골을 폭발했다.

동시에 손흥민과도 환상적인 호흡을 보인다. 두 선수는 서로에게 양질의 어시스트를 제공하며 LAFC를 이끄는 '흥부 듀오'로 탄생했다. 자연스레 손흥민의 합류로 날개를 단 부앙가는 득점왕을 노리고 있다. 그는 지난 22일 레알 솔트레이크전에서 해트트릭을 기록하며 메시와 득점 동률이 됐다.

하지만 메시는 역시 메시였다. 부앙가가 동률을 만들자마자 홀로 2골을 넣으며 달아났다. MLS에 큰 파장을 일으키고 있는 흥부 듀오라도, 메시라는 상대는 절대 만만하지 않다."
