date,title,content
20250910,"‘SON 영혼단짝’ 케인 “솔직히 토트넘 결정, 이해 안 간다” 다니엘 레비 회장 사임 소식 접한 후 밝힌 ‘솔직한 심정’","해리 케인(위), 손흥민(아래). 게티이미지



잉글랜드 국가대표 해리 케인. Getty Images코리아



과거 토트넘 홋스퍼에서 뛰어난 활약을 선보였던 해리 케인이 다니엘 레비 전 토트넘 회장의 사임 소식에 놀랐다고 말했다.

토트넘은 지난 5일(한국시간) 구단 공식 홈페이지를 통해 “레비는 약 25년 동안 토트넘 회장직 사임했다”고 공식 발표했다.

레비 회장은 “나는 경영진과 모든 직원과 함께 이뤄낸 일들을 매우 자랑스럽게 생각한다. 우리는 이 클럽을 세계 무대에서 최고 수준으로 경쟁하는 강팀으로 성장시켰다. 그보다 더 중요한 것은, 우리는 하나의 공동체를 만들어왔다는 점이다”라고 말했다.
그러면서 “나는 리리화이트 하우스와 홋스퍼 웨이에서 함께한 최고의 인재들로부터 수많은 선수와 감독들까지 이 스포츠에서 가장 훌륭한 사람들과 함께할 수 있었던 행운을 누렸다”라며 “나를 오랫동안 지지해 주신 모든 팬분께 감사의 말씀을 남긴다. 늘 순탄한 여정은 아니었지만, 우리는 의미 있는 진전을 이뤄냈다. 앞으로도 저는 이 클럽을 열정적으로 응원할 것이다”라고 토트넘 회장으로 마지막 인사를 남겼다.

케인은 레비 회장이 토트넘을 떠날 것이라 전혀 예상 못했다.

케인(좌), 레비(우). 토크 스포츠


스포츠 전문 매체 ‘스포츠 일러스트레이티드(SI)’에 따르면, 케인은 잉글랜드 대표팀 소집 후 레비 회장이 토트넘을 떠난 것에 대해 “솔직히 말하면 놀랐다. 예상치 못 했다. 전혀 예상 못했다”고 입을 열었다.

이어 “레비는 토트넘에서 약 20년 동안 훌륭한 회장이었다. 토트넘 과거의 위상과 지금 위치를 생각하면 큰 변화가 발생했다고 생각한다. 단순히 구단 내부뿐만 아니라 외적인 부분도 그렇다”며 “어느 시점에서든 구단에는 변화가 있게 마련이다. 특히 고위직에서는 변화가 일어나게 된다”고 주장했다.

또 케인은 “솔직히 왜 이런 일이 일어났는지 이유를 모르겠다. 내가 말할 수 있는 건 레비의 앞길에 행운이 따르길 바란다는 것”이라며 “우리는 함께한 시간 동안 분명히 관계를 쌓았다. 언젠가는 다시 만나게 될 것이라 확신한다. 토트넘은 이제 새로운 장이 열리기 시작했다”고 덧붙였다.

바이에른 뮌헨 해리 케인. Getty Images코리아



케인은 1993년생 잉글랜드 국적의 스트라이커다. 현재 잉글랜드 축구 국가대표팀 주장을 맡고 있다. 토트넘 홋스퍼 유소년 출신으로 토트넘과 잉글랜드 대표팀 역대 최다 득점자이며, 잉글리시 프리미어리그 역대 득점 2위에 올라있다.

케인은 토트넘 시절 손흥민과 함께 영혼의 단짝으로 불렸다. 둘은 프리미어리그에서 47골을 합작해 역사상 최고의 듀오가 됐다. 첼시에서 합을 맞춘 디디에 드로그바-프랭크 램파드(36골)보다 많은 득점을 만들었다. 둘이 넣은 47골 중 케인이 23골 손흥민이 24골로 득점 분포도 또한 완벽하다. 지난 2023년부터 토트넘을 떠나 현재 바이에른 뮌헨 소속 공격수로 있다.

한편, 토트넘은 레비 회장이 사임이라고 발표했지만, 해임으로 바라보는 의견이 지배적이다.

다니엘 레비 토트넘 회장. 게티이미지코리아



영국 공영방송 ‘BBC’는 “토트넘은 레비 회장이 사임했다고 발표했다. 그러나 이 결정은 이미 레비의 손을 떠나있었다”고 보도했다.

높은 공신력을 자랑하는 글로벌 매체 ‘디 애슬레틱’은 “레비 회장을 데려왔던 루이스 가문과 가까운 소식통에 따르면 루이스 가문은 여러 세대에 걸쳐 토트넘을 응원했다. 그래서 팬들이 원하는 것을 잘 알고 있다”며 “더 많은 승리를 안겨주는 것이다. 최근 변화를 주고 새로운 리더십과 접근법이 나타난 이유다. 루이스 가문은 벤카테샴 CEO, 토마스 프랑크 감독, 채링턴 비상임 회장 체제가 이 목표를 달성할 적임자들이라 보고 있다”고 설명했다.

용환주 기자 dndhkr159@kyunghyang.com"
20250910,"""흥민이형 사랑해요"" SON 세상에서 제일 존경하는 '팀 득점 1위', 토트넘 벤치→친정팀 깜짝 복귀? ""前 스승 포스테코글루가 원할 것""","사진=브레넌 존슨 SNS 캡처
로이터연합뉴스
[스포츠조선 이현석 기자]'손흥민바라기' 브레넌 존슨이 토트넘을 떠나게 될까.

영국의 TBR풋볼은 9일(한국시각) '엔제 포스테코글루는 토트넘의 스타를 노팅엄 포레스트로 영입하길 원할 것이다'라고 보도했다.

지난 시즌 토트넘에 유로파리그 우승 트로피를 안겼지만, 아쉽게도 리그 17위라는 처참한 성적으로 팀을 떠나야 했던 포스테코글루. 불과 몇 달 만에 그는 잉글랜드 프리미어리그(EPL)로 돌아왔다. 노팅엄의 감독으로 부임하며 잉글랜드 무대에 다시 발을 들였다.

로이터연합뉴스
긴 시간이 걸리지 않은 감독직 복귀는 상황이 맞아 떨어졌다. 노팅엄은 구단주 마리나키스와 누누 에스피리투 산투 감독이 갈등을 겪었다. 누누는 2024~2025시즌 노팅엄을 이끌며 유럽대항전 진출까지 성공했으나, 상황은 달라지지 않았고, 결국 3경기 만에 팀을 떠났다. 마리나키스 구단주는 평소 포스테코글루와 친분이 두터운 것으로 알려졌다. 곧바로 포스테코글루와 협상에 돌입하며 감독 선임에 성공했다.

새롭게 노팅엄에 부임한 포스테코글루가 노팅엄을 어떻게 탈바꿈할 것인지에도 관심이 쏠렸다. 일부 토트넘 팬들은 ""확실히 공격은 해줄 것""이라며 기대감을 가져도 좋다는 메시지를 전하기도 했다. 다만 지난 시즌 리그에서 보여준 약점도 확실히 있기에, 포스테코글루의 입맛에 맞는 선수단 구성이 중요할 수밖에 없다.

이 과정에서 존슨의 이름이 떠올랐다. 지난 2023년 여름 토트넘 유니폼을 입은 존슨은 당시 노팅엄을 떠나 포스테코글루의 구애를 받으며 북런던으로 향했다. 이적 첫 시즌 5골에 그치며 아쉬웠던 존슨은 지난 시즌은 반등한 모습을 선보였다. 51경기에서 18골4도움으로 손흥민을 제치고 팀 내 득점 1위에 올랐다. 올 시즌도 리그 3경기에서 2골로 토트넘 팀 내에서 가장 많은 득점을 기록 중이다. 올여름에는 손흥민과의 이별을 앞두고 득점 후 '찰칵' 세리머니로 애정을 과시하는 등 손흥민과 좋은 케미도 보여줬다.

로이터연합뉴스
다만 존슨의 현재 입지는 위태롭다. 모하메드 쿠두스의 영입으로 일단 오른쪽 윙어 주전 자리를 뺏기고 왼쪽으로 자리를 옮겼다. 다만 해당 포지션에도 사비 시몬스, 랑달 콜로 무아니 등을 데려오며 향후 입지가 흔들릴 수 있는 상황이다.

이런 상황에서 포스테코글루의 구애 가능성이 등장했다. TBR풋볼은 '포스테코글루는 노팅엄에 도착했다. 그가 존슨을 노리더라도 놀랄 일이 아니다. 포스테코글루는 존슨을 노팅엄으로 데려오고 싶어 할 것이다. 존슨은 인상적인 득점수에도 불구하고 활약에 물음표가 달렸고, 토트넘에서의 미래가 불확실하다'라고 설명했다.

토트넘 출신 포스테코글루 제자들의 노팅엄 이적이 이뤄질 수 있을까. 겨울 이적시장에 큰 관심을 받게 될 것은 분명해 보인다."
20250910,"""한국인 형제여, 이제 넌 멕시코인이야"" 墨, '韓사랑' 대박! ""손흥민 향한 존경""→2018 WC부터 이어진 인연 ""특별한 형제애 계속될 것""","[SPORTALKOREA] 김경태 기자= 2018 국제축구연맹(FIFA) 러시아 월드컵 때부터 이어져 온 대한민국-멕시코와 특별한 인연은 여전히 유효한 것으로 보인다. 

멕시코 매체 '에스타디오'는 10일(한국시간) 미국 테네시주 내슈빌에 위치한 지오디스 파크에서 열리는 대한민국과 멕시코 대표팀간의 경기를 두고 앞서 두 국가의 접점에 대해 설명했다. 



특히 매체는 2018 러시아 월드컵 때를 조명하며 ""'한국인 형제여, 이제 넌 멕시코인이야!(¡Coreano, hermano, ya eres mexicano!)'라는 외침은 러시아 2018 월드컵을 통해 멕시코와 한국을 하나로 묶은 상징적인 순간이었다""고 전했다.

이어 ""단순한 승리의 환호를 넘어 두 나라 팬들의 열정, 존중, 그리고 잊을 수 없는 추억들이 어우러져 탄생한 특별한 형제애였다""고 덧붙였다.

2018 러시아 월드컵 당시 대한민국은 멕시코, 독일, 스웨덴과 F조였다. 

스웨덴을 제외하고 세 국가 모두 탈락 위기에 처해있었다. 특히 멕시코는 2승을 챙기고도 3차전에서 스웨덴에 0-3으로 대패하며 벼랑 끝으로 몰렸다. 만약 같은 시간 열린 경기에서 독일이 한국을 꺾는다면 멕시코는 그대로 탈락이었다.



대한민국도 급한 것은 마찬가지였다. 스웨덴과 멕시코에 2연패 하며 탈락을 목전에 두게 됐고, 반드시 마지막 경기에서 '디펜딩 챔피언' 독일 꺾어야만 했다.

기적이 벌어졌다. 대한민국이 후반 추가시간에만 두 골을 몰아서 넣으며 2-0 승리를 거둔 것이다. 독일의 탈락과 동시에 멕시코는 극적으로 16강에 진출할 수 있었다. 

이에 당시 멕시코 국민들은 대사관까지 찾아와 노래를 부르고, 깃발을 흔들며 감사를 표하기도 했다. 매체는 당시 상황을 두고 ""이는 멕시코와 한국 축구사에서 잊지 못할 순간으로 남았다""고 짚었다.



또한 매체는 두 나라의 축구교류 역사를 주목하며 ""멕시코와 한국은 미국-멕시코처럼 치열한 라이벌 관계는 아니지만, 오히려 협력과 존중으로 관계를 이어왔다. 멕시코축구연맹(FMF)와 대한축구협회(KFA)는 여러 차례 친선전과 청소년 대회를 통해 교류했고, 1986 FIFA 멕시코 월드컵 당시 한국이 경험한 뜨거운 환영은 이후 관계의 씨앗됐다""고 강조했다.

그러면서 ""리가 MX에서 활약한 선수들, 그리고 한국의 스타 손흥민을 향한 멕시코 팬들의 존경은 두 나라를 가깝게 만드는 또 다른 요인이었다""고 설명했다.



흥미로운 사례도 소개됐다. 매체는 ""러시아 월드컵 당시 멕시코 술집에서는 김치가 제공됐고, 한국에서는 타코가 인기를 끌며 문화를 잇는 다리 역할을 했다. 손흥민은 독일전 득점으로 멕시코 팬들의 형제로 자리매김했다. 최근 친선전에서는 멕시코 마리아치 밴드가 아시아에서 연주했고, 멕시코 아즈테카 스타디움에는 K-POP이 울려 퍼졌다""고 전했다.

끝으로 매체는 ""'한국인 형제여, 이제 넌 멕시코인이야!'라는 구호는 단순한 해프닝이 아니다. 축구가 대륙과 문화를 넘어 사람들을 하나로 묶는 힘을 보여주는 증거다. 멕시코가 2026 월드컵 공동 개최국으로 나서고, 한국이 새로운 역사를 쓰려는 지금, 이 특별한 형제애는 앞으로도 계속될 것""이라고 전망했다.

사진=에스타디오, 게티이미지코리아

취재문의 sportal@sportalkorea.co.kr"
20250910,'손흥민 단기 영입할까? 우승할 수 있는데' 오피셜 '공식발표' 떴다! 3개월 만에 EPL 전격 복귀…포스테코글루 노팅엄 사령탑 부임 확정 '35년 무관 깰까',"[스포티비뉴스=박대성 기자] 엔지 포스테코글루 감독이 프리미어리그에 돌아왔다. 토트넘에서 역사를 만들고 경질된 뒤 3개월 만에 일이다. 이제 35년째 메이저 대회 무관에 시달리는 노팅엄의 새 희망이 됐다.

10일(한국시간) 영국 공영방송 'BBC'에 따르면, 노팅엄은 구단 공식 채널을 통해 누누 에스피리투 산투 감독의 경질과 포스테코글루 감독 선임을 동시에 발표했다. 경질 발표가 나온 지 13시간 만의 신속한 인선이었다. 21개월간 팀을 지휘하며 유럽 무대까지 이끌었던 산투 체제는 막을 내리고, 팀은 새로운 전환점을 맞이했다.

노팅엄은 구단 성명에서 ""포스테코글루 감독은 25년 이상의 풍부한 지도자 경력을 보유하고 있으며, 호주 A리그, 일본 J리그, 스코틀랜드 프리미어십, 프리미어리그에서 우승을 경험한 검증된 지도자""라고 소개했다. 구단주 에반젤로스 마리나키스는 ""최고 수준에서 성공을 경험한 감독과 함께 특별한 무언가를 만들고자 한다""며 강한 기대를 드러냈다.
BBC에 따르면 이번 감독 교체의 직접적인 배경은 산투 감독과 구단주의 관계 악화였다. 여름 이적 시장에서 1억 8000만 파운드(약 3383억 원)를 투자했지만 영입 속도가 더뎌 전력 구성이 늦어졌고, 산투 감독은 이를 공개적으로 불만 표출했다. 크리스탈 팰리스전(1-1 무) 전 인터뷰에서 ""내 입지가 흔들리고 있다면, 연기가 나는 곳에 불이 있는 법""이라는 발언을 남기며 구단과의 신뢰 균열을 드러냈다.

이 같은 발언은 결국 '불필요한 잡음'으로 해석됐고, 3-0 완패를 당한 웨스트햄전 직후 경질로 이어졌다. 산투는 강등권 탈출과 유럽 대항전 진출이라는 업적을 세우며 18개월간 완벽에 가까운 관계를 유지했지만, 신뢰가 무너지자 관계 회복은 어려웠다.

▲ bestof topix


BBC는 포스테코글루가 지난 7월 그리스 슈퍼리그 시상식에서 마리나키스 구단주로부터 '유럽대항전 우승을 차지한 최초의 그리스 혈통 감독' 특별상을 받은 사실을 주목했다. 마리나키스는 당시 ""그는 오랜 무관에 시달리던 팀을 정상에 올려놓았다. 그리스인의 자부심을 높여준 지도자""라며 극찬을 아끼지 않았다.

포스테코글루는 토트넘 부임 첫해 리그 5위를 기록하며 유럽 무대 진출권을 확보했고, 2년 차에는 맨체스터 유나이티드를 꺾고 UEFA 유로파리그 우승을 차지해 17년 무관을 끊었다. 그러나 리그에서는 17위라는 최악의 성적으로 경질됐다.

'가디언'은 ""포스테코글루의 임무는 결코 쉽지 않다""고 경고했다. 누누는 선수단과 강한 유대감을 형성했고, 그 침착함은 구단에 드문 안정감을 제공했다. 포스테코글루는 이 결속력을 무너뜨리지 않으면서도 자신만의 공격 철학을 녹여내야 한다.

노팅엄은 이번 여름 이적 시장에서 오마리 허친슨, 제임스 맥카티, 아르노 칼리무엥도 등을 영입하며 공격을 강화했다. 기존 주축인 모건 깁스-화이트, 엘리엇 앤더슨, 20골 스트라이커 크리스 우드까지 보유해 전력은 상당히 탄탄하다. 그러나 포스테코글루의 전술 스타일(전방 압박, 점유율 축구)은 누누의 카운터 어택 중심 전술과는 큰 차이가 있어 적응 기간이 필요할 전망이다.



BBC는 ""대표팀 차출 중이던 선수들도 감독 교체 소식에 놀랐다""고 전했다. 누누는 선수들이 미디어 일정 후에도 남아 유대감을 다질 만큼 친밀한 분위기를 만들었기에, 일부는 이별에 아쉬움을 표했다. 그러나 동시에 포스테코글루의 새로운 철학에 대한 호기심도 존재한다.

전 셀틱 공격수 크리스 서튼은 ""포스테코글루는 토트넘 데뷔 시즌에 상위권에서 경쟁할 수 있는 팀으로 끌어올렸고 두 번째 시즌에 트로피를 안겼다. 호주, 일본, 스코틀랜드에서 이룬 우승 경험을 결코 과소평가해서는 안 된다""고 말했다.

포스테코글루의 첫 경기는 라이벌 아스널과의 원정 경기다. 이후 4경기 연속 원정 일정을 소화한 뒤 9월 27일 선덜랜드전에서 홈 데뷔전을 치른다. 일정은 험난하지만, BBC는 ""그는 셀틱과 토트넘에서 초반부터 팀을 변화시킨 전례가 있다""며 빠른 적응을 기대했다.

노팅엄은 1990년 리그컵 이후 메이저 대회 우승이 없다. 토트넘의 17년 무관을 끊었던 포스테코글루가 이번엔 35년 무관을 끝낼 수 있을지 지켜봐야 한다. 손흥민과 함께 쌓았던 '트로피 DNA'가 노팅엄에도 통할 수 있을지 주목된다.

▲ bestof topix"
20250910,"日 ""공세 간신히 버텼다, 무기력한 패배"" 한숨, 미국전 0-2 패배에 현지 비판 목소리","[스타뉴스 | 김명석 기자]
10일(한국시간) 미국 콜럼버스의 로우어닷컴필드에서 열린 A매치 친선경기 미국과 일본의 경기 모습. /AFPBBNews=뉴스1
10일(한국시간) 미국 콜럼버스의 로우어닷컴필드에서 열린 A매치 친선경기 미국과 일본의 경기 모습. /AFPBBNews=뉴스1
일본 축구대표팀이 미국에 0-2로 완패하자 현지 매체들도 비판 목소리를 내고 있다. 지난 멕시코전에 이어 2경기 연속 무득점 무승인 데다, 선발 전원을 바꾼 파격적인 선택도 결과적으로 아무런 소득도 얻지 못했다는 것이다.

모리야스 하지메 감독이 이끄는 일본은 10일 오전 8시 37분(한국시간) 미국 콜럼버스의 로우어닷컴 필드에서 열린 A매치 친선경기에서 미국에 0-2로 졌다. 피파랭킹은 일본이 17위, 미국은 15위다.

앞서 멕시코와 평가전에서도 무득점에 그쳤던 일본은 미국전 0-2 패배를 더해 미국 원정 평가전을 1무 1패, 무득점으로 마쳤다. 미국이 앞서 한국에 0-2로 완패를 당했던 팀이라는 점에서 무기력했던 이날 패배는 더욱 큰 충격으로 다가온 모양새다.

이날 일본은 지난 멕시코전과 비교해 선발 전원을 모두 바꿨다. 구보 다케후사(레알 소시에다드), 미토마 가오루(브라이턴 앤 호브 알비온) 등이 대거 빠지고 오가와 고키(네이메헌), 이토 준야(헹크) 등이 선발로 나섰다. 1986년생 베테랑 나가토모 유토(FC도쿄)도 주장 완장을 차고 그라운드에 나섰다.

10일(한국시간) 미국 콜럼버스의 로우어닷컴필드에서 열린 A매치 친선경기 미국과 일본의 경기 모습. /AFPBBNews=뉴스1
다만 일본은 전·후반 각각 1골씩 허용한 끝에 미국에 0-2로 졌다. 후반 주축 선수들이 교체로 투입된 뒤에도 공격 흐름이 번번이 끊겼다. 오사코 게이스케(산프레체 히로시마) 골키퍼의 선방이 아니었다면 격차가 더 벌어질 수도 있었던 경기였다.

경기 후 현지 매체들의 비판이 이어졌다. 일본 데일리스포츠는 ""선발 전원을 교체했지만 미국에 힘으로 밀렸다. 경기 내내 사소한 실수가 눈에 띄었고, 결정적인 찬스는 적었다""며 ""후반 막판 상대 공세에 시달렸다. 오사코 골키퍼의 선방 덕분에 간신히 버텼다. 완패라고 할 만한 경기 내용이었다""고 비판했다.

니칸스포츠도 ""무기력한 패배였다""면서 ""한 방을 날리고 싶었으나 공격을 마무리하지 못하는 답답한 전개가 이어졌다. 멕시코전에 이어 2경기 연속 무득점 경기에 그쳤다""고 꼬집었고, 스포니치아넥스는 ""미국전 0-2 패배로 원정 평가전 1무 1패에 그치면서, 월드컵 본선을 앞둔 일본 대표팀은 산적한 과제만 확인하게 됐다""고 덧붙였다.

미국이 앞서 한국에 0-2로 패배한 팀이라는 점을 강조하는 매체도 있었다. 축구 매체 풋볼채널은 ""일본이 한국에 패했던 미국에 0-2로 완패했다""고 전하면서 ""선발 멤버를 전원 교체하고도 완패를 당해 수확이 전혀 없었다. 미국의 압박에 시달리며 빌드업이 정체되는 시간이 이어졌다""고 비판했다.

10일(한국시간) 미국 콜럼버스의 로우어닷컴 필드에서 열린 A매치 친선경기 일본전에서 선제골을 넣은 알렉스 젠데하스. /AFPBBNews=뉴스1"
