date,title,content
20251128,‘항명 논란’ 오피셜 ‘공식 성명’→레알 마드리드 ‘핵심 MF’→“우리가 반항? 그 어느 때보다 단합력 최고” 정면 반박,"레알 마드리드의 페데리코 발베르데. 파브리지오 로마노 SNS


레알 마드리드 소속 미드필더 페데리코 발베르데가 자신을 둘러싼 논란에 직접 입을 열었다.

최근 레알 마드리드 내부 분위기가 흔들리고 있다. 높은 공신력을 자랑하는 글로벌 매체 ‘디 애슬레틱’은 지난달 “최근 몇 주 동안 알론소와 일부 레알 마드리드 선수들의 갈등이 점차 심해지고 있다. 여러 1군 선수들은 알론소의 선수 관리 방식과 새로운 변화들에 불만을 느끼고 있다”고 보도했다.

그리고 영국 매체 ‘기브미스포츠’는 지난 26일(한국시간) “주드 벨링엄을 포함한 7명의 레알 마드리드 선수들이 사비 알론소 감독 아래에서 행복하지 않다고 한다”고 밝혔다. 매체에 따르면 벨링엄을 포함 7명의 선수는 비니시우스 주니어, 호드리구, 엔드릭, 발베르데, 브라힘 디아스, 페를랑 멘디로 알려졌다.

비니시우스(좌), 사비 알론소 감독. 게티이미지코리아


레알 마드리드 미드필더 페데리코 발베르데. Getty Images 코리아



발베르데가 명단에 이름을 올렸다. 그는 원래 중원에서 활약하는 선수다. 특히 슈팅 능력이 좋아 경기 판도를 바꾸는 벼락 같은 중거리 슈팅은 많은 축구 팬에게 짜릿함을 느끼게 해줬다.

하지만, 알론소가 레알 마드리드 감독으로 부임 후 공격이 아니라 3선 밑에서 수비 역할에 집중하고 있다. 그래서 팬들 사이 발베르데는 본인이 맡는 역할에 불만이 있는 것 같다는 이야기가 나왔다.

해당 논란에 발베르데가 공식 입장을 전했다. 유럽 축구 이적시장 전문가 파브리지오 로마노는 27일 자신의 사회관계망서비스(SNS)를 통해 발베르데의 성명문을 전했다.

발베르데. 파브리지오 로마노 SNS


발베르데는 “우리 관련해서 많은 말들이 나온 한 주였다. 지금 우리는 보시다시피 그 어느 때보다 더 단단하게 하나로 뭉쳐 있다”고 입을 열었다.

이어 “비니시우스와 킬리안 음바페 같은 선수들이 팀에 있다는 건 큰 행운이다. 또 세계 최고의 팀이자 헌신적인 구단과 함께한다는 건 정말 큰 영광이다”라며 “개인적으로 내 최고의 경기력을 되찾기 위해노력하고 있다”고 설명했다.

마지막으로 “알론소 감독은 항상 내 옆에서 나를 지지해준다. 내가 계속 성장해 팀에 도움이 될 수 있도록 모든 걸 해주고 있다. 코칭스태프와 모든 선수들은 그 어느 때보다 더 단합해 있다”고 확실히 말했다.

용환주 기자 dndhkr159@kyunghyang.com"
20251128,한국인 윙어 왜 선발 출전했나…현지 비난에 득점으로 반박 '셀틱에서 최고의 경기 펼쳤다',"양현준/게티이미지코리아
양현준/게티이미지코리아

[마이데일리 = 김종국 기자] 양현준의 페예노르트전 활약이 긍정적인 평가를 받았다.

셀틱은 28일 오전(한국시간) 네덜란드 로테르담에 위치한 스타디온 페예노르트 더카위프에서 열린 2025-26시즌 유럽축구연맹(UEFA) 유로파리그 페이즈 5차전에서 페예노르트에 3-1로 이겼다. 양현준은 페예노르트 원정에서 선발 출전해 동점골을 터트려 역전승 주역으로 활약했다. 양현준은 지난 9월 열린 스코틀랜드 리그컵 이후 2개월 만에 득점포를 가동하며 시즌 2호골을 기록했다.

양현준은 UEFA 클럽 대항전에서 자신의 첫 득점에 성공하며 맹활약을 펼쳤다. 양현준의 활약과 함께 승리를 거둔 셀틱은 2승1무2패(승점 7점)의 성적으로 UEFA 유로파리그 페이즈 21위를 기록하게 됐다. 페예노르트는 1승4패(승점 3점)의 성적으로 30위에 머물게 됐다.

셀틱은 '네덜란드 원정에서 마지막 승리를 거둔 것은 지난 2001년 8월 아약스전이 마지막이었다. UEFA 클럽대항전 원정 경기에서 승리를 거둔 것은 2021년 페렌체바로시전 이후 처음'이라며 '양현준은 일대일 상황에서 자신감을 되찾았고 수비수들을 따돌리고 득점하는 등 좋은 활약을 펼쳤다'고 조명했다.
셀틱은 페예노르트를 상대로 마에다가 공격수로 나섰고 양현준, 하타테, 맥코완이 공격을 이끌었다. 맥그리거와 엥겔스는 중원을 구성했고 티어니, 스케일스, 트러스티, 도노반이 수비를 맡았다. 골문은 슈마이헬이 지켰다.

양팀의 맞대결에서 페예노르트는 전반 11분 우에다가 페널티에어리어 왼쪽을 침투해 왼발 대각선 슈팅으로 선제골을 터트렸다.

반격에 나선 셀틱은 전반 30분 양현준이 동점골을 기록했다. 양현준은 하타테가 골문앞으로 띄운 볼을 문전 쇄도하며 슈팅으로 마무리해 페예노르트 골망을 흔들었다.

이후 셀틱은 전반 43분 하타테의 득점으로 승부를 뒤집었다. 하타테는 페널티에어리어 정면에서 오른발 슈팅으로 페예노르트 골문을 갈랐다. 전반전을 앞서며 마친 셀틱은 후반 37분 뉘그렌의 득점으로 승부에 쐐기를 박았고 셀틱의 승리로 경기가 종료됐다.

영국 매체 67헤일은 '셀틱은 이상한 선발 명단으로 페예노르트전에 임했다. 양현준과 맥코완이 선발 명단에 포함된 반면 발리퀴샤와 투넥티 모두 벤치에 있었다. 양현준이 발리퀴샤를 대신해 선발 명단에 포함된 것은 예상치 못한 일이었다'고 언급했다.

영국 스코츠맨은 양현준의 페예노르트전 활약에 대해 '깜짝 선발 출전이었지만 셀틱에서 보여준 자신의 최고 활약으로 선발 출전에 대한 정당성을 입증했다. 동점골을 훌륭하게 마무리했고 왼쪽 윙에서 맹활약을 펼쳤다'며 긍정적으로 평가했다. 영국 스코티시선 역시 '양현준은 보기 드문 선발 출전 기회를 얻어 발리슛으로 멋진 골을 넣었다. 양현준은 자신감을 되찾았고 셀틱에서 자신의 최고의 경기 중 하나를 펼쳤다'는 뜻을 나타냈다.
양현준/게티이미지코리아
양현준/게티이미지코리아"
20251128,"맨체스터 유나이티드, '세계 최고 윙어'에게 관심 크다…""2370억이면 영입 가능""","사진=게티이미지


[포포투=김재연]

맨체스터 유나이티드가 마이클 올리세에게 관심을 보이고 있다.

영국 '커트 오프사이드'는 27일(한국시간) ""맨유는 올리세를 면밀히 지켜보고 있다. 아스널 역시 마찬가지이며 리버풀도 이 경쟁에 합류했다. 1억 4,000만 유로(약 2,372억 원) 정도의 이적료를 지불한다면 그가 바이에른 뮌헨을 떠날 수도 있다""라고 보도했다.

올리세는 2001년생 프랑스 국적의 윙어다. 스트라이커를 제외한 공격진 전 포지션을 소화할 수 있다. 정확한 왼발 킥과 뛰어난 드리블 돌파 기술 및 플레이메이킹 능력을 갖춘 '완성형 선수'다. 현 시점 최고의 오른쪽 윙어로 평가해도 손색이 없다.

그는 레딩 유스를 거쳐 1군 무대에 데뷔한 그는 크리스탈 팰리스에서 재능을 만개했다. 첫 시즌부터 31경기 4골 8도움으로 준수한 활약을 펼쳤다. 팰리스에서의 세 시즌 기록은 90경기 16골 25도움.

사진=게티이미지


2023년 여름 첼시 이적을 눈앞에 뒀었지만 '불법 접촉 논란'으로 거래가 무산되면서 잔류했다. 이후 2024-25시즌을 앞두고 4,500만 파운드(약 870억 원)의 이적료를 기록하면서 '독일 명문' 바이에른 뮌헨에 입단했다.

독일 무대에서도 올리세의 활약은 빛났다. 데뷔 시즌이었던 지난 시즌부터 50경기 17골 18도움을 기록하면서 맹활약했다. 이번 시즌 역시 해리 케인, 루이스 디아스와 함께 팀 공격을 이끌고 있다. 현재까지의 기록은 19경기 9골 8도움. 뮌헨의 확실한 '에이스'로 활약 중이다.

한편 맨유는 지난 여름 이적시장에서 벤자민 세스코, 브라이언 음뵈모, 마테우스 쿠냐 영입에 2억 파운드(약 3,870억 원) 가량을 지출했다. 그러나 음뵈모를 제외하면 활약상이 미미하다. 세스코와 쿠냐를 합쳐서 3골 1도움을 기록하고 있다. 게다가 부상까지 겹치는 중이다. 결국 맨유가 공격진 보강을 위해 다시 한번 지갑을 열 가능성이 높아졌다. 과연 맨유가 리버풀, 아스널과의 경쟁에서 승리하면서 올리세를 영입할 수 있을지 이목이 집중된다."
20251128,"‘英 단독!’ 맨유 넘어 ‘EPL 최다 우승’ 꿈꾸는 리버풀, 슬롯 감독 ‘경질 X’→“구단 고위층, 패배해도 감독 신뢰, 지휘권 보장”","아르네 슬롯 신임 리버풀 감독. 리버풀 SNS


리버풀이 매우 부진한 상황에도 결국 감독 교체 없이 시즌을 진행할 것으로 전망된다.

영국 매체 ‘데일리메일’은 27일(한국시간) “아르네 슬롯 리버풀 감독은 지금 엄청난 압박을 받고 있다. 그래도 리버풀 고위층은 그를 신뢰하고 있는 것으로 보인다”고 단독 보도했다.

매체에 따르면 구단 관계자들은 “슬롯 감독의 직위는 안전하다. 최근 PSV 아인트호벤과 경기에서 패배했지만, 구단 입장은 변함없다”고 밝혔다.

최근 리버풀 팬들은 축구를 보는 맛이 없다. 지난 22일 기준, 리버풀은 최근 10경기에서 7번 패배했다. 리그 한정으로 비교하면 더 심각하다. 6경기 1승 5패를 기록했다. 노팅엄은 최근 리그 6경기에서 1승 1무 4패로 오히려 리버풀보다 좋은 성적을 기록했다.

그리고 23일 홈구장 안필드에서 리그 19위 강등권에 있는 노팅엄 포레스트와 맞대결을 펼쳤다. 아무리 리버풀이 부진해도 지난 시즌 프리미어리그 우승 팀인 만큼, 강등권 팀에게 홈에서 승리할 것으로 많은 기대를 모았다.

리버풀 신임 감독으로 선임된 아르네 슬롯. 게티이미지코리아



아르네 슬롯 리버풀 감독이 경기를 지켜보고 있다. Getty Images



하지만, 결과는 처참했다. 0-3으로 완패했다. 리버풀은 리그 12위까지 추락했다. 그리고 지난 27일 이번에는 유럽축구연맹(UEFA) 챔피언스리그에서 PSV에 1-4로 무너졌다. 이번에도 안필드에서 열린 경기였다. 그러나 홈에서 2경기 연속 3점 차로 크게 패배했다.

최악의 부진이다. 수많은 리버풀 팬이 분노하기 시작했다. 이번 시즌 누구보다 프리미어리그 우승을 기대했다. 올 시즌이 시작하기 전에 국제스포츠연구센터(CIES)가 발표한 내용에 따르면 이번 시즌 리버풀이 다시 리그 우승컵을 들어 올릴 확률이 28.9%로 가장 높았다.

이번 시즌 리그 우승 정말 중요하다. 리버풀은 현재 퍼스트 디비전, 프리미어리그 포함 영국 축구 1부리그 우승을 20회 해냈다. 이는 맨체스터 유나이티드와 함께 공동 최다 우승이다.

아르네 슬롯 리버풀 감독. 게티이미지


만약 이번 시즌 리버풀이 다시 프리미어리그 우승컵을 들어 올리면, ‘단독’ 최다 우승 팀으로 우뚝 올라선다. 당연히 영국 축구 역사상 최초의 21회 1부 리그 우승 팀이라는 칭호까지 함께 따라온다. 리버풀은 이번 시즌 누구보다 우승이 간절하다.

하지만, 상황은 정반대다. 약 29%로 우승 후보로 평가받던 리버풀은 현재 리그 12위를 기록하고 있다. 그리고 영국 현지 정보에 따르면 슬롯 감독이 계속 지휘봉을 잡을 것으로 전망된다.

용환주 기자 dndhkr159@kyunghyang.com"
20251128,"""손흥민이 토트넘 돌아온다"" SON, 12월 복귀 확정…""작별인사 하고 싶어"" 끝내 이뤄진다, 리버풀전 행사 준비","(엑스포츠뉴스 김환 기자) 토트넘 홋스퍼의 현지 팬들에게 작별인사조차 하지 못하고 갑작스럽게 팀을 떠났던 손흥민이 다시 토트넘으로 돌아온다.

보도에 따르면 토트넘 구단은 내달 열리는 리버풀과의 잉글리시 프리미어리그(EPL) 경기 일정에 맞춰 손흥민을 초대할 계획이다. 지난 8월 미국프로축구 메이저리그사커(MLS)의 로스앤젤레스FC(LAFC)로 이적한 손흥민은 최근 플레이오프에서 탈락해 시즌을 마친 뒤 귀국해 휴식을 취하는 중이다. 

토트넘은 시즌이 끝난 손흥민을 홈구장으로 초대해 구단 역대 최고의 레전드 중 한 명인 손흥민을 위한 이벤트를 마련하겠다는 계획을 세운 것으로 알려졌다. 토트넘 팬들에게 제대로 된 작별인사를 건네지 못하고 토트넘과 결별한 이후 줄곧 아쉬움을 드러내며 토트넘 팬들에게 따로 작별인사를 하고 싶다는 소망을 밝혔던 손흥민의 바람이 이뤄질 수 있을 전망이다. 

토트넘 관련 소식을 다루는 '스퍼스 웹'은 지난 26일(한국시간) ""손흥민이 12월에 토트넘 홋스퍼로 돌아오는 것이 확정됐다. 특별한 이벤트도 계획되어 있다""며 ""토트넘은 손흥민이 북런던 구단(토트넘)을 떠나 LAFC에 입단한 지 몇 개월 만에 손흥민의 소원을 이뤄주기 위해 노력하는 중""이라고 전했다.



'스퍼스 웹'은 ""손흥민은 지난 10년 동안 토트넘에서 환상적인 모습을 보여줬으며, 토트넘의 현대에서 가장 위대한 레전드 중 한 명일 뿐만 아니라 프리미어리그 역사에서 가장 위대한 아이콘 중 한 명으로 기억되고 있다""며 ""토트넘 팬들은 손흥민에게 제대로 작별 인사를 하지 못했다. 손흥민이 토트넘 소속으로 치른 마지막 경기가 한국에서의 프리시즌에 치러졌기 때문""이라고 설명했다.

매체는 그러면서 ""손흥민은 지난달 토트넘 홋스퍼 스타디움에 돌아와 팬들에게 제대로 된 작별인사를 하고 싶다고 말했고, 토트넘은 손흥민의 소원을 이뤄줄 준비가 되어 있다""며 구단의 주도 하에 토트넘 홈 팬들에게 작별인사를 하고 싶어했던 손흥민의 바람이 이뤄질 거라고 했다.
지난 8월 서울월드컵경기장에서 진행된 뉴캐슬 유나이티드와의 친선경기를 마지막으로 10년간 활약했던 토트넘의 유니폼을 벗었다. 한국 팬들 앞에서 토트넘 소속으로 마지막 경기를 치른 것은 손흥민에게 의미가 있었지만, 오랜 기간 손흥민을 지켜보고 응원했던 현지 팬들로서는 구단 역대 최고의 레전드 중 한 명인 손흥민의 고별전을 보지도 못한 채 손흥민과 생이별을 한 게 아쉬울 법했다.

이는 손흥민도 마찬가지였다.



손흥민은 지난 9월 한 인터뷰에서 ""개인적으로 토트넘 홋스퍼 스타디움에서 팬들에게 작별인사를 하고 싶다""며 토트넘의 홈구장인 토트넘 홋스퍼 스타디움에서 현지 팬들에게 제대로 된 작별인사를 할 수 있는 자리가 마련되길 바란다고 밝혔다.

그는 ""그동안 이야기를 할 타이밍이 없었는데, 이제는 말할 때가 된 것 같다""면서 ""당시에는 이적과 관련된 일이 진행되고 있었다. 한국에서 마지막 경기를 치렀지만, (현지) 팬들에게 직접 작별 인사를 하지는 못했다""며 아쉬움을 드러냈다.

손흥민은 그러면서 ""런던으로 돌아가 팬들 앞에서 작별인사를 하는 게 맞다고 생각한다. 팬들도 날 직접 보고 인사할 자격이 있다""며 ""그날이 온다면 감정적으로 매우 특별한 날이 될 것""이라고 이야기했다.

손흥민의 소속팀 LAFC가 최근 플레이오프에서 탈락, 손흥민의 시즌이 끝나면서 기회가 생겼다. MLS와 달리 시즌이 한창 진행되고 있는 토트넘이 이 기간을 활용해 손흥민을 토트넘 홋스퍼 스타디움으로 초대할 계획을 세운 것이다.

'스퍼스 웹'에 따르면 토트넘은 내달 21일 열리는 리버풀과의 홈 경기 일정에 맞춰 손흥민을 초대하려고 준비 중이다. 2025년 마지막 홈 경기인 데다, 상대가 프리미어리그 내 빅클럽인 리버풀이기 때문에 여러모로 손흥민을 초대할 명분이 충분해 보인다.



'스퍼스 웹'은 ""손흥민은 12월에 팬들과 다시 만날 것으로 보인다""며 ""토트넘은 12월에 열리는 홈 경기 중 하나에 손흥민을 초대할 계획이다. 12월21일 리버풀전이 손흥민의 작별인사 행사가 진행될 가장 유력한 날짜로 거론되는 중""이라고 전했다.

또한 '스퍼스 웹'은 토트넘이 공식 프레젠테이션과 하프타임 헌정 행사, 특별한 선물 등 손흥민을 위한 다양한 이벤트를 마련 중이라고 설명했다. 손흥민은 이 방문을 통해 팬들은 물론 구단 셰프, 경기장 관리자, 물리치료사 등 구단 직원들과도 인사를 나눌 수 있을 전망이다.

지난 2015년 독일 분데스리가의 바이엘 레버쿠젠에서 토트넘으로 이적한 손흥민은 한 시즌 만에 구단의 핵심 공격수로 거듭났고, 10년 동안 토트넘에서 활약하며 팀의 프랜차이즈 스타는 물론 프리미어리그를 대표하는 선수로 자리잡았다.

2010년대 후반 토트넘의 전성기를 이끌었던 손흥민은 해리 케인, 델레 알리, 크리스티안 에릭센 등 주축 선수들이 떠나는 와중에도 홀로 자리를 지켰고, 지난 시즌 유럽축구연맹(UEFA) 유로파리그 우승 트로피를 들어올리며 자신의 헌신에 대한 보답을 받았다. 

사진=토트넘 홋스퍼 / 엑스포츠뉴스DB / 연합뉴스"
20251128,"'에이징 커브' 징조 보이자 바로 떠난 손흥민이 현명...""다리 잘린 것 같다"" 충격 혹평까지 들었다","[인터풋볼=박윤서 기자] 모하메드 살라에 대한 혹평이 점점 짙어지고 있다.

리버풀은 27일 오전 5시(한국시간) 영국 리버풀에 위치한 안필드서 열린 2025-26시즌 유럽축구연맹(UEFA) 챔피언스리그(UCL) 리그 페이즈 5라운드에서 PSV 아인트호벤에 1-4 패배했다. 리버풀은 13위에 위치하게 됐다.

리버풀은 전반 6분 만에 이반 페리시치에게 페널티킥 실점하면서 끌려갔다. 곧바로 도미닉 소보슬러이의 동점골로 균형을 맞췄지만 후반전 들어서 연달아 3실점해 끝내 1-4로 패배하고 말았다.

최근 부진이 상당히 심각하다. 지난 9월 크리스탈 팰리스전(1-2) 패배를 시작으로 12경기 3승 9패다. 무승부도 없이 9패. 수비가 무너지는 모습을 자주 보이고 있으며 안방에서의 강세도 이어지지 않고 있다. A매치 휴식기 이전에 아스톤 빌라와 레알 마드리드를 잡으면서 분위기를 끌어 올렸지만 휴식기 이후에 노팅엄 포레스트-PSV 홈 2연전 모두 패배했다.
특히 이번 PSV전은 공격수들의 부진이 아쉬웠는데, 그 중심에는 살라가 있다. 살라는 여느 때와 다름 없이 우측 윙어로 선발 출전했다. 90분 풀타임을 소화했는데 크게 빗나간 왼발 슈팅 하나 외에는 슈팅을 기록하지 못했고 드리블 성공률도 20%로 아주 낮았다. 지상볼 경합 승률도 20%로 상대 수비와의 경합에서도 존재감이 없었다.

리버풀 레전드 제이미 캐러거는 ""난 항상 아르네 슬롯 감독을 따라야 한다는 입장이었다. 솔직히 말하자면 선수들에게 화가 난다""라며 작심발언을 이어갔다.

캐러거는 ""2018년 위르겐 클롭 감독 체제에서 리버풀 전성기가 시작될 때 중심 선수는 알리송, 버질 반 다이크, 살라였다. 알리송은 부상이 많아 경기를 뛰지 못하고 반 다이크도 달라졌으며 살라는 다리가 잘린 것 같다. 이들을 비판하는 것도 싫고 이번 시즌 그들에 대한 비판 중 일부는 가혹했다고 생각한다. 하지만 잘 풀리지 않을 때 팀에서 리더가 나서야 하는 것도 당연한 일이다. 살라가 직접 나서서 팬들에게 선수들이 어떻게 하고 있는지에 대해 말해주길 바란다. 상황이 나아질 거라는 희망을 주었으면 좋겠다""라고 말했다.

살라는 지난 시즌 최고의 폼을 보여주며 리버풀과 2년 재계약을 맺었다. 하지만 예상치 못한 에이징 커브 조짐이 보이면서 우승한 뒤 팀을 떠난 동갑내기 손흥민의 선택이 재조명되고 있다."
20251128,'괜찮아 흥민이 형'...손흥민 승부차기 실축에 가장 먼저 다가와 위로한 부앙가,"사진=LAFC


[인터풋볼=박윤서 기자] 드니 부앙가가 손흥민을 위로한 장면이 포착됐다.

미국메이저리그사커(MLS) 사무국은 27일(한국시간) 공식 SNS 채널에 밴쿠버 화이트캡스와 LAFC의 MLS컵 플레이오프 2라운드에서의 손흥민 전용 캠 영상을 공개했다. 경기 시작 전부터 경기 종료까지 손흥민을 비춘 영상이었다. 경기 시작 전 비장한 모습을 시작으로 두 골을 먼저 내줬을 때의 좌절, 동점골이 들어간 순간 환호 등 손흥민의 여러 감정이 담겨있었다.

손흥민의 승부차기 실축 장면도 나왔다. 손흥민은 두 골을 넣으면서 기적적으로 연장 승부로 몰고 갔는데 연장전에 역전에 실패하면서 승부차기에 돌입했다. LAFC 1번 키커로 나선 손흥민의 슈팅은 골대에 맞았다. 이후 LAFC는 델가도까지 놓치면서 승부차기에서 3-4로 패배했다.

손흥민은 실축 직후 허벅지를 붙잡으며 절뚝였다. 킥을 처리할 때 근육이 올라온 모습이었다. 손흥민은 경기가 끝난 뒤 ""가끔 축구는 미친 경기가 나온다. 우리가 축구를 사랑하는 이유이기도 하다. 밴쿠버에게 큰 축하를 보낸다. 내년에는 반드시 승리할 것이다. 내년에 더 강해져서 돌아오겠다""라며 패배에 아쉬움을 드러내면서 ""연장 후반 막판 근육 경련이 왔다. 승부차기에서 슈팅을 차는 순간에도 경련이 왔다는 것을 느꼈다. 정확하게 차지 못했는데 모두 다 내 책임이다""라고 말한 바 있다.

사진 = MLS SNS 캡처


실축 장면 부앙가는 가장 먼저 달려와 손흥민을 위로했다. 손흥민의 목을 어루만지며 괜찮다고 다독였다.

두 선수는 함께 한 시간이 짧았지만 MLS를 대표하는 최고의 듀오로 자리잡았다. 손흥민이 LAFC에 입단하자마자 공격을 홀로 이끌던 부앙가의 짐을 덜었고 두 선수는 찰떡 호흡을 자랑하면서 MLS 여러 상대 팀을 격파해나갔다. 두 선수의 활약은 9월 대단했다. LAFC는 산호세 어스퀘이크스전부터 토론토전까지 6연승을 달렸는데 이 기간 흥부 듀오는 16골을 뽑아냈다.

손흥민과 부앙가는 내년에도 LAFC에서 함께 한다. LAFC는 27일 공식 홈페이지를 통해 2026시즌에 참가하는 스쿼드를 발표했다. 위고 요리스 등 아직 재계약 협상이 완료되지 않은 선수들은 포함되지 않았지만 부앙가와 손흥민의 이름은 포함됐다."
