date,title,content
20250611,"“SON, 프랑크 감독 체제 왼쪽 주전 윙어”···새 감독 계약 초읽기, 손흥민 예상 베스트11서 존재감","토트넘 손흥민이 지난달 유로파리그 우승 후 우승컵을 들어올리고 있다. Getty Images코리아



손흥민의 소속팀 토트넘 홋스퍼가 새 사령탑으로 토마스 프랑크(덴마크) 브렌트퍼드 감독을 이번 주말까지 선임할 것이라는 보도가 나왔다. 현지에서는 프랑크 감독 체제에서의 다음 시즌 토트넘 예상 베스트11까지 나왔는데 손흥민이 포함됐다.

영국 BBC는 11일 “토트넘과 브렌트퍼드와 협상이 긍정적으로 진행 중”이라며 “프랑크 감독 선임이 48시간 이내 확정될 거란 기대감이 커지고 있다”고 전했다.

토트넘은 프랑크 감독을 데려오기 위해 브렌트퍼드에 보상금 1000만 파운드(약 184억원)를 줄 것으로 전망된다. 여기에 프랑크 감독을 보좌할 코치진까지 포함하면 비용은 더 커질 것으로 보인다.

앞서 토트넘은 2024-25시즌 유럽축구연맹(UEFA) 유로파리그 우승을 이끈 안지 포스테코글루 감독을 지난 7일 경질했다. 유럽대항전 우승컵을 들어 올렸지만, 잉글랜드 프리미어리그(EPL)에서 17위에 그친 성적 부진이 발목을 잡았다. 결국 토트넘은 새 사령탑 찾기에 나섰고, 프랑크 감독을 최종적으로 낙점했다.

축구 대표팀 주장 손흥민이 10일 서울월드컵경기장에서 열린 11회 연속 월드컵 본선 진출 축하 행사에서 관중들에게 인사를 하고 있다. 연합뉴스


2018년 브렌트퍼드에 부임한 프랑크 감독은 2022-21시즌 챔피언십(2부) 플레이오프를 통해 EPL 승격을 이끌었다. 2024-25시즌에는 브렌트퍼드를 토트넘보다 높은 EPL 10위에 올려놓았다.

영국 매체 기브미스포츠는 이날 프랑크 감독 체제에서의 토트넘 베스트11을 예상해 눈길을 끌었다. 토트넘을 떠나가나 새로 이적할 가능성이 높은 선수들까지 두루 포함해 베스트11을 선정했다.

4-3-3 포메이션에서의 스리톱으로 손흥민·솔란케·음뵈모를 예상했다. 토트넘과 계약 기간이 1년 남겨놓고 이적설이 나오고 있는 손흥민이지만 프랑크 감독 체제에서 변함없이 왼쪽 윙어로 주전으로 나설 것으로 봤다. 전방은 도미닉 솔란케가 올 시즌에 이어 자리를 지키고 오른쪽 윙어에 최근 토트넘 이적설이 뜨거운 음뵈모가 영입돼 나설 것으로 전망했다.

토트넘 손흥민이 지난달 24일 런던에서 진행된 유로파리그 우승 카퍼레이드에서 우승컵을 들어보이고 있다. Getty Images코리아



이 매체는 손흥민에 대해 “2008년 이후 토트넘에서 처음으로 우승 트로피를 들어 올린 주장 손흥민은 새 시즌을 앞두고 몇 달 동안 불투명한 상황에 직면해 있다”면서 “이 한국 스타는 의심할 여지 없이 클럽의 레전드이지만, 최근 부진한 폼은 우려를 불러일으켰고, 사우디 프로 리그 구단은 손흥민의 상태를 예의주시하고 있는 것으로 알려졌다”고 최근 상황을 전했다. 그러면서도 “하지만 손흥민이 북런던에 잔류한다면, 왼쪽 윙어로 계속 선발 출장할 것으로 예상된다. 데얀 쿨루셰브스키가 오른쪽 윙어로 선발 출장할 가능성이 높지만, 프랑크는 또한 자신에게 매우 친숙한 선수를 기용할 가능성이 있다”면서 브렌트퍼드 애제자 음뵈모를 데려와 주전으로 활용할 것으로 예상했다.

양승남 기자 ysn93@kyunghyang.com"
20250611,"김민재 이런 치욕 있나? 30% 할인! 뮌헨, EPL 구단에 역제안! 첼시-토트넘 등 동시 주시…영입 경쟁은 벌어졌는데","(엑스포츠뉴스 윤준석 기자) 2025년 여름 유럽 축구 이적 시장이 본격적으로 열리면서, 바이에른 뮌헨 수비수 김민재의 거취가 초미의 관심사로 떠오르고 있다.

독일과 영국, 이탈리아 등 유럽 전역 언론들은 연일 김민재의 이적설을 보도하고 있으며, 뮌헨이 실제로 김민재 매각을 위해 구체적인 움직임에 나섰다는 정황도 속속 확인되고 있다.

영국 매체 '풋볼365'는 10일(한국시간) ""바이에른 뮌헨이 여러 프리미어리그 클럽에 김민재의 영입 가능성을 타진했다""며 ""사실상 역제안을 보낸 것으로 보인다""고 보도했다.

여기에 더해, 독일 유력 매체 '스카이 스포츠' 독일판의 플로리안 플레텐베르크 기자도 같은 날 자신의 사회관계망서비스(SNS)를 통해 ""김민재는 바이에른 뮌헨의 분명한 매각 후보""라며 ""구단은 적절한 제안이 올 경우 주저 없이 이적을 허용할 것""이라고 또 다시 전하며 김민재가 뮌헨을 떠날 가능성을 높게 점쳤다.



김민재는 그간 잉글랜드 프리미어리그 클럽들의 지속적인 관심을 받아왔다.

'풋볼365'에 따르면, 뮌헨은 최근 김민재를 맨유, 리버풀, 첼시, 토트넘을 포함한 몇몇 프리미어리그 구단에 제안하면서 해당 관심을 실질적으로 확인했다.

이 보도에 따르면 김민재는 최근 뮌헨이 레버쿠젠에서 영입한 수비수 요나탄 타와의 경쟁 구도에서 밀릴 가능성이 있는 가운데, 뮌헨은 이미 김민재의 여름 이적을 위해 적극적으로 시장과 접촉하고 있는 것으로 전해졌다.

영국 '더 부트룸'의 축구 전문 기자 그레이엄 베일리는 해당 보도에서 ""김민재가 맨유, 리버풀, 첼시, 맨체스터 시티, 토트넘, 뉴캐슬 등 프리미어리그 다수 구단에 '제안된 상태'이며, 해당 구단들은 김민재의 이적 가능성에 대해 알고 있다""고 전했다.

이는 뮌헨이 김민재 매각에 적극적으로 나섰다는 방증이며, 빠른 매각을 위해 다른 클럽들에 김민재 구매 의사를 직접 물어본 것으로 해석된다.

이어 매체는 ""바이에른 뮌헨이 손실을 감수하면서도 김민재의 이적 협상에 나설 의향이 있다""며, ""구단은 이적료에 있어서도 유연한 자세를 취할 가능성이 있다""고 덧붙였다.



김민재는 2023년 여름 나폴리에서 바이에른 뮌헨으로 이적하며 아시아 선수 이적료 역대 최고액인 약 5100만 파운드(약 941억원)의 이적료를 기록한 바 있다.

뮌헨은 해당 이적료를 회수하지 못하더라고 김민재의 빠른 매각을 원한다는 주장이다.

매체에 따르면, 언급된 프리미어리그 구단들 중 김민재의 잠재적인 새 행선지로는 첼시가 유력하게 거론된다.

엔조 마레스카 신임 감독은 수비 재편을 목표로 기존 어린 수비 자원들을 매각 대상으로 설정하며 수비 보강을 예고한 상황이다. 이와 관련해 매체는 ""첼시는 김민재와 같은 수준 높은 센터백 영입에 관심을 가질 수밖에 없는 상황""이라고 전했다.
같은 한국 국가대표인 손흥민이 주장으로 뛰고 있는 토트넘도 잠재적 후보군으로 지목됐다.

현 수비 핵심인 크리스티안 로메로가 아틀레티코 마드리드와 연결되고 있는 가운데, 김민재가 그 자리를 대체할 수 있는 옵션이 될 수 있다는 것이다.

김민재는 대한민국 국가대표팀에서 손흥민과 오랜 기간 호흡을 맞춰 왔으며, 지난해 손흥민은 ""김민재는 내가 정말 좋아하는 수비수이며, 세계적인 관점에서 봐도 앞으로 더 많은 것을 배울 수 있는 선수""라고 극찬한 바 있다.

하지만 손흥민은 최근 사우디아라비아 프로리그 구단으로부터 이적 제안을 받은 것으로 알려지며, 김민재와의 재회 가능성은 변수로 남아 있는 상태다.



프리미어리그 외에도 파리 생제르맹(PSG), AC 밀란, 그리고 사우디아라비아 구단들도 김민재의 상황을 예의주시하고 있는 것으로 알려졌다.

특히 김민재는 그간 프리미어리그 진출을 희망해 왔다는 점에서, 이번 여름이 잉글랜드 무대 진출의 적기로 작용할 수 있다는 평가도 나온다.

베일리는 ""김민재는 오래전부터 프리미어리그에서 뛰고 싶다는 의지를 갖고 있었으며, 이번 여름 그 기회가 현실화될 수 있다""며 ""현재 여러 구단과의 접촉이 이루어지고 있는 것으로 보인다""고 말했다.

김민재는 2023년 여름 나폴리에서 뮌헨으로 이적해 곧바로 주전 센터백으로 자리 잡았다. 첫 시즌부터 강한 대인 방어, 발 빠른 커버 능력, 빌드업 역량 등을 바탕으로 존재감을 나타냈다.

그는 뮌헨 입단 2년 차인 이번 시즌에도 뱅상 콤파니 감독 체제에서 꾸준히 중용됐고, 분데스리가 우승을 통해 유럽 4대 리그에서 두 리그 우승을 경험한 최초의 한국인 선수가 됐다.

하지만 지난해 10월부터 이어진 아킬레스건 부상 여파가 발목을 잡았다. 김민재는 완전히 회복되지 않은 상태에서도 경기를 소화했고, 이는 후반기 경기력 저하와 잦은 실수로 이어졌다.

이어지는 비판에 결국 뮌헨은 김민재를 레온 고레츠카, 킹슬리 코망 등과 함께 방출 명단에 올렸다.

한 시즌 내내 팀의 성적을 위해 아픈 몸을 이끌고도 헌신을 보여준 선수에게 걸맞지 않은 대우임에는 분명하지만, 냉정한 프로 스포츠 세계에서는 어쩔 수 없다는 반응도 존재한다.



한편, 뮌헨은 김민재를 다가오는 2025 FIFA 클럽 월드컵 최종 명단에 포함시켰다.

김민재는 타와 다요 우파메카노 등과 함께 주축 센터백으로 이름을 올렸으며, 구단은 김민재의 미국 도착 사진과 영상을 공식 채널을 통해 공개했다.

또한 김민재는 구단의 2025-2026시즌 유니폼 모델로도 활용됐다. 일반적으로 구단 유니폼 모델은 팀의 주축 선수들이 맡는다는 점에서, 이는 이적과 별개로 상징적인 의미가 있다는 해석도 나온다.

하지만 구단의 이 같은 행보가 반드시 잔류를 뜻하는 것은 아니라는 분석이 지배적이다.

김민재는 과거 공식 인터뷰에서 ""바이에른 뮌헨에서 뛰는 것이 좋다. 다음 시즌에도 이 팀에서 뛰고 싶다""고 밝혔지만, 현재로서는 그의 바람대로 이루어지지 않을 가능성이 높다.

현재 김민재는 아킬레스건염 재활 중이며, 이르면 클럽 월드컵 16강 진출 시점부터 출전이 가능할 것으로 전망된다.

사진=연합뉴스/바이에른 뮌헨"
20250611,"바이에른 뮌헨 제안 받은 첼시…'김민재는 이상적인 영입, 센터백 영입 추진'","첼시 마레스카 감독/게티이미지코리아
김민재/게티이미지코리아

[마이데일리 = 김종국 기자] 클럽 월드컵 출전을 앞둔 김민재의 이적설이 꾸준히 관심받고 있다.

독일 매체 스카이스포츠는 11일 '김민재는 바이에른 뮌헨 매각 1순위 후보'라며 김민재의 이적 가능성을 높게 점쳤다. 영국 매체 풋볼365는 10일 '바이에른 뮌헨은 리버풀, 첼시, 맨체스터 유나이티드(이하 맨유) 등 여러 프리미어리그 클럽에 김민재 영입을 제안한 것으로 전해졌다. 김민재는 지난 2023년 바이에른 뮌헨 이적에 앞서 프리미어리그 클럽 영입설이 있었고 특히 맨유가 김민재 영입을 노렸다. 요나단 타가 바이에른 뮌헨에 합류한 이후 맨유등 프리미어리그 클럽들이 김민재 영입을 다시 추진할 가능성이 있다'고 언급했다. 또한 '맨유, 리버풀, 토트넘, 첼시, 뉴캐슬, 맨체스터 시티는 올 여름 이적시장에서 김민재 영입이 가능하다는 것을 알고 있다'고 덧붙였다.
영국 매체 투더레인앤백은 10일 '첼시, 맨유, 토트넘 등은 김민재 영입 제의를 받았다. 첼시는 아다라비오요와 찰로바를 방출할 의지가 있다. 포파나는 꾸준히 부상을 당하는 등 수비진이 부족하고 김민재 같은 선수를 영입할 가능성이 있다'고 언급했다. 풋볼 365는 '김민재는 첼시에 이상적인 영입이 될 수 있다. 첼시의 마레스카 감독이 수비진에 새로운 선수를 영입하는 대신 아다라비오요와 찰로바는 팀을 떠날 가능성이 있다'는 뜻을 나타냈다.

바이에른 뮌헨은 10일 '29명의 선수단과 함께 미국으로 향한다'며 클럽 월드컵 출전 명단을 발표했다. 바이에른 뮌헨은 클럽 월드컵을 앞두고 요나단 타와 비쇼프가 새롭게 팀에 합류한 가운데 2024-25시즌 분데스리가 우승 주역으로 활약한 김민재를 포함해 29명이 클럽 월드컵에 나선다. 김민재는 바이에른 뮌헨이 공개한 영상에서 팀 동료들과 함께 밝은 모습으로 비행기에 오르는 모습을 보였다.

바이에른 뮌헨은 클럽 월드컵에서 보카 주니어스, 벤피카, 오클랜드 시티를 상대로 C조에서 경쟁하는 가운데 오는 16일 오클랜드 시티를 상대로 대회 첫 경기를 치른다. 김민재는 바이에른 뮌헨의 새 시즌 유니폼 모델로도 나서며 팀의 주축 선수로 인정받았다.

독일 매체 메르쿠르는 지난 8일 '클럽 월드컵을 앞둔 바이에른 뮌헨은 안도의 한숨을 내쉬게 됐다. 김민재가 클럽 월드컵에 출전할 예정'이라며 '김민재는 아킬레스건 부상으로 어려움을 겪고 있고 조별리그 출전은 어려울 것으로 예상되지만 16강 토너먼트부터는 출전 가능하다. 바이에른 뮌헨이 예상대로 오클랜드 시티, 벤피카, 보카 주니어스를 상대로 승리를 거둔다면 김민재는 16강전부터 출전할 수 있을 것'이라며 아킬레스건 문제를 겪고 있는 김민재의 클럽 월드컵 활약 가능성을 전했다.
김민재, 뮐러, 이토/게티이미지코리아
김민재와 콤파니 감독/게티이미지코리아"
20250611,"충격! 토트넘, '오일 머니'에 항복…SON, 새 감독 원해도 팔아치운다→""손흥민 현금화 마지막 기회, 적정 제안 오면 방출 OK""","(엑스포츠뉴스 용환주 기자) 토트넘 홋스퍼의 새로운 감독은 손흥민을 기용할 가능성이 크다. 

하지만, 토트넘은 새 감독의 의견을 넘어 충격적인 결정을 내릴 준비를 마친 것으로 알려졌다. 
토트넘은 지난 7일(이하 한국시간) 포스테코글루 감독을 경질했다. 차기 사령탑으로 토트넘과 같은 프리미어리그의 브렌트퍼드를 이끄는 토마스 프랭크 감독이 유력하다. 

유럽 축구 이적시장 전문가 파브리치오 로마노는 10일 자신의 사회관계망서비스(SNS)를 통해 ""프랭크가 토트넘의 새로운 감독으로 부임한다""며 ""감독, 그리고 그의 휘하 코칭스태프가 계약 조건을 두고 합의를 마쳤다. 현재 프랭크 감독이 지휘봉을 잡고 있는 브렌트퍼드는 1000만 파운드(187억원)의 위약금을 받고 프랭크를 내보낼 예정이다. 포스테코글루 감독을 대체할 인물""이라고 밝혔다.

그리고 영국 공영방송 'BBC' 또한 토트넘은 안지 포스테코글루 감독을 경질한 후 토마스 프랭크 감독을 선임하는 방향으로 기울고 있다""고 보도했다.



토트넘의 감독이 바뀐다. 사령탑이 변경되면 선수단에 변화가 생긴다. 현장 최고 책임자 감독의 전략, 전술에 맞는 코치, 선수로 구성한다. 감독 눈에서 벗어난 선수는 출전 기회를 받기 힘들어 팀을 떠나는 경우가 대부분이다. 또 선수단 주장도 감독이 다시 선임할 수 있다. 

손흥민은 프랭크 감독과 좋은 호흡을 보여줄 것으로 전망된다. 

영국 매체 '기브미스포츠'는 11일 다음 시즌 프랭크 감독이 지휘할 토트넘의 예상 라인업을 공개했다. 손흥민은 여전히 주장 완장을 차고 왼쪽 윙어로 출전할 것으로 전망됐다. 

하지만, 토트넘이 프랭크 감독이 손흥민을 원해도 매각을 추진할 수 있다는 주장도 나왔다.



영국 '더 하드 태클'은 지난 10일 영국 매체 '풋볼 인사이더' 내용을 인용, ""프랭크 감독은 여름 이적시장 이후 손흥민을 구단에 잔류를 원하는 것 같다. 그러나 토트넘은 감독의 의견을 넘어서는 결정을 내릴 준비가 됐다""며 ""구단은 적정한 가격의 제안을 받으면 손흥민의 방출을 승인할 수 있다는 입장""이라고 밝혔다. 

토트넘이 손흥민의 매각을 추진하는 이유가 있다. 나이와 부상, 계약기간 등이 핵심 원인이다. 



먼저 손흥민은 1992년생으로 지금 32살이다. 다음 달에 33살이 된다. 미래를 책임질 수 있는 선수가 아니다. 실력 또한 하락하고 있다.

손흥민은 직전까지 8시즌 연속 프리미어리그에서 10득점 이상을 터트렸다. 이번 시즌 9시즌 연속 두 자릿수 득점 기록을 이어 나갈 예정이었지만, 7득점에 그쳤다. 

손흥민의 공격력이 하락하고 있는 가운데, 토트넘과 다가오는 2026년 6월 구단과 계약이 끝난다. 구단은 선수와 계약 기간이 끝나서 자유 계약(FA) 신분이 되면 이적료를 받을 수 없다.

손흥민은 지난 1년간 햄스트링 부상과 정체불명의 발 부상으로 3번이나 재활했다.



독일 이적시장 전문 사이트 '트란스퍼마르크트'에 따르면 지난 3월 18일까지 손흥민의 추정 몸값은 3000만 유로(약 470억원)였다. 그러나 지난 5월 30일 기준 2000만 유로(약 313억원)로 약 157억 원 대폭 하락했다. 

손흥민의 몸값은 앞으로도 꾸준히 하락할 것이다. 동시에 구단과 계약 종료가 다가온다. 마침 '오일 머니' 사우디아라비아 프로축구에서 손흥민 영입에 관심을 보인다.

영국 현지에선 지금이 손흥민을 매각할 좋은 기회로 바라보고 있다. 



영국 정통 일간지 '데일리 텔래그레프'는  ""손흥민은 다음 주요 이적 후보로 떠오를 것이다. 사우디 프로리그의 러브콜을 받는 만큼, 손흥민 매각으로 돈을 챙길 마지막 기회""라고 바라봤다. 

그런 상황에서 일부 매체는 손흥민 매각을 반대했다. 

더 하드 태클은 풋볼 인사이더 내용을 인용, ""손흥민은 팀의 핵심이다. 이번 여름에 그를 매각하는 건 좋은 생각이 아닐 수 있다""며 ""토트넘이 다음 시즌 좋은 성적을 원하면 손흥민의 능력이 경기장 안팎에서 필수""라고 주장했다. 토트넘은 다음 시즌 프리미어리그는 물론, UEFA 챔피언스리그까지 나서야 한다. 경험 넘치는 손흥민의 존재감이 필요하다.

매체는 이어 ""손흥민을 원하는 구단은 많지 않다. 사우디 리그가 관심을 보이고 있지만, 한국 대표팀 주장은 토트넘에 귀중한 구성원""이라며 ""토트넘은 손흥민은 팀에 남겨두는 것을 고려해야 한다""며 손흥민 매각으로 인한 손실이 더 커질 수 있음을 알렸다.

사진=연합뉴스 / BBC SPORT / 트란스퍼마르크트 캡처 "
20250611,"'토트넘 잘 있어요' 손흥민 정말 이렇게 말할까...최고 공신력 기자 ""떠날 가능성 진짜 있다""","<저작권자(c) 연합뉴스, 무단 전재-재배포, AI 학습 및 활용 금지>
[스포츠조선 김대식 기자]손흥민이 정말로 토트넘을 떠나고 싶어할 수도 있다는 소식이다.

영국 풋볼 런던의 알레스디어 골드 기자는 10일(한국시간) ""토마스 프랭크가 토트넘에 들어선 후 처음 맡게 될 과제 중 하나는 손흥민의 미래에 대해 논의하는 것이다. 손흥민은 지금까지보다 더 토트넘을 떠나는 데 열린 태도를 보이고 있다. 손흥민은 이번 여름, 모든 당사자에게 적합한 조건의 제안이 들어온다면 과거보다 클럽을 떠나는 것에 더 열린 입장을 가지고 있다""고 밝혔다.
<저작권자(c) 연합뉴스, 무단 전재-재배포, AI 학습 및 활용 금지>
그는 ""사우디아라비아 프로리그 팀들이 이번 여름 손흥민을 영입하기 위한 대형 제안을 준비하고 있는 것으로 알려졌다. 손흥민의 아시아 전역에서의 높은 인기는 리그에 큰 노출 효과를 가져다줄 수 있다. 이런 이적 가능성은 손흥민이 이를 부정했던 지난 여름보다 이번 여름에 더 비현실적이지 않다는 평가다""며 손흥민이 사우디의 제안을 받아들일 가능성이 있다고 말했다.

또한 골드 기자는 ""미국 구단들의 관심도 어느 정도 관심을 받고 있는 것으로 보인다. 그러나 미국 리그에서는 손흥민 영입에 필요한 금액을 충당하기 어려울 것으로 예상된다""고 덧붙였다. 골드 기자는 토트넘 내부 소식에 대해서 제일 능통한 기자 중 한 명이라 신뢰할 수 있는 정보다.
<저작권자(c) 연합뉴스, 무단 전재-재배포, AI 학습 및 활용 금지>
이에 앞서 영국 텔레그래프에서도 프랭크 감독의 선임이 임박했다고 전하면서 '사우디아라비아의 관심을 받고 있으며 팀을 떠날 수 있다는 생각을 선수와 스태프에게 심어준 주장 손흥민의 미래에 대한 결정이 포함될 수 있다'고 설명했다.

영국 주요 매체에서 손흥민이 토트넘을 자신의 선택으로 떠날 수 있다는 이야기가 들리기 시작한 건 손흥민이 토트넘 선수가 된 이후로 처음이다.

손흥민의 태도가 조금은 바뀐 것도 사실이다. 2년 전 사우디에서 손흥민을 노린다는 이야기가 나왔을 때 손흥민은 1초도 고민하지 않고 거부했다. 토트넘 팬들은 좋아할 것이라며 토트넘 잔류를 선언했다.
<저작권자(c) 연합뉴스, 무단 전재-재배포, AI 학습 및 활용 금지>
하지만 6월 A매치 후 손흥민은 토트넘에 남겠다고 확실하게 말하지 않았다. 그는 ""나도 상당히 궁금하다. 미래를 생각하기보다는 현재 어떤 일이 벌어질지를 조금 더 지켜보는 게 좋을 것 같다. 내가 어디에 있든 어떤 자리에 있든 나는 항상 최선을 다하고 노력해 온 선수라는 건 변함없다. 그 자리에 있더라도 해야 할 것은 최선을 다해서 열심히 잘 준비하겠다""는 원론적인 대답만 내놓았다.

결국엔 손흥민의 결정이 중요할 전망이다. 토트넘 역시 좋은 제안이 온다면 손흥민과 이별을 선택할 수도 있다는 입장으로 전해졌다."
20250611,'김민재 대반전' 새 시즌 유니폼 모델에 클럽 월드컵 참여까지…'이적설' KIM 함박미소로 '미국 도착',"사진=바이에른 뮌헨


[포포투=박진우]

김민재가 환한 미소로 미국에 도착했다.

바이에른 뮌헨은 11일 구단 홈페이지를 통해 2025 국제축구연맹(FIFA) 클럽 월드컵 최종 명단을 발표했다. 김민재를 비롯해 다요 우파메카노, 요나단 타 등 주축 센터백들이 이름을 올렸다.
이적설에 휩싸인 김민재는 미국에 도착했다. 독일 현지에서는 뮌헨이 김민재를 매각 명단에 올렸다고 보도했다. 2024-25시즌 빈센트 콤파니 감독 체제에서 '부동의 주전'으로 활약했음에도 불구하고, 후반기 몇 차례 실수로 인해 숱한 비판을 받았다. 지난해 10월부터 아킬레스건염 부상을 참고 뛰어온 상황에서, 독일 현지는 김민재에 혹독한 평가를 내렸다.

구단은 김민재에 적절한 제의가 온다면 매각할 의향이 있는 것으로 알려졌다. 김민재는 독일 '스포르트 빌트'와의 인터뷰에서 뮌헨 잔류를 희망한다고 선언했지만, 결과는 달라지지 않았다. 현재까지 김민재는, 독일, 영국, 이탈리아 등 유럽 5대 리그 빅클럽의 러브콜을 받고 있다. 특히 최근에는 파리 생제르맹(PSG)과 진하게 연결되기도 했다.

사진=바이에른 뮌헨


그러한 상황에서 뮌헨의 2025-26시즌 새로운 유니폼이 공개됐다. 뮌헨은 몇몇 선수가 라커룸에서 새로운 유니폼을 입고 있는 영상을 게재했는데, 김민재의 모습도 찾아볼 수 있었다. 아울러 김민재가 라커룸에 앉아 있는 사진까지 공식 채널을 통해 게재했다. 일반적으로 새 시즌 유니폼 모델을 '주축 선수'에 맡기는 경향이 있다는 점을 미뤄볼 때, 주목할 만한 행보였다.

여기서 그치지 않았다. 뮌헨은 같은 날 선수단이 미국에 도착했음을 알렸다. 구단은 ""선수들이 안전하게 도착했다""라는 문구와 함께, 선수 한 명 한 명의 사진을 나열했다. 해당 게시물의 '대표 사진'은 김민재였다. 이와 함께 선수들과 하이파이브를 하는 영상이 게재됐는데, 김민재는 하이파이브에 응한 뒤 환한 미소로 이동했다.

김민재는 아직 아킬레스건 부상으로부터 완전히 회복되지 않은 것으로 알려졌다. 만약 뮌헨이 16강에 진출한다면, 그 시점부터 김민재를 가용할 수 있을 것이라 독일 언론은 예측하고 있다. 클럽 월드컵 이후 김민재의 향후 거취에 큰 관심이 쏠린다.

사진=바이에른 뮌헨


#포포투 코리안리거 소식"
