date,title,content
20251128,"""손흥민 토트넘 복귀 세부 정보 유출됐다""...英 매체 화들짝! 12월 작별 선사할 절호의 기회라 판단","[스포티비뉴스=신인섭 기자] 현지 매체에서도 손흥민의 토트넘 훗스퍼 복귀 소식에 놀란 분위기다.

영국 '골닷컴'은 27일(한국시간) ""LAFC의 스타 손흥민이 여름 이적 이후 토트넘에서 감동적인 재회를 준비한다. 복귀 세부 정보가 유출됐다""라며 ""손흥민과 토트넘은 제대로 작별 인사를 하지 못한 것에 대한 아쉬움이 여전히 남아 있는 가운데, 구단은 현재 하프타임 헌정 행사, 특별 선물, 그리고 핫스퍼 웨이 비공개 방문까지 포함한 다양한 프로그램을 진행하려 한다고 전해졌다""라고 보도했다.

2015년 8월 28일 손흥민은 독일 분데스리가의 바이엘 04 레버쿠젠을 떠나 토트넘 유니폼을 입었다. 당시 토트넘은 이적료 3,000만 유로(약 410억 원)를 지불하며 손흥민을 품었다. 이는 당시 기준 아시아 역대 최고 이적료였다. 손흥민은 5년 계약을 체결했고, 등번호 7번을 받았다.



손흥민은 프리미어리그를 넘어 전 세계적으로 유명한 윙포워드 가운데 한 명이 됐다. 손흥민은 이적 첫 시즌 부진했지만 이후 델레 알리, 크리스티안 에릭센, 케인과 함께 'DESK 라인'을 꾸리며 토트넘의 공격진의 한 축으로 성장했다.

꾸준함의 대명사다. 손흥민은 프로 데뷔 이후 11번째 10골 이상을 달성했다. 손흥민은 2012-2013시즌 함부르크에서 12골을 터트리며 프로 통산 첫 10골 고지를 밟았고, 레버쿠젠 시절에도 2시즌 연속 10골 이상을 넣었다. 토트넘 이적 이후 첫 번째 시즌과 마지막 시즌을 제외하면 모두 10골 이상을 넣었다.
다양한 상을 수상했다. 손흥민은 2019-2020시즌 번리를 상대로 70m 질주 후 득점을 터트린 바 있다. 손흥민은 해당 득점으로 푸스카스상을 수상한 바 있다. 또한 2021-2022시즌에는 EPL 23골을 터트리며 골든 부트를 수상했다. 손흥민의 득점왕이 더욱 놀라운 것은 페널티킥(PK)이 단 한 차례도 없다는 것이다.

프리미어리그 역대 득점 랭킹 16위에 이름을 올렸다. 손흥민은 토트넘 유니폼을 입고 총 127골을 기록했다. 15위에는 판 페르시(144골)가 랭크돼 있고, 손흥민 바로 아래에는 로비 킨(126골)이 자리하고 있다. 손흥민은 총 333경기에 출전해 127골 71도움을 기록했다. 모든 대회로 범위를 넓히면 454경기 173골 98도움을 올렸다.



그러나 지난여름 갑작스럽게 팀을 떠나게 됐다. 손흥민은 토트넘과의 프리시즌 투어를 마치고 곧바로 미국행 비행기에 올랐다. 미국메이저리스사커(MLS)가 시즌을 진행중이었던 만큼 빠르게 손흥민 영입을 추진했기 때문.

손흥민은 팀의 주축 공격 자원으로서 막대한 영향력을 발휘했다. 10년 동안 팀을 위해 헌신했고, 지난 시즌에는 유럽축구연맹(UEFA) 유로파리그(UEL) 우승을 견인하기도 했다. 그야말로 클럽의 레전드인 셈.

손흥민은 한국 팬들 앞에서 토트넘 유니폼을 입고 작별 인사를 고했으나, 정작 현지 런던 팬들 앞에서는 마지막 인사를 나누지 못했다. 이에 토트넘 측은 손흥민을 스타디움으로 초대해 마지막 순간을 선사하고자 한다.

토트넘은 12월 홈 경기장인 토트넘 훗스퍼 스타디움에서 브렌트포드(7일), 슬라비아 프라하(10일), 리버풀(21일)와 총 세 차례 격전을 벌인다. '골닷컴'은 ""토트넘은 12월의 가장 큰 홈 경기인 크리스마스 직전 주말 리버풀과의 경기를 중심으로 계획을 세웠다""라고 밝혔다.



그러면서 ""한국 프리시즌 투어를 마친 직후 토트넘을 떠나 LA로 향했던 손흥민은 떠나기 전 팬들에 제대로 감사 인사를 드리지 못했다는 점을 거듭 언급했다. MLS 일정과 토트넘의 여름 일정 때문에 갑작스럽게 팀을 떠나게 된 손흥민은 작별 경기도, 감사 인사도, 그가 클럽의 레전드가 되는 모습을 지켜본 팬들과 직접 소통할 기회도 갖지 못했다. 토트넘은 12월이 손흥민에게 그간의 공백을 메우고 그가 놓친 작별의 순간을 선사할 절호의 기회라고 판단했다""라고 전했다.

리버풀전에 손흥민 행사를 진행한다면 주목도 역시 높을 전망이다. 매체 또한 ""12월 홈 경기는 명성, 분위기, 그리고 감성적인 무게감을 지니고 있다. 특히 리버풀과의 홈경기 전이나 경기 중에 헌정 행사를 개최할 가능성이 높은데, 이는 전 세계적인 관심으로 인해 가장 유력한 날짜로 빠르게 부상하고 있다""라고 언급했다.

끝으로 ""이러한 행사를 통해 토트넘은 만석 관중 앞에서 손흥민을 기리고, 그의 존재가 북런던을 넘어 한국, 유럽, 그리고 MLS 팬들에게도 깊은 울림을 줄 수 있는 주말을 보낼 수 있다. 이는 작별 인사를 위한 순간일 뿐만 아니라, 토트넘과의 놀라운 인연을 전 세계에 알리는 계기가 될 것""이라고 덧붙였다.



한편 손흥민은 시즌 종료 이후 한국으로 복귀했다. 한동안 휴식을 보낼 예정이다. 2024년 여름 시작한 손흥민의 시즌은 2025년 11월이 되서야 막을 내렸다. 해당 기간 손흥민은 59경기에 출전해 23골 16도움을 올리며 여전한 클래스를 과시했다.

손흥민은 개인 SNS를 통해 ""이 팀이 정말 자랑스럽습니다. 어젯밤은 모두가 바라던 대로 끝나지 않았지만, 우리가 보여준 투지는 놀라웠고 마지막 순간까지 포기하지 않았습니다""라며 감사의 메시지를 전했다.

이어 ""한 시즌 동안 보내주신 모든 응원에 진심으로 감사드리며, 이곳에서 집처럼 느끼게 해주셔서 감사합니다. 다음 시즌에는 더 강해져서 돌아오겠습니다""라고 덧붙였다."
20251128,‘HERE WE GO’ 로마노 떴다! 맨체스터 유나이티드 이적 열망 강하다…유럽 대항전 못 나가도 상관없어,"[골닷컴] 이정빈 기자 = 주앙 고메스(울버햄튼)가 맨체스터 유나이티드 이적에 큰 관심을 드러냈다. 그는 맨유가 유럽 대항전에 나서지 못함에도 올드 트래퍼드 잔디를 밟고 싶어 한다.

유럽축구 이적시장 전문가 파브리지오 로마노는 28일(한국 시각) “고메스는 맨유가 중원 보강을 위해 주시하는 이름 중 하나다”라며 “맨유가 유럽 대항전에 나서지 못하지만, 고메스는 아랑곳하지 않고 맨유 이적을 바라고 있다”라고 보도했다.

맨유는 겨울 이적시장을 앞두고 미드필더들과 이적설이 급물살을 탔다. 후벵 아모링 감독은 보강이 가장 시급한 포지션으로 중원을 뽑았다. 엘리엇 앤더슨(노팅엄 포레스트), 코너 갤러거(아틀레티코 마드리드), 앙겔로 슈틸러(슈투트가르트) 등이 언급된 가운데, 최근 들어서 고메스가 유력 후보로 떠올랐다.


브라질 국가대표인 고메스는 활동량, 태클, 판단력 등 수비 능력이 뛰어난 미드필더다. 상황에 따라서는 풀백 역할도 소화할 수 있다. 고메스는 지난 2023년부터 울버햄튼 중원을 지켰는데, 성실한 플레이로 좋은 평가를 받았다. 이번 시즌에도 리그 전 경기에 출전했다.

고메스는 브라질 국가대표팀에서 카세미루(맨체스터 유나이티드)의 후계자로 불린다. 공교롭게도 맨유는 카세미루를 대체할 선수가 필요하다. 카세미루는 내년 여름에 맨유와 계약이 만료된다. 다만 맨유는 전성기가 지난 카세미루와 재계약을 망설이고 있다.

카세미루의 자리를 고메스로 대체한다면 자연스러운 세대교체가 진행될 수 있다. 맨유가 고메스를 영입하려면 4,300만 파운드(약 835억 원)가 필요할 거로 보인다. 협상이 순조롭게 진행된다면, 겨울 이적시장이 열리자마자 합류할 가능성도 있다.


브라질 매체 ‘글로보’는 26일 “맨유는 고메스 영입을 두고 울버햄튼과 협상하고 있다. 이적료는 4,300만 파운드 수준이다”라며 “당사자 사이에는 연말에 협상이 완료될 거라는 낙관적인 기류가 있다. 고메스가 1월 1일에 곧바로 합류할 수도 있다”라고 보도했다.

한편, 고메스가 떠난다면 최하위인 울버햄튼은 지금보다 더 어려운 상황에 놓이게 된다. 아직 리그에서 승리가 없는 가운데, 주축 자원인 고메스까지 맨유행을 바라고 있어 골치가 아파졌다.

사진 = 소셜네트워크서비스(SNS) 캡처, 게티이미지"
20251128,"""황인범 페예노르트에서 이런 일이"" 19살 아들 프로 데뷔 시킨 '레전드' 판 페르시 ""감독으로 내린 결정""…양현준 골에 빛바랜 첫 선","사진캡처=BBC
로이터 연합뉴스
샤킬 SNS
[스포츠조선 김성원 기자]감독인 아버지가 아들을 프로 무대에 데뷔시켰다.

황인범이 몸담고 있는 네덜란드의 명문 페예노르트에서 일어난 일이다. 네덜란드 레전드 로빈 판 페르시 감독이 28일(한국시간) 네덜란드 로테르담의 스타디온 페예노르트 더카위프에서 열린 셀틱(스코틀랜드)과의 2025~2026시즌 유로파리그(UEL) 리그 페이즈 5차전에서 아들 샤킬 판 페르시를 1군 무대에 첫 출격시켰다.

샤킬은 후반 35분 교체 투입으로 프로 무대에 데뷔했다. 아버지는 설명이 필요없는 전설이다. 페예노르트에서 프로에 데뷔한 그는 2004년 아스널로 이적해 세계적인 공격수 반열에 올랐다. 2012년에는 라이벌 맨유로 이적하며 리그 우승 트로피까지 거머쥐었다. 판 페르시 감독은 페네르바체, 페예노르트를 거쳐 2019년 현역에서 물러났다. 네덜란드 국가대표로는 A매치 102경기에서 50골을 기록했다.
그는 올해 2월 '친정팀'인 페예노르트의 지휘봉을 잡았다. 2006년생인 샤킬은 아버지와 같은 포지션인 공격수로 대를 잇고 있다. 그는 맨시티 유스에서 두 시즌을 보낸 후 2017년 페에노르트로 둥지를 옮겼다.

2022년 프로 계약에 성공했고, 이날 첫 발을 내디뎠다. 샤킬은 나흘 전인 23일 네덜란드 에레디비시 네이메헌전에서 처음으로 엔트리에 포함됐지만 벤치에서 대기했다.

로이터 연합뉴스
EPA 연합뉴스
하지만 데뷔전은 패전으로 빛이 바랬다. 페예노르트는 전반 11분 일본인 공격수 우에다 아야세의 선제골을 리드를 잡았다. 그 흐름을 양현준이 돌려세웠다. 그는 전반 31분 동점골을 터트렸다. 셀틱은 양현준에 이어 전반 43분 하타테 레오, 후반 37분 베니아민 뉘그렌의 연속골을 앞세워 3대1로 역전승을 거뒀다.

샤킬은 1-2로 역전된 상황에서 투입됐고, 존재감은 미미했다. 단 1개의 슈팅에 그쳤다. 판 페르시 감독은 경기 후 ""나는 아빠로서가 아니라 감독으로서 그런 결정을 내렸다. 우리에게 골이 필요했기 때문""이라며 ""샤킬은 모든 각도에서 골을 넣을 수 있는 선수다. 내가 그를 1군에 올린 이유도 이 때문이다""고 밝혔다.

그리고 ""아버지 입장에서 아들이 데뷔하는 순간은 언제나 특별한 순간이다. 하지만 나는 그 순간을 즐길 정도의 정신이 없었다. 샤킬처럼 내 일을 하고 있었다""고 강조했다.

EPA 연합뉴스
부상 중인 황인범은 결장했다. UEL에서 승점 3점(1승4패)의 페예노르트는 30위에 머물렀다. 36개팀이 참가하는 UEL 리그 페이즈에선 유럽챔피언스리그(UCL)와 마찬가지로 팀당 8경기씩을 치른다. 1∼8위 팀은 16강에 직행하고, 9∼24위는 플레이오프(PO)를 통해 16강행을 가린다. 현재로선 16강 진출이 쉽지 않다.

판 페르시 감독은 ""나는 샤킬을 선수 중 한 명으로만 본다. 이건 우리가 몇 년 전에 이미 함께 일할 때 합의했던 거다. 샤킬은 그 부분을 정말 잘 대처하고 있고, 나도 그렇게 생각한다""고 말했다.

그는 또 ""물론 나중에 집에 돌아가면 서로 자랑스러워하는 즐거운 순간을 가질 수 있을 거다. 샤킬이 자랑스럽다. 데뷔하는 모든 선수처럼, 데뷔하기 전에 온갖 과정을 거쳐야 한다. 그는 열심히 노력했고, 그럴 자격이 있다. 그에게는 특별한 순간""이라고 덧붙였다."
20251128,"이러면 맨유서도 기회 없다…복귀 한 달 만에 또 부상→""정말 실망스러운 일이다""","사진=게티이미지


[포포투=이종관]

토비 콜리어가 또다시 부상을 당했다.

맨체스터 유나이티드 소식을 전하는 '유나이티드 인 포커스'는 27일(한국시간) ""맨유의 임대생 콜리어가 또 다른 부상으로 좌절을 겪었다""라고 전했다.

2004년생, 잉글랜드 국적의 미드필더 콜리어는 맨유가 기대하는 차세대 자원이다. 브라이튼 유스에서 성장한 그는 지난 2022년, 자유 계약(FA) 신분으로 맨유 유니폼을 입었다. 계약 기간은 3년 6개월.

2023-24시즌을 앞두고 1군으로 콜업됐다. 프리시즌 경기에 출전하며 팬들에게 눈도장을 찍은 그는 1군 데뷔전을 치르지는 못했으나 교체 명단에 포함되며 잠재력을 인정받았다. 그리고 시즌이 종료된 후 맨유와 재계약을 맺으며 동행을 이어갔다.

지난 시즌을 기점으로 본격적인 1군 생활을 시작했다. 맨체스터 시티와의 커뮤니티 실드에서 교체 투입되며 1군 데뷔전을 치른 그는 교체 자원으로 활용되며 준수한 경기력을 보여줬다. 2024-25시즌 최종 기록은 10경기.

데뷔 2년 차를 맞이한 콜리어. 올 시즌을 앞두고 잉글랜드풋볼리그(EFL) 챔피언십(2부리그)의 웨스트브롬위치 알비온으로 임대를 떠났으나 부상으로 고생 중이다. 이에 매체는 ""맨유에서 웨스트브롬위치 알비온으로 임대된 콜리어는 10월에 부상을 당한 이후 한 달간 경기에 나서지 못했다. 그리고 버밍엄 시티와의 경기에서 복귀전을 치렀으나 11분 만에 근육 부상으로 교체됐다. 이에 라이언 메이슨 감독은 '콜리어가 근육 부상을 당했다. 그에게는 힘든 일일 것이다. 그는 지난 시즌, 맨유에서 몇 번의 기회를 얻었고 나 역시 그에게 많은 인내심을 가졌다. 하지만 경기 시작 10분 만에 이런 일이 발생하는 것은 실망스러운 일이다. 그의 상태를 계속해서 지켜봐야 한다'라고 말했다""라고 보도했다.

사진=게티이미지"
20251128,"재계약 협상 '공식발표'...토트넘서 싸우고 LAFC서 재회→38살 골키퍼, 손흥민과 다시 이별?","사진=LAFC


[인터풋볼=신동훈 기자] 위고 요리스는 LAFC에 남아 손흥민과 동행을 이어갈까.

LAFC는 27일(이하 한국시간) 로스터 변경을 알렸다. 밴쿠버 화이트캡스와의 미국 메이저리그사커(MLS) 플레이오프 2라운드에서 패배한 이후 로스터 변경이 있었다. 케니 닐슨, 은코시 타파리, 토마스 하살 등과 계약 연장을 했다. 알렉산드루 발루샤, 라이언 라포소, 아담 살다나, 다비드 오초아 등은 LAFC를 떠났다.
재계약을 맺은 라이언 홀링스헤드, 세르지 팔렌시아, 티모시 틸먼, 네이선 오르다스는 로스터에 이름을 올렸고 손흥민, 드니 부앙가도 당연히 포함됐다. LAFC는 ""월드컵 우승 골키퍼 요리스, 그리고 마티외 슈아니에르와 계약 협상을 하고 있다""고 전했다.

요리스 재계약 여부가 관심을 모은다. 요리스는 1986년생으로 38살 골키퍼다. 니스에서 성장해 프로 데뷔를 했고 2008년 리옹으로 이적하면서 본격적으로 전성기에 돌입했다. 리옹에서 프랑스 리그앙 최고 골키퍼로 군림했고 프랑스 국가대표 주전 골키퍼로 발돋움했다.



토트넘 홋스퍼로 이적했다. 토트넘에서 무려 11년 동안 뛰면서 주전 골키퍼로 나섰다. 여러 골키퍼들이 요리스에게 도전을 했지만 모두 좌절됐다. 2015년부터 손흥민과 같이 뛰면서 관심을 받았다. 프랑스 국가대표로 계속 뛰면서 2018 국제축구연맹(FIFA) 러시아 월드컵 우승을 하면서 역사를 썼다. 토트넘에선 우승 없이 떠났다.

LAFC로 갔다. LAFC에서 노익장을 과시하면서 골문을 지켰다. 이번 여름 손흥민이 토트넘을 떠나 LAFC로 오면서 요리스, 손흥민이 재회를 했다. 둘은 토트넘에 이어 함께 뛰면서 LAFC 플레이오프 진출을 이끌었다.



요리스는 ""난 손흥민과 오랫동안 훈련했기 때문에 누구보다 그를 잘 알고 있다. 손흥민은 양발을 자유자재로 쓰는 선수다. 1대 1 상황에서 왼쪽이든 오른쪽이든 돌파와 슈팅 모두 능숙하게 해낸다. 지금까지 쌓아온 기록이 그 능력을 증명한다. 손흥민은 경기장 안팎에서 팀에 큰 영향을 미친다. 경기 외적으로도 정말 훌륭한 인물이며, 언제나 야망과 승리에 대한 갈망으로 가득 차 있다. 그 열정이 동료들에게도 긍정적인 에너지를 전한다""고 칭찬했다.

요리스는 LAFC와 계약 협상을 하고 있다. 손흥민과 계속 뛸지 지켜볼 일이다."
20251128,"'英 단독' 리버풀, 슬롯 '경질 임박'…결국 지난 시즌 우승은 클롭 덕! 8195억 투자→12위 추락 ""후임 포스텍 거론만으로도 심각""","[SPORTALKOREA] 황보동혁 기자=리버풀 FC가 아르네 슬롯 감독의 경질을 본격적으로 고려하기 시작한 분위기다.

영국 매체 '트라이벌 풋볼'은 28일(한국시간) ""PSV 에인트호번전 충격 패배 이후 슬롯 감독의 리버풀에서의 입지가 크게 흔들리고 있다""는 단독 보도를 전했다.

매체는 ""리버풀의 프리미어리그 타이틀 방어는 이미 사실상 붕괴됐고, 챔피언스리그에서도 PSV를 상대로 홈에서 1-4 참패를 당하며 슬롯의 미래에 더욱 짙은 먹구름이 드리워졌다""고 지적했다.



이어 ""상황이 악화되면서, 올여름 토트넘에서 경질되고 10월에는 노팅엄 포레스트에서도 해고된 엔지 포스테코글루가 차기 감독 후보로 언급되는 상황까지 왔다. 내부 소식통들은 그의 리버풀행 가능성은 낮다고 보고 있지만 이름이 등장하고 있다는 사실 자체가 심각성을 보여준다""고 덧붙였다.

보도에 따르면 리버풀은 원래 이번 시즌 슬롯을 전폭적으로 지원하고 시즌 종료 후 계약 연장을 추진할 계획이었다. 시즌 초반부터 문제점이 드러났지만 구단은 슬롯에게 팀을 정비할 시간을 충분히 부여해왔다. 그러나 상황은 매주 더 나빠지고 있다. ""시즌 중 경질은 없다""던 내부 분위기도 흔들리는 모양새다.

리버풀은 시즌 초반 리그 5연승으로 산뜻하게 출발했지만 이후 급격한 추락을 겪으며 최근 7경기에서 무려 6패를 당했고, 순위는 12위까지 하락했다.



안필드에서 노팅엄 포레스트에 0-3으로 완패한 데 이어 유럽축구연맹(UEFA) 챔피언스리그에서 PSV에 1-4로 패배하며 상황은 걷잡기 어려워졌다. 

물론 참작의 여지도 있다. 시즌 개막 직전 디오구 조타의 비극적인 사망 소식으로 팀 전체가 큰 충격을 받았고, 여름 이적시장 동안 대규모 보강을 단행한 만큼 선수 적응 기간이 필요하다는 점도 감안할 수 있다.

하지만 리버풀은 이번 여름 이미 알렉산더 이사크, 플로리안 비르츠, 위고 에키티케, 제레미 프림퐁, 밀로스 케르케즈, 지오반니 레오니 등 대형 영입에 총 4억 8,290만 유로(약 8,195억 원)를 투입했다.



전폭적인 투자에도 불구하고 성적은 오히려 지난해보다 떨어지고 있다. 특히 지난 시즌에는 위르겐 클롭 감독의 시스템을 그대로 이어받아, 사실상 큰 보강 없이도 우승을 차지했기에 현재의 급격한 추락은 슬롯의 지도력에 대한 의문만 더 커지고 있다. 

매체는 ""앞으로 치러질 웨스트햄 유나이티드, 선덜랜드, 리즈 유나이티드와의 리그 일정은 무너진 시즌을 되살릴 사실상 마지막 기회가 될 수 있다""며 ""하지만 지금 상황에서 슬롯에게 신뢰를 계속 부여하는 결정은 큰 모험이다. 리버풀이 여전히 슬롯을 믿고 있는 것인지, 아니면 믿고 싶어하는 것인지 곧 드러날 것""이라고 경고했다.

사진= 스카이스포츠, 게티이미지코리아, The Football Community

취재문의 sportal@sportalkorea.co.kr"
20251128,"아스널서 6분 뛰고 방출→5개월째 무소속, 日 대표팀 복귀 시동거나...개인 훈련 공개","사진=토미야스 SNS


[포포투=김아인]

토미야스 타케히로가 복귀를 준비하고 있다.

토미야스는 27일(한국시간) 자신의 SNS에 개인 훈련 중인 영상을 게시했다. 최근 몸 상태를 회복하면서 조금씩 컨디션을 끌어올리고 있는 것으로 보여진다. 해당 게시물에는 직전 아스널에서 한솥밥을 먹었던 윌리엄 살리바, 에디 은케티아, 알렉산드르 진첸코 등의 응원 댓글도 달렸다.

토미야스는 현재 무적 신분이다. 한때 유럽 최고의 수비수로 떠오르던 그는 벨기에 신트 트라위던, 이탈리아 볼로냐를 거쳐 프리미어리그(PL)로 향했다. 토트넘 홋스퍼와 연결됐지만 이적료 문제로 협상이 막히며 영입이 무산됐다. 그러다 아스널과 이적시장 막판 1860만 유로(약 270억 원)에 계약이 타결되면서, 2021-22시즌 개막을 앞두고 합류했다.

아스널에서의 첫 시즌은 긍정적이었다. 21경기에 출전하며 후방 안정에 역할을 했고, 다재다능한 수비 옵션이라는 평가를 받았다. 다만 시즌 후반에는 부상과 코로나19 확진이 겹치며 출전 시간이 줄었다. 이때부터 잦은 부상이 그의 성장을 꾸준히 방해하기 시작했다. 2022-23시즌에는 선발 기회가 6경기에 불과했으며, 2023-24시즌에도 리그 22경기 출전과 2골 1도움에 그쳤다.

지난 시즌은 더욱 불운했다. 개막 전 무릎 부상으로 출발부터 꼬였고, 10월이 되어서야 간신히 복귀했다. 사우샘프턴전에서 교체 출전했지만 6분 만에 또 쓰러졌다. 결국 2월에 두 번째 무릎 수술을 받으며 시즌을 조기 마감했고, 구단과 2026년까지 남아 있던 계약도 상호 합의로 정리되면서 아스널과의 여정은 종료됐다.

5개월 째 무소속 신분이지만, 복귀를 준비하는 모양새다. 그동안 토미야스는 세리에A 클럽 등 이적설이 흘러나오기도 했다.영국 '풋볼 런던'은 ""그가 다음에 어느 팀으로 향할지, 대표팀에 복귀할 수 있을지, 그 과정에서 계속 좋은 몸 상태를 유지할 수 있을지는 아직 알 수 없다""고 전했다.

빠르게 회복하고 팀을 구한다면 내년 월드컵 출전도 가능할 일이다. 최근 일본 축구 국가대표팀을 이끌고 있는 모리야스 하지메 감독은 토미야스의 월드컵 출전 가능성에 대해 ""충분히 가능하다고 생각한다""고 말하기도 했다.

사진=게티이미지"
