date,title,content
20250622,"'불법 촬영' 황의조, 재판부에 ""韓대표팀 복귀해 북중미 월드컵 나가고 싶다""... 감형 요청","[스타뉴스 | 이원희 기자]
황의조. /사진=뉴시스 제공
불법 촬영 혐의로 징역형의 집행유예를 선고받은 한국 축구대표팀 출신 공격수 황의조(33·알라얀스포르)가 2026 국제축구연맹(FIFA) 북중미 월드컵에 출전하고 싶다는 뜻을 밝혔다.

21일 KBS에 따르면 황의조는 지난 달 항소심 재판부인 서울중앙지법 형사항소1-3부(부장판사 조정래·진현지·안희길)에 항소이유서를 제출했다.

총 93페이지 분량의 항소이유서에는 황의조가 한국 축구대표팀에 복귀하고, 북중미 월드컵에 나가고 싶다면서 감형을 요청하는 내용이 담겼다.
황의조는 ""내년 북중미 월드컵에 '대한민국 간판 스트라이커이자 선배로서 후배들에게 노하우를 전달해 줘야 할 뿐만 아니라, 팀의 중심이자 기둥 역할을 해야 하는 상황""이라고 밝혔다.

또 황의조는 형이 확정될 경우 ""국가대표로서 삶은 종지부를 찍게 된다""고 호소했다.

앞서 황의조는 2022년 6~9월 동안 4차례에 걸쳐 여성 2명의 동의 없이 성적인 영상을 불법 촬영하거나, 영상통화를 녹화한 혐의로 재판에 넘겨졌다.

1심 재판부는 ""죄질이 좋지 않다""면서 황의조에게 징역 1년에 집행유예 2년을 선고했다. 또 200시간의 사회봉사와 400시간의 성폭력 치료 프로그램 수강도 명령했다.

지난 19일에는 황의조의 2심 첫 공판이 진행됐다. 황의조도 검은 정장 차림으로 직접 출석했다. 뉴스1, 뉴시스에 따르면 황의조 측 변호인은 ""피고인이 반성하고 있고 합의도 했다. 사진으로 피해자가 특정되지 않아 피해가 다소 작다. 전과도 없고 그동안 축구선수로 국가를 위해 열심히 한 점 등을 고려했을 때 1심 형이 다소 무겁다는 이유로 항소했다""고 주장했다.

2심 첫 공판에 참가한 황의조. /사진=뉴시스 제공
반면 피해자 측 변호사는 ""국가대표 선수고 팬이 많아 인터넷상에서 피해자에 대한 비난이 많았다. 이 때문에 피해자는 정신과 상담도 받지 못했다. (1심 집행유예로) 피고인은 일상으로 돌아갔지만, 피해자는 한 번 더 일상이 엉망이 됐다. 많은 사람이 받을 영향을 생각해 엄벌해 달라""고 요청했다.

황의조는 1심에서 징역 1년 집행유예 2년을 선고받아 실형을 면했지만, 형이 이대로 확정될 경우 대표팀 활동은 끊기게 된다. 대한축구협회 규정에 따르면 금고 이상 실형을 받으면 5년간, 집행유예를 받으면 기간 만료일부터 2년간 태극마크를 달 수 없다."
20250622,"한때 'SON 대체자' 17살 유망주, 결국 920억 토트넘 방출↑...""UCL급 영입 위해 현금화""","사진=토트넘 타임스


한때 손흥민의 대체자로 거론됐던 유망주가 올여름 방출될 위기다.

토트넘 소식통 '토트넘 홋스퍼 뉴스'는 22일(이하 한국시간) ""토트넘의 마이키 무어는 이번 여름 매우 중요한 시점을 앞두고, 그의 잠재력으로 인해 주목을 받고 있다. 하지만 재정 규제를 피하기 위해서는 기존 선수들의 방출이 불가피하며, 무어 역시 이적 대상으로 거론되고 있다""라고 보도했다.
2007년생 무어는 잉글랜드 출신 유망주 공격수다. 토트넘 성골 유스인 무어는 2014년부터 현재까지 팀에 몸 담고 있다. 지난 2023-24시즌 프로 데뷔에도 성공했다. 2024-25시즌부터는 본격적으로 1군과 함께 한 시즌을 소화했다.

무어의 잠재력이 주목을 받은 건 유럽축구연맹(UEFA) 유로파리그(UEL) 리그페이즈였다. 당시 무어는 AZ 알크마르전 선발 출전해 눈도장을 제대로 남겼다. 당시 영국 '풋볼 팬캐스트'는 ""무어가 실제로 자신을 미래의 스타로 알린 것은 UEL 리그페이지 알크마르전이었다. 그는 공격 포인트를 기록하지 못했지만 끊임없이 상대의 골칫거리였다""라고 조명한 바 있다.



해당 활약을 기점으로 무어는 부진하던 손흥민의 후계자라는 평가까지 받았다. '풋볼 팬캐스트'는 ""손흥민의 진정한 후계자는 토트넘 유스에서 나올 가능성이 크다. 무어는 아치 그레이와 루카스 베리발과 같이 클럽의 다른 흥미로운 10대 재능 같이 1군 경기에 많이 나서지 못했지만, 경기장에 나설 때마다 그는 엄청나게 인상적이었다""라고 전했다.

이어 ""놀라운 무어와 함께 토트넘은 손흥민이 결국 은퇴하거나 더 큰 부진을 할 때 이미 완벽한 국내 대체 선수가 있어서 대신 나서서 활약할 수 있다는 사실에 안심하고 또 안심할 수 있을 것""이라고 내다봤다.

그러나 무어의 활약은 오래가지 못했다. 시즌 막바지로 갈수록 영향력을 떨어졌다. 결국 공식전 19경기 1골 2도움에 그쳤다. 아직 어린 나이이기에 다음 시즌 한층 더 성장한 모습을 보일 것이라는 기대가 많았다.



다만, 토트넘의 인내심이 변수다. 다음 시즌 유럽축구연맹(UEFA) 챔피언스리그(UCL)에 나서는 토트넘은 유망주의 성장보다 최고 수준에서 경쟁력을 갖춘 즉시 전력 자원을 더 원하고 있다.

전 토트넘 출신 폴 로빈슨은 '토트넘 홋스퍼 뉴스'와의 인터뷰에서 ""무어의 잠재력을 고려했을 때, 이적료는 최소 5,000만 파운드(약 920억 원) 이상이어야 한다고 생각해요. 현재 토트넘도 다른 모든 클럽과 마찬가지로 재정적 지속 가능성 규정(PSR)을 고려해야 하고, 무어는 유소년 출신이기 때문에 매각 시 100% 순이익이 발생한다. 이는 곧 UCL에서 바로 뛸 수 있는 검증된 선수를 데려올 수 있는 재원을 의미한다""라고 주장했다.

한편, 무어는 세리에 A 명문 유벤투스의 관심을 받고 있다. 매체는 ""토마스 프랭크 감독은 반드시 이 10대 유망주를 직접 살펴보고 자신의 구상에 포함시킬지 판단할 것으로 보인다. 만약 계획에 포함되지 않는다면, 유벤투스는 무어 영입을 위해 움직일 준비가 돼 있다""라고 밝혔다."
20250622,"'현실 아이언맨' 40세 모드리치, '무더위+58G' 혹사에도 부상 無...감독도 ""좀 더 쥐어짤 것""","루카 모드리치의 헌신이 대단하다.

레알 마드리드는 23일 오전 4시(이하 한국시간) 미국 노스캐롤라이나주에 위치한 뱅크 오브 아메리카 스타디움에서 2025 국제축구연맹(FIFA) 클럽 월드컵(CWC) 조별리그 H조 2라운드 파추카와 격돌한다.

경기를 앞두고 레알의 베테랑 모드리치의 헌신이 큰 화제가 되고 있다. 1985년생 모드리치는 올해로 40세가 되는 노장 선수다. 그는 토트넘 홋스퍼를 떠나 2012년 레알에 합류한 후 현재까지 590경기 43골 90도움을 올렸다. 말 그대로 살아 있는 전설이다.

현재 모드리치는 레알과 13년을 함께하고 있는데 세월이 흘렀음에도 여전한 기량을 과시하고 있다. 2024-25시즌에만 모드리치는 공식전 58경기 출전해 4골 9도움을 올리고 있다. 게다가 시즌 내내 별다른 부상을 당하지도 않았다. 불혹을 앞둔 나이의 선수라고는 믿기지 않을 정도로 자기 관리가 대단한 모습이다.



주전 선수들의 잔부상으로 신음한 레알이다. 이에 은퇴를 목전에 둔 나이에도 철강왕 기질을 보이고 있는 모드리치가 대단해 보일 수밖에 없다. 스페인 '아스'는 22일 ""2024-25시즌의 극심한 체력 소모 속에서, 모드리치는 레알에서 가장 믿을 수 있는 '예비 엔진' 역할을 수행 중이다""라고 극찬했다.

이어 ""마이애미의 무더위로 시작된 이번 CWC는 체감온도 35도에 달하는 기후로 이어지며, 체력 소모가 엄청난 환경이다. 그런 와중에도 모드리치는 부상 한번 없이 시즌 59경기 출전을 눈앞에 두고 있다. 만약 파추카전에도 나선다면, 2024-25시즌 그의 59번째 경기이자, 여전히 '무결점'을 유지한 채 치르는 경기가 된다. 이는 잦은 부상에 시달리는 현재의 레알에서 더욱 놀라운 수치다""라고 조명했다.

레알과 마지막 동행이 될 이번 CWC에서도 모드리치의 열정은 식지 않았다. 이번 대회에서 모드리치보다 나이가 많은 선수는 단 3명 뿐. 파비오(44세), 오냥고(40세), 티아고 실바(40세)인데 이 중 수비수인 실바를 제외하면 모두 골키퍼다. 반면, 불혹을 앞둔 모드리치는 이들보다 많은 활동량을 가져가는 미드필더다.



사비 알론소 감독도 ""캡틴을 한 달간 조금 더 쥐어짜 보려 한다""라며 모드리치를 적극 기용할 뜻을 밝힌 바 있다. 모드리치의 지치지 않는 열정은 레알 팬들뿐 아니라 전 세계 축구 팬들에게 경외감마저 안겨주고 있다.

'아스'는 ""한마디로 모드리치는 토니 스타크가 아닌 '현실의 아이언맨'이다. 부상 없는 연속 출전, 경기 지배력, 정신력, 그리고 팀에 대한 헌신. 그는 고령의 선수들이 대부분 기복을 보이는 현대 축구에서 예외 중의 예외다""라고 평가했다."
20250622,"'사우디 NO' 손흥민, 친정 레버쿠젠 복귀한다... 새 감독 텐 하흐 'EPL 검증' SON 원해 ""10년 만에 컴백""","[스타뉴스 | 박재호 기자]
손흥민의 레버쿠젠 시절 모습. /AFPBBNews=뉴스1
손흥민(33·토트넘)이 친정 바이어 레버쿠젠으로 10년 만에 복귀할 가능성이 커지고 있다.

영국 '토크 스포츠'의 벤 제이콥스는 ""레버쿠젠이 손흥민의 영입을 원한다""고 주장했다.

영국 '윈풋볼'도 ""레버쿠젠이 토트넘 최고 스타인 손흥민 영입에 관심을 보인다. 과거 손흥민은 2013년 레버쿠젠으로 이적해 2시즌 동안 87경기 출전 29골을 넣었다""고 설명했다.
독일 명가 레버쿠젠은 손흥민의 친정팀으로도 잘 알려져 있다. 2013년 손흥민은 당시 레버쿠젠 최고 이적료인 1000만 유로(약 158억원)로 함부르크를 떠나 레버쿠젠 유니폼을 입었다. 이적 후 데뷔 시즌에 공신전 12골 6도움으로 핵심 공격수임을 증명했고, 2014~2015시즌엔 17골 2도움으로 분데스리가 커리어하이를 기록했다. 활약을 발판 삼아 2015년 분데스리가에서 토트넘으로 이적 잉글리시 프리미어리그(EPL) 진출을 이뤘다.

손흥민이 떠난 레버쿠젠은 최근 큰 명성을 얻었다. '명장' 사비 알론소 감독의 지휘 아래 2023~2024시즌 구단 역대 최초로 리그 무패 우승(28승6무) 신화를 쓰며 바이에른 뮌헨의 장기집권을 무산시켰다.

손흥민(가운데)의 레버쿠젠 시절 경기 모습. /AFPBBNews=뉴스1
새 시즌을 앞두고 큰 변화를 맞이한 레버쿠젠이다. 황금기를 이끈 알론소 감독이 레알 마드리드로 떠났고 에릭 텐 하흐 감독이 새로 지휘봉을 잡았다. 핵심 선수들도 대거 이탈했다. 공격수 플로리안 비르츠가 리버풀 유니폼을 입었고, 제레미 프림퐁도 리버풀이 이적이 유력하다. 센터백 조나단 타는 뮌헨으로 이적했다. 레버쿠젠은 10년 전 핵심 선수였던 손흥민을 영입해 공격을 보강한다는 계획이다.

손흥민은 지난 시즌 도중 토트넘과 1년 계약 연장 옵션을 실행하며 2026년 여름까지 계약 기간을 늘렸다. 연장 계약을 하자마자 손흥민이 시즌이 끝나면 다른 팀으로 간다는 소문이 끊임없이 이어졌다. 지금까지 뮌헨, 맨체스터 유나이티드, 바르셀로나 등 유럽 빅클럽들뿐 아니라 알 이티하드, 알 힐랄 등 사우디아라비아 이적설도 불거졌다.

최근 엔제 포스테코글루 감독이 토트넘을 떠나고 토마스 프랭크 감독이 새 감독으로 임명되자 손흥민의 이적설에 더욱 무게가 실리는 분위기다.

손흥민이 지난 5월 22일(한국시간) 스페인 빌바오의 산 마메스 경기장에서 열린 토트넘 대 맨유의 '2024~2025시즌 유럽축구연맹(UEFA) 유로파리그(UEL)' 결승전에서 우승한 뒤 트로피에 입 맞추고 있다. /AFPBBNews=뉴스1
유럽 시장 이적 전문가 파브리시오 로마노는 지난 20일 ""손흥민의 미래는 아직 결정되지 않았다. 프랭크 감독과 미래에 관해 대화해야 한다. 대화 이후 (이적 여부를) 결정할 것이다""라고 전했다. 손흥민은 프랭크 감독과 대화 후 본인이 다음 시즌 계획에 얼마나 비중이 있는지 판단하고 이적 여부를 결정할 것으로 보인다.

그러면서 로마노는 ""만약 엔제 포스테코글루 전 감독이 경질되지 않았다면 손흥민은 토트넘에 남았을 것이다""라고 전했다.

손흥민은 EPL보다 다른 유럽 리그로 향할 가능성이 커 보인다. 최근 레버쿠젠 외에도 조세 무리뉴 감독이 이끄는 페네르바체와 계약이 유력하다고 유럽 매체가 보도하기도 했다. 스페인 '피차헤스'는 지난 16일 ""페네르바체가 손흥민에게 구체적인 제안을 했다. 연봉 조건이 1200만 유로(약 190억원)다""라고 보도했다.

이어 ""유럽축구연맹(UEFA) 유로파리그(UEL)에서 우승한 손흥민은 토트넘을 떠날 준비를 하고 있다. 만 32살인 그에게 미래를 바꿔 놓을 엄청난 제안이 다가섰다""고 전했다.

토트넘 공격수 손흥민. /AFPBBNews=뉴스1"
20250622,"'07년생 천재' 야말, 30살 모델과 비키니 휴가→'포르노 스타'와 또 스캔들...""너가 거짓말이잖아!"" 진실공방 계속","[OSEN=고성환 기자] '제2의 메시' 라민 야말(18, 바르셀로나)이 진실 공방에 휩싸였다. 그가 최근 불거진 여자 모델들과 만남에 관한 소문을 정면 반박하고 나섰다.

글로벌 매체 '골닷컴'은 21일(한국시간) ""포르노 스타 클라우디아 바벨은 야말의 반박을 다시 부인했다. 온리팬스 모델인 그가 야말에게 거절당했다는 주장을 반박하면서 경기장 밖 드라마가 계속되고 있다""라고 보도했다.
야말은 스페인과 바르셀로나가 자랑하는 최고 기대주다. 그는 바르셀로나 유스 출신으로 어릴 적부터 네이마르나 호나우지뉴에 비견되는 재능을 뽐냈다. 2023년 4월엔 15살 9개월 16일의 나이로 라리가에 데뷔했다.

야말은 지난 시즌부터 주전으로 활약했다. 그는 리그 37경기에서 5골 5도움을 기록하며 바르셀로나의 미래이자 현재가 됐다. 바르셀로나는 빠르게 그와 2026년까지 재계약을 맺으며 10억 유로(1조 5601억 원)에 달하는 바이아웃 조항까지 넣었다.

무서운 성장세는 이번 시즌에도 이어졌다. 야말은 공식전 55경기 18골 21도움을 터트리며 월드클래스 윙어 반열에 올랐다. 실력을 입증한 그는 올여름 바르셀로나와 2031년까지 장기 재계약을 맺었으며 다가오는 2025-2026시즌부터는 리오넬 메시의 등번호 10번을 달고 뛸 예정이다.





다만 라말은 최근 들어 때 아닌 염문설에 휩싸였다. 만 17세인 그가 10살 넘게 차이 나는 연상의 모델들과 열애설이 터져 나온 것. 먼저 성인용 콘텐츠를 제작하는 소셜 미디어 스타 바벨이 야말로부터 수천 개의 메시지를 받았다고 주장했다. 그녀는 야말이 함께 아는 지인을 통해 자신에게 먼저 연락했지만, 거절했다고 밝혔다.

여기에 야말이 30세 스튜어디스이자 모델인 파티 바스케스와 함께 휴가를 즐기는 모습이 포착됐다. 스페인 '렉투파스'는 ""바르셀로나 스타 야말의 스캔들이 터졌다. 그는 바스케스와 뜨거운 시간을 보냈다. 둘은 수영복을 입고 다정하게 제트스키를 함께 타는 등 연인 같은 모습을 보였다""라고 보도했다.

두 사람은 같은 장소에서 찍은 사진을 나란히 소셜 미디어에 공유하기도 했다. 야말은 즉각 ""연인 사이가 아니다""라고 부정했지만, 많은 팬들은 믿지 않았다. 수영복을 입은 바스케스가 제트보트에서 야말을 껴안은 모습과 함께 일광욕을 즐기는 모습 등이 포착됐기 때문.

게다가 바스케스는 이미 남자친구가 따로 있는 것으로 알려졌기에 야말이 '엄마뻘' 모델과 바람을 피운 뒤 거짓말하고 있다는 비판이 나오고 있다. 일부 팬들은 바스케스의 소셜 미디어에 몰려가 살해 협박성 댓글까지 남기기도 했다. 일단 바스케스는 같이 여행을 즐긴 건 맞지만, 그걸 제외하면 아무 일도 없었다고 말하고 있다.





바벨과 진실공방도 계속되고 있다. 먼저 야말은 자신이 바벨에게 먼저 연락했다가 거절당했다는 주장을 단호하게 거부했다. 그는 ""전부 거짓말이다. 그녀를 본 적도 없다. 우리 둘이 만난 적도 없다. 우리 집에 들어오는 사진 같은 건 있을 수도 없다""라며 ""난 엄마랑 같이 산다. 우리 엄마는 어떤 여자도 집에 들이지 않는다""라고 받아쳤다.

심지어 바벨이 야말을 이용하려 했다는 주장까지 나왔다. 스페인 언론인 알렉스 알바레스는 오히려 야말이 바벨의 만남 요구를 거절했으며 바벨이 화를 냈다고 설명했다. 또한 그는 바벨이 사진작가와 함께 만남을 조작하려 했다는 정황이 포착됐다며 민감한 사진을 만들어 돈을 벌려 한 게 아닌지 의심했다.

하지만 바벨 측의 입장은 정반대다. 그는 소셜 미디어를 통해 ""난 이 문제에 대해 공개적으로 발언하지 않으려 했지만, 야말이 먼저 언급했기 때문에 내 입장을 공유하겠다. 그는 어머니와 함께 살고 있다고 하지만, 실제로는 혼자 살고 있다. 내 연락처를 차고 만나자고 고집했던 사람이 나를 거절했다고 말한다""라고 반박문을 게시했다.

또한 바벨은 ""야말은 여러 파티에서 나와 마주쳤음에도 불구하고 우리가 만난 적이 없다고 부인한다. 모욕적이고 명예훼손적인 메시지를 그만 보내주길 요청한다""라며 ""난 미성년자와 관계를 맺은 적도 없고, 만나려고 한 적도 없다. 명성이나 돈과 관련된 계획도 없었다""라고 덧붙였다. 

/finekosh@osen.co.kr

[사진] 스포츠 키다, 클라우디오 바벨, 렉투파스, 블라우그라나 펄스, 컴플리트 풋볼 247 소셜 미디어."
20250622,"""전성기 끝났다! PL 속도 못 따라가"" 충격 혹평...32세 손흥민, ""느린 리그"" 사우디행 현실로","사진=스퍼스 코너


손흥민의 기량이 프리미어리그 수준에 못 미친다는 충격적인 혹평이다.

올여름 손흥민의 거취가 불투명하다. 1992년생 손흥민은 어느덧 토트넘 홋스퍼 소속 10년 차를 보냈다. 그러나 오랜 세월만큼 손흥민의 예리함에도 점차 녹이 슬고 있다. 과거 손흥민은 폭발적인 스프린트와 강력한 양발 마무리를 강점으로 프리미어리그를 수놓았다.

그러나 2024-25시즌 손흥민의 기량 하락이 뚜렷해졌다. 손흥민은 공식전 46경기 11골 11도움을 올렸다. 공격 포인트 자체는 준수하지만, 순도가 매우 떨어진다. 주요 경기에서 침묵하는 빈도가 잦았고, 시즌 막바지로 갈수록 생산력도 저조했다. 특히 드리블, 슈팅 전환율 등 세부 지표가 모두 하락세를 기록했다.
결국 손흥민과 올여름 작별해야 한다는 여론이 들끓었다. 영국 '텔레그래프'는 ""토트넘이 스쿼드 재편과 이적 자금 확보를 추진하는 가운데, 손흥민의 이적이 하나의 출구 전략이 될 수 있다는 분석이다. 손흥민은 올 시즌 유럽축구연맹(UEFA) 유로파리그(UEL) 우승을 이끈 뒤 현재 계약이 1년 남은 상태다. 이적료 수익을 거둘 수 있는 현실적인 마지막 기회가 이번 여름이라는 점에서, 토트넘은 이를 놓치지 않으려 할 수 있다""라고 설명했다.

평소 손흥민을 맹비판하기로 유명한 토트넘 출신 전 선수 제이미 오하라도 해당 여론에 합류했다. 주장 박탈설, 매각설 등 손흥민 깎아내리기로 유명세를 탄 오하라는 이번에는 손흥민이 프리미어리그 수준에 미달한다고 주장했다.



오하라는 21일(이하 한국시간) 영국 '포포투'와의 인터뷰에서 ""이제는 손흥민을 떠나보내야 할 시점""이라며 ""좋은 기회가 온다면 난 그를 보내줄 것이다. 손흥민 최고의 폼은 이제 지났고, 조금 더 느린 리그로 가야 할 시기가 왔다""라고 말했다.

이어 ""프리미어리그는 너무 빠르고, 손흥민은 예전만큼 빠르지 않다. 손흥민은 정말 믿기 어려울 정도로 토트넘을 위해 헌신했지만, 때로는 축구도 변화를 맞이해야 한다. 그는 레전드다. 개인적으로는 그가 토트넘에 남아 예전처럼 활약하길 바라지만, 솔직히 말해 다시 그런 모습을 보긴 어려울 것 같다. 그의 전성기는 지나갔다""라고 지적했다.

계속해서 손흥민의 기량 하락을 꼬집었다. 오하라는 ""손흥민은 과거에는 공을 툭 쳐내기만 하면 수비수를 따돌릴 수 있었다. 하지만 지금은 그게 안 된다. 라이언 긱스도 그랬다. 젊을 땐 번개같았지만 나이가 들자 플레이 스타일을 바꿨다. 미드필더처럼 변했다. 손흥민도 그런 식으로 플레이를 바꿀 수 있을까? 새로운 방식으로 축구를 배워야 한다""라고 이야기했다.

마지막으로 손흥민이 올여름 토트넘을 떠날 시점이라는 데 동의했다. 오하라는 ""당연히 그럴 수 있다. 그가 항상 원했던 우승컵을 마침내 들어 올렸고, 그것도 토트넘에서 해냈다. 그는 믿을 수 없을 만큼 훌륭한 리더였고, 뛰어난 선수였다. 상업적으로도 아시아에서 토트넘의 위상을 끌어올린 인물이다. 그는 이 클럽의 레전드다""라고 했다.



오하라의 주장처럼 손흥민이 프리미어리그보다 더 느린 리그로 가야한다면 현재로서는 사우디아라비아가 유력하다. 영국 '토크스포츠'는 ""올여름 알 아흘리, 알 나스르, 알 카디시 세 구단이 손흥민 영입에 관심을 보이고 있다. 구단은 손흥민 영입을 위해 4,000만 유로(약 630억 원)를 지불할 준비가 돼 있다. 사우디 측은 손흥민에게 연간 약 3,000만 유로(약 430억 원)의 연봉을 제안할 계획이다""라고 밝혔다.

손흥민의 거취는 토마스 프랭크 감독과의 면담 후 정해질 전망이다. 손흥민은 7월 둘째 주 토트넘 훈련장에서 프랭크 감독을 첫 대면할 예정이다. 만일 이적이 결정된다면 손흥민은 오는 8월 내한 일정 소화 후 본격적인 토트넘 이탈을 준비할 전망이다."
