date,title,content
20250818,'10분 뛴 김민재가 풀타임 요나단 타보다 낫다'…김민재 대신 선발 출전 센터백 비난,"김민재/게티이미지코리아
요나단 타/게티이미지코리아

[마이데일리 = 김종국 기자] 바이에른 뮌헨의 김민재가 시즌 첫 공식전에서 교체 출전했다.

바이에른 뮌헨은 17일 오전(한국시간) 독일 슈투트가르트 메르세데스 벤츠 아레나에서 열린 2025 독일 슈퍼컵에서 슈투트가르트에 2-1로 이겼다. 바이에른 뮌헨의 김민재는 이날 경기에서 후반 35분 교체 출전해 팀 승리를 함께했다. 바이에른 뮌헨은 요나단 타와 우파메카노가 센터백으로 선발 출전했고 김민재는 경기 종반 짧은 시간 동안 활약했다.

바이에른 뮌헨은 슈투트가르트를 상대로 케인이 공격수로 출전했고 디아스, 올리세, 나브리가 공격을 이끌었다. 고레츠카와 킴미히는 중원을 구성했고 스타니시치, 요나단 타, 우파메카노, 라이머가 수비를 맡았다. 골문은 노이어가 지켰다.
양팀의 맞대결에서 바이에른 뮌헨은 전반 18분 케인이 선제골을 터트렸다. 케인은 페널티에어리어 정면에서 오른발 슈팅으로 슈투투가르트 골문 구석을 갈랐다.

전반전을 앞서며 마친 바이에른 뮌헨은 후반 32분 디아스가 추가골을 성공시켰다. 디아스는 나브리의 크로스를 골문앞 헤더 슈팅으로 마무리해 슈투트가르트 골망을 흔들었다. 반격에 나선 슈투트가르트는 후반전 추가시간 레벨링이 만회골을 기록했지만 승부를 뒤집지 못했고 바이에른 뮌헨의 승리로 경기가 종료됐다.

바이에른 뮌헨은 지난 6월 클럽월드컵을 앞두고 레버쿠젠 센터백 요나단 타를 영입했다. 요나단 타는 2023-24시즌 레버쿠젠의 분데스리가 무패우승 주역으로 활약한 가운데 바이에른 뮌헨에 합류해 김민재와 포지션 경쟁을 예고하고 있다. 요나단 타는 14일 독일 키커를 통해 바이에른 뮌헨 이적을 결심했던 것에 대해 ""콤파니 감독과 소통하는 방식이 좋았고 에베를 디렉터와 나와 많은 이야기를 나눴다. 나에게 제안한 프로젝트가 마음에 들었다. 클럽이 나에게 무엇을 원하고 내가 팀에 기여할 수 있는 방법을 알아봐줬다. 내게 딱 맞는 도전이었다""고 언급했다. 또한 ""목표는 가능한 많은 타이틀을 차지하는 것이다. 또한 바이에른 뮌헨의 명성을 꾸준히 강화하고 싶다""며 의욕을 드러냈고 독일 슈퍼컵에서 김민재를 대신해 선발 출전했다.

요나단 타는 슈퍼컵에서 풀타임 활약하며 50번의 볼터치와 함께 패스 성공률 98%를 기록했다. 6번의 볼 경합 상황에서 한 차례 승리하는데 그쳤다. 김민재는 후반 35분 우파메카노 대신 교체 출전해 10분 남짓 활약한 가운데 2번의 태클과 2번의 인터셉트를 기록했다. 세 차례 볼 경합 상황에선 모두 승리했다. 유럽축구 통계매체 소파스코어는 조나단 타보다 김민재에게 높은 평점을 부여하기도 했다.

독일 매체 스포르트는 요나단 타의 슈투트가르트전 활약에 대해 평점 4.5등급을 부여하며 혹평했다. 이 매체는 '요나단 타는 일대일 상황에서 자주 패배했고 수비에 필요한 안정감을 제공하지 못했다'고 비난했다. 반면 김민재에 대해선 '김민재는 완벽한 모습을 보였지만 바이에른뮌헨 수비진은 안정적인 모습을 보여주지 못했다'는 뜻을 나타냈다.

김민재는 올 여름 이적시장에서 다양한 이적설과 함께 거취가 주목받고 있다. 독일 매체 메르쿠르는 지난 14일 '바이에른 뮌헨의 에베를 디렉터는 김민재의 이적도 추진하고 있다. 바이에른 뮌헨은 4500만유로의 이적료로 영입한 김민재를 3000만유로의 이적료에도 이적시킨다는 방침'이라고 전했다. 또한 '바이에른 뮌헨의 콤파니 감독은 김민재를 높게 평가하고 있고 김민재와 좋은 관계를 유지하고 있다. 김민재는 공격적인 플레이와 활발한 움직임으로 요나단 타보다 바이에른 뮌헨의 시스템에 더 잘 적응하고 있다'며 콤파니 감독은 김민재 이적을 꺼려한다는 뜻을 나타냈다.
김민재/게티이미지코리아
요나단 타/게티이미지코리아"
20250818,손흥민에게 화내던 '문제아' 맞아요? 이게 바로 '다이어식 인생 역전'...뮌헨 특급 백업→모나코에선 '결승골+MVP 미친 데뷔전',"사진=트위터 캡처
로이터연합뉴스
[스포츠조선 이현석 기자]'인생 역전'의 주인공이다. 에릭 다이어의 선수 경력이 황금빛으로 물들고 있다.

프랑스의 레퀴프는 17일(한국시각) '에릭 다이어가 AS모나코에서 리그1에 성공적으로 입성했다'라고 보도했다.

레퀴프는 '다이어가 리그1 첫 경기를 거의 실수 없이 완벽하게 소화했다'라며 다이어의 활약을 칭찬했다. 리그1 공식 홈페이지도 '신입생 다이어가 모나코의 개막전 승리를 견인했다'라고 다이어의 개막전 활약을 주목했다.

로이터연합뉴스
모나코는 17일 모나코 스타드 루이2세에서 열린 르아브르와의 2025~2026시즌 리그1 1라운드 경기에서 3대1로 승리했다. 승리의 주역은 다이어였다. 모나코는 가티에 요리스의 자책골로 리드를 잡은 후 다이어의 추가 득점이 터졌다. 라술 은디아예에게 실점했지만, 마그네스 아클레우슈의 쐐기골이 터지며 승리했다. 다이어의 득점은 결승골이 됐다.

다이어는 공격 외에도 수비에서 인상적인 활약을 펼쳤다. 패스 성공 108회, 패스 성공률 99%, 롱패스 성공률 100%, 클리어링 6회, 인터셉트 1회, 슛 블록 2회 등을 기록했다. 축구통계매체 풋몹은 다이어에게 평점 8.4점을 주며 경기 최우수 선수로 선정했다.

다이어는 경기 후 구단 인터뷰에서 ""첫 출전이라 어떨지 예상할 수 없었지만, 정말 좋은 하루였다. 승리와 내 득점에 만족한다. 하지만 가장 중요한 것은 팀이다. 시즌 초반 좋은 모습으로 다시 축구할 수 있어서 기쁘다""라고 소감을 밝혔다.

AFP연합뉴스
그야말로 경력의 대반전이다. 다이어는 한때 토트넘에서 최악의 수비수로 꼽히며 내리막을 걷고 있었다. 살아날 수 없는 부진의 늪에 빠졌다는 평가가 쏟아졌다. 토트넘에서는 상대에게 공격을 허용한 후 손흥민에게 화를 내는 장면으로 많은 논란이 되기도 했다. 반전의 시작은 바이에른 뮌헨 이적이었다. 바이에른은 해리 케인 영입 후 다이어까지 노리며, 수비 보강에 성공했다. 바이에른에서도 부진할 것이라는 전망과 달리 다이어는 주전 수비수 김민재를 한때 밀어내는 등 준수한 활약을 펼치며 바이에른에서 꾸준히 기회를 받았다.

2024~2025시즌 이후 바이에른은 쏠쏠한 백업이었던 다이어와 계약 연장까지 고려했으나, 다이어의 선택은 이적이었다. 다이어는 주전으로 활약하기 위해 모나코로 떠났다. 다이어는 모나코 공식 데뷔전인 이번 리그 경기에서 맹활약하며, 자신의 선수 경력이 다시금 상승세로 전환됐음을 알렸다. 다이어의 전성시대가 열렸다."
20250818,"한국인 선수 3명이 동시에 그라운드에? 이강인 61분 출전, 권혁규-홍현석 출전...PSG 개막전 승리 [스춘 해축]","비티냐 결승골로 낭트 1대 0 격파, 권혁규·홍현석과 한국 선수 매치 '화제'
이강인의 활약 속에 PSG가 승리했다(사진=파리생제르맹 SNS)


[스포츠춘추]

프랑스 리그1에서 전례 없는 '코리안 더비'가 펼쳐졌다. 한국인 선수 3명이 한 경기에서 동시에 활약한 역사적 경기에서 이강인의 파리 생제르맹(PSG)이 승리를 거뒀다.
루이스 엔리케 감독이 이끄는 PSG는 18일(한국시간) 프랑스 낭트의 스타드 드 라 보주아르에서 열린 2025-26 리그1 개막전에서 낭트를 1대 0으로 꺾으며 5연패 도전의 첫 승을 신고했다.

이날 경기에선 한국인 선수 3명이 모두 출전하는 '코리안 더비'가 성사돼 화제가 됐다. PSG에서 이강인이 선발로 나선 가운데, 낭트 역시 올 시즌 새로 가세한 권혁규와 홍현석이 각각 선발과 교체로 투입됐다. 유럽 빅리그에서 한 경기에 한국인 선수 3명이 동시에 뛰는 것은 매우 드문 일로, 전반 9분 이강인의 정확한 크로스를 권혁규가 걷어내는 장면은 이날의 상징적인 순간이었다.

그 중심에서 이강인은 61분간 존재감을 발휘했다. 슈퍼컵에서 극적인 추격골로 팀을 구원한 지 나흘 만에 다시 한 번 핵심 역할을 해냈다. 축구 통계 매체 풋몹에 따르면 이강인은 패스 성공률 92%(62회 중 57회)를 기록하며 경기 흐름을 안정적으로 조율했다. 기회 창출 3회, 슈팅 2회, 크로스 성공 3회 등의 수치로 공격 전개의 핵심축 역할을 했다.

낭트의 한국인 듀오 역시 각자 맡은 바 역할에 충실했다. 셀틱에서 완전 이적한 권혁규는 선발로 나서 79분을 소화하며 수비형 미드필더로서 안정감을 과시했다. 패스 성공률 73%(15회 중 11회), 차단 3회, 지상 볼 경합 성공률 100% 등의 수치를 남겼다. 마인츠에서 임대로 합류한 홍현석은 후반 14분 투입돼 32분간 뛰며 슈팅 1회와 패스 성공률 71%를 기록했다. 이강인이 교체되기 전까지는 한국인 선수 3명이 동시에 그라운드에 서는 역사적 순간이 연출되기도 했다.

이강인의 활약 속에 PSG가 승리했다(사진=파리생제르맹 SNS)


경기의 주도권은 처음부터 PSG가 장악했다. 전반에만 74%의 점유율을 기록한 PSG는 낭트를 숨 막히게 압박했다. 낭트는 전반 39분 코너킥 상황을 제외하고는 제대로 된 슈팅조차 시도하지 못할 정도였다. 하지만 PSG 역시 브래들리 바르콜라의 오른발 슈팅과 루카 에르난데스의 헤더가 상대 골키퍼에게 막히는 등 득점으로 연결되지 못해 전반을 0대 0으로 마쳤다.

답답한 교착 상태는 후반 22분 비티냐의 환상적인 중거리 슛으로 깨졌다. 누누 멘데스의 패스를 받은 비티냐가 아크 정면에서 시도한 오른발 슈팅이 수비수 치도지 아와지엠을 맞고 굴절되며 골키퍼 안토니 로페스를 완전히 속였다. 20m 거리에서 날아온 이 득점은 PSG의 결승골이 됐다. 후반 31분 곤살루 하무스의 추가골이 VAR 판독 결과 오프사이드로 취소됐지만, PSG에게는 1골만으로도 충분했다.

이번 승리로 PSG는 최근 4시즌 연속 우승팀의 위력을 다시 한 번 입증했다. 지난 시즌 득실차 19점으로 압도적 우승을 차지한 디펜딩 챔피언답게 개막전부터 강력한 면모를 자랑했다. 루이스 엔리케 감독이 슈퍼컵 선발 멤버 중 7명을 교체하며 스쿼드 로테이션을 적극 활용했음에도 여유 있는 승리를 거둔 것은 PSG 전력의 뎁스를 보여주는 대목이다. 우스만 뎀벨레, 데지레 두에, 흐비차 크바라츠헬리아 등 쟁쟁한 공격수들을 벤치에 앉히고도 우세한 경기력을 발휘한 PSG다.

PSG는 이번 주말 파르크 데 프랭스에서 앙제 SCO와 홈 개막전을 치른다. 연속 승리로 5연패 행진에 탄력을 받을 수 있을지 주목되는 가운데, 이강인에게는 홈 팬들 앞에서 또 다른 특급 활약을 펼칠 기회가 기다리고 있다."
20250818,"""최소 1132억 부터 시작"" 토트넘 '손흥민 7번 대체자' 영입 답도 없다 'HERE WE GO' 확인!...""맨시티는 급하지 않아""","[SPORTALKOREA] 황보동혁 기자= 토트넘 홋스퍼 FC가 손흥민(로스앤젤레스 FC)의 빈자리를 메우기 위해 추진하던 사비뉴(맨체스터 시티 FC) 영입이 난관에 부딪혔다.

유럽 이적시장 전문가 파브리시오 로마노 기자는 18일(한국시간) 유튜브 채널을 통해 ""토트넘이 5천만, 6천만, 6천5백만 유로를 제시해도 맨시티는 팔지 않는다. 최소 7천만 유로(약 1,132억 원) 이상이 돼야 이적을 고려할 것이다. 맨시티는 전혀 급하지 않다""고 전했다.

다만 그는 ""사비뉴가 직접 펩 과르디올라 감독에게 '떠나고 싶다'고 요청한다면, 과거 훌리안 알바레스 사례처럼 이적을 허용할 수도 있다""고 덧붙였다.



실제로 맨시티는 사비뉴를 쉽게 내줄 이유가 없다. 잭 그릴리시(에버튼 FC), 제임스 맥아티(노팅엄 포레스트 FC) 등 공격 자원이 이미 두 명이나 팀을 떠난 상황이기 때문이다.

로마노 기자는 만약 사비뉴 이적이 성사된다면 토트넘이 레알 마드리드 CF의 호드리구 고이스를 노릴 가능성이 있다고 밝혔지만, 이적시장이 2주밖에 남지 않은 데다 레알이 1억 유로(약 1,617억 원)를 요구하고 있어 현실적으로 쉽지 않다.

손흥민은 2015년 입단 이후 10년간 공식전 454경기에서 173골 101도움을 기록하며 구단 역사상 가장 위대한 공격수 중 한 명으로 자리매김했다.



비록 지난 시즌 프리미어리그에서는 7골 9도움에 그쳤지만, 그의 빈자리를 메울 확실한 카드가 필요한 상황이다. 마티스 텔, 윌슨 오도베르, 브레넌 존슨, 마르노 솔로몬 등이 거론되지만 손흥민의 영향력을 완전히 대체하기에는 의문부호가 따른다.

이때문에 토트넘은 과거 지로나에서 돌풍을 일으킨 사비뉴를 영입하려는 것으로 보인다. 

그는 2022년 여름 프랑스 트루아로 이적한 뒤 PSV 에인트호번과 지로나로 임대 이적했으며 특히 2023/24시즌 지로나에서 폭발적인 스피드와 화려한 드리블, 날카로운 왼발을 앞세워 41경기 11골 10도움을 기록, 팀의 라리가 3위 돌풍을 이끌었다.



이 활약으로 라리가 올해의 팀과 U-23 이달의 선수상을 수상했다. 이러한 활약을 발판으로 지난 시즌 맨시티가 4,000만 유로(약 647억 원)에 그를 영입했다.

데뷔 시즌에 48경기 3골 11도움이라는 준수한 기록을 남겼지만, 시즌 후반 들어 경기력 기복과 체력 저하로 주전 경쟁에서 밀리기 시작했다.

이 틈을 타 토트넘이 그를 노렸지만 맨시티가 잔류 쪽에 무게를 두고 있어 토트넘은 난처한 상황이다.

한편 토트넘은 에베레치 에제(크리스탈 팰리스 FC) 영입에도 가까워진 상태다. 그러나 그는 시즌 아웃이 유력한 제임스 매디슨 대체자에 가까운 자원이어서, 사비뉴 딜이 지연될 경우 토트넘이 다른 대안을 서둘러 찾아야 할 것으로 보인다.

사진= 맨체스터 시티 뉴스, 게티이미지코리아 

취재문의 sportal@sportalkorea.co.kr"
20250818,"韓 축구 초대박 터진다…""이강인, EPL 이적 급물살"" 아스널↔PSG 전격 접촉 중","[스포티비뉴스=박대성 기자] 이강인(24·파리 생제르맹)이 또 이적설에 급물살을 탄다. 유럽 이적 시장 막판에 프리미어리그 팀 유니폼을 입을 가능성이 있다. 올해 겨울에도 뜨겁게 타올랐던, 프리미어리그 우승 경쟁 팀 아스널이다.

영국의 '기브 미 스포츠'는 18일(한국시간) ""아스널이 몇 주 안에 파리 생제르맹에 접근할 가능성이 있다. 아스널은 파리 생제르맹 미드필더 이강인에게 관심이 있다. 잠재적인 영입을 추진하기 위해 파리 생제르맹에 접촉을 시도했다""라고 알렸다.

아스널은 이미 이번 여름 이적시장에서 마르틴 수비멘디, 노니 마두에케, 빅토르 요케레스 등 굵직한 영입을 마쳤지만, 여전히 스쿼드 보강에 의욕적인 모습을 보이고 있다. 이강인의 다재다능함이 아르테타 감독의 전술 구상과 맞물리며, 영입 타깃으로 급부상한 것이다.
이강인은 공격형 미드필더뿐 아니라 좌우 측면, 심지어는 스트라이커나 수비형 미드필더까지 소화 가능한 전술적 유연성을 갖춘 선수다. 아르테타 감독이 중시하는 '멀티 포지션 자원'이라는 점에서, 아스널 합류 시 마르티넬리, 외데고르, 사카와 함께 강력한 공격 조합을 이룰 것으로 기대된다.

그러나 파리 생제르맹에서 이강인의 현재 입지는 다소 애매하다. 지난 시즌 모든 대회 통틀어 49경기에 출전하며 7골 6도움을 기록했지만, 평균 출전 시간은 50.2분에 불과했다. 프랑스 리그앙 우승 확정 후 최종전 결장은 물론, 쿠프 드 프랑스와 유럽축구연맹(UEFA) 챔피언스리그 결승전에서도 1분도 출전하지 못했다. 국제축구연맹(FIFA) 클럽 월드컵에서도 4경기 출전이었는데 평균 출전 시간은 15분에 불과했다. 파리 생제르맹 안에서 이강인의 입지가 주전급은 아니라는 걸 말해주는 수치다.



프랑스 '레키프'와 스페인 '마르카'에 따르면, 루이스 엔리케 감독은 이강인의 기량 자체는 인정하고 있으나, 팀 내 경쟁이 치열한 만큼 주전으로서의 기회는 제한적이다. 이강인이 직접 이적을 요청할 경우, 파리 생제르맹는느 만족할 만한 제안이 들어온다면 이를 수용할 의사가 있는 것으로 알려졌다. 현재 이강인의 이적료는 3500만(약 569억 원) 수준으로 추산된다.

일각에서는 아스널뿐 아니라 맨체스터 유나이티드(맨유)도 이강인 영입전에 가세했다는 보도가 이어지고 있다. 영국 매체 '커트옵사이드'는 ""맨체스터 유나이티드의 아모림 감독이 이강인을 전술 구상에 포함시키고 있으며, 직접 영입을 검토 중""이라고 보도했다. 맨체스터 유나이티드는 측면 자원의 기량 저하로 창의적인 플레이가 부족한 상황에서, 이강인의 기술력과 시야, 그리고 빠른 판단력을 높게 평가하고 있다. 이강인은 토트넘 홋스퍼와 유럽축구연맹(UEFA) 슈퍼컵에서 교체 투입 직후 만회골을 기록했고, 파리 생제르맹은 이강인의 만회골을 발판 삼아 대역전승과 창단 첫 슈퍼컵 우승을 해냈다. 유럽 이적 시장 막판에 이강인이 연결되고 있는 이유다.

그럼에도 불구하고 아스널이 이강인 영입에 있어 더 유리한 고지에 있다는 관측이 우세하다. 아르테타 감독은 선수의 전술 적응력을 중요시하며, 이강인의 스타일이 아스널의 빠른 템포와 패스 중심 플레이에 잘 어울린다고 판단하고 있다. 또한 아스널은 최근 수년간 체계적인 팀 개편과 유망주 육성에 집중해 왔고, 이강인이 성장할 수 있는 이상적인 환경이라는 분석도 설득력을 얻고 있다.



이강인이 아스널로 이적하게 될 경우, 한국인으로서는 박주영(2011~2014년) 이후 14년 만에 아스널 유니폼을 입게 되며, 프리미어리그 진출 한국 선수로는 통산 21번째 기록이다. 박주영은 아스널에서 공식 경기 7경기 1골이라는 아쉬운 성적을 남기고 팀을 떠났지만, 이강인은 보다 확고한 입지 구축을 목표로 하고 있는 만큼 새로운 도약의 발판이 될 수 있다.

이강인에게는 지금이 커리어의 중대한 갈림길이다. 파리 생제르맹에 잔류해 로테이션 자원으로 남을 것인지, 혹은 프리미어리그라는 새로운 무대에서 자신을 증명할 것인지는 오직 그의 선택에 달려 있다. 24세라는 나이는 경험과 패기를 모두 갖춘 시점이며, 향후 몇 년이 그의 축구 인생을 결정짓는 핵심 시기가 될 전망이다.

아스널과 맨체스터 유나이티드를 포함해 여러 유럽 명문 구단들이 이강인의 상황을 주시하고 있는 것으로 보인다. 이적시장 마감까지 남은 2주 동안 그의 거취는 뜨거운 이슈로 부상할 것으로 보인다."
20250818,‘슈퍼스타 쏘니 효과 미쳤다!’ 손흥민 LAFC 홈 데뷔전 입장권 최고가 무려 526만 원…원래 10배,"[사진] ⓒGettyimages(무단전재 및 재배포 금지)


[OSEN=서정환 기자] 슈퍼스타 손흥민(33, LAFC) 효과가 미국을 강타하고 있다. 

손흥민은 데뷔와 동시에 미국무대를 접수하고 있다. LAFC는 17일(한국시간) 미국 매사추세츠주 폭스버러 질레트 스타디움에서 열린 2025시즌 MLS 27라운드에서 손흥민의 첫 도움이 터지며 뉴잉글랜드 레볼루션을 2-0으로 눌렀다. 

손흥민이 첫 선발부터 도움을 올리며 역사적인 공격포인트를 추가했다. 첫 선발경기부터 미국팬들의 기대를 200% 충족시켰다. 손흥민은 25일 댈러스 원정경기에서 미국무대 첫 골에 도전한다. 

[사진] ⓒGettyimages(무단전재 및 재배포 금지)


벌써부터 손흥민 효과가 엄청나다. 손흥민 유니폼은 주간 전세계 판매 1위를 기록하며 품귀현상까지 빚고 있다. MLS 최고의 스타 리오넬 메시는 물론이고 르브론 제임스 오타니 쇼헤이 등 타 종목 스타들까지 손흥민이 제쳤다. 

LAFC는 9월 2일 미국 캘리포니아주 로스엔젤레스 BMO 스타디움에서 샌디에이고를 상대한다. 손흥민의 홈 데뷔전으로 관심을 모은다. 

미국에서는 입장권을 되파는 리셀 문화가 자리를 잡고 있다. 손흥민의 홈 데뷔전 입장권 가격이 벌써 폭등하고 있다. 

[사진] ⓒGettyimages(무단전재 및 재배포 금지)


LA타임즈의 보도에 따르면 손흥민 데뷔전 입장권이 원래의 10배 이상 치솟고 있다. 운동장과 가까운 프리미엄 좌석은 원래 300-500 달러(약 41-69만 원)에 판매되는데 3800 달러(약 526만 원)까지 치솟았다. 그나마 지난주까지 1200 달러(약 166만 원)였던 좌석이 세 배 이상 더 오른 셈이다. 

LA타임즈는 “손흥민의 데뷔전은 마치 메시를 연상시킨다. 메시가 인터 마이애미에 합류했을 때도 입장권 가격이 치솟는 비슷한 현상이 있었다. 손흥민 홈 데뷔전의 최저가 입장권도 187 달러(26만 원)다. 같은 레전드가 출전하는 토마스 뮐러의 8월 31일 밴쿠버 경기는 2달러(2800원) 짜리도 있다. 이러한 가격 차이는 손흥민에 대한 엄청난 관심을 보여준다”고 서술했다. 

[사진] ⓒGettyimages(무단전재 및 재배포 금지)


손흥민은 LAFC 입단과 동시에 실력과 인기에서 모든 선수를 뛰어넘고 있다. / jasonseo34@osen.co.kr "
