date,title,content
20250611,'맨유 보내준단 약속 지켜라!' 요케레스 대폭발! 이적 막는 구단에 분노…SNS서 팀 언급 삭제,"(엑스포츠뉴스 윤준석 기자) 스포르팅 리스본의 간판 공격수인 스웨덴 국가대표 빅토르 요케레스가 잉글리시 프리미어리그 맨체스터 유나이티드와(이하 맨유)의 이적설에 휩싸인 가운데, 그는 자신의 이적을 쉽게 허락하지 않는 구단에 불만을 품은 것으로 전해졌다.

그는 본인의 소셜미디어 계정에서 구단에 대한 언급을 삭제하는 등 의미심장한 움직임을 보이며 팬들의 주목을 받고 있다.



이번 시즌을 통해  유럽 최고의 스트라이커 중 하나로 자리매김한 요케레스는 자신의 활약에 따라 빅클럽들의 관심을 한 몸에 받고 있는 상황이다.

영국 유력지 '스카이스포츠'의 10일(한국시간)자 보도에 따르면 그 중 맨유는 최근 요케레스 측과의 첫 접촉을 이미 완료했다. 구체적으로는 선수의 대리인을 통해 이적에 따른 재정 조건을 타진한 것으로 전해졌다.

이는 구단 간의 정식 협상 이전의 초기 단계로 해석되지만, 맨유가 이번 여름 공격진 보강을 위해 요케레스를 우선순위에 두고 있다는 점에서 큰 의미를 가진다.

특히 후벵 아모림 맨유 감독은 지난해 11월 맨유에 부임하기 직전까지 스포르팅에서 요케레스를 지도했으며, 선수의 능력을 최대치로 끌어올리기도 했다, 과거 인연이 다시금 주목받고 있는 상황이다. 이는 맨유와 선수 간 접점 형성에 중요한 요소로 작용하고 있다.

선수나 감독이 새 행선지를 정했을 때 '히어 위 고(Here We Go)'를 사용하는 것으로 유명한 유럽 이적시장 전문가 '파브리치오 로마노' 역시 최근 ""요케레스는 여전히 맨유의 공격수 후보군 리스트 상단에 위치해 있으며, 선수 본인의 이적 의지도 분명하다""고 전하며 해당 이적설에 신뢰도를 높였다.



여기에 더해, 요케레스가 현재 소속팀 스포르팅과의 관계에 불만을 품고 있는 것으로 전해져 해당 이적설에 불을 더했다.

'스카이스포츠'에 따르면, 요케레스와 스포르팅 간의 갈등의 핵심은 바로 이전에 구두로 합의한 '신사 협정'이다.

요케레스는 2023년 코번트리 시티에서 스포르팅으로 이적할 당시, 향후 유럽 빅리그에서 제의가 올 경우 합리적 금액인 약 6000만 파운드(약 1107억원)에 이적을 허용하겠다는 구두 약속을 받은 것으로 알려졌다.

하지만 스포르팅 측은 최근 입장을 선회하며 약속한 금액을 상회하는 최소 6800만 파운드(약 1255억원)를 요구하고 있어 요케레스가 큰 실망감을 드러낸 것으로 전해진다.



이러한 불만은 선수의 사회관계망서비스(SNS)에서도 간접적으로 드러났다.

포르투갈 매체 '레코르드'가 최초 보도한 바에 따르면, 요케레스는 최근 자신의 인스타그램 계정에서 스포르팅 리스본과 스웨덴 국가대표팀 관련 문구를 모두 삭제했으며, 현재는 단순히 '운동선수(Sportsperson)'라는 소개 표시만 남아 있다.

이는 단순한 이미지 관리 이상의 신호로 해석되며, 선수 본인의 이적 의사를 간접적으로 표현한 조치라는 해석이 지배적이다.

현재 요케레스의 가장 최근 게시물에는 수많은 맨유 팬들이 남긴 “올드 트래퍼드에서 보자”, ""맨유에 온 것을 환영한다"" 등 맨유 이적설에 대한 댓글이 대부분이다.



요케레스의 현재 몸값은 놀라운 수준으로 치솟았다.

'스카이스포츠'에 따르면, 2017년 브롬마포이카르나에서 브라이턴 앤드 호브 앨비언으로 이적할 당시 요케레스의 시장 가치는 45만 파운드(약 8억 3000만원)에 불과했지만, 현재 그의 시장 책정가는 7500만 파운드(약 1380억원)로 2년 만에 약 166배 상승했다.
이 몸값 상승은 스포르팅에서의 폭발적인 활약을 바탕으로 한다. 그는 2023년 여름 이적 후 2시즌 만에 스포르팅에서 모든 대회를 통틀어 102경기에서 97골을 기록했으며, 유럽 챔피언스리그에서도 8경기 6골이라는 눈부신 기록을 남겼다.

그의 전술적 영향력도 단순 득점력에 그치지 않는다. 2024-2025시즌 기준 유럽 상위 7개 리그 공격수 중 경기당 득점(1.25골), 상대 박스 내 터치, 드리블 성공률, 전진 돌파, 패스 창출 등 거의 모든 항목에서 상위 3% 이내에 들어가는 성과를 보여주었다.

특히 경기당 1.99개의 찬스를 창출했으며, 경기당 0.22개의 어시스트도 해당하는 뛰어난 기록을 남겼으며, 수비 기여 면에서도 압박 상황에서의 공 회수 횟수가 매우 높은 수치를 기록해, 현대형 스트라이커로서 완성형에 가까운 모습을 보이고 있다.

다만 이러한 기록이 포르투갈 프리메이라리가라는 상대적으로 약한 리그에서 나왔다는 점은 맨유가 고민해야 할 요소다.

유럽축구연맹(UEFA) 기준 포르투갈 리그는 유럽 7위로 평가되며, 프리미어리그나 라리가, 분데스리가 등에 비해 수준이 낮은 편이다. 이에 따라 요케레스가 과연 잉글랜드 프리미어리그에서도 동일한 퍼포먼스를 낼 수 있을지에 대한 의문도 동시에 존재한다.



한편, 요케레스는 사우디아라비아의 알힐랄로부터 연봉 3000만 파운드(약 533억원) 규모의 제안을 받았지만 이를 거절한 것으로 알려졌다.

알힐랄은 앞서 나폴리의 빅터 오시멘 영입에 실패한 뒤 요케레스를 대체 자원으로 낙점했지만, 결국 그의 유럽 잔류 의지를 꺾지 못한 것으로 보인다.

현재 맨유는 울버햄프턴의 마테우스 쿠냐 영입을 마무리지은 뒤, 요케레스와 함께 브렌트퍼드의 브라이언 음뵈모 영입에 나서는 등 공격진 전면 개편을 추진 중이다.

문제는 맨유의 재정 상황이다.

맨유는 요케레스를 영입하기 위해선 기존 주축 자원 중 일부를 매각해야 한다는 압박을 받고 있으며, 로마노 역시 ""알레한드로 가르나초, 마커스 래시포드, 제이든 산초 등 일부 자산 매각 없이는 이 딜이 진전되기 어려울 수 있다""고 내다봤다.

이적시장이 정식으로 열리는 이번 달 말, 맨유는 다시금 이적 협상을 본격화할 것으로 보이며, 선수 측도 이 갈등 상황이 조속히 마무리되길 기대하고 있을 것으로 보인다.

사진=연합뉴스"
20250611,"맨유, 마침내 '명가재건' 아프리카 특급 FW 오시멘, '영입 청신호' ""선수도 OK 결단""→음뵈모-요케레스까지 품고 '제2의 황금기' 구가하나","[SPORTALKOREA] 김경태 기자= 맨체스터 유나이티드가 여름 이적 시장에서 광폭 행보를 보이고 있다. 브라이언 음뵈모, 빅토르 요케레스도 모자라 '꿈의 공격수' 빅터 오시멘까지 데려올 준비를 하고 있다.

현재 맨유는 공격수 보강에 여념이 없다. 마테우스 쿠냐의 영입을 시작으로 음뵈모, 요케레스까지 데려오기 위해 고삐를 당기고 있다. 다행히도 두 선수 모두 맨유 이적에 청신호가 켜진 상황이라 고무적이다.



여기에 더해 맨유는 그야말로 겹경사가 터졌다. 예전부터 관심 있게 지켜보던 오시멘이 맨유행을 원하고 있다는 소식이 들려왔다. 

영국 매체 '팀토크'는 10일(한국시간) ""오시멘은 사우디아라비아 구단들의 제안을 계속 거절하고 프리미어리그 이적을 희망하고 있다""고 전했다.

이어 ""맨유가 SSC 나폴리를 설득하기 위해 다량의 현금과 선수를 포함한 제안을 준비 중이다""고 밝혔다.

오시멘은 '맨유의 꿈'과도 같은 선수였다. 특히 지난 2022/23시즌 나폴리에서 맹활약을 펼치며 우승까지 견인하자 맨유는 지대한 관심을 품었었다.



다만 나폴리는 그의 이적을 허용하지 않았고, 끝내 무산됐었다. 올 시즌 막바지로 접어들자 맨유는 다시금 그의 영입에 만전을 기하고 있었다. 그러나 사우디의 알 힐랄이 막대한 금액으로 유혹하며 또다시 골머리를 앓고 있었다.

천금 같은 기회가 생겼다. 오시멘이 사우디행을 포기하고 유럽행을 원하고 있었던 것. 오시멘 역시 맨유행을 긍정적으로 생각하고 있는 것으로 알려졌다. 맨유는 이를 놓칠 수가 없었다. 이탈리아 매체 '가제타 델로 스포르트'에 따르면 맨유는 죠수아 지르크지를 포함해 현금을 지불하는 방식으로 오시멘의 영입을 준비하고 있다. 



사진=도고크리스 페이스북, 게티이미지코리아

취재문의 sportal@sportalkorea.co.kr"
20250611,"맨체스터 시티 또 해냈다! '더 브라위너 후계자' 540억에 영입 완료...""팀을 돕는 게 내가 원하는 책임감"" [공식발표]","맨체스터 시티가 라얀 셰르키를 영입했다./맨체스터 시티
라얀 셰르키./게티이미지코리아

[마이데일리 = 노찬혁 기자] 맨체스터 시티가 케빈 더 브라위너의 공백을 메웠다. 올랭피크 리옹으로부터 라얀 셰르키의 영입을 완료했다.

맨시티는 11일(이하 한국시각) 구단 홈페이지를 통해 ""맨체스터 시티는 리옹으로부터 라얀 셰르키를 영입했다. 21세의 셰르키는 5년 계약을 체결했으며 2030년까지 에티하드 스타디움에서 활약하게 된다""며 셰르키의 영입을 공식 발표했다. 이적료는 3500만 유로(약 540억원)다.
2015년부터 맨시티 유니폼을 입은 더 브라위너는 잉글랜드 프리미어리그(EPL) 6회 우승, 2022-23시즌 유럽축구연맹(UEFA) 챔피언스리그(UCL) 우승과 트레블 달성 등 맨시티의 황금기를 이끌었다. 하지만 더 브라위너는 올여름 계약 만료와 함께 작별을 택했다.

맨시티는 더 브라위너에게 재계약을 제안하지 않았고, 더 브라위너는 새로운 도전을 위해 팀을 떠나기로 결정했다. 현재 차기 행선지는 세리에 A 챔피언 SSC 나폴리로 유력하게 거론되고 있다. 더 브라위너가 떠난 자리는 셰르키가 맡게 됐다.
라얀 셰르키./게티이미지코리아

셰르키는 프랑스 국적의 공격형 미드필더로, 양발을 자유자재로 사용하는 드리블 능력과 뛰어난 탈압박 기술, 킬패스와 슈팅 능력까지 갖춘 전천후 플레이메이커다. ‘프랑스의 외질’이라는 별명처럼 창의적인 플레이가 강점으로 꼽힌다.

셰르키는 리옹 유스팀 출신으로, 만 16세에 1군 무대에 데뷔한 특급 유망주다. 2003년생으로 만 21세에 불과하지만 프랑스 리그앙과 유럽대항전 통산 185경기에 출전해 풍부한 경험을 자랑한다. 2022-23시즌부터는 리옹의 주전 미드필더로 확실히 자리 잡았다.

이번 시즌 셰르키는 커리어 하이를 기록하며 주가를 끌어올렸다. 공식전 44경기에서 12골 20도움을 올렸고, 리그앙 베스트 일레븐, 리그앙 영플레이어상, UEFA 유로파리그(UEL) 베스트 일레븐에 선정되며 유럽 무대에서 강한 인상을 남겼다.
라얀 셰르키./게티이미지코리아

이러한 활약을 통해 셰르키는 유럽 주요 클럽들의 관심을 받았고, 결국 맨시티와 계약을 체결했다. 셰르키는 ""내게 꿈 같은 일""이라며 ""솔직히 맨시티 같은 구단에 합류해 내 커리어의 다음 단계로 나아갈 기회를 얻는 건 정말 특별한 일""이라고 밝혔다.

이어 ""모두가 맨시티가 얼마나 좋은 팀인지 알고 있다. 팀의 지속적인 승리를 돕는 것이 내가 진정으로 원하는 책임감이다. 내가 믿는 프로젝트를 위해서만 리옹을 떠날 것이다. 맨시티에서 내가 발전하고 팀의 성공을 도울 수 있다는 걸 보여주고 싶다""고 덧붙였다."
20250611,"'김민재 방출한다며? 왜 데리고 가나' 뮌헨, 부상당한 KIM 끌고 미국 간다…클럽 WC '불편한 동행' 스타트","(엑스포츠뉴스 김환 기자) 김민재가 바이에른 뮌헨과 함께 미국으로 향한다.

김민재의 소속팀 바이에른 뮌헨이 김민재를 이달 중순 미국에서 열리는 2025 국제축구연맹(FIFA) 클럽 월드컵 명단에 포함시켰다. 김민재가 아직 부상에서 완전히 회복하지 못해 대회 출전 여부가 불투명하다는 점, 그리고 이적설이 나오는 와중에 바이에른 뮌헨이 김민재를 매각하는 데 적극적인 모습을 보이고 있다는 점 등을 생각하면 놀라운 일이다.

바이에른 뮌헨이 김민재를 클럽 월드컵에 동행시키는 이유는 현재 수비진의 상황이 좋지 않기 때문인 것으로 보인다.

지난 시즌 주전 센터백으로 활약한 다요 우파메카노를 비롯해 이토 히로키, 알폰소 데이비스 등 주전급 자원들이 모두 부상으로 빠져 있고, 최근 합류한 요나탄 타가 아직 팀에 적응하지 못했기 때문에 그나마 감독의 전술에 익숙한 선수인 김민재를 데려가려는 것이다. 수비진 사정이 아쉽다보니 김민재를 데려갈 수밖에 없다.

바이에른 뮌헨은 10일(한국시간) 구단 공식 채널을 통해 ""오늘 마누엘 노이어와 토마스 뮐러, 자말 무시알라를 포함한 선수단은 미국 플로리다주의 올랜도로 이동할 예정이다. 올랜도에 도착한 뒤 베이스 캠프를 차리고 대회를 준비할 계획""이라며 2025 FIFA 클럽 월드컵에 참가할 29명의 선수 명단을 공개했다. 



김민재의 이름에 눈길이 간다.

김민재는 지난 시즌 뱅상 콤파니 감독 체제에서 주전 센터백으로 뛰며 바이에른 뮌헨의 독일 분데스리가 우승 트로피 탈환에 결정적인 공헌을 한 선수다. 콤파니 감독은 수비라인을 높게 유지해 넓은 뒷공간이 노출되더라도 일대일 수비 능력을 앞세워 높은 위치에서 상대를 견제하는 플레이가 가능하고, 공간을 커버하는 능력이 뛰어난 김민재를 선호하며 그를 주전으로 기용했다.
하지만 지난해 10월 입은 아킬레스건 부상이 낫지 않아 시즌 막바지 스쿼드에서 빠진 채 회복에 집중해야 했고, 김민재의 부상은 지금까지도 완전히 회복되지 않은 것으로 알려졌다. 김민재는 클럽 월드컵이 끝난 이후까지 회복에 전념해야 한다는 진단을 받았는데, 그가 바이에른 뮌헨의 클럽 월드컵 명단에 이름을 올린 것이다.

또한 현지에서는 계속해서 바이에른 뮌헨이 김민재 매각을 추진 중이라는 이적설이 나오고 있다. 구단이 김민재의 활약에 실망했고, 2년 만에 김민재를 이적시장에 내놓았다는 내용이다. 보도에 의하면 바이에른 뮌헨이 책정한 김민재의 이적료는 5000만 유로(약 781억원)에서 3500만 유로(약 547억원)로 낮아진 상태다. 그만큼 바이에른 뮌헨이 김민재 매각에 적극적이라는 의미로 해석된다.



특히 최근에는 지난 시즌 유럽축구연맹(UEFA) 챔피언스리그 우승팀이자 프랑스를 대표하는 빅클럽인 파리 생제르맹(PSG)이 김민재에게 관심을 보이고 있다는 소식과 심지어 바이에른 뮌헨이 복수의 프리미어리그 구단에 김민재를 역제안했다는 전해지면서 김민재의 이적설에도 힘이 실렸다.

프랑스 매체 '풋 메르카토'의 유력 기자인 산티 아우나는 PSG의 스포츠 디렉터인 루이스 캄포스 단장이 김민재의 에이전트와 접촉했다고 주장했으며, 독일 유력지 '빌트'는 캄포스 단장과 김민재의 에이전트가 만난 것은 사실이 아니지만 김민재가 튀르키예 쉬페르리가의 페네르바체에서 뛰던 2022년 당시 캄포스 단장이 갈라타사라이의 기술 고문으로 있었기 때문에 김민재 영입에 관심을 가질 이유가 충분하다고 설명했다.

프랑스 언론들의 보도에 따르면 PSG는 주장 마르퀴뇨스가 사우디아라비아로 떠날 시나리오를 대비해 김민재를 마르퀴뇨스의 대체자로 낙점했다. 

김민재에게 책정된 이적료와 1700만 유로(약 265억원)로 알려진 그의 연봉이 비싼 축에 속하지만, 카타르 스포츠 투자청(QSI)을 등에 업고 있는 PSG의 경우 이것이 큰 문제가 되지 않기 때문에 김민재의 PSG 이적설은 실현 가능성이 높은 루머로 받아들여졌다. 



영국 언론 'TBR 풋볼'은 10일 보도를 통해 바이에른 뮌헨이 프리미어리그 구단에 김민재를 역제안했다면서 수비진 개편을 꾀하고 있는 첼시와 아틀레티코 마드리드 이적설로 이탈 가능성이 높아진 크리스티안 로메로의 대체자를 찾는 중인 토트넘 홋스퍼가 김민재 영입에 관심을 가질 가능성이 크다고 내다봤다. 

 

바이에른 뮌헨은 이미 김민재의 대체자 명단까지 작성한 상태다.

독일 '빌트' 등에 따르면 바이에른 뮌헨은 지난 시즌 번리의 프리미어리그 승격 주역으로 활약한 프랑스 출신 수비수 막심 에스테브 영입 계획을 세웠다. 바이엘 레버쿠젠에서 뛰던 독일 국가대표 센터백 타를 자유계약(FA)으로 영입했지만, 김민재를 내보내고 더 젊은 수비수를 영입해 미래를 대비하겠다는 생각으로 보인다.

번리가 에스테브에게 무려 5000만 파운드(약 924억원)의 가격표를 붙였다는 보도가 나오면서 의견이 갈리고 있으나, 지금의 기세라면 바이에른 뮌헨이 에스테브 영입에 거액을 투자하더라도 이상할 게 없는 분위기다.

이적설이 난무하는 와중에 바이에른 뮌헨이 김민재를 클럽 월드컵 참가 명단에 포함시킨 것이다. 김민재의 이름이 가장 주목받고 있는 이유다.



바이에른 뮌헨이 김민재를 클럽 월드컵에 데리고 가지만, 막상 김민재가 클럽 월드컵 기간 동안 출전할 수 있을지는 불분명하다.

이번 클럽 월드컵은 현지시간으로 6월14일부터 7월13일까지 열린다. 바이에른 뮌헨이 조별리그를 통과하고 토너먼트를 거쳐 결승전에 진출한다면 7월 중순까지 미국에서 경기를 치러야 한다.

구단은 김민재의 복귀를 기대할 수도 있겠지만, 애석하게도 김민재는 적어도 7월 중순까지는 경기를 뛰지 말고 회복에만 집중해야 완치에 가까워질 수 있는 것으로 알려졌다. 김민재가 초인적인 회복력을 발휘하더라도 사실상 그는 클럽 월드컵에 출전하기 어려운 게 사실이다.

현재로서는 바이에른 뮌헨이 괜한 오해를 사지 않기 위해 김민재를 명단에 포함시켰을 가능성이 높아 보인다. 어쩌면 이번 클럽 월드컵은 김민재와 바이에른 뮌헨의 '불편한 동행'일 수 있다.

사진=바이에른 뮌헨 / 연합뉴스"
20250611,"초대박! '해버지' 박지성에 이어 김민재도 맨유 진출?...""경험, 실력, 피지컬 모두 갖췄어""","사진=트랜스퍼


김민재가 맨체스터 유나이티드와 연결됐다.

영국 매체 '커트오프사이드'는 10일(한국시간) ""바이에른 뮌헨의 수비수 김민재가 이번 여름 리버풀과 맨유에 영입 제안된 것으로 알려졌다""라고 보도했다.

올여름 김민재의 이탈은 확정적이다. 지난 시즌 김민재는 토마스 투헬 감독 체제에서 비판을 받으며 아쉬운 한 해를 보냈다. 그러나 이번 시즌 빈센트 콤파니 감독이 부임하면서 팀 내 입지가 달라졌다. 콤파니 감독은 '하이 라인' 전술을 사용하면서 발이 빠른 김민재와 다요트 우파메카노가 중용을 받았다.

둘의 조합도 나쁘지 않았다. 우파메카노가 앞으로 뛰쳐나가면, 김민재가 후방을 든든하게 지켜줬다. 반대로 김민재가 적극적으로 압박하면, 우파메카노가 뒷공간을 사수했다. 그렇게 안정적인 활약을 펼치던 중 부상이 발목을 잡았다. 지난해 10월부터 아킬레스 부상에 시달렸던 것. 이는 경기력 저하로 이어졌다. 독일 현지에서는 김민재에게 '최악의 수비수'라며 날카롭게 비판했다.



이번 여름 이적시장에서 팀을 떠날 가능성이 매우 높아졌다. 독일 '스카이 스포츠' 소속 플로리안 플레텐베르크 기자는 ""뮌헨은 김민재를 이번 여름 이적시장에서 매각 대상 중 하나로 분류한 것으로 알려졌다. 구단은 다른 팀들의 관심을 인지하고 있다. 합리적인 제안이 도착할 경우, 김민재의 이적을 허용할 준비가 되어 있다""라고 밝혔다.

만약 팀에 남더라도 주전은 확보하지 못할 전망이다. '빌트'는 ""조나단 타가 합류하면서 김민재의 입지는 줄어들 예정이다. 구단 내부에서도 김민재의 향후 거취를 두고 논의 중이다. 좋은 조건의 제안이 올 경우, 이적을 허락할 것이다""라고 설명했다.

결국 팀을 떠날 확률은 매우 높아진 상황. 워낙 실력은 입증됐기에 이적시장 최대어가 될 전망이다. 벌써부터 여러 빅클럽에서 김민재 영입을 위해 대기표를 뽑고 있다. 뉴캐슬 유나이티드, 인터 밀란, AC 밀란, 첼시, 파리 생제르맹(PSG), 리버풀이 관심을 보냈다. 여기에 맨유까지 가세했다.



눈길을 끄는 건 바로 맨유다. 과거 박지성이 활약했던 구단이기 때문. 2005년부터 2012년까지 약 7년 간 몸 담으며 맹활약했다. 그런데 그때와 지금은 상황이 매우 다르다. 알렉스 퍼거슨 경이 감독직에서 물러난 뒤, 맨유는 끝도 없이 추락했다. 이번 시즌은 말 그대로 최악이었다. 리그, 컵대회 모두 탈락했다. 다음 시즌 유럽 대항전 진출도 무산됐다.

따라서 이번 여름 이적시장에서 선수 보강은 필수. 이에 센터백 자원을 물색할 전망이다. '커트오프사이드'는 ""맨유는 수비 불안 문제를 겪고 있다. 해당 포지션에서의 뎁스 보강이 필요하다. 김민재는 경험과 실력을 갖춘 선수다. 프리미어리그(PL)에서 성공할 수 있는 신체 조건과 피지컬을 지녔다. 뮌헨 팀 동료들도 그를 '좋은 선수'로 평가하고 있다""라고 전했다.

김민재 본인도 PL행에 열려 있다. 매체는 ""김민재는 PL 이적에 매력을 느끼고 있다. 현재 커리어 단계에서 새로운 도전에 나서는 데 관심이 있는 것으로 전해졌다. 리버풀과 맨유는 세계에서 가장 큰 클럽들 중 하나들이다. 대부분의 선수들에게 있어 이들의 제안을 거절하기에는 쉽지 않다. 과연 양 구단 중 어느 팀이 먼저 행동에 나설지 향후 몇 주간의 귀추가 주목된다""라고 내다봤다."
