date,title,content
20250611,"'진짜 답없다' 레비 회장, '10년 헌신' 손흥민은 판매→로메로는 필사적으로 지킨다...""주급 인상 재계약 추진""","다니엘 레비 회장이 크리스티안 로메로를 반드시 지키겠다는 입장이다.

토트넘 훗스퍼 소식통인 '스퍼스 웹'은 10일(한국시간) ""토트넘은 팀의 핵심 선수 중 한 명에게 계약 연장을 제안할 예정이지만, 그는 여름 이적시장에서 이적을 강하게 원하고 있다""고 보도했다.

여기서 말한 선수는 바로 로메로다. 매체는 ""토트넘의 가장 큰 우선순위는 로메로를 팀에 남기는 것이다. 최근 아틀레티코 마드리드가 영입전에 참전하면서, 그가 토트넘을 떠나려 할 수 있다는 우려가 커지고 있다""고 전했다.

실제로 이번 시즌 로메로는 여러 이적설에 휩싸였다. 레알 마드리드와 아틀레티코가 러브콜을 보냈다. 이 가운데 아틀레티코가 가장 유력한 행선지로 떠올랐다. 스페인 '렐레보'는 ""로메로는 디에고 시메오네 감독의 철학에 완벽하게 부합하는 선수다. 같은 아르헨티나 출신인 만큼 잘 사용할 것이다. 실제 협상이 시작되지는 않았지만, 로메로가 여름 이적시장에 나올 경우를 대비해 준비하고 있다""고 주장했다.



본인도 스페인 라리가 무대를 열망했다. 로메로는 아르헨티나 매체 'TyC 스포츠'와의 인터뷰에서 ""이번 시즌이 끝나고 나면 어떻게 될지 두고 봐야 한다. 아직 에이전트와 이야기를 나누지 않았다. 뭐든 열려 있다. 그런데 계속 발전하기 위해 새로운 곳으로 가는 것도 생각하고 있다. 개인적으로 가고 싶은 리그는 라리가다""고 말했다.

로메로 입장에서도 아틀레티코는 굉장히 매력적인 구단이다. 같은 아르헨티나 대표팀 동료들인 훌리안 알바레스, 앙헬 코레아, 지울리아노 시메오네, 로드리고 데 파울, 나우엘 몰리나 등이 대거 포진해 있기 때문. 오히려 토트넘보다 더 적응하기 쉬운 곳일지도 모른다.

물론 절대적으로 아틀레티코 이적이 확정된 것은 아니었다. 로메로가 잔류 조건으로 내민 것은 크게 두 가지였다. 유럽축구연맹(UEFA) 챔피언스리그(UCL)와 엔제 포스테코글루 감독의 잔류. 일단 UEFA 유로파리그(UEL)에서 우승을 차지함으로써 조건 하나는 충족했다. 그러나 포스테코글루 감독이 경질되면서 다시 미궁 속으로 빠졌다.



일단 레비 회장의 입장은 분명하다. '스퍼스 웹'은 ""레비 회장은 로메로의 주급 인상을 포함한 재계약을 제안하며, 잔류를 설득하고 있는 것으로 알려졌다. 현재 그의 계약은 2년 남아 있다. 토트넘은 로메로의 이적료로 7,000만 유로(약 1,093억 원)를 요구 중이다""고 밝혔다.

하지만 여전히 로메로는 이적을 원하고 있는 상황. 어쩌면 지금이 판매 최적의 시기일 가능성이 있다. 억지로 1시즌 데리고 있다가 더 낮은 금액으로 떠나보낼 수 있기 때문. 매체 또한 ""만약 토트넘이 로메로를 강제로 잔류시키더라도, 다음 시즌에는 더 낮은 이적료로 떠날 수 있는 리스크가 있다. 로메로급 수비수를 대체하는 것은 매우 어려운 일이다. 그러나 정말 이적이 현실화된다면, 충분한 자원 투자와 대체자 영입이 필수다""고 내다봤다.



한편, 로메로와 마찬가지로 손흥민도 팀을 떠날 가능성이 있다. '풋볼 런던' 소속 알레스데어 골드 기자는 ""이번 여름 손흥민은 자신과 구단 모두에게 적절한 제안이 올 경우, 팀을 떠나는 것을 진지하게 고려하고 있다. 사우디 프로리그 팀들이 손흥민을 영입하기 위해 대규모 제안을 할 것으로 예상된다""고 했다.

토트넘은 로메로와 달리 손흥민에게는 큰 미련이 없는 것처럼 보인다. 토트넘 소식에 능통한 피터 오루크 기자는 '풋볼 인사이더' 팟캐스트에서 ""손흥민을 이적시키기 위해서는 사우디로부터 거액 제안이 필요할 것이다. 동시에 토트넘도 그 제안을 받아들일 수 있다. 비즈니스 관점에서 보면, 이는 토트넘이 손흥민으로부터 수익을 창출하고, 재정적 페어플레이(FFP) 문제를 해결할 수 있는 절호의 기회다. 토트넘은 큰 제안이 올 경우, 마지못해 이적을 수용할 가능성이 있다""고 이야기했다."
20250611,"[속보] 韓 역대급 소식...'뮌헨 방출 명단' 김민재 파격 결정 ""알 나스르와 협상 진전...선수도 사우디행 OK""","게티이미지
[스포츠조선 김대식 기자] 한국 역대 최고의 수비수인 김민재가 사우디아라비아로의 이적을 원하고 있다는 놀라운 소식이다.

먼저 바이에른 뮌헨은 10일(한국시간) 공식 홈페이지를 통해 2025 국제축구연맹(FIFA) 클럽 월드컵 참가 명단을 발표했다. 총 29명의 선수단에는 대한민국 대표 수비수 김민재도 포함됐다.

바이에른은 오클랜드 시티(뉴질랜드), 보카 주니어스(아르헨티나), 벤피카(포르투갈)와 함께 C조에 속해 조별리그를 치른다. 바이에른은 현재 미국 플로리다주 중부에 위치한 베이스캠프에 입성한 상태이며, 첫 경기는 오는 16일 신시내티 스타디움에서 열리는 오클랜드 시티와의 C조 1차전이다.

관심을 끄는 대목은 김민재의 현재 상황이다. 김민재는 부상에서 회복 중이지만 이번 클럽 월드컵 참가뿐 아니라, 바이에른의 2025~2026시즌 새 홈 유니폼 모델로도 등장했다. 일반적으로 유니폼 모델은 다음 시즌을 함께할 주전급 선수들 중에서 선정되지만, 김민재는 이번 여름 이적 가능성이 제기되며 매각 후보로 분류된 상태다. 독일 스카이 스포츠는 11일 ""김민재는 확실한 매각 후보다. 바이에른은 적절한 제안을 받으면 김민재를 팔 것이다""며 김민재의 방출 가능성을 다시 한번 확인했다.
사진=바이에른
11일 저녁 김민재의 차기 행선지로 알 나스르가 거론됐다. 프랑스 매체 풋 메르카토의 산티 아우나 기자는 11일(한국시간) 개인 SNS를 통해 ""알 나스르가 바이에른 뮌헨에서 김민재 영입을 추진하고 있다. 사우디 클럽 측에서 최근 며칠 동안 영입을 위해 노력하고 있으며 선수단과 합의를 위해 노력하고 있다고 한다""고 보도했다.

아우나 기자는 ""바이에른에서 다소 아쉬운 시즌을 보낸 김민재는 벌써 새로운 길을 모색할 가능성이 있다. 알 나스르의 강한 관심을 받고 있는 김민재는 사우디아라비아로의 이적 가능성에 긍정적인 반응을 보이고 있다. 이는 나폴리의 철벽 수비수였던 그의 커리어에 또 다른 전환점을 가져올 수 있는 움직임""이라고 덧붙였다.
<저작권자(c) 연합뉴스, 무단 전재-재배포, AI 학습 및 활용 금지>
유럽 축구 이적시장 전문가 파브리치오 로마노는 지난달 개인 SNS를 통해 이적시장 관련해 팬들과 묻고 답하는 시간을 가졌다. 이때 한 축구팬이 ""바이에른의 상황을 토대로 보면 김민재는 어디로 이적할 것 같은가?""라며 김민재의 거취에 대한 질문을 남겼다. 그러자 로마노 기자는 굉장히 간결하게 ""프리미어리그 혹은 사우디로 향할 것 같다. 김민재는 높은 연봉을 받고 있다""고 대답했다.

프리미어리그의 관심에도 정말로 김민재는 바이에른을 떠나서 사우디행을 고려하는 것일까. 아우나 기자의 정보대로라면 김민재 역시 알 나스르행을 원하고 있다는 이야기가 된다. 1996년생으로 이제 전성기를 구사할 시기에 사우디행을 결정한다면 적지 않은 파장이 있을 것으로 예상된다. 내년에 월드컵도 있기 때문에 팬들은 김민재가 사우디로 이적하지는 않을 것이라고 전망했기 때문이다.

아우나 기자의 보도 이후 또 다른 이적시장 전문가들의 정보가 나와봐야 김민재의 알 나스르 이적설이 정말로 사실인지 판단될 것으로 보인다.
<저작권자(c) 연합뉴스, 무단 전재-재배포, AI 학습 및 활용 금지>
일단 아우나 기자는 ""이미 협상이 어느 정도 진전됐으며 알 나스르가 김민재를 영입하려는 의지는 확실하다. 김민재는 사우디 이적에 열려있다. 스포츠와 재정적인 측면에서 새로운 도전을 좋게 바라보고 있다. 며칠 안에 최종 협상이 있을지 지켜봐야 한다""고 설명했다."
20250611,"""포스테코글루→케인, 프랭크→손흥민"" 또 발등에 불 떨어진 토트넘 신임 감독…데칼코마니 같은 운명에 한숨 가득","로이터 연합뉴스
토트넘 SNS
AFP 연합뉴스
[스포츠조선 김성원 기자]토마스 프랭크 브렌트포드 감독의 토트넘 사령탑 선임이 임박했다.

유럽이적시장 전문가인 파브리지오 로마노는 10일(이하 한국시각) 자신의 SNS를 통해 '프랭크 감독이 토트넘의 새 사령탑에 선임된다. 구두합의는 이루어졌고, 공식적인 스텝을 밟고 있다'고 밝혔다.
영국의 'BBC'도 11일 '토트넘과 브렌트포드의 협상이 긍정적으로 진행되고 있다. 프랭크 감독이 엔제 포스테코글루 감독의 후임으로 48시간 이내에 확정될 수 있다는 기대감이 커지고 있다'고 보도했다.

프랭크 감독은 브렌트포드와 2027년 6월까지 계약돼 있다. 토트넘은 '바이아웃' 금액인 1000만파운드(약 185억원)를 지불하는 조건으로 브렌트포드와 합의한 것으로 전해졌다. 프랭크 감독의 코치진도 토트넘행에 동행하기로 했다.

프랭크 감독이 토트넘 사령탑에 선임된 후 첫 임무가 이미 떨어졌다. '풋볼런던'은 이날 '프랭크 감독이 토트넘에 부임한 뒤 가장 먼저 할 일 중 하나는 손흥민의 미래에 대해 논의하는 것이다. 손흥민은 예전보다 토트넘을 떠날 가능성이 더 높은 것으로 관측된다'고 우려했다.

10일 서울월드컵경기장에서 열린 대한민국과 쿠웨이트의 2026년 북중미월드컵 아시아 3차예선 B조 최종전. 대한민국이 4대0 승리를 거둔 후 열린 월드컵 진출 축하행사에서 손흥민이 감사 인사를 전하고 있다. 상암=정재근 기자 cjg@sportschosun.com/2025.6.10/
10일 서울월드컵경기장에서 열린 대한민국과 쿠웨이트의 2026년 북중미월드컵 아시아 3차예선 B조 최종전. 손흥민이 후반전 교체 멤버로 출전해 동료의 플레이를 격려하고 있다. 상암=정재근 기자 cjg@sportschosun.com/2025.6.10/
손흥민은 10일 서울월드컵경기장에서 열린 쿠웨이트와의 2026년 북중미월드컵 아시아 3차예선 최종전(4대0 승) 후 자신의 거취에 대해 말문을 열었다. 그는 ""축구를 시작하며 좇던 꿈을 모두 이뤘다. 축구는 이기기 위해 하는 것이다. 위너(승자)만이 항상 기억된다. 올 시즌 쉽지 않은 시즌이었음에도 어릴 때부터 좇았던 우승이라는 것을 경험했다. 더 경험하고 더 잘해야겠다는 생각이 들었다""며 ""개인적으로 아쉬울 수 있는 시즌이라 생각할 수 있겠지만, 행복한 시즌이었고, 늦게나마 팬들과 이런 감정을 공유할 수 있어 행복했다. 올 시즌은 정상 컨디션이 많이 없었는데, 다음 시즌은 잘 준비하겠다""고 말했다.

그리고 ""일단은 (토트넘과) 계약기간이 남아있다. 어떤 말을 하는 것보다 기다려야 한다. 많은 분들처럼 나도 내 미래가 궁금하다. 미래에 어떤 일이 일어날지 지켜봐야 한다. 어디에 있든 최선를 다하고 노력해야 하는 것은 변함없다. 최선을 다해 잘 준비하겠다""고 말을 아꼈다. 영국 현지에선 이별을 암시하는 말이라고 해석하고 있다. 미묘한 파장이 일고 있다.

손흥민은 2024~2025시즌을 끝으로 계약이 종료되지만, 토트넘이 올해 초 1년 옵션을 발동했다. 계약기간은 2026년 6월까지 1년 늘어났다.

AFP 연합뉴스
로이터 연합뉴스
분위기가 2년 전과 비슷하다. '풋볼런던'은 '포스테코글루 감독이 2023년 토트넘에 합류한 후 최다 득점자인 해리 케인(바이에른 뮌헨)을 잃었다. 포스테코글루 감독 후임자도 주장 손흥민은 물론 부주장 크리스티안 로메로의 미래가 불확실해 비슷한 상황에 직면할 수 있다'고 전했다.

로메로는 아틀레티코 마드리드의 러브콜을 받고 있다. 손흥민은 사우디아라비아와 미국 메이저리그사커(MLS)의 주목을 받고 있다. 다만 미국 시장은 손흥민의 연봉을 충족시키기 쉽지 않을 것이라는 전망이 있다.

토트넘도 복잡하다. '갑'이 아닌 '을'이다. 손흥민은 역사에 남을 토트넘의 레전드다. 토트넘에서 454경기에 출전, 173골 101도움을 기록한 그는 해묵은 과제인 우승 가뭄을 털어냈다. 토트넘은 2024~2025시즌 유로파리그에서 정상에 등극하며, 2007~2008시즌 이후 17년 만에 우승 트로피를 들어올렸다.

토트넘은 이번 여름 홍콩, 대한민국으로 이어지는 아시아 투어를 계획하고 있다. 손흥민이 존재하지 않으면 의미가 없는 투어다. 프랭크 감독은 덴마크 출신이다. 그는 2018년 10월 챔피언십(2부)에 위치한 브렌트포드의 지휘봉을 잡았고, 2020~2021시즌 EPL로 승격시켰다. 86년 만의 1부 승격이었다.

로이터 연합뉴스
프랭크 감독은 브렌트포드에서 7시즌을 성공적으로 지휘했다. 잉글랜드 프리미어리그(EPL)에선 4시즌 동안 13위, 9위, 16위, 10위를 기록했다.

'풋볼런던'은 '프랭크 감독은 뛰어난 소통 능력으로 선수들과 긴밀한 관계를 유지하는 것으로 유명하다. 그는 손흥민을 다시 정상급 선수로 복귀시킬 수 있다. 챔피언스리그 복귀가 손흥민에게는 유혹이 될 수 있다'고 강조했다.

잔류 혹은 이적, 열쇠는 손흥민이 쥐고 있다. 그의 결심에 따라 미래는 달라질 수 있다."
20250611,‘토트넘 국민구단 등극한다!’ 레전드 손흥민 이어 철벽 김민재까지 영입한다,"[사진] ⓒGettyimages(무단전재 및 재배포 금지)


[OSEN=서정환 기자] 토트넘이 국민구단으로 거듭난다. 

‘커트오프사이드’ 등 영국언론은 7일 “김민재의 잉글랜드행 가능성이 높아지고 있다. 리버풀, 첼시, 뉴캐슬이 김민재를 놓고 경쟁하고 있다. 선수 역시 프리미어리그 행을 선호하고 있다”고 보도했다. 

여기에 토트넘까지 참전했다. 영국 ‘트라이벌 풋볼’은 10일 “한국대표팀 수비수 김민재가 프리미어리그 여러 팀으로 입단제의를 받고 있다. 그 중 토트넘이 포함됐다. 김민재는 지난 시즌 뱅상 콤파니의 뮌헨을 분데스리가 정상으로 이끌었다. 하지만 조나단 타의 영입으로 입지가 줄었다. 뮌헨은 김민재 또는 다요 우파메카노를 이적시킬 것”이라 보도했다. 

[사진] ⓒGettyimages(무단전재 및 재배포 금지)


김민재에 대한 토트넘의 관심은 처음이 아니다. 토트넘은 주제 무리뉴 감독이 이끌었던 지난 2019년에도 김민재 영입을 시도했다. 무리뉴 감독이 강력하게 추천했지만 토트넘 수뇌부가 거절하면서 이적은 성사되지 못했다. 이후 김민재는 튀르키예와 이탈리아에서 성공하며 월드클래스 수비수로 성장했다. 

이후 무리뉴 감독은 “싼값에 김민재를 데려올 수 있었다. 하지만 토트넘 수뇌부가 말을 듣지 않았다”면서 아쉬워했다. 

타이밍이 다시 맞았다. 바이에른 뮌헨은 2023년 김민재를 영입하며 5100만 파운드(약 937억 원)를 지불했다. 현재 김민재 몸값은 3500만 파운드(약 643억 원)까지 내려간 상태다. 

[사진] ⓒGettyimages(무단전재 및 재배포 금지)


갑자기 김민재가 가성비 선수가 됐다. 이에 프리미어리그의 다른 팀들도 김민재를 노리고 있다. 프리미어리그 챔피언 리버풀을 비롯해 명문 첼시와 뉴캐슬도 김민재에게 관심이 있다. 

손흥민과 김민재는 검증된 콤비다. ‘트라이벌 풋볼’은 “김민재와 손흥민은 한국대표팀에서 57경기를 함께 뛰었다. 둘은 30승18무9패로 성적이 아주 좋았다. 김민재가 토트넘으로 이적한다면 북런던에서 두 선수가 재회할 수 있다”고 기뻐했다. 

문제는 손흥민 이적설이다. 이 매체는 “사우디 명문팀 알 힐랄이 손흥민을 노리고 있다. 손흥민이 사우디로 간다면 한국대표팀 콤비는 결성될 수 없다”고 설명했다. / jasonseo34@osen.co.kr "
20250611,"KIM 역제안 할 땐 언제고? B.뮌헨, 급해진 상황에 '부상 중' 김민재도 클럽 월드컵 29인 명단 포함!","[SPORTALKOREA] 황보동혁 기자= 바이에른 뮌헨이 최근 계속해서 이적설이 도는 김민재를 우선 클럽 월드컵 명단에 포함시켰다. 

뮌헨은 10일(이하 한국시간) 공식 홈페이지를 통해 ""미국에서 열리는 클럽 월드컵에 총 29명의 선수로 구성된 스쿼드를 데리고 참가하며, 이 안에는 새롭게 영입한 요나탄 타와 톰 비쇼프도 포함돼 있다""고 발표하며 명단을 공개했다.



마누엘 노이어, 토마스 뮐러, 해리 케인 등 주축 선수들이 대거 포함된 가운데, 국내 팬들의 눈길을 끈 이름은 단연 김민재였다.

김민재의 이름이 주목받는 이유는 그가 현재 부상 중이기 때문이다. 최근 A매치 소집에서도 부상으로 인해 제외됐기 때문이다. 

그럼에도 불구하고 부상인 김민재가 명단에 포함된 것은 팀 상황 때문인 것으로 보인다. 



다요 우파메카노가 부상으로 인해 출전이 어려운 상태이며, 이토 히로키 역시 부상으로 낙마하면서 수비 자원에 공백이 생겼다. 반면 김민재는 빠르게 회복할 경우, 조별리그 이후 실전에 투입될 가능성이 높은 상황이다. 

독일 매체 'TZ' 역시 김민재가 조별리그 출전 가능성은 낮지만, 이후 단계에서는 출전할 가능성이 높다고 전했다.

하지만 최근 뮌헨의 행보만 본다면 김민재의 클럽 월드컵 명단 포함을 긍정적으로만 바라보긴 어렵다.



물론 김민재는 여전히 뮌헨 소속 선수이며, 수많은 이적설 속에서도 팀에 남아 있는 상태다. 다만 최근 뮌헨은 김민재의 헌신에도 불구하고 선수를 존중하지 않는 듯한 태도를 보여준 것 또한 부정할 수 없는 사실이기 때문이다. 

김민재는 올 시즌 총 43경기에서 3,593분을 소화하며 핵심 수비수로 활약했다. 하지만 아킬레스건 통증을 안고 강행군을 이어가는 과정에서 실수가 잦아졌고, 이에 따른 비판도 따랐다. 특히 빈센트 콤파니 감독 체제에서도 꾸준히 기회를 받았지만 누적된 피로는 경기력 저하로 이어졌다.



가장 뼈아팠던 장면은 지난 4월 도르트문트전 이후였다. 당시 막스 에베를 단장은 공식 인터뷰에서 ""실수였다. 김민재가 상대를 놓쳤다""며 실명을 직접 언급해 공개적으로 비판했다. 팀을 위해 몸을 사리지 않았던 선수에게는 지나치게 냉정한 반응이었다.

이뿐만이 아니다. 바이에른이 리그 우승을 확정한 뒤 SNS에 게시한 우승 축하 이미지에서 김민재의 모습이 거의 보이지 않자, 팬들 사이에선 '아시안 패싱' 논란이 일기도 했다. 논란이 커지자 구단은 뒤늦게 김민재가 포함된 이미지를 별도로 추가 게시하며 수습에 나서는 촌극도 벌어졌다.

그럼에도 김민재는 독일 매체 '빌트'와의 인터뷰에서 ""떠날 이유가 없다. 남고 싶다. 하지만 앞으로 어떻게 될지는 지켜봐야 한다""며 잔류 의사를 내비친 바 있다.



하지만 뮌헨은 선수의 이런 의사를 고려하기보다는 매각에 무게를 두고 있는 모양새다. 최근에는 김민재를 잉글랜드 빅클럽들에 '역제안'한 정황까지 포착됐다.

영국 매체 '풋볼365'는 10일 ""바이에른이 김민재를 맨체스터 유나이티드, 리버풀, 첼시를 포함한 프리미어리그 클럽들에 제안했다""고 보도했다. 더 나아가, 이적료를 일부 낮춰 제안했다는 내용까지 전해졌다.

매체에 따르면 ""현재 28세인 김민재는 맨체스터 유나이티드뿐만 아니라 토트넘, 리버풀, 첼시, 맨체스터 시티, 뉴캐슬 등 복수의 프리미어리그 구단들에 제안됐다""며 ""바이에른은 김민재 이적에 열린 자세를 보이고 있으며, 일정 수준의 손해를 감수하더라도 협상에 나설 준비가 되어 있는 것으로 알려졌다""고 덧붙였다.



한편 뮌헨의 클럽 월드컵 첫 경기는 16일 오클랜드 시티를 상대로 치러질 예정이다.

대회가 시작됨에 따라 한시적으로 열린 '특별 이적기간' 이 끝난 만큼 김민재의 이적 협상은 대회 종료 이후 본격화될 가능성이 높은 상황이다. 

사진= 바이에른 뮌헨 X, 게티이미지코리아 

취재문의 sportal@sportalkorea.co.kr"
20250611,"[속보] '2,340억' 초대형 이적 'Here We Go'...비르츠, 리버풀 역사상 가장 비싼 사나이 된다","플로리안 비르츠가 리버풀로 향한다.

유럽 이적시장에 능통한 파브리시오 로마노 기자는 11일(한국시간) ""비르츠는 리버풀로 향한다. 리버풀은 레버쿠젠과 1억 5,000만 유로(2,340억) 규모의 거래에 대해 합의했다. 에드 온 조항이 포함된 금액이다. 비르츠 측은 이미 2주 전에 동의했고 이적이 임박했다. 메디컬 테스트와 계약 체결이 남았다""라고 전했다. 로마노 기자 특유의 이적이 확정되었을 때 알리는 'Here We Go'도 있었다.
비르츠는 독일 최고 재능을 꼽힌다. 2003년생으로 나이가 어리지만 이미 분데스리가 탑급 선수가 됐다. 2020-21시즌 레버쿠젠에서 주전급 선수로 활약하기 시작했으며 리그 5골 6도움으로 가능성을 보여주었다. 2년 차부터 비르츠는 분데스리가 탑급 선수로 거듭났다. 리그 7골 10도움을 올리면서 성공적으로 시즌을 마쳤다. 지난 시즌 비르츠는 모든 대회 18골 20도움을 기록하여 레버쿠젠의 분데스리가 무패우승, DFB-포칼 우승과 유럽축구연맹(UEFA) 유로파리그(UEL) 준우승을 이끌었다.

이번 시즌을 앞두고 비르츠는 한 시즌 더 팀에 남았다. 바이에른 뮌헨의 러브콜이 있었지만 비르츠는 사비 알론소 감독을 믿었고 1년 더 레버쿠젠에 헌신했다.

그러나 이번 시즌이 종료된 뒤 알론소 감독도 레알 마드리드로 떠났고 함께 했던 동료 제레미 프림퐁 등도 팀을 떠나면서 더 이상 비르츠는 레버쿠젠에 남을 이유가 없었다. 비르츠는 이적시장에 나왔고 뮌헨, 맨체스터 시티 등 여러 클럽이 관심을 보였다.

최종 승자는 리버풀이었다. 비르츠는 여러 팀과 만났는데 리버풀에 깊은 인상을 받은 것으로 알려졌다.

남은 것은 이적료 협상. 레버쿠젠은 리버풀의 제안을 여러 차례 거절했었다. 영국 '팀토크'에 따르면 가장 최근 리버풀은 1억 1,300만 파운드(2,080억)를 제안했는데 레버쿠젠이 거절한 것으로 알려졌다. 레버쿠젠은 적어도 2,340억 원 정도를 원했는데 결국 그대로 진행됐다. 로마노 기자 보도에 따르면 에드 온 조항을 포함하여 총액 1억 5,000만 유로(2,340억)다.

비르츠는 이제 리버풀로 향한다. 플로리안 플레텐버그 기자에 따르면 2,340억 원이라는 이적료는 분데스리가 최고 이적료 방출이며 리버풀 '클럽 레코드'다."
