date,title,content
20250310,"'홍명보호 합류 적신호' 극적인 빅리그행, 국가대표 MF...악수였나 '최근 7경기서 플레잉 타임 단 45분'","[SPORTALKOREA] 박윤서 기자= 국가대표 미드필더 홍현석이 어려운 시간을 보내고 있다.

홍명보 감독은 10일 오전 11시 서울 종로구 소재 축구회관에서 2026 국제축구연맹(FIFA) 북중미 월드컵 3차 예선 2연전 오만, 요르단전에 나설 선수 명단을 발표한다.

현재 대한민국은 3차 예선 6경기에서 4승 2무(승점 14)로 B조 선두를 질주하고 있다. 이번 3차 예선 2연전을 모두 승리로 장식할 경우 2위 이라크(승점 11), 3위 요르단(승점 9)과의 격차를 벌려 남은 두 경기 결과와 무관하게 북중미행을 조기 확정 지을 수 있다.


홍명보 감독 입장에선 일찍이 본선행을 적극적으로 대비할 수 있는 절호의 기회다. 이에 쓸 수 있는 최적의 라인업을 꾸려 변수를 줄일 가능성이 매우 높다.

다행히 현재 대표팀의 주축을 담당하는 유럽파 선수단 면면의 컨디션은 물올랐다. 양현준, 배준호, 엄지성, 양민혁 등 젊고 유망한 선수들이 저마다 소속팀에서 자신의 진가를 입증하고 있다.

여기에 손흥민, 이강인, 이재성 등 대표팀 에이스들 역시 건재함을 뽐내고 있다. 다만 최근 활약상이 아쉬운 선수도 있다. 대표적으로 올 시즌 KAA 헨트를 떠나 마인츠05 유니폼을 입은 홍현석이 그렇다.


홍현석은 어렵게 합류한 빅리그지만, 기대에 미치지 못하는 활약을 펼치고 있다. 올 시즌 리그 16경기에 나섰으나 0골 1도움을 기록했다. 선발 출전은 단 4회에 불과하다.

여기에 최근 흐름은 더욱 좋지 못한 모양새다. 마지막 출전이 지난달 1일 브레멘전으로 이후 마인츠가 치른 5경기에서 단 1분의 기회도 얻지 못했다. 범위를 조금 확장해 최근 7경기로 봐도 출전 시간은 단 45분에 그치고 있다.


반면 마인츠는 올 시즌 리그 25경기에서 13승 5무 7패(승점 44)로 3위를 질주하며 승승장구하고 있다. 보 헨릭센 감독 입장에선 굳이 가까운 시일 내에 스쿼드 내 변화를 줄 이유가 없는 상황이다. 아직 결과를 알 순 없으나 대표팀도 소속팀서 출전 기회를 얻지 못하고 있는 선수를 위해 한 자리를 내어줄 가능성은 희박하다는 평이다.

사진=마인츠 SNS, KFA

취재문의 sportal@sportalkorea.co.kr"
20250310,"와! 손흥민 추천→이강인 토트넘 입성? 이게 되네…""LEE 몸값 630억, EPL 관심 폭발""","(엑스포츠뉴스 권동환 기자) 대한민국 국가대표 이강인(PSG)이 다시 한번 토트넘 홋스퍼와 연결됐다.

토트넘 소식을 주로 전하는 '토트넘 트랜스퍼 뉴스'는 9일(한국시간) 사회관계망서비스(SNS)를 통해 ""토트넘은 이번 여름 파리 생제르맹(PSG)에서 이강인을 영입하는 데 관심을 보이고 있다""라고 보도했다. 

2023년 여름 PSG에 입단한 이강인은 데뷔 시즌인 2023-24시즌에 모든 대회에서 39경기에 나와 5골 5도움을 기록했다. 리그에선 3골 4도움을 올렸다.

2024-25시즌엔 더 많은 공격포인트를 길고 중이다. 아직 잔여 경기가 많이 남아 있는 가운데 이강인의 올시즌 공격포인트는 6골 5도움이다. 벌써 지난 시즌 공격포인트(5골 5도움) 숫자를 넘겼고, 두 자릿수 득점이나 도움도 노릴 수 있는 상황이다.



공격포인트 숫자를 보면 충분히 주전으로 뛸 수 있는 선수이지만 냉정하게 이강인은 PSG에서 핵심 전력으로 꼽히고 있지 않다.

올시즌 이강인은 39경기를 출전했는데, 이중 17경기를 교체로 뛰었다. 교체 출전 횟수가 많아 출전시간 총합이 2097분에 그쳤다.
입지가 줄면서 다가오는 여름에 이강인이 PSG에서 방출될 수 있다는 주장이 등장하기 시작했다. 프랑스 매체 '스포르트 프랑스'는 지난달 26일 ""이강인은 이미 떠날 예정인가? 파리 생제르맹(PSG)이 후계자를 준비 중이다""라고 전했다.

이강인에 대해 매체는 ""지난 시즌 큰 야망을 안고 PSG에 입단한 이강인은 기대에 부응하기 위해 고군분투하고 있다""라며 ""루이스 엔리케 감독의 시스템에서 예상보다 영향력이 약했던 이강인은 이번 여름에 짐을 싸야 할 수도 있을 것이다""라고 밝혔다.



이어 ""PSG 중원에서 입지를 굳건히 하고자 이적료 2200만 유로(약 332억원)에 영입됐지만, 이강인은 결코 필수적인 선수가 되지 못했다""라며 ""후보 역할로 밀려난 그는 경기 막판 몇 분 동안만 출전하고 있는 반면에 브래들리 바르콜라, 우스만 뎀벨레, 데지레 두에, 주앙 네베스 같은 선수들이 주목을 받는다""라고 덧붙였다.

그러면서 ""이런 상황에 직면해 PSG 경영진은 이미 자리를 확보하고 새로운 지원군의 도착에 대비하기 위해 이강인의 이적을 고려하고 있다""라고 주장했다.

또 ""어떤 클럽도 움직이지 않는다면 아시아 시장이 이강인에게 탈출구를 제공할 수도 있다""라며 ""PSG가 팀에서 제대로 된 자리를 찾지 못한 이강인을 되살리기 위해 이적을 선택할지 아니면 임대를 선택할지는 아직 알 수 없다""라고 전했다.

PSG 소식을 주로 전하는 'PSG 인사이드 악투스'는 지난 5일 SNS를 통해 ""경기 시간이 부족하거나 전성기가 끝난 일부 선수는 클럽을 떠날 수 있다""라며 ""이강인은 거의 퇴출 직전인 선수이다""라고 보도했다.



이강인이 여름에 방출될 것이라는 주장이 계속해서 나오고 있는 가운데 대한민국 축구대표팀 주장 손흥민이 뛰고 있는 프리미어리그 클럽 토트넘이 이강인을 노릴 계획이라는 주장이 등장해 눈길을 끌었다.

'토트넘 트랜스퍼 뉴스'는 ""토트넘은 이번 여름 PSG에서 이강인을 영입하는 데 관심을 보이고 있다""라며 ""이강인은 이번 여름 4000만 유로(약 630억원)에 영입될 수 있을 것으로 보이며, 이번 시즌 공격포인트 11개를 기록한 이강인을 많은 프리미어리그 클럽들이 원하고 있다""라고 설명했다.

실제로 이강인은 지난 1월 겨울 이적시장 때 토트넘을 포함해 많은 프리미어리그 클럽들과 연결됐다.

글로벌 매체 '온더미닛'은 지난 1월 ""토트넘과 노팅엄 포레스트가 맨체스터 유나이티드와 뉴캐슬 유나이티드에 합류해 PSG 미드필더 이강인을 눈독 들이고 있다""라고 전한 바 있다.



또 ""우리는 토트넘과 노팅엄 또한 이강인에게 관심을 보이고 있다는 것을 파악했다""라며 ""하지만 두 클럽 모두 4000만 유로(약 630억원)로 평가되는 이강인에 대한 움직임을 보이기 전까지 여름 이적시장까지 기다리는 것을 선호할 것""이라고 했다.

토트넘 소식을 주로 전하는 영국 '토트넘 홋스퍼 뉴스'는 지난 1월 ""손흥민은 비밀리에 토트넘에 새로운 영입을 추천했다""라며 ""안지 포스테코글루가 이끄는 토트넘은 PSG와 대한민국 공격수 이강인에 관심을 가진 프리미어리그 4개의 클럽 중 하나이다""라고 주장했다.

매체에 따르면 전 토트넘 스카우터 브라이언 킹은 인터뷰에서 ""토트넘은 이강인 영입을 검토할 수 있고, 손흥민의 추천은 이적을 지원할 수 있다""라고 말했다.

이어 ""다만 난 이 거래가 1월에 이뤄질 거라고 생각하지 않는다""라며 ""토트넘이 이강인을 영입하려고 한다면 이강인 이적료는 싸지 않을 거다. 이강인은 손흥민보다 9살 어리다""라고 덧붙였다.



더불어 ""그러므로 이강인은 아마 토트넘이 손흥민의 대체자로 영입하려고 하는 선수일 것""이라며 ""난 손흥민이 있기 때문에 토트넘이 대한민국에서 어떤 선수를 타깃으로 삼을지에 대해 도움을 받을 수 있을 것이라고 확신한다""라고 전했다.

킹의 주장에 대해 매체는 ""일부는 손흥민이 토트넘에서의 생활을 마감했다는 의견도 있지만, 손흥민은 여전히 무대 뒤에서 무언가를 조종하고 있는 듯하다""라며 ""이강인은 토트넘에 최전방에 퀄리티를 제공할 수 있고, 손흥민이 클럽에 있으면 더 빨리 정착하는데 도움이 될 수 있다""라고 주장했다.

또 ""다니엘 레비(토트넘 회장)는 여름까지 기다리기 보다 지금 당장 거래를 시작하는 게 나을 것""이라며 이번 겨울에 이강인 영입을 추진할 것으로 추천했다.

사진= 엑스포츠뉴스DB, 연합뉴스"
20250310,지고 있는 상황서 PK 파넨카킥 골… ‘강심장’ 손흥민,"담대한 캡틴 토트넘 홋스퍼의 손흥민(왼쪽)이 9일 밤(한국시간) 영국 런던의 토트넘 홋스퍼 스타디움에서 열린 EPL 홈경기에서 후반 39분 페널티킥을 골로 연결하고 있다. AFC 본머스의 골키퍼 케파 아리사발라는 타이밍을 빼앗겨 공을 바라만 보고 있다. 로이터 연합뉴스


■ EPL 토트넘, 본머스와 2-2

손, 빠른 스피드로 PK 유도뒤

직접 키커로 나서 동점골 성공

52일 만에 득점포…리그 7호골

“승점 3을 따지 못해 매우 실망”

‘주장’ 손흥민이 토트넘 홋스퍼를 패배에서 구했다. 손흥민은 위기에서 ‘강심장’을 뽐내며 침착하게 페널티킥으로 동점골을 터트렸다.

손흥민은 9일 밤(한국시간) 영국 런던의 토트넘 홋스퍼 스타디움에서 열린 AFC 본머스와 잉글랜드 프로축구 프리미어리그(EPL) 홈경기에서 1득점을 올렸다. 손흥민의 올 시즌 EPL 7호 골. 손흥민은 지난 1월 16일 아스널전 이후 52일 만에 득점포를 가동했다. 모든 대회로 범위를 넓히면 올 시즌 11번째 득점이며, 지난 1월 24일 호펜하임(독일)과 유럽축구연맹(UEFA) 유로파리그 경기 이후 44일 만이다.
손흥민을 앞세운 토트넘은 패배 위기를 모면했다. 토트넘은 본머스를 상대로 0-2로 뒤지다가 2-2로 비겼다. 통계전문업체 옵타에 따르면 토트넘이 2점 차 이상 뒤지다가 비기거나 승리, 승점 1 이상을 획득한 건 1992년 EPL 출범 이후 26번째(9승 17무)다. 토트넘은 이 부문에서 맨체스터 유나이티드(30회)에 이어 2위에 자리하고 있다. 토트넘은 그러나 승리를 놓친 탓에 10승 4무 14패(승점 34)로 13위에 자리했다.

손흥민은 이날 선발에서 제외, 벤치에서 시작했다. EPL 상위권 진입이 어려워진 토트넘은 오는 14일 AZ 알크마르(네덜란드)와 UEFA 유로파리그 16강 2차전에 집중하기 위해 손흥민을 포함한 일부 주축 선수들의 기용을 아꼈다. 토트넘은 그러나 전반 42분 선제 실점하자 손흥민을 후반 시작과 함께 투입했다. 토트넘은 후반 20분 추가 실점해 0-2로 몰렸으나 후반 22분 파페 사르의 득점으로 추격의 불씨를 지폈다.

그리고 손흥민이 1-2로 뒤진 후반 39분 동점골을 넣었다. 박스 왼쪽으로 침투한 손흥민은 골키퍼의 손에 다리가 걸려 넘어졌다. 손흥민이 먼저 공을 터치한 후 골키퍼가 손을 뻗었기에 페널티킥이 선언됐다. 키커로 나선 손흥민은 오른발 ‘파넨카킥’으로 가운데 골망을 흔들었다. 통상 페널티킥은 빠르고 강하게 차지만, 파넨카킥은 정면을 향해 살짝 띄우듯이 차서 골키퍼의 타이밍을 뺏는다. 골키퍼가 슈팅 방향을 읽기 전에 예측, 몸을 날리는 경우가 많기에 역으로 이용하는 방법이다.

손흥민은 후반전밖에 안 뛰었지만 호평을 받았다. 영국 매체 스카이스포츠는 손흥민에게 팀 내 공동 1위인 평점 8을 부여했다. 양 팀을 통틀어도 공동 2위다. 스카이스포츠는 “손흥민이 경기의 흐름을 완전히 장악했다”며 “손흥민은 위협적이지 않은 상황에서 골키퍼의 불필요한 반칙을 유도했다. 그리고 직접 나서서 재치있게 페널티킥을 성공시켰다”고 극찬했다. 소파스코어는 손흥민에게 평점 7.4, 후스코어드닷컴은 평점 7.12, 풋볼런던은 평점 7을 책정했다. 모두 팀 내 세 번째다.

손흥민은 오랜만에 골을 넣었으나 팀이 승리를 놓쳤기에 고개를 숙였다. 손흥민은 “승점 3(승리)을 못 따서 매우 실망스럽고 좌절감이 든다”면서 “홈에서 경기할 때엔 승점 3을 기대하기 마련이다”고 말했다. 또 “물론 본머스는 정말 좋은 팀이고, 특히 올 시즌에 뛰어난 모습을 보여주고 있다. 하지만 2-2 무승부는 여전히 우리에게 충분하지 않다고 느껴진다. 우리는 앞으로 계속 나아가야 한다”고 덧붙였다."
20250310,"김민재 없으니 '와르르'…콤파니 이례적 분노, ""최소한 패배하지는 말았어야지""","사진=iMiaSanMia


[포포투=박진우]

김민재가 결장하자 와르르 무너졌다. 빈센트 콤파니 감독은 이례적으로 분노를 표출했다.
바이에른 뮌헨은 8일 오후 11시 30분(한국시간) 독일 뮌헨에 위치한 알리안츠 아레나에서 열린 2024-25시즌 독일 분데스리가 25라운드에서 보훔에 2-3으로 역전패했다. 이로써 뮌헨은 리그 10경기 무패 행진을 마감했지만, 리그 선두는 유지했다.

이날 콤파니 감독은 로테이션을 가동했다. 유럽축구연맹(UEFA) 챔피언스리그(UCL) 2차전 레버쿠젠과의 경기를 대비하기 위함이었다. 지난 1차전에서 3-0 완승을 거두기는 했지만 레버쿠젠은 언제나 만만하게 볼 상대가 아닌 만큼, 보훔전에서 주전 멤버에게 휴식을 주고 오는 2차전에서 총력을 다하겠다는 심산이었다.

특히 수비진 변화가 눈에 띄었다. 콤파니 감독은 김민재, 다요 우파메카노, 콘라트 라이머, 알폰소 데이비스 등 주전 포백에 모두 휴식을 부여했다. 빈 자리는 에릭 다이어, 요시프 스타니시치, 사샤 보이, 이토 히로키로 채웠다.

초반 흐름은 괜찮았다. 공격형 미드필더로 나선 하파엘 게헤이루가 전반 초반부터 멀티골을 터뜨리며 2-0으로 앞서 나갔다. 그러나 전반 30분 코너킥 상황에서, 메디치에게 추격골을 허용했다. 게다가 전반 42분에는 팔리냐가 최악의 태클로 다이렉트 퇴장을 당하며 수적 열세에 몰렸다.

이 때부터 판도는 뒤집어졌다. 후반 6분 시소코에게 헤더 실점을 허용하며 2-2 무승부를 내준 뮌헨이었다. 콤파니 감독은 후반 17분 해리 케인, 자말 무시알라, 마이클 올리세, 라이머를 연달아 투입하며 역전 의지를 다졌고, 실제로 투입과 함께 주도권을 찾은 뮌헨이었다. 그러나 후반 25분 다이어의 안일한 수비가 실점으로 이어졌다. 결국 뮌헨은 격차를 좁히지 못하고 2-3 역전패로 경기를 마무리했다.

콤파니 감독은 경기 후 기자회견에서 이례적으로 선수들에게 쓴 소리를 뱉었다. 본래 콤파니 감독은 선수들을 외부의 압박에서 보호하기 위해, 특정 선수나 선수단을 상대로 공개 석상에서 쓴 소리를 뱉지 않는다. 그러나 이날은 달랐다.

콤파니 감독은 ""우리에게 매우 불쾌한 결과다. 좋은 출발을 했지만, 절대 퇴장을 당해서는 안 됐다""며 팔리냐의 어이없는 퇴장을 비판했다. 이어 그는 ""그러나 10명이 남은 상황에서도 오늘 경기를 이겨야 했고, 최소한 패배는 당하지 않았어야 했다. 그러나 오늘은 그렇게 되지 않았다. 변명의 여지가 없다. 우리는 이번 경기를 분석하고 그에 대한 책임을 져야 한다""고 덧붙였다.

사진=게티이미지"
20250310,"손흥민 PK 만들어 천금 동점포…토트넘, 본머스와 0-2→2-2 무승부","(엑스포츠뉴스 윤준석 기자) 토트넘 홋스퍼가 프리미어리그 본머스와의 경기에서 극적으로 무승부를 거두었다.

경기 내내 실망스러운 경기력을 보인 토트넘은 손흥민의 활약 덕분에 패배를 면할 수 있었다.

후반 교체 투입된 손흥민은 페널티킥을 유도하며 직접 골을 성공시켰다. 환상적인 파넨카킥이었다.

하지만 이 무승부는 토트넘이 간신히 거둔 결과였으며, 경기 내내 본머스에게 철저히 밀리는 모습을 보였다.

토트넘은 9일(현지시간) 영국 런던 토트넘 홋스퍼 스타디움에서 열린 2024-2025시즌 잉글리시 프리미어리그(EPL) 28라운드 홈 경기에서 본머스와 2-2로 비겼다. 최근 3경기 1무 2패를 기록 중인 토트넘이다.



이날 토트넘은 대거 로테이션을 가동했다.

14일 열리는 유럽축구연맹(UEFA) 유로파리그 AZ알크마르와 16강 2차전 대비로 보인다. 토트넘은 1차전 0-1 패배로 인해 2차전에는 2점차 이상 승리를 거두어야 유로파리그 8강 진출에 성공할 수 있는 상황이다.

손흥민 역시 벤치에서 경기를 시작했다. 손흥민 뿐만 아니라 제임스 매디슨과 마티스 텔, 루카스 베리발, 아치 그레이, 데스티니 우도기 등 평소 선발자원으로 출전한 핵심자원들이 모두 벤치에서 출발했다.

한편, 토트넘에는 기나긴 부상에서 복귀한 수비수 크리스티안 로메로가 오랜만에 선발출전했다.

안지 포스테코글루 감독이 이끄는 홈팀 토트넘은 4-3-3 포메이션으로 시작했다. 굴리엘모 비카리오가 골문을 지킨채 제드 스펜스, 크리스티안 로메로, 케빈 단소, 페드로 포로가 백4를 구축했다. 허리는 파페 사르, 이브 비수마, 로드리고 벤탄쿠르가 책임졌고, 최전방 쓰리톱에는 윌손 오도베르, 도미니크 솔란케, 브레넌 존슨이 상대 골문을 노렸다. 

이에 맞서는 이라올라 감독이 이끄는 본머스는 4-2-3-1 포메이션으로 맞섰다. 케파 아리사발라가가 골키퍼 장갑을 꼈고, 밀로시 케르케즈, 딘 하위선, 제임스 힐, 루이스 쿡이 수비라인을 구성했다. 3선에는 타일러 아담스와 라이언 크리스티가 호흡을 맞추었고, 2선에는 앙투안 세메뇨, 저스틴 클라위버르트, 마커스 태버니어가 최전방 이바니우송을 지원했다.



지난 목요일 AZ 알크마르와의 경기에서 패배한 이후 반등이 필요했던 토트넘은 경기 초반부터 어처구니없는 실수를 연발했다.

오랜만에 선발 출전한 로메로는 경기 감각이 무뎌진 듯 여러 차례 위험한 패스를 시도했고, 결국 본머스에게 여러 차례 기회를 내줬다. 경기 시작 16초 만에 첫 실수를 범한 그는 수비진영에서 상대 공격수 에바니우송에게 공을 넘겨주어 슈팅을 허용했지만, 골키퍼 비카리오가 간신히 선방했다.
이후에도 전반 3분 로메로는 비수마에게 받기 힘든 패스를 내줬고, 이를 틈타 압박을 시도한 클라위버르트가 공을 뺏어 패널티 박스 안에서 결정적인 오른발 슈팅을 시도하기도 했다. 이 역시 비카리오의 선방에 막혔다.

토트넘의 수비는 계속해서 흔들렸다. 비카리오는 본머스의 강한 전방 압박에 당황한 듯 불안한 클리어링을 반복했고, 벤탄쿠르는 공을 엉뚱한 곳으로 패스하며 공격 기회를 날렸다. 포로 역시 세메뇨에게 시종일관 압박당하며 어려움을 겪었다.

토트넘도 분위기를 바꿔보려 노력했다. 전반 21분, 포로가 오른쪽 측면에서 올린 긴 크로스가 솔란케의 머리로 연결됐지만, 골로 이어지기엔 힘이 부족했다. 

하지만 역시 먼저 웃은 쪽은 경기 내내 우세를 보인 본머스였다.

전반 41분, 포로의 실수로 인해 본머스가 선제골을 기록했다. 공격 기회를 맞이한 토트넘이었지만, 포로의 느슨한 패스가 상대의 역습으로 이어졌고, 본머스의 케르케즈가 먼 거리를 질주한 뒤 날카로운 크로스를 올렸다. 길게 날라오는 얼리 크로스를 뒤쪽에서 침투하던 태버니어가 논스톱 오른발 슈팅으로 득점으로 연결시키며 토트넘은 0-1로 끌려갔다.

전반 종료 후 관중들은 실망감을 숨기지 못하며 야유를 보냈다.



후반전 시작과 함께 손흥민과 베리발이 교체 투입되면서 분위기가 조금씩 달라졌다. 손흥민의 적극적인 돌파가 토트넘에 희망을 불러일으켰다. 손흥민의 투입과 함께 토트넘은 분위기를 가져왔다.

토트넘은 반격을 시도해봤지만 번번히 기회를 놓치고 말았다. 후반 8분 손흥민의 전매특허 오른발 감아차기 슈팅은 골문을 살짝 벗어났고, 후반 12분 손흥민의 킬패스에 이은 패스플레이로 사르가 페널티박스에서 여유롭게 슈팅을 시도할 수 있었지만 이 슈팅 역시 골문을 크게 벗어났다.

토트넘의 기세에도 불구하고, 후반 15분 본머스의 두 번째 골이 터졌다. 클라위버르트가 전진패스를 이어받아 센스있는 침투패스를 넣어줬다. 이 패스를 받은 에바니우송은 왼발로 띄어 비카리오를 넘기는 골로 팀의 2-0 리드를 안겨줬다.

후반 17분 토트넘의 추격골이 터졌다. 사르의 예상치 못한 실수가 오히려 행운의 골로 이어졌다. 사르는 크로스를 시도하려 했으나 공이 엉뚱한 방향으로 흘러가면서 상대 골키퍼 케파를 속이며 골문으로 빨려 들어갔다. 이로 인해 토트넘은 1-2로 따라붙었다.

그리고 경기 종료 직전인 후반 41분, 손흥민이 결정적인 순간을 만들었다.

페널티 박스 안에서 상대 골키퍼 케파의 반응을 유도하며 발을 걸려 넘어졌고, 주심은 페널티킥을 선언했다.

손흥민은 강심장이었다. 침착하게 파넨카 킥으로 골을 성공시키며 토트넘에 소중한 승점 1점을 안겼다. 경기는 그대로 2-2로 마무리됐다.



손흥민은 이날 교체 투입 후 45분 동안 그라운드를 누비면서 오랜만에 그다운 활약을 선보였다. 터치 25회, 패스 성공률 81%(13/16), 기회 창출 1회, 유효슈팅 1회, 드리블 성공률 33%(1/3), 볼 경합 성공 2회 등을 기록했다.

상대편 감독인 안토니 이라올라 역시 이 경기 종료 후 ""손흥민은 굉장히 영리한 선수다. 그는 슈팅보다는 시간을 끌며 상대의 반응을 유도했고, 결국 페널티킥을 얻어냈다""고 인정했다.

이번 경기에서 본머스는 토트넘을 압도하며 승리를 가져갈 뻔했으나, 손흥민의 노련함이 승부를 바꿨다.

그러나 토트넘은 여전히 불안한 경기력을 보이며 향후 일정에 대한 우려를 남겼다. 다가오는 유로파리그 경기에서 1차전 0-1 열세를 극복하지 못하면 이번 시즌 유일한 우승 가능성마저 사라질 수 있다. 포스테코글루 감독 체제의 미래 역시 불투명한 상황이다.

사진=연합뉴스"
