date,title,content
20251209,"손흥민 토트넘 복귀 D-1...10일 오전 5시 UCL 프라하전, 레전드의 귀환! 벽화도 거의 완성","사진=토트넘 홋스퍼


[인터풋볼=박윤서 기자] 손흥민의 화려한 복귀가 하루 남았다.

토트넘 홋스퍼는 10일 오전 5시(한국시간) 영국 런던에 위치한 토트넘 홋스퍼 스타디움에서 열리는 2025-26시즌 유럽축구연맹(UEFA) 챔피언스리그(UCL) 리그 페이즈 6라운드에서 슬라비아 프라하를 상대한다.

이 경기를 앞두고 손흥민이 토트넘 팬들 앞에 화려하게 돌아온다. 토트넘은 지난 3일 공식 홈페이지를 통해 ""Sonny's coming home""이라며 ""손흥민이 클럽을 떠난 후 처음으로 토트넘 홋스퍼 스타디움으로 돌아와 10일 프라하와의 UCL 경기에서 홈팬들에게 작별인사를 할 예정이다""라고 공식발표했다.
이어서 ""손흥민은 프라하전 킥오프를 앞두고 경기장에 나설 예정이다. 손흥민은 2015년 이적한 후 그를 진심으로 사랑하고 10년 동안 아껴준 팬들에게 직접 인사를 전할 기회를 가진다. 감동적인 순간이 될 것이다""라고 덧붙였다.

손흥민도 직접 토트넘 SNS 영상에 등장하여 ""모두 안녕하세요, 손흥민입니다. 여러분 모두 잘 지내고 계시길 바랍니다. 내가 이 클럽을 떠났을 때 한국에 있어서 모두에게 인사를 할 적절한 기회가 없었다. 이제 나는 12월 9일 UCL 경기 날 런던으로 돌아가게 되어 아주 기쁘다. 팬들, 선수들, 코칭스태프 등 모두를 보고 싶고 모두에게 작별인사를 하고 싶다. 아주 감정적인 날이 될 것이며 나에게도, 클럽에도 중요한 날이다. 곧 만나요""라고 말했다.

사진 = X


여기서 끝이 아니다. 토트넘은 손흥민에 대한 예우를 제대로 하려 한다. 토트넘은 ""팬 자문 위원회화 협력하여 토트넘 하이 로드에 거리 벽화 작업이 시작되었고, 12월 9일에 완료될 예정이다. 벽화 디자인은 손흥민이 직접 선택했으며 경기장 통로를 장식하는 레들리 킹, 해리 케인의 작품을 제작한 머월스 팀이 제작했다""라며 벽화가 제작 중임을 알렸다.

이미 SNS상에서는 손흥민 벽화 사진이 떠돌고 있다. 아직 완성되지는 않았는데 윤곽은 드러났다. 손흥민의 시그니처 세리머니인 '찰칵' 세리머니와 태극기를 두른 채 UEFA 유로파리그(UEL) 트로피를 들고 있는 장면이 벽화에 그려질 것으로 보인다."
20251209,"토트넘 '오피셜' 공식발표, 손흥민 ""영원히 남는다""…SON 드디어 런던 입성→'태극기 쾅쾅' SON 벽화 공개 시선집중","(엑스포츠뉴스 김현기 기자) 손흥민이 북런던에 영원히 남기 위해 떠났다.

모처럼 런던으로 향하며 귀향했다. 손흥민이 피땀 흘려 만들어낸 유럽축구연맹(UEFA) 챔피언스리그 무대에 앞서 팬들에게 인사 올리고 손을 흔든다.

국내에 체류하던 손흥민은 지난 8일 영국 런던으로 출국했다.

10일 영국 런던의 토트넘 홋스퍼 스타디움을 찾아 친정팀 팬들에게 인사하기 위해서다.



앞서 토트넘은 지난 3일 손흥민의 친정팀 방문 계획을 발표했다. 손흥민은 10일 오전 5시 토트넘 홋스퍼 스타디움에서 열리는 유럽축구연맹(UEFA) 챔피언스리그 슬라비아 프라하(체코)와의 홈경기에 경기장을 방문한다.

지난여름 미국 메이저리그사커(MLS) LAFC로 옮겨 갑작기 토트넘을 떠났던 손흥민이 영국의 토트넘 팬들 앞에 서는 건 이번이 처음이다.

손흥민은 10년간 몸 바쳤던 토트넘에서의 마무리를 런던이 아닌 서울에서 했다. 토트넘은 프리시즌 아시아 투어를 위해 홍콩에서 아스널과 친선 경기를 한 뒤 서울에서 뉴캐슬과 친선 경기를 치렀다. 지난 8월3일 서울월드컵경기장에서 열린 뉴캐슬과의 친선 경기가 토트넘 고별 무대가 됐다. 당시 선발 출전했다가 후반 교체아웃됐다.



손흥민도 이 점을 늘 아쉬워했다. 기회가 되면 북런던에 오겠다는 생각을 전했다.

그는 LAFC 이적 직후 인터뷰에서 ""토트넘 홋스퍼 스타디움에서 팬들에게 작별 인사를 하고 싶다. 그들은 나를 직접 만나 인사받을 자격이 있다""고 말했다. LAFC 시즌 도중에서 그런 생각을 전했다. 오랜 시간 지나지 않아 실현됐다.

토트넘은 그의 홈구장 방문에 맞춰 큰 선물을 하나 준비하고 있다. 북런던 거리에 3층 높이의 대형 벽화를 그리고 있는 것이다.
벽화의 일부도 공개됐는데 손흥민이 유로파리그 우승컵에 입맞춤을 하는 장면이 메인이며, 한 켠에 태극기도 들어가는 것으로 드러났다. 토트넘 구단도 공식적으로 이런 콘셉트를 알렸다.

손흥민의 벽화는 토트넘의 레전드 레들리 킹과 해리 케인의 벽화를 담당했던 아티스트 그룹 '머월스'가 담당 중이다.

7일 토트넘 전문 매체 '스퍼스 아미'에 따르면, 런던 하이로드 일대에 찰칵 세리머니를 형상화한 그래피티가 조금씩 윤곽을 드러내기 시작했다. 일부 영상에서는 '손 세븐 레전드(SON SEVEN LEGEND)'라는 문구가 확인되면서 손흥민을 레전드로 공식 인정하는 것은 물론 그의 등번호 7번도 벽화에 새기는 것으로 확인됐다.



이전에도 손흥민을 상징하는 벽화는 있었다.

가장 대표적인 것이 손흥민이 자신의 시그니처 세리머니인 찰칵 세리머니 하는 모습을 크게 확대해서 그린 것이다.

지난 5월 유로파리그 우승 뒤엔 손흥민이 팬들에게 했던 인삿말인 ""여러분들을 X나게 사랑해""를 벽화게 그리는 팬들도 있었다.

이번 토트넘 구단의 공식 벽화는 우승 세리머니와 태극기, 그의 등번호 7번이 모두 들어간 손흥민 토트넘 10년의 '총집합'이 될 전망이다.

손흥민의 토트넘 퇴단은 오히려 6개월이 지난 지금 시점에서 더욱 주목을 받고 있다.

토트넘이 손흥민 떠난 첫 시즌 성적 부진에 시달리고 있기 때문이다.

특히 토트넘은 손흥민이 맡았던 왼쪽 날개, 그리고 리더십 부재로 고충을 겪고 있다. 손흥민을 단기 임대라도 데려와야 하는 것 아니냐는 의견이 토트넘 매체 중심으로 불거졌으나 손흥민이 ""그럴 일은 절대 없고, LAFC에서 시즌을 마치면 쉬겠다""고 했기 때문에 토트넘은 올겨울 손흥민 대체자를 다시 알아보는 중이다.



다행히 토트넘 홋스퍼 스타디움 방문을 통해 손흥민의 기를 전달받게 됐다. 지난달 23일 밴쿠버 화이트캡스와의 MLS컵 서부 콘퍼런스 4강전(LAFC 승부차기패)으로 손흥민의 올해 LAFC 공식 일정이 다 끝났고, 손흥민도 귀국했다.

일주일 넘게 국내에서 휴식을 취한 손흥민은 12월10일을 북런던 복귀일로 못 박았다.

토트넘은 손흥민을 위한 공식 프레젠테이션과 하프타임 헌정 행사를 준비 중인 것으로 알려졌다. 손흥민은 경기장을 방문해 팬들뿐만 아니라 10년 동안 토트넘에서 함께 일했던 구단 직원들을 모두 만나 감사 인사를 전할 예정이다.

다만 팬들은 벽화 갖고는 부족하다는 생각이다. 2019년 완공된 토트넘 홋스퍼 스타디움의 동상 1호로 손흥민을 지목했다.



토트넘 관련 소식을 다루는 '투 더 레인 앤드 백'에 따르면 토트넘 팬들은 소셜미디어(SNS)에서 ""손흥민의 동상이 필요하다"", ""손흥민은 우리 팀의 아이콘"" 등의 반응을 보이며 손흥민의 동상을 요구하는 중이다.

토트넘 구단도 새 구장 앞에 아직 동상 하나 없어 이제 세우겠다는 구상을 드러낸 적이 있는데 21세기 구단의 최고 스타 손흥민 동상에 생길지 궁금하게 됐다.

사진=토트넘 홈페이지 / SNS"
20251209,"손흥민처럼 참을성 없었고 '폭탄발언' '폭로' 이후 '몰락'…""리버풀 날 보호하지 않아"" 살라 챔스 명단 제외 '오피셜' 공식발표 '굴욕'","[스포티비뉴스=박대성 기자] 모하메드 살라(33, 리버풀)가 결국 챔피언스리그 명단에서 제외됐다. 폭탄발언 이후 후폭풍이 상당하다.

리버풀은 9일(한국시간) 구단 공식 페이지를 통해 인터밀란과 2025-26시즌 유럽축구연맹(UEFA) 챔피언스리그에 출전할 소집 명단을 발표했다. 여기에 살라의 이름은 없었다.

이미 예견된 일이었다. 영국 공영방송 'BBC'는 리버풀 발표가 있기 직전 속보를 통해 ""살라가 인터 밀란과의 챔피언스리그 경기 선발 명단에서 제외됐다""고 보도했다. 'BBC'에 따르면 리버풀은 리즈 유나이티드전에서 현지 취재진에 '폭탄발언' 이후 일정 기간 살라를 선발 대상에서 제외하기로 결정했다.

살라는 리즈 유나이티드전 인터뷰에서 ""리버풀이 날 보호하지 않는다. 내가 버려진 것 같다""라고 말했고, 아르네 슬롯 감독과의 관계가 무너졌다고 주장했다. 'BBC'는 ""슬롯 감독도 살라의 명단 제외 결정에 동의했고 클럽 차원에서 공식적인 징계는 없을 것""이라고 보도했다.
살라는 2024-25시즌을 앞두고 리버풀과 2년 재계약을 체결했다. 사우디아라비아 팀의 천문학적인 영입 제안에도 리버풀과 동행에 서명했다. 위르겐 클롭 감독이 떠난 뒤 새롭게 부임한 슬롯 감독의 첫 번째 시즌에 핵심 선수로 맹활약하며 에이징 커브 논란을 불식, 팀의 두 번째 프리미어리그 우승에 기여하며 레전드로 존재감을 입증했다.

하지만 두 번째 시즌, 한 순간에 존재감이 사라졌다. 리버풀의 전술적인 문제도 있겠지만 살라의 경기력도 예년처럼 날카롭지 않았다. 살라가 빠졌던 경기에서 리버풀의 경기력이 살아났던 점까지 주전 경쟁 입지를 위태롭게 했다.

▲ bestof topix


슬롯 감독은 팀 분위기 반등을 위해 살라를 선발에서 제외하기로 결정했다. 살라가 마지막으로 선발 출전했던 경기는 PSV전 1-4 패배 경기, 마지막 득점은 11월 1일 아스톤 빌라전이었다. 리즈 유나이티드전에서 교체 없이 벤치에서 90분을 버텼고, 그전 두 경기에서는 교체 출전 또는 벤치로 밀렸다.

이번 시즌 프리미어리그와 챔피언스리그 18경기 5골이라는 기록은 '득점 기계' 시절과 비교하면 초라하다. 6개월 전만 해도 프리미어리그 29골로 팀의 리그 우승을 이끌었던 핵심 선수였는데 한 순간에 존재감이 사라졌다.

'BBC'에 따르면, 살라는 리즈 유나이티드전 이후 스스로 취재진에게 인터뷰를 요청했다. 이후 ""나는 팀에 의해 버려졌다. 누군가가 나를 원하지 않는다고 느꼈다. 팀이 나를 보호하지 않았다""고 말했다.

'BBC'는 ""클럽 내부는 살라의 발언에 큰 충격을 받았다. 불필요한 혼란을 일으키기에 충분한 발언이라고 판단 중""이라며 내부 분위기를 전하면서 ""리버풀은 잠시나마 살라를 선발에서 제외해 팀 내 분위기를 잠잠하게 만들려는 결정을 내렸다""고 설명했다.

▲ bestof topix


물론 살라를 완벽하게 내친 건 아니다. 챔피언스리그 원정길에 떠나기 직전, 리버풀에서 열린 훈련에 살라를 포함했다. BBC는 ""살라는 팀 훈련에는 참여했고, 이는 복귀 가능성을 남겨둔 것이다. 실제로 리버풀 훈련장에서 웃는 모습이 카메라에 잡혔다""라고 알렸다.

하지만 원정 명단에 없었고 리버풀은 살라 등을 제외한 19명만 데리고 이탈리아 밀라노로 향했다. 이에 BBC는 ""살라는 다음 주 아프리카 네이션스컵 출전으로 팀을 떠날 예정인데 브라이튼전까지 결장할 가능성이 크다""고 전망했다.

살라의 폭탄발언은 프리미어리그 레전드에게 큰 비판을 받았다. 맨체스터 유나이티드 출신 웨인 루니는 ""살라가 스스로 자신의 레거시를 파괴하고 있다""고 직격탄을 날렸다. 이어 ""슬롯 감독은 인터밀란전, 브라이튼전 모두 살라를 기용하지 말아야 한다""고 주장했다.

현지 팬 여론도 갈리고 있다. ""레전드라 해도 예외는 없다"", ""감정 폭발은 이해되지만 팀을 먼저 생각해야 했다""는 평가가 공존한다.

▲ bestof topix


BBC는 ""살라가 내년 1월 이적을 원한다고 보긴 어렵지만, 향후 리버풀엣서 미래가 불투명하다는 것을 의미한다""고 분석했다. 실제 살라는 ""안필드에서 팬들에게 작별을 말하고 네이션스컵으로 향할 것이다. 이후 어떻게 될지는 모른다""고 말했다.

그러면서도 매체는 ""리버풀은 여전히 살라와 미래를 논의할 의지가 있는 것으로 보인다""고 강조했다.

살라는 리버풀 유니폼을 입고 420경기 250골을 기록한 절대적인 상징이다. 리버풀의 레전드이자 팀 역사를 새로 쓴 공격수다. 손흥민이 토트넘에서 10년 동안 쌓았던 위상처럼, 살라 역시 리버풀의 얼굴이었다.

▲ bestof topix


하지만 손흥민은 토트넘이 어려웠던 순간, '주장감이 아니다'라는 온갖 비난에도 침묵하며 팀을 위해 헌신했던 반면 살라는 아니었다. 경기력 부진, 벤치 추락, 폭탄발언, 그리고 챔스 제외까지 도미노처럼 무너지고 있다. 어쩌면 결별을 암시하는 수순처럼 보인다.

손흥민은 토트넘과 박수 속에서 아름다운 작별로 마침표를 찍었다면, 살라는 끝없는 논란 속 이별할 가능성이 거론되고 있다. BBC는 ""살라가 팀을 떠나지 않는 방향으로 마무리될 수도 있다. 구단은 그가 100% 회복 후 다시 팀에 기여하길 바란다""고 전했지만, 살라는 ""어떤 일이 일어날지 지켜보자""는 의미심장한 말만 반복했다."
20251209,이보다 손흥민다울 수 없다...손흥민이 선택한 벽화 디자인 일부 공개 '태극기+찰칵 세리머니',"사진= 토트넘


[인터풋볼=김현수 기자] 손흥민의 벽화 디자인이 일부 공개됐다.

10년간 토트넘 홋스퍼 간판스타로 활약했던 손흥민이 런던에 복귀했다. 토트넘은 3일(한국시간) 공식 SNS에 ""손흥민이 집으로 돌아온다. 10일 열리는 유럽축구연맹(UEFA) 챔피언스리그(UCL) 슬라비아 프라하전에서, 클럽을 떠난 이후 처음으로 토트넘 홋스퍼 스타디움을 찾아 팬들에게 작별 인사를 전할 예정이다""라고 공식 발표했다.

바로 다음 날 토트넘은 SNS에 손흥민의 메시지 영상도 새로 게시했다. 영상에서 손흥민은 ""모두 잘 지내고 있었나. 쏘니다. 마지막으로 토트넘 유니폼을 입었을 때는 한국에 있었기 때문에 런던 현지 팬들과 인사하지 못했다. 그런데 이렇게 런던으로 돌아가 토트넘 팬들을 만날 기회가 주어져 정말 행복하다""라며 입을 열었다.
연신 미소를 지으며 ""팬분들을 포함해 선수들, 그리고 코칭 스태프까지 모든 클럽 사람들과 만날 날이 정말 기다려진다. 빨리 가서 모두에게 작별 인사를 하고 싶다. 매우 감정적인 날이 될 것 같지만 이날은 나와 토트넘을 위해서라도 굉장히 중요한 날이다. 곧 보자""라며 들뜬 마음을 감추지 못했다.

복귀를 앞둔 손흥민을 위해 토트넘은 여러 이벤트를 준비 중이다. 프라하전 손흥민을 위한 작별식을 여는 것과 동시에 N17(토트넘 하이로드)에 손흥민의 벽화도 만들고 있다. 일전 레들리 킹, 해리 케인의 벽화를 그렸던 아티스트와 팬 자문위원회가 협력해 제작 중이고 손흥민 복귀날에 맞춰 완성할 예정이다.

사진= 토트넘 SNS


완공에 앞서 벽화 일부가 먼저 공개됐다. 벽화 디자인은 손흥민이 직접 선택한 것으로 전해 졌는데 손흥민다운 요소들이 눈에 띈다. 손흥민 특유의 찰칵 세러머니와 더불어 지난 시즌 우승한 UEFA 유로파리그(UEL) 트로피를 안은 모습, 여기에 몸에 태극기를 허리에 감싼 모습이 보였다.

벽화에 담긴 이 세 가지 요소만 봐도 손흥민이 지난 10년 동안 토트넘에서 만들어온 상징적 순간들이 자연스럽게 떠오른다. 새롭게 완성될 벽화는 손흥민의 토트넘 여정을 기리는 또 하나의 상징물이 될 것으로 보인다."
20251209,"손흥민 복귀 하루 전! 역대급 '전설' 귀환…""토트넘에 영원히 남을 것"" 英 현지 감탄 ""구단 역사상 어떤 선수도 쏘니보다 더 큰 벽화 없었어""","[스포티비뉴스=박대성 기자] 손흥민(33, LAFC)이 토트넘에 돌아온다. 그토록 바랐던 홈 팬들 앞에서 작별인사다. 경기장 주변에 손흥민의 벽화가 새겨질 예정인데, 손흥민보다 더 큰 벽화는 토트넘 역대 누구도 없었다.

토트넘 소식을 전문적으로 전하는 웹진 '스퍼스웹'은 9일(한국시간) ""손흥민의 토트넘 복귀를 앞두고 벽화 설치 위치가 확인됐다. 토트넘 팬들은 곧 손흥민을 다시 보게 될 것""이라며 ""슬라비아 프라하전에서 손흥민이 특별 게스트로 초청된다""고 보도했다.

손흥민은 오는 10일 토트넘 홋스퍼 스타디움에서 열리는 유럽축구연맹(UEFA) 챔피언스리그 경기에서 킥오프 전 그라운드에 등장해 홈 팬들에게 마지막 인사를 건넬 예정이다. 이는 지난 여름 이적 이후 처음으로 북런던에 돌아오는 자리이며 약 6개월 만의 복귀다.

'스퍼스웹'에 따르면 토마스 프랑크 감독은 ""슬라비아 프라하전에서 승리해 손흥민의 귀환을 더욱 특별하게 만들고 싶다""고 밝힌 상태다. 손흥민을 향한 토트넘의 예우는 단순 환영이 아니라 영구적 기념 작업으로 이어지고 있다. 지난 3일 구단은 손흥민 벽화 제작을 공식 발표했으며, 벽화 디자인은 손흥민이 직접 선택했다.



'스퍼스웹'은 ""손흥민의 벽화는 토트넘 하이 로드에 설치되며, 현재 작업이 시작됐다. 위치는 3 Points Cafe(쓰리 포인츠 카페) 외벽이다. 바로 맞은편에는 펍이 있다""고 구체적으로 설명했다.

토트넘 팬들 사이에서는 이미 ""순례 장소""가 될 것이라는 반응이 퍼지고 있고, 건물 측면 전체를 덮을 만큼의 대형 스케일이라는 전언이다. 벽화 제작팀은 해리 케인, 레들리 킹 벽화를 제작했던 팀이다. 현지에서는 ""해리 케인과 래들리 킹에 이어 토트넘이 인정한 또 하나의 '레전드 박제'""라는 평가가 나온다.
'스퍼스웹'은 ""토트넘은 전설적인 선수들의 동상을 세우는 경향이 없지만, 이것은 그들을 기리는 다음으로 좋은 방법이다. 손흥민보다 더 큰 벽화를 가질 만한 선수는 없다. 손흥민은 좋을 때나 좋지 않을 때나 늘 팀에 헌신했다. 경기장에 나설 때면 늘 최선을 다했다""라고 감탄했다.

토트넘은 과거에도 레전드의 동상을 잘 세우지 않았는데, 이번 '오피셜' 벽화 제작은 사실상 팀의 레전드로 인정했다는 방증이다. 손흥민이 토트넘 역사 속 영원히 남는 존재가 됐다는 뜻을 갖는다.

▲ bestof topix


""손흥민만큼 거대한 벽화를 가질 자격이 있는 선수는 없다. 그는 어려울 때도, 잘 나갈 때도 팀과 함께했고, 언제나 최선을 다했다""고 전했던 '스퍼스웹'은 ""다음 주 UCL 경기 전 수많은 팬들이 3 Points Cafe 앞에 몰려 벽화를 찍어갈 것""이라고 기대했다.

손흥민은 토트넘에서 공식 경기 454경기 173골 101도움을 기록하며 아시아 선수 최초 프리미어리그 득점왕, FIFA 푸스카스상 수상, 41년 만 유럽대항전 우승 팀의 주장 등 구단 역사 최전성기의 중심 인물이었다. 이번 복귀가 단순 이벤트가 아닌 이유다. 10년을 함께한 팬과 팀이 미처 건너지 못했던 마지막 인사를 위해 다시 만나는 것이다."
20251209,"'바이에른 뮌헨 선수단 보강 계획, 센터백 판도 변화'…'김민재 시즌 중 이적은 불가' 예측","김민재/게티이미지코리아
김민재/게티이미지코리아

[마이데일리 = 김종국 기자] 바이에른 뮌헨 김민재의 이적설에 대한 관심이 이어졌다.

독일 매체 AF는 8일 'AC밀란은 바이에른 뮌헨에서 주전 자리를 잃은 김민재 영입을 고려하고 있다. 바이에른 뮌헨에서 김민재의 미래는 불투명하다. 이러한 상황은 AC밀란, 인터밀란, 유벤투스 등 여러 이탈리아 명문 클럽의 관심을 끌고 있다'며 '김민재는 여전히 이탈리아에서 높은 명성을 누리고 있다. 2022-23시즌 나폴리를 세리에A 우승으로 이끌었고 리그 최고 수비수로 선정되기도 했다. 김민재의 뛰어난 기량은 훌륭한 명성을 얻고 있다. 불과 몇 주 전 유벤투스가 김민재 영입에 관심을 보인다는 루머 이후 AC밀란도 겨울 이적시장에서 김민재 영입을 고려하고 있다는 소문이 돌았다'고 전했다.

이 매체는 '바이에른 뮌헨은 선수단을 더욱 강화할 계획이며 센터백 판도가 변화할 수도 있다. 슐로터벡과 코나테 같은 선수들이 잠재적인 영입 후보로 거론되고 있다. 김민재가 바이에른 뮌헨에서 장기적으로 어떤 역할을 맡을지에 대한 불확실성은 여전히 남아있다'며 '바이에른 뮌헨이 수비지을 더욱 강화한다면 김민재의 여름 이적이 더 현실적일 수 있다. 그때까지 김민재는 바이에른 뮌헨의 중요한 일원으로 남을 것이다. 하지만 경쟁은 여전히 치열하기 때문에 주전 자리를 차지하는 것은 쉽지 않을 것'이라고 주장했다.

김민재는 지난 6일 독일 슈투트가르트에 위치한 MHP아레나에서 열린 2025-26시즌 분데스리가 13라운드 원정 경기에서 풀타임 활약하며 바이에른 뮌헨의 5-0 무실점 대승 주역으로 활약했다. 바이에른 뮌헨은 올 시즌 분데스리가 무패행진과 함께 12승1무의 성적으로 리그 선두를 질주했다. 김민재가 분데스리가 경기에서 풀타임 활약한 것은 지난달 열린 레버쿠젠과의 9라운드 이후 4경기 만이다.

김민재의 이적설이 꾸준히 언급되는 가운데 독일 스포르트는 6일 'AC밀란이 김민재에게 관심을 보이고 있다. AC밀란은 이미 지난 여름 김민재를 영입하려 했다'며 '김민재는 요나단 타 합류 이후 바이에른 뮌헨에서 주전 자리를 잃었다. 김민재는 바이에른 뮌헨과 2028년까지 계약되어 있다'고 전했다.

이 매체는 '김민재는 여전히 이탈리아에서 훌륭한 명성을 얻고 있다. 최근 김민재는 유벤투스 영입설이 있었고 유벤투스가 겨울 이적시장에서 김민재 영입을 추진할 가능성도 언급했다. 이제 AC밀란도 김민재 영입설이 있다'고 전했다. 반면 '바이에른 뮌헨이 겨울 이적시장에서 김민재를 보낼 가능성은 낮다. 바이에른 뮌헨은 올 시즌 다양한 대회에 나서고 있고 바이에른 콤파니 감독은 목표 달성을 위해 두터운 선수단을 필요로 한다'고 언급했다.
김민재/게티이미지코리아"
