date,title,content
20251221,"손흥민은 대체 어떤 리더였나...""정말 미친 짓""→""불필요한 행동으로 퇴장"" 경기 완전히 망친 토트넘 주장, 날 선 비난 폭주","사진=트위터 캡처
로이터연합뉴스
로이터연합뉴스
[스포츠조선 이현석 기자]손흥민은 어떤 리더였을까. 새로운 주장 크리스티안 로메로의 수난시대다.

토트넘은 21일(한국시각) 영국 런던의 토트넘 홋스퍼 스타디움에서 열린 리버풀과의 2025~2026시즌 잉글랜드 프리미어리그(EPL) 17라운드에서 1대2로 패배했다.

아쉬움이 컸다. 전반 33분 터진 사비 시몬스의 퇴장 이후 토트넘은 2골을 연속해서 실점했다. 이후 히샬리송의 만회골이 있었으나, 후반 38분 로메로의 경고 누적 퇴장이 나오며 추격할 힘을 잃었다. 결국 1대2로 패배했다.

로이터연합뉴스
경기 후 비판의 화살은 로메로에게 향했다. 영국의 풋볼런던은 로메로에게 평점 3점을 부여하며 '리버풀의 첫 번째 득점 상황에서 공을 빼앗겼고, 두 번째 골 장면에서는 에키티케에게 밀려서 실점했다. 이후 토트넘이 동점골을 넣기 위해 공세를 펼치던 중 코나테를 차며 불필요하게 퇴장당했다'고 지적했다.

맨유 레전드 게리 네빌은 로메로에 대해 ""첫 골을 내주면서 팀에 실점을 안겨줬다. 팀이 이제 막 만회하려는 참이었는데, 그런 실수를 하다니. 도대체 무슨 짓을 한 것인가""라며 지적했다. 이어 ""정말 미친 짓이다. 심판이 어쩔 틈도 없게 만들었다. 정말 어리석은 짓이다""라고 덧붙였다.

제이미 레드냅 또한 ""로메로가 한 행동은 로메로다운 행동일 뿐이다. 심판 바로 앞에서 시비 걸고 누군가를 발로 차는 건 정말 어처구니없는 짓이다. 너무 멍청한 짓이다. 네 살짜리 아이가 그런 짓을 했다면 '뭐 하는 거니?'라고 했을 것이다. 정말 어처구니없는 행동이다""고 비판했다.

로이터연합뉴스
로메로의 이러한 문제는 최근 문제가 아니다. 토트넘 합류 이후 꾸준히 기행으로 문제가 제기된 바 있다. 주장으로서 팀의 중심을 잡아줘야 할 선수가 그런 행동을 범한 것은 쉽게 납득하기 어렵다. 토트넘 소식에 정통한 폴오키프 또한 과거 개인 SNS를 ""솔직히 말해서 로메로는 리더십 면에서 전혀 효과가 없다. 그의 실력에 대해서는 논쟁의 여지가 없다. 이는 완전히 다른 문제""라고 언급한 바 있다.

로메로는 올 시즌 프랭크 감독 부임 후 손흥민이 떠나며, 새로운 팀의 리더로 낙점됐다. 지난 2021년 토트넘으로 이적한 로메로는 합류 이후 줄곧 토트넘 주전으로 활약했고, 리더십을 인정받기도 했다. 주장 완장을 받았고, 곧이어 연장 계약도 체결했다. 하지만 손흥민이 보여줬던 리더십을 로메로에게는 찾을 수 없다. 도리어 팀의 문제까지 안겨주는 모습이다. 토트넘의 주장 완장을 차기 위해서는 조금 더 성숙해져야 하는 로메로다."
20251221,"'죄송합니다, 잘못했습니다' 일본서도 혼낸 이강인급 日 국대 에이스, 결국 사과 세리머니...4달 만에 득점포","[스포츠조선 김대식 기자]일본 국가대표 에이스 쿠보 타케후사가 팬들에게 사과했다.

쿠보의 소속팀 레알 소시에다드는 21일(한국시각) 스페인 발렌시아의 에스타디오 시우닷 데 발렌시아에서 열린 레반테와의 2025~2026시즌 스페인 라리가 17라운드에서 1대1 무승부를 거뒀다. 승점 1점에 만족한 소시에다드는 하위권 탈출에 실패했다.

이번 시즌 쿠보는 역대급 부진에 시달리는 중이다. 리그 개막전에서 득점을 터트리면서 기분 좋게 출발했지만 무려 4달 동안 득점포가 없었다. 소시에다드가 라리가 명문 구단이라는 걸 고려하면 쿠보의 부진은 용납하기 힘든 수준이었다.

그럼에도 쿠보는 계속해서 선발로 나섰고, 레반테전에서도 기회를 받았다. 잠잠하던 쿠보는 전반 종료 직전 선제골을 터트렸다. 소시에다드의 압박이 성공하면서 공격이 시작됐다. 곤살로 게데스가 왼쪽에서 크로스를 올렸는데 굴절되면서 쿠보에게 향했다. 페널티박스 안으로 침투한 쿠보가 높이 뛰어올라 헤더로 마무리했다. 쿠보는 득점을 확인한 후 오른쪽 코너플래그로 달려가 소시에다드 팬들을 향해 사과하는 세리머니를 보였다. 두 손을 가지런히 모은 쿠보는 골을 넣고도 마냥 행복한 표정이 아니었다.
<저작권자(c) 연합뉴스, 무단 전재-재배포, AI 학습 및 활용 금지>
쿠보는 무려 4달 만에 득점을 터트렸다. 발목 부상을 참고 뛰었다는 걸 고려해도 쿠보의 부진은 쉽게 용납되기 어려운 수준이었다. 공격 포인트를 전혀 생산하지 못한 쿠보는 11월 말에 치러진 14라운드 경기까지 개막전 득점 후 1개의 공격 포인트를 만들어내지 못했다.

쿠보의 부진과 함께 소시에다드의 하락세가 같이 찾아오면서 쿠보를 향한 비판이 나올 수밖에 없다. 쿠보는 주전에서 밀리지 않은 게 다행인 수준이었다. 소시에다드로 이적한 후로 매 시즌 기량이 떨어졌기 때문이다. 리그 기준 데뷔 시즌 9골 7도움, 2년 차 7골 4도움, 3년 차 5골 그리고 올해는 1골 1도움이 전부였다. 공격 포인트뿐만 아니라 경기장 안에서이 영향력도 떨어졌다.
<저작권자(c) 연합뉴스, 무단 전재-재배포, AI 학습 및 활용 금지>
일본에서도 비판이 나올 정도였다. 일본 사커다이제스트웹은 직전 경기인 3부 구단 엘덴세와의 경기 후 '쿠보는 2022년 여름 소시에다드에 합류한 이후 최악의 시기를 겪고 있다. 성적 부진으로 세르히오 프란시스코 감독이 14일 경질된 가운데, 쿠보 역시 자신의 장점을 잃어버린 듯하다. 돌파력과 마무리 정확도가 떨어진 모습을 보이고 있다. 부상은 이미 과거의 이야기'라며 쿠보를 냉혹하게 비판한 바 있다.

쿠보가 반전의 계기를 만드는 득점을 터트리자 일본도 걱정을 덜었다. 2026년 국제축구연맹(FIFA) 북중미 월드컵을 앞두고 국가대표팀 에이스가 부진하다는 건 자국에서도 엄청난 문젯거리로 인식됐기 때문이다.
<저작권자(c) 연합뉴스, 무단 전재-재배포, AI 학습 및 활용 금지>
일본 매체 도쿄웹은 '쿠보는 올 시즌 9월 일본 대표팀의 미국 원정 도중 왼쪽 발목을 다쳤고, 이후 한동안 소속팀에서도 기대만큼의 퍼포먼스를 보여주지 못했다. 그러나 부상이 회복되고 결과까지 나오면서 부활의 신호탄을 쏜 모습이다. 지금까지 현지 언론으로부터 혹평을 받은 경기들도 적지 않았지만, 침체에 빠진 팀의 반등을 위해 구보가 앞으로 더 컨디션을 끌어올릴 수 있을지 주목된다'고 전했다.

그러나 쿠보의 득점에도 불구하고, 소시에다드는 경기 종료 직전 페널티킥을 허용해 승점 1점에 만족할 수밖에 없었다."
20251221,"맨유 레전드 소신 발언 ""박지성이 손흥민보다 대단할 수도...한국의 데이비드 베컴인 줄 알았다""","스포츠조선DB
스포츠조선DB
[스포츠조선 김대식 기자]맨체스터 유나이티드 레전드인 리오 퍼디난드가 박지성과 손흥민의 한국 내에서의 인기를 두고 자신의 의견을 전했다.

퍼디난드는 20일(한국시각) 필 존스와 함께 맨유 유튜브 채널에 출연했다. 퍼디난드는 최근 미국 워싱턴에서 진행된 2026년 국제축구연맹(FIFA) 월드컵 조추첨식에 참석했다. 도널드 트럼프 미국 대통령과 만난 일화부터 유소년 축구, 프리시즌 투어 등 다양한 주제를 가지고 대화를 진행했다.
프리시즌 투어 관련된 이야기를 하다가 퍼디난드는 한국에서의 느꼈던 점에 대해서 말하기 시작했다. 그는 ""난 실제로 박지성 때문에 한 쇼핑몰이 문을 닫은 걸 목격했다""며 존스에게 그 당시를 기억하는지 물었다. 존스도 ""나도 거기에 있었다""고 대답했다.

퍼디난드는 ""우리가 한국에 가기 전까지 나는 박지성이 한국에서 그렇게 큰 존재인지 몰랐다. 훈련 후에 내 방에 갔을 때, 모든 광고에 박지성이 나왔다. 질레트 광고, 펩시 광고에도 박지성이 나왔다. 완전히 한국에서는 박지성이 데이비드 베컴 같은 존재였다""며 정말 놀랬다고 고백했다.
사진=프리미어리그
퍼디난드는 ""지금도 손흥민의 인기도 대단하지만, 제 생각엔 박지성이 여전히 더 대단할 수도 있다고 봐요""라고 말할 정도였다. 그러면서 퍼디난드는 ""정말 좋은 사람이었고, 대단한 사람이었다""며 박지성을 칭찬했다.

옆에 있던 진행자 역시 박지성을 두고 ""박지성이 팀에서 차지하는 중요성도 컸어요. 경기력과 에너지 레벨, 맡은 역할 수행 능력 면에서요. 그는 정말 보이지 않는 영웅이었고, 엄청난 궂은일을 해냈다""며 극찬했다.

그러자 퍼디난드는 ""내 생각에 박지성은 맨유 팬들로부터 정말 높은 평가를 받았다. 다른 팀들에서 우리 팀을 이야기할 때면 그의 이름은 절대 먼저 나오지 않았겠지만, 우리 팬들은 박지성을 최고라고 생각했다""고 거들었다.
스포츠조선DB
퍼디난드는 현역 시절 박지성과 오랜 시간을 함께 뛰면서 항상 박지성의 능력을 높이 평가했다. 그는 약 1년 전 구단 인터뷰를 통해 ""감독이 지시하는 것이라면 무엇이든지 했다. 누군가를 막거나, 수비하거나, 어디론가 투입되어 변화를 만들어야 한다면 박지성이 투입됐다. 정말 좋은 선수다. 팀에는 박지성같은 선수가 필요하다""고 말하면서 안드레아 피를로를 막아냈던 그 날을 추억했다.

맨유와 AC밀란의 경기에서 알렉스 퍼거슨 전 맨유 감독은 박지성에게 피를로를 막으라고 지시했다. 박지성은 엄청난 맨마킹 능력으로 당대 최고의 플레이메이커인 피를로를 지워버렸다. 퍼디난드는 ""(박지성이) 피를로를 맨마킹한 날이 있었다. 아마 그날 밤 침대까지 따라가 악몽을 선사했을 것이다. 환상적인 선수이며 진정한 선수들을 위한 선수다. 동료들과 팬들에게 정말 많은 찬사를 받았다. 이타적인 선수이며 팀을 위해 뛰는 선수다. 팀에서 성공적인 날들을 보냈다. 입단 3~4년 후에는 모두에게 농담도 많이 했다""며 엄지를 치켜세웠다."
20251221,"[PL 17R] '손흥민 후계자' 제대로 사고쳤다...전반 33분 다이렉트 퇴장→토트넘, '비르츠 리그 첫 도움' 리버풀에 1-2 패배","후반 추가시간 로메로까지 퇴장-리그 13위 추락


(MHN 오관석 기자) 수적 열세에 놓인 토트넘 홋스퍼가 리버풀에 패하며 연승 흐름을 이어가지 못했다.

토트넘 홋스퍼는 21일 오전 2시 30분(한국시간) 런던 토트넘 홋스퍼 스타디움에서 열린 2025-26 프리미어리그 17라운드 리버풀과의 경기에서 1-2로 패했다.

토트넘은 굴리엘모 비카리오, 제드 스펜스, 미키 반더벤, 크리스티안 로메로, 페드로 포로, 루카스 베리발, 아치 그레이, 로드리고 벤탕쿠르, 모하메드 쿠두스, 랑달 콜로무아니, 사비 시몬스가 선발 출전했다.

원정팀 리버풀은 알리송 베케르, 밀로시 케르케즈, 버질 반 다이크, 이브라히마 코나테, 코너 브래들리, 커티스 존스, 라이언 흐라벤베르흐, 플로리안 비르츠, 알렉시스 맥알리스터, 도미닉 소보슬라이, 위고 에키티케가 나섰다.

팽팽한 중원 싸움이 이어진 가운데, 토트넘이 먼저 기회를 잡았다. 전반 27분 포로의 크로스를 스펜스가 헤더로 연결했고, 이를 콜로무아니가 머리로 마무리했지만 알리송의 선방에 막혔다.

그러나 예상치 못한 변수가 토트넘에 발생했다. 전반 33분 시몬스가 전방 압박 과정에서 반 다이크에게 거친 태클을 시도했다. 주심은 처음에 옐로카드를 꺼내들었으나, 비디오 판독(VAR) 끝에 판정이 번복되며 다이렉트 퇴장이 선언됐다. 전반전은 득점 없이 0-0으로 마무리됐다.

수적 우위를 잡은 리버풀은 후반 들어 주도권을 가져갔다. 후반 11분 비르츠의 패스를 받은 교체 투입 알렉산더 이삭이 침착하게 마무리하며 선제골을 터뜨렸다. 비르츠의 리그 첫 공격포인트였다. 다만 이삭은 슈팅 과정에서 반더벤의 태클에 발목을 가격 당해 통증을 호소하며 재교체됐다.

토트넘도 기회를 잡았다. 후반 19분 콜루무아니가 단독 돌파 이후 페널티 박스 안에서 슈팅을 시도했지만, 케르케즈의 태클에 굴절된 공이 크로스바를 강타하며 기회가 무산됐다.
위기를 넘긴 리버풀은 곧바로 추가골을 만들어냈다. 후반 21분 교체 투입된 제레미 프림퐁의 크로스를 에키티케가 헤더로 연결하며 골망을 흔들었다.

후반 막판 토트넘도 끝까지 추격했다. 후반 37분 페널티 박스 안 혼전 상황에서 흘러나온 공을 히샬리송이 밀어 넣으며 만회골을 기록했다. 하지만 경기 막판 총공세에 나선 토트넘은 오히려 후반 추가시간 로메로가 경고 누적으로 퇴장당하며 기세가 꺾였다. 결국 경기는 리버풀의 2-1 승리로 종료됐다.



이날 패배로 토트넘은 공식전 2연승의 흐름을 이어가지 못하며 6승 4무 7패(승점 22), 리그 13위에 머물렀다. 반면 수적 우위를 바탕으로 승리를 거둔 리버풀은 9승 2무 6패(승점 29), 챔피언스리그 진출 순위권인 5위로 도약했다.

한편 토트넘은 오는 29일 크리스탈 팰리스와, 리버풀은 28일 울버햄튼 원더러스와 리그 경기를 치른다.

사진=연합뉴스/로이터, 리버풀 SNS"
20251221,"‘대형 사고!’ 손흥민 ‘7번 후계자+캡틴’ 퇴장→토트넘, 9명으로 리버풀과 맞대결···홈에서 1-2 패[EPL·리뷰]","토트넘 홋스퍼의 사비 시몬스가 레드카드(퇴장)을 받았다. 로이터연합뉴스


토트넘 홋스퍼가 홈에서 리버풀에 패배했다.

토트넘 21일(한국시간) 영국 런던에 있는 토트넘 홋스퍼 스타디움에서 열리는 2025-2026시즌 프리미어리그 17라운드에서 리버풀에 1-2로 패배했다.

리버풀은 이번 결과로 리그 17전 9승 2무 6패 29승점으로 5위를 기록했다. 토트넘은 6승 4무 7패 22승점으로 13위로 하락했다.

홈팀 토트넘은 4-2-3-1 포메이션을 가동했다. 굴리엘모 비카리오(GK)-제드 스펜스, 미키 판 더 펜, 크리스티안 로메로, 패드로 포로-아치 그레이, 로드리구 벤탄쿠르-사비 시몬스-루카스 베리발-모하메드 쿠드스-콜로 무아니가 선발 출전했다.

원정팀 리버풀도 4-2-3-1 전략을 가동했다. 알리송 베케르(GK)-케르케즈 밀로시, 버질 판 다이크, 이브라히마 코나테, 코너 브래들리-커티스 존스, 라이언 그라벤베르흐-플로리안 비르츠, 알렉시스 마크 알리스테르, 도미니크 소보슬라이, 위고 에키티케가 선발 명단에 이름을 올렸다.

리버풀 수문장 알리송의 선방. 로이터연합뉴스


토트넘의 제드 스펜스(오른쪽)가 리버풀의 코너 브래들리(가운데), 커티스 존스과 공을 다투고 있다. AP연합뉴스


경기 포문은 토트넘이 열었다. 전반 5분 무아니가 페널티 박스 중앙에서 오른발 슈팅을 시도했지만 수비에 막혔다. 전반 13분 이번에는 리버풀이 공격했다. 판 다이크가 상대 박스 안으로 올라온 공을 헤더로 연결했다. 비카리오의 선방에 막혔다.

토트넘도 좋은 기회가 왔다. 전반 27분 포로의 크로스를 스펜스가 헤더로 건들였다. 이를 콜로 무아니가 헤더로 득점을 노렸지만, 알리손의 선방에 막혔다. 하지만 변수가 발생했다. 전반 33분 시몬스가 압박 과정에서 판 다이크에게 거친 태클을 시도했다. 주심은 경고를 줬지만, 비디오 판독(VAR) 끝에 판정을 번복했다. 시몬스에게 레드카드(퇴장)를 꺼냈다.

토트넘은 남은 시간 10명으로 싸우게 됐다. 리버풀은 수적우위를 잡고 밀어 붙였다. 전반 36분 비르츠가 박스 왼쪽에서 오른발 슈팅을 시도했다. 비카리오가 오른쪽 아래로 몸을 날려 막았다. 토트넘은 수비에 집중했고 전반전 0-0 무승부로 마쳤다.

이삭의 선취골. 로이터연합뉴스


히샬리송의 만회골. 로이터연합뉴스


리버풀은 후반 시작하자마자 브래들리를 빼고 알렉산더 이삭을 투입했다. 그리고 선취골을 터트렸다. 후반 11분 비르츠의 패스를 이삭이 박스 중앙에서 받아 왼발로 마무리했다. 리버풀이 1-0 앞서갔다.

후반 13분 토트넘은 쿠두스를 빼고 브레넌 존슨을 올렸다. 리버풀은 2분 후 부상 신호를 보낸 이삭을 빼고 제레미 프림퐁을 그라운드에 투입했다.

토트넘은 10명으로 리버풀을 막기 어려웠다. 후반 24분 에키티케가 헤더로 리버풀에 추가골을 안겨줬다. 토트넘은 비상에 걸렸다. 후반 26분 베리발, 그레이를 내리고 윌슨 오도베르, 주앙 팔리냐를 투입했다. 그리고 후반 35분 무아니를 빼고 히샬리송을 투입해 끝까지 만회골을 노렸다.

결국 용병술이 통했다. 후반 38분 리버풀 페널티박스 안에서 혼전 상황이 벌어졌고 공은 주인을 잃었다. 이걸 히샬리송이 오른발로 왼쪽 골문 구석으로 밀어 넣었다. 토트넘이 1-2로 추격했다.

그러나 후반 추가시간 토트넘의 주장 롬[로까지 경고 누적으로 레트카드를 받았다. 토트넘은 9명이 됐다. 더 이상 득점을 만들기엔 체력, 선수 모 부족했다. 결국 리버풀의 2-1 승리로 경기 종료됐다.

용환주 기자 dndhkr159@kyunghyang.com"
20251221,"스타킹이 찢어질 정도로 밟았는데? 토트넘 감독은 ""난폭한 태클 아니야, 레드카드 마음에 들지 않아""","[인터풋볼=주대은 기자] 토트넘 홋스퍼 토마스 프랭크 감독이 레드카드에 대해 불만을 드러냈다.

토트넘은 21일 오전 2시 30분(한국시간) 영국 런던에 위치한 토트넘 홋스퍼 스타디움에서 열린 2025-26시즌 프리미어리그 17라운드에서 리버풀을 만나 1-2로 패배했다. 토트넘은 승점 22점으로 리그 13위가 됐다.

전반전 도중 토트넘에 변수가 발생했다. 전반 30분 사비 시몬스가 압박하는 과정에서 버질 반 다이크의 발목 부위를 강하게 밟았다. 주심은 비디오 판독 후 레드카드를 꺼냈다. 전반전이 끝나기도 전에 토트넘은 수적 열세에 처했다.

후반전 들어 리버풀이 리드를 잡았다. 후반 11분 알렉산더 이삭이 플로리안 비르츠의 패스를 받아 득점에 성공했다. 격차가 벌어졌다. 후반 21분 위고 에키티케가 수비수 맞고 굴절된 공을 헤더로 연결하며 한 골 추가했다.

토트넘은 후반 38분 히샬리송의 득점이 터지며 추격의 고삐를 당겼으나 또 퇴장자가 발생했다. 후반 추가 시간 2분 크리스티안 로메로가 이브라히마 코나테를 가격한 뒤 경고 누적으로 퇴장당했다. 토트넘은 1-2로 패배했다.



경기 후 토트넘 토마스 프랭크 감독이 판정에 불만을 드러냈다. 그는 ""난 이걸(시몬스의 반칙) 레드카드로 보는 게 마음에 들지 않는다. 내 기준에선 난폭한 태클도 아니고 과도한 힘도 아니다. 그는 반 다이크를 쫓고 있었다. 압박하려고 하다가 방향을 바꿨다""라고 말했다.

이어서 ""불운하게도 시몬스의 발이 반 다이크의 아킬레스건으로 올라갔다. '더 똑똑했어야지, 하지 말았어야지'라고 말할 수는 있겠지만, 이제는 신체 접촉 자체가 허용되지 않나? 더 이해가 안 되는 건 3경기 출전 정지다. 난폭하지도 않은 상황에서 어떻게 3경기 정지가 나오는지 모르겠다""라고 더했다.

프랭크 감독은 ""그게 고의적이었거나 정말 어리석은 태클이었다면 이야기가 달라질 거다. 하지만 난 그렇게 보지 않는다. 그런 태클 하나로 3경기 출전 정지다. 처벌이 너무 가혹하다고 생각한다""라고 밝혔다.

로메로의 퇴장에 대해선 ""첫 번째 옐로카드를 주는 게 옳은지 잘 모르겠다""라며 ""두 번째 옐로카드에 대해선 두 명의 큰 선수들이 경쟁하는 걸 봤다. 코나테가 로메로를 완전히 부딪치며 돌진했다. 파울이다. 더 이상 말하지 않겠다""라고 덧붙였다."
