date,title,content
20250623,"[속보] 英 1티어 기자 확인, 이강인 PSG 남는다! ""판매 불가 선언→나폴리 이적 불발…중요한 선수라 생각""","[SPORTALKOREA] 배웅기 기자= 이강인이 파리 생제르맹에 잔류한다.

영국 매체 'ESPN'의 마테오 모레토 기자는 23일(이하 한국시간) 이적시장 전문가 파브리지오 로마노 기자의 유튜브에 출연, 이강인의 거취를 언급하며 ""SSC 나폴리 이적은 어려울 것""이라고 내다봤다.

모레토는 ""이강인 소식만큼은 내 정보를 확신한다""고 힘주어 말할 만큼의 공신력을 자랑한다. 실제로 2023년 여름 이강인의 PSG 이적을 최초 보도한 게 모레토다.



올여름 이적시장 '뜨거운 감자'는 단연 이강인의 거취였다. 이탈리아 매체 '아레아나폴리'는 13일 ""나폴리가 이강인 영입을 위해 결정적 제안을 준비하고 있다. 지오반니 만나 단장은 PSG와 협상하고 있으며 이강인 역시 정기적 출전 기회를 원하고 있다""고 보도했다.

매체는 지난달 30일 ""만나가 다음 시즌을 대비해 분주히 움직이고 있는 가운데 이강인의 기량에 깊은 인상을 받았다. 이적료는 3,000만 유로(약 477억 원) 수준으로 아우렐리오 데 라우렌티스 회장이 원하는 조건을 충족한다""고 전했다.



나폴리가 최우선 영입 대상 중 한 명으로 이강인을 상정한 가운데 PSG의 입장이 돌변하며 이적이 불발될 분위기다. 모레토는 ""이강인은 나폴리가 높이 평가하는 선수지만 PSG와 계약 만료까지는 많은 시간이 남았다""고 밝혔다.

그러면서 ""PSG는 이강인을 중요한 선수로 간주하고 있다. 그가 나폴리 유니폼을 입은 모습은 보기 어려울 가능성이 높고 설령 팀을 떠난다고 해도 이탈리아와 프랑스가 아닌 다른 국가일 공산이 크다""고 덧붙였다.

사진=게티이미지코리아

취재문의 sportal@sportalkorea.co.kr"
20250623,"“공식 영상 공개→사실상 퇴장 확정” 충격적인 주장 나왔다…‘韓 축구 대들보’ 손흥민, 이번 여름 토트넘과 이별 [속보]","[골닷컴] 강동훈 기자 = 이적설이 끊이질 않으면서 손흥민(32·토트넘)이 올여름 토트넘과 10년 동행에 마침표를 찍는 쪽으로 기울고 있다. 최근 새롭게 부임한 토마스 프랭크(51·덴마크) 감독이 인터뷰한 공식 영상에서 손흥민의 이름이 언급되지 않은 것을 두고 현지에선 손흥민이 새 시즌 프랭크 감독의 구상에서 제외돼 떠날 거라는 주장을 내놨다.

토트넘 소식을 전문적으로 다루는 토트넘 홋스퍼 뉴스는 23일(한국시간) “손흥민의 토트넘 생활이 마침내 끝날 가능성이 생겼다”면서 “지난 몇 주 동안 손흥민의 미래를 둘러싼 추측이 최고조에 달한 가운데 그가 이번 여름 떠날 확률이 50%라고 파악했다. 그러나 최근의 동향을 보면 50%가 아니라 100%로 확실해졌다”고 보도했다.

보도에 따르면 손흥민이 토트넘을 떠날 확률이 100%로 확실해진 배경엔, 새롭게 지휘봉을 잡은 프랭크 감독이 인터뷰한 공식 영상에서 자신의 계획과 함께 일하고 싶은 선수들에 대해 이야기를 했는데, 여러 선수들을 언급하면서도 손흥민의 이름은 언급하지 않았기 때문이다.



토트넘 홋스퍼 뉴스는 “토트넘 내부 사정에 밝은 존 웬햄은 ‘프랭크 감독이 인터뷰한 공식 영상의 핵심 중 하나는 손흥민의 언급이 없었다는 것’이라며 ‘또 지난 시즌 선수들의 훈련 영상을 보여줬지만, 그 영상에는 손흥민이 나오지 않았다’고 말하면서 손흥민이 올여름 토트넘을 떠날 것임을 시사한다고 주장했다”고 설명했다.

더군다나 프랭크 감독은 새로운 공격수 영입을 원하고 있다. 실제 브렌트퍼드에서 함께한 ‘애제자’ 브라이언 음뵈모를 데려오길 원하고, 최근엔 티머시 웨아 영입도 요청한 것으로 알려졌다. 이미 마티스 텔을 완전 영입한 상태에서 음뵈모와 웨아까지 합류한다면, 공격진은 포화 상태가 된다. 자연스레 손흥민은 떠날 수밖에 없다.
특히 토트넘은 새로운 선수를 영입하기 위해선 이적 자금이 필요한데, 그동안 구단주 조 루이스와 회장 다니엘 레비의 행보를 놓고 봤을 때 투자에 인색한 터라 기존 선수를 매각해 재투자할 수 있는 이적료 수익을 마련해야 한다.

이런 가운데 현재 복수 구단의 관심 속 적절한 제안을 받고 있는 데다, 계약기간도 1년밖에 남지 않아 이번 여름 매각해야만 이적료 수익을 벌어들일 수 있는 손흥민은, 토트넘이 매각을 적극적으로 고려할 수밖에 없는 대상이다.



실제 손흥민은 연봉 2560만 파운드(약 472억 원)를 제안하면서 적극적으로 구애를 보내고 있는 알나스르, 알힐랄, 알카디시아 등 사우디 복수 구단들과 연결되고 있다. 다음 시즌 페네르바체를 우승시키고자 ‘톱 클래스’ 선수 영입을 요청한 주제 무리뉴 감독의 러브콜도 받고 있다.

다만 손흥민이 올여름 떠나기로 마음을 굳힌다면, 8월 초 아시아 투어가 끝난 직후가 될 가능성이 크다. 토트넘이 아시아 투어를 앞두고 손흥민이 떠날 경우 계약 위반 등 주최 측과 문제가 발생할 수 있어 아시아 투어 이후 손흥민을 매각할 거로 전망되고 있기 때문이다.

한편, 손흥민이 이번 여름 토트넘과 동행을 마치게 된다면 10년 만이다. 그는 지난 2015년 토트넘 유니폼을 입은 이후 지금까지 ‘에이스’로 활약했다. 통산 454경기를 뛰면서 173골·101도움을 기록했다. 구단 역사상 최다출전 6위이며, 최다득점 5위에 해당한다. 지난 2023년부터는 아시아인 최초로 주장으로 임명돼 선수단을 이끌고 있다.

사진 = 게티이미지"
20250623,2700억 레코드 박살! EPL 희대의 사기팀 탄생…살라+비르츠 이어 이삭까지→리버풀 절대 왕조 세운다,"사진=SNS
<저작권자(c) 연합뉴스, 무단 전재-재배포, AI 학습 및 활용 금지>
[스포츠조선 강우진 기자]매각 불가능한 선수로 여겨졌던 알렉산더 이삭이 팀을 떠날 확률이 있다. 뉴캐슬이 이삭에 대한 천문학적인 이적료 제안을 수용할 수도 있다는 것이다.

리버풀이 가장 유력한 행선지로 평가받는다. 리버풀이 이번 여름 전력 강화에 특히 심혈을 기울이고 있어 기대감은 커지고 있다. 이적이 성사된다면 이적료는 리버풀 클럽 레코드를 넘어 잉글랜드 프리미어리그(EPL) 역사에 남게된다.
영국 풋볼인사이더는 22일(한국시각) ""리버풀과 아스널의 관심 속에 뉴캐슬은 알렉산더 이삭에 대한 1억5000만 파운드(약 2700억원)의 이적 제안을 수락할 것으로 예상된다""라고 보도했다.

이삭은 뉴캐슬의 핵심 공격수다. 2024~2025시즌에는 모든 대회에서 42경기 27골 6도움을 기록했다. 팀을 프리미어리그 5위에 올려 놨으며 카라바오컵 우승으로 이끌었다.

이 같은 활약은 세계적인 빅클럽들의 이목을 끌었고, 리버풀과 아스널은 이번 여름 이삭의 영입을 노리고 있다.

<저작권자(c) 연합뉴스, 무단 전재-재배포, AI 학습 및 활용 금지>
<저작권자(c) 연합뉴스, 무단 전재-재배포, AI 학습 및 활용 금지>
뉴캐슬은 재정적인 문제가 없는 팀이며 유럽축구연맹(UEFA) 챔피언스리그 복귀로 인해 이삭을 지키고자 하는 입장이지만, 일각에서는 무조건 잔류보다는 고액의 이적료를 받고 매각하는 쪽을 선택할 것이란 전망이 나온다.

2700억원의 이적료는 뉴캐슬이 다음 시즌을 앞두고 충분한 전력 보강을 이룰 수 있는 금액이다. 그간 이삭의 득점력에 크게 의존한 뉴캐슬인 만큼 이를 대체할 자원에 대한 고민도 깊었다. 새로운 색깔로 팀을 탈바꿈할 기회이기도 하다.

뉴캐슬은 지난 2022년 이삭을 6300만 파운드(약 1100억원)에 영입했다. 3년이 지난 시점에서 2배 이상의 금액에 팔 수 있는 조건이라 충분히 고려해 볼만하다.

매체는 ""이삭은 뉴캐슬 입장에서 당연히 팔 수 없는 선수로 평가받고 있지만, 2022년에 6300만 파운드를 주고 영입한 선수에게 두 배 이상의 금액이 제시된다면, 어떤 상황에서도 충분히 고려해 볼 가치가 있다""라고 설명했다.

<저작권자(c) 연합뉴스, 무단 전재-재배포, AI 학습 및 활용 금지>
<저작권자(c) 연합뉴스, 무단 전재-재배포, AI 학습 및 활용 금지>
이삭은 현재 뉴캐슬과 계약이 3년 남아 있어 이적을 결정할 필요는 없다. 그러나 뉴캐슬이 계속해서 유럽축구연맹(UEFA) 챔피언스리그 티켓을 확보한다고 해도 우승권에 도전하는 팀이라고 하기에는 무리가 있다. 현재 25세로 적지 않은 나이인 이삭은 전성기에 가까워지며 최상위 수준의 팀에서 우승 도전을 희망할 수 있다.

풋볼인사이더는 ""계약이 1년밖에 남지 않게 되면 이적료는 지금보다 훨씬 낮아질 수밖에 없기 때문에, 뉴캐슬은 이런 상황을 방지해야 한다""라며 ""향후 몇 년간의 성공을 위한 자금 확보 차원에서도 다가오는 여름 모든 조건이 맞아떨어진다면 이삭을 최고가에 매각하는 것이 바람직하다""라고 주장했다.

프리미어리그에서 매각에 가장 적합한 팀은 지난 시즌 리그 우승팀인 리버풀이다. 이삭도 만족할 만한 이적지가 될 수 있다. 뉴캐슬 입장에서도 제값을 받아낼 수 있는 팀이 리버풀이다. 최근 독일 분데스리가 레버쿠젠에서 월드 클래스로 평가받는 플로리안 비르츠 영입에도 성공한 만큼 리버풀의 다음 시즌은 충분히 기대해 볼만하다.

수비 진영에서 버질 반다이크가 버티고 있고, 공격 진영에 비르츠와 모하메드 살라에 이어 이삭까지 합류한다면 역대 최고의 전력으로 봐도 손색이 없다."
20250623,"[속보] 韓 축구 대환호…뮌헨 '오피셜' 공식발표 떴다! ""김민재, 다시 훈련장 돌아왔다"" → 아킬레스건 부상 100% 회복 본격 시동","[스포티비뉴스=박대성 기자] 대한민국 축구 팬들에게 오랜 기다림 끝에 희망적인 소식이 전해졌다. 독일 분데스리가 명문 구단 바이에른 뮌헨이 수비수 김민재(29)의 팀 훈련 복귀를 공식 발표했다.

바이에른 뮌헨은 23일(한국시간) 구단 공식 채널을 통해 ""다시 그라운드에 선 모습 반가워, 민재""라는 문구와 함께 김민재가 팀 훈련에 참여하는 영상을 공개했다.

공개된 영상 속 김민재는 밝은 표정으로 팀 동료들과 함께 몸을 풀고 훈련을 소화하고 있었다. 이는 단순한 복귀 이상의 의미를 지닌다. 오랜 기간 김민재는 아킬레스건 부상으로 고통을 받아왔고, 이는 지난 시즌 후반기 경기력 저하의 주요 원인이었다. 독일 스포츠 전문지 '키커'는 당시 ""김민재는 아킬레스건 부상으로 재활에 집중 중이며, 다가오는 국제축구연맹(FIFA) 클럽 월드컵 출전은 불투명하다""고 보도하기도 했다.

아직 100% 회복은 알 수 없다. 하지만 팀 훈련에 돌아와 동료들과 호흡했다는 것 만으로도 크게 안심되는 부분이다. 김민재는 이번 시즌 모든 대회를 통틀어 3,593분이라는 출전 시간을 기록하며 팀 내 수비수 중 최다 출전을 기록했다. 이는 부상에도 불구하고 헌신적으로 팀을 위해 희생한 결과였다.



국제축구선수협회(FIFPro)는 이에 대해 ""김민재의 사례는 과도한 경기 일정이 선수 건강에 미치는 심각한 영향을 잘 보여주는 대표적인 사례""라며 경고 메시지를 던졌다. FIFPro는 특히 ""적절한 보호와 휴식이 보장되지 않는다면 더 많은 선수들이 장기적인 부상의 위험에 노출될 것""이라고 강조했다.

하지만 김민재에 대한 독일 현지 언론의 평가는 냉정했다. '키커'가 발표한 '2025년 여름 센터백 랭킹'에서 김민재의 이름은 제외됐다. 다요트 우파메카노(7위), 에릭 다이어(8위) 등이 순위에 오른 가운데 김민재는 명단에 들지 못했다. 매체는 그 이유로 ""경기력 저하와 기여도 감소""를 꼽았지만, 국내 팬들은 부상을 안고 뛰었던 김민재의 헌신이 무시당했다며 강한 불만을 드러냈다.
더 큰 충격은 뮌헨 내부에서조차 김민재를 매각 대상으로 분류했다는 점이다. 독일 '스카이 스포츠'의 플로리안 플레텐베르크 기자는 ""김민재는 뮌헨이 매각을 고려 중인 주요 자원이다. 적절한 제안이 온다면 구단은 이적을 허용할 것""이라고 전했다. 실제로 여러 독일 매체는 김민재가 이미 이적 리스트에 포함됐다고 보도했다.

이런 상황 속에서 뮌헨의 스포츠 디렉터 막스 에베를의 발언은 팬들의 분노를 더욱 자극했다. 그는 최근 인터뷰에서 ""김민재의 부상에 대해 우리가 그의 건강을 위험에 빠뜨렸다는 주장은 사실이 아니다""라며 구단의 책임을 부인했다. 그러나 지난 시즌 내내 부상을 안고 뛰었던 김민재에게 충분한 회복 시간을 제공하지 않았다는 지적은 여전하다.



김민재는 현재 유럽 주요 빅클럽들의 관심을 한 몸에 받고 있다. 인터 밀란, AC 밀란, 첼시, 뉴캐슬 유나이티드, 리버풀, 맨체스터 유나이티드, 파리 생제르맹(PSG) 등이 그의 영입에 관심을 보였다. 최근에는 유럽5대리그에서 큰 두각을 보였고, 바이에른 뮌헨 이적에 초석을 다진 나폴리 복귀설까지 제기됐다.

최근에 급부상한 구단까지 눈길을 끌었다. 바로 사우디아라비아의 알 나스르다. 프랑스 매체 '스포르트'는 ""알 나스르가 김민재 측과의 협상에 있어 가장 적극적이다. 선수 본인도 새로운 도전을 위해 사우디행에 열려 있는 상황""이라고 보도했다.

일단 김민재는 순조롭게 회복하고 있다. 바이에른 뮌헨이 클럽월드컵에서 더 높은 곳에 올라간다면 실전 감각을 점검할 수도 있다. 최근에 여름에 새로 영입한 조나단 타도 클럽월드컵 두 경기 만에 혹평을 듣고 있다.

물론 동시에 이적 시장이 본격적으로 열리는 만큼, 새로운 유니폼을 입고 출전할 가능성도 배제할 수 없다. 뮌헨은 여름 이적 시장에서 팀 리빌딩을 선언한 상황이며, 이를 위한 자금 확보 차원에서 김민재 매각이 현실화될 수 있다는 분석이 나온다.

김민재의 다음 행선지가 어디가 될지는 아직 미지수다. 하지만 확실한 건 그의 복귀는 단순한 재활에서 회복한 것이 아닌 새로운 시작을 알리는 출발점이라는 것이다. 김민재가 어떤 유니폼을 입든 부상 없는 시즌을 보내며 다시 한 번 유럽 무대에서 '괴물 수비수'의 위용을 드러낼 수 있을까."
20250623,"'3년 1422억' 손흥민 핵폭탄급 이적 성큼!…BBC+더 타임즈+HERE WE GO ""SON 사우디 이적 현실일 수도""","(엑스포츠뉴스 김현기 기자) 토트넘 새 감독이 새판짜기에 나설 것으로 보인다.

손흥민의 거취가 더욱 불안하게 됐다. 지난 10년간 토트넘에 헌신하며 다른 스타플레이어들이 모두 팀을 떠나고 남아서 유럽축구연맹(UEFA) 유로파리그 우승 트로피를 들어올렸지만 이제 논공행상이 끝났고 손흥민이 토트넘에 잔류할지에 시선이 쏠리고 있다.

특히 손흥민의 퇴단 가능성을 예측하는 언론들이 이제는 B급 수준이 아니다. 당장은 토트넘의 7월 말 프리시즌 투어 일정 때문에 잠잠하지만, 8월 중순부터는 그에게 러브콜 보내는 구단의 제안을 토트넘이 살펴볼 태세다.

""8월 말엔 손흥민의 소속팀이 달라질 수도 있다""는 말이 괜히 나오는 게 아니다.

최근 들어 영국 공영방송 BBC, 최고 유력지 '더 타임스', 이적시장 전문가 파브리치오 로마노가 공통적으로 손흥민의 다음 시즌 소속팀이 토트넘이 아닐 수 있다고 보도하는 중이다.

로마노는 이미 지난 19일(한국시간) 자신의 동영상 채널을 통해 토트넘의 감독 변화를 설명하면서 손흥민을 도마 위에 올려놨다.



그는 ""안지 포스테코글루 감독이 토트넘에서 경질되지 않았다면 손흥민은 토트넘에 남았을 것""이라며 ""손흥민의 미래는 아직 아무 것도 결정되지 않았다. 손흥민은 토마스 프랭크 감독과 논의한 뒤 자신의 미래를 결정할 예정이다""고 했다.

중동 구단이 거액을 들고 손흥민을 유혹한다는 보도는 사실이라고 강조했다. 그는 ""사우디 구단들이 손흥민에게 강한 관심을 보이고 있는 것은 맞다. 사우디 구단들은 손흥민의 에이전트와 좋은 관계를 유지하고 있다. 이제 손흥민의 선택이 중요하다""고 했다.

손흥민 주변이 뒤숭숭하다. 최근 그는 여러 이적설과 연결됐다. 10년간 지속된 손흥민과 토트넘의 동행이 끝을 향하는 것은 부정할 수 없는 사실이다.

토트넘은 오는 6월30일 끝나는 손흥민과의 계약을 지난 1월 7일 1년 연장했다. 당시만 해도 토트넘이 손흥민을 내년 6월까지 데리고 갈 생각인 것으로 해석됐다.

그러나 이젠 달라졌다. 무엇보다 손흥민의 기량 하락세가 너무 가파르다. 손흥민은 2016-2017시즌부터 이어오던 프리미어리그 두 자릿수 득점 기록을 이번 시즌 끝냈다. 7골에 그치면서 대기록 행진이 마감됐다. 3차례 부상이 문제였다. 지난 9월과 10월에 허벅지 뒤근육 부상으로 3주씩 쉰 손흥민은 지난 4~5월엔 한달 가량 정체 불명의 발 부상으로 쉬었다.



손흥민 역시 이젠 토트넘과 결별할 가능성을 숨기지 않고 있다. 손흥민은 지난 5월 유럽축구연맹(UEFA) 유로파리그 우승으로 구단에 17년 만의 트로피를 안기며 주장으로서의 소임을 다했다.

토트넘은 우승 직후 열린 프리미어리그 시즌 최종전에서 '레전드 오브 레전드'로 인정받으며 역사의 한 페이지를 장식했다.
하지만 레전드 대우를 매일 같이 할 순 없다. 덴마크 명장 토마스 프랑크 감독이 부임한 상황에서 최고참 손흥민의 거취 논의는 더 이상 피할 수 없는 토트넘의 과제가 됐다.

손흥민도 이런 분위기를 부정하지 않는다. 그는 최근 인터뷰에서 ""지금 뭔가를 말하기보다 기다리는 것이 맞다고 생각한다""며 올여름 행보에 대해 여러 가능성을 열어놨다.

손흥민은 2년 전 사우디 이적설에 대해 대한민국 국가대표팀 주장 선배 기성용의 코멘트를 빌어 ""대한민국 주장은 사우디로 가지 않는다""고 단호하게 말했지만 지금은 ""어떻게 될지 지켜보자""는 입장을 견지하는 중이다.

손흥민은 2015년 독일 분데스리가의 바이엘 레버쿠젠에서 토트넘으로 이적해, 지난 10년간 북런던 클럽의 상징으로 군림했다.

빠른 발과 정확한 슈팅, 강한 투지를 겸비한 그는 팀의 공격을 이끌며 프리미어리그 최고 윙어 중 하나로 평가받았다. 그가 기록한 454경기 173골이라는 기록은 단순한 수치를 넘어, 클럽 역사에 깊이 각인될 성과다.



이어 2024-2025 UEFA 유로파리그 우승을 통해 토트넘에 41년 만에 UEFA 클럽대항전 타이틀을 안겼다.

그러나 팀 성적과는 별개로 손흥민 경기력은 완만한 하향세를 보였고 특히 3차례 부상이 문제로 드러났다.

부상으로 한 달 간 고전하다가 간신히 치료를 하고 나선 이번 시즌 유로파리그 결승전이 대표적이다. 그는 히샬리송에 밀려 벤치에서 경기를 시작했다. 손흥민이 시즌 동안 풀타임 주전에서 밀려난 것은 지난 10년동안 보기 힘들었던 장면으로, 이젠 '포스트 손흥민' 준비가 필요하다는 뜻이다.

올여름이 토트넘 구단 입장에서는 선수를 판매, 이적료를 받을 수 있는 마지막 여름 이적시장이다.

여기에 지난 2년간 토트넘을 지도하며 유로파리그 우승을 이끌었던 안지 포스테코글루 감독이 토트넘을 떠나면서 손흥민도 고민이 큰 것으로 보인다.

토트넘은 7월 말 홍콩과 한국을 방문해 아스널, 뉴캐슬과 각각 한 차례씩 격돌하는 프리시즌 투어 일정을 갖고 있다.

한국 일정이 끝나면 손흥민의 이적이 본격화될 것이라는 게 BBC와 더 타임스의 공통된 생각이다.



'BBC'는 ""손흥민을 향한 사우디아라비아 구단들의 관심이 높아지면서 토트넘의 한국 투어가 손흥민의 미래에 영향을 미칠 만한 요소로 떠오르고 있다""면서도 ""신뢰할 만한 소식통에 의하면 손흥민은 다음 시즌이 시작되기 전 토트넘을 떠날 수도 있지만, 손흥민이 토트넘을 떠나는 시기는 토트넘의 아시아 투어 이후일 가능성이 높다. 손흥민이 팀에 없으면 투어 주최측과 문제가 생길 수 있기 때문""이라고 했다.

손흥민을 '얼굴 마담' 내세워 한국 투어를 탈 없이 마무리한 뒤 그를 팔아 이적료도 받고, 프랑크 감독 새판짜기에 힘을 실어주겠다는 게 토트넘의 의중으로 보인다.

손흥민 입장에선 프랑크 체제에선 자신의 팀내 영향력을 많이 내놓을 수밖에 없다.

로마노도 그 점을 지적하면서 손흥민의 중동 등 여러 구단 이적 가능성을 거론하는 중이다.

영국 매체 '토크스포츠'는 17일 사우디 세 구단이 관심을 보이고 있다며 연봉으로 3000만 유로(474억원), 계약기간 3년이 거론되고 있다고 보도했다. 3년 총액 1422억원에 달하는 셈이다.

사진=연합뉴스"
20250623,"토트넘 레비, 이적료 1300억 요구에 기겁…손흥민 후계자 영입 중단","손흥민과 세메뇨/게티이미지코리아


[마이데일리 = 김종국 기자] 토트넘이 본머스 공격수 세메뇨 영입 추진을 중단한 것으로 전해졌다.

영국 더선은 22일 '토트넘은 본머스의 세메뇨 이적료를 문의한 후 즉시 이적 추진을 멈췄다. 토트넘이 영입을 노렸던 음뵈모는 맨유 이적을 선호하는 것으로 알려졌다. 토트넘은 세메뇨 영입을 위해 본머스와 접촉했지만 본머스는 이적료로 7000만파운드(약 1300억원)를 요구한 것으로 알려졌다. 엄청난 이적료를 제안받은 토트넘은 즉시 거부했고 당장 거래를 추진하지 않기로 결정했다'고 전했다.

이 매체는 '토트넘은 더 나은 가격에 영입할 수 있는 오른쪽 측면 공격수를 찾기 위해 계속해서 시장을 탐색할 것이다. 토트넘이 적절한 대체 선수를 찾지 못한다면 이적 시장 기간 후반에 세메뇨 영입을 다시 추진할 가능성이 있다'며 '세메뇨는 본머스와의 계약기간이 4년이나 남아있다'고 전했다.

세메뇨는 지난 2022-23시즌 본머스에서 프리미어리그 데뷔전을 치렀다. 지난 시즌 프리미어리그에선 37경기에 출전해 11골을 터트렸다. 2000년생 세메뇨는 프리미어리그 통산 81경기에 출전해 20골 7어시스트를 기록 중이다.

프리미어리그 사무국은 23일 프리미어리그 클럽들이 여름 이적 시장에서 보강이 필수인 포지션을 언급했다. 프리미어리그는 토트넘이 윙어 보강이 시급한 것으로 분석했다. 프리미어리그는 '손흥민의 미래에 대한 소문이 돌고 있고 토트넘은 프랭크 감독과 음뵈모를 재결합시키는데 관심이 있다. 프랭크 감독은 골을 넣을 수 있는 윙어를 더 원할 가능성이 높다'며 '솔랑케는 지난 시즌 프리미어리그에서 9골에 그쳤지만 토트넘은 새로운 스트라이커 영입보다 더 나은 드리블러를 배치해야 한다. 포스테코글루 감독 체제에서 토트넘은 파이널서드에서 날카로움을 보여주지 못했다. 직선적인 윙어가 있다면 토트넘 공격 전개에 도움이 될 수 있다'는 뜻을 나타냈다.
세메뇨/게티이미지코리아
프랭크 감독/게티이미지코리아"
