date,title,content
20250925,"이동국 아들 시안, 전북 아닌 미국 선택…“특혜 시선 피하고 싶었다”","이동국 아들 시안, 美 LA갤럭시 유스팀 합격…“아빠 빽 두려웠다”

사진|이수진SNS

[스포츠서울 | 배우근 기자] 전북 현대와 국가대표에서 활약했던 이동국의 아들 이시안(10) 군이 미국 메이저리그 사커(MLS) 명문 구단 LA 갤럭시 유스팀 테스트에 합격했다.

24일 이동국의 아내 이수진 씨는 자신의 SNS를 통해 “전북 현대보다도 입단이 어렵다는 LA 갤럭시 유스팀 디렉터로부터 ‘시안이와 함께하고 싶다’는 말과 함께 합격 통보를 받았다”고 전했다.

이어 “단순히 축구팀 입단을 넘어 시안이의 노력과 실력만으로 인정받았다는 점에서 무엇보다 값지고 소중한 결과”라고 밝혔다.

사진|이동국SNS

◇ ‘아빠 빽’ 우려 넘어 미국 도전

이 씨는 “(국내) 전북 현대 같은 팀에 입단하게 되면 시안이의 땀으로 만들어낸 노력들이 온전히 인정받기 못하고 ‘아빠 빽(배경)’이라는 말들이 따라붙을 것이 두려웠다”며 미국 유스팀에 도전한 이유를 밝혔다.

시안 군은 LA 갤럭시뿐 아니라 LAFC, 샌디에이고 FC 등 미국 유명 유스팀 테스트에도 도전한 것으로 알려졌다.
이수진 씨는 “한국에 남아 좋은 팀에 입단해 성장하기, 미국으로 건너가 축구와 영어 두 마리 토끼 잡기”라는 선택지를 공개 투표에 부치며 팬들과 소통하기도 했다.

시안 군은 과거 KBS2 ‘슈퍼맨이 돌아왔다’에서 태명 ‘대박이’로 불리며 큰 인기를 끌었다.

사진|이동국SNS

이수진 SNS 전문

시안이 LA 갤럭시 유스팀 입단 테스트 합격 소식 을 전합니다. 벌써 5학년 한 학기가 훌쩍 지나가고, 마냥 즐겁게 따라다니며 뛰놀던 시간이 어느새 중학교 진학이라는 현실적인 고민을 해야 하는 시기가 되었네요.

많은 분들이 시안이의 진학 방향과 계획을 궁금해하시며 물어봐 주셨지만, 저도 사실 명확한 답을 드리지 못하고 많은 고민을 해왔습니다.

‘프로팀 입단만이 과연 정답일까?’ ‘우리가 직접 U15 팀을 만들어볼까?’

수많은 시나리오를 그리며 밤늦게까지 고민하고 또 고민했습니다. 만약 시안이가 전북현대 같은 팀에 입단하게 된다면, 시안이의 땀으로 만들어낸 노력들이 온전히 인정받지 못하고 “아빠 빽이다”, “특혜다”라는 말들이 따라붙을 것이 사실 두려웠습니다.

그래서 저는 조금 다른 길을 생각해보았습니다. 미국에 가족이 있었기에 용기를 내어 미국 유스팀 트라이아웃에 도전해보기로 했습니다. LA 갤럭시, LAFC, 샌디에고 FC 등 미국 최고의 유스팀에 테스트를 받아보자는 제안이었죠.

3년 정도 미국 유스팀에서 지내며 축구와 영어, 두 마리 토끼를 잡아보자는 생각, 그리고 이 경험 자체가 시안이의 성장에 큰 자산이 될 것이라는 확신이 들었습니다.

사진|이수진SNS

하지만 시안이는 처음부터 지금까지 미국오기 싫다며 강하게 거부합니다. 그럼에도 저는 설득하고 또 설득했습니다. “너의 실력을 테스트해보자. 결과가 어떻든 그 자체로 큰 경험이 될 거다. 전북현대를 가면 아빠 빽이라는 소리를 듣게 되지만, 아무도 모르는 미국에서 최고의 유스팀에 입단한다면 그건 온전히 너의 실력을 인정받는 거야.“

이 말로 겨우 마음을 움직여 2주간의 미국 도전을 시작할 수 있었습니다. 사실 시안이뿐만 아니라 아빠, 시부모님, 주변 모든 사람들이 반대했지만 저 혼자만의 고집으로 시안이를 여기까지 데리고 왔습니다.

시안 아빠가 “만약 합격하면 어떻게 할 거냐”라고 물었을 때, 저는 파워 P답게 “몰라, 그때 가서 또 고민해보자~”라고 대답했지요. 그리고 오늘, 전북현대보다도 입단이 어렵다는 LA 갤럭시 유스팀 디렉터로부터 “시안이와 함께하고 싶다”는 말과 함께 합격 통보를 받았습니다!

이 합격은 단순히 축구팀 입단을 넘어, 시안이의 노력과 실력만으로 인정받았다는 점에서 무엇보다 값지고 소중한 결과라고 생각합니다.

앞으로도 시안이가 자신감을 가지고 새로운 도전에 한 걸음 더 나아가는 계기가 되기를 진심으로 바랍니다. 아직 모든 것이 결정된 것은 아니지만, 시안이의 꿈을 위해, 그리고 그 꿈이 누구의 것도 아닌 시안이의 것으로 빛날 수 있도록 앞으로도 많은 고민과 선택을 이어가겠습니다.

kenny@sportsseoul.com"
20250925,"""손흥민 적당히 해"" 부앙가와 '괴물 듀오' 파괴력 역대급→입성 2달 만에 MLS 판 뒤집었다…파워랭킹 급상승에 메시마저 긴장!","(엑스포츠뉴스 윤준석 기자) 한국 축구의 아이콘 손흥민이 미국 메이저리그사커(MLS)에 상륙한 지 두 달 만에 리그의 중심을 뒤흔들며 LAFC의 판도를 완전히 바꿔놓고 있다.

기존 리그 판도를 흔드는 '생태계 교란종'으로 자리매김한 손흥민은 이제 리오넬 메시와 어깨를 나란히 하며 곧 그를 뛰어넘을 정도의 존재감을 보여주고 있다는 평가다.

LAFC는 지난 22일(한국시간) 홈 구장 BMO 스타디움에서 열린 2025시즌 MLS 31라운드 레알 솔트레이크와의 경기에서 4-1 대승을 거두었다.

이날 경기에서는 손흥민과 '영혼의 투톱 조합'으로 자리매김 중인 드니 부앙가가 해트트릭을 기록하고 손흥민이 한 골을 추가하며 팀의 압도적 승리를 견인했다.

LAFC는 지난 18일 열린 레알 솔트레이크 원정 경기에서도 4-1 승리를 거둔 바 있다. 당시에는 손흥민이 해트트릭을 기록하고 부앙가가 추가골을 넣으며 대승을 거두었다.
또한 지난 14일 산호세 어스퀘이크 원정 경기에서도 부앙가가 해트트릭을 기록하며 4-2 완승을 거두는 등 LAFC는 최근 3경기에서 모두 4골씩 총 12골을 넣는 폭발적인 화력을 과시했다.

특히 이 과정에서 부앙가와 손흥민이 번갈아가며 해트트릭을 기록하며, MLS 역사상 최초로 3경기 연속 해트트릭을 달성한 클럽이 됐다.



해당 활약 덕분일까. LAFC는 팀 성적은 물론 브랜드 가치에도 엄청난 상승세로 보이고 있다.

글로벌 스포츠 매체 'ESPN'이 23일 발표한 MLS 클럽 파워랭킹에서 LAFC는 7위에 올랐다. 지난 발표보다 두 계단 순위가 올라간 것이다.

매체는 ""손흥민과 부앙가는 상대 수비진을 계속해서 공포에 떨게 하고 있다. 레알 솔트레이크전에서 나란히 골을 터트려 LAFC의 4-1 승리를 이끌었다. 최근 3경기에서 12골을 넣었는데, 그 12골을 모두 손흥민과 부앙가가 기록했다""며 ""LAFC는 지금 파이널 서드에서 공포의 대상""이라고 평가했다.

이어 MLS 사무국이 24일 발표한 동서부 콘퍼런스 통합 파워랭킹에서 LAFC는 6위에 올랐다. 순위가 네 계단 상승한 LAFC는 이로써 메시의 인터 마이애미보다 더 높은 랭킹에 위치하게 됐다.

이 같은 순위 상승의 이유는 수치로도 증명된다.

실제로 손흥민의 MLS 데뷔 후 적응 속도는 독보적이다. 그는 데뷔 후 7경기에서 6골 3도움을 기록하며, 최근 3경기 연속 공격포인트를 올리는 등 팀 상승세의 핵심에 서 있다.

폭발적 득점력뿐만 아니라 팀 전체 흐름을 바꾸는 결정적 장면으로 남았다. 손흥민의 활약 덕에 부앙가 역시 최근 3경기에서 7골, 4경기에서는 8골을 기록하며 MLS 역사상 최초로 3시즌 연속 20골 이상 기록하는 진기록을 달성했다.



LAFC는 손흥민 합류 이후 팀 분위기 자체가 달라졌다는 평가를 받고 있다.

로스앤젤레스 지역지 'LA타임스'는 최근 ""손흥민이 LAFC에서 경기 활약뿐 아니라 인간적으로도 훌륭한 모습을 보이고 있다. 그의 친근한 성격과 친절한 태도는 팀의 문화 자체를 바꿔버렸다""면서 ""손흥민 합류 전 LAFC는 12경기에서 단 4승만 거뒀고, FIFA 클럽월드컵과 리그스컵에서도 모두 탈락하는 등 우울한 상황이었지만, 손흥민이 온 이후 모든 게 달라졌다""고 평가했다.

특히 부앙가와의 호흡이 큰 주목을 받고 있다.  역시 눈부시다. 부앙가는 손흥민에 대해 “손흥민은 아주 뛰어난 선수이고 경기장 안팎에서 좋은 친구다. 우리가 가진 이 연결, 이 케미스트리는 무의식적이었다”고 밝혔고, 손흥민은 “팀을 돕고 많은 골을 넣기 위해 열심히 뛰는 부앙가에게 공을 돌려야 한다. 그는 늘 득점 위치에 있기 위해 정말 열심히 한다. 우리는 그를 인정해야 한다”고 치켜세웠다.

미국 매체 '야드베이커'는 ""일각에서는 손흥민 합류가 부앙가를 억누를지도 모른다고 우려했다. 그러나 체룬돌로 감독은 역동적인 3-5-2 전술로 두 선수를 동시에 배치하며 폭발적인 시너지를 만들어냈다""며 ""손흥민과 부앙가의 진짜 강점은 합작이 아니라 각자의 움직임에 있다. 상대 수비를 끌어내고 공간을 만들며 공격을 완성하는 능력은 MLS에서 누구도 막기 어렵다""고 분석했다.



이탈리아 축구의 전설이자 LAFC 구단주 그룹 일원인 조르조 키엘리니 또한 손흥민의 영향력에 감탄했다.

그는 최근 MLS 공식 유튜브 채널 공식 프로그램인 '디스 이즈 MLS'에 출연해 ""손흥민이 LAFC에 기쁨과 웃음을 가져왔다. 시즌 초반 팀은 결과의 일관성을 잃고 기쁨마저 사라졌지만, 손흥민이 그것을 되찾아줬다""며 ""팬과 선수 모두가 그 에너지를 느끼고 있다""고 전했다.

또한 ""손흥민과 부앙가가 자신감과 호흡을 찾으면서 특별한 듀오가 되고 있다""면서 ""미드필드와 수비가 균형을 갖춘다면 리그 전체를 뒤흔들 '괴물 듀오'가 될 수 있다""고 밝혔다.

해당 프로그램에 함께 출연한 MLS 현지 중계진 케빈 이건 역시 ""두 선수가 전속력으로 함께 뛰면 수비 입장에서는 악몽일 것이다. 손흥민과 부앙가를 동시에 막는 팀은 아직 아무도 없다""고 평가했다.



한편, LAFC는 최근 3연승을 질주하며 서부 콘퍼런스 4위를 지키고 플레이오프 진출을 확정했다.

MLS 포스트시즌은 각 콘퍼런스 상위 8팀이 참가한다.

손흥민과 부앙가의 듀오에 힘입어 조기 플레이오프 진출을 확정했으며, 서부 콘퍼런스 3위권을 바라보며 홈 어드밴티지를 확보하는 데 집중하고 있다.

LAFC는 오는 28일 MLS 32라운드 세인트루이스 시티와의 경기를 앞두고 있으며, 손흥민과 부앙가가 보여줄 연속 득점 폭발이 기대되는 가운데 팬들과 리그 전체가 이들의 활약에 주목하고 있다.

사진=연합뉴스/MLS/LAFC"
20250925,"일침! ""'토트넘의 아들 손흥민'처럼 안 뛴다고 부정적 태도 취할 이유 없다""...유망주 2인방, 악플로 몸살→""불필요하게 깎아내리지 마""","[SPORTALKOREA] 김경태 기자= 토트넘 홋스퍼 FC팬들이 두 유망주를 향해 지나치게 가혹한 평가를 내리고 있자, 비판 대신 지켜보자는 주장이 제기됐다. 

토트넘 소식을 주로 전하는 영국 매체 '홋스퍼 HQ'는 24일(한국시간) '유망주' 마티스 텔과 윌손 오도베르를 향해 팬들이 지나치게 가혹한 잣대를 들이밀고 있다고 꼬집었다.



이에 대해 매체는 ""토트넘은 손흥민이 MLS로 떠나면서 그 자리를 메울 영입을 하지 않은 탓에 스스로 발목을 잡았고, 왼쪽 윙에 큰 공백을 남겼다""며 ""모하메드 쿠두스가 오른쪽에서 더 많은 역할을 해주고 있지만, 왼쪽 자리는 아직 채워지지 않았다. 프랑크 감독은 텔과 오도베르를 그 자리에 기용했지만, 둘은 잠재력을 보여주면서도 아직 확실한 주전 자리를 차지하지 못하고 있다""고 짚었다.

그러면서 ""자연스럽게 일부 팬들은 텔과 오도베르에게 불만을 쏟아냈다. 텔은 유럽축구연맹(UEFA) 슈퍼컵 결승 패배 이후 많은 비판을 받았고, 오도베르는 브라이턴 앤 호브 앨비언 FC와의 2-2 무승부 이후 비난의 중심에 서야 했다""고 설명했다.



실제 텔과 오도베르는 현재 둘 다 만 20세로 미래가 전도유망하다. 이들은 잠재력이 뛰어 일찍이 유럽 무대를 누비며 경험을 축적하고 있다. 다만 팬들의 주장처럼 아직 이렇다 할 퍼포먼스를 보여주지 못하고 있는 것도 사실이다. 

텔은 FC 바이에른 뮌헨에서 83경기를 소화하며 가능성을 입증했으나, 토트넘에선 현재까지 25경기 3골 1도움에 머물고 있다. 오도베르 경우 역시 27경기 3골에 그치고 있으며, 올 시즌은 아직 공격 포인트를 올리지 못한 상태다.

매체는 이를 두고 ""두 선수가 아직 해답이 되지 못한 것은 사실""이라면서도 ""그것이 곧 미래에도 그렇다는 의미는 아니고, 두 선수가 형편없거나 이미 실패작이라는 뜻도 아니다. 사회관계망서비스(SNS)에서 늘 그렇듯 이적료 값을 못 한다거나 실패작이라는 목소리가 들려오지만, 이는 사실과 거리가 멀다""고 주장했다.



계속해서 ""오도베르, 텔은 모두 토트넘이 충분히 도전해 볼만한 가치가 있었던, 잠재력이 뛰어난 선수들이며 이미 프리미어리그에서 스타로 성장할 수 있는 원석 같은 기량을 보여주고 있다""고 짚었다.

끝으로 ""따라서 오도베르나 텔 같은 재능 있는 어린 선수들을 불필요하게 깎아내리는 대신, 보다 세밀한 시각으로 접근해야 한다. 두 선수가 당장 '스퍼스의 아들 손흥민'의 재림처럼 뛰지 않는다고 해서 지나치게 부정적인 태도를 취할 이유는 없다""고 강조했다.

사진=게티이미지코리아, TBR 풋볼, 토트넘 홋스퍼 FC

취재문의 sportal@sportalkorea.co.kr"
20250925,"""LAFC 상대하는 팀은 아무도 해내지 못한 과제 떠안게 된다""…'5경기 15골 폭격' MLS 최강 '흥부듀오' 극찬","손흥민과 데니스 부앙가./게티이미지코리아

[마이데일리 = 김건호 기자] ""로스앤젤레스 FC를 상대하는 모든 팀은 아직 아무도 해내지 못한 과제를 떠안게 된다.""

LAFC는 지난달 7일(한국시각) 손흥민을 영입했다. 이후 메이저리그사커(MLS)에서 가장 강력한 공격 듀오를 형성했다. 손흥민과 데니스 부앙가가 그 주인공이다.

손흥민은 LAFC 유니폼을 입고 7경기 6골 2도움을 기록 중이다. 최근 3경기 연속 골을 넣었으며 한 차례 해트트릭도 있었다. 부앙가도 손흥민 합류 이후 더 날개를 펼치고 있다. 7경기에서 9골 1도움을 마크했다.

LAFC는 MLS 역사상 최초로 3경기 연속 해트트릭을 달성한 팀이 됐다. 14일 산호세 어스퀘이크전에서 부앙가가 해트트릭을 완성했다. 18일 레알 솔트레이크전에서는 손흥민이 해트트릭을 달성했고 22일 다시 한번 부앙가가 솔트레이크를 상대로 해트트릭했다.
손흥민./게티이미지코리아

손흥민과 부앙가는 LAFC의 최근 5경기 득점을 모두 책임졌다. 15골을 모두 손흥민과 부앙가가 넣었다.

부앙가는 최근 엄청난 득점력을 과시하며 MLS 최초로 3년 연속 20골을 넣은 선수가 됐다. 손흥민은 그에 대해 ""팀을 돕고 많은 골을 넣기 위해 열심히 뛰는 부앙가에게 공을 돌려야 한다. 우연이 아니다. 운도 아니다. 그는 늘 득점 위치에 있기 위해 정말 열심히 한다. 우리는 그를 인정해야 한다""고 엄지를 치켜세웠다.

하지만 부앙가는 손흥민 덕분에 자기가 득점할 수 있었다고 인정했다. 그는 ""손흥민은 아주 뛰어난 선수이고, 경기장 안팎에서 좋은 친구다. 우리가 가진 이 연결, 이 케미스트리는 무의식적이었다""고 밝혔다.
손흥민과 데니스 부앙가./게티이미지코리아

미국 '야드베이커'는 24일 ""일각에서는 손흥민의 합류가 부앙가를 억누를지도 모른다고 우려했다. 두 선수 모두 비슷한 스타일이고, 스티브 체룬돌로 감독이 선호하는 4-3-3 전술에서는 동시에 기용하기 어렵다는 이유에서였다. 그러나 체룬돌로는 완고한 전술 고집을 버리고 역동적인 3-5-2로 변화를 줘, 두 명의 폭격기를 중원 위에 배치했다""고 했다.

계속해서 ""손흥민과 부앙가의 진짜 강점은 ‘합작’이 아니라 ‘각자의 움직임’에 있었다. 두 사람은 각자 상대 수비를 끌어내며 공간을 만들어주었고, 상대가 그 틈을 막기 전에 공격을 완성했다. 아직 이 파트너십의 잠재력이 온전히 드러나지 않은 셈이다""며 ""상대하는 모든 팀은 MLS에선 아직 아무도 해내지 못한 과제를 떠안게 된다. 바로 손흥민과 부앙가를 동시에 막는 것""이라고 덧붙였다.

3연승을 질주하고 있는 LAFC는 오는 28일 미국 미주리주 세인트루이스의 에너자이저 파크에서 MLS 32라운드 세인트루이스 시티와의 맞대결을 치를 예정이다."
20250925,"손흥민-부앙가? '내가 축신이다'…'GOAT' 메시, 2골 1도움 원맨쇼→부앙가 밀어내고 다시 MLS 득점 선두로","(엑스포츠뉴스 김환 기자) '축구의 신' 리오넬 메시가 뉴욕 시티 FC를 상대로 2골 1도움을 올리는 원맨쇼를 펼치며 팀의 대승을 이끌었다.

메시는 이날 활약으로 자신을 맹추격하는 드니 부앙가를 제치고 미국프로축구 메이저리그사커(MLS) 전체 득점 선두로 올라서며 MLS 득점왕 경쟁에서 한 발 앞서갔다. 최근 손흥민의 합류로 득점 능력이 물올랐다는 평가를 받고 있는 부앙가지만, 개인 능력으로 골을 뽑아내는 메시와 비교하기에는 아직 부족한 듯하다. 
인터 마이애미는 25일(한국시간) 미국 뉴욕의 뉴욕 양키스타디움에서 열린 뉴욕 시티와의 2025 MLS 정규리그 19라운드 순연 경기에서 2골 1도움을 기록한 메시의 활약과 루이스 수아레스, 발타사르 로드리게스의 득점을 앞세워 4-0 대승을 거뒀다.

승점 3점을 얻은 마이애미는 승점 55점(16승7무6패)을 마크하며 동부 컨퍼런스 3위로 올라섰다. 2위 신시내티와(승점 58)의 승점 차가 3점이지만, 마이애미가 2경기 덜 치른 상태이기 때문에 남은 일정에 따라 2위, 나아가 동부 컨퍼런스 선두 필라델피아(승점 60)의 자리까지 넘볼 수 있게 됐다.



과거 바르셀로나에서 발을 맞췄던 우루과이 국가대표 출신 공격수 수아레스와 함께 마이애미의 4-4-2 전형에서 투톱으로 출전한 메시는 경기 초반부터 날카로운 면모를 뽐내며 공격을 이끌었다.

득점이 터지지 않아 답답한 흐름이 이어지고 있던 전반전 막바지, 메시의 절묘한 패스가 득점으로 이어졌다. 전반 43분 상대 수비수 다리 사이로 찌른 패스가 로드리게스에게 정확히 향한 것을 로드리게스가 골로 연결한 것이다.

전반전을 1-0으로 마친 마이애미는 후반전에도 뉴욕 시티를 압박하며 추가골을 노렸고, 전반전에 선제골을 도왔던 메시가 또다시 해결사로 나섰다. 이번에는 메시가 직접 득점을 터트리며 뉴욕 시티의 추격을 따돌렸다.

메시는 후반 30분경 세르히오 부스케츠의 패스를 받은 뒤 공을 몰고 뉴욕 시티의 수비를 휘저으며 페널티지역까지 진입한 뒤 침착한 오른발 마무리로 상대 골네트를 흔들었다. 메시의 추가골로 기세가 오른 마이애미는 후반 38분 수아레스의 페널티킥 득점으로 경기에 쐐기를 박았다.



경기 막바지 메시가 축포를 터트렸다. 후반 41분 공을 몰고 페널티지역까지 질주한 이후 정교한 슈팅을 쏴 4-0을 만들었다. 이날 2골 1도움을 기록한 메시는 경기 최우수선수로 선정됐다.

더불어 메시는 뉴욕 시티전 활약으로 리그 24골 11도움을 기록, 자신을 따라잡았던 부앙가를 제치고 다시 MLS 득점 단독 선두가 됐다. 앞서 손흥민의 도움을 받아 최근 3경기에서 7골 1도움을 올리며 메시와 득점 동률(22골)을 맞췄으나, 메시는 부앙가의 노력을 비웃듯 손쉽게 2골을 추가했다.

현재 MLS 득점왕 경쟁은 메시(24골)와 부앙가(22골), 그리고 내쉬빌의 샘 서리지(21골)까지 3파전으로 진행되는 모양새다. 최근 부앙가의 기세가 매섭기 때문에 일각에서는 부앙가가 메시를 넘어 MLS 골든 부트를 차지할 수 있을 거라고 예상하기도 했지만, 메시는 뉴욕 시티전에서 페널티킥을 양보하고도 2골을 기록하는 다시 한번 자신의 수준을 증명했다. 

메시도 최근 경기력이 심상치 않다. 메시는 뉴욕 시티전에 앞서 시애틀을 상대로 1골 1도움, DC 유나이티드전에서 2골 1도움을 기록하며 최근 3경기에서 5골 3도움이라는 공격포인트를 올리는 등 괴랄한 페이스를 보여주고 있다. 메시와 부앙가의 경기력이 물오르면서 시즌 막판 MLS 득점왕 경쟁도 더욱 흥미로운 구도로 흘러가게 됐다.



마이애미 역시 시즌 막바지 메시의 활약에 힘입어 정규리그 역전 우승에 도전하는 중이다.

마이애미는 메시의 합류 이후 2023시즌 리그스컵 우승과 2024시즌 서포터즈 실드, 그리고 MLS컵 플레이오프에서 우승을 차지했다. 만약 마이애미가 이번 시즌에도 우승 트로피를 들어올린다면 메시 영입 후 3시즌 연속 특정 대회 정상에 오르게 된다.

사진=연합뉴스"
