date,title,content
20250425,"[속보] ""아름다운 소식 온다""...'HERE WE GO' 확인! '1195억' 공격수, 토트넘 대신 맨유행 초읽기→""곧 계약 끝낼 자신 있다""","[OSEN=고성환 기자] 치열한 영입 경쟁의 승자는 맨체스터 유나이티드가 되는 분위기다. 맨유가 뜨거운 인기를 끌고 있는 마테우스 쿠냐(26, 울버햄튼 원더러스)를 품기 직전이다.

유럽축구 이적시장 전문가 파브리시오 로마노는 25일(한국시간) 개인 소셜 미디어를 통해 ""맨유는 곧 쿠냐와 계약을 끝낼 자신이 있다. 협상은 진전된 단계에 있으며 합의를 완료하기 위해 더 많은 접촉이 이루어질 예정이다. 쿠냐는 이적을 열망하고 있다. 맨유도 그를 최우선 목표로 삼고 공식적인 절차를 따를 예정""이라고 전했다.
또한 그는 ""맨유는 쿠냐와 계약의 일환으로 울버햄튼에 몇 년 안에 할부금 포함 6250만 파운드(약 1195억 원)의 바이아웃 조항을 지불할 준비가 돼 있다""라며 ""맨유 팬들을 위한 아름다운 소식이 다가오고 있다""라고 덧붙였다.

쿠냐도 맨유에 진심인 모양새다. 로마노에 따르면 그는 다른 팀의 관심도 받고 있지만, 맨유행에 적극적이기 때문에 유럽축구연맹(UEFA) 챔피언스리그(UCL) 경기는 문제가 되지 않을 것으로 보인다. 맨유는 프리미어리그 14위에 머물러 있기에 다른 경쟁팀들과 달리 다음 시즌 UCL 진출 가능성이 적다. 유일한 경우의 수는 UEFA 유로파리그(UEL) 우승뿐이다.



맨유 팬들이 기다리고 있는 쿠냐는 스트라이커뿐만 아니라 윙어까지 소화할 수 있는 다재다능한 자원이다. 브라질 출신답게 공을 다루는 기술도 뛰어나며 강력한 슈팅과 연계 능력까지 지녔다. 올 시즌에만 31경기 16골 4도움을 터트리며 팀 내 최다 득점을 책임지고 있다.

사실 쿠냐는 어릴 적부터 유럽에서 주목받는 기대주였다. 그는 라이프치히와 헤르타 베를린, 아틀레티코 마드리드에선 크게 활약하지 못했지만, 프리미어리그에 도착한 뒤 재능을 꽃피웠다. 쿠냐는 2023년 울버햄튼 유니폼을 입은 뒤 85경기 31골 13도움을 기록 중이다. 황희찬과도 5골을 합작하는 등 좋은 호흡을 보여주곤 했다.

쿠냐의 활약이 계속되자 수많은 프리미어리그 빅클럽들이 탐을 내고 있다. 영국 'BBC'에 따르면 맨유뿐만 아니라 리버풀, 아스날, 첼시, 뉴캐슬, 등 이른바 상위권 팀들은 하나같이 쿠냐 영입을 추진 중이다. 토트넘 역시 이전부터 쿠냐 영입을 고려해 왔다. 구단 역대 최고 이적료를 갱신할 수 있다는 전망까지 나왔다.



특히 쿠냐는 지난 겨울이적시장에서 아스날로 이적할 수도 있었다. 부카요 사카와 카이 하베르츠, 가브리엘 제주스 등 공격 자원들이 줄줄이 쓰러진 아스날이 그에게 접근한 것. 하지만 쿠냐는 강등권에서 헤매는 울버햄튼을 구하기 위해 러브콜을 뿌리쳤다.

쿠냐는 지난달 ""때때로 우리가 인생에서 원하는건 애정뿐이다. 선수들도 인간이고, 어려움이 있다. 약간의 이해가 필요하다. 울브스가 내게 그 기쁨을 돌려줬다. 정말 감사드린다""라며 ""이적 제안이 많았다. 하지만 이적했다면 마음이 좋지 않았을 거다. 통제할 수 없는 것들도 있지만, 시즌 중반 어려운 상황에서 강등권에 처한 팀을 떠날 수 없었다""라며 울버햄튼에 대한 애정을 드러냈다.

다만 이제는 울버햄튼과 인연을 뒤로 하고 새로운 도전을 꿈꾸고 있는 쿠냐다. 그는 지난 2월 재계약을 체결했지만, 울버햄튼을 떠날 예정이라고 선언했다. 재계약을 맺으면서 바이아웃 조항을 넣은 것도 올여름 이적을 위한 포석이었다.

쿠냐는 얼마 전 영국 '가디언'과 인터뷰에서 ""이제 우리는 (잔류) 목표를 거의 달성했다. 하지만 다음 단계를 밟아야 한다는 점을 분명히 말씀드렸다. 난 우승이나 큰 것들을 두고 싸우고 싶다. 난 잠재력이 있다""라며 공개적으로 이적 의사를 선언했다.



아스날이 다시 쿠냐에게 접근해 영입을 마무리할 것이란 관측도 적지 않았다. 하지만 맨유가 적극적으로 움직이면서 분위기가 바뀌었다. 영국 'BBC' 역시 ""맨유는 올여름 울버햄튼 공격수 쿠냐 영입에 관심이 있다""라며 ""쿠냐는 시즌이 끝나면 몰리뉴 스타디움(울버햄튼 홈구장)을 떠날 것으로 예상된다""라고 보도했다.

매체는 ""여러 클럽 소식통에 따르면 쿠냐뿐만 아니라 입스위치 타운 스트라이커 리암 델랍(만 22세)도 맨유의 관심을 받고 있는 여러 공격 옵션 중 하나다. 맨유의 득점력 개선은 후벵 아모림 감독의 최우선 과제다. 맨유는 올 시즌 프리미어리그 33경기에서 38골을 넣었다. 사우스햄튼, 레스터 시티, 입스위치, 에버튼, 웨스트햄만이 이보다 적은 득점을 기록했다""라고 덧붙였다.

BBC는 쿠냐가 맨유에도 잘 녹아들 수 있을 것이라고 내다봤다. 매체는 ""쿠냐는 아모림이 선호하는 3-4-2-1 포메이션에서 두 공격형 미드필더 포지션 중 하나에서 뛰기에 이상적인 선수로 평가받고 있다. 그는 지금도 울버햄튼에서 비토르 페레이라 감독의 지휘 아래 비슷한 시스템에서 활약하고 있다""라고 짚었다.

맨유는 2022년에도 쿠냐를 눈독 들였다. 당시 맨유는 아틀레티코 마드리드에서 뛰고 있던 쿠냐의 에이전트와 접촉하며 이적 가능성을 모색했다. 그러나 이적료 문제로 불발됐고, 결국 쿠냐는 완전 이적 옵션이 포함된 임대 형태로 울버햄튼에 합류했다. 돌고 돌아 3년 만에 쿠냐 영입을 재시도 중인 맨유다.

/finekosh@osen.co.kr

[사진] ⓒGettyimages(무단전재 및 재배포 금지), 마테우스 쿠냐, NORTFX, 백포스트 UK 소셜 미디어."
20250425,"'SON, 제발 빨리 돌아와' 호랑이 입처럼 벌려 우승 기다리는 리버풀, 희생양 토트넘 '호구는 되기 싫어!'","▲ 토트넘 홋스퍼는 주장 손흥민이 빨리 복귀하지 않으면 프리미어리그 역대 최다 패배와 최저 승점 기록을 세울지도 모른다. ⓒ연합뉴스/REUTERS
▲ 손흥민 \'살라 우승\' 지켜보나. 리버풀, 5년 만에 EPL 제패 눈앞. 토트넘전 무승부로도 쾌거
▲ 엔제 포스테코글루 감독과 다니엘 레비 토트넘 홋스퍼 회장에 대한 팬들의 분노는 시간이 갈수록 커지고 있다. 유로파리그(UEL) 우승이 만병통치약이 된다는 보장도 없다. ⓒ연합뉴스/REUTERS/AP


[스포티비뉴스=이성필 기자] 토트넘 홋스퍼는 오는 28일 오전(이하 한국시간) 영국 리버풀의 안필드에서 리버풀과 2024-25 잉글리시 프리미어리그 34라운드를 치른다.

잔류를 확정한 토트넘은 리버풀전 다음에 치를 예정인 5월 2일 보되/글림트(노르웨이)와의 유럽축구연맹 유로파리그(UEL) 4강 1차전에 더 집중할 태세다. 홈에서 먼저 경기를 치르고 9일 노르웨이 북부 지방의 보되에서 덜 녹은 눈을 보면서 결승 진출 여부를 확인할지도 모른다.

그렇지만, 리버풀전은 단순한 경기가 아니다. 올 시즌 토트넘 실패의 상징처럼 만든 경기였다. 지난해 12월 23일 17라운드 홈경기에서 제대로 힘을 써보지도 못하고 3-6으로 완패했다.

리그컵(카라바오컵) 4강 1차전에서는 극강의 수비 축구로 1-0으로 이겼지만, 2차전에서 0-4로 완패하며 결승 진출에 실패했다. 리버풀이 뉴캐슬 유나이티드에서 패하며 준우승에 머물러 아픔의 고통은 더 컸다.

하필 이번 만남은 괴로움 그 자체다. 2연패에 승점 37점으로 16위인 토트넘은 13위 에버턴(38점)에 1점 차다. 이기면 경우에 따라 13위까지도 올라갈 수 있다. 물론 12위 크리스탈 팰리스(45점)와는 8점 차다. 리버풀전을 포함해 남은 5경기를 모두 이기고 한 경기를 더 치른 팰리스가 다 패해야 12위로 올라갈 수 있다.
리버풀은 안필드에서 우승을 노래하고 싶다. 79점으로 1위를 달리고 있고 2위 아스널(67점)에 12점 차다. 리버풀이 토트넘에 비겨도 13점 차가 되면서 우승을 확정한다. 이기면 더 모양새 좋게 우승을 즐긴다.

우승의 희생양이 될 위기에 처한 토트넘 입장에서는 무조건 이겨야 한다. 그렇지만, 주장 손흥민의 발등 부상 회복 여부는 외부로 노출되지 않았다. 주장이라는 구심점이 보이지 않고 엔제 포스테코글루 감독의 거취에 대한 이야기는 계속 쏟아져 나오고 있다.

▲ 토트넘 홋스퍼 측면 수비수 페드로 포로의 이적설이 눈덩이처럼 커지고 있다. ⓒ연합뉴스/REUTERS
▲ 토트넘 홋스퍼 크리스티안 로메로가 레알 마드리드, 아틀레티코 마드리드의 동시 구애를 받는 모양이다. ⓒ연합뉴스/AFP/EPA


부주장 크리스티안 로메로는 아틀레티코 마드리드와 레알 마드리드로 대표되는 스페인 프리메라리가 이적 가능성을 스스로 키우는 발언을 쏟아냈다. 다른 부주장 제임스 매디슨도 잔류와 이적 사이에 서 있다.

한마디로 리버풀 우승의 희생양, 호구가 될 가능성이 있다. 토트넘이 연고로 하는 런던 지역팀을 주로 다루는 축구 전문 매체 '풋볼 런던'은 24일, 토트넘이 얼마나 더 리그 순위를 높여 끝낼 수 있는가를 진단했다.

2003-04 시즌 리그 38경기의 절반인 19패를 했던 기억이 있는 토트넘이다. 11승 4무 18패의 토트넘이 21시즌 전의 기억과 마주할 가능성이 있는 토트넘이다. 9위 풀럼FC(48점)와 11점 차이다. 풀럼이 전패하고 토트넘이 전승해도 두팀 사이에 있는 팀들이 같이 전패해야 한 자릿수 순위 진입이 가능한 극한의 조건이다.

일련의 흐름은 토트넘의 잔여 경기, 당장 눈앞의 리버풀전 전망도 부정으로 만든다. 매체는 '두 팀의 순위나 경기력 등을 고려하면, 리버풀이 안필드에서 우승을 결정하는 경기고 토트넘은 원정이라 19번째 패배가 올 것 같다'라며 당연한 패배를 전망했다.

순위 상승도 어디까지나 꿈이다. 리버풀전이 끝나도 웨스트햄과의 런던 더비를 원정으로 치르고 크리스탈 팰리스(홈), 애스턴 빌라(원정), 브라이턴(홈) 순이다. 보되/글림트와의 4강 1, 2차전은 웨스트햄전 앞뒤로 붙어 있다. 결승에 나선다면 빌라와 브라이턴전 사이에 스페인 빌바오를 다녀와야 한다.

우승을 위해 총력전에 나설 리버풀에 패하며 호구가 되더라도 보되/글림트전과 더불어 리그 전승이 가능할까. 매체는 '포스테코글루 감독과 토트넘은 역대 최저 승점이라는 기록을 세우지 않기 위해 필사적인 노력을 할 것이다'라며 역대 최저 승점 수확인 1997-98 시즌 44점보다 더 적지 않기를 바라고 있다.

물론 토트넘 마음대로 되는 것은 하나도 없다. 리버풀전 이후 만나는 웨스트햄 상황은 토트넘 이상으로 나쁘고 유럽클럽대항전 출전 가능성도 없지만, 남은 세 팀은 다르다. FA컵 4강에 올라가 있는 팰리스도 리그 순위를 9위까지는 올려야 유로파 컨퍼런스리그(UECL)라도 갈 수 있다.

UCL에서 아스널, UEL 토트넘 또는 맨유, UECL 첼시가 우승하면 최대 11팀까지도 유럽클럽대항전에 나가는 그림이 그려진다. 물론 아스널이 리그 5위 밖으로 밀려나 우승하지 않을 것이고 첼시도 7위 밖으로 벗어나기 어려워 보이기 때문에 9팀이 마지노선일 수 있다.

손흥민 없이 치른 울버햄턴전에 2-4, 노팅엄 포레스트에 1-2로 패하며 무기력함의 끝판왕을 스스로 증명한 토트넘이다. 부상에서 빨리 복귀하기만 바라야 하는 처절한 상황이다.

UEL 결승 진출과 우승을 통한 UCL 출전권 확보 외에는 다음 시즌을 행복하게 지낼 무대가 없는 토트넘이다. 리버풀전 패배를 당연히 생각하는 언론의 전망 자체가 토트넘의 위상이 지면에 거의 붙어 있음을 의미한다."
20250425,"우파메카노와 재계약 실패→""김민재 사우디에 팔 생각에 기뻐"" 이적설만...뮌헨, 수비 계획 없다","다요 우파메카노 재계약 실패, 김민재 매각 소식에 바이에른 뮌헨 팬들은 구단의 수비진 계획에 의문을 품기 시작했다.

독일 '빌트'의 크리스티안 폴크 기자는 23일(이하 한국시간) ""뮌헨은 우파메카노와 재계약에 난항을 겪고 있다. 우파메카노가 과도한 요구를 하면서 협상이 진행되지 않는 상태다. 김민재는 5,000만 유로(약 814억 원) 제안이 오면 판매하려고 한다""고 주장했다.

뮌헨의 향후 수비진 계획에 궁금증이 모아진다. 이번 시즌을 앞두고 마타이스 데 리흐트를 보내면서 이토 히로키를 데려왔고 레버쿠젠에 임대를 다녀온 요십 스타니시치와 재계약을 맺었다. 남은 김민재, 우파메카노까지 더해 센터백 라인이 구축됐는데 김민재 외 잦은 부상으로 인해 정상 가동이 된 경기는 얼마 없다.



후반기 들어 이토가 또 쓰러지고 우파메카노까지 부상을 당했고 김민재도 온전하지 않은 몸 상태 속 경기를 치렀다. 수비 불안이 심해졌고 결국 유럽축구연맹(UEFA) 챔피언스리그(UCL) 8강에서 탈락했다. 독일 분데스리가에서 불안한 선두를 유지하다 최근 레버쿠젠과 차이를 벌려 우승을 눈앞에 두긴 했지만 수비 문제는 지적되고 있다.

뚜렷한 계획 없이 안 좋은 소식만 가득하다. 2026년 6월까지 계약이 되어 있는 우파메카노와 재계약 합의에 실패한 상황이다. 여기에 김민재는 매각하려고 한다. 'HERE WE GO' 기자로 유명한 파브리시오 로마노는 23일 ""김민재는 바이에른 뮌헨과 선수 모두에게 좋은 제안이 있다면 뮌헨을 떠날 구체적 가능성이 있다. 손댈 수 없는 존재가 아니다. 유럽 여러 클럽들이 이 상황에 대해 알고 있고 사우디아라비아 프로리그 클럽들도 김민재 영입에 대해 문의하기 시작했다""라고 보도했다.



김민재 이적설을 두고 독일 'TZ'는 ""김민재는 이적료 값을 못하고 있다. 뮌헨의 올 시즌 UCL 탈락에 크게 일조했다. 뮌헨 보드진은 실수가 많은 김민재를 매각 대상자에 올렸다. 큰 이적료를 버는 게 목표다. 사우디아라비아가 김민재를 노리는데 어떤 액수라도 받을 수 있다. 제안을 들을 예정이다. 유럽 내에서도 김민재를 향한 관심이 높다. 뮌헨은 이를 반기고 있을 것이다""고 말했다.

타팀들은 재계약 실패를 한 우파메카노도 노릴 것이다. 우파메카노, 김민재가 모두 떠난다면 뮌헨 수비진은 붕괴다. 대체를 하려면 플로리안 비르츠 등 현재 1순위 타깃들에게 투자할 금액 정도의 돈을 지불해야 할 것이다. 수비가 가장 문제인데 계획이 없어 보여 뮌헨 팬들은 걱정이 크다."
20250425,"김민재 114,100,000,000원 이적료 확정 미쳤다!…'사우디 NO, 안 간다' KIM 입장 나와→UEFA 챔스 원한다","(엑스포츠뉴스 권동환 기자) 바이에른 뮌헨 센터백 김민재의 이적 조건이 공개됐다.

튀르키예 언론 '포토맥'은 25일(한국시간) ""바이에른 뮌헨이 김민재를 내보내기로 한 후 시장 상황을 살피던 페네르바체는 예상치 못한 반응을 접했다""라고 보도했다.

지난 2023년 여름 바이에른 뮌헨에 합류한 김민재는 현재 뮌헨에서의 미래가 불확실하다.

독일 유력지 '빌트'는 지난 22일 ""바이에른 뮌헨이 인터 밀란과의 유럽축구연맹(UEFA) 챔피언스리그에서 뼈아픈 탈락을 한 후 김민재는 엄청난 비난을 받았다""라며 ""특히 8강 2차전에서 2-2로 비긴 경기에서 결정적인 실수를 두 번이나 저질렀기 때문이다""라고 전했다.



이어 ""한 가지 확실한 건 김민재는 더 이상 판매가 불가능한 선수가 아니라는 것""이라며 ""여름에 적절한 제안(약 5000만 유로)이 온다면 뮌헨을 떠나는 것도 결코 불가능한 일은 아니다""라고 덧붙였다.

더불어 ""가장 최근에는 아킬레스건에 지속적인 문제가 생겨 하이덴하임(4-0)과의 경기에서 벤치에만 앉아 있었다""라며 ""김민재는 시즌 마지막 경기를 바이에른 뮌헨에서 자신의 능력을 증명하거나 다른 팀에서 자신의 모습을 보여주기 위해 활용해야 한다""라고 전했다.
뮌헨은 지난 2023년 여름 SSC나폴리에서 뛰던 김민재를 이적료 5000만 유로(약 813억원)를 주고 영입했다. 그렇기에 원금을 회수할 수 있다면 올여름 김민재의 이적을 허락할 생각이다.

유럽축구 이적시장 전문가 파브리치오 로마노 기자도 23일 자신의 사회관계망서비스(SNS)를 통해 ""김민재는 이번 여름 구단과 선수 모두에게 좋은 제안이 있을 경우 바이에른 뮌헨을 떠날 수 있는 구체적인 가능성이 있다""라고 보도했다.



그는 ""김민재는 이적이 불가능한 선수가 아니며, 유럽의 여러 클럽들이 그의 상황에 대해 파악하고 있다""라며 ""사우디 프로리그 클럽들도 김민재에 대한 문의를 시작한 것으로 알려졌다""라고 전했다.

김민재가 이적시장에 나오자 유럽 빅클럽들이 관심을 보이기 시작했다. 프랑스 매체 '풋메르카토'는 지난 18일 ""김민재는 프리미어리그 이적 가능성을 열었다""라고 전해 눈길을 끌었다.

매체는 ""SSC나폴리에서 바이에른 뮌헨으로 이적한 지 2년 만에 김민재는 새로운 지평을 향해 나아갈 수 있게 됐다""라며 ""우리 정보에 따르면 그는 이번 여름에 뮌헨을 떠날 가능성을 열었다""라고 설명했다.

이어 ""첼시와 뉴캐슬 유나이티드를 포함한 몇몇 프리미어리그 클럽은 이미 김민재의 에이전트와 잠재적인 이적에 관해 이야기를 나눴다""라며 ""세리에 A 클럽도 김민재에게 관심을 표명했다""라고 덧붙였다. 



바이에른 뮌헨 매체 'FCB 차이퉁'도 19일 ""플레텐베르크는 방송에 나와 김민재에게 관심을 보이는 구단이 첼시와 뉴캐슬, 유벤투스라고 주장했다""고 밝혔다. 다른 바이에른 뮌헨 소식통 '바이언 앤드 저머니'도 ""김민재를 원하는 팀은 유벤투스와 첼시, 뉴캐슬""이라고 전했다.

'스카이스포츠 독일' 역시 ""김민재는 뮌헨 입단 2년 만에 이번 여름 팀을 떠날 가능성이 있다""라며 ""김민재를 원하는 팀이 존재하며, 첼시, 뉴캐슬 유나이티드, 유벤투스가 관심을 보이고 있다""라며 이탈리아 명문 유벤투스도 김민재를 노리고 있는 상황이라고 밝혔다.

그러나 김민재 이적은 그의 고액 연봉으로 인해 변수가 생겼다.

로마노 기자는 24일 ""김민재에 대해 문의하는 유럽 클럽은 많지만 문제는 연봉일 수 있다""라며 ""김민재는 뮌헨에서 많은 연봉을 받고 있다""라고 밝혔다.



그러면서 ""따라서 김민재는 연봉 삭감을 감수해야 하고, 그렇지 않으면 유럽에서 거래를 성사시키기가 어려울 것""이라고 주장했다.

더불어 ""사우디에서도 진정한 관심도 있다. 사우디 클럽들은 김민재의 연봉에 맞춰 더 많은 연봉을 제시할 준비가 되어 있을 것""이라며 ""선수와 뮌헨이 적절한 제안을 받을 수 있는 건 선수와 뮌헨의 몫이지만, 김민재가 뮌헨을 떠날 가능성은 매우 구체적이다""라고 전했다.

한편 김민재가 이적시장에 나오자 김민재 친정팀 튀르키예의 페네르바체도 관심을 보였는데, 뮌헨의 요구 액수로 인해 김민재의 페네르바체 복귀 가능성은 희박하다.

'포토맥'은 ""바이에른 뮌헨이 김민재를 내보내기로 한 후 시장 상황을 살피던 페네르바체는 예상치 못한 반응을 접했다""라며 ""뮌헨은 김민재의 이적료를 7000만 유로(약 1141억원)로 책정했다""라고 보도했다.



또 ""사우디아라비아에서도 러브콜이 있는 김민재는 UEFA 챔피언스리그에서 뛰는 팀으로 가고 싶어한다는 말도 나왔다""라고 했다.

튀르키예 언론 보도 내용이 사실이라면 김민재가 여름에 사우디로 떠날 가능성은 적다. 또 여름에 행선지를 정할 때 UEFA 챔피언스리그 참가 여부를 고려할 것으로 보인다.

김민재 영입을 원하고 있는 프리미어리그 클럽 첼시와 뉴캐슬은 현재 치열한 UEFA 챔피언스리그 진출 경쟁을 펼치고 있다.

이번 시즌 프리미어리그에서 상위 5위 안에 드는 팀은 다음 시즌 UEFA 챔피언스리그에 나간다. 현재 뉴캐슬이 리그 5위에 올라와 있고, 6위 자리에 첼시가 추격 중이다.

세리에A 명문 유벤투스도 다음 시즌 UEFA 챔피언스리그에 나가기 위해 분투 중이다. 세리에A에선 4위 안에 들어야 챔피언스리그에 나갈 수 있는데, 유벤투스는 승점 1점 차이로 5위에 자리 중이다.

사진=연합뉴스"
20250425,이강인 초대박! 야말·KDB·하피냐·사카 ‘월클’들과 어깨 나란히…EPL이 부르는 이유 있다,"[골닷컴] 이정빈 기자 = 이강인(24·파리 생제르맹)이 유럽 5대 리그에서도 손꼽는 찬스 메이커임이 드러났다. 90분을 기준으로 오픈 플레이 상황에서 8번째로 많은 ‘결정적 기회’를 창출하며 세계적인 선수들과 어깨를 나란히 했다.

축구 통계 매체 ‘스쿼카’는 25일(한국 시각) 유럽 5대 리그 선수 중 오픈 플레이에서 90분당 가장 많은 결정적 기회를 창출한 선수 10명을 공개했다. 미카엘 올리세(23·바이에른 뮌헨), 라민 야말(17), 하피냐(28·이상 바르셀로나), 케빈 더 브라위너(33·맨체스터 시티), 부카요 사카(23·아스널) 등 세계적인 선수들이 순위에 오른 가운데, 이강인의 이름도 포함됐다.
이 매체가 공개한 통계에 따르면, 이강인은 오픈 플레이 상황에서 90분당 0.76개의 결정적 기회를 만들었다. 이는 8위에 해당하는 기록이다. 더 브라위너와 0.04회 차이밖에 나지 않았고, ‘발롱도르 유력 후보’ 하피냐와는 불과 0.01 차이였다. 심지어 아스널 에이스인 사카와 비교하면 0.08회 차이를 보이며 기록에서 앞섰다.

이강인이 적은 출전 시간 속에서도 제 몫을 다해내고 있다는 걸 알 수 있는 지표다. 이번 시즌 이강인은 공식전 43경기 출전해 6골과 6도움을 기록했다. 공식전 출전 경기 수는 많지만, 경기당 출전 시간은 52.6분에 불과하다. 시즌 초반에는 꾸준히 선발 기회를 받았으나, 흐비차 크바라츠헬리아(24)가 합류하고, 데지레 두에(19)가 잠재력을 터트린 이후에는 주전 경쟁에서 밀렸다.



그런데도 이강인은 꾸준히 존재감을 내뿜고 있다. 오른쪽 윙어, 중앙 미드필더에 이어 르 아브르전에서는 수비형 미드필더 역할도 맡았다. 공격적인 재능이 뛰어난 선수지만, 후방에서도 인상적인 활약을 남겼다. 장점인 정교한 패스를 통해 동료들의 공격을 지원했고, 능숙한 드리블로 공을 끝까지 지켜내는 등 새로운 자리에서 가능성을 보였다.

이강인이 다재다능한 활약상을 펼치면서 그를 지켜보는 빅리그 구단들이 더욱더 늘어나고 있다. 지난겨울 아스널 이적설이 떠올랐던 이강인은 최근 뉴캐슬 유나이티드, 맨체스터 유나이티드와 이어졌다. 특히 그의 에이전트인 하비에르 가리도가 영국을 방문하면서 이적 가능성을 증폭시켰다. 가리도가 관리하는 선수 중 잉글랜드 프리미어리그(EPL) 이적설이 나온 건 이강인과 하비 게라(21·발렌시아) 뿐이다.

여기에 사우디아라비아 구단들도 이강인을 호시탐탐 주시하고 있다. 다만 파리 생제르맹은 이강인을 지키고 싶어 한다. 프랑스 현지에서 파리 생제르맹이 이강인과 재계약을 준비하고 있다는 보도가 나왔다. 이강인이 주전에서 거리가 멀어졌음에도 구단은 이강인의 기량을 높게 평가하고 있다. 루이스 캄포스(60·포르투갈) 파리 생제르맹 단장이 직접 재계약 협상을 이끌 거로 보인다.

한편, 이강인의 동료인 두에와 브래들리 바르콜라(22)도 순위표에 올랐다. 특히는 두에는 올리세 다음으로 높은 수치를 선보이며 최근 상승세를 톡톡히 알렸다. 바르콜라 역시 더 브라위너보다 높은 순위에 오르며 파리 생제르맹의 새로운 핵심임을 증명했다.

사진 = 소셜네트워크서비스(SNS) 캡처, 스쿼카, 게티이미지"
