date,title,content
20250511,"‘철벽수비 기여’ 김민재 트로피 번쩍…뮌헨, 분데스리가 우승 세리머니","바이에른 뮌헨 소속 해리 케인(왼쪽)과 김민재. [EPA]


[헤럴드경제=신혜원 기자] ‘철기둥’ 김민재가 독일 프로축구 분데스리가 우승 트로피를 들어 올렸다.

지난 5일(이하 한국시간) 2024-2025 분데스리가 우승을 확정한 김민재의 소속팀 바이에른 뮌헨은 11일 독일 뮌헨 알리안츠 아레나에서 묀헨글라트바흐와 33라운드를 치른 뒤 우승 세리머니를 진행했다.

2023-2024시즌을 앞두고 뮌헨 유니폼을 입은 김민재는 올 시즌 뮌헨에서 처음으로 리그 우승을 경험했다.

2022-2023시즌 이탈리아 세리에A에서 나폴리의 33년 만의 우승에 기여한 그는 빅리그 두 곳에서 우승한 첫 한국 선수가 됐다.

뮌헨으로서는 2년 만의 왕좌 복귀다. 지난 시즌엔 레버쿠젠에 우승을 내주며 3위에 그치는 굴욕을 맛봤다.

27경기에 출전해 뮌헨의 철벽 수비에 기여하고 득점도 두 차례나 올린 김민재는 우승 세리머니에서도 ‘주연급’으로 대접받았다.
김민재는 골잡이 해리 케인에 앞서 등장해 우승 메달을 받았다. 또 우승 트로피를 돌아가며 들어 올릴 땐 6번째로 나섰다.

우승 트로피를 가장 먼저 넘겨받은 골키퍼 마누엘 노이어는 이를 들어 올리지 않고 곧바로 올 시즌을 끝으로 은퇴하기로 한 베테랑 공격수 토마스 뮐러에게 전달했다.

뮐러가 가장 먼저 트로피를 번쩍 들어 올렸고, 선수들은 방방 뛰며 기쁨을 만끽했다.

이어 케인과 수비수 에릭 다이어가 차례로 나섰다. 이들은 뮌헨에 오기 전 잉글랜드 토트넘 홋스퍼에서 ‘무관’의 한을 제대로 느낀 선수들이다.

마이클 올리세, 콘라트 라이머가 다이어의 뒤를 이었고, 그다음에 수줍어하던 김민재가 ‘끌려’ 나왔다.

다이어 등이 멱살을 잡고 무대 중앙으로 끌어당기는데도 난처한 표정으로 버티던 김민재는 결국 동료들의 성화를 이겨내지 못하고 앞으로 나와 트로피 ‘마이스터샬레’를 번쩍 들었다.

김민재는 아킬레스건 부상 여파로 이날 경기에 출전하지는 않았다.

뮌헨은 전반 31분 해리 케인의 선제 결승골을 앞세워 묀헨글라트바흐에 2-0 완승을 거두고 우승을 자축했다.

올리세가 오른쪽에서 왼발로 감아 찬 슈팅에 케인이 머리를 살짝 갖다 대 골대를 갈랐다.

리그 25호 골을 기록한 케인은 2년 연속 득점왕 타이틀에 바짝 다가섰다. 한 경기만 남겨놓은 가운데 2위 파트리크 시크(레버쿠젠)와 6골 차여서 케인의 득점왕 등극은 매우 유력한 상황이다.

후반 45분 올리세가 레로이 자네의 전진 패스를 오른발로 마무리해 2-0 승리에 쐐기를 박았다."
20250511,"이재성 ‘시즌 7호 도움’+홍현석 ‘쐐기골 기점’ 대폭발! 마인츠, 보훔에 4-1 승···‘120년’ 최초 UCL 진출은 아쉽게 무산[분데스 리뷰]","<저작권자(c) 연합뉴스, 무단 전재-재배포, AI 학습 및 활용 금지>


Getty Images



이재성이 시즌 7호 도움을 기록한 가운데 교체로 나선 홍현석은 쐐기골 상황에서 기점 역할을 했다. 마인츠는 보훔을 4-1로 꺾고 리그 8경기 만에 승리를 거두며 6위로 올라섰지만 유럽축구연맹(UEFA) 챔피언스리그 진출은 아쉽게 무산됐다.

마인츠는 10일 오후 10시 30분(한국시간) 독일 보훔의 보노비아 루스타디온에서 열린 2024-25 독일 분데스리가 33라운드 원정 경기에서 보훔에 4-1로 승리했다.

이날 승리로 마인츠는 14승 9무 10패(승점 51)를 기록하며 6위로 올라섰다. 하지만 4위 프라이부르크 역시 승리를 거두면서 승점 차이는 그대로 4점이 유지됐고, 챔피언스리그 진출이 좌절됐다.

마인츠 선발 라인업. 마인츠 SNS


보 헨릭센 감독이 이끄는 마인츠는 3-4-2-1 포메이션을 가동했다. 라세 리스가 골문을 지켰고, 안드레아스 한체올센-슈테판 벨-대니 다코스타가 백3를 구축했다. 수비진 앞에는 필립 음베네-나디엠 아미리-사노 카이슈-앙토니 카시가 위치했고, 2선에 이재성과 파울 네벨이 포진했다. 최전방 원톱에는 요나탄 부르카르트가 나섰다. 홍현석은 벤치에 앉았다.

Getty Images



마인츠는 이 경기에서 반드시 승리가 필요했다. 한때 4위까지도 오르며 챔피언스리그 진출을 꿈꿨으나 최근 리그 7경기에서 4무 3패를 기록, 최악의 부진에 빠지며 7위까지 추락했다. 챔피언스리그에 나서기 위한 마지노선인 4위 프라이부르크와는 4점까지 벌어졌기에 이 경기를 반드시 잡고 다른 팀들의 상황을 지켜보며 실낱같은 희망을 기대해야 했다.

전반 8분 마인츠가 좋은 기회를 만들었다. 오른쪽에서 넘어온 크로스를 반대편에서 음베네가 잡은 뒤, 오른발 감아 찬 슈팅으로 마무리했으나 골문 앞에서 보훔 수비가 머리로 걷어냈다.

경기의 주도권을 잡은 마인츠가 계속해서 경기를 이끌어 나갔다. 공격적으로 나서며 보훔의 수비진을 공략해보려 했으나 마무리에서 아쉬움을 드러내며 어려움을 겪었다.

Getty Images



전반 추가시간 마인츠의 선제골이 터졌다. 종료 직전 박스 앞에서 얻은 프리킥 상황에서 아미리가 키커로 나섰고, 직접 골문을 노렸다. 이 프리킥이 수비벽을 넘어 골문 구석으로 빨려들어가며 골망을 흔들었다.

아미리의 환상적인 프리킥 선제골을 앞세운 마인츠가 1-0으로 리드를 잡은 채 전반이 종료됐다.

후반 8분 이재성의 도움이 마인츠의 추가골을 만들었다. 스로인 상황에서 부르카르트가 내준 공을 이재성이 잡은 뒤 반대편에 있던 음베네에게 내줬고, 음베네가 마무리하며 추가골을 터트렸다. 이재성의 시즌 7호 도움이었다.

후반 16분 이재성과 홍현석이 교체됐다. 헨릭센 감독은 이재성을 빼고 홍현석을 투입하며 변화를 가져갔다. 이재성은 61분을 소화하며 1도움을 기록한 뒤 일찌감치 경기를 마쳤다.

Getty Images



후반 28분 마인츠의 쐐기골이 터졌다. 홍현석이 기점이 됐다. 전방에서 홍현석이 보훔 수비가 제대로 처리하지 못한 공을 가로챈 뒤, 빠르게 부르카르트에게 내줬다. 이후 부르카르트가 네벨과 주고받은 뒤 그대로 치고 들어가 오른발 슈팅으로 마무리하며 쐐기골을 터트렸다.

보훔도 이대로 무너지지 않았다. 후반 40분 게리트 홀트만이 만회골을 터트리며 0패를 면했다. 하지만 후반 종료 직전 네벨이 마지막 득점을 터트리며 경기를 끝냈다. 그렇게 마인츠가 보훔에 4-1 승리를 거두며 경기가 종료됐다.

박찬기 온라인기자 chan@kyunghyang.com"
20250511,"'大충격' ""손흥민, 팰리스전 뛸 예정"" 포스텍 '선언'... '병명미상 부상' 드디어 떨쳐냈다","[사진] ⓒGettyimages(무단전재 및 재배포 금지)
[사진] ⓒGettyimages(무단전재 및 재배포 금지)


[OSEN=우충원 기자] 손흥민(토트넘 홋스퍼)이 돌아온다. 팀의 주장인 그가 다시 피치에 선다. 그리고 그 복귀는 유럽축구연맹(UEFA) 유로파리그 결승을 앞둔 토트넘에 있어 결정적인 분수령이 될 전망이다.

토트넘의 엔지 포스테코글루 감독은 10일(이하 한국시간) 크리스탈 팰리스와의 2024-2025 프리미어리그 36라운드를 앞두고 열린 기자회견에서 손흥민의 출전 가능성을 공식화했다. 토트넘은 11일 토트넘 홋스퍼 스타디움에서 크리스탈 팰리스를 상대로 시즌 막판 중요한 일전을 치른다.

풋볼런던에 따르면 포스테코글루 감독은 “새로운 부상자는 없다. 전체적으로 팀 상황은 좋아지고 있다”며 “손흥민이 내일 경기에서 몇 분간 뛸 수 있을지도 모른다는 희망이 있다. 복귀가 임박한 유일한 선수”라고 밝혔다.

사실 손흥민의 복귀 조짐은 그보다 앞서 있었던 것으로 보인다. 그는 보되/글림트와의 유럽축구연맹(UEFA) 유로파리그 4강 2차전 직전 팀 훈련엔 불참했지만 현장에 모습을 드러냈다. 포스테코글루 감독도 당시 “손흥민이 돌아오지 못해 아쉽지만 긍정적인 신호가 있다”며 ""주말 경기 출전을 목표로 하고 있다""고 밝힌 바 있다.
이후 손흥민은 결승 진출이 확정된 직후 자신의 SNS에 “굿모닝, 그리고 곧 경기장에서 만나자”는 메시지를 남기며 팬들의 기대감을 증폭시켰다. 이는 사실상 복귀가 임박했음을 알리는 사인이었다.

손흥민이 부상으로 이탈한 건 지난달 UEFA 유로파리그 8강 1차전에서 아인라흐트 프랑크푸르트의 장 마테오 바호야에게 거친 태클을 당하면서다. 이후 발 타박상이 예상보다 길게 이어졌고, 한 달 가까이 전력에서 제외됐다.

[사진] ⓒGettyimages(무단전재 및 재배포 금지)
[사진] ⓒGettyimages(무단전재 및 재배포 금지)
리그에서도 울버햄튼, 노팅엄, 웨스트햄 등 총 4경기를 결장했다. 구체적인 부상명과 복귀 일정이 공개되지 않았던 만큼  일각에선 시즌 아웃 가능성까지 제기됐다. 그러나 그의 최근 컨디션과 감독의 발언을 종합하면, 그 우려는 기우에 불과했다는 평가다.

보되/글림트와의 1차전에서 손흥민은 사복 차림으로 경기장을 방문했고 잔디 위에 올라 몸을 푸는 장면도 포착됐다. 아직 팀 훈련에 완전히 복귀하지는 못했지만 몸 상태는 눈에 띄게 호전된 것으로 전해졌다.

크리스탈 팰리스전은 결승 복귀를 앞둔 손흥민에게 중요한 전환점이 될 수 있다. 리그에서 최소 1~2경기를 소화하며 경기 감각을 끌어올려야, 오는 24일(이하 한국시간) 열리는 유로파리그 결승에서 최상의 경기력을 선보일 수 있기 때문이다.

토트넘은 이번 시즌 유로파리그에서 결승 진출이라는 큰 성과를 거뒀다. 결승 상대는 맨체스터 유나이티드. 손흥민은 이번 대회 9경기에서 3골-2도움을 기록하며 토트넘 공격을 이끌었다. 8강 2차전 이후 결장했지만 조별리그와 토너먼트 초반의 결정적인 활약이 결승행의 기반이 됐다는 평가가 나온다.

이번 결승은 손흥민에게 특별한 의미를 지닌다. 유럽 클럽대항전 결승전 선발 출전 경험이 있는 토트넘 선수는 현재 그가 유일하다. 그리고 이 경기는 손흥민의 첫 메이저 우승이 걸린 무대이기도 하다.

그러나 시즌 전체를 돌아보면 손흥민의 2024-2025시즌은 순탄치 않았다. 프리미어리그에서 기록한 7골-9도움은 2016-2017시즌 이후 처음으로 두 자릿수 득점이 무산될 위기에 놓여 있으며 공식전 기록은 43경기 11골-12도움으로 다소 아쉬운 수치다.

[사진] ⓒGettyimages(무단전재 및 재배포 금지)
[사진] ⓒGettyimages(무단전재 및 재배포 금지)
시즌 초 손흥민은 주장 완장을 차고 “이제는 우승을 하고 싶다”고 말했었다. 유럽 무대에서 수많은 도전을 이어왔고 매번 트로피 앞에서 눈물을 삼켰던 손흥민. 이제 그가 이끄는 토트넘은 또 한 번의 결승에 나선다.

그리고 이번엔, 손흥민이 단순한 '도전자'가 아닌 '선봉장'으로 트로피를 들어올릴 수 있을지 팬들의 이목이 집중되고 있다. / 10bird@osen.co.kr"
20250511,"'민재야 네가 축하받을 차례야' 김민재 빨리 트로피 들라고 들라고 떠민 뮐러, 케인, 다이어","김민재(바이에른뮌헨). 독일 '스카이스포츠' 유튜브 캡처


활약상을 인정받지 못해 아쉬운 순간이 잦았지만, 우승을 축하하는 날 동료들은 김민재를 빠짐없이 챙겼다. 

11일(한국시간) 독일 뮌헨의 알리안츠 아레나에서 2024-2025 독일 분데스리가 33라운드를 가진 바이에른뮌헨이 보루시아묀헨글라드바흐에 2-0으로 승리했다. 마이클 올리세가 1골 1도움을 기록했고 해리 케인이 1골, 리로이 사네가 1도움을 올렸다.

바이에른은 앞선 32라운드 결과 이미 분데스리가 우승을 확정 지은 상태였다. 확정 직후 가진 홈 경기에서 공식 시상식이 진행됐다.

바이에른은 비록 지난 시즌 우승을 놓치긴 했지만 앞선 11시즌은 연속으로 우승한 팀이다. 선수들은 분데스리가의 접시 모양 트로피 마이스터샬레(Meisterschale)를 들어본 경험이 많다. 시상식은 다른 팀처럼 주장이 트로피를 멋지게 들 줄 아는지 여부만 따지는 구도가 아니었다. 서로 트로피를 들 자격이 있는 선수를 챙겨주며 진행됐다.

독일 분데스리가 우승 시상식에 선 김민재(바이에른뮌헨). 게티이미지코리아


가장 먼저 주장 노이어가 트로피 시상식을 하지 않으면서, 이 시상식의 스토리가 시작됐다. 노이어는 이날 마지막 분데스리가 홈 경기를 치른 '전설' 토마스 뮐러의 손을 잡고 앞으로 끌고 나왔다. 뮐러가 특유의 예능감 넘치는 표정으로 '오호라, 나에게 이걸?'이라는 느낌으로 등장한 뒤 마이스터샬레를 번쩍 들었다.

뮐러는 자신의 차례를 빨리 마치고 다른 선수에게 넘겼다. '무관의 전설' 해리 케인의 첫 우승을 축하해 주기 위해서였다. 뮐러가 고갯짓으로 케인을 불러냈고, 노이어도 케인을 끌어내 앞에 세웠다. 그래서 두 번째 차례는 케인이었다. 뮐러는 케인이 자신보다도 오래 트로피 세리머니를 할 수 있게 순서를 늘려줬다.
이처럼 선수들끼리 축하받을 자격이 있다고 챙겨 준 선수, 그냥 먼저 들어보려고 제발로 나온 선수들이 섞여 있었다. 이후 흐름을 보면 케인 다음은 에릭 다이어였다. 다이어 역시 이번 시즌을 끝으로 바이에른을 떠나는 것이 예정된 선수다. 세르주 그나브리가 다이어를 앞으로 끌어내자 김민재도 웃으며 동참하는 모습을 볼 수 있다.

다이어 다음은 우승 일등공신 중 하나인 마이클 올리세였다. 올리세는 이번 시즌 바이에른에 합류해 케인과 원투 펀치를 형성, 공격을 이끌었다. 이번 시즌 분데스리가 처음으로 10-10을 돌파했고 이날도 1골 1도움을 올렸다.

김민재, 토마스 뮐러, 이토 히로키(왼쪽부터, 이상 바이에른뮌헨). 게티이미지코리아


그 다음으로 팀원들이 챙겨 준 선수는 김민재였다. 올리세가 한창 축하를 받고 다음 차례는 누군지 찾고 있을 때부터 다이어가 김민재의 멱살을 잡다시피 하고 앞으로 끌어냈다. 김민재가 사양하느라 콘라트 라이머, 주앙 팔리냐가 먼저 들었고 뮐러와 케인이 합세해 네 차례라며 재촉했다.

김민재는 떠밀리듯 앞으로 나왔지만 트로피를 드는 모습은 흥이 넘쳤다. 번쩍 드는 척 하다가 페인팅을 한 번 주면서 바로 앞의 동료들이 정신을 못차리게 한 번 속이고 드는 재치를 발휘했다.

동료들이 '다음엔 네가 나가라'라는 식으로 떠밀어 끌어낸 선수들로만 보면 뮐러, 케인, 다이어, 올리세, 김민재 순이었던 셈이다. 이번 시즌 팀을 떠나는 레전드, 팀을 떠나는 우승 공로자, 그밖에 많이 고생하고 팀에 기여한 순이 케인, 올리세, 김민재였다. 김민재 이후로는 다른 선수를 끌어내는 일 없이 다양한 선수가 자연스레 돌아가면서 트로피를 들었다.

각종 해외 중계에서 유독 아시아 선수가 트로피를 드는 순간에 카메라를 돌려버린다는 논란도 있었지만 이날 독일 '스카이스포츠'는 김민재가 준비할 동안 트로피를 든 팔리냐의 차레에 관중석을 보여주고, 김민재가 트로피를 드는 모습은 빼먹지 않았다.

사진= 게티이미지코리아, 독일 '스카이스포츠' 유튜브 캡처"
20250511,"다이어, 김민재 멱살 잡았다…'한 페이지 될 수 있게' 우승 세리머니 권했다→韓 최초 빅리그 2개 대회 제패 쾌거","(엑스포츠뉴스 김현기 기자) 김민재가 한국 축구 사상 최초로 유럽 빅리그에서 2개 대회 트로피를 들어올리는 역사를 썼다.

시즌 막판 주요 경기에서 연이은 실수로 팬들의 비판을 받기도 했지만 소속팀 독일 최고 명문 바이에른 뮌헨에서 2024-2025시즌 두 번째로 많은 출전시간을 기록한 김민재는 '우승 대접'을 받을 자격이 있었다.

실제 뮌헨의 핵심 공격수인 해리 케인, 레전드 미드필더로 뮌헨 고별전을 치른 토마스 뮐러, 같은 포지션의 라이벌이자 동료인 에릭 다이어가 김민재의 우승 세리머니를 챙겼다.

1년간 땀 흘린 보상을 얻는 세리머니 현장에 '김민재 패싱'은 없었다.

김민재가 독일 분데스리가 우승 트로피를 들어 올렸다.

바이에른 뮌헨은 11일(한국시간) 독일 뮌헨 알리안츠 아레나에서 열린 보루시아 묀헨글라트바흐와의 2024-2025 시즌 분데스리가 33라운드를 홈 경기를 치른 뒤 우승 세리머니를 진행했다.

뮌헨은 이번 시즌 24승 7무 2패(승점 79)를 기록, 지난 시즌 우승팀 바이엘 레버쿠젠(승점 68)을 밀어내고 남은 한 경기에 관계 없이 34번째 분데스리가 정상 등극을 일궈냈다.



뮌헨은 지난 2012-2013시즌부터 2022-2023시즌까지 분데스리가 11연패를 일궈냈으나 김민재, 케인이 입단한 2023-2024시즌엔 '무해 신화'를 기록한 레버쿠젠에 우승컵을 내주고, 슈투트가르트에도 밀린 끝에 3위에 그쳤다.

이번 시즌은 달랐다. 뮌헨과 레버쿠젠이 모두 두 경기를 졌으나 무승부에서 뮌헨은 7경기, 레버쿠젠은 11경기로 뮌헨이 승리가 더 많고 무승부가 적어 정상 탈환을 이뤄낼 수 있었다. 레버쿠젠이 지난 5일 프라이부르크와 2-2로 비기면서 뮌헨 선수들은 TV를 보다가 우승을 확정지었다.
뮌헨 구단은 분데스리가사무국에 에 홈 최종전인 묀헨글라트바흐전을 마치고 세리머니할 뜻을 내비쳤고 드디어 이날 시상식이 열렸다. 

김민재 입장에선 한국 축구의 새 이정표를 만드는 시상식이 됐다.

2022-2023시즌 이탈리아 세리에A에서 나폴리의 33년 만의 우승에 기여한 그는 빅리그 두 곳에서 우승한 첫 한국 선수가 됐다.

과거 박지성이 맨체스터 유나이티드에서 뛸 때 잉글리시 프리미어리그에서, 그리고 지난 시즌 이강인이 프랑스 파리 생제르맹(PSG)에서 각각 우승 트로피를 들어올린 적이 있다.



뮌헨 2군에 입단해 2018-2019시즌 1군 무대를 밟았던 정우영도 해당 시즌 뮌헨의 우승을 경험했으나 분데스리가 우승 기록이 한 경기, 딱 5분에 불과해 우승에 기여했다고 하긴 어려웠다.

김민재는 달랐다. 김민재는 이번 시즌 분데스리가에서 2284분을 뛰어 요주아 키미히(2757분), 케인(2350분)에 이어 3번째로 많은 출전 시간을 기록했다. 지난해 12월 말 겨울 브레이크 이전엔 전 경기를 선발로 나서면서 '철인'의 면모를 유감 없이 발휘했다.

김민재는 2022-2023시즌 나폴리 소속으로 이탈리아 세리에A 우승한 것에 이어 2년 만에 또 다른 빅리그 타이틀을 거머쥐었다.

김민재는 골잡이 해리 케인에 앞서 등장해 우승 메달을 받았다. 또 우승 트로피를 돌아가며 들어 올릴 땐 6번째로 나섰다.

우승 트로피를 가장 먼저 넘겨받은 골키퍼 마누엘 노이어는 이를 들어 올리지 않고 올 시즌 끝으로 뮌헨 구단을 떠나는 '리빙 레전드' 뮐러에게 전달했다.

이에 뮐러가 가장 먼저 트로피를 번쩍 들어 올렸고, 케인과 다이어가 다음 차례로 나섰다. 둘은 뮌헨에 오기 전 손흥민 소속팀인 잉글랜드 토트넘 홋스퍼에서 이어왔던 '무관'의 한을 마침내 풀었다. 다이어는 이번 시즌을 끝으로 토트넘을 떠나 프랑스 AS모나코에서 3년간 뛴다.



4번째 트로피를 들어올린 이는 최근 수년간 뮌헨 최고의 영입을 꼽히는 프랑스 윙어 마이클 올리세였다. 이어 오스트리아 수비수 콘라트 라이머가 분데스리가 우승트로피인 '마이스터 샬레'를 들어올렸다.

그리고 뒤에서 수줍어하던 김민재가 '끌려' 나왔다.

케인과 뮐레가 김민재를 찾았다. 앞서 다이어가 멱살을 잡고 무대 중앙으로 끌어당기는데도 난처한 표정으로 버티며 라이머를 먼저 단상 위에 세웠던 김민재는 라이머가 세리머니 한 뒤 동료들의 성화를 이겨내지 못하고 앞으로 나와 트로피 '마이스터 샬레'를 번쩍 들었다.

김민재는 지난해 10월 아인트라흐트 프랑크푸르트전부터 생긴 아킬레스 건염으로 인해 진통제를 맞고 뛰는 등 악전고투했다.

그러다가 뮌헨이 우승을 거의 확정짓는 순간부터 출전 시간이 줄었다. 뮌헨은 오는 6월 중순부터 미국에서 국제축구연맹(UEFA) 2025 클럽월드컵을 치른다. 뮌헨은 7경기를 치러 우승하겠다는 목표를 갖고 있어 지금 말고는 김민재가 휴식을 취하며 아킬레스 건염 부상에서 회복할 시기가 없다.





최근 뮌헨의 우승 동영상 썸네일(동영상 표지)에 주전급 선수 10명와 콤파니 감독이 포함됐지만 김민재가 빠져 '김민재 패싱' 논란이 강하게 불거졌으나 이날 시상식에선 케인과 뮐러 등 팀의 간판 선수들이 김민재를 앞다퉈 챙겼다. 세리머니 순서로 굉장히 앞에 배치했다.

김민재는 축구 인생의 또 다른 '한 페이지'를 장식하고 클럽월드컵과 다음 시즌을 기약하게 됐다.

사진=연합뉴스 / 중계화면"
20250511,"드디어 'Here We Go' 떴다...아스널, 프리미어리그 최고 중원 구축! 외데고르-라이스-수비멘디 완성","사진=파브리시오 로마노


아스널이 마르틴 수비멘디 영입에 근접했다.

유럽 이적시장에 능통한 파브리시오 로마노 기자는 10일(한국시간) ""아스널은 레알 소시에다드와 수비멘디 이적에 합의헀다. 아스널은 6,000만 유로(940억) 바이아웃 조항을 발동할 예정이다. 수비멘디도 아스널 이적에 구두 합의했다. 모든 문서는 준비 중이지만 아스널은 이미 구두 합의가 끝났기에 이적이 이루어질 것이라 확신하고 있다""라고 전했다. 로마노 기자 특유의 이적이 확정되었을 때 알리는 'Here We Go'도 있었다.

수비멘디는 소시에다드에서 뛰고 있는 수비형 미드필더다. 소시에다드 유스를 거쳐 2020-21시즌부터 주전으로 활약했고 매 시즌 큰 부상 없이 많은 경기를 뛰었다. 5시즌 연속 리그 30경기 이상 소화한 철강왕이다. 이번 시즌도 모든 대회 44경기에 출전하여 2골 2도움을 기록 중이다.

지난 유럽축구연맹(UEFA) 유로 2024 스페인 대표팀에 승선해 4경기에 뛰었다. 잉글랜드와의 결승전에서도 45분간 뛰면서 조국의 우승에 크게 기여한 바 있다.

아스널은 수비멘디에 꾸준히 관심을 가져왔다. 수비멘디는 당초 이번 시즌을 앞두고서 팀을 떠나는 것에 가까웠다. 위르겐 클롭 감독의 뒤를 이어 새롭게 지휘봉을 잡은 아르네 슬롯 리버풀 감독은 수비멘디 영입을 원했다. 리버풀이 꽤나 적극적으로 시도했는데 수비멘디는 마지막 순간에 거절하면서 소시에다드에 잔류했고 아스널이 나섰다. 지난 겨울 이적시장 수비멘디 영입을 시도했었다. 로마노 기자는 당시 ""아스널은 2025년 여름 이적시장에서 수비멘디 영입을 위한 심도 있는 협상을 진행 중이다. 긍정적인 대화가 진행되었고, 선수 측과 협상하고 있다""라고 전한 바 있다.

즉 겨울 이적시장부터 공을 들인 영입이라는 것이다. 아스널은 수비멘디 영입을 통해 프리미어리그 최고 수준 중원을 구축하게 됐다. 마르틴 외데고르, 데클란 라이스 콤비에 수비멘디가 가세한다면 분명히 큰 힘이 될 것이다."
