date,title,content
20250511,[EPL현장라인업]손흥민 돌아왔다! 7경기 결장 후 복귀! 토트넘 선발 라인업 발표,"[토트넘홋스퍼스타디움(영국 런던)=이건 스포츠조선닷컴 기자]손흥민(토트넘)이 크리스탈팰리스전에 나선다. 일단은 벤치에서 출발한다.

토트넘은 11일 오후 영국 런던 토트넘 홋스퍼 스타디움에서 크리스탈팰리스와 2024~2025시즌 잉글랜드 프리미어리그(EPL) 36라운드 경기를 치른다. 이 경기를 앞두고 토트넘은 선발 라인업을 발표했다. 로테이션에 들어갔다. 토트넘은 16일 오후 애스턴빌라 원정 경기를 치른다. 그리고 21일 스페인 빌바오에서 맨유와 유로파리그 결승전을 치르게 된다. 이를 대비해 주전 선수들을 아꼈다.

킨스키가 골문을 지킨다. 센터백에는 단조와 데이비스가 나선다. 좌우 풀백에는 스펜스와 포로가 출전한다. 허리에는 사르와 그래이, 벤탕쿠르가 뒨다. 공격에는 클루셰프스키, 텔, 오도베르가 출격한다. 손흥민은 판 더 벤, 로메로 등과 함께 서브 명단에 이름을 올렸다.

손흥민의 출전 명단 포함은 이미 예고됐다. 경기를 하루 앞둔 10일 포스테코글루 감독은 손흥민에 대해 ""내일 경기에서 손흥민이 조금 이라도 뛰길 반 쯤 기대하고 있다""고 말했다. 이어 ""돌아올 수 있는 선수는 손흥민이 유일하다""고 덧붙였다. 손흥민은 7경기를 결장했다. 경기 감각을 올릴 필요가 있다. 경기 상황에 따라 투입될 것으로 보인다."
20250511,"김민재, 빅리그 우승천재 됐다… 마이스터샬레 번쩍! 세리에A 이어 분데스리가도 정복한 괴물 수비수","(엑스포츠뉴스 윤준석 기자) 바이에른 뮌헨의 '괴물 수비수' 김민재가 분데스리가 우승을 자축하는 공식 세리머니에서 팀 동료들의 격려를 받으며 우승 트로피를 들어 올렸다.

시즌 막판 부상으로 전력에서 이탈했지만, 헌신적인 활약으로 팀의 정상 탈환에 크게 기여한 그는 독일 무대에서 첫 우승을 경험하며 또 하나의 이정표를 세웠다.

뮌헨은 11일(한국시간) 독일 뮌헨 알리안츠 아레나에서 열린 2024-2025시즌 독일 분데스리가 33라운드 경기에서 보루시아 묀헨글라트바흐에 2-0으로 승리했다.

전반 31분 해리 케인의 선제골과 후반 45분 마이클 올리세의 쐐기골로 승리를 장식한 뮌헨은 승점 79(24승 7무 2패)를 기록하며 분데스리가 우승을 더욱 공고히했다.

경기 전부터 이미 우승을 확정한 뮌헨은 이날 경기에서 완승을 거두며 마지막 홈 경기에서 팬들과 함께 우승의 기쁨을 나눴다.



이날 경기에 출전하지 않은 김민재는 부상으로 남은 시즌 경기에 결장할 예정이다.

독일 현지 언론 보도에 따르면 뱅상 콤파니 뮌헨 감독은 김민재의 회복을 위해 남은 일정을 배제하기로 결정했고, 다가오는 클럽 월드컵부터 다시 출전할 예정이다.

김민재는 이번 시즌 중반부터 아킬레스건염과 감기 증세, 허리 통증 등으로 고통받으면서도 리그 27경기에 출전하며 후방 수비의 중심 역할을 수행해왔다.

김민재의 시즌 누적 출전 시간은 팀 내 필드 플레이어 중 두 번째로 많은 것으로 알려졌으며, 이에 대해 국제프로축구선수협회(FIFPRO)도 우려를 표한 바 있을 정도로 강행군을 이어왔다.

하지만 이러한 헌신에도 불구하고 우승 확정 직후 뮌헨이 구단 공식 유튜브 채널에 올린 우승 축하 영상 대표 사진(섬네일)에 김민재의 모습이 누락되며 논란이 불거졌다.
김민재는 이번 시즌 리그 우승의 주역임에도 불구하고 포스터에서 제외됐고, 일부 팬들 사이에서는 인종차별 의혹까지 제기됐다.

팬들의 항의가 이어지자 구단은 해당 사진을 교체했고, 사회관계망서비스(SNS)에 김민재를 축하하는 별도의 게시물을 게재하며 ""이번 시즌의 헌신, 첫 분데스리가 우승을 진심으로 축하한다""며 수습에 나섰다.

또 해당 게시물에는 한국 전통 궁궐 배경 이미지에 김민재가 트로피를 든 포스터를 추가 공개하며 논란을 진화하려는 시도를 이어갔다.



하지만 해당 논란이 무색하게 이번 우승 트로피 세리머니에서는 김민재의 존재감이 굉장했다.

뮌헨이 구단 홈페이지를 통해 공개한 해당 세리머니 영상 속, 김민재의 동료 선수들은 누구보다 그를 인정했고 우승 세리머니에서 그들의 진심이 드러났다.

이번 시즌을 끝으로 팀을 떠나는 뮌헨 레전드 토마스 뮐러부터 케인, 에릭 다이어 등은 김민재를 앞으로 밀어내며 트로피를 들어 올릴 것을 적극 권유했다.

김민재는 잠시 머뭇거리다 동료들의 격려에 마침내 '마이스터샬레'라고 불리는 분데스리가 우승 트로피를 번쩍 들어 올렸다. 팀 내 여섯 번째로 트로피를 든 그는 우승의 기쁨을 웃음으로 표현했다.

김민재는 자신의 수줍은 성격을 증명하기라도 하듯, 영상 대부분에서 다소 소극적인 모습을 보였다. 하지만 뮐러와 같은 아시아 동료 선수인 이토 히로키 등과 함께 사진을 찍는 등 동료들과 기쁨을 나누는 모습이 포착되기도 했다.



김민재에게 이번 우승은 유럽 무대에서의 연속적인 커리어 하이라이트다.

지난 시즌 뮌헨으로 이적하기 전에 이탈리아 세리에A 나폴리 소속으로 33년 만의 리그 우승을 이끈 그는 올해 독일 분데스리가 정상에 오르며 한국인 최초로 유럽 5대 리그 중 두 리그에서 우승을 경험한 선수가 됐다.

비록 시즌 중반 이후 부상과 컨디션 문제로 출전이 줄었지만, 시즌 전체를 통틀어 뮌헨 수비진에서 가장 안정적인 모습을 보였다는 평가가 주를 이룬다.

시즌 내내 비판의 중심에 서 있었지만, 실제로는 수비 동료들의 잦은 부상 속에서 가장 꾸준히 팀을 지탱한 선수가 김민재였다는 분석이다.

이제 김민재의 다음 목표는 FIFA 클럽 월드컵과 다음 시즌을 위한 준비가 될 예정이다.

지난 달 까지만 해도 그를 둘러싼 이적설이 계속 피어올랐지만, 현재는 살짝 소강 상태이다. 이번 시즌 김민재의 활약을 감안한다면 뮌헨 구단 내부에서도 김민재에 대한 신뢰가 여전히 굳건할 것으로 보이며 콤파니 감독 역시 다음 시즌에도 그를 핵심 수비 자원으로 계획하고 있을 가능성 또한 적지 않을 것으로 보인다.

김민재는 부상 치료를 마치고 여름 클럽 월드컵을 앞두고 컨디션을 끌어올릴 예정이다. 유럽 최정상급 수비수로 입지를 굳힌 그는 이제 아시아 수비수의 위상을 넘어, 세계 무대에서 새로운 전설을 써 내려가고 있다.



한편, 이날 세리머니에서는 또 다른 상징적인 장면도 연출됐다. 이번 시즌을 끝으로 은퇴를 선언한 뮐러가 주인공이었다.

2000년부터 뮌헨 유소년 팀에서 자란 그는 정규리그 13회, 포칼 6회, 챔피언스리그 2회 우승 등 숱한 영광을 안긴 '원클럽맨'이다.

주장이 가장 먼저 트로피를 들어올리는 전통과 다르게, 마누엘 노이어로부터 트로피를 건네 받은 뮐러는 팀 내에서 가장 먼저 팀의 환호 속에서 마지막 우승 트로피를 들어 올렸다.

콤파니 감독도 자신의 우승 메달을 뮐러에게 걸어주며 레전드에 대한 존경을 표했다.

사진=바이에른 뮌헨"
20250511,"울버햄튼 감독이 황희찬 공개 저격, ""훈련 후 불평만 한다""…브라이튼전도 결장","페레이라 감독/게티이미지코리아
황희찬/게티이미지코리아

[마이데일리 = 김종국 기자] 황희찬이 결장한 울버햄튼이 브라이튼 호브&알비온에 완패를 당했다.

울버햄튼은 10일(현지시간) 영국 울버햄튼 몰리뉴스타디움에서 열린 브라이튼과의 2024-25시즌 프리미어리그 36라운드에서 0-2로 졌다. 울버햄튼은 이날 패배로 12승5무19패(승점 41점)의 성적으로 리그 14위에 머물게 됐다. 황희찬은 근육 부상으로 인해 이날 경기 엔트리에서 제외되며 결장했다.
울버햄튼은 브라이튼을 상대로 쿠냐가 공격수로 나섰고 게데스와 무네트시가 공격을 이끌었다. 안드레와 주앙 고메스는 중원을 구성했고 누리와 세메두가 측면에서 활약했다. 토티 고메스, 아그바두, 도허티는 수비를 맡았고 골문은 호세 사가 지켰다.

브라이튼은 웰벡이 공격수로 출전했고 민테, 오라일리, 램프티가 공격을 이끌었다. 아야리와 발레바는 허리진을 구축했고 에스투피냔, 웹스터, 반 헤케, 위버가 수비를 책임졌다. 골키퍼는 페르브뤼헌이 출전했다.

양팀의 맞대결에서 브라이튼은 전반 29분 웰벡이 페널티킥 선제골을 터트렸다. 전반전을 앞서며 마친 브라이튼은 후반 40분 그루다가 페널티에어리어 왼쪽에서 왼발 로빙 슈팅으로 추가골을 기록했고 브라이튼의 승리로 경기가 종료됐다.

브라이튼의 페레이라 감독은 지난 9일 클럽 인터뷰를 통해 황희찬에 대해 언급했다. 페레이라 감독은 ""황희찬은 환상적인 선수라고 생각한다. 좁은 공간에서도 빠르고 지능적으로 움직인다. 기술이 뛰어나고 마무리 능력도 갖췄다""면서도 ""우리는 올 시즌 두 명의 스트라이커를 가동하지 않고 있다. 우리는 한 명의 스트라이커를 놓고 경기하고 라르센이 골을 넣고 있다""고 전했다. 또한 ""지금까지 좋은 컨디션에도 기회를 주지 못한 선수들이 있다. 나는 선수들에게 솔직해야 한다. 지금은 황희찬에게 기회를 줄 여유가 없다. 스트라이커가 자신감을 얻기 위해선 출전 시간이 필요하고 골도 넣고 스스로 중요한 선수라는 것을 느껴야 한다. 하지만 쉬운 일은 아니다""고 덧붙였다.

페레이라 감독은 브라이튼전을 마친 후 황희찬에 대해 재차 언급했다. 페레이라 감독은 영국 버밍엄월드를 통해 ""황희찬은 지난 2주 동안 불평만했다. 한 번 훈련하고, 두 번 훈련하고, 세 번 훈련한 후 황희찬은 불평했다""면서도 ""우리는 황희찬이 필요하다. 라르센은 최상의 컨디션이 아니다""고 전했다.
황희찬./게티이미지코리아
황희찬/게티이미지코리아"
20250511,"'아약스 황금세대'→'몸값 99% 추락' 비극의 주인공, 또 무너졌다...""수술로 4~5개월 결장 예정""","사진=트위터 캡처
사진=판더비크 SNS 캡처
[스포츠조선 이현석 기자]도니 판더비크가 다시 부상으로 무너졌다.

스페인의 마르카는 10일(한국시각) '판더비크가 4~5개월가량 결정할 예정이다'라고 보도했다.

마르카는 '판더비크는 발꿈치와 아킬레스건 부상으로 수술을 받았다. 소식에 따르면 판더비크는 4~5개월 동안 결장해야 할 것으로 확인됐다. 동료들과 얼마나 빨리 프리시즌에 함께할 수 있을지는 아직 알 수 없다. 판더비크는 올 시즌 지로나에서 주도적인 역할도 했으나, 성적은 아쉬웠다'라고 전했다.

AFP연합뉴스
판더비크는 한때 프랭키 더용, 율리엔 팀버, 하킴 지예흐와 함께 네덜란드 아약스 황금세대를 대표하는 최고의 유망주 중 한 명이었다. 그는 텐하흐 감독이 아약스를 이끌던 시절 엄청난 활약을 펼치며 2018~2019시즌 아약스의 유럽챔피언스리그 4강 진출을 이끌기도 했다.

아약스 시절 판더비크는 중원에서의 왕성한 활동량과 동료를 활용하는 지능적인 플레이, 침투 능력 등이 큰 관심을 받으며 빅클럽들의 관심을 받았다. 판더비크에게 가장 먼저 손을 내민 팀은 맨유였다. 맨유는 2020~2021시즌을 앞두고 판더비크를 영입하며 중원을 강화했다.

AFP연합뉴스
하지만 맨유에서 판더비크의 선수 경력을 꺾이고 말았다. 아약스에서 보여준 능력은 찾을 수 없었다. 부상과 부진이 겹치며 어려움을 겪었고 2021~2022시즌에는 겨울 이적시장에서 에버턴 임대라는 반등 기회를 노렸지만, 크게 달라지지 않았다. 2022~2023시즌 텐하흐 감독의 맨유 부임으로 달라질 것이라는 기대가 다시 등장했지만, 효과는 없었다. 텐하흐 감독도 부상으로 자주 이탈한 판더비크를 기용하지 않고 카세미루, 크리스티안 에릭센, 스콧 맥토미니 등을 더 자주 선발로 내세웠다. 사실상 판더비크를 포기했다.

출전을 원했던 판더비크는 2023~2024시즌 겨울 이적시장에서 임대를 택했다. 분데스리가 아인트라흐트 프랑크푸르트가 손을 내밀며 기회를 얻었다. 하지만 프랑크푸르트에서도 반등은 없었다. 1300만 유로(약 200억원)의 완전 이적 옵션을 가졌던 프랑크푸르트는 이를 실행하지 않고 그대로 판더비크를 돌려보냈다.

AFP연합뉴스
판더비크는 지난해 여름 맨유가 판매를 결정하며 아주 싼 이적료로 지로나 이적이 성사됐다. 유럽축구 이적시장 전문가 파브리치오 로마노 기자는 당시 '판더비크의 이적료는 50만 유로(약 7억원)로 추가적인 보너스 조항이 있지만, 충족되지 못한다면 맨유는 단 1%의 이적료만을 회수할 수 있다'라고 밝혔었다.

지로나에서 판더비크는 반등의 기미를 보였다. 시즌 초반 많은 기회를 받으며 지로나 주전 선수로 활약하기 시작했다. 하지만 활약은 오래가지 못했다. 지로나의 부진과 함께 판더비크도 다시 무너졌다. 판더비크는 부상 직전 3경기에서는 38분 출전에 그쳤다. 이런 상황에서 장기 부상까지 당하며, 차기 시즌 판더비크가 지로나에서 계속 활약할 수 있을지 여부도 장담하기 어렵게 됐다.

아약스 황금세대에서 최악의 선수로 추락하게 된 판더비크가 이번 부상을 극복하지 못한다면 그의 선수 경력은 더욱 급격하게 꺾일 수 있을 전망이다.

이현석 기자 digh1229@sportschosun.com"
20250511,"[bundes.review] '빛바랜 7호 도움' 이재성 꿈의 무대 좌절…마인츠, 보훔전 4-1 완승에도 'UCL 진출 실패'","사진=게티이미지


[포포투=박진우]

도움을 적립하며 시즌 7골 7도움을 달성한 이재성. 아쉽게도 끝내 유럽축구연맹(UEFA) 챔피언스리그(UCL) 진출에 실패했다.

마인츠는 10일 오후 10시 30분(한국시간) 독일 보훔에 위치한 루르슈타디온에서 열린 2024-25시즌 독일 분데스리가 33라운드에서 보훔에 4-1로 승리했다. 이로써 마인츠는 승점 51점으로 6위로 올라섰지만, 같은 시간 '4위' 프라이부르크가 승리하며 승점 55점이 됐다. 마인츠는 남은 1경기에서 승리해도 프라이부르크와의 격차를 따라 잡을 수 없게 됐고, 그대로 UCL 진출이 좌절됐다.
마인츠는 3-4-2-1 포메이션을 가동했다. 부르카르트, 이재성, 네벨, 음웨네, 아미리, 사노, 카시, 핸슈-올센, 벨, 다 코스타, 리스가 선발 출격했다. 홍현석은 벤치에서 시작했다.

보훔은 3-1-4-2 포메이션을 내세웠다. 보아두, 마수라스, 비텍, 시소코, 베로, 파슬락, 크라우스, 베르나르도, 오르데츠, 외어만, 호른이 선발로 나섰다.

사진=마인츠


[전반전] 전반 종료 직전 '아미리 환상 FK골'...같은 시간 '4위' 프라이부르크 1-1 전반 종료

경기 포문은 마인츠가 열었다. 전반 1분 네벨의 패스를 받은 부르카르트가 박스 우측에서 오른발 슈팅을 시도했지만 골키퍼가 막아냈다. 보훔도 곧바로 반격했다. 전반 2분 측면에서 비텍이 올린 크로스를 보아두가 다이렉트 슈팅으로 연결했지만 수비벽에 막혔다.

마인츠가 위기를 넘겼다. 전반 22분 보훔이 박스 부근에서 슈팅을 시도했는데, 이를 벨이 걷어냈다. 그러나 공은 골문으로 향했고, 골문 바로 위를 살짝 스치며 자책골 위기를 넘겼다.

기세를 올린 마인츠였지만 결정력이 아쉬웠다. 전반 32분 박스 우측에서 네벨이 공을 잡았고, 그대로 오른발 슈팅을 시도했지만 골문을 크게 벗어났다. 전반 36분 네벨은 다시 한 번 박스 중앙에서 왼발 슈팅을 연결했지만 수비에 막혔다.

마인츠가 땅을 쳤다. 전반 42분 문전 혼전 상황, 부르카르트가 강한 오른발 슈팅을 시도했는데 이재성의 발에 맞고 튕겨 나왔다. 흐른 공을 다시 한 번 부르카르트가 왼발 슈팅으로 연결했지만 이번에는 수비벽에 막혔다.

전반 추가시간은 1분이 주어졌고, 마인츠의 원더골이 터졌다. 마인츠의 프리킥 상황, 키커로 아미리가 나섰다. 아미리는 환상적인 오른발 감아차기 슈팅을 시도했고, 공은 수비벽을 살짝 넘겨 환상적인 포물선을 그리며 골망에 꽂혔다. 그렇게 전반은 마인츠의 1-0 리드로 끝났다.

사진=게티이미지


[후반전] '빛바랜 이재성 7호 도움' 마인츠 4-1 승리했지만 '챔스 진출 실패'

이재성이 UCL의 꿈을 살렸다. 후반 8분 박스 우측에서 공을 잡은 이재성이 반대편으로 쇄도하는 음웨네에게 정확한 침투 패스를 내줬다. 음웨네가 이를 침착하게 마무리하며 2-0까지 격차를 벌렸다.

이재성과 홍현석이 바톤 터치를 했다. 후반 16분 마인츠는 이재성, 음웨네를 빼고 홍현석, 위드머를 투입하며 중원에 안정감을 불어 넣었다. 이재성은 1도움을 기록, 61분을 소화하며 경기를 마무리 했다.

마인츠가 또다시 격차를 벌렸다. 후반 28분 박스 부근에서 아미리가 터치한 공을 부르카르트가 이어 받았다. 부르카르트는 곧바로 대포알 중거리 슈팅을 시도했고, 공은 골키퍼 손 끝에 스치며 골망을 흔들었다. 마인츠가 3-0까지 격차를 벌렸다.

홍현석의 움직임이 빛났다. 후반 33분 홍현석이 박스 우측으로 빠져 들어갔고, 문전으로 쇄도하는 부르카르트를 향해 날카로운 컷백 크로스를 올렸다. 부르카르트가 방향만 바꾸는 슈팅으로 연결했지만, 아쉽게 득점으로 이어지지 않았다.

보훔이 뒤늦게 추격했다. 후반 39분 박스 안에서 컷백 크로스를 이어 받은 홀트만이 그대로 왼발 다이렉트 슈팅으로 연결하며 골망을 갈랐다. 보훔이 1-3으로 추격했다.

후반 추가시간은 3분이 주어졌고, 마인츠는 레벨의 득점이 터졌다. 경기는 마인츠의 4-1 승리로 끝났다. 이로써 마인츠는 승점 51점으로 6위로 올라섰지만, 같은 시간 '4위' 프라이부르크가 승리하며 승점 55점이 되며 UCL 진출이 좌절됐다.

사진=마인츠


#포포투 코리안리거 소식"
20250511,"'KIM은 자격있다'…뮐러-케인-다이어가 인정한 김민재, 한국인 사상 최초 마이스터샬레 번쩍","김민재/스카이스포츠
김민재/게티이미지코리아


[마이데일리 = 김종국 기자] 바이에른 뮌헨의 분데스리가 우승 주역으로 활약한 김민재가 우승 세리머니와 함께 팀 동료들과 즐거운 시간을 보냈다.

바이에른 뮌헨은 11일 독일 뮌헨 알리안츠아레나에서 묀헨글라드바흐를 상대로 2024-25시즌 분데스리가 33라운드 홈경기를 치렀다. 올 시즌 마지막 홈경기를 치른 바이에른 뮌헨은 묀헨글라드바흐에 2-0 완승을 거둔 가운데 경기 후 올 시즌 분데스리가 우승 세리머니를 진행했다.

바이에른 뮌헨은 올 시즌 초반부터 분데스리가 선두를 질주했고 올 시즌 분데스리가 2경기를 남겨 놓은 지난 5일 올 시즌 분데스리가 조기 우승을 확정했다. 바이에른 뮌헨은 지난 시즌 무관에 그친 가운데 김민재는 바이에른 뮌헨 입성 두 번째 시즌 리그 우승에 성공했다.
바이에른 뮌헨 선수단이 시상대에 오른 가운데 주장 노이어가 분데스리가 우승 트로피 마이스터샬레를 들고 등장했고 올 시즌 후 팀을 떠나는 뮐러에게 마이스터샬레를 전달했다. 뮐러는 팀 동료들 앞에서 마이스터샬레를 들어 올리며 함께 환호했다. 이어 뮐러는 케인에게 마이스터샬레를 전달했고 케인은 마이스터샬레를 들어 올리며 무관탈출 기쁨을 동료들과 함께했다. 케인에 이어 다이어가 등장했고 이어 올리세가 마이스터샬레를 이어받는 등 화기애애한 분위기가 이어졌다.

분데스리가 우승 세리머니가 이어진 가운데 뮐러, 케인, 다이어는 김민재가 마이스터샬레를 들어올릴 수 있도록 배려했다. 다이어는 머뭇거리는 김민재 유니폼 상의를 멱살을 잡듯이 강하게 잡아당기며 김민재를 선수단 앞으로 내보냈고 케인과 뮐러 역시 김민재를 떠밀며 우승 세리머니에서 조명받을 수 있도록 배려했다. 바이에른 뮌헨 선수단 앞에 나선 김민재는 동료들 앞에서 마이스터샬레를 번쩍 들어 올리며 분데스리가 우승 기쁨을 만끽했다.

김민재는 올 시즌 분데스리가 27경기에 출전해 바이에른 뮌헨의 우승 주역으로 활약했다. 시즌 중반 이후 아킬레스건 통증을 참고 경기에 나선 김민재는 혹사 우려에도 불구하고 바이에른 뮌헨 수비 버팀목으로 활약했다.

김민재는 지난 2022-23시즌 나폴리에서 이탈리아 세리에A 우승에 성공했고 독일 분데스리가 우승에도 성공했다. 김민재는 한국 선수로는 사상 최초로 유럽 5대리그 중 2개 이상의 리그에서 우승에 성공한 선수로 이름을 남기게 됐다.
김민재, 뮐러, 이토/게티이미지코리아
김민재/게티이미지코리아


김민재는 바이에른 뮌헨의 분데스리가 우승 확정 이후 경기에 나서지 않고 있다. 독일 매체 푸스발트랜스퍼스는 7일 '김민재는 올 시즌 바이에른 뮌헨에서 더 이상 분데스리가 경기에 출전하지 않을 예정이다. 바이에른 뮌헨의 콤파니 감독은 부상 문제로 인해 김민재가 올 시즌 남은 두 경기에서 휴식을 취하기로 결정했다'며 '김민재는 올 여름 열리는 클럽월드컵을 대비해 몸을 완벽하게 단련할 시간을 가질 것으로 예상된다. 김민재는 몇 달 동안 아킬레스건염과 발 문제를 겪었고 최근에는 자신의 기량을 발휘하지 못했다'고 언급했다.

김민재는 지난달 분데스리가 사무국이 발표한 2024-25시즌 올해의 팀 후보에 이름을 올리며 맹활약을 인정받았다. 분데스리가는 김민재에 대해 '2024-25시즌 바이에른 뮌헨 수비에서 중심적인 역할을 했다. 김민재의 피지컬, 정확한 패스와 태클 능력은 자신을 올해의 팀 후보로 합당하게 만들었다'고 전했다.

김민재는 다양한 이적설과 함께 올 시즌 종료 이후 거취가 주목받고 있다. 바이에른 뮌헨은 다음달 15일 오클랜드시티를 상대로 국제축구연맹(FIFA) 클럽월드컵 첫 경기를 치른다.

바이에른 뮌헨은 우파메카노, 데이비스, 이토 등 시즌 아웃 판정을 받았던 수비수들의 클럽 월드컵 활약이 불투명하다. 올 시즌 종료 후 모나코 이적이 사실상 확정된 다이어도 클럽 월드컵 출전이 확정되지 않았다. 바이에른 뮌헨은 올 시즌 종반 수비수 부족으로 고전한 가운데 클럽월드컵에서도 김민재에 대한 의존도가 높을 전망이다.
김민재/게티이미지코리아"
