date,title,content
20250731,"'충격' 토트넘의 깜짝 이적! 'GOOD BYE' 매디슨…꾸준함 부족이 원인→""제안오면 매각 열려 있다""","사진=토트넘
<저작권자(c) 연합뉴스, 무단 전재-재배포, AI 학습 및 활용 금지>
[스포츠조선 강우진 기자]제임스 매디슨이 토트넘을 떠날 수 있다는 주장이 제기됐다.

영국 TBR풋볼은 30일(한국시각) ""제임스 매디슨이 토트넘을 떠날 가능성을 배제할 수 없다""라고 보도했다. 이는 이번 여름 이적시장 토트넘의 영입 전략을 바탕으로 나온 주장이다.

매체는 ""토트넘 홋스퍼의 이번 여름 이적 전략은 외부에서 보기엔 다소 이상하게 보일 수도 있다. 이미 오른쪽 날개와 공격형 미드필더에서 뛸 수 있는 모하메드 쿠두스를 영입했다. 이 두 포지션은 현재 토트넘이 선수층이 두터운 자리다""라며 ""쿠두스를 영입한 이후 토트넘은 또다시 10번 역할에서 강점을 보이는 모건 깁스-화이트 영입을 시도했다. 토트넘은 이미 공격형 미드필더 자리에서 뛰어난 기량을 가진 여러 선수를 보유하고 있어, 이러한 영입 시도들은 다소 기이하게 느껴졌다""라고 전했다.

<저작권자(c) 연합뉴스, 무단 전재-재배포, AI 학습 및 활용 금지>
<저작권자(c) 연합뉴스, 무단 전재-재배포, AI 학습 및 활용 금지>
<저작권자(c) 연합뉴스, 무단 전재-재배포, AI 학습 및 활용 금지>
토트넘의 이러한 영입시도 배경에는 제임스 매디슨이 있다는 이야기가 나온다.

이적시장 전문가 벤 제이콥스는 최근 ""제임스 매디슨이 토트넘을 떠날 수도 있다""고 주장했다.

제이콥스는 ""토트넘이 매디슨을 밀어내려는 것은 아니지만, 적절한 제안이 들어올 경우 이적을 고려할 수 있다""라며 ""제임스 매디슨에 대해 깜짝 이적 가능성이 존재한다. 그를 억지로 내보내려는 것은 아니지만, 구단은 제안이 들어오면 들을 의향은 있다""라고 말했다.
또 그는 ""지난 시즌 매디슨은 들쭉날쭉한 활약을 보였고, 때때로 체력 문제도 겪었다. 정상이었을 때조차 꾸준함이 부족했다""라며 ""그렇기에 적절한 금액의 제안이 있다면 이를 무시하지 않을 수도 있다. 단, 그를 이적시장에 내놓거나 방출할 계획은 없다. 계획에 있는 이적은 아니지만, 가격이 맞다면 고려할 수 있다""라고 설명했다.

매디슨은 지난 시즌 꾸준한 활약을 보이진 못했다. 벤치에서 시작하는 경기도 일부 있었다. 팀 전체가 침체된 상황에서 고립되는 장면이 여러번 연출됐다. 그럼에도 탈압박 능력을 바탕으로 눈에 띄는 플레이를 여러차례 보여주기도 했다.

<저작권자(c) 연합뉴스, 무단 전재-재배포, AI 학습 및 활용 금지>
<저작권자(c) 연합뉴스, 무단 전재-재배포, AI 학습 및 활용 금지>
창의적인 능력은 토트넘이 매디슨을 놓지 말아야 하는 이유다. 이적설이 나오는 것 자체가 있을 수 없는 일이라는 의견도 나온다.

매체는 ""토트넘이 제임스 매디슨을 이번 여름 이적시킬 수도 있다는 소식은 꽤 이상하게 들린다""라며 ""물론 토트넘은 지난 시즌 형편없는 경기력을 보였지만, 매디슨은 그 안에서도 높은 평가를 받은 선수 중 하나였다. 그의 기록은 토트넘에서 뛰어난 활약을 펼쳤음을 입증한다""라고 했다.

매디슨은 2024~2025시즌 프리미어리그에서 팀 내 득점 2위, 도움 2위를 기록했다. 현재 팀이 어려운 상황임을 고려하면, 이런 창의적인 선수를 잃는 건 매우 부담스러운 일이다. 새로운 프랭크 감독 체제에서 매디슨이 다시 빛을 볼 수 있을지 아니면 깜짝 이적이 성사될지 팬들의 관심이 쏠리고 있다."
20250731,"역대급 '오피셜' 공식발표 뜬다…""토트넘, 손흥민 1년 재계약 준비""","▲ 손흥민 ⓒ연합뉴스/AFP


[스포티비뉴스=박대성 기자] 손흥민(33, 토트넘 홋스퍼)의 거취가 새로운 전환점을 맞이했다. 미국 메이저리그사커(MLS) LA FC와 강력하게 연결되고 이지만 토트넘 잔류 시나리오가 떠올랐다. 토트넘이 1년 재계약을 추진할 예정이다.

영국 매체 '팀토크'는 31일(한국시간) ""토트넘이 손흥민에게 1년 계약 연장을 준비 중이다. 인터 마이애미와 LA FC가 손흥민을 주요 타깃으로 삼고 있는 가운데, 토트넘은 손흥민의 가치를 보호하고 이적료를 확보하기 위해 계약을 1년 연장할 계획이다""라고 보도했다.
손흥민은 2015년 토트넘에 입단한 이래 팀의 간판 공격수로 활약해왔다. 올해 초 토트넘이 연장 옵션을 발동하면서 2026년 6월 계약이 종료 예정이다. 영국 '타임즈'에 따르면, 손흥민이 토트넘 추가 재계약을 거절했다고 알려져 향후 재계약 여부가 명확하지 않았다. 특히 이번 여름, MLS의 LA FC가 손흥민 측과 조건 협상에 돌입하며 이적이 급물살을 타는 듯했다.

유럽축구 이적시장 전문가 '파브리시오 로마노'는 지난 24일 ""LA FC가 손흥민에게 공식 제안을 했다. 아직 초기 단계지만 손흥민과 토트넘의 결정만 남았다""고 알리면서 ""손흥민은 프랭크 감독과 대화한 뒤 자신의 거취를 정할 것""이라며 결정권이 선수 본인에게 있다고 전했다.



영국 '기브미스포츠'에서 활동하는 벤 제이콥스 기자는 ""LA FC가 손흥민과 조건 협상에서 마무리 단계에 들어섰다""고 밝히며 이적 가능성에 불을 지폈다. LA FC 단장이 손흥민을 영입하기 위해 영국을 직접 방문했다는 보도까지 나오며, 협상은 현실화되는 분위기였다.

하지만 며칠 사이 분위기는 급반전됐다. 토트넘의 토마스 프랭크 신임 감독이 손흥민의 잔류를 암시하는 발언을 하면서 손흥민을 향한 토트넘의 신뢰가 다시 한번 확인됐다.

프랭크 감독은 아시아 투어(홍콩, 한국)를 떠나기 직전, 프리미어리그 전문 유튜브 채널 '맨 인 블레이저스'와의 인터뷰에서 ""손흥민의 업적은 대단하다. 그는 훌륭한 사고방식과 리더십을 갖춘 선수다. 다음 시즌 팀에서 아주 중요한 역할을 할 것""이라고 밝혔다. 첫 부임 공식 인터뷰에서 손흥민의 이름조차 거론하지 않았던 것과는 달리, 공개적으로 손흥민의 역할을 강조한 것이다.

이어 프랭크 감독은 ""손흥민은 이 팀의 핵심 자원이며, 지난 10년간 토트넘의 최고 선수 중 한 명이었다. 지금도 훈련을 훌륭하게 소화하고 있고, 지난 친선 경기에서도 좋은 모습을 보였다. 그의 장점은 언제든 골을 넣을 수 있는 능력이며, 그런 위치에 배치하는 것이 중요하다""며 전술적 핵심으로 기용할 계획임을 명확히 했다.

이와 함께 토트넘 전담 기자 잭 피트 브루크 또한 긍정적인 전망을 내놨다. 그는 '라스트 워드 온 스퍼스'에 출연해 ""토트넘은 손흥민이 원한다면 1년 더 함께할 가능성이 높다. 그의 선택에 달렸다. 구단은 손흥민의 결정을 존중할 것""이라고 밝혔다.

잭 기자는 ""지금으로서는 손흥민이 떠나도, 남아도 놀랍지 않을 상황이지만, 개인적으로는 잔류 가능성이 더 크다고 본다. 아직 협상 시간은 충분하다""고 덧붙였다.



이처럼 프랭크 감독과 토트넘 내부 관계자들 모두 손흥민의 팀 내 입지를 재확인하고 있다. 이는 손흥민이 홍콩을 포함한 아시아 투어에서 보여준 압도적인 팬심과 영향력 덕분이기도 하다. 토트넘은 손흥민을 앞세운 아시아 투어에서 폭발적인 반응을 얻었고, 이는 구단의 상업적 가치와 직결된다.

실제로 영국 '풋볼런던'은 ""홍콩에서 팬들에게 가장 많이 연호된 이름은 손흥민이었다. 팬들은 경기 후에도 끝까지 그를 외쳤다""고 전하며 손흥민의 글로벌 인기와 영향력을 재조명했다. 이 같은 인기 덕분에 토트넘이 손흥민을 계약상으로도 활용할 수밖에 없는 상황이라는 분석도 뒤따른다.

다만 '팀토크'는 ""토트넘이 손흥민에게 1년 이상의 장기 계약을 제안할 가능성은 낮다""고 보도하면서도 ""1년 재계약은 현실적인 방안이며, 이후 내년 여름 이적료를 확보할 수 있는 길을 열어둔 전략적 선택이 될 수 있다""고 평가했다.

이제 모든 시선은 손흥민 본인의 입에 쏠리고 있다. 8월 3일 한국에서 열리는 뉴캐슬 유나이티드와 프리시즌 경기에 출전할 예정이다. 영국 'BBC' 등이 뉴캐슬 유나이티드전 이후 손흥민의 미래가 확실하게 알려질 것이라고 전망한 점을 짚어보면, 경기 후 공식 기자회견 또는 믹스트존(공동취재구역) 인터뷰를 통해 향후 거취에 대한 입장을 밝힐 것으로 보인다.

손흥민이 마지막까지 토트넘과 함께할지, 아니면 새로운 도전을 향해 미국이나 중동으로 향할지는 아직 미지수다. 하지만 분명한 것은, 그가 어떤 결정을 내리더라도 팀과 팬들은 그의 선택을 존중하고 박수를 보낼 준비가 되어 있다는 점이다."
20250731,"""개에게 생식기 물려 병원 이송"" 前 바르셀로나 유망주, 절체절명 위기 봉착! ""6바늘 봉합, 수술 검토 중""","[SPORTALKOREA] 김경태 기자= 전 바르셀로나 출신 유망주 카를레스 페레스가 개한테 생식기를 물리는 끔찍한 사고를 당했다.

스페인 매체 '마르카'는 31일(한국시간) ""페레스가 개에게 생식기를 물리는 사고를 당해 병원에 입원했다. 다행히 중상은 아니지만, 당분간 복귀는 어려울 전망이다. 그리스 현지 매체에 따르면, 사고는 개 두 마리를 떼어놓으려다 발생한 것으로 알려졌다""고 보도했다.

이어 ""현재 페레스는 병원에서 경과 관찰 중이며, 총 6바늘을 꿰맨 상태""라고 설명했다.



1998년 스페인에서 태어난 페레스는 바르셀로나 라 마시아 출신으로 일찌감치 두각을 드러냈다. 차츰 실력을 갈고 닦은 페레스는 2019년 5월 SD 에이바르전에 출전하며 1군 데뷔전을 치렀다.

같은 해 8월엔 레알 베티스 발롬피에를 상대로 첫 골을 기록하기도 했으며, 유럽축구연맹(UEFA) 챔피언스리그에서도 인터밀란을 상대로 선제골을 터뜨려 존재감을 드러냈다.



다만 키케 세티엔 감독 체제에서 중용받지 못한 페레스는 더 많은 출전 기회를 보장받기 위해 2020년 1월 AS 로마로 떠났다. 

바르셀로나에서 보여줬던 퍼포먼스를 감안하면 반등을 충분히 기대해볼 수 있었으나, 페레스는 기회를 살리지 못했다. 결국 로마를 떠나 2022년 8월 셀타 데 비고로 이적했다.



셀타 데 비고에서도 페레스는 아쉬움을 남겼다. 두 시즌 간 57경기 출전해 8골 7도움에 그쳤고, 전력 외 판정을 받은 페레스는 현재 헤타페를 거쳐 그리스의 아리스 테살로니키로 임대 떠난 상황이었다.

시살상 이번 아리스 임대가 페레스의 커리어를 되살릴 기회로 여겨졌지만, 예상치 못한 부상으로 향후 몇 주간의 계획은 모두 중단됐다. '마르카'에 따르면 훈련 복귀 시점도 정해지지 않았으며, 수술 가능성도 검토 중인 것으로 알려졌다.

사진=게티이미지코리아, 아리스 테살로니키

취재문의 sportal@sportalkorea.co.kr"
20250731,"‘이 정도면 환불사유 아니냐?’ 손흥민, 홍콩경기 충격의 20분 교체출전…토트넘, 아스날에 1-0 승리","[사진] ⓒGettyimages(무단전재 및 재배포 금지)


[OSEN=서정환 기자] 주장 손흥민(33, 토트넘)이 충격의 20분 교체출전을 했다. 

토트넘은 31일 오후 8시(한국시간) 홍콩 카이탁 스타디움에서 개최된 숙명의 라이벌 아스날과 친선전에서 파페 사르의 결승골을 지켜 1-0으로 승리했다. 토마스 프랭크 감독 부임 후 첫 북런던 더비에서 승리했다. 

충격적이지만 손흥민이 선발에 없고 양민혁과 함께 벤치멤버에 포함됐다. 손흥민은 후반 32분 교체로 들어가 20분 정도 짧게 뛰었다. 손흥민은 골맛을 보지 못했다. 양민혁은 결장했다. 

4-2-3-1의 토트넘은 히샬리송을 최전방에 두고 윌손 오도베르, 루카스 베리발, 모하메드 쿠두스의 2선이었다. 로드리고 벤탄쿠르, 페페 사르가 중원을 지휘하고 제드 스펜스, 미키 반 더 벤, 크리스티안 로메로, 페드로 포로의 수비였다. 골키퍼는 굴리엘모 비카리오가 맡았다. 

[사진] ⓒGettyimages(무단전재 및 재배포 금지)


4-3-3의 아스날은 마르티넬리, 카이 하베르츠, 부카요 사카의 스리톱으로 맞섰다. 데클란 라이스, 뇌르고르, 외데고르의 중원에 루이스 스켈리, 키비오르, 살리바, 화이트의 수비였다. 골키퍼는 라야가 맡았다. 

손흥민은 양민혁과 함께 벤치서 대기했다. 최고스타인 손흥민이 선발로 나오지 않아 홍콩 팬들이 실망한 기색이 역력했다. 손흥민은 홍콩에서도 최고 인기스타다. 토트넘은 30일 카이탁 스타디움에서 오픈 트레이닝을 실시했다. 토트넘 선수들을 가까이서 보기 위해 입장권을 구입해 많은 팬들이 경기장을 찾았다. 

북런던 더비가 홍콩에서 열렸다. 최고인기스타는 손흥민이었지만 아스날을 응원하는 홍콩팬들도 많이 보였다. 라이벌전이 홍콩에서 재현됐다. 

[사진] ⓒGettyimages(무단전재 및 재배포 금지)


두 팀의 명성과 달리 답답한 경기였다. 두 팀 모두 화끈하게 주고받는 모습이 아니라 소극적으로 경기를 운영했다. 0-0 상황에서 전반전 마지막 손흥민이 사이드라인에서 몸을 풀었다. 관중석에서 함성이 터졌다. 왜 손흥민이 뛰지 않느냐는 메시지였다. 

몸싸움은 거칠었다. 벤탄쿠르는 전반 41분 위험한 반칙으로 옐로카드를 받았다. 손흥민 대신 나선 오도베르는 결정적 기회에서 넘어지는 등 미숙한 경기력을 보였다. 

전반 45분 기다리던 첫 골이 터졌다. 파페 사르가 하프라인 부근에서 공을 빼앗아 골키퍼가 나온 것을 보고 그대로 때린 장거리 슈팅이 골이 됐다. 라야 골키퍼의 실책이었다. 프랭크 감독도 환하게 웃었다. 토트넘이 전반전을 1-0으로 리드했다. 

[사진] ⓒGettyimages(무단전재 및 재배포 금지)


후반전이 시작됐지만 손흥민의 모습은 보이지 않았다. 프랭크 감독이 계속 손흥민 없이 경기를 운영했다. 손흥민 출전을 당연시했던 홍콩팬들이 술렁이기 시작했다. 

아스날도 반격했다. 후반 13분 마르티넬리가 박스 앞에서 좋은 기회를 잡았지만 슈팅이 어이없이 골대를 넘었다. 
후반 17분 드디어 토트넘이 선수를 교체했다. 하지만 손흥민이 아니라 케빈 단소, 마티스 텔, 브레넌 존슨이 들어갔다. 홍콩팬들이 실망하는 기색이 역력했다. 손흥민은 사이드라인에서 계속 몸을 풀며 뛸 의지가 있었지만 감독이 투입을 하지 않았다. 

손흥민은 후반 32분 드디어 그라운드를 밟았다. 아스날은 후반 32분 빅토르 요케레스를 투입해 승부를 걸었다. 앙리의 14번을 물려받은 요케레스의 데뷔전이었다. 

[사진] ⓒGettyimages(무단전재 및 재배포 금지)


손흥민이 공에 다가서기만 해도 홍콩팬들의 엄청난 함성이 터졌다. 그만큼 대부분의 팬들이 손흥민을 보기 위해 왔다고 해도 과언이 아니었다. 손흥민이 후반 38분 드리블을 하면서 폭풍질주를 하자 엄청난 환호성이 나왔다. 

후반 39분 매디슨과 그레이까지 교체로 투입됐다. 토트넘은 한 골을 지키지 않고 더 공격적으로 나갔다. 손흥민이 후반 44분 공을 잡았지만 아스날 수비가 두터워 위협적인 장면은 연출하지 못했다. 

추가시간 7분이 주어졌다. 후반 51분 좌측에서 공을 잡은 손흥민이 드리블하면서 역습을 주도했다. 엄청난 환호성이 터졌다. 손흥민이 올려준 크로스가 제대로 슈팅까지 연결되지 못했다. 체력이 고갈된 두 팀은 다소 늘어진 경기운영 끝에 경기를 마무리했다. 어느 팀 팬들도 좋아하지 못할 경기내용이었다. 

[사진] ⓒGettyimages(무단전재 및 재배포 금지)


홍콩팬들은 최고스타 손흥민의 활약을 보려고 비싼 입장권을 사서 경기장을 찾았다. 손흥민이 스크린에 잡히기만 해도 함성이 터졌다. 하지만 프랭크 감독은 손흥민을 겨우 20분 뛰게 했다. 여러모로 뒷말이 무성할 수밖에 없는 경기였다. / jasonseo34@osen.co.kr "
20250731,"'韓 축구 쾌거!' 이강인, 비로소 미래 거취 드러났다! ""PSG 이적 제안 3건 접수, 모두 불충분 판단""→잔류 가능성↑","[SPORTALKOREA] 김경태 기자= 한때 크고 작은 이적설에 휘말렸던 이강인이 파리 생제르맹(PSG) 잔류로 가닥이 잡히고 있다.

PSG 소식을 주로 전하는 프랑스 매체 'VIPSG'는 30일(한국시간) ""PSG는 이강인에게 도착한 이적에 제안이 3건이나 있을 정도로 선택권이 있었으나, 구단은 거절했다""고 밝혔다.



당초 또 다른 프랑스 매체 'PSG 인사이드 악투'의 보도를 인용 ""PSG의 보드진은 최근 이강인에 대한 이탈리아, 사우디아라비아, 튀르키예에 구체적인 영입 제시를 세 건이나 접수했지만, 모두를 불충분하다고 판단했다""고 설명했다.

이강인은 2024/25시즌 막바지부터 이적설의 중심에 올라섰다. PSG에서 리그 1, 쿠프 드 프랑스, 트로페 데 샹피옹, 유럽축구연맹(UEFA) 챔피언스리그에서 우승컵을 석권하며 '쿼드러플'을 달성하는 기염을 토했다.



다만 개인 성적은 아쉬웠다. 49경기 7골 6도움을 기록하긴 했으나, 대부분의 출전은 로테이션에 그쳤고, 확고한 주전이라고 판단하기엔 무리가 있었다.

그도 그럴 것이, 떠오르는 신예 데지레 두에와 브래들리 바르콜라는 매서운 성장세를 보여주며 치고 올라왔으며 이들 외에도 이미 PSG는 초호화 공격진을 보유하고 있었기 때문이다.



차기 행선지로 페네르바흐체 비롯해 알 나스르까지 언급되기 시작했다. 특히 올여름 이적시장에서 케빈 더브라위너를 품을 정도로 과감한 행보를 보이고 있는 SSC 나폴리와 급속도로 연결되기 시작했다.

근접했던 나폴리 이적설로 시들해지면서 잔류로 가닥이 잡히고 있다. 이강인의 PSG 이적을 최초 보도할 정도로 높은 공신력을 가진 마테오 모레토 기자는 지난달 파브리치오 로마노 기자의 유튜브 채널에 출연해 ""이강인의 나폴리행 가능성은 낮다. PSG는 그를 핵심 자원으로 보고 있다""고 설명한 바 있다. 



PSG 내부 사정에 정통한 기자 로맹 콜레 고댕 기자에 따르면 PSG는 이강인의 이적료로 3,000만 유로(약 477억 원)를 요구하고 있었다.

다만 PSG를 만족시킬 적절한 제안이 오지 않았다는 점, 적절한 대체자를 못 찾았다는 것이 주된 사안으로 떠오르며 현재 이강인 PSG에서 남을 가능성이 점차 높아지고 있는 상황이다.

사진=파리 생제르맹, 게티이미지코리아

취재문의 sportal@sportalkorea.co.kr"
20250731,"英 단독 보도! 토트넘, '여름 이적설' 손흥민 7번 뺏을까? ""1800억 먹튀 영입전 선두""...""선수도 런던 이적 원해""","사진=트위터 캡처
AP연합뉴스
[스포츠조선 이현석 기자]토트넘이 손흥민의 자리를 대체할 수 있는 선수 영입에 나섰다.

영국의 기브미스포츠는 30일(한국시각) 단독보도를 통해 '토트넘이 잭 그릴리시 영입에 상당한 노력을 쏟고 있다'라고 보도했다.

기브미스포츠는 '그릴리시는 기회가 있다면 런던으로 이적하는 것을 원하고 있다. 유럽챔피언스리그 진출로 인해 토마스 프랭크의 토트넘은 그릴리시 영입전에서 웨스트햄에 앞서며 선두다. 토트넘은 그릴리시에 대해 이미 문의했으며, 공식 제안을 통해 관심을 구체화 한다면 그릴리시를 영입할 가능성이 큰 것으로 알려졌다'고 전했다.

로이터연합뉴스
지난 2021년 잉글랜드 선수 역대 최고 이적료를 기록하며 1억 파운드(약 1800억원)에 맨체스터 시티로 향했던 그릴리시는 최근 이적 가능성이 커지고 있다. 애스턴 빌라에서 보여줬던 엄청난 기량과 달리 부진이 거듭되며 맨시티는 그릴리시의 매각을 고려 중이다.

첫 시즌 부침을 겪었던 그릴리시는 2022~2023시즌 맨시티의 트레블 달성과 함께 유럽챔피언스리그, 리그, FA컵을 가리지 않고 활약하며 다시 기대감을 끌어 올렸다. 하지만 2023~2024시즌 그릴리시는 다시 벤치로 돌아가는 시간이 늘어났고, 제레미 도쿠에게 자리를 뺏기며 좀처럼 반등하지 못했다.

2024년을 득점 없이 마칠 정도로 심각했다. 그릴리시는 2023년 12월 16일 이후 2025년 1월 12일 살포드와의 FA컵 경기까지 1년이 넘는 시간 동안 단 하나의 득점도 기록하지 못하며 많은 비판을 받기도 했다. 올 시즌도 여전히 뚜렷한 반등은 보여주지 못했다.

로이터연합뉴스
여러 팀이 올여름 그릴리시에게 관심을 보이고 있으며, 그중 한 팀이 토트넘이다. 토트넘은 당초부터 손흥민의 대체자로 그릴리시를 원한다고 알려졌다. 지난겨울 이적시장에서도 그릴리시가 토트넘의 영입 후보로 거론됐으나, 협상이 이뤄지지는 않았다. 올여름 이적시장에서는 맨시티를 떠날 가능성이 커지며 토트넘 이적에 대한 기대감이 높아지고 있다.

다만 걸림돌은 그릴리시의 높은 연봉이다. 기브미스포츠는 '그릴리시는 맨시티와 주당 30만 파운드 수준의 계약을 체결했다. 웨스트햄은 선수 영입을 원했지만, 해당 금액을 지불할 수 없다. 토트넘은 그에게 제안을 할지 고민하고 있다'고 했다. 30만 파운드는 토트넘 최고 주급자인 손흥민의 19만 파운드를 훨씬 상회하는 금액이다. 토트넘이 그릴리시의 연봉을 모두 지불할 수 있을지는 미지수다.

로이터연합뉴스
한편 그릴리시가 토트넘으로 온다면, 올여름 이적 가능성이 거론되는 손흥민이 팀을 떠나고 등번호 7번을 넘겨줄 가능성도 존재한다. 손흥민은 이번 여름 이적시장이 열린 후 미국 메이저리그사커 이적 가능성이 꾸준히 나오고 있다. 일부 영국 언론은 '그릴리시는 7번 유니폼을 주목하고 있을 것이다. 손흥민은 이적설이 제기됐다. 그릴리시는 토트넘으로 이적한다면 7번 유니폼을 자기 것으로 만들려고 할 것이다'라고 주장한 바 있다."
