date,title,content
20250425,"'흥민아 미안해!' 포스테코글루 감독, EPL 깜짝 이적…승격팀 러브콜 터졌다","(엑스포츠뉴스 윤준석 기자) 안지 포스테코클루 토트넘 홋스퍼 감독이 시즌 종료 후 경질될 가능성이 높은 현재, 그의 차기 행선지에 대한 추측이 벌써 등장하고 있다.

시즌 초반 기대를 모았던 포스테코글루 감독은 현재 팀 성적 부진과 내부 신뢰 하락으로 인해 여름 경질 가능성이 제기되고 있으며, 심지어 유럽축구연맹(UEFA) 유로파리그 우승 여부와 무관하게 팀을 떠날 수 있다는 전망까지 나오고 있다.

최근 복수의 현지 언론은 포스테코글루 감독은 UEFA 유로파리그 우승을 차지하더라도 시즌 종료 후 토트넘에서 경질될 수 있다며 다니엘 레비 토트넘 회장이 감독 교체를 심각하게 검토 중이라고 보도했다.

토트넘은 2007-2008시즌 이후 처음으로 프리미어리그 하위권 마감을 앞두고 있고 현재 리그 16위라는 구단 역사상 최악의 프리미어리그 성적으로 시즌 마무리를 앞두고 있는 상황이다.





하지만, 글로벌 축구 전문 매체 '포포투'의 25일(한국시간) 보도에 따르면, 포스테코글루 감독은 토트넘에서 경질당하더라고 프리미어리그를 떠나지 않을 수도 있다.

최근 잉글랜드 2부 리그 챔피언십에서 승격을 확정지은 리즈 유나이티드가 현 사령탑 다니엘 파르케 감독을 교체하고 새 감독 선임을 추진 중이며, 그 대안 중 하나로 포스테코글루 감독이 거론되고 있기 때문이다.
매체는 영국 '데일리 익스프레스'의 보도를 인용, ""리즈가 파르케 감독을 경질할 가능성을 진지하게 검토 중이며, 포스테코글루를 차기 사령탑 후보로 검토하고 있다""고 전했다.

이어 '데일리 메일'의 보도를 인용, ""리즈 구단주단이 파르케의 과거 프리미어리그 성적에 의구심을 품고 있으며, 기존 성과만으로는 프리미어리그 생존을 보장할 수 없다고 판단했다""면서 프리미어리그에서 검증된 감독을 선임하겠다는 리즈 구단의 입장을 설명했다.

파르케 감독은 올 시즌 리즈를 프리미어리그로 복귀시키는 데 성공했지만, 그의 과거 노리치 시절 프리미어리그 성적은 좋지 않았다. 2019-2020시즌에는 승점 21점으로 최하위를 기록했고, 이듬해 11라운드까지 승점 5점에 머물며 경질됐다.

이에 따라 리즈의 미국계 구단주인 '49ers 엔터프라이즈'는 보다 확실한 생존을 책임질 수 있는 인물을 물색 중이며, 포스테코글루 감독의 이름이 그 후보군에 포함돼 있다는 주장이다.



포스테코글루 감독 역시 현재 최악의 성적을 기록하고 있지만 그가 후보로 거론되는 이유는 바로 그의 전술적 스타일이다.

포스테코글루는 셀틱, 요코하마 마리노스, 호주 대표팀 등에서 쌓은 공격적인 전술 철학과 리더십을 인정받아 토트넘에 부임했으며, 지난 시즌에는 비교적 약체로 평가된 스쿼드로도 UEFA 챔피언스리그 진출권에 근접한 성과를 낸 바 있다.

그의 전술은 과거 리즈 팬들에게 강한 인상을 남긴 마르셀로 비엘사 전 감독과 유사한 스타일로 평가받는다. 이에 따라 '포포투'는 ""포스테코글루가 리즈의 고강도, 하이 프레싱 스타일을 다시 살릴 수 있는 적임자라는 평가도 있다""고 설명했다.

그러나 리즈와 포스테코글루의 연결 가능성에 대해 '포포투'는 다소 회의적인 시각도 덧붙였다. 포스테코글루 감독이 보다 상위권 팀을 맡고 싶어할 것이라는 입장이다.

매체는 ""포스테코글루가 리즈에 갈 가능성은 낮아 보이며, 그 역시 더 나은 유럽 구단들의 제안을 기다릴 것""이라며 ""리즈는 재정 부담, 전력 보강 한계, 승격 구단 특유의 불안정성을 감안할 때 매력적인 목적지는 아니다""라고 분석했다.



리즈는 파르케 감독의 성과에도 불구하고 교체 여부를 신중히 검토 중인 것으로 보인다. 파르케 감독이 시즌 초반 성적 부진을 보일 경우 시즌 도중 성급하게 감독을 교체하는 것보다 시즌 종료 전부터 차근차근 차기 시즌을 준비하겠다는 마음가짐이다.

리즈의 다음 시즌 계획에는 재정적 제약도 따른다. 프리미어리그 생존을 위해서는 이적 시장에서 1억 파운드(약 1909억원) 이상이 필요할 것으로 보이나, PSR(수익성과 지속 가능성 규정)을 충족시키기 위해 선수 판매가 필수적이라는 시각이 존재한다.

리즈의 다음 시즌이 본격적으로 시작되기도 전에 불안한 미래가 예상되는 이유다.

토트넘과 리즈, 두 팀 모두 감독 교체라는 기로에 선 가운데, 포스테코글루 감독의 향후 선택이 프리미어리그의 또 다른 변수가 될 가능성이 커지고 있다.

사진=연합뉴스"
20250425,"'기성용 후배된다' 김민재, 뉴캐슬로 이적하는 이유 ""수비진 보강 원한다""…첼시와 영입 경쟁 펼친다","[스포티비뉴스=이민재 기자] 김민재(바이에른 뮌헨)가 프리미어리그로 팀을 옮기게 될까.

영국 매체 '커트오프사이드'는 25일(이하 한국시간) ""뉴캐슬 유나이티드가 김민재에 대한 관심을 드러냈다""라고 보도했다.

이어 ""뉴캐슬은 이번 여름 많은 돈을 쓸 예정이다. 중앙 수비수 보강을 원한다. 2024년에는 마크 게히(크리스탈 팰리스)를 놓쳤고, 현재 스쿼드를 더 강화하기 위해 노력할 예정이다""라고 덧붙였다.

또한 ""뉴캐슬은 세 시즌 만에 두 번째로 유럽축구연맹(UEFA) 챔피언스리그 진출권 확보를 위해 노력하고 있다. 그렇게 된다면 이적 시장에서 더 많은 선수를 데려올 수 있다""라고 전했다.

'풋볼 인사이더'에 따르면 전 스카우트 믹 브라운은 뉴캐슬이 김민재를 타깃으로 두고 있다고 언급했다.

그는 ""뉴캐슬은 현재 위치에서 더 나아가고자 한다. 그들은 최근 좋은 성적을 거두며 마침내 트로피를 획득했고, 챔피언스리그 진출 가능성도 높아 보인다. 하지만 에디 하우 감독은 여전히 수비 라인을 강화할 필요가 있다고 느낀다""라고 말문을 열었다.



그러면서 ""스벤 보트만은 부상으로 불운을 겪었고, 댄 번은 훌륭한 활약을 펼쳤지만 유럽 무대 수준의 수비수는 아니며, 파비안 셰어는 나이가 적지 않다. 그래서 뉴캐슬은 수비진을 개선해야 할 부분으로 보고 있으며, 이번 여름 이를 실행에 옮기고자 한다""라고 언급했다.

브라운은 김민재를 강력하게 추천했다. 그는 ""김민재는 좋은 선택이 될 수 있다. 맨체스터 유나이티드는 김민재가 바이에른 뮌헨으로 이적하기 전에 관심을 보였고, 그는 바이에른 뮌헨에서 좋은 활약을 펼쳤지만, 최근 그가 이적 시장에 나올 수 있다는 소문이 들리고 있다""라고 언급했다.
그는 ""뉴캐슬에 풍부한 노하우와 엘리트 레벨의 경험을 가져다줄 것이며, 이는 어떤 팀에게나 큰 자산이다. 게다가 그는 견고한 수비수이고, 프리미어리그로 이적에 관심이 있을 것으로 보인다. 그래서 뉴캐슬이 그를 영입하기 위해 노력할 가능성이 크다""라고 강조했다.

뉴캐슬만 관심이 있는 게 아니다. '커트오프사이드'는 ""첼시 역시 이번 여름 김민재 영입에 관심을 보이고 있는 것으로 전해졌다. 챔피언스리그 진출을 노리는 두 프리미어리그 구단 간 흥미로운 경쟁이 펼쳐질 수 있다""라고 내다봤다.

최근 김민재의 이적설이 뜨거워지고 있다. 독일판 '스카이스포츠' 플로리안 플라텐버그 기자의 보도부터 시작됐다. 그는 ""김민재는 바이에른 뮌헨에서 절대적인 핵심 선수로 간주되지 않고 있다. 구단은 그를 적극적으로 매각하려는 계획은 없지만, 이번 여름 이적 시장에서 들어오는 제안을 검토할 의향이 있다""라고 밝혔다.



또한 ""만약 김민재가 팀을 떠난다면, 바이에른 뮌헨은 그 자금으로 재투자를 진행할 계획이다. 김민재가 남는다면, 바이에른 뮌헨은 현재 그를 포함해 다요 우파메카노, 이토 히로키, 에릭 다이어, 요시프 스타니시치와 함께 다음 시즌 센터백 라인을 구성할 계획을 세우고 있다""라고 덧붙였다.

이후 프랑스 매체 '풋 메르카토'는 ""나폴리에서 바이에른 뮌헨으로 이적한 지 2년 만에 김민재가 새로운 도전을 향할 가능성이 생겼다. 소식통에 따르면 김민재는 이번 여름 이적의 문을 열었다. 첼시와 뉴캐슬을 포함한 여러 프리미어리그 팀들이 이미 그의 에이전트와 잠재적 이적에 대해 논의했다""라고 보도했다.

이어 ""세리에 A의 한 클럽도 김민재에 관심을 표명했지만, 현재 2028년까지 바이에른 뮌헨과 계약된 그는 새로운 리그로 이적을 선호하고 있다. 소식통에 따르면, 프리미어리그가 그의 최우선 선택지 중 하나다""라고 덧붙였다.

이탈리아 매체 '가제타 델로 스포르트'도 ""유벤투스는 올여름 수비진 강화를 계획하고 있다. 김민재가 바이에른 뮌헨을 떠나기로 결정할 경우, 유벤투스는 김민재 영입에 관심이 있다""라고 밝혔다.

바이에른 뮌헨은 김민재와 함께하고 싶어 하는 마음이 있다. 그러나 그를 원하는 구단이 있다면 적절한 금액에 떠나보낼 계획이다. 세계적인 수비수로 자리 잡은 그를 원하는 구단이 많아질 터. 여기서 이적료 경쟁이 붙는다면 바이에른 뮌헨은 김민재 매각을 통해 현금 확보에 나설 전망이다.

김민재는 이번 시즌 바이에른 뮌헨 수비에 핵심적인 역할을 맡고 있다. 안정적인 수비력과 공을 연결하는 빌드업 능력은 바이에른 뮌헨의 경기 운영에 필수적이다.



지난해 11월 FIFA 산하의 국제스포츠연구소(CIES)는 올 시즌 최고의 경기력을 보이는 센터백 10인을 선정했다. CIES는 자체 지표로 경기력을 분석해 김민재에게 100점 만점에 91.1점을 매겼다. 이는 전 세계 센터백 중 최고 점수다.

그러나 헌신적으로 경기에 나서면서 부상이란 악재가 찾아왔다. 김민재는 지난해 10월 아인트라흐트 프랑크푸르트와 경기 이후 발목 통증과 아킬레스건 염증에 시달려왔다. 당시부터 부상을 안고 경기를 소화해왔던 김민재는 겨울 휴식기에도 염증이 완전히 해소되지 못한 것으로 보인다.

그럼에도 김민재는 쉴 생각이 없다. 그는 ""벤치에 앉아 있는 것보다 차라리 뛰는 게 낫다. 팀을 위해 무언가 할 수 있다면 최선을 다하겠다. 동료들은 내가 파이터라는 걸 알고 있다. 최대한 자주 출전해 팀에 도움이 되고 싶다""라고 강조했다. 그는 진통제를 맞으면서 경기에 나선 바 있다.

그러나 계속된 강행군 속에 실수가 잦아지고 있다. 인터 밀란과 유럽축구연맹(UEFA) 챔피언스리그 8강 1, 2차전에서 실점의 빌미를 제공했고, 도르트문트전에서도 마찬가지였다.

경기 후 막스 에베를 단장은 김민재를 비판했다. 에베를 단장은 ""김민재의 실수다. 그는 상대를 놓쳤다. 그전까지는 매우 좋은 경기를 했다. 그러나 그는 실점 상황을 알고 있었다""라고 말했다.

김민재는 아킬레스건 부상을 안고 뛰고 있다. 그러나 에베를 단장에게는 변명거리에 불과하다. 그는 ""시즌 막판에 모든 선수들이 100% 상태가 아니다. 하지만 우리가 그를 투입할 수 없다는 것은 아니다""라고 밝혔다."
20250425,"'토트넘, 뉴캐슬에 1-6 패배' 대참사 원흉, 어디서 뭐하나 봤더니...콘테와 다시 한번 승승장구→감독은 안 어울려","[스포티비뉴스=장하준 기자] 역시 감독직은 어울리지 않는 것일까.

이탈리아 세리에A의 나폴리가 2년 만의 우승에 도전한다. 2022-23시즌 나폴리는 김민재와 빅터 오시멘, 흐비차 크바라츠헬리아 등 핵심 선수들의 활약과 루치아노 스팔레티 감독의 공격 전술에 힘입어 33년 만의 세리에A 우승 트로피를 들어 올렸던 바 있다.

하지만 우승 직후 핵심 수비수인 김민재가 바이에른 뮌헨으로 떠났다. 덕분에 나폴리는 지난 시즌 추락을 거듭했다. 스팔레티 감독도 비슷한 시기에 나갔고, 이후 뤼디 가르시아 감독이 새로 지휘봉을 잡았지만 부진의 늪에 빠지며 경질됐다. 그리고 나폴리는 지난 시즌에만 총 3명의 감독과 함께하는 등 시행착오를 겪었다. 결국 지난 시즌을 10위로 마무리했다.
이에 나폴리는 결단을 내렸다. 이번 시즌을 앞두고 우승 청부사라 불리는 안토니오 콘테 감독을 선임했다. 콘테 감독은 과거 인터밀란, 첼시 등을 이끌고 여러 대회 우승을 차지했던 바 있다.

콘테 감독과 손을 잡은 나폴리는 승승장구하고 있다. 현재 나폴리는 리그 21승 8무 4패(승점 71)로 2위에 올라 있다. 1위 인터밀란과 승점은 같지만, 득실 차에서 밀려 2위에 자리 중이다.

이처럼 콘테 감독은 지난 시즌 부진했던 나폴리를 다시 상위권으로 올려놓았다. 우승 시즌에 함께했던 김민재, 오시멘, 크바라츠헬리아 없이 이뤄낸 쾌거다. 콘테 감독을 필두로 한 나폴리의 코칭 스태프는 엄청난 능력을 발휘하고 있다.



그리고 콘테 사단의 핵심 중 한 명은 토트넘 홋스퍼 팬들에게 익숙한 인물이다. 바로 크리스티안 스텔리니 수석 코치가 콘테 사단에 소속되어 있다. 그는 토트넘 시절에 이어 다시 한번 콘테 감독과 손을 잡은 뒤 나폴리의 상승세를 이끌고 있다.

이탈리아 국적의 스텔리니 수석 코치는 2021년 콘테 감독과 함께 토트넘에 입성했다. 이후 콘테 감독은 부진한 토트넘을 바로잡은 뒤, 팀을 4위에 올려놓으며 유럽축구연맹 챔피언스리그(UCL) 티켓을 선물했다.

하지만 2022-23시즌 들쑥날쑥한 경기력을 선보였다. 결국 콘테 감독은 토트넘 수뇌부와 마찰을 일으킨 뒤, 시즌 도중 사임했다. 그의 뒤를 이어 스텔리니 수석 코치가 임시 지휘봉을 잡았다.

그러나 그는 콘테 감독과 다를 것이 없었다. 특히 해당 시즌 프리미어리그 32라운드 뉴캐슬 유나이티드전에서 토트넘이 기존에 사용하던 백3 대신 백4를 깜짝 공개했다. 결과는 참담했다. 토트넘은 뉴캐슬 원정에서 전반에만 5골을 내주며 무너졌다. 이 경기는 결국 1-6, 토트넘의 패배로 끝났다. 경기가 끝난 후 스텔리니 수석 코치는 곧바로 경질됐다. 토트넘 팬들 입장에서 이 경기는 여전히 악몽으로 남아 있다.

이처럼 콘테 감독과 함께 나란히 토트넘에서 굴욕을 겪은 스텔리니는 나폴리의 수석 코치로 활동하며 다시 한번 승승장구하고 있다. 역시 감독보단 수석 코치직에 어울리는 인물이다."
20250425,"김민재, 韓 16번째 프리미어리거 실패 유력...첼시 이적설 완전 박살→애초에 타깃도 아니었다","사진=Chelsea super club
[스포츠조선 김대식 기자]첼시는 김민재를 노리지 않고 다른 수비수 타깃을 노리고 있는 것으로 보인다.

최근 김민재의 첼시행 이적설은 많은 화제가 되고 있는 중이다. 지난 주말 프랑스 풋 메르카토의 산티 아우나 기자는 ""김민재는 이번 여름에 팀을 떠날 수 있는 가능성을 열어뒀다. 첼시와 뉴캐슬을 포함한 몇몇 프리미어리그(EPL) 구단들이 이미 김민재의 에이전트와 잠재적인 이적에 대해서 이야기를 나눴다. 이탈리아 세리에A 리그 구단들도 관심을 표명했다. 김민재는 새로운 리그 이적을 선호하며 EPL이 그가 선호하는 행선지다""고 보도했다. 아우나 기자는 이적시장 전문가 중 한 명이다.
<저작권자(c) 연합뉴스, 무단 전재-재배포, AI 학습 및 활용 금지>
이후 파브리시오 로마노 기자는 24일(이하 한국시각) 개인 SNS를 통해 ""김민재는 클럽과 선수 모두에게 좋은 제안이 있을 경우 여름에 바이에른을 떠날 수 있는 진지한 가능성이 있다. 김민재는 대체불가능한 존재가 아니다. 유럽 여러 구단들이 이 상황을 파악하고 있다""고 전했다. 첼시가 김민재를 노리고, 김민재가 EPL행을 원한다면 충분히 이뤄질 수 있는 이적처럼 보였다.

하지만 첼시가 노리는 수비수는 김민재가 아니었다. 영국 텔레그래프는 23일 '첼시는 본머스 수비수 딘 하위선 영입 경쟁에서 우위를 점하고 있다. 이는 엔조 마레스카 첼시 감독에게 큰 힘이 될 것이다'고 전했다.
<저작권자(c) 연합뉴스, 무단 전재-재배포, AI 학습 및 활용 금지>
매체는 '하위선은 계약서에 5000만파운드(약 950억원)의 바이아웃 조항이 있다. 첼시는 하위선 영입 경쟁에서 선두를 달리고 있다. 마레스카 감독은 웨슬리 포파나를 도우면서, 동시에 포파나를 부상으로 잃었을 때 공백을 채울 수 있는 볼을 잘 다루는 센터백을 영입하길 원하고 있다. 하위선은 리버풀, 레알 마드리드를 포함한 여러 구단으로부터 관심을 받고 있는 중이지만 첼시가 바이아웃 금액을 지불할 준비가 됐다'고 설명했다.

하위선은 이번 시즌에 떠오른 차세대 월드 클래스 수비수다. 본머스에서 정말로 뛰어난 활약을 보여주면서 빅클럽들의 마음을 사로잡았다. 아직 수비력에 있어서는 개선점이 필요하다는 지적을 받고 있지만 빌드업 실력은 이미 정상급이라는 평가다. 주전 등극 1시즌 만에 스페인 국가대표로도 발탁될 정도로 성장세가 빠르다.
<저작권자(c) 연합뉴스, 무단 전재-재배포, AI 학습 및 활용 금지>
첼시는 하위선 에이전트와 이미 우호적인 관계까지 만들었을 정도로 영입에 속도를 내고 있는 중이다. 그래도 하위선 경쟁이 치열한 만큼 첼시도 영입을 100% 확신할 수는 없는 상황. 이에 첼시는 다른 대안까지도 준비해놓고 있었다. 하지만 그 명단에 김민재는 없었다.

텔레그래프는 '첼시는 다른 수비수 영입 대상도 가지고 있다. 아약스의 조렐 하토와 에버튼의 제러드 브랜스웨이트가 예시다. 첼시가 다른 곳에서도 찾아보기로 결정한다면 마크 게히는 여전히 매력적인 선택지'라고 설명했다.

독일 스포르트 빌트에서 일하는 크리스티안 폴크 기자도 아직까지 김민재 영입을 위해 실질적인 움직임을 가져간 구단이 없다고 밝힌 바 있다. 첼시가 하위선 영입을 마무리한다면 김민재의 첼시행은 없을 것으로 예상된다.

<저작권자(c) 연합뉴스, 무단 전재-재배포, AI 학습 및 활용 금지>

김대식 기자 rlaeotlr2024@sportschosun.com"
20250425,"[속보] 獨 유력 매체 발표! 손흥민, 바이에른 뮌헨은 이제 끝…'연봉 삭감 역제안' 사네와 재계약 곧 발표","[스포티비뉴스=조용운 기자] 이달까지 손흥민(33, 토트넘 홋스퍼)을 둘러쌌던 바이에른 뮌헨 이적설은 이제 완전히 사그라들 전망이다. 뮌헨이 측면 공격수를 새로 영입하기보다 현재 자원과 재계약을 하는 쪽으로 결론을 내린 모양새다.

독일 매체 '빌트'는 25일(한국시간) 자체 팟캐스트인 '바이에른 인사이더'를 통해 ""뮌헨이 르로이 사네와 계약 연장에 합의했다""며 ""새로운 계약은 다음 주에 공식 체결된다""고 밝혔다.
구체적인 계약 기간도 알려졌다. 빌트에 따르면 2028년 6월까지 재계약이 이뤄지며 사네의 향후 연봉은 1,000만 유로(약 163억 원)다. 옵션으로 500만 유로(약 81억 원)가 달려 사네의 최대 임금은 연간 1,500만 유로(약 244억 원)가 될 전망이다.

사네의 연봉 삭감 제시가 통했다. 현 계약상 사네는 2,000만 유로(약 326억 원)를 수령하는 것으로 알려졌다. 그런데 뮌헨이 사네와 계약 연장에 소극적인 태도를 보이자 먼저 급여를 내릴 생각이 있다고 전달했다. 결국 기본 연봉이 절반이 되는 상황이 됐지만 뮌헨에서 3년 더 뛸 수 있는 방안을 택했다.

사네가 뮌헨에 남게 되면서 조금씩 줄어들던 손흥민 이적설에도 마침표가 확실하게 찍혔다. 손흥민이 지금의 발목 부상을 당하기 직전만 해도 이슈는 뮌헨 이적설이었다.

앞서 독일 지역지 'TZ'는 ""뮌헨은 사네가 떠날 경우 손흥민을 이상적인 대체 후보라 생각한다""고 보도했다. 원 출처로 스페인의 '피차헤스'를 꼽았다. 이들의 공신력이 부족하다고 알려졌으나 손흥민의 뮌헨 이적설이 반복해서 보도된 건 해리 케인의 존재가 컸다. 토트넘에서 케인과 영혼의 파트너로 호흡을 맞췄던 손흥민이기에 번졌던 이적설이다.



그도 그럴 것이 손흥민과 케인 조합은 검증이 끝났다. 둘은 토트넘에서 무려 54골을 합작했다. 잉글랜드 프리미어리그만 따졌을 때는 47골을 합작해 역대 최다 듀오 득점으로 남아있다. 이 기간 손흥민과 케인은 각각 23골과 24도움을 기록하며 팀의 공격 선봉에서 최고의 호흡을 자랑했다. 케인은 손흥민과 함께한 순간들을 추억하며 ""그와 함께 뛰는 것은 나에게 큰 자부심이었다""라고 말했다.

그래서 손흥민 팬들은 바이에른 뮌헨으로 이적해 마지막 불꽃을 태우길 원하는 바람이 불분명한 이적설을 낳았다. 독일에서도 손흥민의 영입이 현실적으로 가능한지 타진할 정도였다. 독일 축구에서 공신력이 높은 크리스티안 폴크 기자가 지난 6일 ""뮌헨의 손흥민 영입설은 근거가 없다. 당장 공격수를 영입할 여유가 없다""라고 일축했다.



작게나마 남아있을 불씨도 이제 꺼졌다. 이적설의 배경이 된 사네가 떠날 경우 손흥민이 영입된다는 명제가 시작부터 성사되지 않는다. 사네는 뮌헨에 남기 위해 간절함을 표한 것으로 보인다. 빌트는 ""사네의 재계약은 수개월 동안 이어졌다. 그러는 사이 잉글랜드 프리미어리그로 이적 가능성도 점쳐졌다""며 ""그러나 사네는 뮌헨에 남기로 했고, 최고 연봉자 지위를 포기하는 것으로 강력한 메시지를 전달했다""고 했다.

이어 ""뮌헨의 고위층은 사네와 계약을 원했다. 막스 에베를 단장과 크리스토프 프로인트 스포츠 디렉터 모두 협상을 적극적으로 추진했다. 헤르베르트 하이너 회장 역시 '사네는 이곳에서 매우 편안하다'는 말로 재계약을 예고했다""며 ""이러한 진행 상황은 사네가 맨체스터 시티에서부터 뱅상 콤파니 감독과 함께한 관계 덕분이기도 하다""고 덧붙였다.

한편 손흥민은 부상 회복에 박차를 가하고 있다. 프랑크푸르트와 유럽축구연맹 유로파리그 8강 1차전 도중 살인태클을 당한 여파로 발목에 통증을 느낀 손흥민은 이후 울버햄튼 원더러스, 프랑크푸르트와 2차전, 노팅엄 포레스트전까지 쉬었다. 토트넘은 28일 예정된 리버풀전 출전 여부를 살피고 있다."
