date,title,content
20250427,"[속보]'대한민국 최고 철벽' 김민재(28세, 맨체스터 유나이티드) 초대박! 'EPL 입성' 희망 청신호...""지난해 여름부터 구애""+""판매 준비 완료""","사진=트위터 캡처
AP연합뉴스
AP연합뉴스
[스포츠조선 이현석 기자]김민재가 다가오는 여름 맨체스터 유나이티드 유니폼을 입을 수 있다.

독일 유력 기자 크리스티안 폴크는 바이에른인사이더를 통해 26일(한국시각) '김민재의 미래가 의문이다'라며 김민재의 최근 상황을 조명했다.

김민재는 최근 바이에른 뮌헨을 떠날 수 있다는 전망이 쏟아지며, 차기 행선지에 대한 추측이 늘고 있다. 유력 기자들도 이를 적극 보도했다. 유럽축구 이적시장 전문가 파브리치오 로마노 기자는 23일 '김민재는 바이에른 뮌헨과 선수 모두에게 좋은 제안이 온다면 팀을 떠날 구체적인 가능성이 있다'라고 전했다. 로마노는 '그는 손댈 수 없는 존재가 아니다. 유럽 여러 구단이 이 상황을 인지하고 있고, 사우디아라비아 구단도 김민재 영입과 관련해 문의를 시작했다'라며 유럽과 사우디의 관심을 인정했다.

AP연합뉴스
이미 구체적인 구단의 이름이 언급되기도 했다. 과거 김민재의 나폴리 이적을 보도했던 프랑스 풋메르카토 소속 산티 아우나 기자는 지난 18일 '김민재는 프리미어리그 이적 가능성을 열었다'라며 '그는 이번 여름에 뮌헨을 떠날 가능성을 있다. 첼시와 뉴캐슬 유나이티드를 포함한 몇몇 프리미어리그 클럽은 이미 김민재의 에이전트와 잠재적인 이적에 관해 이야기를 나눴다. 세리에A 구단도 관심을 보이고 있다'라고 밝혔다.

독일 유력 언론에서는 이미 김민재의 이탈을 인정하며, 이후 김민재의 이적 가능성을 거론했다. 폴크 기자는 지난 17일 '바이에른은 김민재의 이적을 계획하고 있으며, 5000만 유로(약 800억원)의 이적료를 제시하는 팀이 나타난다면, 여름 이적시장에서 김민재를 판매할 가능성이 있다'라며 '바이에른은 딘 하위선을 영입 리스트에 올려두고 있기에 김민재의 미래는 더 불투명할 가능성도 있다. 하위선은 6000만 유로(약 960억원)의 바이아웃 조항을 갖고 있으며, 이를 김민재의 매각으로 충당할 수 있다'라고 밝혔다.

독일 스카이스포츠 소속 플로리안 플레텐베르크 기자도 '김민재는 바이에른에서 손댈 수 없는 선수로 여겨지지 않는다'라며 '바이에른은 김민재를 적극적으로 매각할 계획은 아니지만, 여름에 적절한 제안을 받는다면 이적에 열려 있다. 만약 김민재가 떠난다면 바이에른은 재투자를 할 것이다. 그렇지 않으면 바이에른은 김민재, 우다욧 파메카노, 이토 히로키, 다이어, 요시프 스타니시치를 센터백 옵션으로 차기 시즌을 계획할 것이다. 김민재와 바이에른의 계약 기간은 2028년까지다'라고 언급했다.

AP연합뉴스
이런 상황에서 새로운 행선지 후보로 맨유가 등장했다. 크리스티안 폴크 기자는 '김민재는 지난해 여름 맨유가 영입 제안을 했을 때 구단을 떠날 생각조차 하지 못했다. 맨유는 김민재 영입에 관심이 있기에 이번 여름 다시 시도할 수 있다. 다만 맨유측에서는 최근 바이에른 출신 선수들에 대한 자신감이 크지 않다. 그렇기에 고민을 할 것이다. 바이에른은 4000만 유로(약 650억원)에서 5000만 유로(약 810억원)의 제안을 받으면 김민재를 보낼 준비가 됐다'라고 했다.

김민재에 대한 맨유의 관심은 실제로 지난해 여름뿐만 아니라 김민재가 바이에른 유니폼을 입었던 2023년 여름에도 등장한 바 있다. 영국의 트라이벌풋볼은 '맨유와 토트넘이 바이에른에서 김민재의 상황을 지켜보고 있다'라며 '김민재는 자신의 상황을 알고 있다고 밝혔다. 그는 최근 경기에서 벤치에 남아 있다. 그에게는 익숙하지 않은 일이다. 김민재는 현재 맨체스터 유나이티드를 시작으로 토트넘, 리버풀 등 잉글랜드에서 큰 관심을 보이고 있다'라고 EPL 빅클럽들의 관심을 전했었다.

영국의 '스트레티 뉴스'도 당시 '맨유는 김민재가 바이에른에서의 상황을 고민하면서 이점을 주목해야 한다'라며 '김민재는 지난여름에도 많은 관심을 받았다. 현재는 다이어에게 밀려 벤치에 머물러 있다. 이는 그가 익숙하지 않은 일이며, 맨유에는 수준급 수비수가 부족하다. 맨유가 다시 문을 두드려보는 것은 어떨까'라며 맨유도 여전히 김민재를 고려할 수 있다는 소식을 언급했었다.

로이터연합뉴스
맨유로서는 올 여름 빅토르 린델뢰프, 조니 에반스가 떠나는 상황에서 해리 매과이어, 레니 요로, 마티아스 더리흐트 등 기존 수비진의 개편이 불가피하다. 김민재가 합류한다면 수비진의 중추적인 역할을 맡을 가능성이 충분하다. 또한 김민재는 과거 페네르바체 시절 스리백에서 활약한 경험이 있기에 후벵 아모림 감독의 전술에도 부할할 수 있다.

한편 김민재는 맨유행 외에도 사우디 이적 가능성에도 열려 있는 것으로 알려졌다. 폴크는 '김민재는 좋은 제안이 온다면 사우디로의 이적도 고려하고 있다. 상황이 쉽지 않다. 다만 다음 시즌 잔류할 계획도 준비가 되어 있다'라고 설명했다. 사우디 언론에 따르면 알힐랄을 비롯한 일부 구단들이 김민재 영입에 관심을 보인 것으로 알려졌다. 사우디가 영입 경쟁에 나선다면 김민재의 선택은 알 수 없지만, 바이에른이 만족할만한 이적료를 제시할 수 있다.

이현석 기자 digh1229@sportschosun.com"
20250427,"'무관' 케인 날벼락! 우승 세리머니 못 한다!…""분데스리가 왜 이래? EPL은 다르다고!""","(엑스포츠뉴스 윤준석 기자) 해리 케인이 또다시 운명의 장난에 발목이 잡혔다. 긴 무관의 세월을 끝낼 절호의 기회를 눈앞에 두고 있는 케인이지만, 그는 벤치에서 동료들의 우승 환호를 바라볼 운명에 처했다.

바이에른 뮌헨은 27일(한국시간) 독일 뮌헨 알리안츠 아레나에서 열린 2024-2025시즌 분데스리가 31라운드 마인츠전에서 3-0 완승을 거두며 리그 우승까지 단 1승만을 남겼다.

레로이 자네, 마이클 올리세, 에릭 다이어의 연속골로 경기를 지배한 뮌헨은 승점 75점을 확보, 2위 바이엘 레버쿠젠(승점 67)과의 격차를 8점으로 유지했다.

이제 뮌헨은 남은 리그 세 경기 중 단 한 경기만 승리하면 자력으로 리그 정상에 오른다. 다음 라운드 상대는 RB 라이프치히로, 이 경기에서 승리하면 통산 33번째 리그 우승을 확정짓는다.

그러나 이 역사적인 순간, 뮌헨의 에이스 케인은 함께할 수 없게 됐다. 그가 받은 이날 경기에서 받은 시즌 다섯 번째 경고 카드 때문이다. 그는 경고 누적으로 다음 리그 경기에 출전할 수 없게 됐다.



케인은 마인츠전 전반 종료 직전, 상대 요나탄 부르카르트와의 몸싸움 이후 심판 판정에 격렬히 항의하며 시간을 끌다가 시즌 다섯 번째 경고를 받고 말았다.

독일 분데스리가 규정상 시즌 중 5회 경고 누적 시 한 경기 출전 정지 처분을 받게 되는데, 하필이면 그것이 우승을 확정 지을 수 있는 라이프치히 원정과 겹치게 된 것이다.
경기 후 케인은 분노를 숨기지 않았다.

그는 경기 후 인터뷰를 통해 ""정말 말도 안 되는 판정이다. 절대 경고 카드를 받을 만한 상황이 아니었다""며 ""어떤 사람들은 알리안츠 아레나에 와서 이름을 알리고 싶어 하는 것 같다""고 주심 바스티안 단커트를 공개적으로 비판했다.

이어 그는 ""5장의 옐로 카드로 34경기 중 한 경기를 출전하지 못하는 분데스리가 규정도 이해할 수 없다""며 시스템을 강하게 꼬집었다. 그는 ""프리미어리그처럼 시즌 중반 옐로 카드를 리셋하는 제도가 있어야 한다""며 자신의 친정 리그와 비교하는 등 억지 논리를 세우기도 했다.



케인은 이번 시즌 분데스리가 29경기에 출전 24골로 리그 득점 선두를 달리고 있으며, 7도움 또한 기록하며 공격진 내 최다 공격포인트를 달성하며 팀의 리그 탈환에 절대적인 역할을 해왔다. 그러나 가장 중요한 순간, 그는 뛸 수 없는 아이러니에 직면했다.

뮌헨의 베테랑 토마스 뮐러도 케인의 분노에 공감했다. ""케인은 하프타임에 정말 분노했다. 물론 심판을 비난하고 싶지는 않지만, 조금 더 세심한 판정이 있었어야 했다""며 ""이제 우리는 케인이 없는 상황에서도 승리를 쟁취해야 한다""고 말했다.

뮌헨 스포츠 디렉터 크리스토프 프로인트 역시 ""정말 아픈 일이다. 내 생각에 파울조차 아니었다""며 억울함을 표했다. 그는 ""케인은 너무나 아쉬워했다. 하지만 이것이 축구다""라며 담담하게 받아들였다.

케인의 커리어는 믿을 수 없을 만큼 무관의 연속이었다. 잉글랜드 토트넘 홋스퍼에서 리그컵, 챔피언스리그, 프리미어리그 준우승에 그쳤고, 잉글랜드 대표팀에서도 유로 2020, 유로 2024에서 준우승의 고배를 마셨다.

최고의 스트라이커로 불리면서도 단 하나의 메이저 트로피도 손에 넣지 못한 불운의 아이콘이었다.



그랬던 그는 커리어 첫 번째 우승 트로피를 위해 2023년 여름 무려 8200만 파운드(약 1570억원)의 이적료를 기록하며 뮌헨으로 이적했다.

그러나 이마저도 쉽지 않았다. 그의 이적 후 첫 시즌이었던 지난 시즌 뮌헨은 리그 11연패 행진을 마감하고레버쿠젠에 밀려 리그 2위에 머물렀다. 케인의 무관 징크스가 여전히 유효한 듯 보였다.

올 시즌 드디어 우승을 눈앞에 두었지만, 케인은 그 역사적 순간을 직접 뛰며 누리지 못하게 됐다. 마치 무관의 신이 끝까지 그의 발목을 잡으려는 듯한 잔혹한 운명이다.

다만 케인이 라이프치히전 우승 확정 장면에는 함께하지 못하더라도, 분데스리가 전통에 따라 최종 홈경기(5월 11일 보루시아 묀헨글라드바흐전)에서 열리는 트로피 수여식에는 참여할 수 있다. 즉, 정식 우승 세리머니 때는 케인도 유니폼을 입고 트로피를 들어 올릴 수 있을 전망이다.

하지만 누구보다 오랫동안 이 순간을 기다려온 케인에게 있어, 팀이 우승을 확정짓는 바로 그 경기장에서 함께하지 못하는 아쉬움은 쉽게 지워지지 않을 것이다.

뮌헨은 이제 케인 없는 라이프치히 원정 승리를 위해 전력을 다해야 한다. 그리고 해리 케인은 비록 경기장 안이 아닌 밖에서, 자신의 첫 우승을 뜨겁게 맞이할 준비를 하고 있다.

사진=연합뉴스"
20250427,"'들통난 거짓부렁' 포스텍, '오피셜' 공식 발표...SON, 4경기 연속 실종 속 '미스테리' 계속→""리버풀전 결장 확정""","[SPORTALKOREA] 박윤서 기자= 토트넘 홋스퍼는 손흥민의 부상을 가볍다고 언급했지만, 벌써 4경기 연속 결장이 확정됐다.

토트넘은 28일 오전 0시 30분(한국시간) 안필드에서 리버풀과 2024/25 시즌 잉글랜드 프리미어리그(PL) 34라운드 원정경기를 앞두고 있다. 해당 매치업은 전 세계 축구 팬들의 시선을 사로잡기 충분하다. 리버풀이 무려 5년 만에 리그 우승을 확정 지을 수 있는 경기이기 때문이다. 많은 이들의 시선이 집중된 경기임에도 토트넘 주장 손흥민은 결장한다.


경기를 앞둔 25일 토트넘은 구단 공식 홈페이지를 통해 ""엔제 포스테코글루 감독은 손흥민이 일요일 안필드에서 열리는 리버풀과의 경기에 나서지 않는다고 이야기했다""라고 전했다.

이로써 손흥민은 울버햄튼 원더러스, 아인트라흐트 프랑크푸르트, 노팅엄 포레스트와의 지난 3경기에 이어 리버풀과의 일전까지 총 4경기 연속 쉬어가게 됐다.


리버풀전을 앞두고 사전 기자회견장에 등장한 포스테코글루 감독은 ""토트넘의 스쿼드는 변함이 없다. 모든 선수가 노팅엄과의 경기를 무사히 끝냈다. 현재 재활 중인 선수는 손흥민밖에 없다. 그는 점점 나아지고 있다. 단 일요일 경기에 뛸 준비가 되지 않은 유일한 선수이다""라고 말했다.

이어 ""손흥민은 부상 이후 처음 그라운드를 밟았다. 본인은 느낌이 좋다고 했다. 상태가 좋아졌다고 말하고 있으나 아직은 상황을 매일 지켜봐야 한다. 발은 체중이 실리는 부위이다. 무리하지 않는 것이 가장 중요하다. 손흥민에겐 휴식과 치료가 필요한 상황이다""라고 덧붙였다.


포스테코글루 감독은 당초 손흥민의 부상 소식에 관한 질문에 '가벼운 타박상'이라고 밝힌 바 있다. 그 이야기가 사실이었다면 그간 철강왕의 면모를 자랑하던 손흥민이 아직 그라운드를 밟지 못하고 있는 작금의 상황에 대한 설명으론 부족한 감이 있다. 심지어 다수의 현지 매체에선 손흥민의 시즌 아웃을 예견하고 있다. 그럼에도 토트넘은 손흥민의 부상 여부와 복귀 시점 등에 관한 구체적인 언급을 피하고 있다. 축구 팬들 입장에선 의아할 수밖에 없는 상황이다.

만일 부상이 심각하지 않다면 구단 차원에서 '손흥민 아끼기'에 들어갔을 가능성도 있다. 올 시즌 토트넘에 PL 일정은 사실상 의미 없는 경기가 되어가고 있다. 현재 리그 33경기에서 11승 4무 18패(승점 37)로 16위에 자리하고 있다. 5경기를 앞둔 시점, 남은 경기서 전승을 거둔다고 해도 가시적인 결과물을 얻을 순 없다.


그나마 토트넘이 올 시즌 부진을 딛고 일어서기 위해선 유럽축구연맹(UEFA) 유로파리그(UEL) 우승 트로피가 필요한 상황이다. 토트넘은 FK 보되/글림트와의 4강전을 제압하고 결승 무대마저 승리할 경우 17년 무관을 깸과 동시에 다음 시즌 UEFA 챔피언스리그(UCL) 티켓을 얻을 수 있다.


다만 손흥민이 4강전에 나설 수 있을지 여부조차 아직은 미지수에 가깝다. 토트넘 소식에 밝은 존 웬햄 역시 '토트넘 뉴스'와 최신 인터뷰를 통해 ""손흥민의 부상에 있어 우리가 당장 알 수 있는 사실은 그가 다쳤다는 내용밖에 없다""라며 ""팬들은 포스테코글루가 그의 부상 정도를 상세히 설명할 길 기다리는 것 말곤 할 수 있는 게 없다. 생각보다 심각한 부상일 가능성이 있다""라고 밝혔다.

사진=게티이미지코리아

취재문의 sportal@sportalkorea.co.kr"
20250427,"[속보] 'PL 16위 추락' 토트넘, 사비 알론소-클롭이 포스테코글루 대체? 현실 불가능한 英 전망","[사진] ⓒGettyimages(무단전재 및 재배포 금지)
[사진] ⓒGettyimages(무단전재 및 재배포 금지)


[OSEN=우충원 기자] 토트넘 홋스퍼가 엔지 포스테코글루 감독(59)과 결별을 준비하면서 차기 사령탑 영입에 본격적으로 착수했다. 현재 거론되는 후보는 사비 알론소(43, 레버쿠젠) 감독과 위르겐 클롭(57, 전 리버풀) 감독이다. 

기브미스포츠는 26일(이하 한국시간) “토트넘 이사회가 알론소 감독을 후임 후보로 적극 검토하고 있으며 클롭 전 감독에게도 관심을 드러냈다”고 보도했다.

토트넘은 이미 알론소 선임 가능성을 내부 논의 테이블에 올렸고 클롭 영입 역시 배제하지 않은 상황이다.
포스테코글루 감독은 이번 시즌을 끝으로 토트넘을 떠날 가능성이 높아졌다. 유럽축구연맹(UEFA) 유로파리그 4강 진출이라는 성과에도 불구하고, 구단은 감독 교체를 통해 새로운 변화를 모색할 방침이다.

차기 감독을 찾고 있는 토트넘 앞에는 난관이 존재한다. 알론소와 클롭 모두 유럽 내 복수 구단들의 관심을 동시에 받고 있기 때문이다.

알론소는 지난 시즌 레버쿠젠을 분데스리가 정상에 올려놓으며 지도자로서 높은 평가를 받았다. 레버쿠젠 CEO 페르난도 카로는 과거 알론소와 맺은 '신사협정'을 공개한 바 있다. 선수 시절 몸담았던 팀에서 부르면 이적을 허용한다는 약속이다. 이에 따라 레알 마드리드 또한 알론소를 1순위 후보로 삼고 있는 것으로 전해졌다. 레알은 이번 시즌 종료와 함께 카를로 안첼로티 감독과 작별할 가능성이 제기되고 있다.

토트넘이 주목하는 또 다른 후보는 클롭이다.

[사진] ⓒGettyimages(무단전재 및 재배포 금지)
[사진] ⓒGettyimages(무단전재 및 재배포 금지)


클롭은 마인츠 05에서 지도자 커리어를 시작했다. 2부리그 소속이던 마인츠를 세 차례 도전 끝에 사상 첫 분데스리가 승격으로 이끌었고, 강등 이후 재승격에 실패하자 스스로 사임했다.

이후 도르트문트로 옮겨 본격적으로 명장 반열에 올랐다. 2010-2011시즌 도르트문트를 리그 정상으로 이끌었고 이어진 2011-2012시즌 리그 2연패를 달성했다. 도르트문트에서만 총 다섯 개의 트로피를 들어 올린 그는 2015년 리버풀로 자리를 옮겼다.

리버풀 시절 클롭은 최고의 전성기를 맞았다. 2018-2019시즌 UEFA 챔피언스리그 우승, 2019-2020시즌에는 30년 만의 프리미어리그 우승을 이끌어냈다. UEFA 슈퍼컵과 FIFA 클럽 월드컵 트로피까지 거머쥐며 리버풀 역사에 한 획을 그었다.

하지만 2023-2024시즌 종료 후 클롭은 리버풀과 결별을 선언했다. 그는 “이젠 젊지 않다. 리버풀엔 새로운 피가 필요하다”며 자리에서 물러났다. 이후 그는 레드불 풋볼 그룹의 글로벌 축구 총괄 직책을 맡으며 잠시 현장을 떠난 상태다.

기브미스포츠에 따르면 클롭은 최근 레알 마드리드로부터 차기 감독 제안을 받았지만 이를 거절했다. 그럼에도 토트넘은 클롭 영입을 포기하지 않고 계속 문을 두드리고 있다.

[사진] ⓒGettyimages(무단전재 및 재배포 금지)
[사진] ⓒGettyimages(무단전재 및 재배포 금지)
포스테코글루 감독 체제 아래 기대 이하의 결과를 받아든 토트넘은 다음 시즌을 새롭게 출발시키기 위해 적극적인 변화에 나섰다. 알론소와 클롭 모두 영입 경쟁이 치열한 상황이지만, 토트넘은 확고한 의지를 보이며 승부수를 준비하고 있다. / 10bird@osen.co.kr"
20250427,"'獨 HERE WE GO' 떴다, 김민재 리그 우승하고 ""바이에른 뮌헨 떠난다"" 조기 작별 고민 중…공신력 최상급 확인 '몸 갈아 뛰어도 욕먹고→정말 지쳐'","[스포티비뉴스=박대성 기자] 김민재(29, 바이에른 뮌헨)가 두 번째 시즌이 끝난 뒤 바이에른 뮌헨을 떠날까. 바이에른 뮌헨이 합리적인 제안이 들어오면 이적을 검토하려는 상황. 김민재도 올여름 바이에른 뮌헨을 떠나 새로운 도전을 고민하려고 한다.

독일 방송 '스카이'는 27일(한국시간) 바이에른 뮌헨 수비수 김민재의 조기 이적 가능성을 보도했다. 바이에른 뮌헨 소식에 정통한 '1티어' 플로리앙 플라텐버그 기자가 '트랜스퍼 업데이트 쇼'를 통해 전해진 바에 따르면, 바이에른 뮌헨은 올시즌 수비 조합이 기대에 못 미치는 모습을 보였다고 판단해 팀 목표 달성에 실패했고, 이로 인해 개편 움직임을 검토했다.

김민재는 바이에른 뮌헨 변화의 중심에 서 있다. '스카이'는 김민재가 바이에른 뮌헨을 조기에 떠나는 가능성을 열어뒀고, 바이에른 뮌헨 역시 만족스러운 제안이 들어올 경우 이적을 허용할 생각이라고 전했다.
2023년 여름, 나폴리에서 바이에른 뮌헨으로 이적했다. 유럽 진출 이후 두 시즌 만에 유럽5대리그에 합류했고 나폴리에서 압도적인 퍼포먼스를 보였다. 이탈리아 올해의 수비수에 등극하며 찬사를 받았고 바이에른 뮌헨의 적극적인 러브콜로 독일 땅을 밟았다.

투헬 감독 시절에 전반기에 준수한 활약을 했지만, 후반기에 아시아축구연맹(AFC) 아시안컵 차출 이후 흔들렸다. 바이에른 뮌헨이 12년 만에 분데스리가 우승 실패 등 악재가 겹치자 김민재를 벤치에 앉히고 마티아스 더 리흐트-에릭 다이어 조합을 쓰기도 했다.

투헬 감독이 떠나고 벵상 콤파니 감독이 지휘봉을 잡은 뒤 김민재에게 변화가 생겼다. 유럽 진출 이후 온전하게 프리시즌부터 전체 시즌을 준비하게 됐고, 콤파니 감독이 김민재에게 엄청난 신뢰를 줬다.



이번에도 전반기에 활약은 꾸준했지만 후반기가 문제였다. 지난해 10월 아킬레스건 통증 이후 컨디션이 온전치 않았다. 김민재를 대체할 선수들이 연달아 부상으로 이탈하면서 혹사에 가까운 시간을 뛰었다. 결국 바이에른 뮌헨은 챔피언스리그 8강에서 고배를 마셨고, 중요한 경기에서 100% 장점을 보이지 못했다.

독일에서는 김민재 경기력에 날을 세웠다. 도르트문트전, 인터밀란과 챔피언스리그 8강에서 실점 빌미를 제공한 걸 모두 김민재 탓으로 돌렸다. 콤파니 감독은 김민재를 감쌌지만, 막스 에베를 단장까지 공식적인 자리에서 ""부상은 핑계가 될 수 없다""라며 김민재를 우회적으로 질타했다.

보도에 따르면, 김민재는 바이에른 뮌헨에서 연봉 1300만 유로(약 190억 원)를 수령하고 있다. 독일 '스카이'와 '빌트' 등 다수 매체는 ""사우디아라비아 클럽뿐만 아니라 이탈리아 세리에A의 유벤투스, 잉글랜드 프리미어리그의 뉴캐슬과 첼시 등 유럽 주요 구단들이 김민재에게 구체적인 관심을 보이고 있다""라고 알렸다.

김민재는 아직 어느 팀으로 갈지에 대해 확정적인 결정을 내리지 않은 것으로 알려졌다. 여러 제안이 오가는 가운데, 본인에게 가장 적합한 팀을 신중히 고르려는 것으로 보인다. 유럽이적시장전문가 '파브리지오 로마노'는 ""유럽에서 김민재를 노리는 팀이 많지만, 유럽 내 이적을 하려면 연봉을 삭감해야 한다. 높은 연봉이 걸림돌""이라고 짚었다.



현재 바이에른 뮌헨은 바이엘 레버쿠젠 수비수 조나단 타를 주요 영입 후보로 점찍고 있다. 타는 이번 시즌 종료 후 자유계약 선수로 풀릴 예정이라 바이에른 뮌헨에게 매력적인 카드다.

그러나 타는 프리메라리가 우승 경쟁 팀 바르셀로나와 계약 합의에 근접해 있다. 바르셀로나의 재정 문제로 인해 최종 계약이 확정되지 못하고 있다. 만약 바르셀로나 이적이 무산된다면, 레알 마드리드 역시 타의 차기 행선지로 거론되고 있다. 이러한 상황은 바이에른 뮌헨의 수비진 개편 계획에도 직접적인 영향을 미칠 전망이다.

또 다른 수비 후보는 딘 후이센(본머스)이다. 바이에른 뮌헨은 이미 여러 차례 후이센을 스카우팅했으며, 선수 측과 접촉도 이어가고 있다. 리버풀, 레알 마드리드 등도 관심을 보이고 있어 경쟁은 치열할 것으로 예상된다.

김민재는 바이에른 뮌헨에 남아 경쟁을 이어갈 수도 있고, 새로운 리그에 도전할 수도 있다. 김민재의 결정은 바이에른 뮌헨 수비진 재편뿐만 아니라, 올 여름 유럽 축구 시장 전체에도 큰 파장을 불러일으킬 가능성이 있다.



한편 바이에른 뮌헨은 챔피언스리그 8강에서 탈락했지만, 독일 분데스리가 우승을 눈앞에 두고 있다.

독일 뮌헨 알리안츠 아레나에서 열린 2024-2025시즌 분데스리가 31라운드에서 레로이 자네, 마이클 올리세, 에릭 다이어의 연속 골로 마인츠를 3-1로 꺾었다.

이날 승리로 뮌헨은 승점 75점을 기록, 승점 67점인 2위 바이엘 레버쿠젠과의 격차를 8점으로 유지했다. 레버쿠젠이 아우크스부르크에 무승부 혹은 질 경우 우승을 확정할 수 있었지만, 레버쿠젠이 아우크스부르크에 이기면서 '매직 넘버1' 다음으로 미루게 됐다.

김민재는 이날 45분 동안 뛰고 교체됐다."
