date,title,content
20250721,"'韓 축구 대형 악재' 손흥민, 레딩전 부진 후 방출 통보…프랑크는 ""구단이 결정 내릴 것""","[SPORTALKOREA] 배웅기 기자= 토트넘 홋스퍼가 손흥민의 이적을 허용했다는 소식이다.

영국 매체 '기브미스포츠'는 20일(이하 한국시간) ""토트넘의 주급 19만 파운드(약 3억 6,000만 원) 스타가 올여름 떠날 수 있다""며 토트넘과 손흥민의 10년여 동행이 막을 내릴 수 있다고 주장했다.

손흥민은 19일 영국 레딩 셀렉트 카 리징 스타디움에서 열린 레딩과 프리시즌 친선경기(원정·2-0 승리)에서 후반 교체 출전했지만 이렇다 할 모습을 보이지 못했다. 영국 매체 '풋볼 런던'의 알레스데어 골드 기자는 손흥민의 활약을 두고 ""녹슬었다""고 평가했다.

기브미스포츠의 보도는 경기 후 이뤄졌다. 토트넘 내부적으로 손흥민의 레딩전 경기력을 지표 삼아 매각을 결정했을 가능성을 무시할 수 없다. 매체는 토트넘이 모하메드 쿠두스를 영입했고, 요안 위사(브렌트퍼드)까지 노리고 있다며 적절한 제안이 있을 경우 손흥민이 이적할 것이라고 내다봤다.



손흥민은 2015년 여름 바이어 04 레버쿠젠에서 토트넘으로 이적, 통산 454경기 173골 101도움을 기록하며 명실상부 레전드로서 입지를 공고히 했다. 지난 시즌 유럽축구연맹(UEFA) 유로파리그에서는 생애 첫 메이저 대회 우승을 차지했다.

최근 미국 메이저리그사커(MLS), 사우디 프로페셔널리그 등과 연결되고 있다. 토트넘이 올겨울 손흥민의 1년 계약 연장 옵션을 발동하기는 했지만 여전히 추측이 끊이지 않는다. 일각에서는 토트넘의 프리시즌 대한민국 투어 후 손흥민이 떠날 것이라고 전망하고 있다.



토마스 프랑크 감독은 18일 부임 후 첫 기자회견에서 손흥민의 거취를 묻는 질문에 말을 아꼈다. 골드의 보도에 따르면 프랑크는 ""손흥민은 최고 수준의 선수다. 토트넘에서 10년을 보내며 마침내 트로피를 들어 올렸다""면서도 ""한 팀에 오래 머무른 선수라면 어느 시점에는 구단이 결정을 내려야 할 때가 있다""고 의미심장한 발언을 남겼다.

사진=게티이미지코리아

취재문의 sportal@sportalkorea.co.kr"
20250721,"초대박! '끝난 줄 알았는데'…김민재 바르셀로나행 급물살, ""아라우호가 뮌헨 간다""","[SPORTALKOREA] 배웅기 기자= 로날드 아라우호(바르셀로나)와 김민재(바이에른 뮌헨)가 유니폼을 바꿔 입는 초유의 연쇄 이동이 발생할 전망이다.

영국 매체 '트리뷰나'는 18일(이하 한국시간) 스페인 매체 '엘 나시오날' 보도를 인용, ""아라우호의 뮌헨 이적을 둘러싼 추측이 다시 커지고 있다. 구단은 그의 상황을 주시하고 있다""며 머지않아 한지 플릭 감독과 아라우호의 면담이 있을 것이라고 밝혔다.

바르셀로나는 주전 센터백으로 파우 쿠바르시와 이니고 마르티네스를 선호하고 있는 것으로 알려졌다. 아라우호는 잦은 부상과 계속되는 실책으로 플릭의 신임을 잃었다. 아라우호는 2026 국제축구연맹(FIFA) 북중미 월드컵을 1년여 앞두고 확실한 입지를 보장받고 싶어 한다.



김민재의 거취와도 연관 지어볼 수 있는 소식이다. 독일 매체 'TZ'의 필립 케슬러 기자는 11일 ""바르셀로나가 뮌헨에 다요 우파메카노와 김민재 영입을 문의했다. 데쿠 바르셀로나 단장은 플릭처럼 높은 수비라인과 빌드업 능력을 중요시 여긴다. 두 선수 모두 이 같은 전술에 적합하다고 평가하고 있다""고 주장했다.

이어 ""구체적 진전은 없다. 바르셀로나는 아라우호가 이적할 경우에만 우파메카노 혹은 김민재 영입을 추진할 계획이다. 새로운 선수를 등록하기 위해서는 기존 선수의 매각이 선행돼야 한다""고 전했다.

닷새 뒤인 16일 독일 매체 '빌트'의 토비 알트셰플 기자가 김민재의 바르셀로나 이적설을 반박했다. 당시 알트셰플은 ""막스 에베를 뮌헨 단장은 올여름 단순 영입이 아닌 방출에도 집중하고 있다. 구단은 일부 선수의 매각으로 자금을 확보하고자 한다""며 ""김민재는 최근 바르셀로나와 연결됐지만 이는 사실이 아니다. 플릭은 그에게 관심이 없다""고 선을 그었다.

잔류가 유력하던 아라우호가 돌연 이적한다면 바르셀로나가 다시금 김민재에게 관심을 가질 수 있다는 의미다.



김민재는 지난 시즌 43경기(3,593분)를 소화하며 뮌헨의 분데스리가 우승에 일조했다. 그러나 지난해 10월부터 왼쪽 아킬레스건 부상을 동반한 채 강행군을 이어왔고, 자연스레 실책 빈도가 늘어 독일 매체의 비판 여론에 휩싸였다. 에베를은 지난달 30일 독일 매체 '스카이스포츠'와 인터뷰에서 김민재의 매각 여부를 결정하지 않았다고 설명한 바 있다.

사진=게티이미지코리아, 바르셀로나

취재문의 sportal@sportalkorea.co.kr"
20250721,"쿠르투아·벨링엄·음바페까지 분노, 레알 라커룸 ‘폭발’…“리더 아닌 문제아” 뤼디거, 동료들과 갈등 심화","레알 마드리드 내부 분위기가 심상치 않다.

레알은 2024-25시즌 우승 트로피를 하나도 들어 올리지 못했다. 그런 상황에서 라커룸 갈등설이 수면 위로 떠올랐다.

그 중심엔 안토니오 뤼디거가 있다.

레알 마드리드 내부 분위기가 심상치 않다. 레알은 2024-25시즌 우승 트로피를 하나도 들어 올리지 못했다. 그런 상황에서 라커룸 갈등설이 수면 위로 떠올랐다. 그 중심엔 안토니오 뤼디거가 있다. 사진=AFPBBNews=News1
스페인 ‘돈발롱’은 “레알 선수단 내부에서 뤼디거에 대한 불만이 커지고 있다”며 “특히나 티보 쿠르투아와 주드 벨링엄은 뤼디거와 거리를 두고 있다”고 전했다. 사진=AFPBBNews=News1
스페인 ‘돈발롱’은 “레알 선수단 내부에서 뤼디거에 대한 불만이 커지고 있다”며 “특히나 티보 쿠르투아와 주드 벨링엄은 뤼디거와 거리를 두고 있다”고 전했다.

이유는 명확하다. 뤼디거의 ‘선 넘는 행동’ 때문이다.

뤼디거는 거친 성격으로 유명하다. 뤼디거는 과격한 태클, 거친 농담 등이 일상인 선수다.
뤼디거의 동료들이 참다못해 폭발한 건 지난 시즌 코파 델 레이 결승전이었다. 상대는 레알의 최고 라이벌인 FC 바르셀로나였다.

뤼디거는 심판 판정에 강하게 항의하던 중 물병을 집어 던졌다. 사람이 없는 곳으로 던진 게 아니었다. 뤼디거는 심판을 향해서 물병을 던졌다. 뤼디거는 레드카드를 받았다. 뤼디거에게 6경기 출전 정지 징계가 내려졌다.

‘돈발롱’에 따르면, 레알 선수들은 이때 뤼디거의 행동에 크게 실망했다.

뤼디거의 동료들이 참다못해 폭발한 건 지난 시즌 코파 델 레이 결승전이었다. 상대는 레알의 최고 라이벌인 FC 바르셀로나였다. 뤼디거는 심판 판정에 강하게 항의하던 중 물병을 집어 던졌다. 사람이 없는 곳으로 던진 게 아니었다. 뤼디거는 심판을 향해서 물병을 던졌다. 뤼디거는 레드카드를 받았다. 뤼디거에게 6경기 출전 정지 징계도 내려졌다. ‘돈발롱’에 따르면 레알 선수들은 이때 뤼디거의 행동에 크게 실망했다. 사진=AFPBBNews=News1
훈련장에서도 마찰은 이어졌다.

벨링엄, 킬리안 음바페 등이 뤼디거의 거친 태클에 불만을 드러냈다.

‘돈발롱’은 “뤼디거는 훈련에서도 강하게 달려든다. 일부 선수들은 이게 ‘필요 없는 행동’이라고 생각한다”고 전했다.

상황이 이쯤 되자 구단 고위층이 움직였다. 레알은 뤼디거의 거취를 두고 논의에 들어갔다.

‘돈발롱’에 따르면 구단 일부 인사는 “지금의 뤼디거는 팀에 도움이 되지 않는다”며 방출을 주장하고 있다.

훈련장에서도 마찰은 이어졌다. 주드 벨링엄, 킬리안 음바페 등이 뤼디거의 거친 태클에 불만을 드러냈다. ‘돈발롱’은 “뤼디거는 훈련에서도 강하게 달려든다. 일부 선수들은 이게 필요 없는 행동이라고 생각한다”고 전했다. 사진=AFPBBNews=News1
뤼디거와 레알의 계약은 2026년 6월까지다. 계약 기간보다 중요한 건 팀 내 입지다. 뤼디거가 레알에서 리더가 될 것이라는 기대는 사라졌다. 뤼디거는 팀원들의 신뢰를 크게 잃었다. 사진=AFPBBNews=News1
뤼디거와 레알의 계약은 2026년 6월까지다.

계약 기간보다 중요한 건 팀 내 입지다. 뤼디거가 ‘레알에서 리더가 될 것’이라는 기대는 사라졌다. 뤼디거는 팀원들의 신뢰를 크게 잃었다.

이제 남은 건 결단이다.

레알 플로렌티노 페레스 회장은 뤼디거를 안고 갈지, 아니면 올여름 이적시장에서 정리할지를 결정해야 한다.

[이근승 MK스포츠 기자]"
20250721,"英 BBC급 폭로 ""손흥민, 토트넘과 이면 협상 진행 예정""…첫 경기 혹평→결별 수순 밟는다","(엑스포츠뉴스 윤준석 기자) 잉글리시 프리미어리그 토트넘 홋스퍼가 2025-2026시즌 준비에 본격 돌입한 가운데, 주장 손흥민의 미래가 다시금 안갯속으로 빠져들고 있다.

프리시즌 첫 경기에서 기대에 못 미친 경기력을 보인 손흥민은 현지 언론과 팬들로부터 냉정한 평가를 받았고, 이와 동시에 이적설이 더욱 구체화되며 이별의 시간이 다가오고 있다는 분석이 설득력을 얻고 있다.

토트넘은 지난 20일(한국시간) 잉글랜드 버크셔주에 위치한 마데이스키 스타디움에서 챔피언십(2부 리그) 소속 레딩과의 프리시즌 친선 경기에서 2-0 승리를 챙겼다.

이날 손흥민은 후반 시작과 함께 교체 완장을 두르고 교체 투입됐으나, 공격 포인트 없이 무득점으로 경기를 마쳤다.

왼쪽 측면 공격수로 출전한 그는 45분 동안 유효슈팅 0, 드리블 성공률 0%(0/3), 크로스 성공률 0%(0/1)를 기록하며 극심한 부진을 드러냈다. 공을 잡은 모든 순간들에 평소와는 다른 어색한 몸동작으로 팬들의 우려를 자아내기도 했다.



축구 통계 매체 '풋몹'은 손흥민에게 팀 내 세번째로 낮은 평점인 6.2를 부여했으며, '풋볼 런던'의 전담 기자 알라스데어 골드는 손흥민을 두고 ""터치 실수가 반복됐고, 슈팅 감각이 크게 떨어져 있었다""며 팀 내 최저 평점인 5점을 매겼다.

'더 스탠더드' 역시 손흥민의 플레이에 대한 호평에 더해 ""손흥민이 다음 시즌에도 이 팀에 남을지 불확실하다""고 전했고, 'TBR풋볼' 역시 ""토트넘은 적절한 제안이 들어올 경우 손흥민 이적을 허용할 준비가 되어 있다""고 지적했다.

반면, 프리시즌 경기에서 손흥민이 부진한 사이, 새 영입생 모하메드 쿠두스는 눈에 띄는 활약을 펼쳤다. 쿠두스는 오른쪽 윙어로 출전해 부드러운 드리블과 날카로운 판단력을 바탕으로 1도움을 기록했다. 부슈코비치의 골을 도우며 평점 7.4점을 기록했다.

이는 곧 토트넘이 손흥민이 다음 시즌 벤치 자원으로 전락할 수 있다는 해석으로 이어진다. 영국 '기브 미 스포츠'는 ""손흥민은 더 이상 토트넘의 중심이 아니다. 쿠두스, 마이키 무어 등 대체 자원이 충분하다""고 주장했다.



실제로 이날 손흥민의 부진 이후, 그를 둘러싼 이적설로 인해 더욱 주목을 받고 있다. 현지 언론에서는 손흥민의 경기력 저하와 불확실한 거취에 대해 집중적으로 조명하고 있다.

영국 매체 '풋볼 인사이더'는 20일 경기 종료 후 전 토트넘 골키퍼 폴 로빈슨의 발언을 인용해, ""토트넘이 손흥민의 거취에 대한 결정을 앞두고 있으며, 선수 본인과 구단 간의 이면 협상이 진행될 예정""이라고 보도했다.

로빈슨은 해당 매체의 팟캐스트 '인사이드 토크'에서 ""토트넘이 챔피언스리그에 진출한 만큼 확장된 선수단이 필요한 상황""이라면서도, ""만약 손흥민이 '지금이 떠날 시기'라고 판단하고 구단에 이적 의사를 전달한다면, 토트넘은 그 결정을 존중하고 최대한 이득을 남기는 방향으로 협상할 것""이라고 밝혔다.

해당 매체는 지난달 보도를 통해 ""토트넘이 손흥민에게 거액의 제안이 들어올 경우 매각을 고려할 수 있다""고 주장했으며, 최근에는 토트넘 전 스카우트 믹 브라운의 최근 인터뷰를 인용해 ""손흥민의 체력 및 경기 지속력에 대한 우려로 인해 토트넘이 이적을 허용할 준비가 되어 있다""고 전했다.
계약 만료까지 1년이 남은 상황에서, 토트넘이 막대한 이적료 수익 없이 손흥민을 내보내는 것을 꺼릴 것이라는 관측도 나온다.

그러나 여전히 사우디아라비아 프로리그(SPL)나 미국 메이저리그사커(MLS) 등에서 유력한 오퍼가 올 가능성도 무시할 수 없다.



이런 가운데 토트넘 현지 팬사이트 '홋스퍼 HQ'는 ""손흥민의 미래가 또다시 불확실해졌다""고 보도했다.

해당 매체는 ""손흥민은 유로파리그 우승의 핵심 멤버였고, 지난 시즌 프리미어리그에서는 득점 기여도 1위를 기록했지만, 부상과 체력 저하로 시즌 후반 급격한 하락세를 겪었다""고 평가했다.

그러면서 ""결국 구단과 손흥민은 계약이 만료되는 2025년 여름까지 마지막 시즌을 함께한 뒤, 선수는 사우디 혹은 튀르키예 등으로 이적해 큰 연봉 계약을 노릴 가능성이 높다""고 전했다.

최근 프랭크 감독의 미온적인 반응도 손흥민의 입지를 둘러싼 논란에 불을 지피는 데 큰 역할을 했다는 것이 매체의 주장이다.

최근 복수의 현지 매체가 전한 프랭크 감독의 발언에 따르면, 그는 ""현재 손흥민은 전적으로 헌신하고 있고, 잘 훈련하고 있으며 내일 경기에 나설 예정""이라면서도 ""오랜 기간 한 팀에 몸담은 선수의 경우, 언젠가는 떠날 수도 있는 시점이 오기 마련이고, 그런 결정은 결국 구단이 내리는 것""이라고 말했다.

이에 대해 '홋스퍼 HQ'는 ""프랭크 감독의 이 발언은 마치 다니엘 레비 회장의 입김이 반영된 공식 멘트처럼 느껴진다""며 ""프리미어리그 최고 공격수 중 한 명인 손흥민과 첫 호흡을 맞추는 데 있어서 이보다 더 무미건조한 평가가 있을 수 있는가""라고 비판적인 시각을 보였다.



한편 토트넘은 프랭크 감독 체제에서 대대적인 선수단 개편을 예고하고 있다.

'풋볼 인사이더'는 ""프랭크 감독이 대대적인 리빌딩에 착수할 예정이며, 다니엘 레비 회장과 구단 이사진도 이를 적극적으로 뒷받침할 것""이라고 보도했다.

이는 기존 주축 선수들의 거취가 모두 재검토 대상이 될 수 있음을 시사하는 대목이다.

손흥민의 거취는 여전히 유동적이다. 구단 내부에서도 이를 두고 의견이 엇갈리는 가운데, 어떤 방향으로든 이달 말까지는 결론이 날 것으로 보인다.

손흥민은 토트넘에서 마지막 시즌을 소화한 뒤, 자유계약(FA) 신분으로 새로운 무대를 향할 가능성도 배제할 수 없지만, 이번 프리시즌 경기력이 해당 계획에 걸림돌이 될 것은 분명해 보인다.

사진=토트넘 홋스퍼/연합뉴스"
20250721,리버풀 대오열! 뮌헨 핵심 공격수 충격의 바이에른 뮌헨행…이적료 1000억→1290억 수정제안,"사진=SNS
<저작권자(c) 연합뉴스, 무단 전재-재배포, AI 학습 및 활용 금지>
[스포츠조선 강우진 기자]바이에른 뮌헨이 리버풀의 핵심 공격수 루이스 디아스 영입을 위해 노력 중이다.

영국 더하드태클은 21일(한국시각) ""뱅상 콤파니 감독이 이끄는 바이에른 뮌헨이 리버풀의 핵심 공격수 루이스 디아스를 영입하기 위해 수정된 제안을 제출할 준비를 하고 있다""라고 보도했다.

앞서 유럽축구 이적시장 전문가 파브리지오 로마노는 바이에른 뮌헨이 디아스 영입에 매우 열의를 보이고 있다고 전했다. 디아스에 대한 바이에른 뮌헨의 첫 제안은 리버풀에 의해 거절됐다. 뮌헨은 곧 개선된 조건의 새 제안을 다시 제출할 예정이다.

<저작권자(c) 연합뉴스, 무단 전재-재배포, AI 학습 및 활용 금지>
사진=SNS
디아스는 지난 2022년 리버풀로 이적한 이후 줄곧 핵심 전력으로 활약해왔다. 지난 시즌 아르네 슬롯 감독 체제에서 잉글랜드 프리미어리그(EPL) 우승을 이끈 주요 선수로, 모든 대회를 통틀어 50경기에 출전해 17골 8도움을 기록했다.

디아스는 리버풀과의 계약이 2년 남아있다. 구단도 그를 붙잡고 싶어하지만, 디아스는 새로운 도전에 관심을 보이고 있는 것으로 전해졌다. 바르셀로나도 디아스 영입에 관심을 보였으나, 재정적인 문제로 인해 협상이 무산됐고 결국 마커스 래시포드 영입으로 선회했다.

뮌헨은 루이스 디아스에게 꾸준한 관심을 보여온 빅클럽이다. 측면 자원의 전력 강화를 원하는 바이에른 뮌헨은 디아스를 콤파니 감독의 전술에 적합한 선수로 간주하고 있다.

<저작권자(c) 연합뉴스, 무단 전재-재배포, AI 학습 및 활용 금지>
<저작권자(c) 연합뉴스, 무단 전재-재배포, AI 학습 및 활용 금지>
바이에른 뮌헨은 디아스 영입에 6750만 유로(약 1000억원)의 초기 제안을 했으나 리버풀은 이를 거절했다. 리버풀은 디아스를 매각할 의사가 없으며 최소 1억 유로(약 1600억원)에 가까운 이적료를 요구하고 있다고 한다.

매체는 ""바이에른 뮌헨은 이미 디아스와 개인 조건에 합의한 상태로, 리버풀과 협상을 통해 이 금액을 낮출 수 있기를 기대하고 있다""라며 ""이에 따라 며칠 내로 약 8000만 유로(약 1290억원) 규모의 새로운 제안을 제출할 예정이다""라고 전했다.

그러나 수정된 제안도 리버풀이 원하는 금액에는 못 미칠 가능성이 있다. 디아스는 바이에른 뮌헨의 최우선 타깃이지만, 영입 실패 가능성을 염두에 두고 있다. 대체 자원으로는 말릭 포파나(리옹)를 낙점하고 영입 가능성에 대한 접촉도 시작한 것으로 알려졌다."
