date,title,content
20251003,"홍명보호 '오피셜' 공식발표, 獨 인종차별급 '무지성' 혹평 이겨냈다! ""묀헨글라드바흐 이달의 선수 등극"" 韓 혼혈 대표팀 카스트로프 극찬","[스포티비뉴스=박대성 기자] 옌스 카스트로프(22, 묀헨글라트바흐)가 독일 무대에서 입지를 다지고 있다. 9월 한국 대표팀에 차출된 이후 독일 매체의 '무지성' 혹평을 받았지만 당당하게 이겨내고 묀헨글라드바흐 이달의 선수에 올랐다.

묀헨글라트바흐는 3일(한국시간) 공식 채널을 통해 ""옌스 카스트로프가 치혼 퍼스널매니지먼트가 주관한 팬 투표에서 전체 득표의 45%를 얻어 9월의 선수상을 수상했다""고 발표했다. 이날 카스트로프는 로빈 하크(29%), 하리스 타바코비치(26%)를 큰 격차로 따돌리고 팬들의 선택을 받았다. 팬 투표에서 절반에 가까운 지지를 받으면서 묀헨글라드바흐 주전급 미드필더로 입지를 넓히고 있었다.
묀헨글라드바흐는 ""레버쿠젠전(1-1 무)에서 선발로 나서 안정적인 경기 운영을 보여주었고, 프랑크푸르트전(4-6 패)에서는 풀타임을 소화하며 데뷔골을 터트렸다. 경기 막판에는 동료의 득점까지 도우며 공수 양면에서 인상적인 활약을 펼쳤다. 이러한 활약이 팬들에게 깊은 인상을 남겼다""라며 카스트로프가 9월 보여준 활약을 구체적으로 설명했다.

실제 프랑크푸르트전에서 카스트로프는 유효 슈팅 2회, 태클 6회, 경합 승리 8회를 기록하며 그라운드 전역에서 눈에 띄는 에너지를 보였다. 비록 팀은 대량 실점 속 패배를 당했지만, 그는 통계 매체 '풋몹'으로부터 팀 내 최고 평점인 8.2점을 받으며 패배 속에서도 빛나는 존재감을 증명했다.



카스트로프는 묀헨글라드바흐 이달의 선수 수상후 인터뷰에서 ""솔직히 뭐라 표현하기 어렵다. 첫 골을 넣었을 때도, 이번 수상도 개인적으로는 기쁘지만 팀의 성적이 더 중요하다. 팬들의 인정을 받는 건 특별하지만, 팀의 성공이 내게는 우선""이라고 말했다.

카스트로프의 9월은 극적인 반전의 연속이었다. 올해 여름 독일 분데스리가에 입성해 기대를 모았지만, 시즌 초반까지만 해도 교체로 짧게 출전하는 정도였다. 주전 경쟁에서 뚜렷한 강점을 보여주지 못했다.

하지만 묀헨글라드바흐 감독이 바뀐 이후 레버쿠젠전에서 선발로 기회를 잡으며 안정적인 경기력을 보여줬다. 프랑크푸르트전에서는 전반에만 다섯 골을 내주며 무너진 팀 분위기 속에서도 후반 만회골을 기록하며 반격의 불씨를 지폈다. 이후 팀은 세 골을 더 넣으며 4-6까지 따라갔고, 완패로 끝난 경기였지만 '포기하지 않는 정신'을 보여주는 상징적인 장면이 됐다.

멀티 포지션 자원으로서 가치도 증명했다. 중앙 미드필더, 수비형 미드필더는 물론 측면 공격수와 풀백까지 소화하며 전술적 유연성을 더했다. 묀헨글라트바흐가 이제 카스트로프를 단순한 '로테이션 자원'이 아니라 스쿼드에 필요한 주전급 자원으로 생각하고 있다는 걸 보여주는 장면이었다. 실제 묀헨글라드바흐는 ""카스트로프는 여러 포지션을 소화할 수 있는 능력으로 팀 전술에 깊이를 더하고 있다""고 강조했다.

이 같은 활약은 불과 한 달 전 독일 유력 매체 '빌트'가 내놓았던 분석과 완전히 상반된다. 당시 독일 매체 '빌트'는 카스트로프가 한국 국가대표팀을 선택한 사실에 주목하며 ""그는 A매치 일정으로 팀 훈련과 샬케전(2-0 승)을 건너뛰었고, 장거리 이동으로 인한 시차 적응 문제가 생길 수 있다. 빡빡한 한국 대표팀 일정이 이어지면 묀헨글라드바흐에서 설 자리를 잃을 수도 있다""라고 부정적인 전망을 내놨다.



'빌트'는 카스트로프가 독일 대표팀 대신 한국 대표팀을 선택한 대가로 구단 내 입지를 잃을 수 있다는 전망을 했던 것. 하지만 현실은 달랐다. '빌트' 보도 이후 오히려 꾸준한 활약으로 팬들의 압도적인 지지를 받았고 '이달의 선수'까지 올랐다. '빌트'의 ""묀헨글라드바흐에서 입지를 잃을 것""이라는 비관적 전망을 보기 좋게 이겨낸 것이다.

더 나아가 카스트로프는 소속팀 활약을 바탕으로 국가대표팀에서도 입지를 굳히고 있다. 지난달 홍명보 감독의 부름을 받아 태극마크를 단 그는 미국, 멕시코와의 평가전에서 안정적인 경기력을 보여주었고, 이번 10월에도 브라질, 파라과이를 상대할 명단에 이름을 올렸다. 외국 태생 혼혈 선수로 한국 대표팀에 발탁된 첫 사례라는 상징성까지 더해지며 한국 축구 팬들에게도 주목받는 신예로 떠올랐다.

결국 이번 9월 이달의 선수상 수상은 단순히 한 달 잘한 선수에게 주어지는 개인적 영광이 아니다. 이는 곧 카스트로프가 팀의 중심으로 자리 잡았음을 상징하며, 대표팀과 소속팀 모두에서 영향력을 확장하고 있음을 보여준다.

불과 한 달 전 ""입지 하락""을 경고하던 독일 언론의 전망은 무색해졌고, 오히려 그는 독일과 한국 양국에서 동시에 주목받는 선수로 급부상했다. 앞으로 카스트로프가 브라질, 파라과이와의 A매치에서 어떤 활약을 보여줄지 기대된다."
20251003,"이렇게 좋은 선수, 토트넘만 누렸네...LA FC 초대박! ""손흥민 열풍, 유니폼 판매 역사상 최고 기록 예정""","사진=손흥민 SNS 캡처
AP연합뉴스
[스포츠조선 이현석 기자]토트넘만 10년 동안 누렸던 손흥민 효과, 이제는 LA FC가 누리고 있다.

스페인의 마르카는 2일(한국시각) 'LA에서 손흥민 열풍으로 한 달 만에 유니폼 150만장이 판매됐다'라고 보도했다.

마르카는 '손흥민은 MLS의 현역 선수다. 그는 리그뿐만 아니라, 도시에도 큰 영향을 미쳤다. 지난해 LA에서 리오넬 메시의 유니폼은 첫 달 동안 50만장이 판매됐다. 반면 손흥민은 첫 달 동안 150만장이 판매됐다고 추정된다. 이 수치는 MLS 역사상 최고 기록이 될 것이다'라고 전했다.

AP연합뉴스
올여름 10년 만에 토트넘 유니폼을 벗고 LA FC 유니폼을 입은 손흥민. 잉글랜드 프리미어리그(EPL)를 대표하는 스타의 이적에 많은 팬이 관심을 가졌다. 당초 파급 효과가 클 것이라는 예상은 많지 않았다. EPL을 비롯해 유럽에서 활약하던 스타 선수들이 미국 메이저리그사커(MLS)로 향하는 사례는 적지 않았다. 리오넬 메시를 비롯해, 티에리 앙리, 웨인 루니 등 여러 케이스가 있었기에 딱 그 정도 수준의 파급력을 예상했다.

하지만 MLS는 손흥민 효과로 판이 흔들리고 있다. 존 토링턴 LA FC 회장은 ""손흥민의 유니폼은 전 세계에서 가장 많이 팔리는 스포츠 유니폼이다""라며, 메시보다 많이 팔리냐는 질문에도 ""그렇다""라고 답했다. 상대 팀들도 손흥민 효과를 활용할 정도다. 대표적인 상대팀의 사례는 바로 새너제이 어스퀘이크다. 새너제이는 원래 1만 8천명을 수용하는 페이팔 스타디움을 홈구장으로 사용하는 팀이다. 하지만 손흥민이 온다는 말을 듣고 최대한 많은 인원을 수용하기 위해 리바이스 스타디움에서 경기장을 바꿔서 개최하기로 결정했다. 무려 경기장을 대여해 손흥민을 맞이할 정도로 열정적이었다.

효과는 대단했다. 6만 8천여명을 수용하는 이 구장에 손흥민을 보기 위해 무려 5만 978명이 입장했다. 새너제이의 기존 홈구장인 페이팔 스타디움 전체 수용 관중에 3배 이상의 규모였다. 손흥민의 티켓 파워를 짐작할 수 있는 부분이다. LA FC를 상대한 레알 솔트레이크 또한 이런 부분을 의식하며, 매치 프리뷰에 손흥민의 이름을 빼놓지 않았다.

AP연합뉴스
미국의 프론트오피스스포츠는 'LA 수뇌부는 손흥민을 오타니의 영입 사례와 함께 가능성과 잠재력을 보여주는 모델로 보고 있다고 알려졌다. 국가대표팀 주장, 잉글랜드 프리미어리그(EPL) 골든 부츠 수상자, 그리고 아시아 최우수 선수상을 아홉 번이나 수상한 것 외에도, 한국 문화와 손흥민의 특성은 바로 그가 만들어내는 슈퍼 팬덤에 있다. 손흥민의 홈 데뷔전 티켓 가격은 200달러 이상으로 치솟았다. 이는 LA FC 티켓 평균 가격의 두 배에 달하는 가격이다. 새롭게 마련된 입석 전용 구역도 매진됐다. 손흥민의 글로벌 팬덤을 통해 그 영향력은 더욱 커질 수 있다'고 설명했다.

이어 '한국에는 약 1200만 명의 토트넘 팬이 있다. 이는 전국민의 거의 25%에 해당한다. 10년 동안 토트넘 홈 경기가 열릴 때마다 한국 팬들과 국기를 흔히 볼 수 있었다. 많은 한국 토트넘 팬들이 LA FC를 응원할 것이며, LA 스포츠 관광도 급증할 것이라 예상된다'고 평가했다.

AP연합뉴스
손흥민 효과는 이미 잉글랜드에서는 토트넘이 10년 동안 누린 바 있다. 영국의 더 타임스는 과거 '손흥민은 팀의 심장이자 엔제 포스테코글루 시대의 빛나는 새로운 생명선이 됐다. 경기가 열리는 날 보통 손흥민의 유니폼이 700장 팔리곤 했는데, 케인이 떠난 이후에는 1000장에 가깝게 팔린다'라고 밝히기도 했다. 토트넘만 누렸던 손흥민을 통한 파급 효과가 LA도 덮치고 있는 셈이다.

손흥민 한 명의 효과가 구단에 막대한 이득을 안겨주고 있다. 상업적으로도, 축구적으로도 손흥민의 LA FC 이적은 구단에는 축복이나 다름없다."
20251003,‘아모링 나가!’ 맨체스터 유나이티드 ‘파격 결단’…‘EPL 111도움’ 라이벌 레전드 선임한다 “구단 재건 이끌 적임자로 판단”,"[골닷컴] 이정빈 기자 = 맨체스터 유나이티드가 세스크 파브레가스(38·스페인) 코모 감독을 눈여겨보고 있다. 구단 내부에서 파브레가스 감독을 적임자로 판단했다.

이탈리아 매체 ‘코리에레 코모’는 3일(한국 시각) “맨유는 파브레가스 감독이 후벵 아모링(40·포르투갈) 감독 뒤를 이어서 구단의 장기적인 재건을 이끌 적임자로 꼽았다”라고 보도했다.

다소 충격적인 소식이다. 파브레가스 감독은 현역 시절에 맨유 라이벌 구단인 아스널, 첼시 등에서 활약했다. 뛰어난 창의성으로 맨유를 괴롭히던 선수였다. 잉글랜드 프리미어리그(EPL) 최다 도움 3위(111도움)일 정도로 한 시대를 풍미한 스타 선수였다. 그런 그가 이제는 맨유 감독 후보로 거론되고 있다.

맨유는 빅리그에서 지도력을 뽐내고 있는 파브레가스 감독을 높이 평가하고 있다. 파브레가스 감독의 지도자 경험은 적어도 그가 보여준 성과에 깊은 인상을 받은 거로 보인다. 더 나아가 전술 능력만 아니라, 선수 육성에서도 니코 파스(21), 알렉스 바예(21) 등 좋은 사례가 있어서 팀을 장기적으로 이끌 적임자로 봤다.



파브레가스 감독은 2023년 코모에서 은퇴한 뒤 곧바로 지도자 길을 걸었다. 코모 B팀에서 시작해 1년 만에 1군 팀 지휘봉을 잡았다. 현역 시절 아스널, 바르셀로나, 첼시 등 세계적인 강팀에서 활약한 지도자답게 체계적인 움직임과 패스를 통해 경기를 풀어가고 있다.

파브레가스 감독 체제에서 코모는 지난 시즌 이탈리아 세리에 A 10위로 시즌을 마쳤다. 함께 승격한 파르마와 베네치아가 강등권에서 허덕일 때 코모는 놀라운 성과를 거뒀다. 이 덕분에 파브레가스 감독은 지난여름 인테르, 레버쿠젠 등 새로운 지도자가 필요한 강팀들과 이어지기도 했다.

파브레가스 감독은 이번 시즌에는 한층 더 안정적인 모습으로 중상위권에서 경쟁하고 있다. 개막 후 5경기에서 승점 8(2승 2무 1패)을 얻으며 돌풍을 이어가고 있다. 라치오, 피오렌티나 등 리그 강호들을 상대로 승점 3을 확보했다. 뚜렷한 상승세로 빅클럽들의 주목을 받고 있다.

한편, 현재 맨유를 이끄는 아모링 감독은 경질설에 별다른 반응을 보이지 않았다. 그는 지난달 27일 브렌트포드전 패배 이후 “그건 내가 할 결정이 아니기에 걱정하지 않는다. 난 이곳에서 매시간 최선을 다할 것이다”라며 “경질은 생각하지 않는다. 난 그런 사람이 아니다”라고 단호하게 말했다.

사진 = SNS 캡처, 게티이미지"
20251003,"'英 BBC 최고 평점' ""토트넘으로 복귀해!""...역경 이겨내고 드디어 터진 '손흥민 후계자', 상상 초월 극찬 등장 ""경이롭다""","사진=포츠머스 SNS 캡처
사진=포츠머스 SNS 캡처
[스포츠조선 이현석 기자]포츠머스 소속 첫 득점을 터트린 양민혁을 향한 찬사가 쏟아졌다.

포츠머스는 2일(한국시각) 영국 포츠머스의 프래튼 파크에서 열린 왓포드와의 2025~2026시즌 잉글랜드 챔피언십(2부리그) 8라운드 경기에서 2대2로 비겼다.

양민혁도 선발 출전했다. 지난 입스위치 타운과의 7라운드 경기에 이어 2경기 연속 선발 명단에 이름을 올렸다. 양민혁은 단 5분 만에 자신의 기량을 과시했다. 전반 5분 스로인 상황에서 수비가 제대로 처리하지 못한 공이 박스 안에서 흐르자, 양민혁은 이를 놓치지 않고 발리슛으로 마무리하며 골망을 흔들었다. 포츠머스 합류 이후 첫 득점이자, 시즌 1호골이었다. 포츠머스는 양민혁의 득점 이후 2골을 실점했으나, 후반 34분 아드리안 세게치치의 동점골로 패배 위기를 모면했다.

양민혁은 이날 경기 63분을 소화하며 1골과 더불어 슈팅 4회, 패스 성공률 82%, 드리블 성공 1회, 롱패스 성공 1회, 경합 성공 3회 등을 기록하며 활약했다.

사진=포츠머스 SNS 캡처
그간의 아쉬웠던 평가를 반전시킨 경기력이었다. 양민혁은 올여름 출전 시간을 확보하기 위해 챔피언십(2부리그) 소속인 포츠머스 임대를 결정했고, 구단 역사상 첫 한국 선수로 합류하게 됐다. 존 무시뉴 포츠머스 감독의 기대가 컸다. 양민혁에 대해 ""왼쪽에서 보여준 날카로움은 인상적이었다. 토트넘에서부터 큰 기대를 하고 있다""고 밝히기도 했다.

하지만 양민혁의 활약은 아쉬웠다. 리그컵 레딩전에서 첫 선발 출전에도 제대로 기량을 선보이지 못했고, 상대의 빡빡한 수비에 고전하며 위협적인 장면도 만들지 못했다. 양민혁을 향한 포츠머스 팬들의 반응도 차가웠다. 일부 팬들은 SNS를 통해 ""형편없었다"", ""토트넘으로 돌려보내야 한다"", ""양민혁은 안타깝게도 경기에 출전하게 된 어린 아이 같았다""고 평가했다.

이후 양민혁은 계속해서 포츠머스 경기에서 모습을 찾아볼 수 없었다. 레딩전 이후 4경기 연속 벤치에만 앉았고 출전은 성사되지 않았다. 다만 기대를 품게 한 발언이 나왔다. 리치 휴즈 디렉터가 양민혁이 기회를 얻을 것이라고 강조했다. 휴즈는 ""양민혁은 정말 잘해왔다. 프리시즌 동안 토트넘 1군에서 출전 시간이 많지 않아서 힘들었던 것 같다. 조금 뒤로 밀려났다. 양민혁은 한 번도 빠진 적이 없고 이번에 처음으로 제대로 된 통합 훈련 기간을 가졌다. 모두에게 자신이 얼마나 좋은 선수인지 보여줬다. 그에게 정말 만족하고 있다. 기회를 얻을 것이고 얼마나 재능 있는 선수인지 모두에게 보여줄 것이라 확신한다""고 했다. 하지만 양민혁은 곧바로 기회를 받지 못했다.

사진=포츠머스 SNS 캡처
이후 부상 문제까지 겪으며 양민혁의 시간은 점점 더 멀어지는 듯 보였다. 하지만 부상 복귀 후 무시뉴 감독이 양민혁을 다시 선발로 기용하기 시작하며, 드디어 시즌 첫 골로 활약의 신호탄을 쏘아올렸다.

칭찬도 쏟아졌다. 영국의 BBC는 '양민혁이 박스 모서리에서의 환상적인 발리슛으로 5분 만에 리드를 안겼다'며 최고 평점인 7.08점을 부여했다. 영국의 폼페이뉴스 또한 양민혁에게 팀 내 최고점인 8점과 함께 ""경이로웠다. 그는 지난 토요일에는 동점골 기회를 놓치며 분노를 샀다. 하지만 이번 왓포드전에서는 만회하며 팀을 이끌었다. 전반 초반 훌륭한 골과 함께 지배적인 모습을 보여주며 큰 역할을 했다""고 칭찬했다.

토트넘 팬들 또한 흥분을 숨기지 못했다. 영국의 TBR풋볼은 '양민혁의 활약에 토트넘 팬들이 응원의 목소리를 보냈다. 토트넘 팬들은 포츠머스에서 양민혁의 첫 골에 환호했다.'고 했다. 팬들은 ""공을 잡을 때마다 그의 재능이 드러난다. 이제 포츠머스에서 제대로 된 출전 시간을 확보하고 있고, 그 효과가 나타나기 시작했다"", ""그냥 다시 토트넘으로 불러와라""라며 긍정적인 반응을 보였다.

올 시즌 첫 골과 함께 양민혁이 전진을 시작했다. 활약을 이어간다면 차기 시즌 토트넘 1군 경쟁에서도 청신호가 켜질 수 있다."
20251003,"""넌 내일 아침 경질될거야"" 코리아듀오 조규성-이한범, 포스테코글루 감독 울렸다...미트윌란, 노팅엄 3-2 제압","[스포티비뉴스=신인섭 기자] 조규성과 이한범이 엔제 포스테코글루 감독에게 좌절을 안겼다.

미트윌란FC는 3일 오전(한국시간) 영국 노팅엄에 위치한 시티 그라운드에서 펼쳐진 2025-2026시즌 유럽축구연맹(UEFA) 유로파리그(UEL) 리그 페이즈 2차전에서 노팅엄 포레스트에 3-2로 승리했다.

미트윌란의 마이클 툴버그 감독은 이날도 조규성을 선발 명단에 배치했다. 조규성은 부상에서 돌아와 정상 폼을 되찾는 과정 속에 있다. 다행히 점차 출전 시간을 늘려가면서 스트라이커의 면모를 보여주는 중. 지난 4경기에서 3골을 기록했다. 이에 다시 한번 최전방을 책임졌다.

반면 이한범은 벤치에서 시작했다. 이한범은 올 시즌 팀 내 주전 센터백으로 자리매김했다. 기존 자원들의 부상 탓도 있으나, 해당 선수들의 공백을 확실하게 메워주면서 입지를 다지고 있다. 올 시즌 이미 15경기에 출전했을 만큼 감독의 신임도 두텁다. 다만 이날은 교체로 그라운드를 밟았다.

▲ ⓒ연합뉴스/AP


경기는 미트윌란이 먼저 앞서 나갔다. 전반 18분 프리킥 공격 상황에서 베크 쇠렌세가 머리로 방향을 바꿔 놨고, 이를 쇄도하던 우스만 디아오가 밀어 넣어 선제골을 뽑아냈다. 노팅엄도 반격에 나섰다. 전반 22분 모건 깁스-화이트가 찔러준 정확한 패스를 페널티 박스 안에서 단 은도예가 마무리하며 동률을 만들었다.

하지만 미트윌란이 재차 리드를 잡았다. 실점 2분 만에 코너킥 공격 과정에서 쇠렌세가 집중력을 발휘하며 골망을 흔들었다. 결국 전반은 미트윌란이 2-1로 앞선 채 마무리됐다. 후반에 미트윌란은 교체 카드를 활용하면서 지키기에 나섰다. 후반 21분 이한범이 투입됐고, 조규성은 교체 아웃됐다.

한 골의 향방이 중요해진 타이밍에 미트윌란이 쐐기를 박았다. 후반 43분 라인을 올린 노팅엄의 뒷공간을 미트윌란이 파고들었다. 이 과정 속 오소리오의 킬러 패스를 받은 발데마르 안드레아센이 침착한 마무리로 승부에 방점을 찍었다. 미트윌란은 후반 추가시간 한 점을 허용했으나, 최종 스코어 3-2로 웃었다.

▲ ⓒ연합뉴스/Reuters


결국 포스테코글루 감독은 다시 한번 승리를 놓쳤다. 지난 9월 노팅엄에 부임한 이후 여섯 경기에서 단 한 차례의 승리도 거두지 못하고 있다. 해당 기간 2무 4패를 기록 중이다. 이에 노팅엄 팬들이 분노했다. 경기 종료 휘슬이 울린 직후 ""넌 아침에 해고당할 거야""라는 챈트를 부르며 분노를 표했다.

불명예 역사를 썼다. 영국 '데일리 메일'은 ""포스테코글루 감독은 100년 만에 노팅엄에 부임 후 첫 6경기에서 한 번도 승리하지 못한 감독이 됐다. 거의 30년 만에 시티 그라운드에 치른 노팅엄의 유럽대항전 첫 경기는 참패로 끝났다""라고 보도했다.



이에 대해 포스테코글루 감독은 이해한다는 반응이다. 그는 경기 종료 후 ""팬들은 실망했고, 자신들의 의견을 말할 권리가 있다. 내가 통제할 수 있는 건 아무것도 없다. 그저 승리를 거두는 게 중요할 뿐이다""라고 말했다.

이어 ""분위기가 좋지 않을 것이라는 것을 알고 있다. 특히 나에 대해 어떤 태도를 취하는지 이해한다. 하지만 익숙한 영역이다. 우리가 올바른 길로 가고 있다고 믿는다. 이 시기를 극복하면 좋은 길로 나아갈 수 있을 것""이라고 덧붙였다."
