date,title,content
20250910,"'손흥민 절친 데려간다'…'포스테코글루 선임' 노팅엄 포레스트, 토트넘에서 선수 영입","손흥민과 데이비스/게티이미지코리아
손흥민과 데이비스/게티이미지코리아

[마이데일리 = 김종국 기자] 토트넘에서 경질됐던 포스테코글루 감독이 프리미어리그 무대에 복귀했다.

노팅엄 포레스트는 9일 포스테코글루 감독 선임을 발표했다. 누누 에스피리투 산투 감독이 지난 8일 노팅엄 포레스트 감독에서 사임한지 하루 만에 포스테코글루 감독이 선임됐다.

포스테코글루 감독을 선임한 노팅엄 포레스트의 마리나키스 구단주는 ""우리는 입증되고 꾸준한 우승 경력을 가진 감독을 영입하게 됐다. 최고 수준의 팀을 지도한 포스테코글루 감독의 경험과 노팅엄 포레스트에서 무언가 만들어가고자 하는 포스테코글루 감독의 열망은 우리의 여정을 돕고 모든 야망을 꾸준히 달성할 수 있도록 도울 것이다. 노팅엄 포레스트는 프리미어리그 승격을 확정한 후 유럽무대를 장악하기 위해 매 시즌 성장했다. 우리는 이제 최고의 팀들과 경쟁하고 트로피에 도전해야 한다""며 의욕을 드러냈다.
영국 익스프레스는 10일 포스테코글루 감독이 선임된 노팅엄 포레스트가 1월 이적시장에서 영입할 가능성이 있는 토트넘 소속 선수 4명을 지목했다. 이 매체는 드라구신, 데이비스, 텔, 우도지의 노팅엄 포레스트 이적 가능성을 점쳤다.

익스프레스는 '드라구신은 포스테코글루 감독이 토트넘에서 두 시즌 동안 영입한 여러 선수 중 한 명이다. 드라구신은 포스테코글루 감독이 선호하는 수비 스타일을 보유한 선수다. 토트넘의 선발 명단에서 제외된 것 같은 드라구신은 1월 노팅엄 포레스트에 매력적인 선택이 될 수 있다'며 '텔은 1월 이적 시장 마감일에 합류해 포스테코글루 감독이 토트넘에서 영입한 마지막 선수다. 토트넘이 임대 영입한 텔은 완전 이적에 성공했지만 챔피언스리그 엔트리에서 제외되며 토트넘에서의 미래에 대한 의문이 제기됐다. 텔을 영입하는 것은 노팅엄 포레스트의 이적시장 예산 범위를 벗어나겠지만 시즌 중반 임대 영입될 수도 있다'고 언급했다.

또한 '데이비스는 여름 이적시장에서 토트넘을 떠날 것이라는 추측이 있었지만 여전히 토트넘에 남아있다. 하지만 시즌 종료 후 계약이 만료되는 데이비스가 재계약 제안을 받을 가능성은 낮다. 토트넘을 떠날 가능성이 높은 데이비스를 영입하는 것은 포스테코글루 감독의 단기적인 선택지가 될 가능성이 높다'며 '우도지는 포스테코글루 감독의 토트넘 초기 시절 프리미어리그에서 독보적인 윙백 중 한 명이었지만 계속되는 부상으로 스펜스에게 주전 자리를 내줬다. 우도지에게 포스테코글루 감독의 노팅엄 포레스트가 피난처가 될 수도 있다'고 덧붙였다.
포스테코글루 감독과 레비 회장/게티이미지코리아
손흥민과 포스테코글루 감독/게티이미지코리아"
20250910,"""치차리토, 이제 은퇴하고 다른 선수들에게 기회 줘라""…멕시코 전설의 소신 발언","[인터풋볼=주대은 기자] 멕시코 축구 전설 콰우테모크 블랑코가 하비에르 에르난데스(치차리토)에게 은퇴하라고 조언했다.

영국 '골닷컴'은 10일(한국시간) ""블랑코는 치바스에 복귀한 뒤로 어려운 시간을 보내고 있는 치차리토에게 강하지만 솔직한 메시지를 보냈다. 치차리토는 35경기에서 단 3골을 기록하고 있다""라고 보도했다.

치차리토는 멕시코 축구 국가대표 출신 공격수다. 과달라하라에서 성장해 잠재력을 가진 선수라는 평가를 받았다. 그에게 주목한 팀은 다름 아닌 맨체스터 유나이티드였다. 2010-11시즌을 앞두고 맨유가 그를 영입했다. 당시 유럽 무대 경험이 없었던 치차리토를 향해 의심의 시선이 있었다.

의심은 기우에 불과했다. 치차리토는 맨유 첫 시즌 45경기 20골 5도움을 몰아치며 맷 버스비 경 올해의 선수에 선정됐다. 2011-12시즌엔 부상으로 인해 36경기 12골 3도움을 기록했다. 2012-13시즌엔 조커로 활약하며 36경기 18골 8도움을 만들었다.



다만 치차리토의 컨디션이 떨어지기 시작했다. 2013-14시즌엔 36경기 10골 4도움에 만족해야 했다. 2014-15시즌엔 레알 마드리드로 임대를 떠나 교체 자원으로 활약하며 33경기 9골 9도움을 기록했다.

치차리토는 2015-16시즌 맨유를 떠나 레버쿠젠에 합류하며 새로운 도전에 나섰다. 결과는 준수했다. 그는 레버쿠젠에서 76경기 39골 9도움을 기록하며 여전한 기량을 자랑했다. 이후 웨스트햄 유나이티드, 세비야, LA 갤럭시 등을 거쳤다. 현재 과달라하라에서 뛰고 있다.

최근 치차리토가 부진하고 있다. 그도 그럴 것이 치차리토는 현재 만 37세다. 다른 선수라면 은퇴를 택할 나이지만, 아직 뛰고 있다. 그는 ""내가 항상 말했듯이 대표팀에서 은퇴하지 않는 한 월드컵은 항상 내 마음속에 있다""라며 북중미 월드컵에 대한 욕심을 드러내기도 했다.



그러나 멕시코 전설 블랑코는 다른 의견이었다. 그는 ""난 비판하는 걸 좋아하지 않지만, 내 생각엔 치차리토는 은퇴해야 한다. 요즘 젊은 선수들은 더 빠르고 더 잘 준비돼 있다. 모든 존중을 담아 말하자면, 치차리토는 축구화를 벗고 젊은 선수들에게 기회를 줘야 한다""라고 말했다.

이어서 ""누구에게나 힘든 일이다. 은퇴는 복잡한 일이다. 선수들이 그리워하는 건 라커룸 분위기, 동료와 우정, 농담들이다. 하지만 결국 '이제 끝이다. 더 이상 못 하겠다'하는 순간이 찾아온다""라고 이야기했다.

블랑코는 ""치차리토는 유럽에서 믿을 수 없는 일들을 해냈다. 하지만 언제 물러나야 할지도 알아야 한다. 그가 고전하고 있는게 보인다. 내 의견으론 그는 할 수 있을 때 은퇴해야 한다. 레알 마드리드와 맨유에서 많은 골을 넣었지만 결국 결정은 본인이 내려야 한다""라고 덧붙였다."
20250910,"졸렬한 日, 패배에 ""우리는 2군도 아닌 3군"" 변명...美는 ""우리도 주전 없는데?""","[OSEN=이인환 기자] 전설의 1군은 언제 모일 것인가.

일본 대표팀은 10일(한국시간) 미국 오하이오주 콜럼버스 로우어닷컴 필드에서 열린 미국과의 평가전에서 0-2로 패배했다. 이로써 지난 멕시코전 무승부(0-0)에 이어 9월 원정을 1무 1패로 마감했다.

경기 초반부터 일본은 미국의 강한 압박에 고전했다. 전반 30분 왼쪽 측면에서 올라온 크로스를 알레한드로 젠데야스가 강력한 오른발 발리슛으로 연결하며 선제 실점을 허용했다. 이후 일본은 이토 준야를 중심으로 만회골을 노렸지만 미국 골키퍼의 선방에 막혔다.

후반 들어 미나미노 다쿠미, 가마다 다이치, 미토마 가오루 등을 투입하며 반격에 나섰으나 결과는 달라지지 않았다. 오히려 후반 19분 크리스천 풀리식의 패스를 받은 플로리안 발로건이 침착한 왼발 슈팅으로 추가골을 터뜨리며 승부에 쐐기를 박았다.


일본은 경기 막판까지 미토마의 슈팅 등 여러 차례 기회를 잡았지만 끝내 득점에 실패했다. 오사코 게이스케 골키퍼가 선방으로 추가 실점을 막아냈음에도, 전체적으로 공격 전개와 수비 안정감 모두에서 한계를 드러냈다.

결국 일본은 미국의 빠른 전환과 강한 압박을 끝내 극복하지 못하며 0-2로 완패했다. 월드컵 본선을 앞둔 모리야스호에 또 하나의 숙제가 생겼다.
경기 종료 후 일본 '스포니치 아넥스'에 따르면 모리야스 하지메 일본 감독은 ""일본 현지서 아침부터 응원해주신 팬분들에게 정말 죄송하다""라며 고개를 떨궜다.

이어 그는 ""2경기에서 승리를 보여드리지 못했고 한 골도 넣지 못한 것이 매우 아쉽다. 기회를 만들기는 했으나 세계 무대에서 싸우기 위해서는 골문 앞의 퀄리티를 끌어 올려야 한다""라고 이야기했다. 


해당 소식을 전하면서 스포니치 아넥스는 ""모리야스호에 무슨 일이 생긴 것인가""라며 ""일본은 미국과 이번이 통산 4번째 맞대결로, 이전까지는 2승 1패로 앞서 있었다. 가장 최근 맞대결은 2022년 기린챌린지컵에서 2-0으로 승리했지만, 이번에는 결과가 정반대였다""라고 전했다.

이어 ""실점 후 일본은 미국의 압박에 고전하며 수세에 몰렸다. 하지만 전반 36분 미드필더 스즈키의 패스를 받은 이토가 슬라이딩 슛을 시도했으나, 상대 골키퍼의 선방에 막혔다. 후반에는 시스템을 4-2-3-1로 전환해 반격에 나섰다. 그러나 후반 19분 왼쪽 측면이 무너지며 추가 실점을 허용했다""라고 짚었다. 

한편 패배에 대해 일본은 수비 주역들이 빠진 2군 위주의 멤버라는 변명을 내세우고 있다. 일부 네티즌들은 주력 수비수들이 빠진 자리에 로테이션까지 가동했으니 3군이라는 주장을 내세우고 있다. 말 그대로 패배에 대한 졸렬한 반응.

미국 'CBS 스포츠'는 ""포체티노호가 터닝 포인트를 만들었다. 말 그대로 중요한 승리로 상대를 압도했다""라면서 ""일본의 멤버가 로테이션이라는 평가도 있지만 미국도 주력이 빠졌다""라면서 그들의 변명을 원천차단했다.

/mcadoo@osen.co.kr"
20250910,"'맨유 아니면 안가' 외쳤던 음뵈모, ""빅클럽 부담 있지만, 즐겁게 적응 중""","[인터풋볼=김현수 기자] 브라이언 음뵈모가 맨체스터 유나이티드 선수로서 부담감은 있지만 순조롭게 적응 중이라고 밝혔다.

맨체스터의 소식을 전하는 '맨체스터 이브닝 뉴스'는 9일(한국시간) ""음뵈모가 맨유 입단 후 소회를 밝혔다. 그는 출발은 힘들었지만, 맨유 생활을 즐기고 있다고 말했다""고 보도했다.

앞서 맨유는 이번 여름 이적시장 브렌트포드와 세 차례 협상 끝에 6,500만 파운드(약 1,120억 원) 이적료로 음뵈모를 영입했다. 새로운 공격진을 원했던 루벤 아모림 감독의 요청에 따라 맨유가 팔을 걷어 올렸다. 그 결과 마테우스 쿠냐와 더불어 벤자민 세슈코까지 데려오며 공격진을 강화했다. 새 얼굴의 골잡이들 가운데 음뵈모 활약이 가장 인상적이다.

아모림 감독은 음뵈모를 10번 역할과 최전방을 오가는 활용도로 기용했다. 음뵈모는 그 역할을 잘 해내고 있다. EFL(카라바오컵) 그림즈비전에서 시즌 첫 골, 이어 번리와의 잉글랜드 프리미어리그(PL) 경기에서 리그 첫 골을 넣으며 맨유 공격진을 진두지휘하고 있다.



맨유는 현재 1승 1무 1패로 아쉬운 성적이지만, 아모림 감독은 ""팀을 넓혀주는 움직임과 첫 터치 모두 인상적이다. 지난 시즌에는 그런 어려움이 있었지만, 올해는 다르다. 음뵈모가 있으면 우린 다른 팀이 된다""며 칭찬했다.

이렇듯 맨유에 서서히 녹아들고 있는 음뵈모. 하지만 그도 처음에는 부담감이 있었다고 털어놨다. 음뵈모는 ""맨유는 빅클럽이라 기대를 많이 했다. 정말 많은 게 크다. 처음 도착하면 나는 잘 모르는 곳이라 목소리를 크게 내거나 나를 드러내고 싶지는 않다""고 이야기했다.

그러면서도 새로운 도전에 대한 각오를 다졌다. 음뵈모는 ""여기서 내가 맞이한 것들, 동료들, 스태프 등 모든 사람들이 정말 좋은 사람들이다. 매일 이곳에 와서 훈련하고 싶게 만든다. 올 시즌 최선을 다해 팀에 보답하겠다""고 덧붙였다,"
20250910,"'초대박' 김민재, 뮌헨 주전 다가온다...'핵심 CB' 레알 마드리드 전격 러브콜! 獨 'BBC급' 매체 보도","다요 우파메카노와 김민재/게티이미지코리아

[마이데일리 = 최병진 기자] 바이에른 뮌헨의 주전 수비수 다요 우파메카노가 레알 마드리드의 관심을 받고 있다.

독일 ‘빌트’는 9일(이하 한국시각) “레알은 우파메카노 영입에 관심을 보이고 있다”고 보도했다.

우파메카노는 프랑스 국적으로 잘츠부르크와 라이프치히를 거쳐 2021-22시즌에 뮌헨 유니폼을 입었다. 그는 뛰어난 주력과 강력한 피지컬을 자랑하며 점차 뮌헨 수비의 중심으로 거듭났다. 대인 마크와 함께 뛰어난 패스 정확도까지 갖추며 분데스리가 최고의 수비수 반열에 올랐다.
지난 시즌에는 김민재와 함께 부동의 중앙 수비진을 구성했다. 두 선수는 최고의 호흡을 자랑하며 분데스리가 타이틀을 획득했다.

이번 시즌에는 파트너가 달라졌다. 뮌헨은 여름 이적시장에서 요나단 타를 영입했다. 뮌헨은 타를 영입하면서 김민재를 매각할 계획이었다. 하지만 김민재의 이적이 이루어지지 않았고 타와 우파메카노가 주전 라인업을 구성했다.

다요 우파메카노/게티이미지코리아

특히 우파메카노의 경기력이 최고 수준을 자랑하고 있다. 독일 'FCB인사이드'에 따르면 우파메카노는 뮌헨에 이어 프랑스 국가대표팀의 중심으로 거듭났으며 우파메카노가 출전한 마지막 500경기 동안 프랑스는 단 한 골도 허용하지 않았다.

이런 상황에서 레알의 관심 소식이 전해졌다. 레알은 최근 이적시장에서 수비진 개편에 힘을 쏟고 있다. 이번 시즌을 끝으로 안토니오 뤼디거, 다비드 알라바와의 계약이 만료되기에 새로운 센터백 영입은 필수가 됐다. 그러면서 우파메카노를 영입 리스트에 올려두었다.

다요 우파메카노와 김민재/게티이미지코리아

뮌헨 입장에서 레알의 관심이 불안한 이유는 재계약 문제 때문이다. 우파메카노는 내년 여름에 뮌헨과의 계약이 만료되지만 아직까지 재계약에 대한 합의점을 찾지 못했다. 주급에 대한 뮌헨과 우파메카노 측의 의견 차이가 계속되고 있다. 만일 재계약이 체결되지 않는다면 레알은 FA(자유계약)로 우파메카노를 영입할 기회를 갖게 된다.

뮌헨 입장에서는 핵심 선수를 잃을 수 있는 위기지만 최근 주전에서 멀어진 김민재에게는 새로운 터닝 포인트가 될 수 있는 시점이다."
20250910,"[오피셜] 우승 청부사가 돌아왔습니다...'손흥민과 유로파 우승' 포스테코글루, 누누 잘린 노팅엄 부임","사진=노팅엄


[포포투=김아인]

엔제 포스테코글루가 노팅엄 포레스트에 부임하면서 프리미어리그(PL)에 3개월 만에 복귀했다.

노팅엄은 9일(이하 한국시간) 구단 홈페이지를 통해 ""포스테코글루가 우리의 1군팀 감독으로 임명되었음을 기쁘게 생각한다. 프리미어리그 승격 후 유럽 무대를 장악하기 위해 매 시즌 꾸준히 성장한 우리는 이제 최고의 팀들과 경쟁하고 트로피에 도전하기 위해 올바른 발걸음을 내딛어야 한다. 포스테코글루는 이를 위한 자격과 커리어를 갖고 있다. 우리의 야심 찬 여정에 그가 함께하게 되어 매우 기쁘다""라고 공식 발표했다.
포스테코글루 감독은 과거 아시아 무대에서 주로 활약했다. 현역 은퇴 이후 지도자 생활을 시작했던 그는 호주 국가대표팀 감독으로 아시안컵 우승을 이끌었고, 일본 요코하마 F.마리노스를 감독하면서 J리그 무대를 경험했다. 이후 셀틱으로 건너간 뒤 오현규를 비롯해 후루하시 쿄고, 마에다 다이젠 등 아시아 선수들을 적극 기용하기도 했다.

지난 2023-24시즌 토트넘 홋스퍼에 부임했다. 손흥민에게 토트넘 주장 완장을 맡기면서 구단 역사상 최초의 비유럽인 주장을 탄생시켰다. 초반엔 화끈한 공격 축구를 선보이며 프리미어리그(PL) 선두를 노리기도 했고, 토트넘 팬들의 큰 지지를 얻었다. 하지만 전술적 한계를 극복하지 못하면서 성적도 점점 내리막길을 걸었다. 

사진=토트넘


지난 시즌엔 최악의 부진을 맞이했다. 포스테코글루 감독은 시즌 초 ""나는 2번째 시즌에 우승했다""라고 밝히면서 자신감을 보였지만, 토트넘이 초반부터 부진한 출발을 알렸고, 줄부상이 겹치면서 리그 17위까지 떨어졌다. 토트넘 팬들의 인내심은 한계에 달했고, 경질설이 점차 심화되어 갔다.

마지막 시험대에서 토트넘의 오랜 숙원이었던 우승컵을 안겼다. 토트넘은 유럽축구연맹(UEFA) 유로파리그(UEL)에서 맨체스터 유나이티드를 꺾고 17년 만에 메이저 대회 트로피를 들어올렸다. 손흥민 또한 커리어 첫 트로피를 안게 되며 명실상부 토트넘 레전드가 되었다. 하지만 리그 성적 부진에 대한 책임을 피하지 못하면서 지난 6월 토트넘에서 경질됐다. 차기 감독으로 브렌트포드를 이끌던 토마스 프랭크가 부임했다. 

비록 트로피를 선사하고도 불명예스러운 경질을 맞이했지만, 막대한 위약금을 챙긴 것으로 전해진다. 영국 '텔레그래프'에서 활동하는 맷 로 기자는 ""다니엘 레비 회장은 포스테코글루를 경질할 경우 400만 파운드(약 70억 원) 위약금을 물 수 있다. 그가 유로파리그 우승으로 받은 성과금은 200만 파운드(약 35억 원)에 추가 보너스가 포함된다""고 설명했던 바 있다.

사진=게티이미지


토트넘을 떠난 뒤에는 여러 행선지가 후보로 꼽히기도 했다. 사우디아라비아 클럽에 부임한다는 소문이 있었고, 손흥민의 이적으로 최근 화제가 된 LAFC와 연결되기도 했다. 하지만 당장 팀을 새로 찾지는 않으면서, 3개월간 무직 신분을 유지하고 있었다. 최근엔 에릭 텐 하흐를 2개월 만에 자른 레버쿠젠과 조세 무리뉴가 쫓겨난 페네르바체와 연결됐지만, 포스테코글루가 프리미어리그 복귀를 선호했다고 전해진다.

그러면서 노팅엄행이 급물살을 탔다. 노팅엄은 지난 시즌 누누 에스피리토 산투와 함께 30년 만에 유럽대항전 진출이라는 새 역사를 썼다. 두 시즌간 잔류 경쟁을 하다가 7위라는 준수한 성적을 거뒀음에도 구단에서는 UEFA 챔피언스리그(UCL) 진출이 무산된 데에 불만을 갖고 있었다. 여기에 여름 동안 누누가 에반젤로스 마리나키스 구단주와 갈등을 겪으면서 불화가 절정에 달했다. 결국 누누와 1년 10개월 만에 이별하고, 포스테코글루가 후임으로 오게 됐다.

노팅엄 구단주 마리나키스는 포스테코글루 구단 홈페이지를 통해 ""우리는 트로피를 꾸준히 들어 올린 검증된 경력을 가진 감독을 구단에 데려왔다. 최상위 무대에서 팀을 지휘해 온 그의 경험과, 우리와 함께 특별한 무언가를 만들어가려는 열망은, 그가 노팅엄의 여정에 함께하며 우리의 모든 목표를 꾸준히 달성하는 데 큰 힘이 될 것임을 보여준다""고 기대감을 전했다.

사진=게티이미지"
20250910,"뮌헨, 단장 돌연 '충격적인 고백' 김민재, 최악의 상황 직면...獨 1티어 ""KIM, 올여름 매각 후보 확실"" 우파메카노, 1순위로 결정","[SPORTALKOREA] 박윤서 기자= FC 바이에른 뮌헨의 시즌 플랜에 김민재는 없었다는 주장이 제기됐다.

독일 '스폭스'는 8일(한국시간) ""뮌헨은 최근 다요 우파메카노의 계약 연장 논의를 잠시 중단했으나 다시금 속도를 내고 있다""라고 전했다.

이어 ""뮌헨은 여름 이적시장이 종료된 후, 팀 구성 계획을 확고히 하고 있다. 이들은 우파메카노를 1순위로 보고 재계약을 최우선 과제로 삼을 전망이다""라고 덧붙였다.



매체가 인용한 높은 공신력을 자랑하는 '빌트'는 최근 김민재와 우파메카노의 희비가 다소 엇갈릴 수 있는 보도를 내놨다.

빌트는 ""김민재는 올여름 뮌헨에서 쫓겨날 위기에 처해 있었다. 그는 끝내 구단에 남았지만, 뮌헨에서 시간이 얼마 남지 않았음을 알 수 있는 대목이다""라고 주장했다.

매체는 뮌헨 막스 에베를 단장이 클럽월드컵이 종료되는 대로 김민재, 주앙 팔리냐를 매각하겠단 의지를 확고히 했다고 강조했다. 



다만 구단을 만족하게 만들 수 있는 수준의 오퍼는 도착하지 않았고, 뮌헨은 김민재와 동행을 이어가게 됐다.

스폭스 역시 비슷한 결의 주장을 펼쳤다. 뱅상 콤파니 감독 체제 뮌헨에서 우선순위 센터백은 우파메카노와 영입생 요나단 타 임을 알렸다. 그러면서 김민재는 훌륭한 백업이지만, 괜찮은 오퍼가 있을 시 매각할 수 있는 자원임을 분명히 했다.

사진=뮌헨 SNS, 게티이미지코리아

취재문의 sportal@sportalkorea.co.kr"
20250910,"‘무득점 참사’ 일본, 미국에 완패... 日 언론 “미국전 패배, 2013년 이후 최악의 기록 남겼다”","[사진] ⓒGettyimages(무단전재 및 재배포 금지)


[OSEN=우충원 기자] 미국에 완패를 당한 일본의 분위기가 심상치 않다. 현지 언론은 이번 패배로 드러난 부진한 기록들을 조목조목 지적하며 우려를 드러냈다.

모리야스 하지메 감독이 이끄는 일본은 10일(한국시간) 미국 오하이오 로우어닷컴필드에서 열린 A매치 친선경기에서 미국에 0-2로 졌다. 미국은 불과 사흘 전 한국과의 경기에서 무기력하게 패했던 팀이었다.

그러나 일본은 전반 30분 알레한드로 젠데야스, 후반 19분 폴라린 발로건에게 연속 골을 내주며 무너졌다.

앞서 7일 멕시코와의 경기에서도 득점 없이 0-0 무승부에 그쳤던 일본은 이번 9월 투어 2연전을 1무 1패, 무득점이라는 초라한 성적으로 마쳤다.

2026 FIFA 북중미월드컵 본선 진출을 확정한 뒤 본격적으로 ‘우승 도전’을 준비하던 시점에서 나온 결과라 충격은 더 크다.

일본 언론도 날카롭게 반응했다. <니칸스포츠>는 일본이 남긴 좋지 못한 기록들을 나열했다. 한 달 내 A매치 2연전을 무득점으로 마친 것은 2013년 10월 이후 12년 만의 일이다. 또 2경기 연속 무승은 2023년 3월 우루과이전(1-1)과 콜롬비아전(1-2) 이후 2년 6개월 만이다. 여기에 0-2 완패는 2022년 6월 튀니지전 0-3 패배 이후 처음이다.

[사진] ⓒGettyimages(무단전재 및 재배포 금지)
[사진] ⓒGettyimages(무단전재 및 재배포 금지)
모리야스 감독도 문제를 인정했다. 그는 경기 후 “스리백을 넓게 쓰는 팀을 상대로 어려움을 겪었다. 전술적인 보완이 필요하다”고 밝혔다.

일본은 다음 달 안방에서 파라과이, 브라질을 차례로 상대한다. 남미 강호들과의 연전은 현재 팀의 수준을 다시 확인할 기회가 될 전망이다.  / 10bird@osen.co.kr"
