date,title,content
20250829,"토트넘 대충격! 또또또 '큰 망신' 위기…'손흥민 대체자' 런던 왔는데 ""그는 첼시 좋아해, 거기 원한다"" 英 언론 비관적","(엑스포츠뉴스 윤준석 기자) 토트넘 홋스퍼가 여름 이적시장의 막바지에서 또다시 치열한 영입전을 벌이고 있다.

이번 목표는 독일 분데스리가 RB라이프치히에서 활약 중인 네덜란드 국가대표 미드필더 사비 시몬스다.

하지만 상황은 단순하지 않다. 협상을 위해 이미 런던에 도착한 시몬스를 두고 토트넘과 첼시가 맞붙는 모양새가 됐다. 선수 본인이 첼시행을 선호한다는 보도까지 나오면서 토트넘이 또 한 번 좌절을 겪을 가능성이 제기되고 있다.



영국 유력지 '스카이스포츠'는 28일(한국시간) ""사비 시몬스가 자신의 미래를 논의하기 위해 런던에 도착했다""며 ""토트넘은 구단 차원에서 긍정적인 대화를 나눴으며, 첼시는 여전히 영입을 고려하는 단계""라고 전했다.

이어 ""라이프치히는 시몬스를 프리미어리그로 보내는 조건으로 약 6000만 파운드(약 1123억원) 수준의 이적료를 원하고 있다""고 덧붙였다.

보도에 따르면 토트넘은 이미 라이프치히와 구체적인 협상을 진행 중이며, 내부적으로 시몬스를 10번(공격형 미드필더) 역할로 활용하기를 희망하고 있다.

독일 현지 보도도 토트넘의 적극적인 움직임을 뒷받침한다.

'스카이스포츠 독일'의 플로리안 플레텐베르크 기자는 자신의 사회관계망서비스(SNS)를 통해 ""토트넘이 라이프치히에 공식 제안을 제출했다. 이는 구단이 원하는 7000만 유로(약 1132억원)에 근접한 액수""라며 ""첼시는 아직까지 어떠한 제안도 하지 않았다""고 밝혔다.

같은 날 독일 '빌트' 역시 ""시몬스는 이미 런던에 머물고 있으며, 라이프치히 구단은 훈련에서 그를 제외했다""고 보도했다.



그러나 토트넘 입장에서 이번 협상도 순탄치 않다. 영국 '데일리 메일'은 ""첼시는 이미 시몬스와 개인 조건에 대해 오래 전부터 합의했으며, 선수 역시 스탬퍼드 브릿지행을 선호하고 있다""고 전했다.

다만 첼시는 재정적 제약으로 인해 공식적인 입찰을 내지 못한 상태다. 매체는 ""첼시는 UEFA 재정 규정을 맞추기 위해 크리스토퍼 은쿤쿠의 AC밀란행 등 선수 매각을 진행 중이며, 알레한드로 가르나초(맨체스터 유나이티드) 영입에도 집중하고 있다""고 설명했다.
토트넘이 빠르게 움직일 수 있는 틈이 존재하지만, 첼시가 이적 시장 마감 직전 또 다시 토트넘의 영입을 방해할 가능성은 여전히 열려 있다.

영국 공영방송 'BBC' 역시 ""첼시는 아직까지 공식 입찰을 하지 않았지만, 협상 창구를 완전히 닫지는 않았다""면서 ""만약 시몬스가 첼시행 의지를 굽히지 않는다면, 토트넘은 또 한 번 원하는 선수를 눈앞에서 놓칠 수도 있다""고 보도했다.

또 다른 영국 유력지 '텔레그래프' 역시 역시 이 같은 긴장감을 강조했다. 해당 매체는 ""토트넘은 지난주 에베레치 에제를 아스널에 빼앗긴 데 이어 다시 한 번 하이재킹을 당할까 우려하고 있다""며 ""시몬스는 이번 이적 시장 초반까지만 해도 첼시행을 원했지만, 최근 며칠 사이 토트넘 프로젝트에도 매력을 느끼고 있다""고 보도했다.

즉, 토트넘이 협상 주도권을 잡았으나 최종 결정을 장담할 수는 없는 상황이라는 해석이다.



토트넘은 현재 공격형 미드필더 자리에 사용 가능한 선수가 없다. 공격 2선 자원이 부상으로 줄줄이 이탈하면서, 토트넘은 반드시 즉시 전력감 영입이 필요한 절박한 상태다.

부주장 제임스 매디슨이 프리시즌 도중 십자인대 부상을 입어 사실상 시즌 아웃 판정을 받았고, 데얀 쿨루셉스키 역시 무릎 수술에서 회복 중이라 최소 내년 1월까지 복귀가 어렵다.

실제로 토트넘은 모건 깁스-화이트(노팅엄 포레스트)와 에베레치 에제(전 크리스털 팰리스, 현 아스널) 영입을 시도했지만, 깁스-화이트는 재계약을 택했고 에제는 아스널로 향했다. 이번 시몬스마저 실패한다면 사실상 대안이 없다는 지적이 나온다.

이런 상황에서 시몬스의 이력은 충분히 매력적이다.

그는 바르셀로나 유스팀 '라 마시아' 출신으로 PSG에서 성장했고, PSV 에인트호번 시절 2022-2023시즌 리그 19골을 기록하며 득점왕에 올랐다. 이후 PSG가 바이백 조항을 발동해 복귀시킨 뒤 라이프치히로 임대를 보냈고, 2023-2024시즌 분데스리가에서도 43경기 10골 15도움을 기록하며 가치를 증명했다.

최근 두 시즌 동안 모든 대회에서 78경기 22골 24도움을 올린 그는 공격형 미드필더뿐 아니라 왼쪽 윙어, 세컨드 스트라이커까지 소화할 수 있는 다재다능한 선수로 평가받는다.



다만 여전히 최종 결론은 오리무중이다. 만약 시몬스가 첼시행을 원한다면, 이는 토트넘이 에제 영입전에서 아스널에 뒤통수를 맞은 기억을 떠올리게 한다. 토트넘 팬들 사이에서도 '이번에는 반드시 잡아야 한다'는 절박한 목소리와 '또 대망신을 당하는 것 아니냐'는 불안이 교차하고 있다.

새 사령탑 토마스 프랑크 감독에게도 이번 영입은 상징적이다. 그는 여름 이적시장 시작과 동시에 2선 보강을 강력히 원했으나, 주요 타깃을 연이어 놓쳤다.

시몬스는 전술적으로도 필요성이 크고, 향후 손흥민이 떠난 왼쪽 공격수 자리를 메울 잠재적 자원으로도 평가된다. 실제로 독일 '빌트'는 시몬스를 '손흥민의 대체자'라고 언급하기도 했다. 손흥민이 미국 메이저리그사커 LAFC로 이적하면서 생긴 공백을 시몬스가 메울 수 있다는 분석이다.

결국 시몬스 개인의 선택이 토트넘의 운명을 가를 전망이다. 이적시장 마감이 임박한 상황에서, 토트넘은 막대한 이적료를 지불하며 협상에 속도를 내고 있다. 하지만 첼시라는 매력적인 선택지 역시 무시할 수 없는 상황이다. 

토트넘이 또 다시 런던 라이벌 팀의 희생자가 될지, 아니면 반대로 경쟁자를 따돌리고 승자가 될 수 있을지 유럽 축구 팬들의 시선이 집중된다.

사진=연합뉴스 / 플로리안 플레텐베르크"
20250829,"""네가 손흥민 7번이야"" 토트넘, 970억 쐈다! 구단 설득 '끝'…선수가 답 없네→피말리는 초신성 MF 영입전","(엑스포츠뉴스 윤준석 기자) 토트넘 홋스퍼가 마침내 여름 이적시장의 최대 난제 풀어낼 기회를 잡았다.

독일 분데스리가 RB 라이프치히의 핵심 미드필더이자 네덜란드 국가대표 사비 시몬스 영입이 성사 직전 단계까지 다다랐다.

협상 과정에서 큰 걸림돌이었던 구단 간 합의가 성사됐고, 이제 남은 것은 선수 본인의 최종 결정뿐이다.

시몬스의 첼시행 선호설이 끊임없이 흘러나오는 가운데 토트넘이 끝내 영입전에 승리할 수 있을지가 유럽 축구계의 초미의 관심사로 떠오르고 있다.



유럽 이적시장 전문가 파브리치오 로마노 기자는 자신의 사회관계망서비스(SNS)를 통해 ""토트넘이 RB 라이프치히와 시몬스 영입을 두고 6000만 유로(약 970억원)에 합의했다""고 전했다.

이어 로마노는 ""구단은 공식 제안을 수락했으며, 선수 측이 긍정적인 반응을 보낸 직후 토트넘이 정식 오퍼를 보냈다""며 ""토트넘은 곧바로 개인 협상에 착수해 오늘 안으로 메디컬 테스트까지 마치길 희망한다""고 덧붙였다.

또한 로마노는 이적이 성사됐음을 뜻하는 자신의 시그니처 문구인 '히어 위 고(Here We Go)'발표가 임박했다면서 해당 이적의 현실 가능성을 높게 점쳤다.



이 소식은 토트넘 팬들에게는 엄청난 희소식이다. 토트넘은 이번 여름 이적시장 내내 주요 영입 타깃을 놓치며 번번이 실망을 안겨줬다.

손흥민과의 작별 이후 꾸준히 2선 자원에서 대체자를 찾던 토트넘은 모건 깁스-화이트(노팅엄 포레스트)와 에베레치 에제(전 크리스털 팰리스, 현 아스널)를 노렸지만, 각각 재계약 및 라이벌 구단 이적으로 인해 실패했다.

특히 에제 건에서는 같은 북런던 연고지 구단인 라이벌 아스널에 사실상 '하이재킹'을 당하면서 팬들의 분노와 허탈감이 극에 달했다. 따라서 이번 시몬스 영입은 단순한 전력 보강을 넘어, 런던 라이벌에 잇따라 밀려왔던 자존심 회복전이기도 하다.

영국 '텔레그래프' 역시 같은 날 ""토트넘은 시몬스 영입에서 첼시보다 한발 앞서 나가고 있다""고 보도했다.
매체에 따르면, 첼시는 지난 7월 이미 선수와 개인 조건 합의를 마쳤으나, RB 라이프치히와 이적료 협상에서 진전을 보지 못했다. 반면 토트넘은 라이프치히가 원하는 금액을 과감하게 수용하며 협상 주도권을 거머쥔 것으로 보인다.

독일 유력지 '빌트' 또한 ""시몬스는 이미 런던에 머물고 있으며, 라이프치히 구단은 그를 훈련 명단에서 제외했다""고 보도하면서 시몬스가 런던 구단과의 협상을 진행 중이라고 전했다. 이는 곧 이적 절차가 사실상 공식 단계에 진입했음을 보여주는 대목이다.

만약 토트넘이 신속하게 개인 협상을 마무리한다면, 곧바로 메디컬 테스트까지 진행될 전망이다.



하지만 가장 큰 변수는 시몬스 본인의 마음이다.

영국 '데일리 메일'은 28일 ""시몬스는 오래 전부터 첼시와 개인 조건에 합의했으며, 스탬퍼드 브릿지행을 선호하는 것으로 알려졌다""면서 ""첼시 역시 여전히 협상 창구를 닫지 않은 상태""라고 전했다.

영국 공영방송 'BBC' 역시 ""첼시는 아직 공식 입찰을 하지 않았지만, 언제든 반격을 준비하고 있다. 최종 선택은 전적으로 시몬스 본인에게 달려 있다""고 언급했다. 

만약 실제로 시몬스가 토트넘 대신 첼시를 선택할 경우, 이번에는 첼시가 토트넘을 상대로 또 다시 하이재킹에 성공해 눈앞에서 원하는 타깃을 놓치게 될 것이라는 분석이다.

다만 첼시의 발걸음은 토트넘보다 더디다. 유럽축구연맹(UEFA) 재정 규정(FFP) 문제로 인해 선수 매각이 선행돼야 하며, 크리스토퍼 은쿤쿠의 AC 밀란행 등 방출 작업에 집중하느라 즉각적인 공식 제안을 내놓지 못하고 있다.



시몬스는 현 시점에서 토트넘이 반드시 필요로 하는 유형의 선수다. 우선 손흥민이 미국 메이저리그사커(MLS) LAFC로 떠난 뒤, 왼쪽 측면 공격수 자리에는 명확한 대체 자원이 없다.

여기에 더해 기존 공격형 미드필더 제임스 매디슨이 프리시즌 도중 십자인대 부상을 당해 시즌 아웃 판정을 받았고, 데얀 쿨루셉스키마저 장기간 회복 중이다. 토트넘의 2선은 그야말로 텅 빈 상태다.

이런 맥락에서 시몬스는 전술적 필요성과 상징성을 동시에 갖춘 영입 카드다. PSV 에인트호번 시절 네덜란드 에레디비시 득점왕에 오르며 잠재력을 폭발시켰던 그는 2023-2024시즌 라이프치히 임대 이적 후 43경기 10골 15도움을 기록하며 자신의 가치를 증명했다. 최근 두 시즌 동안 모든 대회에서 78경기 22골 24도움을 올린 다재다능한 공격형 미드필더다.

이 같은 만능 플레이메이커의 합류는 토트넘의 공격 옵션을 획기적으로 넓혀줄 수 있다.

모하메드 쿠두스가 오른쪽에서 활약하고, 시몬스가 왼쪽과 중앙을 오가게 된다면, 토트넘은 빠르게 2선 세대교체를 완성할 수 있다. 또한 시몬스는 아직 22세에 불과해 장기적인 투자 가치까지 높다는 점에서 구단 경영 측면에서도 매력적인 카드다.



구단이 지난 시즌 UEFA 유로파리그 우승이라는 업적 이후 챔피언스리그에 복귀했음에도 불구하고 수 차례 영입 경쟁에서 좌절한 끝에, 토트넘 팬들은 이번 협상이 반드시 성사되기를 간절히 바라고 있다.

프랑크 감독에게도 시몬스의 영입은 매우 중요하다. 그는 부임 직후부터 2선 보강을 강력히 요청했으나 주요 타깃을 연이어 놓치며 어려움을 겪었다.

만약 시몬스 영입이 확정된다면, 프랑크 감독이 원하던 첫 번째 대형 성공 사례가 될 수 있다. 반대로 또다시 실패한다면, 시즌 초반부터 토트넘의 전력 운영은 심각한 차질을 빚게 될 전망이다.

과연 토트넘이 또 다른 런던 라이벌인 첼시를 제치고, 시몬스 영입에 성공을 거둘 수 있을지 전 세계 축구 팬들의 이목이 집중된다.

사진=파브리치오 로마노/연합뉴스/플로리안 플레텐베르크"
20250829,"[속보] 토트넘-레비 미쳤다! 손흥민 대체자 진짜 영입 성공! 970억에 네덜란드 슈퍼스타, 메디컬 테스트 완료→곧 오피셜","사진=로마노
[스포츠조선 김대식 기자]토트넘이 사비 시몬스 영입에 성공했다.

영국 디 애슬래틱의 데이비드 온스테인 기자는 29일 오후 3시경(한국시각) '토트넘 홋스퍼가 RB 라이프치히로부터 시몬스를 영입할 예정이다. 두 구단은 22세 네덜란드 국가대표 공격수를 두고 6000만유로(약 970억원)에 합의했다. 개인 조건 협상도 마무리됐으며, 시몬스는 목요일 메디컬 테스트까지 완료했다. 현재 남은 절차는 라이프치히와의 계약 종료를 위한 세부 조율뿐이다'며 토트넘이 시몬스 영입에 성공했다고 발표했다. 온스테인 기자는 프리미어리그 관련해 최고의 공신력을 자랑한다.

앞서 디 애슬레틱은 목요일 '토트넘이 RB라이프치히로부터 런던행을 허가받은 시몬스를 대상으로 첫 제안을 제출했다고 보도했다. 토트넘은 9월 1일 이적시장 마감 전에 토마스 프랑크 감독의 공격 옵션을 보강하기 위해 시몬스를 원하고 있다. 앞서 모건 깁스-화이트와 에베레치 에제 영입에 실패했고, 제임스 매디슨이 전방십자인대 부상으로 이탈했기 때문이다'고 설명했다.
<저작권자(c) 연합뉴스, 무단 전재-재배포, AI 학습 및 활용 금지>
이날 오전 유럽 이적시장 전문가인 파브리시오 로마노 기자 또한 독점 보도라며 ""토트넘이 RB 라이프치히와 6000만유로에 시몬스 영입에 합의했다. 토트넘은 선수의 긍정적인 반응 이후 공식 오퍼를 보냈고, 구단은 이를 받아들여 최종 승인했다. 토트넘은 오늘 안으로 선수 측과도 합의를 마무리하고, 몇 시간 안에 메디컬 테스트까지 진행하길 원한다. 곧 HERE WE GO가 나올 것이다""고 보도한 바 있다.

토트넘이 초대형 계약을 해냈다. 구단 역대 최고 이적료 수준으로 손흥민과 제임스 매디슨의 공백을 동시에 채울 수 있는 선수를 데려왔다 2003년생인 시몬스는 어릴 적부터 천재 유망주로 인정받은 선수다. 바르셀로나 라 마시아에서 성장한 시몬스를 파리 생제르맹(PSG)에서 영입했다. PSG에서 자리가 없던 시몬스는 PSV 에인트호번으로 임대를 떠나서 네덜란드 리그 득점왕을 수상하면서 잠재력을 뽐냈다. 이후 RB라이프치히로 이적한 시몬스는 독일 분데스리가 최고 2선 자원으로 거듭났다.
<저작권자(c) 연합뉴스, 무단 전재-재배포, AI 학습 및 활용 금지>
비교적 작은 체구지만 기술력과 순간 스피드로 수비수들을 괴롭히는 스타일이다. 돌파력을 가지고 있는 선수라 중앙과 측면에서 모두 뛸 수 있다. 동료들에게 키패스를 찔러주는 능력도 좋다. 활동량과 수비 가담 역시 적극적이라 프랭크 감독의 총애를 받을 것으로 보인다.

시몬스는 스타성까지 가지고 있어서 손흥민을 대체할 수 있는 충분한 잠재력을 가졌다. 원래 첼시로 이적하려고 했던 시몬스는 토트넘에서 적극적으로 자신을 원하자 마음을 바꿨고, 토트넘행을 전격 결정했다. 런던에 머물고 있던 시몬스는 메디컬 테스트까지 마치면서 토트넘행 오피셜만을 남겨뒀다.

이제 토트넘이 시몬스에게 손흥민이 떠나면서 빈 등번호 7번을 시몬스에게 줄 것인지에 관심이 쏠린다."
20250829,"英 BBC 폭로! 맨유, 리그 단 3경기 만에 아모링, 경질 검토한다...""3745억 투자에도 개선되지 않는 경기력""→""번리전서 미래 결정될 수도""","[SPORTALKOREA] 박윤서 기자= 맨체스터 유나이티드가 후벵 아모링 감독을 경질할 수 있단 주장이 제기됐다.

영국 'BBC'는 28일(한국시간) ""맨유는 아모링 감독 체제에서 막대한 투자를 단행했음에도 경기력이 개선되지 않고 있다. 구단은 올여름 2억 파운드(약 3,745억 원)를 투자해 새로운 선수들을 영입했지만, 경기력이 개선되지 않고 있다""라고 보도했다.



맨유는 지난 시즌 프리미어리그(PL) 15위에 그쳤다. 알렉스 퍼거슨 경이 팀을 떠난 이후 숱한 위기가 있었지만, 잉글랜드 축구를 대표하는 전통의 명가가 강등을 걱정해야 하는 지경에 이를 것으로 우려했던 이는 찾아보기 어려울 것이다.

이에 구단 보드진은 재빠르게 움직였다. 최대 약점으로 지적 받던 공격진 보강을 위해 천문학적인 금액을 쏟았다.

맨유는 여름 이적시장을 통해 리그 내 검증이 끝난 자원인 마테우스 쿠냐, 브라이언 음뵈모를 영입했고 분데스리가 수위급 스트라이커 베냐민 세슈코를 품었다. 그럼에도 아모링은 이들을 조합해 내는 데 어려움을 겪고 있다.



당장 최고의 퍼포먼스를 보여주기 어렵단 점을 차치하고도 약간의 가능성조차 입증해 내지 못하고 있다.

설상가상 27일엔 카라바오컵 2라운드에서 4부 리그 구단 그림즈비 타운에 승부차기 접전 끝에 패했다.

이는 자연스레 경질 여론으로 이어지고 있다. 매체는 ""그림즈비 타운과의 경기가 종료된 후 아모링의 거취가 큰 타격을 입었다. 30일 예정된 번리와의 일전은 아모링의 운명을 결정할 시험대가 될 수 있다. 구단 보드진은 지난 몇 시즌 동안 반복된 실패와 잦은 감독 교체에도 아모링의 미래를 두고 심각하게 고민하고 있다""라고 주장했다.



또 다른 매체인 '미러'는 같은 날 보도를 통해 ""아모링은 또다시 최저점을 찍었다. 그는 경기 후 인터뷰를 통해 팀의 위기 상황과 자신의 미래를 두고 진지한 논의가 필요하다는 점을 인정했다. 아모링은 그 시점이 다가오는 번리전 이후가 될 것임을 암시했다""라고 강조했다.

사진=맨유 SNS, 게티이미지코리아

취재문의 sportal@sportalkorea.co.kr"
20250829,"'Here We Go' 단독! 손흥민, 7번 대체자 마침내 낙점 ...토트넘, 이적료 971억 사비 시몬스 영입 임박","[SPORTALKOREA] 박윤서 기자= 사비 시몬스가 토트넘 홋스퍼 FC로 이적할 것으로 보인다.

유럽 축구 이적시장 소식에 정통한 파브리지오 로마노 기자는 29일(한국시간) 자신의 사회관계망서비스(SNS)를 통해 시몬스 영입 소식을 단독으로 전했다. 



로마노는 ""시몬스가 RB 라이프치히를 떠나 토트넘으로 이적한다. 토트넘은 이적료 6,000만 유로(약 971억 원)를 지급하는 계약 조건으로 시몬스 협상을 끝냈다. 현재 양 구단은 이적 오퍼를 수락한 상황이다""라고 주장했다.

이어 ""토트넘은 첼시와 경쟁에서 승리했다. 오늘 안으로 선수와의 협상, 메디컬 테스트 등 남은 절차가 마무리될 예정이다""라고 덧붙였다.

로마노에 따르면 이번 계약은 2030년 6월까지로 2년 옵션이 포함 되어 있다. 토트넘 측의 오피셜 발표는 오늘이 될 전망이다.



높은 공신력을 인정받고 있는 영국 'BBC'도 시몬스의 토트넘 이적이 사실상 확정 되었음을 알렸다.

첼시와 8월 내내 협상을 진행했으나 공식적인 오퍼가 도착하지 않았고, 선수가 관심을 돌려 토트넘과 접촉해 결실을 보았단 후문이다. 토트넘은 올여름 손흥민을 떠나보낸 후 걸출한 2선 자원 영입을 노렸다.

이에 모건 깁스 화이트, 에베레치 에제, 사비뉴, 니코 파스 등 다양한 선수들과 연결됐다. 다만 협상은 지지부진했고 별다른 보강 없이 시즌을 치러야 한다는 우려가 반복됐다.



그러나 토트넘은 네덜란드를 넘어 전 유럽이 주목하는 초특급 재능 시몬스를 품으며 반전을 이룩했다. 특별한 영입이 없는 한 손흥민의 7번을 임시 결번으로 비워 둘 예정이었던 토트넘으로서도 배번을 고민해 볼 수 있는 초대형 영입이다.

해리 케인이 이적하며 남긴 10번을 제임스 매디슨이 이어받았듯, 손흥민의 7번을 시몬스가 착용할 수 있을지 지켜볼 일이다.

사진=토트넘 SNS, 게티이미지코리아

취재문의 sportal@sportalkorea.co.kr"
20250829,"레알 마드리드-리버풀-레버쿠젠, 사실상 삼각 트레이드? 바스케스, 레버쿠젠과 2년 계약 체결","바이어 04 레버쿠젠, 루카스 바스케스 FA 영입... 2027년 6월까지 계약
루카스 바스케스, 우측 윙백 포지션에서 텔라, 아르투르와 경쟁할 듯
레버쿠젠과 계약을 체결한 바스케스. /레버쿠젠

[마이데일리 = 진병권 기자] 루카스 바스케스가 바이어 04 레버쿠젠에 합류했다.

바이어 04 레버쿠젠은 지난 26일(한국 시각), 구단 공식 홈페이지와 SNS를 통해 루카스 바스케스 영입을 공식 발표했다. FA(자유계약선수) 영입으로 이적료는 없으며, 계약 기간은 2027년 6월까지다.
지난 시즌을 끝으로 레알 마드리드와의 동행을 마친 루카스 바스케스. /게티이미지코리아

바스케스는 지난 6월, 유소년 시절부터 18년 동안 몸담았던 레알 마드리드 CF와의 동행을 마무리했다. 함께 팀을 떠난 루카 모드리치는 2025 FIFA 클럽 월드컵 직후 AC 밀란으로 합류하면서 현역 연장 의지를 드러냈지만, 바스케스는 2개월이 지나도록 소속팀을 찾지 못해 은퇴 가능성이 제기되기도 했다.

레버쿠젠과 계약을 체결한 뒤 바스케스는 ""레버쿠젠에서 내 여정을 이어갈 수 있게 되어 기쁘다. 레버쿠젠은 절대적으로 승리에 집착하며 가장 높은 목표를 향해 나아가는 팀이다. 이런 태도는 제 생각과 일치한다. 레버쿠젠과 함께 더 많은 성공을 쫓게 되어 매우 기쁘다""라며 소감을 전했다.

흥미롭게도 바스케스가 레버쿠젠으로 이적하면서 레알 마드리드, 리버풀 FC, 레버쿠젠 세 팀은 우측면 수비수 '삼각 트레이드'를 한 셈이 됐다. 리버풀은 트렌트 알렉산더아놀드를 레알 마드리드로, 레버쿠젠은 제레미 프림퐁을 리버풀로, 레알 마드리드는 바스케스를 레버쿠젠으로 보냈다.
루카스 바스케스. /게티이미지코리아

지난 시즌 레알 마드리드에서 부진한 경기력을 보여줬던 바스케스지만, 레버쿠젠에서는 주전 경쟁에 뛰어들 전망이다. 에릭 텐하흐 감독은 프리시즌과 개막전에서 네이선 텔러, 아르투르를 우측 윙백으로 기용했으나 기대치에 미치지 못하는 활약을 보여줬기 때문이다. 풀백으로 기용되었던 레알 마드리드 시절과 달리 윙백으로 기용될 예정이다. 수비력보다는 공격력에 강점이 있는 선수기에 더 맞는 옷을 입게 된 것이다.

바스케스 영입은 전력 보강뿐만 아니라 팀 분위기에도 긍정적인 효과를 줄 것으로 기대된다. 레버쿠젠은 이번 여름 이적시장에서 요나탄 타, 그라니트 자카, 루카시 흐라데츠키 등 주축 베테랑들을 잃었다. 사비 알론소 감독을 팀을 떠났기 때문에 팀 분위기가 혼란스러울 수밖에 없다. 산전수전을 모두 겪은 베테랑인 바스케스는 선수단을 이끌만한 리더십을 보유한 선수다."
