date,title,content
20251022,"'동남아 혼혈' 바르셀로나 역대급 '17세 천재' 등장, 세계가 놀랐다... UCL 깜짝 선발 데뷔→공격포인트 작렬","[스타뉴스 | 박건도 기자]
드로 페르난데스가 22일(한국시간) 스페인 바르셀로나의 에스타디 올림피크 루이스 콤파냐스에서 열린 2025~2026시즌 유럽축구연맹(UEFA) 챔피언스리그(UCL) 리그 페이즈 3차전 시작 전 엄지를 치켜세우고 있다. /사진=FC바르셀로나 공식 사회관계망서비스(SNS)
FC바르셀로나에서 동남아시아 혼혈 유망주가 깜짝 등장했다. 필리핀 출신의 어머니를 둔 드로 페르난데스(17)가 유럽 대항전에서 깜짝 선발 데뷔해 맹활약을 펼쳤다.

바르셀로나는 22일(한국시간) 스페인 바르셀로나의 에스타디 올림피크 루이스 콤파냐스에서 열린 2025~2026시즌 유럽축구연맹(UEFA) 챔피언스리그(UCL) 리그 페이즈 3차전에서 올림피아코스(그리스)를 6-1로 크게 이겼다.

지난 파리 생제르망(프랑스)와 경기에서 1-2로 패했던 바르셀로나는 올림피아코스전에서 승전고를 울리며 2승 1패로 상위권 경쟁을 이어나갔다.
한지 플릭 바르셀로나 감독은 올림피아코스전에서 17세 유망주를 선발로 내세우는 파격 선택을 했다. 페르난데스는 4-2-3-1 포메이션의 공격형 미드필더를 맡았다. 영국 'BBC'도 ""페르난데스의 UCL 깜짝 선발 데뷔""라고 놀라워했다.

경기 초반부터 바르셀로나가 주도권을 잡았다. 전반 7분 라민 야말의 슈팅을 골키퍼 촐라키스가 막아냈지만 공을 제대로 처리하지 못했고, 페르민 로페스가 쇄도하며 선제골을 기록했다.

22일(한국시간) 스페인 바르셀로나의 에스타디 올림피크 루이스 콤파냐스에서 열린 2025~2026시즌 유럽축구연맹(UEFA) 챔피언스리그(UCL) 리그 페이즈 3차전 바르셀로나와 올림피아코스 경기 결과. /사진=FC바르셀로나 공식 사회관계망서비스(SNS)
이후 30분 깜짝 선발로 나선 17세 미드필더 페르난데스가 전진 패스를 찔러 넣었고, 이를 받은 로페스가 수비 사이로 파고들며 왼발 슈팅으로 추가골을 완성했다.

페르난데스는 이날이 유럽 무대 데뷔전이었다. 플릭 감독이 지난달 일본 프리시즌 투어에 포함한 라 마시아 출신 7명 중 한 명으로, 팀의 부상 공백을 메우기 위한 전략적 선택이었다.

로베르트 레반도프스키, 하피냐, 다니 올모 등이 모두 부상으로 이탈한 상황에서 플릭 감독은 부상이 확인된 페란 토레스의 복귀를 서두르지 않고 17세 신예에게 기회를 줬다.

스페인 북서부 갈리시아 지방 니그란 출신의 페르난데스는 2022년 발 미노르 니그란에서 바르셀로나로 이적한 뒤, 15세 이하 대표팀에서 두각을 나타낸 유망주다.

필리핀 혈통을 지닌 페르난데스는 스페인 청소년 대표팀에 발탁되는 등 빠르게 성장했다. 지난 9월 레알 소시에다드전 스페인 라리가 데뷔전 당시에는 선발로 나서 후반 시작과 함께 교체됐다. 올림피아코스전에서 보여준 뛰어난 경기력은 페르난데스가 바르셀로나 1군팀에서도 경쟁할 자원임을 입증했다. 'BBC'를 비롯해 스페인, 아시아 복수 매체가 페르난데스의 올림피아코스전 맹활약을 집중 조명하고 있다.

페르난데스(왼쪽에서 두 번쨰)가 22일(한국시간) 스페인 바르셀로나의 에스타디 올림피크 루이스 콤파냐스에서 열린 2025~2026시즌 유럽축구연맹(UEFA) 챔피언스리그(UCL) 리그 페이즈 3차전 중 바르셀로나의 골을 축하하고 있다. /사진=FC바르셀로나 공식 사회관계망서비스(SNS)
후반 들어 올림피아코스가 잠시 반격에 나섰다. 엘 카비의 헤딩골이 VAR 판독 끝에 취소됐고, 직후 에릭 가르시아의 핸드볼 파울로 페널티킥이 선언돼 엘 카비가 이를 성공시켰다.

하지만 3분 뒤 산티아고 헤세가 로페스를 가격하며 두 번째 경고로 퇴장당하자, 경기 균형은 완전히 무너졌다.

바르셀로나는 수적 우위를 놓치지 않았다. 후반 24분 래시포드가 직접 얻은 페널티킥을 야말이 침착하게 마무리하며 3-1로 달아났다. 6분 뒤 래시포드는 추가골을 넣었다. 곧이어 로페스가 페널티박스 외곽에서 왼발로 감아 차며 해트트릭을 완성했다. 이후 바르셀로나는 래시포드의 쐐기골까지 더하며 6-1 대승을 거뒀다.

래시포드는 이날 멀티골로 UCL 3경기 4골을 기록하며 확실한 공격의 축으로 자리 잡았다. 맨체스터 유나이티드 시절 37경기에서 단 한 차례만 멀티골을 기록했던 그는, 바르셀로나 이적 후 단 3경기 만에 두 차례 두 골 이상을 터뜨리며 완전히 달라진 모습을 보였다.

한편 바르셀로나가 챔피언스리그 경기에서 6골을 넣은 것은 2017년 PSG전 6-1 승리 이후 8년 만이다. 올림피아코스는 승점 1점에 그치며 원정 12연패의 부진을 이어갔다.

분위기를 끌어올린 바르셀로나는 오는 27일 엘 클라시코에서 레알 마드리드를 만난다.

라민 야말(가운데)이 22일(한국시간) 스페인 바르셀로나의 에스타디 올림피크 루이스 콤파냐스에서 열린 2025~2026시즌 유럽축구연맹(UEFA) 챔피언스리그(UCL) 리그 페이즈 3차전 경기 중 득점 후 세리머니하고 있다. /사진=FC바르셀로나 공식 사회관계망서비스(SNS)"
20251022,"""중요 자원 인식"" PSG, 1000억 마다하고 이강인 바짓가랑이 잡은 이유 있었네!...재계약 돌입 예정 ""양측 모두에게 이익""","[SPORTALKOREA] 황보동혁 기자= 파리 생제르맹FC가 거액의 이적 제안을 거절하고 이강인과 재계약을 추진할 것으로 보인다.

축구 전문 매체 '트리뷰나'는 21일(한국시간) ""곤살로 하무스와 이강인이 PSG와의 계약 연장 협상을 앞두고 있다. 두 선수 모두 2028년까지 계약이 남아 있으며, 향후 몇 주 안에 새로운 조건을 두고 논의가 진행될 예정""이라고 보도했다.



이어 ""PSG는 두 선수를 장기적으로 팀에 잔류시키기를 원하고 있으며, 그들이 구단의 목표 달성에 있어 중요한 자원임을 인식하고 있다. 이번 협상은 양측 모두에게 이익이 될 것으로 예상된다""라고 덧붙였다. 

결국 최근 PSG가 이강인을 향한 거액의 이적 제안을 거절한 것은 재계약을 위해서였다. 

영국 매체 '버밍엄 라이브'는 앞서 11일 ""아스톤 빌라는 세계적인 스타들로 가득한 PSG에서 입지를 잃은 선수들을 주시하고 있으며, 우나이 에메리 감독이 특히 이강인을 높이 평가하고 있다""고 전했다. 매체는 이강인의 몸값이 약 6,000만 유로(약 1,000억 원)에 달할 것으로 내다봤다.



이는 김민재가 나폴리에서 바이에른 뮌헨으로 이적할 당시 세운 한국인 역대 최고 이적료(5,000만 유로, 약 831억 원)를 크게 웃도는 금액이다. 빌라가 이강인을 얼마나 높이 평가하고 있는지를 보여주는 대목이다.

이강인 역시 꾸준한 출전 시간을 확보하기 위해 이적 가능성을 검토 중인 것으로 알려졌다.

프랑스 '레키프'의 로익 탄지 기자에 따르면 그는 2026 북중미 월드컵을 앞두고 주전 경쟁이 보장되는 환경을 원하고 있다.



하지만 프랑스 매체 '풋01(Foot01)'은 ""아스톤 빌라가 이강인 영입을 원하고 있지만, 챔피언스리그 우승 경험이 있는 PSG는 결코 협상이 쉬운 구단이 아니다""라며 ""루이스 엔리케 감독은 현재 공격진 부상 여파 속에서 이강인을 놓치고 싶어 하지 않는다""라며 이번 겨울 이적시장에서 그의 이적은 현실적으로 어려울 것으로 전망됐다.

이강인은 지난 시즌 공식전 45경기에서 6골 6도움을 기록하며 중앙 미드필더, 측면, 2선, 심지어 '가짜 9번' 역할까지 소화하며 전술적 유연성을 입증했다.

UEFA 슈퍼컵 결승 토트넘전에서는 교체 투입 직후 만회골을 넣으며 역전승을 이끌었지만, 시즌 초반에는 여전히 팀 내 입지가 불안했다.



그러나 최근 들어 상황은 달라지고 있다. 데지레 두에, 우스만 뎀벨레 등 핵심 자원들이 부상으로 이탈하자 이강인이 기회를 잡았고 실력으로 입지를 넓히는데 성공했다.

지난 2일 UEFA 챔피언스리그 리그페이즈 바르셀로나 원정에서 교체 출전 후 골대를 강타하는 슈팅과 역전골의 기점이 되는 패스를 기록한 데 이어, 6일 LOSC릴전과 18일 스트라스부르전에서는 연속 풀타임 출전을 소화하며 확실히 입지를 굳혔다.



결국 PSG는 최근 상승세를 타고 있는 이강인을 핵심 전력으로 인정하고 재계약을 통해 그를 잔류시키려는 모양이다. 

사진= 파리생제르맹FC, 게티이미지코리아 

취재문의 sportal@sportalkorea.co.kr"
20251022,"'손흥민 임대설' 유럽 전역이 관심, 토트넘 복귀설에 뮌헨 가능성까지","[스타뉴스 | 김명석 기자]
로스앤젤레스(LA)FC 손흥민. /AFPBBNews=뉴스1
로스앤젤레스(LA)FC 손흥민(33)이 미국 프로축구 메이저리그사커(MLS) 올 시즌이 끝난 뒤 유럽으로 단기 임대 이적할 가능성이 제기되면서 유럽에서도 관심이 쏠리고 있다. 계속 언급되는 이탈리아 세리에A AC밀란뿐만 아니라 '친정팀' 토트넘 복귀 가능성, 나아가 바이에른 뮌헨에서 해리 케인과 재회 가능성까지도 거론되고 있다.

글로벌 축구 매체 골닷컴은 22일(한국시간) ""손흥민이 내년 1월 이적시장을 통해 잉글랜드 프리미어리그(EPL)에 깜짝 복귀할 수도 있다는 전망이 나왔다""면서 ""손흥민과 LAFC 계약엔 이른바 '데이비드 베컴' 조항이 포함된 것으로 알려졌다. 그는 미국에서 놀라운 활약을 펼치고 있지만 유럽 무대와 인연이 완전히 끝난 건 아닐 수도 있다""고 전했다.
이른바 베컴 조항은 MLS 시즌이 끝난 뒤 다음 시즌이 개막하기 전까지 휴식기를 활용, 유럽 무대로 임시 복귀할 수 있는 조항이다. 과거 베컴도 LA 갤럭시에서 뛰던 시절 겨울 이적시장을 활용해 AC밀란으로 이적해 뛰다 다시 LA 갤럭시로 복귀한 바 있다. 'EPL 레전드' 티에리 앙리 역시 뉴욕 레드불스 시절 아스날에서 잠깐 뛴 바 있다. MLS는 플레이오프를 포함해 12월 초에 막을 내리고, 이듬해 2월 말 새 시즌이 개막한다.

오랫동안 EPL에서 뛰었던 손흥민은 MLS 이적 후 처음 맞이하는 겨울 휴식기가 낯설 수밖에 없다. 특히 내년 2026 국제축구연맹(FIFA) 북중미 월드컵에 대비해 경기력과 컨디션을 최상으로 끌어올리는 건 손흥민이 가장 중요하게 여기는 부분이기도 하다. 손흥민이 휴식기 동안 유럽 단기 임대를 통해 경기력을 유지할 수도 있고, 반대로 푹 휴식을 취하면서 2026시즌 MLS에 포커스를 맞출 수도 있다. 저마다 장단이 뚜렷하다.

로스앤젤레스(LA)FC 손흥민. /AFPBBNews=뉴스1
만약 LAFC와 계약에 베컴 조항 포함이 사실이고, 손흥민이 유럽 임시 복귀 가능성을 열어두고 행선지를 찾기 시작한다면 '러브콜'을 받을 가능성은 충분하다. 토트넘의 유럽축구연맹(UEFA) 유로파리그 우승을 이끈 지 얼마 되지 않은 데다, MLS 이적 후 10경기에서 9골 2도움의 맹활약을 펼치며 여전한 기량을 과시하고 있는 덕분이다. 이미 손흥민의 MLS 활약이 이어지면서 유럽 현지에서조차 너무 빨리 MLS로 향했다는 아쉬움이 제기되기도 했다. 손흥민의 단기 영입을 통해 누릴 수 있는 여러 '반짝 효과'도 유럽 각 구단 입장에선 매력적인 요소가 될 수 있다.

매체는 ""최근 AC밀란이 손흥민의 영입에 관심을 표명한 팀 중 하나로 알려졌다""면서 ""토트넘으로 복귀 가능성도 거론되고 있다. 분데스리가 바이에른 뮌헨으로 이적하면 케인과 재회할 수도 있다. 손흥민과 케인은 EPL에서 합작골 신기록을 세운 바 있다""고 조명했다. AC밀란과 토트넘, 뮌헨 등 유럽 빅클럽들의 관심이 손흥민에게 향할 거라는 전망이기도 하다.

관건은 역시나 손흥민의 의지다. 오히려 겨울 임대가 내년 월드컵 시기 체력적인 부담으로 이어질 수도 있고, 부상 위험 등도 고민해야 한다. 반대로 낯선 겨울 휴식기를 통한 경기력 유지에 대한 고민도 필요하다. 골닷컴은 ""내년 월드컵은 손흥민의 계획에 포함돼 있고, 월드컵에 최상의 컨디션으로 임하기를 원하고 있다. 올해 말부터 내년 초까지 충분한 휴식을 취할 수도 있다""면서도 ""대신 매력적인 제안만 있다면 유럽으로 복귀할 가능성도 있다. 특히 손흥민의 스포츠적·상업적 효과를 고려하면 수많은 클럽들도 문을 활짝 열 준비가 돼 있을 것""이라고 덧붙였다.

로스앤젤레스(LA)FC 손흥민. /AFPBBNews=뉴스1
로스앤젤레스(LA)FC 손흥민. /AFPBBNews=뉴스1"
20251022,"'韓 축구 역대급 사건' 터질까...손흥민이 토트넘 아닌 AC밀란 이적설 ""MLS 비시즌 기간 동안 단기 임대 가능성""","[스포티비뉴스=장하준 기자] 손흥민(33·로스앤젤레스FC)이 떠난 지 채 반년도 되지 않아 다시 유럽 무대의 중심에 섰다. 이번에는 잉글랜드가 아닌 이탈리아였다. 메이저리그사커(MLS)에서 폭발적인 활약을 이어가고 있는 손흥민을 향해 세리에A 명문 AC밀란이 러브콜을 보냈다.

이탈리아 매체 '셈프레 밀란'은 22일(한국시간) ""AC밀란이 손흥민을 단기 임대 형태로 영입하는 방안을 검토 중이다. 과거 데이비드 베컴이 AC밀란 유니폼을 입었을 때와 유사한 방식이 될 수 있다""고 전했다. 보도에 따르면 손흥민의 LAFC 계약에는 MLS 비시즌 기간 동안 유럽 구단과 임시 계약을 맺을 수 있는 '베컴 조항'이 포함되어 있다고 한다.

이 조항은 이미 유명한 전례가 있다. 베컴은 2009년과 2010년 LA갤럭시 소속으로 뛰던 중 밀란으로 임대를 떠나며 유럽 복귀를 경험했고, 티에리 앙리 또한 2012년 뉴욕 레드불스 소속 시절 아스널에 단기 임대돼 팬들의 큰 환호를 받았다. 이번에는 손흥민이 그 뒤를 이을 가능성이 제기된 것이다.

셈프레 밀란은 ""손흥민의 커리어와 상징성, 그리고 MLS 내 영향력을 고려하면 잉글랜드 복귀 가능성도 있지만, 베컴 루트를 밟았던 AC밀란이 현실적으로 가장 유력한 행선지가 될 수 있다""고 분석했다. 이어 ""손흥민은 토트넘 복귀를 포함해 밀란 임대, 혹은 2026년 월드컵을 앞둔 한국 복귀 등 여러 선택지를 신중히 검토 중인 것으로 알려졌다""고 덧붙였다.



손흥민은 지난여름 10년간의 토트넘 생활을 마치고 LAFC 유니폼을 입었다. MLS 역대 최고 수준인 약 2,200만 달러(약 315억 원)의 이적료가 지불되며 큰 화제를 모았다. 그리고 그 기대에 걸맞게 MLS 데뷔 10경기 만에 9골 2도움을 기록, 부앙가와 함께 '흥부 듀오'를 결성하며 리그를 폭격했다. 특히 세 경기 연속 해트트릭 합작은 MLS 역사에서도 전례를 찾기 힘든 대기록이었다.

손흥민의 합류는 단순히 팀 전력을 끌어올리는 수준을 넘어 MLS 전체의 구도를 흔들었다. LAFC 유니폼 판매량은 폭등했고, 홈경기는 연일 매진을 기록했다. 미국 현지 언론들은 ""손흥민이 MLS의 흥행 구조 자체를 바꿔놓았다""고 평가했다. 실제로 LAFC는 손흥민 합류 후 공격 템포와 전진 패스 비율이 리그 최상위권으로 올라섰으며, 팬들 사이에서는 ""손흥민을 보기 위해 경기장을 찾는다""는 말이 일상적인 풍경이 됐다.
이런 퍼포먼스는 유럽에서도 충분히 통할 만하다는 평가다. AC밀란이 손흥민을 눈독들이는 이유가 여기에 있다. 현재 밀란은 2025-26시즌 세리에A에서 5승 1무 1패로 선두를 달리고 있지만, 공격진의 득점력이 아쉽다. 7경기에서 단 11골로 2위 인터밀란(18골)에 비해 효율이 떨어진다. 셈프레 밀란은 ""밀란은 빠른 결정력과 순간 침투 능력을 갖춘 공격수를 원한다. 손흥민은 이 조건을 완벽히 충족한다""고 분석했다.

MLS는 2월 개막해 10~11월 시즌을 마치는 춘추제 리그다. 시즌이 끝난 뒤 약 석 달의 휴식기가 주어지는데, 이 시기는 유럽 리그의 정규 시즌 한가운데에 해당한다. 따라서 손흥민의 계약에 '유럽 단기 임대' 조항이 존재한다면, 시즌 공백기 동안 2~3개월간 유럽 무대에 나서는 것이 가능하다.

다만 체력 관리가 변수다. MLS 시즌을 막 끝낸 직후 곧바로 유럽의 강도 높은 일정에 투입될 경우 부상 위험이 크다. 이에 대해 영국 매체 '더 선'은 ""손흥민이 2026 북중미 월드컵을 앞두고 있어, 유럽행보다는 휴식과 컨디션 조절에 집중할 가능성도 있다""고 내다봤다.

매체는 또 ""손흥민은 이적 후에도 여전히 세계 최고 수준의 경기력을 유지하고 있다""며 ""그가 어느 길을 택하든 그 영향력은 팀을 넘어 리그 전체에 파급될 것""이라고 평가했다.



한편 손흥민은 MLS '올해의 골' 후보에 이어 'MLS 신인상' 후보로도 거론되고 있다. 시즌 중반에 합류한 베테랑 선수가 신인상 후보에 이름을 올리는 건 이례적이다. MLS 신인상은 단순한 유망주 대상이 아니라, 리그 데뷔 첫해 가장 큰 영향력을 미친 선수에게 주어진다.

MLS 전문기자 파비안 렌켈은 ""손흥민은 시즌 도중 합류했음에도 불구하고 신인상 후보로 손색이 없다""며 ""MLS의 신인 기준은 '올 시즌 처음 MLS에서 뛰는 선수'로, 최소 500분 이상 출전해야 한다. 손흥민은 이미 그 조건을 훨씬 넘겼다""고 설명했다.

현재 손흥민의 LAFC 계약은 2027년까지다. 그러나 그가 보여주는 경기력과 상업적 영향력을 고려하면, '베컴 조항' 발동은 충분히 현실적인 시나리오로 보인다. 만약 실제로 손흥민이 밀란 유니폼을 입고 유럽 무대에 다시 선다면, 이는 MLS와 세리에A 모두에게 상징적인 순간이 될 것이다."
20251022,"'손흥민 아웃' BBC 직격 “토트넘 공격수들, 리그 정상급 수준에 한참 못 미친다”","[사진] ⓒGettyimages(무단전재 및 재배포 금지)


[사진] ⓒGettyimages(무단전재 및 재배포 금지)
[OSEN=우충원 기자] 토트넘이 손흥민의 빈자리를 메우지 못한 채 또 한 번 고개를 숙였다. 해결사가 사라진 공격진은 끝내 빌라의 벽을 넘지 못했다.

BBC는 21일(이하 한국시간) “토트넘은 아스톤  빌라에 패하며 6위에 머물렀다. 결정력 부족이 발목을 잡았다”고 전했다.

토트넘은 19일 런던 토트넘홋스퍼스타디움에서 열린 2025-2026 프리미어리그 8라운드에서 아스톤 빌라에 1-2로 패했다. 경기 초반까지만 해도 분위기는 나쁘지 않았다. 전반 5분 만에 선제골을 터뜨리며 홈팬들을 들썩이게 했지만, 이후 흐름이 급격히 기울었다. 전반 27분과 후반 14분 연속 실점으로 경기를 뒤집혔고, 수차례의 기회도 날아갔다.
BBC는 “토트넘은 몇 차례 결정적인 장면을 만들었지만 마무리에서 무너졌다. 마티스 텔의 발리 슈팅은 허공으로 향했고  미키 판 더 펜의 헤더 역시 골문을 벗어났다”며 부정확한 마무리를 꼬집었다.

이날 경기에서 가장 크게 느껴진 것은 손흥민의 부재였다. 손흥민은 토트넘 입단 이후 줄곧 ‘해결사’로 불렸다. 해리 케인이 떠난 뒤에도 꾸준히 득점을 책임지며 팀을 지탱했다. 하지만 이번 시즌부터는 그의 이름이 스퍼스 명단에 없다. 그 공백은 현실이었다.

토트넘 팬들도 같은 생각이었다. BBC는 “토트넘 팬들은 쿠두스를 제외하면 공격 자원 대부분이 리그 정상급 수준에 미치지 못한다고 비판했다”고 전했다. 팬들은 “수비수들이 오히려 골대 앞에서 더 침착하다. 매디슨과 쿨루셉스키, 솔란케가 복귀하더라도 최고의 경기력을 되찾기까지는 시간이 필요하다”고 냉정히 평가했다. 일부 팬은 “이대로라면 상위권 진입은커녕 중위권 잔류도 쉽지 않다”고 탄식했다.

결정력 부재와 리더십 공백이 겹치면서, 토트넘의 경기력은 불안정하다. 공격 루트는 단조롭고, 전방에서의 연계도 매끄럽지 않다. 포스테코글루 감독 체제 초기에 보여줬던 빠른 전환과 창의적 공격은 점점 사라졌다.

[사진] ⓒGettyimages(무단전재 및 재배포 금지)
[사진] ⓒGettyimages(무단전재 및 재배포 금지)
반면 손흥민은 LAFC로 무대를 옮긴 뒤에도 변함없는 클래스와 집중력을 증명하고 있다. 그는 MLS 데뷔 이후 단 10경기 만에 9골을 터뜨리며 리그를 뒤흔들고 있다. LAFC는 그의 활약 덕분에 단숨에 서부 콘퍼런스 3위로 도약했고 MLS컵 우승 후보로 평가받는다.

결국 토트넘이 맞이한 현실은 명확하다. 케인과 손흥민이라는 두 축이 사라진 공격 라인은 완전히 다른 팀이 됐다. 단순한 전력 이탈이 아니라, 팀 정체성이 흔들리고 있다.  / 10bird@osen.co.kr"
20251022,"'日 스타 선수' 작심 발언! ""손흥민에게 수준 떨어지는 리그""…'단기 임대 미련' 프랭크와 마지막 시즌 보냈어야","사진=토트넘
사진=MLS
[스포츠조선 강우진 기자]일본 선수 요시다 마야가 손흥민에 대해 좋은 평가를 했다. 미국 메이저리그사커(MLS)가 손흥민이 있기에는 너무 좁은 리그라는게 요지다.

영국 스퍼스웹은 20일(한국시각) ""요시다가 토트넘을 떠나 로스앤젤레스 FC(LAFC)로 이적한 뒤 손흥민의 첫 몇 달에 대해 솔직한 발언을 남겼다""라고 전했다.

손흥민은 토트넘에서 총 173골을 기록하며 구단 역사상 통산 득점 순위 5위에 올랐고, 지난 10년간 프리미어리그에서 가장 꾸준한 공격수 중 한 명이었다. 그는 지난 여름 유럽 무대에서의 커리어를 마감하기로 결정했고, 예상대로 미국으로 이적한 이후 리그에서 독보적인 활약을 보여주고 있다.

사진=LAFC
손흥민은 올여름 이적 이후 MLS 수비진을 무너뜨리며 단 10경기에서 9골 3도움을 기록하고 있다. 요시다는 프리미어리그 시절 손흥민과 여러 차례 맞붙었던 선수로 두 사람은 잉글랜드 무대에서 자주 대결을 펼쳤다.

사우샘프턴에서 활약했던 요시다는 지난 2023년부터 LAFC의 지역 라이벌인 LA 갤럭시에서 뛰고 있다. 그는 손흥민의 LAFC 활약에 대해 묻는 질문에 ""그에게 여긴 너무 쉽다""라고 주장했다.

사진=토트넘
요시다는 손흥민이 여전히 유럽에서도 충분히 통할 실력을 갖췄다고 생각하는 듯하다. 그럼에도 손흥민은 토마스 프랭크 감독 아래서 챔피언스리그와 마지막 시즌을 보낼 기회를 스스로 포기했다고 매체는 전했다.

매체는 ""토트넘 팬들 중 일부는 왼쪽 윙어 자리가 부진한 현재의 팀 상황을 고려해 그가 1월 단기 임대로 돌아올 수 있지 않을까 하는 기대를 품고 있다""라며 ""MLS컵 결승전은 2025년 12월 초에 열리며, 다음 시즌은 2026년 2월 말에 시작된다. 이 일정상 손흥민이 잠시 토트넘으로 돌아올 수 있는 시간이 있다""라고 했다."
