date,title,content
20251022,"'손흥민 바이에른 뮌헨 이적' 초대박! ""케인과의 재회, 낭만적인 시나리오""→유럽 이적시장 달구는 SON","사진=SNS
사진=바이에른 뮌헨 SNS
[스포츠조선 강우진 기자]손흥민의 이적설이 또다시 유럽을 달구고 있다. 단기 임대 가능성이 커지면서 여러 구단들이 그의 상황에 예의주시하는 모습이다.

영국 트리뷰나는 22일(한국시각) ""전 토트넘 주장 손흥민이 LAFC(로스앤젤레스 FC)와의 계약 덕분에 유럽으로 단기 복귀할 수도 있다""라고 보도했다.

손흥민의 계약에는 과거 데이비드 베컴이 LA 갤럭시 시절에 보유했던 조항과 유사한 내용이 포함돼 있다고 한다. 당시 베컴은 MLS 비시즌 동안 AC밀란으로 임대 이적할 수 있었는데, 손흥민도 비슷한 방식으로 유럽 복귀가 가능하다는 것이다.

사진=SNS
사진=SNS
사진=LAFC
오는 2026년 북중미 월드컵은 손흥민이 한국 대표팀과 함께 치르는 마지막 대회가 될 것으로 예상되며, 이 대회를 앞두고 경기 감각을 유지하기 위해 단기 유럽 임대를 활용할 가능성이 있다. 손흥민의 LAFC 계약은 오는 2027년까지 이어지지만, 유럽의 여러 구단들이 여전히 그를 잠시라도 복귀시키기 위해 시도할 수 있다고 매체는 전했다.

33세인 손흥민은 MLS에서 맹활약을 펼치고 있다. 그는 9경기에서 8골 3도움을 기록하며 LAFC를 우승 경쟁 팀으로 끌어올리고 있다.

손흥민의 이적 가능성에 많은 구단들이 관심을 보이고 있다. 오랜기간 몸 담은 토트넘을 비롯해 이탈리아 세리에A의 명문팀 AC 밀란, 해리 케인이 있는 바이에른 뮌헨 등이 거론된다.

<저작권자(c) 연합뉴스, 무단 전재-재배포, AI 학습 및 활용 금지>
<저작권자(c) 연합뉴스, 무단 전재-재배포, AI 학습 및 활용 금지>
트라이벌 풋볼은 ""데이비드 베컴, 티에리 앙리, 프랭크 램파드 역시 MLS 소속 시절 유럽으로의 단기 복귀를 통해 컨디션과 경쟁력을 유지한 바 있다""라며 ""손흥민 또한 비슷한 길을 택할 수 있다. 이미 AC밀란이 관심을 보이고 있으며, 토트넘과의 짧은 재회, 혹은 바이에른 뮌헨에서 해리 케인과 다시 호흡을 맞추는 낭만적인 시나리오도 거론되고 있다""라고 전했다.

손흥민의 LAFC는 MLS컵 우승 후보 중 하나로 꼽히며, 결승전은 12월에 열릴 예정이다. 손흥민은 이 무대에서 자신의 첫 시즌을 우승으로 마무리하고자 한다. 시즌이 끝난 뒤에는 약 2~3개월의 공백기가 생긴다. 이 기간이 손흥민에게 새로운 도전의 가능성을 열어줄 수 있다.

매체는 ""어떤 선수들은 이 시기를 휴식의 기회로 삼지만, 또 다른 선수들은 유럽으로 단기 임대를 떠나 경기 감각을 유지하곤 한다""라며 ""2026년 월드컵이 다가오고 있는 만큼 손흥민의 이번 결정은 더욱 중요한 의미를 가질 수 있다""라고 주장했다."
20251022,"손흥민, 미국 떠나도 토트넘 안 간다...'충격' AC밀란 이적설→""연속 단기 임대 계약 원해! 34살이지만 큰 기대""","사진=스포츠360


[인터풋볼=신동훈 기자] 손흥민 유럽 복귀설에 힘이 붙고 있다. 이번엔 AC밀란과 연결됐다.

이탈리아 '풋이탈리아'는 21일(이하 한국시간) ""손흥민은 2026 국제축구연맹(FIFA) 북중미 월드컵을 앞두고 유럽 복귀를 원한다. 데이비드 베컴 룰로 유럽에 돌아오려고 한다. 밀란의 관심을 받고 있다""고 전했다.

LAFC는 정규 라운드를 종료했다. 미국 메이저리그사커(MLS)는 정규 라운드 후 플레이오프를 치른다. 서부 컨퍼런스에서 3위에 오른 LAFC는 플레이오프에 임한다. 결승까지 오른다고 해도 12월 초반에 시즌이 끝난다. 내년 시즌 시작은 2월이다. 3개월간 공백이 있다. 내년 월드컵을 준비해야 하는 손흥민 입장에선 실전 없이 3개월을 쉬는 건 타격이 클 수 있어 보인다.



겨울에 손흥민이 돌아올 수 있다는 주장이 나오는 이유다. 지난 8월 토트넘을 떠나 MLS 역대 최고 이적료에 LAFC에 입단했다. 손흥민은 LAFC 10경기에서 9골 3도움을 올리는 대단한 활약을 펼쳤다.

손흥민과 함께 LAFC는 MLS컵 우승을 노린다. 미국 '라스트 워드 온 스포츠'는 ""손흥민은 LAFC 첫 시즌에 MLS컵 우승을 노린다. 손흥민이 온 후 LAFC는 MLS컵 우승후보로 떠올랐다. 10경기 9골 3도움을 올린 손흥민은 LAFC에서 가장 사랑을 받는 선수로 24골을 터트린 부앙가와 엄청난 호흡을 자랑하는 중이다. 나단 오르다즈가 여기에 에너지를 더하는 중이다. 메시가 동부 컨퍼런스를 뒤흔드는 동안 손흥민이 서부를 지배했다. 손흥민의 빠른 발, 기술, 창의성은 MLS수비수가 감당하기에는 너무 힘들다""고 하면서 손흥민의 능력을 매우 높게 평가했다.



MLS 사무국은 LAFC는 MLS컵 우승 후보 1티어로 평가하면서 ""LAFC는 약팀을 괴롭히는 팀이었고 비슷한 체격의 팀을 만나면 고전했다. 올해는 그러지 않았다. 손흥민 영입 전에도 강팀들을 상대로 더 잘했다. 손흥민이 오고 부앙가와 호흡을 하니 누구도 막기 어렵다. 리그 최고 선수들이 어떤 모습을 보일까""고 기대감을 보였다.

화려하게 활약 중인 LAFC를 떠나 '베컴룰'로 겨울에 잠시 미국을 떠날 수 있다는 주앙이다. 시즌 종료가 되면 추춘제로 펼쳐지는 유럽에서 뛸 수 있도록 계약 조항이다. 이를 통해 과거 베컴-티에리 앙리가 이 룰을 통해 유럽으로 가 잠시 뛰고 돌아왔다. 베컴은 LA갤럭시에서 AC밀란으로, 앙리는 뉴욕 레드불스에서 아스널로 임대를 간 바 있다

영국 '더 선'은 17일 ""전 토트넘 '캡틴' 손흥민이 유럽에 돌아올 가능성이 생겼다. 손흥민의 경우, 내년 중반에 예정된 월드컵이 오프시즌 활용 방식에 영향을 줄 가능성이 있다. 아마도 이번 월드컵이 대한민국 대표팀에서의 마지막 월드컵이 될 가능성이 높아 휴식과 준비를 선택할 수도 있다. 다만 유럽 구단이 3~4개월 정도의 단기 계약으로 그를 다시 데려갈지는 미지수다""라고 이야기했다.



토트넘이 당연하게 떠오른다. 손흥민은 토트넘에서 10년 동안 뛰면서 공식전 454경기 173골 101도움을 기록했다. 프리미어리그 기록은 333경기 127골 77도움이었다. 손흥민은 프리미어리그 역대 득점 17위에 올라있다. 지난 시즌에는 유럽축구연맹(UEFA) 유로파리그(UEL) 우승을 이끈 후 화려하게 떠났다.

밀란도 언급되고 있다. '풋이탈리아'는 ""MLS 오프시즌 동안 미국을 떠나 유럽으로 돌아올 수 있는 손흥민을 밀란이 원한다. 곧 34살이 되는 선수인데 공격에 많은 걸 제공할 수 있다. 손흥민은 MLS로 떠나기 전부터 이탈리아 세리에A 팀들과 여럿 연결됐다. 1월에 다시 이탈리아와 연결될 것이마 밀란이 임대 영입을 원한다. 몇 년 동안 이 계약을 반복해서 하며 손흥민을 활용하기를 원한다""고 주장했다.

사진=LAFC
사진=LAFC


그러면서 ""밀란은 세리에A 정상 자리를 지키고 싶어한다. 크리스티안 풀리시치 등은 부상으로 고생을 하고 있어 공격진 보강을 원한다. 1월에 손흥민을 영입하려고 하는 이유다. 베컴도 미국에 있을 때 밀란으로 온 바 있다""고 덧붙였다.

미국 '애슬론 스포츠'도 ""손흥민 역시 월드컵 준비를 위해 유럽으로 돌아갈 계획이 있다. 2026년 합류가 가능한 옵션 중 하나로 AC 밀란이 거론된다. 손흥민이 AC 밀란에 합류할 경우 임대 계약은 연초부터 시작해 2026 MLS 시즌 시작 전까지 짧게 체결될 예정이다""라고 손흥민의 밀란 이적설을 거들었다.

사진=LAFC


스티브 체룬돌로 감독은 손흥민 복귀설에 대해 ""질문에 대답하자면 나는 잘 모르겠다. 확실하게 말할 수 있는 건 손흥민은 LAFC에 헌신적이라는 것이다. 그는 모든 경기에서 이기길 원한다. 시즌이 끝날 때까지 그럴 것이다""라고 답했다. 체룬돌로 감독이 간접적으로 부정했어도 이적설은 이어지고 있다. 토트넘보다 세리에A, 그 중에서도 밀란이 가장 언급된다.

세리에A는 항상 노장 선수들에게 열려 있다. 레알 마드리드를 떠난 루카 모드리치도 밀란에 있고 맨체스터 시티와 작별한 케빈 더 브라위너는 나폴리 유니폼을 입고 뛰는 중이다. 손흥민도 세리에A로 가면서 유럽에서 다시 기록을 쓸지 지켜볼 일이다."
20251022,"韓 축구 초대박 유럽 리턴…""손흥민, MLS → 세리에A"" 초명문 AC밀란, 골 필요해서 SON 겨울에 영입 시도","▲ 유럽으로의 짧은 복귀냐, MLS 정복의 완성이냐. 손흥민의 다음 행보가 다시 한 번 전 세계 축구 팬들의 시선을 끌고 있다. 세리에A AC 밀란이 단기 임대를 원한다.


[스포티비뉴스=조용운 기자] 떠난 지 반년도 되지 않아 손흥민(33, 로스앤젤레스FC)의 이름이 다시 유럽 축구판에 등장했다.

미국 무대를 뒤흔들며 새로운 전성기를 열고 있는 손흥민에게 이번엔 이탈리아 명문 AC밀란이 손짓을 보냈다.
이탈리아 매체 '셈프레 밀란'은 22일(한국시간) ""밀란이 손흥민을 단기 임대 형태로 데려올 가능성을 검토 중""이라며 ""과거 데이비드 베컴을 영입했을 때와 같은 방식이 될 수 있다""고 전했다.

보도에 따르면 손흥민의 LAFC 계약에는 MLS 비시즌인 겨울 기간 동안 유럽 구단과 단기 계약을 체결할 수 있는 이른바 '베컴법'이 포함된 것으로 알려졌다. 이는 과거 베컴과 티에리 앙리가 활용했던 조항과 같은 형태다.

베컴은 2009년과 2010년 LA갤럭시 소속으로 뛰던 중 AC밀란 유니폼을 입었고, 앙리는 2012년 뉴욕 레드불스 시절 아스널에 잠시 합류해 팬들의 환호를 받았다.

▲ 유럽으로의 짧은 복귀냐, MLS 정복의 완성이냐. 손흥민의 다음 행보가 다시 한 번 전 세계 축구 팬들의 시선을 끌고 있다. 세리에A AC 밀란이 단기 임대를 원한다. ⓒ LAFC


손흥민이 이 조항을 실제로 가동할 경우 유럽 무대 복귀는 충분히 실현 가능한 시나리오가 된다. 셈프레 밀란은 ""손흥민의 커리어와 상징성을 감안할 때 잉글랜드 프리미어리그 복귀설도 있지만, 베컴 루트를 개척했던 밀란이 가장 현실적인 행선지일 수 있다""고 분석했다.

이어 ""손흥민은 토트넘 복귀뿐 아니라 밀란 임대 혹은 월드컵을 앞둔 한국 복귀 시나리오까지 폭넓게 검토 중인 것으로 알려졌다""고 덧붙였다.

손흥민은 지난 여름 토트넘 홋스퍼를 떠나 LAFC에 합류했다. 이적료는 MLS 역대 최고 수준인 2,200만 달러(약 315억 원)를 기록했다. 자연스럽게 이적 발표 직후부터 미국 축구계의 화제 중심에 섰다.

손흥민은 단 10경기 만에 9골 2도움을 기록하며 '흥부 듀오'로 불리는 드니 부앙가와 함께 MLS를 뜨겁게 달궜다. 둘은 3경기 연속 해트트릭 합작이라는 전무후무한 기록을 세우며 LAFC를 단숨에 우승 후보로 끌어올렸다.

▲ 유럽으로의 짧은 복귀냐, MLS 정복의 완성이냐. 손흥민의 다음 행보가 다시 한 번 전 세계 축구 팬들의 시선을 끌고 있다. 세리에A AC 밀란이 단기 임대를 원한다.


손흥민의 합류는 단순한 전력 강화 이상의 효과를 냈다. 유니폼 판매량은 폭발적으로 늘었고, 홈경기 매진 행렬이 이어졌다. 미국 언론들은 ""손흥민이 MLS 전체의 흥행 구도를 바꿔놨다""며 '손흥민 효과'를 집중 조명했다.
실제로 LAFC는 공격 템포와 전진 패스 비율이 리그 최상위권으로 올라섰고, 팬들은 ""손흥민을 보기 위해 경기장을 찾는다""고 입을 모은다.

지금 보여주는 퍼포먼스는 당연히 유럽 최고 무대에서도 통한다는 평이다. 그래서 밀란이 득점력 부재로 애를 먹는 현 상황을 타개하기 위해 손흥민을 염두에 두고 있다. 2025-26시즌 세리에A에서 5승 1무 1패로 선두를 달리는 밀란이지만 11골에 머물고 있다. 2위 인터 밀란이 같은 기간 18골을 넣은 것에 비교하면 다소 처지는 수치다.

MLS는 2월 개막해 10~11월 시즌을 마치는 춘추제 리그다. 시즌이 끝나면 약 석 달간 휴식과 전지훈련 기간이 이어진다. 만약 손흥민의 계약에 알려진 대로 유럽 단기 임대 조항이 있다면, 이 공백기 동안 유럽 클럽에 등록해 2~3개월간 뛰는 것이 가능하다.

▲ 유럽으로의 짧은 복귀냐, MLS 정복의 완성이냐. 손흥민의 다음 행보가 다시 한 번 전 세계 축구 팬들의 시선을 끌고 있다. 세리에A AC 밀란이 단기 임대를 원한다. ⓒ LAFC


다만 변수는 체력 관리다. 한창 일정이 많아지는 내년 초에 유럽 무대에 즉시 투입될 경우 부상 위험이 커질 수 있다. 베컴법 존대를 알린 영국 '더 선'은 ""손흥민이 2026 북중미 월드컵을 앞두고 있기 때문에 유럽행보다 휴식과 컨디션 유지에 집중할 가능성도 있다""고 전망했다.

매체는 또 ""손흥민이 이적 후에도 여전히 세계 최고 수준의 컨디션을 유지하고 있다""며 ""그가 어느 길을 택하든 팀과 리그 모두에게 영향력은 막대할 것""이라고 덧붙였다.

한편 손흥민은 MLS '올해의 골' 후보로 선정된 데 이어 이번에는 MLS 신인상 후보로까지 거론되고 있다. 시즌 중반에 합류한 선수로서는 이례적인 평가다.

▲ 유럽으로의 짧은 복귀냐, MLS 정복의 완성이냐. 손흥민의 다음 행보가 다시 한 번 전 세계 축구 팬들의 시선을 끌고 있다. 세리에A AC 밀란이 단기 임대를 원한다. ⓒ LAFC


MLS 신인상은 어린 유망주에게 주어지는 K리그의 영플레이어상과 성격이 다르다. 다른 무대에서 충분한 경력을 쌓은 선수라도 MLS 데뷔 시즌에 가장 큰 영향력을 보여줬을 때 수여되는 상이다. 말 그대로 나이 불문하고 리그를 뒤흔든 신참에게 주어지는 트로피다.

미국 MLS 전문기자 파비안 렌켈은 21일(한국시간) ""손흥민은 시즌 도중에 합류했음에도 MLS 올해의 신인상 후보 자격이 충분하다""고 평가했다. 그는 ""MLS의 신인은 '프로 경력이 있는 선수 중 올 시즌 처음 MLS에서 뛴 선수'를 의미한다""며 ""500분 이상 출전이 자격 조건인데 손흥민은 이를 훌쩍 넘겼다""고 덧붙였다."
20251022,"'월클 MF' 동생, 김민재 향해 깜짝 폭언…""뮌헨? KIM보다 더 빼어난 센터백 필요""","(엑스포츠뉴스 나승우 기자) '월드클래스 미드필더' 토니 크로스의 동생 펠릭스 크로스가 바이에른 뮌헨에 김민재 대신 더 강한 센터백이 있어야 한다고 주장했다.

독일 매체 슈포르트1은 20일(한국시간) ""펠릭스 크로스는 뮌헨이 다요 우파메카노의 재계약 여부에 관계 없이 니코 슐로터벡(보루시아 도르트문트)을 영입할 기회를 놓쳐서는 안 된다고 주장했다""고 보도했다.
1999년생 독일 출신 수비수 슐로터벡은 프라이부르크, 우니온 베를린을 거쳐 지난 2022년부터 도르트문트에서 활약하고 있다.

191cm의 장신인 슐로터벡은 정확한 태클과 뛰어난 볼 경합 능력을 가지고 있다. 귀한 왼발잡이 센터백으로 정확한 패스를 통해 빌드업에 강점을 보인다. 이미 독일 국가대표로 A매치 22경기에 출전하는 등 재능을 인정 받았다.

슐로터벡은 최근 바이에른 뮌헨의 관심을 받고 있다. 뮌헨이 프랑스 수비수 다요 우파메카노와 재계약 협상에 난항을 겪고 있기 때문이다.

1년이 지나가고 있는 상황에서 아직까지 합의에 이르지 못했다. 우파메카노는 내년 여름이면 뮌헨과 계약이 종료된다. 뮌헨은 우파메카노를 붙잡지 못했을 경우를 대비해 주전 센터백을 찾아봐야 하는 상황이다.



슐로터벡은 충분히 노려볼 만한 자원이다. 도르트문트와 계약이 1년 반 정도 남아있기 때문에 많은 이적료가 들지는 않는다.

슐로터벡이 뮌헨의 관심을 받고 있는 상황에서 펠릭스 크로스는 우파메카노의 재계약 여부와 관계 없이 뮌헨이 슐로터벡을 영입해야 한다고 주장했다.

슈포르트1에 따르면 펠릭스는 ""뮌헨이라면 최고 수준의 센터백을 세 명은 둬야 하는 것 아닌가?""라고 말했다.

독일 유력지 빌트 소속 기자 토비 알트셰플이 ""뮌헨 스쿼드에는 여전히 김민재라는 센터백이 있다""고 반박했으나 크로스는 ""알고 있다. 하지만 난 최고 수준의 센터백을 말하는 것""이라며 김민재가 뮌헨에서 뛸 만한 뛰어난 선수는 아니라고 받아쳤다.



알트셰플이 ""그건 조금 심한 주장이다""라고 말하자 크로스는 ""슐로터벡이 김민재보다 훨씬 뛰어난 선수다. 난 그가 김민재보다 훨씬 앞서 있다고 본다""면서 슐로터벡이 김민재보다 뛰어난 센터백이라는 점을 꿋꿋하게 강조했다.

크로스의 주장과는 별개로 뮌헨은 김민재의 기량에 만족하고 있는 것으로 알려졌다.

알트셰플은 최근 빌트 팟캐스트에 출연해 ""지난 여름에도 김민재를 원하는 팀들의 조건은 이적 옵션이 포함된 임대였다. 이제 김민재에게는 그런 선택지가 없다. 특히 지금은 더욱 그렇다. 김민재가 뮌헨에서 편안함을 느끼고 있기 때문""이라며 ""뮌헨에서도 김민재가 백업 선수임에도 출전했을 때 보여주는 열정과 헌신에 대해 매우 긍정적으로 평가하고 있다""며 뮌헨 역시 김민재를 방출할 생각이 없다고 강조했다.

사진=연합뉴스"
20251022,"손흥민, AC밀란 단기 임대 재점화! 마지막 월드컵 전 '3개월 공백' 싫다… MLS 오프시즌 유럽행? '베컴 플랜'' 가동","(엑스포츠뉴스 윤준석 기자) 미국 무대를 평정한 손흥민이 불과 몇 달 만에 다시 유럽 무대 복귀를 추진하고 있다는 보도가 연이어 나오고 있다.

잉글랜드와 이탈리아 주요 매체들은 손흥민이 2026 국제축구연맹(FIFA) 북중미 월드컵을 앞두고 경기 감각을 유지하기 위해 이른바 '데이비드 베컴 조항'을 발동할 가능성이 높다고 전했다.

이 조항은 메이저리그사커(MLS) 소속 선수가 오프시즌 기간 동안 유럽 구단으로 단기 임대를 떠날 수 있도록 허용하는 계약 조건이다.

이탈리아 축구 전문 매체 '풋볼 이탈리아'는 21일(한국시간) ""손흥민이 월드컵을 앞두고 유럽 복귀를 추진하고 있으며, 세리에A 명문 AC 밀란이 그를 임대로 데려오길 원하고 있다""고 보도했다.

매체는 이어 ""손흥민은 토트넘 홋스퍼를 떠나 MLS에 입성한 뒤 10경기에서 9골 3도움을 기록하며 완벽히 적응했다. 그러나 MLS 시즌이 12월에 종료되면 약 2~3개월 동안 공백기가 생기기 때문에, 손흥민이 이를 최소화하기 위한 방안으로 유럽 복귀를 모색하고 있다""고 덧붙였다.



손흥민은 지난 2025년 8월, 토트넘과의 10년 동행을 마무리하고 이적료 2200만 유로(약 365억원)에 로스앤젤레스FC(LAFC)로 이적했다.

당시 MLS 역대 최고 수준의 이적료로 기록된 그의 영입은 미국 축구계 전반에 걸쳐 큰 반향을 일으켰다.

복수 매체는 손흥민의 LAFC 합류가 리오넬 메시가 인터 마이애미에 입단했을 때와 비견될 만한 파급력을 가져왔다고 언급했다. 

실제로 그가 입단한 이후 LAFC 구단의 SNS 반응은 약 600% 폭등했으며, 경기장 수익도 눈에 띄게 늘어난 것으로 전해졌다. 

그는 데뷔 직후부터 MLS에서 압도적인 활약을 펼치며 LAFC의 서부 콘퍼런스 3위 진출을 견인했다. 특히 콜로라도 래피즈전에서는 시즌 9호골을 기록하며 정규리그를 마무리했다. 이제 팀은 오는 10월 30일부터 시작되는 플레이오프에서 오스틴FC와 2차전 승부를 벌이며 통산 두 번째 MLS컵 우승을 노린다.



문제는 시즌이 끝난 뒤 찾아오는 공백기다.

MLS는 춘추제로 운영되어 12월 초에 시즌이 종료되고, 다음 시즌은 이듬해 2월 말 혹은 3월에 개막된다.
손흥민이 속한 LAFC가 결승에 오르지 못할 경우 약 석 달 가까이 공식 경기를 치르지 못하는 셈이다. 33세의 나이를 감안하면 경기 감각 저하가 우려되는 부분이며, 이를 해결하기 위한 현실적인 대안이 바로 '베컴 조항'이라는 설명이다.

'베컴 조항'은 잉글랜드의 축구 스타 데이비드 베컴이 2007년 LA 갤럭시로 이적할 당시 체결했던 계약에서 유래했다.

베컴은 2009년과 2010년 두 차례에 걸쳐 AC 밀란으로 단기 임대를 떠나 잉글랜드 대표팀 소집을 대비했다. 이 조항을 통해 그는 유럽 최고 수준의 경기력을 유지하며 2010 남아공 월드컵에도 출전 자격을 유지할 수 있었다.

손흥민 역시 같은 방식으로 MLS 오프시즌 동안 유럽 구단에 임시 합류할 수 있는 조항을 계약서에 삽입한 것으로 알려졌다.



현재 손흥민의 잠재적 행선지로는 이탈리아 세리에A AC 밀란이 거론된다.

'풋볼 이탈리아'는 ""AC 밀란이 손흥민을 2026년 1월 이적 시장에서 단기 임대로 영입하는 방안을 검토하고 있다:고 전했다.

또한 ""이 조항이 작동될 경우, 향후 몇 년간 반복적인 임대 형태로도 이어질 가능성이 있다""고 덧붙였다.

현재 밀란은 공격진에 부상 악재가 겹친 상황이다. 크리스티안 풀리식이 부상으로 이탈해 있고, 하파엘 레앙은 두 달간 결장 후 최근 복귀했다. 공격 자원이 부족한 밀란으로서는 손흥민 같은 다재다능한 공격수의 단기 영입이 매력적인 선택지로 보인다는 해석이다.

특히 베컴이 2009년과 2010년에 LA 갤럭시에서 밀란으로 임대됐던 전례를 고려하면, 손흥민의 단기 임대 가능성도 충분하다는 설명도 덧붙였다.



프리미어리그 복귀도 말이 안 되는 이야기는 아니다.

영국 '골닷컴'은 ""손흥민의 MLS 계약에는 단기 임대 허용 조항이 존재하며, 이를 통해 그는 프리미어리그 복귀도 가능하다""고 전했다.

매체는 ""손흥민은 토트넘 시절 445경기 173골을 기록하며 구단 역사상 가장 성공한 아시아 선수로 자리했다. 만약 그가 임대를 통해 잉글랜드로 돌아온다면, 이는 프리미어리그 역사상 또 하나의 상징적인 장면이 될 것""이라고 평가했다.

'골닷컴'은 또 다른 가능성으로 독일 분데스리가의 바이에른 뮌헨도 언급했다. 매체는 ""손흥민이 뮌헨으로 향할 경우 해리 케인과 재회할 수 있다. 두 선수는 프리미어리그에서 수차례 득점과 도움 합작 기록을 세우며 '역대 최고의 공격 듀오'로 불렸다""고 덧붙였다.



하지만 손흥민의 유럽 복귀 가능성에 대한 논란이 커지자, 현 소속팀 LAFC의 스티브 체룬돌로 감독은 최근 인터뷰에서 ""사람들은 날씨, 정치, 내 머리 스타일까지 여러 가지 이야기를 하지만, 나는 그런 말들에 귀 기울이지 않는다""며 해당 이적설을 일축했다.

그는 ""확실히 말할 수 있는 건 손흥민이 LAFC에 매우 헌신적이라는 사실이다. 그는 매 경기에서 승리를 원하고, 시즌이 끝날 때까지 변함없을 것""이라고 강조하며 손흥민은 LAFC 선수라는 점을 각인시켰다.

손흥민의 LAFC와의 계약 기간은 2027년까지로, 구단이 원할 경우 2029년까지 연장 옵션이 포함된 장기 계약이다.

그럼에도 불구하고 MLS 오프시즌 동안의 단기 임대는 충분히 가능하다는 것이 주요 외신들의 공통된 분석이다.

무엇보다 손흥민은 다음 월드컵에서는 만 34세가 되는 만큼, 이번 대회가 그의 국가대표 커리어에서 마지막 무대가 될 가능성이 크다.

손흥민의 향후 행보는 오는 12월 MLS 시즌 종료 이후 본격적으로 가시화 될 수 있다.

LAFC가 플레이오프에서 어떤 결과를 내느냐에 따라 복귀 시점이 달라질 수 있으나, 외신 보도대로 '베컴 조항'이 실제로 발동된다면, 손흥민은 2026년 1월부터 3월 사이 유럽 무대에서 다시 한 번 유니폼을 입는 모습을 볼 수도 있다.

사진=연합뉴스 / 엑스포츠뉴스DB"
