date,title,content
20250818,"‘흥민아, 형도 MLS 데뷔했다’···‘독일 레전드’ 뮐러, 밴쿠버 데뷔전 30여분 활약 ‘공격포인트 없어’","밴쿠버 화이트캡스 토마스 뮐러가 18일 MLS 휴스턴전에 후반 교체 멤버로 나서 그라운드를 누비고 있다. AP연합뉴스


‘흥민아, 나도 데뷔했다.’

독일 축구 레전드 토마스 뮐러(36·밴쿠버)가 미국 메이저리그사커(MLS) 데뷔전을 치렀다. 손흥민(33·LAFC)에 이어 또 한명의 ‘월드클래스’가 MLS 무대 신고식을 치렀다.

뮐러는 18일 캐나다 밴쿠버 BC플레이스에서 열린 2025 MLS 휴스턴 다이너모와 홈경기에 1-0으로 앞선 후반 16분 교체 멤버로 그라운드를 밟았다. 뮐러는 경기 종료까지 30여 분간 그라운드를 누비며 MLS에서 화려한 데뷔전을 마쳤다. 뮐러는 27번 볼터치를 기록하며 패스 정확도 83%(19/23)를 기록하고, 롱패스 2개를 정확하게 배달했다. 후반 18분 통렬한 중거리슛으로 골망을 갈랐으나 앞서 동료의 오프사이드가 선언돼 골로 인정되지 못했다. 뮐러는 데뷔전에서 공격포인트를 기록하진 못했다.
밴쿠버는 후반 추가시간에 휴스턴 아르투르에게 골을 내줘 1-1로 비겼다. 밴쿠버는 이날 무승부로 시즌 13승7무6패(승점 46)로 손흥민이 속한 서부 콘퍼런스 3위를 지켰다. LAFC(승점 40)는 밴쿠버보다 2경기 덜 치른 가운데 서부 콘퍼런스 5위다.

뮐러는 밴쿠버 팬의 뜨거운 환호 속에 데뷔전을 치르며 축구인생의 새로운 장을 열었다. 뮐러는 지난 15일 밴쿠버 입단 기자회견에서 “나는 승부욕이 강한 사람이다. 지금 이 시점에도 은퇴하기에는 내 몸이 너무 좋은 상태라고 느낀다”라며 새로운 도전에 대한 의욕을 밝혔다.

밴쿠버 화이트캡스 토마스 뮐러(왼쪽)가 18일 MLS 휴스턴전을 마치고 동료 잉게 우트빅과 웃으며 대화하고 있다. Imagn Images연합뉴스


뮐러는 미국에서 새로운 도전을 선택한 데 대해 “유럽, 특히 바이에른 뮌헨에서 수년간 뛰었던 시간을 매우 자랑스럽게 생각한다. 하지만 이제는 모험을 해볼 때라고 느꼈다”라고 했다. 그는 “내게 모험이란, 타이틀에 도전할 기회가 있어야만 흥미롭다. 올 시즌 밴쿠버의 경기력과 최근 몇 년간의 발전을 보면 올해뿐만 아니라 내년에도 기회가 있다고 생각한다”라고 덧붙였다.

뮐러는 2010년대와 2020년대까지 독일 축구를 대표한 레전드다. 특히 뮌헨과 함께한 세월만 하더라도 25년에 달한다. 2008-09시즌 뮌헨에서 프로 데뷔한 이래로 지난 시즌까지 통산 756경기에서 250골·223도움을 기록했으며, 같은 기간 33개의 우승 트로피를 들어 올렸다.

그러나 이번 여름 새 도전에 나섰다. 앞서 밴쿠버는 7일 구단 홈페이지를 통해 “우리는 축구 역사상 가장 많은 우승 경력을 자랑하는 선수 중 한 명인 독일의 전설적인 공격형 미드필더 뮐러를 영입했다”라고 발표했다.

이에 뮐러는 “도시가 아름답다. 하지만 그보다 중요한 건 우승이다. 악셀 슈스터 디렉터와 예스퍼 쇠렌센 감독과의 대화는 매우 긍정적이었다. 이제 팬들 앞에서 뛰는 것이 정말 기대된다. BC플레이스를 가득 채운 팬들과 함께 플레이오프(PO)를 향해 달려가고 싶다”고 전했다.

밴쿠버 화이트캡스 토마스 뮐러가 18일 MLS 휴스턴전을 앞두고 경기장에 입장하며 홈팬들의 열렬한 환호를 받고 있다. AP연합뉴스


양승남 기자 ysn93@kyunghyang.com"
20250818,"이렇게 서럽게 울 수가...네이마르, 0-6 대패에 눈물 펑펑 ""고통스럽고 부끄럽다""","사진 = 풋아프리카


[인터풋볼=박윤서 기자] 네이마르가 패배에 엉엉 울었다.

네이마르가 뛰고 있는 산투스는 18일 오전 4시(한국시간) 브라질 상파울루에 위치한 모룸비스에서 열린 2025시즌 브라질 세리A 20라운드에서 바스쿠 다 가마에 0-6으로 대패했다.

산투스는 전반전 1실점하면서 끌려갔다. 후반전 들어서 산투스는 완전히 무너졌다. 후반 7분부터 23분까지 16분 동안 무려 5실점했다. 바스쿠 다 가마는 필리페 쿠티뉴를 앞세워서 공격했고 후반전 이른 시간 아예 승부를 결정지었다. 경기는 바스쿠 다 가마의 6-0 승리로 종료됐다.

이날 네이마르는 선발로 출전하여 90분 풀타임을 소화했다. 패스 성공률 71%(27/38), 기회 창출 2회, 파이널 써드 패스 7회, 지상볼 경합 승률 83%(5/6) 등을 기록했다. 슈팅은 없었다. 공격형 미드필더로 나섰는데 어떤 것도 해보지 못하고 철저히 제압당했다.

사진 = BBC


경기가 끝난 뒤 네이마르는 눈물을 흘렸다. '풋 아프리카'는 18일 ""경기 종료 후 디니스 감독의 품에 안겨 눈물을 흘리는 네이마르의 모습이 포착됐다. 산투스 팬들은 큰 충격에 빠졌다""라고 전했다.

네이마르는 ""오늘 일어난 일은 충격적이다. 이런 경기는 절대 일어나서는 안 된다. 모두가 우리가 짊어져야 할 책임을 알고 있다. 고통스러운 패배였고 정말 부끄러운 일이다. 깊이 좌절했다. 팀은 달라져야 한다. 전에는 느껴보지 못한 부끄러움이다. 오늘은 정말 힘든 날이었다. 분노와 좌절, 무력감이 느껴진다. 내가 할 수 있는 일은 아무것도 없었다""라고 말했다.

네이마르는 바르셀로나와 파리 생제르맹(PSG)에서 수년 동안 활약한 뒤 2023년 유럽을 떠났다. PSG를 떠나 사우디아라비아 프로 리그 알 힐랄로 향했는데 곧바로 부상에 시달리면서 첫 시즌 단 5경기밖에 뛰지 못했다. 지난 시즌도 마찬가지였다. 결국 알 힐랄과 계약 해지했고 네이마르는 올해 친정팀 산투스로 돌아갔다. 현재 산투스에서 리그 11경기에 출전해 3골을 기록 중이다."
20250818,"뉴캐슬 캡틴도 인정 ""손흥민은 EPL 레전드""…'토트넘은 너무 쉽게 떠나 보냈다'","기마랑이스/게티이미지코리아
기마랑이스와 손흥민/게티이미지코리아

[마이데일리 = 김종국 기자] 뉴캐슬의 주장 기마랑이스가 손흥민이 프리미어리그 무대를 떠난 것에 대한 아쉬움을 나타냈다.

영국 매체 TBR은 17일 가마랑이스가 손흥민에 대하 언급한 내용을 소개했다. 이 매체는 '뉴캐슬의 주장 기마랑이스가 올 여름 토트넘이 매각한 손흥민에 대해 언급했다. 토트넘은 이전 주장이 보장했던 골과 어시스트를 어느 정도 잃게 됐다. 손흥민의 미국 메이저리그사커(MLS)행을 이야기할 때 기마랑이스는 많은 사람들과 마찬가지로 토트넘이 전설을 잃었다고 말했다'고 조명했다.
기마랑이스는 손흥민에 대한 질문에 ""한마디로 딱 잘라 말하기는 어렵다. 레전드라도 말하고 싶다. 토트넘과 프리미어리그에서 손흥민은 레전드다. 나는 항상 손흥민을 좋아했고 레전드라고 표현하고 싶다""는 뜻을 나타냈다.

기마랑이스는 지난 3일 서울에서 열린 토트넘과 뉴캐슬의 프리시즌 경기에 출전했다. 당시 경기는 손흥민의 토트넘 고별전이었고 손흥민이 토트넘 주장으로 뛴 마지막 경기였다. 경기 중 기마랑이스는 토트넘 수비수 로메로와 몸싸움에 가까운 신경전을 펼쳤지만 손흥민이 다가서 중재에 나서자 곧바로 흥분을 자제하는 모습을 보이기도 했다.

기마랑이스는 지난 2021-22시즌부터 뉴캐슬에서 활약하고 있는 가운데 지난 시즌에는 프리미어리그 38경기에 모두 출전하기도 했다. 브라질 대표팀에선 지난 2020년 A매치 데뷔전을 치른 후 A매치 35경기에 출전하고 있다.

손흥민은 올 여름 이적시장을 통해 MLS의 LAFC로 이적한 가운데 17일 열린 뉴잉글랜드레볼루션과의 2025 MLS 26라운드를 통해 LAFC 입단 후 첫 선발 출전했다. LAFC는 손흥민의 활약과 함께 2-0 승리를 거두며 MLS에서 4경기 만에 승리하는데 성공했다. 손흥민은 이날 경기 추가골을 어시스트하며 팀 승리 주역으로 활약했다.

MLS는 '손흥민이 LAFC의 승부를 결정하는 선수가 되기 위해선 단 한 번의 선발 출전만 필요했다. 손흥민은 LAFC에서 두 번째로 출전한 경기에서 뛰어난 성과를 거뒀다'며 '손흥민은 LAFC의 두 골에 모두 관여했고 MLS 데뷔골을 넣을 뻔했다. 손흥민은 강력한 압박으로 델가도의 선제골을 이끌어냈고 후반전 추가시간에는 쇼이니에르의 득점을 어시스트했다'며 활약을 조명했다.

손흥민은 뉴잉글랜드레볼루션을 상대로 LAFC의 최전방 공격수로 나서 인상적인 활약을 펼쳤다. 네 차례 시도한 드리블 돌파는 모두 성공했고 4번의 슈팅을 기록하기도 했다. 뉴잉글랜드레볼루션의 포파나는 후반 43분 속공 상황에서 드리블을 시도하는 손흥민을 발을 걷어차 경고를 받기도 했다. 손흥민은 키패스도 다섯 차례 기록하는 등 팀 공격에 활기를 불어 넣었다. LAFC의 체룬돌로 감독은 ""손흥민은 매일 팀에 미소를 가져다준다. 그 점이 매우 중요하다고 생각한다. 손흥민은 행복해하고 의욕이 넘치고 팀과 소통이 잘 되는 선수""라며 ""또한 손흥민은 뛰어난 기술과 스피드, 마무리 능력과 오랜 세월 쌓아온 경험도 보유하고 있다. 손흥민을 영입하게 되어 정말 기쁘다""며 만족감을 나타냈다.
손흥민/게티이미지코리아
손흥민/게티이미지코리아"
20250818,"토트넘-레비 회장 상상이나 했을까, 손흥민 떠난 빈자리 '비둘기 댄스가이'가 대체할 줄이야...""히샬리송, 마치 해리 케인 같아"" 극찬","사진=히샬리송 SNS 캡처
로이터연합뉴스
[스포츠조선 이현석 기자]리그 단 한 경기만에 에이스로 떠올랐다. 손흥민의 빈자리를 히샬리송이 채우고 있다.

글로벌 스포츠 언론 디애슬레틱은 17일(한국시각) '히샬리송이 토트넘 주전 스트라이커 자리를 둔 경쟁에서 이점을 얻었다'라고 보도했다.

토트넘은 16일 영국 런던의 토트넘 홋스퍼 스타디움에서 열린 번리와의 2025~2026시즌 잉글랜드 프리미어리그(EPL) 1라운드 경기에서 3대0 대승을 거뒀다. 지난 시즌 리그 17위로 마감했던 토트넘은 개막전 대승과 함께 토마스 프랭크 감독 체제에서의 기대감을 끌어올렸다.

로이터연합뉴스
승리의 주역은 단연 멀티골을 터트린 히샬리송이었다. 히샬리송은 전반 10분 감각적인 오른발 발리 슛으로 번리 골망을 흔든 것에 이어, 후반 15분 화려한 바이시클 킥으로 다시 한번 번리 골문을 갈랐다. 토트넘은 브레넌 존슨의 쐐기골까지 터지며 번리를 완전히 제압했다.

손흥민의 공백과 함께 우려가 컸던 시즌의 시작이었다. 토트넘은 올여름 팀 레전드이자, 공격의 핵심인 손흥민이 LA FC로 이적했다. 지난 시즌 다소 부진했던 손흥민이지만, 공격에서의 영향력 만큼은 토트넘 내에서 절대적이었다. 그런 그가 떠났기에 토트넘은 전력 약화 우려가 있었다. 하지만 히샬리송의 반전 활약으로 공격진 무게감이 전혀 줄어들지 않은 모습이었다.

히샬리송에게도 반전의 경기였다. 왓포드와 에버턴을 거친 히샬리송은 지난 2022년 6000만 파운드(약 1120억원)라는 막대한 이적료로 토트넘에 합류했다. 뛰어난 활동량과 문전 앞에서의 날카로움, 제공권 등이 뛰어났기에 활약이 기대됐다. 하지만 활약은 미미했다. 히샬리송은 토트넘에서 3시즌 동안 90경기를 뛰며 단 20골에 그쳤다. 하지만 이날 경기 활약으로 다시금 토트넘 주전으로 도약할 기회를 받을 수 있을 것으로 보인다.

로이터연합뉴스
디애슬레틱은 '히샬리송은 EPL의 수수께끼 같은 선수였다. 그는 지난주 파리 생제르맹과의 슈퍼컵 경기와 EPL 개막전을 통해 2023~2024시즌 활약 이후 가장 뛰어난 재능을 선보였다'며 '그는 최근 토트넘 홈구장에서 선발 9경기 9골을 기록했고, 꾸준한 득점력을 보여왔다. 해리 케인을 떠오르게 하는 마무리를 보여줬고, 무엇보다 케인의 마무리 스타일과 닮았다'라고 평가했다.

이어 '히샬리송은 월드클래스 마무리뿐만 아니라, EPL 공격수로서 필요한 일반적인 역할들도 수행할 수 있다는 점을 증명했다. 이는 프랭크 감독에게도 고무적인 요소다. 주의할 점은 활약 이후 부상으로 꺾이는 히샬리송의 반복된 패턴이다. 히샬리송으로서는 꾸준히 출전하기 위해 보호하는 것이 무엇보다도 중요하다'라고 덧붙였다.

손흥민의 이적 이후 걱정이 컸던 토트넘 공격진에 새로운 에이스가 등장했다. 반전 경기력을 선보인 히샬리송이 토트넘에서 드디어 자신의 진가를 발휘할 수 있을지도 귀추가 주목된다."
20250818,"'韓 축구 역대급 사건' 터질까! '아스날 이적설' 이강인, 깜짝 선발 출전→평점 7.5 맹활약, PSG는 낭트에 1-0 승...권혁규,홍현석도 출전","▲ ⓒ연합뉴스/EPA
▲ ⓒ연합뉴스/EPA


[스포티비뉴스=장하준 기자] 이적설이 불거지는 와중, 오랜만의 선발 출전이 매우 흥미롭다.

파리 생제르맹(PSG)은 18일(한국시간) 프랑스 낭트의 스타드 드 라 보주아르에서 열린 2025-26시즌 프랑스 리그앙 1라운드에서 1-0으로 승리했다. 후반 22분에 터진 비티냐의 선제골은 결승골로 이어졌다.

최근 이적설이 불거지고 있는 이강인은 낭트를 상대로 깜짝 선발 출전에 성공했다. 그는 후반 16분까지 활발한 움직임을 선보이며 PSG의 승리에 이바지했다. 공격 포인트를 기록하지는 못했지만, 중원에서 팀의 중심을 잡으며 맹활약했다.

축구통계매체 '풋몹'에 따르면 이강인은 이날 패스 성공률 92%(57/62)를 기록했으며, 2번의 슈팅과 3번의 기회를 창출했다. 이에 풋몹은 이강인에게 평점 7.5를 부여했다. 비티냐와 워렌 자이르-에메리, 일리얀 자바르니에 이어 선발 선수 중 4번째로 높은 평점을 기록했다.

PSG의 루이스 엔리케 감독은 이날 경기에서 4-3-3을 들고 나왔다. 최전방에는 곤살루 하무스와 브래들리 바르콜라, 이브라힘 음바예를 최전방에 배치했다. 이어 이강인과 비티냐, 마누엘 우가르테로 구성된 중원을 꾸렸다. 백4는 루카스 에르난데스, 루카스 베랄두, 자바르니, 자이르-에메리로 구성됐다. 골문은 루카스 슈발리에가 지켰다.
전체적으로 선발 라인업에 힘을 뺀 PSG였다. PSG는 지난 14일 토트넘 홋스퍼를 상대로 한 유럽축구연맹(UEFA) 슈퍼컵을 치렀다. 두 팀은 2-2 무승부를 거둔 뒤, 승부차기에 돌입했고 끝내 PSG가 승리했다.

이러한 혈투 덕분에 PSG는 주전 선수들의 체력 안배를 위해 낭트전에서 로테이션을 가동했다. 자연스레 PSG는 상대적으로 전력상 열세에 놓인 낭트와 치열한 승부를 벌였다. 전반 35분에는 이강인의 날카로운 왼발 슈팅이 나왔다. 하지만 이 슈팅은 상대 수비수 맞고 굴절되며 골문을 벗어났다. PSG는 전반전에만 무려 9개의 슈팅을 때렸지만, 결실을 맺지 못했다.

이후 PSG는 후반전에 이강인 등 일부 선수들을 교체한 뒤, 효과를 봤다. 후반 22분 비티냐가 시도한 중거리 슈팅이 상대 수비에 굴절되며 낭트의 골문으로 빨려 들어갔다. 이 골은 결승골이 됐고, PSG는 힘겹게 승점 3점을 챙겼다.

▲ ⓒ연합뉴스/EPA


이날 경기는 이강인에게도 의미가 있었다. 2023년 마요르카를 떠나 PSG에 입단한 이강인은 힘든 시기를 보내고 있었다. 첫 시즌에는 준수한 활약을 펼쳤지만, 지난 시즌 주전에서 완벽히 밀리며 고전했다. 시즌 초에는 익숙하지 않은 가짜 9번으로 활용되는 등 멀티 자원으로서의 가능성을 입증했다. 하지만 점차 한계를 드러내기 시작했고, 겨울 이적시장을 기점으로 흐비차 크바라츠헬리아라는 강력한 경쟁자가 합류했다.

이에 따라 이강인은 주전에서 완벽히 밀렸다. 크바라츠헬리아가 빠른 적응력을 보였고 우스만 뎀벨레, 데지레 두에 등이 놀라운 활약을 펼치기 시작했다. 자연스레 이강인의 자리는 사라졌다.

덕분에 이강인은 올여름 내내 꾸준히 이적설에 시달려야 했다. 나폴리와 뉴캐슬 유나이티드, 아스날, 크리스탈 팰리스 등 다양한 팀과 연결됐다. 특히 나폴리 이적설이 거세게 불거지며 세리에A 입성이 임박하기도 했다.

이강인 스스로도 간접적으로 이적을 인정한 바 있다. 그는 지난 시즌 말미에 본인의 사회관계망서비스(SNS) 소개란에 적혀 있던 PSG 문구를 삭제했다. 분명 이적을 암시하는 행동이었다.

그런데 돌연 이강인의 이적설이 사그라들었다. PSG 잔류가 유력하다는 보도가 쏟아졌다. 자연스레 이강인은 새 시즌도 PSG에서 함께할 것이 유력해 보였다.



그러던 중 약간의 반전을 만들었다. 이강인은 지난 14일에 있었던 슈퍼컵 경기에서 PSG가 0-2로 끌려가던 후반 40분 환상적인 왼발 슈팅으로 만회골을 넣었다. 그의 골은 추격의 발판이 됐고, 후반 추가시간에 하무스가 동점골을 만들어 승부를 승부차기로 끌고 갔다. 그리고 이강인은 PSG의 키커로 나서 득점에 성공했고, PSG의 우승에 결정적인 공헌을 했다.

이강인은 이 경기를 기점으로 어느 정도 반전의 계기를 만든 것처럼 보인다. 비록 로테이션 가능성을 배제할 수는 없으나, 낭트전 선발 출전은 그에게 있어 긍정적이다.

그런데 같은 날 영국 매체 '기브미 스포츠'는 18일 아스날이 몇 주 안에 PSG에 접근할 가능성이 있다. 아스날은 PSG의 이강인에게 관심이 있으며, 그의 영입을 추진하기 위해 PSG에 접촉을 시도했다""라고 보도했다.

한편 이날 경기는 코리안 더비로도 많은 화제를 모았다. 이강인뿐만 아니라 낭트 소속의 권혁규와 홍현석도 그라운드를 밟으며 잠시 한국 선수간의 맞대결이 성사됐다."
20250818,"韓 축구 초대박 터진다, 박주영 이후 두 번째이자 14년만…‘골든보이’ 이강인, ‘EPL 우승 도전’ 아스널행 급물살 [속보]","[골닷컴] 강동훈 기자 = ‘골든보이’ 이강인(24·파리 생제르맹·PSG)이 잉글랜드 프리미어리그(EPL) 아스널과 강력하게 연결되고 있다. 아스널이 이적시장 마감이 다가오는 가운데 이강인을 영입하기 위해 접촉을 시도한 정황이 포착되면서다. 이강인이 만약 아스널에 입단한다면, 박주영(40·은퇴)에 이어 두 번째이자 14년 만에 아스널 유니폼을 입는 한국인 선수가 된다.

영국 매체 기브 미 스포츠는 18일(한국시간) “아스널은 앞으로 몇 주 안에 이강인을 영입하기 위해 PSG와 접촉할 가능성이 있다”면서 “이적시장 마감일이 다가오면서 선수단을 보강하려는 아스널은 이강인에게 관심이 있으며, 잠재적인 거래를 모색하기 위해 PSG에 접촉을 시도했다”고 보도했다.

보도에 따르면 아스널은 마르틴 수비멘디와 노니 마두에케, 빅토르 요케레스 등을 영입하면서 총액 2억 2420만 유로(약 3647억 원)를 지출, 상당히 공격적인 이적시장을 보냈지만 여기서 멈추지 않고 더 많은 자금을 투자하면서 스쿼드를 강화하는 데 집중하고 있다. 이런 가운데 아스널의 레이더망에 포착된 게 다양한 역할을 소화할 수 있는 이강인이다.



아스널은 이강인이 PSG를 떠나는 것을 진지하게 고려하고 있어 영입에 적극적이다. 실제 이강인은 PSG에서 로테이션 자원에 머무르고 있어 출전 기회가 제한적인 터라 이적을 고심하고 있다. 그는 지난 시즌 모든 대회에서 49경기(7골·6도움)를 뛰었지만 정작 평균 출전시간은 50.2분밖에 되지 않았다.

이강인은 특히 지난 시즌 PSG가 일찌감치 조기에 우승을 확정 지었음에도 프랑스 리그1 최종전에서 결장했고, 쿠프 드 프랑스(프랑스컵) 결승전과 UCL 결승전에선 단 1분조차 출전시간을 얻지 못했다. 때문에 그는 아시아 선수 최초로 유럽 무대 ‘트레블(3관왕)’이라는 대기록을 달성하고도 마냥 크게 기뻐할 수 없었다.

지난 6월 열린 국제축구연맹(FIFA) 클럽 월드컵에서도 이강인은 기회를 거의 받지 못했다. PSG가 조별리그부터 결승전까지 총 7경기를 치르는 과정에서 이강인은 4경기(1골)를 뛰었는데, 평균 출전시간은 고작 15분에 불과했다. 이강인이 현재 PSG 내에서 입지가 얼마나 좁아졌는지 적나라하게 보여주는 대목이다.




PSG는 이강인을 매각하는 데 적극적이진 않지만 만족할만한 제안이 온다면 기꺼이 이강인이 떠나는 것을 붙잡지 않을 계획이다. 올여름 이강인의 이적설이 나올 때마다 거론됐던 이강인의 이적료는 3500~4500만 유로(약 569~732억 원) 수준으로 예상된 만큼, PSG는 이에 해당하는 이적료를 제안받으면 이강인을 매각할 공산이 크다.

기브 미 스포츠는 “아스날은 이적시장이 2주밖에 남지 않은 상황에서 이강인의 상황을 예의주시하고, 또 PSG와 직접 접촉하고 있다”며 “만약 아스널이 PSG가 만족할만한 제안을 건넨다면, 이강인은 아스널에 합류해 가브리엘 마르티넬리, 마르틴 외데고르, 부카요 사카 등과 뛰게 될 것이다. 다만 마두에케, 에단 은와네리 등과 경쟁해야 할 수도 있다”고 덧붙였다.

만약 이강인이 올여름 아스널에 입단하게 되면, 역대 한국인으로는 21번째로 EPL 구단과 계약하게 된다. 아울러 박주영 이후 두 번째이자, 14년 만에 아스널에서 뛰는 한국인이 된다. 박주영은 2011년 아스널로 이적해 2014년 떠났다. 다만 공식전 7경기(1골) 출전에 그쳤고, 셀타 데 비고(스페인)와 왓포드(잉글랜드) 등에서 임대 생활을 하기도 했다.

사진 = 게티이미지, 소셜네트워크서비스(SNS) 캡처"
