date,title,content
20250623,"""사실상 100%에 가까워져"" 프랑크 감독 '캡틴 SON' 無 언급...손흥민, 토트넘과 결별 임박","[SPORTALKOREA] 황보동혁 기자= 최근 이적설이 끊이지 않는 손흥민(토트넘 홋스퍼)이 결국 팀을 떠날 가능성이 점점 커지고 있다.

최근 토트넘 구단과 팬들 사이에서 가장 큰 관심사는 단연 손흥민의 거취다. 주장인 손흥민은 2026년 여름 계약 만료를 앞두고 있으며, 최근 이적설은 점점 더 구체화되는 분위기다.



영국 매체 '토크스포츠'는 17일(이하 한국시간) ""손흥민이 프리시즌 기간 중 토트넘과 자신의 미래에 대해 논의할 예정이며, 여름 이적 가능성도 열려 있다""고 보도했다.

보도에 따르면 사우디 프로리그 소속 클럽들인 알아흘리, 알나스르, 알카디시야는 손흥민에게 약 4,000만 유로(한화 약 635억 원)의 이적료와 연 3,000만 유로(약 476억 원)에 달하는 초고액 연봉을 제시할 준비를 마쳤다.

유럽 이적시장 전문가 파브리시오 로마노 기자 역시 '기브미 스포츠' 방송에서 ""사우디 클럽들의 관심은 매우 진지하다. 손흥민 측과의 커넥션도 이미 강하게 구축돼 있다""며 ""이러한 조건은 손흥민처럼 글로벌 영향력을 지닌 선수에게 엄청난 기회가 될 수 있다""고 전했다.



아직 손흥민 본인의 공식 입장은 없는 상황이지만, 연봉과 조건 모두 천문학적인 제안이 쏟아지고 있는 만큼 이적설은 계속해서 설득력을 더해가고 있다.

여기에 토트넘이 최근 공개한 토마스 프랑크 감독의 첫 공식 인터뷰에서도 손흥민이 언급되지 않았다는 점이 이적설에 무게를 더하고 있다.

일반적으로 새 감독이 팀의 주장이나 핵심 선수에 대해 신뢰를 표하는 것이 관례지만, 손흥민은 단 한 차례도 거론되지 않았다.



이와 관련해 토트넘 소식에 정통한 매체 '토트넘 홋스퍼 뉴스'는 22일 ""앞서 손흥민의 이적 가능성을 50%로 보도했지만, 최근 상황 전개를 고려하면 사실상 100%에 가까워졌다는 분석이 나오고 있다""고 전했다.

이어 ""프랑크 감독은 부임 첫 인터뷰에서 향후 계획과 기대되는 선수들을 언급했는데, 도미닉 솔랑케 등은 거론됐지만 손흥민의 이름은 없었다""고 강조했다.



그러면서 매체는 구단 소식에 정통한  팟캐스트 '릴리화이트 로즈' 진행자 존 웬햄의 인터뷰도 같이 개제했다.

그는 ""훈련 장면 영상에서도 손흥민은 전혀 등장하지 않았다. 이는 매우 의미심장하다""며 ""토트넘 내부적으로 세대교체가 진행 중이며, 손흥민은 올여름 팀을 떠날 가능성이 크다. 주장 완장도 다른 선수에게 넘어갈 수 있다""고 말했다. 

실제로 토트넘은 프랑크 감독 체제 아래 장기적인 리그 우승 도전을 목표로 팀을 재정비하고 있는 것으로 알려졌다. 곧 33세가 되는 손흥민을 떠나보내는 결정은 현실적인 선택일 수 있다.



손흥민은 2015년 토트넘에 입단한 이후 공식전 454경기에 출전해 173골 101도움을 기록하며, 구단 역사상 최고의 에이스 중 한 명으로 자리매김했다. 특히 해리 케인이 팀을 떠난 뒤에는 주장으로서 중심을 잡았고, 올 시즌 유로파리그 결승전에서 우승 트로피를 들어올리며 입단 이후 첫 우승의 기쁨도 누렸다.

하지만 개인 성적은 다소 아쉬웠다. 프리미어리그 30경기에서 7골 9도움에 그치며, 2016/17시즌 이후 처음으로 '10골-10도움' 달성에 실패했다. 부상 여파도 있었지만, 전성기에 비해 영향력이 줄어든 점은 부인할 수 없다.



이러한 상황에서 사우디 구단들의 거액 제안은 구단 입장에서도 충분히 고려할 만한 카드다. 팀의 레전드이지만, 재정적 수익과 세대교체를 동시에 이룰 수 있기 때문이다.

다만 손흥민의 이적이 본격화되는 시점은 8월이 될 가능성이 높다.

영국 공영방송 BBC는 ""사우디 클럽들의 지속적인 관심에도 손흥민의 미래는 아직 확정되지 않았다""며 ""토트넘의 아시아 투어가 끝난 뒤에야 본격적인 논의가 이뤄질 것""이라고 전했다.



토트넘은 오는 8월 3일 뉴캐슬 유나이티드와의 '쿠팡플레이 시리즈'를 통해 한국을 방문할 예정이며, 구단은 최소한 해당 일정까지는 손흥민을 팀에 잔류시킬 방침인 것으로 보인다.

사진= 더 타임즈 캡처, 게티이미지코리아, 토트넘 홋스퍼 공식 유튜브 캡처

취재문의 sportal@sportalkorea.co.kr"
20250623,"'음뵈모•요케레스는 어쩌고?' 맨유, PSG에서 쫓겨난 ST 영입한다...""최대 1,295억 예상""","사진=spinzographics


맨체스터 유나이티드가 랑달 콜로 무아니 영입을 노리고 있다.

영국 매체 '기브미 스포츠'는 22일(한국시간) ""맨유는 파리 생제르맹(PSG)의 공격수 무아니 영입에 관심을 보이고 있는 구단 중 하나다. 이 선수는 여름 이적시장에서 이적이 유력하다""라고 보도했다.

올여름 이적시장에서 바쁜 나날을 보내고 있는 맨유. 앞서 1호 영입으로 마테우스 쿠냐를 품었다. 그러나 여기서 멈출 생각이 없다. 쿠냐는 2선 자원이기에 스트라이커 보강에 나설 계획이다. 심지어 라스무스 호일룬, 조슈아 지르크지의 미래가 불투명하면서 스트라이커 영입은 선택이 아닌 필수가 됐다.
여러 매물들 가운데 브라이언 음뵈모와 빅토르 요케레스가 영입 대상에 포함됐다. 문제는 요케레스는 맨유행을 희망하고 있지 않다는 것. 따라서 발 빠르게 새 자원 물색에 나섰고, 무아니가 레이더망에 포착됐다.

1998년생인 무아니는 프랑스 국적의 스트라이커다. 과거 FC낭트 유스 출신인 그는 2017년 프로에 데뷔했다. 본격적으로 이름을 알린 건 독일 분데스리가의 아인라흐트 프랑크푸르트 시절이었다. 지난 2022-23시즌을 앞두고 낭트를 떠나 프랑크푸르트로 이적한 무아니. 첫 시즌부터 주전을 확보하더니 공식전 46경기 23골 14도움을 몰아쳤다.



이러한 활약에 여러 빅클럽들이 러브콜을 보냈고, 결국 이듬해 여름 PSG가 7,700만 파운드(약 1,424억 원)의 이적료로 무아니를 품었다. 당시 막대한 이적료와 더불어 이전 프랑크푸르트에서 23골을 기록했기에 팬들의 기대는 매우 높았다.

하지만 첫 시즌 무아니는 공식전 40경기에 출전해 9골과 6도움에 그치며 기대에 부응하지 못했다. 기록만 놓고 보면 무난했지만, 실상은 달랐다. 특히 골 결정력이 심각했다. 이에 방출될거라는 소문이 있었으나 구단은 그를 잔류시켰다.

결과는 달라지지 않았다. 이번 시즌 전반기 동안 루이스 엔리케 감독에게 철저히 외면당하며 공식전 14경기 2골 1도움에 그쳤다. 엔리케 감독은 무아니를 사용하는 대신 '가짜 9번'으로 이강인, 우스만 뎀벨레를 사용했을 정도였다.



결국 지난 겨울 이적시장을 통해 쫓기듯이 PSG를 떠나 유벤투스에 임대로 합류했다. 예상과는 달리 활약이 나쁘지 않았다. 데뷔전에서 데뷔골을 터뜨리며 강렬한 인상을 남겼다. 이후 2경기 연속 멀티골을 기록하는 등 순조로운 출발을 알렸다. 그러나 거기까지였다. 2월 중순부터 4월 중순까지 약 2개월 가까이 득점을 하지 못하는 등 부진을 거듭했다. 막바지에 골을 넣기는 했지만 아쉬움이 짙게 남았다. 기록은 공식전 20경기 10골 2도움.

다가오는 시즌을 앞두고 PSG로 합류해야 하는 무아니. 이미 팀 내 매각 대상에 포함되며 새 팀을 찾아야 하는 입장이다. 다행히도 원하는 팀이 나타났다. 바로 맨유와 첼시다. 두 팀 모두 여름 이적시장에서 활발한 행보를 보이고 있다. 간절함에 있어서는 맨유가 앞서있지만, 현지 보도를 종합하면 영입전에서는 첼시가 우위를 점했다는 평가가 지배적이다.

PSG는 무아니를 헐값에 내줄 의향이 없다. '팀토크'는 ""PSG는 이번 여름 무아니의 이적료로 5,000만 파운드에서 7,000만 파운드(약 925억~1,295억 원) 선으로 책정했다. 만약 무아니가 첼시로 향한다면 맨유는 또 하나의 공격 옵션을 놓치게 된다. 현재로선 가장 유력한 행선지는 첼시로 떠오르고 있다""라고 주장했다."
20250623,"""말해봐요, 흐비차 왜 영입했는지"" 위기감 느낀 바르콜라 PSG에 해명 요구…구단 답변은 ""이강인·아센시오 좋은 인상 못 심어→공격수 영입 필요""","EPA연합뉴스
로이터연합뉴스
[스포츠조선 윤진만 기자]프랑스 매체가 지난 1월 '조지아 마라도나' 흐비차 크라바츠켈리아 영입 비하인드 스토리를 보도했다.

파리생제르맹(PSG)은 2024~2025시즌 도중 공격진 강화 차원에서 나폴리에서 활약 중인 윙어 크라바츠켈리아를 이적료 7000만유로(약 1100억원)에 영입했다. 흐비차는 적응기간 없이 곧바로 PSG의 한쪽 날개를 맡아 PSG 구단 최초 트레블 달성에 힘을 보탰다. 현재 진행중인 2025년 국제축구연맹(FIFA) 클럽 월드컵을 포함해 PSG 유니폼을 입고 27경기에 출전해 7골8도움을 기록했다.
하지만 모두가 흐비차를 두 팔 벌려 환영한 건 아니었다. 22일(현지시각) 프랑스 일간 '레퀴프'의 보도에 따르면, 프랑스 출신 윙어 브래들리 바르콜라는 흐비차 영입 소식에 당황하며 구단측에 해명을 요구했다. 자신의 입지가 흔들릴 것을 우려한 것으로 보인다.

이 매체에 의하면 PSG는 바르콜라 달래기에 나섰다. '너에게 반하는 결정을 내린 것은 아니다. 마르코 아센시오, 이강인, 랑달 콜로 무아니가 모두 좋지 못한 인상을 남기면서 루이스 엔리케 감독이 더 많은 공격 옵션을 원했다'라고 설명했다.

AFP연합뉴스
레퀴프는 'PSG는 감독이 여전히 바르콜라를 중요한 선수로 여기고 있으며, 출전 시간을 확보할 수 있을 것이라고 말했다. 이에 바르콜라는 안심하고 남은 대회에 출전하기로 결심했다'라고 당시 분위기를 전했다.

바르콜라는 후반기에 선발과 교체를 오가며 팀 공격에 윤활유 역할을 했다. 59경기에 출전해 21골19도움을 남겼다. 흐비차, 바르콜라 등에 밀린 윙어 겸 공격형 미드필더 이강인은 후반기에 주로 교체로 활약했다.

'레퀴프'는 '바이에른 뮌헨이 바르콜라 영입에 진지하게 관심을 보이지만, 이제 그는 떠나고 싶어하지 않는다. 그는 다른 공격수들과 좋은 관계를 맺고 있으며, 엔리케 감독의 로테이션을 통해 모든 선수가 각자 역할을 맡고 있음을 확인했다. 이적의 문은 구단과 선수 모두에게 닫혀있다'라고 이번 여름 이적시장을 통한 이적이 성사될 가능성이 희박하다고 내다봤다.

뮌헨은 팀을 곧 떠날 예정인 르로이 사네의 빈자리를 메우기 위해 다양한 윙어와 접촉하고 있다. 니코 곤살레스(아틀레틱), 미토마 가오루(브라이튼), 하파엘 레앙(AC밀란), 루이스 디아스(리버풀) 등이 타깃으로 거론된다."
20250623,"""손흥민 몸값? 924억 요구할 수도""…'SON 덕에 돈폭탄' 토트넘 회장, 마지막까지 뽕 뽑고 결별?","(엑스포츠뉴스 권동환 기자) 토트넘 홋스퍼의 다니엘 레비 회장이 손흥민을 매각할 경우 거액을 요구할 것이라는 주장이 등장했다.

토트넘 소식통 '토트넘 홋스퍼 뉴스'는 21일(한국시간) ""다니엘 레비는 토트넘을 떠날 수도 있는 손흥민의 이적료로 거액을 요구할 것으로 보인다""라고 보도했다.

2015년부터 토트넘에서 활약한 손흥민은 이번 여름 토트넘에서의 미래가 불투명한 상황이다.

토트넘은 지난 1월 손흥민의 계약서에 있던 1년 연장 옵션을 발동해 계약 기간을 2026년 6월까지 늘렸다. 재계약이 없다면 토트넘과 손흥민은 내년 여름 작별하게 된다. 



손흥민의 계약 만료가 임박하자 토트넘이 이번 여름 이적료를 받고 손흥민을 매각할 수도 있다는 주장이 등장했다. 마침 사우디아라비아가 손흥민 영입에 큰 관심을 보이면서 손흥민 이적설에 불을 붙였다.

매체도 ""토트넘은 이미 극적인 여름을 보냈고, 그것은 앞으로 몇 주 동안 눈덩이처럼 불어날 뿐이다""라며 ""토마스 프랭크 감독은 손흥민과 그의 미래에 대해 회담을 가질 예정이다""라고 설명했다.

이어 ""손흥민의 계약 기간이 1년밖에 남지 않았다는 점을 고려하면, 지금이 손흥민 이적에 가장 적합한 시점일 것""이라며 ""그 결과, 사우디아라비아의 관심을 등에 업고 토트넘이 이번 여름에 손흥민을 매각할 가능성이 있다는 보도가 널리 퍼졌다""라고 덧붙였다.
토트넘 소식에 정통한 알레스데어 골드 기자도 21일 영국 '풋볼 런던'을 통해 ""난 손흥민이 이번 여름에 토트넘을 떠날 가능성이 그 어느 때보다 높다고 생각한다""라며 손흥민의 이적 가능성을 거론했다.

영국 '토크스포츠'에 따르면 사우디 프로리그의 3팀이 손흥민 영입을 위해 막대한 이적료와 급여를 준비 중이다.



매체는 ""2023년과 2024년에 손흥민에게 접근했던 사우디 구단들은 이번 여름에도 다시 러브콜을 보냈다""라며 ""알아흘리, 알나스르, 알카디시야는 손흥민 이적료로 4000만 유로(약 632억원)를 지불할 의향이 있다""라고 전했다.

또 ""해당 구단들은 손흥민에게 연봉 3000만 유로(약 474억원) 수준의 조건을 제시할 준비가 되어 있다""라며 ""그들은 손흥민가 합류할 경우 한국 방송사와의 중계권 계약 등을 통해 즉각적인 수익 회수가 가능하다는 판단을 하고 있다""라고 밝혔다.

사우디 외에도 손흥민은 미국 메이저리그사커(MLS), 튀르키예 진출 그리고 친정팀인 독일 분데스리가 강호 바이엘 레버쿠젠 복귀 가능성도 거론되고 있다.

그러나 이적료 협상에서 매우 단호하기로 유명한 레비 회장은 만족할 만한 액수가 아니면 손흥민 이적을 허락하지 않을 것으로 예상된다.



'토트넘 홋스퍼 뉴스'는 ""손흥민이 싸게 나올 가능성은 낮다""라며 ""손흥민이 토트넘을 떠난다면 레비 회장은 강경한 협상을 이끌어낼 듯하다""라고 주장했다.

레비 회장이 손흥민 몸값을 높게 책정할 것으로 예상되는 이유에 대해선 ""손흥민은 단순한 선수가 아니라 하나의 브랜드이며, 손흥민의 명성은 그의 고국에서 상당한 돈을 벌어들인다""라고 설명했다.

매체에 따르면 축구 재정 전문가 댄 플럼리는 손흥민 몸값이 최소 5000만 파운드(약 924억원)가 될 수도 있다고 내다봤다.

플럼리는 ""우리는 대략적인 수치에 대해 이야기하고 있지만, 최근 몇 년 동안 시장은 부풀려졌다""라며 ""사우디아라비아는 특히 이에 기여하는 요소이다""라고 말했다.



이어 ""스타 플레이어 중 한 명인 손흥민이 토트넘에 제공한 것과 최근 몇 시즌 동안 경기장에서 보여준 좋은 활약을 고려하면 토트넘은 최소한 4000만 파운드(약 739억원)를 볼 거다. 그들은 아마 이보다 좀 더 높은 가격을 정했을 거다""라고 덧붙였다..

더불어 ""손흥민은 정점이 아니라 선수 생활의 마지막을 향해 가고 있지만, 토트넘은 손흥민에게서 큰 이적료를 요구하고 싶어할 거다""라고 강조했다.

그는 ""또 다른 측면은 손흥민이 다른 시장에 부가가치 관점에서 무엇을 가져다주는가이다""라며 ""우리는 손흥민이 토트넘에 있는 동안 한국과 아시아에 미친 영향에 대해 이야기했다""라며 손흥민이 아시아 시장에서 끼치는 영향력을 주목했다.

또 ""선수를 잃는 것뿐만 아니라 그 자체까지 잃게 된다면, 최대한 높은 이적료를 요구해야 할 거다""라며 ""심지어 5000만 파운드(약 924억원)를 요구할 수도 있다""라고 주장했다.



그러면서 ""아마 레비 회장의 운영 방식에 따른 거지만 알겠는가? 바이아웃 조항이 있는지는 모르겠지만, 만약 있다면 5000만 파운드(약 924억원)를 시작점으로 삼을 수 있을 것 같다""라고 전했다.

플럼리의 주장에 대해 매체는 ""손흥민이 토트넘의 레전드인 것은 분명하지만, 5000만 파운드는 그의 나이에 비해 엄청난 액수이다""라며 ""프랭크 감독은 레비 회장으로부터 가능한 모든 도움이 필요할 것이고, 5000만 파운드의 추가 자금이 큰 도움이 될 것""이라며 원하는 액수의 제안이 올 경우 이를 받아들일 것을 추천했다.

과거 토트넘에서 뛰었던 제이미 오하라도 ""큰 제안이 오면 손흥민을 내보내야 한다""라며 친정팀에 손흥민 매각을 촉구했다.

만약 레비 회장은 손흥민의 이적료로 900억이 넘은 금액을 받아 낸다면 토트넘은 2015년 여름 레버쿠젠으로부터 2200만 파운드(약 406억원)에 영입한 손흥민을 통해 엄청난 이득을 보게 된다.



당장 토트넘은 이번 여름 손흥민과 함께 아시아 투어를 떠나 상당한 수익을 올릴 계획이다.

토트넘은 오는 7월 31일 홍콩을 찾아 카이탁 스포츠 파크 스타디움에서 북런던 라이벌 아스널과 친선전을 가진다. 이후 대한민국으로 이동해 8월 3일 서울월드컵경기장에서 같은 프리미어리그 클럽인 뉴캐슬 유나이티드와 쿠팡플레이시리즈 경기를 치른다.

손흥민은 대한민국 최고의 축구스타이기에 이번 토트넘과 뉴캐슬 간의 친선전 때 많은 팬들이 경기장을 찾을 것으로 예상된다.

전 토트넘 스카우터 브라이언 킹도 ""토트넘은 손흥민 덕분에 이 친선 경기에서 큰돈을 벌게 될 거다. 이 경기로 100만 파운드(약 18억원) 이상을 벌어들일 거다""라며 기대감을 드러냈다.

사진=연합뉴스, 엑스포츠뉴스DB"
20250623,"'BBC급 기자' 확신! ""PSG, 이강인 팔지 않을 것""…나폴리 이적, 결국 소속팀이 가로막나","(엑스포츠뉴스 윤준석 기자) 이강인의 이탈리아 세리에A 디팬딩 챔피언 나폴리 이적 가능성이 급격히 사그라들고 있다.

프랑스 리그1의 파리 생제르맹(PSG)에서 입지를 잃은 이강인은 지난 몇 주간 나폴리와 강하게 연결되며 이적 가능성이 높게 점쳐졌지만, 현지 복수 언론의 보도에 따르면 관련 논의는 사실상 중단된 상태다.

이강인은 다시 PSG 잔류 혹은 제3의 선택지를 고민해야 하는 입장에 놓였다.

스페인 이적시장 전문가 마테오 모레토는 22일(한국시간) 파브리치오 로마노의 유튜브 채널에 출현해 이강인의 미래에 대한 새로운 주장을 내놓았다.

그는 ""이강인은 나폴리가 높이 평가하던 선수""라면서도 ""하지만 PSG와의 계약이 아직 한참 남아 있는 상황에서 구단이 그를 매각할 필요는 없다. 이강인은 PSG 내에서 여전히 중요한 자원으로 간주되고 있다""고 밝혔다.

모레토는 이어 ""따라서 이강인의 나폴리 이적 가능성은 현 시점에서 매우 낮아졌다""며 ""이강인이 프랑스나 이탈리아가 아닌 제3국으로 향할 가능성도 있다""고 전했다.



스페인 매체 '렐레보' 소속의 모레토는 최근 이강인과 직접 만나 그의 상황을 확인한 적이 있다. 또 다른 이적시장 전문가 파브리치오 로마노와 함께 이강인을 만났고 3명은 사진까지 찍었다. 모레토의 이강인 관련 소식 공신력이 영국 공영방송 BBC 이상으로 높을 수밖에 없는 이유다.

이강인과 PSG의 재계약 협상이 교착 상태에 빠졌다는 소식 역시 모레토의 입에서 가장 먼저 나온 바 있다.

당시 모레토는 ""이강인은 이번 여름 이적시장에서 가장 주목받는 스타 중 하나가 될 것""이라고 전하며, 이강인은 나폴리는 물론 잉글리시 프리미어리그, 스페인 라리가, 사우디아라비아 클럽들의 관심을 한몸에 받고 있으며, PSG와의 최종 합의를 본 팀은 아직 없는 상태라고 덧붙였다.



하지만, 이번 보도와 함께 또 다른 예상치 못한 변수로 인해 이강인의 나폴리 이적은 제동이 걸린 듯 하다.

이탈리아 유력지 '코리에레 델로 스포르트'는 21일 ""기존 미드필더인 안드레-프랑크 잠보 앙귀사가 팀 잔류를 택하면서, 나폴리는 이강인에 대한 관심을 접었다""고 보도했다.

이어 매체는 ""앙귀사의 잔류로 인해 나폴리는 더 이상 미드필더 영입에 예산을 투입하지 않을 것""이라고 강조했다.

당초 나폴리는 앙귀사의 이적을 전제로 이강인 영입을 위한 예산에 해당하는 2500만 유로(약 397억원)을 마련하고자 했지만, 앙귀사의 갑작스러운 잔류 결정으로 해당 자금이 동결되면서 스쿼드 운용 계획도 급변한 것이다.

이후 이탈리아의 이적시장 전문가 잔루카 디 마르지오 기자 역시 ""나폴리는 앙귀사와 재계약 협상을 진행 중이며, 이로 인해 미드필더 자원 보강 필요성이 사라졌다""고 보도했다.



이처럼 이강인 영입이 중단된 나폴리는 미드필더 영입 대신 공격진 재구성에 눈을 돌린 것으로 보인다.

나폴리가 맨체스터 유나이티드 소속 제이든 산초에게 관심을 보이고 있다는 소식이다.
영국 대중지 '더 선'에 따르면 안토니오 콘테 나폴리 감독은 팀 내 응집력과 태도를 중시하며, 철학에 반하는 선수는 과감히 제외할 계획이다.

매체에 따르면, 산초는 맨유에서 전력 외로 밀려나 있는 상황이며, 향후 계획에서 나폴리행을 선호한다. 나폴리 역시 선수와의 개인 합의를 마친 상태다.

이강인에게는 뼈아픈 소식이다.

그는 2023년 PSG로 이적해 첫 시즌 트레블을 경험했으나, 점차 입지가 줄어들면서 벤치에서 머무는 시간이 길어졌다.

특히 지난 2024-2025시즌 UEFA 챔피언스리그 결승전과 쿠프 드 프랑스 결승 등 주요 경기에서는 출전 기회를 얻지 못했고, 사실상 주전 경쟁에서 밀린 모습이다.



현재 이강인은 PSG 소속으로 미국에서 열리는 2025 국제축구연맹(FIFA) 클럽월드컵에 참가 중이다. 아틀레티코 마드리드와의 1차전에서는 페널티킥으로 득점을 기록했지만, 2차전에서는 다시 교체 명단에 그치며 입지 반등에는 실패했다는 평가가 나온다.

이강인의 여름 이적을 놓고 또 다른 걸림돌은 PSG가 책정한 이적료다.

튀르키예 출신 이적시장 전문가 에크렘 코누르에 따르면 PSG는 이강인의 이적료로 최소 4000만 유로(약 635억원)를 원하고 있다.

축구 통계 사이트 '트랜스퍼마르크트'가 평가한 이강인의 현재 시장 3000만 유로(약 476억원) 수준이다. 시장 가치에 비해 높게 책정된 이적료는 협상 과정에서 많은 구단이 주저할 수 있는 지점으로 작용한다.

그럼에도 불구하고 이강인을 향한 외부의 관심은 여전히 뜨겁다.

지난해 여름에는 익명의 잉글랜드 프리미어리그 클럽이 7000만 유로(약 1112억원)의 이적료를 제시했다는 보도도 있었고, 아스널, 뉴캐슬, 유벤투스, AC밀란 등 유럽 주요 리그 클럽들도 지속적인 관심을 보이고 있다.



지금 상황에서 이강인의 행선지를 예단하기는 어렵다.

나폴리는 사실상 경쟁에서 이탈했지만, 새로운 팀이 등장할 가능성은 여전히 열려 있다.

다양한 선택지를 가진 이강인이 다음 시즌을 어디에서 맞이하게 될지는 곧 윤곽이 드러날 것으로 보인다.

PSG는 이강인을 제대로 활용하지 못하고 있음에도 불구하고 여전히 그를 매각할 필요는 없는 선수로 간주하고 있어 향후 미래에 불확실성을 키우고 있는 상황이다.

하지만 이강인에게 지금 필요한 것은 구체적인 오퍼와 꾸준한 출전 기회를 보장해 줄 수 있는 팀이다.

여름 이적시장의 시간은 점점 흐르고 있고, 이강인의 선택도 머지않아 가시화될 전망이다.

사진=연합뉴스 / 마테오 모레토 인스타그램"
