date,title,content
20250623,"독일 매체, ‘KIM vs 타’ 집중 비교…“김민재가 콤파니볼에 적합”","클럽 월드컵에 참가하는 김민재. 사진=로이터 연합뉴스


독일 한 현지 매체가 바이에른 뮌헨 수비수 김민재(29)와 조나단 타(29)를 비교 분석해 눈길을 끌었다. 

독일 매체 ‘RAN’은 22일(한국시간) ‘타 vs 김민재’라는 제하의 기사를 다루며 뮌헨 소속 두 수비수의 장단점을 비교했다. 매체는 먼저 “뮌헨은 다요 우파메카노와 타를 중심으로 새 시즌을 시작하려는 계획을 추진 중인 거로 보인다”며 “반면 김민재는 이적 후보로 거론되고 있다. 하지만 이 수비 변화가 진정한 전력 강화로 이어질 수 있을까”라며 의문을 드러냈다.
김민재는 지난 2시즌 동안 뮌헨의 주전 수비수로 활약했다. 이 기간 팀 동료들이 하나둘 부상으로 쓰러졌지만, 김민재는 통증을 안고도 꾸준히 그라운드를 지켰다. 결국 지난 4월 전열에서 이탈했다가, 최근 팀 훈련에 복귀한 상태다.

그 사이 뮌헨은 자유계약선수(FA) 타를 영입하며 수비진을 보강했다. 같은 나이의 타를 영입하면서, 이적료를 받아낼 수 있는 김민재가 이적 대상으로 꼽힌다. 

매체는 현 상황을 두고 “뮌헨은 타가 가진 리더십 능력을 통해 수비에 안정감을 더할 수 있을 것으로 기대하며 독일 대표 수비수를 영입했다. 반면, 김민재는 브리안 사라고사, 주앙 팔리냐와 함께 현재 가장 유력한 이적 대상 중 한 명으로 분류된다”며 “타는 레버쿠젠이 우승했던 지난 시즌에서 중심적인 역할을 맡았고, 김민재는 실수로 종종 주목받았다. 그러나 과연 타가 진정한 업그레이드인지에 대한 의문은 여전히 남아 있다. 이를 판단하려면 다양한 요소를 종합적으로 검토해야 한다”라고 진단했다.
22일 뮌헨 홈페이지에 공개된 벤피카와의 2025 FIFA 클럽 월드컵 조별리그 3차전 대비 팀 훈련에 복귀한 김민재의 모습. 사진=뮌헨

매체는 두 수비수가 지닌 강점을 주로 강조했다. 먼저 타에 대해선 “그는 명확한 지시를 내릴 수 있는 능력을 갖추고 있으며, 주변 수비수들과 미드필더들을 효과적으로 조율한다. 타는 스스로를 리더로 인식하며, 뮌헨에서도 빠르게 상위 서열로 올라가기를 노리고 있다. 반면 김민재는 그동안 자신의 경기력에 집중하느라 지휘자로서의 역할은 거의 드러나지 않았다. 이는 언어 장벽의 영향도 일부 있는 것으로 보인다. 우파메카노 또한 말이 적은 선수이기 때문에, 타의 합류는 긍정적인 시너지를 낼 수 있다”라며 그의 리더십을 호평했다.

또 “타도 가끔 실수를 저지르긴 하지만, 전반적으로 안정적인 플레이와 집중력이 그의 강점이다. 그는 큰 경기에서도 냉정함을 유지하며, 좋은 위치 선정으로 실수를 줄인다”며 “김민재는 큰 경기에서의 실수가 문제다. 그는 챔피언스리그 레알 마드리드전과 인터 밀란전에서 불안한 모습을 보였고, 결정적인 순간에 실수를 범했다”라고 돌아봤다.

매체가 김민재의 장점으로 거론한 건 스피드와 지상 볼 경합 능력이다. 매체는 “김민재는 확실히 타보다 더 빠르다”며 “분데스리가 공식 기록에 따르면 김민재는 지난 시즌 최고 속도 33.75km/h를 기록했고, 타는 33.09km/h였다. 속도의 차이는 근소해 보이지만, 가속력에서 큰 차이가 드러난다. 김민재는 폭발적인 가속으로 짧은 거리의 스프린트에서 우위를 보인다. 방향 전환 능력에서도 타보다 민첩하다”라고 호평했다.

조나단 타. 사진=바이에른 뮌헨

또 “김민재는 ‘괴물’이라는 별명에 완전히 부합하진 못했지만, 51%의 지상 수비 승률을 기록하며 타보다 더 나은 성과를 보였다. 또한, 경기당 평균 두 배 가까운 수비 성공 횟수를 기록했다”라고 주목했다.

결국 매체는 타의 영입이 무조건 ‘업그레이드라고 할 수 없다’라고 결론 내렸다. 매체는 “사실 김민재는 뱅상 콤파니 감독의 시스템에 가장 잘 맞는 수비수다. 하이라인에서 1대1 대처 능력과 피지컬, 민첩함을 활용할 수 있기 때문”이라고 조명했다.

끝으로 “김민재가 지난 반년간 부상 투혼을 펼쳐온 점도 감안해야 한다. 그가 건강한 몸 상태로 실수를 줄인다면, 타보다 뮌헨 시스템에 더 어울릴 가능성이 있다”면서 “김민재의 이적은 합당한 제안이 있을 때만 고려되어야 하며, 대체 자원이 확보된 경우에 한해서만 현실적인 선택이 될 거”라고 내다봤다.

김우중 기자"
20250623,"大충격! 김민재, 사우디 알 나스르 이적 가까워졌다...""협상 진전, 선수도 이적 열려 있어""","사진=Al_nassr_live_kerala_


김민재가 사우디아라비아의 알 나스르와 연결됐다.

프랑스 매체 '스포르트'는 22일(한국시간) ""바이에른 뮌헨을 떠날 가능성이 제기된 김민재가 사우디의 알 나스르와 가까워지고 있다""라고 보도했다.

이번 시즌 김민재는 부상이라는 악조건 속에서도 묵묵히 팀을 위해 헌신했다. 지난해 10월부터 아킬레스 부상을 당했지만, 충분한 휴식은 주어지지 않았다. 다요트 우파메카노, 이토 히로키, 알폰소 데이비스 등 수비진이 부상으로 전멸하면서 억지로라도 뛰어야 했다. 부상과 더불어 막중한 책임감까지 더해진 김민재였다.

하지만 부상은 곧 부진으로 이어졌다. 실제로 경기 도중 김민재가 치명적인 실책을 범하는 등 아쉬운 모습을 보였다. 이를 두고 독일 현지에서는 '최악의 수비수'라며 강하게 비판했다. 독일과 뮌헨의 레전드인 로타어 마테우스 역시 김민재의 기량 부족을 걸고 넘어졌다.



그렇다고 해서 김민재의 헌신은 충분히 박수를 받아야 하는 것이 마땅하다. 올 시즌 김민재는 모든 대회를 통틀어 3,593분을 소화했다. 이는 팀 내 수비진 중 최다 출전 시간이다. 이를 두고 국제축구선수협회(FIFPro)가 걱정하기도 했다. 'FIFPro'는 ""김민재의 사례는 분명한 경고다. 지금처럼 적절한 보호 장치 없이 과도한 일정이 지속된다면 더 많은 선수가 장기적인 부상 위험에 노출 될 것이다""라며 목소리를 높였다.

이번 2025 국제축구연맹(FIFA) 클럽 월드컵 출전도 불투명했지만, 최근 팀 훈련에 복귀한 모습이 포착됐다. 그런데 지금 당장 클럽 월드컵이 중요한 것이 아니다. 이번 여름 팀을 떠날 가능성이 매우 높기 때문. 이미 매각 대상에 올랐다. 독일 '스카이 스포츠' 소속 플로리안 플레텐베르크 기자는 ""김민재는 뮌헨에서 판매될 가능성이 매우 높은 선수다. 뮌헨은 다른 팀들의 관심을 알고 있다. 적절한 제안이 온다면 떠나보낼 의향이 있다""라고 이야기했다.



영국 '원풋볼'은 ""뮌헨은 김민재의 이적료를 당초 약 5,000만 유로(약 790억 원)에서 3,500만 유로(약 550억 원)로 낮춘 상태다. 김민재는 이적에 열린 입장인 것으로 알려졌다""라고 설명했다.

올여름 떠날 가능성이 매우 높은 상황. 맨체스터 유나이티드를 시작으로 리버풀, 첼시, AC 밀란, 파리 생제르맹(PSG), 뉴캐슬 유나이티드, 나폴리 등 여러 빅클럽들과 연결됐다. 그런데 충격적이게도 사우디의 알 나스르까지 가세했다.

이번 관심이 처음이 아니다. 앞서 '풋 메르카토' 소속 산티 아우나 기자는 ""알 나스르는 최근 며칠 동안 협상을 추진해왔다. 선수 대리인들과 이적 합의를 이루기 위해 적극적으로 움직이고 있다""라고 밝혔다.

그리고 오늘날 협상이 진전되고 있다. '스포르트'는 ""한때 PSG가 김민재를 노린다는 보도가 있었지만, 지금은 알 나스르가 협상을 더욱 적극적으로 추진 중이다. 사우디 클럽 측과 김민재 측은 협상이 진전되고 있다. 선수 본인 역시 새 출발을 위해 사우디행에 열려 있는 것으로 알려졌다""라고 주장했다."
20250623,"[오피셜] 韓 축구 초대박 희소식! ‘철기둥’ 마침내 돌아왔다…‘아킬레스건 부상 이탈’ 김민재, 밝은 표정 속 팀 훈련 복귀","[골닷컴] 강동훈 기자 = ‘철기둥’ 김민재(28·바이에른 뮌헨)가 마침내 아킬레스건 부상을 털고 돌아오면서 팀 훈련에 복귀했다. 바이에른 뮌헨은 23일(한국시간) 공식 홈페이지를 통해 “뱅상 콩파니 감독은 일요일 아침 선수들을 다시 훈련장으로 불러들였다”면서 “김민재가 팀 훈련의 일부를 마쳤다”고 발표하면서 복귀 소식을 전했다.

바이에른 뮌헨은 팀 훈련을 담은 영상도 공개했는데, 영상 속 김민재는 밝은 표정으로 동료들과 함께 팀 훈련을 소화했다. 그는 이날 코디네이션 훈련을 하는 도중 몸 상태가 상당히 가벼웠다. 특히 스텝을 밟는 과정에서 아킬레스건 부상도 어느 정도 다 회복된 것처럼 보였다. 물론 당장 경기 출전은 어렵겠지만, 팀 훈련에 복귀했다는 것만으로도 희소식이다.



지난 시즌 김민재는 새롭게 부임한 콩파니 감독으로부터 두터운 신임을 받으면서 ‘단짝’ 다요 우파메카노와 함께 초반부터 붙박이 주전으로 활약했다. 안정적인 수비로 호평을 받아오던 김민재는 하지만 지난해 10월 아킬레스건 부상을 당했다. 그러나 김민재는 강행군을 이어갔다. 콩파니 감독이 김민재를 신뢰하면서 매 경기 기용한 데다, 대체할 센터백이 없었던 탓이다.

결국 김민재는 시간이 지날수록 아킬레스건 부상이 더 심해지면서 고통을 안고 뛰다가 지난 3월 A매치 기간에 축구대표팀 소집 명단에 발탁됐지만 뛸 수 없다는 통보와 함께 휴식을 취했다. 하지만 김민재는 A매치 기간이 끝나자마자 곧바로 다시 복귀했다. 당초 예정된 휴식일이 2~3주였지만, 기용할 센터백이 없던 탓이었다.
무리한 복귀 속 김민재는 잦은 실책을 범하면서 흔들리기 시작했다. 보루시아 도르트문트와 독일 분데스리가 29라운드에 이어 인터 밀란과 유럽축구연맹(UEFA) 챔피언스리그(UCL) 8강 2차전에서 자신의 마크맨을 놓쳐 실점의 빌미를 제공했다. 자연스레 거센 비판이 쏟아졌다. 하지만 바이에른 뮌헨은 선수를 보호하기는커녕 김민재를 매각하기로 결단했다.

실제 바이에른 뮌헨은 김민재에게 떠나도 된다고 ‘이별 통보’를 한 데다, 당초 5000만 유로(약 789억 원)로 책정한 김민재의 이적료를 3500만 유로(약 552억 원)까지 낮췄다. 그만큼 김민재를 매각하겠다는 의지가 상당히 강하다. 그뿐 아니라 앞서 지난달 말 FA(자유계약선수) 신분이 된 요나탄 타를 영입해 이미 김민재가 떠날 것을 대비하기까지 했다.



현지에선 바이에른 뮌헨이 새 시즌 타와 우파메카노를 주축으로 활용할 거로 전망하고 있다.김민재는 타의 합류와 맞물려 설 자리가 잃을 거로 내다보고 있다. 지난 시즌 바이에른 뮌헨이 모든 대회 통틀어 50경기를 치르는 동안 43경기(3593분)에 출전, 아픈 몸을 이끌고도 두 번째로 많은 시간을 뛰며 헌신했지만 푸대접을 당한 것이다.

현재 김민재는 복수 구단의 관심을 한 몸에 받고 있다. 리버풀과 첼시, 맨체스터 유나이티드, 나폴리, 유벤투스, AC밀란, 파리 생제르맹(PSG), 알나스르 등이 김민재에게 관심이 있다. 다만 김민재는 현재 국제축구연맹(FIFA) 클럽 월드컵 참가를 이유로 미국에 있는 데다, 아킬레스건 부상이 완벽하게 회복되지 않아 구체적인 협상은 아직 진행되고 있진 않다.

사진 = 게티이미지, 소셜네트워크서비스(SNS) 캡처"
20250623,회장 때문에 ‘꿈의 이적’ 막힌다…공개 발언하고도 ‘탈트넘’ 못할 위기,"""잉글랜드 프로축구 프리미어리그(EPL) 토트넘이 15일 오전 서울 목동종합운동장에서 오픈 트레이닝을 했다. 훈련을 마친 손흥민이 팀 동료 로메로로부터 물세례를 받고있다 토트넘은 16일 오후 8시 수원월드컵경기장에서 세비야(스페인)와 대결한다. 목동종합운동장=정시종 기자 capa@edaily.co.kr /2022.07.15.""

크리스티안 로메로(토트넘)의 이적 길이 막힐까. 다니엘 레비 토트넘 회장이 로메로의 이적을 막을 수 있다는 보도가 나왔다.

영국 매체 더 부트 룸은 22일(한국시간) “레비 회장은 로메로를 잔류시키기 위해 강력한 움직임을 보인다”며 “레비 회장은 디에고 시메오네 아틀레티코 마드리드 감독의 최우선 타깃 중 하나인 로메로 영입을 매우 까다롭게 만들 것으로 예상된다”고 전했다.
토트넘 주전 센터백인 로메로는 스페인 라리가 강팀인 아틀레티코와 연결되고 있다.

로메로는 2024~25시즌이 진행 중인 지난 4월, 한 인터뷰에서 “스페인 라리가에서 뛰고 싶다”고 공언했다.

당시 그는 “여러 상황에 따라 다르겠지만, 리그가 끝난 뒤에 다시 이야기해 보자”며 “사실 아직 에이전트와 이야기를 나누진 못했지만, 어떤 일이든 열려 있다. 내 목표는 항상 성장하고 새로운 곳에 가서 계속 발전하는 것”이라고 말했다.

크리스티안 로메로. 사진=로메로 SNS

마침 아틀레티코가 손을 내밀고 있다.

토트넘 입장에서도 올여름이 계약 기간 2년 남은 로메로에게 새 계약서를 내밀거나, 매각을 택할 적기로 평가된다.

레비 회장이 높은 이적료를 책정해 로메로의 이적을 막을 수 있다는 게 매체의 견해다. 축구 이적 전문 사이트 트랜스퍼마르크트에 따르면, 로메로의 시장가치는 5000만 유로(792억원)로 평가된다.

토마스 프랭크 토트넘 신임 감독이 2025~26시즌에도 로메로를 활용하고 싶어 하는 게 잔류를 고집하는 이유로 꼽힌다.

매체는 “프랭크 감독은 로메로가 다음 시즌 토트넘에서 결정적인 역할을 할 것이라고 생각하며 그가 잔류하길 희망한다”고 주장했다.

토트넘 새 주장단으로 선임된 주장 손흥민(가운데)과 부주장 제임스 매디슨(왼쪽) 크리스티안 로메로. 토트넘 SNS

로메로는 지난 시즌 ‘주장’ 손흥민을 보좌하는 부주장 역할을 소화했다. 토트넘 팬들은 사우디아라비아 이적설에 시달리고 있는 손흥민을 비롯해 로메로, 또 다른 부주장 굴리엘모 비카리오까지 팀을 이탈할 가능성에 노심초사하는 분위기다.

2021년 8월 임대생 신분으로 토트넘 유니폼을 입은 로메로는 이듬해 완전 이적했다. 그는 4년간 토트넘 소속으로 공식전 124경기에 출전해 7골 3도움을 기록했다.

김희웅 기자"
20250623,"""황의조, 항소심 재판부에 북중미 월드컵 출전 원한다며 선처 호소""","'불법 촬영' 혐의 축구선수 황의조
항소이유서에 ""팀 중심 역할 해야""
1심에서 징역형 집행유예 선고돼
불법 촬영 혐의로 1심에서 징역형 집행유예를 선고받은 축구선수 황의조(32)가 항소심 재판부에 '내년 북중미 월드컵에 국가대표로 출전하고 싶다'는 뜻을 밝힌 것으로 전해졌다. 21일 KBS는 ""황의조가 지난달 서울중앙지법 형사항소 1-3부(부장판사 조정래 진현지 안희길)에 제출한 93장 분량의 항소이유서를 입수했다""며 이같이 보도했다.

축구선수 황의조(32) 씨가 지난해 10월 16일 성폭력범죄의 처벌 등에 관한 특례법 위반(카메라 등 이용촬영) 혐의에 대한 첫 공판에 출두하기 위해 서울중앙지방법원 청사에 도착해 법정으로 향하고 있다. 허영한 기자


KBS에 따르면 황의조는 항소이유서에서 ""(자신은) 대한민국 간판 스트라이커이자 선배""라며 ""후배들에게 노하우를 전달해줘야 할 뿐 아니라 팀의 중심이자 기둥 역할을 해야 하는 상황""이라고 했다. 또 자신이 축구 국가대표로서 국위선양에 기여했다는 점을 강조하며 형이 확정될 경우 ""국가대표로서의 삶은 종지부를 찍게 된다""며 선처를 호소했다.

다만 황의조의 국가대표 복귀는 사실상 어려울 것으로 보인다. 대한축구협회는 지난 2023년 11월 ""불법 촬영 혐의에 대한 명확한 결론이 나올 때까지 황의조를 국가대표팀에 선발하지 않기로 했다""며 황의조의 국가대표 자격을 박탈했다. 협회 공정위원회 운영 규정 제14조에 따르면 성폭력 등 중대한 범죄를 저지른 선수는 영구제명 등 최고 수준의 징계를 받는다. 또 협회 선수 등록 규정에도 금고 이상 형을 선고받고 집행유예 기간 중인 선수는 선수 등록이 불가능하다.

황의조는 이미 재판에서 자신의 혐의를 인정한 바 있다. 지난 19일 2심 첫 공판에서 황의조 측 변호인은 ""피고인은 반성하고 있고 합의도 했다. 다행스럽게도 사진으로 피해자가 특정되지 않아 피해가 다소 적다""며 ""전과도 없고 그동안 축구선수로 국가를 위해 열심히 한 점 등을 고려했을 때 1심 형이 다소 무겁다는 이유로 항소했다""고 밝혔다.

반면 피해자 측 변호인은 ""황의조는 불법 촬영이 아니라고 하고 피해자의 직업과 혼인 여부를 특정하면서 보도자료를 돌렸다""며 ""이후 피해자에 대한 비난이 높아져 피해자는 정신과 상담도 받지 못했다""고 지적했다.

황의조는 지난 2022년 6~9월 피해자 2명의 동의 없이 성관계 영상을 불법 촬영하거나 영상통화를 녹화한 혐의를 받는다. 그는 자신과 여성들의 모습이 담긴 사진과 동영상을 사회관계망서비스(SNS)에 공유한 형수를 협박 등 혐의로 경찰에 고소했으나 수사 과정에서 불법 촬영 정황이 포착됐다. 검찰은 황의조를 성폭력처벌법 위반으로 불구속기소했다.

지난 2월 1심 재판부는 황의조에 대해 징역 1년에 집행유예 2년을 선고하며 ""공소 제기 이후 피해자를 위해 상당한 금액을 공탁했고, 현재까지 형사 처벌 전력이 없는 초범인 점을 참작했다""며 ""피고인은 법정에서 자신의 범행을 모두 인정하며 반성하고 있다""고 밝혔다. 또 황의조에게 200시간의 사회봉사 및 400시간의 성폭력 치료 프로그램 수강도 명령했다. 황의조 측은 이에 항소했으며, 항소심 재판부는 오는 7월24일 오후 3시 30분께 한 차례 더 공판을 열고 변론을 종결할 예정이다."
20250623,"진짜 충격이다! 프랭크 감독, 손흥민 주전 NO→로테이션 자원은 '환영'...""단독 면담 예정""","토마스 프랭크 감독은 손흥민을 주전 자원으로 기용할 생각이 없다.

토트넘 훗스퍼 소식통인 '스퍼스 웹'은 23일(한국시간) ""손흥민은 유럽축구연맹(UEFA) 유로파리그(UEL) 우승을 차지하며, 역사적인 순간을 만들었다. 그러나 이번 여름 커리어에서 가장 중대한 결정을 앞두고 있다. 이 선택은 클럽과 선수 모두에게 막대한 재정적 영향을 미칠 수 있다""라고 전했다.
이어 ""소식통에 따르면 프랭크 감독은 이미 손흥민과 관련된 계획을 구단 측에 전달한 상태다. 핵심은 다음 시즌 대대적인 리빌딩 속에서 손흥민이 '로테이션 자원'으로 남는 것에는 환영하지만, 주전 보장은 어렵다는 뜻이다""라고 알렸다.

향후 손흥민의 거취에 대해 많은 관심이 집중되고 있다. 확실한 건 그 어느 때보다 팀을 떠날 가능성이 높다는 것이다. 영국 '풋볼 런던' 소속 알레스데어 골드 기자는 ""내가 알기로는 손흥민이 지난 몇 년보다 올여름 토트넘 훗스퍼를 떠나는 데 더 열려 있다. 모든 당사자에게 적절한 제안이 온다면 떠날 가능성이 있다""라고 주장했다.



최근 손흥민의 이탈 가능성에 불을 지핀 사건이 발생했다. 앞서 프랭크 감독은 토트넘에 부임하자마자 인터뷰를 가졌다. 도미닉 솔란케, 로드리고 벤탄쿠르, 제임스 매디슨, 루카스 베리발의 이름은 거론됐지만, 손흥민은 언급하지 않았다.

이를 두고 손흥민의 상황을 간접적으로 내비친 것이 아니냐는 주장이 제기되기도 했다. 토트넘 팬 커뮤니티 '릴리 화이트 로즈'의 운영자 존 웬햄은 ""프랭크 감독의 인터뷰 영상에서 가장 인상 깊었던 건 손흥민의 부재였다. 프랭크 감독은 손흥민에 대해 아무 말도 하지 않았다. 이는 단순한 실수가 아니라고 본다. 토트넘에서 세대 교체가 진행되고 있는 것이다. 그 과정에서 손흥민이 떠나게 될 가능성이 높다""라고 말했다.

손흥민을 향한 관심은 뜨겁다. 사우디아라비아와 강하게 연결됐다. '토크 스포츠'는 ""사우디의 알 아흘리, 알 나스르, 알 카디시야 세 구단이 손흥민 영입에 관심을 보이고 있다. 이들은 4,000만 유로(약 634억 원) 이적료를 제시할 준비가 되어 있는 것으로 알려졌다""라고 설명했다.



물론 어디까지나 손흥민의 결정에 달려 있다. 영국 '기브미 스포츠' 소속 벤 제이콥스 기자는 ""손흥민은 토트넘에서 훌륭한 선수였고, 라커룸에의 리더이자 귀감이기도 했다. 1년 계약 연장은 반드시 잔류를 의미하지 않는다. 다가오는 여름 제안이 있을 경우를 대비해 가치를 보호한 조치일 뿐이다""라고 했다.

이어 ""손흥민이 한국 투어에 참가한 뒤, 이후의 결정은 그의 손에 달렸다. 현재로선 토트넘이 손흥민을 적극적으로 매각할 의도는 없어 보인다. 손흥민의 의사를 존중할 것이다. 본인 스스로 벤치에 머물 가능성을 고려할 수도 있다. 다만 아직 명확한 결정은 내려지지 않았다""라고 이야기했다.

우선 결정에 앞서 한국 투어는 진행할 예정이다. 제이콥스 기자는 ""출전 의무가 있는 건 맞다. 물론 이적 시에는 예외 조항이 있을 수 있다. 그러나 토트넘과 손흥민 모두 이 계약을 존중할 것으로 예상된다. 이를 어기면 위약금을 물어야 할 수도 있다""라고 덧붙였다."
