date,title,content
20250402,"韓 축구 경사 났다! '이강인(24·맨체스터 유나이티드)' 현실로…""에이전트와 접촉"" (西 매체)","[SPORTALKOREA] 배웅기 기자= 이강인(24)이 올여름 파리 생제르맹(이하 PSG)을 떠나 영국 무대를 밟을 것으로 보인다.

스페인 매체 '엘데스마르케'는 1일(이하 한국시간) ""하비 게라(발렌시아)와 이강인의 에이전트로 알려진 하비에르 가리도가 이적 협상을 위해 영국을 찾았다. 게라는 발렌시아가 붙잡고 싶어 하는 자원""이라고 보도했다. 현재로서 어느 선수의 이적을 논의한 것인지 확실하지는 않으나 이강인일 가능성이 높다.
이강인의 거취를 둘러싼 추측이 끊이지 않고 있다. 특히 흐비차 크바라츠헬리아가 합류한 올겨울 기점으로 이적설이 계속되고 있다. 루이스 엔리케 감독은 흐비차를 왼쪽 윙어로 기용하고 브래들리 바르콜라와 우스만 뎀벨레를 각각 오른쪽 윙어와 최전방 공격수에 배치하는 전술 변화를 꾀했다. 중원의 경우 파비안 루이스-비티냐-주앙 네베스 조합이 견고하다.

복수의 현지 매체에 따르면 아스널, 뉴캐슬 유나이티드, 맨체스터 유나이티드(이하 맨유) 등이 이강인을 노리는 상황이다. 이 중에서도 이강인에게 가장 진한 관심을 드러낸 구단은 아스널과 맨유다.


지금으로서는 맨유가 영입 경쟁에서 앞서는 분위기다. 아스널은 1월 미국 매체 '디 애슬레틱'의 보도 이후 별다른 소식이 나오지 않고 있다. 반면 맨유의 경우 이강인의 PSG 이적을 최초 보도한 마테오 모레토 기자부터 시작해 수많은 현지 매체가 이적 가능성을 높게 점치는 모양새다.

실제로 모레토 기자는 ""맨유가 이강인의 에이전트 가리도와 만나 대화를 나눴다""며 ""공식적 논의는 없지만 동향을 예의주시하는 단계""라고 밝혔다. 이탈리아 매체 '투토 메르카토'에 따르면 맨유는 이강인의 2024 트로페 데 샹피옹 우승 당시 스카우터를 파견한 것으로 전해진다.

애초 PSG는 이강인을 매각할 생각이 없었다. 디 애슬레틱은 ""PSG는 아시아 시장에서 큰 영향력을 가진 이강인을 높이 평가하며 당장 매각하고 싶어 하지 않는다""고 알렸으나 몇 개월 새 입지가 좁아지며 상황이 바뀌었다. 프랑스 매체 '르퀴프'의 로익 탄지 기자에 의하면 PSG는 5,000만 유로(약 795억 원) 이상의 제안이 들어온다면 이적을 고려해 볼 방침이다.



한편 이강인의 PSG는 지난달 30일 프랑스 생테티엔 스타드 조프루아 기샤르에서 열린 AS 생테티엔과 2024/25 리그 1 27라운드 원정 경기에서 6-1 완승을 거뒀다.

뒤이어 치러지는 AS 모나코와 OGC 니스 경기 결과에 따라 조기 우승을 확정 지을 수 있었던 상황이지만 모나코가 2-1로 이기며 다음으로 기회를 미뤘다. 2위 모나코(15승 5무 7패·승점 50)와 격차는 승점 21로 남은 7경기 가운데 최소 1무만 확보해도 우승 메달을 목에 건다.

비록 이강인은 국가대표팀 차출간 입은 발목 부상으로 명단 제외됐지만 리그 1 출범 이래 93년 동안 단 한 번도 없었던 무패 우승 신화에 한 발 가까워졌다. PSG는 현재 22승 5무(승점 71)로 선두를 공고히 하고 있다.


다음 목표는 아시아 선수 최초의 트레블이다. 이번 시즌 리그 우승을 사실상 확정 지은 PSG는 쿠프 드 프랑스와 유럽축구연맹(UEFA) 챔피언스리그에서도 각각 4강과 8강에 올라있다. 후반기 들어 절정의 경기력을 보이는 만큼 숙원과도 같은 트레블은 더 이상 꿈이 아닐지 모른다.

사진=WIK7 유튜브 캡처, 게티이미지코리아

취재문의 sportal@sportalkorea.co.kr"
20250402,"토트넘, 손흥민 드디어 보낸다→'146,200,000,000원' 역대 최고 이적료 쏜다!…'가나 FW' 영입 총력전 ""여름 SON과 결별""","(엑스포츠뉴스 나승우 기자) 토트넘 홋스퍼가 손흥민의 대체자로 본머스 공격수 앙투안 세메뇨를 낙점했다. 현지 보도에 따르면 세메뇨 영입 논의는 구단 수뇌부 내에서 이미 진지하게 진행 중이다. 이적 가능성도 현실화되고 있다.

영국 현지 및 스페인 보도에 따르면, 토트넘은 손흥민의 기량 하락과 계약 만료 시점을 고려해 대체자 영입을 준비하고 있다. 영입을 위해 구단 역대 최고 이적료 지출도 각오할 것으로 보인다.

영국 풋볼팬캐스트는 2일(한국시간) ""토트넘은 손흥민을 대체하기 위해 본머스의 앙투안 세메뇨를 영입할 가능성이 커졌다""고 보도했다.



매체는 ""손흥민의 토트넘 미래에 대한 의문이 일고 있다. 지난 1월 1년 연장 옵션을 통해 2026년까지 뛰게 됐으나 장기적인 미래에 대해서는 여전히 의문이 제기되고 있다""며 ""토트넘은 여름에 33세가 되는 손흥민의 잠재적인 대체자를 찾기 시작했고, 세메뇨가 관심을 받고 있다""고 설명했다.

스페인 피차헤스의 보도를 인용한 매체는 ""토트넘이 손흥민 후계자로 세메뇨를 선택할 가능성이 점점 커지고 있으며 손흥민은 가까운 미래에 이적을 결정할 수도 있다. 세메뇨의 이름이 영입 타깃 목록에 오르고 있기 때문""이라고 덧붙였다.



손흥민은 지난 1월 구단과 2026년까지 1년 연장 계약을 체결했지만, 향후 플랜에서 완전히 중심에 있다고 보기 어려운 상황이다. 특히 올 시즌 프리미어리그에서 단 7골에 그치며 이전 시즌들과는 달리 주춤한 모습을 보이고 있다.

물론 손흥민은 여전히 팀 내 최다 공격 포인트를 기록하고 있다. 주장으로서의 리더십과 상업적 가치까지 고려하면 당장 팀을 떠날 가능성은 높지 않다.

하지만 토트넘은 이미 손흥민 이후를 준비하고 있다. 그 중심에 세메뇨가 있다는 점은 토트넘이 세대 교체를 본격화하려는 의지를 반영하는 것을 암시한다.
토트넘이 우선적으로 고려했던 대안은 바이에른 뮌헨에서 임대로 합류한 마티스 텔이었다. 그러나 텔은 프리미어리그에서 아직 골을 기록하지 못했고, 기대에 미치지 못하는 경기력으로 영입 우선순위에서 밀려났다.

이 가운데 세메뇨가 급부상했다. 세메뇨는 이번 시즌 프리미어리그에서 7골 5도움을 기록하며 본머스 공격의 핵심으로 활약 중이다. 현지 언론은 세메뇨에 대해 '믿을 수 없는(unbelievable)' 퍼포먼스를 보여주는 선수라고 평가했고, 포스트 손흥민 자원으로 적합하다는 판단이 내려진 것으로 알려졌다.



토트넘 내부에서는 세메뇨의 다재다능함에 주목하고 있다. 윙어와 세컨드 스트라이커, 중앙 공격수 역할을 모두 소화할 수 있다는 점이 안지 포스테코글루 감독의 전술적 요구와도 맞아떨어진다는 평가다.

세메뇨의 장점은 단순한 윙어 유형이 아니라는 점이다. 돌파력과 속도를 갖춘 직선적인 플레이어이면서도 수비 가담 능력과 압박 강도, 그리고 전환 속도까지 갖춘 선수다.

포스테코글루 감독이 강조하는 강력한 전방 압박 시스템과 빠른 전환에 적합한 자원으로 평가된다. 손흥민이 빠른 침투와 마무리에 강점을 지닌 피니셔형 윙어라면 세메뇨는 좀 더 넓은 지역에서 폭넓게 기회를 만드는 스타일이라는 평가다.

또한 세메뇨는 체격 조건이 좋아 전방 압박과 피지컬 싸움에서도 밀리지 않는다는 평가를 받는다. 실제로 이번 시즌 본머스에서는 스트라이커 포지션에서도 몇 차례 기용됐고, 혼자서 역습을 전개하며 찬스를 만드는 장면도 자주 연출했다. 손흥민 대체자로서 단순히 같은 스타일의 대체자가 아니라 팀 전술 자체를 유연하게 바꿀 수 있는 자원이라는 점에서 의미가 있다.

세메뇨는 맨체스터 유나이티드, 아스널 등 다른 프리미어리그 빅클럽들의 관심도 받고 있지만, 출전 시간과 전술 비중을 고려하면 토트넘이 가장 현실적인 선택지가 될 수 있다.



다만 문제는 이적료다. 풋볼팬캐스트에 따르면 본머스는 세메뇨의 이적료로 약 3400만~4200만 파운드(646~798억원)를 요구하고 있는 것으로 전해졌다.

그러나 영국 더선은 본머스가 세메뇨의 이적료로 무려 7500만 파운드(약 1462억원)를 책정했다고 전했다. 최소 이 수준의 이적료를 제안하지 않는다면 세메뇨를 내주지 않겠다는 의지를 보인 것이다.

만약 본머스의 요구대로 토트넘이 세메뇨를 7500만 파운드에 영입한다면 토트넘 구단 역대 최고 이적료 지출 기록이 새로 쓰여진다. 세메뇨가 클럽 레코드를 기록하고 토트넘에 오게 된다는 것이다.

영국 기브미스포츠도 ""토트넘은 손흥민 대체자로 7500만 파운드의 절대적인 스타 영입을 원한다""며 ""보도에 따르면 토트넘은 여름 이적시장에서 본머스 스타 세메뇨를 영입할 가능성이 있다. 세메뇨에게는 7500만 파운드의 이적료가 책정됐고, 토트넘은 손흥민이 떠난 후의 시대에 주목하고 있다""고 보도했다.



이어 ""세메뇨는 토트넘의 중장기적 옵션이 될 수 있다. 여름 이적시장이 다가오면서 손흥민은 이적을 고려할 가능성이 있다. 따라서 토트넘은 10년간 활약한 한국인 선수의 활약이 끝나게 되면 그를 대신할 믿을 수 있는 대체자를 확보해야 할 것""이라며 세메뇨가 손흥민의 완벽한 대체자가 될 수 있을 거라고 전망했다.

토트넘 소식을 전하는 토트넘 홋스퍼 뉴스 또한 ""토트넘은 이번 여름 손흥민과 결별할 수 있다. 손흥민은 이번 시즌 포스테코글루 감독 밑에서 힘겨운 시간을 보냈다""고 토트넘과 손흥민이 곧 갈라설 거라고 예상했다.

토트넘과 손흥민은 이번 여름을 끝으로 갈라설 가능성이 높다. 과연 토트넘이 손흥민 대체자로 무려 구단 역대 최고 이적료를 주고 세메뇨를 데려올지 관심이 집중된다.

사진=연합뉴스"
20250402,"[속보] '너무 안타깝다' 한국 차세대 에이스, 인대 부상으로 시즌 아웃 판정...""소속팀의 큰 손실""","[스포티비뉴스=장하준 기자] 너무나 안타까운 소식이 전해졌다.

독일 매체 '빌트'는 2일(한국시간) ""최악의 우려가 현실이 됐다. 정우영은 더 이상 우니온 베를린에서 뛸 수 없게 됐다""라며 정우영의 시즌 아웃 소식을 알렸다.

이어 ""정우영은 심각한 인대 부상을 입었다. 이로써 남은 시즌을 소화할 수 없게 됐으며, 이는 강등 싸움을 벌이고 있는 우니온 베를린에 큰 손실이 될 전망이다. 그는 2일 프랑크푸르트에서 전문의를 찾아 수술 일정을 조율할 예정이다""라고 보도했다.

이번 시즌 슈투트가르트를 떠나 임대 신분으로 베를린에서 활약 중인 정우영은 최근 기세가 상당했다. 지난달 10일에는 아인라흐트 프랑크푸르트전에서 득점포를 가동하는 등 이번 시즌 23경기에 출전해 3골 2도움을 기록하며 좋은 활약을 펼치는 중이었다. 덕분에 베를린은 정우영의 완전 영입을 고려하고 있었다.



하지만 예기치 못한 부상으로 남은 시즌을 소화할 수 없게 됐다. 그는 지난달 30일에 있었던 프라이부르크전 도중 전반 8분 만에 부상을 당하며 그라운드를 빠져나갔다.

과거 바이에른 뮌헨 유스팀에 입단하며 화제를 모았던 정우영은 빠르게 능력을 인정받았다. 이어 2018년 바이에른 뮌헨 1군 데뷔에 성공했다.

하지만 많은 기회를 받지 못한 뒤, 2019년 프라이부르크로 이적해 핵심 선수로 활약헸다. 이어 2023년에는 슈투트가르트로 이적하며 새로운 도전을 선택했다. 그러나 프라이부르크 시절에 비해 많은 기회를 받지 못한 뒤, 이번 시즌을 앞두고 베를린으로 임대를 떠났다. 그리고 최근 상승세를 타며 베를린의 잔류 경쟁에 힘을 보태고 있었지만, 아쉽게 쓰러지며 남은 시즌을 소화할 수 없게 됐다."
20250402,"미쳤다! 또 韓 프리미어리거 탄생 예감, 이강인(24·맨체스터 유나이티드) 현실로?...""에이전트와 접촉""","[SPORTALKOREA] 황보동혁 기자= 파리 생제르맹(PSG)의 이강인(24)이 올여름 프랑스 무대를 떠나 잉글랜드로 갈지도 모른다는 충격적인 소식이다.

스페인 매체 '엘데스마르케'는 1일(한국시간) '이강인과 하비 게라의 에이전트는 이적을 위해 잉글랜드를 찾았다. 누구라고 단언할 순 없지만, 두 선수 가운데 한 명이 프리미어리그 구단과 접촉을 했다'라고 전했다.

이강인과 게라의 에이전트인 하비에르 가리도는 두 선수를 포함해 압데 에잘줄리, 이냐키 페냐, 헤수스 포르테아 등의 선수를 관리하고 있다.


이강인의 에이전트 가리도가 이적 작업을 위해 PL 구단을 방문했다는 사실은 익히 알려진 내용이다. 단 그가 보유한 선수 가운데 어떠한 선수 건으로 잉글랜드를 밟는지가 확실하지 않았다.

그러나 매체에 따르면 게라는 현재 발렌시아를 떠나고 싶지 않으며, 구단 역시 그를 매각할 의향이 없는 것으로 알려졌다. 이에 최근 PSG에서 입지가 줄어든 이강인의 이적을 위해 잉글랜드에 방문했을 가능성이 높다고 전망했다.


이강인이 PSG를 떠날 가능성이 제기된 것은 전혀 놀라운 일이 아니다. 출전 시간이 줄어들며 최근 지속적으로 이적설에 시달려왔기 때문이다.

최근 이강인은 흐비차 크바라츠헬리아(24)의 영입과 데지레 두에(19)의 포지션 변화로 인해 리그에서 26경기 6골 5도움이라는 준수한 활약에도 불구하고 점차 출전 시간이 줄어들고 있다.

실제로 그는 2월 한 달간 7경기에서 총 322분만을 소화했으며, 특히 지난 6일 열린 2024-25 UEFA 챔피언스리그 16강 1차전 리버풀과의 중요한 경기에서도 벤치에만 머물렀다.

프랑스 매체 '풋01' 은 지난달 선수의 줄어든 입지를 조명하며 '이강인과 PSG가 이번 여름 결별하기로 했으며, 시즌 종료 후 팀을 떠날 가능성이 매우 높다'고 보도하며 이강인의 이적을 점치기도 했다.


영국 다수의 현지 매체에선 맨체스터 유나이티드, 아스널, 뉴캐슬, 애스턴 빌라 등이 상황을 지켜보고 있음을 알렸다. 와중에 그의 에이전트까지 바쁘게 움직이고 있다는 사실이 드러나며 이적에 대한 기대감이 높아지고 있다.

엘데스마르케는 정확히 가리도가 정확히 어떤 클럽들과 접촉했는지는 언급하지 않았지만, 복수의 현지 보도에 따르면 아스널, 뉴캐슬 유나이티드, 맨유 등이 이강인 영입에 관심을 보이고 있는 것으로 전해진다.

여러 팀이 그에게 관심을 보이는 가운데, 가장 유력해 보이는 팀은 맨유다. 최근 이탈리아 매체 '투토 메르카토'에 따르면 맨유는 이강인의 2024 트로페 데 샹피옹 우승 당시 스카우터를 파견한 것으로 전해진다.


게다가 지난달 ‘기브미스포츠’에 따르면 맨유는 지난겨울 이적시장에서도 이강인 영입에 관심을 보인 것으로 알려져 있다.

해당 매체는 '올드 트래포드엔 새로운 공격수가 필요하다. 이강인은 PSG에서 주전 자리를 굳히지 못했기 때문에 맨유 이적에 관심이 있을 수 있다. 그는 아모림 체제 맨유에서 첫 번째 계약이 될 수 있다'며 이강인의 맨유행 가능성을 밝힌 바 있다.


이강인의 정확한 행선지는 아직 불확실하다. 그러나 최근 끊이지 않는 이적설을 감안하면, PSG와의 결별은 시간문제일 것으로 보인다.

사진= goal post asia 인스타그램 캡처, 게티이미지코리아

취재문의 sportal@sportalkorea.co.kr"
20250402,"[속보] '대충격 이강인-손흥민 안녕!!' ""토트넘, 손흥민 대체자 바르사서 영입"" 英 매체... 이강인 절친 토트넘행 언급","[사진] ⓒGettyimages(무단전재 및 재배포 금지)
[사진] ⓒGettyimages(무단전재 및 재배포 금지)


[OSEN=우충원 기자] 토트넘이 이강인(PSG) 절친을 영입할 예정이다. 손흥민 대체 선수로 점찍었다. 

트리뷰나는 1일(이하 한국시간) ""토트넘과 아스톤 빌라 그리고 뉴캐슬이 페란 토레스에 대해 관심을 갖고 있다""면서 ""바르셀로나는 토레스를 이적 시킬 계획을 갖고 있다. 바르셀로나는 5000만 유로(800억 원)라면 판매를 고민할 수 있다""라고 보도했다. 

발렌시아 유소년팀 출신인 토레스는 이강인과 함께 어린 시절을 보낸 절친한 사이다. 이강인과는 현재까지도 친분을 유지하며 서로를 응원하는 관계로 알려졌다. 이강인보다 먼저 발렌시아 1군 무대에 모습을 드러냈던 페란은 이후 성장세를 보이며 2020년 맨체스터 시티로 이적했지만, 이후 기대만큼 잠재력을 폭발시키지 못했다.

2022년 바르셀로나로 향하며 다시 반전을 노렸던 토레스는 라민 야말, 하피냐, 로베르트 레반도프스키 등에 리며 활약할 자리를 잃었다. 결국 이적 가능성이 높았다.

다만 올 시즌 달라졌다.  한지 플릭 감독 체제에서 페란은 자신의 역할을 찾았다. 올 시즌 주전 대신 조커로 활약하며 바르셀로의 승리에 기여했다.

토레스는 프리메라리가 20경기 출전 중 선발이 7경기에 불과한 페란은 이미 7골-2도움을 기록 중이다. 또 올 시즌 공식전 32경기에서 13골-3도움으로  커리어 하이를 넘어섰다. 그결과 토트넘을 비롯해 프리미어리그 구단들의 관심을 받고 있다. 

토레스가 토트넘에 합류한다면 손흥민이 떠날 가능성이 높다. 최근 영국 언론들은 손흥민의 이적 가능성을 높게 보고 있다. 

토트넘 홋스퍼 뉴스는 1일 손흥민의 통산 8번째 수상 소식을 알리면서 ""이번 시즌 기대에 못 미치는 활약으로 비판을 받아온 손흥민은 기분 좋은 소식을 전했다""라고 밝혔다. 

[사진] ⓒGettyimages(무단전재 및 재배포 금지)
[사진] ⓒGettyimages(무단전재 및 재배포 금지)
토트넘 홋스퍼 뉴스는 지난달 31일 ""토트넘은 이적시장을 통해 새로운 변화를 계획 중이다. 손흥민의 시대는 끝났다고 판단했다""라고 주장했다.

이어 ""손흥민을 매각해야 한다. 이게 합리적이다. 최우선으로 팔아야 하는 선수는 아니지만 나이와 높은 주급을 고려하면 유력한 매각 후보라고 볼 수 있다""라며 ""그와 이별하면 히샬리송을 포함해 도미니크 솔란케 역시 도움이 될 것이다""라고 했다. 

토트넘 훗스퍼 뉴스는 ""토트넘은 다가오는 이적시장을 통해 공격진을 개편해야 한다. 토트넘은 울버햄튼의 쿠냐 같은 경험이 풍부한 선수가 필요하다""라고 전했다. 
투더레인앤드백은 지난달 29일 ""토트넘이 손흥민과 결별 수순을 밟을 수 있다. 토트넘에서 한 시대가 끝날 가능성이 있다""면서 ""토트넘은 다가오는 여름 이적 시장에서 손흥민에 대한 제안을 심각하게 검토할 예정""이라고 보도했다.

손흥민은 지난 1월 토트넘이 2026년까지 계약 기간을 1년 더 연장하는 옵션을 발동하면서 다음 시즌까지 뛰게 됐으나 올시즌 내내 기복 있는 모습으로 일부 팬들과 현지 전문가들에게 '계약 연장 대상이 맞느냐'는 비판을 받아왔다.

토트넘 홋스퍼 뉴스는 ""손흥민은 불확실한 상황 속에서도 긍정적인 소식을 전했다. 손흥민이 시즌 종료 후 토트넘을 떠날 가능성도 제기되고 있는 가운데, 최근 그는 대한민국에서 의미 있는 상을 수상했다""라고 전했다. 

이어 ""이번 시즌 여러 어려움을 겪었지만, 손흥민은 팀의 주장으로서 아직 자신의 첫 토트넘 트로피를 들어 올릴 기회를 남겨두고 있다. 토트넘은 유로파리그 8강에 진출한 상태로, 17년 만의 메이저 트로피 탈환을 위해 집중하고 있다""라며 ""이를 위해서는 손흥민이 팀의 에이스로서 다시 제 역할을 해줘야 하며, 이번 '올해의 선수' 수상이 그에게 자신감을 불어넣는 계기가 될 수 있다""라고 짚었다.

[사진] ⓒGettyimages(무단전재 및 재배포 금지)
[사진] ⓒGettyimages(무단전재 및 재배포 금지)
 토트넘 홋스퍼 뉴스는 ""최근 몇 주간 손흥민은 선발 명단에서 제외되는 경우도 있었고, 출전 시간에 대한 불만을 나타낸 발언 또한 감독과의 관계에 영향을 미쳤을 가능성이 있다""라며 억지 주장을 내세웠다. 

기사의 해당 부분을 '억지 주장'이라고 표현한 이유가 있다. 토트넘 홋스퍼 뉴스는 지난달 22일부터 줄곧 ""손흥민의 인터뷰가 알려지면서 포스테코글루 감독이 손흥민의 발언에 불쾌감을 가질 수 있다""라고 주장해왔다. 

근거는 3월 19일 고양종합운동장에서 열린 오만전에 앞선 사전 기자회견이었다. 해당 기자회견장에서 만난 손흥민은 ""몸 상태가 매우 좋다. 여러 번 말했듯 지금이 가장 컨디션이 좋은 시기다. 3월에 유로파리그와 리그를 병행하느라 체력 소모가 컸지만, 감독님께서 좀 더 좋은 컨디션을 유지할 수 있도록 판단하신 것 같다. 현재 몸은 문제 없다""라고 밝혔다.

이 발언을 두고 토트넘 홋스퍼는 손흥민이 포스테코글루 감독의 출전 시간 관리에 불만을 품은 것이라고 해석했다. 손흥민은 본인의 몸 상태를 긍정적으로 평가하며 '체력 때문은 아니었다'는 뉘앙스를 남겼기 때문이다. 

포스테코글루 감독은 ""체력적인 이유로 로테이션을 시행했다""라고 설명했지만, 일부 영국 매체들은 ""손흥민이 전술적인 이유로 점점 계획에서 밀려나는 것 아니냐""는 관측을 내놓고 있다. 주장임에도 불구하고 출전 기회가 줄어드는 것은 이례적인 상황이다.

손흥민은 자기 역할을 묵묵하게 해냈다. 특히 AZ알크마르와의 16강 2차전에서는 모든 골에 관여하며 3-1 승리를 이끌어 1, 2차전 합계 3-2로 8강 진출에 기여했다. 리그도 풀럼과의 29라운드에서 경기가 풀리지 않았던 후반 시작과 동시에 흐름을 바꾸는 모습을 과시했다. 레드냅의 말 바꾸기가 머쓱할 정도의 기량 과시다.

올 시즌 공식 대회 40경기 11골-11도움으로 토트넘 내 가장 폭발적인 공격력을 선보이고 있다.

기브미스포츠는 24일 “토트넘이 블록버스터급 손흥민 매각을 꾀하고 있다. 이미 이적에 관한 기초 공사는 완료됐다. 토트넘은 여름 이적시장을 앞두고 손흥민과 결별할 생각”이라고 보도했다. 

손흥민에 대해 못살게 구는 것은 일반적인 상황이 아니다. 결국 손흥민을 깎아 내리고 유리한 상황이 되겠다는 토트넘의 의지로 밖에 보이지 않는다.

[사진] ⓒGettyimages(무단전재 및 재배포 금지)
[사진] ⓒGettyimages(무단전재 및 재배포 금지)
투더래인앤드백은 ""토트넘은 니코 윌리엄스도 바이아웃을 통해 영입하길 원하는 것으로 알려졌다. 다만 선수가 아틀레틱 빌바오에서 행복하기에 설득하기 쉽지 않을 것이다. 토트넘이 그를 영입하기 위해서는 유럽축구연맹(UEFA) 챔피언스리그에 나서야 한다""라고 설명했다.

니코 윌리엄스가 토트넘에 합류할 가능성은 높지 않다. 하지만 토트넘에 합류한다면 손흥민의 대체자로 활약할 것이 분명한 선수다. / 10bird@osen.co.kr"
