date,title,content
20250623,손흥민 '1425억 초대형 딜' 이뤄지나? 드디어 새 감독 만난다!…프랑크와 면담서 중대 선택,"영국 매체 '풋볼 인사이더'는 22일(한국시간) '손흥민과 토트넘은 결별할 수 있다'며 '계약 만료까지 1년을 남긴 손흥민은 이번 여름, 구단과 미래를 논의할 예정이며 이적 가능성이 그 어느 때보다 높다'고 보도했다. 매체는 토트넘 내부 사정에 정통한 소식통을 인용해 '손흥민이 토트넘을 떠나는 데 있어 구단은 더 이상 장애물이 되지 않을 것'이라며 사실상 이적에 열려 있는 입장을 전했다. 토트넘 전문 기자 알레스데어 골드도 '손흥민이 구단을 떠날 가능성이 그 어느 때보다 높다. 그의 미래는 스스로가 결정할 문제지만, 감독과의 면담 결과가 향방을 가를 것'이라고 분석했다. 손흥민은 최근 사우디아라비아 3개 구단에서 3년 총액 1425억원에 달하는 거액 제안을 받은 것으로 알려졌다. 연합뉴스


(엑스포츠뉴스 윤준석 기자) 10년의 동행이 끝을 향하고 있는걸까.

곧 있을 새로운 감독과의 면담이 가장 중요할 것으로 보인다.

토트넘 홋스퍼가 안지 포스테코글루 감독 경질 후, 토마스 프랑크 신임 감독 체제를 출범시키며 공격진 재편에 본격적으로 나선 가운데, 주장 손흥민 거취에도 중대한 변화가 감지되고 있다.

영국 유력 매체들은 일제히 손흥민이 토트넘을 떠날 가능성이 커지고 있다며 연쇄 보도를 내놓고 있다. 실질적인 이적 협상 또는 결별 시점이 다가오고 있다는 해석이 지배적이다.

특히 새로 부임한 토마스 프랑크 감독과의 면담 이후 손흥민의 미래가 결정될 것으로 보인다.

2015년 여름, 바이엘 레버쿠젠에서 이적료 2200만 파운드(약 375억원)에 토트넘 유니폼을 입은 손흥민은 지난 10년간 프리미어리그를 대표하는 공격수로 성장해왔다.

2021-2022시즌에는 EPL 공동 득점왕에 오르며 구단 역사상 최초의 아시아 출신 득점왕이라는 금자탑을 쌓았고, 지난 시즌에는 마침내 토트넘의 17년 무관을 끝내는 유럽축구연맹(UEFA) 유로파리그 우승컵을 들었다.

영국 매체 '풋볼 인사이더'는 22일(한국시간) '손흥민과 토트넘은 결별할 수 있다. 계약 만료까지 1년을 남긴 손흥민은 이번 여름, 구단과 미래를 논의할 예정이며 이적 가능성이 그 어느 때보다 높다'고 보도했다. 매체는 토트넘 내부 사정에 정통한 소식통을 인용해 '손흥민이 토트넘을 떠나는 데 있어 구단은 더 이상 장애물이 되지 않을 것'이라며 사실상 이적에 열려 있는 입장을 전했다. 토트넘 전문 기자 알레스데어 골드도 '손흥민이 구단을 떠날 가능성이 그 어느 때보다 높다. 그의 미래는 스스로가 결정할 문제지만, 감독과의 면담 결과가 향방을 가를 것'이라고 분석했다. 손흥민은 최근 사우디아라비아 3개 구단에서 3년 총액 1425억원에 달하는 거액 제안을 받은 것으로 알려졌다. 연합뉴스


그러나 영국 매체 '풋볼 인사이더'는 22일(한국시간) ""손흥민과 토트넘은 결별할 수 있다""며 ""계약 만료까지 1년을 남긴 손흥민은 이번 여름, 구단과 미래를 논의할 예정이며 이적 가능성이 그 어느 때보다 높다""고 보도했다.

매체는 토트넘 내부 사정에 정통한 소식통을 인용해 ""손흥민이 토트넘을 떠나는 데 있어 구단은 더 이상 장애물이 되지 않을 것""이라며 사실상 이적에 열려 있는 입장을 전했다.

토트넘 전문 기자 알레스데어 골드도 ""손흥민이 구단을 떠날 가능성이 그 어느 때보다 높다""며 ""그의 미래는 스스로가 결정할 문제지만, 감독과의 면담 결과가 향방을 가를 것""이라고 분석했다고 매체는 전했다.

또 다른 토트넘 커뮤니티 '스퍼스웹'도 최근 ""프랑크 감독은 손흥민이 다음 시즌 벤치에 머무는 상황을 받아들일 경우에만 잔류가 가능하다는 입장""이라고 전했고, 영국 'TBR 풋볼'은 ""손흥민이 스스로 자신의 역할 축소를 받아들인다면 남을 수 있지만, 이미 이적을 고려하고 있는 상황으로 보인다""고 설명했다.

영국 매체 '풋볼 인사이더'는 22일(한국시간) '손흥민과 토트넘은 결별할 수 있다. 계약 만료까지 1년을 남긴 손흥민은 이번 여름, 구단과 미래를 논의할 예정이며 이적 가능성이 그 어느 때보다 높다'고 보도했다. 매체는 토트넘 내부 사정에 정통한 소식통을 인용해 '손흥민이 토트넘을 떠나는 데 있어 구단은 더 이상 장애물이 되지 않을 것'이라며 사실상 이적에 열려 있는 입장을 전했다. 토트넘 전문 기자 알레스데어 골드도 '손흥민이 구단을 떠날 가능성이 그 어느 때보다 높다. 그의 미래는 스스로가 결정할 문제지만, 감독과의 면담 결과가 향방을 가를 것'이라고 분석했다. 손흥민은 최근 사우디아라비아 3개 구단에서 3년 총액 1425억원에 달하는 거액 제안을 받은 것으로 알려졌다. 연합뉴스


가장 큰 변수는 새 사령탑 프랑크다. 브렌트퍼드에서 잉글랜드식 전방 압박 전술과 유연한 포메이션 운용으로 주목받아온 프랑크 감독은 최근 토트넘 지휘봉을 잡으며 스쿼드 개편 작업에 착수했다.

그런데 프랑크 감독의 첫 공식 인터뷰에 이어 토트넘 구단이 구단 채널을 통해 공개한 공식 인터뷰 영상에서도 손흥민의 이름이 언급되지 않았다는 점이 매체의 주목을 받았다.
토트넘 전문 소식지 '토트넘 홋스퍼 뉴스'는 22일 ""토트넘이 공개한 첫 공식 인터뷰 영상에서도 프랑크 감독이 도미니크 솔란케, 제임스 매디슨, 로드리고 벤탄쿠르 등 주요 자원을 언급했지만, 손흥민과 크리스티안 로메로는 빠져 있었다""며 ""이는 이적이 유력한 선수들을 의도적으로 언급하지 않았을 가능성을 시사한다""고 보도했다.

부임 당시 인터뷰보다 더 자세한 이야기가 담긴 영상에서도 손흥민의 이름이 없다는 것은 그가 떠날 가능성이 높은 데서 기인한 것이 아니냐는 해석이다.

영국 매체 '풋볼 인사이더'는 22일(한국시간) '손흥민과 토트넘은 결별할 수 있다. 계약 만료까지 1년을 남긴 손흥민은 이번 여름, 구단과 미래를 논의할 예정이며 이적 가능성이 그 어느 때보다 높다'고 보도했다. 매체는 토트넘 내부 사정에 정통한 소식통을 인용해 '손흥민이 토트넘을 떠나는 데 있어 구단은 더 이상 장애물이 되지 않을 것'이라며 사실상 이적에 열려 있는 입장을 전했다. 토트넘 전문 기자 알레스데어 골드도 '손흥민이 구단을 떠날 가능성이 그 어느 때보다 높다. 그의 미래는 스스로가 결정할 문제지만, 감독과의 면담 결과가 향방을 가를 것'이라고 분석했다. 토트넘은 본머스의 가나 국가대표 윙어 앙투안 세메뇨와 협상하고 있다. 연합뉴스


또 다른 이적 정황으로, 토트넘은 손흥민의 이적을 가정하고 이미 후임 영입에 나섰다는 점 역시 주목할 만하다.

영국 '디 애슬레틱'은 ""토트넘이 본머스의 측면 공격수 앙투안 세메뇨 영입에 나섰다""고 보도하며, 구체적인 이적료 협상까지 진행 중임을 전했다.

보도에 따르면 본머스는 세메뇨의 몸값으로 약 6500만 파운드(약 1200억원)를 요구한 것으로 알려져 협상이 쉬워보이지는 않을 것으로 보인다.

세메뇨는 지난 시즌 공식전 42경기에서 13골 6도움을 기록했으며, 빠른 스피드와 직선적 돌파 능력, 멀티 포지션 소화력이 강점이다. 우측 측면 공격수로 손흥민과 포지션과 겹친다는 점에서 토트넘이 세메뇨를 후임 자원으로 낙점했을 가능성이 높다.

또한 브렌트퍼드 시절 프랑크 감독과 호흡을 맞췄던 브라이언 음뵈모도 토트넘의 영입 리스트 상단에 이름을 올렸다.

지난 시즌 리그 20골 7도움을 기록한 음뵈모는 맨체스터 유나이티드의 타깃이기도 하며, 토트넘은 유럽 대항전 진출권이라는 메리트를 활용해 경쟁에서 우위를 점하려 하고 있다.

하지만 맨유는 음뵈모에게 최대 5500만 파운드(약 1019억원)의 조건을 제시한 것으로 알려져 협상이 쉽지만은 않은 상황이다.

영국 매체 '풋볼 인사이더'는 22일(한국시간) '손흥민과 토트넘은 결별할 수 있다. 계약 만료까지 1년을 남긴 손흥민은 이번 여름, 구단과 미래를 논의할 예정이며 이적 가능성이 그 어느 때보다 높다'고 보도했다. 매체는 토트넘 내부 사정에 정통한 소식통을 인용해 '손흥민이 토트넘을 떠나는 데 있어 구단은 더 이상 장애물이 되지 않을 것'이라며 사실상 이적에 열려 있는 입장을 전했다. 토트넘 전문 기자 알레스데어 골드도 '손흥민이 구단을 떠날 가능성이 그 어느 때보다 높다. 그의 미래는 스스로가 결정할 문제지만, 감독과의 면담 결과가 향방을 가를 것'이라고 분석했다. 손흥민은 최근 사우디아라비아 3개 구단에서 3년 총액 1425억원에 달하는 거액 제안을 받은 것으로 알려졌다. 연합뉴스


이적 가능성이 점점 높아지면서 손흥민을 향한 해외 구단들의 관심도 뜨겁다.

사우디아라비아의 알나스르, 알아흘리, 알카디시야 등이 손흥민에게 총액 9000만 유로(약 1425억원)의 조건을 제시할 준비를 하고 있으며, 이렇게 된다면 세후 연봉으로 최상위권에 들 전망이다.

튀르키예의 명문 페네르바체도 움직이고 있다. 과거 토트넘에서 손흥민과 함께했던 조제 무리뉴 감독이 직접 영입을 요청한 것으로 알려졌다.

그럼에도 불구하고 손흥민의 이적은 당장 이뤄지지 않을 수 있다. 토트넘은 올여름 아시아 투어 일정을 예정하고 있으며, 손흥민은 여전히 투어 명단에 포함돼 있다.

토트넘은 7월 중순 한국과 홍콩에서 프리시즌 투어를 진행하며, 서울에서는 뉴캐슬 유나이티드와 친선 경기를 치를 예정이다.

손흥민의 이적이 이 시점 이전에 결정되면 스폰서 및 주최 측과의 계약 문제까지 야기될 수 있는 만큼 구단은 일정 종료 후 협상에 속도를 낼 가능성이 높다.

영국 매체 '풋볼 인사이더'는 22일(한국시간) '손흥민과 토트넘은 결별할 수 있다. 계약 만료까지 1년을 남긴 손흥민은 이번 여름, 구단과 미래를 논의할 예정이며 이적 가능성이 그 어느 때보다 높다'고 보도했다. 매체는 토트넘 내부 사정에 정통한 소식통을 인용해 '손흥민이 토트넘을 떠나는 데 있어 구단은 더 이상 장애물이 되지 않을 것'이라며 사실상 이적에 열려 있는 입장을 전했다. 토트넘 전문 기자 알레스데어 골드도 '손흥민이 구단을 떠날 가능성이 그 어느 때보다 높다. 그의 미래는 스스로가 결정할 문제지만, 감독과의 면담 결과가 향방을 가를 것'이라고 분석했다. 손흥민은 최근 사우디아라비아 3개 구단에서 3년 총액 1425억원에 달하는 거액 제안을 받은 것으로 알려졌다. 연합뉴스


손흥민은 지난 6월 서울월드컵경기장에서 열린 쿠웨이트와의 A매치 이후 믹스트존에서 ""계약이 남아 있는 상황에서 지금 어떤 말을 하는 것보다는 기다려보는 게 좋을 것 같다""며 말을 아꼈다.

현재로서는 토트넘의 공식 발표나 손흥민 본인의 입장이 나오기 전까지 확정적 판단은 이르다.

그러나 다수 언론 보도와 구단 내 흐름, 감독의 구상 등을 종합할 때 손흥민의 이적은 단순한 가능성을 넘어 점점 구체화되고 있다.

곧 있을 프랑크 감독과의 면담 결과에 모든 관심이 쏠릴 예정이다.

사진=연합뉴스"
20250623,레버쿠젠 474억 폭발! '손흥민 COME BACK' 대환영…레비vs프랭크→쏘니 이적 두고 '충돌 예고',"사진=SNS
<저작권자(c) 연합뉴스, 무단 전재-재배포, AI 학습 및 활용 금지>
[스포츠조선 강우진 기자]손흥민의 분데스리가 복귀설이 들려오고 있다. 전 소속팀인 레버쿠젠이 손흥민에 관심이 있다는 소식이 알려졌다. 이번 이적 시장에서 다수의 전력을 잃을 것으로 예상되는 만큼 레버쿠젠 입장에서는 스타급 플레이어 영입을 환영할 수밖에 없다.

토트넘은 손흥민을 매각해 금전적인 이득을 취할 것이라는 전망까지 나왔다. 손흥민의 이적 소식은 아시아 지역 프리시즌 투어 이후 결정 날 것으로 보인다.

영국 토트넘 홋스퍼 뉴스는 21일(한국시각) ""손흥민은 토트넘과의 계약이 1년 남아 있으며, 사우디아라비아 이적설과 조세 무리뉴 감독과의 재회 가능성 등 여러 추측이 난무하고 있다""라고 보도했다.

사우디아라비아 프로리그의 알아흘리, 알나스르, 알카디시야가 손흥민에게 관심을 보이고 있으며, 이들 세 구단은 이적료로 4000만 유로(약 632억원)를 지불할 준비가 돼 있는 것으로 전해졌다.
사우디 리그를 제외하고 흥미 있는 이적설은 독일 분데스리가 바이엘 레버쿠젠이다. 손흥민이 토트넘으로 이적하기 전 몸담은 팀이 바로 이 레버쿠젠이다.

앞서 글로벌 매체 원풋볼은 이적시장 전문가 벤 제이콥스를 인용해 ""레버쿠젠이 토트넘 홋스퍼의 스타 손흥민 영입을 추진하고 있다""라고 전했다.

<저작권자(c) 연합뉴스, 무단 전재-재배포, AI 학습 및 활용 금지>
<저작권자(c) 연합뉴스, 무단 전재-재배포, AI 학습 및 활용 금지>
손흥민은 지난 2013년 레버쿠젠에 합류해 두 시즌 동안 활약했으며 총 87경기에서 29골 11도움을 기록했다.

레버쿠젠은 경험 많은 공격수를 원하고 있지만, 대부분의 포지션을 보강해야 하기에 막대한 이적료를 지급하기는 어려울 수도 있다.

매체는 ""레버쿠젠은 손흥민에게 연봉 3000만 유로(약 474억원)를 제안할 계획""이라며 ""손흥민이 중동행을 수락할지는 아직 불확실하다""라고 주장했다.

토트넘은 손흥민 매각에 최선을 다하고 있다. 올해 초 손흥민을 자유계약으로 내보내지 않기 위해 오는 2026년 6월까지 계약을 연장했다.

손흥민도 유럽축구연맹(UEFA) 유로파리그 우승컵을 들어 올린 뒤라 가장 이적에 열려 있다는 분석도 나온다.

다만 토마스 프랭크 감독은 부임 이후 인터뷰에서 ""젊은 선수들의 잠재력 극대화뿐만 아니라 경험 많은 선수들에게도 집중할 것""이라고 말했다. 프랭크 감독이 손흥민을 중심으로 다음 시즌을 준비하려 할 가능성이 있다.

손흥민의 매각을 원하는 다니엘 레비 토트넘 회장과 프랭크 감독 사이에서 이를 두고, 의견 충돌이 있을 수도 있다. 손흥민의 거취는 오는 8월 한국에서 열리는 뉴캐슬과의 프리시즌 경기 이후 결정될 것으로 보인다.

<저작권자(c) 연합뉴스, 무단 전재-재배포, AI 학습 및 활용 금지>
<저작권자(c) 연합뉴스, 무단 전재-재배포, AI 학습 및 활용 금지>
토트넘 홋스퍼 뉴스는 ""손흥민이 가진 글로벌 위상과 상업적 가치는 그의 미래 결정에 있어 레비 회장에게 복잡한 고민거리를 안긴다""라며 ""레비 회장은 손흥민이 구단에 얼마나 큰 수익을 안겨주는지를 직접 목격해 온 인물이다""라고 설명했다.

브라이언 킹 토트넘 전 스카우터는 한국에서의 친선경기 하나만으로도 토트넘은 100만 파운드(약 18억 원) 이상을 벌어들일 수 있다고 전망했다.

킹은 ""손흥민에 대한 보도 중 상당수는 성급한 판단이다. 그는 공개적으로 이적 의사를 밝힌 적이 없다. 아시아 투어에 출전해야 한다는 계약 조항이 있다면, 그것은 반드시 지켜져야 한다""라며 ""한국에서 열리는 뉴캐슬전은 손흥민 때문에 많은 관심을 받을 것이다. 관중들도 손흥민을 보기 위해 올 거다""라고 말했다.

무수히 많은 이적설이 있지만, 손흥민의 결정은 토트넘으로 기울 가능성이 크다. 구단 역시 팀의 확실한 레전드를 섣불리 매각하는 결정을 하기는 쉽지 않다.

손흥민은 2015년 토트넘에 입단한 이후 꾸준한 활약을 이어왔다. 모든 대회를 통틀어 454경기에 출전해 173골 101도움을 기록했다. 주장으로서 2024~2025시즌 UEFA 유로파리그 우승에 결정적인 기여를 하기도 했다."
20250623,"나폴리행 무산→크리스털 팰리스 차기 행선지로 새롭게 떠올라…이적 유력한 ‘골든보이’ 이강인, 韓 역대 20번째 EPL 입성하나","[골닷컴] 강동훈 기자 = ‘골든보이’ 이강인(24·파리 생제르맹·PSG)의 차기 행선지로 크리스털 팰리스가 새롭게 떠올랐다. 나폴리가 이강인 영입전에서 손을 떼는 분위기로 흘러가는 가운데 최근 크리스털 팰리스의 새 시즌 예상 베스트11에 이강인의 이름이 거론되면서다. 만약 이강인이 이번 여름 크리스털 팰리스로 이적하면서 잉글랜드 프리미어리그(EPL)에 입성하게 된다면, 역대 한국인으로는 20번째 EPL리거가 된다.

22일(한국시간) 현지 보도를 종합하면 당초 올여름 떠나는 듯했던 앙드레프랑크 잠보 앙기사가 여전히 본인이 안토니오 콘테 감독의 프로젝트에서 핵심이라고 생각하면서 잔류하기로 마음을 바꾸자, 나폴리는 영입 계획을 전면 수정했다. 나폴리는 이번 여름 앙기사가 떠나지 않는 이상 추가로 중원 보강을 하지 않을 생각이다. 자연스레 그동안 협상을 벌여온 이강인 영입에서는 완전히 손을 뗄 전망이다.

실제 나폴리는 1년 전부터 노렸던 이강인을 영입하기 위해 적극적으로 움직여왔다. PSG에 보너스를 포함해 이적료 3000~3500만 유로(약 474~553억 원)를 제안해 원칙적으로 구단 간 합의를 맺었고, 이강인에게 계약기간 5년에 연봉 500만 유로(약 79억 원)를 제안하면서 개인 합의를 남겨두고 있었다. 그러나 영입 계획이 바뀌면서 이강인 영입은 현재로선 ‘올 스톱’됐다.



나폴리행이 사실상 무산되는 쪽으로 기운 상황에서 공교롭게도 크리스털 팰리스가 이강인에게 관심을 가지기 시작했다. 크리스털 팰리스가 구체적으로 영입을 위해 움직임이 포착된 건 아니지만, 현지에선 크리스털 팰리스의 새 시즌 예상 베스트11에 이강인의 이름을 올리면서 크리스털 팰리스가 이강인을 영입을 추진할 수 있을 거란 전망을 전했다.

영국 매체 런던 월드는 “새 시즌 유럽축구연맹(UEFA) 유로파리그(UEL)에 출전하는 크리스털 팰리스는 바쁜 여름 이적시장을 보낼 예정”이라며 “올리버 글라스너 감독은 기존 핵심 선수들을 지키는 동시에 유럽 무대에서 경험 많은 선수들을 영입해 스쿼드를 강화하려할 것”이라고 보도하면서 다음 시즌 예상 어떤 베스트11을 전망했는데, 공격형 미드필더 자리에 이강인과 조 윌록을 올렸다.
만약 이강인이 크리스털 팰리스로 이적하게 된다면, 그는 역대 한국인으로는 20번째 EPL리거가 된다. 다만 황의조, 정상빈은 각각 노팅엄 포리스트와 울버햄프턴과 계약한 후 데뷔전 없이 임대 생활을 했고, 양민혁은 아직 토트넘 유니폼을 입고 공식 데뷔전을 치르지 못한 상태다. 윤도영은 브라이턴 앤 호브 앨비언으로 이적이 확정됐지만 곧바로 임대를 떠날 예정이다. 아울러 이청용에 이어 크리스털 팰리스에 입단한 두 번째 한국인이 된다.

지난 2023년 여름 마요르카를 떠나 PSG에 입단한 이강인은 우려와 달리 성공적으로 연착륙했다. PSG에 스타 플레이어들이 즐비한 터라 주전 경쟁이 험난해지면서 자칫 벤치를 지키는 시간이 많을 거란 우려와 달리 그는 첫 시즌 PSG가 모든 대회에서 53경기를 치르는 동안, 2023 항저우 아시안게임과 2023 카타르 아시안컵을 이유로 국가대표에 차출되는 경우가 많았음에도 36경기(선발 24경기)에 출전해 5골·5도움을 올렸다.



이강인은 두 번째 시즌도 전반기 동안엔 꾸준히 기회를 받으며 좋은 흐름을 이어갔다. 루이스 엔리케 감독은 ‘제로톱(가짜 9번 공격수)’부터 측면 공격수, 중앙 미드필더 등 이강인에게 여러 역할을 맡기며 기용했다. 다만 이강인은 첫 시즌과는 달리 확실한 인상을 남기지 못했고, 이런 와중에 지난겨울 크바라츠헬리아의 합류와 맞물려 주전 경쟁에서 완전히 밀려났다.

실제 엔리케 감독은 후반기 들어서 공격진을 꾸릴 때 크바라츠헬리아를 비롯해 우스만 뎀벨레와 브래들리 바르콜라, 데지레 두에만 중용했다. 이강인은 철저히 외면했다. 이강인은 중원에서도 자리가 없었다. 기동력 있고 많이 뛰는 미드필더를 선호하는 엔리케 감독은 비티냐, 주앙 네베스, 파비안 루이스를 붙박이 주전으로 고정하며 기용했다.

이렇다 보니 이강인은 겨울 휴식기(지난해 12월 24일부터 올해 1월 5일까지) 전까지 전반기 동안 PSG가 모든 대회에서 치른 23경기 가운데 23경기(6골·2도움)를 모두 뛰었다. 평균 출전시간으로 따져보면 56.5분. 하지만 후반기 들어서 PSG가 공식전 35경기를 치르는 동안 그는 22경기(4도움)밖에 뛰지 못했고, 평균 출전시간도 49.9분으로 감소했다. 특히 유럽축구연맹(UEFA) 챔피언스리그(UCL) 등 중요한 일전 때마다 기회를 받지 못했다.

사진 = 게티이미지, 소셜네트워크서비스(SNS) 캡처"
