date,title,content
20251128,"""유럽 복귀 없다"" 손흥민 귀국, 11년 만의 축구 없는 '크리스마스 휴가'→토트넘 팬들과 '작별 인사'…월드컵 '올인', ""겨울에 잘 쉴 것""","<저작권자(c) 연합뉴스, 무단 전재-재배포, AI 학습 및 활용 금지>
AP 연합뉴스
[스포츠조선 김성원 기자]축구 인생에서 잊지 못할 2025년을 보낸 손흥민(33·LA FC)이 귀국했다.

미국 메이저리그사커(MLS) LA FC에서 시즌을 마감한 손흥민은 27일 귀국, '비시즌' 휴식기에 들어갔다. 그는 2015년 여름 토트넘에 둥지를 튼 후 연말연시를 그라운드에서 보냈다. '박싱데이'를 전후로 살인적인 일정을 소화했다.
함부르크와 레버쿠젠, 독일 분데스리가 시절에는 겨울 브레이크가 있었다. 하지만 잉글랜드 프리미어리그(EPL)는 없다. 올해 토트넘에서 출발한 그는 프로 데뷔 후 첫 우승컵을 품에 안았다.

지난 5월 토트넘 주장으로 유로파리그에서 정상에 올랐다. 토트넘에는 2007~2008시즌 리그컵 정상 이후 17년 만의 환희를 선물했다. 유럽대항전은 1983~1984시즌 이후 41년 만의 우승이었다.

마침표였다. 손흥민은 8월 토트넘과의 10년 동행을 끝냈다. MLS에 둥지를 틀었다. MLS 역대 최고 이적료가 경신됐다. LA FC는 손흥민을 영입하는 조건으로 2650만달러(약 388억원)를 토트넘에 지급했다. 연봉은 1115만달러(약 163억원)로 2045만달러(약 299억원)인 리오넬 메시(인터마이애미) 그 다음이다.

AFP 연합뉴스
<저작권자(c) 연합뉴스, 무단 전재-재배포, AI 학습 및 활용 금지>
LA FC는 이미 그 효과를 봤다. 손흥민의 전과 후가 달랐다. LA FC의 존재감이 폭발했다. 그러나 손흥민의 2025년 여정은 23일(이하 한국시각) 멈췄다. 그는 밴쿠버 화이트캡스와의 2025년 MLS컵 플레이오프(PO) 서부 컨퍼런스 4강전서 만회골에서 이어 후반 추가시간 극장 동점골을 터트리는 원맨쇼를 펼쳤다. 2-2, 승부는 30분 연장 혈투에도 승부가 나지 않았다. 명암은 승부차기에서 엇갈렸다. 손흥민에게는 고통이었다. 그는 첫 번째 키커로 나섰지만 실축했고, LA FC는 3-4로 패했다.

비록 정상 등극에는 실패했지만 손흥민은 13경기에서 12골 4도움을 올리며 MLS를 완벽하게 접수했다. 그는 ""정말 환상적인 시즌이었다. 그러나 나는 우승 트로피를 들기 위해 여기에 왔다. 오늘은 원하는 결과를 얻지 못했지만 내년에는 우리가 치르는 모든 대회에서 성공하고 싶다""며 ""MLS라는 새로운 환경과 리그에 적응하면서 성장할 수 있는 기회였다. 나의 임팩트를 떠나 실망스러운 시즌이었다. 내년에는 좋은 모습으로 우승할 수 있는 컨디션을 만들어 돌아올 수 있는 것이 목표""라고 밝혔다.

비시즌 손흥민의 유럽 복귀설도 제기됐다. 영국의 '더선'은 '전 토트넘 주장 손흥민의 계약서에는 MLS 오프시즌 동안 유럽으로 복귀할 수 있는 조항이 포함돼 있는 것으로 전해졌다'고 단독 보도했다.

18일 서울월드컵경기장에서 열린 대한민국과 가나의 A매치 평가전. 경기 종료 후 손흥민이 팬들에게 인사를 건네고 있다. 상암=박재만 기자 pjm@sportschosun.com/2025.11.18/
14일 대전월드컵경기장에서 열린 대한민국과 볼리비아의 A매치 평가전. 손흥민이 프리킥 선제골을 터뜨리고 기쁨을 나누고 있다. 대전=허상욱 기자wook@sportschosun.com/2025.11.14/
이른바 '베컴 조항'이다. 잉글랜드의 레전드 데이비드 베컴은 2007년 LA 갤럭시로 둥지를 옮겼다. 당시 비슷한 조항이 있었다. 이 조항에 따라 그는 MLS 오프시즌 동안 AC밀란(이탈리아)에서 활약했다.

티에리 앙리도 MLS 계약에서 비슷한 조건을 따랐다. 2012년 뉴욕 레드불스가 앙리를 아스널에 임시로 임대한 바 있다.

그러나 손흥민이 직접 부인했다. 그는 11월 A매치 기간 '문스오층'과의 인터뷰에서 ""(시즌이 끝나면)잘 쉬어야한다. 많은 분들이 궁금해 하는데 루머가 나오는 것 자체가 많이 불편하고 팬들이 혼란스러울 수도 있다""며 ""항상 가지고 있는 신념, 생각, 마인드가 뛰고 있는 팀에 최선을 다하는 것이 중요하다. 루머는 사실이 아니다""고 밝혔다.

그리고 ""겨울에 어디를 간다고 다른 팀과 단 한 번도 그런 얘기를 한 적이 없다. 사실이 아니다. 구단에 실례가 될 수 있다. 이런 자리를 통해서 사실이 아니라고 말하고 싶다""고 강조했다.

손흥민이 MLS행을 선택한 이유는 자신의 마지막 월드컵이 될 수 있는 2026년 북중미월드컵 때문이다. 그는 ""월드컵에 포커스를 많이 맞추고 있다. 겨울에 잘 쉬고 6개월이라는 시간 동안 갖고 있는 최상의 컨디션을 만들어놓고 준비하고 싶다. 그래서 이런 선택을 했다""며 ""앞으로 이런 이야기가 많이 안 나왔으면 좋겠다. 나는 생각했던 것보다 클럽을 많이 애정하고 존중하고 있다. 내가 뛰고 있는 한 그런 일은 없을 거다""고 덧붙였다.

3일 서울월드컵경기장에서 열린 토트넘과 뉴캐슬의 경기, 손흥민이 헹가레를 받고 있다. 상암=허상욱 기자wook@sportschosun.com/2025.08.03/
다만 손흥민은 휴식기동안 영국 런던으로 날아가 토트넘 팬들과 '작별 인사'는 할 예정이다. 그는 이미 ""토트넘 마지막 경기가 한국에서 열렸다. 런던으로 돌아가 토트넘 팬분들을 만나고 싶다. 나도, 팬들도 직접 만나 작별 인사를 할 자격이 있다. 정말 감동적인 하루가 될 것 같다""고 했다.

토트넘 소식을 다루는 '스퍼스웹'은 26일 '손흥민이 토트넘 홋스퍼 스타디움을 방문한다'고 전했다. 구체적인 일정까지 나왔다. 12월 21일 리버풀전이 유력하다. '스퍼스웹'은 '토트넘은 손흥민을 위해 특별한 선물을 준비 중'이라며 '경기 전과 하프타임 동안 헌정 영상 등이 나올 예정'이라고 했다."
20251128,"'항명 논란' 발베르데, 직접 입 열었다… ""감독님은 항상 나를 지지""","[인터풋볼=김은성 기자] 레알 마드리드의 페데리코 발베르데가 항명 논란에 직접 입을 열었다.

최근 레알 마드리드의 분위기는 뒤숭숭하다. 지난 26일 영국 '기브미스포츠'는 ""주드 벨링엄을 포함한 7명의 레알 마드리드 선수들이 사비 알론소 감독 아래에서 행복하지 않다""고 밝혔다.

매체에 따르면 벨링엄 외에도 비니시우스 주니오르, 호드리구, 엔드릭, 발베르데, 브라힘 디아스, 페를랑 멘디가 명단에 올랐다.

발베르데의 이름도 포함됐다. 1998년생 우루과이 미드필더인 그는 풀백, 미드필더, 윙어를 모두 소화할 수 있는 다재다능함으로 높은 평가를 받아왔다. 그러나 매체에 따르면, 발베르데는 알론소 아래에서 보다 수비적인 역할을 맡는 것에 대해 불만을 가지고 있다. 실제로 알론소는 전문 오른쪽 풀백인 트렌트 알렉산더-아놀드와 다니 카르바할의 부상 기간 동안 발베르데를 풀백으로 자주 기용한 바 있다.



여러 논란에 발베르데가 직접 진화에 나섰다. 발베르데는 28일(이하 한국시간) 자신의 SNS를 통해 '항명 의혹' 이후 레알 마드리드 상황에 대한 성명서를 발표했다.

그는 ""우리에 대해 많은 말이 있었던 한 주가 지나고, 우리는 보다시피 어느 때보다 단합되어 있다. 팀이 비니시우스와 음바페를 보유한 것은 행운이지만, 세계 최고의 팀에서 헌신적인 동료들과 함께 뛸 수 있다는 건 큰 영광이다""라며 운을 뗐다.

이어 ""개인적인 차원에서, 나는 최고의 폼으로 돌아가기 위해 노력하고 있다. 감독은 항상 내 곁에 있고, 나를 지지하며 내가 팀을 도울 수 있도록 최선을 다하고 있다""며 알론소 감독과의 불화설을 일축했다.

마지막으로 ""항상 쉽지는 않지만, 스태프와 모든 선수들은 어느 때보다 끈끈하다""며 팀 분위기에 이상이 없음을 재차 강조했다.

내부 잡음에 시달린 레알 마드리드는 지난 27일 유럽축구연맹(UEFA) 챔피언스리그(UCL) 리그 페이즈 5라운드에서 올림피아코스에게 4-3 승리를 거두며 분위기 반전에 성공했다. 발베르데가 직접 나서서 불화설을 진화한 가운데, 레알이 그의 말대로 '끈끈하게' 뭉친 모습을 보여줄 수 있을지 주목된다."
20251128,"결국 손흥민도, 뮐러도 선택한 MLS 간다...마이애미가 영입 적극 검토→메시와 한솥밥 가능성","사진=게티이미지


[포포투=김아인]

티모 베르너가 인터 마이애미와 연결되고 있다.

독일 '빌트'는 27일(한국시간) ""베르너는 겨울 이적시장에 RB 라이프치히를 떠날 계획을 갖고 있다. 이제 그의 목표는 미국 메이저리그 사커(MLS)이며, 인터 마이애미 이적을 고려 중이다. 마이애미는 베르너 영입에 진지하게 검토 중일 가능성이 커지고 있다""고 보도했다.
베르너는 독일 출신이다. 슈투트가르트에서 성장했고 RB 라이프치히에서 최정상급 활약을 펼쳤다. 이후 2020-21시즌 첼시에 입단하면서 프리미어리그(PL)행이 성사됐지만, 부진하면서 통산 89경기 23골에 그쳤다. 라이프치히에 돌아와 공식전 40경기 16골 5도움을 기록해 반등을 모색했지만, 2023-24시즌 개막 후 전반기 동안 분데스리가 8경기 2골만을 남겼다.

겨울 동안 손흥민이 아시안컵 일정을 소화하면서 공백을 메우기 위해 임대 이적했다. 베르너는 토트넘 공격진에 잘 녹아들었다. 결정력 문제가 매번 고질적으로 해결되지 않았어도 연계, 속도, 침투 등 준수한 활약을 보였다. 하지만 두 번째 시즌은 실망스러웠다. 설상가상 잦은 부상까지 맞물려 공식전 27경기에서 EFL컵 단 1골만 남긴 채 라이프치히로 복귀했다.

여전히 미래가 어둡다. 이번 시즌에도 리그 1경기 1분 출전에 불과할 정도로 전력에서 아예 제외됐다. 내년 여름이면 계약이 만료되는데 번리, 리즈 유나이티드를 비롯해 유럽 여러 클럽 관심을 받았다. 뉴욕 레드불스가 영입을 시도한 것으로 알려졌지만 베르너의 높은 연봉 1000만 유로(약 160억 원)가 이적하는 데 발목을 잡았다. 

MLS행이 꾸준히 제기됐는데 이번엔 리오넬 메시가 뛰고 있는 마이애미다. '빌트'는 ""MLS는 2월에 새 시즌이 시작되기 때문에, 베르너는 새 팀과 함께 완전한 프리시즌을 소화할 수 있는 절호의 타이밍이다. 또한 그는 이번 여름 무적(실업자) 신분이 되는 상황을 반드시 피하고 싶어 한다""고 이야기했다.

마이애미로 간다면 메시와 한솥밥을 먹고, 손흥민, 토마스 뮐러 등 스타들과 맞대결을 펼칠 가능성이 생긴다. 특히 마이애미는 현재 지정 선수(MLS 샐러리캡 제한을 받지 않는 선수) 3자리에 등록된 메시, 조르디 알바, 세르히오 부스케츠 중 알바와 부스케츠가 시즌을 마치고 은퇴를 선언하면서 베르너를 영입할 자리도 생긴다. 토트넘 시절 동료였던 손흥민, 독일 대표팀 선배 뮐러에 이어 미국 무대로 향할지 지켜볼 일이다.

사진=게티이미지"
20251128,"""손흥민, 12월 토트넘 복귀 확정"" 英 매체 보도 나왔다…리버풀전서 성대한 이벤트→""작별인사 원해"" SON 소원 이뤄진다","토트넘 소식을 전하는 영국 매체 스퍼스웹은 지난 26일 '손흥민, 12월 토트넘 홋스퍼 복귀 확정. 특별 이벤트 계획'이라며 손흥민이 12월 중으로 토트넘에 복귀한다고 전했다. 매체는 '토트넘 팬들은 32세 손흥민에게 제대로 작별 인사를 할 기회를 갖지 못했다. 손흥민이 토트넘 소소속으로 출전한 마지막 경기는 구단의 한국 프리시즌 투어에서 치러졌기 때문'이라며 '지난달 손흥민은 토트넘 홋스퍼 스타디움에 돌아와 제대로 된 작별 인사를 하고 싶다고 밝혔고, 토트넘은 그의 소원을 이뤄줄 준비가 돼 있다'고 토트넘이 손흥민 복귀를 계획하고 있다고 덧붙였다. 엑스포츠뉴스DB


(엑스포츠뉴스 나승우 기자) 손흥민이 올 겨울 토트넘 홋스퍼로 복귀한다.

리버풀과의 경기에서 토트넘 홈 팬들 앞에 모습을 드러낼 전망이다.

토트넘 소식을 전하는 영국 매체 스퍼스웹은 지난 26일(한국시간) ""손흥민, 12월 토트넘 홋스퍼 복귀 확정. 특별 이벤트 계획""이라며 손흥민이 12월 중으로 토트넘에 복귀한다고 전했다.

매체는 ""토트넘은 손흥민이 북런던 클럽을 떠나 LAFC에 입단한 지 몇 달 만에 그의 소원을 이루기 위해 노력하고 있다""며 ""손흥민은 토트넘에서 10년간 환상적인 봉사를 했으며, 현대 토트넘의 가장 위대한 레전드 중 한 명으로 기록될 뿐만 아니라 프리미어리그 역사상 가장 위대한 아이콘 중 한 명으로 기억된다""고 했다.

그러면서 ""토트넘 팬들은 32세 손흥민에게 제대로 작별 인사를 할 기회를 갖지 못했다. 손흥민이 토트넘 소소속으로 출전한 마지막 경기는 구단의 한국 프리시즌 투어에서 치러졌기 때문""이라며 ""지난달 손흥민은 토트넘 홋스퍼 스타디움에 돌아와 제대로 된 작별 인사를 하고 싶다고 밝혔고, 토트넘은 그의 소원을 이뤄줄 준비가 돼 있다""고 토트넘이 손흥민 복귀를 계획하고 있다고 덧붙였다.

토트넘 소식을 전하는 영국 매체 스퍼스웹은 지난 26일 '손흥민, 12월 토트넘 홋스퍼 복귀 확정. 특별 이벤트 계획'이라며 손흥민이 12월 중으로 토트넘에 복귀한다고 전했다. 매체는 '토트넘 팬들은 32세 손흥민에게 제대로 작별 인사를 할 기회를 갖지 못했다. 손흥민이 토트넘 소소속으로 출전한 마지막 경기는 구단의 한국 프리시즌 투어에서 치러졌기 때문'이라며 '지난달 손흥민은 토트넘 홋스퍼 스타디움에 돌아와 제대로 된 작별 인사를 하고 싶다고 밝혔고, 토트넘은 그의 소원을 이뤄줄 준비가 돼 있다'고 토트넘이 손흥민 복귀를 계획하고 있다고 덧붙였다. 엑스포츠뉴스DB


이로써 지난 여름 한국 투어를 끝으로 팀을 떠나며 아쉬움을 남겼던 손흥민이 홈구장에서 팬들과 마지막 인사를 나누고 싶다던 소원을 이루게 될 것으로 보인다.

손흥민은 지난 8월, 10년간 몸담았던 토트넘을 떠나 미국 메이저리그사커(MLS) LAFC)로 이적했다. 당시 서울에서 열린 뉴캐슬 유나이티드와의 프리시즌 친선전이 손흥민의 고별전이 됐고, 손흥민은 10년을 함께 했던 런던 현지 팬들과 직접 작별 인사를 나누지 못한 것에 진한 아쉬움을 드러냈다.
지난 9월에는 한 인터뷰를 통해 ""개인적으로 토트넘 홋스퍼 스타디움에서 팬들에게 작별 인사를 하고 싶다""는 바람을 강하게 드러내기도 했다.

당시 손흥민은 그동안 이야기할 타이밍이 없었는데 이제는 말할 때가 된 것 같다. 그땐 이적과 관련된 일이 진행 중이었다. 한국에서 마지막 경기를 치렀지만 팬들에게 직접 작별 인사를 하지는 못했다""면서 ""런던으로 돌아가 팬들 앞에서 작별 인사를 하는 게 맞다고 생각한다. 팬들도 날 직접 보고 인사할 자격이 있다""고 말했다.

그러면서 ""그날이 오면 감정적으로 매우 특별할 것""이라고 기대했다.

토트넘 소식을 전하는 영국 매체 스퍼스웹은 지난 26일 '손흥민, 12월 토트넘 홋스퍼 복귀 확정. 특별 이벤트 계획'이라며 손흥민이 12월 중으로 토트넘에 복귀한다고 전했다. 매체는 '토트넘 팬들은 32세 손흥민에게 제대로 작별 인사를 할 기회를 갖지 못했다. 손흥민이 토트넘 소소속으로 출전한 마지막 경기는 구단의 한국 프리시즌 투어에서 치러졌기 때문'이라며 '지난달 손흥민은 토트넘 홋스퍼 스타디움에 돌아와 제대로 된 작별 인사를 하고 싶다고 밝혔고, 토트넘은 그의 소원을 이뤄줄 준비가 돼 있다'고 토트넘이 손흥민 복귀를 계획하고 있다고 덧붙였다. 토트넘 홋스퍼


손흥민의 바람은 생각보다 빠르게 현실이 됐다. 현 소속팀 LAFC가 최근 MLS컵 플레이오프에서 탈락하며 시즌을 마감했고, 손흥민은 휴식기를 이용해 12월 중으로 런던을 방문할 수 있게 됐다.

스퍼스웹은 손흥민이 오는 12월 21일 열리는 리버풀과의 프리미어리그 홈 경기에 맞춰 방문할 것이 유력하다고 전했다.

매체는 ""손흥민은 12월에 토트넘 팬들과 재회할 듯하다. 토트넘은 12월 홈 경기 중 하나를 위해 손흥민을 다시 초대할 계획이다. 12월 21일 리버풀과의 경기가 손흥민의 작별 인사가 진행될 가장 유력한 날짜로 거론되고 있다""고 설명했다.

토트넘 역시 레전드를 위한 성대한 예우를 준비하고 있는 것으로 알려졌다. 스퍼스웹에 따르면 토트넘은 리버풀전 경기 전 공식 프레젠테이션과 하프타임 헌정 행사를 통해 손흥민의 10년 헌신을 축하할 예정이며, 특별한 선물까지 마련한다는 계획이다.

손흥민은 팬들뿐만 아니라 10년간 함께 일했던 셰프, 경기장 관리자, 물리치료사, 분석가 등 구단 직원들과도 만나 감사를 전할 계획인 것으로 알려졌다.

토트넘 소식을 전하는 영국 매체 스퍼스웹은 지난 26일 '손흥민, 12월 토트넘 홋스퍼 복귀 확정. 특별 이벤트 계획'이라며 손흥민이 12월 중으로 토트넘에 복귀한다고 전했다. 매체는 '토트넘 팬들은 32세 손흥민에게 제대로 작별 인사를 할 기회를 갖지 못했다. 손흥민이 토트넘 소소속으로 출전한 마지막 경기는 구단의 한국 프리시즌 투어에서 치러졌기 때문'이라며 '지난달 손흥민은 토트넘 홋스퍼 스타디움에 돌아와 제대로 된 작별 인사를 하고 싶다고 밝혔고, 토트넘은 그의 소원을 이뤄줄 준비가 돼 있다'고 토트넘이 손흥민 복귀를 계획하고 있다고 덧붙였다. 연합뉴스


토트넘이 이 정도로 손흥민을 환대하려는 이유는 손흥민이 21세기 구단 레전드 중 한 명이기 때문이다.

2015년 독일 바이엘 레버쿠젠에서 이적한 손흥민은 지난 시즌까지 10년간 토트넘에서 뛰며 454경기 173골 101도움이라는 경이적인 성적을 남겼다.

아시아 선수 최초로 프리미어리그 득점왕에 올랐고, 국제축구연맹(FIFA)가 선정하는 한 해 최고의 골인 푸스카스상도 수상했다. 토트넘 구단 최초의 비유럽인 주장이라는 타이틀까지 얻으며 명실상부 21세기 최고의 레전드 중 한 명으로 거듭났다.

특히 지난 5월 주장 완장을 차고 유럽축구연맹(UEFA) 유로파리그 우승컵을 들어올리며 17년간 지긋지긋하게 이어져오던 토트넘의 '무관' 딱지를 뗐다.

10년간 팀에 헌신하고도 지난 여름 현지 팬들과 작별 인사를 하지 못했던 손흥민이 마침내 북런던에서 팬들과 뜨거운 작별을 고할 준비가 착착 진행되고 있다.

사진=엑스포츠뉴스DB / 토트넘 홋스퍼 / 연합뉴스"
20251128,"제2의 아놀드 실패, 'HERE WE GO' 확인...레알 마드리드 현명하다! 리버풀 수비 부진 원흉 관심 철회","[인터풋볼=신동훈 기자] 최근 부진을 봤던 걸까. 레알 마드리드는 이브라히마 코나테 관심을 철회했다.

'HERE WE GO' 기자로 유명한 파브리시오 로마노는 28일(이하 한국시간) ""레알은 리버풀에 코나테 영입을 하지 않을 거라고 말했다. 2026년 여름에 리버풀과 계약이 만료되는 코나테를 영입하기 위해 레알은 노력했지만 끝내 영입을 하지 않기로 했다. 코나테는 리버풀과 재계약 협상을 하고 있는데 아직 결정된 건 없다""고 전했다.

코나테는 이번 여름 트렌트 알렉산더-아놀드에 이어 또 자유계약(FA) 신분으로 리버풀을 떠나 레알로 떠나는 걸 노렸다. 코나테는 프랑스 국가대표 센터백으로 소쇼몽벨리아르에서 성장했고 2017년 라이프치히로 이적해 본격적으로 빅리그에서 능력을 증명했다. 압도적인 피지컬로 경합에서 상대를 제압하고 속도에서 밀리지 않는 모습으로 찬사를 받았다.

라이프치히 주전 센터백으로 뛰던 코나테는 리버풀로 이적했다. 건재한 버질 반 다이크 짝이 필요했던 리버풀에 코나테는 최고의 영입이었다. 코나테는 반 다이크와 센터백 라인을 구축해 지난 시즌 프리미어리그 우승에 결정적 활약을 했다.

레알이 러브콜을 보냈다. 딘 하위선 영입 이후에도 새로운 센터백 수급을 노리는 레알은 다비드 알라바, 안토니오 뤼디거와 결별하고 코나테를 노렸다. 가브리엘 마갈량이스, 윌리엄 살리바 등도 타깃이었는데 아스널과 재계약을 맺었다. 리버풀은 코나테를 보낼 의사가 없었고 계약은 무산됐는데 내년 여름, 코나테가 리버풀과 계약이 만료될 때 떠날 수 있다는 소식이 전해졌다.



제2의 아놀드가 될 수 있었는데 레알은 코나테의 올 시즌 부진을 지켜봤다. 코나테는 리버풀 수비 부진 원흉으로 지목된다. 지난 PSV 아인트호벤과의 유럽축구연맹(UEFA) 챔피언스리그(UCL)에서도 부진하면서 비난을 받았다. 영국 '리버풀 에코'는 ""전반에는 좋은 태클을 선보였는데 끔찍한 실수로 3번째 실점을 내줬다""고 평점 3만 부여했다. 리버풀 팬들은 ""이제 코나테에게 지쳤다"", ""코나테는 끔찍하다"" 등의 반응을 내놓았다. 영국 '풋볼 365'는 ""코나테 슬럼프는 걱정스럽다. 쿠하이브 드리우에크에게 3번째 실점을 당한 장면에서 코나테 모습은 정말 처참했다. 리버풀 경력을 치욕적으로 끝낼 수 있다""고 했다.

레알은 다른 타깃으로 선회할 듯 보인다. 리버풀은 공짜로 내보내지 않기 위해 재계약을 하려고 하나, 현재 활약을 보면 코나테를 거액의 이적료를 주고 데려갈 팀은 없어 보인다."
