date,title,content
20250704,"'20번째 우승' 리버풀, '충격 사망' 조타 등번호 20번 '영구 결번'…""잔인하게도 화려한 마무리"" [오피셜]","(엑스포츠뉴스 김정현 기자) 충격적인 사망 소식을 전한 디오구 조타의 등번호 20번이 영구 결번된다. 

리버풀은 4일(한국시간) 공식 채널을 통해 교통사고로 사망한 디오구 조타의 등번호 20번을 영구 결번한다고 발표했다. 

구단은 ""잔인하게도 조타의 축구 인생 마지막은 프리미어리그 챔피언과 유럽축구연맹(UEFA) 네이션스리그 우승이라는 화려한 순간으로 장식되었다. 그의 등번호로 사용된 20번은 리버풀의 2024-2025 시즌 프리미어리그 우승과 함께 팀의 20번째 리그 우승에 기여한 그의 공헌을 기리기 위해 영구 결번될 예정""이라고 전했다. 

이날 스페인 매체 '마르카'는 ""조타가 현지시각 3일 오전 사모라 지방에서 교통사고로 사망했다""고 전했다. 조타는 향년 28세, 축구 선수로 전성기를 보내야 하는 나이에 세상을 떠났다. 



매체는 ""조타와 그의 동생 안드레의 사고는 사모라주 사나브리아에 있는 A-52 도로 베나벤테 방향으로 시속 65km로 달리던 도중 발생했다""라며 ""두 사람이 탄 차량은 도로 중앙 분리대에서 화재가 발생한 도로에서 출구에 충돌로 사망했다""라고 전했다. 

이어 ""112에 신고한 목격자에 따르면, 차량은 불타오르면서 중앙분리대로 화재가 옮겨갔다. 여러 사람들은 차량의 타이어 중 하나가 터졌고 이로 인해 도로 밖으로 이탈해 불이 붙었을 수 있다고 지적했다""고 밝혔다. 



영국 BBC도 ""스페인 경찰은 조타와 동생이 탄 람보르기니가 앞 차량을 추월하는 과정에서 타이어 하나가 터지면서 도로에서 이탈했고 이후 화재가 발생했다고 알렸다""라면서 구체적인 상황을 전했다. 

조타는 오랜 시간 만난 루테 카르도소와 11일 전 결혼식을 올렸고 슬하에 3명의 자녀도 두고 있다. 그는 지난달 22일 자신의 인스타그램에 결혼식 사진을 올렸다. 

조타의 소속팀 리버풀은 처참한 마음을 드러냈다. 



리버풀은 공식 채널을 통해 ""구단은 조타의 비극적인 주금으로 너무나 큰 충격에 빠졌다. 구단은 조타와 그의 형제 안드레가 함께 스페인에서 교통사고를 당한 후 사망했다는 통보를 받았다""라고 알렸다. 

이어 ""구단은 이 시간 이후로 추가로 성명을 내지 않을 것이며 조타의 가족, 친구, 동료, 그리고 구단 스태프들이 상상할 수 없는 상실감을 감당하려고 노력하고 있기 때문에 프라이버시 보호를 요청한다. 우리는 계속해서 그들에게 전폭적인 지원을 제공할 것""이라고 덧붙였다. 
포르투갈 축구협회도 ""협회와 포르투갈 축구계 전체는 오늘 아침 스페인에서 디오구와 안드레의 사망으로 큰 충격을 받았다. 국가대표팀에서 A매치 50경기 가까이 뛴 디오구 조타는 훌륭한 선수 그 이상의 존재였으며 모든 동료와 상대 선수들에게 존중받는 특별한 사람이었다. 전염성 있는 기쁨과 좋은 평판을 가진 사람이었다""라고 전했다. 

그러면서 포르투갈 협회는 유럽축구연맹(UEFA) 여자 유로 2025에서 포르투갈과 스페인의 경기를 앞두고 UEFA에 묵념을 요청했다. 



1996년생인 조타는 곤도마르, 파코스 페레이라 유스팀을 거쳐 2015년 1월 프로로 데뷔했다. 이후 2016년 여름 아틀레티코 마드리드(스페인)로 이적하면서 빅리그에 입성했다. 

다만 FC포르투(포르투갈), 울버햄튼 원더러스(잉글랜드) 임대를 거치면서 아틀레티코에서 뛰지는 않았다. 

특히 울버햄튼에서 맹활약하면서 주목받은 조타는 2018년 여름 울버햄튼에 완전이적하면서 프리미어리그에서 활약을 이어가기 시작했다. 

2020년에는 4470만유로(약 716억원)의 이적료로 리버풀로 이적하면서 프리미어리그 빅클럽에 입성했고 5년간 활약했다. 

리버풀에서 조타는 지난 2024-2025시즌 프리미어리그 우승을 비롯해 2021-2022시즌 FA컵과 리그컵을 동시에 들어 올렸고 이 시즌 UEFA 챔피언스리그 준우승 멤버이기도 했다. 조타는 리버풀 통산 182경기를 출전해 65골을 넣었다. 



조타와 함께 감독 생활을 한 위르겐 클롭 감독도 ""정말 힘든 순간이다. 반드시 더 큰 목적이 있을 것이다. 하지만 나는 이를 볼 수 없다. 디오구는 환상적인 선수일 뿐 아니라 훌륭한 친구였고 사랑스럽고 다정한 남편이자 아빠였다. 우리는 그가 너무나 그리울 것""이라고 전했다. 

조타의 전 소속팀 울버햄튼도 ""우리는 가슴이 아프다. 디오구는 우리 팬들에게 사랑받았고 팀 동료들에게도 그랬으며 그와 함께 일한 모든 사람들에게 소준한 존재였다""라며 ""그가 만든 추억들은 영원히 잊혀지지 않을 것이다. 우리의 마음은 디오구의 가족, 친구, 그가 사랑하는 사람들에게 향할 것""이라고 헌사했다. 

조타는 포르투갈 대표로도 A매치 49경기 14골을 기록했다. 특히 지난 6월 8일 UEFA 네이션스리그에서 스페인을 꺾고 우승을 차지했는데 이 결승전이 그의 공식전 마지막 경기로 기록됐다. 



사진=연합뉴스, 마르카"
20250704,"'손흥민 LAFC 이적 논의' 드디어 행선지 결정? ""토트넘 떠날 기회...영입 위한 작업 진행 중""","토트넘 홋스퍼 캡틴 손흥민. /사진=게티이미지코리아


[STN뉴스] 반진혁 기자 | 손흥민이 드디어 행선지를 결정한 걸까?

영국 매체 '더 부트 룸'은 3일 ""LAFC가 손흥민과 이적에 대해 논의했다. 영입을 위한 작업을 진행하는 중이다""고 전했다.

이어 ""손흥민은 토트넘 홋스퍼를 떠날 큰 기회를 잡았다. 올리비에 지루가 떠나면서 LAFC는 한 자리가 생겼다""고 덧붙였다.

'풋볼 런던'에 따르면 손흥민은 미국 메이저리그 사커(MLS)에서 뛰는 것에 관심이 이다. 사우디아라비아 리그도 영입을 원하고 있다.

그러면서 손흥민이 지난 10년 동안 구단을 이끈 만큼 토트넘은 매각하기보다 직접 미래를 결정하도록 둘 것이라고 전망했다.

손흥민에게 관심이 있는 MLS 클럽은 LAFC라는 소식이 흘러나오기도 했다.

LAFC는 토트넘에서 함께했던 휴고 요리스가 있으며 엔제 포스테코글루 감독이 지휘봉을 잡을 예정이라는 보도가 나오는 중이다.

포스테코글루 감독은 토트넘 사령탑 부임 후 손흥민을 주장으로 선임하는 등 사이가 각별했다.

손흥민은 포스테코글루가 토트넘을 떠날 때 ""토트넘의 궤도를 변경했다. 단 한 순간도 흔들리지 않았다. 수십 년만에 가장 좋은 밤을 보냈다. 평생 이 추억을 가지고 갈 것이다""고 포스테코글루 경질과 관련한 입장을 밝혔다.

이어 ""리더십을 가까이서 배울 수 있다는 건 놀라운 특권이었다. 영원히 토트넘의 전설이다. 감사했다""며 안녕을 고하기도 했다.

토트넘 홋스퍼 캡틴 손흥민. /사진=게티이미지코리아


손흥민은 시즌 종료 후 이적설로 몸살을 앓는 중이다.

토마스 프랭크 감독이 지휘봉을 잡아 사령탑이 바뀌는 등 여러 가지 부분이 손흥민의 거취에 영향을 줄 것으로 보인다.

손흥민의 직전 시즌 기량 하락을 주장하며 곱지 않은 시선이 많았던 것도 시즌 종료 후 이적설이 제기된 이유다.

영국 매체 '텔레그라프'는 ""손흥민의 방출을 고려할 때다. 토트넘에서 선발 출격 자격이 있는지 의문을 제기하는 것에 점점 더 타당하게 느껴진다. 이제 자리를 위협받고 있다""고 입지가 위태롭다고 언급했다.
영국 공영방송 'BBC'까지 가세했는데 ""손흥민은 더 이상 토트넘에 없어서는 안 될 선수가 아닌 듯하다""고 언급했다.

이어 ""토트넘이 손흥민을 바꾸는 건 상상도 할 수 없는 일이었다. 하지만, 이번 시즌은 예전만큼 빠르거나 날카롭지 않다. 영향력은 점점 약해지고 있으며, 속도도 떨어지고 있다""며 기량 하락을 주장했다.

영국 매체 '풋볼 런던'의 기자 골드는 ""토트넘의 프랭크 감독은 손흥민에게 선택권을 줄 것이다. 스스로 미래를 결정할 수 있다""고 전했다.

영국 매체 '스포츠 몰'은 '더 부트 룸'의 보도를 인용해 ""손흥민이 새로운 팀을 찾을 수도 있다는 걸 토마스 프랭크 감독은 인지했고 몇 주 내로 행보에 대해 논의할 예정이다""고 전했다.

이어 ""손흥민이 토트넘을 떠나기로 선택한다면 프랭크 감독은 말리지 않을 것이다""고 덧붙였다.

토트넘 팬 사이트 '스퍼스 웹'은 토트넘, 뉴캐슬 유나이티드 출신으로 축구 해설가로 활동 중인 크리스 와들이 손흥민에 대해 언급한 내용을 공개했다.

와들은 ""손흥민은 토트넘에서 훌륭한 선수였다. 모든 선수에게 유통기한이 있다. 프리미어리그(EPL)는 빠르고 피지컬이 좋아야 한다. 다른 리그로 가는 것이 맞다""고 말했다.

이어 ""토트넘도 손흥민의 이적을 막지 않을 것이다""고 덧붙였다.

토트넘 홋스퍼 캡틴 손흥민. /사진=게티이미지코리아


손흥민의 행선지로는 사우디아라비아가 꾸준하게 거론되는 중이다.

영국 매체 '토크스포츠'는 ""손흥민에게 관심을 표명한 사우디아라비아 3개 클럽이 있다. 알 아흘리, 알 나스르, 알 카디시아다. 영입을 위해 4,000만 유로(약 630억)를 지불할 준비가 됐다""고 전했다.

영국 매체 '텔레그라프'는 ""손흥민의 방출을 고려할 때다. 토트넘에서 선발 출격 자격이 있는지 의문을 제기하는 것에 점점 더 타당하게 느껴진다. 이제 자리를 위협받고 있다""고 입지가 위태롭다고 언급했다.

영국 공영방송 'BBC'까지 가세했는데 ""손흥민은 더 이상 토트넘에 없어서는 안 될 선수가 아닌 듯하다""고 언급했다.

이어 ""토트넘이 손흥민을 바꾸는 건 상상도 할 수 없는 일이었다. 하지만, 이번 시즌은 예전만큼 빠르거나 날카롭지 않다. 영향력은 점점 약해지고 있으며, 속도도 떨어지고 있다""며 기량 하락을 주장했다.

토트넘 홋스퍼 캡틴 손흥민. /사진=게티이미지코리아


하지만, 토트넘이 당장 손흥민을 매각할 수 없다는 분위기다.

토트넘은 오는 7월 대한민국에 방문해 뉴캐슬 유나이티드와 친선경기를 치른다. 홍콩 등 아시아 투어에 나서는 것이다.

토트넘 입장에서는 손흥민을 포기할 수 없다. 수익 등 흥행 보증 수표이기에 필수 참석이라는 조항이 있을 것이라는 전망이 지배적이다.

영국 '더 선'에 따르면 손흥민이 뉴캐슬 유나이티드와의 경기에 무조건 출전해야 한다는 조건이 계약에 포함됐다. 그렇지 않으면 스폰서와 관계, 재정적 측면에서 손해를 입을 수 있다. 프리시즌 투어 이후 이적이 본격화될 것이다.

'토트넘 홋스퍼 뉴스'는 축구 재정 전문가인 댄 플럼리와의 인터뷰를 통해 손흥민의 이적설을 조명했다.

플럼리는 토트넘의 다니엘 레비 회장이 손흥민에게서 마지막 한 푼까지 짜낼 것인지 묻는 질문에 ""물론이다""고 답했다.

이어 ""토트넘이 왜 손흥민을 붙잡아두려고 하는지 알 수 있을 것이다. 계약에 출전 의무가 있다면 투어 이후 이적을 논의하는 건 전혀 놀랍지 않다""고 덧붙였다.

토트넘 홋스퍼 캡틴 손흥민. /사진=게티이미지코리아


STN뉴스=반진혁 기자"
20250704,"""영원히 기억될 것"" 조타의 NO.20, 리버풀 구단 최초 영구결번 지정... 사망 소식에 팬들도 추모 물결","[스타뉴스 | 이원희 기자]
디오고 조타. /AFPBBNews=뉴스1
""디오고 조타는 영원히 기억될 것이다.""

리버풀과 포르투갈 대표팀 공격수 조타는 3일(한국시간) 스페인 팔라시오스 데 사나브리아 지역 A-52 지점에서 발생한 교통사고로 인해 목숨을 잃었다. 향년 29세. 너무나도 어린 나이다. 조타와 함께 있던 그의 동생 안드레도 사망했다.

스페인 문도 데포르티보는 ""조타가 휴가기간 중 발생한 교통사고로 동생과 함께 사망했다""면서 ""새벽 1시경 그들의 차량은 도로를 이탈했고, 조타와 그의 동생이 타고 있던 차량은 화재가 발생해 불길에 휩싸였다. 구조대원과 의료진이 현장에 투입됐지만 조타와 안드레의 사망을 확인했다""고 전했다.
조타의 소속팀 리버풀은 큰 충격에 빠졌다. 리버풀 구단은 곧바로 입장문을 발표해 애도의 뜻을 전했다. 리버풀은 ""팀 승리를 이끌었던 조타가 영원히 잠들었다""면서 ""조타는 꾸준히 팀을 위해 골과 도움을 올리며 위르겐 클롭 감독, 아르네 슬롯 감독 모두에게 신뢰를 받았다. 지난 2023년 4월 토트넘전에서 극장골을 넣었고, 경기장 밖에서는 존경과 사랑을 받는 팀 동료였다. 안타깝게도 조타의 축구 인생 마지막은 잉글랜드 프리미어리그(EPL) 우승, 또 유럽축구연맹(UEFA) 네이션스리그 우승으로 화려하게 마무리됐다""고 전했다.

조타가 리버풀에서 달았던 등번호 20번은 영구결번으로 지정됐다. 리버풀 구단 역사상 최초 있는 일이다. 리버풀은 ""조타가 사용했던 등번호 20번은 2024~2025시즌 리버풀의 20번째 리그 우승에 공헌한 그를 기리기 위해 영구결번될 것""이라면서 ""조타는 지난 4월 머지사이드 더비에서 승리를 확정짓는 골을 넣으며, 팬들 앞에서 골 세리머니를 선보였다. 조타 인생의 마지막 골로서 더욱 가슴 아픈 의미를 가진다""고 회상했다.

디오고 조타(오른쪽). /AFPBBNews=뉴스1
조타는 잉글랜드 프리미어리그(EPL) 수준급 공격수 평가를 받았다. 울버햄튼에서 좋은 활약을 펼친 뒤 2020년 리버풀 유니폼을 입었다. 선발과 슈퍼조커 역할을 겸하며 리버풀 공격진을 이끌었다. 2024~2025시즌에도 조타는 리그 26경기에서 6골 3도움으로 활약했다. 덕분에 리버풀도 구단 역대 20번째 리그 우승을 차지했다.

앞서 조타는 ""수년간 꿈꿔왔던 우승을 세계 최고의 리그에서, 또 제가 어릴 때부터 상상했던 곳에서 이뤄냈다. 특별한 시즌을 성공적으로 마무리한 것을 영원히 소중히 간직할 것""이라면서 ""제게는 놀라운 성과였고, 이런 순간을 맞이했다는 것이 믿기지 않는다""고 말했다. 그만큼 리버풀 선수로서 진심을 보여줬다.

조타의 사망 소식에 리버풀 팬들의 추모 물결도 이어졌다. 리버풀 홈구장 안필드 주변에는 조타의 유니폼, 꽃다발이 놓여졌다. 리버풀 역시 ""리버풀 팬들의 응원가에서 항상 울려 퍼졌던 '그의 이름은 디오고'라는 구절은 영원히 기억될 것""이라고 다시 한 번 애도를 표했다.

디오고 조타를 추모한 축구 팬들. /AFPBBNews=뉴스1"
20250704,"""나의 훌륭한 동료이자 친구"" 비극 앞에서 리버풀의 분노가 잠시 꺼졌다...조타 추모한 아놀드 ""영원한 나의 20번""","▲ ⓒ아놀드 SNS


[스포티비뉴스=장하준 기자] 비극 앞에서 분노가 잠시 꺼졌다.

리버풀 소속이자, 포르투갈 국가대표 공격수인 디오고 조타는 지난 3일(한국시간) 스페인 사모라 주에서 발생한 교통 사고로 목숨을 잃었다. 동승자인 그의 동생 안드레 조타도 함께였다.
현지 매체들에 따르면, 조타가 탄 람보르기니의 타이어가 운행 중 터졌고, 그의 차량은 도로를 이탈했다. 그리고 화재가 발생하며 조타는 생을 마감했다.

생각지도 못한 소식에 온 축구계가 슬픔에 잠겼다. 리버풀은 공식 홈페이지를 통해 조타를 애도했다. 이어 맨체스터 유나이티드, 맨체스터 시티 등 프리미어리그 클럽들이 추모했다.

선수들도 마찬가지였다. 함께 포르투갈 국가대표로 활약했던 크리스티아누 호날두는 비통한 마음을 감추지 않았다. 리버풀 선수들도 마찬가지였다. 불과 지난 시즌 프리미어리그 우승을 함께 차지했던 조타가 세상을 떠나자 고통스러워했다.

여기에 더해 올여름 리버풀을 떠나 레알 마드리드로 이적한 트렌트 알렉산더 아놀드도 본인의 사회관계망서비스(SNS)에 조타를 향한 추모글을 올렸다.

아놀드는 ""소중한 사람을 떠나보냈다는 것을 받아들이기 위해 머리와 마음이 고군분투할 때, 어떤 말을 해야할지 모르겠다. 조타, 너의 가족은 너의 그 자체였다. 너의 와이프와 아이들, 부모님을 생각하면 가슴이 아프다. 형제이자 가장 친한 친구였던 동생 안드레를 생각해도 마찬가지다. 조금이라도 덜 고통스러운 순간이 온다면 환하게 웃으며 너를 기억하고 싶다. 많은 웃음과 행복한 순간들을 함께 했고, 너는 정말 훌륭한 동료이자 친구였다. 영원한 나의 20번, 편히 쉬어 디오고""라고 말했다.

이처럼 아놀드가 눈물 나는 추모글을 게시하자, 리버풀 팬들의 분노가 잠시 꺼졌다. 리버풀 성골 유스 출신인 아놀드는 리버풀을 향한 충성심을 오랫동안 드러내왔다. 하지만 올여름 이적료 없이 레알 마드리드로 이적하며 리버풀 팬들을 분노하게 했다. 일부 팬은 아놀드의 유니폼을 불태우는 등 화를 직접적으로 표출했다. 덕분에 아놀드는 리버풀 역사상 최악의 배신자로 거듭났다.

하지만 조타의 비극 앞에서는 아무런 의미가 없었다. 리버풀 팬들은 아놀드의 SNS에 비판 댓글 대신 슬픔을 공감하며 분노를 멈췄다. 그렇게 모두가 참담한 심정이었다."
20250704,"英 BBC 보도에 日 충격에 빠졌다, 결국 '아스날 방출' 임박한 핵심 수비수","[스타뉴스 | 김명석 기자]
아스날과 계약 해지가 임박한 일본인 수비수 도미야스 다케히로. /AFPBBNews=뉴스1
잉글랜드 프리미어리그(EPL) 아스날에서 뛰고 있는 일본인 수비수 도미야스 다케히로(27)가 결국 팀에서 방출된다. 잦은 부상 탓에 경기 출전 시간이 줄어들자, 결국 남은 계약을 해지한다는 현지 보도가 나온 것이다. 공신력이 높은 현지 매체 보도에 일본 매체들도 발 빠르게 관련 소식을 전하는 중이다.

영국 공영방송 BBC는 4일(한국시간) ""부상에 시달리던 도미야스가 결국 아스날 생활을 마무리한다. 구단과 상호 합의로 계약을 해지하고 팀을 떠날 예정""이라며 ""도미야스는 지난 시즌 단 6분만 출전한 뒤 무릎 수술을 받고 회복하고 있다. 원래 계약은 다음 시즌까지지만, 결국 양 측이 계약 해지 합의에 이르렀다""고 전했다.
지난 2021년 이탈리아 볼로냐를 떠나 아스날에 입단한 도미야스는 센터백뿐만 아니라 양 측면 풀백까지 소화가 가능해 많은 주목을 받았다. EPL 데뷔 시즌인 2021~2022시즌부터 세 시즌 연속 리그 21경기 이상 출전하며 백업 역할을 수행했지만 지난 시즌 부상 때문에 리그 단 1경기, 그것도 단 6분 출전 기록만 남긴 채 사실상 한 시즌을 통으로 날렸다.

이적 전문 사이트 트랜스퍼마르크트에 따르면 아스널 입단 이후 부상으로 전열에서 이탈한 횟수만 무려 8경기다. 특히 지난 시즌엔 무릎 부상만 무려 두 차례 당했고, 결국 지난 2월 수술대에 올라 오는 10월 복귀할 예정이다. 결국 아스날과 도미야스는 남은 동행에 의미가 없다고 보고 계약 해지에 합의했다. 당초 계약은 내년 6월까지에 1년 연장 옵션이 있었다.

아스날과 계약 해지가 임박한 일본인 수비수 도미야스 다케히로. /AFPBBNews=뉴스1
대표팀 핵심 수비수이기도 한 도미야스의 아스날 방출 소식이 BBC를 통해 전해지자 일본 현지에서도 충격에 빠진 모양새다. 축구매체 사커킹은 ""BBC 보도에 따르면 도미야스가 아스날을 퇴단할 가능성이 커지고 있는 것 같다. 2026년 6월까지인 계약을 합의하에 해지하고 떠날 가능성이 농후해졌다""며 ""최근 거듭 부상에서 시달리던 그는 결국 지난 시즌 단 6분 출전에 그쳤다. 결국 수술대에 오른 그는 재활 프로그램을 포함한 회복 프로세스를 연말까지 진행할 예정이었다""고 전했다.

또 다른 매체 풋볼존도 ""부상에 시달리던 도미야스가 결국 아스날 커리어에 종지부를 찍을 것이 분명해졌다고 보도했다""며 ""도미야스는 올해 말 복귀를 목표로 재활 중이었고, 새 시즌 완전한 부활이 기대됐지만 결국 계약 해지로 퇴단하는 게 확정 수순이 됐다""고 보도했다.

조만간 아스날 구단 차원의 공식 발표가 있을 것으로 보이는 가운데, 잦은 부상 이력 탓에 EPL은 물론 유럽 무대 잔류 여부는 매우 불투명하다. EPL 통산 기록은 4시즌 65경기 2골 3도움이다. 현지 보도에 따르면 사우디아라비아 구단들이 선수 에이전트 측과 접촉한 것으로 알려져 중동행 가능성이 거론된다.

아스날과 계약 해지가 임박한 일본인 수비수 도미야스 다케히로. /AFPBBNews=뉴스1"
20250704,"""분데스리가는 나의 꿈""→경쟁 밀린 홍현석, 이강인 이어 프랑스서 뛸까...낭트가 '완전 영입' 관심","사진=게티이미지


[포포투=김아인]

분데스리가에서 자리를 잡지 못한 홍현석이 낭트의 관심을 받고 있다.

독일 '스카이 스포츠'에서 활동하는 데니스 바이어 기자는 4일(한국시간) 자신의 SNS를 통해 ""낭트가 홍현석에게 공식 제안을 보냈다. 낭트는 홍현석을 완전 영입하고 싶어 한다. 마인츠가 그를 내보낼지는 불확실하다. 그는 2028년까지 계약되어 있다""고 소식을 전했다.
홍현석은 대한민국의 미드필더다. 울산 HD 유스 출신인 그는 어린 나이에 유럽 진출이 성사되면서 독일 3부 리그 소속 운터하잉에서 프로 경력을 시작했다. 이후에는 오스트리아 LASK로 완전 이적했고, 유니오즈에서 다시 임대 생활을 하다가 돌아왔다. 리그 23경기 출전과 유럽축구연맹(UEFA) 유로파 컨퍼런스리그(UECL) 무대를 밟으면서 성장을 거듭했다.

지난 2022-23시즌부터는 벨기에 무대에서 활약하기 시작했따. 헨트로 이적하면서 팀 핵심으로 자리 잡았고, 벨기에 주필러 리그 31경기에서 5골 6도움을 올렸다. 지난해 생애 첫 한국 국가대표팀 데뷔전도 치르면서 2023 카타르 아시안컵에도 다녀왔고, 2023 항저우 아시안게임에서는 3골을 기록하면서 금메달 주역이 됐다. 

지난해 여름 마인츠에 입단하면서 분데스리가 1부에 입성했다. 마인츠는 400만 유로(약 60억 원)로 구단 역사상 6번째 코리안리거를 품게 됐고, 이재성과 함께 한솥밥을 먹게 됐다. 홍현석은 오피셜 직후 ""세계 최고의 리그인 독일 분데스리가에서 뛰는 건 나의 꿈이었다. 이적하기 전 (이)재성이 형과 많은 대화를 나눴다. 내가 마인츠로 간다고 하니 매우 기뻐했고, 환영해줬다""라며 기대감을 드러내기도 했다.

사진=마인츠


하지만 주전 경쟁은 험난했다. 초반엔 기회를 잡았지만 파울 네벨, 아르민도 지프 등에게 밀려나면서 벤치를 지키기 시작했다. 보 헨릭슨 감독은 공개적으로 ""홍현석은 몸싸움과 경합에서 더 적극적이어야 한다""고 말하면서 홍현석에게 개선점을 원하기도 했다. 홍현석은 2024-25시즌 23경기에서 4번의 선발 출전을 기록했고, 0골 1도움으로 시즌을 마쳤다.

다음 시즌엔 프랑스로 떠날 가능성이 떠올랐다. 낭트는 리그앙에서 중위권에 꾸준히 들고 있는 명문 구단이다. 리그앙 우승 8회, 트로페 데 샹피옹 우승 2회, 쿠프 드 프랑스 우승 4회에 빛난다. 분데스리가보다 낮게 평가되지만 유럽 빅리그 팀인 점에서 홍현석이 충분히 경쟁력을 발휘할 수 있다. 파리 생제르맹(PSG) 소속 이강인이 이적 가능성이 있어 다음 시즌 맞대결이 성사될지는 가능성이 낮아 보이지만, 홍현석이 이강인 다음으로 리그앙에서 뛰는 코리안리거가 될 수 있다.

#포포투 코리안리거 소식"
