date,title,content
20250918,"'승승승승승승승승승승무무승승무승승무승승' 손흥민 떠나도 대기록 이어진다...""토트넘, UEFA 대회 홈 21경기 무패행진""","[OSEN=고성환 기자] 어느덧 유럽축구연맹(UEFA) 주관 대회 홈 21경기 무패다. 토트넘 홋스퍼가 손흥민(33, LAFC)이 떠난 뒤에도 홈에서 강한 면모를 이어가고 있다.

토트넘은 17일(한국시간) 영국 런던의 토트넘 홋스퍼 스타디움에서 열린 2025-2026시즌 유럽축구연맹(UEFA) 챔피언스리그(UCL) 리그 페이즈 1차전에서 비야레알을 1-0으로 꺾었다.

단 한 골이 승부를 갈랐다. 전반 4분 베리발이 우측에서 골문 앞으로 크로스를 올렸다. 어려운 공은 아니었지만, 2001년생 골키퍼 루이스 주니오르가 제대로 처리하지 못하면서 자기 골문 안으로 밀어넣고 말았다.

주니오르의 자책골은 그대로 결승골이 됐다. 양 팀 모두 90분 내내 이렇다 할 기회를 만들지 못했다. 심지어 유효 슈팅도 토트넘 쪽에서 단 하나가 나온 게 전부였다. 비야레알은 후반 들어 반격에 나서봤으나 골문 안으로 공을 찰 수조차 없었다. 경기는 그대로 토트넘의 1-0 승리로 끝났다.





비록 공격은 답답했지만, 토트넘으로선 뜻깊은 승리였다. 3시즌 만에 돌아온 UCL 무대 복귀전에서 승점 3점을 챙기는 데 성공했기 때문. 토마스 프랭크 감독도 생애 단 한 번 있는 UCL 데뷔전을 승리로 장식했다. 반면 4시즌 만에 돌아온 비야레알은 아쉬운 패배를 받아들여야 했다.

경기 후 프랭크 감독은 '아마존 프라임'을 통해 ""승리했을 때는 그 승리를 기뻐하고 감사해야 한다는 걸 다시 느꼈다. 좋은 점이 많았다. 우리는 정말 잘 수비했고, 수준 높은 비야레알을 상대로 거의 기회를 내주지 않았다""라고 만족감을 드러냈다.
또한 프랭크 감독은 ""공격적으로는 최고 수준에는 미치지 못했다. 후반전에 한동안 '공은 비야레알 선수들에게 주고, 우리는 달려서 다시 막자'라는 식으로 경기한 시간대도 있었다. 아주 재미있는 일이었지만. 아주 팽팽한 경기였고, 우리가 근소하게 이겼다""라고 되돌아봤다.

경기 최우수선수(POTM)로 선정된 베리발도 벅찬 감정을 전했다. 그는 ""우선 승점 3점을 따낸 게 정말 중요하다. 우리는 진정한 '클린시트 멘탈리티'를 만들어냈고, 그 부분에서 훌륭하게 해냈다. 좋은 경기였다""라며 ""어렸을 때부터 챔피언스리그에서 뛰는 게 꿈이었다. 홈에서 팬들 앞에서 승리하는 건 정말 믿을 수 없을 정도로 놀라운 기분""이라고 밝게 웃었다.



한편 토트넘은 이번 승리로 대기록을 이어갔다. UEFA 주관 대회에서 홈 기준 21경기째 패배를 잊었다. 2022-2023시즌 UCL 16강, 지난 시즌 손흥민과 함께 일궈낸 UEFA 유로파리그 우승에 이어 2025-2026시즌 UCL을 승리로 시작하며 안방에서 강한 모습을 이어갔다.

축구 통계 매체 '스쿼카'는 ""토트넘은 최근 UEFA 대회에서 홈 21경기 무패 행진을 달리고 있다. 승승승승승승승승승승무무승승무승승무승승""이라며 토트넘의 무패 기록을 조명했다.

유독 유럽대항전만 나가면 홈 극강을 자랑 중인 토트넘. 스쿼카는 ""이 기간 토트넘은 56골을 넣었고, 13골만 실점했다. 무실점 클린 시트 경기는 11번이나 된다. 토트넘 홋스퍼 스타디움은 요새와 같다""라고 강조했다.

수비 안정화는 이룬 만큼 공격에서 실마리만 찾으면 되는 프랭크호다. 프랭크 감독은 기자회견에서 ""이 팀, 이 선수들, 우리는 골을 넣을 거다. 의심의 여지가 없다. 오늘은 자책골이 전부였지만, 우리는 득점할 것""이라고 다짐했다.

/finekosh@osen.co.kr

[사진] 스쿼카, 토트넘 소셜 미디어."
20250918,"'英 BBC도 충격 분석' 에이스 손흥민 제발 돌아와...'NEW 슈퍼스타'도 못 채운 빈자리 ""토트넘, 아직 갈 길이 멀다""→""득점력 떨어져""","사진=트위터 캡처
로이터연합뉴스
로이터연합뉴스
[스포츠조선 이현석 기자]토트넘이 올 시즌 좋은 시작을 알렸지만, 여전히 갈 길이 멀다. 문제는 역시나 공격이다.

토트넘은 올여름 손흥민과 이별했다. 지난 10년 동안 팀 공격의 한 축을 책임졌던 에이스를 떠나보냈다. 손흥민은 토트넘과 유로파리그 우승을 차지하고, 재계약 대신 아름다운 작별을 택했다.

손흥민이 떠나고 토트넘은 고민이 커질 수박에 없었다. 해리 케인의 이적 후 채우지 못했던 공백도 여전한 상황에서 손흥민의 빈자리까지 대체해야 했다. 여름 이적시장에서 모건 깁스화이트를 시작으로 여러 선수를 노리며 공백을 최소화하려고 했고, 결국 모하메드 쿠두스, 사비 시몬스, 랑달 콜로 무아니를 데려오며 공격진을 보강했다.

로이터연합뉴스
다만 손흥민의 공백은 쉽게 채울 수 없었다. 토트넘은 올 시즌 답답한 경기에서 공격을 풀어줄 선수가 아직은 부족한 모습이다. 리그 본머스전 패배 당시에도 빈공과 함께 0대1 패배를 경험했다. 그간 답답했던 순간마다 득점으로서 해결사 면모를 보여준 손흥민의 부재가 드러난 순간이었다.

이러한 아쉬움은 최근 유럽챔피언스리그 경기 후 평가에서도 등장했다. 영국의 BBC는 18일(한국시각) '프랭크의 토트넘은 좋은 출발을 보였지만, 여전히 득점 기회가 드물다'라고 보도했다.

토트넘은 17일 영국 런던의 토트넘홋스퍼스타디움에서 열린 비야레알과의 2025~2026시즌 유럽챔피언스리그(UCL) 리그 스테이지 1차전 경기에서 1대0으로 승리했다. 다만 득점은 자책골이 전부였고, 토트넘의 공격은 여러 차례 위협적인 모습을 보여주지 못하며 아쉬움이 컸다. 유효 슈팅이 한 개에 그칠 정도였다.

로이터연합뉴스
BBC는 '토트넘은 또 한 번 무실점 승리를 따냈다. 이는 드문 일이다. 5경기에서 4승을 거둔 것은 매우 좋은 시작이다. 하지만 세트페스와 실수를 제외하면 골과 골 기회가 여전히 드물다. 몇 주 안에 토트넘이 정기적으로 상대 팀을 공격하는 모습을 본다면 좋을 것이다. 토트넘은 많이 발전했지만, 아직 갈 길이 멀다. 슛을 하지 않고, 골을 넣는 것을 항상 기대할 수는 없다'고 했다.

프랭크 감독 또한 이런 부분을 인정했다. 그는 ""공격적으로 창의성에 어려움을 겪었다. 그럼에도 큰 승리다. 어느 대회든 승리하고 출전하는 것은 중요하다. UCL은 믿을 수 없을 정도로 힘들다. 상대는 강팀이고, 힘든 경기를 승리로 마무리할 수 있었다""고 평가했다.

한편 손흥민은 토트넘을 떠나 미국으로 이적한 이후 LA FC 소속으로 2경기 연속골을 터트리며 득점력을 제대로 자랑했다.

손흥민의 빈자리가 여전히 남아있는 토트넘, 올 시즌 안에 그 자리를 채우고 공격에서도 단단한 모습을 보여줄지도 귀추가 주목된다."
20250918,"'내 골보다 흥민이 형이 먼저'…손흥민 美 입성 최초 해트트릭, 부앙가 역대급 배려로 '완성'","사진=LAFC


[포포투=박진우]

손흥민의 해트트릭 뒤에는 데니스 부앙가의 배려가 있었다.

LAFC는 18일 오전 10시 30분(한국시간) 미국 유타주 솔트레이크 시티에 위치한 아메리카 퍼스트 필드에서 열린 2025 미국 메이저리그사커(MLS) 서부 컨퍼런스 20라운드에서 레알 솔트레이크에 4-1 대승을 거뒀다.

지난 14일 열린 산호세 어스퀘이크스전에서 '53초 선제골'을 만든 손흥민. 엄청난 임팩트를 보였던 만큼, 솔트레이크전 활약상도 기대됐다. 스티브 체룬돌로 감독은 손흥민과 부앙가의 위력을 극대화하기 위해 3-5-2 포메이션을 들고 나왔다.
손흥민은 이번에도 경기 시작과 함께 득점포를 가동했다. 정확히 경기 시작 2분 5초 만에 득점포를 가동했다. 전반 2분 빈 공간을 빠르게 침투하던 손흥민에게 침투 패스가 전달됐다. 손흥민은 골키퍼와의 일대일 상황에서 침착한 오른발 슈팅으로 골망을 흔들었다.

여기서 끝나지 않았다. 불과 14분 뒤에 멀티골을 완성했다.  전반 16분 박스 바깥 '손흥민 존'에 손흥민이 위치했다. 이후 오른쪽 골문을 보며 오른발로 감았고, 공은 그대로 골망을 갈랐다. 손흥민이 전반 16분 만에 멀티골을 폭발시키며 2-0을 만들었다.

동료들도 손흥민의 '해트트릭'을 바라봤다. 계속해서 손흥민에게 공을 밀어줬고, 손흥민은 이전 경기와는 다르게 과감하게 슈팅을 시도하며 해트트릭을 완성하려 했다. 후반 11분에는 또다시 '흥민존'에서 왼발 감아차기를 시도했지만 아쉽게 골대를 맞고 흘렀다.

마침내 손흥민이 해트트릭을 달성했다. 그 뒤엔 부앙가의 역대급 배려가 있었다. 후반 27분 좋은 침투로 박스 우측에서 골키퍼와 일대일 기회를 만든 부앙가. 부앙가는 계속해서 고개를 돌리며 반대편으로 침투하는 손흥민의 위치를 확인했다.

상대 수비들이 손흥민을 마크하기 위해 전력질주했다. 부앙가가 그대로 슈팅하면 득점이 나올 수 있었다. 그러나 부앙가는 손흥민 주위에 수비가 있는 상황에서도, 손흥민에게 패스를 내줬다. 결국 손흥민이 공을 잡아내고 침착한 슈팅으로 골망을 갈랐다.

손흥민의 해트트릭을 만든 부앙가. 그는 곧바로 손가락으로 '3'을 그리며 손흥민의 해트트릭을 축하했다. 손흥민이 85분을 소화하고 경기장을 빠져 나간 뒤, 완벽한 일대일 찬스에서 경기에 마침표를 찍는 쐐기골을 터뜨렸다. 결국 경기는 LAFC의 4-1 대승으로 끝났다.

경사 중에 경사였다. 손흥민은 미국 입성 최초로 해트트릭을 달성했다. 부앙가는 마지막 쐐기골로 카를로스 벨라를 넘어 LAFC 구단 역사상 최다 득점자에 이름을 올렸다. 손흥민과 부앙가, '흥부 듀오'가 역사를 작성한 날이었다.

사진=게티이미지


#포포투 코리안리거 소식"
20250918,‘골골골골!’ 이강인 ‘35분 활약+패스 정확도 93%’ PSG는 ‘득점 축제’ 아탈란타에 4-0 완승[UCL.리뷰],"이강인. AFP연합뉴스


18일. 아탈란타전 완승을 거둔 후 기뻐하는 이강인과 PSG 선수들. 로이터연합뉴스


‘파리 생제르맹(PSG)이 아탈란타에 완승을 거뒀다.

이강인은 후반전 교체 투입 후 총 35분 활약해 승리에 이바지했다.

루이스 엔리케 감독이 이끄는 PSG는 18일(한국시간) 프랑스 파리에 있는 파르크 데 프랭스에서 열린 2025-2026시즌 유럽축구연맹(UEFA) 챔피언스리그 리그 페이즈 1차전 아탈란타와 맞대결에서 4-0으로 승리했다.
홈팀 PSG는 4-3-3 포메이션을 가동했다. 뤼카 슈발리에, 누누 멘데스, 윌리안 파초, 마르퀴뇨스, 아슈라프 하키미-파비안 루이스, 비토르 페헤이라, 주앙 네베스-브래들리 바르콜라, 세니 마율루, 흐비차 크바라트스켈리아가 선발 출전했다.

원정팀 아탈란타는 3-4-1-2 전략을 준비했다. 마르코 카르네세키-베라트 짐시티, 아이작 히엔, 오딜롱 코수누-로렌조 베르나스코니, 유누스 무사, 마르텐 드 룬, 라울 벨라노바-마리오 파샬리치-다니엘 말디니, 샤를 데 케텔라에르 선발 명단에 이름을 올렸다.

선취골을 터트린 마르퀴뇨스. AP연합뉴스


224-2025시즌 UEFA 챔피언스리그 1라운드 PSGvs아탈란타. 로이터연합뉴스


PSG가 경기 초반 선취골을 터트렸다. 전반 3분 프리킥 상황에서 루이스 패스를 마르퀴뇨스가 상대 페널티 박스 안에서 오른발로 슈팅해 득점으로 연결해 PSG가 1-0으로 앞서갔다. 이후 전반 5분 멘데스의 슈팅을 카르네세키 골키퍼가 막아냈다.

PSG는 아탈란타를 강하게 몰아붙였다. 전반 6분 마유루의 슈팅이 수비에 막혔다. 그리고 2분 후 전반 8분 이번에는 바르콜라가 박스 중앙에서 오른발로 슈팅했고 카르네세키 골키퍼가 다시 선방해 팀을 위기에서 구했다. 또 전반 21분 흐비차의 패스를 받은 루이스가 득점을 노렸지만, 이번에도 카르네세치 골키퍼가 이를 허용하지 않았다.

아탈란타도 반격했다. 전반 27분 파샬리치가 헤더로 동점골을 노렸지만, 골대 상단으로 넘어갔다. 반대로 PSG가 격차를 벌렸다. 전반 36분 우측면에서 하키미가 넘겨준 패스를 흐비차가 박스 밖에서 오른발로 슈팅해 골망을 흔들었다. 이후 양 팀 추가득점 없이 전반전 PSG가 2-0으로 앞선 상황으로 종료됐다.

PSG에 추가골을 안겨준 흐비차. AFP연합뉴스


아탈란타에 득점 후 기뻐하는 PSG 선수들. AP연합뉴스


전반전 2실점을 허용한 아탈란타는 후반 시작하자마자 교체 카드를 사용했다. 케텔라에르, 말디니를 빼고 라자르 사마르지치, 니콜라 크르스토비치를 투입해 공격진에 변화를 줬다.

PSG가 다시 경기 초반 득점포를 가동했다. 후반 6분 바르콜라가 멘데스에게 공을 넘겼다. 멘데스는 왼쪽에서 어려운 각도에도 불구하고 왼발로 슈팅해 왼쪽 아래 구석 골망을 흔들었다. PSG가 3-0으로 앞서갔다.

여유가 생긴 PSG도 교체 카드를 사용했다. 후반 10분 루이스, 마유루 대신 자이르 에머리와 이강인을 기용했다. 그리고 후반 13분 네베스를 빼고 곤살루 하무스를 그라운드에 투입했다.

7분 후인 후반 30분 양 팀이 다시 변화를 줬다. PSG는 멘데스와 흐비차를 대신 일리야 자바르니, 이브라힘 음바예를 투입했다. 아탈란타는 무사와 짐시티 대신 마르코 브레샤니니, 조르지오 스칼비니를 선택해 만회골을 노렸다.

하지만, 상황은 좀처럼 변하지 않았다, PSG의 일방적인 공격이 이어졌다. 아탈란타는 후반 39분 스칼비니가 부상으로 다시 나가고 오네스트 아이오르를 그라운드로 올렸다. 하지만, 후반 45분 하무스가 박스 중앙에서 왼발 슈팅으로 득점을 만들어 경기의 마침표를 찍었다. PSG의 4-0 승리로 경기 종료됐다.

용환주 기자 dndhkr159@kyunghyang.com"
20250918,"'손흥민 첫 해트트릭 아깝다' 흥민존 왼발 감아차기 골대 불운…LAFC, 솔트레이크에 2-0 리드 (후반 진행)","사진=게티이미지


[포포투=박진우]

손흥민의 회심의 왼발 감아차기가 골대를 맞혔다.
LAFC는 18일 오전 10시 30분(한국시간) 미국 유타주 솔트레이크 시티에 위치한 아메리카 퍼스트 필드에서 열린 2025 미국 메이저리그사커(MLS) 서부 컨퍼런스 20라운드에서 레알 솔트레이크에 2-0으로 앞서며 후반 진행 중이다.

LAFC는 3-5-2 포메이션을 내세웠다. 손흥민, 부앙가, 틸만, 세구라, 델가도, 슈아니에르, 홀링스헤드, 타파리, 팔렌시아, 포티어스, 요리스가 선발 출전했다.

솔트레이크는 4-4-2 포메이션을 가동했다. 크루스, 올라툰지, 루나, 오제다, 에넬리, 고조, 카트라니스, 베라, 글래드, 예들린, 마르티노가 선발로 나섰다.

[전반전] 손흥민 MLS 첫 멀티골 폭발…2분 5초 선제골, 16분만 멀티골

손흥민이 정확히 경기 시작 2분 5초 만에 득점포를 가동했다. 전반 2분 빈 공간을 빠르게 침투하던 손흥민에게 침투 패스가 전달됐다. 손흥민은 골키퍼와의 일대일 상황에서 침착한 오른발 슈팅으로 골망을 흔들었다. 손흥민이 2분 만에 선제골을 넣으며 LAFC가 1-0 리드를 잡았다.

이로써 손흥민은 지난 14일 열린 산호세 어스퀘이크스전 53초 선제골을 작렬한 뒤, 솔트레이크전에서는 2분 5초 만에 선제골을 넣으며 날아 올랐다.

손흥민이 또 터졌다. 전반 16분 박스 바깥 '손흥민 존'에 손흥민이 위치했다. 이후 오른쪽 골문을 보며 오른발로 감았고, 공은 그대로 골망을 갈랐다. 손흥민이 전반 16분 만에 멀티골을 폭발시키며 2-0을 만들었다. MLS 진출 이후 첫 번째 멀티골이었다.

동료들도 손흥민의 '해트트릭'을 바라고 있는 듯한 모습이었다. 전반 24분 역습 상황, 우측면에서 패스를 이어받은 부앙가가 박스 뒷편에 있는 손흥민을 향해 정확한 컷백 크로스를 내줬다. 손흥민은 곧바로 오른발 슈팅을 연결했지만 아쉽게 수비벽에 막혔다.

이후 LAFC는 안정적인 경기 운영을 가져갔다. 추격을 시도하는 솔트레이크를 상대로 아래로 내려 앉으며 차분하게 공격을 틀어 막았다. 추가골은 나오지 않았고, 전반은 LAFC의 2-0 리드로 끝났다.

[후반전] 손흥민 회심의 왼발 감아차기 골대 불운...LAFC, 2-0 리드 중

LAFC가 안도의 한숨을 내쉬었다. 후반 9분 홀링스헤드가 박스 안에서 올라툰지의 발을 걸어 반칙을 범했다. 주심은 곧바로 페널티킥을 선언했다. 키커로 나선 올라툰지가 요리스를 속이고 우측 골문으로 슈팅했는데, 공은 골대를 맞고 요리스 쪽으로 흘렀다.

손흥민이 골대 불운에 시달렸다. 후반 11분 손흥민이 박스 바깥에서 수비를 제친 뒤, 전매특허 왼발 감아차기를 시도했다. 공은 좌측 골문 구석으로 향했지만, 아쉽게 골대를 맞고 흘렀다. 해트트릭을 노리던 손흥민이었기에 아쉬울 따름이었다.

사진=게티이미지


#포포투 코리안리거 소식"
20250918,"""0-2→3-2. 충격, 충격 또 충격"" 포스테코글루, '1도움→2기점, 포스트 손흥민' 엄지성에 당했다…노팅엄, 2부 스완지 극장 역전패→데뷔승 또또 실패","로이터 연합뉴스
로이터 연합뉴스
사진캡처=BBC
[스포츠조선 김성원 기자]노팅엄 포레스트의 지휘봉을 잡은 엔제 포스테코글루 감독이 '이변의 희생양'으로 전락했다.

'포스트 손흥민'을 꿈꾸는 엄지성(스완지시티)이 새 시즌 첫 공격포인트인 1도움을 기록하며 포스테코글루 감독에게 대충격을 안겼다. 노팅엄은 14일(이하 한국시각) 영국 스완지의 스완지닷컴 스타디움에서 열린 챔피언십(2부) 스완지시티와의 2025~2026시즌 잉글랜드 카라바오컵(리그컵) 3라운드에서 2대3으로 역전패하며 조기 탈락했다.
출발은 좋았다. 노팅엄은 전반 15분과 전반 추가시간인 46분 이고르 제주스의 연속골을 앞세워 2-0으로 리드했다.

그러나 후반 집중력이 흐트러지며 다잡은 승리를 놓쳤다. 스완지의 역전쇼는 후반 23분 시작됐다. 엄지성의 코너킥 도움을 받은 카메론 버지스가 만회골을 터트렸다.

정규시간은 후반 45분에서 멈췄다. 경기는 이대로 끝날 것 같았다. 그 순간 기적의 문이 열렸다.

후반 48분이었다. 엄지성이 기점이었다. 왼쪽 측면에 볼을 잡은 엄지성이 리암 컬렌에게 연결했다. 컬렌의 크로스를 잔 비포트니크가 볼 방향을 바꿔 동점골을 터트렸다.

포스테코글루 감독은 망연자실한 표정을 지었다. 끝이 아니었다. 후반 52분 엄지성이 또 시발점이었다. 엄지성의 코너킥을 상대 수비가 헤더로 걷어냈다. 흘러나온 볼을 에단 갈브라이스가 회심의 중거리포로 응수했다. 볼은 골대를 맞고 다시 나왔다. 만회골의 주인공 버지스가 지체없이 왼발 슈팅으로 연결, 역전 결승골을 작렬시켰다. 포스테코글루 감독은 현실이 아닌 듯 고개를 흔들며 충격에 빠졌다.

노팅엄은 9일 토트넘에서 손흥민(LA FC)과 유로파리그 우승을 합작한 포스테코글루 감독을 새 새령탑으로 선임했다. 그러나 그는 13일 노팅엄 감독 데뷔전인 아스널과의 잉글랜드 프리미어리그(EPL) 4라운드에서 0대3으로 완패했다.

리그컵에서도 첫 승에 실패했다. 2경기 연속 3골을 헌납하는 굴욕으로 출발부터 적신호가 켜졌다. 포스테코글루 감독은 ""우리는 경기를 끝냈어야 했고, 그렇게 할 수 있는 기회는 많았다. 그러나 몇몇 결정이 우리에게 유리하지 않았다""며 ""경고 신호를 알아채야 했지만 선수들이 조금은 안일했다. 경기가 자연스럽게 그렇게 끝날 거라고 생각했고, 그로 인해 큰 대가를 치렀다. 개선해야 하는 부분""이라며 고개를 숙였다.

로이터 연합뉴스
로이터 연합뉴스
스완지시티가 극적으로 16강에 진출했다. 포스테코글루 감독은 ""우리가 컵 대회에서 다음 라운드로 진출하고 성공할 수 있는 좋은 기회였지만, 그것을 놓친 것은 매우 실망스럽다. 하지만 아무것도 바뀌지 않는다. 우리는 개선해야 할 부분이 있다는 걸 알고 있다""고 강조했다.

그는 이어 ""일부 경기에서는 긍정적인 면을 볼 수도 있지만, 궁극적으로 가장 중요한 요소는 우리가 정말로 발전했어야 할 시기에 컵 대회에서 탈락했다는 것이다. 발전할 기회를 놓쳤다는 걸 깨달았을 때 그 모든 게 사라져 버린다""면서도 ""괜찮다. 나에 대한 문제가 아니라 클럽에 대한 문제다. 우리가 발전하고 진정한 성공을 거둘 수 있는 환경을 만드는 것이 중요하다""고 덧붙였다.

엄지성은 풀타임을 소화했고, 최고의 밤을 보냈다."
