date,title,content
20250626,"사실상 ‘판매 불가’ 선언! ‘손흥민, 1000억에 판다’...천문학적 가격 붙은 이유? “스타성+리더십+실력 모두 갖춘 대체자 없다”","X 캡처


손흥민의 이적설이 끊임없이 나오고 있다. 확실한 건 토트넘 홋스퍼가 그를 매각하는 순간 다음 시즌 많은 것을 잃는다.

토트넘 소식을 전하는 ‘토트넘 홋스퍼 뉴스’는 지난 25일(한국시간) “다니엘 레비 토트넘 회장이 손흥민과 계약을 파기 후 돈을 짜낼 수 있다”고 밝혔다.
이어 “손흥민이 이번 여름 팀을 떠나든 아니든 가장 큰 화제가 될 선수다. 그는 직전 시즌(2024-2025) 유럽축구연맹(UEFA) 유로파리그를 우승하며 10년 만에 토트넘에서 우승컵을 들었다”며 “하지만 손흥민과 토마스 프랭크 토트넘 감독 사이 긴장감이 흐르고 있고 미래가 불확실하다”고 했다.

그리고 “토트넘은 곧 한국으로 프리시즌을 떠난다. 정보에 따르면 손흥민은 의무출전 조항이 있다. 한 경기만에 토트넘에 100만 파운드(약 19억원) 수익을 안겨줄 수 있다”고 주장했다.

출처 : 게티이미지



토트넘 홋스퍼 뉴스는 축구 재정 전문가 댄 플럼리와 단독 인터뷰도 공개했다.

그는 “레비는 손흥민을 이적시키기 전까지 최대한 수익을 뽑아낼 것이다. 특히 정말 손흥민 의무출전 조항이 있다면 그건 토트넘이 손흥민을 왜 잡아두려고 하는지 알 수 있다”고 말했다.

또 “토트넘은 한국을 여러 방문했다. 손흥민을 통해 얻는 브랜드 연계를 모르는 것도 아니다”라며 “선수의 경기장 밖 요인이 절대적으로 중요하다. 손흥민에게 이적 제안을 올 수 있다. 다만, 그는 여전히 리더십과 능력을 갖췄다”고 설명했다.

마지막으로 “손흥민이 쇠퇴의 조짐을 보였지만, 토트넘은 젊은 선수들을 이끌 위대한 인물이 필요하다. 또 다음 시즌 UEFA 챔피언스리그에 나선다. 그는 프랭크 감독에게 가장 큰 효과를 안겨줄 수 있는 선수”라고 덧붙였다.

출처 : 게티이미지


손흥민은 이번 여름 그 어느 때보다 이적 가능성이 열려있다.

손흥민은 1992년생으로 지금 32살이다. 다음 달에 33살이 된다. 미래를 책임질 수 있는 선수가 아니다. 실력 또한 하락하고 있다.

손흥민은 직전까지 8시즌 연속 프리미어리그에서 10득점 이상을 터트렸다. 이번 시즌 9시즌 연속 두 자릿수 득점 기록을 이어 나갈 예정이었지만, 7득점에 그쳤다.

그의 공격력이 하락하고 있는 가운데, 토트넘과 다가오는 2026년 6월 계약이 끝난다. 구단은 선수와 계약 기간이 끝나서 자유 계약(FA) 신분이 되면 이적료를 받을 수 없다. 올여름이 결별 적기다.

출처 : 트랜스퍼마크트 캡처


현재 손흥민의 몸값을 계속 하락하고 있다. 독일 이적시장 전문 사이트 ‘트란스퍼마르크트’에 따르면 지난 5월 30일 기준, 현재 손흥민 추정 몸값은 2000만 유로(약 313억원)다. 지난 3월 18일까지 3000만 유로(약 469억원)였는데, 크게 하락했다.

하지만 토트넘은 손흥민을 해당 가격이 판매할 생각이 없다. 플럼리는 토트넘 홋스퍼 뉴스와 인터뷰를 통해 자신이 생각했을 때 토트넘은 손흥민을 훨씬 비싸게 판매할 것이라고 예상했다.

플럼리는 “최근 이적시장에서 선수 몸값은 부풀려졌다. 사우디 구단들이 이런 현상에 이바지했다. 토트넘은 손흥민의 몸값으로 최소 4000만 파운드(약 739억원)를 부를 것이다. 더 높은 가격을 정했을 수도 있다”며 “손흥민과 이별하면 단순히 선수 한 명 잃는 게 아니다. 최대한 높은 이적료를 요구해야 할 것이다. 5000만 파운드(약 923억원) 이상 원할지도 모른다”고 설명했다.

출처 : 게티이미지



토트넘이 손흥민을 비싸게 판매하는 이유는 ‘시장 가치’ 때문이다. 손흥민의 대에 접어들고 공격 포인트가 눈에 띄게 하락했다. 그러나 그의 스타성은 구단에 큰 수익을 안겨준다.

영국 최고 권위 유력지 ‘더 타임즈’는 “사우디 리그가 특정 국가 스타를 영입하는 데 집중하고 있다. 이는 전 세계 시청자들에게 TV 중계권을 판매하는 데 도움이 된다”며 “손흥민은 과거에 사우디 리그 이적 제안을 거절했지만, 지금은 구단을 떠나는 것에 대해 더 열린 마음을 가진 것으로 알려졌다”고 했다.

마지막으로 “토트넘은 손흥민과 상업적 가치 때문에 2026년보다 더 긴 계약을 맺길 원했지만, 그는 거절했다”고 덧붙였다.

손흥민은 토트넘을 대표하는 스타다. 구단에 많은 수익을 안겨주고 있고 주장으로서 선수단을 이끌고 있다. 그를 매각하면 구단 수익은 물론 선수단을 이끌 경험 많은 리더의 부제가 생긴다.

당장 손흥민 수준의 스타성과 실력, 리더십 오래 뛸 수 있는 젊은 나이의 선수는 극소수다. 토트넘이 이를 누구보다 잘 알고 있다. 그래서 매각을 고려하고 있지만, 상당히 비싼 값을 부르고 있다.

한편, 토트넘은 다가오는 8월 3일 오후 8시 서울 상암에 있는 서울월드컵경기장에서 뉴캐슬 유나이티드와 친선경기를 펼칠 예정이다.

용환주 온라인기자 dndhkr159@kyunghyang.com"
20250626,"이럴 수가! '韓 축구 대형 호재' 손흥민, 방출 가능성↓...'사우디 이적 일축?' 新 유니폼 '메인 모델 발탁'","[SPORTALKOREA] 김경태 기자= 지속적으로 이적설의 중심에 있는 토트넘 홋스퍼의 '주장' 손흥민이 2025/26시즌 어웨이 유니폼 메인 모델로 발탁됐다.

토트넘은 26일(이하 한국시간) 공식 홈페이지를 통해 오는 2025/26시즌 원정 유니폼을 공개했다. 토트넘을 상징하는 흰색의 대척점인 완전한 검은색으로 파격 변신을 꾀했다. 



토트넘은 이에 대해 ""드라마틱한 올블랙 디자인으로 날렵한 실루엣의 핏을 연출하며, 스피드를 위해 설계되고 은밀함을 위해 제작됐다""고 설명했다.

이어 ""'어둠 속에서 우리는 도전한다'라는  슬로건과 함께 공개된 이 키트는 다가오는 시즌 유럽축구연맹(UEFA) 챔피언스리그 원정 경기의 복귀를 기념하는 대담한 룩을 선보이며 우리의 유명한 모토를 변형했다""고 밝혔다.



홍보 영상도 함께 공개됐다. 도미닉 솔랑케, 제드 스펜스, 굴리엘모 비카리오 등이 출연했지만, 눈길을 끄는 것은 단연 '주장' 손흥민.

메인 모델로 등장한 손흥민은 현재 토트넘과 이별 가능성이 점점 높아지고 있는 추세다. 이적 시장 소식에 정통한 파브리치오 로마노 기자에 따르면 엔지 포스테코글루 감독이 경질됨에 따라 손흥민의 거취도 불투명하다. 이에 따라 사우디아라비아의 구단들이 관심을 표출하고 있는 상태다. 



이를 두고 높은 공신력을 자랑하는 벤 제이콥스 기자는 ""사우디의 알 카디시야, 알 아흘리, 알 나스르가 군침을 흘리고 있고, 4,000만 유로(약 633억 원)를 지불할 의향이 있다""고 전했다.

아직 계약 기간이 1년 남아 유효하긴 하나, 지금이 이적료를 실현할 수 있는 마지막 기회이기도 하다. 따라서 손흥민이 토트넘을 떠날 것이라는 분석이 지속적으로 나오고 있었다.



이러한 상황 속 토트넘은 손흥민을 새 유니폼 모델로 앞세운 것이다. 일부 선수들이 유니폼 홍보까지 하고 이적하는 경우도 있긴 하지만, 구단이 명실상부 구단 레전드를 단발성 마케팅 수단으로 활용하고 매각을 처분할 가능성은 낮은 것이 사실이다.

토마스 프랑크 감독 체제에서도 손흥민은 여전히 영향력을 끼칠 수 있는 존재다. 영국 매체 '풋볼 인사이더'의 피터 오르쿠 기자는 ""손흥민은 여전히 팀 내에서 핵심적인 임무를 수행할 수 있는 선수다. 손흥민이 토트넘에 잔류한다면, 프랑크 감독은 빠르게 팀을 장악하고 안정된 분위기 속에서 새 시즌을 시작할 수 있다""고 평가를 내렸다. 

사진=토트넘 홋스퍼, 게티이미지코리

취재문의 sportal@sportalkorea.co.kr"
20250626,김민재 리버풀로 탈출! 뮌헨 수비 풍비박산…'김민재 대체자' 알고보니 거북이→553억에 누가 누굴 버려?,"사진=SNS
[스포츠조선 강우진 기자]바이에른 뮌헨이 김민재를 버리는게 아니라 김민재가 바이에른 뮌헨을 버려야 할 판이다. 김민재가 빠진 뮌헨이 FIFA(국제축구연맹) 클럽월드컵에서 엉성한 모습을 보이고 있다.

뮌헨은 25일(한국시각) 미국 노스캐롤라이나주 샬럿의 뱅크 오브 아메리카 스타디움에서 열린 FIFA 클럽월드컵 조별리그 C조 최종 3차전에서 벤피카에게 0대1로 패배했다.

이로써 뮌헨은 조별리그서 2승 1패를 기록, 승점 6점으로 벤피카(승점 7점)에게 밀린 C조 2위를 확정했다.

세계적인 클럽인 만큼 팬들의 실망감은 크다. 특히나 수비진이 허술하다. 이날 전반전 일찍이 수비 집중력이 흐려지면서 뮌헨은 돌아 뛰는 벤피카의 안드레아스 시엘데루프를 마크하지 못하고 실점했다. 이후 추격 골에 실패한 뮌헨은 그대로 패배했다.

<저작권자(c) 연합뉴스, 무단 전재-재배포, AI 학습 및 활용 금지>
<저작권자(c) 연합뉴스, 무단 전재-재배포, AI 학습 및 활용 금지>
<저작권자(c) 연합뉴스, 무단 전재-재배포, AI 학습 및 활용 금지>
지난 21일 열린 C조 2차전에서도 수비 불안을 노출했다. 신입생 요나탄 타가 실망스러웠다. 후반 21분 보카주니어스의 메렌티엘에게 일격을 맞은 것. 메렌티엘은 순수 스피드로 타를 완벽하게 제압한 뒤 골망을 흔들었다. 타가 전속력으로 따라갔지만, 메렌티엘을 전혀 따라가지 못하는 모습이었다. 스피드만큼은 일품인 김민재가 그리워지는 순간이었다.

뮌헨은 오는 30일 플라멩구와 16강전을 치른다. 김민재가 훈련에 복귀함에 따라 토너먼트에서 출전할 가능성도 있다. 수비진의 전반적인 부진으로 뮌헨 입장에서는 김민재를 처분하기 곤란한 상황이 됐다.
앞서 뮌헨이 김민재의 매각을 위해 이적료를 3500만 유로(약 553억원)까지 낮췄다는 이야기가 나왔다. 지난 시즌 부진에 대한 책임으로 그를 매각한다는 것이다

자연스레 김민재에게 유럽 전역에서 많은 관심을 보내고 있다. 잉글랜드 프리미어리그(EPL) 리버풀과 프랑스 리그1의 파리 생제르망(PSG) 등 굵직한 팀에서 러브콜을 보내왔다.

<저작권자(c) 연합뉴스, 무단 전재-재배포, AI 학습 및 활용 금지>
<저작권자(c) 연합뉴스, 무단 전재-재배포, AI 학습 및 활용 금지>
지금의 뮌헨이라면 김민재는 차라리 이적을 선택하는 게 옳은 선택으로 보인다. 라인을 최대한 끌어올리는 전술 특성상 뮌헨은 수비진이 더 비판받을 수밖에 없는 전술 구조다. 뮌헨은 모든 선수가 공격에 치중하며 공격진에게 좋은 판을 깔아주지만, 그렇다고 공격수들이 날카로운 결정력을 보여주는 것도 아니다.

수비 진영과 공격 진영의 전반적인 균형을 추구하는 리버풀이나 PSG로 갈 수 있는 기회가 있다면 떠나는 게 맞는 판단으로 보인다.

김민재의 몸값이 3500만 유로까지 낮아진 지금이 적기다. 낮아진 몸값으로 리버풀의 예산 부담이 급감했다. 리버풀은 김민재가 이탈리아 세리에A 나폴리에서 우승을 차지하던 시절부터 그에게 주목해왔다.

리버풀이 김민재를 영입한다면 이는 버질 반다이크의 대체자로 활용할 의도다. 33세인 반다이크는 출전 시간을 적절히 조절할 필요가 있다. 또다른 리버풀의 중앙 수비수 이브라히마 코나테는 계약 마지막 해에 있어 떠날 가능성도 있다. 이렇게 될 경우 리버풀 주전 수비수 듀오는 김민재와 반다이크다.

김민재가 리버풀로 떠나 나폴리 시절의 경쟁력을 보여주며 반등할 수 있을지 여름 이적시장에 주목할 필요가 있다."
20250626,"""손흥민 1422억 초대형 딜, 서울 오기 전 성사"" BBC급 유력지 쐐기…토트넘 갈팡질팡 행보→한국팬 속 탄다","(엑스포츠뉴스 김현기 기자) 또 다른 유력지가 손흥민의 올여름 이적 가능성을 제기하고 나서 눈길을 끈다.

이미 영국 유력 매체들과 이적시장 전문가들까지 손흥민의 토트넘 퇴단 가능성을 어느 때보다 높게 내다보는 가운데 뉴욕 타임스 산하 글로벌 스포츠 미디어에서도 손흥민 거취 변화를 조명하고 나섰다.

글로벌 매체 '디 애슬레틱'은 25일(한국시간) 토트넘의 2025 여름 이적시장을 내다보면서 손흥민 거취가 주요 변수임을 알렸다.

'디 애슬레틱'은 ""토트넘은 이번 달 바이에른 뮌헨에서 완전 이적한 마티스 텔을 포함해 윌송 오도베르, 브레넌 존슨 등 측면에 많은 옵션을 보유하고 있지만 또 다른 보강을 위해 노력하고 있다""며 ""브렌트퍼드에서 브라이언 음뵈모를 영입하고 싶어 하지만 정작 음뵈모는 맨체스터 유나이티드로의 이적을 선호한다. 토트넘은 본머스 윙어 앙투안 세메뇨 영입에도 관심이 있다""라고 주장했다.

그러면서 주장단인 손흥민과 크리스티안 로메로의 이적설도 다뤘다.

매체는 ""로메로와 주장 손흥민은 잠재적으로 이적 가능성이 있는 선수들""이라며 ""이브 비수마와 로드리고 벤탄쿠르는 계약 마지막 해를 맞이했다. 토트넘 신임 사령탑 토마스 프랑크 감독은 인터뷰에서 벤탄쿠르의 이름을 언급했다. 이는 벤탄쿠르의 잔류를 바라는 그의 의지를 보여주는 것일 수도 있다""라고 밝혔다.



프랑크 감독은 토트넘 부임 인터뷰에서 여러 선수들의 이름을 지목하면서 새 팀에서 자신의 역량 발휘하고픈 의지를 드러냈다.

다만 프랑크 감독은 손흥민을 거론하진 않아 많은 매체들이 ""프랑크 감독이 손흥민과 작별하고 싶어한다""는 억측을 내놓은 상태다.

토트넘은 33살이 된 손흥민을 최대 900억원까지 받고 중동 구단 등에 팔 수 있다는 자세다.

일각에선 8월14일 예정된 프랑스 파리 생제르맹(PSG)와의 UEFA 슈퍼컵은 물론 8월3일로 예정된 토트넘의 한국 투어 이전에도 손흥민이 팀 스쿼드에서 사라질 수 있다는 견해를 내놓는다.

토트넘 구단 소식을 전하는 '토트넘 홋스퍼 뉴스'가 지난 24일 이런 주장을 펼쳤다. 토트넘이 의무 출전 계약 위반에 따른 위약금을 물고서라도 손흥민 앞에 적절한 제안이 온다면 올여름 아시아투어 이전에 이적시킬 가능성이 있다고 했다. 시간 끌지 않겠다는 얘기다.

토트넘 팬사이트 릴리화이트로즈 운영자로, 토트넘 사정에 밝은 존 웨넘은 '토트넘 홋스퍼 뉴스'와 인터뷰에서 위약금 규모를 200만 파운드(약 37억원)로 추정했다.



토트넘이 손흥민을 빠트리고 한국 투어를 올 경우 한국 측 파트너에 지불해야하는 위약금이 40억원 약간 안 된다는 얘기다.

웨넘은 ""손흥민은 여러 클럽과 연결돼 있다. 사우디아라비아로 간다면 이적료는 5000만∼6000만 파운드, 다른 곳으로 이적하면 3000만 파운드 정도 될 것""이라면서 ""좋은 제안이 오면 토트넘은 손흥민이 한국 경기에 뛰지 않아 발생할 수 있는 위약금을 내고서라고 거래할 거로 확신한다""고 주장했다.

이어 ""위약금이 있다면 이적료에 포함될 것""이라고도 덧붙였다.
손흥민 이적은 축구 이적시장에서 가장 공신도가 높은 영국 공영방송 BBC의 보도로 가속화되고 있다.

BBC는 지난 18일 ""손흥민이 다음 시즌이 시작하기 전 토트넘을 떠날 가능성이 있지만, 떠난다고 하더라도 토트넘의 아시아 투어 이후로 지연될 가능성이 크다""면서 ""구단은 투어 주최 측과 사이에 문제가 발생할 위험을 피하기 위해 손흥민이 투어에서 빠지는 상황은 피하려고 할 것""이라고 보도한 바 있다. 

토트넘은 새 시즌을 앞두고 올여름 아시아 투어에 나선다. 

7월 31일 홍콩에서 아스널(잉글랜드)과 북런던 더비 친선 경기를 먼저 펼친다. 이어 한국으로 넘어와 8월 3일 서울월드컵경기장에서 뉴캐슬 유나이티드(잉글랜드)와 대결한다.

토트넘은 이번 아시아투어에 손흥민과 양민혁 등 현재 계약 중인 아시아 선수 두 명, 그리고 곧 입단 예정인 일본 수비수 다카이 고타가 올 것으로 보인다. 그 중에서도 손흥민은 아시아투어 흥행을 책임질 간판 스타라고 과언이 아니다.



이런 상황에서 토트넘은 41년 만에 UEFA 유로파리그 우승 트로피를 안겨준 호주 출신 안지 포스테코글루 감독을 프리미어리그 17위 추락 책임 물어 2년 만에 조기퇴진시키고, 브렌트퍼드에서 지휘봉을 오래 잡은 덴마크 명장 토마스 프랑크 감독을 선임한 것이다.

프랭크 감독이 오면서 '새 술은 새 부대에'라는 논리에 따라 가장 먼저 거취를 고민해야 하는 대상으로 손흥민이 떠올랐다.

마침 사우디아라비아 3개 구단에서 손흥민을 찾는 것으로 알려져 토트넘은 그와의 결별을 고민 중이다.

이적시장 전문가 파브리치오 로마노는 지난 19일 자신의 동영상 채널을 통해 토트넘의 감독 변화를 설명하면서 손흥민을 도마 위에 올려놨다.

그는 ""안지 포스테코글루 감독이 토트넘에서 경질되지 않았다면 손흥민은 토트넘에 남았을 것""이라며 ""손흥민의 미래는 아직 아무 것도 결정되지 않았다. 손흥민은 프랑크 감독과 논의한 뒤 자신의 미래를 결정할 예정이다""고 했다.

손흥민의 기량 하락세가 너무 가파른 것도 지적받고 있다. 손흥민은 2016-2017시즌부터 이어오던 프리미어리그 두 자릿수 득점 기록을 이번 시즌 끝냈다. 7골에 그치면서 대기록 행진이 마감됐다. 3차례 부상이 문제였다. 지난 9월과 10월에 허벅지 뒤근육 부상으로 3주씩 쉰 손흥민은 지난 4~5월엔 한달 가량 정체 불명의 발 부상으로 쉬었다.

폭발적인 스피드와 정교한 골결정력이 한꺼번에 사라졌다는 평가가 나온 상황에서 프랑크 감독이 왔고, 사우디아라비아 구단은 손흥민을 원하다보니 토트넘도 그의 빼어난 상품성을 알지만 매각에 유혹을 느끼는 중이다.



손흥민은 2015년 독일 분데스리가의 바이엘 레버쿠젠에서 토트넘으로 이적해, 지난 10년간 북런던 클럽의 상징으로 군림했다.

빠른 발과 정확한 슈팅, 강한 투지를 겸비한 그는 팀의 공격을 이끌며 프리미어리그 최고 윙어 중 하나로 평가받았다. 그가 기록한 454경기 173골이라는 기록은 단순한 수치를 넘어, 클럽 역사에 깊이 각인될 성과다.

다만 손흥민의 노쇠화가 뚜렷한 것도 부정할 수 없는 현실이다. 올여름이 토트넘 구단 입장에서는 선수를 판매, 이적료를 받을 수 있는 마지막 여름 이적시장이다.

'BBC'는 ""손흥민을 향한 사우디아라비아 구단들의 관심이 높아지면서 토트넘의 한국 투어가 손흥민의 미래에 영향을 미칠 만한 요소로 떠오르고 있다""면서도 ""신뢰할 만한 소식통에 의하면 손흥민은 다음 시즌이 시작되기 전 토트넘을 떠날 수도 있지만, 손흥민이 토트넘을 떠나는 시기는 토트넘의 아시아 투어 이후일 가능성이 높다. 손흥민이 팀에 없으면 투어 주최측과 문제가 생길 수 있기 때문""이라고 했다.

그러나 웨넘은 중동 구단이 900억원 이상의 거액 이적료를 내놓게 되면 손흥민을 한국 투어 이전에도 보낼 수 있을 것으로 단언한다.

영국 매체 '토크스포츠'는 17일 사우디 세 구단이 관심을 보이고 있다며 연봉으로 3000만 유로(474억원), 계약기간 3년이 거론되고 있다고 보도했다. 3년 총액 1422억원에 달하는 셈이다.

'풋볼 인사이더'는 24일 ""UEFA 슈퍼컵이 열리기 전에 손흥민이 토트넘에서 없을 수도 있다""고 했다. 이래저래 손흥민을 기다리는 한국 및 아시아 팬들만 속이 타게 됐다.

사진=연합뉴스 / 엑스포츠뉴스DB / 토트넘 홋스퍼"
