date,title,content
20251221,[오피셜] '결국' 클린스만 외면했다…한국 대표팀 망친 과거 폭로→'74세' 노장 감독 선임,"사진=게티이미지


[포포투=박진우]

체코는 위르겐 클린스만 감독을 외면했다.

체코축구협회는 20일(한국시간) 미로슬라프 쿠벡 감독 선임을 공식 발표했다. 계약 기간은 2028년까지다.
체코는 중요한 기로에 서 있다. 2026 국제축구연맹(FIFA) 북중미 월드컵 유럽 예선 L조에서 5승 1무 2패(승점 16점)를 거두며 조 2위로 본선 직행을 확정하지 못했다. 체코는 아일랜드, 덴마크, 북마케도니아와 경쟁한다.

만약 본선행을 확정한다면 한국, 멕시코, 남아프리카공화국과 함께 A조에 편성된다. 체코는 아일랜드와의 플레이오프(PO)를 치른다. 만약 아일랜드를 꺾는다면 덴마크-북마케도니아 경기 승자와 맞붙는다. 그 경기에서 이겨야 본선에 진출할 수 있다.

체코축구협회는 월드컵 본선행을 선물할 감독 찾기에 혈안이었다. 지난 10월 부진을 이유로 이반 하셰크 감독을 경질했고, 야로슬라프 쾨스틀에게 임시로 지휘봉을 맡겼다. 유럽 예선이 끝난 뒤, 정식 감독을 선임해 PO 준비에 박차를 가하겠다는 의도였다.

그 과정에서 떠오른 인물이 클린스만 감독이었다. 지난 10월 말, 체코 '블레스크'는 ""체코축구협회의 실세인 파벨 네드베드가 클린스만 감독을 차기 사령탑으로 강하게 밀고 있는 것으로 전해졌다""고 보도했다. 다만 매체는 클린스만 감독의 과거를 들추며 강하게 반대의 목소리를 냈다.

대한민국 국가대표팀에서 남긴 과오를 하나하나 짚었다. 매체는 ""클린스만이라는 이름만 놓고 보면 확실히 화려하다. 하지만 동시에 '겉만 번지르르하고 속은 엉망'이라는 속담이 어울릴 정도로 '퇴색된 명성'이라는 평가도 따른다""고 주장했다.

그러면서 ""한국 대표팀 팬들이라면 이 말에 고개를 끄덕일지도 모른다. 클린스만 감독은 지난 2023년 2월 한국 감독으로 부임했지만, 1년도 채 되지 않아 경질됐다. 이유는 간단했다. 일하는 태도였다. 선수 선발은 이름값 위주였고, 부임 첫 6개월간 서울에 머문 날은 고작 67일. 대부분의 시간을 미국 캘리포니아 자택에서 보냈다""며 문제를 짚었다.

네드베드에게 강한 경고를 보냈다. 매체는 ""이런 클린스만 감독이 체코 대표팀을 맡는다면, 다른 양상을 보일까? 언론은 이미 '한국에서의 일이 체코에서도 반복되지 않으리란 보장이 있을까?'라고 묻고 있다""고 주장했다. 해당 매체 외에도 다수 언론들이 클린스만 감독의 과거를 파헤치며 화제가 됐다.

결국 체코축구협회는 클린스만 감독을 외면했다. 체코 클럽팀과 대표팀 지휘봉을 잡았던 '자국 출신' 74세 베테랑 쿠벡 감독을 선임했다. 쿠벡 감독 체제의 체코가 본선 진출에 확정해 A조에서 한국과 맞대결을 펼칠 수 있을지 지켜 볼 일이다.

사진=게티이미지"
20251221,"김민재도 무너졌다! 韓 축구 대위기!…이강인 이어 KIM OUT→""치아+근육문제로 결장, 장기 부상자 명단 올라""","(엑스포츠뉴스 나승우 기자) 한국 축구 핵심 2명이 쓰러졌다. 이강인(파리 생제르맹)에 이어 김민재(바이에른 뮌헨)까지 부상으로 당분간 결장한다.

분데스리가 소식을 전하는 리가인사이더는 21일(한국시간) ""김민재는 바이에른 뮌헨과 하이덴하임의 경기에 출전하지 못한다""고 전했다.

TZ 소속 기자 필립 케슬러의 보도를 인용한 매체는 ""뮌헨은 또 한명의 선수를 잃게 됐다. 김민재는 하이덴하임과의 원정 경기에 출전할 수 없다""며 ""한국인 센터백 김민재는 치아와 근육 문제로 고생하고 있어 출전하지 못한다""고 설명했다.

이어 ""김민재는 장기 부상자 명단에 합류하게 됐다""고 전한 매체는 ""요주아 키미히, 사샤 보이, 마누엘 노이어, 니콜라 잭슨, 자말 무시알라, 콘라트 라이머가 장기 부상자 명단에 있다""고 덧붙였다.

김민재가 당분간 출전하기는 어려울 거란 전망이 나온 셈이다. 폭발적인 스피드와 몸싸움을 주무기로 하는 김민재에게 근육 부상은 치명적일 수 있다.



글로벌 축구 매체 골닷컴은 ""김민재가 부상으로 쓰러지면서 뱅상 콤파니 감독은 중앙 수비에 요나탄 타, 다요 우파마카노, 이토 히로키만 기용할 수 있을 것으로 보인다""면서 ""요시프 스타니시치도 출전 가능성이 있지만 그는 수비의 오른쪽이나 왼쪽 측면에서 뛰어야 할 것으로 예상된다""고 뮌헨이 당장 선수 구성에 어려움을 겪게 됐다고 전했다.

다행히 뮌헨은 하이덴하임과의 경기를 끝으로 2025년 일정을 마무리한다. 22일 오전 1시30분 하이덴하임 원정을 치르고 나면 내달 12일 볼프스부르크전까지 3주 가량 휴식기에 돌입한다. 부상자들이 충분히 휴식을 취할 수 있는 기간이다.

문제는 대한민국 축구 국가대표팀이다. 최근 핵심 미드필더 이강인이 햄스트링 부상으로 몇 주간 결장이 확정된 바 있다.



공격 전개의 시발점인 이강인을 잃은 충격이 채 가시기도 전에 수비진을 지탱하는 기둥인 김민재마저 부상  리스트에 오르면서 대표팀 전력 유지에 빨간불이 켜졌다.

아직 구단 측의 공식적인 재활 기간 발표는 나오지 않았으나 근육 문제는 재발 위험이 높고 회복에 세심한 관리가 필요한 만큼 김민재의 공백이 예상보다 길어질 수 있다.

이번 시즌 많은 경기를 뛰지 못해 컨디션 유지에 어려움을 겪던 김민재가 부상 복귀 후 실전 감각을 충분히 끌어올릴 수 있을지도 지켜봐야 한다.

사진=연합뉴스"
20251221,"'악평 또 악평'…""캡틴 믿기 어려운 수준, 끔찍하다"" 손흥민 '리더십·경기력' 전부 그립다→ 결국 우려대로 로메로 또 분 못 이겨 퇴장 ""정말 형편없었어""","[SPORTALKOREA] 황보동혁 기자= 크리스티안 로메로(토트넘 홋스퍼FC)에게 주장 완장은 여전히 어색해 보인다.

토트넘은 21일(한국시간) 영국 런던 토트넘 홋스퍼 스타디움에서 열린 리버풀FC와의 2025/26시즌 프리미어리그 17라운드 홈 경기에서 1-2로 패했다.

이 패배로 토트넘은 최근 공식전 9경기에서 단 2승에 그치며 리그 13위까지 추락했다. 더욱 아쉬운 점은 경기 초반까지만 해도 토트넘이 리버풀을 상대로 대등함을 넘어 오히려 더 나은 경기력을 보여줬다는 사실이다.



하지만 흐름은 한순간에 무너졌다. 전반 31분 사비 시몬스가 버질 반 다이크를 향해 스터드를 들고 태클을 시도했고 비디오 판독(VAR) 끝에 레드카드를 받고 퇴장당했다. 수적 열세에 몰린 토트넘은 이후 연달아 실점을 허용하며 0-2로 끌려갔다.

후반 37분 히샤를리송이 골문 앞 혼전 상황에서 추격골을 터뜨리며 분위기를 살리는 듯했지만, 또 한 번의 퇴장이 모든 희망을 꺾었다.

후반 추가시간, 로메로는 이브라히마 코나테와의 몸싸움 이후 불필요한 행동으로 옐로카드를 받았다. 이미 한 차례 경고가 있었던 로메로는 경고 누적으로 퇴장당했고, 토트넘은 마지막 동력마저 잃고 말았다.



로메로의 퇴장 이후에도 토트넘이 몇 차례 결정적인 기회를 만들어냈다는 점을 고려하면 더욱 뼈아프게 느껴졌다. 특히 주장 완장을 찬 선수가 감정 조절에 실패하며 퇴장당했다는 점에서 비판은 피할 수 없었다.

영국 '토크스포츠'에 따르면, 이날 해설을 맡았던 '스카이스포츠'의 게리 네빌은 로메로의 플레이를 두고 ""정말 형편없다""고 혹평했다. 그는 로메로의 성급한 전진 패스 장면을 지적하며 ""그 한 번의 판단이 팀 전체를 노출시켰다""고 꼬집었다.

결과적으로 시즌 초반부터 반복적으로 지적돼 온 로메로의 문제가 다시 한 번 팀을 위기로 몰아넣은 셈이다. 로메로는 지난 8월 LAFC로 이적한 손흥민의 뒤를 이어 토트넘의 새 주장으로 선임됐다. 시즌 초반에는 비교적 안정적인 모습을 보였지만, 최근 들어 경기력 기복과 함께 리더십 논란이 불거지고 있다.



지난 11월 토크스포츠 해설위원 스튜어트 피어스 역시 로메로를 향해 날 선 비판을 쏟아냈다.

그는 ""지금 로메로의 플레이는 끔찍하다. 중원에서 공을 빼앗기고도 전혀 복귀하지 않는다. 수비수라면 몸에 배어 있어야 할 기본""이라며 ""미드필드까지 올라가다 완전히 뚫리고, 그 뒤에는 조깅만 하며 돌아온다""고 지적했다.

이어 ""같은 말을 반복하게 되지만, 그가 주장이라는 사실을 생각하면 믿기 어려운 수준""이라고 비난했다. 

손흥민이 주장이던 시절, 토트넘은 리그 17위까지 추락한 적도 있었지만 주장이 모범을 보이며 선수단이 그라운드 위에서 감정을 통제하지 못하거나 선을 넘는 장면은 거의 없었다.



그러나 손흥민의 뒤를 이어 주장 완장을 찬 로메로는 팀을 안정시키기는커녕, 오히려 본인이 퇴장으로 변수가 되고 있다. 토마스 프랑크 감독 입장에서는 고민이 깊어질 수밖에 없는 대목이다.

사진= 게티이미지코리아 

제휴문의 ad@sportalkorea.co.kr"
20251221,"충격 또 충격! ""절대 영입하지 마라"" 서울 떠나 '영국행' 린가드, EPL 복귀 어려운가...""마지막에 완전 실패""→""더 이상 젊지 않아""","사진=린가드 SNS 캡처
사진=트위터 캡처
10일 오후 서울월드컵경기장에서 아시아챔피언스리그 엘리트(ACLE) 리그 6차전 FC서울과 멜버른시티FC의 경기가 열렸다. 전반전 FC서울 린가드가 선취골을 성공시켰다. 팬들을 향해 세리머니를 펼치고 있는 린가드. 상암=송정헌 기자songs@sportschosun.com/2025.12.10/
[스포츠조선 이현석 기자]잉글랜드로 돌아간 제시 린가드를 향한 충격적인 주장이 등장했다.

영국의 웨스트햄웨이는 20일(한국시각) '웨스트햄은 1월에 린가드를 영입한다는 이야기를 그만둬야 한다'라고 보도했다.

린가드는 10일 서울월드컵 경기장에서 열린 멜버른 시티(호주)와의 2025~2026시즌 아시아챔피언스리그 엘리트(ACLE) 리그 스테이지 6차전을 끝으로 FC서울에서의 여정에 마침표를 찍었다. 2024년 2월 서울에 입단해 데뷔 이후 처음으로 아시아 무대로 향한 센세이셔널한 행보의 마무리였다.

사진=린가드 SNS 캡처
린가드는 K리그 역사상 최고의 네임밸류를 자랑하는 선수였다. 맨체스터 유나이티드 출신의 그는 잉글랜드 프리미어리그(EPL) 무대에서 주전급 선수로 활약하던 자원이다. 2015~2016시즌부터 본격적으로 맨유 1군에서 활약하기 시작했다. 2015~2016시즌 당시에는 주로 우측 윙어로 출전해 루이 판할 감독의 유스 기용 정책에 수혜를 입었다. 당시 린가드는 선발 32경기 포함 공식전 40경기에 출전해 6골 4도움을 기록하며 차근히 경험을 늘려갔다.

2016~2017시즌부터는 본격적으로 활약을 시작했고, 2017~2018시즌 조세 무리뉴 감독 지휘하에서 실력이 만개했다. 2017~2018시즌 당시 린가드는 날카로운 슈팅과 크로스, 왕성한 활동량으로 맨유 팬들의 큰 사랑을 받았다. 해당 시즌에서 맨유는 리그 2위로 시즌을 마감하며 준수한 성적을 거뒀다. 당시 잉글랜드 대표팀에서도 활약한 경험도 있다. 국제축구연맹(FIFA) 2018년 러시아 월드컵에서 4강까지 오른 잉글랜드 대표팀의 주역 중 한 명이었다.

10일 오후 서울월드컵경기장에서 아시아챔피언스리그 엘리트(ACLE) 리그 6차전 FC서울과 멜버른시티FC의 경기가 열렸다. FC서울과 멜버른이 1-1 무승부를 기록했다. 경기 종료 후 인사를 나누고 있는 린가드-앤더슨. 상암=송정헌 기자songs@sportschosun.com/2025.12.10/
그런 그는 2023년 6월 노팅엄을 떠난 후 9개월가량 소속팀 없이 개인 훈련만 진행했다. 서울은 린가드에게 적극적인 구애를 펼쳤고, 2024년 파격적인 영입에 성공했다. 서울의 브랜드 가치와 위상을 크게 높이는 특별한 존재감을 과시한 린가드는, K리그 전체에 큰 파급 효과를 불러일으켰다. 2025시즌 구단의 주장으로서 활약하기도 했다. 다만 린가드는 올 시즌 종료 후 2년의 계약 기간을 채우며 서울과의 동행 대신 다시 도전을 택하며 팀을 떠나게 됐다.

린가드가 영국으로 떠난 후 곧바로 이적설에 불이 붙었다. 관심의 주인공은 린가드의 과거 소속팀이었던 웨스트햄이었다. 린가드는 과거 웨스트햄 소속으로 16경기에 출전해 9골5도움을 기록하며, 잉글랜드 프리미어리그(EPL) 데뷔 이후 가장 뜨거운 모습을 보여주기도 했다. 일부 영국 언론은 '린가드가 웨스트햄과 이미 대화를 나눴다'라며 EPL 복귀에 무게를 두기도 했다.

로이터연합뉴스
하지만 린가드의 EPL 복귀는 쉽지 않아 보인다. 웨스트햄 소식을 전하는 웨스트햄웨이는 '웨스트햄 웨이 팟캐스트 진행자 데이브 워커는 웨스트햄의 린가드 영입 소식에 부정적인 견해를 밝혔다'고 전했다. 워커는 ""린가드가 우리 클럽에서 임대 생활을 하면서 엄청난 활약을 보여줬기 때문에 우리가 그를 영입하려는 이유를 알겠다. 하지만 그건 5년 전 일이다. 더 이상 젊지 않고, 솔직히 말해서 그가 마지막으로 EPL에 있었을 때는 완전히 실패했다""라고 지적했다.

한편 린가드는 EPL 구단 외에도 챔피언십 구단, 중국, 말레이시아 등 다양한 구단들의 이름들과 엮이고 있다. K리그 역대 최고 수준의 명성을 자랑한 선수의 다음 행보에 관심이 쏠릴 전망이다."
20251221,"'초대박' 태극기 한국 사랑 월드 클래스, 손흥민 제2의 파트너 될까...경쟁자는 리오넬 메시 ""봄에 미래 결정""","사진=디발라 SNS
<저작권자(c) 연합뉴스, 무단 전재-재배포, AI 학습 및 활용 금지>
[스포츠조선 김대식 기자]파울로 디발라는 미국행을 선택할까.

유럽 이적시장 전문가인 에크렘 코누르는 21일(한국시각) 개인 SNS를 통해 ""디발라와 AS로마와의 계약은 이번 시즌을 끝으로 종료된다. 보카 주니어스는 6월 이적을 추진하고 있다. 인터 마이애미와 LAFC도 관심을 가지고 있다""고 보도했다.

디발라는 유럽 무대에서 기술과 창의성을 겸비한 공격수로 확고한 커리어를 쌓아온 선수다. 1993년생인 디발라는 아르헨티나에서 프로에 데뷔한 뒤 2012년 팔레르모로 이적하며 유럽 무대에 입성했다. 이탈리아 세리에A에서 빠르게 두각을 나타낸 그는 2015년 유벤투스로 이적해 전성기를 맞았다.

알렉산드로 델 피에로의 후계자로 불리며 입성한 디발라는 유벤투스의 핵심으로 도약했다. 유벤투스에서 리그 우승 5회, 코파 이탈리아 우승 4회를 경험하며 팀의 전성기를 이끌었다. 작은 체구지만 요즘 시대에 희귀한 세컨드 스트라이커라는 역할을 맡아 날카로운 왼발과 창의성으로 본인만의 장점을 잘 발휘했다. 2019~2020시즌 세리에 MVP를 수상하며 커리어 정점을 찍었다.
<저작권자(c) 연합뉴스, 무단 전재-재배포, AI 학습 및 활용 금지>
유벤투스와 계약이 만료된 디발라는 사우디아라비아 이적설이 터졌지만 2022년 AS로마로 이적했다. 로마에서도 조세 모리뉴 감독 체제에서의 공격 중심 역할을 맡았고, 2022~2023시즌 유로파리그 준우승을 이끌며 존재감을 재확인했다. 아르헨티나 대표팀에서도 꾸준히 발탁된 디발라는 2022 카타르 월드컵 우승 멤버였다.

하지만 디발라는 이제 확실히 전성기는 지난 모습이다. 원래부터도 유리몸 기질이 있있던 디발라는 2024~2025시즌 잦은 부상으로 좋은 모습을 보여주지 못했다. 이번 시즌에는 아예 주전 경쟁에서도 밀린 모습이다. 로마 입장에서도 디발라를 굳이 잡을 이유가 없는 상황.
<저작권자(c) 연합뉴스, 무단 전재-재배포, AI 학습 및 활용 금지>
디발라는 2026년이 되면 보스만 룰에 따라 자유롭게 행선지를 결정할 수 있다. 현재 LAFC는 손흥민과 드니 부앙가의 역할을 분담해줄 수 있는 선수가 필요하다. 디발라라면 그 역할을 충분히 해낼 수 있을 것이며 손흥민과 부앙가에게 양질의 득점 기회를 만들어줄 수 있을 것이다. 현재 LAFC는 연봉 샐러리캡 규정에 구애받지 않는 지정 선수 목록이 1자리 비어있어서 디발라 연봉 지급에는 큰 문제가 없다.

다만 경쟁팀이 보카와 인터 마이애미라는 점이 LAFC 입장에서는 어렵다. 아르헨티나 최고 명문인 보카이며 인터 마이애미는 아르헨티나 전설인 리오넬 메시가 있다. 심적으로 디발라한테 더 끌릴 수 있는 선택지들이다. 코누르는 ""선수는 봄에 미래를 결정할 것""이라고 덧붙였다.

한편 디발라는 한국 팬들에게 굉장히 이미지가 좋은 선수 중 하나다. 한국과 인연이
<저작권자(c) 연합뉴스, 무단 전재-재배포, AI 학습 및 활용 금지>
닿지 않은 선수지만 한국 팬들이 보낸 선물을 개인 SNS에 태극기를 달아 인증샷을 올리기도 했다. 또한 디발라는 코로나19 팬데믹이 유행하던 시기에 SNS에 태극기 마스크를 착용한 사진을 올린 적도 있다. 아시아권 사람들에 대한 인종차별에 반대하는 목소리까지 직접 냈던 선수기도 하다."
20251221,"""이탈리아, 드디어 한국에 복수!"" 日 깜짝 주장…월드컵 '24년 만의' 재대결 성사?→""한일 WC 설욕 기회""","(엑스포츠뉴스 권동환 기자) 월드컵 토너먼트에서 대한민국과 이탈리아가 24년 만에 재대결을 펼치는 순간이 나올까.

일본 매체 '풋볼 채널'은 20일(한국시간) ""한국에 복수할 절호의 기회가 찾아올까? 이탈리아는 대진 추첨 운이 좋다고 할 수 있다""라고 보도했다.

FIFA 랭킹 12위 이탈리아는 내년 3월 북아일랜드, 웨일스, 보스니아 헤르체고비나와 함께 2026 국제축구연맹(FIFA) 북중미 월드컵(캐나다·미국·멕시코 공동개최) 본선행 티켓이 걸려 있는  유럽 예선 플레이오프A에 참가한다.

만약 티켓 확보에 성공한다면 이탈리아는 북중미 월드컵 조별리그에서 캐나다, 스위스, 카타르와 함께 B조에 편성된다.





이탈리아가 본선행에 성공하면 대회 토너먼트에서 홍명보 감독이 이끄는 대한민국 축구 국가대표팀을 상대할 수도 있다.

한국은 월드컵 조별리그에서 멕시코, 남아프리카공화국, 유럽 예선 플레이오프D 승자(덴마크, 북마케도니아, 아일랜드, 체코 중 하나)과 함께 A조에 편성됐다. 대진표에 따르면, A조 2위는 대회 32강에서 B조 2위와 맞대결을 펼친다.
언론도 월드컵 토너먼트에서 이탈리아와 한국이 맞붙을 가능성을 주목했다.

매체는 ""이탈리아가 조별리그를 1위로 돌파할 경우, 32강에서 E, F, G, I, J조에서 3위를 차지한 국가 중 하나와 맞붙는다""라며 ""2위로 통과하면 A조의 2위와 대결한다. A조엔 개최국인 멕시코 외에도 한국, 남아공, 유럽 예선 플레이오프D 승자가 포함돼 있다""라고 설명했다.





이어 ""참고로 이탈리아는 지금까지 멕시코와 12번 맞붙어 7승4무1패로 크게 앞서 있다""라며 ""한국과도 과거 두 번 맞붙었는데, 2경기 모두 월드컵 본선에서의 대전이었다""라고 덧붙였다.

더불어 ""이탈리아는 1986 멕시코 월드컵 조별리그에서 한국에 3-2로 승리했고, 2002 한일 대회에선 16강에서 1-2로 패했다""라며 ""만약 한국과의 대전이 성사된다면 설욕할 수 있는 절호의 기회가 될 것""이라고 전했다.

이탈리아는 한국과 일본이 공동 개최한 2002 한일 월드컵 16강에서 거스 히딩크 감독이 이끄는 대한민국 축구 국가대표팀을 만났다.

당시 한국은 선제골을 허용했지만, 설기현의 동점골, 안정환의 골든골에 힘입어 대역전승을 거두고 8강에 진출했다. 이후 승부차기 끝에 8강에서 스페인도 꺾으면서 아시아 최초로 월드컵 4강 신화를 이뤄냈다.

사진=연합뉴스"
20251221,"""손흥민, 나와 대화를 하더라…진짜 충격 받았다!"" 이라크 국대 MF, 깜짝 일화 공개→""내가 상대한 선수들 중 최고"" 극찬","(엑스포츠뉴스 권동환 기자) 이라크 국가대표 미드필더 아미르 알암마리(할름슈타드)가 대한민국 축구 스타 손흥민(LAFC)과의 일화를 소개했다.

이라크 소식통 '이라크 엑스트라'는 19일(한국시간) 사회관계망서비스(SNS)를 통해 알암마리의 인터뷰 내용을 공개했다.

매체에 따르면 A매치 통산 47경기를 뛴 알암마리는 자신이 상대한 선수들 중 최고의 선수를 묻는 질문에 망설임 없이 ""손흥민(Son)""이라고 답했다.

손흥민에 대해 알암마리는 ""알다시피, 손흥민이 순간적으로 속도를 내려고 하면 순식간에 일어난다. 그는 믿을 수 없다""라고 답했다.



아울러 알암아리는 자신의 A매치 데뷔전인 한국전에서 일어났던 일화도 소개했다. 그는 지난 2021년 9월 서울월드컵경기장에서 열렸던 대한민국과 이라크 간의 A매치에 선발로 나와 데뷔전을 가졌다. 당시 경기는 0-0 무승부로 끝났다.

이날 알암아리는 경기 후 도핑 테스트 대상자로 뽑혔는데, 도핑 검사실에서 당시 잉글리시 프리미어리그의 토트넘 홋스퍼에서 활약하던 손흥민을 만나 대화를 나눴다고 고백했다.

그는 ""손흥민을 눈 앞에서 보니깐 내가 예전에 할름슈타드(스웨덴 구단)에서 뛸 때가 떠올랐다""라며 ""사실 나는 알스벤스칸(스웨덴 1부리그)에서 겨우 6개월만 뛰었기에 '지금이 이런 선수와 이야기할 수 있는 기회다'라고 생각했다""라고 말했다.



이어 ""머릿속으로는 '내가 지금 프리미어리그 선수랑 나란히 앉아 있는데, 이 사람은 완전히 레벨이 다른 선수라 아무것도 묻지 않을 거다'라고 생각했는데, 내가 질문을 하면 내게도 질문을 하면서 대화를 나눌 수 있도록 했다는 사실에 충격을 받았다""라고 덧붙였다.

더불어 손흥민과 유니폼 교환을 하길 원했으나 당시 코로나19 유행으로 인해 손흥민의 유니폼을 얻지 못했다고 밝혔다.

알암아리는 ""마지막으로 내가 유니폼 교환에 대해 물어봤는데, 그때 코로나 시기였다""라며 ""특히 한국은 코로나에 대해 더 엄격했고, 결국 손흥민은 유니폼을 교환할 수 없다고 말했다""라고 전했다.

사진=엑스포츠뉴스DB / 연합뉴스"
