date,title,content
20250829,"영국 정론지 가디언 ""맨유 내부, 아모링 감독 자진 사퇴 가능성 거론""","후벵 아모림 맨체스터유나이티드 감독. 게티이미지코리아


후벵 아모링 감독의 맨체스터 유나이티드 시대가 위약금 없이 마무리될 가능성이 제기됐다. 영국 유력 일간지 가디언은 29일(현지시각) 보도를 통해, 후벵 아모링 감독을 둘러싼 불안한 기류가 맨체스터 유나이티드 내부에서 감지되고 있다고 전했다.

보도에 따르면, 최근 리그와 컵대회에서 연이은 부진을 겪고 있는 아모링 감독의 전술과 선수단 관리 방식에 대해 선수단 내부에서 의문이 제기되고 있으며, 클럽 내부에서는 감독이 스스로 지휘봉을 내려놓을 수 있다는 이야기까지 나오고 있다.

그림즈비 충격패, 전례 없는 위기감

맨유는 지난 카라바오컵 2라운드에서 4부리그 팀 그림즈비 타운에 승부차기 끝에 패배하며 충격을 안겼다. 이는 구단 역사상 처음으로 4부 팀에 탈락한 사례다. 이미 시즌 개막 후 아스널전 패배와 풀럼전 무승부로 리그 승리가 없는 상황에서, 컵대회 탈락은 감독에 대한 압박을 더욱 키웠다.

가디언은 ""구단 수뇌부는 아모링 감독 경질 계획을 세우지 않고 있지만, 성적 부진이 이어질 경우 감독 스스로 고집을 꺾기보다는 사퇴를 선택할 가능성이 있다는 분위기가 형성되고 있다""고 보도했다. 특히 이번 주말 번리전 결과에 따라 국제 A매치 휴식기 기간 중 결단이 나올 수 있다는 전망도 덧붙였다.
아모링 감독은 스포르팅CP 시절 성공 방정식이었던 3-4-3 전술을 고수하고 있다. 하지만 맨유 부임 후 이 시스템은 리그 29경기에서 단 27점밖에 얻지 못하며 한계를 드러냈다. 선수단 내에서도 ""의도는 좋지만 결과적으로 역효과를 내는 경우가 있다""는 불만이 감지된다고 가디언은 전했다.

감독은 그림즈비전 직후 인터뷰에서 ""무언가 바뀌어야 한다""고 말했지만, 구단 내부에서는 이를 전술적 변화를 의미하는 것으로 받아들이지 않고 있다.

윌콕스 단장 움직임 주목

제이슨 윌콕스 풋볼 디렉터 역시 아모링 감독의 전술적 완고함과 선수단 관리 문제를 인식하고 있으며, 필요하다면 개입할 수 있다는 관측이 제기된다.

클럽은 공식적으로는 ""번리전을 치르고 휴식기를 맞이한 뒤 생각을 정리할 것""이라는 감독의 언급에 힘을 실으며 '평소대로 진행된다'는 입장을 내세우고 있다. 그러나 국제 휴식기 이후 맨체스터 시티와의 '맨체스터 더비'가 예정돼 있어, 번리전 결과가 아모링 체제의 분수령이 될 가능성이 크다.

한편, 구단 내부 이적 상황도 격변 중이다. 아모링 감독이 '전력 외'로 분류했던 공격수 알레한드로 가르나초는 첼시 이적이 가시화됐다. 가디언은 양 구단이 4,000만 파운드(약 750억 원) 이적료와 향후 이적 시 10%의 셀온 조항을 포함한 계약에 최종 합의했다고 전했다.

맨유는 지난 시즌 15위라는 역대 최악의 리그 성적을 기록한 데 이어, 올 시즌도 개막 이후 승리가 없어 분위기가 침체돼 있다. 가디언의 보도처럼 아모링 감독의 체제가 번리전 결과에 따라 국제 휴식기를 기점으로 큰 변화를 맞이할 수 있다는 전망은 점점 현실성을 더해가고 있다.

사진=게티이미지코리아"
20250829,'3부리그 팀 상대 바이에른 뮌헨 2실점 원인' 지목…김민재와 동반 풀타임 센터백 혹평,"요나단 타/게티이미지코리아
김민재/게티이미지코리아

[마이데일리 = 김종국 기자] 바이에른 뮌헨이 3부리그 클럽을 상대로 고전 끝에 승리를 거둔 가운데 수비진이 비난받았다.

바이에른 뮌헨은 28일 독일 비스바덴에 위치한 브리타아레나에서 열린 비스바덴과의 2025-26시즌 DFB포칼 1라운드 원정 경기에서 3-2로 이겼다. 올 시즌 초반 2경기에서 교체 출전한 김민재는 이날 경기에서 요나단 타와 함께 풀타임 활약하며 수비진을 이끌었다. 바이에른 뮌헨은 케인이 후반전 추가시간 극적인 결승골을 터트려 승리로 경기를 마쳤다.

바이에른 뮌헨은 비스바덴을 상대로 케인이 공격수로 출전했고 디아스와 올리세가 측면 공격을 이끌었다. 칼, 파블로비치, 킴미히는 중원을 구성했고 게레이로, 김민재, 요나단 타, 보이가 수비를 맡았다. 골문은 우르비히가 지켰다.

양팀의 맞대결에서 바이에른 뮌헨은 전반 16분 케인이 페널티킥 선제골을 터트렸다. 전반전을 앞서며 마친 바이에른 뮌헨은 후반 6분 올리세의 추가골로 점수 차를 벌렸다. 올리세는 페널티에어리어 오른쪽에서 왼발 슈팅으로 골망을 흔들었다.
반격에 나선 비스바덴은 후반 19분 카야가 만회골을 기록했다. 카야는 팀 동료 마이의 크로스를 문전 쇄도하며 오른발 슈팅으로 마무리해 바이에른 뮌헨 골문을 갈랐다.

이후 비스바덴은 후반 24분 카이의 멀티골과 함께 승부를 원점으로 돌렸다. 카야는 김민재와의 공중볼 경합을 이겨낸 플로토의 헤더 패스를 이어받은 카야는 바이에른 뮌헨 수비 뒷공간을 침투해 페널티에어리어 정면에서 오른발 슈팅으로 골문을 갈랐다.

양팀이 두 골씩 주고받은 가운데 바이에른 뮌헨은 후반 3분 케인이 자신이 얻어낸 페널티킥 기회에서 키커로 나서 오른발 슈팅을 때렸지만 골키퍼 선방에 막혔다. 이후 케인은 후반전 추가시간 극적인 결승골을 성공시켰다. 케인은 스타니시치의 크로스를 골문앞에서 타점 높은 헤더 슈팅으로 마무리해 비스바덴 골망을 흔들었고 바이에른 뮌헨의 극적인 승리로 경기가 종료됐다.

바이에른 뮌헨은 3부리그 클럽을 상대로 후반전 중반 연속 실점한 가운데 센터백 요나단 타에 대한 비난이 집중됐다. 요나단 타는 이날 경기에서 3번의 볼 클리어링과 2번의 태클을 기록했다. 129번의 볼터치와 함께 패스 성공률은 98%를 기록했지만 실점 상황에서의 불안정한 모습이 지적됐다.

독일 매체 스폭스는 요나단 타에 대해 '요나단 타의 불안하고 위험한 패스를 받은 파블로비치는 경고를 받았고 첫 번째 실점 상황에서 요나단 타는 깊은 잠에 빠져 있었다. 카야가 자신의 뒤로 빠져나가도록 내버려 뒀다. 동점골 실점 상황에서도 플로토가 카야에게 헤더 패스를 했을 때 상황을 제대로 파악하지 못했다. 이런 경기력은 콤파니 감독에게 큰 걱정거리가 될 것'이라며 팀내 최저 평점 5등급을 부여했다.

이 매체는 김민재에 대해선 '전반전에 카야를 막아내며 비스바덴의 동점골 기회를 저지했다. 동점골 실점 상황에서 플로토에게 접근했지만 플로토의 헤더 패스를 막지는 못했다'며 이날 경기 활약에 대해 평점 3등급을 부여했다.

독일 매체 스폭스는 '김민재는 전반전에 비스바덴의 유일한 득점 기회를 저지했다. 다소 컨디션이 좋지 않아 보였지만 후반전에서 꾸준한 활약을 이어가며 7번의 볼 리커버리를 기록해 볼 리커버리가 없었던 요나단 타와 비교됐다'고 언급했다. 독일 매체 메르쿠르는 '김민재의 활약은 빛과 그림자가 함께했다. 전반전에 카야의 슈팅을 막아내며 멋진 선방을 보여줬지만 동점골 실점 상황에선 플로토와의 헤더 경합에서 패했다'는 뜻을 나타냈다.
김민재/게티이미지코리아
요나단 타/게티이미지코리아"
20250829,"[PL POINT] '하이재킹'은 '하이재킹'으로 잊는다! 에제 아스널에 빼앗긴 토트넘, '첼시 타깃' 시몬스 영입 직전","사진=로마노


[인터풋볼=이주엽 기자] 하이재킹은 하이재킹으로 잊으려는 토트넘 홋스퍼다.

유럽 축구 이적시장에 능통한 파브리시오 로마노 기자는 29일(이하 한국시간) ""토트넘은 사비 시몬스 영입을 위해 라이프치히와 6,000만 유로(약 975억 원)의 이적료에 합의했다""라고 보도했다. 나아가 후속 보도로 시몬스의 이적 근접 소식을 전하며 이적이 확실시됐을 때 사용하는 멘트인 'HERE WE GO'도 덧붙였다.

시몬스는 네덜란드 국적의 2003년생 공격형 미드필더다. 바르셀로나 '라 마시아' 시스템과 파리 생제르맹(PSG) 유스 팀을 거치며 성장했으며 프랑스 무대를 통해 프로에 첫발을 내디뎠다.

이후 성장을 거듭했다. PSV 에인트호번에서 잠재력을 끌어올렸으며, 라이프치히로 이적한 뒤에도 쾌조의 컨디션을 이어갔다. 시몬스는 분데스리가를 누빈 두 번의 시즌 동안 21골 21도움을 기록했다.

이에 첼시가 시몬스의 영입을 적극적으로 타진했다. 이적은 성사되기 직전이었다. 로마노 기자는 이달 초 ""첼시와 라이프치히 간의 협상이 순조롭게 진행 중이다. 개인 조건 협상도 진전된 상태""라고 이야기했다.



그러나 상황이 바뀌었다. 로마노 기자는 오늘날 ""토트넘이 공식 제안을 보낸 후 최종적으로 승인됐다. 토트넘은 선수 측과 계약 체결 및 메디컬 테스트를 몇 시간 이내에 완료하길 원하고 있는 상황이다""라고 덧붙였다.

한편, 토트넘은 얼마 전 '북런던 라이벌' 아스널에 에베레치 에제를 빼앗겼다. 토트넘은 당초 에제를 영입하기 위해 팰리스에 이적료 최대 6,000만 파운드(약 1,128억 원)를 제시할 의향이 있었던 것으로 알려졌다.

그러나 아스널이 영입전에 뛰어들었고 하이재킹에 성공했다. 이에 토트넘은 첼시의 타깃이었던 시몬스를 하이재킹하며 지난 아픔을 잊고자 한다."
20250829,"""MLS를 크게 만들기 위해 왔다""...'유니폼 1위·최고의 영입 1위' 손흥민의 목표","사진=굿모닝 아메리카


[포포투=김아인]

손흥민이 자신의 영향력으로 미국 메이저리그 사커(MLS)를 더 발전시키고 싶다고 말했다.

미국 'ABC 방송'의 '굿모닝 아메리카'는 29일(이하 한국시간) 손흥민과 나눈 단독 인터뷰를 공개했다. 미국으로 이적한 데 대해 손흥민은 ""긴장감은 좋은 거다. 그것이 행복을 주고 웃음을 준다""고 입을 열었다. 
손흥민은 지난 7일 토트넘 홋스퍼를 떠나 LAFC로 이적했다. 2,650만 달러(약 360억 원)라는 MLS 역사상 최고 이적료를 기록한 그의 이적은 미국 내 엄청난 영향을 불러일으켰다. 데뷔전에서 교체 출전한 뒤 짧은 시간에도 페널티킥을 유도해 팀의 무승부를 이끌었고, 2경기 만에 치른 선발 데뷔전에서는 MLS 첫 도움을 기록하며 2-0 승리 주역이 됐다. 

3경기 만에 데뷔골까지 터뜨렸다. 지난 24일 FC댈러스전에서 환상적인 프리킥 골로 미국 입성 후 첫 골을 터뜨린 그는 MLS 이주의 팀에도 2연속 선정되면서 팀의 중심으로 자리 잡고 있다. 손흥민 합류 후 LAFC도 MLS 서부 컨퍼런스 5위에 올라 있고, MLS 사무국은 이번 여름 이적시장 최고의 영입생으로 손흥민을 꼽으면서 LAFC의 이적 시장 평가도 A+를 줬다.

사진=게티이미지


손흥민은 미국에서의 목표에 대해 ""잉글랜드에서는 축구가 최고의 스포츠고, 거의 문화와 마찬가지다. 미국은 풋볼, 야구 등 많은 스포츠가 있다. 나는 MLS를 더 크게 만들기 위해 왔다""고 다짐했다.

미국 현지에서는 어마어마한 손흥민 효과를 누리고 있다. 그의 유니폼 판매량은 리오넬 메시, 르브론 제임스 등을 넘어 전 세계 1위를 기록했다. LAFC 경기 티켓은 5배나 급증했고, 손흥민 한 명의 영입으로 분기당 약 1억 2천만 달러(약 1680억 원)까지도 손흥민 관련 상품 판매로 수익을 볼 수 있다는 주장도 나왔다. 손흥민을 보기 위해 홈 원정 나눌 것 없이 수많은 팬들이 경기장을 찾고 있기도 하다.

이에 대해 손흥민은 ""모두가 내 이름이나 유니폼을 찾는다는 게 정말 감사하게 느낀다. 클럽과 나를 응원해주는 사람들에게 무언가 보답해야 한다는 책임감을 가져다 준다""고 고마움을 전했다.

사진=게티이미지


최근 LA 다저스에서 진행한 시구 행사에 대한 비화도 밝혔다. LA를 연고지로 하며 LAFC와 구단주가 같은 LA 다저스가 손흥민을 시구 행사에 초청하면서 만남이 이뤄졌다. 지난 28일 손흥민은 LA 다저스 홈 구장인 다저스타디움에 자신을 상징하는 7번 유니폼과 파란 LA 다저스 모자를 쓴 차림으로 나타났다. 

손흥민은 완벽한 스트라이크로 시구를 마쳤고, 다저스 선수단과도 만남을 갖는 등 미국 메이저리그 베이스볼(MLB) 무대까지 뒤흔들었다. 손흥민은 ""시구를 앞두고 동료들, 심지어 내 경호원과도 함께 연습했다. 만약 시구가 잘 안 되면 내일 훈련에 안 나오겠다고 농담도 했다""고 웃어 보였다.

#포포투 코리안리거 소식"
20250829,"""축구, 美 인기 스포츠 만들겠다"" 손흥민, '최고 시청률' 전국방송서 당찬 포부","◇사진출처=ABC GMA 홈페이지
Aug 23, 2025; Frisco, Texas, USA; Los Angeles FC forward Son Heung-Min (7) celebrates with Los Angeles FC midfielder Ryan Hollingshead (24) after scoring a goal on a free kick during the first half against FC Dallas at Toyota Stadium. Mandatory Credit: Kevin Jairaj-Imagn Images TPX IMAGES OF THE DAY

<저작권자(c) 연합뉴스, 무단 전재-재배포, AI 학습 및 활용 금지>
Aug 27, 2025; Los Angeles, California, USA; Los Angeles FC soccer forward Son Heung-min (7) waves to fans at Dodger Stadium. Mandatory Credit: Kirby Lee-Imagn Images

<저작권자(c) 연합뉴스, 무단 전재-재배포, AI 학습 및 활용 금지>
[스포츠조선 박상경 기자] 미국 메이저리그사커(MLS)에 진출한 손흥민(33·LA FC)의 위상이 하늘을 찌르고 있다.

최고 시청률을 자랑하는 아침 전국 방송까지 나섰다. 50년 역사를 자랑하는 미국 ABC의 아침 간판 프로그램 '굿모닝 아메리카(GMA)'가 28일(이하 한국시각) 손흥민과의 단독 인터뷰에 나섰다. 1975년부터 시작된 GMA는 매일 아침 미국 전역에 방송되는 ABC의 대표 프로그램이다. NBC의 '투데이'와 함께 전국 시청률 1위 자리를 다퉈왔으며, 데이타임 에미상도 3차례 수상한 바 있다. 손흥민의 출연은 그의 위상이 미국에서 어떻게 받아들여지고 있는지를 설명할 만한 부분이다.

LA FC 훈련장에서 ABC뉴스의 트레버 올트 아나운서와 마주한 손흥민은 ""잉글랜드에선 축구가 최고 스포츠다. 마치 문화와 같다""며 ""미국에는 축구, 야구 등 다양한 스포츠가 있다. 나는 MLS를 더 크게 만들기 위해 LA FC에 합류했다""고 말했다.

FOXBOROUGH, MASSACHUSETTS - AUGUST 16: Fans Son Heung-Min #7 of Los Angeles FC hold flags of South Korea prior to the MLS match between New England Revolution and Los Angeles Football Club at Gillette Stadium on August 16, 2025 in Foxborough, Massachusetts. Winslow Townson/Getty Images/AFP (Photo by Winslow Townson / GETTY IMAGES NORTH AMERICA / Getty Images via AFP)

<저작권자(c) 연합뉴스, 무단 전재-재배포, AI 학습 및 활용 금지>
Los Angeles FC soccer player Son Heung-min warms up before throwing out a ceremonial first pitch before a baseball game between the Los Angeles Dodgers and the Cincinnati Reds Wednesday, Aug. 27, 2025, in Los Angeles. (AP Photo/Mark J. Terrill)

<저작권자(c) 연합뉴스, 무단 전재-재배포, AI 학습 및 활용 금지>
미국 진출 후 엄청난 인기를 구가 중인 손흥민이다. 그가 LA FC로 이적한다는 발표가 나온 뒤 LA를 연고로 하는 타 프로팀조차 환영 메시지를 전할 정도로 큰 관심을 모았다. 다저스는 28일 간판스타 오타니 쇼헤이가 선발 등판한 홈 경기에 손흥민을 시구자로 초청하기도. 입단 발표와 동시에 LA FC가 내놓은 손흥민 유니폼은 불티나게 판매되고 있고, 원정으로 치른 3경기엔 한국계 교포들과 태극기 물결이 줄을 잇고 있다. ABC는 '2000만달러의 역대 최고 이적료로 미국 땅을 밟은 손흥민은 단 몇 주 만에 MLS 발전에 큰 영향을 미친 것으로 보인다'며 'LA FC 단장에 따르면, 손흥민의 유니폼은 판매 기록을 경신했다'고 소개했다.

손흥민은 ""팬들이 내 유니폼을 찾고 있다는 사실은 너무 감사한 일이다. 클럽과 팬들에게 뭔가를 돌려줘야 한다는 책임감도 커진다""고 말했다. 다저스 시구 행사에 대해선 ""팀 동료 뿐만 아니라 경비원과도 연습했다. 동료들에겐 '시구가 별로면 다음 날 훈련에 안 나갈 것'이라고 농담을 하기도 했다""고 미소 지었다.

손흥민은 오는 31일 샌디에이고FC와 MLS 진출 후 첫 홈 경기에 나선다. 2만2000명 수용 가능한 BMO스타디움의 입장권은 이미 매진된 것으로 알려졌다. 손흥민은 ""긴장감은 행복과 미소를 준다""며 최선을 다하겠다는 의지를 드러냈다."
20250829,"생각 자체가 다르다! '홈 데뷔전 임박' 손흥민, ""MLS를 더 크게 만들기 위해 왔다"" 각오","[인터풋볼=주대은 기자] 손흥민이 미국 메이저리그사커(MLS)를 더 크게 만들겠다고 선언했다.

손흥민은 29일(한국시간) 미국 'ABC'의 '굿모닝 아메리카'를 통해 ""긴장감은 좋은 거다. 행복과 웃음을 준다""라며 ""잉글랜드에선 축구가 최고의 스포츠다. 거의 문화다. 미국은 야구 등 많은 스포츠가 있다""라고 말했다.

이어서 ""난 MLS를 더 크게 만들기 위해 왔다. 모두가 내 이름이나 유니폼을 찾는다는 것이 정말 감사하게 느껴진다. 구단과 날 응원해 주는 사람들에게 무언가 보답해야 한다는 책임감을 가져다 준다""라고 이야기했다.

손흥민은 이번 여름 이적시장을 통해 10년 만에 토트넘 홋스퍼를 떠나 LAFC에 합류했다. 이적료는 무려 2,600만 달러(약 361억 원). 지난 2월 에마뉘엘 라테 라트가 애틀랜타 유나이티드로 이적하며 발생한 1,650만 파운드(약 309억 원)를 넘는 MLS 역대 최고 이적료다.



손흥민 효과가 대단하다. 미국 '에센셜리 스포츠'는 손흥민의 이적을 두고 ""손흥민은 MLS에 있어서 엄청난 영입이다""라며 ""손흥민의 MLS 입성은 즐라탄 이브라히모비치나 데이비드 베컴이 미친 영향보다 더 큰 것 같다""라고 분석했다.

영국 '골닷컴'은 손흥민을 영입한 LAFC를 이번 여름 이적시장 위너로 분류하며 ""이번 여름 이적시장의 가장 큰 영입""이라며 ""손흥민은 합류 후 경기장 안팎에서 게임 체인저가 됐다. 그는 이미 LAFC에 즉각적인 영향을 미쳤다""라고 전했다.

경기력도 좋다. 손흥민은 지난 10일 시카고 파이어 원정 경기에서 교체 출전해 데뷔전을 치렀다. 후반 34분 페널티킥을 유도하며 동점골에 공헌했다. 지난 17일엔 뉴잉글랜드 레볼루션 원정에서 어시스트를 기록했다. 24일 FC 댈러스 원정 경기에선 환상적인 프리킥으로 데뷔골을 기록했다.



이제 시선은 손흥민의 LAFC 홈 데뷔전으로 쏠린다. LAFC는 오는 9월 1일 미국 LA에 위치한 BMO 스타디움에서 샌디에이고를 상대한다. 부상 같은 변수가 아니라면 손흥민이 출전할 가능성이 매우 높다.

경기를 앞두고 MLS 사무국은 ""LAFC 서포터즈 TSG와 3252는 손흥민을 맞이하기 위해 음료를 제공할 계획이다. 또한 티포(현수막) 등 경기 당일 팬 활동에 대한 비밀을 유지하기 위해 많은 노력을 기울이고 있다""라고 밝혔다.

3252 회장을 맡고 있는 프리에토는 ""손흥민에게 잊지 못할 날을 선사하고 싶다. 물론 승리가 목표이지만, 손흥민이 '와, 나는 이 멋진 서포터즈와 구단을 위해 뛰고 있다'라고 느끼도록 응원하겠다. 특히 한국인들이 몰릴 것 같다. 그들은 티켓 가격의 세 배를 들여서라도 올 거다""라고 덧붙였다."
20250829,"'손흥민에게 양보 안 한 이유 있었네' 케인, 3년 만에 PK 실축…공식전 '31회 연속 성공' 기록 깨졌다","(엑스포츠뉴스 나승우 기자) 해리 케인이 토트넘 홋스퍼 시절부터 페널티킥을 독식했던 이유가 있었다. 최근 경기에서 실축하기 전까지 무려 3년 동안 한 번도 실패하지 않았을 정도로 뛰어난 결정력을 자랑했다.

뮌헨은 28일(한국시간) 독일 비스바덴에 위치한 브리타 아레나에서 열린 베헨 비스바덴과의 2025-2026시즌 독일축구연맹(DFB) 포칼 1라운드 원정 경기에서 후반 추가시간 터진 해리 케인의 결승골로 3-2 진땀승을 거뒀다.

뮌헨은 전반 16분 케인이 페널티킥으로 선제골을 뽑아내면서 앞서갔다. 후반 6분에는 마이클 올리세의 추가골로 한 점 더 달아났다.
그러나 비스바덴의 반격이 만만치 않았다. 지난 시즌 3부리그 득점왕 파티 카야가 멀티골을 작성하며 2-2 동점을 만들었다.

뮌헨은 후반 31분 페널티킥을 얻으며 다시 앞서갈 절호의 기회를 잡았다. 키커로 케인이 나섰다. 하지만 케인의 슈팅은 골키퍼 선방에 막혔다.

케인은 후반 추가시간 요시프 스타니시치의 크로스를 헤더로 연결해 비스바덴 골망을 흔들며 실수를 만회했다.



뮌헨은 케인의 결승골로 간신히 3-2 승리를 거뒀다.

경기 후 독일 방송사 란은 케인의 페널티킥 득점 기록을 조명했다.

란은 ""케인이 바이에른 뮌헨 이적 후 공식 경기에서 처음으로 페널티킥을 실축했다""고 보도했다.

매체는 ""케인은 비스바덴전 전반전에 페널티킥을 성공시키며 공식 경기에서 페널티킥을 31연속 성공시켰다. 하지만 후반전 플로리안 슈트리첼에게 막히며 뮌헨 공식 경기에서 첫 페널티킥을 실축했다""고 전했다.

매체에 따르면 케인이 마지막으로 페널티킥을 실축했던 건 3년 전으로 2022 카타르 월드컵 8강 프랑스전이 마지막이었다.

이후 토트넘 홋스퍼, 바이에른 뮌헨에서 뛴 공식 경기에서 페널티킥을 31회 연속 성공시켰다.



실로 대단한 기록이 아닐 수 없다. 아무리 뛰어난 킥 능력을 가진 선수라도 페널티킥을 31회 연속 성공시키는 건 쉽지 않은 일이다. 킥 능력 뿐만 아니라 골키퍼와의 심리전도 능하다는 뜻이다.

최근 손흥민이 미국 메이저리그사커(MLS)에서 환상 프리킥 골을 터뜨린 후 일부 토트넘 팬들이 프리킥과 페널티킥을 독식했던 케인에 대한 비판을 내놓기도 했다.

그러나 3년 동안 한 번도 페널티킥을 실패하지 않았던 기록을 보면 토트넘 시절 손흥민에게 페널티킥 기회를 양보하지 않고 키커 역할을 도맡았던 확실한 이유가 있었던 셈이다.

사진=연합뉴스"
