date,title,content
20250704,"'참혹하다' 조타 사망사고 현장, 형체도 못 알아볼 슈퍼카... ""과속 가능성""","[스타뉴스 | 박건도 기자]
조타와 그의 동생 안드레가 탑승했던 차량 잔해. /사진=CNN 갈무리
지오구 조타의 죽음을 추모한 크리스티아누 호날두. /사진=크리스티아누 호날두 개인 사회관계망서비스(SNS)
지오구 조타와 그의 동생 안드레 실바의 사망사고 현장은 참혹했다. 두 사람이 탄 차량은 형체를 알아볼 수 없을 정도로 파손됐다.

영국 매체 '텔레그래프'는 4일(한국시간) ""리버풀 공격수 조타는 영국으로 가는 비행기를 타는 대신 스페인 페리까지 10시간을 운전할 예정이었다. 안타깝게도 그는 교통사고로 사망했다""고 보도했다.
이어 매체는 ""조타와 그의 동생 안드레는 팔라시오스 데 사나브리아의 A-52 고속도로 잔해 속에서 숨진 채 발견됐다""며 ""목격자들에 따르면 차량은 불길에 휩싸였고, 인근 초목에도 불이 옮겨붙었다""고 알렸다.

잉글랜드 프리미어리그(EPL)와 포르투갈 국가대표팀의 수준급 공격수로 통하는 조타는 갑작스러운 차량사고로 사망했다. 영국 현지 보도에 따르면 리버풀 홈구장인 안필드 앞에는 조타를 애도하는 머플러와 유니폼들이 놓였다.

특히 조타는 불과 11일 전 오랜 연인인 루테 카르도소와 결혼한 것으로 알려졌다. 세 아이를 둔 아버지이자 뛰어난 선수의 사망에 축구계가 큰 충격에 빠졌다.

불운의 연속이었다. 조타는 지난 시즌 10월 첼시와 경기에서 갈비뼈 부상을 당해 가벼운 폐 수술을 받은 것으로 알려졌다. 해당 수술로 인해 의료진은 조타에게 이동 시 비행기 대신 차량 운전을 권고했다. 'BBC' 등에 따르면 사고 당시 조타는 리버풀 프리시즌 합류를 위해 이동 중이었다.

조타와 안드레의 사망사고가 일어난 고속도로. /AFPBBNews=뉴스1
조타와 안드레의 차량 사고 현장. /AFPBBNews=뉴스1
조타가 탄 연두색 람보르기니 차량은 형체도 알아볼 수 없을 정도로 파손됐다. 사고가 일어난 사모라 현지 소식통은 ""과속 사고 가능성을 조사 중""이라고 전했다. 사고 차량은 람보르기니 우라칸 에보 스파이더로 추정된다. 경찰은 ""아직 누가 운전했는지는 파악하지 못했다""고 했다.

아르네 슬롯 리버풀 감독은 ""충격과 고통이 극심한 시기다. 어떤 말을 할 수 있겠나""라며 ""진심으로 사랑했던 선수이자 사람이 떠났다. 지오구와 안드레의 가족이 가장 힘들 것이다""라고 했다.

리버풀 동료인 앤디 로버트슨은 ""조타 가족의 상실감은 감당하기 힘든 수준일 것""이라며 ""지오구와 안드레, 두 소중한 영혼을 잃어 정말 안타깝다""고 추모했다.

포르투갈 대표팀에서 함께한 크리스티아누 호날두(알 나스르)도 ""믿을 수 없다. 불과 며칠 전에 결혼했는데""라며 안타까워했다.

조타의 장례식은 포르투갈 포르투에서 진행될 예정이다.

조타를 추모하는 리버풀 팬들의 머플러. /AFPBBNews=뉴스1"
20250704,"리버풀, 교통사고로 숨진 디오구 조타 등번호 20번 영구결번","교통사고로 숨진 공격수 디오구 조타를 추모하기 위해 리버풀의 안방 경기장인 안필드 앞에 모인 팬들. 리버풀=AP 뉴시스.

잉글랜드 프리미어리그(EPL) 리버풀이 교통사고로 세상을 떠난 디오구 조타(29)의 등번호 20번을 영구결번 지정하기로 했다.

리버풀은 4일 구단 홈페이지를 통해 “우리 팀의 20번째 우승에 기여한 조타의 등번호(20번)는 영원히 기억될 것”이라고 전했다. 리버풀은 2024~2025시즌 EPL 정상에 오르며 잉글랜드 최상위 리그 20번째 우승을 달성했다.

조타는 3일 스페인 사모라에서 동생 안드레 실바와 자신의 람보르기니 차량을 타고 고속도로를 달리던 중 교통사고를 당해 숨졌다. 오랜 연인 루트 카르도수와 지난달 22일 뒤늦게 결혼식을 올린 지 약 2주 만에 사고를 당했다.

조타는 EPL 울버햄프턴과 리버풀 등에서 뛰면서 정규리그 190경기에 출전해 63골을 넣었다. 포르투갈 국가대표팀에선 A매치 통산 49경기에 출전해 14골을 터뜨렸다.

여러 축구계 인사와 구단들이 갑작스럽게 사망한 조타를 추모했다. 포르투갈 대표팀 주장인 호날두는 자신의 소셜미디어를 통해 “말도 안 된다. 우리는 얼마 전까지만 해도 대표팀에서 함께 뛰었는데”라며 슬퍼했다. 조타는 지난달 호날두와 2024~2025시즌 유럽축구연맹(UEFA) 네이션스리그 우승을 합작했다.

리버풀의 안방 경기장인 안필드 주변에도 팬들의 추모 발걸음이 끊이지 않았다. 팬들은 조타의 유니폼과 응원 머플러, 추모 꽃다발 등을 경기장 앞에 놓고 추모했다."
20250704,"[속보] ""손흥민 토트넘 잔류 확정""→UCL 우승 도전 선언!…""다음주 프랑크 감독과 계획 논의""","▲ 'Last word on spurs' SNS


[스포티비뉴스=박대현 기자] 손흥민(33)이 토트넘 홋스퍼에 잔류한다.

토트넘 소식을 다루는 팟캐스트 '라스트 워드 온 스퍼스'는 4일(한국시간) ""손흥민이 스퍼스에 남기로 결정했다. 다음 주께 토마스 프랑크 신임 감독과 만나 이 같은 계획을 논의할 예정""이라고 속보로 전했다.

""최근 미국 메이저리그 사커(MLS) 로스앤젤레스(LA) FC와 이적 협상을 진행했음에도 손흥민의 목표는 유럽축구연맹(UEFA) 챔피언스리그 우승에 마지막으로 한 번 도전하는 것""이라고 덧붙였다.
올여름 손흥민의 차기 거취를 둘러싸고 사우디아라비아 프로페셔널 리그(SPL)와 MLS, 옛 스승 주제 무리뉴 감독이 이끄는 페네르바흐체(튀르키예) 등 다양한 후보가 물망에 올랐다. 다만 4일 영국 현지 매체가 '북런던 잔류' 가능성을 시사해 눈길을 모았다.

영국 '더 하드 태클'은 이날 ""손흥민은 토트넘과 계약을 만료하는 내년 6월까지 북런던에 잔류할 수도 있다. 신임 사령탑과 함께 UEFA 챔피언스리그 출전에 비중을 둘 가능성이 있기 때문""이라고 적었다.

""이번 여름 다양한 이적설에 노출된 손흥민이 자신의 차기 거취에 어떻게 생각하는지는 아직 불확실하다. 떠날 가능성이 충분히 있지만 토트넘 잔류를 전격 고려할 수도 있는 것""이라고 덧붙였다.



다만 손흥민이 실제 잔류를 선택할 경우 지난달 이적료 3000만 파운드(약 550억 원)에 완전 이적을 완료, 프랑크 체제 1호 영입으로 등극한 마티스 텔의 백업 역할을 맡을 확률이 유력하다. 실제 스퍼스 내부사정에 밝은 영국 '풋볼 런던' 소속의 알레스데어 골드 기자에 따르면 프랑크 감독은 손흥민에게 주전 입지를 보장할 수 없다는 메시지를 건네 이선 후퇴 또는 이적을 독려하는 분위기를 드러냈다.

아울러 풋볼 런던은 ""토트넘은 차기 시즌 잉글랜드 프리미어리그와 UCL을 비롯한 총 4개 대회에 참가해야 한다. 그러기 위해선 파이널 서드에 충분한 자원을 갖춰야 한다"" 진단하며 손흥민을 다음 시즌 스퍼스 예상 공격진 명단에서 배제하는 다소 충격적인 전망을 내놨다. 매체는 프랑크 감독이 브렌트포드에서처럼 4-2-3-1 포메이션을 가동할 것으로 예측해 차기 시즌 중용할 12명의 공격진을 나열했는데 여기에 손흥민은 배제됐다.

풋볼 런던은 손흥민이 주로 뛰던 왼쪽 윙어에 텔과 마노르 솔로몬, 마이키 무어 등 3명을 올렸다. 손흥민이 종종 뛴 최전방 원 톱에는 도미닉 솔란케와 히샤를리송, 데인 스칼렛이 프랑크 감독 부름을 자주 받을 것으로 예상했다.

오른쪽 윙어로는 기존 브레넌 존슨, 윌송 오도베르가 버티는 그림에 올여름 웨스트햄 유나이티드와 협상 중인 모하메드 쿠두스를 더했다. 현재 토트넘은 웨스트햄과 쿠두스 영입을 두고 협상 중인데 지난달 이적료 5000만 파운드(약 929억 원)를 제시했지만 거부당했다. 10번 공격형 미드필더 자리는 데얀 쿨루셉스키와 제임스 매디슨, 제이미 돈리가 이름을 올렸다.

풋볼 런던은 ""손흥민의 이탈을 고려하면 텔이 왼쪽에서 꾸준히 선발 출장할 것""이라며 ""솔로몬 역시 리즈 유나이티드에서 보여준 활약을 이어 간다면 레프트 윙어로 고려될 수 있다. 왼 측면이 주 포지션인 무어는 자신이 선호하는 위치에서 많은 기회를 얻게 될 것""이라고 강조했다.



한국인 공격수가 프랑크 감독의 시즌 구상에서 제외돼 있다는 전망이 힘을 얻는 가운데 손흥민은 최근 MLS와 강하게 연결됐다. 구체적인 구단명도 공개됐다. 올 시즌 MLS 7위를 달리는 팀으로 과거 토트넘에서 한솥밥을 먹은 프랑스 국가대표 출신 골키퍼 위고 요리스가 뛰고 있는 LA FC가 차기 행선지 후보로 급부상했다.

영국 'TBR 풋볼'은 전날 ""LA FC는 토트넘 주장 손흥민과 미국행에 관한 구체적인 논의를 시작했다. 구단은 올여름 이적시장에서 손흥민을 데려오기 위한 파격적인 영입을 추진 중""이라고 단독 보도했다.

LA FC의 손흥민 영입 추진에 활기가 돈 배경은 MLS 특유의 샐러리캡 제도에 있다. MLS는 '지정 선수 규정(Designated Player Rule)'이란 독특한 제도를 운영하는 리그다. 지정 선수란 구단이 샐러리캡 적용을 받지 않고 연봉 상한선 초과 급여를 지불할 수 있는 계약자를 가리키는데 팀마다 최대 3명까지 보유할 수 있다. 다만 이 3명은 샐러리캡을 계산할 때 상한선을 꽉 채운 최고 연봉자로 취급받는다.

TBR 풋볼에 따르면 LA FC는 올여름 지정 선수(DP·Designated Player) 세 자리 중 하나를 차지하던 프랑스 국가대표 출신 공격수 올리비에 지루가 LOSC 릴(프랑스)로 이적을 결심하면서 한 자리가 비게 됐다. 덕분에 손흥민을 품에 안을 여력을 확보할 수 있게 된 것이다.

그러나 손흥민은 차기 시즌 주전 입지를 보장받지 못할 가능성이 유력한 상황서도 잔류 결심을 굳힘에 따라 SPL과 MLS, 튀르키예행 모두 수면 밑으로 가라앉을 전망이다. 올해 유로파리그 우승컵을 들어 올려 숙원이던 '트로피 수집' 목표를 마침내 달성한 그가 본인의 열망대로 차기 시즌 UCL에서도 더 높은 곳을 향해 발 디딜 수 있을지 주목된다."
20250704,"'메시 꿇어!' 韓 축구 역대급 '오피셜' 임박! …""손흥민 노리는 美 LA FC, 엄청난 거래 진행 중""→SON, 새 감독과 담판","(엑스포츠뉴스 권동환 기자) 토트넘 홋스퍼 주장 손흥민의 미국 메이저리그사커(MLS) 진출 여부가 조만간 가려질 것으로 보인다.

리오넬 메시와 드디어 같은 리그에서 뛸 가능성이 생겼다.

영국 매체 '풋볼 런던'은 3일(한국시간) ""이번 주가 끝나면 토마스 프랭크 감독은 토트넘의 새로운 사령탑으로서의 구체적인 업무에 대해 이야기할 예정이다""라고 보도했다.

토트넘은 2024-25시즌 종료 후 안지 포스테코글루 감독과 결별하고, 프리미어리그 클럽 브렌트퍼드를 이끈 덴마크 출신 토마스 프랭크 감독을 선임했다.

여름 휴가 기간이 곧 끝나면서 토트넘 선수들은 조만간 클럽에 복귀해 프랭크 감독과 만남을 가질 예정이다. 이때 손흥민은 프랭크 감독과 미래를 두고 진지한 대화를 나눌 계획인 것으로 알려졌다.



매체는 ""첫 몇몇 선수는 토요일(5일) 복귀하지만, 지난 6월에 A매치를 치렀던 선수들은 다음 주부터 훈련장으로 복귀할 예정이다""라고 설명했다.

이어 ""그 선수 그룹에는 프랭크 감독이 대화를 나누고 싶어 할 주요 인물들이 포함될 것""이라며 ""예를 들어, 주장 손흥민과 부주장 크리스티안 로메로가 있다""라고 덧붙였다.
그러면서 ""손흥민과 로메로 모두 클럽에서의 미래가 불확실하다""라며 ""두 사람은 프랭크 감독이 자신들을 위해 어떤 생각을 가지고 있는지 직접 듣고, 앞으로 무엇을 하고 싶은지에 대한 자신의 견해를 말하기를 기다릴 것""이라고 전했다.

손흥민은 지난달 대한민국 축구대표팀에서 A매치 일정을 소화했기에 일주일 안에 토트넘으로 돌아갈 것으로 예상된다. 복귀 후 그는 프랭크 감독과 대화를 통해 이적과 잔류 여부를 결정할 예정이다.



2015년부터 토트넘에서 활약한 손흥민은 이번 여름 그 어느 때보다 클럽을 떠날 가능성이 높은 상황이다.

글로벌 매체 '디 애슬레틱'은 지난 1일 이번 여름 토트넘을 떠날 가능성이 있는 선수들 중 한 명으로 손흥민을 언급했다.

손흥민에 대해 언론은 ""지난 시즌 말 토트넘은 계약 연장 옵션을 발동했고, 이제 계약은 1년이 남았다""라며 ""사우디아라비아를 비롯해 손흥민에 대한 관심이 많다""라고 보도했다.

또 ""올여름 구단에서 10년을 보낸 후 드디어 메이저 트로피를 거머쥔 지금이 이별을 하기에 완벽한 순간이 될 수 있다는 느낌이 든다""라며 ""하지만 8월 3일 토트넘이 서울에서 뉴캐슬 유나이티드와 경기를 치르기 전까지는 별다른 이적은 없을 것으로 보인다""라고 밝혔다.



토트넘 소식에 정통한 '풋볼 런던'의 알레스데어 골드 기자도 이번 여름 손흥민이 토트넘을 떠날 가능성이 그 어느 때보다 높다고 주장했다.

골드 기자는 ""우리는 손흥민이 토트넘에서 마침내 트로피를 들어올리는 꿈을 이룬 후, 올해는 그 어느 때보다 팀을 떠날 의향이 더 크다고 보도했다""라며 ""10년간 팀을 이끌어 온 만큼, 토트넘은 이적료를 받을 마지막 기회를 잡기 위해 손흥민을 문밖으로 밀어내기보다는 손흥민이 미래를 결정하도록 내버려 둘 것으로 예상된다""라고 전했다.

더불어 ""손흥민은 미국 MLS에서 뛰는 데 관심이 있는 것으로 알려졌지만, 사우디 프로리그 구단들은 여전히 그를 프리미어리그에서 빼내려 하고 있다""라고 했다.

그러면서 ""선수들이 다음 주부터 단계적으로 프리시즌 훈련에 복귀함에 따라, 손흥민은 먼저 홋스퍼 웨이에서 프랭크 감독과 만나 토트넘의 미래와 챔피언스리그 진출을 위한 시즌 계획에 대해 논의할 예정이다""라고 설명했다.



일각에선 손흥민이 토트넘의 신임 사령탑 프랭크 감독의 전술과 맞지 않기에 프랭크 감독이 손흥민의 이적을 허락할 것으로 예상했다.

영국 'TBR 스포츠는 ""32세의 나이에 손흥민의 힘이 쇠퇴하기 시작했다는 것은 의심의 여지가 없으며, 지난 시즌 손흥민의 성적은 하락세를 보였다""라며 ""그는 여전히 인상적인 공격포인트 21개를 달성했지만, 그의 폭발력과 마무리 능력은 예전만큼 뛰어나지 않았다""라고 지적했다.

매체는 ""프랭크 감독의 빠른 속도의 시스템에서 손흥민은 적응하고 토트넘에서 보여주었던 역동성을 제공하려고 노력하는데 어려움을 겪을 수도 있다""라며 손흥민이 새 감독 전술에 적응하지 못할 수도 있다며 우려를 표했다.

만약 프랭크 감독과 토트넘이 손흥민을 매각하기로 결정했다면, 손흥민의 다음 행선지는 미국 MLS 클럽 LA FC가 될 가능성이 있다.



'TBR 풋볼'은 지난 3일 ""LA FC는 이번 여름 전설적인 토트넘 주장을 데려오기 위한 엄청난 거래를 진행 중이다""라고 보도했다.

이어 ""토마스 프랭크 감독은 손흥민을 매각하는 데 관심이 있지만, 손흥민의 미래에 대한 최종 결정은 선수 본인이 내릴 예정이다""라며 ""손흥민은 올여름 MLS와 사우디 프로리그의 관심으로 토트넘 홋스퍼를 떠날 큰 기회를 갖게 됐다""라고 덧붙였다.

매체에 따르면 'TBR 풋볼'의 수석 기자 그레임 베일리는 LA FC가 지정 선수(Designated Player) 자리 하나를 비우면서 손흥민을 영입할 수 있게 됐다고 주장했다.

MLS 클럽들은 1군 선수단 연봉 총액(샐러리 캡)과 선수 한 명한테 줄 수 있는 최대 연봉이 정해져 있다.



이때 규정에 따라 클럽들은 최대 3명까지 연봉 상한선을 초과하는 급여를 줄 수 있고, 이 3명은 '지정 선수'라고 부른다. 이 3명은 샐러리 캡을 계산할 때 최고 연봉을 받는 것으로 취급한다.

그동안 LA FC에서 지정 선수 3자리 중 하나를 차지하고 있던 건 프랑스 공겨수 올리비에 지루였는데, 지루가 최근 프랑스 LOSC릴로 이적하면서 지정 선수에 빈 자리가 생겼다.

매체도 ""올리비에 지루가 LA FC를 떠났다는 것은 이제 손흥민을 영입할 자리가 생겼다는 것을 의미한다""라고 밝혔다.

더불어 ""손흥민은 현재 토트넘에서 주당 약 19만 파운드(약 3억 5300만원)를 받고 있으며 이적료가 필요하므로 LA FC는 손흥민을 지정 선수 자리 중 하나에 추가해야 할 것""이라고 했다.

사진=토트넘 SNS, 연합뉴스"
20250704,"""아이들이 아빠없이 깨어나"" 숨막히게 눈물나는 '오피셜'…""故 조타 등번호 20번, 영구결번 확정"" 리버풀 공식발표 ""승리를 이끌었던 별, 영원히 잠들었다""","[스포티비뉴스=박대성 기자] 리버풀이 비극적인 사고로 세상을 떠난 공격수 디오구 조타(28)의 등번호 '20번'을 영구결번으로 지정했다.

리버풀은 4일(한국시간) 공식 채널을 통해 ""조타의 마지막 축구 인생은 프리미어리그 우승과 UEFA 네이션스리그 우승이라는 영광의 순간으로 장식됐다. 그가 마지막으로 달았던 등번호 20번은 구단의 20번째 리그 우승에 대한 상징이자 헌사로서 영구 결번된다""고 발표했다.

비극은 스페인 사모라 지방에서 발생했다. 영국 공영방송 'BBC'에 따르면, 조타와 그의 동생 안드레 실바는 람보르기니 차량을 타고 가던 중 시속 약 65km로 A-52 고속도로를 달렸는데 중앙분리대 근처에서 사고를 당했다. 차량은 타이어 폭발 후 추월 과정에서 도로를 벗어나 화재가 발생했고, 두 형제는 그 자리에서 숨졌다.

조타는 11일 전 오랜 연인 루테 카르도소와 결혼식을 올렸고, 슬하에 세 자녀를 두고 있었다. 그는 건강상의 이유로 비행기 대신 자동차와 배를 이용해 영국으로 돌아가던 중이었다.

사고 소식이 전해진 직후, 리버풀은 충격과 슬픔을 감추지 못했다. 구단은 ""조타와 그의 동생 안드레가 스페인에서 교통사고로 사망했다는 비보를 접하고 깊은 충격에 빠졌다""며 ""조타의 가족, 친구, 동료, 구단 스태프 모두 상상할 수 없는 상실을 겪고 있으며, 우리는 그들의 프라이버시를 존중하며 전폭적인 지원을 약속한다""고 밝혔다.



리버풀 팬들은 안필드에 모여 조타를 추모했고, 힐스버러 참사 추모비 주변에는 조타의 유니폼, 꽃다발, 메시지 카드, 스카프 등이 쌓였다. 구단은 팬들이 직접 조타를 기릴 수 있도록 온라인과 오프라인 추모 공간을 열었으며, 오는 주말까지 운영될 예정이다.

포르투갈 축구협회도 깊은 애도를 표했다. 협회는 ""디오구 조타는 단순한 국가대표 선수를 넘어 모두에게 사랑받는 인물이었다. 조타는 명랑한 성격을 가졌고 동료들에게 기쁨을 퍼트렸다. 상대팀 선수들에게도 존중받던 품격 있는 선수였다""고 전했다. 이어 UEFA는 여자 유로 2025 예선에서 포르투갈-스페인 경기 전 묵념을 요청했다.
조타는 1996년 포르투갈 곤도마르 출신으로, 파코스 데 페레이라 유스팀에서 성장해 2015년 프로에 데뷔했다. 이후 2016년 아틀레티코 마드리드로 이적하며 빅리그에 입성했지만, FC포르투와 울버햄튼 원더러스로 임대되어 실전 경험을 쌓았다.

울버햄튼에서는 2017-18시즌 챔피언십에서 17골을 터뜨리며 팀을 프리미어리그로 승격시켰고, 2018년 완전 이적 후 프리미어리그에서 강한 인상을 남겼다. 이어 2020년, 약 4,470만 유로(약 716억 원)의 이적료로 리버풀에 합류했다.



리버풀에서 조타는 총 182경기에서 65골을 기록했으며, 2021-22 시즌 FA컵과 리그컵을 동시에 들어올렸다. 그 시즌 UEFA 챔피언스리그 준우승을 차지하며 리버풀의 핵심 공격수로 자리매김했다.

지난 2024-25 시즌에는 리버풀의 프리미어리그 20번째 우승에 결정적인 기여를 하며, 구단 역사에 길이 남을 발자취를 남겼다. 그가 안필드 '더 콥' 앞에서 머지사이드 더비에서 터뜨린 결승골은 그의 마지막 득점으로 기록되며, 많은 팬들의 가슴에 남을 명장면으로 남았다.

리버풀 위르겐 클롭 전 감독은 ""말로 표현할 수 없는 고통의 순간이다. 분명 더 큰 의미가 있겠지만, 나는 그것을 아직 볼 수 없다. 조타는 뛰어난 선수이자 다정한 남편, 아버지였고, 우리는 그를 몹시 그리워할 것""이라 전했다.

전 소속팀 울버햄튼도 공식 성명을 통해 ""디오구는 우리 모두에게 특별한 존재였다. 그와 함께한 모든 순간은 잊지 못할 것이며, 그의 가족과 사랑하는 이들에게 깊은 애도를 보낸다""고 전했다.

2019년부터 포르투갈 대표팀에서 뛰었떤 주앙 칸셀루는 ""오늘 세 아이가 아빠없이 깨어났다. 어느 어머니와 아버지가 두 아들 없이 일어나게 됐다. 한 아내가 남편 없이 깨어났다. 오늘 우리 모두는 충격에 빠져 깨어났다""라며 자신의 사회관계망서비스 채널에 가슴아픈 글귀를 적었다.

포르투갈 대표팀에서도 조타는 49경기 14골을 기록하며 큰 활약을 펼쳤다. 마지막 공식전은 지난 6월 8일 UEFA 네이션스리그 결승전 스페인전으로, 조국에 트로피를 안긴 역사적인 날이 그의 마지막 경기로 남게 되었다.

이제 리버풀의 등번호 20번은 더 이상 누군가의 유니폼에 붙지 않는다. 그것은 오직 디오구 조타의 것이며, 그가 남긴 업적과 기억은 영원히 구단과 팬들의 마음속에 살아있을 것이다."
