date,title,content
20250511,이강인 4달 만에 리그 풀타임! '패스 93%'... '19살 원더골→하무스 해트트릭' PSG 4-1 대승,"[스타뉴스 | 이원희 기자]
경기 전 몸을 푸는 이강인. /사진=PSG SNS
기뻐하는 PSG 선수들. /사진=PSG SNS
'골든보이' 이강인(24·파리 생제르맹)이 모처럼 선발 출전해 소속팀 승리에 힘을 보탰다.

파리 생제르맹(PSG)은 11일 오전 4시(한국시간) 프랑스 프랑스 몽펠리에에 위치한 스타드 드 라 모송에서 열린 2024~2025 프랑스 리그1 33라운드 몽펠리에와 원정 경기에서 포르투갈 공격수 곤살루 하무스의 해트트릭을 앞세워 4-1 대승을 거뒀다.

이미 리그 우승을 확정 지은 PSG는 25승6무2패(승점 81)를 기록하게 됐다. 직전 리그 3경기에서 1무2패로 부진했는데 4경기 만에 승리를 추가했다.

대한민국 미드필더 이강인도 선발 명단에 이름을 올렸다. 올 시즌 주전 경쟁에서 밀려 유럽챔피언스리그(UCL)에 결장하는 등 힘든 시간을 보내고 있으나, 리그 경기에선 꾸준히 출전하며 기회를 받고 있다. 다만 리그 풀타임은 오랜만이다. 무려 4달 만. 이강인의 마지막 리그 풀타임 경기는 지난 1월에 열린 생테티엔전이었다. 다만 지난 2월 쿠프 드 프랭스(컵대회)에서 풀타임을 소화하기는 했다.
이날 이강인은 팀 3-4-3 포메이션의 왼쪽 미드필더로 출전했고, 교체 없이 풀타임을 소화했다. 또 슈팅 1회와 패스성공률 93%, 키패스 1회 등을 기록했다.

유럽축구 통계매체 풋몹은 이강인에게 평점 6.6을 부여했다. 다른 PSG 선수들이 대부분 평점 7점대를 기록한 것을 생각하면 조금 아쉬운 부분이다. 또 다른 통계매체 후스코어드닷컴의 평점도 6.69였다. 소파스코어는 평점 6.9를 주었다.

이날 루이스 엔리케 PSG 감독은 후보 선수들을 대거 투입해 로테이션을 돌렸다. '2008년생 공격수' 이브라힘 음바예, 또 다른 유망주 미드필더 세니 마율루(19)도 선발 출전했다. 수비진에선 '18세 기대주' 악셀 타페 코브리사가 리그 데뷔전을 치렀다. 주전 멤버라고 하면 데지레 두에 정도였다.

하지만 PSG는 압도적인 전력을 과시했다. 패스 플레이로 서서히 점유율을 늘려간 PSG는 슈팅 기회도 잡았다. 전반 32분 브래들리 바르콜라의 슈팅이 골대를 강타했다. 전반 42분에는 음바예가 골키퍼와 일대일로 맞서는 찬스를 놓쳤다. 로빙슛을 시도했으나 골키퍼 키를 넘기지 못했다. PSG의 선제골은 전반 44분에 터졌다. 주인공은 마율루. 페널티박스에서 강력한 왼발 슈팅을 날려 골망을 흔들었다.

세니 마율루의 골 세리머니. /사진=PSG SNS
분위기를 잡은 PSG는 후반이 되자 더욱 강하게 공격을 몰아쳤다. 최전방 공격수 하무스의 득점이 폭발했다. 먼저 하무스는 후반 4분 음바예를 패스를 다이렉스 슈팅으로 연결해 골망을 흔들었다. 후반 13분에는 두에가 페널티킥을 얻었는데, 키커로 나선 하무스가 침착하게 성공시켰다.

몽펠리에도 후반 19분 탕귀 쿨리바리가 만회골을 터뜨렸지만, PSG의 공격은 계속됐다. 하무스가 후반 20분에도 골을 터뜨려 해트트릭을 만들었다. 페널티박스에서 상대 수비진의 압박을 이겨내고 절묘한 슈팅을 날려 마침표를 찍었다. 상대 골키퍼도 움직이지 못한 환상적인 골이었다. 결국 PSG가 적지에서 대승을 낚았다.

곤살루 하무스(오른쪽)의 골 세리머니. /사진=PSG SNS"
20250511,"'인종차별+홀대' 없었다...'韓 역사상 최초 대기록' 김민재 등 떠밀은 뮌헨 동료들, KIM 세리머니에 '다같이 만세'","사진=트위터 캡처
AFP연합뉴스
AFP연합뉴스
[스포츠조선 이현석 기자]김민재가 팀 동료들의 지지와 함께 바이에른 뮌헨 우승 세리머니에서 기쁨의 만세까지 해냈다.

바이에른은 11일(한국시각) 독일 뮌헨의 알리안츠 아레나에서 열린 묀헨글라트바으화의 2024~2025시즌 분데스리가 33라운드 경기에서 2대0으로 승리했다. 바이에른은 이미 지난 32라운드 무승부 이후 2위 레버쿠젠이 32라운드에서 무승부를 기록하며 일찌감치 우승을 확정했다. 이날 경기를 앞두고 선수단은 구단 직원들로부터 가드 오브 아너를 받기도 했으며, 해리 케인을 비롯해 바이에른 선수단은 우승 파티를 즐기는 모습이 공개되기도 했다.
이날 경기 후에는 트로피 세리머니가 진행됐다. 올 시즌 부상으로 인해 조금 일찍 시즌을 마감한 김민재도 빠지지 않았다. 독일의 TZ는 '뱅상 콤파니 감독은 오랫동안 활약한 김민재를 시즌 종료 시점까지 휴식시키기로 결정했다'라며 '김민재는 리그 우승 이후 클럽 월드컵에서 다음 우승을 위해 기여할 예정이다. 에릭 다이어의 이적, 이토 히로키의 부상, 다욧 우파메카노의 복귀 날짜 불확실 등으로 인해 바이에른은 수비진 인력에 문제가 생겼고, 클럽 월드컵에서 건강한 김민재가 절실하게 필요할 수 있다'라고 전했다.

김민재는 부상으로 결장한 김민재의 헌신을 잊지 않았다. 트로피 세리머니 도중 김민재가 다른 선수들에게 양보를 하자, 토마스 뮐러, 에릭 다이어, 해리 케인이 김민재에게 얼른 트로피 세리머니를 진행하라는 의미에서 등을 떠밀었다. 김민재는 이를 거부하고 나가지 않으려 했지만, 동료들의 계속된 시도에 마이스터샬레를 받아들었다. 김민재는 이후 세리머니 과정에서는 동료들을 속이는 재치까지 선보이며 즐겁게 트로피 세리머니를 진행했다.

AFP연합뉴스
김민재는 올 시즌 부상에도 불구하고 시즌 막판까지 팀 수비진을 지키며 바이에른 우승에 크게 공헌했다. 지난 시즌 후반기부터 올 시즌 초반까지 들었던 비판을 뒤집으며 좋은 모습을 보여줬었다. 토마스 투헬 체제에서 주전 경쟁을 밀렸던 김민재는 올 시즌 다시 뱅상 콤파니 감독 체제에서 주전 센터백으로 자리 잡았다.

다만 부상이 발목을 잡았다. 무려 지난해 10월부터 이어진 부상이었다. 당시 독일 언론은 '지난해 10월 프랑크푸르트전 당시 김민재에게 아킬레스건 문제가 발생했다. 겨울 휴식기 중에도 이 염증을 제거하지 못한 것으로 보인다'라며 '김민재는 10월 초부터 발목 통증을 호소하고 있다. 아킬레스건에 문제가 있다. 만약 김민재의 아킬레스 문제가 심해지고 그가 장기간 결장한다면 이것이 최악의 시나리오가 될 것이다'라고 전했었다.

김민재는 자리를 비울 수 없었다. 시즌 막판 우파메카노, 이토 등이 연달아 시즌 아웃되며 김민재는 부상에도 불구하고 휴식 없이 경기를 소화해야 했다. 이 과정에서 경기력 문제가 발생하며 비판을 받기도 했으나, 김민재는 묵묵히 경기를 뛰며 바이에른 수비를 지켰다. 결국 시즌이 거의 마무리되고 우승이 거의 확정된 뒤에야 콤파니 감독은 김민재의 휴식을 결정할 수 있었다. 김민재의 휴식과 더불어 바이에른이 우승을 확정하며 더 큰 기쁨을 즐길 수 있었다. 또한 김민재는 이번 우승으로 한국 축구 선수 최초로 유럽 5대 리그 2관왕을 달성했다.

AFP연합뉴스
한편 김민재는 최근 혹사 논란에 이어 바이에른의 우승 이후 인종차별 논란까지 등장해 실망감이 클 수 있는 상황이 반복되던 중이었다. 발단은 바이에른 공식 유튜브 채널이었다. 우승 이후 바이에른은 공식 유튜브 채널을 통해 '우승컵을 집으로 가져왔다'는 기념 영상을 올렸다. 이 영상의 섬네일에는 올 시즌 팀을 우승으로 이끈 주전 선수들이 대거 포함됐다. 문제는 김민재였다. 올 시즌 수비진에서 가장 꾸준히 활약했던 김민재만이 사진에서 제외됐다. 후보였던 레온 고레츠카, 부상으로 장기 이탈한 다욧 우파메카노, 알폰소 데이비스까지 포함된 상황에서 김민재의 모습을 찾아볼 수 없었다.

해당 사진은 이미 바이에른 우승 이후 공식 SNS에 올라왔던 사진으로, 이전 버전에서는 김민재가 있었다. 하지만 핵심 선수를 간추린 영상 섬네일에서는 김민재만 유일하게 제외됐다. 팬들은 거세게 반발했다. 인종차별 의혹까지 등장하며 댓글로 불만을 표했다. 바이에른은 팬들의 비판과 함께 섬네일을 교체했는데, 김민재를 추가한 버전 대신, 기존 포스터를 그대로 사용하는 방식으로 교체했다. 이후 바이에른이 김민재가 가마에 탄 포스터를 올렸지만, 논란은 쉽게 잠잠해지지 않았었다. 다행히 이날 트로피 세리머니에서는 김민재를 향한 동료들의 뜨거운 지지와 함께 논란에 다시 불을 붙일 상황은 발생하지 않았다.

이현석 기자 digh1229@sportschosun.com"
20250511,"""민재야, 너도 빨리해!"" 케인→뮐러→다이어, '푸대접 논란' KIM 헌신 인정 '우승 세리머니' 재촉","사진=AFP 연합뉴스
사진=중계 화면 캡처
[스포츠조선 김가을 기자]'괴물 수비수' 김민재(바이에른 뮌헨)가 동료들의 뜨거운 격려 속 우승 세리머니를 즐겼다.

빈센트 콤파니 감독이 이끄는 바이에른 뮌헨은 11일(이하 한국시각) 독일 뮌헨의 알리안츠 아레나에서 열린 묀헨글라트바흐와의 2024~2025시즌 독일 분데스리가 홈경기에서 2대0으로 이겼다. 일찌감치 우승을 확정한 바이에른 뮌헨(24승7무2패)은 승리 뒤 환하게 웃으며 트로피 세리머니를 펼쳤다.
이날 김민재는 부상으로 경기에 완전 제외됐다. 앞서 독일 언론을 통해 '김민재가 2024~2025시즌 바이에른 뮌헨에서 더 이상 경기에 출전하지 않을 것이다. 콤파니 감독은 김민재의 지속적 부상 문제로 인해 올 시즌 남은 경기에 출전시키지 않기로 결정했다. 김민재는 이 시간을 이용해 휴식을 취한다. 국제축구연맹(FIFA) 월드컵을 위해 컨디션을 회복할 예정'이라고 보도했다.

김민재는 올 시즌 바이에른 뮌헨 수비의 핵심으로 활약했다. 아킬레스건 염증은 물론, 인후통, 허리 통증으로 고생하면서도 제 몫을 해냈다. 리그 27경기에 나섰다. 국제프로축구선수협회(FIFPRO)가 우려를 제기했을 정도다. FIFPRO는 지난달 SNS(소셜네트워크서비스)를 통해 '김민재가 아킬레스건 통증에도 올 시즌 대부분 경기를 소화하고 있다. 아킬레스건염은 과도한 경기 부담과 연관된 부상이다. 올 여름 2026년 북중미월드컵 예선과 FIFA 클럽 월드컵으로 다음 2025~2026시즌을 앞두고 김민재가 쉴 시간이 적다. 김민재의 사례는 경고다. 안전장치가 없다면 이런 방식으로 경기 부담이 극단적으로 커질 수 있다'고 했다.

사진=REUTERS 연합뉴스
김민재의 헌신 속 바이에른 뮌헨은 정상을 되찾았다. 하지만 최고의 순간 논란이 발생했다. 구단 SNS 포스터에서 김민재를 제외한 것이다. 김민재는 올 시즌 공식전을 통틀어 팀 내에서 두 번째로 출전 시간이 많다. 하지만 김민재의 모습이 보이지 않아 팬들의 질타를 받았다. 일부에선 인종차별 논란까지 발생했다. 바이에른 뮌헨은 뒤늦게 SNS에 '김민재의 첫 분데스리가 우승, 진심으로 축하합니다. 분데스리가 27경기, 2289분의 열정과 헌신은 올 시즌 뮌헨에 큰 힘이 됐다. 바이에른 뮌헨 선수로서 들어 올린 첫 트로피, 진심으로 축하합니다!'라는 글과 함께 김민재가 우승 트로피를 들고 꽃가마를 타는 이미지를 게시했다. 하지만 팬들의 계속된 분노에 SNS에 한국의 고궁을 배경으로 김민재가 우승 트로피를 들고 꽃가마를 탄 이미지를 게재했다.

사진=AP-LaPresse 연합뉴스
동료들은 달랐다. 김민재의 헌신을 높이 평가하는 모습이었다. 토마스 뮐러, 해리 케인, 에릭 다이어 등은 김민재의 등을 떠밀며 우승 세리머니를 요구했다. 난처한 표정으로 버티던 김민재는 동료들의 거센 성화를 이겨내지 못하고 앞으로 나와 트로피 '마이스터샬레'를 번쩍 들었다. 팀 내 6번째였다.

한편, 이날 뮐러의 은퇴식도 진행했다. 1989년생 뮐러는 2000년 바이에른 뮌헨의 유소년 아카데미에 합류한 이후 이번 시즌까지 25년 동안 '원클럽맨'으로 선수 생활을 이어왔다. 바이에른 뮌헨 구단 통산 최다 출전 선수다. 정규리그인 분데스리가 13회를 비롯해 독일축구협회컵(DFB 포칼) 6회, 유럽축구연맹(UEFA) 챔피언스리그 2회, 국제축구연맹(FIFA) 클럽 월드컵 2회, 유럽 슈퍼컵 2회, 독일 슈퍼컵 8회 우승을 차지했다. 하지만 올 시즌을 끝으로 바이에른 뮌헨과 결별한다. 우승 트로피를 가장 먼저 넘겨받은 골키퍼 마누엘 노이어는 이를 들어 올리지 않고 곧바로 뮐러에게 전달했다. 뮐러가 가장 먼저 트로피를 번쩍 들어 올렸고, 선수들은 방방 뛰며 기쁨을 만끽했다. 또한, 콤파니 감독은 자신의 우승 메달을 뮐러에게 걸어주는 모습을 보이기도 했다.

김가을 기자 epi17@sportschosun.com"
20250511,"김민재 '노 패싱' 트로피 세리머니, 인종차별 없었다…케인-다이어 등 슬쩍 밀어 → 뮌헨 우승 동료애 과시","▲ 김민재가 혹사 논란과 그에 따른 경기력 저하, 이적설로 시즌 말미 입길에 오르긴 했지만 바이에른 뮌헨의 통산 34번째 독일 분데스리가 우승에 일조했다. 유럽클럽대항전에선 데뷔골을 쏘아 올리는 등 개인 전과 역시 적지 않았다. 우승 세리머니에 주축으로 참여할 자격이 충분했다. ⓒ 연합뉴스/EPA


[스포티비뉴스=조용운 기자] 바이에른 뮌헨은 김민재(29)를 우승 주역에서 제외했지만, 선수단은 달랐다. 해리 케인과 에릭 다이어, 토마스 뮐러 등이 김민재의 등을 툭툭 밀며 정 가운데에서 트로피 세리머니를 하라고 부추겼다.

바이에른 뮌헨이 독일 분데스리가 정상을 되찾았다. 11일(한국시간) 홈구장인 알리안츠 아레나에서 끝난 분데스리가 보루시아 묀헨글라트바흐와 33라운드를 2-0으로 이겼다. 징계를 끝내고 돌아온 해리 케인이 선제골을 넣었고, 마이클 올리세가 쐐기를 박았다.

웃으면서 세리머니를 펼쳤다. 바이에른 뮌헨은 이미 분데스리가 우승을 확정했다. 지난 주 RB 라이프치히와 원정 경기에서 종료 직전 3-3 동점골을 내주면서 아쉽게 자력으로 조기 우승을 결정하지 못했으나, 이튿날 바이엘 레버쿠젠이 프라이부르크와 비기면서 잔여 일정 상관없이 정상 등극이 결정됐다.

바이에른 뮌헨의 우승으로 김민재는 한국 선수로는 최초의 기록을 썼다. 유럽에 진출하는 것도 쉽지 않은 상황에서 빅클럽에서 뛰는 건 물론 빅리그를 두 차례나 주축으로 우승했다. 이탈리아 세리에A에 이어 분데스리가까지 최고의 무대를 정복했다.

▲ bestof topix


독일 진출 2년 만에 분데스리가 우승을 달성했다. 이번 시즌 리그 27경기에 출전하며 어느 누구보다 핵심으로 뛰었기에 바이에른 뮌헨이 정상을 탈환하는데 혁혁한 공을 세웠다. 이는 한국 축구의 전설인 차범근과 손흥민도 이루지 못한 대업이다. 1980년대 분데스리가에 진출해 프랑크푸르트와 레버쿠젠에 UEFA컵(유로파리그 전신)을 안긴 차범근도 분데스리가는 정상에 오르지 못했다. 함부르크와 레버쿠젠에서 뛰었던 손흥민도 무관으로 독일 무대를 떠났다.

김민재는 단시간에 빅리그 타이틀을 중심적인 역할로 해냈다는데 눈길을 끈다. 유럽에 진출한 시기가 상당히 늦다. 전북 현대와 베이징 궈안을 거쳐 유럽 무대를 밟은 건 2021년이다. 튀르키예 명문 페네르바체와 계약하며 유럽에 처음 등장한 김민재는 매년 팀과 리그를 옮기면서 성장하는 모습을 보였다.

단숨에 빅리거가 됐다. 2022년 SSC 나폴리에 입단하며 세리에A에 진출한 김민재는 세계 최고 레벨로 도약했다. 입단 직후 나폴리를 1989-90시즌 이후 33년 만에 우승을 이끌면서 핵심 수비수로 떠올랐다. 세리에A 사무국은 김민재 활약에 박수를 보냈고 아시아인 최초 이탈리아 세리에A 올해의 선수상으로 톱 클래스 경기력을 인정했다.

▲ 김민재 ⓒ 연합뉴스/AFP


이를 바탕으로 아시아 수비수 최초로 발롱도르 순위에도 진입했다. 2023년 수비수로는 가장 높은 22위에 호명됐다. 한국 선수가 30위 안에 든 건 역대 4번째. 2002년 설기현(당시 안더레흐트)을 시작으로 박지성(2005년•당시 맨체스터 유나이티드), 손흥민(2019•2022년•토트넘 홋스퍼) 등이 발롱도르 후보에 이름을 올렸다.

곧바로 바이에른 뮌헨에 합류했다. 한국 선수가 유망주 시절이 아닌 성인 레벨에서 기량을 입증해 '레바뮌' 유니폼을 입는 기염을 토했다. 바이에른 뮌헨은 김민재를 영입하기 위해 5,000만 유로(약 793억 원)를 쏟아부을 정도로 노력했다.

김민재는 바이에른 뮌헨에서도 늘 핵심으로 분류됐다. 입단 첫해 토마스 투헬 감독 밑에서 전반기 쉴 틈 없이 뛰었다. 그러다 혹사 피로도가 쌓인 후반기 기복을 보이면서 다소 힘든 시기를 보였다. 이번 시즌도 마찬가지다. 뱅상 콤파니 감독으로 바뀐 뒤에도 여전히 센터백 1순위로 인정받으면서 분데스리가를 누볐고 마침내 트로피까지 들었다.

▲ bestof topix
▲ bestof topix


선수들에게 인정을 받는다. 이날 세리머니에서 잘 드러났다. 경기가 끝나고 우승 축하연이 시작됐다. 주장부터 선수 한 명 한 명 중앙 단상으로 나와 은빛 접시(마이스터 샬레)를 들고 기쁨을 표하는 시간이 펼쳐졌다. 트로피에 한이 새겨졌던 케인을 비롯해 이번 시즌을 끝으로 팀을 떠나는 뮐러 등 하늘 높이 치켜들었다.

김민재는 한발 빠졌다. 다른 선수들에게 세리머니를 계속 양보하자 동료들이 일제히 직접 들라고 등을 떠밀었다. 케인과 뮐러, 다이어가 김민재를 정중앙으로 몰면서 분위기를 조성했다. 그제서야 김민재도 트로피를 든 뒤 동료들을 속이는 재치까지 발휘하며 우승컵을 손에 쥐었다.

구단과 참 다르다. 바이에른 뮌헨이 공개한 우승 기념 영상에서 논란이 있었다. 구단이 공식 채널이 공개한 큰 포스터에는 김민재, 이토 히로키가 있었지만 구단 공식 유튜브 채널에 올라온 영상 섬네일에 김민재의 모습이 보이지 않았던 것이다.

해당 섬네일에는 해리 케인, 마누엘 노이어, 토마스 뮐러 등 주요 주전 선수 10명만 등장했다. 주전급 선수는 골키퍼를 포함해 11명인데 올시즌 바이에른 뮌헨 최다 출전 2위(3593분)에 혹사에 가깝게 헌신했던 김민재가 사라진 것이다. 인종차별 논란으로 번지면서 시끄러웠는데 선수단 안에서는 김민재의 노고를 모두 인정하는 세리머니로 웃음을 안겼다."
20250511,"'거짓부렁' 포스테코글루, 이번엔 진짜다...드디어 손흥민, 복귀 언급 ""몇 분 정도 뛸 수 있다는 희망 있어""","[SPORTALKOREA] 박윤서 기자= 토트넘 홋스퍼 소속 손흥민이 드디어 그라운드 위에 모습을 드러낸다.

토트넘은 11일 오후 10시 15분(한국시간) 영국 런던에 위치한 홈구장 토트넘 홋스퍼 스타디움에서 크리스털 팰리스를 상대로 2024/25 프리미어리그(PL) 36라운드를 치른다.



눈길을 끄는 건 손흥민의 출전 가능성이다. 최근 손흥민은 발 부상으로 인해 7경기 연속 결장했다. 다만 이날 경기를 통해 손흥민이 그라운드를 밟을 수 있다는 장밋빛 전망이 나오고 있다.

엔제 포스테코글루 감독은 사전 기자회견을 통해 ""손흥민은 다가오는 경기에서 몇 분 정도 뛸 수 있다는 희망이 있다. 현재 부상에서 돌아올 수 있는 선수는 손흥민이 유일하다""라고 밝혔다. 손흥민 역시 자신의 사회관계망서비스(SNS)를 통해 복귀를 시사했던 만큼 출전 기회를 얻을 가능성이 있다는 평이다.


토트넘의 올 시즌 남은 목표는 유럽축구연맹(UEFA) 유로파리그(UEL) 우승으로 고정됐다. 프리미어리그(PL) 35경기에서 11승 5무 19패(승점 38)로 16위에 자리 잡고 있다. 어떠한 동기 부여도 찾기 어려운 상황이다.

반면 UEL의 경우 이야기가 다르다. 만일 맨체스터 유나이티드를 잡고 트로피를 들어 올릴 수 있다면 17년 동안 이어져 온 무관이라는 오명을 깸과 동시에 다음 시즌 UEFA 챔피언스리그(UCL) 출전권도 얻을 수 있다.


관건은 에이스이자, 주장인 손흥민이 출전할 수 있을지 여부다. 포스테코글루 감독은 그간 손흥민의 부상 부위 및 복귀 시점 등을 명확하게 하지 않는 등 의아한 반응을 내놓았다. 그는 지난달 26일 ""내부엔 손흥민을 제외하면 부상자가 없다. 그는 복귀를 위해 노력하고 있다. 점차 컨디션을 끌어올리고 있다. 이날 처음 잔디를 밟았는데 확실히 괜찮아진 것 같다""고 설명했다. 이는 불과 얼마 전 ""손흥민이 훈련에 참여했다. 아쉽게도 여전히 통증이 남아있다""라고 밝힌 것과 충돌하는 내용이었다.


또한 포스테코글루는 손흥민의 부상이 가벼운 타박상이라고 언급했지만, 그는 무려 7경기 동안 출전하지 못했다. 이에 다소 아리송한 태도로 일관하던 포스테코글루 감독의 선택에 수많은 비판이 오갔다. 그러나 일단 핵심 선수인 손흥민을 아껴가며 원하는 결과를 만들어내는 데 성공했다.

그는 지난 보되/글림트와의 원정 2차전에서 승리한 후 ""선수들 모두가 함께 뭉쳐 뛴 것이 정말 자랑스럽다. 사람들은 우리가 이런 위치에 오르기까지 얼마나 큰 노력을 했는지 알지 못할 것이다. 우리는 어려운 노르웨이 원정길에서 편안히 승리를 챙겼다. 오늘 우리와 함께하지 못하고 집을 지킨 동료들이 있다. 손흥민, 제임스 매디슨, 루카스 베리발, 라두 드라구신, 프레이저 포스터는 큰 역할을 했다. 모두가 기여했고 그것이 우리가 결승전까지 오른 가장 큰 원동력이었다. 내일부터는 경기에 집중해야겠지만 오늘은 즐겨보자""라고 소감을 밝혔다.

사진=미러, 게티이미지코리아

취재문의 sportal@sportalkorea.co.kr"
