date,title,content
20250721,"[속보] 英 BBC '비피셜'급 떴다…""손흥민 등 부상 입은듯→그럼에도 레딩전 2골 기여"" 호평, 프리시즌 ""녹슬었다"" 비판 취소","[스포티비뉴스=박대현 기자] 프리시즌 첫 경기에서 부진한 경기력으로 입길에 오른 손흥민(33, 토트넘 홋스퍼)이 현재 정상 컨디션이 아닐 수 있다는 분석이 현지 유력 기자를 통해 제기됐다. 등 부상 가능성을 전망한 것인데 그럼에도 레딩전 2골에 모두 기여했다며 이틀 전 스스로 ""녹슬었다"" 지적한 쓴소리를 일정 부문 거둬들였다.

영국 매체 '풋볼 런던'의 토트넘 출입기자 알레스데어 골드는 21일(한국시간) ""손흥민은 레딩전 내내 불편함을 느끼는 듯보였다. 경기 전 워밍업부터 토마스 프랑크 감독의 경기 후 브리핑을 듣는 동안까지 계속해서 손으로 등 아랫부분을 잡고 치는 모습이 보였다""고 적었다.

""33살의 손흥민은 토트넘이 후반에 수확한 2골 모두에 기여했다. 득점으로 이어진 코너킥을 모두 따냈다""며 ""경기 중에 부상을 입어 충격을 입은 것인지 아니면 고질적인 통증인진 불분명하나 그는 걸어다니는 동안 확실히 (등 통증으로) 어려움을 겪는 듯보였다. 구단 관계자와도 이를 상의하는 장면이 확인됐다""고 덧붙였다.
토트넘은 지난 19일 레딩을 상대로 프리시즌 첫 경기를 치렀다. 다만 이날 손흥민 경기력은 아쉬웠다. 레딩전에서 제 역할을 하지 못했다. 이제 막 프리시즌을 시작했기에 한창 경기력을 끌어올리는 중이란 점을 고려해야 겠지만 후반 교체 투입 후 45분간 번뜩이는 장면이나 돌파, 슈팅 마무리는 보이지 않았다. 슈팅은 1개도 없었고 드리블을 시도할 때마다 번번이 상대 수비에 가로막혔다.

경기 후 현지 매체들이 혹평을 쏟아냈다. 영국 매체 '스탠다드'는 ""손흥민은 매우 조용한 경기를 펼쳤다. 다음 시즌에도 그가 이 팀에 남을 수 있을진 알 수 없다""며 고개를 저었다. 또 다른 매체인 'TBR 풋볼' 역시 ""손흥민의 볼 터치는 무뎠고 볼 소유 또한 불안했다. 적절한 제안이 온다면 토트넘은 손흥민을 매각할 수도 있을 것""이라며 프랑크호에서 생존 가능성을 높지 않게 내다봤다.

골드 기자도 쓴소리를 더했다. 그는 손흥민에게 팀 내 최저 평점인 5를 부여하며 ""손흥민의 몸에 녹이 슬었다. 몇 차례 볼 터치 미스를 보였고 아직 경기 감각이 올라오지 않은 듯했다""며 아쉬움을 진하게 드러냈다.



일부 현지 팬들 역시 이번 여름에야말로 손흥민을 팔아야 한다 역설하지만 반론 목소리가 만만찮다. 이틀 전엔 쓴소리를 뱉었지만 이날은 손흥민의 등 부상 가능성을 거론한 골드 기자를 비롯해 잉글랜드 국가대표 수문장 출신 폴 로빈슨과 맨체스터 유나이티드·선덜랜드 수석 스카우트를 지낸 믹 브라운 등 여러 전문가가 ""손흥민은 여전히 스퍼스에 가져다줄 게 많은 공격수""라며 적극 옹호했다. 경기력뿐 아니라 한국인 캡틴을 활용한 마케팅은 여전히 팀에 큰 도움이 된다는 주장이다.

이번 여름 손흥민의 이적설은 국내를 넘어 잉글랜드 축구계 최고 관심사라 해도 과언이 아니다. 사우디아라비아 프로페셔널 리그(SPL)와 튀르키예 쉬페르리그, 미국 메이저리그 사커(MLS)가 차기 행선지로 꾸준히 물망에 올랐다.

다만 쉬페르리그와 MLS는 현재 후보군에서 낙마한 분위기다. 2019년부터 3년간 토트넘에서 호흡을 맞춘 '옛 스승' 주제 무리뉴 감독이 이끄는 페네르바흐체는 토트넘 기준에 부합하는 이적료를 감당치 못할 거란 전망이 나왔고 손흥민 영입을 발판으로 MLS 상위권 도약을 꾀하는 로스앤젤레스 FC는 선수가 원하는 선택지가 아니라는 유력지 보도가 흘렀다.

오직 SPL만이 생존에 성공해 이적설 불씨를 호호 불어가며 지키는 형국이다. 지난 9일에도 영국 '팀토크'는 ""복수의 사우디 구단이 손흥민에게 연봉 3000만 유로(약 483억 원)를 제안했다. 이 제안을 받아들일 경우 토트넘 캡틴은 3년 총액 9000만 유로(약 1450억 원)라는 천문학적인 연봉을 수령하게 된다""고 적었다.

올여름 극적으로 잔류한다 해도 다음 시즌 상당 폭의 출전 기회 감소는 피할 수 없을 것으로 예상된다. 마티스 텔과 윌송 오도베르, 마이키 무어, 히샤를리송 등 기존 자원에 '신입생' 모하메드 쿠두스, 모건 깁스화이트 등 좌우 측면을 뛸 수 있는 자원이 크게 늘어 치열한 내부경쟁이 불가피한 형국이다. 전방에서 끊임없는 스위칭과 강한 압박을 강조하는 프랑크 감독 성향을 고려할 때 브뢴뷔(덴마크)-브렌트퍼드(잉글랜드) 시절처럼 20대 초중반 공격수를 중용할 가능성이 농후하다."
20250721,"'이렇게 못할 줄 몰랐다' 유로 우승자의 몰락...리버풀서 단 2골, 결국 1년 만에 이별","페데리코 키에사가 리버풀을 떠날 예정이다.

유럽 이적시장에 능통한 파브리시오 로마노 기자는 7일(한국시간) ""키에사의 이번 여름 이적시장 최우선 순위는 이탈리아 복귀다. 키에사는 리버풀을 좋아하지만 출전 시간이 너무 부족한 것이 문제다. 이탈리아 클럽은 키에사와 거래 조건 논의를 위해 접촉을 시도했다. 키에사는 이번 여름 팀을 떠날 것으로 예상되어 프리시즌 투어 스쿼드에서도 제외됐다""라고 전했다.

키에사는 이탈리아 세리에A에서 오랜 시간 활약한 전천후 공격수다. 좌우 윙어는 물로 노치전방 공격수와 섀도 스트라이커도 소화할 수 있는 다재다능한 자원이다. 피오렌티나에서 153경기 34골 26도움을 기록하며 잠재력을 보여주었고 2020-21시즌 유벤투스로이적했다. 첫 시즌 모든 대회 14골 10도움을 올리며 기대에 부응했으나 거기까지였다. 이후로는 잦은 부상과 들쭉날쭉한 경기력으로 인해 부진했고 결국 지난 시즌을 앞두고 리버풀로 이적했다.

리버풀은 키에사를 적절한 로테이션 자원으로 봤다. 이탈리아의 유럽축구연맹(UEFA) 유로 우승을 이끌 때 보여주었던 파괴력이 다시 나오길 기대했다. 키에사는 모하메드 살라, 디오구 조타, 루이스 디아스 등 강력한 공격진 경쟁에서 실패하면서 벤치만 달궜다. 지난 시즌 리그 6경기 출전에 그쳤는데 출전시간은 104분에 불과했고 다른 대회에서도 마찬가지였다. UEFA 챔피언스리그(UCL), FA컵, 잉글랜드 풋볼리그컵(EFL컵) 등 도합 8경기 출전이 전부였다. 공격포인트는 2골 2도움. 키에사에 기대한 건 이런 활약이 아니었다.

결국 이적이 확정됐다. 키에사가 리버풀에 남아도 출전시간이 늘어날 가능성은 아주 적다. 리버풀은 이번 여름 폭풍 영입을 이어가고 있다. 클럽 레코드를 경신하면서 독일 최고 재능 플로리안 비르츠를 품었고 아인트라흐트 프랑크푸르트에서 위고 에키티케 영입을 확정했다. 공격진 숫자가 늘어나는 것과 더불어 리버풀이 거액의 이적료를 주고 영입한 선수들이기 때문에 이 선수들에게 기회가 우선적으로 주어질 것이다."
20250721,"레알 마드리드, 진짜 리버풀 스쿼드 폭파하나…'4350만 파운드 수비수' 첫 접촉 '관심 가속→이적 논의'","사진=AP 연합뉴스
사진=AFP 연합뉴스
[스포츠조선 김가을 기자]레알 마드리드(스페인)가 리버풀(잉글랜드) 핵심을 연달아 영입할 움직임이다.

영국 언론 익스프레스는 21일(이하 한국시각) '레알 마드리드가 이브라히마 코나테 영입을 위해 리버풀과 처음으로 접촉했다. 레알 마드리드는 코나테에 대한 관심을 가속화했다. 코나테는 리버풀과 계약을 연장하지 않았다. 레알 마드리드는 당초 코나테가 자유계약(FA) 선수가 될 내년 여름까지 기다릴 것으로 예상했다. 하지만 레알 마드리드는 올 여름 코나테를 영입하려는 것으로 보인다'고 보도했다.

레알 마드리드는 2024~2025시즌을 끝으로 카를로 안첼로티 감독과 결별했다. 레알 마드리드는 2024~2025시즌 주요 대회에서 단 하나의 우승컵도 들지 못했다. 스페인 프리메라리가, 유럽챔피언스리그(UCL), 코파 델 레이(국왕컵) 등에서 고개를 숙였다. 레알 마드리드는 2020~2021시즌 이후 4년만에 처음으로 메이저 대회 정상을 모두 놓쳤다. 레알 마드리드는 사비 알론소 감독에게 새 시즌 지휘봉을 맡겼다. 알론소 감독은 2025년 국제축구연맹(FIFA) 클럽 월드컵을 통해 레알 마드리드 사령탑 데뷔전을 치렀다. 성적은 썩 만족스럽지 못했다. 특히 4강에서 파리생제르맹(PSG·프랑스)에 0대4로 크게 졌다.

사진=REUTERS 연합뉴스
사진=REUTERS 연합뉴스
익스프레스는 프랑스 언론 레키프의 보도를 인용해 '레알 마드리드는 리버풀에 연락해 코나테 영입을 논의했다. 거래 성사를 위해 필요한 자금을 문의했다. 리버풀은 1년 뒤 코나테를 잃는 대신 매각을 고려하고 있다. 코나테의 이적료는 4350만 파운드 수준이란 주장이 제기됐다. 하지만 레알 마드리드는 FA로 영입할 가능성도 있다. 리버풀이 가장 강력한 위치에 있는 것은 아니다. 레알 마드리드는 트렌트 알렉산더-아놀드 영입 때도 비슷한 전술을 사용했다. 결국 클럽 월드컵에 맞춰 단 1000만 파운드를 지불했다. 리버풀은 낮은 제안을 받아들일 수밖에 없었다'고 했다. 알렉산더-아놀드는 2024~2025시즌을 끝으로 리버풀과의 계약이 만료됐다. FA로 레알 마드리드에 합류할 것으로 보였다. 하지만 레알 마드리드는 알렉산더-아놀드의 클럽 월드컵 출전을 위해 일부 금액을 지불하고 조기 영입했다.

한편, 1999년생 코나테는 2021~2022시즌부터 리버풀에서 뛰고 있다. 그는 리버풀과 새로운 계약을 하는 대신 새로운 도전을 준비하는 것으로 알려졌다."
20250721,"""되팔 가치도 없는 선수다""…바이에른 뮌헨, 리버풀 FW 영입 자신감 드러내자 레전드 '결사반대'","루이스 디아스./게티이미지코리아

[마이데일리 = 김건호 기자] 바이에른 뮌헨이 루이스 디아스(리버풀) 영입에 강한 자신감을 드러냈다. 하지만 레전드 디트마어 하만은 디아스 영입을 반대했다.

영국 '미러'는 21일(이하 한국시각) ""리버풀은 바이에른 뮌헨의 두 번째 공식 제안을 앞두고 긴장하고 있다""며 ""바이에른 뮌헨은 디아스 영입을 이번 여름 최우선 과제로 삼고 있으며, 이번 주 초 디아스에게 5850만 파운드(약 1100억 원) 규모의 제안을 보낸 바 있다""고 전했다.
리버풀은 바이에른 뮌헨의 첫 번째 제안을 거절했다. 하지만 바이에른 뮌헨은 디아스 영입을 포기할 생각이 없다. 최근 닉 볼테마데(VfB 슈투트가르트)와도 연결됐지만, 현재 디아스 영입에 집중하는 것으로 보인다.

'미러'는 독일 '빌트'를 인용해 ""바이에른 뮌헨은 디아스 영입에 낙관적인 입장이며 협상을 계속 진행 중이다""며 ""바이에른 뮌헨의 최고경영자(CEO) 얀 크리스티안 드레센과 단장 막스 에벌은 디아스 이적 협상에 우선순위를 두고 있으며, 시즌 개막 전에 이적을 마무리하길 원하고 있다""고 했다.
루이스 디아스./게티이미지코리아

디아스 역시 바이에른 뮌헨 이적 가능성을 열어두고 있다. 애초 바르셀로나와도 연결됐지만, 바르셀로나는 디아스 영입을 포기, 현재 마커스 래시퍼드 임대 영입에 근접한 상황이다.

'미러'는 ""디아스는 이미 리버풀 수뇌부에게 이적 의사를 전달한 것으로도 알려졌다. 바이에른은 이번 여름 최소한 한 명의 공격수 영입을 계획하고 있으며, 해리 케인을 지원할 수 있는 윙어를 찾고 있다""며 ""이러한 움직임은 르로이 사네가 재계약에 실패하고 갈라타사라이로 이적한 데다, 클럽 월드컵에서 자말 무시알라가 다리 골절과 발목 탈구라는 심각한 부상을 당한 것이 영향을 준 것으로 보인다""고 했다.

디아스는 지난 시즌 50경기에 출전해 17골 8도움을 기록했다. 리버풀의 잉글랜드 프리미어리그(PL) 우승에 일조했다.
루이스 디아스./게티이미지코리아

그럼에도 디아스 영입을 반대하는 목소리도 있다. 바이에른 뮌헨과 리버풀에서 모두 활약했던 하만은 최근 독일 '스카이'와의 인터뷰에서 ""이제 와서 디아스를 영입한다고? 28세의 남미 선수고, 지난 4~5년 동안 매 시즌 50경기씩 뛰었으며, 남미로의 장거리 비행도 문제가 된다""며 ""게다가 7000만~8000만 파운드(약 1310억~약 1500억 원)를 지급하고 계약 종료 시점에는 32세가 되어 되팔 가치도 없는데… 그럴 거면 바이에른 유스 아카데미는 왜 있는 건가?""라고 했다.

그는 브라이턴 앤드 호브 알비온에서 활약하는 브라얀 그루다를 추천했다. 하만은 ""나는 그루다를 데려오겠다. 그는 내 생각에 최고의 독일 선수 중 한 명이다""며 ""오랜 부상 이후 시즌 끄트머리에 아주 좋은 활약을 펼쳤다. 그루다는 측면과 중앙 모두에서 뛸 수 있다. 그가 나의 1순위다""고 말했다.

그루다는 마인츠에서 이재성과 한솥밥을 먹던 사이다. 지난해 8월 마인츠에서 브라이턴으로 적을 옮겼다. 지난 시즌 브라이턴에서 25경기에 나와 1골 5도움을 마크했다."
20250721,"""손흥민, 토트넘서 마지막 여름 보낸다"" 프리시즌 1경기 만에 견적 나왔나…이면 계약 예정→사우디-MLS행 가능성"," 

(엑스포츠뉴스 나승우 기자) 손흥민이 프리시즌 첫 경기서 부진한 경기력을 보여준 가운데 소속팀 토트넘 홋스퍼가 손흥민과 결별을 고려하고 있는 것으로 알려졌다.

손흥민은 19일(한국시간) 영국 버크셔에 위치한 셀렉트 카 리징 스타디움에서 열린 레딩과의 프리시즌 친선경기에서 선발이 아닌 벤치로 시적해 후반 시작과 함께 투입됐으나 45분 동안 공격 포인트 0개에 그쳤다.

레딩은 잉글랜드 프로축구 3부리그 리그원 소속 구단이다. 하지만 손흥민은 이날 여러 차례 일대일 돌파와 크로스를 시도하려 했으나 수비에게 막히는 등 어려움을 겪었다.
후반 27분 코너킥 상황에서 뒤로 흐른 공을 논스톱 슈팅으로 연결했으나 골대 위로 높게 떴다.

후반 34분에는 왼쪽 측면에서 수비를 허물고 돌파하려는 순간, 공을 제대로 터치하지 못하는 등 몸상태가 아직 정상 수준까지 올라오지 않은 모습이었다.



토트넘은 후반 4분 윌 랭크셔, 후반 8분 루카 부슈코비치의 골로 2-0 승리했다. 하지만 경기력이 워낙 좋지 않았던 손흥민은 경기 후 혹평을 피하지 못했다.

영국 풋볼런던은 손흥민에게 루카스 베리발과 함께 최저 평점인 5점을 줬다. 풋볼런던은 손흥민에 대해 ""때때로 그의 터치는 매우 녹슨 것처럼 보였다. 어려운 슈팅 중 하나는 크로스바 위로 훌쩍 넘어갔다""고 혹평했다.

손흥민이 3부리그 소속 레딩을 상대로도 날카로운 모습을 보여주지 못하자 영국 현지에서 손흥민의 방출을 전망하고 있다.

영국 TBR풋볼은 ""손흥민은 감각이 떨어진 모습이었다. 불안한 터치가 몇 차례 있었다. 토트넘은 손흥민을 적당한 제안이 올 경우 팔겠다는 입장이다. 레딩전 손흥민의 경기력은 그 이유를 어느 정도 보여줬다""고 비판하면서 이번 경기를 통해 손흥민이 토트넘을 떠날 가능성이 더욱 높아졌다고 분석했다.

풋볼인사이더는 ""손흥민이 사우디아라비아 프로리그나 미국 메이저리그사커(MLS)로의 이적설이 제기되는 가운데 토트넘에서의 미래에 대한 비공개 논의가 있을 예정""이라고 전했다.



과거 토트넘에서 활약했던 폴 로빈슨도 ""손흥민이 지금 당장 떠나고 싶다고 말한다면 토트넘도 최대한 많은 걸 얻어낼 수 있는 거래를 성사시키기로 할 것이다. 손흥민은 세계적인 선수일 뿐만 아니라 상업적으로도 놀라운 존재""라며 토트넘이 손흥민을 이용해 막대한 수익을 올릴 수 있을 거라고 주장했다.

토트넘 소식을 전하는 홋스퍼HQ는 ""토트넘에서 손흥민의 미래가 또다시 불확실해졌다. 손흥민은 토트넘에서 마지막 여름을 보낼 것이고 이를 통해 튀르키예나 사우디아라비아 구단에서 두둑한 연봉을 받을 수 있을 것""이라며 손흥민이 올여름 토트넘을 떠날 가능성이 충분하다고 강조했다.

과거 토트넘, 맨체스터 유나이티드, 선덜랜드 등에서 수석 스카우트로 활동했던 믹 브라운은 ""토트넘은 이번 여름 손흥민을 떠나보낼 준비가 돼 있다. 그들이 하고 있는 일이나 하려고 하는 일을 살펴보면 모든 당사자가 계속 전진하고 새로운 방향으로 나아갈 수 있는 길을 열어줄 것으로 보인다""면서 ""이제 모두 앞으로 나아갈 때가 됐다. 손흥민은 토트넘에서 매우 잘했고, 구단 레전드 중 한 명이지만 누구나 시간에 따라잡히기 마련""이라며 토트넘이 손흥민 없이 나아갈 때라고 주장하기도 했다.

손흥민은 지난 시즌 잦은 부상으로 정상적인 경기력을 보여주지 못했다. 영국 현지에서는 손흥민이 노화로 꺾이기 시작하는 '에이징 커브'에 돌입했다는 주장을 하기도 했다.

토트넘 입장에서는 계약 만료까지 1년도 채 남지 않은 손흥민을 굳이 붙잡고 있을 이유가 없다. 이적료를 회수할 수 있을 때 매각하는 것이 가장 합리적인 선택이다.



이에 최근 사우디아라비아, 미국 MLS, 튀르키예 쉬페르리그 등 다양한 이적설과 연결된 상태다. 프랭크 감독 또한 손흥민의 거취에 대해 말을 아끼고 있다.

부임 후 첫 기자회견에서 손흥민의 미래에 대해 선수가 한 클럽에 오랫동안 몸담았다면 구단이 결정을 내려야 할 것""이라며 ""어떤 시점에 누군가 떠나고 싶어 한다면, 거기에는 뭔가 이유가 있을 수 있다. 결정은 구단이 내릴 것""이라며 손흥민의 이적 가능성을 적극 부인하지도 않았다.

이어 ""일단 지금은 손흥민이 이곳에 있기 때문에 크게 걱정하지 않는다""면서 ""5~6주 뒤에 생각해봐야 할 문제다. 지금 당장은 손흥민이 여기에 있다""고 아직 결정을 내리기에는 이르다고 강조했다.

프리시즌 동안 지켜볼 것으로 예상됐으나 이후 방출 가능성이 계속 제기되고 있는 걸 보면 프랭크 감독은 지난 레딩전을 통해 손흥민의 실력 평가를 마친 것으로 보인다.

결국 손흥민이 이번 여름 팀을 떠날 가능성이 점점 높아지고 있다. 이대로라면 8월 3일 한국에서 있을 뉴캐슬 유나이티드와의 프리시즌 친선전이 토트넘에서 마지막 경기가 될 수도 있다.

사진=연합뉴스, SNS"
20250721,"[속보] 성사된다면 ‘희대의 배신자’ 낙인찍힌다…‘韓 철기둥’ 김민재, 갈라타사라이 임대 이적설","[골닷컴] 강동훈 기자 = 올여름 ‘방출 대상’으로 분류되면서 이적설이 끊이질 않는 ‘철기둥’ 김민재(28·바이에른 뮌헨)가 갈라타사라이의 집중 관심을 받고 있다. 갈라타사라이는 김민재를 임대 영입하려는 가운데, 구체적인 임대 영입 계획도 세운 것으로 전해졌다.

튀르키예 매체 아 스포르는 21일(한국시간) “갈라타사라이는 새로운 시즌을 앞두고 스쿼드를 강화하기 위한 노력을 계속 이어가고 있다”면서 “최근 여러 선수를 지켜보고 있는 갈라타사라이가 깜짝 영입할 수 있다는 주장이 제기됐다. 바로 김민재를 영입하는 데 관심이 있다는 주장”이라고 보도했다.
보도에 따르면 지난 3시즌 연속 튀르키예 쉬페르리그 우승을 차지한 갈라타사라이는 다가올 새 시즌도 왕좌를 지키면서 동시에 유럽축구연맹(UEFA) 챔피언스리그(UCL)에서 좋은 성과를 목표로 올여름 스쿼드를 강화하는 데 집중하고 있다.

갈라타사라이는 이미 지난달 바이에른 뮌헨과 계약이 만료돼 FA(자유계약선수) 신분으로 시장에 나온 리로이 자네를 영입했고, 임대 영입한 빅터 오시멘을 완전 영입하기 위해 나폴리와 협상도 벌이고 있다. 이미 현지에선 마무리 조율 단계에 접어들었다고 전하고 있다.



오시멘 영입이 마무리되면서 공격진 보강이 끝나는 대로 갈라타사라이는 수비진 강화를 위해 본격적으로 움직일 계획이다. 이런 가운데 갈라타사라이의 레이더에 포착된 게 바로 바이에른 뮌헨이 ‘방출 대상’으로 분류한 김민재다.

실제 김민재는 이번 여름 ‘방출 대상’으로 분류되면서 미래가 불투명한 상태다. 바이에른 뮌헨은 요나탄 타를 데려오면서 수비진의 리더를 맡기기로 한 가운데 타의 파트너로 다요 우파메카노를 낙점했고, 김민재는 매각하기로 결단했다.

바이에른 뮌헨은 특히 이미 김민재에게 떠나도 된다고 ‘이별 통보’까지 했을뿐더러 당초 5000만 유로(약 810억 원)로 책정한 이적료를 3500만 유로(약 567억 원)까지 낮췄다. 영입할 당시 원금을 회수하지 못하는 것을 감수하면서까지 이적료를 낮춘 건 그만큼 최대한 빠르게 매각하길 원한다는 뜻으로 해석할 수 있다.



바이에른 뮌헨이 김민재를 ‘방출 대상’으로 분류, 매각을 결심하자 리버풀과 바르셀로나, 알나스르, 유벤투스, 파리 생제르맹(PSG), 첼시, 토트넘 등 여러 구단이 김민재를 주시하고 있다. 이런 가운데 갈라타사라이도 김민재에게 관심을 보이면서 영입전에 뛰어든 것이다.

갈라타사라이는 김민재를 임대 영입할 계획인 가운데 구체적인 임대 영입 계획도 세웠다. 지난해 사샤 보이를 바이에른 뮌헨으로 매각했을 당시 계약서에 삽입한 보너스 옵션 500만 유로(약 81억 원)와 바이에른 뮌헨과 두 차례 친선경기 수입을 포기하고 김민재를 무상으로 임대 영입하겠다는 계획이다.

다만 갈라타사라이의 관심에도 김민재는 갈라타사라이행을 전혀 고려하지 않을 가능성이 크다. 과거 페네르바흐체에서 뛰었던 데다, 여전히 페네르바흐체 팬들에게 큰 사랑을 받고 있기 때문이다. 갈라타사라이와 페네르바흐체는 전 세계를 대표하는 유명한 라이벌리를 자랑한다.

실제 ‘이스탄불 더비’가 펼쳐지는 날에는 각종 사건 사고가 벌어질 정도다. 과거 페네르바흐체에서 인상적인 활약을 펼쳤던 김민재가 만약 올여름 갈라타사라이 유니폼을 입게 될 경우, 페네르바흐체 팬들의 엄청난 비판·비난은 물론이고 신변에 위협을 받을 가능성도 있다.

사진 = 게티이미지, 소셜네트워크서비스(SNS) 캡처"
