date,title,content
20250417,"진짜 막장 구단 토트넘...포스텍 둘러싸고 '반대' 손흥민파 VS '지지' 로메로파로 분열 ""","[OSEN=이인환 기자] 진짜 막장 팀이다.

토트넘 소식을 다루는 '릴리 화이트 로즈'는 지난 15일(한국시간) ""토트넘의 분위기는 최악이다. 특히 엔지 포스테코글루 감독과 선수들의 갈등이 극대화됐다""라면서 ""일부 선수를 제외하고 대다수의 선수들이 강하게 불만을 나타내고 있다""고 보도했다.

손흥민은 모두가 인정하는 토트넘 레전드다. 그는 지난 2015년 바이어 레버쿠젠을 떠나 토트넘에 입단한 뒤 한 번도 팀을 옮기지 않았다. 지난 10년간 손흥민은 토트넘 7번 유니폼을 입고 451경기에서 173골 96도움을 터트렸다. 구단 역사상 최다 득점 5위에 해당하는 기록이다.

이뿐만이 아니다. 손흥민은 데뷔 시즌을 제외하고는 8시즌 연속 프리미어리그 두 자릿수 득점을 올리고 있다. 리그 득점만 127골로 역대 공동 16위에 올라 있다. 도움도 통산 72개로 전체 17위이자 토트넘 역대 1위다. 여기에 공격 포인트 하나만 더 추가하면 프리미어리그 통산 200개를 채우게 된다.


투 더 레인 앤 백도 앞서 ""손흥민은 2015년 토트넘에 합류한 뒤로 충성스러운 하인이었다. 전설이라는 단어는 축구계에서 너무 쉽게 사용되지만, 토트넘 7번은 클럽의 전설이자 클럽 역사상 최고의 선수 수준이라고 해도 과언이 아니다. 손흥민은 모든 팬들에게 사랑받고 있으며 토트넘 위해 매주 활약하고 있다""라며 손흥민의 업적을 높이 평가한 바 있다.

하지만 토트넘에서 손흥민의 존재감은 갈수록 줄어들고 있다. 올 시즌 성적은 43경기 11골 12도움. 특히 그는 최근 17경기에서 단 1골만 기록했고, 이마저도 본머스전 페널티킥 득점이었다. 프리미어리그 기준 필드골은 지난 1월 아스날전 굴절골이 마지막이었다.

토트넘도 리그 31경기에서 17번이나 패배하며 15위까지 추락했다. 그러자 주장 손흥민에게 지나친 비판이 쏠리고 있다. 여전히 팀 내 최다 공격 포인트를 자랑하고 있는 손흥민이지만, 예전의 손흥민이 아니라며 이번 시즌을 끝으로 내보내야 한다는 주장도 적지 않다.


그러나 투 더 레인 앤 백은 손흥민이기 때문에 부진해 보일 뿐이라고 지적했다. 매체는 ""토트넘은 역사상 최저 승점으로 시즌을 마칠 위기다. 손흥민의 폼과 영향력 부족도 도움이 되지 않았다""라면서도 ""손흥민은 그만의 기준으로 부진한 시즌을 겪고 있다. 11골 12도움은 전혀 나쁜 수치가 아니다""라고 짚었다.

다만 투 더 레인 앤 백은 ""하지만 손흥민의 일관적이지 못한 활약은 토트넘의 대의에 도움을 주지 못했다. 그는 최근 몇 달 동안 영향력을 발휘하는 데 고전했다. 2025년에 접어든 이래로 최소한의 영향력만 끼치고 있다""라며 손흥민이 기복을 겪고 있다고 덧붙였다.

토트넘의 전설 중 한 명인 로비 킨도 손흥민을 옹호했다. ""킨은 손흥민이 힘든 시즌을 보내고 있지만, 이는 다른 공격수들의 도움을 받지 못했기 때문이라고 말했다. 그는 손흥민이 여전히 최고 수준 선수이며 여름에 떠나보낼 이유가 없다고 주장했다. 킨은 포스테코글루 감독이 손흥민에 대한 믿음이 없다고 생각한다""라고 전했다.


매체에 따르면 킨은 최근 인터뷰에서 ""손흥민은 어려운 시즌을 보내고 있지만, 팀 전체가 그러고 있다. 그는 해리 케인을 확실히 그리워하고 있다. 둘은 서로 잘 맞았기 때문에 손흥민에게는 항상 큰 변화다. 그는 원하는 만큼 자주 경기에 나서지 못했고, 자신감도 조금 부족하다. 하지만 여전히 최고의 선수(top player)다""라고 높이 평가했다.

또한 그는 ""손흥민은 토트넘에서 믿을 수 없을 정도로 놀라운 선수였기 때문에 여름에 떠나지 않길 바란다. 내 생각엔 그와 포스테코글루의 관계가 이전에 다른 감독들과 가졌던 관계가 아닌 것 같다. 왜냐하면 포스테코글루는 손흥민을 자주 교체하고 선발에서 제외하기 때문""이라며 포스테코글루 감독과 손흥민의 사이가 좋지 않아 보인다고 주장했다.

이런 불화설 이후 충격적인 상황이 나왔다. 토트넘이 오는 18일 독일 프랑크푸르트 도이체 방크 파르크에서 아인트라흐트 프랑크푸르트와 2024-2025시즌 유럽축구연맹(UEFA) 유로파리그(UEL) 8강 2차전을 치른다. 지난주 열린 홈 1차전에서 1-1 무승부를 기록한 토트넘은 이번 원정 경기에서 반드시 승리해야만 준결승 진출이 가능하다. 다시 말해, 패배는 곧 탈락으로 직결된다.


현재 유로파리그는 토트넘이 이번 시즌 마지막으로 노릴 수 있는 트로피다. 프리미어리그에서 부진을 거듭한 결과, 리그 31경기에서 무려 17패를 기록했고, 이는 구단 역사상 최악의 성적 중 하나로 남을 수 있다. 2003-2004시즌 19패 이후 최다 패배 기록을 경신할 위기다. 순위 또한 15위까지 추락하며 강등권에 근접한 상태다.

토트넘 엔지 포스테코글루 감독도 이 점을 의식하고 있다. 그는 리그 경기에서는 손흥민을 포함한 주요 선수들을 일부러 휴식시켜 체력 안배에 집중해왔다. 지난 13일 울버햄튼 원정에서도 손흥민은 출전 명단에서 제외됐다. 포스테코글루 감독은 경기 전 기자회견에서 손흥민이 발에 충격을 받은 상태라며, 보호 차원에서 결정을 내렸다고 설명했다.

당시 포스테코글루 감독은 프랑크프루트와 경기에 나설 수 있을 것이라고 설명했다. 그러나 정작 프랑크푸르트전을 앞두고 손흥민은 비행기에 타지 않으면서 원정에 동행하지 않았다. 그리고 기자 회견에서 포스테코글루 감독이 직접 프랑크푸르트전에 손흥민이 나서지 못한다고 인정했다.


포스테코글루 감독은 ""손흥민은 프랑크푸르트전에 동행하지 않았다. 발 문제로 인해 나서지 못하는 것이다""라면서 ""그를 제외한 나머지는 다 나설 수 있는 상황""이라고 전했다. 현재 손흥민은 팀 훈련에도 정상적으로 복귀한 상태다. 부상에서 회복된 만큼 출전에는 무리가 없다는 평가였지만 정작 프랑크푸르트전에서 빠진 것이다.

특히 최근 토트넘의 불화설이 대두된 것을 생각하면 의미 심장한 부분이다. 릴리 화이트 로즈는 한 소식통을 인용해서 ""토트넘 스쿼드 내부에서 갈등이 커지고 있다. 손흥민과 매디슨, 이브 미수마, 마이키 무어, 세르히오 레길론, 데얀 쿨루셉스키, 라드 드라구신, 페드로 포로, 루카스 베리발이 포스테코글루 감독과 충돌했다""고 설명했다.


문제는 포스테코글루 감독 지지파들. 릴리 화이트 로즈는 ""크리스티안 로메로와 로드리고 벤탄쿠르가 대표적인 포스테코글루 감독 지지파이다. 팀내 분위기는 사실상 붕괴 직전이면서 굴리엘모 비카리오와 벤탄쿠르만이 팀을 하나로 묶으려고 하고 있다""고 우려했다.

 /mcadoo@osen.co.kr

[사진] ⓒGettyimages(무단전재 및 재배포 금지), 스포츠 바이블."
20250417,"“내 알 바 아니다”…포스테코글루, 무너지는 토트넘 속에서도 ‘무심한’ 미래","포스테코글루 감독이 17일 프랑크푸르트에서 열린 공식 기자회견에서 말하고 있다. 로이터


아직 끝나지 않았지만 끝이 보인다. 안지 포스테코글루 감독이 이끄는 토트넘 홋스퍼가 유럽 무대에서마저 탈락할 경우, 시즌 종료 전 경질설은 현실이 될 수 있다.

이번 시즌 포스테코글루 감독은 잉글랜드 프리미어리그(EPL) 32경기에서 무려 17패를 기록했다. 현재 리그 15위. 강등권에 있는 사우샘프턴(26패), 레스터(22패), 입스위치(19패)를 제외하면 최다 패배 팀이다. FA컵과 카라바오컵에서도 조기 탈락했다. BBC는 17일 “토트넘이 ‘재건’을 내세운 첫 시즌의 결과치고는 기대 이하다 못해 ‘실패’로 분류될 수밖에 없는 성적표”라고 혹평했다.
포스테코글루 감독은 이날 프랑크푸르트에서 열린 공식 기자회견에서 “내 미래가 어떻게 될지 전혀 모른다. 내일 경기가 더 중요하다”며 감독직 유지 여부에 대한 질문에 선을 그었다. 그는 이어 “내가 좋은 감독인지 아닌지를 단 한 경기가 바꿀 수 있다고 생각하지 않는다. 내 자존감은 남들이 뭐라 하든 그 영향을 받지 않는다. 내일 경기를 이긴다고 내가 더 좋은 감독이 되는 것도 아니고, 진다고 더 나빠지는 것도 아니다”고 덧붙였다. 그는 “우리는 4강이라는 큰 기회를 눈앞에 두고 있다. 내가 집중할 건 그것뿐”이라며, 개인보다 팀의 현재를 우선하겠다는 입장을 밝혔다.

유럽 대항전에서도 상황은 쉽지 않다. 토트넘은 18일 오전 4시(한국시간) 독일 도이체방크 파르크에서 아인트라흐트 프랑크푸르트와 유로파리그 8강 2차전을 치른다. 1차전은 1-1 무승부로 끝났지만, 원정경기라는 부담과 함께 주장 손흥민이 발 부상으로 결장한다는 점은 치명적이다.

현재 포스테코글루 감독의 입지는 흔들리고 있다. 남은 시즌 결과에 따라 재신임 여부가 결정될 가능성이 높다. 그러나 그 자신은 “감독직에 대한 고민은 없다”고 선을 긋고 있다. 문제는 구단과 팬들의 판단이다. 이미 신뢰는 흔들렸고, 다음 결과가 마지막 시험대가 될 수 있다.

토트넘이 겪고 있는 문제는 단순히 결과만이 아니다. 시즌 초반 ‘에너지 축구’로 기대를 모은 공격 전술은 이내 예측 가능한 단조로움으로 바뀌었고, 전술적 대처 능력 부족이 패배로 이어졌다. 경기 후 책임은 늘 ‘선수들 기회 부족’, ‘장기적 프로젝트’로 모면됐다. BBC는 “포스테코글루의 말처럼, 단 한 경기가 감독의 자질을 결정하지는 않는다”며 “그러나 리더는 위기의 순간에 자신의 방향성을 증명해야 한다. 현재의 포스테코글루는 그 책임에 있어 설득력을 잃고 있다”고 전했다.

김세훈 기자 shkim@kyunghyang.com"
20250417,"'엉엉' 네이마르 커리어 박살 났다! 울면서 실려나가→""기도하는 수밖에..."" 좌절의 연속","[스타뉴스 | 박건도 기자]
네이마르가 그라운드에 쓰러져 고통스러워하고 있다. /AFPBBNews=뉴스1
좌절의 연속이다. 브라질 축구 영웅 네이마르(33·산투스)가 부활할 기미가 보이질 않는다.

영국 'BBC' 등의 17일(한국시간) 보도에 따르면 네이마르는 2024~2025시즌 브라질 세리에A 첫 선발 경기에서 34분 만에 쓰러졌다. 아틀레치쿠MG와 경기에서 네이마르는 34분 만에 다리 부상으로 경기장을 떠났다.

매체에 따르면 네이마르는 산투스 100경기를 기념해 특별한 등번호 100을 달고 출전했다. 하지만 네이마르는 전반전 도중 벤치를 향해 손짓하며 그라운드에 주저앉았다. 구단 의료진은 네이마르가 더는 경기에 뛰지 못한다는 손짓을 취했다.
네이마르는 끝내 카트에 실려 경기장을 떠났다. 큰 부상임을 직감한 듯 눈물을 흘리며 왼쪽 허벅지를 붙잡고 있었다. 전 브라질 국가대표팀 동료 헐크(39·아틀레치쿠)가 네이마를 위로했다.

이미 네이마르는 허벅지 부상으로 6주간 결장한 바 있다. 세사르 삼피아오 산투스 감독은 ""네이마르의 부상 정도는 확실한 답변을 내놓기 어렵다. 진단 결과가 나오길 기다려야 한다""면서도 ""산투스는 네이마르가 오랜 기간 결장하는 일이 없기를 간절히 기도해야 한다""며 안타까워했다.

네이마르. /AFPBBNews=뉴스1
한때 월드클래스 공격수로 통한 네이마르의 커리어는 갈수록 곤두박질쳤다. 파리 생제르망(PSG)에서 프랑스 리그1을 제패할 정도로 뛰어난 실력을 뽐냈지만, 끝내 유럽축구연맹(UEFA) 챔피언스리그(UCL) 우승은 실패했다. 2023~2024시즌부터는 사우디아라비아 프로리그(SPL)의 알 힐랄로 전격 이적했다.

네이마르는 알 힐랄에서 천문학적인 연봉을 받고도 제대로 경기조차 뛰지 못했다. 두 시즌2간 7경기 1골 2도움이라는 초라한 성적을 남겼다. 올해 초 친정팀 산투스로 전격 복귀해 부활을 꿈꿨다.

하지만 고질적인 부상 빈도는 줄어들 기미가 보이질 않는다. 'BBC'에 따르면 네이마르는 지난 3월 다쳤던 허벅지 부위를 잡으며 고통스러워했다. 심지어 네이마르는 2023년 10월 전방십자인대가 끊어지는 부상을 당한 뒤 줄곧 브라질 대표팀에 승선하지 못했다. 지난 3월 아르헨티나, 콜롬비아와 2026 국제축구연맹(FIFA) 북중미월드컵 남미 예선을 치르기 전 대표팀 소집 명단에는 올랐지만, 부상으로 끝내 명단 제외됐다.

네이마르가 지난 2023년 10월 우루과이 몬테비데오에서 열린 브라질 대 우루과이의 2026 국제축구연맹(FIFA) 북중미 월드컵 남미예선 경기 도중 부상으로 들것에 실려 나가고 있다. /AFPBBNews=뉴스1"
20250417,"레전드는 레전드를 알아본다…로비 킨 ""손흥민은 여전히 최고의 선수, 토트넘 떠나지 말아야 한다""","로비 킨/게티이미지코리아
손흥민과 벤탄쿠르/게티이미지코리아

[마이데일리 = 김종국 기자] 토트넘과 손흥민의 올 시즌 활약에 대한 비난 속에서도 손흥민에 대한 긍정적인 언급이 이어졌다.

영국 매체 투더레인앤백은 16일 손흥민에 대한 로비 킨의 인터뷰 내용을 소개했다. 지난 2000년대 토트넘을 대표하는 공격수로 활약한 로비 킨은 프리미어리그 통산 349경기에 출전해 126골을 터트렸다. 손흥민은 프리미어리그 통산 127골을 기록 중인 가운데 토트넘 레전드 로비 킨의 득점 기록을 넘어섰다.

로비 킨은 ""손흥민은 힘든 시기를 보내고 있지만 팀 전체가 모두 힘든 시기를 보내고 있다. 케인이 확실히 그리워진다. 손흥민과 케인은 서로에게 아주 좋은 영향을 미쳤다. 손흥민은 자신이 원하는 만큼 자주 출전하지 못하고 있고 자신감도 약간 부족해 보이지만 여전히 최고의 선수""라는 뜻을 나타냈다.

로비 킨은 ""손흥민은 토트넘에서 정말 훌륭한 선수이기 때문에 올 여름 팀을 떠나지 않았으면 좋겠다""면서도 ""내 생각에는 손흥민과 포스테코글루 감독의 관계가 예전처럼 좋지 않은 것 같다. 포스테코글루 감독이 손흥민을 경기에서 자주 빼는 모습을 보인다""고 언급했다.
토트넘은 지난 13일 손흥민이 결장한 울버햄튼과의 2024-25시즌 프리미어리그 32라운드에서 2-4 완패를 당했다. 토트넘은 울버햄튼전 패배로 11승4무17패(승점 37점)의 성적과 함께 리그 15위에 머물게 됐다.

토트넘의 포스테코글루 감독은 손흥민의 울버햄튼전 결장에 대해 ""쏘니는 발에 부상을 당했기 때문에 손흥민에 대해 주의를 기울이고 있다""며 결장 이유를 전했다. 토트넘은 '손흥민은 프랑크푸르트전에는 출전할 수 있을 것'이라고 예고했다.

토트넘은 오는 18일 프랑크푸르트를 상대로 2024-25시즌 유럽축구연맹(UEFA) 유로파리그 8강 2차전 원정 경기를 치른다. 토트넘은 프랑크푸르트와의 유로파리그 8강 1차전 홈경기에서 1-1 무승부를 기록한 가운데 원정 2차전에서 승리를 거둬야 4강 진출이 가능하다.

포스테코글루 감독은 13일 ""손흥민은 지난 프랑크푸르트전에서 골운이 없었지만 골을 넣을 수 있는 선수다. 나에게 더 중요한 것은 손흥민이 계속해서 팀에서 좋은 활약을 한다는 것""이라며 ""손흥민은 지난 10년 동안 쏘니는 자신의 포지션에서 인상적인 선수였다""며 변함없는 믿음을 나타냈다.

영국 핫스퍼HQ는 16일 '손흥민이 토트넘에서의 경력이 끝났다고 말할 수 없다'며 '올 시즌 토트넘은 모든 것이 잘못되고 있다. 손흥민조차 참담한 시즌을 보내는 가운데 비난을 피할 수 없었다. 손흥민에 대한 모욕적인 말들이 쏟아지고 있다'면서도 '손흥민이 부진한 시즌을 보내고 있지만 통계적으로는 여전히 토트넘 최고의 공격수다. 손흥민은 경기당 1.8개의 키패스와 함께 경기당 드리블 돌파와 파울을 두 차례씩 기록하고 있다. 손흥민이 커리어에서 선보인 기준에는 못 미치지만 평균적인 프리미어리그 윙어들과 비교하면 여전히 괜찮은 기록'이라고 조명했다.
손흥민과 포스테코글루 감독/게티이미지코리아
베리발과 손흥민/게티이미지코리아"
20250417,EPL 역대 최고 영입 대폭발! 맨시티 이적료 2420억+연봉 420억 준비...KDB 대체자는 '03년생' 분데스 MVP,"사진=Manchester City Central
<저작권자(c) 연합뉴스, 무단 전재-재배포, AI 학습 및 활용 금지>
[스포츠조선 김대식 기자]맨체스터 시티가 플로리안 비르츠 영입을 위해 리그 역사상 최고 금액을 준비했다.

독일 스포르트 빌트는 15일(한국시각) 이번 여름 이적시장에서 비르츠의 미래가 어떻게 될 것인지를 예측했다.

2003년생 비르츠는 자말 무시알라와 함께 독일이 낳은 최고의 재능 중 하나다. 독일의 안드레아 이니에스타라는 별명을 가지고 있는 슈퍼스타다. 지난 시즌 바이엘 레버쿠젠을 독일 분데스리가 무패우승으로 이끈 후 리그 MVP까지 수상하면서 독일 최고 선수 중 한 명이 됐다. 이번 시즌에도 비르츠는 분데스리가 최고의 선수다운 활약상을 자랑하고 있다.
<저작권자(c) 연합뉴스, 무단 전재-재배포, AI 학습 및 활용 금지>
비르츠는 현재 자신의 미래를 두고 고민 중이다. 레버쿠젠과 재계약을 체결해 2026년 월드컵 이후에 이적할 것인지 아니면 이번 여름 이적시장에 이적할 것인지를 고려 중이다. 비르츠가 이적을 한다면 행선지는 세 군데로 압축됐다. 레알 마드리드, 맨체스터 시티 그리고 바이에른 뮌헨이다.

빌트에 따르면 비르츠는 유럽 챔피언스리그(UCL) 우승과 발롱도르 수상을 위해 레알, 맨시티, 바이에른 순으로 선호한다고 한다. 맨시티와 바이에른이 비르츠 얻기 위해 레알을 경쟁에서 이기려면 결국 재정적으로도 선수가 매력적이라고 느낄 수 있는 제안을 보내야 하는 상황.

맨시티는 구단 역사상 최고의 선수 중 한 명인 케빈 더 브라위너를 위해 막대한 투자를 할 결심을 내렸다. 빌트는 이번 여름에 비르츠가 떠난다면 레버쿠젠이 이적료로 1억5000만유로(약 2417억원)를 요구할 것이라고 밝혔다. 맨시티는 이를 지불할 계획이며 비르츠에게는 연봉 2500만유로(약 402억 원)를 지급하기로 결정을 내렸다.
<저작권자(c) 연합뉴스, 무단 전재-재배포, AI 학습 및 활용 금지>
비르츠의 맨시티 이적이 성사되면 프리미어리그(EPL) 역사가 달라진다. 현재까지 EPL 역사상 최고 이적료는 첼시가 엔조 페르난데스를 영입하면서 지불한 1억2100만유로(약 1949억 원)다. 이를 훌쩍 뛰어넘는 액수가 될 수 있다.

또한 비르츠의 이적료는 축구 역사상 가장 비싼 이적료 3위에 기록될 것이다. 1억5000만유로는 파리 생제르맹(PSG)이 네이마르와 킬리안 음바페를 영입한 금액 다음가는 액수다.
<저작권자(c) 연합뉴스, 무단 전재-재배포, AI 학습 및 활용 금지>
맨시티가 비르츠 영입을 위해서 역대급 제안을 준비한 가운데, 관건은 이제 비르츠의 이적 의지와 레알과 바이에른이 얼마나 적극적으로 선수 영입을 위해 움직일 것인지다. 맨시티한테도 마찬가지겠지만 1억5000만유로는 어느 구단에게나 부담스러운 액수다. 레버쿠젠은 비르츠 이적료를 깎아줄 생각은 전혀 없는 것으로 보이기 때문에 1억5000만유로를 지불할 수 있는 구단만이 비르츠를 품을 수 있을 것이다.

김대식 기자 rlaeotlr2024@sportschosun.com"
20250417,BBC '비피셜' 이어 '감독피셜'까지...아모림 오열! '1290억' 망한 제2의 홀란 써야 하나→지르크지 시즌 아웃에 '골치',"▲ ⓒ호일룬 SNS


[스포티비뉴스=장하준 기자] 남은 시즌 동안 최악의 공격수에게 운명을 맡겨야 한다.

영국 공영방송 'BBC'는 17일(한국시간) ""맨체스터 유나이티드의 조슈아 지르크지는 허벅지링 부상을 당했다. 그는 몇 주 동안 결장할 예정이다. 시즌 아웃 가능성도 있다""며 ""지르크지는 뉴캐슬 유나이티드전 후반전에 다리를 절뚝거리며 교체로 물러났다""라고 전했다.

이어 맨유는 공식 홈페이지를 통해 ""지르크지는 뉴캐슬전에서 당한 부상으로 남은 시즌 동안 출전이 불가능하다""라고 발표했다. 후벤 아모림 감독 역시 올림피크 리옹(프랑스)과 2024-25시즌 유럽축구연맹 유로파리그(UEL) 8강 2차전을 앞두고 진행된 공식 기자회견에서 이를 인정했다.

여러모로 안 풀리는 맨유다. 이번 시즌 내내 최전방에 대한 고민을 안고 있다. 그러던 중, 최근 들어 지르크지가 좋은 모습을 보이며 남은 시즌 동안의 활약을 기대하게 했다. 그러나 부상으로 쓰러졌다.



이제 잔여 시즌 동안 맨유의 최전방은 라스무스 호일룬에게 맡겨야 할 전망이다. 썩 믿음직스럽지 못한 게 사실이다. 그는 이번 시즌 내내 최악의 골 결정력을 보여주고 있기 때문이다.

덴마크 국적의 호일룬은 지난 시즌을 앞두고 아탈란타를 떠나 맨유로 이적했다. 당시 그는 엘링 홀란(맨체스터 시티)과 비슷한 플레이 스타일로 '제2의 홀란'이라는 평가를 받기도 했다. 덕분에 맨유는 호일룬 영입을 위해 무려 8,500만 유로(약 1,292억 원)를 투자했다.

하지만 호일룬은 지난 시즌 기복 있는 득점력을 선보였다. 이어 이번 시즌에는 43경기 8골에 그쳐 있다. 이러한 부진이 계속되자, 올여름 매각설도 돌고 있다.

이러한 상황에서 같은 스트라이커인 지르크지가 시즌 아웃 진단을 받았다. 이로써 맨유 내 정통 최전방 자원은 호일룬이 유일해졌다. 과연 아모림 감독이 남은 시즌 동안 호일룬에게 신뢰를 보낼지, 혹은 플랜B를 마련해 다른 선수로 최전방 공백을 메우게 될지 관심이 쏠린다."
