date,title,content
20251124,"'스리백 최적화' 맨유, 단돈 423억에 분데스리가 최정상 LB 모셔온다!...""아모림 기준 충족""","[SPORTALKOREA] 황보동혁 기자= 왼쪽 라인이 흔들리는 맨체스터 유나이티드FC가 분데스리가 최고 레프트백을 정조준했다.

맨유 소식을 전문으로 다루는 매체 '더 피플스 퍼슨'은 23일(한국시간) ""루크 쇼는 현재 센터백으로 기용되고 있고, 패트릭 도르구는 아직 미완성 단계다. 아모림 감독 전술에서 윙백은 핵심 포지션인 만큼 좌측 전력 강화가 반드시 필요하다""고 전했다.

이어 ""맨유는 이를 해결할 방안으로 레버쿠젠의 알레한드로 그리말도 영입을 검토하고 있다. 그는 벤피카와 레버쿠젠에서 모두 백3 시스템의 좌측 윙백으로 뛰며 아모림이 요구하는 전술·기술적 기준을 충족하는 자원""이라고 평가했다.



그리말도는 라 마시아 출신으로 바르셀로나 1군 기회를 잡지 못해 지난 2015/16시즌 포르투갈 명문 벤피카로 이적했다. 이적 후 곧바로 주전으로 올라선 그는 강력한 왼발 킥을 앞세워 팀의 측면을 책임졌다.

벤피카에서 301경기 27골 61도움을 기록하며 포르투갈 무대를 넘어 유럽이 주목하는 자원으로 성장했다. 이에 2023/24시즌 레버쿠젠으로 이적한 그는 사비 알론소 감독 아래 핵심 자원으로 활약하며 팀의 역사적인 무패 우승을 이끌었다. 51경기 12골 17도움을 기록하는 등 수비수임에도 엄청난 영향력을 보였다. 



그 기세는 올해도 이어지고 있다. 지난 시즌 48경기 4골 13도움을 올렸고 이번 시즌에도 이미 16경기 7골 4도움이라는 엄청난 생산력을 보이고 있다. 

현재 맨유는 루크 쇼, 패트릭 도르구, 그리고 유망주 디에고 레온을 보유하고 있다. 그러나 도르구와 레온은 경험이 부족하고, 쇼는 이제 윙백보다는 쓰리백의 좌측 센터백 역할에 더 적합하다는 평가가 나온다.

결국 아모림은 감독은 스리백 시스템에 최적화된 그리말도를 팀의 새로운 왼쪽 윙백으로 점찍은 모양새다.



보도에 따르면 레버쿠젠은 약 2,500만 유로(약 423억 원)의 이적료를 요구하고 있는 것으로 전해졌다. 물론 리빌딩 단계에서 30세 선수를 데려오는 것이 부담이 될 수 있다.

그러나 팀에 즉시전력감이 절실하고 유망주들에게 성장할 시간을 제공해야 한다는 점을 감안하면 맨유 입장에서는 충분히 현실적인 선택지로 보인다. 

사진= 게티이미지코리아 

취재문의 sportal@sportalkorea.co.kr"
20251124,"""제대로 싸우지 않았다""… 아스널전 1-4 참사 뒤 토트넘 GK 비카리오의 통렬한 사과, ""팬들에게 죄송하다""","(베스트 일레븐)

토트넘 홋스퍼 수문장 굴리에모 비카리오가 '북런던 더비' 아스널전 패배 후 토트넘 팬들에게 사과했다.

비카리오가 골문을 책임진 토트넘은 24일 새벽(한국 시간) 에미레이츠 스타디움에서 열린 2025-2026 잉글랜드 프리미어리그 12라운드 아스널 원정 경기에서 1-4로 완패했다. 토트넘은 후반 10분 히샬리송이 한 골을 만회했으나, 전반 36분 레안드로 트로사르의 선제골과 전반 41분·후반 1분·후반 31분 에베레치 에제의 해트트릭에 힘없이 무너졌다.

비카리오는 경기 후 <스카이스포츠>와의 인터뷰에서 곧바로 팬들에게 사과했다. 비카리오는 ""우리에게 매우 나쁜 밤이었다""라며 ""매일 우리를 지지해주는 사람들에게 사과해야 한다. 팬들은 우리가 싸우기를 기대했지만, 오늘 우리는 싸우지 않았다. 이런 레벨의 무대에서 그것은 용납할 수 없다""라고 말하며 동료 선수들의 단합력에 문제를 짚었다.



이어 ""힘든 밤이고 아주 나쁜 패배였지만, 우리는 뭉쳐야 한다""라며 ""수요일 중요한 경기가 있다. 우리는 하나로 뭉쳐야 한다. 오늘 우리는 평소 보여주던 모습을 전혀 보여주지 못했다""라고 자성의 뜻을 나타냈다. 참고로 비카리오가 언급한 '중요한 경기'는 27일 새벽(한국 시간) 파리 파르크 데 프랭스에서 예정된 2025-2026 UEFA 챔피언스리그 리그 페이즈 5라운드 파리 생제르맹 원정을 의미한다.

비카리오는 선수들의 수동적인 자세에 대해서도 문제를 지적했다. 비카리오는 ""너무 수동적이었고 준비한 경기 계획과는 달랐다. 우리는 이번 경기에서 싸우지 않았다""라며 ""이 부분에 대해 팬들에게 우선 사과해야 한다""라고 말했다.

한편 토트넘은 이날 패배로 승점 18점에서 점수를 더하지 못하며 순위가 9위로 내려갔다."
20251124,"英 언론도 대서특필! ""손흥민 기쁨에서 고통으로""...최고의 활약 이후 아쉬움의 실축, SON도 ""오늘 성공하지 못했다""","사진=LA FC SNS 캡처
로이터연합뉴스
[스포츠조선 이현석 기자]손흥민의 활약과 아쉬움이 교차한 하루였다. 그럼에도 내년을 기약했다.

영국의 토크스포츠는 23일(한국시각) '손흥민은 미국 메이저리그사커(MLS)에서의 첫 시즌을 고통스럽게 마무리했다'라고 보도했다.

손흥민의 소속팀 LA FC는 23일 캐나다 밴쿠버의 BC플레이스에서 열린 밴쿠버 화이트캡스와의 2025시즌 MLS 플레이오프 서부 콘퍼런스 준결승 경기에서 승부차기 끝에 패하며 서부 콘퍼런스 결승 진출이 좌절됐다.

로이터연합뉴스
손흥민은 이날 경기 승부차기 직전까지 팀의 영웅이나 다름 없었다. 이날 경기 최전방 공격수로 출전한 손흥민은 전반까지 팀의 아쉬운 실점들을 바라봐야 했다. LA FC는 전반 39분 다카오카가 시도한 롱킥이 최전방의 사비에게 연결됐고, 사비는 요리스의 키를 넘기는 슈팅으로 골망을 흔들었다. 전반 추가시간에는 코너킥 상황에서 토마스 뮐러의 헤더를 요리스가 선방했으나, 라보르다가 밀어넣으며 격차를 벌였다.

위기의 순간 손흥민이 나섰다. 손흥민은 후반 15분 델가도의 패스가 모란의 헤더를 거쳐 자신에게 연결되자, 세 차례 슈팅을 시도해 골망을 흔들었다. 집념이 만들어낸 득점이었다. 손흥민의 능력은 마지막까지 빛났다. 후반 추가시간 LA FC는 동점골이 간절했다. 후반 추가시간 5분 프리킥을 얻어내자 손흥민이 키커로 나섰고, 슈팅은 환상적인 궤적을 그리며 밴쿠버 골문을 갈랐다. 손흥민의 활약 덕에 LA FC는 연장까지 승부를 끌고갔다.

연장에서도 득점이 터지지 않자, 경기는 승부차기로 이어졌다. LA FC의 첫 번째 키커는 손흥민, 하지만 손흥민은 마지막 순간 아쉬움을 삼켜야 했다. 손흥민의 발을 떠난 공은 골대를 강하게 때리며 그대로 튕겨나왔다. 믿었던 손흥민의 실축에 팬들은 더욱 아쉬울 수밖에 없었다. 이후 LA FC는 세 번째 키커인 델가도도 실축하며 결국 밴쿠버에 패하고 말았다.

로이터연합뉴스
손흥민은 경기 후 인터뷰에서 ""너무 실망스럽다""라며 ""이기기 위해 노력한 팀은 자랑스럽다""고 했다. 이어 ""축구는 언제나 그렇다. 2-0으로 앞설 때는 잡았다고 생각하지만 2-1이 되면 상황이 달라질 수 있다. 이런 순간들을 정말 좋아한다. 슈팅을 잘했고, 운좋게도 골이 들어갔다. 하지만 이런 골을 넣는 것만으로 경기를 이기기엔 부족했다. 정말 아쉽다""며 아쉬움을 토로했다.

이어 ""내가 이곳에 온 이유는 트로피를 따기 위해서다. 오늘은 성공하지 못했다. 내년에는 꼭 성공하도록하겠다. 오늘 실망스럽지만, 내년에는 강해져서 돌아올 것이다""고 했다.

로이터연합뉴스
토크스포츠는 '손흥민이 프리킥의 기쁨에서 페널티킥의 고통으로, MLS 플레이오프에서 탈락했다. 손흥민은 두 골을 넣었지만, 팀이 탈락하며 헛수고가 됐다. 손흥민은 그럼에도 마지막까지 최고의 모습을 보여줬다'고 평가했다."
20251124,"韓 축구 '5-0 대패' 치욕 이번엔 씻을까, 한국·네덜란드·스웨덴·파라과이 죽음의 조?…월드컵 '최악 조편성' 시뮬레이션 나왔다","(엑스포츠뉴스 나승우 기자) 2026 국제축구연맹(FIFA) 북중미 월드컵 가상 조 추첨 결과 대한민국 축구 국가대표팀이 네덜란드와 같은 조에 묶이는 시나리오가 나왔다.

만약 실제로 네덜란드와 조별리그에서 만난다면 1998 프랑스 월드컵서 당했던 0-5 참패의 아픔 설욕하고 32강 토너먼트에 진출할 수 있을지가 관전 포인트가 될 전망이다.
남미 축구 매체 SAG풋볼은 지난 22일(한국시간) 2026 북중미 월드컵 가상 조 추첨 결과를 공개했다.

매체에 따르면 홍명보 감독이 이끄는 한국 축구대표팀은 네덜란드, 파라과이, 유럽 예선 플레이오프 진출팀과 J조에 묶였다.



FIFA 랭킹 상위권을 유지하고 있는 네덜란드는 포트1에 배정됐으며 객관적 전력상 조 1위가 유력하다. 대표팀 입장에서도 반드시 넘어야 할 가장 큰 산이다.

특히 네덜란드는 한국 축구사에 지울 수 없는 상처를 안긴 팀으로 기억되고 있다. 1998 프랑스 월드컵 당시 한국은 거스 히딩크 감독이 이끌던 네덜란드에 0-5 참패를 당했다.

이 충격으로 차범근 당시 대표팀 감독이 대회 도중 경질되는 초유의 사태까지 벌어지기도 했다.

만약 이번 월드컵에서 다시 만난다면 승리를 장담하기는 어렵지만 약 28년전 빚을 갚을 절호의 기회가 될 수 있다.

네덜란드 뿐만 아니라 다른 상대들도 만만치 않다. 남미 강호 파라과이는 끈끈한 조직력과 기술을 갖춘 팀으로 결코 쉽지 않은 상대다.



지난 10월 A매치 평가전을 통해 파라과이에 승리를 거두긴 했으나 월드컵 본선에서 만나는 건 또 다른 문제다. 중립국에서 경기가 열리는 만큼, 안방에서 잡았던 것처럼 승리를 장담할 수 없다.

마지막 한 자리를 차지할 유럽 플레이오프 진출팀도 변수다. 시뮬레이션 결과 이 자리에는 플레이오프 루트 B를 통과한 팀이 차지하게 되는데 스웨덴, 우크라이나, 폴란드, 알바니아 등이 진출할 가능성이 열려있다.

2018 러시아 월드컵에서 한국의 발목을 잡았던 스웨덴이 올라온다면 또 다른 악연이 재현될 수 있다. 특히 스웨덴에는 잉글리시 프리미어리그에서 활약 중인 알렉산데르 이삭, 빅토르 요케레스 두 공격수가 있다. 두 선수의 몸값만 3500억원에 근접할 정도다.

스웨덴이 아니더라도 동유럽 복병 우크라이나, 로베르트 레반도프스키가 버티는 폴란드가 올라올 경우에도 만만치 않을 것으로 보인다. 그나마 알바니아가 해볼 만하지만 현실적으로 알바니아가 올라올 가능성은 크지 않다.

대표팀 입장에서는 32강 진출을 장담할 수 없는 죽음의 조가 이뤄지는 셈이다.

사진=엑스포츠뉴스DB / SNS / 연합뉴스"
20251124,"손흥민 대체 왜 프리킥 안 찼나? 英분노 터졌다...""적어도 20골은 더 넣었을 것""","[인터풋볼=박윤서 기자] 손흥민이 토트넘 홋스퍼를 떠난 뒤에 프리킥 골을 자주 넣으면서 토트넘 팬들의 분노가 커지고 있다.

LAFC는 23일 오전 11시 30분(한국시간) 캐나다 밴쿠버에 위치한 BC 플레이스에서 열린 2025 미국메이저리그사커(MLS)컵 플레이오프 2라운드에서 밴쿠버 화이트캡스에 2-2로 비긴 뒤 승부차기에서 패배했다.

패배에도 손흥민의 활약이 돋보였다. LAFC는 전반전에만 두 골을 허용하며 끌려갔는데 후반전 손흥민의 원맨쇼로 균형을 맞췄다. 손흥민은 후반 15분 혼전 상황에서 침착하게 마무리하며 한 골 추격했고 후반 추가시간 5분 극적인 다이렉트 프리킥 골로 경기를 원점으로 돌렸다. 손흥민은 승부차기에 돌입해서 1번 키커로 나섰는데 아쉽게도 슈팅이 골대에 맞으면서 실축했고 LAFC는 3-4로 패배하고 말았다.

사진= MLS


손흥민의 프리킥 감각은 엄청났다. LAFC 입성 이후 데뷔골이었던 댈러스전 득점도 다이렉트 프리킥 득점이었고 이는 MLS 올해의 골로 선정되기도 했다. 손흥민은 국가대표에서도 뛰어난 프리킥 득점 능력을 이어오고 있다. 지난 2024 카타르 아시안컵 8강 호주전에서 손흥민은 환상적인 궤적의 프리킥 득점으로 한국의 4강행을 견인했다. 최근 볼리비아전에서도 프리킥 선제골을 터뜨린 바 있다.

이렇게 프리킥 능력이 좋은 손흥민이지만, 토트넘에서는 전담 키커가 아니었다. 크리스티안 에릭센이 도맡아서 차다가 에릭센이 떠난 이후에는 케인이, 케인이 떠난 뒤에는 페드로 포로 등이 찼다.

이번 프리킥 득점 이후 토트넘 팬들도 뿔났다. 토트넘 소식통 '스퍼스 웹'은 ""손흥민이 또다시 멋진 골로 토트넘을 어리석게 만들었다""라며 ""손흥민은 왜 토트넘에서 프리킥을 도맡지 않았을까""라며 의문을 제기했다.

이어서 ""손흥민이 이런 능력을 갖고 있었다면 훈련 중에도 당연히 보여줬을 거다. 에릭센이 떠난 뒤 토트넘의 세트피스가 부진했다는 점을 고려하면 손흥민이 프리킥을 차지 않은 것이 당혹스럽다. 손흥민의 능력을 고려하면 손흥민이 프리킥을 도맡았다면 토트넘에서 15~20골은 더 넣을 수 있었을 거다""라며 후회했다."
20251124,"""해리 케인, 손흥민에 왜 그랬어?', ""SON 20골 손해 봤네""…손흥민, 토트넘 10년 프리킥 1골→LAFC 이적 뒤 벌써 2골","(엑스포츠뉴스 권동환 기자) 손흥민(LAFC)이 또다시 프리킥으로 득점을 기록하자 토트넘 홋스퍼가 프리킥을 손흥민에게 맡기지 않은 점을 지적하는 목소리가 커졌다.

토트넘 소식통 '스퍼스웹'은 23일(한국시간) ""손흥민이 최근 멋진 골로 토트넘을 어리석게 만들다""라고 보도했다.
매체는 ""토트넘 홋스퍼 팬들은 이번 시즌에도 공격수 손흥민이 만약 특정 종류의 골을 계속 넣으면 어떻게 될지 궁금해할 것""이라며 ""예상대로 손흥민은 LAFC로 이적한 이후 미국 메이저리그사커(MLS)에서 너무 쉽게 뛰는 것처럼 보였다. 그는 13경기에서 12골 4도움을 기록했다""라고 설명했다.

이어 ""하지만 토트넘 팬들은 손흥민이 넣은 골의 특징에 놀랐다""라며 ""손흥민은 이번 시즌 이미 여러 번의 프리킥 골을 넣었는데, 그중에는 FC댈러스와의 경기에서 넣은 골도 있다. 이 골로 손흥민은 MLS 올해의 골 상을 수상했다""라고 덧붙였다.



또 ""손흥민은 최근의 A매치 기간에도 같은 활약을 펼쳤는데, 볼리비아를 상대로 한 대한민국의 승리에서 프리킥을 성공시켰다""라며 ""그는 밴쿠버와의 MLS 플레이오프 경기에서 95분에 프리킥으로 LAFC의 중요한 골을 넣었다""라고 전했다.

손흥민은 최근 소속팀과 국가대표팀을 가리지 않고 멋진 프리킥으로 득점을 기록하면서 뛰어난 프리킥 실력을 과시 중이다.

손흥민은 지난 8월 FC댈러스와의 MLS 경기에서 프리킥으로 데뷔골을 터트렸다. 이날 손흥민이 터트린 프리킥 데뷔골은 2025 MLS 올해의 골로 뽑히기까지 했다.

손흥민의 프리킥 득점은 대한민국 축구 국가대표팀에서도 나왔다. 지난 14일 대전월드컵경기장에서 열린 볼리비아와의 평가전에서 손흥민은 후반 12분 프리킥으로 선제골을 터트리면서 2-0 승리에 일조했다.



손흥민은 지난 23일 캐나다 밴쿠버에 있는 BC플레이스에서 열린 밴쿠버 화이트캡스와의 2025 MLS컵 플레이오프 서부 콘퍼런스 준결승에서도 멋진 프리킥 골을 터트리면서 팬들을 열광시켰다.

이날 LAFC는 전반 40분 선제골을 허용한 뒤, 전반 추가시간에 추가골을 허용해 전반전을 0-2로 마치면서 패배 위기에 놓였다.

LAFC를 구한 건 손흥민이었다. 손흥민은 후반 15분 골문 앞 혼전 상황에서 귀중한 추격골을 터트렸고, 후반 추가시간에 환상적인 프리킥으로 동점골을 넣으면서 스코어 2-2를 만들어 경기를 연장전으로 끌고 갔다.

비록 LAFC는 승부차기에서 3-4로 패해 결승 진출에 실패했지만, 이날 손흥민이 보여준 프리킥은 다시 한번 팬들 사이에서 화제가 됐다.



특히 토트넘 팬들은 손흥민이 최근 프리킥으로 3골을 터트리자 지난 10년 동안 손흥민에게 프리킥을 맡기지 않은 점에 대해 불만을 드러냈다.

손흥민은 2015년 여름 토트넘에 합류하고 지난 8월 LAFC로 이적하기 전까지, 무려 10년 동안 토트넘에서 뛰면서 173골을 넣었지만 프리킥 득점은 단 1골에 불과하다. 반면 LAFC 이적 후 13경기에서 12골을 넣었는데, 이 중 2골이 프리킥 득점이다.

토트넘에서 뛸 때 손흥민은 해리 케인(바이에른 뮌헨) 등에 밀려 프리킥을 찰 기회가 거의 없었다. '스퍼스웹'도 지난 8월 손흥민이 프리킥으로 LAFC 입단 3경기 만에 데뷔골을 터트리자 ""아마 역대 토트넘 감독들이 손흥민에게 프리킥을 맡기지 않은 것은 실수였을 것""이라며 아쉬움을 드러냈다.

이후 손흥민이 또다시 프리킥으로 득점을 기록하자 매체는 ""손흥민은 왜 토트넘에서 프리킥 임무를 맡지 않았을까?""라며 의구심을 드러냈다.



언론은 ""손흥민이 항상 이런 능력을 가지고 있었다면 훈련 중에 프리킥 능력을 보여주었을 것이라고 상상할 수 있다""라고 설명했다.

이어 ""따라서 크리스티안 에릭센이 떠난 후로 토트넘이 데드볼 상황에서 부진한 모습을 보였다는 점을 감안하면, 손흥민이 토트넘에서 프리킥을 거의 차지 않았다는 것은 당혹스러운 일이다""라고 덧붙였다.

그러면서 ""손흥민이 보여주는 능력을 고려하면, 손흥민은 토트넘에서 프리킥을 담당했다면 15~20골을 더 넣을 수 있었을 것""이라고 주장했다.

토트넘 팬들은 ""손흥민의 프리킥을 보니 케인이 너무했다는 느낌이다""며 탄식했다.

사진=433 SNS / 연합뉴스"
20251124,"'골골골골골골골골' 손흥민 없으니 오합지졸 '와장창'…토트넘, 하이재킹 당한 NO.10에 해트트릭 '대치욕'→'북런던 더비' 아스널 원정 1-4 참패","(엑스포츠뉴스 김정현 기자) 손흥민 없이 치른 첫 북런던 더비에서 토트넘 홋스퍼가 무려 해트트릭을 헌납하며 무너졌다. 

토마스 프랑크 감독이 이끄는 토트넘은 24일(한국시간) 영국 런던 에미레이츠 스타디움에서 열린 아스널과의 2025-2026시즌 프리미어리그 12라운드 원정 경기에서 1-4로 대패했다. 

손흥민이 없는 첫 북런던 더비 원정에서 토트넘은 선두 아스널에 무기력하게 밀리면서 무려 4골을 헌납했다. 

특히 지난여름 이적시장에 영입을 시도했다가 막판 아스널에 '하이재킹'으로 빼앗긴 에베리치 에제에게 해트트릭을 헌납하면서 무기력한 결과를 맞이했다. 



프리미어리그 홈페이지도 ""에제가 토트넘이 자신들이 무엇을 놓쳤는지 보여줬으며 아스널의 우승에 대한 믿음이 커져간다""라는 제목으로 해당 경기 리뷰를 하기도 했다. 

토트넘은 3경기 연속 무승(1무2패)의 늪에 빠지며 9위(5승3무4패·승점 18)에 머물렀다. 아스널은 이 승리로 승점 29(9승2무1패)를 만들며 2위 첼시(승점 23)와의 격차를 2경기 차로 벌렸다. 

이날 홈팀 아스널은 4-2-3-1 전형으로 나섰다. 다비드 라야 골키퍼가 장갑을 꼈고 위리엔 팀버, 위릴엄 살리바, 피에로 인카피에, 리카르도 칼라피오리가 수비를 구축했다. 3선은 마르틴 수비멘디와 데클란 라이스가 나와 수비를 보호했다. 2선 측면에는 부카요 사카와 레안드로 트로사르 중앙에 에제, 최전방은 미켈 메리노가 출격했다. 

토트넘은 3-4-3 전형으로 맞섰다. 굴리에모 비카리오 골키퍼가 골문을 지켰고 크리스티안 로메로, 미키 판더펜, 케빈 단소가 백3를 구성했다. 중원은 주앙 팔리냐, 로드리고 벤탄쿠르가 지켰고, 윙백은 제드 스펜스, 데스티니 우도기가 맡았다. 측면에 모하메드 쿠두스와 윌송 오도베르, 최전방에 히샬리송이 나와 득점을 노렸다. 

아스널의 공격이 초반부터 불을 뿜었다. 전반 3분 만에 에제의 환상적인 로빙 패스로 라이스의 발리슛이 터졌다. 비카리오가 넘어지면서 이를 쳐냈다. 



전반 18분 박스 오른쪽에서 사카가 직접 왼발 프리킥을 시도했지만, 살짝 크로스바 위로 넘어갔다. 전반 33분에는 거의 비슷한 위치에서 사카가 다시 골문 안쪽으로 공을 처리했는데 동료들에게 걸리지 않고 비카리오가 쳐냈다. 

토트넘의 측면을 계속 공략한 아스널은 압도적인 공격력으로 토트넘의 수비를 무력화하려 했다. 
결국 아스널이 골망을 흔들었다. 전반 36분 중앙에서 로빙 패스로 침투하는 트로사르에게 연결됐다. 트로사르가 공을 지켜낸 뒤돌아서면서 왼발 터닝슛을 시도해 선제골에 성공했다. 

아스널은 계속 공세를 높였다. 전반 41분에는 에제가 박스 중앙에서 날카로운 오른발 슈팅으로 골망을 흔들었다. 아스널 유소년팀 출신이자 팬인 애제는 아스널 이적 후 첫 북런던 더비에서 득점에 성공하며 꿈을 이뤘다. 

전반을 2-0으로 리드한 아스널은 공세를 늦추지 않았다. 후반 1분 오른쪽에서 사카와 팀버가 룰어나온 공을 에제가 중앙에서 다시 골로 연결하면서 멀티 골에 성공했다. 



토트넘은 단 한 번의 압박으로 만회 골에 성공했다. 후반 10분 주앙 팔리냐가 하프라인에서 수비멘디에게 태클해 공을 뻇었다. 근처에 있던 히샬리송이 기습적인 하프라인 슛을 시도했다. 라야가 앞으로 나와있었기 때문에 히샬리송의 킥이 그대로 골문 안으로 빨려 들어갔다. 

하지만 아스널의 공세는 계속됐다. 후반 31분 비카리오의 킥이 차단된 뒤 빠르게 이어진 공격에서 에제가 오른발 슈팅으로 해트트릭에 성공했다. 

에제는 후반 34분 네 번째 골까지 터뜨릴 뻔했지만, 비카리오가 이를 막아냈다. 

결국 경기는 아스널의 완승으로 끝났다.

손흥민의 공백이 큰 경기였다. 축구통계매체 스쿼카에 따르면 손흥민은 지난 2019년 12월 미켈 아르테타 감독이 아스널에 부임한 뒤 8골을 넣으며 아스널 상대로 가장 밚은 골을 넣은 선수다. 손흥민이 사라진 토트넘은 공격력과 리더십이 모두 결여된 오합지졸과 같은 팀이었다.

마침 손흥민이 현 소속팀 LAFC에서 밴쿠버 화이트캡스와의 MLS컵 플레이오프 원정 경기에서 프리킥 동점포를 포함 2골을 터트리며 자신의 존재감을 확실히 알린 날이어서 토트넘의 대패가 더욱 아플 수밖에 없는 상황이 됐다. 



사진=연합뉴스"
