date,title,content
20250704,"'결혼 후 10일만' 남편 故 조타, 떠나보낸 아내, 몸도 제대로 못 겨눴다...부축받으며 영안실 나와 깊은 슬픔에 잠겨","[SPORTALKOREA] 박윤서 기자= 섣불리 상상하기조차 어려운 감정이다. 비극적인 사고로 세상을 떠난 디오고 조타의 아내 루테 카르도소가 슬픔에 빠진 모습이 공개되며 안타까움을 더하고 있다.

스페인 'Diario AS'는 4일(한국시간) 디오고 조타의 아내 루테 카르도소가 영안실에서 빠져나오는 모습을 다뤘다.



영상 속 루테 카르도소는 큰 상실감에 빠져 퉁퉁 부은 얼굴로 몸을 겨누기 어려운 듯 측근들의 부축을 받았다.

어렵게 발걸음을 옮긴 그녀는 차량에 탑승해 고개를 떨군 채 훌쩍거리며 한참 동안 정면을 바라보지 못했다. 차마 헤어 나오기 어려운 슬픔에 괴로워했다.

디오고 조타는 지난 3일 축구 선수 동생 안드레 실바와 함께 스페인 사모라에서 차량으로 이동하던 중 세상을 떠났다. 

영국 'BBC' 등 주요 외신에 따르면 당시 상황은 이렇다. 두 사람이 탄 차량은 앞서 있던 차량을 추월하는 과정에서 타이어 파열로 도로를 이탈했고 강한 충격으로 인해 불길에 휩싸였다.



이후 축구계를 넘어 각계각층에서 애도 물결이 계속되고 있다. 특히 세 자녀를 둔 디오고 조타가 6월 22일 백년가약을 맺은 후 10일여 만에 세상을 떠났다는 점에서 더욱 큰 안타까움을 자아내고 있다.

두 사람은 2013년부터 사랑을 꽃피워 포르투갈 북부 브라가 소재의 한 교회에서 결혼식을 올렸다. 당시 조타는 ""나는 운이 좋은 사람""이라며 감격했고 루테 카르도소는 ""영원히 함께 할게, 내 꿈이 이루어졌다""라며 기뻐했다.

사진=Diario AS, 디오고 조타 SNS

취재문의 sportal@sportalkorea.co.kr"
20250704,"""세상 떠난 그를 위해 월드컵 포기""…첼시 FW, 조타 장례식 참석 위해 클럽월드컵 캠프 떠났다→""출전 여부는 전적으로 그의 선택""","(엑스포츠뉴스 윤준석 기자) 축구계는 지금 비통함 속에 있다.

리버풀의 공격수이자 포르투갈 국가대표로 활약하던 디오고 조타가 지난 3일(한국시간) 스페인에서 발생한 교통사고로 동생 안드레 실바와 함께 숨지는 비극이 벌어졌다.

현재 그를 향한 추모의 물결은 비단 리버풀만이 아닌 라이벌 클럽들을 포함한 전세계로 번지고 있다.

사건 발생은 스페인 사모라 주 팔라시오스 데 사나브리아 지역 인근 고속도로 A-52에서 일어났다. 당시 조타와 안드레는 고급 슈퍼카 람보르기니를 타고 이동하던 중이었다.

목격자와 경찰에 따르면 차량은 도로를 이탈해 중앙분리대를 넘은 뒤 전복됐으며, 이어 차량은 큰 불길에 휩싸였다. 추락 직후 구조대가 현장에 도착했지만, 불이 너무 빨리 번져 두 형제를 구해내지 못했다.

조타는 물론이고 그의 친동생 안드레 역시 포르투갈 2부리그 페나피엘에서 뛰고 있던 현역 선수였기에 축구계는 하루에 2명의 유망한 선수를 잃게 됐다.



현재 현지 경찰은 타이어 결함으로 인한 주행 중 손상이 원인일 수 있다고 추정하고 있으며, 차량에 급제동 흔적이 거의 없었던 점 등을 토대로 차량 자체의 결함 가능성도 배제하지 않고 있다.

특히 조타는 불과 2주 전 오랜 연인이었던 루트 카르도수와 결혼식을 올린 직후였기에 해당 사건이 더욱 충격적으로 다가온다.

두 사람은 10년 연애 끝에 세 자녀를 둔 가정으로 이어졌으며, 조타는 지난달 22일 열린 결혼식 영상을 사고가 있기 불과 하루 전에 자신의 SNS에 올리며 ""인생 최고의 날""이라고 적었다.

이는 팬들과의 마지막 공식 소통이 됐다. 둘은 조타의 결혼식을 마친 뒤 리버풀의 프리시즌 훈련 일정을 위해 잉글랜드로 가려던 배를 타기 위해 스페인으로 향하던 길이었던 것으로 추정된다.



리버풀 선수단과 구단 관계자들도 조타의 갑작스러운 죽음에 큰 충격을 받았고, 대부분의 선수가 조타를 향한 추모글을 SNS에 게시했다.

대표적으로 주장 버질 판데이크는 ""도저히 믿을 수 없다. 믿고 싶지도 않다""며 ""조타는 단지 훌륭한 선수였을 뿐만 아니라 가족을 누구보다 사랑한 사람이었다. 그의 가족이 겪을 고통은 상상조차 할 수 없다. 우리는 영원히 그의 가족 곁에 있을 것""이라고 전했다.

앤드류 로버트슨은 ""말이 필요 없다. 나는 내 친구를 잃었다. 평생 기억할 그의 미소, 장난, 그리고 가족을 향한 사랑이 아직도 생생하다""면서 ""그는 내가 아는 가장 영국적인 포르투갈인이었다""고 회고하기도 했다.
아르네 슬롯 감독은 공식 성명을 통해 ""디오고는 단지 선수 이상의 존재였다. 그는 동료이자 친구, 진심 어린 인간이었다. 나는 그와 마지막으로 통화하며 네이션스리그 우승을 축하하고, 그의 결혼식을 축복했다. 그의 죽음은 단지 축구가 아닌 인생 전체의 상실""이라며 감정을 드러냈다.

그는 ""조타의 이름은 앞으로도 리버풀에서 영원히 울려 퍼질 것이다. 우리는 그의 유산을 잊지 않고 이어나갈 것이다""라고 덧붙였다.



해당 사건의 충격은 비단 리버풀 선수단 뿐에게만 해당하는 것이 아니다.

대표적으로 가장 큰 충격을 받은 인물 중 하나는 포르투갈 국가대표이자 현재 첼시에서 뛰고 있는 페드로 네투다.

그는 조타와 대표팀에서 오랜 기간 룸메이트로 함께 지내며 절친한 관계를 유지한 인물로, 이번 비보에 깊은 상실감과 정신적 충격을 겪은 것으로 전해졌다.

2025 국제축구연맹(FIFA) 클럽월드컵에 참여해 현재 8강을 앞두고 있는 첼시 구단은 조타 사망 이후 네투가 훈련을 중단했으며, 오는 5일 포르투갈 곤도마르에서 열리는 조타의 장례식에 참석하기 위해 미국 필라델피아의 팀 캠프를 이탈했다고 밝혔다.

미국 유력지 '디 애슬레틱'에 따르면 네투는 현재 장례식 참석 결정을 내렸다. 첼시 구단도 해당 결정을 존중하고 있다.

첼시 측은 ""경기보다 중요한 것이 있다""며 그를 위한 심리적 지원을 아끼지 않겠다고 전했다.

클럽월드컵 8강전이 임박한 상황에서도 첼시 팀 전체는 훈련 전 1분간의 묵념을 통해 조타를 애도한 것으로 전해졌다.



또한, 첼시의 엔조 마레스카 감독 역시 8강전을 앞두고 공식 기자회견에서 ""네투는 매우 슬퍼하고 있다. 단지 슬픔 그 이상의 고통에 처해 있다""고 말했다.

그는 ""오늘 아침 그와 대화를 나눴고, 경기 출전 여부는 전적으로 본인의 선택에 맡기기로 했다. 우리가 어떤 선택을 하든 전폭적으로 지지할 것""이라고 강조했다.

마레스카는 또한 ""조타는 단지 동료 축구 선수가 아니라, 그의 삶에서 중요한 사람이었다. 네투에게 있어 이번 사고는 감정적으로 엄청난 타격""이라고 덧붙였다.

실제로 조타와 네투는 2020년 이후 포르투갈 대표팀에서 여러 대회를 함께 치르며 공격진에서 유기적인 호흡을 맞춰왔다.

이들은 대표팀 소집기간 내내 같은 방을 쓰며 경기 외적으로도 가족 이야기를 나누고, 각자의 자녀 사진을 공유할 정도로 가까운 사이인 것으로 전해지며, 과거 조타가 부상에서 복귀해 다시 대표팀에 합류했을 때 가장 먼저 달려와 껴안아 준 인물도 네투였다.

그만큼 이번 사고는 네투에게 단순한 동료의 죽음을 넘어선, 인생의 일부분을 잃은 충격 그 자체로 여겨질 것으로 추측된다.



조타는 아틀레티코 마드리드, FC 포르투, 울버햄프턴 원더러스 등을 거쳐 리버풀에 합류한 뒤 4시즌 동안 182경기에 출전해 65골을 기록했으며, 2022 챔피언스리그 준우승, 2022 FA컵과 리그컵 우승, 그리고 2024-2025시즌 프리미어리그 우승을 함께한 핵심 멤버였다.

포르투갈 대표팀에서는 A매치 49경기 14골을 기록했고, 지난달 네이션스리그 우승의 주역이기도 했다.

하지만 그 어떤 기록보다 값진 것은 그가 동료와 팬들의 기억 속에 남긴 인간적인 따뜻함일 것이다.

그는 이제 더 이상 경기장을 누비지 않지만, 팬들과 동료들, 가족들의 마음 속에 남게 됐다.

사진=연합뉴스/리버풀/리버풀에코/페드루 네투 인스타그램"
20250704,"모하메드 살라, 故조타 부고 소식에 '휴가 종료, 리버풀 조기 복귀'...""통산 두 번째로 많은 경기 함께 해, 150경기 19골 합작""","[SPORTALKOREA] 김경태 기자= 디오구 조타가 불의 사고로 안타깝게 세상을 떠났다. 이에 따라 그의 동료 모하메드 살라는 휴가를 중단하고 리버풀로 조기 복귀할 예정이다. 

영국 매체 'BBC'는 3일(이하 한국시간) ""조타가 스페인 사모라 인근 A-52 고속도로에서 차량이 전복되는 교통사고를 당해 28세의 나이로 세상을 떠났다. 사고 당시 조타는 동생 안드레 실바와 함께 있었으며, 차량이 추월 중 타이어가 터지면서 전복돼 화재가 발생한 것으로 전해졌다. 두 사람 모두 현장에서 사망했다""고 보도했다.

이에 추모의 물결이 이어졌다. 동료 다르윈 누녜스는 ""이토록 큰 슬픔을 위로할 말이 없다. 항상 당신의 미소와, 그라운드 안팎에서 훌륭한 동료였던 모습을 기억할 것이다. 그의 가족에게 모든 힘을 보낸다. 그가 어디에 있든, 언제나 곁에 있을 거라 확신한다. 부디 평안히 잠드소서""라며 애도했다.

주장 버질 반다이크 역시 ""믿을 수가 없다. 완전히 충격이고, 아직도 현실 같지 않다. 우리 모두에게 정말 특별한 존재였고, 앞으로도 그럴 것이다. 그라운드 위에서 조타와 함께 뛸 수 있었던 건, 그라운드 밖에서 너의 친구가 될 수 있었던 건 내게 큰 특권이었다""며 슬픔을 표했다.

이에 따라 일부 리버풀 선수들이 휴가를 중단하고 곧장 안필드로 돌아올 전망이다. 간판스타 살라도 조기 복귀를 선택했다. 이집트 매체 '얄라코라'는 4일 ""살라는 원래 다음 주까지 그리스에서 머물 계획이었으나, 조타의 사망 소식을 접한 뒤 귀국 결정을 내렸다""고 밝혔다.

영국 매체 '데일리메일'에 따르면 살라와 조타는 리버풀에서 함께 150경기를 뛰었고, 19골을 합작해 만들어냈다. 또한 조타의 커리어 중 두 번째로 많은 시간을 함께한 선수가 살라로 알려져 더욱 안타까움을 자아냈다.



사진=악투 풋 X, 게티이미지코리아

취재문의 sportal@sportalkorea.co.kr"
20250704,"수비멘디 영입 발표하려던 아스널, 故 조타 추모 의미로 '오피셜 연기'","사진=파브리시오 로마노 기자 SNS


[포포투=박진우]

아스널이 마르틴 수비멘디 영입 오피셜을 연기했다. 故 디오구 조타를 추모하기 위함이었다.

아스널 소식통 '아스널 뉴스 채널'은 4일(한국시간) ""오늘은 아스널이 수비멘디 영입이 공식 발표될 예정이었던 날이었다. 그러나 조타와 그의 동생 안드레 실바의 안타까운 사망 소식으로 인해, 아스널은 공식 발표를 연기했다. 100% 옳은 결정이었다. 조타의 유가족에게 깊은 애도와 위로를 보낸다""고 전했다.
지난 시즌을 프리미어리그(PL) 2위로 마친 아스널. 벌써 세 시즌 연속 리그 준우승이다. 미켈 아르테타 감독은 시즌이 끝나자마자 선수단 보강 작업에 착수했다. 특히 중원 보강에 집중하고 있는 것으로 알려졌다. 브렌트포드의 주장인 크리스티안 노르가르드 영입과 가까워졌다는 소식도 전해졌다.

아울러 수비멘디 영입을 확정 지은 것으로 알려졌다. 아스널은 이미 2024-25시즌 시작 전부터 수비멘디를 향해 강한 러브콜을 보내고 있었다. 수비멘디는 레알 소시에다드와의 신의를 지키고자 리버풀 제안을 거절했지만, 이후에도 PL 빅클럽들의 구애는 끊이지 않았다.

끝내 아스널이 수비멘디를 품에 안게 됐다. 아스널 소식통들은 일제히 3일 저녁 구단이 수비멘디 영입 오피셜을 발표할 것이라 예측했다. 그러나 구단은 수비멘디 영입 공식 발표 일정을 연기했다. 전 세계 축구계가 비통함에 빠졌기 때문이었다.

3일 포르투갈 국가대표팀이자 리버풀의 공격수 조타 사망 소식이 전해졌다. 조타는 스페인 산탄데르에서 영국 플리머스로 향하는 배를 탑승하러 가던 도중, 스페인 고속도로에서 교통사고로 사망했다. 조타와 함께 차량에 탑승했던 축구 선수 동생 안드레 또한 함께 사망했다.

전 세계가 충격에 빠졌다. 포르투갈 축구협회, 정부, 의회를 비롯해 전 세계 언론, 구단, 선수들은 일제히 조타와 안드레, 그들의 유가족에게 애도의 말을 전했다. 리버풀은 조타의 등번호 20번을 영구결번으로 지정했다. 리버풀 팬들은 홈구장인 안필드 앞에 조타를 기념하는 물품들과 조화를 길게 늘어서며 추모의 공간을 만들었다. 영국 공영방송 'BBC'에 따르면 수천 만명 팬들의 조문이 이어졌다고 한다.

이에 아스널 또한 조타를 추모하는 의미로 수비멘디 영입 오피셜 일정을 연기했다. 아스널은 조타 사망 소식이 전해진 직후, 구단 공식 채널을 통해 ""우리는 모두 축구 가족의 일원이며, 오늘 같은 날에는 서로를 지지한다. 조타와 안드레, 부디 평안히 잠들기를 바란다. 리버풀과 관련된 모든 이들, 그리고 유가족과 사랑하는 이들에게 깊은 위로의 마음을 전한다""며 추모사를 남겼다.  

사진=디오구 조타 SNS"
20250704,"사고 1건당 사망 1.5명… 조타 교통사고 구간, 스페인 A-52는 '죽음의 고속도로'","(베스트 일레븐)

디오고 조타, 안드레 실바 형제가 사고를 당한 고속도로 구간은 현지에서는 악명 높은 사고 다발 구간이었던 것으로 뒤늦게 알려졌다.

조타는 지난 3일 새벽(현지시각) 스페인 사모라주 팔라시오스 데 사나브리아를 통과하는 스페인 A-52 고속도로 65km 지점에서 탑승했던 람보르기니 차량의 타이어가 고속 주행 중 파열되는 교통사고에 휘말려 안타깝게도 목숨을 달리했다.
향년 28세다. 최근 폐 기흉 수술을 받았던 조타는 항공편 탑승을 자제하는 병원측의 권고를 받아들여, 리버풀의 2025-2026 프리시즌 캠프에 합류하려고 스페인 산탄데르에서 영국 남부 도시 플리머스로 향하는 장거리 국제선 페리에 탑승하려다 변을 당했다.

언급했듯이 현재 사고 원인에 대해 람보르기니의 타이어에 문제가 있었다는 보도가 주를 이루고 있다. 하지만 해당 차량이 주행했던 스페인 A-52 고속도로 자체도 상당히 문제가 많았던 것으로 보인다.



영국 매체 <더 선>은 앙헬 블랑코 사모라 지방정부 대표가 성명을 통해 A-52 고속도로가 매우 위험하다고 구조적 문제를 지적했음을 보도했다. 블랑코 대표는 ""A-52는 매우 위험한 도로다. 심야 시간에는 시야 확보도 어렵고, 120km/h로 곡선을 도는 구간들이 반복된다""며 이 도로의 구조적 문제를 지적했다.

지역 매체인 <엘 디아 데 사모라>에 의하면, A-52 고속도로는 2023년 기준으로 인근 고속도로에 비해 사고가 굉장히 많았던 구간이다. 총 19건의 교통사고가 발생해 사고당 1.5명이 사망한 것으로 조사됐다.

단순히 고속 주행을 해야 할 커브길이 많은 게 아니다. A-52 고속도로는 도로 포장 상태가 극히 나쁜 것으로 지적되었다. 작년에는 40건이 넘는 민원이 접수되었는데, 대부분이 도로 중간에 움푹 패인 공간이 너무 많다는 것이었다. 여기에 야생 늑대나 사슴 등 대형 동물이 출몰하는 것으로도 알려져 있어 야간 사고 위험은 더욱 높다.

또 다른 지역 매체 <라 라손>은 ""야생동물이 쉽게 도로에 진입할 수 있고, 커브에서 시야 확보가 어려운 구조""라고 경고하며 ""오늘은 조타와 그의 동생이 희생자였지만, 내일은 또 다른 이름 없는 사람이 될 수 있다""는 지역 당국자의 말을 전했다.

<더 선>은 이 A-52 고속도로를 두고 ""죽음의 고속도로""라는 표현까지 썼다. 단순히 차량의 문제가 아니라 도로 자체가 굉장히 위험했다는 증언과 보도가 쏟아지면서, 사회적인 문제로 비화될 조짐까지 보인다."
20250704,"향년 28세···“람보르기니 타고 추월 중 전복” 스페인 경찰, 英 BBC가 밝힌 조타의 ‘사고 원인’","디오구 조타. BBC SPORT


디오구 조타의 사고 원인이 밝혀졌다.

앞서 지난 3일(한국시간) 영국 공영방송 ‘BBC’ 스페인 매체 ‘마르카’ 등 외신은 “포르투갈 출신 및 리버풀 소속 공격수 조타가 교통사고로 사망했다”고 보도했다.

‘마르카’에 따르면 조타는 동생 안드레 조타와 함께 차량에 타고 있었으며, 스페인 팔라시오스 데사나브리아 지역 고속도로에서 교통사고가 났다. 차량이 도로를 이탈했고 화재가 발생했으며 조타가 사망한 것으로 전해졌다.
전 세계 축구가 조타를 추모했다. 그리고 포르투갈 일간지 ‘레코드’는 3일 사고 원인을 알렸다.

매체는 “추월 중 차량 타이어가 터졌다. 그대로 미끄러졌고 전복 후 화재가 발생했다. 탑승자 둘은 사망했다”고 알렸다.

사고현장. 로이터연합뉴스


사고 현장. 로이터연합뉴스


조타의 차량과 같은 모델. 람보르기니


이어 “당시 조타의 차량은 람보르기니 우라칸 Evo였다. 이탈리아 브랜드 차량으로 고속 주행 마니아를 위해 제작됐다. 5.2리터 V10엔진을 탑재해 최대 640마력의 출력을 자랑한다”며 “정지 상태에서 시속 100km까지 가속하는 데 겨우 3.2초가 소요된다. 최고 속도는 시속 325km”라고 설명했다.

스페인 경찰은 “람보르기니를 탄 조타와 그의 동생 안드레 시우바는 타이어가 파열돼 도로를 벗어나 불길에 휩싸였다”고 밝혔다. BBC 또한 같은 내용을 전했다.

단, 현재까지 다른 차량과 직접 연관은 없는 것으로 알려졌다. 즉, 다른 차량을 스포츠카로 무리하게 앞지르다 발생한 사고라 단정할 수 없다.

디오구 조타. 게티이미지



1996년생인 조타는 포르투갈의 포르투에서 1996년 태어나 파코스 데페레이라에서 프로 데뷔했다. 이후 아틀레티코 마드리드과 포르투를 거쳐 울버햄튼 원더러스로 이적했고 이후 2020년 리버풀에 합류했다.

부상으로 결장하는 경기가 많긴 했지만, 특유의 날카로운 골 결정력과 침투 능력, 센스있는 움직임으로 위르겐 클롭에게 중용받으며 리버풀의 황금기 중심에 있었다.

이번 소식이 더 안타까운 이유가 있다. 조타는 오래 연인으로 지내온 루테 카르도소와 백년가약을 맺고서 불과 열흘여만에 이번 사고로 세상을 떠났다. 조타와 카르도소 사이에는 자녀가 셋 있다.

디오구 조타의 가족사진. 조타 SNS


조타의 소속팀 리버풀은 “많은 리버풀 팬이 ‘조타는 우리를 승리로 이끌 것이다’라고 노래를 불렀다. 그는 실제로 팀의 역사에 이바지했다. 우리에게 항상 필요했던 그가 불과 28살의 나이에 비극적인 사고로 세상을 떠났다”고 했다.

이어 “잔인하게도 그의 마지막 축구 인생은 프리미어리그, 유럽축구연맹(UEFA) 네이션스리그 우승자라는 화려한 순간으로 장식됐다. 그의 등번호 20번은 영구결번이 될 예정이다. 팬들의 응원가에서 항상 울려 퍼졌던 ‘디오구’라는 이름은 영원히 기억될 것이다”라며 고인의 명복을 빌었다.

조타를 추모하는 리버풀. 리버풀 SNS 캡처


용환주 기자 dndhkr159@kyunghyang.com"
20250704,"PSG 감독-디렉터 모두 포기했다...이강인 방출 확정! 나폴리가 적극 구애 ""예상 이적료 482억""","사진=트랜스퍼마크트 


이강인 차기 행선지로 가장 유력한 팀은 나폴리다.

프랑스 'VIPSG'는 4일(이하 한국시간) ""나폴리는 이강인을 원하고 파리 생제르맹(PSG)은 이적료를 책정했다. 이강인은 PSG를 2시즌 만에 떠날 것이다. 2028년까지 계약이 되어 있지만 PSG 스쿼드에서 자리를 못 잡았고 루이스 엔리케 감독은 이별을 원한다""고 전했다.
이강인 예상 이적료는 3,000만 유로(약 482억 원)다. 프랑스 '스포르트'는 4일 ""이강인은 시야, 우아한 공 컨트롤, 다재다능함 등으로 자신을 보여줬지만 입지가 애매해다. 경기력은 불안하고 럭셔리 조커에 그치고 있다. PSG는 여름에 이강인을 막을 생각이 없다. 루이스 캄포스 디렉터는 이강인을 통해 상당한 이익을 얻고 싶어한다. 아스널, 나폴리가 노리며 예상 이적료는 3,000만 유로다. 이강인은 주전으로 뛸 수 있는 클럽에서도 다시 선수 생활을 하고 싶어한다""고 이야기했다.

이강인은 PSG에 남을 가능성이 적어 보인다. 지난 시즌 PSG는 창단 첫 유럽축구연맹(UEFA) 챔피언스리그(UCL) 우승에 성공하면서 트레블도 이뤄냈다. 아시아 최초 트레블 경험자가 된 이강인은 UCL, 트레블 멤버가 되면서 트로피를 연이어 들었는데 후반기 데지레 두에, 흐비차 크바라츠헬리아 등에게 완전히 밀리면서 출전하지 못했다.



현재 2025 국제축구연맹(FIFA) 클럽 월드컵에 참여 중인데 세니 마욜루 등 어린 선수들에게 밀려 있다. 클럽 월드컵을 통해서 이강인 입지가 더욱 명확해졌다. 비판도 나왔다. 성추행 문제로 퇴출됐던 피에르 메네스 전 기자는 ""이강인은 PSG에서 뛸 선수가 아니다. 나쁜 선수는 아니나 PSG는 그에게 너무 큰 클럽이다. 압박감이 덜한 클럽으로 가는 게 낫다. PSG에서 이강인이 드리블을 하는 걸 본 적이 없다""고 한 적이 있는데 이번에도 비난을 가했다.

메네스는 ""(클럽 월드컵을 보면) 선발, 후보 선수들 사이에는 수준, 질 차이가 있다. PSG라는 주전 뒤에 뤼카 에르난데스, 워렌 자이르-에메리, 이강인, 곤살루 하무스가 있는데 매우 뒤처져 있다. 그게 문제다""고 지적했다.



이적설에 박차를 하고 있다. 아스널과 함께 나폴리가 이강인을 원한다. 김민재가 뛰었던 나폴리는 흔들렸던 2023-24시즌을 지나 2024-25시즌 안토니오 콘테 감독과 함께 이탈리아 세리에A 트로피를 되찾았다.

케빈 더 브라위너를 영입한 나폴리는 이적시장에서 공격적인 행보를 이어갈 예정이다. 이강인도 데려오려고 한다. 프랑스 유력 기자 로망 콜레 고댕은 ""나폴리가 여전히 이강인에게 큰 관심이 있다. 이제 속도를 내고 싶어 한다. PSG는 이강인에 대해 3,000만 유로를 요구한다""고 주장했다."
