date,title,content
20250704,"'와' 아스널 '초대박' 났다…""1,365억 제안 준비 중, 계획 없었는데 협상 테이블 열릴 수도""","아스널이 가브리엘 마르티넬리의 이적료로 엄청난 금액을 손에 넣을 수도 있다.

영국 '골닷컴'은 4일(한국시간) ""알 나스르가 왼쪽 윙어 영입을 위해 아스널 마르티넬리로 관심을 돌렸다""라며 ""여름 스쿼드 강화를 위한 최우선 자원으로 마르티넬리를 지목했다""라고 보도했다.

알 나스르는 이번 여름 이적시장에서 공격수 존 듀란과 이별이 유력하다. 지난 겨울 이적시장에서 듀란이 합류한 뒤 18경기 12골을 기록했으나, 아시아축구연맹(AFC) 챔피언스리그 엘리트(ACLE) 4강 가와사키 프론탈레전 등 중요 경기에서 부진했다.
결국 알 나스르가 듀란의 이적을 허락했다. 유럽 축구 이적시장 소식에 능통한 파브리지오 로마노 기자는 ""알 나스르가 듀란의 이적 허가를 내렸다. 이제 페네르바체가 그의 영입을 눈앞에 두고 있다. 페네르바체 오제크 디렉터가 개인 협상에 착수했고 마무리 단계에 접어들었다""라고 설명했다.

이번 여름 이적시장에서 알 나스르는 공격 보강을 계획 중이다. 타겟은 아스널 측면 공격수 마르티넬리다. '골닷컴'은 ""알 나스르는 마르티넬리를 유혹하기 위해 입찰을 준비 중이다. 듀란은 페네르바체 이적이 유력하다""라고 밝혔다.



그런데 거론되는 이적료가 엄청나다. 매체는 ""원래 아스널은 리버풀 루이스 디아스를 최우선 목표로 삼았지만, 이제 마르티넬리에게 시선을 돌렸다""라며 ""알 나스르는 아스널을 시험하기 위해 약 8,500만 유로(약 1,365억 원)의 거액 제안을 준비 중인 것으로 전해졌다""라고 더했다.

냉정히 유럽에서 마르티넬리에게 1,300억 원이 넘는 금액을 내밀 팀은 거의 없다. 매체는 ""아스널은 당장 마르티넬리를 내보낼 계획은 없다. 하지만 알 나스르로부터 초대형 제안이 오면 협상 테이블이 열릴 수 있다는 관측도 점차 확산되고 있다""라고 이야기했다.

만약 마르티넬리가 알 나스르로 향한다면, 아스널은 새로운 공격수를 영입할 수 있다. 매체는 ""아스널은 레알 마드리드의 호드리구, 뉴캐슬 유나이티드의 앤서니 고든과 연결돼 있다. 마르티넬리 이적료는 이들의 영입 자금으로 활용될 수 있다""라고 덧붙였다."
20250704,"伊 역대급 사건 터진다! 26세에 '빅리그 득점왕' 먹었는데 야망 대신 돈 선택→""사우디 알 카디시아 이적 임박""","▲ ⓒ레테기 SNS


[스포티비뉴스=장하준 기자] 충격적인 이적이다. 이제 막 전성기에 접어들었지만, 야망 대신 돈을 선택헀다.

아르헨티나 유력 기자인 헤르만 가르시아 그로바는 3일(한국시간) ""사우디아라비아의 알 카디시아가 마테오 레테기 영입을 앞뒀다. 아탈란타와 협상이 진전됐으며, 이적료는 5,000만 유로다(약 802억 원)""라고 전했다.

이탈리아와 아르헨티나 이중 국적을 가진 스트라이커 레테기는 유소년 시절 아르헨티나의 리버 풀레이트와 보카 주니어스를 거치며 성장했다. 이어 2017-18시즌에 보카 주니어스 유니폼을 입고 프로 데뷔전을 치렀다. 하지만 성장이 더 필요했고, 남미 여러 팀에서 임대를 거치며 기회를 차츰 늘려갔다.

그러던 중 2022년 아르헨티나 티그레로 임대 이적한 뒤, 19골을 넣으며 리그 득점왕을 차지했다. 이에 이탈리아 대표팀이 그의 합류를 노렸다. 결국 이중 국적을 가진 레테기는 이탈리아 대표팀을 선택했고, 많은 주목을 받았다.



이어 2023년 세리에A 제노아가 레테기를 영입했다. 레테기는 제노아에서 통산 9골 3도움을 기록하며 가능성을 입증했고 작년 여름에는 아탈란타 유니폼을 입었다.

그는 여기서 폭발했다. 모든 대회 28골 9도움으로 세리에A 최고의 공격수 중 한 명으로 거듭났다. 또한 리그에서는 25골로 득점왕을 차지했다.

1999년생의 레테기는 이제 본격적으로 전성기에 돌입했다. 그런데 돌연 사우디아라비아 이적설이 제기되더니 결국 알 카디시아 이적을 눈앞에 뒀다.

알 카디시아는 아탈란타에 5,000만 유로의 이적료를 제시했고, 레테기에게도 거액의 연봉을 내민 것으로 보인다. 그리고 레테기는 돈의 유혹을 이기지 못했고, 전성기 나이에 유럽 무대를 누비는 대신 돈을 택했다. 이탈리아 팬들 입장에서는 아쉬운 선택이다. 레테기는 향후 몇 년간 이탈리아 대표팀의 최전방을 책임져 줄 핵심 자원이다. 그러나 주목도가 덜한 사우디아라비아 이적이 임박하며 그를 유럽에서 볼 가능성이 희박해졌다."
20250704,"'대박!' 손흥민, 프랑크와 담판 지었다…토트넘 떠나 LA 이적 유력→요리스와 한솥밥","[SPORTALKOREA] 배웅기 기자= 토트넘 홋스퍼 주장 손흥민이 과거 한솥밥을 먹은 위고 요리스의 로스앤젤레스 유니폼을 입을 것이라는 주장이 나왔다.

영국 매체 'TBR 풋볼'은 3일(이하 한국시간) ""LA가 올여름 손흥민을 BMO 스타디움으로 데려오기 위해 협상을 벌이고 있다""고 보도했다.

매체는 ""LA는 손흥민 영입을 위해 지명 선수 자리를 비워뒀다. 이는 그에게 미국 메이저리그사커 샐러리캡을 초과하는 연봉을 제안할 수 있다는 의미""라고 덧붙였다.

LA는 최근 올리비에 지루의 LOSC 릴 이적이 확정돼 대체자를 물색하고 있는 것으로 알려졌다. MLS 규정상 각 구단은 최대 3명의 지명 선수를 등록할 수 있다. 매체에 따르면 LA는 현재 손흥민이 받고 있는 주급 19만 파운드(약 3억 5,000만 원)를 제안할 의향이 있다.



손흥민의 이적이 기정사실화되고 있다. 토트넘 소식에 정통한 영국 매체 '더 스퍼스 웹'은 2일(이하 한국시간) ""토마스 프랑크 토트넘 감독이 손흥민의 이적을 승인했다""며 ""손흥민에게 잔류를 택할 시 주전을 보장할 수 없다는 점을 분명히 했다""고 보도했다.

올 시즌 유럽축구연맹(UEFA) 유로파리그 우승 트로피를 들어 올리며 유종의 미를 거둔 손흥민이나 경기력이 하향세를 그린 건 부정할 수 없는 사실이다. 설상가상 손흥민에게 전폭적 지지를 보내던 엔지 포스테코글루 전 감독마저 경질됐다.

영국 매체 '더 보이 홋스퍼'는 지난달 19일 ""프랑크는 강제로 손흥민을 내보낼 생각은 없다. 다만 잔류할 경우 벤치에 머무는 시간이 늘어날 것이라는 점은 분명하다""며 ""프랑크는 자신의 입장을 정리했고, 더 이상 손흥민을 핵심이라고 생각하지 않는다""고 전했다.



토트넘은 손흥민의 입장을 최대한 존중한다는 방침이다. 영국 매체 '풋볼 런던'의 알레스데어 골드 기자는 지난달 30일 ""토트넘은 올겨울 손흥민의 1년 계약 연장 옵션을 발동하기는 했지만 (이적에 있어) 그의 결정을 존중할 것""이라며 ""손흥민은 이전보다 이적에 열려있다. MLS와 사우디 프로페셔널리그가 관심을 갖고 있다""고 강조했다.

사진=게티이미지코리아

취재문의 sportal@sportalkorea.co.kr"
20250704,"'주급은 그렇다 치자. 그럼 이적료는?' 또 등장한 손흥민 미국행 루머, 주급보다 이적료가 핵심인 이유","사진=토트넘 훗스퍼 뉴스
<저작권자(c) 연합뉴스, 무단 전재-재배포, AI 학습 및 활용 금지>
[스포츠조선 이원만 기자] LA FC가 과연 '장사의 신' 다니엘 레비 회장을 설득할 수 있을 것인가.

여름 이적시장에서 손흥민(33)이 미국으로 갈 수 있다는 주장이 영국 매체에서 또 등장했다. 이번에는 한층 더 구체적인 내용이 들어갔다. 파격적인 계약으로 손흥민이 만족할 만한 주급을 맞춰줄 준비가 됐다는 내용이다.

그러나 정작 가장 중요한 부분이 아직도 빠져 있다. 바로 토트넘 홋스퍼 다니엘 레비 회장이 손흥민의 이적을 승인해 줄 수 있는 유일한 조건, 바로 충분한 이적료에 대한 부분이다.

영국 매체 TBR풋볼은 3일(이하 한국시각) '미국 메이저리그사커(MLS) LA FC가 손흥민과 미국행에 대해 이야기를 나눴다. LA FC는 손흥민을 미국으로 데려오기 위해 놀라운 계약을 추진하고 있다'는 내용을 단독으로 보도했다.

손흥민은 지난 10년간 토트넘의 핵심선수로 활약해왔고, 특히 2023년부터는 주장을 맡아 팀의 염원이던 '우승'까지 이뤄냈다. 엔제 포스테코글루 전 감독과 함께 2024~2025시즌 유럽축구연맹(UEFA) 유로파리그 우승을 달성했다.

<저작권자(c) 연합뉴스, 무단 전재-재배포, AI 학습 및 활용 금지>
그러나 토트넘은 유로파리그 우승 이후 대대적인 팀 개편을 추진 중이다. 비록 유로파리그에서는 우승했지만, 잉글랜드 프리미어리그(EPL) 성적은 17위에 그친 포스테코글루 감독을 해임한 것이 시작이다. 이어 2024~2025시즌에 다소 침체된 성적을 낸 손흥민을 내치려는 분위기다.

새로 팀을 맡은 토마스 프랭크 감독도 최근 손흥민과의 면담에서 '다음 시즌 주전을 보장할 수 없다'며 이적을 승인했다는 보도가 나왔다. 토트넘 소식을 전담하는 알라스데어 골드 기자는 지난 2일 ""프랭크 감독이 손흥민과 직접 면담을 진행하면서 만약 다음 시즌에도 팀에 남는다면 선발이 아닌 조연의 위치에 머물 수밖에 없다는 점을 밝혔다. 또한 손흥민이 이적을 원하면 구단 차원에서 수용할 수도 있다는 입장을 전했다""고 보도했다.
결국 손흥민의 '탈토트넘'은 이제 확실해지는 분위기다.

시장 역시 이런 토트넘의 상황을 예의주시하고 있다. 비록 기량이 떨어졌다고 해도 손흥민은 여전히 세계적인 수준의 윙어다. 게다가 '코리아 마케팅'의 가치도 지니고 있다. 영입하면 충분히 그 가치를 할 선수다.

<저작권자(c) 연합뉴스, 무단 전재-재배포, AI 학습 및 활용 금지>
때문에 사우디아라비아 프로구단과 튀르키예 페네르바체 등이 손흥민을 적극적으로 원하고 있었다. 이 가운데 페네르바체는 최근 살짝 발을 뺀 분위기다. 조제 무리뉴 감독이 적극적으로 원하고 있지만, 레비 회장이 원하는 손흥민의 이적료를 감당할 수 없다는 판단을 했기 때문이다.

이런 분위기 속에 최근 국제축구연맹(FIFA) 클럽월드컵이 펼쳐지고 있는 미국이 손흥민의 새 행선지로 등장했다. 구체적으로는 MLS의 LA FC가 손흥민을 원하고 있다는 내용이었다.

사실 구단 재정규모나 리그의 위상 때문에 처음 LA FC 이적설이 나왔을 때는 단순한 루머에 그칠 듯 했다. 하지만 TBR풋볼은 LA FC가 새로운 방식으로 손흥민을 유혹하고 있다는 내용을 전했다.

이 매체는 'LA FC가 손흥민을 데려가기 위해 지명 선수(DP) 슬롯을 비워둔 상태다. MLS 규정상 각 구단은 최대 3명의 지명 선수를 보유할 수 있으며, 이들에게는 리그 샐러리캡을 초과하는 주급을 줄 수 있다. LA FC에 뛰었던 올리비에 지루가 LOSC 릴로 이적하면서 슬롯 한 자리가 확보됐다'고 보도했다.

상당히 진전된 이야기다. LA FC가 DP슬롯을 이용한다면, 손흥민에게 현재 토트넘에서 받는 주급 19만파운드(약 3억5000만원)를 뛰어넘는 주급을 제시할 수 있다는 전망이다.

하지만 이 전망에는 매우 중요한 포인트가 하나 빠져 있다. 바로 이적료에 관한 내용이다.

<저작권자(c) 연합뉴스, 무단 전재-재배포, AI 학습 및 활용 금지>
토트넘 구단은 지난 1월 손흥민에게 '계약 1년 연장옵션'을 발동했다. 결국 손흥민의 계약은 2026년 6월까지 연장됐다. 이렇게 되면 이번 여름 이적시장에서 손흥민을 영입하기 위해서는 토트넘 구단에 이적료를 지불해야 한다.

현지에서는 레비 회장이 바로 이점을 노리고 계약 연장 옵션을 쓴 것으로 보고 있다. 손흥민 급의 선수를 그냥 공짜로 내준다는 건 엄청난 손해이기 때문이다. 실제로 레비 회장은 사우디아라비아 구단이 손흥민을 원할 경우 이적료로 무려 '1억 파운드(약 1863억원)'를 요구할 것이라는 보도가 나오기도 했다.

토트넘 소식을 다루는 토트넘 홋스퍼 뉴스는 지난 달 24일 '토트넘 구단이 손흥민의 이적료로 1억 파운드를 요구할 것'이라며 전 토트넘 스카우트였던 브라이언 킹의 주장을 전했다. 킹은 ""토트넘 구단은 사우디아라비아 구단이 손흥민을 원할 경우 1억 파운드의 이적료를 요구할 것이다""라며 ""그 정도 규모의 제안이 온다면 레비 회장은 거절할 수 없을 것이다. 토트넘은 그만한 돈을 받을 수 있다고 생각한다. 한국에서 엄청난 인지도 덕분에 엄청난 마케팅 비용을 벌어들일 수 있기 때문이다""라고 주장했다.

<저작권자(c) 연합뉴스, 무단 전재-재배포, AI 학습 및 활용 금지>
1억파운드까지는 아니더라도 레비 회장이 손흥민을 절대 헐값에 보내지 않을 것이라는 점은 불을 보듯 뻔하다. 사우디아라비아 알 아흘리와 알 나스르, 알 카디시야 구단도 경쟁적으로 손흥민 영입을 추진하고 있는데, 이들은 5000~6000만파운드의 이적료를 제시하는 것으로 알려졌다. 페네르바체 역시 최대 3000만파운드의 이적료를 준비중이었다는 보도가 있었다.

결국 손흥민을 토트넘에서 빼내려면 적어도 3000만파운드 이상은 제시해야 협상이 가능하다는 뜻이다. 전세계 선수의 가치를 평가하는 트랜스퍼마크트는 최근 손흥민의 몸값을 2000만유로(약 318억원)로 매겼다.

<저작권자(c) 연합뉴스, 무단 전재-재배포, AI 학습 및 활용 금지>
그런데 LA FC가 이러한 손흥민의 이적료를 감당할 것이라는 내용은 어디에서도 찾아보기 힘들다. 만약 손흥민이 LA FC행을 실제로 원하고, 개인합의까지 마쳤다고 해도 레비 회장이 승인을 하지 않는다면 계약이 어려워진다. 그리고 레비 회장을 움직일 수 있는 유일한 해법은 결국 돈, 즉 이적료다.

LA FC 구단의 역대 최고 이적료는 2019년 아르헨티나 출신 브리안 로드리게스를 영입할 때 쓴 1045만 유로(약 166억원)였다. 이 정도로는 레비 회장을 절대 움직일 수 없다. 이보다 최소 2배 이상은 제시해야 협상 테이블에 앉을 수 있다. 과연 LA FC가 이를 감당할 수 있을 지는 미지수다. 현실적으로 손흥민의 미국행은 해프닝 정도로 끝날 듯 하다."
20250704,"""오늘, 세 아이가 아빠없이 깨어났다""…전세계가 '조타 추모' 물결→리버풀 공격수 교통사고 참변 '향년 28세'","▲ 디오구 조타 SNS


[스포티비뉴스=박대현 기자] 세계 축구계가 불의의 교통사고로 세상을 떠난 디오구 조타(1996~2025) 추모 물결에 발을 담그고 있다. 동료를 잃은 깊은 상실감을 토로하면서 그의 남은 세 자녀와 아내를 향한 안타까움도 아울러 드러내 보는 이 마음을 아프게 적시고 있다.

영국 공영방송 BBC, 스페인 마르카 등 현지 언론에 따르면 조타는 3일(현지시간) 스페인 사모라 지역에서 발생한 교통사고로 숨을 거뒀다. 함께 차량에 탑승한 동생 안드레 역시 사망했다.

조타와 함께한 축구계 동료와 감독, 스태프는 물론 라이벌 팀과 리그까지 한목소리로 28세를 일기로 황망히 곁을 떠난 그를 위해 진심어린 추모글을 적어 올리고 있다.
2019년부터 포르투갈 대표팀에서 한솥밥을 먹은 주앙 칸셀루(알힐랄)는 자신의 누리소통망(SNS)에 ""오늘 세 아이가 아빠 없이 깨어났습니다. 오늘, 어느 어머니와 아버지가 두 아들 없이 깨어났습니다. 오늘, 한 아내가 남편 없이 깨어났습니다. 오늘, 우리 모두는 충격에 빠져 깨어났습니다""라고 적었다.

""오늘만큼은 우리가 잠시 걸음을 멈춰 진정한 감정을 표현하고 우리가 가진 것과 보장되지 않는 것에 대해 생각하는 하루가 됐으면 합니다. 내일을 맞이할 수 있다는 것에 감사할 수 있는 날이 됐으면 합니다. 애도를 표합니다""라고 덧붙여 너른 공감을 얻었다.

▲ 주앙 칸셀루 SNS


위르겐 클롭 전 리버풀 감독은 ""지금은 내가 심리적으로 너무 어렵고 힘든 순간이다. 조타와 그의 동생 안드레의 부고 소식을 듣고 가슴이 너무도 아팠다""면서 ""조타는 훌륭한 축구 선수였을뿐 아니라 훌륭한 친구이기도 했다. 또한 사랑스럽고 자상한 남편이자 아버지였다. 나는 그가 너무 그리울 것""이라며 옛 제자의 뒤안길을 배웅했다.

이어 ""조타의 아내와 아이들, 가족 그리고 그를 사랑한 모든 이에게 제 기도와 마음, 힘을 드리고 싶다. 사랑하는 J, 편히 쉬기를""이라고 끝을 맺었다.

크리스티아누 호날두(알나스르) 또한 황망한 심경을 감추지 못했다. ""말도 안 된다. 며칠 전만 해도 우린 국가대표팀에서 함께였고 더구나 당신은 이제 막 결혼을 하지 않았나""라며 거대한 당혹감을 꺼내보였다.

""당신의 가족과 아내, 그리고 아이들에게 깊은 애도를 표한다. 세상의 모든 힘이 당신과 당신 주변에 가닿길 기원한다""며 ""조타, 당신은 영원히 함께할 것이다. 편히 쉬세요. 디오고 그리고 앙드레. 우린 모두 당신을 그리워할 것""이라고 덧붙였다.



소속팀 리버풀도 애통한 심정을 감추지 못했다. 구단 홈페이지를 통해 ""리버풀은 조타의 비극적인 죽음으로 너무나 큰 충격에 빠졌다. 구단은 28세의 조타가 그의 동생 안드레와 함께 스페인에서 교통사고를 당한 후 사망했다는 비보를 접했다""면서 ""리버풀은 조타의 가족과 친구, 팀 동료, 클럽 스태프가 느낄 상상할 수 없는 고통을 받아들이려 노력할 것이다. 그래서 앞으로 더는 (이 비보에 대한) 언급을 삼갈 것이다. 이 같은 결정에 존중을 부탁드리며 우리는 조타를 위해 전폭적인 지원을 아끼지 않을 것""이라며 슬픔과 다짐을 아우르는 성명문을 발표했다.

라이벌 구단 맨체스터 유나이티드 역시 ""오늘 너무나 가슴 아픈 소식이 있다. 조타와 그의 동생 안드레가 불의의 사고로 우리 곁을 떠났다. 두 사람을 사랑하는 분들과 리버풀 관계자에게 깊은 애도를 표한다""고 추모했다.

최근 4~5년간 리버풀과 치열하게 리그 우승 다툼을 벌인 맨체스터 시티도 ""모든 맨시티인은 황망한 소식으로 충격과 슬픔을 느끼고 있다. 우리는 어려운 시기에 놓인 조타의 가족과 친구들, 리버풀에 있는 모든 분들께 위로를 전한다""고 적었다.

다수의 리버풀 레전드도 조타 추모 행렬에 동행했다. 제이미 캐러거는 ""오늘 아침 들은 비보는 너무나 참혹하다. 그의 아내와 세 아이를 비롯한 모든 가족과 친구들께 비통한 위안을 건넨다"" 밝혔고 스티븐 제라드는 ""RIP 디오구. 믿을 수 없는 슬픔 속에 유가족과 함께하겠다""는 짧지만 선명한 메시지를 남겼다.



조타는 2015년 파수스 드 페헤이라(포르투갈)에서 프로 커리어 첫발을 뗐다. 이후 아틀레티코 마드리드(스페인)와 포르투(포르투갈) 울버햄튼 원더러스(잉글랜드)를 거쳐 2020년 리버풀 유니폼을 입었다.

지난 시즌 EPL 26경기에서 6골을 넣어 리버풀의 5년 만에 왕좌 탈환에 공헌했다. 빼어난 오프 더 볼 무브와 높은 축구 지능으로 최전방 원 톱부터 좌우 윙어, 처진 공격수까지 1~2선 어느 포지션이든 두루 가능한 멀티성이 돋보인 선수였다.

포르투갈 대표팀에서의 실적 역시 눈부시다. 연령별 대표팀을 차례로 거친 조타는 2019년 포르투갈 A대표팀에 처음 승선해 6년째 활약해왔다.

유럽축구연맹(UEFA) 유로 2020과 2024에 참가했고 올해는 UEFA 네이션스리그 우승에 일조해 주목받았다. 통산 A매치 기록은 49경기 14골.

동생 안드레 역시 축구선수로 활동했다. 포르투 유스 출신으로 지난 시즌엔 포르투갈 하부리그 팀 페나피엘에서 뛰었다.

▲ 'Sky sports' 홈페이지


BBC에 따르면 조타 형제가 탑승한 차량은 다른 차량을 추월하다 타이어 파열로 고속도로에서 이탈했다. 차량은 빠르게 불길에 휩싸였고 둘은 현지시간 3일 오전 0시 30분을 기해 숨을 거뒀다.

조타는 사고가 일어나기 약 2주 전에 오랜 연인과 결혼식을 올린 것으로 알려져 안타까움을 더했다. 슬하에 자녀 셋을 둔 루테 카르도소와 지난달 22일 결혼식을 올렸는데 신혼 생활을 시작한 지 불과 열하루 만에 참변을 입은 것이다.

포르투갈축구협회(FPF)는 공식 성명을 내고 ""포르투갈 축구계는 조타 소식에 큰 충격에 빠졌다. 그는 훌륭한 선수를 넘어 모든 동료와 상대 선수에게 존경받는 남자였다""며 ""주변에 기쁨을 전파하고 지역사회서도 모범적이었던 인물""이라며 너무나 이른 나이에 세상을 등진 동료를 추사(追思)했다.

▲ 'Marca' SNS"
