date,title,content
20250310,"0-2 되자 손흥민 분노 폭발→PK로 극적 무승부…""비긴 것도 실망스러워""","안지 포스테코글루 감독이 이끄는 토트넘이 9일(한국시간) 영국 런던에 있는 토트넘 홋스퍼 스타디움에서 열린 본머스와의 2024-2025시즌 프리미어리그 28라운드 홈 경기에서 손흥민의 페널티킥 득점이 터지며 2-2 무승부를 거뒀다. 중계화면 캡쳐


(엑스포츠뉴스 김정현 기자) 토트넘 홋스퍼 주장 손흥민의 분노에 선수단이 각성한 걸까.

연패 위기에서 토트넘이 동점을 만들었지만, 손흥민은 만족할 수 없었다. 

안지 포스테코글루 감독이 이끄는 토트넘이 9일(한국시간) 영국 런던에 있는 토트넘 홋스퍼 스타디움에서 열린 본머스와의 2024-2025시즌 프리미어리그 28라운드 홈 경기에서 손흥민의 페널티킥 득점이 터지며 2-2 무승부를 거뒀다. 

손흥민은 이날 교체 명단에서 경기를 시작해 후반전에 교체 출전했다. 후반에 동점을 만드는 페널티킥을 성공시키면서 손흥민은 팀에 소중한 승점 1점을 가져다줬다. 토트넘은 13위(10승4무14패·승점34)를 유지했다. 

안지 포스테코글루 감독이 이끄는 토트넘이 9일(한국시간) 영국 런던에 있는 토트넘 홋스퍼 스타디움에서 열린 본머스와의 2024-2025시즌 프리미어리그 28라운드 홈 경기에서 손흥민의 페널티킥 득점이 터지며 2-2 무승부를 거뒀다. 연합뉴스


손흥민은 올 시즌 리그에서 네 번째로 교체 출전했다. 지난달 27일 맨체스터 시티와 홈 경기 교체 출전 이후 두 경기 연속이다. 현재 유럽축구연맹(UEFA) 유로파리그 16강 일정에 선발로 나서면서 로테이션을 진행했다. 

홈 경기임에도 토트넘은 본머스의 맨투맨 수비에 시작하자마자 고전했다. 다행히 이를 잘 버텨냈지만, 수비가 시원하게 뚫리면서 결국 리드를 내줬다. 

전반 42분 토트넘 페드로 포로의 패스를 차단한 본머스 밀로시 케르케즈가 왼쪽 측면 전진 이후 얼리 크로스를 올렸다. 반대편에서 마커스 태버니어가 오른발로 때려 넣었다.

안지 포스테코글루 감독이 이끄는 토트넘이 9일(한국시간) 영국 런던에 있는 토트넘 홋스퍼 스타디움에서 열린 본머스와의 2024-2025시즌 프리미어리그 28라운드 홈 경기에서 손흥민의 페널티킥 득점이 터지며 2-2 무승부를 거뒀다. 연합뉴스


전반전은 본머스의 리드로 끝났다. 전반 종료 휘슬이 울리자, 토트넘 홈 팬들은 강력한 야유를 보냈다. 

후반 시작과 함께 토트넘은 이브스 비수마, 브레넌 존슨을 빼고 손흥민, 루카스 베리발을 투입해 변화를 줬다. 

하지만 토트넘은 오히려 추가 실점을 허용했다. 후반 20분 저스틴 클라위베르트가 침투 패스를 넣었고 에바니우송이 왼발 칩슛으로 굴리에모 비카리오를 뚫고 두 번째 골을 터뜨렸다. 

안지 포스테코글루 감독이 이끄는 토트넘이 9일(한국시간) 영국 런던에 있는 토트넘 홋스퍼 스타디움에서 열린 본머스와의 2024-2025시즌 프리미어리그 28라운드 홈 경기에서 손흥민의 페널티킥 득점이 터지며 2-2 무승부를 거뒀다. 연합뉴스


두 골 차로 벌어지자, 손흥민은 동료들에게 불같이 화를 내며 상황을 반전시켜야 한다는 의지를 드러냈다. 너무나 안일한 수비로 두 골을 내주면서 토트넘은 다시 연패에 빠질 위기였다. 

토트넘은 후반 22분 파페 사르가 오른쪽에서 시도한 킥이 반대편 골포스트를 맞고 들어가는 행운의 득점이 터지면서 한 골 차 추격했고 손흥민이 직접 구원자로 나섰다. 

후반 36분 제임스 매디슨이 손흥민에게 패스를 시도했다. 박스 안에서 손흥민이 한 번 터치한 뒤, 케파에게 걸려 넘어지면서 주심은 페널티킥을 선언했다. 손흥민이 키커로 나서 파넨카 킥을 하면서 케파를 완전히 속이고 동점 골을 터뜨렸다. 리그 7호 골이자 공식전 11호 골이다. 

안지 포스테코글루 감독이 이끄는 토트넘이 9일(한국시간) 영국 런던에 있는 토트넘 홋스퍼 스타디움에서 열린 본머스와의 2024-2025시즌 프리미어리그 28라운드 홈 경기에서 손흥민의 페널티킥 득점이 터지며 2-2 무승부를 거뒀다. 연합뉴스


이후 역전 골은 터지지 않았다. 하지만 손흥민의 흔치 않은 분노가 선수단을 일깨웠고 결과적으로 승점을 챙길 수 있었다. 

손흥민은 경기 후 인터뷰에서 무승부에 만족하지 못하는 모습을 보였다. 
경기 후 스카이스포츠와의 인터뷰에서 손흥민은 ""난 승점 3점을 얻지 못해 정말 실망하고 좌절했다""면서 ""홈에서 경기할 때 승점 3점을 기대한다. 분명히 본머스가 좋은 팀이다. 특히 올 시즌 그들은 정말 뛰어나다. 하지만 2-2는 여전히 우리에게 좋지 않고 계속 나아가야 한다""라고 밝혔다. 

구단 인터뷰에서 손흥민은 더 자세한 이야기를 전했다. 그는 ""전반에 좋은 기회들이 있었고 비카리오의 놀라운 선방도 있었다. 하지만 여전히 2-2는 홈에서 정말 실망스럽다. 승점 3점을 얻어야 했다""라고 말했다. 

안지 포스테코글루 감독이 이끄는 토트넘이 9일(한국시간) 영국 런던에 있는 토트넘 홋스퍼 스타디움에서 열린 본머스와의 2024-2025시즌 프리미어리그 28라운드 홈 경기에서 손흥민의 페널티킥 득점이 터지며 2-2 무승부를 거뒀다. 연합뉴스


로테이션을 통해 교체 출전한 점에 대해, 손흥민은 ""나는 모든 경기를 뛰고 싶다. 하지만 신체적으로 어느 때보다 나아지려고 한다. 팀의 계획이 있다. 모두가 출전 시간이 필요하다. 골을 넣어서 팀에 정말 도움이 됐다. 새로운 에너지와 정신적, 신체적으로 산뜻한 상태로 경기에 나서고 있다. 무엇보다 중요한 건 경기력""이라고 밝혔다.

매번 뒤늦게 추격하는 점을 지적하자, 손흥민도 ""뒤쫓아 가는 경기는 이상적이지 않다. 우리는 강하게 나서야 하고 발전해야 한다. 같은 단계에 있지 말고 앞으로 나아가야 한다. 우리의 기록을 늘려나가야 하고 성장해야 한다""라고 답했다.

안지 포스테코글루 감독이 이끄는 토트넘이 9일(한국시간) 영국 런던에 있는 토트넘 홋스퍼 스타디움에서 열린 본머스와의 2024-2025시즌 프리미어리그 28라운드 홈 경기에서 손흥민의 페널티킥 득점이 터지며 2-2 무승부를 거뒀다. 연합뉴스


후반에 교체로 나선 손흥민은 팀에 어떤 것들을 불어넣으려고 했는지 묻자, ""나는 항상 경기장에서 팀을 위해 기회를 만들고 득점하려고 한다. 영향력을 주려고 한다. 많은 공간이 있지만 올바른 결정을 하지 못해 어려울 때도 있다. 하지만 난 최고의 해결책을 찾아내려고 한다. 파이널 서드 지역에서 패스를 하고 결과를 내야 한다. 좋은 결정과 득점을 했다. 우리는 그저 머리를 처박고 뛸 수밖에 없다""라고 말했다. 

페널티킥 득점에 대해서는 ""훈련 후에 항상 연습했다. (지난해 말)울버햄프턴 원더러스전에 페널티킥을 놓친 뒤 계속 연습했다. 침착하려고 했고 결정지으려고 했다. 골망이 출렁였을 때 너무나 행복했다""라고 전했다. 

현재 팀에 필요한 점이 무엇인지 묻자, 손흥민은 ""퀄리티가 결과를 가져오지 않는다. 정신력과 관리도 필요하고 경기력을 위한 훈련도 필요하다. 개개인의 능력은 말할 필요가 없다. 프리미어리그에서 뛰는 선수들은 모두 그럴 이유가 있다. 하지만 모든 것을 쏟지 않으면 축구는 반전을 가져올 수 없다. 진지하게 임하고 할 수 있는 것들을 해내야 한다""라고 강조했다. 

안지 포스테코글루 감독이 이끄는 토트넘이 9일(한국시간) 영국 런던에 있는 토트넘 홋스퍼 스타디움에서 열린 본머스와의 2024-2025시즌 프리미어리그 28라운드 홈 경기에서 손흥민의 페널티킥 득점이 터지며 2-2 무승부를 거뒀다. 연합뉴스


사진=연합뉴스"
20250310,"3145억 벌고 탈중국 성공! 그런데 월급이…中매체 '브라질 돌아간 오스카, 3개월 째 임금 체불'","◇사진출처=오스카 개인 SNS
◇사진출처=오스카 개인 SNS
[스포츠조선 박상경 기자] 상하이 하이강을 떠나 모국 브라질로 돌아간 오스카가 임금 체불에 시달리고 있다는 설이 제기됐다.

중국 축구보는 9일 '상파울루에서 활약 중인 오스카는 행복해 보이지 않는다. 오스카와 그의 동료들은 현재 상파룰루에서 급여를 받지 못하고 있다'고 전했다.

오스카는 지난해 12월 상하이 하이강과의 계약이 만료되자 브라질 복귀를 택했다. 상파울루에 입단한 오스카는 11경기 2골-4도움으로 녹슬지 않은 기량을 과시했다. 이 11경기 중 상파울루가 기록한 총 득점에 오스카가 30% 이상 관여했다는 통계가 나오기도.

오스카는 상파울루와 월 120만헤알(약 3억원)에 계약했다. 하지만 상파울루 입단 후 지금까지 월급이 통장에 들어오지 않고 있다는 것. 축구보는 '상파울루 선수단의 인내심은 한계에 달했고, 언제 갈등이 터져도 이상하지 않은 상태'라며 '아마 오스카는 중국을 떠난 것을 후회하고 있을지도 모른다'고 촌평했다.

◇사진출처=오스카 개인 SNS
오스카는 2017년 6000만유로의 이적료에 첼시에서 상하이 하이강으로 이적했다. 당시 오스카가 상하이 하이강에 약속 받은 주급은 47만유로(약 7억4000만원)였다.

프리미어리그에서 한창 전성기를 구가하던 그가 갑작스럽게 '변방' 중국으로 향한다는 소식에 세계가 경악했다. 하지만 오스카는 ""축구 선수는 다른 노동자와 마찬가지로 돈을 벌어 가족을 도와야 한다. 나는 브라질의 매우 가난한 가정에서 왔고, 그들을 도와야 한다""는 현실적인 이유를 털어놓은 바 있다. 오스카는 지난해까지 중국에서 8시즌 간 활약하면서 2억유로(약 3145억원)를 번 것으로 알려졌다.

중국슈퍼리그가 2020년대 들어 거품이 꺼지면서 각 클럽이 줄도산하는 위기에 빠진 가운데, 상하이 하이강도 오스카에 부담을 느끼기 시작했다. 결국 계약 만료를 앞두고 브라질 복귀설이 제기됐다. 플라멩구, 인테르나시오나우 등의 제의가 이어졌으나, 오스카는 친정팀 상파울루 복귀를 택했다.

박상경 기자 ppark@sportschosun.com

◇사진출처=오스카 개인 SNS"
20250310,"충격! 토트넘, 히샬리송 375억 손해 감수하고 에버턴 복귀 허용…칼버트 르윈 대체자로 낙점","[스포티비뉴스=이민재 기자] 토트넘의 히샬리송(27)이 에버튼으로 복귀할까.

영국 매체 '스퍼스 웹'은 10일(이하 한국시간) ""히샬리송은 에버튼의 관심 속에 토트넘이 이적료를 책정했다""라고 보도했다.

이어 ""에버튼은 히샬리송을 재영입하려는 계획을 세우고 있다. 그는 에버튼과 좋은 관계를 유지하고 있다""라고 덧붙였다.
영국 매체 '기브미스포츠'에 따르면 에버튼은 도미닉 칼버트 르윈을 대체할 선수를 찾고 있다. 영입 타깃으로 히샬리송이 언급되고 있다.

이 매체는 ""토트넘은 히샬리송 매각에 나설 수 있다. 에버튼이 원한다면 이적료 4,000만 파운드(약 750억 원)를 요구할 것이다""라고 밝혔다.

또한 ""에버튼은 거래를 빠르게 성사하길 원한다. 만약 거래가 조기에 결론 나지 않는다면 데이비드 모예스 감독은 클럽에 다른 대안을 찾도록 요구할 것이다""라고 내다봤다.



에버튼을 떠나 2022-23시즌 토트넘에 합류한 히샬리송은 이적료 6,000만 파운드(약 1,125억 원)의 주인공이었다. 당시 안토니오 콘테 감독은 해리 케인과 손흥민에게 쏠린 공격 부담을 덜기 위해 스트라이커와 윙어를 오가는 히샬리송을 선택했다. 그는 에버튼에서 4시즌 동안 두 자릿수 득점을 올렸다.

그러나 토트넘 합류 이후 존재감은 크지 않았다. 골 결정력이 부족했다. 첫 시즌에는 35경기서 3골 4도움에 그쳤다. 프리미어리그 27경기 중 단 12경기만 선발로 나설 정도로 영향력이 부족했다.

지난 시즌 케인이 바이에른 뮌헨으로 떠나면서 히샬리송에 대한 기대감이 커졌다. 엔지 포스테코글루 감독은 히샬리송을 시즌 초반 최전방 스트라이커로 기용했다. 그러나 기대에 부응하지 못했다. 손흥민이 그 자리에 나서자 토트넘 공격력이 달라지기 시작했다.

시즌 막판에는 히샬리송이 힘을 냈다. 시즌 초반 경기력이 떨어진 히샬리송은 부진을 딛고 다시 올라섰다. 경기를 치를수록 날카로운 모습을 보였다. 그는 총 31경기서 12골 4도움을 기록했다.

이번 시즌에는 존재감이 아예 없다. 햄스트링 부상과 함께 결장한 경기가 많기 때문이다. 올 시즌 총 14경기서 3골 1도움을 기록 중이고, 프리미어리그 9경기서 선발로 나선 적은 단 두 경기였다. 최근 영향력을 발휘하다가 다시 종아리 부상으로 쓰러지고 말았다.

존재감이 떨어진 그를 떠나보낸다는 루머가 종종 나왔다. 이런 상황에서 히샬리송 계약은 2027년 여름에 끝난다. 계약 종료 2년 반을 앞두고 재계약과 매각을 두고 고민할 시기가 찾아왔다.



그의 영향력은 없다. 전 토트넘 선수이자 스카이스포츠 해설위원 제이미 오하라는 에버튼의 타깃인 히샬리송을 매각해야 한다고 강조하고 있다.

'토트넘 홋스퍼 뉴스'도 ""히샬리송을 보유할수록 그의 임금에 돈을 더 많이 쓰게 된다. 따라서 그가 이번 여름 이적해야 한다. 토트넘은 구단 역사상 최악의 이적 중 하나로 꼽히는 이 움직임에 더 이상 돈을 낭비할 여유가 없다""라며 ""그러나 토트넘에서 또 한 번의 실패한 시즌을 보낸 그를 원하는 구단을 찾기 어려울 수 있다. 토트넘이 불리한 조건을 받아들여야 할 수 있다""라고 내다봤다."
20250310,"미치도록 침착한 정우영, 수비 3명 농락 후 원더골 폭발! 팀 3연패 끊는 결승골→U베를린, 프랑크푸르트에 2-1 역전승","[스타뉴스 | 박수진 기자]
포효하는 정우영. /사진=우니온 베를린 공식 홈페이지
정우영(26·우니온 베를린)이 킬러본능을 뽐내며 팀의 연패를 직접 끊어냈다. 미치도록 침착한 슈팅을 날리며 팀 승리를 이끌었다.

정우영은 9일(한국시간) 독일 프랑크푸르트에 위치한 도이체 방크 파르크에서 열린 2024~2025시즌 독일 분데스리가 25라운드 아인트라흐트 프랑크푸르트전에 교체로 나서 1골을 넣어 팀의 2-1 승리를 이끌었다.

이 경기 전까지 3연패의 수렁에 빠져있던 유니온 베를린은 7승 5무 13패(승점 26점), 14위로 강등권인 16위(보훔)와 승점을 6점 차이로 벌렸다.
이날 경기를 선발 명단이 아닌 벤치에서 시작한 정우영은 1-1로 맞선 후반 26분 야닉 하버러 대신 교체로 투입됐다. 강등권에서 조금이라도 도망가야 하는 팀 입장에서는 결승골이 필요한 상황에서 선택된 교체 카드였다. 전반 13분 프랑크푸르트 미키 바추아이에게 선제골을 헌납하며 어렵게 끌려갔던 베를린이었다.

기회는 곧바로 찾아왔다. 후반 33분 역습 상황에서 하프라인에서 개인 드리블 돌파 후 자신을 둘러싼 수비수 3명 사이를 농락하며 슈팅 공간을 만들었고 침착한 왼발 슈팅으로 골대 구석을 찔렀다. 이번 시즌 분데스리가 정우영의 3호 골이 터지는 순간이었다. 정우영은 지난해 11월 30일 레버쿠젠과 12라운드 이후 오랜만에 득점포를 가동했다.
득점 직후 관중들을 바라보고 있는 정우영./사진=우니온 베를린 공식 홈페이지

정우영의 활약은 여기서 끝이 아니었다. 후반 42분 오른쪽 측면에서 정확한 크로스를 날려 베네딕트 훌러바흐의 득점을 만들어냈으나 아쉽게 VAR 판독 끝에 취소되며 도움을 올릴 기회를 날렸다.

후반 추가 시간 베를린은 페널티 박스에서 핸드볼 반칙을 범해 프랑크푸르트에 페널티킥을 내줬으나 프랑크푸르트 키커 휴고 에키티케가 실축하며 경기는 2-1, 베를린의 승리로 종료됐다.

이날 활약으로 인해 정우영이 국가대표팀에 뽑힐 수 있을지도 관심이다. 홍명보 축구 국가대표팀 감독은 10일 오전 10시 대한축구협회에서 3월 북중미월드컵 3차 예선 2연전(3월 20일 오만, 3월 25일 요르단)에 나설 선수 명단을 발표한다. 지난해 11월 명단에도 이름을 올렸던 정우영이 이번에도 태극마크를 달 수 있을지 귀추가 주목된다.
/사진=우니온 베를린 공식 SNS
지난해 11월 대표팀 훈련에서 정우영이 몸을 풀고 있다. /사진=대한축구협회 제공"
20250310,"‘PK유도 → 파넨카킥 동점골’ 손흥민, 토트넘 3연패 위기 구해내다!…본머스전 2-2 무","손흥민이 토트넘의 패배를 틀어막았다.

토트넘은 9일(한국시간) 잉글랜드 런던 토트넘 홋스퍼 스타디움에서 열린 2024-25시즌 프리미어리그 28라운드 본머스와 홈경기에서 2-2 무승부를 기록했다.

이로써 토트넘은 10승 4무 14패(승점 34) 13위를 유지했다. 본머스는 12승 8무 8패(승점 44)로 8위에 놓였다.

빠르게 달리는 손흥민. 사진(잉글랜드 런던)=ⓒAFPBBNews = News1
손흥민. 사진(잉글랜드 런던)=ⓒAFPBBNews = News1
토트넘은 4-3-3 포메이션으로 나섰다. 윌슨 오도베르-도미닉 솔랑케-브레넌 존슨, 파페 사르-이브 비수마-로드리고 벤탄쿠르, 제드 스펜스-케빈 단소-크리스티안 로메로-페드로 포로, 굴리예모 비카리오가 출전했다.

본머스는 4-2-3-1 포메이션으로 맞섰다. 이바니우송, 앙투안 세메뇨-저스틴 클라위베르트-마커스 태버니어, 타일러 아담스-라이언 크리스티, 밀로시 케르케스-딘 하위선-제임스 힐-루이스 쿡, 케파 아리사발라가가 나섰다.

본머스가 전반전 내내 팽팽했던 흐름에 균열을 만들었다. 전반 42분 토트넘의 공격을 끊은 뒤 좌측면 케르케스가 전진 후 크로스를 오려보냈고 박스 안쪽으로 쇄도하던 태버니어가 슈팅으로 연결하며 선제골을 터뜨렸다.

득점 후 기뻐하는 본머스 마커스 태버니어 . 사진(잉글랜드 런던)=ⓒAFPBBNews = News1
후반 시작과 함께 토트넘이 변화를 가져갔다. 존슨, 비수마를 빼고 손흥민, 루카스 베리발을 투입했다. 이어 후반 16분에는 벤탄쿠르, 로메로를 빼고 제임스 매디슨, 미키 판 더 펜을 투입해 승부수를 띄웠다.

그러나 본머스가 찬물을 끼얹었다. 후반 20분 이바니우송이 수비 사이를 파고들었고, 클라위베르트가 이에 맞춰 패스를 찔러넣었다. 이바니우송은 비카리오 골키퍼의 키를 넘기는 슈팅으로 2-0을 만들었다.

추가골을 기록하는 이바니우송과 실망하는 굴리예모 비카리오 골키퍼. 사진(잉글랜드 런던)=ⓒAFPBBNews = News1
어깨동무하는 파페 사르(왼쪽)와 루카스 베리발(오른쪽). 사진(잉글랜드 런던)=ⓒAFPBBNews = News1
토트넘이 빠르게 한 점을 추격했다. 두 번째 실점 후 2분 만이다. 후반 22분 우측 하프스페이스 부근에서 전진한 사르가 박스 안쪽으로 크로스를 올리는 듯했으나 그대로 골문 안으로 향해 들어갔다. 마치 ‘크로슛(크로스 + 슛)’처럼 케파 골키퍼 손을 넘기며 골망을 흔들었다.

여전히 끌려가던 토트넘의 구세주는 당연 ‘주장’ 손흥민이었다. 후반 39분 손흥민이 본머스의 수비 뒷공간을 파고들었다. 이때 케파 골키퍼가 골문을 박차고 튀어나왔고, 손흥민은 케파 골키퍼를 따돌리는 과정에서 걸려 넘어졌다. 주심은 곧바로 페널티킥을 찍었다.

하이파이브! 도미닉 솔란케-손흥민. 사진(잉글랜드 런던)=ⓒAFPBBNews = News1
키커로 솔란케가 나오는 듯했지만, 최종적으로 손흥민이 키커로 나섰다. 크게 숨을 들이쉰 손흥민은 케파 골키퍼의 움직임을 보고는 침착하게 파넨카킥으로 2-2 동점을 만들었다.

결국, 경기는 그대로 종료됐다. 토트넘은 직전 2경기 연패를 기록 중이었다. 오늘 경기 3연패에 빠질 수 있었으나 손흥민의 활약으로 무승부를 기록할 수 있었다.

[김영훈 MK스포츠 기자]"
20250310,"""매우 실망스럽고 좌절스럽네요"" 리그 7호골에도 웃지 못한 손흥민…""계속 나아가야 해""","사진=스퍼스 플레이


토트넘 홋스퍼 주장 손흥민이 무승부에 아쉬움을 드러냈다.

토트넘 홋스퍼는 9일 오후 11시(한국시간) 영국 런던에 위치한 토트넘 홋스퍼 스타디움에서 열린 2024-25시즌 프리미어리그 28라운드에서 본머스와 2-2 무승부를 거뒀다. 토트넘은 연패 탈출에 성공했다.

토트넘은 4-3-3 포메이션을 꺼냈다. 오도베르, 솔란케, 존슨, 사르, 비수마, 벤탄쿠르, 스펜스, 단소, 로메로, 포로, 비카리오가 선발 출전했다. 손흥민은 벤치에서 출발했다.
경기 초반부터 토트넘이 흔들렸다. 전반 1분 로메로의 패스 미스를 가로챈 뒤 나온 에바니우송의 슈팅을 비카리오가 가까스로 막았다. 전반 4분 전방 압박 후 클라위버르트의 슈팅을 비카리오가 선방했다.

토트넘은 본머스의 강력한 압박에 고전했다. 선제골도 본머스의 몫이었다. 전반 42분 역습 상황에서 케르케즈가 왼쪽에서 올린 얼리 크로스를 테버니어가 오른발 슈팅으로 마무리하며 선제골에 성공했다. 전반전은 본머스가 1-0으로 앞선 채 종료됐다.



손흥민은 후반전 시작과 동시에 그라운드를 밟았다. 몸놀림이 가벼웠다. 후반 9분 손흥민이 왼쪽 측면에서 치고 들어온 뒤 날린 슈팅이 골대를 맞고 무산됐다. 후반 16분 솔란케에게 패스를 내준 뒤 침투했지만 돌아온 패스가 부정확했다.

토트넘을 패배에서 구한 것도 손흥민이었다. 팀이 1-2로 끌려가던 후반 37분 손흥민이 매디슨의 패스를 받은 뒤 페널티 박스 안에서 케파를 제치려고 했지만 걸려 넘어졌다. 주심은 페널티킥을 선언했다. 키커로 나선 손흥민이 가볍게 동점골을 만들었다. 2-2 무승부로 경기가 끝났다.



경기 후 손흥민이 결과에 대한 아쉬움을 드러냈다. 그는 ""승점 3점을 얻지 못해 매우 실망스럽고 좌절스럽다. 홈에서 경기를 할 때는 승점 3점을 기대한다""라고 말했다.

이어서 ""분명히 본머스는 정말 좋은 팀이고, 특히 이번 시즌 뛰어난 활약을 펼쳤다. 하지만 2-2로 비긴 건 우리에게 충분하지 않다고 생각한다. 계속 나아가야 한다""라고 덧붙였다.

한편 토트넘은 오는 14일 유럽축구연맹(UEFA) 유로파리그(UEL) 16가 2차전에서 AZ 알크마르를 상대한다. 1차전에서 0-1로 패배한 토트넘을 손흥민이 구할 수 있을지 주목된다."
