date,title,content
20250925,"""쏘니, 쏘니! 그를 무조건 영입하라고 했어…SON, 라커룸에 기쁨과 웃음 몰고 왔다!"" LAFC 구단주+레전드 DF 키엘리니 SON 효과 극찬","(엑스포츠뉴스 윤준석 기자) 이탈리아 축구의 전설이자 현 로스앤젤레스FC(LAFC) 구단주 그룹 일원인 조르조 키엘리니가 손흥민을 향해 극찬을 아끼지 않았다.

그는 ""손흥민이 LAFC에 기쁨과 웃음을 다시 가져왔다""며 경기장 안팎에서 팀의 분위기를 근본적으로 바꿔놓았다고 평가했다.

키엘리니는 최근 미국 프로축구 메이저리그사커(MLS) 공식 프로그램 '디스 이즈 MLS'에 출연해 손흥민 영입 과정과 현재 팀 내 영향력에 대해 심도 있게 언급했다.

키엘리니는 과거 전성기 시절 유벤투스에서 긴 선수생활을 보낸 뒤 커리어 황혼기를 LAFC에서 마무리한 경험이 있는 만큼, 현지 팬과 구단 내부의 분위기를 누구보다도 잘 이해하는 인물로 꼽힌다.

특히, 지난 7월부로 LAFC의 구단주 그룹으로 새롭게 합류하면서 LAFC 구단의 행정에도 직간접적으로 영향을 미치고 있다.



이번 인터뷰에서 키엘리니는 지난 6월 손흥민의 합류 가능성을 일찌감치 접했다면서도, 실제로 손흥민이 보여준 변화의 폭은 기대 이상이라고 강조했다.

그는 ""나는 여름에 구단 관계자들과 연락을 주고받으며 손흥민의 영입 가능성이 있다는 걸 미리 알았다. 클럽 월드컵 기간에 그들과 만나면서 '할 수 있다면 무조건 추진하라'는 이야기를 들었다""라며 포문을 연 그는 ""당시에도 좋은 영입이라 생각했지만, 지금 손흥민이 만들어내는 파급력은 상상을 뛰어넘는다""고 평가했다.
무엇보다 키엘리니가 주목한 부분은 손흥민의 성격과 태도였다.

그는 ""시즌 초반 팀은 롤러코스터처럼 기복이 있었고, 결과의 일관성을 잃으면서 기쁨과 즐거움마저 사라졌다""면서도 ""그런데 손흥민이 그걸 되찾아줬다. 팬들뿐 아니라 라커룸 안의 선수들 모두가 그 에너지를 느끼고 있다. 세리머니에서 드러나는 활기찬 분위기 대부분이 손흥민이 가져온 것""이라고 설명했다.



LAFC 동료이자 팀의 간판 공격수 드니 부앙가와의 호흡 역시 빼놓을 수 없는 대목이다.

키엘리니는 ""최근 손흥민과 부앙가가 자신감과 호흡을 찾으면서 특별한 듀오가 되고 있다. 미드필드와 수비가 균형을 갖춘다면 리그 전체를 뒤흔들 '괴물 듀오'가 될 수 있다""고 말했다.

실제로 손흥민은 MLS 데뷔 후 7경기에서 6골 3도움을 기록했고, 부앙가는 손흥민 합류 후 9골 1도움을 추가하며 골든부츠 경쟁을 이어가고 있다.

해당 인터뷰에 함께한 현지 중계진 케빈 이건 역시 ""두 선수가 전속력으로 함께 뛰면 수비 입장에서는 악몽일 것""이라며 극찬을 덧붙였다.



키엘리니는 손흥민의 경기력뿐 아니라 인간적인 면모에도 큰 감탄을 표했다.

그는 ""손흥민은 경기장 밖에서도 기쁨을 퍼뜨린다. 팬과 함께 웃고, 팀 동료들과 즐거움을 나누며 구단 문화를 변화시켰다""면서 ""이런 긍정적인 분위기는 소유주와 감독 모두가 바라던 부분""이라고 말했다.

이어 ""나는 여름 투어를 시작하며 손흥민이 라커룸 분위기를 바꿀 수 있는 선수라고 확신했다. 지금은 그 확신이 현실이 됐다""라고 덧붙였다.

끝으로 키엘리니는 ""스티브 체룬돌로 감독과 손흥민의 관계도 매우 강하다. 이번 시즌이 감독에게 마지막 몇 달인데, 시즌 끝에 트로피를 들어 올리는 게 모두의 바람""이라고 말하면서 인터뷰를 종료했다.

LAFC는 최근 3연승을 달리며 서부 콘퍼런스 4위로 올라섰고, 플레이오프 진출을 확정했다. 트로피를 들어올리는 일도 가능성이 적지 않다.



실제로 손흥민은 합류 직후부터 연속 득점과 공격포인트를 기록하며 즉각적인 임팩트를 남겼고, 경기장 안팎에서 LAFC의 간판 스타로 자리 잡았다.

MLS는 손흥민의 등장 이후 아시아 시장에서의 중계권 및 팬덤 확대를 경험하고 있으며, 한국과 미국을 오가는 축구 팬들의 관심을 집중시키고 있다.

현지 언론들 역시 이 같은 맥락을 두고 손흥민의 합류가 단순히 경기력 차원의 영입이 아니라 리그 전체에 걸친 마케팅적 효과와 브랜드 가치를 끌어올리는 움직임이라고 평가한다.

'LA 타임즈'는 최근 ""손흥민은 득점 그 이상을 보여주고 있다""며 ""그의 친화력과 긍정적인 태도가 팀 문화를 바꿔놨다. 팬들뿐 아니라 코칭스태프와 동료들도 손흥민을 '놀라운 사람'이라고 평가한다""고 보도했다.

또한 ""팬들은 손흥민을 보기 위해 훈련 센터 밖에서 몇 시간을 기다리고, 손흥민은 싸인과 사진 촬영으로 보답한다""며 LAFC 구단 문화 전반이 달라졌다고 전했다.

사진=MLS/LAFC"
20250925,"손흥민 ‘발롱도르 역사’ 기록됐다, 21세기 EPL 선수 최고 순위 ‘재조명’","2001년 이후 프리미어리그에서 활약하던 선수들 최고 순위. score90


2025 발롱도르 시상식이 진행되면서, 2001년 이후 역사에 이름을 남긴 선수들이 다시 주목받고 있다.

최근 2025년 발롱도르 시상식이 진행됐다. 발롱도르는 1956년에 프랑스의 축구 잡지 ‘프랑스 풋볼’이 창설한 상이다. 한 시즌 동안 최고의 활약을 펼친 단 한 명의 선수에게 수여된다. 현대 축구에서 이 상은 현역 축구 선수가 받을 수 있는 최고의 명예로 평가받고 있다. 그래서 매 시즌 축구 팬들은 이 상의 주인이 누구일지 주목한다.
올해 발롱도르 주인공은 우스만 뎀벨레였다. 뎀벨레는 23일 프랑스 파리 샤틀레 극장에서 바르셀로나 라민 야말(18)을 제치고 발롱도르를 받았다. 프랑스 선수로는 2022년 카림 벤제마 이후 3년 만이다. 1991년 장피에르 파팽 이후 34년 만에 프랑스 클럽 소속으로 이 상을 받은 선수이기도 하다.

발롱도르 시상식에서 뎀벨레는 눈물을 보였다. 그는 “방금 일어난 일이 믿기지 않는다”며 “2023년 나를 영입해 준 PSG에 감사하다. 나세르 회장과 루이스 엔리케 감독은 아버지 같은 분들”이라고 말했다.

2025 발롱도르를 받고 눈물을 흘리는 우스만 뎀벨레. AFP 연합뉴스


같은 날 축구 소식을 전하는 ‘스코어90(score90)’은 사회관계망서비스(SNS)를 통해 2001년 이후 2024년까지 발롱도르에 이름을 올린 프리미어리그(PL) 선수들을 주목했다.

한국 축구 팬들이 가장 주목한 시기는 2022년이다. 사디오 마네(당시 리버풀)가 2위로 당시 PL에서 활약 중이던 선수 중 가장 높은 순위를 기록했다.

다음으로 높은 순위를 기록한 건 3위, 케빈 더브라위너(당시 맨체스터 시티)다. PL 도움왕, 유럽축구연맹(UEFA) 챔피언스리그 도움왕, FA컵 도움왕, PL 올해의 플레이메이커 등 압도적인 모습을 보여줬다.

토트넘 손흥민이 잉글랜드 프리미어리그 득점왕에 주어지는 골든 부트를 들고 미소를 짓고 있다. AP연합뉴스


잉글랜드 프리미어리그 공동 득점왕에 오른 토트넘 손흥민(왼쪽)과 리버풀 살라흐. 게티이미지코리아



모하메드 살라(리버풀)가 5위로 세 번째로 높은 순위에 이름을 올렸다. 네 번째로 손흥민(당시 토트넘 홋스퍼)이 발롱도르에서 11위를 기록했다.

2022년은 손흥민의 날이었다. 2021-2022시즌 손흥민은 아시아 축구 선수 역사상 최초로 PL 득점왕을 해냈다. 이전 시즌에 이어 본인의 단일 시즌 리그 최다 득점 기록을 다시 경신했고, 아시아 선수 최초의 유럽 4대 리그 득점왕이라는 기록을 세운 아시아 역대 최고 수준의 활약을 한 시즌이다.

이런 활약을 인정받아 2022 발롱도르 11위에 이름을 올렸다. 해당 시즌 토트넘이 우승컵을 하나도 획득하지 못한 무관이었다는 것을 생각하면 정말 놀라운 순위다. 손흥민은 지난 2018-2019시즌 22위로 아시아 축구선수 역대 최고 순위를 경신했는데, 본인이 해당 기록을 다시 경신했다.

시간이 흘러 손흥민은 올해 여름 토트넘을 떠났다. 그리고 최근 미국 메이저리그사커(MLS) 무대에서 뛰어난 활약을 보여주고 있다. 미국 ‘로스앤젤레스 타임스(LA 타임스)’는 23일 “손흥민은 LAFC 합류 후 7경기 6득점 3도움을 기록했다. 그동안 팀은 단, 1경기 패배했다. 손흥민이 합류한 지 7주 만에 이뤄낸 변화다”라고 보도했을 정도로 MLS에서 자신의 가치를 다시 증명하고 있다.

용환주 기자 dndhkr159@kyunghyang.com"
20250925,"""토트넘 돌풍은 SON 덕분이었다"" 포스테코글루, 노팅엄 4경기 무승 굴욕→""'8골 손흥민' 사라지자 무기력""","▲ 지난 시즌 유로파리그에서 토트넘 홋스퍼 돌풍을 주도한 안지 포스테코글루(왼쪽) 감독이 노팅엄 포레스트에선 끝없는 부진 늪에서 헤어나질 못하고 있다. 부임 첫 4경기에서 승점 2를 수확하는 데 그치고 있다. 잉글랜드 프리미어리그 7위 돌풍을 이끈 누누 산투 경질이 결과적으로 악수(惡手)가 돼 가는 양상이다.


[스포티비뉴스=박대현 기자] 지난 시즌 유럽축구연맹(UEFA) 유로파리그(UEL)에서 토트넘 홋스퍼 돌풍을 주도한 안지 포스테코글루 감독이 노팅엄 포레스트에선 끝없는 부진 늪에서 헤어나질 못하고 있다.

부임 첫 4경기에서 승점 2를 수확하는 데 그치고 있다.

잉글랜드 프리미어리그(EPL) 7위 돌풍을 이끈 누누 산투 경질이 결과적으로 악수(惡手)가 돼 가는 양상이다.

'부임 효과'가 사실상 실종됐다. 토트넘 시절 개막 10경기 무패를 쌓은 우승 청부사 위용이 자취를 감췄다.

노팅엄은 25일(한국시간) 스페인 세비야의 에스타디오 라 카르투하에서 열린 2025-2026 UEL 리그 페이즈 원정 1차전에서 레알 베티스와 2-2로 비겼다.

스코어만 보면 나쁘지 않지만 내용과 흐름은 노팅엄이 반드시 잡았어야 할 경기였다.

그러나 '탈(脫)맨유 산증인' 안토니에게 극장골을 헌납해 승점 1 획득에 그쳤고 포스테코글루 감독은 부임 후 4경기 연속 무승(2무 2패)이란 초라한 성적표를 받아들었다.



호주 국적 사령탑은 토트넘에서 승부사 이미지를 남겼다.

2023-2024시즌 스퍼스 지휘봉을 잡자마자 개막 10경기 무패, 리그 단독 선두, 강렬한 압박 축구로 EPL 축구계를 놀라게 했다.

무엇보다 손흥민을 최전방 스트라이커로 배치하는 '파격 실험'을 성공시켰다. 이른바 '손 톱' 전술이다.

손흥민은 이 기간 10경기 8골 1도움을 몰아쳐 승리의 파랑새 임무를 완수했다.

토트넘 팬으로부터 ""쏘니-포스테코글루 조합은 EPL 최고""란 찬사를 끌어냈다.
하나 지금 노팅엄엔 그때의 손흥민 같은 해결사가 없다. 경기 흐름을 단숨에 뒤집고 상대를 제압할 '킬러'가 부족한 것이다.

2001년생 스트라이커 이고르 제주스가 최근 멀티골을 연속으로 꽂아 분전 중이지만 승패를 바꿀 만큼의 파괴력은 아직 부족하다.

▲ 현재 노팅엄에서 가장 돋보이는 선수는 이고르 제주스(앞줄 왼쪽)다. 최근 2경기 연속 멀티골로 물오른 골 감각을 뽐내고 있다.


베티스전은 경기 내용만 보면 노팅엄 승리였다.

전반 14분 선제골을 내줬지만 하프타임을 맞기 전 제주스가 연속 득점으로 2-1 역전에 성공했다.

기대 득점값(xG) 역시 노팅엄은 2.78로 베티스(0.5)보다 압도적이었다. 슈팅 수도 16개로 홈팀을 쉴 새 없이 몰아붙였다.

그러나 두 번째 킥오프 휘슬이 울리기 전 큰 폭의 교체를 단행한 마누엘 펠레그리니 베티스 감독 승부수에 허를 찔렸다.

후반 시작과 동시에 교체 카드 3장을 활용해 변화를 주자 노팅엄은 흔들렸다.

결국 후반 40분 '베티스 에이스' 안토니에게 동점골을 허용했다. 경기 지배력과 득점 기대치는 노팅엄이 훨씬 높았지만 결과적으로 승점 1점에 만족해야 했다.

베티스전을 포함해 현재 노팅엄은 6경기째 승리를 못 챙기고 있다.

지난달 24일 크리스탈 팰리스전(1-1무)을 시작으로 웨스트햄과 아스널에 나란히 0-3 완패를 당했고 컵대회에선 2부리그 팀 스완지 시티에 2-3으로 충격패했다.

직전 경기인 닷새 전 번리 원정 역시 1-1로 승패를 가리지 못했다.

잡아야 할 경기가 적지 않았단 점에서 팬들 불만이 점점 커지고 있다.

▲ 포스테코글루 감독이 토트넘에서 선보인 ‘공세적 전술’은 EPL 빅클럽 환경에선 통했지만 정작 중상위권 구단에선 결과로 이어지지 못하는 모양새다. 이는 스퍼스 시절 손흥민과 제임스 매디슨, 데얀 쿨루셉스키 등 선수단 역량에 다소 의존한 게 아니냐는 물음표로 이어진다.


포스테코글루 감독이 토트넘에서 선보인 '공세적 전술'은 EPL 빅클럽 환경에선 통했지만 정작 중상위권 구단에선 결과로 이어지지 못하는 모양새다.

이는 스퍼스 시절 손흥민과 제임스 매디슨, 데얀 쿨루셉스키 등 선수단 역량에 다소 의존한 게 아니냐는 물음표로 이어진다.

현재 노팅엄에서 가장 돋보이는 선수는 제주스다. 최근 2경기 연속 멀티골로 물오른 골 감각을 뽐내고 있다.

하나 축구는 개인이 아니라 팀 스포츠다. 득점이 나오더라도 승리로 연결되지 않는다는 건 노팅엄이 여전히 전술적 완성도와 집중력에서 큰 약점을 드러내고 있음을 의미한다.

포스테코글루 감독에게는 시간이 많지 않다. 노팅엄 팬들은 이미 ""토트넘 돌풍은 손흥민 덕분 아니었나""라는 냉소적인 시선을 보내고 있다.

시즌 도중 부임해 준비 시간이 부족했단 점은 감안할 수 있지만 하위권·하부리그 팀과 경기서조차 승리를 챙기지 못하는 건 변명의 여지가 없다.

특히 '괴짜 구단주' 에반겔로스 마리나키스는 시간축을 길게 잡는 스타일이 아니다. 넉넉하게 기다려주지 않을 공산이 크다. 다음 일정서도 반등에 실패한다면 노팅엄의 포스테코글루 시대는 토트넘 시절 영광과 달리 '짧고 굴욕적인 도전'으로 끝날 가능성을 배제할 수 없다.

결론적으로 포스테코글루 감독의 두 번째 EPL 도전기는 손흥민과 함께했던 화려한 서사와 달리 침체와 위기 속에서 흔들리고 있다. 과연 그는 노팅엄에서 다시 한 번 '캥거루 매직'을 일으킬 수 있을까. 아니면 지난 시즌 UEL 돌풍은 과거 5월의 기억으로만 찬란히 남게 될까. 향후 몇 경기가 그의 운명을 좌우할 결정적 시험대가 될 전망이다."
20250925,"HERE WE GO 기자, '충격 보도!' 해리 케인, 토트넘서 '마지막 낭만' 태우나, ""홋스퍼, 우선 협상권 갖고 있어""","[SPORTALKOREA] 김경태 기자= 해리 케인과 토트넘 홋스퍼 FC가 낭만적인 재회를 할 수 있을까.

이적시장 소식에 정통한 파브리치오 로마노 기자는 24일(이하 한국시간) 자신의 유튜브 채널을 통해 ""2026 국제축구연맹(FIFA) 월드컵 이후 케인의 토트넘 복귀 가능성과 관련된 소식이 나오기 시작했다""고 운을 뗐다.

이어 ""토트넘은 케인이 2026년 혹은 2027년에 뮌헨을 떠나기로 결정할 경우 '우선 협상권'을 갖는다. 즉, 케인이 이적을 원한다면 가장 먼저 토트넘에 제안이 들어가게 된다. 최종 결정은 케인 본인에게 달려 있다""고 설명했다.



현재 케인은 토트넘 복귀설이 진하게 일고 있다. 주된 이유는 독일 매체 '빌트'가 케인의 프리미어리그 복귀 가능성 및 이에 따른 조항을 밝혔기 때문. 매체에 따르면 여타의 구단들은 6,500만 유로(약 1,072억 원)를 제시할 경우 뮌헨을 떠날 수 있다.

뮌헨 내부 소식에 밝은 토비 알트셰플 기자 역시 24일 ""케인이 이번 시즌 이후에도 뮌헨에서 뛰게 될지는 미지수다. 오는 2026년 여름에는 6,500만 유로의 바이아웃 조항이 발동될 수 있기 때문이다. 케인의 머릿속에는 여전히 PL 최다 득점 기록이 자리 잡고 있다. 그는 현재 PL에서 213골을 넣었고, 260골을 기록한 앨런 시어러의 기록까지는 47골이 부족하다""고 강조했다.



이 같은 소식이 전해지자 현 토트넘 사령탑 토마스 프랑크 감독도 직접 반응을 보였다. 영국 매체 '스카이스포츠'에 따르면 그는 ""토트넘 팬들, 그리고 나 자신도 케인이 돌아오는 걸 보고 싶어 한다""며 ""케인은 언제든 환영한다. 돌아오고 싶다면 두 팔 벌려 맞이할 것""거 여지를 남겨뒀다.

다만 케인이 현재 뮌헨에서 정상급 활약을 펼치고 있으며, 더 많은 트로피를 정조준하고 있고 독일 생활에 만족감을 드러냈다. 그럼에도 불구하고 뮌헨에서 현역 은퇴를 할 공산은 매우 낮은 것으로 알려졌다.



이를 두고 독일의 전문가 라파엘 호니히슈타인은 이달 초 영국 매체 '토크스포츠'와의 인터뷰에서 ""독일에서는 케인이 커리어를 뮌헨에서 끝내지 않을 것이라고 보는 게 더 이상 비밀이 아니다. 바이에른은 케인이 2027년 계약 만료 전 일찍 떠날 가능성에 대비하고 있다""고 말했다.

계속해서 ""케인과 구단은 곧 입장을 정리해야 한다. 바이에른은 케인의 백업이자 후계자가 될 수 있는 선수를 찾고 있었고, 베냐민 셰슈코, 닉 볼테마데를 검토하다 결국 니콜라 잭슨을 택했다. 이는 케인이 1~2년 안에 떠날 수도 있다는 가능성을 구단이 인식하고 있다는 뜻""이라고 전한 바 있다.

만약 케인이 토트넘으로 돌아온다면 이는 구단과 선수 모두에게 최상의 시나리오가 될 수 있다. 토트넘은 케인 이적 후 여전히 확실한 대체자를 찾지 못한 상태다. 케인에게도 유소년 시절부터 몸담았던 팀, 그리고 세계 최고 공격수로 성장할 토대를 마련해준 구단으로의 복귀는 그야말로 낭만적인 마무리가 완성될 수 있다.



사진=게티이미지코리아

취재문의 sportal@sportalkorea.co.kr"
20250925,"""유럽도 아닌데"" 냉정 평가도…이동국 아들 '대박이' 대박 났다?→美 LA갤럭시 유스 입단 테스트 합격","(엑스포츠뉴스 나승우 기자) 한국 축구 국가대표 공격수 출신 이동국의 아들 '대박이' 이시안 군의 LA갤럭시 입단 테스트 합격 소식이 화제다.

이동국 부인 이수진 씨는 24일 자신의 사회관계망서비스(SNS)를 통해 이시안 군의 LA갤럭시 입단 테스트 합격 소식을 전했다.

""시안이 LA 갤럭시 유스팀 입단 테스트 합격 소식을 전합니다""라고 전한 이씨는 ""오늘 전북현대보다도 입단이 어렵다는 LA 갤럭시 유스팀 디렉터로부터 '시안이와 함께하고 싶다'는 말과 함께 합격 통보를 받았다""고 알렸다.

""많은 분들이 시안이의 진학 방향과 계획을 궁금해하시며 물어봐주셨지만, 저도 사실 명확한 답을 드리지 못하고 많은 고민을 해왔다""는 이씨는 ""'프로팀 입단만이 과연 정답일까?', '우리가 직접 15세 이하(U-15)팀을 만들어볼까?' 수많은 시나리오를 그리며 밤늦게까지 고민하고 또 고민했다""고 이시안 군을 위해 여러 고민을 해왔음을 밝혔다.

그러면서 ""만약 시안이가 전북현대 같은 팀에 입단하게 된다면, 시안이의 땀으로 만들어낸 노력들이 온전히 인정받지 못하고 '아빠 빽이다', '특혜다'라는 말들이 따라붙을 것이 사실 두려웠다""면서 ""그래서 저는 조금 다른 길을 생각해봤다. 미국에 가족이 있었기에 용기를 내어 미국 유스팀 트라이아웃에 도전해보기로 했다 LA갤럭시, LAFC, 샌디에이고FC 등 미국 최고의 유스팀에 테스트를 받아보자는 제안이었다""고 LA갤럭시 입단 테스트를 받게된 배경을 설명했다.



이씨는 ""3년 정도 미국 유스팀에서 지내며 축구와 영어, 두 마리 토끼를 잡아보자는 생각, 그리고 이 경험 자체가 시안이의 성장에 큰 자산이 될 것이라는 확신이 들었다""면서 ""이 합격은 단순히 축구팀 입단을 넘어, 시안이의 노력과 실력만으로 인정받았다는 점에서 무엇보다 값지고 소중한 결과라고 생각한다""고 밝혔다.

""앞으로도 시안이가 자신감을 가지고 새로운 도전에 한 걸음 더 나아가는 계기가 되기를 진심으로 바란다""며 아들의 도전을 응원한 이씨는 ""아직 모든 것이 결정된 것은 아니지만, 시안이의 꿈을 위해, 그리고 그 꿈이 누구의 것도 아닌 시안이의 것으로 빛날 수 있도록 앞으로도 많은 고민과 선택을 이어가겠다""며 적극 지원을 아끼지 않겠다고 덧붙였다.
이동국은 선수 시절 한국 축구 최고의 공격수로 활약했다. K리그 역대 필드 플레이어 중 최다 출전 기록(548경기)을 보유하고 있고, K리그 역대 최다 득점 기록(228골), 최다 공격포인트(305개) 주인공이기도 하다.

탁월한 골 결정력을 자랑했고, 특히 발리 슈팅에 능해 '발리슛 장인'이라는 별명도 가지고 있다.

이시안 군 역시 아버지의 피를 이어 받아 발리 슈팅에 능한 모습을 한 방송 프로그램을 통해 알려지기도 했다.

이씨가 올린 영상에서는 공격수에게 가장 중요한 능력 중 하나인 퍼스트 터치 능력을 엿볼 수 있었다. 수비를 등진 상황에서도 깔끔한 터치로 돌아서서 터닝 슈팅을 때리는 모습은 아버지 이동국의 모습을 연상케 했다.



아버지가 한국 축구 최고의 공격수였던 만큼, 이시안 군 역시 재능을 갈고 닦으면 한국 축구의 미래를 책임질 대형 공격수로 성장할 가능성이 있다.

체계적인 육성 시스템을 가진 구단에서 성장한다면 재능을 온전히 꽃피우는 모습을 볼 수 있을 것으로 기대된다.

한국이 아닌 미국을 택한 것에는 '아빠 찬스'이라는 말이 나오지 않고, 영어도 동시에 배울 수 있다는 메리트가 있는 게 결정적이었던 것으로 보인다.

일각에서는 유럽이 아니라 축구 불모지인 미국 구단 유스에서 성장하는 게 과연 옳은 일인지 의문을 제기하기도 한다. 미국 축구 환경에 적응하지 못하고 제대로 성장하지 못하는 경우도 생각해 볼 문제다.

다만 국제축구연맹(FIFA) 규정에 따르면 만 18세 이하 선수의 경우, 부모가 축구와 관련이 없는 직업이 아닌 상황에서만 해당 선수의 해외 구단 이적이 유효하기 때문에 이시안 군은 유럽에서 테스트 합격하더라도 현지 구단에 등록하긴 굉장히 어렵다.

이씨 역시 게시글 말미에 ""아직 모든 게 결정된 건 아니다. 한국에 남아 좋은팀에 입단해 성장하기, 미국으로 건너가 축구와 영어 두 마리 토끼를 잡기. 여러분이라면 어떤 선택을 하실까? 조언과 의견 부탁드린다""며 여러 의견을 듣고 아들을 위한 최선의 선택을 내리겠다고 밝혔다.

사진=이수진 인스타그램"
