date,title,content
20251209,"‘대충격’ 사실상 ‘방출’ 통보나 다름없다, ‘오피셜’ 공식발표 예정…‘폭탄 발언’ 후 갈등 빚은 살라, 인터밀란 원정명단서 제외 [속보]","[골닷컴] 강동훈 기자 = ‘파라오’ 모하메드 살라(33·리버풀)가 안필드(리버풀 홈구장)를 떠날 가능성이 점점 커지는 분위기다. 최근 3경기 연속 선발 라인업에 들지 못하면서 불만을 터뜨린 그가 아르네 슬롯(47·네덜란드) 감독과 갈등을 빚더니 다가올 인터밀란 원정 명단에서 제외됐다.

8일(한국시간) 현지 보도를 종합하면 살라는 오는 10일 인터밀란과 유럽축구연맹(UEFA) 챔피언스리그(UCL) 리그 페이즈 6차전 원정경기 때 선수단과 동행하지 않는 게 확정됐다. 이는 아침에 살라가 AXA 트레이닝 센터(리버풀 훈련장)에 있었음에도 불구하고 내려진 결정이다.

인터밀란전 결장이 사실상 확정된 살라는 오는 14일 브라이턴 앤 호브 앨비언과 잉글랜드 프리미어리그(EPL) 16라운드 홈경기 때 복귀할 거로 예상되고 있다. 다만 슬롯 감독과 여전히 관계가 회복되지 않은 가운데 지금보다 더 악화된다면 또다시 명단에서 제외될 가능성도 있을 거로 전망되고 있다.


앞서 살라는 지난 7일 “저는 EPL에 입성한 이래 누구보다 많은 득점을 올렸다”면서 “제가 만약 다른 팀이었다면 모두가 언론을 통해서 선수를 옹호했을 거다. 이런 상황에 놓인 건 저뿐”이라고 분노했다. 이어 “슬롯 감독과 좋은 관계였는데 한순간에 모든 관계가 끊겼다”며 “팀에 있는 누군가가 제가 리버풀에서 뛰는 걸 원치 않는 것 같다”고 의문을 제기했다.

살라가 3경기 연속 선발 라인업에 포함되지 못하자 슬롯 감독과 팀의 대우에 ‘폭탄 발언’을 한 것이다. 실제 살라는 지난달 30일 웨스트햄 유나이티드와 EPL 13라운드를 시작으로 4일 선덜랜드와 EPL 14라운드, 7일 리즈 유나이티드와 EPL 15라운드까지 모두 벤치에서 시작했다. 이 가운데서 그가 교체로 나선 건 선덜랜드전이 유일했다.
살라가 벤치로 밀려난 건 부진이 가장 큰 요인이다. 그는 올 시즌 기량이 급격하게 저하되면서 제 역할을 다하지 못하고 있다. 리버풀 유니폼을 입은 이래 매 시즌 30골 이상 기록했지만 ‘에이징 커브(선수가 나이가 들면서 능력이 감퇴하는 것을 나타내는 표현)’를 피하지 못하면서 파괴력을 잃었다. 공식전 19경기 동안 5골(3도움)에 그쳤다.

단순히 공격 포인트가 줄어든 것뿐 아니라 경기력 자체가 워낙 좋지 못하다. 살라는 신체 능력이 떨어지면서 스피드가 감소한 것은 차치하고, 결정적 찬스를 마무리하지 못하는 빈도가 급격하게 늘어났다. 또 경기당 턴오버 횟수도 많다. 리버풀 특유의 역습 상황에서 그에게 볼이 가더라도 팬들이 별다른 기대를 하지 않는 이유다.


자연스레 살라를 향한 비판이 쏟아지고 있다. 팬들은 “살라를 이제 그만 보내줄 때가 됐다”면서 방출을 요구하는 목소리를 내고 있고, 리버풀 출신 해설위원 제이미 캐러거도 “전방에서 골을 넣지 못하고, 수비 가담도 하지 않는다면 살라를 계속 기용할 이유가 없다. 살라가 매 경기 선발로 나서는 시대는 이제 끝내야 한다”고 주장했다.

결국 슬롯 감독은 과감한 결단을 내렸다. 살라를 선발 라인업에서 제외하더니, 인터밀란 원정명단에서까지 제외하며 기용하지 않겠다는 뜻을 밝혔다. 다만 살라 본인은 좀처럼 이 상황을 받아들이지 못하면서 여전히 불평불만을 늘어놓고 있다. 이에 리버풀은 당장 내달 겨울 이적시장 때 살라를 방출하려는 분위기다.

리버풀은 특히 살라의 나이를 생각했을 때 기량이 떨어지면 더 떨어졌지 부활할 거란 기대를 아예 하지 않는 셈이다. 경기력이 처참한 그에게 높은 주급을 계속 주는 것도 한계가 있다. 스포츠 재정 통계 전문 매체 카폴로지에 따르면 살라의 주급은 무려 40만 파운드(약 7억 8200만 원)에 달한다.


사진 = 게티이미지, 소셜네트워크서비스(SNS) 캡처"
20251209,"[오피셜] '토트넘 1군 데뷔 無' 양민혁, 드디어 프리미어리그 팀 만난다...FA컵 3라운드 아스널과 격돌","[인터풋볼=박윤서 기자] 2025-26시즌 FA컵 3라운드 대진이 확정됐다.

FA컵 사무국은 9일(한국시간) FA컵 3라운드 대진을 확정했다. 맨체스터 시티, 아스널, 맨체스터 유나이티드, 토트넘 홋스퍼 등 프리미어리그 팀들이 들어오는 라운드로, 이제부터 많은 팬들의 관심이 예상된다. 3라운드는 2026년 1월 10일과 11일에 열린다.

프리미어리그 팀들의 맞대결도 성사됐다. 토트넘과 아스톤 빌라가 맞대결을 펼치고, 에버턴과 선덜랜드가 맞붙는다. 맨유는 브라이튼 앤 호브 알비온을 상대하고 뉴캐슬 유나이티드와 본머스가 경기를 치른다. 맨시티는 엑스터 시티(3부)를 만난다.

황희찬의 울버햄튼 원더러스는 4부 리그 슈르스버리 타운을 상대한다. 최근 프리미어리그에서 출전시간을 많이 부여받지 못하는 황희찬은 상대적으로 여유가 있는 슈르스버리전에 출전할 것으로 예상된다.

잉글랜드 풋볼리그 챔피언십(2부)에서 뛰고 있는 코리안 리거들도 참가한다. 먼저 양민혁의 포츠머스는 3라운드 아스널을 상대하게 됐다. 프리미어리그 선두를 달리고 있는 팀인 만큼 포츠머스에는 힘든 경기가 예상된다. 양민혁은 토트넘 이적 이후 퀸즈파크레인저스, 포츠머스 등 임대를 돌아다니느라 아직 프리미어리그 팀들을 상대해보지 못했다. 이번 아스널전이 프리미어리그 팀을 상대하는 건 처음이다.

사진 = FA컵 SNS
사진 = FA컵 SNS


스완지 시티에서 뛰고 있는 엄지성은 웨스트브롬위치 알비온을 만나며 백승호의 버밍엄 시티는 캠브리지 유나이티드(4부)를 상대한다. 배준호의 스토크 시티는 2부 리그에서 강한 면모를 보이고 있는 코벤트리 시티와 맞붙는다.

지난 시즌 FA컵 챔피언은 크리스탈 팰리스였다. 팰리스는 풀럼, 아스톤 빌라를 꺾고 결승전까지 진출해 맨체스터 시티까지 무너뜨렸다. 창단 119년 만의 첫 메이저 대회 우승이었다. '디펜딩 챔피언' 팰리스는 이번 라운드에서 6부 리그 맥클레스필드를 상대한다."
20251209,"'악몽 된 손흥민 고별전'...전방십자인대 파열→시즌 아웃급 판정받은 토트넘 매디슨, 근황 전했다 '코칭 자격증 과정+쌍둥이 출산'","[SPORTALKOREA] 김경태 기자= '절친' 손흥민의 고별전에서 심각한 부상을 당했던 제임스 매디슨이 근황을 전했다. 

매디슨은 토트넘 홋스퍼 FC 중원의 핵심 전력이다. 지난 2023년 6월 레스터 시티 FC를 떠나 토트넘의 유니폼으로 갈아입는 매디슨은 정교한 패싱 능력과 슈팅으로 금세 주전 자리를 꿰찼다.

여기에 더해 리더십까지 인정받아 지난 시즌엔 손흥민과 함께 주장단으로 활약하기도 했다. 



다만 현재는 다소 힘든 시간을 보내고 있다. 이유는 다름 아닌 부상 때문. 매디슨은 지난 8월 서울월드컵 경기장에서 열린 뉴캐슬 유나이티드 FC와의 친선 경기에서 무릎 통증을 호소하며 쓰러졌다.

상태는 좋지 못했다. 매디슨은 혼자 걸을 수도 없어 들것에 실려 그라운드를 빠져나왔다. 

진단 결과는 더욱 참혹했다. 오른쪽 무릎 전방십자인대(ACL) 파열로 확인됐다. 이전에 다쳤던 부위를 또다시 다쳤기에 사실상 시즌 아웃이나 마찬가지였다. 더욱이 이날 경기는 그와 절친한 손흥민의 고별전이었기에 안타까움은 배가 됐다.



좌절이 찾아왔지만, 매디슨은 포기하지 않았다. 그는 사회관계망서비스(SNS)를 통해 주기적으로 재활 영상을 업로드하며 복귀 의지를 피력했다.

개인 훈련에도 돌입하며 점점 회복세를 보이던 매디슨은 9일(한국시간) 영국 매체 '스카이스포츠'의 '먼데이 나이트 풋볼'에 출연해 자신의 몸 상태를 직접 설명했다.

그는 ""지금 단계에선 회복이 정말 잘 되고 있다. 큰 무릎 수술을 했기 때문에 당연히 오랜 시간이 필요한 부상""이라며 ""지금 가장 중요한 건 올바른 멘탈을 유지하는 것""이라고 말했다.



이어 ""오랫동안 뛸 수 없다는 사실을 받아들이고 극복해야 했다. 내 안을 완전히 무너뜨릴 정도로 큰 충격이었다. 나에게 아주 중요한 시즌이었고, 새로운 감독(토마스 프랑크)이 부임했고, 대표팀 입장에서는 월드컵이 있는 해였다. 커리어의 이 시점에서 정말 큰 시즌을 보내고 싶었다""고 털어놓았다.

그러면서도 ""그게 내게 주어진 여정은 아니었다. 과거에도 힘든 일을 겪어냈듯 이번에도 이겨내고 있다. 시간이 생긴 만큼 새로운 도전을 해보고 있다. 코칭 자격증 과정을 시작했고, 최근에는 아내가 쌍둥이를 출산했다. 내 삶에 많은 일이 벌어지고 있지만, 긍정적인 마음을 유지하려고 노력하고 있고, 여전히 축구를 많이 보고 있다""고 밝혔다.

사진=토트넘 홋스퍼 FC, 게티이미지코리아, 제임스 매디슨 인스타그램

취재문의 sportal@sportalkorea.co.kr"
20251209,"""드디어 왔다"" 토트넘+손흥민 '오피셜 공식발표'…태극기 벽화 떴다→SON 환영! 3달 만에 '마지막 인사' 감동 예고","(엑스포츠뉴스 윤준석 기자) 손흥민의 토트넘 복귀가 단 하루 앞으로 다가오며 북런던이 축제 분위기로 물들고 있다.

10년 동안 토트넘 홋스퍼의 상징이자 구단 역사에 길이 남을 업적을 남긴 손흥민이 현지 팬들에게 정식 작별 인사를 전하기 위해 다시 한 번 토트넘 홋스퍼 스타디움에 발을 들인다.

손흥민이 미국 메이저리그사커(MLS) LAFC 이적으로 토트넘과의 동행을 마친 지 약 석 달 만이다.

손흥민은 지난 8월 서울월드컵경기장에서 열린 뉴캐슬 유나이티드와의 프리시즌 경기 전 인터뷰에서 토트넘과의 작별을 발표했다.

토트넘에서의 마지막 일정을 마친 뒤 한국과 미국을 오가며 바쁜 시간을 보냈던 손흥민은 그 과정에서 정작 런던 토트넘 팬들에게 직접 작별을 전할 기회가 없었다.

손흥민 역시 한 차례 한 유튜브 콘텐츠에서 ""당연히 런던으로 돌아가 토트넘 팬들을 만날 거다. 팬들도 나를 직접 보고 인사할 자격이 있다고 생각한다""라며 아쉬움을 드러낸 바 있다.



토트넘 구단은 이런 아쉬움을 달래고자 손흥민에게 제대로 된 작별 인사 시간을 만들어줬다.

토트넘은 지난 3일(한국시간) 공식 발표를 통해 손흥민이 오는 10일 토트넘 홋스퍼 스타디움에서 열리는 슬라비아 프라하와의 2025-2026시즌 유럽축구연맹(UEFA) 챔피언스리그 리그페이즈 홈 경기에 앞서 팬들에게 작별 인사를 전할 예정이라고 밝혔다.

또한 구단은 공식 SNS를 통해 ""손흥민이 집으로 돌아온다""는 메시지를 공개하며 손흥민이 토트넘 홋스퍼 스타디움을 찾는 날짜를 알렸다.

그는 공식 발표에서 ""여름에 토트넘을 떠난다는 어려운 결정을 발표했을 때 나는 한국에 있었고, 경기장에서 팬들에게 제대로 작별 인사를 할 기회를 갖지 못했다""며 아쉬움을 드러냈다. 

또한 그는 ""지난 10년간 저와 제 가족에게 보내주신 팬 여러분의 사랑과 응원이 얼마나 큰 의미였는지를 직접 전할 수 있게 되어 정말 기쁘다""고 소감을 덧붙였다.

토트넘은 9일 공식 SNS에 ""드디어 기다리고 기다렸던 그날이 왔습니다. 오랜만에 옛 동료들과 재회 예정인 쏘니""라는 메시지와 함께 하트 이모티콘을 남기며 손흥민 방문을 또 다시 환영했다.

구단은 손흥민이 유로파리그 우승 트로피를 들어올리는 사진, 그의 전매특허 감아차기 골 영상, 그리고 토트넘 시절 동료들과 함께한 여러 장의 사진까지 공개하며 기대감을 끌어올렸다.

토트넘이 손흥민을 향해 이처럼 대대적인 환영 메시지를 띄운 것은 그가 단순한 스타를 넘어 ‘레전드’라는 의미를 스스로 증명한 시간이 있었기 때문이다.



한편, 손흥민 복귀 소식과 함께 가장 큰 화제가 된 것은 토트넘이 준비한 초대형 벽화다.

토트넘은 손흥민이 토트넘에서 보낸 10년간의 시간을 기념하기 위해 토트넘 하이 로드에 대형 스트리트 벽화를 제작 중이라고 발표했으며, 이 벽화는 팬 어드바이저리 보드와 협력해 만들어지고 있다고 밝혔다.
이 벽화는 레들리 킹과 해리 케인의 벽화를 그렸던 팀이 작업을 맡고 있고, 벽화 디자인은 손흥민이 직접 선택한 것으로 알려졌다.

토트넘 소식을 전하는 크리스 코울린은 자신의 SNS를 통해 벽화가 거의 완성된 모습을 공개했다. 그는 ""손흥민의 벽화는 건물 외벽 전체를 덮는 초대형 규모""라고 전하며 현장 분위기를 전했다.

공개된 사진 속에는 손흥민의 시그니처 '찰칵' 세리머니가 건물 외벽 전체를 덮는 규모로 제작되고 있으며, 손흥민이 UEFA 유로파리그(UEL) 우승 트로피를 들어올리는 장면과 함께 태극기를 허리에 두른 모습도 담기고 있어 토트넘과 아시아 축구의 상징인 손흥민을 기념하는 의미가 더욱 강하게 드러난다.

이는 지난 5월 토트넘에서 주장으로 뛰며 17년 만에 메이저 대회 트로피를 들어올렸던 손흥민의 업적을 기리는 상징물로 자리 잡을 전망이다.

토트넘 전문 매체 '스퍼스웹' 역시 ""토트넘 하이 로드에 설치 중인 손흥민 벽화가 모습을 드러내기 시작했다""며 팬들의 기대감을 전했다.

토트넘 스타디움 앞에는 이미 벽화 작업을 기다리는 팬들이 사진을 찍는 모습이 포착되기도 했다.



따라서 손흥민이 방문하는 이번 슬라비아 프라하전은 단순한 홈 경기 이상의 의미를 가진다.

손흥민은 10년 동안 토트넘에서 454경기를 소화하며 173골 101도움을 기록했고, 이는 클럽 역대 최다 득점 5위에 오르는 수치다.

또한 아시아 선수 최초의 프리미어리그 득점왕을 차지했고, FIFA 푸스카스상을 수상한 2019년 번리전 70m 드리블 원더골은 여전히 팬들 사이에서 전설적으로 회자되는 장면이다.

손흥민이 떠난 이후 MLS에서 보여준 활약 역시 팬들의 반응을 더욱 뜨겁게 만들었다.

손흥민은 이적 후 3개월이 채 되지 않은 기간 동안 정규리그에서 9골 3도움을 기록했고, 플레이오프에서 3경기 3골 1도움을 추가해 짧은 기간 동안 13경기 12골 4도움을 기록했고 MLS 데뷔 시즌을 강렬하게 마무리했다.

비록 서부 콘퍼런스 준결승에서 승부차기 실축으로 결승 진출 실패라는 아쉬움도 있었지만, MLS 데뷔 시즌만으로도 손흥민의 영향력을 입증했다.

이런 활약은 토트넘 팬들이 여전히 손흥민을 다시 그리워하게 만들었고, 이번 방문이 더 큰 환영을 받는 이유가 되고 있다.

손흥민의 복귀가 하루 앞으로 다가온 상황에서, 북런던 팬들은 이미 손흥민을 맞기 위한 준비를 마친 모습이며, 토트넘 홋스퍼 스타디움은 손흥민과 팬들이 함께했던 10년의 세월을 기억하는 감정적인 행사가 될 예정이다.



사진=SNS / 토트넘 홋스퍼"
20251209,'토트넘 관중 앞' 허리 숙여 90도 사죄했는데…손흥민 나가고 '또' 불법 혐의→토트넘서 미래 없다,"사진=게티이미지


[포포투=박진우]

토트넘 홋스퍼 관중들 앞에서 '90도 인사'로 사죄했던 이브 비수마. 또다시 불법 혐의를 받고 있다.

영국 공영방송 'BBC'는 8일(한국시간) ""토트넘은 비수마가 아산화질소를 흡입하는 모습이 담긴 영상과 관련해 사실관계를 확인하고 있다고 밝혔다""고 보도했다.

이번 시즌 단 한 경기도 나서지 못한 비수마. 또다시 도마 위에 올랐다. '이번에도' 웃음가스 논란이었다. 비수마는 지난해 프리시즌 기간, '웃음가스'로 알려진 아산화질소를 흡입하는 영상을 SNS에 게재했는데, 곧바로 파장이 일었다.

영국에서 아산화질소 소지 행위는 징역 2년이 선고될 수 있는 중대 범죄이기 때문. 논란이 일자 비수마는 개인 SNS를 통해 ""판단력이 심각하게 부족했다""며 사과했다. 결국 토트넘은 비수마에게 1경기 출전 정지 징계 처분을 내렸다.

사진=더 선


비수마는 토트넘 관중들 앞에서 사과하기도 했다. 지난 시즌 프리미어리그(PL) 2라운드 에버턴전에서 징계를 마치고 복귀했는데, 전반 14분 만에 선제골을 만들었다. 비수마는 토트넘 관중 앞에서 90도 허리를 숙이며 두 손을 모아 '사죄의 제스처'를 취했다. 웃음가스 논란에 대한 사과였다.

다만 1년이 지난 후에도 같은 잘못을 반복한 혐의를 받고 있다. 영국 '더 선'은 비수마가 웃음가를 흡입하는 장면이 촬영된 것이라 주장하는 영상을 공개했다. 결국 또다시 논란이 일었고, 토트넘은 'BBC'와의 인터뷰에서 ""해당 사안에 대해 확인 중이며, 내부적으로 문제를 처리할 것""이라 입장을 밝혔다.

만약 웃음가스 흡입이 사실로 밝혀진다면, 비수마는 토트넘에서 자리를 완전히 잃을 것으로 예상된다. 비수마는 토마스 프랭크 감독 체제에서 단 한 경기도 출전하지 못했다. 지난 겨울 이적시장에서 이적설이 제기되는 상황에서 잔류를 택했는데, 프랭크 감독은 그를 신임하지 않고 있다. 심지어 이번 시즌을 끝으로 계약 기간이 만료되는 상황, 비수마는 토트넘 팬들의 '문제아'로 낙인 찍힐 위기다. 

사진=더 선"
20251209,"'대충격' 레알 마드리드, 6개월 만에 '전격 경질'...알론소 OUT→'레전드' 지단 돌아온다! 맨체스터 시티전 '마지막 기회'","사비 알론소 감독/풋볼365

[마이데일리 = 최병진 기자] 레알 마드리드가 사비 알론소 감독의 경질을 고려하고 있다.

레알은 지난 8일(이하 한국시간) 스페인 마드리드에 위치한 산티아고 베르나베우에서 펼쳐진 셀타 비고와의 ‘2025-26시즌 스페인 프리메라리가’ 15라운드에서 0-2로 패했다.

이날 패배로 레알은 승점 36에 머물렀고 1위 바르셀로나(승점 40)와의 격차가 벌어졌다. 오히려 3위 비야레알(승점 35)이 레알보다 한 경기를 덜 치러 2위 자리도 위험한 상황이다.

그러면서 알론소 감독의 경질설도 전해졌다. 스페인 ‘문도데포르티보’는 “레알 보드진은 알론소 감독의 거취를 논의하기 시작했다. 후임 감독 물색 작업에 돌입했으며 다가오는 맨체스터 시티와의 유럽축구연맹(UEFA) 챔피언스리그(UCL) 경기가 마지막 기회가 될 것”이라고 보도했다.

알론소 감독은 레버쿠젠에서 2023-24시즌 무패우승을 이끌며 지도력을 인정받았다. 전술적인 능력과 함께 리더십으로 레버쿠젠의 새로운 역사를 썼고 이번 시즌을 앞두고 선수로 활약했던 레알에 부임했다.

초반 기세는 좋았으나 최근에는 어려 어려움이 이어지고 있다. 결과를 내지 못하는 상황과 함께 내부 분열 소식도 전해졌다. 비니시우스 주니오르, 호드리구 등 주축 자원들이 알론소 감독과 등을 졌다는 보도가 이어지면서 내부 장악 실패에 대한 우려도 커졌다.

사비 알론소 감독/게티이미지코리아

결국 이러한 상황으로 경질 가능성까지 등장하게 됐다. 후임으로는 레알을 두 차례 이끌며 UEFA 챔피언스리그 3연패의 대업을 이룬 지네딘 지단 감독이 또 물망에 올랐다.

매체는 “이미 라커룸 분위기는 돌이킬 수 없는 모습이다. 유력한 인물은 지단 감독과 함께 위르겐 클롭 감독도 후보군에 포함됐다”고 설명했다. 레알은 11일 오전 5시 산티아고 베르나베우에서 맨체스터 시티와 UEFA 챔피언스리그 리그 페이즈 6차전을 갖는다."
20251209,"'이럴 수가' 처음 뒤집혔다! 한국 17위→일본은 12위, 英 월드컵 '파워랭킹' 등장...1위는 메시의 아르헨티나","사진=트위터 캡처
14일 대전월드컵경기장에서 열린 대한민국과 볼리비아의 A매치 평가전. 홍명보 감독이 경기 시작을 기다리고 있다. 대전=허상욱 기자wook@sportschosun.com/2025.11.14/
[스포츠조선 이현석 기자]한국과 일본의 파워랭킹이 뒤집혔다.

영국의 풋볼365는 8일(한국시각) '2026년 북중미월드컵 파워랭킹, 조추첨 확정 이후'라며 조추첨 이후 각 나라의 파워랭킹을 공개했다.

풋볼365는 '월드컵 파워랭킹의 시간이 다가왔다. 이 순위는 확정적인 것이 아니며 전혀 흥분할 필요가 없다. 다만 이것은 월드컵 및 대륙 선수권 대회 참가 기록, 세계 랭킹, 그리고 토너먼트에 미칠 영향에 대한 직감 등 다양한 요소가 고려됐다'고 전했다.

한국은 17위에 올랐다. 풋볼365는 '1982년 이후로 월드컵을 놓친 적이 없다. 견고한 예선 성적을 거뒀고, 모두가 원하던 개최국 중 한 팀을 1포트 경쟁자로 선택했다'고 했다. 일본은 한국보다 높은 12위에 자리했다. 풋볼365는 '1998년 월드컵 출전 이후 꾸준히 출전 중이다. 아시아 예선을 멋지게 통과했다. F조에서 네덜란드와는 쉽지 않은 경기가 될 것이다'고 설명했다.

AFP연합뉴스
6일 미국 워싱턴DC의 케네디센터에서 열린 2026년 북중미월드컵 조추첨식이 마무리된 후 한국은 멕시코, 남아공, 유럽 PO D 승자와 함께 A조에 편성됐다. F조에 편성된 일본은 네덜란드, 튀니지, 유럽 PO B승자와 함께 묶였다.

앞서 글로벌 스포츠 언론들은 한국을 높이 평가했다. 충분한 저력을 갖췄음을 인정했다. 디애슬레틱은 한국을 16위로 평가하며 '한국은 빅네임의 선수들이 출전하면 아시아 국가 중 이번 대회에서 선전할 가능성이 가장 크다. 손흥민은 대화의 간판 스타가 될 것이다. 한국이 홈 이점을 최대한 활용해 아시아 최초로 4강에 올랐던 2002년의 영웅적인 활약을 재현하려면 황희찬과 이강인의 활약이 필수적이다'고 했다.

글로벌 축구 언론 골닷컴 또한 '한국은 지난 예선을 무패로 마쳤다. 일부 주축 선수들의 고령화 등 순조롭기만 한 것은 아니었지만, 홍명보 감독은 팀을 다시 궤도에 올리고, 젊은 선수들로 여러가지를 도모하는 대처도 시작됐다. 이번 대회는 멕시코와, 남아공, 유럽 PO 통과국을 만난다. 실력 차이가 거의 없기에 예상이 상당히 어렵다. 그럼에도 한국의 조별리그 1위 통과 가능성도 충분히 있다'고 호평했다.

AFP연합뉴스
반면 일본에 대해서는 한국보다 낮은 위치에 두고, 조별리그 통과부터 쉽지 않을 것이라는 전망들이 있었다. 하지만 영국 언론은 객관적인 성과를 거둔 일본 대표팀에 대한 평가를 더 높게 줬다.

아시아 국가들을 향한 세계 언론의 월드컵 전망이 엇갈리고 있다. 본선 무대에서 한국과 일본이 모두 웃을 수 있을지, 아니면 변수가 발생할지도 큰 관심을 받을 전망이다."
