date,title,content
20250626,"""이강인 아스널-유벤투스-AC밀란"" 인기 미쳤다, PSG 탈출 476억 OK…유럽 빅클럽 인기 폭발! 잉글랜드-이탈리아 명문 주목","(엑스포츠뉴스 김환 기자) 이강인은 최근 나폴리와 멀어졌지만, 여전히 유럽 빅클럽들의 관심을 받고 있다.

이강인의 소속팀 파리 생제르맹(PSG)은 3000만 유로(약 476억원)의 이적료라면 이강인의 이적을 허가하겠다는 방침을 유지하고 있는 것으로 알려졌다. 이강인에게 관심을 보이고 있는 빅클럽들이 3000만 유로를 지불할 경우 이강인을 영입, 지난 시즌 주전 경쟁에서 밀려난 이강인도 새로운 팀에서 커리어를 이어갈 수 있는 것이다.
프랑스 언론 '풋살7'은 25일(한국시간) ""이강인의 목적지가 점점 구체화되는 중""이라며 ""PSG의 윙어 이강인은 올여름 엄청난 제안을 받고 있다. 수많은 클럽들이 이강인에게 제의를 준비하고 있다""고 전했다.

매체는 ""PSG는 이번 여름 이적시장에서 핵심 선수를 영입하면서 몇몇 선수들을 이적시키는 걸 고려 중""이라며 ""유럽 빅클럽들이 PSG의 선수들을 탐내고 있고, 특히 이강인은 유럽에서 뜨거운 관심을 받고 있다""고 설명했다.



'풋살7'은 '풋 메르카토'의 보도를 인용해 지난 시즌 프리미어리그에서 준우승을 차지한 잉글랜드의 명가 아스널이 이강인 영입을 고려하고 있다고 주장했다. 아스널은 지난 겨울에도 이강인에게 관심을 표명했던 팀이다. 당시만 하더라도 PSG의 루이스 엔리케 감독이 이강인을 자신의 구상에 포함시켰기 때문에 PSG에서 아스널의 관심을 차단했었다.

'풋살7'에 따르면 아스널은 지난 시즌 유럽축구연맹(UEFA) 챔피언스리그에서 PSG와 격돌할 때 이강인을 주시했다. 이강인은 아스널과의 UEFA 챔피언스리그 준결승전에 결장했지만, 스쿼드에는 꾸준히 포함됐다.

또한 '풋살7'은 아스널 외에도 이탈리아 세리에A를 대표하는 세 곳의 명문 구단이 이강인을 주시 중이라고 했다.

매체에 의하면 유럽축구 이적시장 전문가 에크렘 코누르는 이강인이 최근 AC밀란, 유벤투스, 나폴리의 관심을 받는 중이라며 ""나폴리는 이강인 영입 경쟁에서 가장 유리한 위치를 점하고 있다""면서 ""이강인은 클럽월드컵이 끝난 뒤 자신의 거취를 결정할 것이다. PSG는 3000만 유로의 제안이 온다면 이강인을 매각할 수 있다""고 밝혔다.



2023년 PSG에 입단하며 유럽에서도 알아주는 빅클럽 입성에 성공한 이강인은 나름대로 안정적인 첫 시즌을 보내며 두 번째 시즌에 대한 기대감을 끌어올렸지만, PSG 생활 2년 차였던 지난 시즌 후반기부터 입지가 급격하게 흔들렸다.

중앙 미드필더와 측면 공격수, 심지어 최전방 공격수 위치에서 펄스 나인(가짜 9번) 역할까지 수행했던 전반기와 달리 후반기 들어 다른 선수들의 경기력이 올라오자 엔리케 감독이 이강인을 외면하기 시작한 것이다. 엔리케 감독은 이강인의 다재다능함을 칭찬하며 이강인을 다양한 포지션에 기용했지만, 오히려 특정 포지션에 자리를 잡지 못하고 소위 '땜빵'처럼 뛴 것이 독이 된 셈이다.

이강인이 주춤하는 동안 겨울 이적시장에서 새롭게 합류한 흐비차 크바라츠헬리아를 비롯해 데지레 두에, 브래들리 바르콜라, 심지어 유망주인 세니 마율루까지 경기력이 급격하게 좋아지면서 이강인을 밀어내고 PSG의 주전과 교체 1순위 자리를 차지했다.

실제 이강인은 시즌 후반기에 열린 중요한 경기에 대부분 결장했다. UEFA 챔피언스리그에서는 리버풀과의 16강 2차전에서 경기가 연장전으로 흘러가자 교체 출전한 이후로는 토너먼트 무대를 밟지 못했고, 리그에서도 PSG가 우승을 확정 지은 뒤 로테이션 멤버처럼 기용됐다.

프랑스 유력지 '레퀴프'의 보도에 따르면 PSG는 리그 우승과 UEFA 챔피언스리그에서의 성공 등을 이유로 기존 선수들에게 더 나은 조건을 제안해 재계약을 맺을 계획이었으나, 계획을 수정해 이강인을 비롯한 몇몇 선수들을 방출하기로 결정했다. 



'레퀴프'의 보도 이후 이강인은 시즌 막바지부터 이적설에 얽혔고, 이달 중순만 하더라도 김민재의 전 소속팀이었던 나폴리와 강하게 연결되면서 올여름 PSG와 작별할 것으로 예상됐다. 안토니오 콘테 감독 아래에서 지난 시즌 세리에A 우승을 차지한 나폴리가 이강인을 원한다는 것은 나름대로 긍정적인 소식이었다.

그러나 PSG와 나폴리가 합의점을 찾지 못하면서 나폴리의 마음이 식었고, 최근 나폴리가 이강인 대신 PSV 에인트호번의 네덜란드 국가대표 윙어 노아 랑을 영입하기로 한 이후에는 나폴리의 영입 명단에서 이강인의 이름이 아예 사라졌다. 현재 나폴리는 이강인 대신 제이든 산초와 단 은도예, 그리고 페데리코 키예사 영입을 추진 중인 것으로 전해졌다.

이런 상황에서 나폴리 외에도 아스널, 밀란, 유벤투스 등 유럽을 대표하는 빅클럽들이 이강인에 대한 관심을 유지하고 있다는 소식은 긍정적이다. 또한 코누르에 따르면 PSG가 책정한 이강인의 이적료도 그다지 높은 편이 아니라 이강인의 이적 가능성을 낮지 않게 볼 수 있는 것도 사실이다.



특히 겨울 이적시장이 한창일 때에도 이강인과 이어졌던 아스널은 과거 아틀레티코 마드리드에서 일할 당시 이강인 영입을 추진했던 안드레아 베르타 신임 단장을 중심으로 여름 이적시장에서 적극적인 행보를 보이고 있어 이강인을 데려갈 가능성이 높은 팀으로 여겨지고 있다.

영국 매체 '풋볼 팬캐스트'는 지난달 ""아스널의 스포츠 디렉터인 베르타 단장이 이강인을 원하고 있다""며 ""베르타 단장은 아틀레티코 마드리드에서 일하던 시절 이강인 영입을 계획했지만 실패했다. 아스널의 미켈 아르테타 감독은 이강인 영입을 반길 것이며, 감독과 단장 모두가 이강인의 자질에 대해 의견이 통일된 것으로 보인다""고 했다. 

지금은 PSG가 2025 국제축구연맹(FIFA) 클럽월드컵에 참가하고 있기 때문에 이강인의 거취는 클럽월드컵 이후에 정해질 공산이 크다. PSG에서 확실하게 자리를 잡지 못한 이강인이 어떤 팀에서 커리어를 이어가게 될지 관심이다.

사진=연합뉴스"
20250626,"""초대박!"" 맨유 '7000만 파운드 스타' 포함↔첼시 역대급 '블록버스터' 스왑딜 고려","사진=REUTERS 연합뉴스
사진=EPA 연합뉴스
[스포츠조선 김가을 기자]맨유와 첼시가 블록버스터급 스와프 계약을 고려하고 있다.

영국 언론 익스프레스는 25일(이하 한국시각) '알레한드로 가르나초(맨유)와 크리스토퍼 은쿤쿠(첼시)가 포함된 블록버스터급 스와프 계약을 추진할 수 있다. 가르나초는 오랜 시간 첼시의 관심을 받아왔다. 맨유는 은쿤쿠와의 스와프 계약 체결을 고려했다'고 보도했다.

2004년생 가르나초는 올 여름 이적 시장의 뜨거운 감자다. 가르나초는 2024~2025시즌 내내 이적설에 시달렸다. 결정적인 장면이 포착되기도 했다. 앞서 또 다른 언론 팀토크는 '가르나초는 토트넘과의 2024~2025시즌 유로파리그(UEL) 결승전 뒤 팀을 부정적으로 묘사했다'고 했다. 또 다른 언론 스포츠바이블도 '가르나초가 결승전에서 패배한 뒤 루벤 아모림 맨유 감독을 겨냥하는 듯 보였다. 가르나초는 경기 뒤 눈에 띄게 실망한 모습이었다'고 전했다. 당시 가르나초는 ""팀이 결승전에 진출할 수 있도록 모든 라운드를 뛰었다. 하지만 결승전에선 20분밖에 시간이 없었다""고 말했다. 그는 자신의 미래에 대해 ""모르겠다. 여름에 무슨 일이 일어나는지 보겠다""고 했다. 가르나초는 2024~2025시즌 UEL에서만 15경기를 소화했다. 하지만 이날은 벤치에서 경기를 시작했다. 팀이 0-1로 밀리던 후반 26분 메이슨 마운트와 교체돼 그라운드를 밟았다.

사진=REUTERS 연합뉴스
사진=REUTERS 연합뉴스
익스프레스는 '가르나초는 아모림 감독에게 새 팀을 찾아야 할 수 있다는 말을 들었다. 은쿤쿠는 첼시에서의 출전 시간이 부족해 좌절감을 느낀 것으로 알려졌다. 이러한 계약이 성사된다면 첼시가 웃을 것이다. 가르나초는 잠재력이 높다. 그는 2024~2025시즌 총 11골-10도움을 기록했다. 가르나초는 첼시에 옵션을 제공할 수 있다. 반면, 은쿤쿠는 맨유로 이적하면 경쟁을 벌여야 한다'고 했다.

한편, 가르나초는 뜨거운 관심을 받고 있다. 팀토크는 '아르헨티나 언론에 따르면 최근 아스널이 가르나초 영입을 요청했다. 아스널은 새로운 스트라이커와 측면 공격수를 찾고 있다. 다만, 가르나초의 이적료로 얼마가 필요할지는 엇갈리고 있다. 일각에선 5000만 파운드로 영입 가능하다고 본다. 그러나 7000만 파운드 이상의 가치를 지니고 있다고 지적한다'고 전했다."
20250626,"""리버풀 미쳤다!"" '아모림 애제자' 8500만 파운드 공격수 영입 경쟁 '아스널도 2차 입찰 예정'","사진=AP 연합뉴스
사진=AFP 연합뉴스
[스포츠조선 김가을 기자]빅토르 요케레스(스포르팅)를 향한 관심이 뜨겁다. 맨유, 아스널에 이어 리버풀까지 영입전에 뛰어 들었다.

영국 언론 더선은 26일(이하 한국시각) '리버풀이 맨유, 아스널을 상대로 요케레스 영입을 위해 싸울 준비가 돼 있다'고 보도했다.

아르네 슬롯 감독이 이끄는 리버풀은 2024~2025시즌 잉글랜드 프리미어리그(EPL) 정상에 올랐다. 새 시즌에도 '왕좌'를 지키기 위해 비시즌 스쿼드 강화에 나섰다. 최근 플로리안 비르츠를 영입하는 등 힘을 쏟고 있다. 여기서 끝이 아니다. 리버풀은 최전방 공격수 영입도 준비하고 있다.

더선은 '리버풀은 EPL 타이틀 방어를 위해 최고의 스트라이커 영입을 준비하고 있다. 알렉산더 이삭(뉴캐슬), 요케레스 등을 눈여겨 보고 있다. 다만, 이삭은 뉴캐슬의 강력한 연봉 정책 탓에 영입이 어려운 상황이다. 이삭은 현재 주급 13만 파운드를 받고 있다. 뉴캐슬은 주급 인상을 계획하고 있다. 주급 20만 파운드 계약을 고려하고 있다. 리버풀은 요케레스를 눈여겨 보고 있다'고 했다.

사진=REUTERS 연합뉴스
사진=AFP 연합뉴스
요케레스는 2023~2024시즌 스포르팅의 유니폼을 입었다. 펄펄 날았다. 요케레스는 스포르팅 첫 시즌 공식 50경기서 43골-14도움(공격포인트 57개)을 기록했다. 같은 기간 엘링 홀란(44개), 킬리안 음바페(54개), 해리 케인(56개)보다도 높은 수치였다. 요케레스는 2024~2025시즌 총 52경기에 나서 54골-13도움을 기록했다.

더선은 '요케레스는 슬롯의 레이더에 포착됐다. 그는 루벤 아모림 맨유 감독 최고의 타깃이 됐다. 하지만 요케레스는 유럽챔피언스리그(UCL)에서 뛰고 싶어한다. 아스널은 요케레스 영입을 위해 5530만 파운드 입찰을 했다. 하지만 거절당했다. 두 번째 제안을 할 가능성이 높다. 다만, 요케레스는 스포르팅과 이적료 관련해 갈등을 빚고 있다. 요케레스의 방출 조항은 8500만 파운드'라고 했다."
20250626,"SON '우승하고 떠난다' 낭만 달성…유로파 결승이 마지막 ""손흥민, 토트넘에 이별 인상 암시""","▲ 손흥민은 2015년 토트넘에 입단한 이후 핵심 전력을 넘어 레전드 반열에 오른 선수다. 해리 케인, 에릭센 등이 우승을 위해 팀을 떠나는 동안 팀을 지켰고, 2024-25시즌에는 유로파리그 우승을 이끌며 개인 커리어 첫 메이저 대회 트로피를 들어올렸다. 토트넘에는 41년 만의 유럽대항전 우승이었다.


[스포티비뉴스=조용운 기자] 우승 하나만 보고 10년을 헌신한 손흥민(33)이 결국 미션을 달성하고 아름다운 이별을 앞두고 있다.

손흥민이 지난 시즌 유럽축구연맹(UEFA) 유로파리그 챔피언에 오른 뒤 토트넘 선수단에 사실상 작별인사를 건넸다는 소식이다. 영국 '텔레그래프'에서 활동하는 맷 로 기자는 26일(한국시간) 토트넘 소식을 다루는 팟캐스트 '라스트 워드 온 스퍼스'에 출연해 손흥민과 이별을 내다봤다.
맷 로 기자는 ""시즌 마지막 경기가 끝나고 토트넘의 라커룸은 손흥민이 고별전을 치렀다는 인상을 받았다는 분위기였다""며 ""트로피를 들어올렸기에 헤어지기에 적절한 시기라고 보여진다. 이적 의향이 있을 것으로 생각한다""라고 말했다.

토트넘 하나만 바라보고 뛰었던 손흥민은 기어코 우승 커리어를 만들었다. 2010년 독일 분데스리가 함부르크에서 데뷔한 뒤 바이엘 레버쿠젠, 토트넘 등 명문 구단에서 뛰었으나 한 차례도 우승컵을 들지 못했다. 10년을 뛴 토트넘에서 준우승만 세 차례 기록하면서 징크스에 시달렸다. 국가대표팀에서도 우승을 한 적이 없어 이번 유로파리그에 거는 기대가 상당했다.

아쉽게도 결승전 당일 손흥민은 비록 주연은 아니었다. 이전부터 고생시켰던 발 부상 탓에 교체 투입으로 짧게 결승전을 누볐다. 그러나 손흥민이 10년간 한결 같이 토트넘을 위해 헌신했던 면과 무관의 아픔을 모르지 않기에 우승이 결정된 순간부터는 모든 스포트라이트를 받았다.

▲ 토트넘은 지난 1월 손흥민과의 계약에 포함된 1년 연장 옵션을 발동해 2026년까지 계약을 유지했다. 계약 만료 1년을 앞두고 엄청난 위업을 달성했지만, 여름 이적 시장이 열리자 손흥민과 작별 가능성이 보도됐다. ⓒ 토트넘 홋스퍼


손흥민은 묵은 한을 마음껏 풀었다. 그토록 품고 싶었던 트로피를 절대 놓지 않았다. 시상식이 펼쳐진 경기장은 물론 런던으로 돌아올 때 기내 안에서도, 런던에서 펼친 퍼레이드까지 손흥민은 항상 우승컵과 함께였다. 결코 잊을 수 없을 것으로 단언했다. 손흥민은 ""이 순간을 정말 기다렸고, 마침내 이뤄냈다. 이곳에서 우승을 해냈다는 게 정말 기쁘다""라고 웃었다.

그러면서 ""17년 동안 아무도 해내지 못했던 우승을 우리 팀이 해냈다. 지금의 팀이 정말 자랑스럽다""며 ""여기까지 오고 싶다고 여러번 말했었는데 정말 특별하다. 더구나 내가 주장을 맡았을 때 운이 찾아와 더없이 기쁘다. 너무 행복하다""라고 미소 지었다.

그만큼 우승 퍼즐을 완성하는 게 목표였다. 주장으로서 팀의 중심을 잡고, 위기의 순간마다 팀에 활력을 불어 넣었고 결국 유럽대항전 우승이라는 결실을 맺었다. 이제는 토트넘에서 더 도전할 게 없다. 계약기간도 1년밖에 남지 않은 상황이라 구단을 생각하는 애정을 봤을 때, 손흥민이 새로운 출발에 스스로 걸림돌이 되지 않으려는 선택을 할 가능성도 여겨진다.

▲ 영국 공영방송 BBC는 “손흥민은 내년 여름 계약 만료를 앞두고 있으며, 올여름 사우디아라비아 클럽들과 연결되고 있다”고 보도했다. BBC를 포함한 꽤 굵직한 매체들이 줄지어 “어느 때보다 이적 가능성이 높다”는 반응이다. ⓒ곽혜미 기자


손흥민은 우승과 무관하게 시즌 전후로 결별 이야기가 상당했다. 지난 시즌 보여준 페이스가 조금 하락한 것도 인정할 부분이라 토트넘이 손흥민과 동행을 이어 갈지 여부가 불확실하다는 어투였다.

시즌 내내 토트넘 정보를 주로 다루는 곳부터 결별의 눈초리를 세웠다. 일례로 '스퍼스 웹'은 ""손흥민은 장기 계약을 원했다. 전적으로 만족하지 못할 1년 연장""이라며 ""손흥민의 가까운 미래에 대한 추측은 일단락됐으나 장기적인 거취는 불확실하다. 당장은 손흥민을 보호했지만 이번 시즌 여전히 부진한 상태""라고 다른 판단을 내릴 수 있는 근거를 열었다.

그러면서 ""몇 달 전만 해도 토트넘이 손흥민을 매각한다는 생각은 상상조차 할 수 없었다. 주장이자 구단의 얼굴이기 때문이다. 그러나 그 이후로 상황이 달라졌다. 이번 시즌 최고치를 달성하는 데 어려움을 겪고 있고, 토트넘은 그에게 새로운 계약을 제안하지 않고 있다""라고 밝혔다.

▲ 손흥민의 이적 시점은 8월 3일 이후가 될 가능성이 높다. 토트넘은 이번 여름 프리시즌의 일환으로 한국을 방문, 서울에서 뉴캐슬 유나이티드와 친선경기를 치른다. 이는 2022년, 2024년에 이어 세 번째 한국 방문으로, 손흥민은 구단 마케팅의 중심축이다. ⓒ곽혜미 기자


영국 매체 '풋볼 인사이더'도 ""손흥민의 계약은 단지 1년 연장된 것이다. 그가 내년 이맘때쯤 클럽을 떠나는 자유 이적에 동의할 수 있다""며 ""클럽은 지금이나 여름 이적 시장에서 그를 현금화할 기회를 확보하기 위해 움직일 수 있다""라고 덧붙였다.

손흥민을 향한 외부의 관심 못지않게, 손흥민도 토트넘을 아름답게 떠나는 그림을 연출하려는 모습이다. 이럴 경우 손흥민의 마지막 공식전은 유로파리그 결승전으로 기록되며, 비공식전은 오는 8월 한국에서 펼칠 뉴캐슬 유나이티드와 이벤트전이 유력하다.

▲ BBC는 “토트넘은 손흥민을 중심으로 한 팬 미팅, 방송 출연 등의 일정을 계획해놓은 상태이며, 투어 후 이적을 논의하는 것이 현실적”이라고 설명했다. 이번 투어가 상업적으로 중요한 행사인 만큼, 구단은 손흥민의 참여를 매우 중시하고 있다. ⓒ 토트넘 홋스퍼"
20250626,"래시포드 신났다! ""바르셀로나와 막판 계약 체결""…임대로 라리가 합류→'예산 부족' 완전 영입은 어려워","사진=SNS
[스포츠조선 강우진 기자]바르셀로나가 맨체스터 유나이티드의 공격수 마커스 래시포드와 막판 계약을 체결할 수 있다는 주장이 나왔다.

영국 풋볼인사이더는 25일(한국시각) ""바르셀로나는 이번 여름 맨체스터 유나이티드의 스타 마커스 래시포드를 영입하는 막판 계약을 체결할 수 있다""라고 보도했다.

래시포드는 지난 1월 애스턴 빌라로 임대 이적한 후, 시즌 후반을 그곳에서 보냈다. 우나이 에메리 감독이 이끄는 빌라에서 17경기에 출전해 4골 6도움을 기록했고, 이후 햄스트링 부상을 당했다.
임대에서 복귀한 뒤 래시포드가 선호하는 행선지는 오랫동안 연결돼 온 스페인 명문 바르셀로나로 알려져 있다.

그러나 바르셀로나는 아직까지 래시포드에게 접근하지 않았으며, 현재는 아틀레틱 빌바오의 니코 윌리엄스 영입 계약에 근접해 있다.

윌리엄스 영입이 바르셀로나의 예산 대부분을 차지할 가능성이 크기 때문에 래시포드를 영입할 예산은 없다는 분석도 있다.

마커스 래시포드는 라민 야말과 함께 뛰고 싶다는 인터뷰를 할 정도로 바르셀로나에게 적극적인 어필을 하고 있다.

<저작권자(c) 연합뉴스, 무단 전재-재배포, AI 학습 및 활용 금지>
<저작권자(c) 연합뉴스, 무단 전재-재배포, AI 학습 및 활용 금지>
맨체스터 유나이티드는 이번 여름 래시포드 매각에 관심이 있지만, 임대 가능성도 배제하지 않고 있다. 래시포드는 맨유에서 막대한 주급을 받고 있고, 계약은 오는 2028년까지다. 맨유는 래시포드로 인한 고정 지출을 줄이는 게 급선무다.

결국 바르셀로나가 선택할 수 있는 유일한 방법은 래시포드의 임대 영입이다.

재정 전문가 스테판 보르손은 ""래시포드에게 선택지가 그렇게 많지 않다. 그가 바르셀로나로 가고 싶어 하는 건 분명해 보인다""라며 ""하지만 현실은 바르셀로나가 에스파뇰의 주안 가르시아 영입을 위해 자금을 마련했고, 니코 윌리암스 영입도 진행 중이다. 이 두 계약만으로도 예산 대부분이 소진될 것이다""라고 말했다.

또 보르손은 ""맨체스터 유나이티드는 여전히 래시포드의 이적을 원하고 있으며, 그 액수도 꽤 클 것이다. 바르셀로나가 영입하는 건 매우 어려울 수 있다""라며 ""아마 이건 이적 시장 마감 직전에 임대로 바르셀로나에 합류하는 형태가 될 수도 있다""라고 주장했다.

<저작권자 ⓒ 연합뉴스. 무단 전재 재배포 금지, AI 학습 및 활용 금지>
<저작권자(c) 연합뉴스, 무단 전재-재배포, AI 학습 및 활용 금지>
래시포드는 맨유에서 더이상 뛰고 싶어 하지 않고 있다. 후벤 아모림 맨유 감독은 래시포드를 기용할 의사가 전혀 없다. 래시포드 입장에서는 바르셀로나로의 이적이 간절하지만, 그의 연봉과 이적료가 큰 걸림돌이다. 결국은 연봉을 깎아서라도 바르셀로나로 가야 하는데 완전 이적은 어렵다.

일단 단기적인 목표는 바르셀로나로 임대를 떠나는 것이다. 완전 이적 옵션을 포함해 계약하는 것이 베스트다. 이후 스페인 라리가에서 자신의 역량으로 바르셀로나의 눈에 들어야 한다. 래시포드가 라리가에서 다시 한번 재기에 성공할지 관심이 모아진다."
