date,title,content
20250721,"“아직 결정 안했다”는 프랑크 감독…‘모호한 위치’ 양민혁, 스스로 더 증명해야","토트넘 양민혁이 런던 엔필드 홋스퍼웨이에서 진행 중인 프리시즌 훈련을 하기 위해 훈련장으로 향하고 있다. 사진출처｜토트넘 홋스퍼 페이스북

토트넘 양민혁(오른쪽)이 런던 엔필드 클럽하우스 홋스퍼웨이에서 진행 중인 선수단의 프리시즌 훈련에 열중하고 있다. 사진출처｜토트넘 홋스퍼 페이스북

토트넘(잉글랜드) 양민혁(19)의 2025~2026시즌은 어떻게 열릴까. 일단 지금까진 긍정적이지도, 부정적이지도 않다. 잉글랜드 프리미어리그(EPL) 데뷔를 노릴 수 있지만 또 한 번 임대될 가능성도 열려있다.

토마스 프랑크 감독(덴마크)은 최근 런던 엔필드 클럽하우스 홋스퍼웨이에서 가진 기자회견에서 “(임대 여부는) 두고봐야 한다. 좀더 지켜보겠다. 어떤 결정이 내려질 때까지 몇 주 더 필요하다”고 말했다. 양민혁을 자신의 데뷔 시즌에 활용할지를 결정하지 못했다는 얘기다.
분위기가 마냥 나쁘진 않다. “지금까진 잘 적응하고 있고, 훈련도 잘 소화하고 있다. (선수가) 아직 배워야 할 부분도 있고, 나 또한 아이디어를 갖고 있으나 당장 판단하기에 이르다”는 것이 프랑크 감독의 설명이다.

일단 프리시즌 첫 연습경기는 건너뛰었다. 토트넘 ‘리딩 레전드’ 손흥민(33)이 20일(한국시간) 셀렉트 카 리싱 스타디움에서 끝난 잉글랜드 3부 레딩과 연습경기 후반전에 교체 출전한 반면 벤치 대기하던 양민혁에겐 기회가 주어지지 않았다.

프랑크 감독은 이날 브레넌 존슨과 마이키 무어를 윙어로 선발 투입했고, 후반전엔 손흥민과 영입생 모하메드 쿠두스 등을 내세웠다. 전·후반전에 11명을 전원 바꿔줬음에도 양민혁은 자리를 지켰다.

물론 토트넘에서 윙어로 기회를 잡는 건 몹시도 어려운 일이다. 차고 넘치는 포지션이 공격 2선이다. 레딩전 출전자를 제외해도 윌송 오도베르, 마티스 텔, 데얀 클루셉스키 등이 버틴다. 모두가 핵심 자원들이다.

그래도 포기할 이유는 없다. 프리시즌은 길다. 파리 생제르맹(프랑스)과 다음달 14일 유럽축구연맹(UEFA) 슈퍼컵에 앞서 잉글랜드 챔피언십(2부) 루턴 타운(26일), 아스널(31일), 뉴캐슬(8월 3일·이상 EPL), 바이에른 뮌헨(독일·8월 7일)과 차례로 친선전을 갖는다. 선수단 회복과 컨디션 주기를 고려하면 기회는 주어질 전망이다.

게다가 프랑크 감독이 신임 사령탑이라는 점도 긍정 요소다. 선입관 없이 원점 경쟁할 수 있어서다. 지난해 12월 토트넘에 합류한 양민혁은 프리시즌을 경험하지 못한 채 후반기 챔피언십 퀸즈파크레인저스로 임대돼 14경기, 694분을 뛰며 2골·1도움을 올렸다.

토트넘 부임에 앞서 EPL 중소클럽 브렌트포드를 성공리에 이끈 프랑크 감독이 유망주를 키우는 데 일가견이 있다는 점도 양민혁이 희망을 품을 만한 요소다.

남장현 기자 yoshike3@donga.com"
20250721,"""이적 제안 쏟아질 것"" 첫 경기부터 '혹평 난무' 손흥민, 결국 토트넘 떠나나?…""구단, 자금 마련 위해 매각 고려""","[SPORTALKOREA] 황보동혁 기자= 토트넘 홋스퍼의 주장 손흥민이 이번 여름 구단과의 결별 수순을 밟을 가능성이 점차 커지고 있다.

영국 매체 '더 선'은 19일(이하 한국시간) ""내년 여름 계약 만료를 앞둔 손흥민에게 곧 이적 제안이 쏟아질 전망""이라며, 사우디아라비아의 알 아흘리, 알 나스르, 알 카디시아가 손흥민 영입에 관심을 보이고 있다고 보도했다.

보도에 따르면 세 구단은 모두 손흥민을 영입하기 위해 3,400만 파운드(약 634억 원)의 이적료를 제시할 준비가 되어 있는 것으로 알려졌다. 여기에 조제 무리뉴 감독이 이끄는 페네르바흐체 역시 손흥민을 주시 중이다.



토트넘도 손흥민의 매각 가능성에 대해 열린 태도를 보이고 있다.

매체는 ""다니엘 레비 회장은 새 감독 토마스 프랑크를 위한 선수단 개편 자금을 마련하기 위해, 수익성 있는 제안이 들어올 경우 손흥민의 이적을 허용할 수 있다는 입장""이라고 전했다.

여기에 프랑크 감독 역시 손흥민의 미래에 대해 명확한 입장을 밝히지 않았다. 그는 최근 공식 기자회견에서 ""한 선수가 오랜 시간 클럽에 있었다면, 구단 입장에서는 결정을 내려야 할 시점이 오게 마련""이라며 의미심장한 발언을 남겼다.



이러한 구단의 분위기 속에서, 손흥민 본인에게도 이번 여름은 전환점이 될 수 있다.

그는 지난 시즌 리그 30경기에서 7골 9도움에 그치며, 8년 연속 이어오던 '10-10 클럽' 달성에 실패했다. 부상의 여파도 있었지만, 데뷔 시즌을 제외하면 커리어 최저 성적이다. 오히려 이적을 통해 반등의 계기를 만들 적기일 수 있다는 평가도 나온다.

이러한 흐름은 프리시즌 경기에서도 이어졌다. 19일 열린 레딩과의 프리시즌 첫 평가전에서 손흥민은 후반 시작과 함께 교체 투입돼 45분을 뛰었지만, 유효 슈팅 없이 무득점에 그쳤고, 몇 차례 터치 미스로 아쉬운 모습을 보였다.



축구 통계 매체 '풋몹(FotMob)'에 따르면, 손흥민은 이날 경기에서 슈팅 1회, 패스 성공률 64%(9/14), 드리블 성공률 0%(0/3), 크로스 성공률 0%(0/1), 볼 경합 성공률 40%(2/5)를 기록했다.

현지 언론의 평가는 냉정했다. '풋볼런던'의 알라스데어 골드는 손흥민에게 팀 내 최저 평점인 5점을 부여하며 ""몸이 덜 풀린 모습이었다. 터치 미스가 잦았고, 팀 플레이에도 잘 녹아들지 못했다""고 평가했다.

'런던 월드'도 평점 6점을 주며 ""다른 동료들과 비교해 위협적인 장면을 거의 만들지 못했다. 여름 이적설이 계속되는 가운데, 그의 눈부셨던 토트넘 커리어가 끝을 향해 가는 것처럼 보인다""고 전했다.



이처럼 리그1(잉글랜드 3부리그) 소속 레딩을 상대로도 영향력을 발휘하지 못하자, 손흥민의 이적설은 더욱 구체화되고 있다.

영국 매체 '기브미스포츠'는 20일 ""토트넘은 올여름 손흥민의 이적을 허용하기로 결정했다""며, ""주급 19만 파운드(약 3억 5,000만 원)를 받고 있는 손흥민의 10년 여정이 이제 막바지에 다다르고 있다""고 보도한 바 있다.

다만 손흥민의 이적이 이뤄지더라도 실제 팀을 떠나는 시점은 8월 이후가 될 가능성이 크다.



더 선은 ""토트넘은 당분간 손흥민을 이적시킬 계획이 없다. 다음 달 초 한국에서 열리는 프리시즌 친선 경기에서 손흥민의 출전이 상업적 계약에 따라 '의무'이기 때문""이라고 설명했다.

실제로 손흥민이 아시아, 특히 한국 시장에서 갖는 영향력을 고려하면, 구단의 입장도 납득할 만하다. 이에 따라 손흥민의 향후 거취는 8월 이후 본격적으로 윤곽이 드러날 전망이다.

사진= 게티이미지코리아 

취재문의 sportal@sportalkorea.co.kr"
20250721,"""손흥민이 주장? 말도 안 돼"" 최저 평점+충격 부진에 주장 교체설 등장…""로메로에게 주장 완장 줘야""","(엑스포츠뉴스 김환 기자) 손흥민이 프리시즌 첫 경기에서 부진하자 토트넘 홋스퍼가 주장을 교체해야 한다는 이야기가 나오기 시작했다.

손흥민의 라커룸 내 영향력은 인정하나, 그가 부진에 빠져 경기에 나오지 못한다면 결국 팀의 주장을 맡는 게 소용이 없다는 지적이다. 현지에서는 손흥민 대신 지난 시즌 토트넘의 부주장을 맡았던 크리스티안 로메로에게 주장직을 맡겨야 한다는 말이 나오고 있다.

토마스 프랭크 감독이 이끄는 토트넘은 지난 19일(한국시간) 영국 레딩에 위치한 셀렉트 카 리싱 스타디움에서 열린 잉글랜드 리그 원(3부리그) 소속 레딩과의 프리시즌 친선경기에서 1골 1도움을 올린 루카 부슈코비치의 활약에 힘입어 2-0 승리를 거뒀다.

프랭크 감독 체제로 첫 경기를 치른 토트넘은 프리시즌 첫 번째 경기부터 완승을 거두며 좋은 분위기 속에 다음 시즌을 위한 준비를 시작했다. 토트넘은 이제 루턴 타운과 친선경기를 치른 뒤 홍콩과 한국을 순회하는 프리시즌 아시아 투어에 나선다. 이후 바이에른 뮌헨, 파리 생제르맹(PSG)과의 친선전도 기다리고 있다.



프랭크 감독은 이번 경기를 통해 선수들의 전체적인 기량을 점검하고자 했다. 그는 전반전과 후반전 베스트 일레븐을 다르게 구성해 최대한 많은 주전급과 준주전급 자원들이 경기장을 밟을 수 있도록 했고, 대부분의 선수들에게 동일하게 45분을 부여했다.

안토닌 킨스키, 데스티니 우도기, 케빈 단소, 크리스티안 로메로, 페드로 포로, 마이키 무어, 로드리고 벤탄쿠르, 파페 사르, 브레넌 존슨, 알피 디바인, 도미닉 솔란케가 전반전에 선발 출전했다.
후반전에는 굴리엘모 비카리오, 제드 스펜스, 벤 데이비스, 미키 판더펜, 제이미 돈리, 모하메드 쿠두스, 루카스 베리발, 이브 비수마, 부슈코비치, 윌 랭크셔, 그리고 손흥민이 경기에 나섰다.

지난 시즌 잉글랜드 챔피언십(2부리그)의 퀸즈 파크 레인저스(QPR)에서 임대로 경험을 쌓고 돌아온 양민혁도 이날 벤치에 앉았으나, 출전 기회를 받지는 못했다. 

가장 눈에 띈 선수는 이번 여름 이적시장에서 웨스트햄 유나이티드를 떠나 토트넘에 합류한 토트넘의 신입생 모하메드 쿠두스였다. 가나 국가대표 공격수인 그는 후반전 초반 날카로운 코너킥으로 윌 랭크셔가 터트린 선제골의 기점이 됐고, 이어 부슈코비치의 추가골까지 도우면서 인상을 남겼다. 그의 장기인 유려한 드리블 돌파는 덤이었다.



반대로 부진한 경기력으로 아쉬움을 산 선수도 있었다.

그중 한 명은 손흥민이었다. 후반전 주장 완장을 차고 교체 투입된 손흥민은 자신의 주 포지션인 왼쪽 날개로 출전했으나, 제 실력을 발휘하지 못하며 아쉬움을 남겼다.

손흥민은 후반 27분 코너킥 상황에서 흐른 공을 잡아 슈팅을 시도한 게 위로 높게 떴고, 후반 34분 왼쪽 측면에서 돌파 도중 터치 실수를 범하기도 했다. 아직 몸이 올라오지 않은 듯했다.

축구 통계 매체 '폿몹'에 따르면 손흥민은 슈팅 1회, 패스 성공률 64%(14회 중 9회 성공), 드리블 성공 0회(3회 시도), 크로스 성공 0회(1회 시도), 경합 성공 2회(5회 시도) 등의 기록을 남겼다.

영국 매체 '풋볼 런던'의 토트넘 전담 기자인 알레스데어 골드는 손흥민의 경기력을 두고 ""그의 터치는 때때로 정말 녹슨 것처럼 보였고, 그가 시도한 어려운 슛 중 하나는 크로스바 위를 훌쩍 넘어갔다""며 손흥민에게 평점 5점을 내렸다. 이는 루카스 베리발과 함께 토트넘 선수들 중 가장 낮은 평점에 해당되는 점수였다. 



지난 시즌 노쇠화와 부상으로 인해 기량을 유지하지 못한 손흥민이 프리시즌 첫 경기에서도 경기력을 회복하지 못한 모습을 보이자 현지에서는 토트넘이 이참에 주장을 교체해야 한다는 목소리까지 나오기 시작했다. 손흥민이 지금의 경기력으로는 토트넘에서 선발 출전하기 어려울 수 있으니, 꾸준히 선발로 경기에 나설 수 있는 선수가 손흥민 대신 주장 완장을 차야 한다는 것이다.

토트넘 팬 커뮤니티 '스퍼스 웹'은 ""토마스 프랭크는 손흥민이 다음 시즌에도 토트넘의 주장을 맡을 수 있다고 말했지만, 다른 선수에게 그 자리를 제안해야 한다""며 ""손흥민이 지난 두 시즌 동안 토트넘의 주장을 맡으면서 팀에 엄청난 기여를 했다는 사실에 대해서는 의심의 여지가 없으나, 안지 포스테코글루 감독의 결정은 처음에는 의외로 받아들여졌다""고 했다.

'스퍼스 웹'은 ""소속팀과 국가대표팀에서 주장을 역임하고 있는 손흥민은 토트넘 역사상 최고의 선수 중 하나였을 수도 있지만, 경기에서 언제나 가장 큰 목소리를 내는 리더는 아니""라며 ""실제로 일부 토트넘 팬들은 손흥민의 경기 후 인터뷰에 실망감을 표했다""고 지적했다.

이어 ""크리스티안 로메로가 토트넘의 새로운 주장이 되어야 한다. 로메로는 토트넘을 이끄는 방법을 알고 있다는 것을 증명했다. 그는 유로파리그 결승전에서 주장 완장을 차고 솔선수범하며 팀을 이끌었다""며 로메로가 이번 여름 아틀레티코 마드리드로 떠나지 않는다면 손흥민 대신 로메로에게 주장 완장을 줘야 한다고 주장했다.



매체는 ""토마스 프랭크 감독이 손흥민을 토트넘의 주장으로 임명하는 것은 말이 안 된다. 손흥민은 현재 33세이고 내년 여름 계약이 만료된다. 지난 시즌보다 기량을 끌어올리지 않는 이상 새로운 계약으로 보답받기는 어려울 것""이라며 ""프랭크 감독은 토트넘과 3년 계약을 맺었고, 자신의 임기 동안 토트넘에 머물 선수를 선택하는 게 현명할 것""이라고 했다.

그러면서 ""로메로가 토트넘의 선발 라인업에서 빠질 가능성은 매우 낮다. 따라서 이제 그는 경기장에서 주장을 찰 만한 더 나은 선택지가 됐다""고 덧붙였다.

사진=연합뉴스"
20250721,"'토트넘 1티어 피셜' 충격적이다! 홈팬 야유 받은 손흥민…""쏘니는 볼 컨트롤을 못해""→감독은 로메로와 차별 대우","<저작권자(c) 연합뉴스, 무단 전재-재배포, AI 학습 및 활용 금지>
[스포츠조선 강우진 기자]토트넘이 다음 시즌을 앞두고, 프리시즌에 돌입했다. 손흥민의 기량은 여전히 올라오지 않은 모습이었다. 그만큼 비판의 목소리도 커지고 있다.

영국 풋볼런던은 20일(한국시각) ""브레넌 존슨과 도미닉 솔란케는 전반전에서 다소 둔한 모습이었고, 손흥민과 루카스 베리발 역시 마찬가지였다""라고 전했다. 이는 지난 19일 열린 토트넘과 레딩의 친선경기에 대한 알레스데어 골드의 평가다.

매체는 페드로 포로와 로드리고 벤탄쿠르, 크리스티안 로메로 등에 대해서는 호평했지만, 손흥민에 대해서는 부정적으로 평가했다.

매체는 ""주장 손흥민은 전체적으로 리듬을 찾지 못하고 몇 차례 공을 놓치며 실망스러운 경기를 펼쳤다""라며 ""그럼에도 불구하고 그가 올린 크로스가 막힌 후 이어진 상황과 드리블 중 수비에 막힌 장면이 토트넘의 득점으로 이어진 점은 주목할 만하다""라고 설명했다.

<저작권자(c) 연합뉴스, 무단 전재-재배포, AI 학습 및 활용 금지>
<저작권자(c) 연합뉴스, 무단 전재-재배포, AI 학습 및 활용 금지>
이어 ""손흥민은 해당 경기에서 허공으로 슈팅하는 장면과 단독 돌파 중 공을 제대로 컨트롤하지 못하는 모습 등을 보여줬다""라며 ""이 장면에서는 홈 팬들의 야유가 터져 나왔고, 이후 쿠두스가 넓은 공간에 있던 손흥민에게 패스를 주지 않자 다소 짜증스러운 반응을 보이기도 했다""라고 주장했다.

손흥민의 미래는 여전히 안개 속이다. 토마스 프랭크 토트넘 감독의 발언도 손흥민에게 확신을 주지 않고 있다. 프랭크 감독은 로메로와 손흥민을 대하는 온도가 다른 모습이다.
프랭크 감독은 로메로에 대해 ""그는 우리에게 매우 중요한 선수이며 다음 시즌을 기대하고 있다""라고 말했지만, 손흥민에 대해서는 이러한 발언을 하지 않았다.

프랭크 감독이 손흥민에게 주장직을 계속 맡길 것인지에 대한 질문에 대해 ""좋은 질문이다. 아직 주장에 대해서는 어떤 결정도 내리지 않았다""라며 ""나는 처리해야 할 일이 많고, 우선순위대로 정리해 나가고 있다""라고 말했다. 아직까지 주장 자리를 누구에게 줄지 고민하고 있다는 것이다.

<저작권자(c) 연합뉴스, 무단 전재-재배포, AI 학습 및 활용 금지>
<저작권자(c) 연합뉴스, 무단 전재-재배포, AI 학습 및 활용 금지>
레딩과의 친선 경기에서는 로메로가 전반 45분 동안 주장을 맡았고, 이후 경기가 끝날 때까지는 손흥민이 완장을 찼다. 현재로서는 손흥민이 팀에 남게 된다면 주장직을 박탈당할 확률은 낮다.

매체는 ""손흥민이 확실하게 잔류한다면, 주장 선임을 고민할 필요가 없다""라며 ""팀에서 10년을 헌신한 선수를 두고 주장직을 박탈할 이유는 없을 것""이라고 주장했다.

또한 프랭크 감독은 손흥민이 자신의 거취를 결정하게 될 것인지에 대한 질문에 ""만약 그런 상황이 실제로 일어난다면 까다롭다. 선수가 오랫동안 클럽에 있었다면, 당연히 클럽은 어떤 결정을 내리게 될 것이고, 그 과정에 감독과 구단 고위층이 관여하게 된다""라며 ""만약 선수가 특정 시점에서 이적을 원한다면, 당연히 고려할 수밖에 없고 결국 결정은 클럽이 내릴 것""이라고 답했다."
20250721,"'전반 뛰었는데 또 뛰라고?' 아모림, 맨유 개조 들어간다...하프타임에 추가 러닝 지시","사진 = 풋볼 인사이더


루벤 아모림 감독은 간절하다.

맨체스터 유나이티드는 19일 오후 10시 10분(한국시간) 스웨덴 솔나에 위치한 스트로베리 아레나에서 열린 프리시즌 친선경기에서 리즈 유나이티드와 0-0으로 비겼다.

대부분의 맨유 주전 선수들이 출전했다. 선발 라인업에는 브루노 페르난데스를 비롯하여 신입생 마테우스 쿠냐, 아마드 디알로, 카세미루, 마타이스 더 리흐트, 누사이르 마즈라위 등이 포함됐다. 후반전 시작과 동시에 조슈아 지르크지, 디오고 달로트, 레니 요로, 코비 마이누, 메이슨 망누트가 교체 투입됐다. 맨유는 19번의 슈팅을 때렸는데 무득점에 그치면서 0-0으로 승부를 가리지 못했다.

전반전 맨유는 9번의 슈팅에도 불구하고 단 한 번의 유효 슈팅에 그쳤는데 아모림 감독은 이에 분노한 모양이다. 보통 하프타임에는 후반전 준비나 선수들 휴식이 먼저다. 그러나 아모림 감독은 전반전을 소화한 선수들에게 추가 러닝을 지시했다. 전반전을 소화한 쇼, 페르난데스, 마즈라위, 치도 오비 등은 하프타임에도 러닝하면서 훈련을 이어갔다. 영국 '풋볼 인사이더'는 ""맨유는 리즈전 하프타임에 추가 훈련을 진행했다. 아모림 감독이 팀을 이끌고 있다""라고 말했다.

아모림 감독은 경기가 끝나고 ""프리시즌 경기였다. 우리가 높은 위치에서 압박하려 했을 때 고전했다. 상대가 볼을 차면서 세컨드 볼을 따냈고 그 순간 우리에게 위협을 가했다. 우리 팀의 중앙 페이스가 부족하다. 그래도 우린 기회를 만들어냈다. 해야 할 일이 많지만 프리미어리그 팀을 상대로 좋은 테스트였다""라며 총평을 남겼다.

이어서 ""환경은 정말 좋다고 느낀다. 힘들 때도 있으나 처음부터 느낀 건 우리가 어려움을 겪을 것이라는 점이다. 우리는 노력하고 있고 이것이 모든 것의 시작이다. 우리는 퀄리티를 높여야 하며 경기에서 이겨야 한다. 아직 개선할 점이 많고 당연히 개선할 거다""라며 앞으로의 각오를 밝혔다."
20250721,"'쿠냐 영입 후 첫 경기' 맨유, 무득점으로 마감…아모림 ""연계 플레이 부족했다""","쿠냐/게티이미지코리아
쿠냐/게티이미지코리아

[마이데일리 = 김종국 기자] 맨체스터 유나이티드(이하 맨유)가 리즈 유나이티드와의 프리시즌 경기를 무득점으로 마쳤다.

맨유는 19일(현지시간) 스웨덴 솔나에서 열린 리즈 유나이티드와의 프리시즌 경기에서 득점없이 0-0으로 비겼다. 맨유가 올 여름 이적시장에서 영입한 쿠냐는 이날 경기에서 선발 출전해 팀 공격을 이끌며 맨유에서의 첫 경기를 치렀다.
맨유는 리즈 유나이티드를 상대로 마틴이 공격수로 출전했고 쿠냐와 콜리어가 공격을 이끌었다. 브루노 페르난데스와 카세미루는 중원을 구성했고 레온과 디알로는 측면에서 활약했다. 쇼, 데 리트, 마즈라위는 수비를 맡았고 골문은 바인디르가 지켰다.

맨유는 리즈 유나이티드를 상대로 전반전 동안 득점에 실패한 가운데 후반전 시작과 함께 11명의 선수를 모두 교체하며 다양한 선수들의 경기력을 점검했다. 맨유는 리즈 유나이티드를 상대로 19차례 슈팅을 시도했지만 골을 터트리지 못했다. 쿠냐는 이날 경기에서 전반 45분 동안 활약하며 26번의 볼터치를 기록했다. 세 차례 시도한 드리블 돌파는 한 차례 성공했고 두 차례 파울을 당하기도 했다.

쿠냐는 맨유 데뷔전으로 주목받은 가운데 영국 맨체스터이브닝뉴스는 '쿠냐는 흥미로운 선수였지만 대단하지는 않았다'고 언급하며 평점 7점을 부여했다. 영국 익스프레스는 '쿠냐는 경기 초반 리즈 유나이티드의 볼 소유를 방해하며 몇 차례 파울을 얻어냈다'고 언급했다.

맨유 아모림 감독은 리즈 유나이티드전을 마친 후 쿠냐에 대해 ""지난 시즌 프리미어리그에서 보여줬던 활약을 기대한다. 아직 브루노 페르난데스와 연계 플레이는 부족하다. 우리는 파이널서드에서 위협적인 모습을 높여야 한다""는 뜻을 나타냈다.

맨유는 올 여름 이적시장에서 브렌트포드 공격자원 음뵈모 영입 가능성도 점쳐지고 있다. 반면 래시포드는 팀을 떠날 전망이다.

영국 매체 기브미스포르트는 19일 '맨유는 바르셀로나와 래시포드 임대에 합의했다. 바르셀로나는 영입을 원했던 윌리암스가 아틀레틱 빌바오와 재계약을 체결하고 디아스의 이적료가 너무 높아 래시포드 영입을 최우선 목표로 움직였다. 바르셀로나는 래시포드 영입을 위해 신속하게 움직였고 래시포드는 바르셀로나의 메디컬테스트를 받을 예정'이라고 전했다. 영국 BBC는 20일 '래시포드의 바르셀로나행이 가까워졌다. 맨유와 바르셀로나의 원칙적인 합의가 이뤄졌다'고 언급했다.
래시포드와 아모림 감독/게티이미지코리아"
