date,title,content
20250709,"英 BBC '비피셜' 떴다…맨유 출신 한국 온다! ""1025억에 이적 확정, 거절할 수 없는 제안""","[스포티비뉴스=박대성 기자] 뉴캐슬 유나이티드가 올여름 천문학적인 돈을 쓴다. 맨체스터 유나이티드 출신 앤서니 엘랑가(23)를 영입해 전력을 보강했다. 엘랑가는 뉴캐슬 유나이티드 유니폼을 입고 토트넘 홋스퍼와 한국 투어에 나설 전망이다.

영국 공영방송 'BBC'는 9일(한국시간) ""우리가 파악한 바에 따르면, 뉴캐슬 유나이티드가 이적료 5500만 파운드(약 1025억 원)에 엘랑가 영입을 확정했다. 이번 주 안으로 이적이 공식 완료될 전망""이라고 보도했다.
뉴캐슬 유나이티드는 다음 시즌 유럽축구연맹(UEFA) 챔피언스리그에서 뛰게 되는데 측면에 스피드와 창의력을 불어 넣어줄 선수가 필요했다. 엘랑가는 뉴캐슬 유나이티드의 요구에 완벽하게 부합하는 선수였다.

엘랑가는 12살의 나이에 맨체스터 유나이티드 유소년 아카데미에 입단해 55경기를 소화한 뒤, 2023년 여름 노팅엄 포레스트로 이적했다. 당시 이적료는 약 1500만 파운드였으며, 계약 기간은 5년이었다. 이적 당시만 해도 기대보다는 가능성 위주의 영입으로 여겨졌지만, 그는 2024-25 시즌 프리미어리그에서 6골 11도움을 기록하며 급격한 성장을 보여줬다.

그의 11도움은 지난 시즌 프리미어리그 전체에서 세 번째로 높은 수치로, 리버풀의 모하메드 살라(18도움), 루턴 타운의 조쉬 머피(12도움)에 이어 당당히 랭크됐다. 단순한 윙어가 아닌 '결정적인 장면을 만드는 플레이메이커'로 거듭난 셈이다.



'BBC' 스포츠 소속 분석가 카란 비노드는 ""엘랑가는 단순히 성장 중인 유망주가 아니라, 리그 최상위권 공격 지표를 기록 중인 검증된 자원""이라고 평가했다. 실제 경기당 크로스 6.65회로 뉴캐슬 유나이티드 소속 측면 자원(제이콥 머피, 하비 반스, 앤서니 고든)보다 훨씬 뛰어난 수치였다.

여기에 엘랑가는 프리미어리그 내 공격형 미드필더 및 윙어들 중 상위 20% 이내의 창의성을 보유하고 있었고, 유효슈팅 비율과 전진 드리블 능력까지 최고 수준이었다. 'BBC'는 ""단순히 슈팅을 많이 때리는 것이 아니라 실질적으로 골문을 위협한다. 엘랑가는 좌우 측면은 물론 중앙 공격수까지 가능하다. 멀티 포지션 능력이 좋다. 에디 하우 감독이 지난 1년간 지속적으로 그를 추적해온 이유""라고 보도했다.

뉴캐슬 유나이티드는 이번 여름 이적시장에서 별다른 지출 없이 스페인 말라가 출신 18세 유망주 안토니오 코르데로만을 자유계약으로 영입했다. 실질적인 이적료 투입은 엘랑가가 처음이다.

이는 구단이 엘랑가를 얼마나 중요하게 여기고 있는지를 보여준다. 뉴캐슬은 현재 고든, 반스, 머피 등 재능 있는 윙어들을 보유하고 있으나, 챔피언스리그 병행을 고려할 때 로테이션이 가능한 믿을 만한 자원 확보가 필수였다. 엘랑가는 즉시 주전 경쟁에 나설 수 있는 수준으로 평가된다.



'BBC'는 ""엘랑가는 새로운 세대의 공격을 이끌 자원이며, 뉴캐슬의 유럽 무대 복귀를 위한 핵심 퍼즐 조각""이라고 극찬했다.

물론 노팅엄 포레스트는 엘랑가의 잔류를 원했다. 누누 에스피리투 산투 감독 역시 시즌 종료 후 ""엘랑가 같은 자원은 절대 놓치고 싶지 않다""고 말한 바 있다.

하지만 뉴캐슬이 노팅엄 포레스트 구단 역대 최고 이적료에 해당하는 5500만 파운드를 제안하자 상황이 바뀌었다. 엘랑가는 이적을 강력하게 요청하지 않았지만, 구단 입장에서 재정적 이득이 너무 컸다.

엘랑가는 본래 에버턴 이적이 유력했지만, 당시 스티브 쿠퍼 감독이 설득에 성공하며 노팅엄으로 데려왔다. 그는 지난 시즌 칼럼 허드슨-오도이와 함께 양쪽 측면을 책임지며, 공격진의 핵심으로 활약했다. 이탈리아 출신 공격수 크리스 우드의 리그 20골 중 상당수가 두 윙어의 지원에서 나왔다.

하지만 엘랑가, 라몬 소사(팔메이라스 이적 예정)까지 이탈하면서, 노팅엄 포레스트의 측면 자원은 더 얇아졌다. 이에 따라 PSV 소속 요한 바카요코가 포레스트의 '다음 타깃'으로 주목받고 있다."
20250709,"이강인 초대박! 레알 마드리드 '어부지리' 입성? '1440억 스왑딜' 핵심→…""첫 접촉 이미 이뤄졌다""","사진=SNS
<저작권자(c) 연합뉴스, 무단 전재-재배포, AI 학습 및 활용 금지>
[스포츠조선 강우진 기자]파리 생제르망(PSG)이 레알 마드리드의 공격수 호드리구 영입을 위해 이강인을 협상 카드로 쓰고 있다는 이야기가 나왔다. 사비 알론소 레알 마드리드 감독은 이 스왑딜을 거부한 것으로 알려졌다.

스페인 돈발롱은 8일(한국시각) ""호드리구의 레알 마드리드에서 미래는 여전히 미지수다. 이 공격수는 샤비 알론소 감독 체제에서 확고한 주전으로 자리 잡지 못하고 있다""며 ""다음 시즌에 팀에 잔류할 것으로 보이지는 않는다. 따라서 이번 여름 이적시장 그의 이적과 관련된 소식이 나올 가능성이 있다""라고 보도했다.
호드리구 영입에 큰 관심을 보이는 팀 중 하나는 PSG다. 양측 간 첫 접촉이 이미 이뤄졌다는 이야기가 나온다.

PSG측에서는 호드리구의 영입을 위해 두 명의 선수를 제안했다고 한다. 바로 한국 축구 국가대표 이강인과 밀란 슈크리니아르다.

이 둘은 현재 PSG 소속이지만 루이스 엔리케 PSG 감독의 다음 시즌 구상에서 제외될 확률이 높다. 다만 샤비 알론소 감독은 이강인과 슈크리니아르의 영입을 거절한 것으로 알려졌다.

<저작권자(c) 연합뉴스, 무단 전재-재배포, AI 학습 및 활용 금지>
<저작권자(c) 연합뉴스, 무단 전재-재배포, AI 학습 및 활용 금지>
사진=SNS
<저작권자(c) 연합뉴스, 무단 전재-재배포, AI 학습 및 활용 금지>
매체는 ""알론소 감독과 구단 모두 호드리구에 대한 스왑딜은 고려하지 않는다는 입장이다. 레알 마드리드는 오직 현금 이적만을 원하고 있다""라며 ""실제로 구단은 9000만 유로(약 1440억원) 수준의 이적료를 요구하고 있으며, PSG는 이 금액을 지불하는 데 큰 문제는 없겠지만 현재로서는 다소 신중한 태도를 보이고 있다.

이 스왑딜이 성사된다면 이강인은 명문 구단 레알 마드리드에 입성할 수 있게 된다. 공격진의 여유가 있는 레알 마드리드다. 이번 이적 시장에서 수비와 미드필더 포지션 영입에 관심이 많은 만큼 고려할 수 있는 딜로 여겨진다.

호드리구 입장에서는 PSG로의 이적을 선호할 수 있다. 킬리안 음바페, 비니시우스 주니오르 등에 밀려 팀 내에서 출전 기회를 보장받지 못하고 있다. 2024~2025시즌 유럽축구연맹(UEFA) 챔피언스리그 우승 팀인 PSG는 현존 세계 최강 클럽으로 분류된다. 지금의 레알 마드리드보다 한 수 위라는 평가다.

매체는 ""호드리구는 PSG와 그의 측근 사이에 이뤄진 초기 접촉 이후 프랑스로의 이적에 매우 긍정적인 반응을 보이고 있다""라며 ""알론소 감독하에서 확실한 주전이 아님을 인지한 그는, 유럽 최고의 팀 중 하나에서 커리어를 이어가며 최고 수준에서 주전으로 뛸 수 있는 기회를 원하고 있다""라고 주장했다.

<저작권자(c) 연합뉴스, 무단 전재-재배포, AI 학습 및 활용 금지>
<저작권자(c) 연합뉴스, 무단 전재-재배포, AI 학습 및 활용 금지>
<저작권자(c) 연합뉴스, 무단 전재-재배포, AI 학습 및 활용 금지>
<저작권자(c) 연합뉴스, 무단 전재-재배포, AI 학습 및 활용 금지>
공교롭게도 PSG와 레알 마드리드는 오는 10일 FIFA(국제축구연맹) 클럽 월드컵 4강전에서 맞붙는다. 이 경기는 알론소 감독이 PSG 선수들의 기량을 확인하는 자리가 될 수도 있다. 이강인의 출전과 활약 여부도 관심사다.

호드리구의 이적 이야기는 이제 막 시작됐다. 여름 내내 PSG와 레알 마드리드 간 이적설이 계속해서 거론될 것으로 보인다.

매체는 ""호드리구는 PSG의 관심을 받고 있는 선수 중 하나로서 주요 관심 대상이 될 것이다. 그의 이적은 거래 규모가 큰 만큼, 여름 내내 지속될 가능성이 있다""라며 ""호드리구가 다음 시즌 레알 마드리드에 남지 않을 가능성은 거의 확실해 보인다""라고 전했다."
20250709,"[속보] 韓 축구 역대급 사건…손흥민 ""미국 MLS 거절→1400억 사우디 이적"" 토트넘 떠나 유력 행선지 나왔다! ","[스포티비뉴스=박대성 기자] 손흥민(33)이 토트넘을 떠나기로 결정한다면, 유력한 차기 행선지로 사우디아라비아가 거론되고 있다.

손흥민이 프리시즌을 끝으로 토트넘과 동행을 마무리하고 새로운 도전을 준비 중이라는 분석이 잇따르고 있다. 9일(한국시간) 영국 웹진 '토트넘 홋스퍼 뉴스'와 현지 매체 '미러', '팀토크' 등 다수에 따르면 손흥민이 미국 LA FC의 이적 제안을 거절하고 사우디 클럽들과 협상 테이블에 올랐다.

실제 영국 '토트넘 홋스퍼 뉴스'는 ""손흥민 영입이 가장 유력한 곳은 사우디아라비아 팀이다. 미국 메이저리그사커 LA FC의 제안을 거부한 손흥민은 사우디아라비아행이 유력하다""라고 알렸다.
유명 베팅업체 '스카이벳'은 손흥민이 다음 소속팀으로 사우디 클럽에 합류할 확률을 대략 69.2%로 평가했다. 이는 꽤 압도적인 수치로, 실현 가능성이 매우 높다는 뜻이다.

영국 매체 '팀토크'에 따르면, 사우디아라비아의 복수 구단들은 손흥민에게 연봉 3,000만 유로(약 482억 원), 3년 총액 9000만 유로(약 1,446억 원)라는 천문학적인 조건을 제시했다. 이 조건이 성사된다면 손흥민은 1년에 약 500억 원 가까운 금액을 수령하게 된다. 이는 현존 아시아 축구선수 중 최고 수준일 뿐 아니라, 세계적으로도 손꼽히는 수준이다.



사우디 측이 손흥민에게 적극적인 이유는 명확하다. 유럽 무대에서 오랜 시간 활약해온 손흥민은 아시아 시장을 포함한 전 세계에서 브랜드 가치가 높은 선수다. 사우디는 현재 자국 리그의 글로벌 중계권 판매와 축구 산업 확대를 위해 해외 유명 선수들을 대거 영입 중이며, 손흥민은 그 '프로젝트'의 핵심이 될 수 있다.

영국 공영방송 'BBC', '더 타임즈' 등 신뢰도 높은 언론까지 손흥민과 사우디아라비아를 강하게 연결했다. 매체들은 ""사우디 구단들이 손흥민의 계약이 1년밖에 남지 않은 점을 노리고 있다. 이적료는 물론, 마케팅 효과까지 노릴 수 있다""고 짚었다.

그러나 모든 가능성이 사우디행에 쏠려 있는 것은 아니다. 손흥민이 토트넘에 잔류할 가능성도 여전히 유효하다. 실제로 영국 현지에서는 ""손흥민이 UEFA 챔피언스리그 무대에 대한 미련을 버리지 못했다""는 분석도 나온다.



토트넘 팬들도 다양한 시선이 있다. 일부 팬들은 유로파리그 우승이라는 최종 목표를 이룬 손흥민이 아름다운 이별을 준비할 시점이라고 보고 있는 반면, 또 다른 팬들은 새로운 감독과의 시너지 가능성에 기대를 걸고 있다.

최근 토트넘 소식을 주로 다루는 웹진 '스퍼스웹'이 ""손흥민이 자신의 미래에 대한 결정을 내렸다. 토트넘에서 한 시즌 더 뛰고 싶어 한다. 토트넘을 향한 손흥민의 충성심을 고려하면 놀라운 일이 아니다""라며 잔류를 알린 바 있다.

게다가 손흥민을 향한 관심은 사우디에 국한되지 않는다. 무리뉴 감독이 이끄는 페네르바체는 연봉 2,000만 유로(약 321억 원)를 준비한 것으로 알려졌다. 과거 무리뉴 감독과 좋은 관계를 유지했던 손흥민이기에 가능성은 열려 있다. 그러나 최근 페네르바체는 현실적인 대안으로 아스널의 트로사르 영입에 무게를 싣고 있다.

'풋볼런던' 알레스데어 골드 기자는 ""손흥민이 미국메이저리그사커(MLS) 이적에 관심을 가지고 있다. 물론 여전히 사우디아라비아 팀이 손흥민에게 큰 관심""이라고 알렸다.

2015년 독일 바이엘 레버쿠젠에서 토트넘으로 이적한 손흥민은 10시즌 동안 토트넘 핵심 선수로 활약했다. 454경기 출전, 173골 94도움이라는 대기록을 세웠고 프리미어리그에서 개인 기록까지 상당하다. 이미 토트넘 역사상 최고의 외국인 선수 중 한 명으로 평가받고 있다.

손흥민의 최종 결정은 이제부터 시작이다. 한국에서 휴가를 끝낸 뒤 영국으로 넘어가 프랭크 감독과 직접 면담을 한다.



토마스 프랭크 감독과의 면담이 예정된 자리에서 자신의 미래에 대한 입장을 밝힐 것으로 예상된다. 만약 이 자리에서 이적 의사를 피력한다면, 토트넘은 올여름 안에 손흥민을 매각해 이적료를 확보하려 할 것이다. 반대로 챔피언스리그 출전을 목표로 남겠다는 의사를 밝힌다면, 토트넘은 손흥민을 중심으로 새로운 시즌 구상을 본격화할 것으로 보인다.

토트넘은 프리시즌 기간에 아시아 투어를 고려하고 있고 홍콩에서 아스널, 한국에서 뉴캐슬 유나이티드를 상대한다. '타임즈'에 따르면, 손흥민이 이적을 결정하더라도 여러 계약 문제로 아시아 투어 기간에 작별을 발표하지 않을 예정이다."
20250709,"""레비는 냉정한 인간"" 손흥민, '메디컬 테스트, 프랑크 대면 면담' 앞두고 '청천벽력'→토트넘 '잔류 희망' 박살 났다! ""1,447억 이적료 포기 못 해""","[SPORTALKOREA] 김경태 기자= 손흥민의 잔류 의지와는 별개로 토트넘 홋스퍼가 강제로 그의 매각을 추진할 것이라는 충격적인 주장이 제기됐다.

손흥민의 거취는 현재 축구계에서 초유의 관심사로 손꼽히고 있다. 우선 영국 매체 '풋볼런던'에 따르면 손흥민은 올여름 토트넘에 남고 싶다는 의사를 확고히 하고 있다.



그도 그럴 것이, 손흥민은 토트넘에서만 10년의 세월을 보냈을 뿐만 아니라, 2024/25 유럽축구연맹(UEFA) 유로파리그에서 챔피언으로 등극하며 그토록 염원하던 우승 트로피를 들어 올리는 데 성공했다. 

여기에 더해 UEFA 챔피언스리그 진출도 확정 지은 만큼 더 큰 무대에서 여전히 뛰고 싶은 마음은 분명히 있을 것이다.



다만 상황은 녹록지 않다. 토트넘의 새 사령탑 토마스 프랑크 감독 체제에서 손흥민의 입지는 불확실하다. 주된 이유는 기량 하락. 복수의 현지 매체들은 손흥민의 매각설을 언급할 때마다 그의 체력이 예년보다 못했다는 점을 들어 이적 가능성을 높였다.

또한 손흥민은 이미 사우디아라비아 구단들을 비롯해 튀르키예의 페네르바흐체, 미국의 로스앤젤레스 FC 등 여러 구단으로부터 러브콜을 받은 상태다.

토트넘 역시 손흥민과의 계약까지 1년을 남겨두고 있어, 사실상 이번 여름 이적시장이 수익을 낼 수 있는 마지막 기회인 셈이다.



다행히도 '더선'은 손흥민의 잔류 의지를 강조하며 ""손흥민은 다음 주 팀 훈련장으로 복귀한다. 메디컬 테스트를 소화한 뒤, 프랑크 감독과도 직접 만나 거취에 대한 이야기를 나눌 예정이다""고 보도했다.

또한 토트넘 내부 소식에 정통한 '릴리화이츠'의 운영자 존 웬햄 역시 '토트넘 홋스퍼 뉴스'와의 인터뷰에서 ""손흥민이 잔류를 원한다면 프랑크 감독은 반드시 그를 위한 자리를 마련해야 한다. 반대로 손흥민이 이적을 택한다면, 토트넘은 그에게 최고의 작별 무대를 선사해야 한다""며 이번 이적 시장에서 손흥민의 의견이 가장 최우선이라고 말했다.



그러나 이와는 정반대의 주장이 제기됐다. 토트넘 소식을 주로 전하는 '토트넘HQ'는 손흥민의 선택과는 별개로 구단이 독단적으로 사안을 결정할 것으로 내다봤다. 이에 대해 ""구단 수뇌부의 생각은 다르다. 2026년 계약 만료까지 손흥민을 붙잡아뒀다가 자칫 무상 이적을 허용하게 되면, 토트넘 입장에선 막대한 손실을 감수해야 한다""고 분석했다.

이어 ""특히 다니엘 레비 회장은 언제나 냉정한 결정을 내려왔다. 그는 엔지 포스테코글루 감독 경질 때처럼, 감정보다는 구단의 미래와 수익을 최우선에 두는 인물이다. 현시점에서 토트넘은 손흥민의 이적료로 9,000만 유로(약 1,447억 원)를 책정하고 있다""고 설명했다.

사진=게티이미지코리아

취재문의 sportal@sportalkorea.co.kr"
20250709,"'살려주세요!' '韓 특급 유망주' 양민혁, 토트넘서 프랑크 '지옥 훈련'에 '숨넘어가네'...'재임대론' 등장, '확실한 눈도장 필요'","[SPORTALKOREA] 김경태 기자= 토마스 프랑크 감독의 '지옥 훈련'에 2006년생의 '한국 특급 유망주' 양민혁도 혀를 내둘렀다.

토트넘은 2025/26시즌 앞두고 첫 팀 훈련을 진행했고, 구단은 8일(한국시간) 공식 유튜브 채널을 통해 해당 장면을 담아 영상을 업로드했다.



공개된 영상 속엔 페드로 포로, 도미닉 솔랑케, 제드 스펜스, 루카스 베리발 등 다양한 선수들이 참가했으며, 이들 가운데 임대 복귀한 양민혁도 눈에 띄었다.

프랑크 감독은 첫날부터 강하게 훈련을 진행했다. 선수들은 뙤약볕 아래 그라운드를 누비며 전력을 다했다.



이내 지친 선수들이 속출했다. 스펜스는 아예 주저앉아 카메라를 응시하며 고개를 저었다. 양민혁 역시 세션을 마무리하고 풀썩 쓰러지며 깊은숨을 들이마셨다.

프랑크 감독은 지친 선수들을 향해 미소를 지으며 체력 상태를 확인했다. 이 외에도 드리블, 패싱 등 전반적인 훈련 상황을 지도했다.

양민혁은 이번 프리 시즌 동안 프랑크 감독의 눈도장을 확실히 찍어야 하는 상황이다. 



지난해 겨우 18세였던 양민혁은 강원FC에서 K리그를 흔들며 확실한 존재감을 남겼다. 완성도 높은 경기 운영과 날카로운 움직임을 바탕으로 38경기에서 12골 5도움을 기록했다.

양민혁은 기세를 몰아 손흥민이 뛰고 있는 토트넘으로 이적하며 한솥밥을 먹게 됐다. 다만 유럽 무대의 벽은 높았다. 당시 토트넘을 이끌던 엔지 포스테코글루 감독 아래, 양민혁은 몇 차례 벤치 명단에 이름을 올리는 데 그쳤고, 끝내 데뷔 출전 기회를 잡지 못했다.



결국 양민혁은 실전 감각을 쌓기 위해 지난 1월 퀸즈 파크 레인저스(QPR)로 임대됐다.

후반기 동안 14경기 출전해 2골 1도움을 기록하는 데 그쳤으나, 가능성을 보여주기엔 충분했다. 마르티 시푸엔테스 감독은 양민혁의 잠재력에 칭찬을 아끼지 않았다.

그렇다고 해서 토트넘에서 입지가 높은 것은 아니다. 실제로 영국 매체 '풋볼런던'은 ""양민혁이 1군 경험을 쌓기 위해 또다시 토트넘을 떠나 임대 갈 수 있다""고 설명했다.



여기에 더해 지난달 역시 라이언 메이슨이 지휘 중인 웨스트 브롬위치 알비온(WBA)으로 임대 가능성을 제기했다. 매체는 ""양민혁이 QPR 임대 시절 인상적인 활약을 펼쳤지만, 실력을 갈고닦기 위해 WBA로 임대가 추진될 수 있다""고 짚었다.

때문에 양민혁은 토트넘에 잔류하기 위해 이번 프리시즌에서 자신의 경쟁력을 입증해야 하는 중요한 기로에 서게 됐다.

사진=토트넘 홋스퍼, 한국프로축구연맹, 퀸즈 파크 레인저스, 게티이미지코리아

취재문의 sportal@sportalkorea.co.kr"
20250709,"""손흥민이 그렇게 아꼈지만"" 결혼한 지 2주 만에 '방출' 통보, 실패한 토트넘 '임대생' 베르너…MLS行 거부, 미운털 박혀","베르너 SNS
베르너 SNS
로이터 연합뉴스
[스포츠조선 김성원 기자]손흥민이 아낀 티모 베르너(29)가 갈 곳 없는 신세가 됐다.

첼시와 토트넘의 '먹튀' 베르너는 이미 토트넘 완전 이적이 무산됐다. 독일 출신인 그는 원소속팀인 RB 라이프치히로 돌아갔다. 하지만 라이프치히로부터 '방출'을 통보받은 것으로 전해졌다.
독일의 '빌트'는 8일(한국시각) '베르너는 라이프치히에서 더 이상 뛰지 못할 것이라는 통보를 받았다'고 보도했다. 베르너는 8년간 사귀었던 폴라와 결혼한 지 불과 2주 만에 선수 생명에 최대 위기를 맞았다.

그는 라이프치히와 계약기간이 1년 남았다. 그의 연봉은 860만파운드(약 160억원)다. 라이프치히의 자매클럽인 미국 MLS(미국 메이저리그사커) 뉴욕 레드불스가 영입 제안을 했다.

계약기간은 2년 반, 그러나 연봉이 350만파운드(약 65억원)로 추락했다. 베르너는 이 제안을 거부한 것으로 전해졌고, 라이프치히도 '손절'을 결심했다.

베르너는 2023년 12월 이후 라이프치히의 경기에 나서지 않았다. 그는 지난해 1월 토트넘에 둥지를 틀었다. 그는 첫 시즌 잉글랜드 프리미어리그(EPL)에서 13경기에 출전해 2골 3도움을 기록했다. 막판 햄스트링(허벅지 뒷근육) 부상으로 시즌을 조기에 접었다.

AP 연합뉴스
로이터 연합뉴스
손흥민은 아꼈지만 완전 영입을 놓고 평가가 엇갈렸다. 베르너는 빠른 발을 앞세워 번쩍이기도 하지만 골결정력은 역시 문제였다. 토트넘의 선택은 한 시즌 재임대였다. 완전 영입 옵션도 포함됐다.

하지만 베르너는 반전에 실패했다. 그는 2024~2025시즌 EPL에서 18경기에 출전했지만 선발은 4차례에 불과했다. 골도 없다. 3도움에 불과하다. 모든 대회에선 27경기에서 1골 3도움에 그쳤다.

베르너는 또 한번 햄스트링 부상으로 신음했고, 2월 27일 맨시티전 교체 출전이 마지막이었다. 토트넘은 베르너의 완전 영입에 따른 1200만유로(약 190억원) 옵션을 발동하지 않기로 했다.

엔제 포스테코글루 전 토트넘 감독은 지난해 12월 13일 레인저스(스코틀랜드)와의 유로파리그 리그 스테이지에서 1대1로 비긴 후 베르너를 정면 비판했다. 독일 국가대표 출신인 베르너가 18세 이하 선수보다 못하다고 저격했다.

EPL은 '약속의 땅'이 아니었다. 첼시는 2020년 7월 베르너를 수혈했다. 당시 이적료는 4500만파운드(약 840억원)였다. 그러나 실패작이었다.

그는 두 시즌 첼시에 몸담았다. EPL 56경기에 출전, 10골을 포함해 89경기에서 23골을 기록했다. 베르너는 2022년 8월 친정팀인 라이프치히로 돌아갔다가 토트넘을 통해 EPL로 복귀했다.

그는 토트넘에서도 실패했고, 미래는 안갯속이다."
