date,title,content
20251003,"""이강인 제정신 아냐, 차라리 장비 담당자 넣는 게 나아"" 충격 악평 날린 佛 언론인, 민망해서 어쩌나?→LEE, 바르셀로나 꺾고 PSG 역전승 결과로 증명!","[SPORTALKOREA] 김경태 기자= 이강인이 충격적인 악평을 딛고 파리 생제르맹 FC(PSG)를 승리로 이끌었다.

프랑스 매체 '르 10 스포르트'는 2일(한국시간) ""데지레 두에, 흐비차 크바라츠헬리아, 우스만 뎀벨레가 결장하면서 루이스 엔리케 감독은 FC 바르셀로나전에 나설 PSG 공격진을 재편해야 했다. 이강인이 선발 옵션으로 거론됐으나, 대신 세니 마율루를 기용하는 쪽을 택했다. 베르트랑 라투르의 시각에서는 당연한 선택이었다""고 전했다.

매체는 프랑스 언론인 라투르가 '카날 챔피언십 클럽'에 출연해 발언한 내용을 실었는데, 내용은 가히 충격적이었다. 라투르는 ""엔리케 감독이 마율루를 이강인 대신 쓴다고? 내 생각엔 이강인은 제정신이 아니다. 솔직히 말해, 지금은 차라리 구단 장비 담당자를 넣어도 이강인보다는 나을 거다""고 발언했다.



라투르의 비난과 달리 이강인은 실력으로 증명했다. 2025/26 유럽축구연맹(UEFA) 챔피언스리그 리그 페이즈 매치데이 2 바르셀로나 원정 경기에 출전해 자신의 기량을 십분발휘했다.

후반 35분 마율루를 대신해 교체 투입된 이강인은 날카로운 드리블과 강력한 왼발 슈팅으로 골대를 맞추는 등 바르셀로나 수비진의 간담을 서늘하게 만들었다.

여기에 더해 후반 44분 이강인은 수비 지역에서 과감한 탈압박으로 공격의 물꼬를 텄다. 이어진 볼은 비티냐를 거쳐 하키미에게 연결됐고, 하키미는 중앙으로 침투하던 곤살루 하무스에게 정확한 패스를 내줬다. 하무스는 침착하게 마무리하며 2-1 역전승을 안겼다.



이 밖에도 이강인은 통계 매체 'FotMob' 기준 패스 정확도 11/12 (92%), 기회 창출 3회, 드리블 성공 1/1 (100%), 크로스 정확도 1/1 (100%), 지상 볼 경합 성공 1/1 (100%) 등의 수치를 쌓으며 인상적인 퍼포먼스를 펼쳤다.

이번 결과는 이강인에게 매우 긍정적이다. 현재 PSG는 데지레 두에, 크비차, 뎀벨레 등 주력 공격진이 부상으로 결장해, 이강인이 자신의 존재감을 드러낼 수 있는 기회가 주어진 상황이었다. 특히 전통 강호 바르셀로나를 상대로 보여준 활약은 앞으로 PSG에서 입지를 다지는 데 큰 힘이 될 전망이다.

사진=파리 생제르맹 FC, 게티이미지코리아

취재문의 sportal@sportalkorea.co.kr"
20251003,"손흥민, 메시 이어 역대 2호! 韓 축구 쾌거! '오피셜 공식발표' 터졌다…'SON 전용캠 생긴다' MLS 중계 쏘니만 추적→숨소리까지 전달하다","(엑스포츠뉴스 윤준석 기자) 미국 메이저리그사커(MLS)가 손흥민을 위해 파격적인 실험을 단행한다.

MLS 사무국은 3일(한국시간) 공식 홈페이지를 통해 ""다가오는 LAFC와 애틀랜타 유나이티드의 경기에 '플레이어 스포트라이트(Player Spotlight): LAFC'가 적용된다""고 발표했다.

사무국이 발표한 '플레이어 스포트라이트'란 MLS, 애플TV, 틱톡이 협업해 선보이는 혁신적 생중계 서비스로, 경기 전체를 팀 중심이나 공 중심이 아닌 오직 '선수 중심'으로 보여주는 점이 특징이다.

전용 카메라가 스타 선수 한 명에게 집중해 움직임, 표정, 오프 더 볼 움직임, 심지어 숨소리까지 실시간으로 포착해 전달하며, 시청자는 마치 경기장 안에서 선수를 따라다니는 듯한 몰입형 경험을 할 수 있다.

해당 중계 방식은 지난 2024년 '플레이어 스포트라이트: 메시'에서 처음 도입돼 미국 스포츠 틱톡 라이브 역사상 최다 시청 기록인 640만명 이상의 시청자를 모으는 등 큰 인기를 끈 바 있다.



MLS 사무국은 이번 조치를 통해 ""손흥민, 드니 부앙가, 위고 요리스, 티모시 틸만 등 핵심 선수들의 움직임을 전용 카메라로 90분 내내 따라가며 팬들에게 독창적인 선수 중심 시청 경험을 제공한다""고 밝혔다.

이는 한국 축구 역사에서 손흥민이 차지하는 상징적 위상을 보여주는 장면으로 기록될 전망이다.

MLS는 공식 채널을 통해 ""'Player Spotlight: LAFC'를 선보이게 돼 기쁘다”며 ""팬들에게는 마치 경기장 속으로 들어가는 듯한 경험을 제공할 것""이라고 밝혔다.

이번 스포트라이트는 MLS, LAFC, AppleTV 공식 틱톡 계정을 통해 전 세계 팬들에게 생중계되며, 부앙가 본인의 틱톡 계정(@d.bouanga)에서도 진행된다.



틱톡 글로벌 스포츠 파트너십 책임자 롤로 골드스타우브는 해당 발표와 함께 ""플레이어 스포트라이트 시리즈의 모멘텀을 이어가, 손흥민과 LAFC 슈퍼스타들을 전 세계 팬들에게 독점 제공할 수 있게 됐다""며 ""실시간으로 선수들과 연결되는 전례 없는 접근성을 제공할 것""이라고 강조했다.

MLS 미디어 담당 세스 베이컨 역시 ""플레이어 스포트라이트는 선수와 팬을 더 가깝게 연결해주는 방식이기에 인기를 얻고 있다""며 ""오늘날 팬들의 참여 방식을 고려할 때, 손흥민같은 슈퍼스타는 이 시리즈의 완벽한 주인공""이라고 평가했다.
이번 프로젝트는 지난해 진행된 '플레이어 스포트라이트: 메시'의 성공에 이은 연장선으로, 손흥민 같은 슈퍼스타에게 완벽히 맞는 플랫폼으로 평가된다.

LAFC의 몇몇 다른 선수들 움직임도 포착하지만 핵심은 역시 손흥민이다. 손흥민의 맹활약아 나오면서 이번 LAFC 선수별 카메라가 생겼다고 해도 과언 아니다.



손흥민 합류 이후 LAFC의 화력은 가히 압도적이다.

손흥민은 이적 후 8경기에서 8골 3도움을 기록하며 리그 최고의 슈퍼스타로 자리매김했다. 특히 솔트레이크전 해트트릭과 세인트루이스전 멀티골은 MLS 팬들을 열광시켰다.

기존 팀 내 에이스였던 부앙가와의 호흡도 화제다. 최근 LAFC의 17골이 모두 손흥민과 부앙가의 발끝에서 나왔는데, 이는 MLS 역사상 최다 합작 득점 기록을 넘어섰다.

또한 지난 14일 산호세전에서 부앙가, 18일 솔트레이크전에서 손흥민, 22일 다시 부앙가가 해트트릭을 기록하며 MLS 최초로 세 경기 연속 팀 해트트릭 기록도 달성했다. 

실제로 부앙가는 현재 23골로 리그 2위이며, 24골의 리오넬 메시(인터 마이애미)를 1골 차로 추격 중이다.

글로벌 스포츠 매체 '디 애슬레틱'은 ""손흥민과 부앙가는 MLS에서 본 적 없는 공격 듀오""라며 ""만약 현재의 폼을 플레이오프까지 유지한다면, LAFC는 가장 상대하기 어려운 팀이 될 것""이라고 분석했다.

이제 손흥민은 메시, 즐라탄 이브라히모비치, 데이비드 베컴 등 과거 MLS를 빛낸 슈퍼스타들에 이어, 단기간에 리그 전체의 주목을 독식한 새로운 아이콘으로 평가받고 있다.



이러한 파급력에 힘입어 오는 6일 애틀랜타전은 한국 축구 역사상 최초로 손흥민 전용 카메라가 투입되는 상징적인 무대다.

그의 숨소리, 표정, 공이 없을 때 움직임까지 기록될 이번 중계는 손흥민이 '메시급 슈퍼스타'라는 평가가 결코 과장이 아님을 입증하는 순간이 될 것으로 보인다.

한편, 다가오는 애틀란타전은 LAFC에게 있어 서부 정상 경쟁에 본격적으로 뛰어오를 수 있는 분수령으로 작용할 전망이다.

현재 LAFC는 최근 4연승을 달리며 서부 콘퍼런스 4위(승점 53)에 올라 있고, 선두 샌디에이고FC(승점 57)와도 불과 4점 차다.

남은 4경기를 모두 승리하면 승점 65점까지 도달할 수 있고, 이는 선두 샌디에이고를 따라잡을 수 있는 수치다. 무엇보다 4위 자리를 벗어나야 다가오는 플레이오프 1라운드에서 서부 콘퍼런스 5위인 시애틀 사운더스와 조기 격돌을 피할 수 있다는 점에서 순위 상승은 절실하다.



애틀랜타는 올 시즌 내내 반등하지 못하며 사실상 플레이오프 희망이 사라진 상태다. 

MLS 공식 홈페이지 역시 이번 LAFC와 애틀랜타 간의 맞대결을 두고 ""이번 시즌 가장 대조적인 팀들의 만남""이라고 설명하며 두 팀의 전력 차이를 강조했다.

손흥민을 경기 내내 따라다니는 카메라 중계 화면에 득점을 기록하는 장면 역시 기록될 수 있다는 기대감이 드는 이유다.

다가오는 애틀란타전이 손흥민의 스타성을 전 세계에 다시 한번 각인시키는 계기가 될 수 있을지 기대가 모인다.

사진=연합뉴스/MLS/LAFC"
20251003,"'대충격' 엘링 홀란드, 맨체스터 시티 퇴단 고려...'9년 6개월' 재계약 후 극심한 좌절감 느낀다","엘링 홀란드/게티이미지코리아

[마이데일리 = 최병진 기자] 엘링 홀란드가 맨체스터 시티의 상황에 좌절감을 느끼고 있다는 소식이다.

영국 ‘미러’는 3일(이하 한국시각) “홀란드는 현재 팀의 상황에 매우 불만을 가지고 있다. 그는 팀의 스쿼드 운영과 함께 올시즌 부진 등에 좌절감을 느끼며 이적도 고려하고 있다”고 보도했다.

홀란드는 현재 세계 최고의 9번 공격수다. 2022-23시즌에 도르트문트를 떠나 맨시티에 합류한 홀란드는 압도적인 득점력을 자랑하기 시작했다.
홀란드는 첫 시즌부터 전체 53경기 52골로 잉글랜드 프리미어리그(EPL) 득점왕을 차지하며 맨시티의 트레블을 이끌었다. 다음 시즌에도 리그 27골로 2년 연속 득점 1위에 올랐고 지난 시즌에는 모하메드 살라(리버풀)에 이어 득점 2위에 올랐다.

지난 1월에는 초장기 재계약도 체결했다. 홀란드는 무려 2034년까지 9년 6개월의 재계약을 체결하며 사실상 맨시티 종신을 선언했다.

엘링 홀란드/게티이미지코리아

하지만 최근 분위기는 좋지 않다. 맨시티는 지난해 프리미어리그 3위에 머물렀고 유럽축구연맹(UEFA) 챔피언스리그(UCL)에서도 녹아웃 플레이오프에서 탈락했다. 유일한 트로피가 시즌 전에 진행된 커뮤니티 실드로 아쉬움을 남겼다.

문제는 올시즌 초반에도 유사한 흐름이라는 점이다. 맨시티는 리그에서 3승 1무 2패 7위로 펩 과르디올라 감독 체제에서 최악의 출발을 보이고 있다. 지난 2일에 펼쳐진 AS모나코와의 UEFA 챔피언스리그 리그 페이즈 2차전에서는 홀란드의 멀티골에도 후반 막판에 극장골을 허용하며 2-2로 비겼다.

이러한 상황으로 홀란드의 불만까지 전해졌다. 매체에 따르면 홀란드는 최근 팀의 경기력과 함께 다른 클럽에 비해 스쿼드 뎁스가 풍족하지 않은 맨시티의 스쿼드 운영에 대해 만족을 하지 못하고 있다.

엘링 홀란드/게티이미지코리아

공교롭게 최근 이적설까지 전해졌다. 스페인 '엘 나치오날'은 지난달 ""바르셀로나는 홀란드 영입을 절대적으로 원하고 있다. 후안 라포르타 회장은 그의 영입을 확신하고 있다""고 주목했다."
20251003,"韓 축구 역사상 최초 사건…""90분 내내 손흥민 숨소리까지 포착"" MLS '오피셜' 공식발표 ""전용 중계카메라 확정"" 전 세계에 스트리밍 예정 '메시급 슈퍼스타 위용'","[스포티비뉴스=박대성 기자] 손흥민(33, LAFC)의 숨소리까지 들을 수 있다. 90분 내내 손흥민만 따라다니는 전용 카메라가 등장한다.

MLS 사무국은 3일(한국시간) 공식 홈페이지를 통해 ""오는 6일 오전 10시(한국시간) BMO 스타디움에서 열리는 LAFC와 애틀랜타 유나이티드의 경기에 '플레이어 스포트라이트'를 적용한다""고 발표했다.

미국 메이저리그사커(MLS)가 또 역대급 시도를 한다. 손흥민을 포함한 팀 핵심 선수들만을 비추는 전용 중계 카메라(Player Spotlight)가 공식적으로 도입된다. 전 세계 팬들에게 독점적인 시청 경험을 제공할 예정이다. 이는 한국 축구 역사상 최초의 사례이자, 손흥민의 위상을 그대로 보여주는 상징적인 장면으로 기록될 전망이다.
이번 특별 중계는 손흥민, 드니 부앙가, 위고 요리스, 티모시 틸만 등 팀의 슈퍼스타들만을 전용 카메라로 90분 내내 따라다니며 팬들에게 독창적인 '선수 중심' 화면을 제공하는 방식이다. 단순 경기 장면이 아니라, 선수 개개인의 움직임과 반응까지 담아내 축구 팬들의 몰입도를 극대화할 것으로 기대된다.

틱톡 글로벌 스포츠 파트너십 책임자 롤로 골드스타우브는 ""플레이어 스포트라이트 시리즈의 모멘텀을 이어가 'LAFC 편'을 선보이게 돼 기쁘다""며 ""손흥민을 포함한 스타 선수들의 모든 순간을 전 세계 팬들에게 독점적으로 제공할 것""이라고 밝혔다.



이번 결정은 단순한 마케팅을 넘어, 손흥민이 MLS에서 차지하는 상징적 위상을 보여준다. 올여름 합류한 손흥민은 두 달 만에 리그를 흔드는 슈퍼스타로 자리매김했다.

특히 '흥부 듀오'로 불리는 손흥민-부앙가 조합은 MLS 공격 판도를 뒤바꾸고 있다. 부앙가는 최근 4경기에서 8골 3도움(해트트릭 2회)을 기록했고, 손흥민은 같은 기간 7골 1도움(해트트릭 1회)을 터트리며 폭발적인 득점력을 과시했다.

흥미로운 점은 LAFC가 최근 17골을 기록하는 동안 모두 손흥민 혹은 부앙가의 발끝에서 나왔다는 사실이다. 미국 '스포츠 일러스트레이트'는 ""이 합작 득점 기록은 MLS 역사상 최다 기록을 넘어섰다""며 ""손흥민과 부앙가는 미쳤다""고 극찬했다.

이들의 득점 행진은 각종 신기록으로 이어졌다. 지난 14일 산호세전에서 부앙가, 18일 솔트레이크전에서 손흥민, 22일 솔트레이크전에서 다시 부앙가가 해트트릭을 작성하며 MLS 최초 '3경기 연속 팀 해트트릭'기록을 세웠다.

MLS 사무국은 공식 사회관계망서비스(SNS)를 통해 ""LAFC는 MLS 역사상 최초로 세 경기 연속 해트트릭을 배출한 팀""이라고 강조하며 손흥민-부앙가 콤비를 집중 조명했다.

득점왕 레이스도 치열하다. 현재 부앙가는 23골로 리그 2위에 올라 있으며, 24골의 리오넬 메시(인터 마이애미)를 단 한 골 차로 추격 중이다. 손흥민이 함께 뛰는 동안 그의 득점왕 도전은 현실화될 가능성이 크다.



손흥민 합류 이후 LAFC는 단숨에 MLS컵 우승 후보로 떠올랐다. 미국 스포츠 매체 '디 애슬레틱'은 ""손흥민과 부앙가는 MLS에서 본 적 없는 공격 듀오다. 이들이 현재의 폼을 플레이오프까지 유지한다면 LAFC는 가장 상대하기 어려운 팀이 될 것""이라고 평가했다.

실제로 LAFC는 최근 리그 4연승을 달리며 서부 컨퍼런스 4위(승점 53)를 기록 중이다. 플레이오프 진출은 사실상 확정된 가운데 MLS컵 플레이오프를 앞두고 가파른 상승세를 이어가려고 한다.

이번 전용 카메라 배치는 손흥민이 단순한 '아시아 스타'가 아닌, MLS 전체의 중심 슈퍼스타로 인정받았다는 방증이다. 리그는 이미 메시, 이브라히모비치, 베컴 등 세계적인 스타들을 맞이한 바 있지만, 손흥민은 짧은 기간 안에 리그 전반의 화제를 독식하며 새로운 역사를 써 내려가고 있다.

MLS 미디어 담당 부사장 세스 베이컨은 ""플레이어 스포트라이트가 팬들의 큰 호응을 얻는 이유는 선수 개개인과 더욱 가까이 연결되기 때문""이라며 ""오늘날 팬들의 참여 방식을 고려할 때, 손흥민 같은 슈퍼스타가 이 시리즈의 완벽한 주인공""이라고 평가했다.

6일 애틀랜타 유나이티드와의 경기는 단순히 또 하나의 정규리그 경기가 아니다. 한국 축구 역사상 최초로 손흥민 전용 카메라가 등장하는 순간이며, 전 세계 팬들이 실시간으로 그의 움직임을 독점 시청하게 되는 상징적인 무대다.

손흥민이 보여줄 경기력, 그리고 부앙가의 득점왕 경쟁은 이번 전용 중계 카메라를 통해 더욱 생생하게 기록될 것이다. '메시급 슈퍼스타'라는 표현이 과장이 아님을 증명할, 새로운 축구 역사의 장이 열리고 있다."
20251003,"'英 BBC 충격 평가' 손흥민 없는 포스테코글루, 100년 만에 '최악의 기록' 작성! 韓 국대에게 '와르르' 패배...""3주 만에 경질 요구 속출""","로이터연합뉴스
로이터연합뉴스
[스포츠조선 이현석 기자]엔제 포스테코글루 감독이 또 승리를 챙기지 못했다.

노팅엄 포레스트는 3일(한국시각) 영국 노팅엄의 시티 그라운드에서 열린 미트윌란과의 2025~2026시즌 유로파리그 리그 페이즈 2차전 원정 경기에서 2대3으로 패배했다.

노팅엄은 지난 레알 베티스와의 1차전 2대2 무승부에 이어 미트윌란에 패하며 유로파리그에서 고전을 면치 못하고 있다. 무려 25위까지 추락하며, 토너먼트 진출에도 적신호가 켜졌다. 또한 포스테코글루 감독 부임 후 6경기에서 2무4패로 최악의 부진이 이어지고 있다.

로이터연합뉴스
미트윌란에서는 조규성이 선발로 나서고, 이한범이 벤치에서 대기했다. 포스테코글루 감독은 앞서 사전 기자회견에서 셀틱 감독 시절에 대해 언급하며 ""조규성을 영입하려 했는데 거절당했다""고 뒷얘기를 웃으며 털어놓기도 했다.

다만 경기에서 포스테코글루 감독은 웃지 못했다. 전반 18분 조규성이 우측에서 얻어낸 프리킥을 키커로 나선 아랄 심시르가 박스 안으로 전달했다. 이를 마스 베흐 쇠렌센이 헤더로 연결했고, 우스만 디아오가 문전에서 밀어넣으며 선제골을 터트렸다. 노팅엄도 밀리지 않았다. 4분 후에 딘 은도이의 동점골로 경기를 원점으로 돌렸다.
미트윌란은 계속해서 앞서 나갔다. 전반 24분 코너킥 상황에서 쇠렌센이 이번에는 직접 마무리하며 다시 리드를 잡았다. 전반은 2-1, 미트윌란의 리드로 마무리됐다.

후반에도 먼저 포문을 연 쪽은 미트윌란이었다. 후반 43분 역습 상황에서 다리오 오소리오의 패스를 받은 안드레아센이 쐐기골을 터트렸다. 후반 추가시간 크리스 우드의 페널티킥 득점이 터졌으나, 동점까지 만들기에는 시간이 역부족이었다. 결국 경기는 미트윌란의 3대2 승리로 마무리됐다.

로이터연합뉴스
경기 후 팬들의 야유를 받은 포스테코글루 감독은 ""팬들이 실망했을 것이다""며 ""나는 팬들의 의견을 들었다. 축구에서는 놀랍지 않은 일이다. 우리가 처한 환경이다. 내가 어떻게 할 수 있는 것은 아니다. 나의 책임은 구단을 승리하게 하고, 발전시키는 것이다. 축구에서는 이겨야만 시각을 바꿀 수 있다. 그럼에도 내가 처리하는 방식을 바꾸지는 않을 것이다. 우리가 하는 일을 진심으로 믿고, 처한 상황을 끊어내면 원하는 결과를 얻을 팀이 되는 것에 멀리 있지 않다""고 주장했다.

하지만 그를 향한 최악의 평가는 이미 등장하고 있다. 영국의 BBC는 '포스테코글루는 노팅엄을 지휘한 6경기에서 승리를 거두지 못했다. 그는 100년 만에 처음으로 노팅엄 정식 감독 부임 후 6경기에서 한 번도 승리하지 못한 사람이 됐다. 많은 노팅엄 팬들은 이번 경기 세 번째 실점이 터진 후 아침에 경질당할 것이라고 그를 향해 외쳤다'라고 언급했다.

지난 시즌 토트넘에서 유로파리그 우승까지 거머쥐며, 아쉬운 리그 성적을 만회했던 포스테코글루는 올 시즌 노팅엄에서 최악의 위기 상황에 놓였다. 당장 승리하지 못한다면, 올 시즌 곧바로 팀을 떠나야 할 가능성도 배제할 수 없다."
20251003,손흥민 초대받았다! '美서 엄청난 인기' MLB→이번엔 미식축구에 떴다... LA 램스 방문,"[스타뉴스 | 이원희 기자]
NFL을 찾은 손흥민. /사진=LA 램스 SNS
LA 램스의 푸카 나쿠아와 손흥민(오른쪽). /사진=LA 램스 SNS
'캡틴' 손흥민(33·LAFC)가 미국에서 엄청난 인기를 자랑했다. 이번에는 미식축구에 떴다.

손흥민은 3일(한국시간) 자신의 SNS에 ""램스, 나를 초대해줘서 고마워""라는 글과 함께 미국 미식축구리그(NFL) LA 램스 구단의 홈구장 소파이 스타디움의 모습을 업로드했다.

LA 램스 구단 역시 손흥민의 소파이 스타디움 방문 소식을 전했다. 손흥민은 NFL 팬들의 뜨거운 환영을 받으며 자신의 시그니처 '찰칵 세리머니'를 선보였다. 또 LA 램스 선수 푸카 나쿠아와 유니폼을 맞바꾸며 기념샷을 찍기도 했다.
미국프로축구(MLS) LAF에서 뛰는 '에이스' 손흥민이지만, 축구 외적으로도 바쁜 시간을 보내고 있다. 그중 하나가 다른 스포츠의 LA 연고팀을 찾으며, 특별한 추억을 쌓고 있다.

앞서 손흥민은 지난 1일 미국프로야구(MLB) LA 다저스의 홈구장 다저스타디움을 찾기도 했다. 손흥민은 ""렛츠고, 다저스!""라고 응원 글을 남겼고, 다저스의 앤드류 프리드먼과 유니폼을 들고 기념샷도 남겼다. 당시 다저스는 손흥민의 응원에 힘입어 신시내티 레즈전에서 10-5 완승을 거뒀다.

LA다저스의 앤드류 프리드먼과 손흥민(오른쪽)이 기념샷을 찍고 있다. /사진=LAFC SNS
손흥민은 다저스 선수들의 뜨거운 응원을 받은 바 있다. 다저스에 뛰는 한국 야구선수 김혜성, 다저스의 에이스 블레이크 스넬이 지난 달 22일 LAFC 홈경기장 BMO 스타디움을 방문했다. 손흥민도 김혜성, 스넬의 응원에 힘입어 레알 솔트레이크전에서 1골 2도움 폭풍활약을 펼쳤다. 손흥민은 경기가 끝난 뒤 김혜성, 스넬과 함께 승리 세리머니도 펼쳤다. 손흥민은 이에 대한 보답으로 다저스타디움을 찾은 것으로 보인다.

직전 세인트루이스전을 치른 손흥민의 다음 경기는 오는 6일 애틀랜타 유나이티드와 홈경기다. 일정이 넉넉한 편이고, 홈에서 치르는 경기여서 이동에 대한 부담도 없다. 덕분에 개인 시간을 많이 얻은 것으로 보인다. 다저스 구단에 이어 램스 구단의 초청을 받아 NFL을 찾았다. 램스 구단은 ""손흥민이 소파이 스타디움을 처음 방문했다""고 반겼다.

손흥민. /사진=LA 램스 SNS"
