date,title,content
20250818,'아스널 임대 협상' 이강인 7.5점 펄펄 날았다…리그1 개막전 61분 활약→권혁규·홍현석과 '코리안 더비',"(엑스포츠뉴스 김현기 기자) 올 초부터 이적설에 휩싸였던 미드필더 이강인이 소속팀인 프랑스 최고 명문 파리 생제르맹(PSG) 새 시즌 개막 2경기에 연속 출전했다.

이강인의 입지가 나아질 수 있음을 보여주는 대목이다. 물론 큰 경기에서도 주전으로 기용될지는 미지수가. 일단 시즌 초반 활발한 몸놀림을 보여주며 컨디션이 좋다는 것을 증명한 것에 의미가 있다. 최근 잉글리시 프리미어리그 명문 아스널이 이강인 임대를 위해 노력하고 있다는 보도도 나온 터라 향후 그의 거취가 주목된다.

이강인의 상대팀 낭트에선 한국인 듀오 권혁규와 홍현석이 나란히 첫 선을 보였다. 프랑스에서 모처럼 '코리안 더비'가 성사됐다.
PSG는 18일(이하 한국시간) 프랑스 낭트의 스타드 드 라 보주아르에서 열린 2025-2026시즌 프랑스 리그1 1라운드 원정 경기에서 후반 22분 터진 비티냐의 결승 골로 낭트에 1-0으로 이겼다.

최근 리그1 4연패를 달성한 PSG는 5시즌 연속 우승을 위한 시동을 힘차게 걸었다.

나흘 전 유럽축구연맹(UEFA) 슈퍼컵 토트넘 홋스퍼(잉글랜드)와 단판 승부에서 후반 교체로 들어가 천금 같은 추격 골을 넣고 우승에 보탬이 됐던 이강인은 이날 낭트전에선 선발 출전한 뒤 61분을 뛰고 0-0으로 맞선 후반 16분 PSG 공격진 최고 신성으로 꼽히는 데지레 두에와 교체됐다.



올여름 나란히 낭트에 동반 이적한 한국인 미드필더 두 명도 모습을 드러냈다. 상무를 제대해 군 문제를 해결한 뒤 지난 두 시즌 스코틀랜드 프리미어십에서 활약했던 권혁규는 선발 출전한 뒤 이강인보다 더 많은 79분을 뛰었다. 독일 마인츠에서 1년 만에 옮긴 홍현석은 후반 14분 교체로 들어가 종료 휘슬이 울릴 때까지 뛰었다.

후반 14분부터 이강인이 빠져나간 후반 16분까지 2분간 한국 선수 3명이 한 그라운드에서 땀을 흘린 셈이다.

이날 PSG에선 루카스 슈발리에 골키퍼를 비롯해 뤼카 에르난데스, 루카스 베랄두, 일리야 자바르니, 워렌 자이르-에메리, 마누엘 우가르테, 비티냐, 이강인, 이브라힘 음바예, 곤살루 하무스, 브래들리 바르콜라 등이 선발로 나섰다.

홈팀 낭트에선 앙토니 로페스가 문지기로 나섰고, 니콜라스 코자, 타이럴 타티, 치도지 아와지엠, 켈빈 아미안, 루이스 르로, 요안 레프낭, 권혁규, 바흐레바 기라시, 무스타파 모하메드, 야신 벤하탑이 전반 킥오프 때부터 출격했다.

PSG는 이날 경기에서 전반을 득점 없이 마친 뒤 교체투입된 누누 멘드스의 후반 22분 패스를 받은 비티냐가 오른발 중거리슛을 시도한 것이 상대 수비수를 맞고 골문 안으로 들어가면서 선제 결승포를 얻고 이겼다.



PSG는 후반 31분 하무스가 한 번 더 골망을 출렁였으나 비디오판독 끝에 오프사이드로 취소됐다.

UEFA 슈퍼컵을 승부차기까지 가는 혈투로 치르느라 주전급들의 체력 소모가 심했던 PSG는 이날 로테이션 멤버들이 대거 선발 출전한 뒤 후반에 멘드스, 아슈라프 하키미, 우스망 뎀벨레, 흐비차 크바라츠헬리아 등 지난 시즌 UEFA 챔피언스리그 우승 주역들이 대거 들어가 결승포를 터트리고 승리를 챙겼다.

다만 이강인 역시 교체아웃될 때까지 부지런히 뛰었다. 전반 9분 크로스가 같은 한국 선수 권혁규에게 막히는 이색 장면도 있었다.

축구 통계 전문 풋몹에 따르면 이강인은 이날 패스 성공률 92%(62회 중 57회)에 기회 창출 3회, 슈팅 2회 등을 기록했다. 평점은 7.5점을 받아 선발 출전한 선수들 중 결승포를 넣은 비티냐(8.5점), 수비수 자이르-에메리(8.0점), 이날 리그1 데뷔전을 치른 자바르니(7.6점)에 이어 팀내 4위를 차지했다.



권혁규는 패스 성공률 73%(15회 중 11회)에 차단 3회, 지상 볼 경합 성공률 100%(3회) 등을 기록했고, 홍현석은 한 차례 슈팅과 패스 성공률 71%(7회 중 5회) 등의 성적을 남겼다. 

한편, 이강인은 이적시장 막바지에 접어들면서 아스널과 다시 연결되고 있다. '저스트 아스널'은 17일 이강인 임대를 놓고 아스널과 PSG가 협상 중이라고 밝혔다.

이강인은 지난 1월에도 아스널과의 임대설에 휩싸인 적이 있었다. 당시엔 글로벌 유력 매체인 '디 애슬레틱'이 이강인의 아스널 선임대 후이적 보도를 내놔 시선을 끌었다.

이후 조용했던 이강인의 거취는 지난 5월 이탈리아 세리에A 챔피언 나폴리 이적 가능성으로 한 번 더 불이 붙었으나 지금은 사라진 상태다. PSG도 이강인에 대한 재계약 제의 등을 하는 것으로 알려졌다.

사진=연합뉴스"
20250818,"'英 BBC' 이어 'HERE WE GO' 까지 토트넘, 매디슨+손흥민 공백 메울 대체자 영입 임박…""회장 간 이적 논의""","[SPORTALKOREA] 황보동혁 기자= 토트넘 홋스퍼가 드디어 제임스 매디슨과 손흥민(로스앤젤레스 FC)의 공백을 동시에 메울 수 있는 카드로 크리스탈 팰리스 에베레치 에제 영입에 근접했다.

이적시장 전문가 파브리시오 로마노 기자는 18일(이하 한국시간) ""토트넘 회장 다니엘 레비와 팰리스 회장 스티브 패리시가 에제 이적 문제를 놓고 직접 접촉했다""고 보도했다.

보도에 따르면 토트넘은 총 6,000만 파운드(약 1,126억 원) 규모의 조건을 준비 중이다. 구체적으로는 5,500만 파운드(약 1,032억 원)의 확정 이적료에 500만 파운드(약 93억 원)의 보너스를 더하는 형태다.



손흥민의 LAFC 이적과 매디슨의 장기 부상 이탈로 공격과 창의력을 동시에 보강해야 하는 상황에서, 에제 영입은 토트넘의 최우선 해법이 될 전망이다.

에제는 2020년 여름 팰리스에 입단한 뒤 프리미어리그 정상급 선수로 성장했다. 초기에는 측면에서 주로 뛰었지만 2022/23시즌부터 공격형 미드필더로 완전히 자리 잡으며 기량이 폭발했다.



해당 시즌 40경기 10골 4도움을 기록했고, 2024/25시즌에는 43경기에서 14골 11도움으로 절대적인 에이스로 군림했다. 특히 FA컵 결승전에서 맨체스터 시티를 상대로 결승골을 터뜨리며 구단 창단 120년 만의 첫 메이저 대회 우승을 이끌며 존재감을 증명했다.

올 시즌 개막을 알린 커뮤니티 실드에서도 공격포인트는 없었지만 날카로운 드리블과 패스로 리버풀 수비진을 흔들며 여전한 위력을 보여줬다.



한편 에제 역시 사실상 결별을 준비하는 듯한 태도를 보이고 있다.

영국 공영 방송 BBC에 따르면 에제는 지난 17일 첼시와의 프리미어리그 개막전 종료 후 원정석을 찾아 팬들에게 손을 모으고 박수를 보내며 작별 인사를 건넸다. 팰리스 팬들도 헌신해온 에제에게 감사의 마음을 전하며 그의 이적을 사실상 받아들이는 분위기다.

사진= 토크스포츠, 게티이미지코리아, BBC 스포츠 

취재문의 sportal@sportalkorea.co.kr"
20250818,"""나 아모림이야"" 피도 눈물도 없는 맨유, 1350억 '먹튀' 호일룬 '아웃'…강력한 잔류 희망에도 엔트리 제외 '초강수'","로마노 SNS
로이터 연합뉴스
AP 연합뉴스
[스포츠조선 김성원 기자]루벤 아모림 맨유 감독의 리더십은 냉혹하다. 길이 어긋나면 돌이키질 않는다.

마커스 래시포드는 바르셀로나로 떠났다. 알레한드로 가르나초, 안토니도 돌아올 수 없는 다리를 건넜다. 에릭 텐 하흐 감독 시절 지워진 제이든 산초도 복귀는 없다.
그리고 또 한명이 맨유를 떠난다. 라스무스 호일룬(22)이다. 맨유는 18일(이하 한국시각) 영국 맨체스터의 올드트래포드에서 아스널과 2025~2026시즌 잉글랜드 프리미어리그 1라운드를 치렀다.

새 영입인 마테우스 쿠냐, 브라이언 음뵈모가 선발 출격했다. 벤자민 세스코는 후반 교체로 그라운드를 밟았다. 그러나 호일룬은 엔트리에서 제외됐다. 이별을 의미한다.

영국의 'BBC'는 '아모림 감독이 호일룬의 미래에 대한 엄청난 추측 속에서 이러한 결정을 내린 것으로 알려졌다. 그는 맨유에 남기를 강력히 희망했지만, 세스코의 영입으로 기회가 현저하게 제한될 가능성이 높다'고 분위기를 전했다.

유럽이적시장 전문가 파브리지오 로마노는 '호일룬이 오늘 엔트리에 제외되면서 확실히 관계가 끝났다. 호일룬는 맨유에 남아 기회를 잡고 싶다고 주장했지만 아모림 감독과 구단은 엔트리 제외라는 명확한 메시지를 보냈다'며 '호일룬은 곧 떠날 예정이며, AC 밀란과 두 개의 클럽이 임대 계약에 열을 올리고 있다. 맨유는 현재 계약 옵션을 검토하고 있다'고 강조했다.

AFP 연합뉴스
로이터 연합뉴스
AFP 연합뉴스
냉정한 승부의 세계일 뿐이다. 맨유는 2023년 8월 덴마크 출신의 호일룬을 옵션을 포함해 7200만파운드(약 1350억원)에 영입했다. 하지만 실패한 영입이었다.

그는 두 시즌 EPL에서 62경기에 출전해 14골에 그쳤다. 2024~2025시즌에는 단 4골의 굴욕을 낳았다. 모든 대회에선 95경기에서 26골을 기록했다.

호일룬은 미국에서 열린 맨유의 프리시즌에는 함께했다. 9일 피오렌티나와의 프리시즌 마지막 리허설에선 벤치를 지켰다. 그러나 세스코가 맨유에 둥지를 틀면서 설자리를 잃었다.

맨유는 이날 아스널에 0대1로 패했다. 세트피스에서 희비가 엇갈렸다. 전반 13분이었다. 안드레 오나나 대신 선발 기회를 잡은 맨유 골키퍼 알타이 바이은드르가 윌리엄 살리바와 자리다툼하다 크로스된 볼을 제대로 처리하지 못했고, 리카르도 칼라피오리가 헤더로 골네트를 갈랐다.

오나나도 햄스트링 부상에서 회복했지만 엔트리에서 빠졌다. 아모림 감독은 ""오나나는 회복했지만 다른 선수들이 프리시즌에 매우 잘했다. 형평성을 고려해야 한다""고 설명했다."
20250818,"英 BBC ‘비피셜’ 떴다, 토트넘 마침내 추가 보강 임박…‘작별 인사’ 에제 영입 협상 가속화→48시간 내 진전 예상","[골닷컴] 강동훈 기자 = 잉글랜드 프리미어리그(EPL) 토트넘이 에베레치 에제(27·크리스털 팰리스)를 영입할 가능성이 점점 커지고 있다. 지난주 초부터 에제 영입을 두고 크리스털 팰리스(잉글랜드)와 논의를 이어온 토트넘은 최근 협상 과정에서 긍정적인 분위기가 조성되면서 거래가 성사될 거란 희망을 가지고 있는 것으로 전해졌다.

영국 공영방송 BBC는 17일(한국시간) “토트넘은 에제 영입을 위한 움직임을 가속화 할 예정이며, 협상은 향후 48시간 내로 진전될 것으로 보인다”면서 “여러 소식통에 따르면 토트넘이 거래가 성사될 거란 희망을 가지고 있는 것으로 비추어 봤을 때 협상이 긍정적으로 진행되고 있다고 전하고 있다”고 보도했다.
보도에 따르면 토트넘은 지금은 만료된 에제의 바이아웃(최소 이적 허용금액) 조항보다 낮은 수준의 이적료로 크리스털 팰리스와 논의 중이다. 계약 조건에 따라 에제는 이번 시즌 EPL 개막과 함께 바이아웃 조항이 만료됐다. 그의 바이아웃 조항은 총액 6800만 파운드(약 1281억 원) 수준이었던 것으로 알려졌다.

토트넘은 이미 에제와 개인 합의를 맺은 터라, 크리스털 팰리스와 구단 간 합의만 맺는다면 거래는 곧바로 성사될 전망이다. 유럽축구 이적시장 전문가 파브리치오 로마노 기자도 이날 자신의 소셜네트워크서비스(SNS)를 통해 “에제는 토트넘과 개인 합의를 마쳤다. 그는 토트넘으로 이적하길 바라고 있다”고 전했다.




특히 에제는 17일 영국 런던의 스탬퍼드 브리지에서 끝난 첼시(잉글랜드)와 2025~2026시즌 EPL 1라운드 원정경기에서 0대 0 무승부 직후, 다른 선수들이 다 떠난 후에도 크리스털 팰리스 원정 팬들과 함께 시간을 보낸 것으로 알려졌다. 이를 두고 전문가들은 에제가 다음 주 내로 이적하게 될 수 있는 터라 사실상 작별 인사를 한 것으로 보고 있다.

토트넘은 현재 플레이메이커, 이른바 10번 역할을 맡을 선수가 없다. 제임스 매디슨은 오른쪽 무릎 전방십자인대가 파열돼 장기 부상자 명단에 이름을 올렸고, 오른쪽 무릎 슬개골 부상으로 전열에서 이탈한 후 아직 재활 단계에 있는 데얀 쿨루셰프스키는 복귀 시점이 불투명하다. 이에 토마스 프랑크 감독은 임시방편으로 모하메드 쿠두스에게 10번 역할을 맡기고 있다.

에제는 10번 역할에 특화된 선수로 평가받는다. 뛰어난 볼 컨트롤과 화려한 발기술, 넓은 시야 그리고 날카로운 킥력을 앞세워 위협적인 기회를 만들어내면서 공격포인트를 양산할 수 있다. 특히 중앙에만 국한되지 않고 좌우 측면을 자유롭게 오가면서 다양한 움직임을 통해 공격을 전개할 수 있다.

2016년 퀸즈 파크 레인저스(QPR)에서 프로에 데뷔한 에제는 위컴 원더러스(이상 잉글랜드) 등을 거쳐 2020년부터 크리스털 팰리스에서 뛰고 있다. 지금까지 프로 통산 305경기 동안 65골·40도움을 올렸다. 빼어난 활약 속에 에제는 2023년 6월 잉글랜드 국가대표로 발탁되면서 A매치 데뷔전을 치러 지금까지 A매치 12경기를 뛰었다.

사진 = 게티이미지, 소셜네트워크서비스(SNS) 캡처"
20250818,"""미국에서 매순간, 매초를 즐긴다"" 손흥민 '오피셜' 공식입장, 윙어→스트라이커 포지션 변경 '만족'…美 ""의구심 모두 지웠다""","[스포티비뉴스=박대성 기자] 손흥민(33, LAFC)이 미국 무대에서 완벽하게 적응하고 있다. 톱으로 포지션을 변경해 뛰어도 여전한 클래스를 보여줬다. 미국 현지 언론 역시 ""모든 의구심을 지웠다""고 평가하며 그의 새로운 도전에 긍정적인 반응을 보였다.

미국 매체 'SI'는 18일(한국시간) ""손흥민이 아직 LAFC 홈 경기를 치르지 않았지만, 미국메이저리그사커(MLS)에 완벽하게 적응하고 있다. 포지션에 대한 의문점이 있었지만 두 경기 모두 스트라이커로 뛰었고 폭발적인 질주로 수비 라인을 깨며 동료들에게 기회를 만들어줬다. 뉴잉글랜드 레볼루션 원정길에서도 압도적이었다""라고 알렸다.

손흥민은 지난 8월 초 LAFC와 2600만 달러(약 345억 원)에 계약하며 MLS 역사상 아시아 선수 최고 이적료를 경신했다. 이적 발표 직후 미국 현지에서는 손흥민의 나이와 적응 문제에 대한 우려가 제기됐다. '프리미어리그에서 곧장 MLS로 와서 과연 정상급 활약을 이어갈 수 있겠는가'라는 의문이었다.

그러나 손흥민은 데뷔전부터 월드클래스 경기력을 유감없이 보여줬다. 시카고 파이어와의 첫 경기에서는 직접 골은 기록하지 못했지만, 상대 페널티킥을 유도하며 팀의 2-2 무승부에 결정적 역할을 했다. 이어 두 번째 경기인 뉴잉글랜드 레볼루션전에서는 선발 스트라이커로 나서며 도움을 기록, 팀의 2-0 원정 승리를 이끌었다.



경기 후 현지 매체들은 ""손흥민은 이미 LAFC의 핵심""이라고 극찬했고, 'ESPN'은 ""그의 합류가 팀의 시즌 전망을 송두리째 바꿔놓았다""고 보도했다.

손흥민은 뉴잉글랜드 레볼루션전 경기 후 MLS와 공식 인터뷰에서 ""저는 매일, 매 순간이 즐겁습니다. 원정에서 승리를 거두면 그 맛은 더 특별합니다. 이제 많은 경기가 기다리고 있고, 저는 잘 준비해 더 즐기고 싶습니다""라며 특유의 밝은 미소와 함께 미국 생활에 대한 만족감을 드러냈다.

손흥민의 발언은 단순한 경기 소감 이상의 의미를 갖는다. 지난 시즌 토트넘에서 주장으로서 무거운 책임을 지고, 프리미어리그와 유럽 무대에서 쉴 틈 없는 경쟁을 이어온 손흥민이 이제는 새로운 무대에서 축구 본연의 즐거움을 다시 찾고 있다는 해석이 가능하다.
그의 가장 큰 변화는 포지션이다. 토트넘 시절 대부분 왼쪽 윙어로 활약하던 손흥민은 LAFC에서 스트라이커로 기용되고 있다.

레볼루션전에서 그는 하프라인 부근에서 폭발적인 스프린트로 상대 수비를 무너뜨린 뒤, 캐나다 국가대표 마티외 쇼이니에르의 추가골을 어시스트했다. 또, 전반전에는 버티는 플레이와 연계 능력을 바탕으로 마크 델가도의 환상적인 중거리슛 선제골을 이끌어내며 스트라이커로서의 새로운 역할을 성공적으로 수행했다.



'디 애슬레틱'은 ""손흥민은 윙어에서 스트라이커로 이동하면서도 전혀 위축되지 않았다. 오히려 나이를 고려하면 더 효과적인 위치일 수 있다. 그는 스피드뿐 아니라 위치 선정, 연계, 마무리 능력을 두루 갖춘 선수""라고 분석했다.

팀 동료들의 반응은 더욱 뜨겁다. 골을 함께 만든 쇼이니에르는 ""그와 함께 뛰면 모든 게 쉬워진다. 그는 팀에 온 이후 모두를 웃게 만들고, 경기장에서의 경험을 공유하며 팀을 한 단계 끌어올렸다""고 말했다.

LAFC의 스티브 체룬돌로 감독은 ""손흥민은 매일 훈련장에 웃음을 가져온다. 행복하고 동기부여된 선수, 그리고 훌륭한 소통가다. 여기에 그의 기술, 속도, 마무리 능력, 경험까지 더해졌다. 이런 선수는 어디에서도 찾기 어렵다""이라며 칭찬했다.

'SI'는 ""손흥민의 합류는 경기장 밖에서도 큰 반향을 일으키고 있다. K-POP 그룹 엔하이픈의 멤버 정원이 LA 콘서트에서 그의 LAFC 유니폼을 입고 등장했고, 손흥민의 유니폼은 현재 MLS 전체에서 가장 잘 팔리는 아이템 중 하나""라고 설명했다.

'포브스'는 ""손흥민은 MLS 역사상 가장 영향력 있는 아시아 스타가 될 수 있다. 이미 문화적 아이콘으로 자리 잡은 그는 리그 전체의 위상까지 끌어올리고 있다""고 분석했다.



손흥민은 오는 8월 23일 FC 댈러스 원정 경기를 치른 뒤, 8월 31일 샌디에이고 FC와의 경기를 통해 홈 데뷔전을 치를 예정이다. 현재 서부 콘퍼런스 5위에 위치한 LAFC는 손흥민의 합류로 상위권 도약을 노리고 있다.

손흥민은 이미 프리미어리그에서 톱 클래스 공격수로 10년 동안 활약했다. 유럽축구연맹(UEFA) 유로파리그(UEL) 우승컵을 품에 안고 프로 첫 메이저 대회 정상을 밟은 뒤 MLS에서 새로운 도전을 시작했다.

포지션 변화, 리그 적응, 팀 내 영향력까지 모든 측면에서 성공적인 출발을 보인 그는, 또다시 자신의 전성기를 써내려갈 준비가 되어 있다. 지금 손흥민은 ""미국에서 매일, 매 순간을 즐기고"" 있다. '행복축구'를 하고 있는 손흥민이 LAFC와 MLS에 어떤 새로운 역사를 만들게 될지 모든 관심이 쏠리고 있다."
20250818,"""확실한 넥스트 레벨"" 美해설자도 반한 손흥민의 원맨쇼, '1도움+기회 창출 5회'","[포포투=정지훈]

미국 해설자도 반한 손흥민의 원맨쇼다.
손흥민이 속한 로스앤젤레스 FC(LAFC)는 17일 오전 8시 30분(한국시간) 미국 보스턴에 위치한 질레트 스타디움에서 열린 2025 미국 메이저리그 사커(MLS) 27라운드에서 뉴잉글랜드 레볼루션에 2-0 승리를 거뒀다.

LAFC는 전반전 뉴잉글랜드의 공세 앞에 다소 고전했다. 전반 10분과 18분 연달아 위협적인 슈팅이 나왔지만, 위고 요리스의 선방에 힘입어 위기에서 벗어났다. 이에 손흥민이 분전했다. 전반 26분 코너킥 상황에서 페인팅 동작 이후 첫 슈팅을 가져갔지만, 골대를 살짝 빗나갔다. 이후 별다른 장면 없이 전반은 종료됐다.

하지만 후반전에는 확연히 달라진 모습을 보여줬다. LAFC는 후반 초반부터 공세를 이어갔으며, 그 결과 후반 6분 문전 앞 혼전 상황에서 마르코 델가도가 선제골을 터뜨렸다. 손흥민도 힘을 보탰다. 후반 추가시간 4분 드리블 돌파 이후 패스를 내줬고, 이를 마티유 초니에르가 왼발 슈팅으로 이어가면서 추가골을 터뜨렸다. 이내 경기는 종료됐다.

손흥민이 맹활약했다. 축구 통계 매체 '풋몹'에 따르면 손흥민은 이날 선발 출전해 풀타임을 소화하면서 어시스트 1개를 포함해 유효 슈팅 2회, 기회 창출 5회, 패스 성공률 88%(29/33), 드리블 성공률 100%(4/4), 리커버리 3회, 볼 경합 성공 7회 등을 기록했다. 이에 '풋몹'은 손흥민에게 양 팀 통틀어 가장 높은 평점 8.5점을 부여하면서 MOM(Man Of the Match)으로 선정했다.

미국 해설자도 손흥민의 활약에 반했다. 경기 내내 손흥민의 별명인 ""쏘니""를 외치며 활약에 칭찬을 아끼지 않았고, 도움을 기록했을 때는 ""환상적인 패스다. 확실한 넥스트 레벨""이라고 찬사를 보냈다.

한편 LAFC는 이날 승리로 승점 40점(11승 7무 6패)을 기록하면서 MLS 서부 콘퍼런스 5위에 올랐다. 더욱이 LAFC가 선두권보다 최대 3경기를 덜 치렀기 때문에 순위 상승의 여지는 여전히 충분하다.

이제 LAFC는 손흥민과 함께 다가오는 24일 오전 9시 30분 미국 텍사스에 위치한 도요타 스타디움에서 열리는 2025 MLS 28라운드에서 댈러스와 맞붙는다. 손흥민은 이날 데뷔골에 도전한다."
