date,title,content
20250622,"손흥민, 사우디 아닌 ‘페네르바흐체’ 이적 유력…무리뉴 감독과 직접 만나→462억 쓴다","[골닷컴] 이정빈 기자 = 페네르바흐체가 손흥민(32·토트넘) 영입하기 위해 안간힘을 쓰고 있다. 주제 무리뉴(62·포르투갈) 감독이 직접 손흥민과 만나 이적에 관해 대화를 나눴다.

글로벌 축구 매체 ‘트라이벌 풋볼’은 22일(한국 시각) “페네르바흐체가 손흥민 영입에 박차를 가하고 있다. 계약 기간이 1년 남은 손흥민은 미래를 고민하고 있다”라며 “무리뉴 감독과 손흥민이 이적을 두고 직접 만났다. 페네르바흐체는 토트넘을 설득하기 위해 이적료 2,500만 파운드(약 492억 원)를 사용할 의사가 있다”라고 보도했다.

무리뉴 감독이 이끄는 페네르바흐체는 올여름 스타 선수 보강을 바라고 있다. 라이벌 갈라타사라이에 밀려 튀르키예 쉬페르리그 2위에 그친 페네르바흐체는 이적시장에 큰돈을 풀기로 했다. 그도 그럴 것이, 주축 베테랑이었던 에딘 제코(39·피오렌티나)와 두샨 타디치(36)가 팀을 떠났기에 뼈대를 잡아줄 새로운 에이스가 필요하다. 무리뉴 감독은 그 역할을 맡을 선수로 손흥민을 지목했다.



토트넘과 계약 기간이 1년밖에 남지 않은 손흥민은 이번 여름 이적이 점쳐진다. 토트넘은 이미 손흥민을 붙잡지 않겠다는 의사를 드러냈다. 이를 인지한 무리뉴 감독은 손흥민과 만나 영입 의사를 내비쳤다. 튀르키예 현지 매체 보도에 따르면, 페네르바흐체는 손흥민에게 연봉 1,200만 유로(약 191억 원)를 보장할 생각이다. 이는 토트넘에서 받는 연봉보다 높은 수준이다.

다만 페네르바흐체는 ‘오일 머니’로 무장한 사우디아라비아 구단과 경쟁해야 한다. 사우디 국부 펀드(PIF)로부터 지원받는 알아흘리, 알나스르와 사우디 공기업 ‘사우디 아람코’ 소유 구단인 알카디시야가 영입전에 참전했다. 세 구단은 손흥민의 흥미를 끌기 위해 3,000만 유로(약 475억 원)에 달하는 연봉을 제시할 준비를 마쳤다.
더불어 토트넘은 손흥민을 매각할 의사를 보였지만, 아시아 투어가 끝나는 8월 3일 이후에 이적을 수락하기로 했다. 토트넘은 이번 여름 홍콩과 한국에서 프리시즌 투어를 진행한다. 친선경기 외에도 손흥민을 내세워 여러 활동을 진행하기로 계약해 이를 이행해야 한다. 다니엘 레비(63·잉글랜드) 회장은 상업적인 이유로 손흥민 매각을 뒤로 미루기로 했다.

페네르바흐체가 발 빠르게 손흥민을 영입하고 싶다면, 더 큰 금액을 제시해야 할 전망이다. 토트넘은 손흥민의 가치를 최소 4,000만 파운드(약 739억 원)로 보고 있다. 상황에 따라서는 레비 회장이 5,000만 파운드(약 924억 원)까지 요구할 것이라는 전망도 있다.



손흥민은 토트넘 소속으로 454경기 출전해 171골과 101도움을 올렸다. 2015년 토트넘에 입단한 그는 첫 시즌 적응기를 마치고, 팀의 간판스타로 거듭났다. 특유의 양발 슈팅 능력과 속도를 활용한 돌파로 시즌마다 파괴력을 자랑했다. 2022-23시즌에는 잉글랜드 프리미어리그(EPL) 23골을 작렬해 리그 득점왕까지 차지했다.

유일한 아쉬움이었던 무관도 지난달 말끔하게 날려버렸다. 손흥민은 이번 시즌 유럽축구연맹(UEFA) 유로파리그(UEL) 우승을 차지하면서 우승 갈증을 풀었다. 커리어 동안 번번이 결승전에서 좌절했던 손흥민은 빌바오에서 맨체스터 유나이티드를 누르고 주장 완장을 두른 채 UEL 트로피를 높게 들어 올렸다.

미래가 불투명한 손흥민은 이달 10일 2026 북중미 월드컵 아시아 3차 예선 B조 10차전 쿠웨이트와 경기를 마치고 믹스트존(공동취재구역) 인터뷰에서 “아직 계약 기간이 1년 남았다. 무슨 말을 하기보다는 기다리는 게 맞다”라며 “미래를 생각하기보다는 지켜보는 게 맞다. 저는 어느 자리에서나 노력해 온 선수다. 어디에 있더라도 최선을 다하겠다”라고 말을 아꼈다.

사진 = 소셜네트워크서비스(SNS) 캡처, 게티이미지"
20250622,맨유 눈물 펑펑! 무자비한 리버풀 '1186억 FW' 강탈→누녜스+키에사 스왑딜 제안,"사진=SNS
<저작권자(c) 연합뉴스, 무단 전재-재배포, AI 학습 및 활용 금지>
[스포츠조선 강우진 기자]리버풀이 나폴리의 공격수 빅터 오시멘 영입에 도전한다. 이 과정에서 두 명의 선수를 내보낼 가능성이 있다.

오시멘은 리버풀의 오랜 라이벌인 맨체스터 유나이티드가 영입을 희망하는 선수이기도 하다. 맨유 역시 중앙 공격수 영입에 간절하다.

영국 팀토크는 22일(한국시각) ""리버풀이 다르윈 누녜스와 페데리코 키에사를 포함한 스왑딜로 나폴리의 공격수 빅터 오시멘 영입을 시도한다""라고 보도했다.

지난 시즌 잉글랜드 프리미어리그(EPL)에서 손쉽게 우승한 리버풀은 다음 시즌에 대비한다. 아스널, 맨체스터 시티, 첼시 등 경쟁자들에 앞서기 위해 이번 여름 이적시장에서 전력을 보강할 필요성을 절감하고 있다. 아르네 슬롯 리버풀 감독은 이미 바이어 레버쿠젠으로부터 제레미 프림퐁과 플로리안 비르츠를 영입했고, 본머스의 밀로시 케르케즈도 곧 데려올 예정이다.
리버풀은 스트라이커 영입에도 열을 올리고 있다.

오시멘은 영입 대상 중 하나로 그와 나폴리의 계약에는 7500만 유로(약 1186억원)의 바이아웃 조항이 포함돼 있는 것으로 알려졌다.

<저작권자(c) 연합뉴스, 무단 전재-재배포, AI 학습 및 활용 금지>
<저작권자(c) 연합뉴스, 무단 전재-재배포, AI 학습 및 활용 금지>
이와 함께 나폴리가 이번 여름 이적시장에서 리버풀로부터 다르윈 누녜스와 페데리코 키에사를 영입하고자 한다는 소식도 전해졌다.

매체에 따르면 리버풀은 오시멘을 데려오기 위해 누녜스와 키에사를 포함한 스왑딜을 제안했다.

나폴리 측에서는 키에사와 누녜스에 더해 2000만 유로(약 316억원)의 추가금까지 요구하고 있다고 한다.

오시멘은 현재 세계에서 가장 많은 관심을 받는 공격수 중 한 명이다.

지난 시즌 튀르키예 갈라타사라이에서 임대 생활을 했던 오시멘은 41경기에서 37골 8도움을 기록하며 팀의 리그 우승을 이끌었다. 그는 이적 관련해서 말을 아끼고 있다.

오시멘은 ""시즌이 끝나고 여름 이적시장이 열리면 늘 이런 일이 반복된다. 많은 클럽들이 나를 원하고 있지만, 지금은 휴가에 집중하며 그저 즐기고 있다""라며 ""쉬는 동안에는 지난 시즌 갈라타사라이에서의 활약, 득점 장면, 실수, 잘한 점 등을 복기하고 있다""라고 말했다.

<저작권자(c) 연합뉴스, 무단 전재-재배포, AI 학습 및 활용 금지>
한편, 맨체스터 유나이티드의 전 수비수 리오 퍼디난드는 오시멘이 맨유에 입단할 것이라 믿고 있다.

앞서 퍼디난드는 ""맨유에 필요한 9번은 이미 정해져 있다. 팬들도 알고 있고, 나도 알고 있다. 내가 데려오고 싶은 선수는 오시멘이다""리며 ""그는 알힐랄의 제안을 거절한 것처럼 보인다. 아마 맨유를 기다리는 중일 것이다""라고 주장했다.

맨유 역시 지난 시즌 최악의 골 결정력으로 역사에 남을 만한 부진을 겪은 만큼 오시멘과 같은 핵심 공격수 영입에 열을 올리고 있는 상황이다. 상대가 리버풀인 만큼 영입 경쟁에서 우위를 점하기는 힘들 것으로 보인다. 맨유는 다음 시즌 유럽축구연맹(UEFA) 챔피언스리그에 나가지 못하는 팀으로 경쟁력이 현저히 떨어질 수밖에 없다."
20250622,"""손흥민 100% 남을 수 있었다"" 레비 실수였나...'HERE WE GO' 로마노 확인 ""포스텍 잔류면 SON도 잔류였어""","[OSEN=고성환 기자] 다니엘 레비 토트넘 홋스퍼 회장의 선택이 어떤 나비효과를 낳게 될까. 손흥민(33)이 엔지 포스테코글루 감독 경질 때문에 이적을 고민하고 있다는 소식이다.  

토트넘 팬 커뮤니티 '스퍼스 웹'은 20일(한국시간) ""파브리시오 로마노는 손흥민과 포스테코글루에 대해 흥미로운 주장을 펼쳤다. 그는 포스테코글루 경질이 손흥민의 토트넘 잔류 가능성에 어떤 영향을 끼쳤는지 조명했다""라고 보도했다.

매체는 ""소셜 미디어의 많은 감정을 보면 이미 많은 토트넘 팬들이 손흥민의 이탈 가능성에 대해 지레 포기한 것으로 보인다. 특히 토마스 프랭크 신임 감독이 토트넘 감독으로서 첫 인터뷰에서 함께하고 싶은 선수 중 한 명으로 손흥민을 언급하지 않으면서 이러한 추측이 더욱 커졌다""라고 전했다.

다만 아직 토트넘 팬들이 손흥민을 포기하긴 이르다. 스퍼스 웹은 ""로마노는 전설 손흥민이 토트넘에 잔류할 가능성을 아직 잃어선 안 된다고 믿는다. 그에 따르면 토트넘은 아직 최종 결정을 내리지 않았다. 흥미롭게도 손흥민은 포스테코글루가 떠나지 않았다면 잔류가 보장됐을 것이라고 한다""라고 설명했다.



손흥민의 미래가 불투명한 가운데 'Here we go'로 유명한 유럽축구 이적시장 전문가 로마노가 입을 열었다. 그는 ""아직 손흥민은 결정된 바가 없다. 특히 선수 측에서 그렇다. 그는 프랭크와 이야기한 뒤 결정을 내려야 한다""라고 밝혔다.

토트넘이 포스테코글루 감독을 해고하지 않았다면 손흥민도 100% 남았을 거라는 다소 놀라운 이야기도 공개했다. 로마노는 ""포스테코글루가 토트넘 감독으로 남아 있었다면 손흥민은 항상 토트넘에 남을 거다. 사우디에서 그를 향해 강력한 관심을 보이고 있다""라고 덧붙였다.
토트넘은 지난달 유럽축구연맹(UEFA) 유로파리그(UEL)에서 우승하며 17년 만의 무관을 끊어냈다. 손흥민도 커리어 최초로 우승 트로피를 들어 올리며 기쁨의 눈물을 흘렸다.

그러나 레비 회장은 포스테코글루 감독을 해고하는 결단을 내렸다. 이 때문에 토트넘 선수단 내부에선 불만의 목소리도 나오고 있다. 영국 '텔레그래프는 ""토트넘은 선수들의 반란 위기에 처했다. 유로파리그 우승 16일 만에 포스테코글루가 잔혹하게 경질되자 분노가 폭발했다""라며 ""일부 선수들은 팀을 떠나고 싶어 한다. 손흥민도 토트넘을 떠날 수도 있다는 인상을 심어줬다""라고 전했다.



게다가 새로 부임한 프랭크 감독도 부임 후 첫 인터뷰에서 손흥민의 이름을 언급하지 않았다. 그는 함께 일하고 싶은 선수들로 도미닉 솔란케, 로드리고 벤탄쿠르, 제임스 매디슨을 선정했다. 나란히 이적설에 휩싸인 주장 손흥민과 부주장 크리스티안 로메로 둘 다 빠진 것.

이 때문에 손흥민이 떠날 수 있다는 관측이 더욱 커지고 있다. 영국 '풋볼 런던'도 ""프랭크 감독이 고참 선수들에 대한 계획을 이야기했지만 정작 손흥민과 로메로는 언급조차 없었다""라고 주목했다.

손흥민은 포스테코글루 감독 체제에서 주장으로 선임돼 2년간 팀을 이끌었다. 하지만 그는 계약 기간이 1년밖에 남지 않은 데다가 포스테코글루 감독까지 팀을 떠나면서 입지가 흔들리는 모습이다.

토트넘은 손흥민이 10년 동행을 끝내고 싶어한다면 말리지 않겠다는 입장이다. 영국 '스카이 스포츠'는 ""손흥민이 새로운 도전을 원할 경우 구단은 그의 선택을 존중할 것이다. 만족할 만한 제안이 도착하면 협상에 나설 것""이라고 전했다.





손흥민은 올여름 토트넘을 떠날 가능성이 커지고 있다. 풋볼 런던은 ""우리는 주장 손흥민이 그 어느 때보다 토트넘을 떠날 가능성이 크다는 사실을 잘 알고 있다""라며 ""손흥민은 토트넘에서 10년을 보낸 뒤 항상 목표로 했던 우승을 이제 달성했다. 그는 모든 당사자에게 적합한 계약이 성사되면 올여름 클럽을 떠나는 데 이전보다 더 열려 있다""라고 주장했다.

이제 꿈을 이룬 손흥민이 전설로서 토트넘을 떠날 수 있다는 것. 실제로 그는 UEL 결승에서도 벤치에서 출발하는 등 이번 시즌 부상 여파와 에이징 커브가 겹치면서 출전 시간이 대폭 줄어들었다. 풋볼 런던도 ""유로파리그 결승전을 앞두고 진행된 인터뷰에서 토트넘에 남은 이유가 마침내 클럽에 트로피를 가져다 주려는 마음 때문이라고 인정했다""라고 짚었다.

특히 손흥민은 다시 한번 '오일 머니'를 자랑하는 사우디아라비아의 뜨거운 관심을 받고 있다. 알 아흘리, 알 나스르, 알 카디시야 등이 그를 원하는 것으로 알려졌다. 영국 언론인 벤 제이콥스에 따르면 사우디 3개 구단이 손흥민 영입을 위해 이적료 4000만 유로(634억 원)와 연봉 3000만 유로(475억 원)를 준비했다. 임금만 3년간 약 1426억 원에 달하는 초대형 계약이다.

손흥민은 2023년 여름에도 알 이티하드로부터 어마어마한 금액을 제안받은 바 있다. 당시 그는 ""돈은 중요하지 않다. 내가 좋아하는 리그에서 뛰는 것이 중요하다""라고 선을 그었지만, 최근엔 달랐다. 쿠웨이트전을 마친 뒤엔 ""지금은 기다리는 게 맞다. 나도 궁금하다. 어떤 일이 일어날지 예측하기 어렵다. 무슨 일이 일어날지 지켜보는 게 좋을 것 같다""라며 모든 가능성을 열어뒀다. 



토트넘도 손흥민의 이탈에 대비하고 있는 모양새다. 이미 앙투안 세메뇨(본머스)와 브라이언 음뵈모(브렌트포드), 조지 웨아(유벤투스) 등 여러 공격수가 토트넘과 연결되고 있다.

스퍼스 웹은 ""주장 손흥민의 거취에 대한 결정을 내렸든 아니든 프랭크가 구단 영입 부서와 논의하지 않았을 가능성은 희박해 보인다. 보도에 따르면 프랭크는 토트넘에 합류한 뒤 이미 우선 이적 목표를 구체적으로 밝혔다. 손흥민의 잔류 여부에 대한 명확한 판단이 내려질 수 있었을 것""이라며 손흥민의 미래가 어느 정도 윤곽이 잡혔을 거이라고 내다봤다.

또한 매체는 ""일부 소식통에 따르면 토트넘은 올여름 사우디 클럽을 상대로 손흥민 이적료로 5000만 파운드(약 926억 원)를 요구할 계획이다. 이 금액이 충족된다면 손흥민이 2주 후 만 33세가 되는 상황에서 거절하기 어려울 것""이라며 몸값 문제만 해결된다면 손흥민의 이탈 쪽에 무게를 뒀다.

/finekosh@osen.co.kr

[사진] 손흥민, 프리미어리그, 토트넘 소셜 미디어."
20250622,"대충격! 토트넘 전담 기자 확인...""손흥민, 올여름 떠날 가능성 높아, 프랭크 감독과 면담 예정""","조만간 손흥민과 토마스 프랭크 감독이 거취와 관련해 대화를 나눌 것으로 보인다.

영국 매체 '풋볼 런던' 소속 알레스데어 골드 기자는 21일(한국시간) ""토트넘 훗스퍼에 격변의 시기가 다시 찾아왔다. 새 감독 부임과 함께 다가오는 시즌을 향한 야심 찬 목표들이 더해지고 있다. 특히 팀의 핵심인 '주장 손흥민'과 '부주장' 크리스티안 로메로의 거취에 대해서도 명확한 판단이 필요한 시점이다""라고 보도했다.
이어 골드 기자는 팬들과의 QnA 시간을 가졌고, 한 팬은 ""손흥민이 이번 여름에 떠날 가능성은 얼마나 되나?"", ""만약 남는다면 프랭크 감독이 선발로 기용할까?""라는 질문을 던졌다.

이에 대해 ""결국 손흥민의 미래는 본인이 결정해야 할 문제다. 그는 클럽에서 10년간 헌신하며 트로피를 들어 올린 레전드다. 그런 결정을 스스로 내릴 자격이 있다. 이번 여름은 손흥민이 이적할 가능성이 그 어느 때보다 높다. 무엇보다도 그는 프랭크 감독과 대화를 나눠야 한다. 감독이 손흥민을 어떻게 계획하고 있는지에 대해서 말이다. 이미 그 얘기가 오갔는지는 확실하지 않다""라고 답했다.



이번 여름 손흥민은 팀을 떠날 가능성이 매우 높다. 골드 기자가 언급한 것처럼 지난 유럽축구연맹(UEFA) 유로파리그(UEL)에서 우승을 차지했기 때문. 그동안 자신이 그토록 원했던 트로피를 들어 올림으로써 10년의 헌신을 보답 받았다.

최근 사우디아라비아와 강하게 연결됐다. 영국 '토크 스포츠'는 ""사우디의 알 아흘리, 알 나스르, 알 카디시야 세 구단이 손흥민 영입에 관심을 보이고 있다. 이들은 4,000만 유로(약 634억 원) 이적료를 제시할 준비가 되어 있는 것으로 알려졌다""라고 전했다.

천문학적인 연봉을 준비하고 있다. 매체는 ""사우디 측은 손흥민에게 연봉 3,000만 유로(약 475억 원)를 제안할 준비가 되어 있다. 만약 손흥민이 이적에 동의한다면, 한국 방송사와의 중계권 계약도 동반될 것으로 예상된다. 이는 구단 입장에서도 즉각적인 수익으로 이어질 수 있다는 평가다""라고 주장했다.



'타임즈'는 ""사우디 구단들은 올여름 특정 국가 출신 스타 선수 영입에 열을 올리고 있다. 이는 해외, 특히 극동지역에 방송권을 판매하려는 전략의 일환이다. 손흥민은 아시아축구연맹(AFC) 챔피언스리그(ACL)에서 아시아 국적 외국인 선수를 필수적으로 포함해야 하는 규정 때문에 더 높은 가치를 지닐 수 있다. 그는 사우디 프로 리그 준우승팀 알 힐랄과 크리스티아누 호날두가 소속된 알 나스르와 연결돼 있다""라고 설명했다.

이미 현지에서는 손흥민이 팀을 떠날 것으로 보고 있고, 다음 시즌 예상 선발 라인업에서 제외했다. 만약 잔류를 하더라도 벤치행일 것이라는 충격적인 주장도 제기됐다. '더 보이 훗스퍼'는 ""프랭크 감독은 손흥민을 쫓아낼 생각은 없다. 하지만 굳이 뛰게 할 생각도 없다는 입장이다""라고 설명했다.

하지만 '더 보이 훗스퍼'는 공신력이 매우 낮다. 주로 사견이 담긴 기사를 퍼나르는 매체다. 그냥 가볍게 보고 지나치면 될 듯 하다. 확실한 건 손흥민이 프랭크 감독과 면담을 할 예정이라는 것이다. 'TBR 풋볼'은 ""현 시점에서 주장 손흥민의 미래는 여전히 불확실하며, 프랭크 감독은 다가오는 시즌에 대한 계획을 손흥민과 면담을 통해 조율해야 할 것이다. 중요한 것은, 손흥민은 여전히 토트넘에서 많은 것을 기여할 수 있다""라고 밝혔다."
20250622,"'감히 야말을 꼬셔?' 30세 스튜어디스, 13살 연하 바르셀로나 스타와 휴가 의혹→살해 협박에 시달려","(엑스포츠뉴스 권동환 기자) 한 유명 스튜어디스가 세계적인 축구스타 라민 야말(바르셀로나)과 함께 휴가를 보낸 것으로 의심되자 살해 협박을 받아 논란이 됐다.

영국 매체 '데일리스타'는 지난 17일(한국시간) ""30세 여객기 승무원이자 인플루언서인 파티 바스케스는 바르셀로나의 10대 천재 라민 야말과 함께 휴가를 보냈다는 보도가 전해진 후 살해 위협을 받았다""라고 보도했다.
매체에 따르면 인스타그램 팔로워 수가 51만명이 넘는 스튜어디스 파티 바스케스는 최근 야말과 함께 찍은 사진을 사회관계망서비스(SNS)에 게시했다.

매체는 ""야말은 바위투성이 배경의 보트 위에서 찍은 사진을 공유했고, 바스케스는 곧바로 다른 각도에서 사진을 공유했다""라고 설명했다.



이어 ""야말은 또한 나무가 배경을 압도하는 풀장의 사진을 게시했는데, 다른 각도에서 촬영되었음에도 불구하고 파티의 게시물에서도 같은 나무가 보인다""라고 덧붙였다.

일부 스페인 언론은 야말과 바스케스가 함께 제트스키를 타는 사진을 올리면서 두 사람의 관계를 의심했다.

바스케스가 자신보다 13살이나 어린 2007년생 야말과 열애 중일 수도 있다는 주장이 나오자, 인플루언서 하비 데 호요스는 두 사람에 대해 ""아무런 관계가 없다""라고 주장했다.

그러나 몇몇 축구 팬들은 바스케스가 야말을 유혹하고 있다고 생각해 그녀의 SNS에 찾아가 살해 위협을 하면서 논란이 됐다.



계속된 위협에 바스케스는 결국 자신의 SNS을 통해 ""내면의 어둠에 갇힌 사람들이 알지도 못하는 누군가의 죽음을 바라는 모습을 보면 너무 슬프다""라며 심경을 고백했다.

또 ""나는 계속 성장하고 빛으로 나를 감싸는 삶을 선택했다""라며 ""내가 병을 앓기를 바라는 사람들에게는 그들의 병이 낫기를 기원한다. 스스로 건강한 사람은 다른 사람의 파멸을 바라지 않는다""라고 전했다.

한편 야말은 바르셀로나가 현재 미국에서 진행 중인 2025 국제축구연맹(FIFA) 클럽 월드컵에 불참함에 따라 이탈리아로 휴가를 떠나 휴식을 취하고 있는 것으로 알려졌다.

야말은 아직 만 18세도 되지 않았지만 향후 축구계를 이끌어 갈 세계적인 축구스타 중 한 명으로 평가되고 있다.



야말은 2024-25시즌 모든 대회에서 55경기에 나와 18골 25도움이라는 믿기지 않는 성적을 기록하며 바르셀로나의 도메스틱 트레블(라리가-코파델레이-수페르코파 데 에스파냐)을 이끌며 2025 발롱도르 후보로 떠올랐다.

시즌을 마치고 휴식 중인 야말은 휴가가 끝나면 바르셀로나로 복귀해 대한민국 방문을 준비할 예정이다.

디드라이브가 주최하는 ‘FC바르셀로나 2025 아시아투어 에디션’에서 바르셀로나는 7월 31일 서울월드컵경기장에서 FC서울과 친선전을 치르고, 8월 4일 대구스타디움에서 대구FC와 맞대결을 가진다.

사진=ABC, SNS, 바스케스 SNS, 연합뉴스"
