date,title,content
20251209,"'韓 역대급 주장' 손흥민 초대박! 토트넘 '오피셜' 공식발표 떴다, 런던 한복판 완성되는 SON의 벽화...""레전드""","[스포티비뉴스=장하준 기자] 손흥민이 떠난 지 반년이 흐른 런던에 또 하나의 역사적 장면이 열린다. 토트넘 홋스퍼가 손흥민(33·LAFC)의 복귀 날짜를 공식 확정했고, 그의 얼굴이 새겨진 초대형 벽화가 홈구장 앞으로 모습을 드러낼 채비를 마쳤다. 이번 귀환은 경기 출전이 아닌 작별 인사를 위한 방문이지만, 상징성과 무게는 어떤 현역 경기보다 크다. 10년 동안 북런던의 심장으로 뛰었던 선수에게 바치는 '영구 헌정식'에 가깝다.

토트넘은 3일(한국시간) 공식 홈페이지를 통해 ""손흥민이 10일 슬라비아 프라하전을 맞아 런던을 찾는다""며 팬 대상 고별 행사를 진행한다고 발표했다. 경기장 입장 전 그라운드에 등장해 팬들과 직접 인사를 나누는 형식이다. 손흥민이 토트넘을 떠나 MLS LAFC로 이적한 뒤 국내에서 시즌 일정을 소화하느라 정작 런던 팬들 앞에서 작별 인사를 하지 못했던 점을 고려한 조정이다. 이 미완의 작별이 이제서야 마침표를 찍는다.
그러나 이 방문의 의미를 결정짓는 핵심은 따로 있다. 바로 토트넘 하이 로드, 구단 홈구장 앞 대로에 올라가는 손흥민 벽화다. 작업은 마무리 단계까지 와 있으며, 공개일은 손흥민 방문 당일과 정확히 맞춰질 예정이다. 팬 커뮤니티에서는 이미 벽화 일부가 포착된 사진이 공유되고 있고, 'SON', 'SEVEN', 'SPURS', 'LEGEND'라는 문구가 선명히 확인되고 있다. 구단이 어떤 메시지를 남기고 싶은지 그 단어만으로 충분히 이해된다.

흥미로운 비화도 함께 전해지고 있다. 이 벽화가 원래 해리 케인(바이에른 뮌헨)의 위치를 대체한다는 점이다. 케인은 토트넘 최다 골 기록을 남기며 명실상부 클럽 레전드로 평가받았고, 그의 벽화는 한동안 토트넘 팬들의 자부심이었다. 하지만 바이에른 뮌헨 이적 후 상징은 사라졌고, 그 자리를 채운 이름이 바로 손흥민이다. 현지 매체 사이에서는 ""토트넘의 중심이 바뀌었다는 평가까지 나온다""고 전했다. 케인의 시대가 끝났다면, 지금 새겨지는 건 '손흥민의 토트넘'이라는 뜻이다.



벽화 디자인은 손흥민이 직접 선택했다. 팬들이 궁금해하던 메인 사진은 그의 대표 세리머니 '찰칵' 포즈로 결정됐다. 토트넘 팬들에게 가장 익숙한 장면이자 손흥민이 남긴 상징적 장면 중 하나다. 풀백 두 명 사이를 찢어놓고, 먼 거리에서 감아 넣고, 역습을 혼자 해결하며, 마지막엔 셔터를 누르듯 양손을 들어올리던 손흥민. 그 미소와 포즈가 이제 런던 거리를 영원히 내려다본다.

그리고 벽화에는 또 하나의 사진이 포함된다. 유로파리그 결승전에서 우승컵을 들어 올리던 순간이다. 토트넘이 41년 만에 들어올린 유럽대항전 트로피. 주장 손흥민이 가장 먼저 손을 뻗어 트로피를 높이 들던 장면. 선수단 내부에서는 폭죽 타이밍이 맞지 않아 손흥민이 트로피를 두 번 들어 올린 비하인드 스토리가 지금도 웃음거리로 회자된다.

숫자도 그의 시대를 증명한다. 토트넘 통산 454경기 173골 101도움. 프리미어리그 아시아 선수 최초 득점왕. FIFA 푸스카스상 수상. 주장 완장을 차고 우승컵을 들어 올린 최초의 아시아 선수. 이 모든 기록이 이제 런던 도심 벽면에 '영구보존'된다.



구단 역시 이 행사에 전례 없는 공을 들이고 있다. 단순한 초청이 아니라 하나의 시대를 정리하는 의식으로 접근하고 있다. 토트넘 관계자들은 ""손흥민은 클럽을 넘어 문화적 유산""이라고 평했고, 팬들은 ""이제야 진짜 이별을 할 준비가 된다""는 반응을 쏟아내고 있다. 벽화 앞에서 인증샷을 찍으려는 팬들로 첫 공개 당일 구단 앞이 혼잡해질 것이라는 전망까지 나온다.

손흥민도 LAFC에서 새로운 챕터를 쓰며 미국 무대를 흔들고 있다. 13경기 12골 4도움. MLS 데뷔 시즌에 터뜨린 임팩트는 비정상적인 수준이다. 하지만 본인은 여러 차례 인터뷰에서 ""토트넘 팬들에게 작별 인사를 하지 못한 것이 마음에 남아 있다""고 말해왔다. 이번 귀환은 자신의 커리어 중 가장 개인적인 순간이 될 가능성이 크다."
20251209,"충격 소식! 날 버린 팀, 나도 버린다...살라, 리버풀과 이별→레알 마드리드 전격 이적 가능성 점화 ""선수 맞교환까지 고려""","사진=트위터 캡처
AFP연합뉴스
[스포츠조선 이현석 기자]모하메드 살라가 리버풀을 떠날 수 있다는 주장이 등장했다. 행선지 후보가 파격적이다.

글로벌 스포츠 언론 디애슬레틱은 9일(한국시각) '리버풀은 살라의 격렬한 인터뷰 이후 일단 진정하는 분위기지만, 앞으로 중대한 결정을 내려야 한다'고 보도했다.

리버풀은 최근 화제의 중심이다. 이유는 단연 살라의 폭탄 발언 때문이다. 선수와 팀 사이의 관계가 크게 갈라지고 있다. 문제의 중심은 살라다. 살라는 리버풀의 상징과도 같은 선수였다. 2024~2025시즌까지만 해도 공식전 52경기에서 34골23도움을 기록하며 살라는 선수 경력 최고의 시즌을 보내기도 했다. PL 골든 부트(득점왕)만 4회를 차지했다. 2017~2018시즌, 2024~2025시즌에는 EPL 올해의 선수로도 선정되며 정점에 올랐다.

AFP연합뉴스
올 시즌 살라는 그간의 모습과 달랐다. 부진이 깊어졌다. 팀 내 영향력이 크게 추락했고, 리버풀의 성적도 곤두박질쳤다. 활약이 부진하자, 아르네 슬롯 감독은 결단을 내렸다. 살라를 선발 명단에서 제외했다. 살라를 제외한 이후에도 리버풀의 성적이 급격하게 달라지지는 않았으나, 그럼에도 슬롯 감독은 살라를 선발로 기용하지 않았다.

하지만 살라는 참지 않았다. 3경기 연속 교체 명단에 이름을 올리자, 갑작스러운 인터뷰를 진행하며 심경을 토로했다. 그는 ""구단이 나를 버스 아래로 던져버린 것 같다. 지금 내 심정이 그렇다. 누군가 내게 모든 책임을 떠넘기려 하는게 분명하다""며 ""솔직히 말하면 이 상황은 내가 용납할 수 없다. 이해다 안 된다. 내가 문제라고 생각치 않는다. 나는 이 팀을 위해 많은 일을 해왔다. 매일 내 자리를 얻기 위해 싸울 필요가 없다. 내가 그 자리를 얻었다. 누구보다 위대하다는 의미가 아니라, 난 이미 내 자리를 얻기 위해 노력했다""고 밝혔다.

그럼에도 리버풀은 살라에 대한 슬롯의 입장을 지지했다. 슬롯 감독은 유럽챔피언스리그 인터 밀란전 소집 명단에서도 살라를 제외했다. 살라는 리버풀 선수단과 훈련은 진행했지만, 현재로서는 어떻게 상황이 흘러갈지도 장담하기 어려운 상황이다.

사진=트위터 캡처
디애슬레틱은 '리그 역사상 가장 폭발적인 인터뷰였다'며 '리버풀 내부에서는 이번 결정이 슬롯 감독이 이처럼 암울한 성적을 거둔 후 팀에 최선이라고 판단하여 내린 선택일 뿐이며, 뒤에서 살라를 몰아내려는 사람은 아무도 없다고 보고 있다'고 설명했다.

이런 상황에서 살라의 이적 가능성까지 거론되고 있다. 스페인의 데펜사 센트럴은 '레알 마드리드가 살라를 주목하고 있다. 살라는 슬롯 감독과의 관계가 깨지며 팀을 떠날 수 있다. 살라는 2027년까지 계약이기에 더욱 가능할 수 있다. 또한 살라를 데려온다면 호드리구 등을 포함해 선수 맞교환도 고려할 수 있다. 예의주시해야 한다'고 설명했다.

살라가 레알로 떠난다면 팬들의 충격은 적지 않을 전망이다. 앞서 리버풀은 지난여름 이적시장에서 팀 내 '성골 유스'였던 트렌트 알렉산더-아놀드가 파격적인 레알 이적을 택한 바 있다. 단 6개월 만에 팀의 상징 중 한 명을 더 레알로 보낸다면 파급 효과가 클 수 있다."
20251209,"미쳤다! 대한민국 캡틴…'한글+태극기' 손흥민, 벽화 디자인에 포함했다…SON 토트넘 복귀 하루 전, 작품 완성!","▲ 토트넘은 최근 유럽축구연맹(UEFA) 챔피언스리그 슬라비아 프라하전에서 손흥민이 팬들 앞에 선다는 것을 공식적으로 발표했다. 오는 10일 토트넘 홋스퍼 스타디움에서 열리는 이날 경기에서 손흥민은 킥오프 전 팬들 앞에서 인사를 전하게 된다. ⓒ THICK ACCENT


[스포티비뉴스=조용운 기자] 손흥민(33, 로스앤젤레스FC)이 토트넘 홋스퍼로 돌아온다.

토트넘은 지난 3일 공식 홈페이지를 통해 손흥민의 방문을 발표하며 복귀 일정을 확정했다. 그에 따르면 손흥민은 오는 10일 홈구장인 토트넘 홋스퍼 스타디움에서 열리는 2025-26시즌 유럽축구연맹(UEFA) 챔피언스리그 리그 페이즈 SK 슬라비아 프라하전에 맞춰 경기장을 방문해 팬들과 공식 작별 행사를 진행한다.

지난여름 미국프로축구 메이저리그사커(MLS) LAFC로 이적하며 토트넘을 떠났던 손흥민은 당시 팬들에게 직접 인사하지 못했다는 점을 아쉬움으로 남겼고, 이번 방문은 미완의 작별을 완성하는 순간이 될 전망이다.

손흥민은 토트넘에서 10년간 454경기에 출전해 173골 101도움을 기록했고 프리미어리그 득점왕, 푸스카스상, 토트넘 주장 그리고 UEFA 유로파리그 우승이라는 굵직한 성과를 남겼다. 이 우승은 토트넘이 2008년 이후 처음 들어올린 트로피였다. 클럽 내부에서는 손흥민을 프리미어리그 출범 후 토트넘 최고 유산 중 한 명으로 평가하고 있다.

토트넘은 그의 방문에 맞춰 상징적인 프로젝트를 진행 중이다. 토트넘 하이 로드 외벽에 손흥민을 주제로 한 대형 벽화를 설치하는 작업이 진행되고 있다. 제작은 레들리 킹과 해리 케인 벽화를 만든 머월스 팀이 맡았고, 공개 예정일은 손흥민 방문일과 동일하다.

▲ 토트넘은 최근 유럽축구연맹(UEFA) 챔피언스리그 슬라비아 프라하전에서 손흥민이 팬들 앞에 선다는 것을 공식적으로 발표했다. 오는 10일 토트넘 홋스퍼 스타디움에서 열리는 이날 경기에서 손흥민은 킥오프 전 팬들 앞에서 인사를 전하게 된다.


흥미로운 점은 벽화가 원래 해리 케인(바이에른 뮌헨)의 자리였다는 점이다. 손흥민의 벽화 비하인드를 공개한 'THICK ACCENT'는 ""기존 벽화는 케인이 구단 최다 득점자가 된 뒤 제작됐지만, 바이에른 뮌헨으로 이적하고 우승을 차지한 이후 철거됐다""며 ""그 자리에 손흥민의 벽화가 다시 세워지면서 팬들 사이에서는 '토트넘의 중심이 바뀌었다'는 해석도 나오고 있다""고 전했다.

디자인 선정 과정에는 손흥민이 직접 참여한 것으로 알려졌다. 어떤 사진이 그려질까 관심을 불러모았던 가운데 선택한 이미지는 시그니처인 '찰칵 세리머니'다.

벽화에는 또 다른 사진도 포함된다. 유로파리그 결승전에서 우승 트로피를 들어 올리는 장면이다. 손흥민은 이 사진을 자신의 커리어에서 가장 의미 있는 순간으로 꼽는다. 촬영 당시 폭죽 타이밍이 맞지 않아 트로피를 두 번 들어 올린 에피소드는 지금도 팀 내부에서 회자된다.

▲ 토트넘은 최근 유럽축구연맹(UEFA) 챔피언스리그 슬라비아 프라하전에서 손흥민이 팬들 앞에 선다는 것을 공식적으로 발표했다. 오는 10일 토트넘 홋스퍼 스타디움에서 열리는 이날 경기에서 손흥민은 킥오프 전 팬들 앞에서 인사를 전하게 된다.


더불어 태극기를 허리춤에 차 한국 축구의 상징으로 확실하게 남았다. 한국 선수로는 유일하게 유럽대항전을 한 구단의 주장 자격으로 우승해 트로피를 가장 먼저 그리고 높게 들어올렸던 손흥민이다. 한국 축구의 최고 레전드로 충분히 불릴 만하고, 이를 축구종가 런던에 오래 새기게 됐다. 더불어 손흥민은 영어가 아닌 한글 이름까지 더해 한국을 영원히 대표한다.

현재 벽화 작업은 마지막 단계에 있다. 도색과 코팅 작업이 진행 중이며 일정에 차질은 없는 것으로 알려졌다. 팬 커뮤니티에서는 현장 사진과 영상이 공유되며 기대감이 높아지고 있다. 토트넘 내부 관계자들은 이번 행사가 단순한 초청이 아니라, 구단과 선수, 그리고 팬 사이의 관계를 공식적으로 마무리하는 의미라고 설명한다.

그만큼 토트넘은 여러모로 손흥민과 이별을 진심으로 준비하고 있다. 수많은 토트넘 팬 채널과 현지 언론들은 벽화 제작 과정을 담은 영상들을 경쟁적으로 공유하기 시작했다. 굵직한 선들로 새겨진 손흥민의 얼굴과 함께 'SON', 'SEVEN', 'SPURS', 'LEGEND' 문구들이 확인됐다. 클럽이 이 벽화를 통해 전달하려는 의도는 더 이상 설명이 필요 없었다.

▲ 토트넘은 최근 유럽축구연맹(UEFA) 챔피언스리그 슬라비아 프라하전에서 손흥민이 팬들 앞에 선다는 것을 공식적으로 발표했다. 오는 10일 토트넘 홋스퍼 스타디움에서 열리는 이날 경기에서 손흥민은 킥오프 전 팬들 앞에서 인사를 전하게 된다.


지금 손흥민은 미국 MLS라는 새로운 무대에서 도전을 이어가고 있지만, 단 하나의 미해결 숙제가 남아있었다. 바로 이별이었다. 손흥민이 토트넘을 떠날 당시 한국에 머물러야 했다. 런던 팬들과 얼굴을 마주하고 직접 건네는 마지막 인사는 끝내 이뤄지지 못했다. 그렇기에 이번 런던 방문은 단순한 초대를 넘어 각종 부분에서 상당한 의미를 지닌다.

런던에 영구히 남겨진 이 벽화는 바로 그 진심 어린 인사의 확장판이다. 팬들은 벽화 앞에서 시간을 보내고, 거리를 지나던 사람들에게 계속해서 손흥민의 존재감을 피력할 예정이다.

▲ 토트넘은 최근 유럽축구연맹(UEFA) 챔피언스리그 슬라비아 프라하전에서 손흥민이 팬들 앞에 선다는 것을 공식적으로 발표했다. 오는 10일 토트넘 홋스퍼 스타디움에서 열리는 이날 경기에서 손흥민은 킥오프 전 팬들 앞에서 인사를 전하게 된다."
20251209,"케인은 17위, 손흥민은 NO! OUT!…SON, EPL '역대 베스트 50위' 안에도 없다→英 매체 리스트 논란 점화","(엑스포츠뉴스 윤준석 기자) 또 저평가인가.

영국 축구매체 '기브미 스포츠'가 선정한 '프리미어리그 역대 최고의 선수 50인' 명단에서 손흥민의 이름이 보이지 않아 국내외 팬들의 아쉬움을 자아내고 있다.

이번 랭킹은 프리미어리그 출범 이후 활약한 수많은 선수 가운데 영향력, 기록, 우승 기여도 등을 종합해 선정한 것으로, 50위 데니스 어윈부터 1위 티에리 앙리까지 프리미어리그의 역사를 대표하는 레전드들이 대거 포함됐다.

여기에는 데니스 베르캄프, 프랭크 램파드, 스티븐 제라드, 크리스티아누 호날두, 웨인 루니 등 시대를 풍미한 슈퍼스타들이 상위권을 차지했다.



하지만 같은 프리미어리그 무대에서 오랜 기간 꾸준한 활약을 이어온 손흥민이 이번 명단에 오르지 못한 점은 팬들에게 상당한 의문을 남겼다.

손흥민은 토트넘에서 장기간 핵심 공격수로 활약해왔으며, 아시아 최초 프리미어리그 득점왕, 푸스카스상과 같은 뛰어난 개인 기록부터, 아시아 선수로서 리그에 남긴 보이지 않는 영향력까지 고려할 때 충분히 평가 대상이 될 만한 선수라는 점에서다.

또한 이번 명단에는 토트넘 출신 공격수 해리 케인이 17위에 이름을 올렸지만, 케인과 함께 토트넘에서 프리미어리그에 큰 족적을 남긴 손흥민이 전혀 언급되지 않은 것 역시 다소 의외라는 평가다.

특히 손흥민은 토트넘 역사상 가장 많은 프리미어리그 득점을 기록한 공격수 중 한 명이며, 국제적 브랜드 가치 향상, 글로벌 인지도 확대, 아시아 시장 확장에 기여한 대표적 인물로 평가받아왔다.

이는 단순히 팀 내부 성적뿐 아니라 프리미어리그 자체가 가진 가치 확장에도 긍정적인 영향을 미쳤다는 평가가 가능하다.



하지만 그렇다고 해서 이번 랭킹에 포함된 선수들이 포함될 가치가 없었던 것은 아니다.

명단 자체가 역대 선수들 기준으로 구성된 만큼 과거 프리미어리그를 대표했던 선수들이 집중적으로 포함된 점, 그리고 우승 횟수와 같은 눈에 띄는 기록의 여부가 중요한 기준으로 작용한 것으로 보인다.

비록 이번 명단에는 포함되지 못했지만, 손흥민은 여전히 프리미어리그 역사에서 독보적인 기록과 의미를 남겨 온 선수다.

반드시 재평가가 이루어질 필요가 있다는 목소리가 이어질 것으로 보인다.

사진=연합뉴스"
20251209,"이럴 수가! 퍼거슨 '마지막 유산', 맨유 떠난다...6개월 만에 행정직 내려놓은 에반스 ""가족과 시간 보내기 위해 퇴사""","[SPORTALKOREA] 김경태 기자= 알렉스 퍼거슨 감독의 '마지막 유산'이던 조니 에반스가 맨체스터 유나이티드 FC를 떠난다.

영국 매체 'BBC'는 9일(한국시간) ""에반스가 맨유에서 맡았던 '임대 및 유망주 육성 책임'직을 6개월 만에 내려놓았다""고 보도했다.



에반스는 퍼거슨 감독 체제의 마지막 유산으로 평가받는 인물이다. 맨유 유스 출신인 그는 2007년 9월 데뷔전을 치른 뒤 로열 앤트워프 FC와  선덜랜드 AFC 임대 기간을 제외하고 약 9년 동안 맨유에서 활약했다. 이 기간 233경기 8골 6도움을 기록하며 유럽축구연맹(UEFA) 챔피언스리그, 프리미어리그 3회 우승을 달성하는 등 팀의 전성기를 함께했다.

이후 2015년 웨스트 브롬위치 알비온 FC로 이적한 그는 세 시즌 동안 96경기에 출전하며 건재함을 보여줬고, 2018년 레스터 시티 FC로 이적해 꾸준한 활약을 이어갔다. 그러던 2023/24시즌 맨유로 복귀해 선수 생활의 마지막을 보냈다. 황혼기에 접어든 37세답게 출전 시간은 제한적이었으나, 베테랑으로서 드레싱룸 내 안정감을 제공하며 팀의 중심축 역할을 담당했다.



지난 6월 현역 은퇴와 동시에 에반스는 맨유 프런트로 합류했다. 그의 역할을 유망주 임대 전략을 총괄하고, 풋볼 디렉터 제이슨 윌콕스와 협력해 선수 육성 체계 구축하는 것이었다.

임명 당시 에반스는 ""차세대 유망주들의 성장을 돕는 데 집중하고 싶다. 나 역시 선수 시절 임대를 거치며 그 중요성을 잘 알고 있다""며 ""유망주들이 1군으로 가는 경로를 더 발전시키고, 맨유의 젊은 선수들이 계속 빛날 수 있도록 돕겠다""고 포부를 밝혔다.

다만 맨유 행정가로서의 생활은 길지 않았다. 임명 6개월 만인 현재, 에반스는 구단에 퇴사 의사를 전달했다. 매체는 에반스의 결정에 이유에 대해 ""그는 가족과 더 많은 시간을 보내기 위해 자리에서 내려오기로 했다고 알려졌다""며 ""에반스는 당분간 휴식을 취한 뒤 향후 거취를 결정할 계획""이라고 설명했다.

사진=맨체스터 유나이티드 FC, 더선, 게티이미지코리아

취재문의 sportal@sportalkorea.co.kr"
20251209,"미쳤다, 아름답다, 환상적...손흥민 벽화 유출 '태극기+트로피+찰칵 세리머니' 환상 3중주","사진=코울린 SNS
[스포츠조선 김대식 기자]곧 전격 공개될 손흥민의 벽화가 유출됐다.

토트넘 소식을 전하는 크리스 코울린은 9일(이하 한국시각) 개인 SNS를 통해 손흥민의 벽화 모습을 유출했다. 거의 다 완성된 손흥민의 벽화였다. 사진을 통해서 손흥민이 택한 벽화의 사진이 어떤 모습인지 다 파악할 수 있었다.

벽화에는 손흥민의 모습이 2개였다. 먼저 손흥민의 시그니처 세리머니인 찰칵 세리머니다. 찰칵 세리머니를 하고 있는 손흥민의 모습이 제일 크게 벽화에 그러졌다. 손흥민은 자신의 트레이드마크인 찰칵 세리머니로서 자신의 업적을 남기고 싶었던 모양이다. 또한 찰칵 세리머니를 하고 있는 손흥민 뒤에는 한글로 손흥민이라고 적혀 있는 걸 알 수 있었다.
<저작권자(c) 연합뉴스, 무단 전재-재배포, AI 학습 및 활용 금지>
다음으로 눈에 띄는 건 트로피를 들고 있는 손흥민의 모습이다. 유로파리그(UEL) 우승 후 손흥민은 수많은 인생샷을 남겼다. 트로피 인생샷 중 하나로 꼽히는 장면을 고른 손흥미이었다. 태극기를 허리춤에 두르고 뒤를 돌아서 트로피를 들고 있는 손흥민의 모습도 벽화로 제작됐다. 트로피를 통해서 스스로를 토트넘 레전드로 인정했던 손흥민이기에, 토트넘에서 그토록 우승을 해내고 싶었던 손흥민이기에 트로피를 들고 있는 자신을 선택한 것으로 보인다.

이제 손흥민은 오랫동안 남을 자신의 벽화의 모습을 확인하면 된다. 앞서 토트넘은 3일 공식 홈페이지를 통해 '손흥민은 12월 10일 유럽챔피언스리그(UCL) 슬라비아 프라하전에서 홈팬들에게 작별 인사를 전하기 위해 클럽을 떠난 이후 처음으로 토트넘 홋스퍼 스타디움을 찾는다'고 발표한 바 있다.
<저작권자(c) 연합뉴스, 무단 전재-재배포, AI 학습 및 활용 금지>
손흥민의 토트넘 복귀 일정에 맞춰서 구단에서는 벽화 제작을 준비했다. 토트넘은 '팬 자문위원회와 협력해, 토트넘 하이로드에 손흥민이 남긴 유산을 기리기 위한 거리 벽화 작업도 시작됐으며, 12월 9일까지 완성될 예정이다. 벽화 디자인은 손흥민이 직접 선택했으며, 레들리 킹과 해리 케인의 상징적인 벽화를 제작한 팀이 작업을 진행하고 있다'며 손흥민을 영원토록 기억하기 위한 벽화 제작에 들어갔다고 밝혔다.

구단의 공식 발표 후 벽화 제작은 곧바로 진행됐다. 이제 영국에서 해가 뜨면 손흥민 벽화 공개식이 제대로 진행될 것으로 예상된다.
<저작권자(c) 연합뉴스, 무단 전재-재배포, AI 학습 및 활용 금지>
손흥민이 토트넘의 레전드이기 때문에 가능한 일이다. 2015년 여름 토트넘에 입단한 손흥민은 2025년 여름 구단을 떠나기로 결정할 때까지 454경기를 뛰면서 173골 101도움을 터트렸다. 수많은 토트넘 올해의 선수, 프리미어리그 득점왕, 발롱도르 11위 등 대단한 업적을 만들어낸 손흥미이다. 17년 동안 이어진 구단의 무관도 주장으로서 깨면서 21세기 토트넘 최고 레전드가 됐다."
