date,title,content
20250709,"주장도 뺏기고, 벤치도 감수하라고? 손흥민, 결국 토트넘 떠나나...""69.2%! 사우디 이적 확률도 떴다""","[사진] ⓒGettyimages(무단전재 및 재배포 금지)


[OSEN=정승우 기자] 주장 완장과 주전 자리를 내줘야 할 수도 있다는 전망이 나오는 가운데, 손흥민(33, 토트넘)의 다음 행선지로 사우디아라비아가 급부상했다. 이적 가능성을 수치로 예측한 베팅업체까지 등장하면서, 그의 결단이 임박했다는 평가가 나온다.

토트넘 홋스퍼는 2025-2026시즌을 앞두고 새로운 국면에 접어들었다. 유럽축구연맹(UEFA) 유로파리그 우승이라는 트로피를 들어 올렸지만, 프리미어리그에서는 실망스러운 성적을 기록했고 결국 안제 포스테코글루 감독과 결별했다. 후임은 브렌트포드에서 팀을 잘 다듬어온 전술가 토마스 프랭크(52)다.
문제는 손흥민의 위치다. 구단 내부 소식에 정통한 '릴리화이트 로즈' 팟캐스트의 진행자 존 웬햄은 ""손흥민은 더 이상 매 경기 선발로 나설 수 있는 선수가 아니다""라고 단언했다. 이어 ""경험은 풍부하지만 기량은 정점에서 내려왔다. 마티스 텔이 완전 영입됐고, 미키 무어는 빠르게 성장하고 있다. 크리스티안 로메로가 남는다면 주장도 물려줘야 한다""라고 주장했다.

사실상 '손흥민이 남더라도 벤치에서 시작하며, 주장도 넘겨야 한다'는 구상이 내부에서 논의되고 있는 셈이다. 이는 단순한 세대교체가 아닌, 상징의 교체다. 손흥민은 지난 시즌 17년 만의 우승을 이끈 주장으로 팬들의 절대적인 지지를 받았지만, 프랭크 감독 체제에선 1순위가 아닐 수 있다.

[사진] ⓒGettyimages(무단전재 및 재배포 금지)
토트넘 팬들의 반응도 갈린다. 꾸준히 성실함과 희생정신을 보여준 손흥민의 헌신을 인정하는 팬들도 있지만, 일부 팬층은 ""팀 재정비를 위해선 과감한 전환이 필요하다""라며 손흥민의 이적 또는 역할 축소를 받아들이는 분위기다.

그럼에도 구단은 손흥민에게 선택권을 부여한 상태다. 영국 '풋볼 런던'은 앞서 ""토트넘은 손흥민의 미래를 본인이 결정하도록 존중하고 있다""라고 전했다. 지난 겨울 연장 옵션을 발동해 1년 더 계약이 연장됐지만, 그것이 곧 '잔류'를 의미하진 않는다.

현실적으로 손흥민은 이제 선택의 기로에 서 있다. 잔류하되 역할을 내려놓을 것인지, 전성기를 마무리할 새로운 무대로 향할 것인지. 구체적인 행선지도 떠오르고 있다. 바로 사우디아라비아다.

영국 '미러'와 '토트넘 홋스퍼 뉴스'에 따르면, 손흥민은 최근 미국 MLS의 LA FC 제안을 거절했으며, 여전히 복수의 사우디 구단들이 그를 노리고 있다. 심지어 영국 베팅업체 '스카이 벳'은 손흥민의 다음 소속팀이 사우디 리그일 확률을 4/9(약 69.2%)로 책정했다. 이는 가장 유력한 시나리오라는 뜻이다.

이미 사우디 리그는 유럽 무대 정상급 스타들을 적극적으로 영입하며 리그 위상을 높이고 있다. 손흥민은 이들 중에서도 아시아 최고 스타로서 상징성과 시장성 면에서도 매력적인 타깃이다.

토트넘의 입장, 손흥민의 고민…결단의 시간


[사진] ⓒGettyimages(무단전재 및 재배포 금지)
토트넘은 지난 시즌부터 손흥민의 매각에 대해 '열려 있는 입장'을 유지해왔다. '풋볼 인사이더'는 ""이적료가 2,500만 파운드(약 465억 원)라면 토트넘은 제안을 수용할 것”이라고 전했다. 즉, 구단은 손흥민이 원하는 결정을 최대한 존중하되, 합리적인 가격과 조건이 맞는다면 보내줄 준비도 되어 있다는 것이다.

손흥민은 현재 서울월드컵경기장에서 열릴 8월 3일 뉴캐슬전 프리시즌 일정에 출전 의무가 있는 상태로 알려져 있다. 하지만 이 경기가 사실상 고별전이 될 가능성도 점점 커지고 있다.

손흥민이 떠난다면, 단순한 포지션의 공백 그 이상이다. 그는 단순한 윙어가 아니었고, 토트넘이라는 클럽의 철학과 감정을 상징하던 존재였다. 잉글랜드 무대에서 성공한 몇 안 되는 아시아 선수로, 그가 떠나는 순간은 곧 '한 시대의 종결'로 읽힐 수밖에 없다.

반대로, 미키 무어나 마티스 텔 등 차세대 유망주들에게는 새로운 기회의 시작이기도 하다. 세대교체의 문은 때때로 전설의 이별로 열리는 법이다.

지금 손흥민의 앞에 놓인 선택지는 단순한 진로 문제가 아니다. 남는다면 잃는 것이 많고, 떠난다면 새로운 모험이 기다린다. 그의 결정은 단순한 개인의 커리어가 아닌, 토트넘이라는 팀의 향후 판도까지 바꿀 수 있는 변수다. /reccos23@osen.co.kr"
20250709,"'이럴 수가' 독일 유력 매체, ""김민재? 바이에른 뮌헨 내부 매각 리스트에 올랐다""","바이에른 뮌헨기 김민재를 내부 매각 리스트에 올린 것으로 알려졌다. 이미 대체자까지 점찍었다.

독일 '빌트'는 8일(한국시간) ""뮌헨이 왼쪽 윙어 포지션을 보강하려는 건 비밀이 아니다""라며 ""하지만 뮌헨은 센터백 포지션도 재정비할 수 있다""라고 보도했다.

김민재는 대한민국 축구 국가대표 수비수다. 그는 전북 현대 모터스, 베이징 궈안 등을 거쳐 지난 2021년 페네르바체에 입단하며 유럽 커리어를 시작했다. 김민재가 본격적으로 이름을 알리기 시작한 건 나폴리 시절이었다.

김민재는 2022-23시즌 나폴리 유니폼을 입은 뒤 곧바로 주전 수비수로 올라섰다. 그는 엄청난 수비력을 바탕으로 33년 만에 나폴리의 세리에 A 우승에 공헌했다. 세리에 A 최우수 선수, 올해의 팀에 선정되기도 했다.



2023-24시즌을 앞두고 뮌헨이 김민재에게 관심을 가졌고 영입에 성공했다. 김민재는 입단 초반엔 주전 수비수로 기용됐으나 시간이 흐르면서 입지가 흔들렸다. 김민재의 폼이 다소 떨어졌고, 뮌헨은 겨울 이적시장에서 에릭 다이어를 영입했다. 결국 주전 경쟁에서 밀린 채 시즌이 끝났다.

이번 시즌엔 달랐다. 빈센트 콤파니 감독의 수비 전술에서 중요한 역할을 맡으며 중용됐다. 다만 제대로 휴식을 취하지 못하면서 몸에 무리가 왔다. 결국 시즌 중후반 중요한 일전에서 다소 부진하며 비판받았다.

이번 여름 이적시장에서 김민재가 뮌헨을 떠날 가능성이 제기되고 있다. 독일 소식에 능통한 플로리안 플레텐베르크 기자는 ""뮌헨에서 김민재는 손댈 수 없는 선수로 여겨지지 않는다. 구단은 그를 적극적으로 팔려고 하진 않지만, 여름에 적절한 제안을 들어볼 의향이 있다""라고 이야기했다.



'빌트'는 ""뮌헨이 센터백을 재정비할 수도 있다는 내용이 밝혀졌다. 우리 정보에 따르면 첼시의 스타 헤나투 베이가가 뮌헨의 리스트에 올라 있다. 몇 주 전부터 뮌헨 스카우트들이 그를 관찰하고 있다""라고 설명했다.

매체는 ""그러나 베이가는 단 한 가지 전제 조건에서만 뮌헨으로 이적할 수 있다. 김민재가 먼저 뮌헨을 떠나야 그의 대체자로 영입될 수 있다. 김민재는 뮌헨의 내부 매각 리스트에 올라 있다""라고 더했다.

한편 김민재는 지난 4월 자신의 이적설에 대해 ""내가 떠날 이유는 없다. 머물 수 있길 바란다. 하지만 두고 볼 일이다. 다음 시즌에 건강하게 뛰고 싶다""라고 이야기한 바 있다. 김민재 거취에 관심이 쏠린다."
20250709,"손흥민 관리를 이렇게 해? 해고!...분노한 레비 회장, 토트넘 메디컬 부서 전면 개편","게티이미지
[스포츠조선 김대식 기자]토트넘이 메디컬 팀을 전편 개편했다.

영국 디 애슬래틱은 8일(한국시각) '토트넘은 2년 연속으로 메디컬 부서를 전면 개편했다. 지난 시즌 부상 악재가 심각했던 만큼, 핵심 인물인 아담 브렛과 닉 데이비스가 구단을 떠났고, 이에 따른 후속 조치가 진행 중이다. 토트넘은 두 사람의 후임을 차후에 선임할 예정이라고 밝혔다'고 보도했다.

토트넘이 메디컬 팀에 대대적인 변화를 꾀한 이유는 선수단의 줄부상 문제가 시즌 내내 심각했기 때문이다. 지난 시즌 손흥민을 비롯해 미키 반 더 벤, 크리스티안 로메로, 데스티니 우도기, 굴리엘모 비카리오 등이 장기 결장하며 팀 운영에 큰 차질을 빚었다.
<저작권자(c) 연합뉴스, 무단 전재-재배포, AI 학습 및 활용 금지>
사실 선수들의 부상은 피할 수 없는 변수 중 하나다. 충돌 과정에서 생기는 부상은 메디컬 팀의 책임이 아니다. 하지만 토트넘은 선수들이 부상에서 돌아와 곧바로 다시 쓰러지는 문제에 불만이 폭발했다.

디 애슬래틱은 '로메로는 발가락 부상 복귀 직후였던 12월 첼시전에서 경기 시작 10분 만에 허벅지 부상을 당했고, 같은 경기에서 판 더 펜도 햄스트링 부상을 재발했다. 이 두 센터백은 다음 해 3월이 되어서야 정상 출전이 가능했다'고 꼬집었다.

엔제 포스테코글루 전 토트넘 감독도 시즌 도중 ""올해 가장 큰 문제는 부상 자체보다 부상에서 복귀한 선수들이 다시 부상을 당하고 있다는 점이다. 핵심 선수들이 훈련과 경기를 계속 소화하는 데는 문제가 없다. 그런데 복귀한 선수들이 다시 쓰러지고 있다. 비카리오를 제외하고는 전부 재부상이거나 복귀 과정에서 생긴 문제다""며 불만을 토로했다.
<저작권자(c) 연합뉴스, 무단 전재-재배포, AI 학습 및 활용 금지>
기사에서 언급은 안됐지만 손흥민의 부상도 그랬다. 지난해 9월 햄스트링 부상을 당한 손흥민은 10월 중순 웨스트햄 유나이티드전에 돌아왔다. 선발로 나와 복귀골을 신고한 후 70분을 뛰고 교체됐는데 햄스트링 부상이 재발돼 짧은 기간이었지만 다시 쉬어야 했다. 손흥민 커리어에서 부상이 다시 도져서 전력에서 이탈한 건 처음이었다. 또한 시즌 막판에도 손흥민은 발 부상으로 계속 고생하면서 팀 전력에 큰 보탬이 되지 못했다.

이에 토트넘 구단은 메디컬 팀에 능력에 의구심을 품었고, 책임자들을 해고하기로 결정했다. 디 애슬래틱은 '다니엘 레비 회장은 이러한 악순환을 막기 위해 다시 한 번 개혁을 단행했다'고 덧붙였다.

손흥민이 토트넘에 남을지는 아직 확실하지 않지만 토트넘에서 선수 생활을 이어간다면 지난 시즌과 같은 부상 문제가 반복되어선 안될 것이다.
<저작권자(c) 연합뉴스, 무단 전재-재배포, AI 학습 및 활용 금지>"
20250709,맨체스터 유나이티드 초대박 소식! '1025억 유리몸 MF' 인기 폭발...세리에 A 4개 구단 영입 관심,"메이슨 마운트./게티이미지코리아

[마이데일리 = 노찬혁 기자] 메이슨 마운트(맨체스터 유나이티드)가 이탈리아 세리에 A 구단들의 집중적인 관심을 받고 있다.

이탈리아 '풋볼 이탈리아'는 9일(이하 한국시각) ""감독의 신뢰를 받고 있음에도 불구하고, 마운트는 이적 가능성이 제기되고 있으며 세리에 A 이적이 유력한 선택지로 여겨지고 있다""고 보도했다.

마운트는 잉글랜드 국적의 미드필더로, 주 포지션은 공격형 미드필더다. 전술적 유연함을 바탕으로 중앙과 측면을 모두 소화할 수 있으며, 왕성한 활동량과 전방 압박, 투지 넘치는 플레이로 공간을 창출하는 능력이 강점으로 꼽힌다. 다만, ‘유리몸’이라는 치명적인 단점이 있다.

첼시 '성골유스' 출신의 마운트는 2019-20시즌부터 1군에 합류해 데뷔 시즌 53경기를 소화하며 핵심 자원으로 부상했다. 2020-21시즌에는 유럽축구연맹(UEFA) 챔피언스리그(UCL) 우승 멤버로 활약하며 명실상부 리그 정상급 미드필더로 평가받았다.
메이슨 마운트./게티이미지코리아

그러나 2022-23시즌 급격한 하락세를 보였다. 부상이 반복되면서 경기력이 급감했고, 해당 시즌 3골 4도움에 그쳤다. 결국 첼시는 매각을 결심했다. 맨유는 5500만 파운드(약 1025억원)를 투자해 마운트를 영입했다.

맨유는 등번호 7번까지 부여하며 기대감을 드러냈지만 마운트는 잔부상에 시달렸고, 두 시즌 동안 46경기 출전에 그쳤다. 설상가상 부상 중 파티 참석 사실까지 알려지면서 팬들의 비판이 이어졌다.

그럼에도 루벤 아모림 감독은 중요한 순간마다 마운트를 중용했다. 토트넘 홋스퍼와의 UEFA 유로파리그(UEL) 결승전에서는 알레한드로 가르나초를 제치고 선발 출전 기회를 얻기도 했다.
메이슨 마운트./게티이미지코리아

이러한 상황 속에서 이탈리아 구단들이 마운트 영입에 적극 나서고 있다. '풋볼 이탈리아'에 따르면 유벤투스와 피오렌티나, 코모 1907, SSC 나폴리가 마운트의 유력한 행선지로 거론되고 있다.

맨유도 매각할 가능성이 있다. 글로벌 매체 '트리뷰나'는 지난달 ""전 맨유 수석 스카우터 믹 브라운은 마운트가 팀 내 미래를 놓고 불확실한 상황에 놓였다고 전했다. 마운트는 성실한 태도와 다재다능함 덕분에 아모림 감독의 총애를 받았지만, 잦은 부상 이력이 우려를 낳고 있다""고 전한 바 있다.

맨유는 이번 여름 대대적인 리빌딩을 예고했다. 마커스 래시포드와 제이든 산초, 안토니 모두 매각 대상으로 분류됐으며 이미 자유계약(FA)으로 팀을 떠난 선수들도 있다. 여기에 마운트까지 팀을 떠날지 관심을 모으고 있다."
20250709,"“HBD야” 뷔, 파리에서 SON 생축…조성진과 함께한 월클 쓰리샷","뷔·손흥민·조성진, 파리에서 포착…K컬처 삼각 조우

사진|뷔SNS

[스포츠서울 | 배우근 기자] BTS 뷔가 축구 국가대표 손흥민의 생일을 직접 축하하며 ‘월드클래스 인맥’을 증명했다.

8일 뷔는 자신의 인스타그램 스토리에 “HBD야”라는 짧은 메시지와 함께 손흥민과 함께 찍은 사진을 공개했다.

현재 프랑스 파리에서 공식 일정을 소화 중인 뷔는 손흥민, 피아니스트 조성진과 함께 벤치에 앉아 담소를 나누는 자연스러운 모습을 공개하며 팬들의 이목을 끌었다.

사진 속 세 사람은 야외 벤치에 앉아 편안한 차림으로 카메라를 응시하고 있다.

손흥민 역시 해당 게시물을 자신의 SNS에 리그램하며 뷔의 축하에 화답했다.

조성진과 뷔의 교류는 오래전부터 이어져왔다. 뷔는 지난 6월 예술의전당에서 열린 조성진의 리사이틀을 직접 관람했고, 전역 축하 파티에서도 조성진과 함께한 모습이 포착된 바 있다.

손흥민과의 만남은 이번이 처음 공개된 사례다. 평소 뛰어난 친화력으로 알려진 뷔는 팬들 사이에서 ‘김스치면(김태형+스치면) 인연’이라는 별명을 얻고 있다.

RM은 “태형이는 잘생기고 친절해서 사람들이 다 잘해준다”고 말한 바 있다.

전역 후 첫 공식 일정으로 뷔는 프랑스 명품 브랜드 셀린느의 2026 봄 컬렉션에 참석했다. 프랑스 배우 폴 키르셰, 보그 편집장 안나 윈투어, 배우 나오미 왓츠 등과 자연스럽게 교류하는 모습이 공개돼 글로벌 네트워크를 입증했다.

뷔는 현재 셀린느 앰버서더로 활동 중이다.

kenny@sportsseoul.com"
20250709,"'이럴 수가' 故 조타 교통사고 원인, 알고 보니...""120km/h 도로서 과속→람보르기니 타이어 터졌다"" 경찰 성명 발표","[OSEN=고성환 기자] 故 디오구 조타(향년 만 28세)의 비극적인 사망 원인이 밝혀졌다. 그가 사고 당시 직접 '과속' 운전을 했다는 정황이 포착됐다.

영국 '스카이 스포츠'는 9일(한국시간) ""스페인 경찰은 리버풀 공격수 조타가 그와 그의 동생을 사망에 이르게 한 치명적인 차량 사고의 운전자였던 것으로 보고 있다""라고 보도했다.
매체는 ""지금까지 나온 모든 증거에 따르면 조타가 교통사고에 연루된 차량 운전자였다. 또한 스페인 경찰은 사고 당시 '차량이 고속도로 제한 속도를 크게 초과했다'라고 보고 있다""라고 전했다.

조타는 최근 불의의 교통사고로 동생 안드레 실바와 함께 세상을 떠났다. 그는 포르투갈에서 스페인 북부 산탄데르로 여행하던 중 페리를 타고 영국으로 돌아갈 예정이었던 것으로 알려졌다. 하지만 스페인 자모라 인근 A-52 고속도로에서 발생한 교통사고로 사망하고 말았다.

경찰에 따르면 사고는 현지 시각으로 3일 0시 30분 발생했다. 조타와 실바가 타고 있던 람보르기니 차량이 다른 차량을 추월하는 과정에서 타이어가 터지며 도로를 이탈했다. 불길에 휩싸인 차량은 그대로 전소됐고, 두 사람은 현장에서 숨졌다.





조타가 비행기가 아닌 차량으로 이동한 이유는 작은 우연이었다. 그는 최근 폐에 문제가 생겨 경미한 수술을 받은 뒤, 의사의 조언에 따라 비행기 대신 차를 이용해 리버풀로 복귀하고 있었다. 그는 포르투에서 산탄데르까지 차로 이동한 뒤 배를 타고 잉글랜드 남부에 도착해 다시 차를 타고 리버풀로 갈 계획이었다.

슬픔 속에 조타의 장례식이 치러진 뒤 스페인 경찰이 사고와 관련된 두 번째 성명을 발표했다. 경찰 측은 ""전문가 보고서를 준비 중이며 마무리되고 있다""라면서도 조타의 과속 운전에 무게를 뒀다. 하비에르 로페스 델가도 스페인 도로안전감사관협회(ASEVI) 회장은 ""만약 시속 55마일(약 88km)로 주행했다면 사망하지 않았을 수도 있다. 스키드 마크를 보면 매우 빠른 속도로 달린 게 분명하다""라고 언급하기도 했다.

경찰 측은 ""무엇보다 차량 바퀴 중 하나가 남긴 자국을 조사하고 있다. 지금까지 나온 모든 증거에 따르면 충돌한 차량의 운전자는 조타였다. 전문가 보고서는 아직 완성되지 않았지만, 사법적 검토를 거쳐야 하므로 푸에블라 데 사나브리아 법원에 제출될 것""이라고 밝혔다.

해당 도로 구간의 제한속도는 시속 120km인 것으로 알려졌다. 특히 곡선 구간이었음에도 불구하고, 조타는 고성능 람보르기니를 몰면서 제한속도를 넘긴 것으로 추정된다. 스페인 경찰은 차량 화재로 인해 블랙박스 등 전자 기록 확인이 어려운 상황에서 타이어 자국과 충돌 흔적, 탑승 위치 등 물리적 단서를 중심으로 수사 중이다.





조타와 안드레의 장례식은 두 형제의 고향인 포르투갈 곤도마르에서 진행됐다. 둘은 곤도마르의 한 교회에 묻혔으며 많은 축구계 인사들이 비공개로 치러진 장례식에 참석했다. 

버질 반 다이크, 브루노 페르난데스, 베르나르두 실바, 앤디 로버트슨 등 리버풀 동료들과 포르투갈 대표팀 동료들이 조타의 마지막 길을 배웅했다. 울버햄튼에서도 한솥밥을 먹었던 후벵 네베스는 클럽 월드컵 일정을 마치자마자 미국에서 날아와 세상을 떠난 친구의 관을 운구했다. 

조타의 아내인 루테 카르도소가 남편의 관을 붙잡고 오열하는 모습이 포착되면서 안타까움을 더하기도 했다. 둘은 지난달 22일 오랜 연애 끝에 결혼식을 올렸다. 2012년부터 교제를 시작한 조타와 카르도소는 불과 2주 전 포르투갈 북부 브라가의 한 교회에서 정식으로 식을 올리며 부부가 됐다.

하지만 조타는 불과 결혼식 열흘 만에 세 자녀를 두고 먼저 세상을 떠나고 말았다. 그가 공유했던 행복한 결혼식 사진은 생전 소셜 미디어 마지막 게시글이 됐다. 장례식을 집도한 돔 마누엘 린다 주교는 ""조타의 어머니와 조부모가 겪는 슬픔은 말로 표현할 수 없다. 자식의 유해를 보는 건 더 큰 고통이겠지만, 두 개의 관이 놓인 상황에선 위로의 말조차 찾기 어렵다""라고 추모했다.





1996년생 조타는 포르투갈 국가대표 공격수였다. 그는 고국 파수스 드 페헤이라에서 어린 시절 성장한 뒤 아틀레티코 마드리드, 포르투, 울버햄튼 등을 거쳐 2020년 리버풀에 입단했다. 

이후 조타는 리버풀 유니폼을 입고 182경기 65골을 기록하며 두 개의 리그컵과 FA컵 우승, 프리미어리그 우승을 손에 넣었다. 특히 그는 지난 시즌 리버풀의 통산 20번째 리그 우승에 힘을 보태며 처음으로 프리미어리그 챔피언에 올랐다. 그러나 지난 4월 안필드에서 에버튼을 상대로 터트린 결승골이 조타의 마지막 골이 되고 말았다.

리버풀 구단은 너무나 빠르게 곁을 떠난 조타를 위해 영구 결번과 잔여 연봉 지급을 결정했다. 그의 등번호 20번은 1892년 창단한 리버풀 역사상 최초로 다시는 사용되지 않을 예정이다. 또한 리버풀은 조타와 남은 2년 계약을 유지함으로써 유족에게 총 1460만 파운드(약 272억 원)를 전달한다.

이제는 경찰 수사로 사고 정황을 밝힐 때다. 세상은 여전히 조타와 실바를 추모하고 있지만, 비극의 그날 밤 정확히 어떤 일이 있었던 건지 추적하는 중이다. 비록 사고에 조타의 잘못이 있다고 할지라도 끝까지 진실을 마주하는 시간이 남았다.

/finekosh@osen.co.kr

[사진] ⓒGettyimages(무단전재 및 재배포 금지), 리버풀, 스포르, 스카이 스포츠."
