date,title,content
20250626,"韓 캡틴은 사우디로 가지 않는다! 손흥민, 결국 무리뉴 품으로? 페네르바체 이적 초읽기...""SON, 여전히 높은 수준 원해""","[SPORTALKOREA] 황보동혁 기자= 최근 이적설이 끊이지 않는 손흥민(토트넘 홋스퍼)의 행선지는 튀르키예가 될 가능성이 높아보인다.

튀르키예 매체 '아크삼'은 26일(이하 한국시간) ""토트넘을 떠날 것이라는 보도들로 주목받았던 32세의 대한민국 공격수 손흥민에 대해 이제 본격적인 카운트다운이 시작됐다""라고 보도했다.

이어 ""이미 소속 팀의 전설로 불릴 정도의 위상을 쌓은 손흥민은 다음 시즌 쉬페르리그 팀 유니폼을 입을 가능성이 크다""라고 덧붙였다.



충격적인 반전이다. 지금까지 손흥민의 행선지로는 사우디아라비아가 가장 유력하다는 평가가 지배적이었다.

영국 '토크스포츠'는 지난 17일 ""손흥민이 프리시즌 기간 중 토트넘과 자신의 미래에 대해 논의할 예정이며, 이적 가능성도 열려 있다""고 전한 바 있다.

특히 사우디 프로리그의 알아흘리, 알나스르, 알카디시야 등 3개 구단이 손흥민에게 약 4,000만 유로(약 635억 원)의 이적료와 연 3,000만 유로(약 476억 원) 규모의 조건을 제시할 준비를 마친 것으로 알려졌다.



이와 관련해 이적시장 전문가 파브리시오 로마노 기자는 '기브미 스포츠'와의 인터뷰에서 ""사우디 클럽들의 관심은 매우 진지하며, 손흥민 측과의 커넥션도 이미 구축돼 있다""며 ""이런 조건은 글로벌 브랜드인 손흥민에게 엄청난 기회가 될 수 있다""고 평가했다.

이처럼 천문학적인 금액을 무기로 달려드는 만큼 만약 손흥민이 토트넘을 떠난다면 사우디로 갈 확률이 높아보였다. 그러나 선수가 유럽 무대 잔류를 원하며 페네르바체 이적이 급물살을 타고 있는 모양새다.



아크삼은 ""새 시즌 준비에 한창인 페네르바체는 손흥민 영입을 위해 본격적으로 움직였다.조세 무리뉴 감독의 옛 제자인 손흥민은 여전히 높은 수준의 경쟁이 있는 리그에서 커리어를 이어가고 싶어 하며, 페네르바체를 선호한다""라며 손흥민의 페네르바체행이 유력해진 이유를 밝혔다.

즉, 손흥민이 튀르키예행을 고려하게 된 배경으로는 조세 무리뉴 감독과의 재회, 그리고 유럽 무대에서 경쟁력을 유지하고자 하는 의지가 크게 작용한 것으로 풀이된다.

손흥민은 무리뉴 감독 체제에서 70경기 29골 25도움을 기록하며 최고의 전성기를 보냈다. 무리뉴는 해리 케인과 손흥민의 시너지를 극대화해 리그 최고의 공격 듀오로 만든 장본인이기도 하다.



또한 손흥민은 대한민국 국가대표 주장으로서, 2026 북중미 월드컵 본선을 앞두고 여전히 최고 수준의 경기력을 유지할 필요가 있다. 그런 점에서 사우디보다 유럽 무대에 남는 선택이 더 설득력 있다.

페네르바체 역시 다음 시즌 챔피언스리그 무대 진출을 노리고 있다. 이번 시즌 쉬페르리그에서 26승 6무 4패(승점 84)를 기록했으나 갈라타사라이(승점 95)에 밀려 2위를 차지하며 챔피언스리그 예선 티켓을 확보했다. 손흥민 영입은 본선 진출을 위한 승부수로 해석된다.



끝으로 매체는 ""토트넘은 손흥민에 대해 약 3천만 유로의 이적료를 책정한 것으로 알려졌으며, 페네르바체는 협상을 계속 진행 중이다. 합의가 성사될 경우 손흥민은 무리뉴 감독의 새 무기가 될 예정이다""라며 두 사람의 재회가 머지 않았다고 주장했다. 

사진= 아크삼 캡처, 게티이미지코리아 

취재문의 sportal@sportalkorea.co.kr"
20250626,"손흥민 1430억 초대형 제안 터졌다! 프리시즌 D-30, SON 선택은…한국투어-슈퍼컵 전 이적 성사도 관심","(엑스포츠뉴스 김환 기자) 과연 손흥민은 어떤 선택을 내릴까.

사우디아라비아 구단들이 손흥민에게 엄청난 규모의 제안을 준비하고 있는 것으로 알려진 가운데 손흥민이 프리시즌 전에 토트넘 홋스퍼를 떠날 수도 있다는 가능성이 제기됐다. 토트넘은 프리시즌 투어를 위해 손흥민의 출전을 조건에 포함한 상업적 계약을 맺었으나, 손흥민의 이적료를 받은 것으로 위약금을 물고 손흥민을 내보내도 이상하지 않다는 주장이다.

영국 공영방송 'BBC', 유력지 '더 타임즈' 등 높은 공신력을 자랑하는 언론들은 최근 사우디아라비아의 관심을 받고 있는 손흥민이 이번 여름 이적시장에서 토트넘을 떠날 수 있지만, 손흥민이 토트넘을 떠나는 시기는 프리시즌 투어 이후가 될 것이라고 내다봤다.

'BBC'는 ""토트넘은 아시아 투어가 끝난 뒤 손흥민의 거취에 대해 고민할 것""이라며 ""토트넘과 손흥민의 미래는 여전히 불투명하다. 중동 구단들은 계약 기간이 12개월밖에 남지 않은 손흥민의 불확실한 상황을 기회로 만들려고 한다""고 했다.



언론은 그러면서도 ""신뢰할 만한 소식통에 의하면, 손흥민은 다음 시즌이 시작되기 전 토트넘을 떠날 수도 있다. 하지만 손흥민이 이적하더라도 그의 이적 시기는 토트넘의 아시아 투어가 끝난 이후가 될 가능성이 높다. 그가 없으면 투어 주최측과 큰 문제가 생길 위험이 있기 때문""이라며 손흥민이 계약상의 이유로 토트넘의 프리시즌 투어가 끝난 뒤 토트넘을 떠날 거라고 설명했다.

'더 타임즈' 역시 ""토트넘의 프리시즌 한국 투어가 끝나기 전 손흥민이 토트넘을 떠날 가능성은 없다""며 손흥민이 오는 8월 서울월드컵경기장에서 열리는 뉴캐슬 유나이티드와의 친선경기 이후 거취를 결정할 것이라고 주장했다.
다른 현지 언론들 역시 토트넘이 아시아 투어를 마친 뒤 토트넘의 신임 사령탑 토마스 프랭크 감독과 손흥민이 손흥민의 거취 문제를 두고 논의할 자리를 마련할 전망이라며 손흥민이 토트넘의 프리시즌 투어에 동행할 거라고 예상 중이다.

그러나 토트넘 관련 소식을 전문적으로 다루는 '토트넘 홋스퍼 뉴스'의 생각은 달랐다.

'토트넘 홋스퍼 뉴스'는 토트넘이 손흥민의 의무 출전 계약 조항을 파기하고 위약금을 물더라도 프리시즌 투어에 앞서 손흥민을 이적시킬 수 있다고 했다.



토트넘 내부 소식통을 보유한 인물로 알려진 존 웬햄은 '토트넘 홋스퍼 뉴스'를 통해 손흥민이 프리시즌 기간에 열리는 친선경기에 출전하지 못하게 될 경우 토트넘이 프리시즌 투어 주최측에 물어야 할 위약금이 200만 파운드(약 37억원) 정도라고 설명했다. 현실적인 측면에서 바라보면 구단이 충분히 감당할 수 있을 만한 액수다.

손흥민이 사우디아라비아로 이적하게 될 경우 토트넘이 받을 이적료를 생각하면 200만 파운드는 절대 큰 금액이 아니다.

보도에 의하면 사우디아라비아 구단들은 손흥민을 영입하기 위해 4000만 유로(약 634억원) 이상의 이적료를 지불할 의사가 있는 것으로 전해졌다. 토트넘은 4000만 유로를 프리시즌 투어 위약금은 물론 선수 영입에도 사용할 수 있다.

'토트넘 홋스퍼 뉴스'는 지난 20일에도 지난 시즌 유럽축구연맹(UEFA) 유로파리그 결승전이 손흥민이 토트넘 소속으로 치른 마지막 경기가 될 수 있다면서 손흥민이 프리시즌이 시작되기 전 토트넘을 떠날 수도 있다고 주장한 바 있다. 

비슷한 시기 토트넘의 새로운 감독인 프랭크 감독이 공식 인터뷰에서 손흥민을 언급하지 않자, 다음 시즌 프랭크 감독의 계획에 손흥민이 없는 게 아니냐는 의심이 떠오르면서 손흥민이 프리시즌보다 빨리 토트넘을 이탈할 수 있다는 주장이 힘을 받기도 했다. 



또한 사우디아라비아 프로리그에서 손흥민을 조금이라도 더 빨리 데려오기 위해 손흥민에게 천문학적인 연봉을 줄 준비도 마쳤다는 루머도 있다. 영국 매체 '토크 스포츠'는 사우디아라비아에서 손흥민을 위해 연봉 3000만 유로(약 476억원), 계약 기간 3년을 기준으로 9000만 유로(약 1429억원)라는 어마어마한 금액을 준비하고 있다고 주장했다. 

 

사우디아라비아 구단들이 현 소속팀과의 계약이 1년밖에 남지 않은 베테랑 선수인 손흥민을 영입하기 위해 지갑을 통크게 여는 이유는 중계권료를 확보하기 위해서다.

'BBC'와 '더 타임즈'는 사우디아라비아 프로리그가 스타 플레이어들을 영입해 전 세계에 TV 중계권을 판매하려는 계획을 갖고 있다고 밝혔다. 한국, 나아가 아시아에서 높은 인기를 자랑하는 선수인 손흥민은 이런 사우디아라비아의 계획에 중요한 영입으로 여겨질 게 당연하다.



결정권은 손흥민이 쥐고 있다. 보도를 종합하면 토트넘은 손흥민의 잔류를 최우선으로 생각하고 있으면서도 적절한 제안이 올 경우 손흥민을 매각하는 것에 열려 있으며, 무엇보다 선수의 선택을 존중하려고 한다. 손흥민이 토트넘에 남겠다면 남는 거고, 떠나겠다면 떠날 수 있는 것이다.

만약 손흥민이 프리시즌이 시작되기 전 토트넘을 떠나기로 결정한다면 시간은 얼마 남지 않았다. 토트넘은 홍콩과 한국 투어에 앞서 영국에서 루턴 타운과의 친선경기를 시작으로 프리시즌의 문을 연다. 두 팀의 경기는 현지시간으로 7월26일에 열린다. 프리시즌이 시작되기 전까지 한 달밖에 남지 않았다. 손흥민의 선택에 시선이 쏠리는 이유다.



사진=연합뉴스"
20250626,"손흥민, 마침내 이적 결심...공신력 1티어 ""선수단+스태프에 이별 암시""","손흥민이 동료들과 스태프들에게 이적을 암시했다는 주장이다.

영국 '텔래그래프'에서 활동하는 맷 로 기자는 토트넘 홋스퍼 팟캐스트 '라스트 워드 온 스퍼스'에서 출연하여 토트넘의 여름 이적시장 상황에 대해 이야기했다.

맷 로 기자는 ""웨스트햄 유나이티드가 모하메드 쿠두스를 매각하길 원한다. 토트넘이 영입전에 나설지는 미지수다"", ""맨체스터 시티는 토트넘의 타깃인 에베레치 에제 영입에 관심이 있다. 유럽축구연맹(UEFA) 챔피언스리그(UCL)에 진출하는 팀이 바이아웃 조항 발동에 유리하다"", ""사비 시몬스가 영국에 오고 싶어한다. 토트넘도 관심이 있다"" 등 여러 가지 흥미로운 발언들을 내놨다.

손흥민에 대한 이야기도 있었다. ""손흥민은 선수단과 스태프들에게 자신이 이미 토트넘에서 마지막 경기를 치른 듯한 인상을 줬다""라고 말했다. 이별을 암시했다는 것이다.

손흥민이 팀을 떠날 것이라는 주장이 점점 많이 나오고 있다. 톰 바클레이 기자도 25일 영국 'TBR 풋볼'을 통해 ""손흥민이 토트넘 이적에 열려 있는 것은 이번이 처음이다. 그의 머릿속에는 17년 만에 무관을 탈출한 것과 10년 동안 헌신한 뒤 처음으로 트로피를 들어올린 것에 대해 긍정적인 생각이 남아있다""라고 말한 바 있다. 처음으로 이적에 열려 있다고 말했다.

영국 '풋볼 런던'에서 활동하는 알라스데어 골드 기자도 ""손흥민의 이적 가능성은 그 어느 때보다 높다""라고 말했었다. 또한 영국 '더 타임즈'는 올해 1월 토트넘이 손흥민의 계약을 1년 연장하기 전 장기 재계약 제안을 했었는데 손흥민이 이를 거절했었다고 밝히기도 했다.

토트넘이 손흥민을 내보내는 그림보다는 손흥민이 이적을 결심하여 떠나는 듯한 그림이 그려지고 있다. 일단 8월까지는 기다려야 한다. 8월 3일 한국 투어에 손흥민이 참여해야 하는 계약상 의무가 있는 것으로 알려졌다. 영국 '더 타임즈'는 17일 ""토마스 프랭크 감독이 토트넘을 개편하면서 손흥민이 매각될 가능성이 있다. 다만 8월 손흥민의 조국 한국에서 열리는 수익성 좋은 프리시즌 투어 전에 팀을 떠날 가능성은 매우 낮다. 토트넘은 8월 3일 서울월드컵경기장에서 뉴캐슬 유나이티드와 친선전을 치른다""라고 전했다."
20250626,"'韓 역대급 사건' 터지나...손흥민, '세계 최고 명장' 무리뉴가 부른다 ""이적 위한 카운트다운 시작, 페네르바체가 원해""","[스포티비뉴스= 장하준 기자] 다시 한번 튀르키예 이적설이 제기됐다.

튀르키예 매체 '아크삼'은 26일(한국시간) ""토트넘 홋스퍼를 떠날 수 있는 한국 공격수 손흥민에 대한 카운트다운이 시작됐다. 이미 토트넘의 전설로 불릴 정도인 손흥민은 다음 시즌 튀르키예 쉬페르리그 팀 유니폼을 입을 가능성이 커 보인다. 페네르바체가 손흥민을 영입하기로 했다""라고 전했다.
최근 들어 손흥민을 향한 페네르바체의 구애가 끊이지 않고 있다. 앞서 튀르키예 이적시장 전문가이자, 공신력이 높은 편에 속하는 야기즈 샤분주오쿨루는 지난 16일 ""손흥민은 페네르바체 이적에 열려 있다. 이에 토트넘은 손흥민의 이적료로 3,000만 유로(약 472억 원)를 요구했다. 이 금액이 합의되면 협상에 진전이 있을 것이다""라고 전했다.

이어 ""페네르바체의 무리뉴 감독은 손흥민을 데려오기 위해 직접 움직이는 중이다. 그는 토트넘 시절 손흥민과 좋은 관계를 맺었으며, 이 부분 때문에 손흥민도 페네르바체 이적에 열려 있다""라고 설명했다.



이처럼 손흥민이 페네르바체와 꾸준히 연결되는 가장 큰 이유는 역시 무리뉴 감독의 존재다. 과거 FC포르투, 첼시, 인터밀란, 레알 마드리드 등을 이끌며 세계 최고의 명장 중 한 명이 된 무리뉴 감독은 2019년부터 토트넘의 지휘봉을 잡았던 바 있다. 자연스레 당시 무리뉴 감독은 손흥민을 지도하며 좋은 호흡을 선보였다.

그리고 이제 튀르키예에서 재회를 원한다. 2024년부터 페네르바체에 전격 부임한 무리뉴 감독은 전력 보강의 일환으로 손흥민 영입에 도전하는 중이다.

손흥민은 올여름 들어 토트넘을 떠날 가능성이 커졌다. 토트넘과 계약이 1년 밖에 남지 않은 상황에서 특별한 재계약설이 들리지 않고 있다.

자연스레 이적설이 강하게 불거진다. 가장 유력한 행선지는 사우디아라비아였다. 영국 매체 '토크스포츠'는 지난 18일 ""사우디아라비아 팀들은 손흥민 영입을 위해 4,000만 유로(약 632억 원)를 지불할 의향이 있다. 특히 알 아흘리가 강력하게 공격 보강을 원하는 중이다. 또한 이 구단들은 손흥민 영입을 위해 3,000만 유로(약 474억 원) 수준의 연봉을 제안할 준비가 되어 있으며, 그가 합류할 경우 한국 방송사와의 중계권 계약을 통해 즉각적인 수익 회수가 가능하다""라고 설명했다.

또한 알 나스르를 떠날 가능성이 있었던 크리스티아누 호날두의 대체자로 낙점을 받는 등, 사우디아라비아의 빅클럽과 강하게 연결됐다. 공신력이 높은 편에 속하는 영국 공영방송 'BBC'도 손흥민을 향한 사우디아라비아의 관심을 인정했다. 이미 손흥민은 지난 2023년 알 이티하드의 공식 제안을 받았던 바 있다.



이에 따라 손흥민의 거취를 두고 3가지 경우의 수가 생겼다. 토트넘 잔류 혹은 사우디아라비아와 튀르키예 이적이다.

모든 것은 손흥민의 선택에 달렸다. 영국 내에서 공신력이 높기로 잘 알려진 '스카이스포츠'는 지난 16일 ""손흥민의 거취는 불분명하다. 그의 계약은 1년이 남아있으며, 토트넘은 선수의 결정을 따를 것이다. 토마스 프랭크 감독은 손흥민과 면담을 통해 동행 여부를 결정할 예정이다""라고 전했다.

토트넘은 최근 감독을 전격 교체했다. 지난 시즌 유럽축구연맹 유로파리그(UEL)에서 우승하며 팀에 17년 만의 무관 탈출을 안겼지만, 프리미어리그에서 부진했던 엔제 포스테코글루 감독을 경질했다. 이어 브렌트포드에서 준수한 성적을 거둬 온 프랭크 감독을 선임했다.

손흥민의 거취에도 영향이 있는 감독 교체다. 프랭크 감독이 손흥민을 얼마나 선호하느냐에 따라 그의 거취가 결정날 전망이다.

한편 BBC 소속의 사미 목벨 기자는 토트넘의 한국 투어가 끝난 후, 손흥민의 이적 여부가 최종 결정될 것이라 예상했다. 토트넘은 오는 8월 3일 서울월드컵경기장에서 뉴캐슬 유나이티드를 상대한다. 자연스레 한국 축구대표팀의 주장인 손흥민을 보기 위해 많은 관중이 경기장을 찾을 것으로 예상된다.

하지만 이적으로 인해 손흥민이 서울월드컵경기장에 모습을 드러내지 않는다면, 흥행에 적신호가 켜질 것이다. 이에 따라 토트넘은 손흥민과 한국 투어를 동행한 뒤 이적에 대한 최종 결정을 내릴 전망이다."
20250626,"손흥민으로 '한국팬 단물' 빼먹을 토트넘…SON이 만든 슈퍼컵 못 뛰나 ""8월 13일 전에 결별 결정""","▲ 손흥민을 원하는 곳이 많다. 가장 먼저 오일머니가 움직인다. 알 아흘리와 알 나스르, 알 카사디아로 이들은 3,400만 파운드(약 630억 원)의 이적료를 제시할 것으로 전망된다. ⓒ곽혜미 기자


[스포티비뉴스=조용운 기자] 토트넘 홋스퍼와 손흥민(33)이 거취에 관해 내릴 데드라인이 8월 13일 이전으로 예측된다.

올여름 손흥민의 거취가 어수선한다. 토트넘과 계약이 1년 남은 시점에 감독이 교체되고, 세대교체 요구 바람이 불면서 손흥민의 활용도를 두고 여러 시나리오가 쓰여지고 있다.

양측 모두 확고한 입장은 밝히지 않고 있다. 언제나 토트넘을 최우선으로 생각하면서 이적설을 차단했던 손흥민도 유보적인 태도로 돌아섰다. 최근 치른 쿠웨이트와 2026 국제축구연맹(FIFA) 북중미 월드컵 아시아지역 3차예썬 최종전을 마치고 거취에 대한 질문에 ""일단은 계약기간이 남아있다. 어떤 말을 하는 것보다 기다려야 한다""며 ""나도 내 미래가 궁금하다. 어디에 있든 최선을 다할 것""이라고 말했다.

토트넘도 잔류와 이적 모두 열어놨다. 손흥민이 10년 동안 토트넘의 성공을 위해 헌신했던 부분을 인정해 결정권을 위임한다는 입장이다. 리빙 레전드이기에 자신의 미래를 직접 선택하는 권리를 주겠다는 뜻이다. 이는 곧 손흥민이 토트넘을 떠나겠다고 하더라도 강력하게 잡을 생각은 없다는 입장인 셈이다.

▲ 토트넘 시절 스승인 조제 무리뉴 감독도 러브콜을 보냈다. 페네르바체의 큰 강점은 손흥민과 감독 무리뉴의 긴밀한 관계로, 손흥민도 실제 제안을 받으면 무리뉴 감독과 재회를 바랄 수도 있다. ⓒ곽혜미 기자


손흥민과 토트넘 모두 급하게 결정할 것으로 보이지 않는다. 일단 양측이 아직 만나서 대화조차 나누지 않았다. 토트넘은 엔제 포스테코글루 감독을 경질하고 토마스 프랭크 신임 감독을 데려온 만큼 선수 한명 한명 미팅을 진행할 계획이다. 주장이자 베테랑인 손흥민과도 이야기를 나눌 예정이며, 이 자리에서 프랭크 감독은 손흥민 활용의 뜻을 밝힐 것으로 알려졌다.

더불어 8월에 한국을 찾는 일정상 손흥민을 7월 내 방출할 가능성은 더욱 희박하다. 토트넘은 7월 31일 홍콩에서 아스널과 친선전을 시작으로 8월 3일에는 한국을 찾아 서울월드컵경기장에서 뉴캐슬 유나이티드를 상대한다. 손흥민 없는 서울 투어는 흥행을 목적으로 하는 프리시즌 이벤트를 망칠 요인이다. 굳이 위험 부담을 안을 필요가 없다.

자칫 계약 분쟁으로 번질 수도 있다. 한국에서 보내는 시간 동안 여러 행사에 손흥민의 참가가 필수 조항으로 들어갔을 가능성이 크다. 반드시 계약을 이행해야 하고, 이를 어길 시 200만 파운드(약 37억 원)의 위약금을 물어야 하기에 그때까지 손흥민이 떠날리는 없다.

▲ 마지막으로 독일 복귀도 언급됐다. 토트넘으로 오기 전 몸담았던 바이엘 레버쿠젠이 손흥민 영입을 고려한다는 소식이다. 맨체스터 유나이티드를 이끌었던 에릭 텐 하흐 감독이 새롭게 지휘봉을 잡은 가운데 손흥민을 데려와 공격 주축으로 삼을 수 있다는 예상이다. ⓒ곽혜미 기자


영국 축구 재정전문가인 댄 플럼리도 ""손흥민이 계약상 반드시 뛰어야 하는 조항이 있다면 토트넘이 지금까지 붙잡고 있는 것도 충분히 이해 가능하다""며 ""손흥민이 경기장 안팎에서 가지는 가치가 얼마나 대단한지 엿볼 수 있다. 행사 주최사 뿐 아니라 여러 파트너사가 손흥민과 연관되어 있을 것이다. 결국 손흥민이 이적한다면 한국 투어가 끝난 뒤어야 할 것""이라고 못박았다.

다만 손흥민과 토트넘이 헤어지기에는 이번 여름이 적기라는 평가도 있어 거취는 계속 혼란할 전망이다. 잔여 계약이 1년에 불과한 게 크다. 올해 초 장기 계약 대신 1년 연장 옵션만 발동하면서 미래가 불투명해진 배경이다. 이를 두고 '풋볼 인사이더'는 ""손흥민의 계약은 단지 1년 연장된 것이다. 그가 내년 이맘때쯤 클럽을 떠나는 자유 이적에 동의할 수 있다""며 ""클럽은 지금이나 여름 이적 시장에서 그를 현금화할 기회를 확보하기 위해 움직일 수 있다""라고 경고했는데 그대로 진행되고 있다.

결국 아시아 투어를 모두 마친 뒤 최종 결정이 내려질 전망이다. 만일 이별을 결정한다면 새로운 시즌의 첫 경기를 굳이 함께하지 않을 수 있다. 토트넘의 새 시즌을 알리는 경기는 8월 13일 이탈리아 우디네세에서 열리는 유럽축구연맹(UEFA) 슈퍼컵이다.

▲ 손흥민을 둘러싼 소문이 워낙 많기에 현금화에 매진하려는 토트넘도 여러 방안을 만드는 중이다. 그래도 그동안 레비 회장이 보여준 행보를 봤을 때 한국 투어에 손흥민을 배제하는 선택은 가장 현실적이지 않다는 게 중론이다. ⓒ곽혜미 기자


손흥민이 10년을 참고 뛴 덕에 토트넘은 지난 시즌 유로파리그를 우승하며 무관을 탈출했다. 이와 함께 챔피언스리그 챔피언과 맞붙을 수 있는 슈퍼컵 출전권을 확보했다. 당초 손흥민과 이강인(파리 생제르맹)의 대결이 펼쳐질 것으로 보였으나, 손흥민이 새로운 도전을 택한다면 슈퍼컵 전에 결단이 내려질 것으로 보인다.

이럴 경우 손흥민과 이강인의 맞대결은 무산에 무게가 실린다. 손흥민뿐만 아니라 이강인도 이적설이 나돌고 있다. 이강인도 사우디아라비아를 비롯해 이탈리아, 잉글랜드 등의 관심을 받고 있어 슈퍼컵에서 코리안 더비는 힘들어질 수 있다.

▲ 파리 생제르맹 우승으로 다음 시즌 유럽 클럽대항전 시작을 알리는 단판 대회 UEFA 슈퍼컵은 파리 생제르맹과 올 시즌 유로파리그 우승팀 토트넘 홋스퍼의 대진으로 확정됐다. 파리 생제르맹과 토트넘은 오는 8월 13일 이탈리아 우디네의 프리울리 경기장에서 맞붙는다. ⓒ곽혜미 기자"
