date,title,content
20251128,"요리스 소신 발언 조명, 손흥민 없으면 아무것도 아니었던 팀 ""LAFC 완전히 다른 팀""...동료도 인정 ""SON이 모든 걸 바꿨다""","<저작권자(c) 연합뉴스, 무단 전재-재배포, AI 학습 및 활용 금지>
사진=TJ 스포츠 캡처
<저작권자(c) 연합뉴스, 무단 전재-재배포, AI 학습 및 활용 금지>
[스포츠조선 김대식 기자]위고 요리스는 손흥민이 있는 상황에서도 LAFC의 성공을 확신하지 못하는 상태였다.

미국 매체 'LA 데일리 뉴스'는 26일(한국시각) '밴쿠버에서 열린 서부 컨퍼런스 준결승전 패배는 2025년을 아쉽게 마무리했지만, 감독이 떠난 상황에서도 LAFC는 2026년과 그 이후를 위한 든든한 기반을 갖추고 있다'며 2025시즌을 돌아보는 시간을 마련했다.

먼저 매체는 이번 시즌 LAFC가 성공하기에는 부족했다는 팀이었다는 걸 요리스의 인터뷰를 통해 설명했다. '요리스 골키퍼의 시각에서 보면, 지난 주말 밴쿠버에서 당한 LAFC의 시즌 종료 패배는 지난 9개월의 모습이 그대로 반영된 결과였다. '완전히 다른 두 팀 같았다.' 요리스는 서부 콘퍼런스 준결승에서 승부차기 끝에 탈락한 뒤 이렇게 말했다'고 언급했다.
<저작권자(c) 연합뉴스, 무단 전재-재배포, AI 학습 및 활용 금지>
요리스는 전반전에는 패배가 당연할 수밖에 없었던 LAFC의 무기력함을 꼬집은 것으로 보인다. 후반전 LAFC가 기적적으로 살아날 수 있었던 손흥민의 개인 능력 때문이었다. LA 데일리 뉴스도 '경기의 흐름에 전혀 맞지 않는 무기력하고 소극적인 출발로 전반에 두 골을 내줬다. 그러나 후반에는 투지 있고 공격적이며 주도적인 모습을 보이며 경기를 원점으로 돌렸다. 연장 30분 동안은 계속해서 결정적인 기회를 만들어내며 승부를 끝낼 수 있는 찬스를 거듭 잡았지만, 결국 결승골은 나오지 않았다'고 LAFC의 양면성을 지적했다.

시즌 초반부터 LAFC는 성공하기엔 힘든 팀이라는 걸 보여준 바 있다. 매체는 '국제축구연맹(FIFA) 클럽 월드컵에 진출해 첼시와의 개막전에서 나름 존중받을 만한 경기력을 보여줬지만, 브라질의 플라멩구와 무승부로 대회를 마치면서, 팀과 전력 약화된 스쿼드는 마치 숙취에 빠진 듯한 상태가 됐다'고 지적했다.
<저작권자(c) 연합뉴스, 무단 전재-재배포, AI 학습 및 활용 금지>
그 상태로 시즌에 돌입한 결과, LAFC는 우승 후보라고 불릴 만한 경기력을 보여주지 못했다. 플레이오프에는 진출할 순위였지만 우승 후보로 평가받지 못했다.

성공적으로 흘러가지 않았던 모든 게 손흥민 영입 후에 달라졌다. 손흥민이 합류한 LAFC는 단숨에 리그 우승 후보로 거듭났다. 드니 부앙가와 손흥민의 파괴력은 미국 메이저리그사커(MLS)에서는 재앙급 수준이었다.

매체 또한 '여름 이적시장이 열리며 변화가 찾아왔다. 슈퍼스타 손흥민이 LA에 합류했고, 여러 신입 선수들이 후반기에 큰 영향을 미쳤다. 수비수 세르지 팔렌시아는 '우리는 길을 찾지 못하고 있었어요. 경기장 안에서도 조금 길을 잃은 상태였죠. 시즌이 우리에게는 다소 길게 느껴졌어요. 손흥민이 왔고, 모든 걸 바꿔놨어요. 그는 우리에게 희망을 줬고, 엄청난 자신감을 심어줬죠. 경기가 쉽게 이기는 것처럼 흘러가기 시작했고, 그는 우리로 하여금 믿게 만들었어요'라고 말했다'며 손흥민 영입 효과를 인정했다.
<저작권자(c) 연합뉴스, 무단 전재-재배포, AI 학습 및 활용 금지>
하지만 손흥민 혼자서는 역부족이었다. 벤쿠버전에서 손흥민을 제외한 동료들이 공격적으로 전혀 도움을 주지 못했다. 부앙가는 부진했고, 다른 동료들은 손흥민의 짐을 덜어주지 못했다. 결국 LAFC의 2025시즌은 그대로 끝이 났다. 손흥민 때문에 가려졌던 문제점들이 그대로 노출된 마지막 경기였다.

그래도 다행인 점은 LAFC의 미래가 밝다는 점이다. 스티븐 체룬돌로 감독이 떠나지만 손흥민과 부앙가 그리고 요리스와 같은 팀의 주축들이 다음 시즌에도 그대로 팀에 남는다. 매체도 'MLS는 본래 프랜차이즈가 지속적인 성공을 만들어내기 어렵게 설계된 리그지만, 체룬돌로 감독의 자진 사임에도 불구하고 LAFC는 2026년 이후를 향한 기반을 갖춘 것으로 보인다. 2018년 창단 이후 세 번째 감독을 맡게 될 사람이 누구든, 그는 단단하게 뭉쳐 있고 실전 경험이 풍부한 스쿼드를 맡게 될 것'이라며 긍정적인 전망을 내놓았다."
20251128,"""'손흥민 시대' 시작됐다"" MLS, 깜짝 '공식발표!'...LAFC, 신규 영입생 줄줄이 실패하고 있었는데, ""쏘니 오자 득점 시너지""","[SPORTALKOREA] 김경태 기자= ""마지막 국면이 열렸다. 바로 '손흥민 시대'의 시작.""

메이저리그사커(MLS) 사무국은 27일(한국시간) 이번 시즌 로스앤젤스 FC(LAFC)에 대해 총평을 내리며 ""2025년 이들의 한 해는 마치 서로 다른 세 시즌이 한 번에 섞여 있는 듯했다""고 설명했다.



우선 초반 LAFC의 흐름을 좋지 못했다. 큰 기대를 안고 지정 선수(DP)로 품에 얻은 젠기즈 윈데르는 16경기 2골 3도움이라는 초라한 성적만을 남긴 채 페네르바흐체 SK로 복귀했으며, '월드컵 위너' 올리비에 지루 역시 전반기 19경기 3골 1도움에 그치며 저조한 기록을 마지막으로 LOSC 릴로 이적했다.

또 다른 DP였던 자바이로 딜로순은 아예 MLS에서 6경기 출전이 2골이 전부인 채 팀을 떠나는 어처구니없는 상황까지 벌어졌다. 결국 LAFC의 주요 영입은 대부분 기대에 미치지 못하며, 투자 실패라는 평가가 잇따랐다.

사무국 역시 이 시점을 두고 ""새로운 시즌이라기보다는 과도기에 가까웠다""고 표현했다.



이러한 분위기가 뒤바뀌기 시작한 것은 여름부터였다. 구단은 프랭키 아마야, 마티외 쇼이니에르, 라이언 포티어스 등을 데려오며 뎁스 강화에 박차를 가했고, 여기에 더해 화룡점정으로 손흥민까지 품에 얻으며 반등하기 시작했다. 사무국도 이에 대해 ""마지막 국면이 열렸다. 바로 '손흥민 시대'의 시작이었다""며 ""손흥민이 들어오자, 팀은 3-4-2-1 포메이션으로 전환했고, 이는 드니 부앙가와 즉각적인 득점 시너지를 만들어냈다""고 설명했다.

실제 손흥민은 입단 석 달 만에 부앙가에 이어 두 번째로 팀 내 최다 공격 포인트(12골 4도움)를 올렸으며, 네 차례의 매치데이 베스트 선정되기도 했으며, MLS 올해의 득점 수상, 신인왕 후보에 오르는 기염을 토했다.



다만 아쉽게도 밴쿠버 화이트캡스 FC와의 MLS컵 서부 콘퍼런스 준결승전에서 승부차기까지 가는 접전 끝에 패배해 고배를 삼켰지만, 더 나은 미래가 기다리고 있다. 사무국은 ""우승 트로피는 없었고, 이제 LAFC는 여러 숙제를 안은 채 오프시즌에 돌입하게 됐으나, LAFC는 확실히 북중미 지역 최상위권 전력임을 입증했고, 내년 한 단계 더 도약할 여지는 충분하다""고 강조했다.

이러한 이유에 대해선 ""내년 시즌 손흥민-부앙가 듀오의 풀타임 시즌이 가장 기대된다. 스쿼드 대부분이 꾸준함을 강점으로 하는 베테랑들인 만큼, 두 슈퍼스타 듀오의 파괴력은 팀의 절대적 무기""라며 극찬을 아끼지 않았다.

사진=로스앤젤스 FC, 게티이미지코리아

취재문의 sportal@sportalkorea.co.kr"
20251128,"손흥민 ""늙은이 필요하면 연락해"" 토트넘 복귀 날짜 잡혔다…12월 리버풀전서 英 현지 팬과 작별 인사","▲ 손흥민이 토트넘 팬들 앞에서 직접 눈을 맞추고 손을 흔드는 마지막 인사가 계획되고 있다. 손흥민이 보여준 화려했던 10년의 역사가 머지않아 확실하게 마무리된다. ⓒ 토트넘 홋스퍼
▲ 손흥민이 토트넘 팬들 앞에서 직접 눈을 맞추고 손을 흔드는 마지막 인사가 계획되고 있다. 손흥민이 보여준 화려했던 10년의 역사가 머지않아 확실하게 마무리된다.


[스포티비뉴스=조용운 기자] 손흥민(33, 로스앤젤레스FC)이 마침내 미뤄뒀던 마지막 인사를 위해 런던으로 향한다. 토트넘 홋스퍼 팬들이 기다려온 공식 고별식이 성사 단계에 들어가면서 북런던에서의 10년을 마무리하는 진짜 엔딩이 펼쳐질 전망이다.

영국 '토트넘 홋스퍼 뉴스'는 28일(한국시간) ""손흥민이 팬들의 예상보다 빨리 북런던으로 돌아올 가능성이 있다""고 전했다. 이와 관련해 '스퍼스 웹'도 ""손흥민이 내달 21일 리버풀과 홈경기에 초청될 가능성이 매우 높다고 덧붙였다.

손흥민의 토트넘 방문은 단순한 행사가 아니다. 벌써 경기 전 환영 프레젠테이션 상영과 하프타임 헌정식이 준비된 사실까지 구체적으로 드러났다. 토트넘 장비팀부터 조리, 의무, 분석팀 등 손흥민 시절을 함께한 내부 스태프들까지 총출동할 예정이다.

지난여름 이적 발표와 동시에 토트넘을 떠나야 했던 손흥민은 정작 현지 홈팬들에게 마지막 인사를 건네지 못했다. 프리시즌 도중 한국에서 LAFC행을 공식화하며 서울월드컵경기장에서 작별을 전했지만, 10년을 함께한 북런던 팬들과 교감하지 못했다.

손흥민은 몇번이고 토트넘을 방문하려는 의사를 보여왔다. 이번에도 손흥민이 먼저 ""런던 팬들에게 정식 인사를 하고 싶다""고 요청하면서 상황이 움직였다. 최근 콘텐츠 촬영에서 ""내 마지막 경기는 한국이었다. 홈 팬들과는 제대로 헤어지지 못했다. 서로 인사해야 할 자격이 있다고 생각한다""고 강조했다.

▲ 손흥민이 토트넘 팬들 앞에서 직접 눈을 맞추고 손을 흔드는 마지막 인사가 계획되고 있다. 손흥민이 보여준 화려했던 10년의 역사가 머지않아 확실하게 마무리된다.
▲ 손흥민이 토트넘 팬들 앞에서 직접 눈을 맞추고 손을 흔드는 마지막 인사가 계획되고 있다. 손흥민이 보여준 화려했던 10년의 역사가 머지않아 확실하게 마무리된다.


그래서 토트넘 역시 손흥민의 의중을 존중하며 일정을 맞춘 것으로 알려졌다. 손흥민이 한국에서 토트넘 팬들을 향해 남겼던 마지막 인터뷰도 다시 회자되고 있다. 당시 손흥민은 ""혹시라도 이 늙은이에게 도움이 필요하면 연락하라. 나는 언제나 너희 곁에 있을 것""이라며 웃음을 보였지만 이내 울컥한 목소리로 동료들에게 마지막 메시지를 남겼다.

""얘들아 안녕, 나는 전 주장이다. 너희 덕분에 매일이 특별했다. 이제는 너희 차례다. 이 팀을 더 특별하게 만들어라""라고 말했다. 이어 ""맹세코 너희를 가장 사랑한다. 내가 이 팀의 일부였다는 사실이 정말 감사하다. 우리는 언제나 친구""라는 말로 긴 여정을 마무리했다.

그만큼 손흥민이 남긴 족적은 단순한 기록 이상의 의미다. 2015년 이적료 2,200만 파운드(약 425억 원)에 합류한 그는 10년 동안 토트넘의 얼굴로 자리 잡았다. 통산 454경기 173골 101도움의 성적표는 구단 역대 득점 랭킹 5위에 해당한다. 이에 힘입어 2021-22시즌 아시아 선수 최초 프리미어리그 득점왕에도 올랐다. 지난 시즌에는 유럽축구연맹(UEFA) 유로파리그 우승 트로피를 주장 완장과 함께 들어 올렸다.

손흥민의 북런던 복귀가 머지 않아다. LAFC가 미국프로축구 메이저리그사커(MLS) 플레이오프에서 일찍 탈락하면서 이적한 팀에서의 시즌을 마무리했다. 손흥민은 현재 한국으로 돌아와 짧은 휴식에 들어간 상태다. 토트넘과 작별인사가 확실하게 결정되면 다시 비행기에 몸을 실을 예정이다.

▲ 손흥민이 토트넘 팬들 앞에서 직접 눈을 맞추고 손을 흔드는 마지막 인사가 계획되고 있다. 손흥민이 보여준 화려했던 10년의 역사가 머지않아 확실하게 마무리된다."
20251128,“손흥민 주장하지 마!” 토트넘 팬들 또 불만 터졌다…“실수해 놓고 바로 들어가?” 로메로 작심 비판,"[골닷컴] 이정빈 기자 = 토트넘 주장은 감당하기 어려운 자리인 걸까. 손흥민(LAFC)을 이어서 토트넘 주장으로 임명된 크리스티안 로메로가 팬들로부터 비판받고 있다.

토트넘은 27일(한국 시각) 프랑스 파리에 있는 파르크 데 프랭스에서 열린 2025-26시즌 유럽축구연맹(UEFA) 챔피언스리그(UCL) 리그 페이즈 5차전 파리 생제르맹과 원정 경기에서 3-5로 패했다.

이날 선발 출전한 로메로는 평소와 다르게 부진했다. 후방에서 안정감이 떨어지는 모습으로 여러 차례 실점에 관여했다. 상대로부터 압박받는 동료에게 패스를 건네거나, 박스 안에서 핸드볼 반칙으로 페널티 킥을 내주는 등 어려운 하루를 보냈다.


그런데 더 큰 문제는 경기 후에 터졌다. 로메로가 파리 원정을 온 팬들에게 인사하지 않고 라커룸으로 향했다는 주장이 나왔다. 조지라는 한 토트넘 팬은 소셜네트워크서비스(SNS)를 통해 “로메로가 곧장 터널로 가는 걸 보고 화가 났다”라며 “로메로는 세 차례나 실점에 관여했다. 이런 선수가 우리 주장인가?”라고 분노했다.

조지에 따르면, 로메로와 로드리고 벤탕쿠르만이 원정 팬들에게 다가가지 않았다. 두 선수를 제외한 나머지 선수들은 먼 길을 온 팬들에게 감사함을 드러냈다. 조지가 해당 이야기를 SNS에 작성하자, 로메로를 두고 토트넘 팬들 사이에서 논쟁이 벌어졌다.

한 팬은 “로메로가 터널로 나가기 전에 박수를 치긴 했다. 그저 경기장을 나가고 싶어 했을 뿐이다. 그를 비난할 수 없다”라고 옹호했다. 다만 다른 팬은 “여전히 책임에서 벗어나고 싶어 하는 눈치다”라고 로메로의 리더십을 의심했다. 여기에 더해 일부 팬은 로메로가 주장답지 않다고 전했다.


토트넘 팬들이 구단 주장을 향해 의심을 보낸 건 로메로가 처음이 아니다. 직전 주장이었던 손흥민 역시 상당한 비판에 시달린 바 있다. 지난 시즌 토트넘이 부진에서 허덕이자, 팬들은 손흥민에게 책임을 넘겼다. 이들은 “손흥민에게 주장 완장을 주면 안 된다”라고 외치며 손흥민을 깎아내렸다.

새롭게 구단 얼굴이 된 로메로 역시 비슷한 상황에 직면했다. 토마스 프랑크 감독의 토트넘이 경기장 안팎으로 흔들리는 가운데, 로메로의 리더십이 자연스럽게 입방아에 올랐다. 신임주장 로메로는 이 혼란스러운 상황을 정리할 수 있을까.

사진 = 게티이미지"
20251128,"작심발언! ""배짱도 없다, 선수단 감독 존중 안해""...손흥민 나간 뒤 토트넘, 프랑크 체제 위기감 고조 ""라커룸 장악 못 하면 아무 소용 없어""","[SPORTALKOREA] 김경태 기자= 토트넘 홋스퍼 FC의 토마스 프랑크 감독을 향한 압박이 거세지고 있다.

토트넘은 최근 10경기에서 3승 2무 5패를 기록하며 저조한 성적을 거두자, 위기가 감돌고 있다. 특히 24일(이하 한국시간) 아스널 FC와의 북런던 더비에서 1-4로 대패하자, 프랑크 감독의 경질을 촉구하는 목소리가 높아졌다.



물론 감안할 요소도 있다. 프랑크 감독이 토트넘 지휘봉을 잡은 지 아직 5개월밖에 지나지 않았고, 지난 10년간 팀의 기둥 역할을 했던 손흥민의 이탈 공백도 결코 작지 않다. 여기에 도미닉 솔랑케, 데얀 쿨루셉스키, 제임스 매디슨 등 잔류 핵심 멤버들마저 부상으로 이탈하면서 전력 누수가 더욱 커졌다는 점도 무시할 수 없다.

또한 프랑크 감독은 플랜 A만 고집하지 않고, 상대에 따라 전술과 포메이션을 유연하게 바꾸는 타입이라, 핵심 전력이 복귀하고 스쿼드가 제대로 갖춰질 경우, 상승효과를 기대해 볼 수 있다.



다만 당장의 성적이 나오지 않자, 프랑크 감독의 전술 유동성이 팀을 혼란에 빠뜨리고 있다는 비판도 나오고 있다. 과거 토트넘에서 활약한 라몬 베가는 27일 영국 매체 '토크스포츠'와의 인터뷰를 통해 ""그는 2초마다 생각을 바꾼다. 엔지 포스테코글루에게 어떤 비판을 하든, 그는 적어도 '배짱'이 있었다. 자신이 원하는 축구를 밀어붙였다""고 말했다.

이어 ""선수들은 지도자가 일관되게 무엇을 원하는지 알아야 한다. 포스테코글루는 부상으로 어린 선수들을 주로 쓸 수밖에 없던 시즌에도, 선수들은 그를 따랐다. 하지만 지금 토트넘 선수단은 프랑크를 존중하지 않는 것처럼 보인다""고 얘기했다.

베가는 ""전술이 계속 바뀌니 선수들이 어디로 움직여야 하는지조차 헷갈린다. 이렇게 되면 선수들의 자신감은 완전히 무너진다. 최근 두 경기에서 그 모습이 그대로 드러났다""며 ""선수단을 장악하지 못하면 아무리 좋은 감독이라도 소용없다. 프랑크는 배짱이 없다. 이 일을 해낼 성격이 아니""라고 발언했다.

사진=게티이미지코리아

취재문의 sportal@sportalkorea.co.kr"
20251128,리버풀 초대박 소식...레알 마드리드 '194cm 괴물 센터백' FA 계약 포기! 재계약 가능성까지 열렸다,"이브라히마 코나테./스포츠키다

[마이데일리 = 노찬혁 기자] 레알 마드리드가 최근 저조한 활약을 보여주고 있는 이브라히마 코나테(리버풀)의 영입 계획을 철회했다.

글로벌 매체 '디 애슬레틱'의 데이비드 온스테인 기자는 28일(이하 한국시각) “레알 마드리드는 코나테 영입을 검토했으나, 영입 의사가 없다는 입장을 리버풀 측에 전달했다”고 보도했다.

프랑스 출신 센터백 코나테는 194cm, 95kg의 강력한 피지컬을 활용한 대인 방어 능력과 공중볼 장악력을 갖춘 선수로 평가받는다. 안정적인 빌드업과 패스 능력도 눈에 띄며, 세트피스 상황에서는 득점까지 가능한 수비 자원으로 인정받고 있다.

코나테는 2021-22시즌을 앞두고 RB 라이프치히를 떠나 리버풀에 합류했다. 리버풀 입단 이후 잔부상에 시달렸으나, 지난 시즌 42경기 2골 2도움을 기록하며 리버풀의 통산 20번째 잉글랜드 프리미어리그(EPL) 우승에 기여했다.
이브라히마 코나테./게티이미지코리아

리버풀은 그의 공헌도를 높게 평가하고 재계약을 추진했지만, 제안을 코나테가 거절하면서 협상이 교착 상태에 놓였다. 현재 계약 기간은 2026년 6월까지이며, 내년 여름이면 자유계약(FA) 자격을 획득해 이적 시장에서 자유롭게 움직일 수 있다.

이 상황 속 레알 마드리드가 코나테에게 관심을 드러냈다. FA 영입 전략에 능한 레알 마드리드는 선수에게 계약금으로 보전하는 방식으로 여러 차례 대형 영입을 성사시켜 왔다. 지난 여름에도 리버풀 유스 출신 트렌트 알렉산더 아놀드를 같은 방식으로 데려온 바 있다.

그러나 올 시즌 코나테 부진이 이어지며 레알 마드리드가 영입 경쟁에서 한 발 물러선 것으로 보인다. 레알 마드리드는 다른 센터백 영입 가능성에 무게를 두고 있다.
이브라히마 코나테/게티이미지코리아

코나테는 바이에른 뮌헨의 관심도 받고 있다. 독일 ‘겟 풋볼 저매니’는 “뮌헨이 리버풀 수비수 코나테 측근들과 잠재적 이적을 두고 접촉 중”이라고 보도했다.

하지만 리버풀과의 재계약 가능성도 여전히 남아 있다. 온스테인 기자는 “코나테의 리버풀 계약 문제는 아직 해결되지 않았으며, 어떤 방향으로든 전개될 수 있다”고 설명했다."
20251128,"클롭, 1년 4개월 만 안필드 컴백→""오직 리버풀"" 확고한 철학 고수, 이번엔 감독직 복귀? ""슬롯 경질 시 1순위 후보""","[SPORTALKOREA] 박윤서 기자= 위르겐 클롭 감독이 다시금 리버풀 FC 지휘봉을 잡는 모습을 볼 수 있을까.

영국 '기브미스포츠'는 27일(한국시간) ""리버풀은 아르네 슬롯이 경질되는 상상할 수 없는 일을 생각하고 있다. 만일 이 같은 상황이 현실이 된다면 리버풀의 지휘봉을 잡기 위해 다양한 감독이 손을 내밀 것이다""라고 보도했다.

매체는 11명의 후보군을 조명하며 클롭 전 리버풀 감독을 1순위로 꼽았다. 최근 클롭이 감독직을 맡을 생각이 있다면 리버풀 복귀 타이밍으론 현시점이 제격이란 주장에 무게가 실리고 있다.



리버풀은 올 시즌 리그 12경기에서 6승 0무 6패(승점 18)를 거두며 정처 없이 흔들리고 있다. 슬롯은 지난 시즌 클롭이 9년 동안 맡아온 구단을 이어받아 프리미어리그(PL) 우승이란 결과물을 만들어냈다. 하지만 올 시즌 막대한 규모의 지원을 받고도 기대에 미치지 못하고 있다. 

이에 리버풀이 슬롯을 경질하는 결단을 내릴 수 있단 주장이 피어오르기 시작했다. 자연스레 구단 역대 최고의 명장으로 불리는 클롭의 복귀 가능성이 거론되고 있다. 클롭은 앞서 ""나는 오직 리버풀이다""라며 ""PL에서 다른 구단을 절대 맡지 않겠다고 말했기에, 만일 돌아오게 된다면 선택지는 리버풀이다""라고 밝힌 바 있다.



클롭은 지난해 1월 번아웃 등을 이유로 리버풀과의 동행을 마무리했다. 안식년을 선언한 클롭은 레드불 글로벌 축구 프로젝트의 책임자 역할을 맡았다. 이후 몇 차례 공식 석상에 등장하긴 했지만, 리버풀과는 거리를 뒀다. '디 애슬레틱' 등에 따르면 클롭은 지난 3월 ""나는 우승이 확실해져야 리버풀로 돌아갈 예정이다. 우승 퍼레이드 버스에는 타지 않을 것이다. 그저 거리에서 버스를 지켜보는 팬들과 함께할 것이다""며 ""구단의 마지막 리그 경기 때 리버풀을 방문할 것 같다. 솔직히 그전에는 돌아가고 싶지 않다. 혹시 내가 방문한 뒤 패한다면 불운을 가지고 오는 것 같은 기분이 들 것 같다""라고 말하며 신중한 태도를 유지했다. 



실제로 클롭은 사임 후 1년 4개월 만인 5월이 되어서야 리버풀서 첫 공식 일정을 소화하며 안필드로 복귀했다. LFC 재단의 명예 홍보 대사 자격으로 5월 23일 진행되는 '갈라 볼(Gala Ball)' 행사에 연설자로 나섰다. 리버풀은 ""클롭은 LFC 재단의 오랜 지지자로 활동했다. 또한 홍보대사 역할을 도맡아 구단을 떠난 이후에도 깊은 애정을 이어갔다. 그는 재단 최초의 명예 홍보대사로 임명되어 안필드로 돌아온다""라고 설명했다.

사진=리버풀 SNS, 게티이미지코리아

취재문의 sportal@sportalkorea.co.kr"
