date,title,content
20250305,"[속보] 김민재+이강인 동시 날벼락...""한국 너무 좋아"" 월클, 뮌헨 재계약 불발→PSG 제안 도착","<저작권자(c) 연합뉴스, 무단 전재-재배포, AI 학습 및 활용 금지>
<저작권자(c) 연합뉴스, 무단 전재-재배포, AI 학습 및 활용 금지>
[스포츠조선 김대식 기자]바이에른 뮌헨에서 김민재 동료로 뛰고 있는 조슈아 키미히가 이강인이 있는 파리 생제르맹(PSG)의 제안을 받은 것으로 확인됐다.

독일 스포르트 빌트에서 일하며 바이에른 내부 소식에 능통한 크리스티안 폴크 기자는 5일(한국시각) 개인 SNS를 통해 ""키미히는 이번 여름 이적하는 걸 두고 PSG로부터 진지한 제안을 받았다""고 밝혔다.

바이에른의 핵심 중 핵심인 키미히는 현재 미래가 매우 불투명한 상황이다. 마누엘 노이어, 토마스 뮐러와 함께 바이에른의 얼굴 중 하나인 키미히는 이번 시즌을 끝으로 구단과의 계약이 만료된다.

바이에른은 빈센트 콤파니 감독 밑에서 다시 능력을 입증한 키미히를 붙잡으려고 했다. 키미히 역시 바이에른에 충성심을 보여주면서 재계약에 긍정적인 입장을 보였다. 하지만 최근 사이에 모든 게 와해됐다.
<저작권자(c) 연합뉴스, 무단 전재-재배포, AI 학습 및 활용 금지>
바이에른은 공식적으로 키미히에게 제안했던 재계약 조건을 철회한 상태다. 이유로는 2가지가 언급되고 있다. 바이에른은 매우 좋은 조건에도 불구하고, 재계약을 망설이는 키미히에게 실망해 재계약 제안을 물렸다는 소식도 있으며 키미히와 바이에른 실무진 사이에서 합의된 사안이 구단 수뇌부로부터 반려됐다는 이야기도 있다.

어찌됐든 월드 클래스급 선수를 잃게 될 위기에 처한 상태다. 키미히급의 선수가 나가는 건 김민재한테는 매우 좋지 못한 소식이다. 키미히는 현재 다른 구단의 오퍼도 들으려고 하는 중이다. 이때 지난 여름부터 키미히에게 진지한 관심을 보였던 PSG가 다시 등장했다.
<저작권자(c) 연합뉴스, 무단 전재-재배포, AI 학습 및 활용 금지>
키미히는 현재 매우 높은 주급을 받고 있는데, PSG라면 충분히 키미히의 연봉을 감당할 수 있다. 키미히가 합류하는 것 자체는 PSG에 좋은 일이지만 이강인의 입지는 더욱 좁아질 수 있다.

이강인은 2025년 들어서 PSG 주전 경쟁에서 밀려서 교체 위주로 경기를 뛰고 있다. 키미히가 PSG로 온다면 미드필더 자리에서 확실한 한 자리를 차지할 가능성이 높아 이강인의 주전 경쟁 난이도는 훨씬 더 올라갈 것이다.

키미히는 보스만 룰에 따라서 현재 어느 구단과도 여름 이적을 두고 합의를 할 수 있는 상태다. 아스널, 레알 마드리드, 리버풀 등 여러 구단과 연결되고 있는 중인 가운데, PSG가 깜짝 등장했다.
<저작권자(c) 연합뉴스, 무단 전재-재배포, AI 학습 및 활용 금지>
한편 키미히는 지난 여름 바이에른이 방한했을 때, 한국 문화를 제일 좋아한 선수 중 하나다. 키미히는 당시에 ""한국에서 너무 짧은 시간을 보냈다. 그래도 오늘 경기장에서 정말 좋은 분위기를 만들어주셔서 상당히 기분이 좋았다. 어제 김민재가 식당에 초대해서 다녀왔는데 거기서 한국 음식을 잘 먹고, 너무 좋았다""고 고백한 적이 있다."
20250305,손흥민 해냈다! EPL 1위 초대박…969억 뮌헨행 2021년 불발탄→올여름 터트릴까,"(엑스포츠뉴스 용환주 기자) 아무리 손흥민을 비판해도 현실은 아직도 잉글랜드 프리미어리그(EPL) 최고의 선수 중 한 명이란 것이다. 

레프트윙에선 프리미어리그 1위인 것이 드러났다.

최근 손흥민이 영국 현지에서 비판을 받고 있다. 토트넘이 올 시즌(2024-2025) 리그 27경기 기준, 13위라는 아쉬운 성적을 기록 중이다. 자국 카라바오컵(리그컵)과 FA컵도 탈락했다. 남은 컵대회는 유럽축구연맹(UEFA) 유로파리그뿐이다. 

토트넘의 절망스러운 부진에 감독과 선수단이 많은 비판을 받았다. '캡틴' 손흥민도 예외가 아니다. 



영국 매체 '팀 토크'는 1일(한국시간) ""손흥민은 예전만큼 강력함이 없다. 더 이상 맹렬한 스피드를 낼 수 없다. 뛰어난 골 결정력도 전성기만큼 확실하지 않다""라며 주장했다. 

이어 ""토트넘은 현실적으로 손흥민을 매각하기 어렵다. 손흥민이 앞으로 전반전인 능력이 하락할 것이기 때문이다""라며 ""안지 포스테코글루 토트넘 감독이 계속 사령탑으로 있을 거면 손흥민은 좋은 로테이션 자원이 될 것이다""라고 주장했다. 

더 나아가 주장 완장까지 내놓으라고 했다. 매체는 ""토트넘이 앞으로 필드 위에서 더 강한 리더십을 보여줄려면 손흥민이 주장직을 내려놓아야 한다. 손흥민을 중심으로 한 지금의 토트넘은 계획대로 전진하지 못하는 모습을 보여주고 있다""라고 설명했다. 사실상 토트넘에 앞으로 손흥민의 입지를 줄이라는 소리다.

손흥민 거취 논쟁은 그간 마이너 매체 위주로 거론됐으나 지난달 27일 영국 '더 타임스'가 끼어들면서 불이 붙었다.
신문은 ""토트넘은 손흥민과 재계약을 통해 그가 구단 역사상 최고의 선수 중 한 명으로 남길 원하고 있다. 그러나 손흥민이 계약 연장에 회의적인 태도를 보이면서 협상에 난항을 겪고 있다""라고 보도했다.

매체에 따르면 토트넘은 손흥민을 매각할 생각이 없으며 토트넘에서 은퇴하기를 바라지만 오히려 손흥민이 토트넘의 재계약 제안을 받아들이지 않고 있다는 얘기다. 



토트넘 팬들이 놀랄 수밖에 없는 내용이다. '더 타임스'는 영국 최고의 정론지로, 전세계 많은 사람들이 구독한다.

같은 날 토트넘도 손흥민과의 결별을 각오하고 있다는 보도가 나왔다.

영국 매체 '풋볼 인사이더'는 ""토트넘 직원들 사이에서 손흥민에 대한 우려가 나오고 있다""며 ""그래서 손흥민의 잠재적인 대체자를 고르고 있는 상황이다. 대안도 나왔다""고 했다.

크리스털 팰리스의 에체베리 에제, FC바르셀로나 페란 토레스 등이 매체가 꼽은 손흥민 대안이다.

토트넘은 올여름에 손흥민을 팔지 못하면 내년 여름에 한 푼도 받지 못하고 잃어버릴 수 있어 그를 원하는 팀의 제안을 들어볼 가능성이 크다. 손흥민의 이적 의지가 굳건하다면 토트넘도 놔줄 수밖에 없다.

글로벌 매체 ESPN도 손흥민 얘기를 내놨다. 무너지는 토트넘 속에서 손흥민도 힘을 잃었다며 그의 사라진 미소를 조명했다.



특히 손흥민과 프리미어리그에서 47골을 합작한 해리 케인이 2023년 여름 토트넘을 떠난 뒤 손흥민이 미소를 잃었다며 그의 경기력 저하가 마땅한 파트너 사라진 뒤 본격화됐다는 분석이 나왔다.

ESPN은 1일 ""손흥민에게 무슨 일이 잘못 일어난 걸까? 토트넘에서 손흥민의 미래는 어떻게 될까?""라며 손흥민이 토트넘에서 행복하지 않으며 토트넘을 떠나기로 결정할 수 있다고 보도했다.

그런 논쟁이 불붙은 상황에서 토트넘 소식을 주로 전하는 영국 매체 '스퍼스웹'은 지난 2일(한국시간) ""바이에른 뮌헨이 지난 18개월 동안 해리 케인과 에릭 다이어를 영입한 데 이어, 또 다른 토트넘 선수 영입을 노리고 있다""고 보도했다.

뮌헨과 연결될 만하다. 손흥민은 냉정하게 보면 여전히 토트넘 최고의 공격수다. 



독일 이적시장 전문 사이트 '트란스퍼마르크트'는 지난달 26일 ""2024-2025시즌 EPL에서 포지션별 공격 포인트가 가장 많은 베스트 11""라는 주제로 만든 라인업을 공개했다. 손흥민은 당당하게 왼쪽 측면 공격수 자리에 이름을 올렸다. 

포메이션은 4-4-2였다. 에데르송(맨체스터 시티)이 골키퍼 장갑을 착용했다. 안토니 로빈슨(풀럼), 가브리엘 마갈량이스(아스널), 마크 게히(크리스탈 팰리스),  트렌트 알렉산더-아놀드(리버풀)이 3선을 구성했다. 손흥민, 엔조 페르난데스(첼시), 브루누 기마랑이스(뉴캐슬), 모하메드 살라(리버풀)가 2선으로 나왔다. 엘링 홀란(맨시티), 알렉산데르 이사크(뉴캐슬)는 1선에 이름을 올렸다. 

가장 많은 공격 포인트를 기록 중인 선수는 우측면에 있는 살라다. 그는 리그 27라운드까지 무려 42개의 공격 포인트(25득점-17도움)를 쌓았다. 현재 리그 득점왕, 도움왕 모두 살라다. 

두 번째로 많은 공격 포인트를 만든 선수는 이사크 (19득점-5도움)다. 다음은 엘링 홀란((20득점-2도움)이었다. 



네 번째로 많은 공격 포인트를 기록 중인 선수는 손흥민이다. 그는 현재까지 6득점 9도움으로 총 15 공격 포인트를 만들었다. 토트넘에서 가장 높은 수치다. 

순수 득점력만 보면 손흥민이 좌측 윙어 최고는 아니다. 

루이스 디아스(리버풀)가 9득점으로 최다 득점자다. 이어 코디 학포(리버풀)가 8득점, 당고 오타라(본머스), 알렉스 이워비(풀럼), 미토마 가오루(브라이턴 앤드 호브 앨비언), 케빈 샤데(브렌트포드)가 7득점을 기록 중이다. 손흥민과 앤서니 고든(뉴캐슬 유나이티드), 가브리엘 마르티넬리(아스널), 일리만 은디아예(에버턴)가 6득점으로 뒤를 쫒고 있다 여기에 도움을 합치면 손흥민이 가장 높은 공격 포인트를 기록 중인 선수가 된다. 그래서 이름을 올린 것이다.

손흥민이 '팀 토크'의 주장처럼 과거만큼 치명적인 모습이 줄어든 건 사실이다. 높은 공신력을 자랑하는 미국 매체 '디 애슬레틱'은 ""지난 1월 기준 손흥민의 리그 성과는 약간 감소했다. 주요 득점 지표인 경기당 기대 득점(xG), 비-페널티 xG, 경기당 득점에서 이번 시즌 기록은 작년보다는 2022-23시즌에 더 가까운 모습을 보였다""라고 과거 만큼 폭발적인 모습이 줄었다고 분석했다.



하지만, 손흥민은 여전히 토트넘에서 가장 치명적인 공격수다. 

축구 통계 매체 '풋몹'에 따르면 토트넘 소속 선수 중 지금 프리미어리그에서 경기당 평균 평점이 가장 높은 선수는 손흥민(7.43)이다. 평균 평점이 높다는 건 기복 없이 매 경기 뛰어난 활약을 가장 많이 보여주고 있다는 의미다. 

아무리 손흥민이 과거만큼 위협적이지 않아도 여전히 팀을 넘어 잉글랜드 1부리그 대표 윙어인 것은 변함없는 사실이다.

뮌헨은 지난 2021년 손흥민은 5년 급여 총액 969억원에 데려오려고 계획했던 것으로 알려졌다. 당시엔 토트넘의 반대가 있었고 결국 재계약으로 끝났으나 이번엔 뮌헨행에 점점 다가설 가능성이 크다. 손흥민은 아직 프리미어리그 정상급 윙어다.

사진=연합뉴스 / 트랜스퍼마크트 / 365 SCORES"
20250305,"손흥민 바이에른 뮌헨 969억 '초대박 5년 계약' 날아갔는데…토트넘 방출리스트 SON 삭제라니, 'HERE WE GO 1티어 인증'","(엑스포츠뉴스 김정현 기자) 손흥민의 우승 열망은 신기루가 될 것인가.

토트넘 홋스퍼를 오랜 시간 관찰한 전담기자가 전망한 방출 명단에 손흥민의 이름은 없었다. 꾸준히 이적설이 불거지지만 모든 것이 허상이 될 수 있다. 

영국 매체 풋볼런던이 지난 3일(한국시간) 오랜 시간 토트넘 전담 기자로 활동 중인 알레스데어 골드가 예상하는 토트넘의 올 여름 방출 명단을 소개했다. 



7명을 고른 골드는 손흥민은 방출 명단에 포함시키지 않았다. 손흥민 외에 히샬리송, 티모 베르너, 브리안 힐, 이브스 비수마, 세르히오 레길론, 프레이저 포스터와 알피 화이트먼이다. 7명 모두 현재 시점에서 전력 외 자원 혹은 백업 멤버다. 힐은 현재 지로나(스페인) 임대 중이다. 

손흥민의 이름이 빠진 건 최근까지 불거진 손흥민의 이적설과 다른 전망이다. 맨체스터 유나이티드에 이어 최근에는 바이에른 뮌헨(독일) 이적설이 불거진 상태다. 

손흥민 거취에 불을 붙인 건 지난달 27일 영국 '타임즈'의 보도가 나오면서부터다. 당시 매체는 ""토트넘은 손흥민과 재계약을 통해 그가 구단 역사상 최고의 선수 중 한 명으로 남길 원하고 있다. 그러나 손흥민이 계약 연장에 회의적인 태도를 보이면서 협상에 난항을 겪고 있다""라고 보도했다.



매체에 따르면 토트넘은 손흥민을 매각할 생각이 없으며 토트넘에서 은퇴하기를 바라지만 오히려 손흥민이 토트넘의 재계약 제안을 받아들이지 않고 있다는 얘기다. 

현재 2026년 여름까지 토트넘과 계약돼 있는 손흥민은 이번 여름 이적시장이 이적료가 발생하는 마지막 시장이다. 내년 겨울로 넘어가면 그는 보스만룰에 의해 해외 타 구단과 자유롭게 협상이 가능하고 FA 이적을 할 수 있다. 이적료가 발생하지 않기 때문에 토트넘에게는 손해가 될 수 있다. 

토트넘도 대안을 준비하는 눈치다. 영국 매체 '풋볼 인사이더'는 27일 ""토트넘 직원들 사이에서 손흥민에 대한 우려가 나오고 있다""며 ""그래서 손흥민의 잠재적인 대체자를 고르고 있는 상황이다. 대안도 나왔다""고 했다.



크리스털 팰리스의 에체베리 에제가 매체가 꼽은 손흥민 대안이다.

손흥민이 올 시즌 득점력이 떨어지면서 그를 교체해야 한다는 여론도 존재한다. 

영국 매체 팀토크는 ""손흥민이 예전만큼 강력하지 않다는 점은 부정할 수 없지만, 여전히 팀에 가치는 있다""며 ""손흥민을 로테이션 자원으로 활용하는 것도 방법이 될 수 있다. 다만 주장직에서는 내려와야 한다. 토트넘에는 더 강한 리더십이 필요하다""고 전했다.

이어 ""현실적으로 생각했을 때 토트넘이 여름 이적시장에서 손흥민을 매각하더라도 준수한 금액을 회수하기는 힘들 것""이라며 ""손흥민은 오는 7월 33세가 되고, 그의 경기력이 전반적으로 하락세에 접어들었기 때문""이라고 했다.



그러면서 ""손흥민이 토트넘에 남으려면 주장직을 포기해야 할 것이다. 현재는 경기가 계획대로 흘러가지 않으면 쉽게 무너지는 느낌이 있다""고 덧붙였다.

또한 ""토트넘은 다음 시즌 손흥민을 선발에서 벤치 자원으로 내려야 한다. 손흥민은 예전만큼 강력함이 없다. 더 이상 맹렬한 스피드를 낼 수 없다. 뛰어난 골 결정력도 전성기만큼 확실하지 않다""라고 비판하며 손흥민을 벤치로 내릴 필요도 있다고 주장했다.
영국 매체 기브미스포츠는 ""손흥민의 경기력 회복이 쉽지 않은 상황에서 부상 위험은 커지고 있다""며 ""토트넘이 부상 없는 스쿼드를 유지할 경우 손흥민은 선발 라인업에서 밀려날 가능성이 크다""고 경고했다.

이어 ""손흥민은 다음 시즌 벤치에 앉거나 새로운 도전을 선택해야 할 수도 있다. 이제 손흥민이 당연히 선발인 시대는 끝났다""고 목소리를 높였다.



손흥민이 토트넘에서 더는 행복하지 않다는 주장도 등장했다. 

글로벌 스포츠 매체 ESPN은 1일 ""손흥민이 골을 넣지 못하는 것이 문제가 아니라 웃지 않는 것이 문제라고 했다. 토트넘이 어려움을 겪고 있는 것을 진심으로 느끼고 있고 자신의 탓으로 크게 느끼는 것을 확인하고 있다""라고 전하기도 했다. 

ESPN 기자인 마크 오그덴은 ""기록을 보면 그는 공식전 35경기 10골 10도움을 기록했다. 나쁘지 않다. 동갑이고 생일도 며칠 차이 나지 않는 모하메드 살라와 비교하는 것이 더 신뢰가 갈 것이다. 손흥민이 리버풀에서 뛰었다면 그는 더 좋은 기록을 냈을 것""이라고 말했다.

그러면서 ""손흥민은 토트넘에서 절대적으로 믿음직한 존재다. 그리고 나는 분명히 그의 커리어에 끝이 다가오고 있다고 생각하고 그의 헌신과 실력에 의문을 표할 수 없다. 그리고 만약 그가 최고의 수준이 아니었다면 그가 토트넘에 뭘 줬는지 의문을 표하기 어렵다""라고 주장했다.



기자는 또 ""손흥민은 토트넘에 훌륭한 선수였고 이번 시즌은 팀이 너무 힘들고 이런 팀에서 뛰는 것이 힘들다. 그는 토트넘보다 더 큰 구단으로 갈 자격이 있다고 생각한다. 아무도 손흥민의 토트넘에 대한 헌신에 의문을 달 수 없다""라며 손흥민이 더 큰 구단에서 뛸 수 있다고 내다봤다. 

토트넘에서의 상황을 불안하게 보는 여론이 많은 가운데, 손흥민에게 뮌헨 이적설이 터졌다. 지난 2021년 이후 4년 만이다. 우승을 원하는 손흥민에게 뮌헨은 아주 매력적인 선택지다. 

스페인 매체 '피차헤스'는 ""뮌헨이 현재 토트넘에 있는 손흥민을 눈여겨 보고 있다. 뮌헨은 다음 이적시장에 그를 영입하기 위한 제안을 고려할 것""이라고 보도하며 뮌헨 이적설이 불거졌다. 

뮌헨은 앞서 2021년에도 손흥민에 대한 관심을 보인 바 있다. 당시 뮌헨은 5년에 주급 20만 파운드(약 3억 6800만원)를 제안했지만 이적이 성사되지 않았다. 총액 969억원에 달하는 엄청난 딜이었다.

손흥민은 이번에도 뮌헨으로 이적할 경우 최대 3년 다년 계약을 할 가능성이 크다. 독일 아벤트 차이퉁은 지난해 말 ""손흥민이 뮌헨에 오면 앞서 에릭 막심 추포 모팅처럼 2+1년 계약을 제안받을 가능성이 크다""고 했다. 그러나 이번 토트넘 방출 리스트 공개에 따라 손흥민이 뮌헨으로 가기 위해선 적지 않은 협상 및 신경전이 필요하게 됐다.



또 매체는 ""뮌헨이 다음 시즌 공격진 보강을 계획하고 있다. 손흥민은 뮌헨이 추구하는 플레이 스타일에 부합하는 선수다. 손흥민은 뮌헨에서 그간 없었던 우승 트로피를 들 기회를 얻을 수 있다""고 손흥민이 뮌헨으로 가면 우승컵을 추가할 수 있다고 기대했다.

더욱이 케인과 손흥민의 호흡을 분데스리가에서 다시 볼 수 있는 가능성은 최근 뮌헨의 2선 공격진의 부진과도 맞물려 있다. 킹슬리 코망, 레로이 자네, 세르주 그나브리 등이 최근 부진에서 벗어나지 못하면서 뮌헨이 이들의 판매를 고려하고 있다는 보도들이 이어지고 있다. 이에 맞물려 손흥민의 이적설이 나오는 것이다. 

손흥민의 팀 동료였던 케인은 2023년 긴 시간 활약했던 친정팀 토트넘을 떠나 뮌헨으로 이적했다. 지난 2023-2024시즌은 우승에 실패했지만, 올 시즌은 분데스리가 우승이 임박한 것으로 보인다. 2위 바이엘 레버쿠젠과 승점 차가 8점이 나는 가운데 10경기도 남지 않았다. 이 흐름을 이어간다면 케인은 그토록 바라는 우승컵을 들 수 있다. 손흥민에게도 독일에서 이런 기회가 찾아올 수 있다. 



사진=엑스포츠뉴스DB, 연합뉴스, SNS"
