date,title,content
20260219,"“재계약 협상 중단키로” 韓 축구 대형 낭보 전해졌다…이강인 로테이션 자원으로만 생각하는 엔리케 감독, 지휘봉 내려놓을 수도","[골닷컴] 강동훈 기자 = 파리 생제르맹(PSG)이 루이스 엔리케(55·스페인) 감독을 붙잡기 위해 재계약 협상을 시작했지만 엔리케 감독이 미온적인 태도를 보이고 있다. 이런 가운데 바르셀로나가 내년 여름 엔리케 감독을 다시 데려오기 위해 움직일 수 있다는 주장까지 더해지면서 엔리케 감독의 거취를 두고 관심이 쏠리고 있다.

이적시장 소식을 전문적으로 다루는 피차헤스는 19일(한국시간) 스페인 매체 엘 나시오날을 인용해 “엔리케 감독이 PSG와 계약 연장 협상을 중단하기로 결정했고, 이 소식은 PSG의 근간을 뒤흔들고 있다”며 “엔리케 감독의 이 같은 결정은 바르셀로나로의 꿈같은 복귀를 향한 치밀한 로드맵의 결과”라고 보도했다.

PSG는 올 시즌이 끝나면 계약기간이 1년밖에 남지 않는 엔리케 감독을 붙잡고자 최근 재계약 협상 테이블을 차려 초기 논의를 시작했다. PSG는 엔리케 감독에게 2030년까지 계약을 연장하길 원한다면서 조건을 제시했다. 다만 현재 여러 구단의 러브콜을 받고 있는 엔리케 감독은 아직 자신의 거취를 명확히 하지 않아 확답을 주지 않고 있다.



엔리케 감독은 특히 바르셀로나의 관심을 받고 있다. 엔리케 감독이 PSG와 계약이 만료되는 시점에 바르셀로나도 한지 플릭 감독과 계약이 종료된다. 플릭 감독은 바르셀로나와 계약이 만료되면 지휘봉을 내려놓겠다고 밝힌 터라, 바르셀로나는 새 사령탑을 찾아야 한다. 이를 두고 일각에선 엔리케 감독이 바르셀로나로 돌아가길 원하는 게 아니냐는 관측이 나오고 있다.

바르셀로나는 구단 철학을 잘 이해하고 있고, 과거 ‘트레블(3관왕)’을 달성했던 엔리케 감독이 돌아온다면 환영한다는 스탠스다. 실제 바르셀로나가 그간 새 사령탑을 찾을 때마다 엔리케 감독의 이름은 항상 거론돼왔고, 엔리케 감독은 여전히 바르셀로나에서 막강한 영향력을 행사하는 인물인 것으로 알려졌다.

피차헤스는 “바르셀로나의 이사회 내에선 현재 플릭 감독의 성과를 전적으로 존중하지만 엔리케 감독을 그리워하고 있다. 바르셀로나 팬들도 ‘트레블’이라는 눈부신 성공과 공격적인 스타일을 선보였던 엔리케 감독 시절을 잊을 수 없는 기억으로 간직하고 있다”며 “엔리케 감독은 바르셀로나의 관심 속 PSG와 새 계약을 맺지 않고 친정으로 돌아가길 원한다”고 덧붙였다.


만약 엔리케 감독이 PSG와 동행을 마치게 될 경우, 이강인으로선 어떻게 보면 희소식이 될 수도 있다. 이강인은 엔리케 감독 체제에서 선발 출전보단 교체 출전이 더 많다. 실제 올 시즌만 놓고 봐도 이강인은 모든 대회 통틀어 25경기(3골·3도움)에 나섰는데 선발로 뛴 건 11경기다. 평균 출전시간은 47.96분이다.

물론 엔리케 감독은 이강인의 다재다능함과 성실함을 높이 평가하고 있다. 올겨울 아틀레티코(AT) 마드리드가 이강인에게 접촉하면서 영입을 추진하자 단칼에 거절한 그는 “이강인은 입단한 이래 매우 중요한 선수 중 한 명이었다”며 이강인이 가진 뛰어난 재능을 상당히 높게 평가하며, 그와 같은 선수를 보유하게 돼 매우 운이 좋다”고 말했다.

다만 선수 기용에 있어서 보수적인 엔리케 감독의 성향을 고려할 때 앞으로 이강인의 입지가 갑자기 확 달라지진 않을 가능성이 크다. 엔리케 감독도 이강인을 두고 “PSG라는 훌륭한 구단의 일원이 될 수 있는 신체적·기술적 능력을 갖춘 선수임을 직접 증명해 보였다”면서도 “기복이 있다. 기복을 줄여야 한다”고 꼬집었다.

사진 = 게티이미지, 소셜미디어(SNS) 캡처"
20260219,"충격! 토트넘은 손흥민 없이도 5-1로 잡았는데...보되, ATM·맨시티 이어 인테르까지 3-1 격파, UCL 3연승 질주","[SPORTALKOREA] 황보동혁 기자= 보되/글림트가 또 한 번 유럽축구연맹(UEFA) 챔피언스리그 무대에서 이변을 연출했다.

보되/글림트는 19일(이하 한국시간) 노르웨이 보되의 아스미라 스타디움에서 열린 2025/26시즌 UEFA 챔피언스리그(UCL) 녹아웃 플레이오프 1차전에서 인터밀란을 3-1로 꺾었다.



이로써 보되는 최근 UCL 3경기에서 3연승을 달리며 놀라운 상승세를 이어갔다. 특히 이들의 약진이 더욱 놀라운 이유는, 리그 페이즈 초반 6경기에서 3무 3패에 그치며 사실상 탈락 분위기가 짙었기 때문이다.

당시 일정도 험난했다. 7차전이 아틀레티코 마드리드 원정, 8차전이 맨체스터 시티와의 홈 경기였던 만큼 연패가 유력해 보였다. 그러나 보되는 아틀레티코 마드리드를 2-1로 잡아낸 데 이어, 맨시티마저 3-1로 꺾는 이변을 연출하며 2승 3무 3패, 리그 페이즈 23위로 극적으로 녹아웃 플레이오프 티켓을 따냈다.



하지만 플레이오프 진출에도 마냥 웃을 수만은 없었다. 상대가 바로 지난 시즌 UCL 준우승 팀 인터밀란이었기 때문이다. 그럼에도 보되는 또 한 번 홈에서 저력을 발휘하며 인테르를 상대로 값진 승리를 챙겼다.

경기 초반부터 기세가 좋았다. 전반 20분 손드레 브룬슈타트 팻이 선제골을 터뜨리며 앞서 나갔지만, 전반 30분 피오 에스포지토에게 동점골을 내주며 흐름이 끊기는 듯했다.

그러나 후반 16분 옌스 페테르 하우게의 추가골, 이어 3분 뒤 카스퍼 호그의 쐐기골이 터지며 보되는 1차전을 3-1 완승으로 마무리했다.



물론 추운 날씨와 얼어붙은 잔디, 홈 특유의 분위기 등 보되에게 유리한 환경이 조성된 것도 사실이다. 하지만 이날의 승리를 단순히 이런 요소들 덕으로 치부하기에는 무리가 있었다.  

실제로 보되는 내용 면에서도 인터밀란에 크게 밀리지 않았다. 점유율은 45:55, 패스 성공률은 85% 대 88%였고, 오히려 유효슈팅에서는 6-4로 앞섰다. UCL 무대에서 보되가 왜 돌풍을 일으키고 있는지를 분명히 보여준 경기였다.

물론 2차전이 인터밀란의 홈인 스타디오 주세페 메아차에서 열리는 만큼 아직 16강 진출을 장담하기는 이르다. 하지만 2골 차 결코 가볍지 않다. 인터밀란 입장에서도 상당한 부담이 될 수밖에 없는 결과다.



한편 보되의 이 같은 상승세에 과거 이들을 상대로 좋은 성적을 거뒀던 토트넘 홋스퍼도 다시 주목을 받고 있다.

토트넘은 이번 UCL 리그 페이즈에서 보되 원정에서 2-2 무승부를 거둔 바 있으며, 지난 시즌 UEFA 유로파리그 4강에서도 보되와 맞붙었었다. 당시 보되는 16강에서 올림피아코스, 8강에서 라치오를 꺾고 올라오며 이번과 마찬가지로 기세가 대단했다.

그만큼 토트넘도 쉽지 않은 승부가 예상됐다. 특히 당시에는 주장 손흥민마저 부상으로 이탈한 상황이었기에 패배 가능성까지 거론됐었다.



하지만 토트넘은 홈에서 열린 1차전에서 3-1로 승리한 데 이어, 원정 2차전에서도 2-0 완승을 거두며 합계 스코어 5-1로 결승 진출에 성공했다.

과연 인터밀란이 홈에서 열리는 2차전에서 토트넘처럼 보되의 돌풍을 잠재울 수 있을지 이목이 쏠린다.

사진= ESPN, 게티이미지코리아, UCL, 보되/글림트 

제휴문의 ad@sportalkorea.co.kr"
20260219,"맨유 대박! ""이적에 동의했다""… 주드 벨링엄, 맨유행 급물살! '세대교체 핵심'으로 낙점됐다","사진=풋볼 365


[포포투=김호진]

주드 벨링엄이 맨체스터 유나이티드 이적에 동의했다는 소식이다.

영국 '기브미 스포츠'는 19일(한국시간) 영국 매체 '풋볼 365'를 인용하여 ""레알 마드리드의 갈락티코 주드 벨링엄이 맨유 이적에 조건부로 동의했다는 충격적인 소식이 전해졌다""고 보도했다.

이어 ""현재 레알 마드리드 생활에 만족하고 있는 벨링엄은, 위르겐 클롭이 레알 감독으로 부임할 경우 팀을 떠날 가능성이 있는 것으로 알려졌다. 벨링엄은 클롭 체제에서 본인의 역할과 입지가 흔들릴 수 있다는 점을 우려하고 있다""고 덧붙였다.

이런 상황 속 중원 보강이 급한 맨유가 움직였다. 올시즌을 끝으로 팀의 핵심 미드필더인 카세미루와 이별이 확정된 맨유는 엘리엇 앤더슨과 애덤 워튼 등 수많은 중원 자원들과 연결되고 있다.

사진=게티이미지


여기에 벨링엄도 포함됐다. 매체는 ""맨유는 벨링엄을 중심으로 팀을 재편할 계획이며, 그를 팀의 핵심 선수로 삼을 준비가 되어 있다. 맨유가 올여름 그를 영입할 수 있다면, 중원 세대교체의 중심이 될 수 있는 '게임 체인저'가 될 전망""이라고 전했다.

한편 벨링엄은 2023년 여름 보루시아 도르트문트에서 이적료 1억1500만 파운드(약 1,960억 원)에 레알 마드리드로 합류했다. 이적 첫해 스페인 라리가와 유럽축구연맹(UEFA) 챔피언스리그(UCL) 우승을 동시에 거머쥐며 43경기에서 23골을 터뜨렸고, 지난 시즌에도 58경기 15골을 기록하며 꾸준한 활약을 이어갔다.

그러나 벨링엄은 올시즌 초반 고질병이었던 어깨 부상으로 수술을 받았다. 이후 복귀를 하며 경기에 출전했지만 최근 햄스트링에 문제가 생기며 또다시 전력에서 이탈한 상황이다.

사진=게티이미지"
20260219,"대충격! 뮌헨, 김민재에 이미 ""떠나라"" 결별 의사 통보했다…토트넘+첼시 러브콜 뒤 숨겨진 진실→시즌 내내 유지된 방출 기조","(엑스포츠뉴스 윤준석 기자) 바이에른 뮌헨이 김민재와의 동행 가능성에 대해 이미 내부적으로 결별 의사를 전달했다는 충격적인 현지 보도가 등장했다.

구단이 적절한 제안이 올 경우 매각할 의사가 있다는 입장을 지난해부터 유지해왔다는 구체적인 정황까지 공개되면서 여름 이적시장 핵심 변수로 급부상하는 분위기다.

여기에 더해 프리미어리그 구단들이 김민재를 향해 단순한 관심 이상의 접근을 한 것으로 전해졌다.



뮌헨 소식을 전문적으로 다루는 매체 '바바리안 풋볼 워크스'는 19일(한국시간) 독일 '스포르트 빌트' 소속이자 구단 내부 정보에 정통한 기자 크리스티안 폴크의 보도를 인용해 뮌헨이 이미 김민재 측에 매각 가능 방침을 전달했다고 보도했다.

매체는 ""바이에른 뮌헨은 김민재를 판매하는 데 열려 있다""며 ""구단은 지난해 여름 선수 에이전트에게 적절한 제안이 도착할 경우 이적을 허용할 수 있다는 뜻을 전달했다""고 전했다.

특히 해당 결정이 일회성 검토가 아닌 지속된 기조라는 점이 강조됐다. 보도에 따르면 당시 이 같은 입장을 전달한 인물은 뮌헨 단장인 막스 에베를이며, 구단의 스쿼드 운영 계획 속에서 김민재가 핵심 자원이 아닌 '조건부 유지 자원'으로 분류됐음을 시사한다.

또한 매체는 ""그 입장은 시즌이 진행되는 동안에도 변하지 않았다""고 못 박았다.



다만 곧바로 방출 수순으로 이어지는 상황은 아니다.

매체는 동시에 선수 본인의 입장도 함께 전했는데, 보도에 따르면 김민재는 현재 뮌헨 생활에 만족하고 있으며 출전 시간이 줄어든 역할 역시 받아들이고 있는 상태다.
실제로 팀 내 환경, 생활 여건, 경쟁 수준 등 전반적 요소에 대해 긍정적 인식을 갖고 있는 것으로 전해졌다.

그럼에도 불구하고 스쿼드 구도 변화는 분명한 변수다. 뮌헨은 이미 핵심 센터백 자원인 다요 우파메카노와 재계약을 체결하며 장기 플랜을 확정했고, 여기에 새롭게 주전 조합을 형성한 수비수로 요나탄 타가 자리 잡았다. 현지에서는 이 두 선수를 최정예 옵션으로 고정하는 구상이 굳어졌다는 평가가 지배적이다.

보도 역시 ""뮌헨은 우파메카노와 타 뒤를 받칠 새로운 3옵션 센터백 구성을 원하고 있다""면서 김민재가 기존 주전 경쟁 자원에서 로테이션 자원으로 역할이 조정됐다고 전했다.

선수 개인 기량과 별개로 전술적 조합 안정성과 빌드업 패턴, 수비 라인 운영 방식이 영향을 미쳤다는 분석이다.



이런 상황 속에서 프리미어리그 구단들의 움직임이 본격 감지되고 있다.

가장 적극적으로 거론되는 팀은 토트넘 홋스퍼와 첼시다.

폴크 기자의 발언을 인용한 '바바리안 풋볼 워크스'의 18일 보도에 따르면 첼시와 토트넘이 모두 김민재의 상황을 면밀히 관찰하고 있으며, 여름 이적시장에서 영입전이 벌어질 수 있다.

두 구단 모두 센터백 보강 필요성이 제기된 가운데 김민재를 영입 후보 명단에 포함시켰다는 설명이다.

토트넘의 경우 수비진 전반에 걸쳐 구조적 변동 가능성이 존재한다.

현재 분데스리가에서 임대 생활 중인 유망주 루카 부슈코비치의 거취 불확실성, 기존 주전 자원들의 이적설, 전력 재편 필요성이 복합적으로 맞물린 상황이다.

특히 김민재의 뮌헨 이탈이 현실화될 경우, 토트넘과 연결된 수비 자원 이동 시나리오까지 연쇄적으로 맞물릴 수 있다는 관측도 제기됐다.



첼시 역시 상황을 주시 중이다. 보도에 따르면 첼시는 경험 많은 센터백 보강 필요성 속에서 김민재 영입 가능성을 검토하고 있다.

다만 구단의 기존 영입 정책이 젊은 선수 위주라는 점에서 29세인 김민재 영입은 내부 철학과 상충될 수 있다는 분석도 뒤따랐다.

첼시 전문 매체 '첼시 크로니클'은 ""경험 보강 측면에선 현명한 선택이 될 수 있지만 첼시의 영입 기조를 고려하면 쉽지 않은 거래""라고 평가했다.

계약 조건도 핵심 변수다. 김민재는 2028년까지 장기 계약을 맺고 있으며 시장 평가 금액은 약 2200만 파운드(약 431억원) 수준으로 거론된다.

뮌헨이 과거 나폴리에서 그를 영입할 당시 약 4300만 파운드(약 843억원)를 투자했다는 점을 감안하면, 구단이 어느 수준 제안에서 협상 테이블에 앉을지도 관심사다.



시끄러운 이적설에도 불구하고 김민재의 경기력 자체에 대한 평가는 여전히 높다.

김민재는 최근 SV 베르더 브레멘전 3-0 승리 경기에서 결점 없는 수비력을 선보였다는 호평을 받았다.

공중볼 장악, 대인 방어, 빌드업 안정성 등 핵심 지표에서 안정적인 모습을 보이며 '여전히 최상위권 센터백'이라는 평가가 이어졌다.

하지만 시즌 전체 흐름을 보면 출전 패턴 변화는 분명하다. 팀을 이끄는 뱅상 콤파니 감독 체제에서 김민재는 확고한 주전이라기보다 로테이션 상황에서 활용되는 비중이 늘어났다. 

다가올 여름 이적시장에서 실제 제안이 도착할지, 그리고 그 제안이 뮌헨이 설정한 기준을 충족할지 여부에 따라 김민재의 거취는 중대한 분수령을 맞게 될 전망이다.

사진=연합뉴스"
20260219,"""5-0에도 심판에 화내더라"" LAFC 감독, 손흥민 미친 승부욕에 경악...""어제도 따로 질문했어, 이러니 월클""","사진=라 프렌사


[포포투=김아인]

손흥민의 프로 정신은 상상 그 이상이었다. 마크 도스 산토스 감독은 손흥민의 승부욕을 칭찬했다.

LAFC는 18일 오후 12시(한국시간) 온두라스 산페드로술라에 위치한 에스타디오 프란시스코 모라잔에서 열린 2026 북중미축구연맹(CONCACAF) 챔피언스컵 1라운드 1차전에서 레알 에스파냐를 6-1로 크게 꺾었다. 이로써 LAFC는 홈에서 열릴 2차전을 앞두고 16강 진출에 가까워졌다.

사실상 16강 진출의 9부 능선을 넘은 압승이었다. 그 중심에는 손흥민과 드니 부앙가의 '흥부 듀오'가 있었다. 손흥민은 1골 3도움을 기록하며 팀 득점의 대부분에 관여했고, 부앙가는 해트트릭으로 화답했다. 자국 리그 선두를 달리던 레알 에스파냐였지만, 전반에만 5골을 퍼부은 손흥민의 지배력 앞에 속수무책으로 무너졌다.

사실 경기 전에는 우려의 목소리도 있었다. 손흥민이 프리시즌 연습 경기에 잇따라 결장한 데다, 온두라스의 열악한 잔디 상태와 거친 환경 탓에 주축 선수들이 몸을 사릴 것이라는 예측 때문이었다. 하지만 산토스 감독은 단호했다. 그는 ""만약 이런 경기에서 그들을 제외했다면, 아마 선수들이 나를 죽이려 들었을 것""이라며 손흥민의 남다른 출전 의지를 전했다. 

사진=LAFC


이어 ""웸블리나 산 시로 같은 거대 스타디움이나 이곳 온두라스나 그들의 태도는 똑같다. 그 겸손함과 프로 정신에 나 역시 매번 배운다""며 고개를 내저었다. 산토스 감독은 6-1 대승 후 가장 만족스러웠던 점으로 ""공식전이 처음인 선수들이 보여준 강도와 상대에 대한 예우다. 단순히 스타 선수 몇 명에 의존하는 팀이 아니라, 모두가 열심히 뛰는 팀이 되길 바랐는데 오늘 우리 선수들이 그것을 해냈다""고 선수단의 화합을 칭찬하기도 했다.

특히 손흥민의 투지를 상징적으로 보여준 장면은 전반 종료 직후였다. 팀이 5-0으로 크게 앞선 상황이었음에도 불구하고, 손흥민은 판정에 대해 심판에게 강하게 항의하며 경기에 몰입하는 모습을 보였다.

산토스 감독은 이를 두고 ""손흥민은 말 그대로 '승부욕의 화신이다""고 정의했다. 그는 ""경기 전날 소니가 나를 찾아와 '오늘 우리 베스트 멤버로 나가는 거 맞죠?'라고 묻더라. 그는 장소가 어디든 오직 승리하고 싶어 한다""고 비화를 공개했다. 그러면서 ""그런 월드클래스 리더가 솔선수범하니 다른 선수들도 전염될 수밖에 없다. 이것이 우리 라커룸의 진짜 힘""이라며 엄지를 치켜세웠다.

사진=LAFC


#포포투 코리안리거 소식"
20260219,"'세기의 개막전' 韓 기다리던 '오피셜' 공식발표, 손흥민 vs 메시 뜬다 ""메시 근육 부상 회복→팀 훈련 성공적 복귀"" ","[스포티비뉴스=박대성 기자] 손흥민(33, LAFC)과 리오넬 메시(38, 인터 마이애미)가 개막전에서 만난다. 두 선수의 미국 무대 진출 이후 최초의 맞대결이다.

오는 22일 오전 11시 30분(한국시간) 미국 캘리포니아주 로스앤젤레스에 위치한 LA 메모리얼 콜로세움에서 2026시즌 메이저리그사커 개막전이 열린다. 개막전에서 만나게 될 두 팀은 서부 콘퍼런스 LA FC와 동부 콘퍼런스 인터 마이애미다.

개막전이 열릴 LA 메모리얼 콜로세움은 1923년 개장하여 102년 이상의 역사를 보유하고 있으며 과거 두 번의 하계 올림픽 개막식이 열린 경기장이다. 메이저리그사커 사무국은 리그 개막전을 위해 로스앤젤레스FC의 기존 홈구장인 BMO 스타디움 대신 7만 7500여 석 규모의 해당 스타디움을 경기 장소로 배정했으며, 당일 현장에 6만 명 이상의 관중이 입장할 것으로 예상된다.
당초 하체 근육 부상으로 개막전 결장이 예상되었던 39세 리오넬 메시의 경기 출전이 가시화되면서 양 팀 주축 선수의 맞대결이 성사되었다. 메이저리그사커 공식 채널은 ""메시는 최근 하체 근육 부상으로 휴식을 취해왔지만, 지난 18일 팀 훈련에 복귀하며 출격 준비를 마쳤다""고 발표했다.

메시는 2023년 인터 마이애미에 입단해 MLS를 뛰고 있고, 중하위권 팀이었던 인터 마이애미를 메이저리그사커 리그 챔피언십 우승, 서포터즈 실드 우승 팀까지 끌어 올렸다. 개인 기록으로는 리그 최우수선수 2회 수상과 골든부트를 2회 수상했다.



손흥민은 지난해 여름 토트넘을 떠나 LAFC에 합류했다. 팀은 지난해 11월 메이저리그사커컵 8강전 탈락 이후 휴식기를 가졌다. 올해까지 춘추제 시즌을 이어가는 MLS라, 겨울에 프리시즌을 훈련을 끝낸 손흥민이었다.

최근 온두라스 산페드로술라 에스타디오 프란시스코 모라산에서 열린 레알 에스파냐와의 2026시즌 북중미카리브축구연맹 챔피언스컵 1라운드 1차전 원정 경기에서 4-3-3 포메이션의 중앙 공격수로 선발 출전해 전반전에만 1골 3도움을 기록했다.

전반 11분 수비 진영에서부터 드리블로 상대 진영에 진입한 뒤 스루패스로 시즌 첫 도움을 기록했다. 이어 전반 22분에는 직접 페널티킥 키커로 나서 골문 왼쪽 하단으로 득점했다. 전반 24분 페널티 박스 안으로 진입하는 데니스 부앙가에게 패스하여 두 번째 도움을 올렸고, 전반 39분 우측 측면 크로스로 티모시 틸먼의 득점을 도우며 총 4개의 공격포인트를 생산했다. 경기 종료 후 축구 통계 전문 매체 풋몹은 손흥민에게 평점 9.6점을 부여했다. 이는 같은 경기에서 해트트릭을 달성하며 9.7점을 받은 부앙가에 이은 팀 내 2위 기록이다. 다른 통계 매체 소파스코어는 손흥민에게 9.2점을 부여했다.

손흥민은 LA FC에서 현재까지 정규리그 10경기 9골 3도움, 플레이오프 포함 13경기 12골 4도움을 기록했다. 분당 공격포인트 생산 효율은 68.9분당 1개를 기록한 메시에 이어 리그 2위였다.



팀 성적은 손흥민 합류 후 9승 4무 2패를 기록하며 서부 콘퍼런스 3위로 상승했다. 또한 손흥민과 부앙가는 합류 이후 팀의 18골을 연속으로 합작하며 메이저리그사커 역대 최다 연속 득점 합작 기록을 경신했다. 이에 원풋볼은 ""손흥민은 기록적인 이적료에 걸맞게 스스로를 증명하는 데 시간이 필요하지 않았다. 숫자로 증명되는 기록보다 동료들의 가치를 한 단계 끌어올린 점이 더 인상적""이라고 보도했다.

구단 존 토링턴 단장 발표에 따르면 손흥민의 유니폼은 이적 직후 일주일 동안 전 세계 판매량 1위를 기록했으며, 리그 역사상 최고 수준인 2650만 달러의 이적료 수치를 보였다.

손흥민이 출전한 북중미카리브축구연맹 챔피언스컵은 지역 클럽 대항전으로 우승팀에게는 2029 국제축구연맹 클럽월드컵 출전권이 부여된다.

미국, 멕시코, 온두라스, 코스타리카, 파나마, 캐나다 등에서 총 27개 팀이 참가한다. 22개 팀이 홈 앤드 어웨이 방식으로 1라운드를 치르고, 승리한 11개 팀이 부전승으로 직행한 5개 팀과 합쳐져 16강을 진행한다.

LA FC가 합계 점수에서 승리하면 16강에서 코스타리카 소속 알라후엘렌세와 맞붙는다. 1라운드 상대 레알 에스파냐는 온두라스 리그 12회 우승 팀으로, 최근 리그 6경기에서 4승 2무로 무패 단독 선두를 기록 중이다.



미국 진출 이후 처음 성사된 손흥민과 메시의 맞대결은 과거 유럽 무대 이후 세 번째다. 2018-2019시즌 유럽축구연맹 챔피언스리그 조별리그 B조에서 손흥민은 토트넘 홋스퍼, 메시는 FC바르셀로나 소속으로 출전했다.

웸블리 스타디움에서 열린 첫 경기에서는 두 선수 모두 선발 출전해 손흥민 1도움, 메시 2골을 기록하며 바르셀로나가 4-2로 승리했다. 캄프 누에서 진행된 두 번째 경기에서는 손흥민 선발, 메시 교체 출전으로 공격포인트 없이 1-1 무승부를 기록했다.

한편 온두라스 원정을 마친 LA FC는 22일 인터 마이애미와 리그 개막전을 소화한 뒤, 25일 레알 에스파냐와 챔피언스컵 1라운드 2차전 홈경기를 진행할 예정이다."
