date,title,content
20260130,"“당장 떠나겠다” 충격 선언, 반년 만에 ‘이별 결단’…손흥민 대체자로 데려온 ‘0골 공격수’ 임대 해지 요청","[골닷컴] 강동훈 기자 = 토트넘이 예상치 못한 전력 손실이 발생할 수도 있을 거로 보인다. 지난여름 합류한 랑달 콜로 무아니(27·프랑스)가 반년 만에 떠나길 원하면서 임대 해지를 요청했다. 콜로 무아니는 지난 시즌 좋은 활약을 펼쳤던 유벤투스로 다시 임대 이적하길 바라고 있는 것으로 전해졌다.

29일(한국시간) 이탈리아 매체 가제타 델로 스포르트에 따르면 콜로 무아니는 남은 겨울 이적시장 기간 토트넘과 임대를 해지한 후 유벤투스로 재임대되길 희망하고 있다. 콜로 무아니는 특히 토트넘에 임대를 해지해달라고 요청하는 등 사실상 토트넘을 떠나겠다는 스탠스를 취하고 있다.

때마침 공격진 보강을 계획하고 있던 유벤투스는 콜로 무아니가 다시 임대 이적을 통해 합류하길 바라자, 콜로 무아니의 원소속팀인 PSG와 현재 콜로 무아니와 임대 계약을 맺고 있는 토트넘과 합의점을 찾기 위해 협상을 벌이고 있다. 다만 토트넘은 전력 손실을 원치 않아 콜로 무아니와 임대 계약을 해지할 수 없다는 입장을 고수 중이다.


앞서 콜로 무아니는 지난해 9월 토트넘과 한 시즌 임대 계약을 체결했다. 토트넘은 당시 손흥민의 대체자를 찾던 도중 콜로 무아니를 낙점, 임대료 500만 유로(약 86억 원)를 지불하는 조건으로 PSG와 합의를 맺었다. 콜로 무아니는 “토트넘 유니폼을 입고 구단을 위해, 팬들을 위해 열심히 싸우겠다. 토트넘을 위해 모든 걸 다 받칠 것”이라고 각오를 다졌다.

콜로 무아니는 하지만 잉글랜드 프리미어리그(EPL) 적응에 애를 먹으면서 이렇다 할 활약을 펼치지 못했다. 실제 꾸준히 기회를 받았지만 올 시즌 EPL 15경기를 치르는 동안 아직 데뷔골도 넣지 못하고 있다. 그나마 유럽축구연맹(UEFA) 챔피언스리그(UCL)에서 3골을 넣었지만 만족스러운 활약은 아니다. 공식전 24경기 3골(3도움)을 기록 중이다.



설상가상 도미닉 솔란케가 부상을 털고 돌아온 뒤 콜로 무아니는 벤치로 밀려나기 시작했다. 결국 그는 토트넘에서의 생활에 만족하지 못하면서 떠나길 희망하는 가운데 지난 시즌 좋은 기억이 있던 유벤투스로 다시 임대 이적하길 바라고 있다.

실제 콜로 무아니는 지난 시즌 유벤투스에서 강렬한 임팩트를 남겼다. 모든 대회에서 22경기 동안 10골(3도움)을 기록했다. 이런 그는 “유벤투스에 와서 매우 행복하다”고 소감을 전하면서 유벤투스에 잔류해 동행을 계속 이어가길 원하는 바람을 밝히기도 했다.

프랑스 국가대표인 콜로 무아니는 연계 플레이와 오프 더 볼 움직임이 뛰어난 데다, 속도가 빠른 공격수다. 이러한 장점을 바탕으로 위협적인 기회를 만들어내는 데 능한 그는 공격포인트를 양산하는 데도 탁월하다. 지난 2016년 낭트에서 프로에 데뷔한 콜로 무아니는 이후 US 불로뉴와 아인트라흐트 프랑크푸르트, PSG, 유벤투스를 거쳐 토트넘에 합류했다.

사진 = 게티이미지"
20260130,"韓 축구 ‘초대형’ 희소식, 새로운 EPL리거 탄생 가능성 아직 남아 있다…‘1순위 영입 난항’ 풀럼, 차선책으로 고려 중인 오현규 다시 접촉","‘아기 괴물’ 오현규(24·헹크)가 한국 축구 역사상 21번째로 잉글랜드 프리미어리그(EPL) 구단과 계약을 맺을 가능성이 여전히 남아 있다. 공격진을 보강하려는 풀럼이 리카르도 페피(23·PSV 아인트호벤) 영입을 두고 협상 과정에서 난항을 겪는 가운데 겨울 이적시장 기간이 얼마 남지 않아 오현규로 선회할 거로 전망되면서다.

29일(한국시간) 영국 매체 스카이스포츠에 따르면 풀럼은 겨울 이적시장 문이 닫히기 전에 공격 옵션을 강화하는데 집중하고 있다. 현재 맨체스터 시티와 이적료 2700만 파운드(약 533억 원)에 합의점을 찾으면서 오스카르 보브 영입이 사실상 확정 단계에 접어들었고, 추가로 페피도 영입하기 위해서 협상을 벌이고 있다.

풀럼은 다만 페피를 영입할 가능성이 그리 크진 않은 분위기다. 이적료 2800만 파운드(약 553억 원)를 제시하면서 협상 테이블을 차렸지만 PSV 아인트호벤이 페피를 쉽게 보내주지 않겠다는 태도를 고수하고 있는 탓이다. 마찬가지로 공격진 보강이 필요한 PSV 아인트호벤은 대체자를 찾아야만 페피의 이적을 승인하겠다는 입장이다.



겨울 이적시장 기간이 닷새도 남지 않은 상황에서 풀럼은 만약 이대로 PSV 아인트호벤과 협상 과정에서 합의점을 찾지 못한다면, 차선책으로 고려 중인 오현규를 영입할 계획 속 다시 접촉 중이다. 이미 풀럼은 앞서 헹크와 협상 과정에서 긍정적인 분위기 속에 대화를 나눴고, 오현규 역시 적극적으로 이적을 모색하면서 풀럼행에 열려 있는 것으로 전해졌다.

오현규가 풀럼 유니폼을 입게 된다면, 그는 역대 한국인으로는 21번째로 EPL 구단과 계약을 맺게 된다. 다만 황의조와 정상빈은 각각 노팅엄 포레스트와 울버햄튼과 계약 후 데뷔전 없이 임대만 전전하다 떠났고, 양민혁과 윤도영은 토트넘과 브라이턴 앤 호브 앨비언에서 데뷔전을 치르지 못했다. 뉴캐슬 유나이티드에 입단한 박승수도 마찬가지다.

동시에 설기현에 이어 두 번째로 풀럼에 입단하는 한국인 선수가 된다. 설기현은 현역 시절 2007년부터 2010년까지 풀럼에서 뛰었다. 당시 그는 레딩을 떠나 풀럼으로 적을 옮긴 후 알힐랄에서 잠시 임대 생활한 시기를 제외하고 통산 26경기(2골·2도움)에 출전했다.


당초 오현규는 지난여름 이적시장 때 이적할 가능성이 컸다. 당시 그는 슈투트가르트의 러브콜을 받으면서 이적을 추진했다. 슈투트가르트가 이적료로 2000만 유로(약 342억 원)를 제시하면서 헹크와 원칙적으로 구단 간 합의를 맺었고, 오현규는 곧바로 입단 절차를 밟기 위해 슈투트가르트로 향했다. 하지만 메디컬 테스트에서 탈락하며 최종적으로 이적은 무산됐다.

아쉬움을 뒤로한 채 오현규는 마음을 붙잡고 헹크에서 ‘지한파’ 토르스텐 핑크 감독의 총애를 받으며 붙박이 주전으로 활약했다. 그러나 지난달 중순 핑크 감독이 성적 부진을 이유로 경질된 후 새롭게 부임한 니키 하옌 감독으로부터 철저히 외면당하며 한순간에 벤치로 밀려났다. 실제 최근 부상이나 징계 등 별다른 이유가 없는데도 2경기 연속 결장했다.

오는 6월 2026 북중미 월드컵에 출전하기 위해 꾸준한 출전 시간을 확보해야 하는 오현규는 결국 겨울 이적시장 기간 이적을 모색하더니 풀럼의 영입리스트에 올랐고, 풀럼이 1순위로 고려하던 페피 영입이 어려워지면서 그가 차선책으로 영입될 가능성이 커지고 있다.


사진 = 게티이미지, 소셜미디어(SNS) 캡처"
20260130,"[단독]‘이적설’ 김민재 前소속 연세대 “FIFA, 기여금 수령준비 요청”","학교측 “이적 담당자가 연락해와”
金, 연대 축구부서 1년 뛴후 자퇴
‘이적료 5%, 학교-구단 지급 규정’
독일 분데스리가 바이에른 뮌헨의 수비수 김민재(30·사진)가 잉글랜드 프리미어리그(EPL) 첼시의 유니폼을 입게 될까.

2023년 이탈리아 세리에A 나폴리를 떠나 분데스리가 최고 명문 팀 뮌헨에 입단한 김민재는 최근 이적설에 휩싸여 있다. 이달 유럽 축구 이적시장이 열리자 독일 축구 전문 매체들은 김민재가 잉글랜드와 이탈리아, 튀르키예 등 다른 유럽 리그의 팀으로 이적할 가능성이 있다고 전망했다. 유력한 행선지로 꼽힌 팀은 첼시다. 독일 ‘빌트’의 크리스티안 폴크 기자는 25일 자신의 소셜미디어에 “첼시가 김민재 영입에 관심을 보이고 있다”고 적었다.

김민재는 나폴리에서 뛰던 2022∼2023시즌 팀을 33년 만에 리그 정상으로 이끌며 세리에A ‘올해의 수비수’에 등극했다. 이를 바탕으로 뮌헨 이적에 성공했지만 잦은 부상과 들쭉날쭉한 경기력으로 인해 주전 경쟁에 어려움을 겪었다. 2025∼2026시즌엔 로테이션 멤버로 경기에 투입되고 있다. 뮌헨 소식을 전문적으로 다루는 매체인 ‘CF바이에른인사이더’는 “첼시가 뮌헨에 김민재와 관련된 문의를 한 것은 사실”이라면서 “김민재가 더 많은 출전 시간을 얻기 위해 이적을 요청한다면 뮌헨은 협상에 나설 의향이 있다”고 전했다.

이런 가운데 과거 김민재의 소속팀이었던 연세대가 김민재의 첼시 이적 시 발생하는 연대기여금을 지급받기 위한 작업에 착수한 것으로 확인됐다. 연세대 고위 관계자는 29일 본보와의 통화에서 “국제축구연맹(FIFA) 연대기여금 업무를 담당하는 에이전시 업체 ‘클리어링 하우스’로부터 김민재가 첼시로 이적할 수 있으니 관련 서류를 준비해 달라는 요청을 받았다”고 말했다. 그러면서 “이례적으로 이적 발표 전에 연대기여금을 준비하라는 연락이 왔다. 전 세계 이적시장 관련 업무를 총괄하는 곳에서 온 요청인 만큼 신뢰도가 높다고 판단해 서류 준비를 하고 있다”고 덧붙였다.

연대기여금은 프로선수가 구단을 옮길 경우 이적료의 5%를 해당 선수가 12세부터 23세까지 몸담았던 학교나 구단에 분배하도록 한 FIFA 규정에 따른 것이다. 김민재는 2015학번으로 연세대에 입학해 축구부에서 1년을 뛴 뒤 자퇴했다. 이후 실업팀 한국수력원자력을 거쳐 2017년 K리그1 전북에서 프로 생활을 시작했다. 연세대는 김민재가 2021년 페네르바흐체(튀르키예), 2022년 나폴리로 몸값을 높여가며 이적했을 때도 연대기여금을 받아 축구부 발전 기금으로 사용했다."
20260130,"'키도 작고 축구도 못한다'…월드컵 본선 상대, 멕시코에서 거센 비판","모라/게티이미지코리아
피네다/게티이미지코리아

[마이데일리 = 김종국 기자] 한국의 북중미월드컵 본선 상대 멕시코에 대한 자국내 비판이 이어졌다.

멕시코는 자국리그에서 활약하는 선수들로 대표팀을 소집해 1월 두 차례 A매치 평가전을 치렀다. 멕시코는 지난 23일 파나마를 상대로 1-0 승리를 거둔데 이어 26일 열린 볼리비아와의 원정 평가전에서 1-0 승리를 기록했다.

멕시코는 파나마와의 경기에서 베르테라메가 공격수로 나섰고 구티에레스와 알바라도가 측면 공격을 이끌었다. 루이즈, 로모, 바르가스는 중원을 구축했고 곤살레스, 아길라, 구스만, 레데스마가 수비를 책임졌다. 골키퍼는 랑헬이 출전했다.

멕시코는 파나마를 상대로 수비 공략에 어려움을 겪었고 후반전 추가시간 상대 자책골에 힘입어 힘겨운 승리를 거뒀다. 멕시코 텔레문도는 파나마전 이후 '멕시코 대표팀에게 기대할 것은 거의 없었다. 파나마전에 출전한 선수 중 월드컵 활약을 기대할 수 있는 선수는 없었다. 멕시코는 즉흥적인 플레이를 펼쳤고 미숙했고 이해도가 부족한 모습이었다. 파나마전은 멕시코 팬들의 희망을 북돋아 줄 만한 모습을 거의 보이지 못했다. 멕시코는 90분 동안 파나마를 강하게 압박했지만 눈에 띄는 활약을 펼친 선수는 없었다'며 멕시코 대표팀의 경기력을 혹평했다.
멕시코는 볼리비아전 승리 이후에도 비난을 피하지 못했다. 멕시코는 볼리비아와의 경기에서 베르테라메가 선제 결승골을 터트려 승리를 거뒀다.

멕시코 매체 TUDN은 17세 신예 모라에 대해 '재능은 있지만 멕시코 대표팀의 구세주가 되지는 못할 것이다. 메시나 호날두처럼 혼자서 팀의 흐름을 변화시킬 수 있는 선수들과는 비교조차 할 수 없는 선수""라면서도 ""모라 만큼 멕시코 대표팀에 기여할 수 있는 재능을 가진 선수가 없다'고 언급했다. 또한 '멕시코 대표팀은 카를로스 로드리게스와 피네다가 자신의 역할을 해주기를 기다리는데 지쳤다. 카를로스 로드리게스와 피네다는 체격이 작은 선수들이고 자신의 역할을 해낼 만한 능력이 없어 보인다. 베가는 소속팀과 대표팀에서의 경기력이 완전히 다르다. 오른쪽 측면의 알바라도와 라이네스는 기복이 심하다'며 공격진과 미드필더진의 선수들을 싸잡아 비난했다.

멕시코는 지난해 북중미골드컵 우승 이후 일본, 한국, 콜롬비아, 에콰도르, 우루과이, 파라과이를 상대로 치른 A매치에서 6경기 연속 무승을 기록했다. 6경기 중 3경기에서 무득점을 기록할 만큼 빈약한 공격력을 드러냈다. 멕시코는 최근 파나마와 볼리비아를 상대로 잇단 승리를 거뒀지만 자국에서의 비판도 이어지고 있다.
멕시코 대표팀/게티이미지코리아
멕시코 대표팀/게티이미지코리아"
20260130,"'충격' 이강인 PSG와 끝내 재계약…""판매불가"" 단호했다→ATM 단장도 포기+김민재 동료 데려온다 ""24시간 내 최종 결정""","(엑스포츠뉴스 나승우 기자) 겨울 이적시장 마감일이 다가오고 있는 가운데 스페인 라리가 강호 아틀레티코 마드리드가 이강인 영입 꿈을 접었다.

이강인을 노렸던 마테우 알레마니 단장이 직접 독일 뮌헨으로 날아가 레온 고레츠카(바이에른 뮌헨) 영입을 마무리 짓기 위해 총력전을 펼치고 있는 것으로 알려졌다.

스페인 매체 에스디아리오는 29일(현지시간) ""마테우 알레마니 아틀레티코 마드리드 단장이 겨울 이적시장 마감 전 전력 보강을 위해 독일 뮌헨으로 향했다""고 보도했다.

당초 아틀레티코 마드리드의 최우선 영입 목표는 이강인(PSG)과 에데르송(아탈란타)이었다. 디에고 시메오네 감독이 원하는 창의성과 활동량을 갖춘 자원들이었기 때문이다.

하지만 현실적인 장벽에 부딪혔다. 루이스 엔리케 PSG 감독은 이강인을 팀의 핵심 자산으로 분류하며 이적을 강력히 반대했다.



PSG 역시 이강인과의 계약 연장을 원하고 있어 협상의 여지가 없었다. 조만간 재계약 협상에 박차를 가할 것이라는 프랑스 현지 보도도 나왔다. 스페인 매체 피차헤스는 ""PSG는 아틀레티코 마드리드 측에 이강인을 판매할 의사가 전혀 없다는 입장을 분명하고 단호하게 전달했다""고 보도했다.

에데르송 또한 소속팀 아탈란타의 반대로 영입이 불가능해졌다.
결국 알레마니 단장은 빠르게 타깃을 수정했다. 목적지는 뮌헨이다. 에스디아리오는 ""최우선 영입 목표는 여전히 에데르송과 이강인이다. 하지만 두 선수 모두 이적이 순탄치 않다.이러한 맥락에서 뮌헨은 전략적으로 중요한 위치에 있다. 유력한 영입 후보는 레온 고레츠카""라고 지목했다.

이어 ""시간이 촉박한 상황에서 알레마니 단장이 독일로 향하는 바라하스 공항에서 목격됐다""며 알레마니 단장의 행보에 주목했다.



고레츠카는 바이에른 뮌헨과 독일 국가대표팀에서 활약한 베테랑 미드필더다. 올해 30세인 고레츠카는 올여름 뮌헨과의 계약 만료를 앞두고 있다.

뮌헨 입장에서는 고레츠카를 자유계약(FA)으로 풀어주는 것보다, 이번 겨울에 이적료를 챙기는 것이 이득인 상황이다.

협상은 이미 상당 부분 진척된 것으로 보인다. 독일 매체 442는 ""레온 고레츠카가 아틀레티코 마드리드를 떠난 코너 갤러거 대체자 1순위로 떠올랐다""며 ""이미 아틀레티코 마드리드 관계자들과 협상이 진행됐으며, 향후 24시간 이내에 고레츠카가 최종 결정을 내릴 것""이라고 전했다.

매체에 따르면 뱅상 콤파니 뮌헨 감독이 고레츠카를 신뢰하고 있지만, 구단 기조가 젊은 선수 육성으로 흐르고 있어 재계약 가능성은 희박하다.

알레마니 단장은 고레츠카 외에도 바이엘 레버쿠젠 소속 알렉스 가르시아 등을 후보군에 올려두고 접촉 중인 것으로 알려졌다.

결국 이강인의 아틀레티코 마드리드 이적은 무산됐다. 알레마니 단장의 뮌헨행이 스쿼드 강화라는 결실로 이어질지 이적시장 막판 행보에 관심이 쏠린다.

사진=연합뉴스"
20260130,"'충격적이다' 역대급 이적 가능성 등장...'1715억' 레알 마드리드 전격 '매각 고려', 西 매체의 폭로 ""이미 EPL 클럽들이 접촉""","주드 벨링엄/Transfer News live

[마이데일리 = 최병진 기자] 주드 벨링엄(레알 마드리드)의 이적 가능성이 등장했다.

스페인 ‘엘 나치오날’은 29일(이하 한국시각) “최근 잉글랜드 프리미어리그(EPL) 몇몇 클럽이 벨링엄에게 1억 유로(약 1,715억원)가 넘는 금액을 제시했다. 레알은 벨링엄의 경기력이 향상되지 않을 경우에는 매각을 고려할 것이다”라고 보도했다.

벨링엄은 잉글랜드 국적의 중앙 미드필더로 버밍엄 유스팀에 입단했다. 어린 시절부터 뛰어난 재능으로 주목을 받았던 그는 2019년 7월 16세의 나이로 구단 최연소 출전 기록을 경신했다.

2020년에는 버밍엄을 떠나 도르트문트로 이적하며 독일 분데스리가에 입성했다. 도르트문트에서는 한 단계 진화한 경기력을 선보였다. 그는 볼을 소유하는 능력을 바탕으로 기술적인 탈압박을 선보였고 넓은 시야를 바탕으로 정확한 패스로 중원을 이끌었다.

2023-24시즌에는 여러 클럽의 러브콜 속에서 레알로 향했다. 레알은 벨링엄 영입에 1억 300만 유로(약 1,788억원)를 투자하며 6년 계약을 체결했다. 벨링엄은 첫 시즌에 라리가 28경기 19골 6도움을 포함해 시즌 전체 42경기 23골 13도움으로 36개의 공격 포인트를 올렸다.

다만 지난 시즌부터 경기력에 대한 아쉬운 평가가 이어졌고 올시즌 초 사비 알론소 감독 체제에서도 중심을 확실하게 잡지 못했다. 특히 알론소 감독과의 불화도 이어지면서 최근에는 레알의 홈 팬들로부터 야유를 받기도 했다.

주드 벨링엄/게티이미지코리아
주드 벨링엄/게티이미지코리아

이렇게 불안한 경기력과 함께 팀 내부적인 문제까지 겹치면서 벨링엄의 거취가 뜨거워졌고 이미 프리미어리그 클럽들이 빠르게 움직이고 있다는 소식이다.

아직까지 레알이 벨링엄의 매각을 진지하게 고려하는 상황은 아니다. 하지만 보도대로 벨링엄의 경기력이 올라오지 않을 경우 잔류를 확신할 수 없으며 이는 다가오는 여름 이적시장에서 대형 이적이 일어날 수 있다는 의미기도 하다."
20260130,"맨유, 아무나 영입 안 한다…'맨체스터 향수병' 英 슈퍼스타, ""감당 못 해""","사진=톱스킬 스포츠 UK


[포포투=김재연]

맨체스터 유나이티드가 콜 팔머를 영입하지 않기로 결정했다.

영국 '미러'는 30일(이하 한국시간) ""맨유는 다가오는 여름 이적시장에서 팔머를 영입하지 않을 전망이다. 그들은 팔머가 현재 감당 가능한 금액대를 벗어난 선수라는 점을 인지하고 있다""라고 보도했다.

이는 최근 팔머가 향수병을 느끼고 있다는 소식이 나오면서부터 시작된 이적설이다. 이에 대해 영국 '더 선'은 지난 20일 ""팔머는 런던 생활을 그다지 즐기지 못하고 있으며 고향에 있는 친구들을 그리워하고 있다. 그는 어릴 적 맨유의 팬이었다""라고 밝혔던 바 있다. 이후 맨유 이적설이 이어졌던 것.

팔머는 2002년생 잉글랜드 국적의 공격형 미드필더다. 중앙뿐만 아니라 좌우를 넘나들면서 보여주는 경기 조율 능력이 훌륭하다. 여기에 뛰어난 공격 포인트 생산 능력까지 갖추고 있으며 중요한 경기에서의 영향력도 좋다. 맨시티의 유스 출신인 그는 1군에서 점차 출전 시간을 늘려갔지만, 당시 포화 상태였던 선수단 때문에 입지를 넓히지 못했다. 결국 2023년 여름 이적시장에서 4,500만 파운드(약 891억 원)의 이적료를 기록하면서 첼시로 이적했다.

사진=게티이미지


이후 팔머는 기량을 만개했다. 첼시에서의 두 시즌동안 101경기 45골 28도움의 맹활약을 하는 중이다. 이러한 그의 활약에 첼시는 지난 시즌 리그 4위를 기록하면서 유럽축구연맹(UEFA) 챔피언스리그(UCL) 복귀에 성공했고, 이에 더해 2025 국제축구연맹(FIFA) 클럽월드컵과 UEFA 유로파 컨퍼런스리그(UECL)에서도 우승했다.

이러한 활약에 힘입어 '2025 발롱도르'에서는 8위라는 높은 순위를 받기도 했다. 첼시를 넘어서서 잉글랜드의 스타 플레이어 반열에 오른 것이다. 또한 2023년 이후부터는 잉글랜드 대표팀에도 꾸준하게 발탁되고 있다.

하지만 지난 9월 펼쳐졌던 맨유전에서 사타구니 부상이 재발하면서 이번 시즌 부진을 겪고 있다. 현재까지의 기록은 공식전 13경기 5골. 지난 두 시즌에 보여줬던 강렬한 활약이 나오지 않고 있는 상태다. 이로 인해 2026 FIFA 북중미 월드컵 잉글랜드 대표 발탁도 불투명해진 것. 결국 맨유는 최근 폼이 좋지 않은 팔머에게 고액을 투자하지 않기로 결정한 듯 보인다."
20260130,"맨유 사랑이 이 정도였어? ""맨유 시절의 우승이 레알 마드리드 때보다 훨씬 기뻤어"" 고백","[인터풋볼=김현수 기자] 라파엘 바란의 맨체스터 유나이티드 사랑은 역대급이다.

맨유 소식을 다루는 'UtdDistrict'는 28일(한국시간) ""맨유에서 보낸 3년 동안 많은 팬들의 사랑을 받았던 바란이 놀라운 고백을 공개했다""라고 전했다.

전 프랑스 국가대표 센터백 바란. 뛰어난 기량은 두말할 것 없고 선수로서 정말 이뤄볼 만한 건 대부분 달성한 역대급 커리어를 쌓았다. 재능을 인정받아 18세 나이에 레알 마드리드에 입단했는데 곧바로 두각을 드러내며 주전을 차지했다. 10년간 360경기 17골 6도움을 올리며 18번의 트로피를 들어 올렸고 2018 국제축구연맹(FIFA) 러시아 월드컵 우승도 차지했다.

사진= 기브미 스포츠


2021년 새로운 도전을 택했다. 맨유 유니폼을 입고 프리미어리그 도전을 택한 것. 레알 황금기에 기여한 월드 클래스 영입에 맨유 팬들은 흥분을 감추지 못했다.

기대에 걸맞은 경기력을 보여줬다. 특유의 공중볼 장악과 태클 등 수비력은 물론 빠른 스피드를 활용한 뒷공간 커버도 뛰어났다. 그러나 문제는 '부상'이었다. 경기에 출전할 때 임팩트는 확실했으나, 잦은 부상으로 많은 경기를 소화하지 못했다. 이 때문에 말년에 입지가 불투명해졌음에도 팀이 잉글랜드 풋볼리그컵(EFL컵), FA컵을 제패하는 데 기여했다. FA컵 우승을 마지막으로 코모 1907로 이적했지만, 심해진 부상이 발목을 잡았고 2024년 결국 축구화를 벗었다.

매체에 따르면 바란은 맨유 시절이 행복으로 가득했다고 말했다. 바란은 ""나는 맨유에서 EFL컵이나 FA컵을 우승했을 때가 레알에서 챔피언스리그 우승을 했을 때보다 기뻤다. 정말 미친 경험이었다. 잉글랜드, 특히 맨체스터에서는 축구에 대한 열정을 진짜로 느낄 수 있다. 매일 그 열기 속에서 살았다""라고 회상했다.

그러면서 ""레알에서는 2018년 챔피언스리그 우승 후에도 우리는 거의 축하하지 않았다. 너무 당연한 일처럼 느껴졌고, 우리의 목표는 이미 다음 챔피언스리그 우승에 맞춰져 있었다. 이후 월드컵까지 우승하자 새로운 도전이 필요했다. 이후 맨유로 갔는데 시간이 지난 지금도 맨유에 합류한 것에 전혀 후회가 없다. 정말 놀라운 경험이었다""라고 덧붙였다."
