date,title,content
20260104,"'韓 축구 초대형 경사' 멀어졌다…대한민국 '16호 프리미어리거' 기대했는데, 에버턴 이한범 포기 수순? ""EFL 수비수 영입 추진""","[SPORTALKOREA] 황보동혁 기자= 당초 이한범(미트윌란FC) 영입을 긍정적으로 검토하던 에버턴FC가 다른 수비수를 영입하려는 모양이다. 

글로벌 매체 '원풋볼'은 4일(한국시간) 영국 '팀토크'의 보도를 인용해 ""에버턴은 1월 이적시장을 앞두고 EFL 챔피언십 블랙번 로버스의 오른쪽 풀백 라이언 알레비오수를 주시하고 있으며, 실제 계약을 추진 중이다""라고 전했다.



이어 ""에버턴의 유일한 정통 우풀백인 네이선 패터슨은 지난 화요일 노팅엄 포레스트와의 경기에서 올 시즌 프리미어리그 첫 선발 출전을 기록하며 준수한 활약을 펼쳤다. 그러나 패터슨은 부상 문제 등으로 데이비드 모예스 감독 체제에서 출전 시간이 많지 않았다. 또한 셰이머스 콜먼은 37세로 현재 부상 중이며 전성기를 지난 상태다. 결국 현재 에버턴에서 정상 컨디션의 '정통' 오른쪽 풀백은 패터슨이 유일한 상황""이라며 알레비오수 영입 배경을 설명했다.

왼발잡이임에도 오른쪽 풀백으로 활약 중인 알레비오수는 올 시즌 블랙번을 넘어 EFL 전체에서도 손꼽히는 활약을 펼치고 있다.

그는 현재까지 21경기에 출전해 1골 2도움을 기록하며 공수 양면에서 존재감을 과시했다.



그동안 에버턴은 제임스 가너, 제이크 오브라이언 등 본래 우풀백이 아닌 선수들을 해당 포지션에 기용해 왔다. 하지만 전문 우풀백인 알레비오수를 영입할 경우 안정적인 스쿼드 운영이 가능해진다.

그리고 이는 최근 제기됐던 이한범 영입 가능성에도 영향을 미칠 전망이다. 알레비오수가 합류할 경우 본래 센터백인 오브라이언을 풀백으로 기용할 필요가 없어지면서 추가적인 센터백 보강 필요성 자연스럽게 줄어들 전망이다. 

지난해 12월, 에버턴 소식을 전문으로 다루는 매체 '토피웹'은 ""에버턴의 리빌딩 프로젝트는 1월에도 계속될 것""이라며 ""티에르노 바리, 타일러 디블링 등 야심 찬 영입을 연이어 성사시키며, 구단은 유럽 전역에서 성장 중인 유망주들을 적극적으로 타깃으로 삼고 있다""고 전한 바 있다.



당시 토피웹은 에버턴이 미트윌란에서 주목하고 있는 선수 3명으로 공격수 프랑쿨리누, 아랄 심시르, 그리고 수비수 이한범을 지목했다.

매체는 이한범에 대해 ""올 시즌 미트윌란 수비진에서 꾸준히 기용되며, 팀이 공식전에서 8차례 클린시트를 기록하는 데 기여했다""며 ""볼 컨트롤에 대한 자신감이 뛰어난 현대적인 센터백 유형으로, 특히 패스 능력이 가장 큰 강점""이라고 평가했다.

또한 ""올 시즌 미트윌란 선수들 가운데 최소 200회 이상 패스를 시도한 선수를 기준으로 보면, 23세 이한범은 팀 내 최고 패스 성공률인 84%를 기록했다""며 ""제임스 타코우스키와 마이클 킨이 커리어 후반기에 접어든 가운데, 재러드 브랜스웨이트 역시 체력 관리에 부담을 안고 있는 상황에서 이한범과 같은 젊은 센터백은 에버턴에 중요한 보강 자원이 될 수 있다""고 덧붙였다.



특히 토피웹에 따르면 에버턴 스카우터가 무려 8차례나 미트윌란을 직접 방문한 것으로 알려지며 기대를 모았지만 알레비오수 영입 가능성이 높아지며 이한범의 에버턴행은 다소 멀어진 모양새다.

사진= 게티이미지코리아 

제휴문의 ad@sportalkorea.co.kr"
20260104,"'독일 국대 포기→한국행 전격 결정' 카스트로프, 일본 혼혈과 너무 비교되네, 미친 애국심...분데스리거 유망주 ""아직 결정 못해""","<저작권자(c) 연합뉴스, 무단 전재-재배포, AI 학습 및 활용 금지>
[스포츠조선 김대식 기자]일본의 사례를 보면 옌스 카스트로프의 결정이 얼마나 대단했는지를 알 수 있다.

일본 레알 스포츠는 3일 일본-독일 혼혈 미오 바크하우스의 딱한 사정을 보도했다. 매체는 '독일인 아버지와 일본인 어머니를 둔 바크하우스는 그 상징적인 존재다. 독일 분데스리가 베르더 브레멘에서 뛰는 신장 194cm의 대형 골키퍼인 그는 독일에서 태어나 어린 시절 가와사키 프론탈레 유소년에서 활약했다. 2018년부터 다시 독일로 돌아가 브레멘 유소에서 성장했고, 올 시즌 마침내 1군의 주전 골키퍼 자리를 꿰찼다'며 바크하우스의 현 상황을 먼저 설명했다.

바크하우스는 독일에서 태어났지만 일본에서 축구 선수 꿈을 키우기 시작했다. 일본 연령별 대표팀에서도 뛴 적이 있다. 더 큰 꿈을 위해 독일로 돌아간 바크하우스는 브레멘과 독일 나아가서는 일본의 미래로 꼽히는 중이다.
<저작권자(c) 연합뉴스, 무단 전재-재배포, AI 학습 및 활용 금지>
바크하우스의 거취는 현재 일본과 독일의 공동 관심사다. 2004년생의 젊은 골키퍼가 분데스리가 구단 주전으로 도약했기 때문이다. 2023~2024시즌 네덜란드 에레디비시 FC볼렌담으로 임대를 떠나서 주전으로 풀시즌을 채웠다. 볼렌담에서 성장하고 돌아온 바크하우스는 이번 시즌부터 브레멘의 1옵션 골키퍼로 맹활약 중이다. 독일 21세 이하(U-21) 팀에도 뽑히고 있다.

일본은 독일 국가대표팀 잠재력을 지닌 바크하우스가 독일이 아닌 일본을 대표해주길 바란다. 모리야스 하지메 일본 국가대표 감독이 직접 바크하우스를 찾아가 대화를 나누기도 했다. 일본과 독일의 노력에도 아직까지도 바크하우스는 결정을 내리지 못했다.
사진=브레멘
신중할 수밖에 없다. 당장 국가대표 주전이 될 수 있는 일본은 아시아 최강이지만 세계적인 수준은 아니다. 독일에선 국가대표 1옵션이 안될 수도 있지만 월드컵 우승을 노려볼 수 있다. 단순히 성적을 넘어서 바크하우스는 정체성에 대한 고민까지 가지고 있는 모양이다.

바크하우스는 최근 ""제 느낌으로는 일본이 싫으냐, 독일이 싫으냐고 묻는 것처럼 느껴질 때도 있다. 하지만 그런 문제가 아니다. 그래서 조금 더 시간을 두고 생각하고 싶다""며 심적인 부담감을 털어놓기도 했다.

독일 매체 다이히슈투베와의 인터뷰에서 ""아직 (결정을 내릴) 준비가 됐다고 느끼지 못하고 있다. 스스로 옳다고 느끼는 순간이 올 때까지 (고민하겠다)""고 대답했다.
<저작권자(c) 연합뉴스, 무단 전재-재배포, AI 학습 및 활용 금지>
바크하우스의 사례를 보면 카스트로프를 떠올릴 수밖에 없다. 카스트로프는 독일 국가대표로서 이룰 수 있는 꿈을 과감하게 포기하고, 한국행을 전격 결정했다. 선수 스스로 내린 결정이다. 가뜩이나 한국 국가대표로 뛰면 독일 소속으로는 신경도 쓸 필요가 없는 병역 문제 등 여러 가지 걸림돌이 있었다. 카스트로프는 이런 걸림돌이 있다는 걸 알고도 어머니의 나라 한국을 선택했다.

카스트로프는 바크하우스처럼 어릴 적에 한국에서 성장한 선수도 아니다. 종종 한국을 여행와서 한국의 문화를 접했지만 독일에서 태어나 그곳에서 자랐다. 카스트로프의 결정이 얼마나 대단했는지를 바크하우스의 고민을 보면 알 수 있다."
20260104,"‘공식 발언’ 프랭크 감독 “손흥민은 이제 없다” 설움 토로 이어 “감독직 즐길 수 없다 특히, 지금 너무 힘들어”","토마스 프랭크 토트넘 홋스퍼 감독. SNS 캡처


토마스 프랭크 토트넘 홋스퍼 감독이 지금 상황이 힘들다고 인정했다.

영국 매체 ‘가디언’은 3일(한국시간) “프랭크 감독이 감독직을 즐기기 어렵다고 말했다”고 보도했다.

지금 토트넘은 ‘비상 사태’다. 이번 시즌(2025-2026) 프리미어리그 19라운드 기준 13위를 기록하고 있다. 시즌 극초반 1위를 달성하고 계속 순위가 하락하고 있다.

토트넘은 현재 리그에서 경기당 승률이 37%다. 홈 경기 승률은 22%로 20팀 중 17위로 하위권이다. 이대로 가면 지난 시즌 리그 17위를 기록했던 악몽이 다시 현실이 된다. 토트넘이 부진하자 감독에게 비판이 쏟아졌다.

토머스 프랭크 토트넘 감독(오른쪽)이 경기 도중 제드 스펜스에게 작전 지시를 하고 있다. 게티이미지코리아



토마스 프랭크 토트넘 홋스퍼 감독. The.standard


가디언에 따르면 프랭크 감독은 “정말 큰 변화가 필요하다. 그 과정은 순탄하지 않고 힘들 것이다. 아마 즐기기 어려울 것이다. 힘들게 뛰다보면 그 순간이 즐겁지 않다”며 “묵묵히 그 상황을 헤쳐나가기 위해 최선을 다해야 하는 것을 알고있다. 우리는 끝까지 버티기 위해 최선을 다해야 하는 상황에 있다”고 입을 열었다.

이어 “감독직을 즐기고 있냐고? 아니다. 현실적으로 그럴 수 없다. 이건 마라톤 같다. 지금 내가 달리고 있는 구간이 특히, 힘든 것같다. 그래도 고개 숙이고 계속 나아가야 한다”고 말했다.

프랭크 감독은 이미 팀 상황을 냉정하게 파악하고 있다. 손흥민, 제임스 매디슨 같은 에이스가 없는 상황과 팀 상태를 보면 지난 시즌 같은 ‘기적’은 정말 쉽지 않다고 말했다.

토마스 프랭크. AFP연합뉴스


손흥민, 프랭크 감독. 토트넘홋스퍼뉴스


영국 ‘스카이 스포츠’에 따르면 프랭크 감독은 “솔직히 말한다. 우리는 지금 과도기에 있다. 목표는 다음 시즌 유럽축구연맹(UEFA) 챔피언스리그 진출권을 확보하는 것이다. 하지만, 정말 그 목표를 바라볼 수 있는 수준의 팀인가?”라고 입을 열었다.

이어 “토트넘은 지난 시즌 UEFA 유로파리그 우승을 차지했다. 그 자격으로 UEFA 챔피언스리그 진출권을 받았다. 프리미어리그에서 4, 5위 이상 순위 경쟁을 통해 얻은 진출권이 아니다”라며 “해당 시즌 리그에서 17위였다. 지금은 더 힘든 상황이다. 프리미어리그와 UEFA 챔피언스리그를 함께하고 있다. 이것이 가장 어려운 부분이다. 마지막으로 그런 성적을 낸 건 3년 전이다”라고 말했다.

또 “손흥민은 떠났다. 데얀 쿨루셉스키와 제임스 매디슨은 장기 부상으로 결장 중이다. 이게 현실이다. 주변의 좋은 동료들과 함께 기존의 것을 바로잡으려고 노력하고 있다. 여기서 특히 리그와 유럽 챔피언스리그를 함께 진행해야 하는 일정이 문제다”라고 다시 한번 일정을 언급했다.

마지막으로 “지금 상황을 시속 100마일로 달리는 동시에 수리까지 함께 하고 있는 격이다. 그러나 이 또한 과정의 일부다. 좋은 도전이라 생각한다. 개선할 부분은 많지만, 가장 중요한 건 성적의 꾸준함이다. 경기력 기복을 어떻게 줄일 것인가? 이것을 매일 고민하고 작업하고 있다”고 덧붙였다.

용환주 기자 dndhkr159@kyunghyang.com"
20260104,"깜짝 소식! ""손흥민도 토트넘 돌아와라"" 메시(39세, 리버풀), 선수 경력 첫 EPL 진출 성사되나...""단기 임대 추진 중""","사진=트위터 캡처
로이터연합뉴스
[스포츠조선 이현석 기자]리오넬 메시의 리버풀행 가능성이 점화됐다.

영국의 리버풀월드는 4일(한국시각) '리버풀이 미국 메이저리그사커(MLS) 개막 전에 메시를 단기 임대하는 방안을 검토 중이다'고 보도했다.

리버풀월드는 '리버풀은 2026년 MLS 개막 전에 메시를 단기 임대하는 방안을 추진하고 있다. MLS는 2월 중순에 개막하며, 메시는 현재 인터 마이애미 소속이다. 그의 전성기는 끝났을 수 있지만, 리버풀은 그를 단기 임대로 데려오기 위해 경쟁하고 있다. 임대 기간이 4~5주 정도로 짧기에 MLS 시즌을 위해 미국으로 돌아가는 상황을 고려하면 위험 부담이 적은 결정이다'고 전했다.

로이터연합뉴스
올겨울 이적시장을 앞두고 MLS 스타들의 이적 가능성이 거론돘다. 앞서 손흥민도 토트넘 복귀 가능성이 등장했었다. 발단은 베컴룰이다. 앞서 2007년 7월 레알 마드리드를 떠나 LA갤럭시에 입단한 데이비드 베컴은 이듬해 시즌을 마친 뒤 AC밀란 단기 임대를 요구했다. 미국 메이저리그사커(MLS) 휴식기이자 팀 훈련 기간인 1~3월 사이에 유럽에서 뛰길 원했다. AC밀란이 베컴에게 관심을 보였고, LA갤럭시는 베컴의 단기 임대를 허용했다. 이후에도 베컴은 한 차례 추가 임대로 AC밀란으로 향하기도 했다.

베컴의 사례처럼 메시나, 손흥민도 MLS 휴식기 동안 유럽 복귀를 고려할 수 있다. 다만 손흥민은 이적에 선을 그었다. 그는 ""내가 항상 가지고 있는 신념, 생각 등은 항상 내가 뛰고 있는 팀에 최선을 다하는 거다""며 ""루머에 대해서 사실이 아니라 말씀드릴 수 있고 따로 어디에 간다고 말한 적이 없다. 이런 얘기 나오는 거 자체가 구단에 실례가 될 수 있다고 생각한다. 이 자리를 통해서 사실이 아니라는 걸 말씀드리고 싶다""고 밝혔다.

로이터연합뉴스
메시는 어떤 마음일지 알 수 없다. 막대한 임대료와 적극적인 구애로 상황이 달라질 가능성도 있다. 메시가 리버풀 유니폼을 입는다면 데뷔 이후 최초의 잉글랜드 프리미어리그(EPL) 진출이다.

MLS에 겨울이 찾아오며, 스타들의 단기 임대를 노리는 구애의 손길이 늘고 있다. 리버풀의 파격적인 구애가 어떤 결말로 이어질지도 귀추가 주목된다."
20260104,"3경기 만에 전격 경질→승률 단 13.3% 대굴욕! 손흥민 前 스승, 또또 쫓겨날 위기...팬들도 ""당장 내보내라"" 분노","AFP연합뉴스
AFP연합뉴스
[스포츠조선 이현석 기자]누누 에스피리투 산투 감독이 다시 경질 위기에 내몰렸다.

영국의 더선은 4일(한국시각) '웨스트햄 팬들은 울버햄튼전 전반에 0-3으로 몰리자, 당장 감독을 경질하라고 분노했다'고 보도했다.

웨스트햄은 4일 영국 울버햄튼의 몰리뉴 스타디움에서 열린 울버햄튼과의 2025~2026시즌 잉글랜드 프리미어리그(EPL) 20라운드 경기에서 0대3으로 패배했다. 울버햄튼(승점 6)이 19위 번리(승점 6)와의 격차도 6점으로 좁힌 반면, 웨스트햄은 이번 패배로 18위에 머물렀다. 17위 노팅엄 포레스트(승점 18)와의 격차는 4점으로 벌어졌다.

로이터연합뉴스
무기력한 패배였다. 웨스트햄은 전반 4분만에 존 아리아스에게 실점한 후 전반 31분에는 황희찬에게 페널티킥으로 두 번째 실점을 헌납했다. 전반 41분 마테우스 마네에게 세 번째 실점까지 내주며 완전히 무너졌다. 후반에 추격을 시도했으나 이미 승기가 넘어간 후였다. 결국 경기는 그대로 웨스트햄의 0대3 패배로 마무리됐다.

더선은 '전반전이 끝나자 팬들은 더 이상 볼 것이 없다고 판단하고 대거 경기장을 떠났다. 팬들은 또한 SNS를 통해 지난 9월 그레이엄 포터의 후임으로 임명된 누누 감독을 경질해야 한다고 요구했다'고 전했다.

AFP연합뉴스
누누는 잉글랜드 프리미어리그(EPL)에서 잔뼈가 굵은 감독이다. 2017년 울버햄튼에서 전성기를 맞이했다. 누누는 울버햄튼의 챔피언십 우승을 이끌며 EPL로 이끌었다. 승격 이후 두 시즌 연속 7위로 EPL에서도 기대 이상의 성적을 거뒀다. 능력을 인정받은 그는 토트넘으로 자리를 옮겼다. 하지만 빅클럽에서 빛을 발하지 못했다. 고작 4개월 만에 성적 부진으로 팀을 떠났다. 8승2무9패의 결과로 토트넘 감독직을 마감했다.

알이타하드를 거쳐 누누는 노팅엄 포레스트 감독직을 맡으며 다시 잉글랜드로 복귀했다. 2023~2024시즌 도중에 부임했다. 팀은 누누 체제에서 완전히 새로운 모습으로 탈바꿈했다. 전술과 선수들의 활약이 어우러지며, 노팅엄은 2024~2025시즌 유로파리그 진출이라는 성과를 거뒀다. 하지만 구단주와의 관계가 발목을 잡았다. 에반젤로스 마리나키스 구단주는 대립각을 세운 누누를 올 시즌 3경기 만에 경질했다.

AFP연합뉴스
곧바로 새 기회가 찾아왔다. 감독 자리가 공석이 된 웨스트햄이 손을 내밀었다. 누누는 거절하지 않았다. 하지만 누누의 웨스트햄 여정은 가시밭길이다. 15경기에서 단 2승에 머무르고 있다. 웨스트햄의 순위는 18위까지 추락하며 강등권에 머무르고 있다.

웨스트햄 수뇌부도 경질을 고민하게 될 가능성이 크다. 팬들의 마음은 이미 돌아섰다. 경기력 반등이 빨리 이뤄지지 못한다면 변화는 불가피하다. 어쩌면 한 시즌 두 차례 경질이라는 충격적인 현실에 직면할 수도 있는 누누 감독이다."
20260104,"‘손흥민 제치고 MLS 시장가치 1위’ 미친 평가의 이 선수, 2026년도 못 뛴다","[사진] ⓒGettyimages(무단전재 및 재배포 금지)


[OSEN=서정환 기자] 슈퍼스타 손흥민(34, LAFC)보다 시장가치가 높은 선수가 있다. 

축구전문사이트 ‘트랜스퍼마크트’는 MLS 선수들의 현재 시장가치를 조사해 발표했다. 손흥민의 가치는 1700만 유로(약 289억 원)로 예전에 비해 떨어졌지만 미국프로축구에서는 전체 2위를 차지했다. 

이 매체는 “한국대표 절대적 에이스 손흥민이 2위를 차지했다. 영국의 명문 토트넘에서 LAFC로 이적한 손흥민은 MLS 사상 최고 이적료 2650만 달러(약 383억 원)를 기록했다. 손흥민은 10경기서 9골, 3도움으로 이름값을 톡톡히 했다. 특히 솔트레이크시티전에서 해트트릭을 달성했다”고 서술했다. 

[사진] ⓒGettyimages(무단전재 및 재배포 금지)


이어 “손흥민이 전성기시절 9000만 유로(약 1531억 원)로 평가받았던 것을 감안할 때 몸값이 1/5 수준으로 떨어졌다. 하지만 33세인 그의 나이를 감안하면 신기한 것은 아니다. 손흥민은 1992년생 중 세 번째로 높은 몸값을 유지하고 있다”고 밝혔다. 

MLS 전체 1위는 1800만 유로(약 306억 원)의 리키 푸츠(26, LA 갤럭시)다. 바르셀로나에서 후보선수였던 그는 MLS 이적 후 가치가 떨어졌다. 그는 2024시즌 29경기서 13골, 10도움을 기록했다. 이후 십자인대가 파열된 그는 2025년 단 한 경기도 뛰지 못했다. 지난해 2000만 유로(약 340억 원)였던 그의 가치도 200만 유로 (약 34억 원)떨어졌다. 

[사진] ⓒGettyimages(무단전재 및 재배포 금지)


하지만 푸츠는 2026년 한 경기도 뛸 수 없는 것으로 알려졌다. LA 갤럭시는 4일 푸츠가 왼쪽 무릎 전방십자인대(ACL) 재건 수술을 다시 받았다고 공식 발표하며, 2027시즌 개막에 맞춰 팀에 복귀할 것으로 예상된다고 밝혔다. 당초 재활을 거쳐 복귀를 준비하던 일정에 차질이 생기면서 사실상 2026시즌 전반까지 결장이 불가피해졌다.

푸츠는 2024년 11월 30일 시애틀 사운더스와의 서부 콘퍼런스 파이널 도중 ACL가 파열되는 중상을 입었다. 당시 그는 불편함을 느끼면서도 30분 넘게 경기를 소화하며 팀의 1-0 승리를 이끌었지만, 이후 정밀 검사와 MRI 결과 시즌 아웃 판정을 받았다. 이 부상으로 2024 MLS컵 결승전에도 출전하지 못했고, 2025시즌 전체를 결장했다. / jasonseo34@osen.co.kr "
20260104,"""감당하기 버거웠어"" 주급 1억 가까이 받았는데… 박지성과 함께 웃던 맨유 레전드, 한순간의 실수로 추락 → 파산 신청","[SPORTALKOREA] 황보동혁 기자= 박지성과 함께 맨체스터 유나이티드FC의 전성기를 이끌었던 웨스 브라운이 결국 은퇴 후 파산 신청을 했다.

영국 매체 '미러'는 4일(한국시간) ""맨유의 상징적인 수비수였던 브라운은 2008년 챔피언스리그 결승전에서 크리스티아누 호날두의 골을 도우며 정상에 올랐지만, 이후 파산을 선언하는 처지에 이르렀다""고 보도했다.

브라운은 맨유에서 총 14시즌을 활약했고, 총 362경기에 출전했다. 이 기간 동안 EPL 우승 5회, 유럽축구연맹(UEFA) 챔피언스리그(UCL) 우승 2회 등 총 13개의 트로피를 들어올렸다. 



비록 확실한 주전은 아니었지만 센터백, 풀백을 가리지 않고 소화하며 뛰며 팀의 황금기에 기여를 한 선수였다. 주급 역시 최대 5만 파운드(약 9,700만 원)이었을 정도로 적지 않았다.

그러나 브라운은 2023년 파산을 신청했다. 이에 대해 미러는 ""연이은 잘못된 투자 판단과 자산 관리에 대한 충분한 조언의 부재가 브라운을 재정적 위기의 소용돌이로 몰아넣었다""며 ""현역 시절 막대한 수입을 올렸음에도 불구하고, 은퇴 후에는 현금을 마련하기 위해 고군분투해야 하는 상황에 놓였었다""고 전했다.

파산 사실이 공개되자 영국 축구계 역시 큰 충격에 빠졌다. 다만 이제 46세가 된 브라운은 최악의 시기를 어느 정도 벗어난 상태다.



그는 방송 활동과 다양한 외부 프로젝트를 병행하며 재정 상황을 점차 회복하고 있다.

브라운은 2024년 파산 사실을 처음 공개했을 당시 ""다행히 지금도 일을 하고 있다. 이제는 내가 무엇을 해야 하는지 알고 있고, 모든 문제가 정리됐다""며 ""힘든 시간을 지나 다시 앞으로 나아가고 있다""고 밝힌 바 있다.

이어 그는 ""혼자서 감당하기엔 버거운 순간도 많았지만, 여전히 많은 일을 하고 있고 다시 움직일 수 있게 됐다. 오늘은 그 힘든 시간을 벗어난 또 하나의 날""이라며 당시의 심경을 솔직하게 털어놨다.



브라운은 은퇴 후 자신의 경험을 교훈 삼아, 자신과 같은 시행착오를 반복하는 선수가 나오지 않도록 자산관리와 투자의 중요성을 알리는 데 힘을 쏟고 있다.

미러에 따르면 브라운은 최근 인터뷰에서 ""당시에는 이런 문제를 누구에게 털어놓고 상의해야 할지조차 몰랐다""며 ""신뢰할 수 있는 사람들과 함께했다면 판단이 훨씬 수월했을 것""이라고 털어놨다.

이어 그는 자신의 사례가 경고가 되길 바란다며, 또 다른 피해자가 나오지 않기를 바라는 뜻을 전했다.

사진= 게티이미지코리아 

제휴문의 ad@sportalkorea.co.kr"
