date,title,content
20260211,"맨체스터 유나이티드 결단 내렸다, 캐릭 임시감독도 외면...‘성골 문제아’ 복귀 무산! ‘520억’ 바르셀로나 완전 이적 예정","마커스 래시포드./영국 '더 선'
마이클 캐릭, 마커스 래시포드./풋볼부저

[마이데일리 = 노찬혁 기자] 맨체스터 유나이티드가 끝내 마커스 래시포드(바르셀로나)를 다음 시즌 복귀시키지 않을 전망이다.

영국 ‘더 선’은 10일(이하 한국시각) “맨유의 마이클 캐릭 임시감독은 래시포드의 복귀를 전혀 고려하지 않고 있다. 자신의 계약이 시즌 종료까지인 만큼, 그 이후의 계획에도 래시포드는 포함돼 있지 않다”고 보도했다.

래시포드는 맨유 유소년 시스템에서 성장했다. 2005년 맨유 유스팀에 합류한 뒤 2015-16시즌 1군에 콜업돼 프로 무대에 데뷔했다. 빠른 주력과 저돌적인 돌파, 침투 움직임을 앞세워 팀 공격의 핵심 자원으로 자리 잡았다.

그러나 2023-24시즌 래시포드는 잦은 지각과 훈련 태도 문제, 음주 논란으로 구설에 올랐다. 결국 지난 시즌 루벤 아모림 전 감독 체제에서 출전 시간이 줄어들었고, 아스톤 빌라로 임대 이적했다.
마커스 래시포드/게티이미지코리아

올 시즌을 앞두고 래시포드는 바르셀로나로 다시 임대를 떠났다. 바르셀로나에서 래시포드는 완전히 반등했다. 공식전 34경기에 출전해 10골 10도움을 기록 중이며, 잉글랜드 국가대표팀 복귀에도 성공했다. 다가오는 북중미 월드컵 출전 가능성도 매우 높다.

활약이 이어지면서 맨유 복귀 가능성도 거론됐다. 특히 래시포드와 선수 시절을 함께 보내고, 감독대행 시절 지도한 경험이 있는 캐릭 임시감독이 복귀를 추진할 수 있다는 관측이 나왔다.

그러나 끝내 래시포드의 맨유 복귀는 물 건너갔다. ‘더 선’은 “래시포드를 둘러싼 상황에는 변화가 없다. 맨유는 올여름 왼쪽 윙어 자원이 부족한 만큼 공격수 영입에 나설 가능성이 크다”고 전했다.
마커스 래시포드/게티이미지코리아

래시포드는 바르셀로나로 완전 이적할 가능성이 높다. 바르셀로나는 임대 계약에 3000만 유로(약 520억원)의 완전 영입 조항을 포함시켰다. 래시포드 역시 바르셀로나 생활에 만족하고 있는 것으로 알려졌다.

‘더 선’은 “래시포드는 2028년까지 맨유와 계약돼 있지만, 올여름 완전 이적 가능성은 여전히 높다”고 덧붙였다."
20260211,"'초대박' 한국인 구단주 대형사고...韓 여성 사업가 강용미, 명문팀 구원자 등극→위기 극복한 뒤 무려 '12연승' 질주","[스포티비뉴스=장하준 기자] 구원자로 나선 한국계 회장을 위한 보답일까. 엄청난 연승 가도가 계속된다.

올랭피크 리옹은 지난 8일(한국시간) 프랑스 스타드 데 라 보주아르에서 열린 2025-26시즌 프랑스 리그앙 21라운드에서 낭트를 1-0으로 제압했다. 전반 25분에 터진 파벨 술크의 선제골은 그대로 결승골이 됐다. 리옹은 후반 16분에 나온 엔드릭의 퇴장이라는 악재를 맞이하기도 했지만, 이를 이겨내고 술크의 골을 잘 지켜 승리했다.

이로써 리옹은 최근 공식전 12연승이라는 엄청난 기세를 이어가게 됐다. 작년 12월에 있었던 유럽축구연맹 유로파리그(UEL) 고어헤드 이글스(네덜란드)전 2-1 승리를 시작으로 모든 대회에서 12경기 연속 승리를 거뒀다. 리그앙 6승, UEL 4승, 쿠프 드 프랑스 2승이다.



자연스레 리옹의 최대주주 중 한 명으로 있는 한국계 여성 사업가 미셸 강(한국명 강용미) 회장에게 관심이 쏠린다. 미셸 강 회장은 작년 12월 영국 매체 '파이낸셜타임스'가 선정한 '2025년 가장 많은 영향력을 행사한 25인'에 선정됐을 정도로 세계적인 주목을 받는 인물이다. 해당 25인에는 엔비디아의 젠슨 황 CEO도 함께 이름을 올렸다.

이처럼 높은 영향력을 자랑하는 미셸 강 회장은 서울에서 태어난 뒤, 1981년 미국으로 이주했다. 그리고 의료 관련 기업을 설립해 사업가로 큰 성공을 거뒀다.

이후 미셸 강 회장은 특별한 행보로 주목받았다. 미국의 워싱턴 스피릿과 프랑스의 올랭피크 리옹 페미닌을 운영하며 여자 축구계의 큰손으로 거듭난 그녀는 리옹 남자팀의 구원자가 됐다.

작년 7월 리옹은 존 텍스터 전임 회장의 부정 행위로 심각한 재정난을 겪으며 강등 위기를 맞이했다. 여기서 미셸 강 회장이 리옹의 구단 최고 경영자(CEO)로 나서 팀의 문제를 빠르게 수습했다. 덕분에 리옹은 위기를 극복한 뒤, 미셸 강 회장의 노력에 보답하듯 무려 12연승을 달리며 좋은 흐름을 탔다."
20260211,"맨유 커리어 종료...‘1470억 문제아’ 초대박! 빌라 ‘완전 이적’ 가능성 등장, 에메리 감독 “최고 실력 보여주면 그를 원할 것”","제이든 산초./폭스스포츠

[마이데일리 = 노찬혁 기자] 제이든 산초가 아스톤 빌라로 완전 이적할 가능성이 제기됐다.

산초는 보루시아 도르트문트 시절 전성기를 보냈다. 2018-19시즌 분데스리가 도움왕에 올랐고, 활약을 인정받아 2021년 여름 8500만 유로(약 1470억원)의 이적료를 기록하며 맨체스터 유나이티드에 합류했다.

그러나 맨유 이적 이후 커리어가 내리막을 걸었다. 경기력 기복이 이어졌고, 2023-24시즌에는 에릭 텐 하흐 전 감독과 공개적인 불화를 겪으며 1군에서 제외됐다.

이후 2023-24시즌 겨울 이적시장에서 친정팀 도르트문트로 임대를 떠났다. 지난 시즌에는 첼시로 다시 임대 이적했지만 기대에 미치지 못했고, 첼시는 위약금을 지불하며 의무 영입 조항을 파기했다.
제이든 산초./게티이미지코리아

올 시즌 산초는 빌라에서 임대 생활을 이어가고 있다. 산초는 내년 여름 자유계약(FA) 신분으로 맨유를 떠날 예정이다. 맨유는 산초와 5년 계약을 체결하며 1년 연장 옵션을 포함했지만, 해당 옵션을 발동할 계획은 없는 것으로 전해졌다.

이러한 상황에서 산초의 빌라 완전 이적 가능성이 제기됐다. 영국 ‘버밍엄메일’은 10일(이하 한국시각) “빌라의 우나이 에메리 감독은 산초가 계속해서 기량 향상을 보여준다면 이번 시즌 이후에도 빌라에 잔류시키는 데 관심이 있다”고 보도했다.

보도에 따르면 에메리 감독은 “지금 산초는 점점 나아지고 있다. 그는 자신과 팀에 주어진 과제를 이해하고 있다. 몇 차례 대화를 나눴다. 지금처럼 스스로에게 엄격하고 일관성을 유지해야 한다”고 밝혔다.
제이든 산초./게티이미지코리아

이어 “우리는 그 이상을 원한다. 기다릴 때가 아니다. 산초는 더 좋은 활약을 펼칠 자격이 있다. 팀 시스템에 적응해 기량을 끌어올리길 바란다”고 덧붙였다.

마지막으로 에메리 감독은 “산초는 재계약이 필요할 것이다. 그 팀이 빌라일 수도 있다. 최고의 기량을 보여준다면 우리는 그를 원할 것”이라고 강조했다."
20260211,"'2조 원 돌파' 초대박! 손흥민, '돈방석' 터트렸다→쏘니 업은 LAFC, 수익 '대폭 상승'...MLS 고가치 구단 2위 선정","[SPORTALKOREA] 김경태 기자= 손흥민을 등에 업은 로스앤젤레스 FC(LAFC)가 가파른 수익 상승 곡선을 그리고 있다.

미국 매체 '스포르티코'는 10일(한국시간) 메이저리그사커(MLS) 30개 구단의 시장 가치와 수익을 산출해 순위를 공개했다.

평가에는 공개된 자료, 재무 기록, MLS 거래에 직접 관여하는 스포츠 투자은행가·변호사 등 구단 재정에 정통한 관계자들과의 인터뷰 내용이 반영됐다.



이번 발표에서 1위는 인터 마이애미 CF가 차지했고, 2위는 LAFC가 이름을 올렸다. 이어 LA 갤럭시(3위), 애틀랜타 유나이티드 FC(4위), 뉴욕 시티 FC(5위)가 뒤를 이었다.

가장 눈에 띄는 변화는 마이애미의 급격한 상승세다. 2021년까지만 해도 14위에 머물렀던 마이애미는 리오넬 메시 입단 이후 급성장해 2024년 3위까지 도약했고, 결국 올해 LAFC를 제치고 1위(14억 5,000만 달러·약 2조 1,049억 원)에 올랐다.

그렇다고 해서 LAFC가 하락세를 찍은 건 아니다. 2021년 공개된 자료 이후 매년 꾸준한 상승 곡선을 그렸다. 지난해 12억 8,000만 달러(약 1조 8,584억 원)를 기록했던 구단 가치는 이번 평가에서 9% 증가한 14억 달러(약 2조 326억 원)로 뛰었다.



이 같은 성장 배경에는 손흥민의 합류를 빼놓을 수 없다. 10년간 토트넘 홋스퍼 FC에서 활약하며 월드클래스로 자리매김한 손흥민은 지난해 8월 LAFC로 이적하며 새로운 도전에 나섰다.

그의 MLS행은 전 세계적인 관심을 끌었다. 입단 일주일 만에 리오넬 메시, 크리스티아누 호날두, 르브론 제임스, 오타니 쇼헤이 등을 제치고 전 세계 유니폼 판매 1위를 기록하는 이례적인 성과를 냈다.



또한 입단 첫 달 동안 LAFC 관련 콘텐츠 조회 수는 약 339억 8천만 회로 594% 급증했고, 언론 보도량도 289% 증가했다. 이는 2022년 가레스 베일 영입 당시보다 5배 이상 높은 수치였다. 여기에 올 시즌 MLS 전체 시청자 수 역시 전년 대비 29% 증가했다.

손흥민 효과는 경기장에서도 확인됐다. 홈과 원정을 가리지 않고 구름 관중이 몰렸고, 구단은 한국 기업들과 신규 스폰서십을 체결하며 상업적 확장에도 속도를 내고 있다.

사진=로스앤젤레스 FC, 스포르티코, 게티이미지코리아

제휴문의 ad@sportalkorea.co.kr"
20260211,"""이럴 거면 양민혁 왜 영입했어?"" YANG, 뒤통수 제대로 맞았다...코번트리 합류 이후 '리그 선발 0회'→팀은 3경기 무승으로 선두 자리 내줘","(MHN 오관석 기자) 양민혁의 코번트리 시티가 최근 연이어 승리를 놓치며 챔피언십 선두 자리를 내줬다.

코번트리 시티는 지난 8일(한국시간) 코번트리 빌딩 소사이어티 아레나에서 열린 2025-26 챔피언십 31라운드 옥스포드 유나이티드와의 경기에서 0-0 무승부를 거뒀다.

이날 경기로 코번트리는 리그 3경기 무승에 빠지며 17승 8무 6패, 승점 59점으로 시즌 초반부터 지켜오던 선두 자리를 미들즈브러에 내줬다.

불과 지난해 11월까지만 해도 코번트리는 미들즈브러에 승점 10점 앞서 있었지만, 이후 흐름은 완전히 뒤집혔다. 미들즈브러가 6연승을 질주하며 선두로 치고 올라온 반면, 코번트리는 최근 경기력 기복 속에 결정력 부족이라는 약점을 노출했다. 최근 3경기에서도 2득점에 그치며 1무 2패를 기록했다.

더욱 아이러니한 점은 코번트리가 시즌 초반 압도적인 공격력으로 주목받았던 팀이라는 사실이다. 코번트리는 리그 31경기에서 63골을 기록하며 득점 2위 입스위치 타운(51골)을 크게 앞서고 있지만, 최근 들어 공격의 날카로움이 눈에 띄게 무뎌졌다.



자연스럽게 시선은 겨울 이적시장에서 새롭게 보강한 공격 자원들에게 향하고 있다. 그중에는 양민혁이 포함된다. 양민혁은 코번트리 이적 당시 ""램파드 감독님이 나를 어떻게 활용할지, 팀에서 어떤 역할을 맡게 될지를 명확하게 설명해 주셨고 그 점이 이곳이 올바른 선택이라는 확신을 줬다""고 밝힌 바 있다.

하지만 이적 이후 현실은 다소 다르다. 양민혁은 리그 5경기 중 3경기에 출전했지만 모두 교체로 투입됐고, 아직 선발 출전 기회는 주어지지 않았다. 팀이 공격에서 해법을 찾지 못하는 상황에서도 활용 폭은 크게 넓어지지 않고 있다.



이런 상황에서 양민혁의 제한적인 출전은 자연스럽게 의문을 낳는다. 당장 성적이 중요한 시점에서 즉시 전력감이 아니라면, 왜 겨울 이적시장에서 영입을 결정했는지에 대한 질문이다. 팀 분위기가 가라앉고 선두 자리까지 내준 흐름 속에서, 양민혁 영입의 의미 역시 재조명되고 있다.

코번트리는 오는 17일 미들즈브러와 맞대결을 앞두고 있다. 선두 경쟁의 분수령이 될 이 경기에서 패할 경우 1위와의 격차는 물론, 승점 5점 차로 추격 중인 3위 입스위치와의 간격도 더욱 좁혀질 수 있다.

양민혁 역시 단순한 교체 자원이 아닌, 영입 이유를 증명해야 할 시험대에 오르게 됐다.

사진=코번트리, 양민혁 SNS"
20260211,"'홍명보호 날벼락!' 월드컵 개막 목전에, 박용우·원두재 이어 '중원 엔진' 백승호마저 부상...고통 호소, 유니폼으로 팔 부목 장면 포착","[SPORTALKOREA] 김경태 기자= 대한민국 국가대표팀의 중원 엔진 백승호가 부상을 당했다.

백승호는 11일(한국시간) 영국 버밍엄에 위치한 세인트앤드루스 스타디움에서 펼쳐진 2025/26시즌 잉글리시 풋볼 리그(EFL) 챔피언십 웨스트 브로미치 알비온 FC와의 홈경기에 선발 출전했지만, 예기치 못한 부상을 당했다.

문제의 장면은 전반 12분 나왔다. 코너킥 상황에서 백승호는 다이빙 헤더를 시도했는데, 착지 과정에서 팔을 접질린 듯 한 장면이 포착됐다.



중계 화면상으로 백승호는 고통을 호소하며 표정을 찡그렸고, 입고 있던 유니폼을 팔목에 감아 부목 형태를 했다. 이후 그는 의료진의 부축을 받으며 그라운드를 빠져나갔다.

정확한 부상 정도는 아직 공개되지 않았지만, 2026 국제축구연맹(FIFA) 북중미 월드컵을 4개월 앞둔 홍명보호에는 반가울 리 없는 소식일 수밖에 없다. 그도 그럴 것이, 이미 박용우와 원두재가 부상으로 전력에서 이탈한 상황이기 때문.



박용우는 지난해 9월 십자인대 부상을 당해 장기 결장이 불가피해졌고, 원두재 역시 이달 초 아랍에미리트(UAE) 대통령컵 8강전 도중 어깨 통증을 호소하며 교체됐다.

이런 상황 속 백승호마저 전열에서 이탈한다면 대표팀 중원 운용에는 적지 않은 부담이 따를 전망이다. 특히 월드컵을 앞두고 전력 점검과 조직력 완성을 위해 3월 28일 코트디부아르, 4월 1일 오스트리아와의 평가전을 앞둔 만큼, 그의 빠른 회복이 절실한 시점이다.

사진=게티이미지코리아, 중계화면

제휴문의 ad@sportalkorea.co.kr"
20260211,"[공식발표] '韓 축구 청천벽력' 황희찬, 'OUT 확정!'→감독, ""종아리 부상, 출전 어렵다""...팀은 꼴찌, 팬들은 조롱","[SPORTALKOREA] 김경태 기자= 황희찬이 힘든 시간을 보내고 있다. 부상으로 인해 고초를 겪는 것도 모자라, 팬들의 시선마저 싸늘하다.

울버햄튼 원더러스 FC는 10일(이하 한국시간) 공식 홈페이지를 통해 황희찬의 부상 소식을 전했다. 롭 에드워즈 감독은 노팅엄 포레스트 FC전을 앞두고 열린 기자회견에서 ""황희찬이 종아리 부상으로 몇 주간 결장한다""고 밝혔다.

이어 ""차니(황희찬의 애칭)는 몇 주간 빠진다. 종아리 부상이다. 2주 뒤 재검사를 통해 상태를 다시 확인할 예정이지만, 당분간 출전은 어렵다""고 설명했다.



황희찬은 지난 8일 영국 울버햄튼의 몰리뉴 스타디움에서 열린 2025/26시즌 프리미어리그(PL) 25라운드 첼시 FC와의 홈경기(1-3 패) 도중 부상을 입었다.

전반 39분 마르크 쿠쿠레야와 볼 경합을 벌이다 넘어지며 종아리 통증을 호소했다. 이후 절뚝이며 플레이를 이어갔지만, 공이 터치라인을 벗어나자 결국 그라운드에 주저앉았다. 의료진이 투입됐고, 그는 더 이상 경기를 소화하기 어렵다는 듯 그라운드를 주먹으로 내려치며 아쉬움을 드러냈다.

이번 부상으로 황희찬의 고심은 더욱 깊어지게 됐다. 올 시즌 그는 24경기 출전해 2골 3도움에 그치며 다소 아쉬운 퍼포먼스를 보여주고 있다. 



팬들의 시선도 싸늘하다. 영국 매체 '풋볼 인사이더'에 따르면 부상 소식이 전해진 뒤 일부 팬들은 황희찬을 향해 비판과 조롱을 쏟아냈다.

이에 에드워즈 감독은 기자회견에서 ""황희찬은 매우 영리한 선수이자 훌륭한 프로다. 실수가 있을 수 있고, 그로 인해 비판을 받을 때도 있지만 그는 불평하지 않는다. 상황상 몇몇 선수에게 비난이 집중되기도 하지만, 그는 정신적으로 강하다""고 감쌌지만, 팬 여론은 쉽게 돌아서지 않는 분위기다.

해당 발언을 전한 영국 매체 '익스프레스 앤 스타'의 리암 킨 기자 사회관계망서비스(SNS) 댓글란에도 비판적인 반응이 이어지고 있다.

엎친 데 덮친 격으로 팀 상황도 녹록지 않다. 울버햄튼은 현재 1승 5무 19패(8)로 PL 20위에 머물러 있으며, 19위 번리 FC(3승 6무 16패·승점 15)와도 승점 격차가 7까지 벌어져 강등권 탈출이 쉽지 않은 상황이다.

사진=게티이미지코리아

제휴문의 ad@sportalkorea.co.kr"
20260211,"'흥부 듀오' 쇼윈도였다…부앙가, 개막 앞두고 충격의 손흥민 뒤통수 ""SON 때문에 잔류"" 외치더니 → ""플루미넨시와 합의, LAFC 선택만 남았다""","[SPORTALKOREA] 황보동혁 기자= 드니 부앙가가 로스앤젤레스 FC를 떠나는 것이 점차 현실화되는 뷘위기다. 

프랑스 매체 '풋메르카토'는 10일(한국시간) 브라질 '글로부'의 보도를 인용해 ""부앙가의 브라질 이적이 목전에 다가왔다. 리우데자네이루를 연고로 하는 플루미넨시는 약 1,500만 달러(약 200억 원) 규모의 이적료로 LAFC와 합의에 도달했다""고 보도했다.

이어 ""부앙가 개인과도 이미 합의를 마친 상태이며, 플루미넨시는 현재 LAFC의 최종 결정을 기다리고 있다""고 덧붙였다.



결국 부앙가는 미국을 떠나 브라질 무대에서 새로운 도전에 나서는게 기정사실화 된 모양새다. 실제 그는 지난달 인터 마이애미로부터 공식 제안을 받았으나 시즌 개막을 앞두고 라이벌 구단으로 에이스를 보낼 수 없었던 LAFC의 반대로 무산된 바 있다. 

그리고 그는 구단에 선택에 대해 불만을 품고 있었다. 스페인 매체 '마르카'는 지난달 24일 ""헤르만 베르테라메의 인터 마이애미 이적설이 MLS에 파장을 일으켰을 때, 그 여파는 부앙가에게서 가장 먼저 드러났다""고 전했다.

실제로 부앙가는 아프리카 네이션스컵 이후 자신의 SNS에 ""꿈에서 불과 몇 센티미터 떨어져 있는데, 구단이 문을 닫아버린다""라는 문구가 담긴 게시물을 리트윗하며 구단의 이적 불허 결정에 우회적으로 불만을 표출하기도 했다.



결국 이러한 일련의 흐름 속에서 부앙가는 팀을 떠나길 원했고, 마침 공격수를 찾고 있던 플루미넨시의 레이더망에 포착됐다.

물론 플루미넨시는 한때 부앙가 대신 존 아리아스 영입을 우선적으로 추진하기도 했다. 실제로 지난 6일 브라질 매체 '오 디아'는 ""플루미넨시가 존 아리아스의 복귀를 추진하면서, LAFC 소속 공격수 부앙가 영입 협상은 잠시 식어버린 상황""이라고 전했다.

그러나 아리아스는 친정팀이 아닌 파우메이라스를 선택했다. 이 틈을 타 플루미넨시는 다시금 부앙가와의 협상에 불을 지폈고, 계속해서 팀을 떠나길 원했던 부앙가는 플루미넨시와 이적에 합의한 것으로 보인다.



부앙가는 3년 연속 MLS 베스트 XI 선정, 지난 시즌 31경기 24골 9도움을 기록하며 MLS 역사상 최초로 3시즌 연속 20골 이상을 터뜨린 리빙 레전드다. MLS 무대에서 이룰 수 있는 모든 것을 이룬 셈이다.

다만 개막을 앞두고 급작스럽게 팀을 떠나려는 그의 행보는 구단은 물론, 손흥민에게도 깊은 아쉬움을 남긴다. 부앙가는 손흥민과 완벽한 호흡을 보이며 '흥부듀오'라는 별명과 함께 MLS무대에서 센세이션을 일으켰기 때문이다.

두 선수는 LAFC의 마지막 18골을 연속으로 합작하며 MLS 신기록을 세웠고, 손흥민 합류 후 팀이 기록한 32골 중 23골(약 70%)을 책임졌다.



손흥민이 수비 시선을 끌어주면 부앙가가 마무리하는 공식이 확립되면서, 중위권에 머물던 LAFC는 급격한 상승세를 타 정규리그 3위로 시즌을 마칠 수 있었다. 이 과정에서 부앙가 역시 손흥민과의 호흡에 큰 만족감을 드러내며 잔류를 원했던 상황이었다.

실제로 지난해 9월 글로벌 매체 골닷컴은 ""부앙가는 한때 이적을 원하는 듯 보였지만, 현재는 팀에 완전히 동화됐다. LAFC는 손흥민 영입을 통해 기대 이상의 가치를 얻었다""고 평가하기도 했다.

하지만 부앙가는 이적 기회가 찾아오자 미련 없이 빠르게 움직이는 모양새다. 다만 LAFC는 그의 이적을 곧장 허락할 계획은 없어 보인다.



풋메르카토는 ""LAFC는 후계자를 찾을 시간을 확보하기 위해 신중한 태도를 보이고 있다. 이 문제가 해결되지 않는 한, 논의가 상당 부분 진전됐음에도 불구하고 최종 승인(그린라이트)은 내려지지 않을 전망""이라며, 결국 대체자 영입이 가능할 때에만 부앙가의 이적이 성사될 것이라고 내다봤다.

과연 시즌 개막이 불과 열흘 앞으로 다가온 가운데, LAFC가 어떤 선택을 할지 귀추가 주목된다.

사진= 톰 보거트, 파토스풋, 게티이미지코리아 

제휴문의 ad@sportalkorea.co.kr"
20260211,"""700억 제안 준비!"" 맨체스터 유나이티드, 중원 보강 위해 독일산 MF 라이츠 '주요 타깃' 설정","사진=페이스북


[포포투=김호진]

맨체스터 유나이티드가 로코 라이츠 영입에 관심을 보이고 있다.

영국 '팀토크'는 10일(한국시간) 스페인 매체 '피차헤스'를 인용해 ""맨유는 로코 라이츠를 주요 타깃으로 설정했다. 라이츠는 최근 '눈에 띄는 도약'을 이뤄내며 구단의 핵심 선수로 자리매김했다는 평가를 받고 있다""고 보도했다.

이어 ""중원 보강은 오래전부터 맨유의 핵심 과제였다. 1월 이적시장에서는 신중한 접근을 택했지만, 여름을 앞두고 그 기조는 변함이 없다. 맨유는 최소 한 명, 많게는 두 명의 미드필더를 영입할 것""이라고 덧붙였다.

사진=게티이미지


라이츠는 2002년생 독일 국적의 중앙 미드필더로, 보루시아 묀헨글라트바흐 유스 시스템을 거쳐 프로 무대에 데뷔했다. 벨기에 클럽 신트트라이위던으로 임대된 기간을 제외하면, 지금까지 커리어를 모두 묀헨글라트바흐에서만 보냈다.

그는 전형적인 박스 투 박스 미드필더로 평가받는다. 성실한 수비 가담과 왕성한 활동량을 앞세워 중원 전반에 에너지를 불어넣는 타입이며, 준수한 슈팅 능력을 갖춰 공격 상황에서도 위협적인 장면을 만들어낸다.

이러한 장점을 바탕으로 라이츠는 이번 시즌 독일 분데스리가 21경기 전 경기에 선발 출전하며 꾸준함을 과시하고 있다. 안정적인 경기력과 성장 가능성을 동시에 인정받으며, 최근에는 다수의 빅클럽들로부터 관심을 끌고 있다.

한편 매체는 ""맨유가 라이츠를 노리는 경쟁자들보다 먼저 움직이겠다는 의지를 갖고 있으며, 약 4,000만 유로(약 700억원)에 달하는 제안을 준비 중""이라고 설명했다.

사진=게티이미지"
