date,title,content
20260104,"'이러면 손흥민도 토트넘!' 메시(39·리버풀) 핵폭탄급 이적설 뜬다!…""5주 단기 임대 가능성","(엑스포츠뉴스 윤준석 기자) '축구의 신' 리오넬 메시가 커리어 사상 처음으로 프리미어리그 무대를 밟을 가능성이 제기됐다.

불과 한 달 남짓한 기간을 활용한 초단기 임대라는 전례 없는 방식으로 말이다.

스페인 매체의 짧은 보도로 시작된 이 소식은 곧 영국 현지 리버풀 전문 매체들로 확산되며 축구계의 이목을 집중시키고 있다.

다만 파급력과는 달리, 현실성에 대해서는 여전히 물음표가 붙는다.



발단은 스페인 바르셀로나에 본사를 둔 스포츠 전문지 '스포르트(SPORT)'의 보도였다.

매체는 4일(한국시간) 라이브 블로그를 통해 ""리버풀은 잉글랜드 소식통에 따르면, MLS 프리시즌 기간인 1월에 리오넬 메시를 단기 임대로 영입하는 방안을 검토 중인 여러 유럽 클럽 중 하나""라고 전했다.

이어 ""거래는 매우 복잡하지만, 몇몇 구단들이 MLS 개막 이전까지 메시를 데려오는 가능성을 타진하고 있다""며 ""리버풀이 이를 추진할 수 있는 가장 영향력 있는 클럽 중 하나""라고 덧붙였다.

이 보도는 곧바로 영국 리버풀 지역 매체 '리버풀 월드'를 통해 재확산됐다.
'리버풀 월드'는 '스포르트'의 보도를 인용해 ""리버풀이 2026시즌 MLS 개막을 앞두고 리오넬 메시를 단기 임대 형태로 영입하는 방안을 검토 중""이라며 ""임대 기간은 약 4~5주에 불과할 가능성이 크다""고 전했다.

메시가 현재 소속된 인터 마이애미가 2월 중순 MLS 시즌 개막을 앞두고 있는 만큼, 유럽에서 뛸 수 있는 시간은 극히 제한적이라는 설명이다.



메시는 현재 만 38세다. 전성기와 비교할 수는 없지만, 그의 커리어가 지닌 무게감은 여전히 압도적이다.

그는 바르셀로나에서 통산 778경기 672골 303도움을 기록하며 구단의 상징으로 군림했고, 파리 생제르맹에서도 58경기 22골 30도움을 올렸다.

인터 마이애미 이적 이후에도 공식전 88경기 77골 44도움을 기록 중이며, 지난 시즌에만 49경기 43골 26도움이라는 수치를 남기며 팀의 MLS컵 우승을 이끌었다.

여기에 발롱도르 8회 수상, 2022 카타르 월드컵 우승이라는 이력은 설명이 필요 없는 커리어다.

'리버풀 월드'는 ""리버풀이 최근 몇 달간 창의성 부족에 시달리고 있는 상황에서, 비록 메시가 전성기 시절의 기량은 아니더라도 이 같은 기회는 쉽게 거절하기 어려울 수 있다""고 분석했다.

특히 2022 카타르 월드컵 당시 메시를 필두로 아르헨티나의 우승을 이끌었던 멤버였던 알렉시스 맥 알리스터가 현재 리버풀 소속이라는 점 역시 설득 요인으로 거론됐다.

리버풀 팬 커뮤니티 성격의 매체 '라우징더콥' 역시 이 가능성을 조명했다.

매체는 ""MLS가 프리시즌에 돌입한 지금, 메시가 월드컵을 앞두고 더 경쟁적인 환경에서 몸 상태를 끌어올리고 싶어 한다는 주장 자체는 이해할 수 있다""며 ""한 스페인 매체가 리버풀이 이러한 복잡한 임대 계약을 검토 중인 구단 중 하나라고 강조했다'고 전했다.



'라우징더콥'은 이 시나리오를 평가하면서 과거 사례를 언급했다.

비로 데이비드 베컴이 LA 갤럭시 소속 시절인 2009년 겨울, MLS 오프시즌을 활용해 AC 밀란으로 단기 임대를 떠났던 전례다. MLS 선수들이 시즌 공백기에 유럽 클럽에서 단기 임대로 뛰는 구조는 제도적으로 완전히 낯선 이야기는 아니라는 점에서다.

이른바 '데이비드 베컴 조항'으로 불리는 이 방법은 최근까지도 간헐적으로 언급돼 왔다.

특히 한국 팬들에게는 지난해 손흥민이 유사한 방법으로 유럽에 단기 임대 복귀를 선택할 수 있다는 루머가 집중적으로 퍼졌다.

당시 일부 유럽 매체들은 MLS 소속 손흥민이 오프시즌을 활용해 유럽 클럽으로 단기 임대를 떠날 수 있다는 시나리오를 제기했고, 이는 베컴의 사례와 연결돼 설명됐다. 특히 손흥민이 스페인 명문 바르셀로나 혹은 세리에A AC밀란으로 향할 수 있다는 루머가 화제였다.

그러나 손흥민은 해당 루머에 대해 직접 선을 그었다. 그는 지난해 11월 ""저를 둘러싼 루머가 계속 나오는 것 자체가 불편하고, 팬들 역시 혼란을 느낄 수 있다""며 ""지금까지 거론된 겨울 이적설은 모두 사실이 아니다. 어느 팀과도 이적과 관련한 논의를 한 적이 없다""고 밝혔다.



손흥민의 사례와 마찬가지로 이번 메시의 단기 임대설 또한 현실성과는 멀다.

'라우징더콥' 역시 현실적인 장벽을 분명히 짚었다. 매체는 ""리버풀은 전통적으로 이러한 유형의 거래를 추진하는 클럽이 아니다""라며 ""메시 본인 역시 잉글랜드에서 뛰고 싶다는 의사를 공개적으로 드러낸 적이 거의 없다""고 전했다.

이어 ""메시가 유럽으로 돌아온다면 가장 이상적인 시나리오는 바르셀로나 복귀일 가능성이 크다""고 덧붙였다. 다만 바르셀로나의 재정 상황을 고려할 때, 그마저도 쉽지 않다는 점 역시 함께 언급됐다.

메시의 리버풀 단기 임대설은 구조적으로는 가능한 이야기이지만, 실제로 성사될 가능성은 낮은 시나리오에 가깝다.

리버풀의 운영 기조, 메시 개인의 커리어 선택, 재정적 부담, 그리고 불과 4~5주에 불과한 임대 기간까지 고려하면 넘어야 할 벽이 적지 않다.

그럼에도 이번 루머는 메시라는 이름이 갖는 상징성 때문에라도 화제가 되기에 충분해 보인다. 

사진=월드사커토크 X / SNS / 연합뉴스"
20260104,"'금발 모델과 17살 차 극복' 56살 시메오네 감독, 아내와 첫 만남 화제... 식당 화장실서 ""널 기다렸어""","[스타뉴스 | 박재호 기자]
디에고 시메오네(오른쪽) 감독과 카를라 페레이라. /AFPBBNews=뉴스1
디에고 시메오네(56) 아틀레티코 마드리드 감독이 17세 연하 아내와의 러브스토리가 재조명받고 있다.

스페인 '리베르타드 디히탈'은 3일(한국시간) ""시메오네 감독은 식당 화장실에서 나오는 아내를 보고 사랑에 빠졌다""고 보도했다.
매체는 ""시메오네 감독과 현재의 아내 카를라 페레이라의 만남은 마치 로맨틱 코미디 영화의 한 장면 같았다""고 전했다.

매체에 따르면 첫 번째 결혼 생활 실패 후 힘든 시기를 보내던 시메오네 감독은 우연히 들른 한 레스토랑 화장실 앞에서 지금의 아내를 만났다. 화장실을 이용하기 위해 기다리던 중, 문을 열고 나오는 매력적인 금발 여성과 마주친 것이다.

당시 시메오네는 순간적인 기지로 ""당신을 기다리고 있었습니다""라고 말했다. 화장실 차례를 기다렸다는 뜻과 당신이라는 사람을 기다렸다는 중의적 의미가 담긴 멘트였다.

위트있는 이 한 마디는 페레이라의 마음을 움직였다. 그녀는 시메오네 감독에게 전화번호를 줬다. 이후 두 사람은 금세 사랑에 빠져 동거를 시작했다. 시메오네의 이혼 절차가 마무리된 후 2019년 결혼식을 올렸다.

디에고 시메오네 부부의 웨딩 사진. /사진=SNS
1987년생인 카를라 페레이라는 시메오네 감독과 같은 아르헨티나 출신이자 17세 연하의 모델 출신 사업가다. 둘은 슬하에 프란체스카(9)와 발렌티나(6), 두 딸이 있다. 시메오네 감독은 그라운드에서 카리스마 넘치는 모습과 달리, 가정에선 '딸바보'로 알려졌다.

최근 시메오네 감독은 55세에 할아버지가 되는 기쁨을 누렸다. 전 부인 사이에서 낳은 세 아들이 모두 축구 선수로 활약 중인데 이중 둘째 지안루카가 득남했기 때문이다.

한편 시메오네 감독이 이끄는 아틀레티코는 지난 시즌에 훌리안 알바레스, 코너 갤러거 등 굵직한 영입생들이 합류하며 기대를 모았지만 우승과 연이 닿지 않았다. 바르셀로나, 레알 마드리드에 이어 라리가 3위에 올랐다. 올 시즌에도 18라운드까지 승점 37(11승4무3패)로 3위를 달리고 있다.

디에고 시메오네 아틀레티코 마드리드 감독. /AFPBBNews=뉴스1"
20260104,"맙소사, 손흥민은 ""부정적 영향 줄 수 있다"" 선 그었는데…메시, 리버풀 간다니! ""합류 가능성 타진"" 드디어 PL 데뷔할까","[SPORTALKOREA] 황보동혁 기자= 리오넬 메시(인터 마이애미 CF)가 단기 임대 형태로 커리어 사상 처음 프리미어리그 무대를 밟게 될까.

리버풀 소식을 전문으로 다루는 '리버풀 월드'는 4일(한국시간) 스페인 매체 '스포르트'를 인용해 ""리버풀이 2026시즌 메이저리그사커(MLS) 개막을 앞두고 메시를 단기 임대 형태로 영입하는 방안을 고려하고 있다""고 전했다.



보도에 따르면 일부 유럽 구단들이 MLS 프리시즌 기간인 1월을 활용해 메시를 단기 임대로 데려오는 방안을 검토 중이고 리버풀 역시 그중 하나로 거론되는 모양이다. 

매체는 ""이번 거래는 현실적으로 매우 복잡한 사안이지만, 여러 유럽 클럽들이 MLS 개막 이전 메시의 합류 가능성을 타진하고 있다""며 ""리버풀은 이 영입을 추진할 수 있는 가장 영향력 있는 구단 중 하나로 평가된다""고 전했다.

메시는 바르셀로나의 상징 그 자체다.



라 마시아 유스 시스템에서 성장해 호나우지뉴의 등번호 10번을 이어받았고, 통산 778경기 672골 303도움을 기록하며 구단 역사에 길이 남을 발자취를 남겼다. 그의 활약 속에 바르셀로나는 라리가 10회, UEFA 챔피언스리그 4회 우승 등 수많은 트로피를 들어 올렸다.

그러나 영원할 것만 같았던 동행에도 끝은 있었다. 2021년 여름, 바르셀로나의 심각한 재정난으로 인해 구단은 메시를 붙잡지 못했고, 메시는 눈물을 흘리며 팀을 떠나 ""언젠가 꼭 돌아오겠다""는 말을 남긴 채 파리 생제르맹FC로 이적했다.

PSG에서 58경기 22골 30도움을 기록하며 여전히 정상급 기량을 유지한 메시는, 2022 카타르 월드컵에서는 아르헨티나를 정상으로 이끌며 커리어의 정점을 찍었다. 현재 인터 마이애미에서도 88경기 77골 44도움을 기록 중이며, 지난 시즌에만 49경기 43골 26도움을 터뜨리는 등 여전한 존재감을 과시하고 있다.



이런 가운데 공격수 알렉산드르 이사크의 부상, 모하메드 살라의 아프리카 네이션스컵(AFCON) 참가로 공격진에 큰 공백이 생긴 리버풀이 메시를 단기 임대 카드로 검토중인 상황이다. 

성사 가능성과는 별개로 전례가 없는 이야기는 아니다. 과거 MLS에서 뛰던 슈퍼스타들이 유럽 무대로 단기 임대를 떠난 사례는 존재한다.

데이비드 베컴은 LA 갤럭시 소속 시절 AC 밀란으로 임대됐고, 티에리 앙리 역시 뉴욕 레드불스에서 뛰던 중 친정팀 아스널의 요청을 받아 한 달가량 활약을 펼친 바 있다.



여기에 리버풀에는 메시와 함께 2022 카타르 월드컵 우승을 일궈낸 알렉시스 맥 알리스터가 있어 그가 안필드행을 설득하는 데 일정 역할을 할 수 있다는 관측도 나온다.

매체는 ""리버풀은 최근 몇 달간 창의성 부족에 시달리고 있고, 비록 메시가 전성기 시절의 기량은 아니더라도 이 같은 기회는 쉽게 거절하기 어려울 수 있다""며 ""만약 성사된다면 임대 기간은 약 4~5주가량이 될 것""이라고 덧붙였다.

한편 손흥민 역시 지난해 프리미어리그 단기 임대설에 휘말린 바 있다. 



그러나 그는 지난 11월 TV조선 유튜브 채널 '문스오층'에 출연해 ""저를 둘러싼 루머가 계속 나오는 것 자체가 불편하고, 팬들 역시 혼란을 느낄 수 있다""며 ""지금까지 거론된 겨울 이적설은 모두 사실이 아니다. 어느 팀과도 이적과 관련한 논의를 한 적이 없다""고 분명히 선을 그었다.

이어 ""이 같은 이야기들이 확산되는 것 자체가 클럽에 대한 신뢰에도 부정적인 영향을 줄 수 있다고 생각한다""고 덧붙였다.

사진= Bolavip Soccer, 게티이미지코리아, 뉴스1 

제휴문의 ad@sportalkorea.co.kr"
20260104,"""그냥 멍청한 구단이다"" 쏘니 놓치고, '플메'마저 잃는다…토트넘 팬들, 역대급 분노 폭발→""매일 우울하다""","사진=쿠팡플레이
[스포츠조선 강우진 기자]토트넘 홋스퍼의 최근 행보에 대해서 팬들의 불만이 폭발하고 있다. 손흥민과 브레넌 존슨을 떠나보낸 데 이어 이제는 유망주 제이미 돈리까지 내보낼 가능성이 있다.

영국 풋볼인사이더는 3일(한국시각) ""토트넘 팬들은 유망주 제이미 돈리가 여름 완전 이적 옵션이 포함된 임대 계약으로 옥스퍼드 유나이티드에 합류하도록 허용한 결정에 격분하고 있다""라고 보도했다.

사진=옥스포드 유나이티드
돈리는 지난 시즌 인상적인 활약을 보여주면서 이번 시즌을 앞두고 여러 잉글랜드 풋볼리그 챔피언십(2부리그) 구단들의 관심을 받았다. 지난 8월 스토크 시티가 돈리의 새 팀으로 낙점됐다. 그는 스토크시티 데뷔전에서 도움을 기록하며 좋은 출발을 했지만, 이후 출전 시간이 급격히 줄어들며 어려움을 겪었다.

결국 토트넘은 최근 그를 조기 복귀시키며 임대 계약을 종료한 뒤, 2부리그 소속의 옥스퍼드로 임대를 보냈다. 하지만 토트넘 팬들은 이번 계약에 불만을 품고 있다.

토트넘 팬들은 과거부터 돈리를 좋은 선수로 평가했다. 토트넘에게 절실히 필요한 플레이메이커로 뛸 수 있는 자원이기 때문이다. 정상적으로 성장한다면 토트넘의 중원을 맡을 적임자로 기대를 모았다.

사진=토트넘 홋스퍼
하지만 돈리는 옥스퍼드에서 좋은 활약을 보일 경우 토트넘을 떠날 가능성이 있다. 이번 임대 계약에 완전 이적 옵션이 포함된 것으로 알려졌기 때문이다.

이를 두고 팬들은 사회관계망서비스(SNS)를 통해 토트넘의 결정을 비난했다.

팬들은 ""왜 완전 이적 옵션을 넣는 거지? 이 구단은 멍청하다"", ""강등될 가능성이 큰 팀에 영구 영입할 기회를 주다니 멍청한 결정이다""라고 불만을 표출했다.

사진=옥스퍼드 유나이티드
또 다른 팬은 ""이 구단은 매일 나를 우울하게 만드는 결정을 한다""라며 ""아카데미에서 선수들을 키워 놓고, 1군으로 가는 길을 완전히 막아버린다. 이 팀이 어떻게 정체성을 만들 수 있겠나?""라고 탄식했다.

지난 시즌 손흥민을 떠나보내면서도 아쉬움이 컸던 토트넘 팬들이다. 최근의 부진한 성적과 함께 브레넌 존슨이 떠났고, 각광받던 유망주마저 다른 팀에게 잃을 위기에 처했다. 주요 선수들을 떠나보내는 토트넘의 선택이 어떠한 부메랑으로 돌아올지 팬들의 분노는 커져만 가고 있다."
20260104,'대한민국에 미친 윙백이 등장했다'…변신한 양현준 역대급 원더골→홍명보 감독 웃는다,"사진=게티이미지


[포포투=박진우]

양현준은 윙백으로서의 가치를 스스로 입증하고 있다.

셀틱은 3일 오후 9시 30분(한국시간) 스코틀랜드 글래스고에 위치한 셀틱 파크에서 열린 2025-26시즌 스코티시 프리미어십 21라운드에서 레인저스와 1-3으로 역전패했다. 이로써 셀틱은 레인저스와 승점 38점으로 동률을 이루며 2위를 기록했다.

이날 셀틱의 패배 속, 한 선수만이 빛났다. 주인공은 최근 윙백으로 변신해 고무적인 활약을 보였던 양현준. 이날도 양현준은 3-4-2-1 포메이션의 우측 윙백으로 선발 출전했다. 양현준은 경기 초반부터 측면에서 활발한 공격력을 과시했다.

'올드펌 더비' 선제골의 주인공은 양현준이었다. 측면 깊숙한 위치에서 공을 잡은 양현준은 특유의 빠르고 역동적인 돌파로 수비를 제치며 단숨에 박스 안으로 접근했다. 속도가 워낙 빨랐기에 상대 수비가 잡지 못했다. 양현준은 강력한 오른발 슈팅을 시도했고, 공은 그대로 골문 우측 상단 구석으로 꽂혔다.
셀틱은 양현준의 선제골을 지키지 못하며 후반에만 3골을 내리 허용했지만, 양현준은 90분 내내 위협적인 장면을 만들었다. 특히 하프 스페이스 부근에 머무르며 자주 공을 잡았고, 머리와 발을 활용해 어떻게든 슈팅을 만드는 적극성이 돋보였다.

수치가 활약상을 증명했다. 축구 통계 매체 '풋몹'에 따르면 양현준은 90분간 1골, 기회 창출 2회, 유효 슈팅 3회, 태클 4회, 걷어내기 2회, 가로채기 2회, 리커버리 6회, 드리블 성공 3회, 지상 경합 성공률 44%(4/9), 공중 경합 성공률 67%(2/3)을 기록했다. 매체는 양현준에 양 팀 통틀어 두 번째로 높은 평점 8.4점을 부여했다.

양현준은 지난달부터 윙백으로 변신해 활약하고 있다. 최근 5경기 연속으로 선발 출전하며 새로운 포지션에 적응하고 있는데, 지난달 28일 열린 리빙스톤전에서도 골맛을 봤다. 측면에서 꾸준히 공격적인 모습을 보인 양현준은 윌프레드 낸시 감독의 눈도장을 찍었고, '최대 라이벌' 레인저스를 상대로 원더골을 터뜨리며 다시 한 번 가능성을 증명했다.

월드컵을 준비하는 대한민국 국가대표팀에게 반가운 소식이다. 홍명보 감독은 월드컵을 대비해 3백 실험을 이어가고 있는데, '공격적인 윙백 활용'에 대해서는 의문 부호가 꾸준히 달렸다. 양현준은 셀틱에서 우측 윙백으로 활약하며 특유의 공격력을 과시하고 있는데, 홍명보 감독은 설영우와 김문환에 이어 양현준이라는 새로운 옵션을 얻은 셈이다.

양현준 입장에서도 윙백 변신은 새로운 기회다. 기존 포지션인 윙어 자리는 이미 포화 상태였다. 양현준에게 기회가 돌아갈 가능성이 크지 않았는데, 대표팀에 부족한 포지션인 윙백으로 변신하며 스스로 기회를 만들었다. 월드컵을 위해 지금의 경기력을 유지한다면, 홍명보 감독의 눈에 들 가능성은 충분하다.

사진=게티이미지


#포포투 코리안리거 소식"
20260104,"호날두 옆에서 뛰어서 이러나, '메시-손흥민 무시' 역대급 망언 재조명 ""사우디, MLS와 비교 불가, 격차 너무 커""","게티이미지
[스포츠조선 김대식 기자]사우디아라비아 리그는 정말로 뛰어난 리그일까.

축구 유명 SNS 매체인 풋볼 토크는 3일(한국시각) 안데르송 탈리스카의 리그 비교 발언을 조명했다. 과거에 탈리스카는 ""사우디아라비아 리그가 미국 메이저리그사커(MLS)보다 약했던 적은 단 한 번도 없다. 메시의 팀(인터 마이애미)이 사우디에 와서 0대6으로 졌다. 비교 자체가 불가능하다""고 말한 바 있다.

탈리스카의 논란 발언은 지난해 5월 브라질 매체 바이아와의 인터뷰에서 나왔다. 그 인터뷰에서 탈리스카는 사우디와 미국 리그 수준을 비교한 적이 있다. 탈리스카가 언급했던 경기는 2024년 2월 프리시즌 경기에서 진행됐던 인터 마이애미와 알 나스르의 경기였다. 당시 경기는 사우디에서 진행됐다. 호날두는 부상으로 결장했고, 메시는 후반 38분에 교체로 들어와 잠깐 뛰었다.

게티이미지
이날 승부는 일방적이었다. 탈리스카의 해트트릭을 앞세운 알 나스르가 인터 마이애미를 박살냈다. 알 나스르는 전반 12분 만에 오타비오, 탈리스카, 아이메릭 라포르테의 득점으로 3대0을 만들었다. 후반에 탈리스카가 2골을 너 넣고, 쐐기골까지 나오면서 알 나스르의 완승으로 경기가 마무리됐다. 메시가 없었지만 루이스 수아레즈, 세르히오 부스케츠가 선발로 나섰던 경기였기에 결과는 다소 충격적이었다.

탈리스카는 이 경기만 봐도 사우디 프로 리그와 MLS의 수준 차이가 극명하다고 주장한 것. 그는 ""두 리그를 비교하는 것 자체가 불가능하다. 완전히 다른 리그다. 메시가 뛰는 리그에는 경기를 뛰고 나서 대학에 가서 공부하는 선수들도 있다. 그것만 봐도 큰 차이가 있다는 걸 알 수 있다""고 말하며 MLS 수준을 굉장히 무시했다. 호날두는 탈리스카의 주장에 굉장히 기분이 좋았을 것이다. 호날두도 사우디 수준이 유럽 5대 리그에 속하는 프랑스 리그1보다 높다고 주장했기 때문이다.

<저작권자(c) 연합뉴스, 무단 전재-재배포, AI 학습 및 활용 금지>
하지만 MLS 수준이 사우디보다 높다는 증거도 충분하다. 축구 통계 매체 OPTA가 발표한 축구 리그 랭킹 TOP 30에서 MLS는 전 세계 10위에 올랐다. 호날두가 사랑하는 사우디 리그는 겨우 30위에 올랐다. 현격한 차이였으며 사우디 리그는 잉글랜드 챔피언십(2부 리그)보다도 수준이 낮았다는 평가를 받았다. MLS는 유럽 중소 리그에 속하는 튀르키예, 네덜란드 리그보다도 순위가 높았다.

사우디 리그에서 리그 20골씩 터트리던 탈리스카는 현재 튀르키예 명문 페네르바체로 이적해서 득점력이 절반 정도 뚝 떨어졌다. 탈리스카가 MLS로 이적한다면 페네르바체에서 뽐내는 득점력이 나오지 않을 수도 있다. 분명 MLS는 메시가 상륙하고, 손흥민과 토마스 뮐러가 도착하면서 전 세계의 주목을 받는 리그로 성장하고 있다. 인터 마이애미와 알 나스르의 단판 경기로 리그 수준을 일반화할 수는 없는 법이다.

<저작권자(c) 연합뉴스, 무단 전재-재배포, AI 학습 및 활용 금지>"
