date,title,content
20260130,"韓 축구 초대박! 이강인, 마침내 거취 종지부...토트넘, 아틀레티코? 어디에도 가지 않는다! ""파리, LEE 신뢰·잔류 확정""","[SPORTALKOREA] 황보동혁 기자= 이번 겨울 이적시장을 뜨겁게 달궜던 이강인(파리 생제르맹)의 거취 논란이 사실상 마침표를 찍을 전망이다. 

이번 겨울 이적시장에서 한국 축구팬들의 최대 관심사는 단연 이강인의 거취였다. 아틀레티코 마드리드와 토트넘 홋스퍼가 동시에 영입 의사를 보이면서, 빅리그 내 이동 가능성이 현실적으로 거론됐기 때문이다.

실제로 지난 20일(이하 한국시간) ATM 소식에 정통한 다비드 메디나 기자는 ""이강인은 PSG를 떠나 ATM으로 이적하는 데 확신을 갖고 있다""며 ""구단은 전력 강화는 물론 글로벌 확장 측면에서도 높은 가치를 지닌 영입으로 평가하고 있으며, 마테우 알레마니 단장은 임대 형태까지 감수하며 영입을 추진할 계획""이라고 전한 바 있다.



이어 영국 매체 '팀토크'는 26일 ""다재다능한 공격 자원을 찾던 토트넘이 이강인 영입을 위해 접근했다""며 ""손흥민의 존재로 한국 시장에 대한 이해도가 높은 토트넘은 임대 가능성을 타진했지만, PSG는 이를 단호히 거절했다""고 보도했다. 매체는 또 ""루이스 엔리케 감독은 이강인의 열렬한 지지자로, 여전히 핵심 전력으로 평가하고 있다""고 덧붙였다.

이처럼 복수의 빅클럽이 움직이면서 이강인의 겨울 이적 가능성에 대한 기대감은 자연스럽게 커졌다. 그러나 PSG의 입장은 끝내 바뀌지 않았다.

프랑스 매체 '풋수르07'은 30일(한국시간) ""이강인의 PSG 잔류가 확정됐다. 구단은 어떤 제안에도 협상 테이블에 앉지 않기로 결정했다""며 ""최근 몇 주간 이강인은 이적설의 중심에 섰지만 PSG는 이강인을 신뢰하기로 했다. 그리고 그는 이 결정을 증명해야 한다""고 보도했다. 



이어 매체는 스페인의 '카데나 세르'를 인용해 ""PSG는 이강인의 이적과 관련한 모든 논의를 거부했다""며 ""1월 이적시장에서 이강인은 어느 방향으로도 움직이지 않는다""고 강조했다.

PSG 입장에서 이강인은 쉽게 포기할 수 없는 자원이다. 이번 시즌에만 무려 7개 포지션을 소화하며 전술적 활용도와 다재다능함을 증명했다.

여기에 현재 부상으로 회복 중인 상황까지 고려하면 겨울 이적은 선수와 구단 모두에게 부담이 될 수 있는 선택지다.



결과적으로 이강인은 이번 겨울 이적시장에서 팀을 떠날 가능성이 낮아졌으며, PSG에 잔류해 주전 경쟁을 이어갈 전망이다. 

사진= 풋수르 07, 게티이미지코리아 

제휴문의 ad@sportalkorea.co.kr"
20260130,"韓 축구 초대형 오피셜 떴다, 클롭 감독 공식발표 ""손흥민 영입 실패→내 인생 최고의 실수""","[스포티비뉴스=박대성 기자] 위르겐 클롭 전 감독이 또 손흥민(33, LAFC)를 언급했다. 감독 시절에 손흥민을 영입하지 못한 것이 천추의 한이었다.

30일(한국시간) 독일 매체 'RTL 스포츠'와의 인터뷰에서 클롭은 자신의 지도자 커리어를 회고하며 손흥민을 직접적으로 언급, 전 세계 축구 팬들의 이목을 집중시켰다.

이날 인터뷰에서 진행자가 ""감독 생활을 하며 꼭 한번 지도해보고 싶었지만 끝내 인연이 닿지 않았던 선수는 누구인가""라고 묻자, 클롭 감독은 주저 없이 ""손흥민""이라고 답했다.

그는 잠시 회상에 잠긴 듯 눈을 감았다 뜨며 ""내가 그 기회를 놓쳤다. 그때 내가 더 강력하게 원했어야 했는데 그러지 못했다. 그것은 내 실수였고, 그 이후에는 더 이상 영입할 기회가 찾아오지 않았다""라며 진한 아쉬움을 토로했다.

클롭 감독이 손흥민을 언급하며 '실수'라는 단어를 사용한 것은 이번이 처음이 아니다. 지난 2022-23시즌 리버풀 감독 재임 당시에도 ""내 인생에서 가장 큰 실수 중 하나는 손흥민을 영입하지 않은 것""이라고 공개적으로 밝혀 큰 화제를 모은 바 있다.

▲ Club Soccer Football Soccer


또 리버풀을 떠난 뒤 남아프리카공화국에서 열린 행사에서도 ""도르트문트 시절 왜 손흥민과 계약하지 않았는지 나 자신도 이해할 수 없다. 나중에 프리미어리그에서 그를 적으로 상대할 때마다 속으로 '이런 바보 같은 놈'이라며 자책하곤 했다""고 고백하기도 했다.

클롭과 손흥민의 엇갈린 인연은 독일 분데스리가 시절부터 시작됐다. 당시 도르트문트의 지휘봉을 잡고 있던 클롭에게 함부르크, 레버쿠젠에서 뛰던 어린 손흥민은 공포의 대상이었다. 손흥민은 유독 도르트문트를 상대로 강한 면모를 보이며 '양봉업자'라는 별명까지 얻었다. 클롭 감독은 손흥민의 재능을 가장 가까이서, 가장 뼈아프게 목격했다. 클롭은 당시 손흥민 영입을 검토했지만, 여러 가지 상황과 판단 착오로 인해 계약은 성사되지 않았다.
이후 클롭이 리버풀로, 손흥민이 토트넘으로 무대를 옮기면서 두 사람의 관계는 프리미어리그를 대표하는 라이벌 구도로 굳어졌다.

리버풀 역시 손흥민을 품을 기회가 있었다. 리버풀의 전 연구 책임자 이언 그레이엄은 지난해 다큐멘터리 'On Running the Game'에 출연해 ""브렌던 로저스 감독 시절 데이터 분석 팀이 손흥민을 영입 최우선 타깃 중 하나로 선정했었다""고 폭로했다.

그레이엄은 ""당시 우리의 영입 리스트 1, 2순위는 호베르투 피르미누와 손흥민이었다. 만약 평행 우주가 존재한다면 리버풀의 공격진은 피르미누와 손흥민 듀오가 이끌었을 것""이라며 ""하지만 감독이 원한 스타일이 달랐고, 결국 우리는 크리스티안 벤테케를 영입했다""고 회상했다.

클롭 감독은 강한 전방 압박과 빠른 공수 전환을 핵심으로 하는 '게겐프레싱' 전술로 톱 클래스 반열에 올랐다. 손흥민은 폭발적인 스피드와 양발을 자유자재로 사용하는 결정력, 성실한 수비 가담 능력까지 갖춘 선수로, 클롭 전술의 이상향에 가장 부합하는 공격수라는 평가를 받아왔다.

▲ soccer
▲ bestof topix


모하메드 살라와 사디오 마네가 월드 클래스 윙어로 성장했듯, 손흥민 역시 클롭을 만났다면 또 다른 차원의 성장을 이뤄냈을 것이라는 관측이 지배적이다. 특히 클롭 감독이 사디오 마네, 케빈 더 브라위너와 함께 손흥민을 '놓쳐서 가장 후회하는 3인'으로 꼽았다는 사실은 그가 손흥민의 가치를 얼마나 높게 평가했는지를 방증한다.

사제지간의 연은 맺지 못했지만, 클롭은 그라운드 위에서 손흥민을 향한 각별한 애정을 숨기지 않았다. 리버풀과 토트넘의 경기가 끝날 때마다 그는 손흥민을 찾아가 따뜻하게 포옹하고 긴 대화를 나누는 모습을 보여줬다.

손흥민은 10년 동안 활약했던 토트넘을 떠나 미국 메이저리그사커(MLS)의 LAFC에서 새로운 도전을 이어가고 있다. 클롭도 리버풀 지휘봉을 내려놓은 뒤 지도자가 아닌 행정가로 활약하고 있다.

두 사람이 한 팀에서 호흡을 맞출 기회는 사실상 사라졌지만, 클롭이 여러번 말하고 있는 ""내 실수였다""라는 고백은 손흥민이라는 선수가 유럽 축구 역사에 남긴 족적이 얼마나 거대했는지를 다시금 확인시켜 주는 증거로 남게 됐다."
20260130,"'홍명보호 초비상!' 韓 축구 절망적 소식...새 팀 이적 임박→돌연 취소, 권혁규 벨기에행 무산","[스포티비뉴스=신인섭 기자] 대한민국 축구 국가대표팀의 미드필더 권혁규가 유럽 무대에서 난항을 겪게 됐다. 이적이 확실시 됐으나, 최종 단계에서 협상 불발이 발생하며 난처한 상황을 겪게 됐다.

벨기에 매체 '헤트 니우브블라드(Het Nieuwsblad)가 30일(한국시간) ""권혁규는 결국 베스테를로에 이적하지 않게 됐다. 그는 거래를 마무리하기 위해 29일 저녁 벨기에에 도착할 예정이었으나, 선수와 구단 간에 끝내 합의점을 찾지 못했다""라고 보도했다.

권혁규는 부산 아이파크가 키운 특급 유망주다. 부산의 산하 소속 개성 초등학교부터 신라 중학교, 낙동 중학교, 개성고등학교까지 거치며 부산 유스 시스템에서 꾸준한 성장세를 보였다. 잠재력을 인정받은 권혁규는 2019년 K리그2 최초의 준프로계약을 맺으며 프로 무대에 입성했다. 2019시즌 프로 무대에 데뷔했고, 2020시즌은 팀이 승격하면서 K리그1 무대에서도 뛰었다.
권혁규는 190cm의 장신으로 공수 모두에서 활약을 펼칠 수 있는 미드필더다. 빠른 발을 갖췄고, 공을 다루는 기술이 뛰어나 안정적인 경기 운영을 이끄는 선수다. 또한 활동량도 뛰어나 박스 투 박스 성향을 갖췄고, 양발을 모두 사용하는 장점을 갖춘 선수다.

군 복무도 완료했다. 권혁규는 2021시즌 김천 상무에 입대해 계속해서 경험을 쌓았다. 전역 이후에는 친정팀 부산으로 복귀했다. 이때부터 셀틱은 권혁규 영입에 관심을 보냈고, 2023년 여름 셀틱 유니폼을 입었다.



하지만 유럽 무대의 벽은 매우 높았다. 권혁규는 단 한 경기도 기회를 받지 못하며 셀틱 데뷔전을 치르지 못했다. 또한 유럽축구연맹(UEFA) 챔피언스리그(UCL) 25인 명단에 이름을 올리지 못하는 일도 발생했다.

결국 권혁규는 칼을 빼들었다. 겨울 이적시장을 통해 뛸 수 있는 팀을 물색했다. 세인트 미렌에 이어 히버니언으로 임대를 떠나 계속해서 유럽 생활을 이어나갔다. 이후 지난해 여름 FC낭트로 이적해 새 도전에 나서게 됐다.

전반기에는 여러 차례 경기에 나섰다. 경쟁자들의 부상과 부진으로 인해 권혁규에게 기회가 찾아왔다. 그러나 팀의 부진 속 권혁규도 본래 기량을 뽐내지 못했다. 수비력적인 측면에서도 아쉬움을 보여줬다. 이러한 상황 속 본래 팀을 지휘했던 카스트로 감독이 경질되고, 아메드 칸타리 감독이 부임하면서 입지가 줄어들었다.

사실상 전력 외 취급을 받았다. 프랑스 매체 레퀴프는 29일 ""2025-2026시즌을 앞두고 낭트에 입단한 권혁규가 지난해 12월부터 결장 중""이라며 ""그는 베스테를로로 떠날 가능성이 크다""고 보도했다. 실제 권혁규는 팀 내 겨울 캠프에 참여하지 못할 만큼 외면받았다.



이러한 상황에 벨기에 1부리그에 속한 베스테를로가 러브콜을 보냈다. 벨기에 축구 소식에 능통한 사샤 타볼리에리는 29일 ""권혁규의 베스테를로 이적이 확정됐다. 24시간 내 계약을 체결할 것""이라고 확신했다.

그러나 얼마 지나지 않아 무산 소식을 알렸다. 타볼리에리는 ""권혁규는 몇 시간 안에 베스테를로와 계약을 체결할 것으로 예상됐으나, 이적이 무산됐다. 양 구단간 막판 의견 불일치가 원인""이라고 밝혔다.

권혁규 입장에서 낙동강 오리알 신세가 됐다. 남은 시간 동안 이적하지 못하게 된다면 FC낭트로 돌아가야 하는 상황. 그러나 복귀하더라도 자리를 잡을 수 있을지 미지수다.

권혁규가 경기에 꾸준히 출전하지 못한다면 홍명보 감독 입장에서도 낭패다. 2026 국제축구연맹(FIFA) 북중미(미국-캐나다-멕시코) 월드컵이 얼마 남지 않은 상황 속 스쿼드 구성에 어려움을 겪을 수 밖에 없다."
20260130,"'韓 축구' 대박 호재! PL '21호 코리안리거' 좌절 아니다...오현규 풀럼행 가능성 부활, 英 BBC ""1순위 공격수와 협상 중단""","[OSEN=서울월드컵경기장, 조은정 기자]홍명보 감독이 이끄는 대한민국 대표팀과 파라과이의 A매치 평가전이 14일 오후 서울월드컵경기장에서 열렸다.'남미 강호' 파라과이는 지난 10일 일본 원정에서 2-2 무승부를 거두고 온 팀이다. 이번 경기는 홍명보호의 2026 북중미 월드컵 포트 배정을 두고도 중요한 일전이다. 현재 한국은 오스트리아, 호주, 에콰도르와 치열한 포트 2 막차 경쟁을 벌이고 있다.대한민국의 두 번째 골을 넣은 오현규가 세리머니를 하고 있다. 2025.10.14 /cej@osen.co.kr


[OSEN=고성환 기자] 오현규(25, KRC 헹크)가 이적시장 막판에 프리미어리그 입성이라는 기분 좋은 반전을 쓸 수 있을까. 풀럼이 리카르도 페피(23, PSV 에인트호번) 영입 협상을 중단하면서 오현규로 선회할 가능성이 피어오르고 있다.

영국 '스카이 스포츠'는 30일(이하 한국시간) ""풀럼은 PSV 공격수 페피 영입 시도에 난항을 겪고 있다. 현재 페피를 영입하기 위한 협상은 진행되고 있지 않다""라고 보도했다.
스카이 스포츠에 따르면 양 구단의 이적료 차이는 약 80만 파운드(약 16억 원)에 불과하다. 하지만 문제는 따로 있다. 한창 시즌이 진행 중인 겨울 이적시장 특성상 대체자 확보가 가장 중요한데 여기서 막히고 있는 모양새다.

매체는 ""PSV는 이적 시장 마감 48시간을 남겨두고 페피를 대체할 선수를 영입하길 원하고 있다. 그러나 마땅한 선수를 찾지 못하고 있다. 따라서 월요일까지 계약이 성사될 수 있을지는 미지수""라고 설명했다.

[사진] 리카르도 페피.


페피도 무리하게 풀럼행을 추진하지 않겠다는 입장이다. 어차피 현재 팔 부상으로 당장 경기에 뛸 수 없는 데다가 여름 이적시장에서도 충분히 프리미어리그 진출이 가능하다는 판단이다.

스카이 스포츠는 ""페피는 계약이 성사되지 않을 경우 여름까지 PSV에 잔류할 의향이 있는 것으로 알려졌다. 그는 팔 부상에서 순조롭게 회복하고 있다. 당초 3월까지 결장할 것으로 예상됐지만, 2월 말 복귀 가능성도 있다""라고 전했다.

또한 매체는 ""지난 한 해 동안 여러 프리미어 리그 클럽들이 페피에게 관심을 보였다. 그가 복귀 후 폼을 되찾는다면 여름 이적 시장에서 더 많은 관심을 받을 것으로 예상된다""라고 덧붙였다.

현재로선 풀럼의 페피 영입이 무산될 가능성이 더 커보인다. 영국 'BBC' 소속 니자르 킨셀라 역시 ""페피를 영입하기 위한 풀럼과 PSV의 대화는 현재 결렬된 상태다. 풀럼은 지난주 2800만 파운드(약 554억 원)의 제안을 보낸 바 있다""라며 빨간불이 켜졌다고 알렸다.



자연스레 오현규의 풀럼행 가능성이 커지게 됐다. 풀럼은 2순위 옵션으로 오현규를 눈여겨보고 있기 때문. 페피 영입이 어려워지고 있는 만큼 오현규와 협상에 박차를 가하게 될 것으로 보인다

앞서 '디 애슬레틱'은 ""풀럼은 페피를 영입하기 위해 PSV에 제안을 보냈지만, 거절당했다. 페피는 팔 부상 때문에 영입 과정이 지연되고 있다""라며 ""이에 따라 헹크 소속의 한국 국가대표 오현규가 백업 옵션으로 거론되고 있다""라며 ""풀럼은 윙어 오스카르 보브(맨체스터 시티) 외에도 이 두 스트라이커 중 한 명을 영입하기 위해 노력할 것""이라고 전했다.

풀럼은 이미 헹크 측과 접촉했으며 오현규 역시 프리미어리그 진출에 열려 있는 것으로 알려졌다. 이적시장 마감이 48시간도 남지 않은 가운데 오현규의 극적인 유럽 빅리그 입성을 기대해볼 수 있는 이유다.

만약 오현규가 정말로 풀럼 유니폼을 입게 된다면 그는 프리미어리그 구단과 계약을 체결하는 역대 21번째 한국인 선수가 된다. 아울러 2007년부터 2010년까지 활약했던 설기현 이후 오랫동안 끊겼던 풀럼의 한국 선수 계보를 잇게 된다. 설기현은 풀럼에서 알 힐랄로 임대됐던 시기를 제외하고 통산 26경기 2골 2도움을 기록했다.



사실 오현규는 지난해 여름에도 빅리그 이적에 가까웠다. 당시 닉 볼테마데를 뉴캐슬에 내준 독일 슈투트가르트가 그를 원했다. 헹크도 이적시장 마감 직전이었지만, 2800만 유로(약 481억 원)라는 거액을 거절할 순 없었다.

하지만 슈투트가르트는 돌연 메디컬 테스트에서 오현규의 무릎을 문제 삼으며 영입을 취소했다. 막판에 이를 빌미로 임대 계약 등 재협상을 요구한 것으로 알려졌다. 오현규는 크게 상심했다고 밝혔으나 헹크로 돌아가 다시 활약을 이어갔다. 올 시즌 성적은 30경기 10골 3도움이다.

다만 오현규는 최근 사령탑이 바뀐 뒤 두 경기 연속 벤치를 지켰다. 토르스텐 핑크 전 감독은 그를 주전 공격수로 중용했지만, 니키 하옌 신임 감독은 그를 벤치로 내렸다. 이 때문에 오현규가 이적을 준비하고 있다는 관측이 나오기도 했다. 물론 헹크는 유럽축구연맹 유로파리그 16강 직행이 걸린 30일 말뫼전에선 오현규를 선발 기용해 83분간 뛰게 했다.

[OSEN=상암, 조은정 기자]10일 서울 마포구 서울월드컵경기장에서 2026 국제축구연맹(FIFA) 북중미 월드컵 아시아 3차 예선 B조 10차전 대한민국 남자 축구 대표팀과 쿠웨이트의 경기가 열렸다.한국은 지난 6일 이라크 원정에서 2-0 완승과 함께 5승 4무(승점 19)로 조 2위 이상을 확정, 11회 연속 월드컵 본선 진출을 조기 확정지었다.후반 한국 오현규가 팀의 세 번째 골을 넣은 뒤 기뻐하고 있다. 2025.06.10 /cej@osen.co.kr


한편 오현규의 거취는 2026 국제축구연맹(FIFA) 북중미 월드컵을 준비하는 홍명보호에도 중요한 변수다. 그는 홍명보 감독 체제에서 꾸준히 출전하며 월드컵 출전의 꿈을 키우고 있다. 현재로선 오현규가 큰 부상을 당하지 않는 한 적어도 월드컵 엔트리에는 포함될 가능성이 매우 크다.

/finekosh@osen.co.kr

[사진] ⓒGettyimages(무단전재 및 재배포 금지), 헹크 소셜 미디어."
20260130,"[오피셜] 거짓부렁→날벼락! 대한민국, 최고 유망주 위태롭다...코번트리, '임대생' 양민혁 두고 수리남 윙어 마르켈로 영입","[SPORTALKOREA] 박윤서 기자= 양민혁이 코번트리 시티 FC서 좀처럼 출전 기회를 확보하지 못하고 있는 가운데 새로운 경쟁자가 추가됐다.

코번트리는 28일(한국시간) 구단 홈페이지를 통해 ""스위스 슈퍼리그 FC 취리히 소속 측면 윙어 야노아 마르켈로를 영입했다""라고 공식 발표했다.

마르켈로는 2024년 취리히 유니폼을 입은 후 공식전 43경기에 출전해 6골 8도움을 터트린 재능이다.

네덜란드 명가 AFC 아약스 유소년 시스템을 통해 커리어를 시작했고, FC 트벤테, 고 어헤드 이글스, NK 쿠스토시야, 첼례 등을 거치며 성장했다. 



마르켈로는 구단을 통해 ""코번트리에 합류할 수 있어 매우 기대된다. 이곳은 큰 구단이고, 엄청난 목표를 이루고자 한다. 나 역시 성공하고 싶고, 구단과 함께 특별한 무언가를 일구길 원한다""라며 ""개인적인 목표는 최대한 많은 출전 시간을 얻어 승리에 기여하는 것""이라고 밝혔다.

승격을 노리는 코번트리의 막바지 승부수는 양민혁에겐 부담으로 다가올 가능성이 높다. 애초 코번트리와 프랭크 램파드 감독은 올겨울 양민혁을 임대 영입하며 즉시 전력감으로 활용할 계획을 수립한 것으로 알려졌다.



양민혁은 입단 소감을 통해 ""감독님께서 얼마나 활용할 계획인지, 내가 이 팀에 어떻게 적응할 수 있는지 아주 명확하게 설명해 주셨다. 이후 내게 꼭 맞는 곳이라는 확신이 들었다""고 밝힌 바 있다.

다만 램파드 감독은 양민혁이 합류한 후 치른 리그 3경기서 단 18분의 기회를 부여하는 데 그쳤다. 완전 영입이 사실상 불가능한 선수를 적극적인 러브콜을 통해 단기 임대했음을 고려할 때 쉽사리 이해되지 않는 대목이다. 설상가상 양민혁은 기존 선수단과의 주전 경쟁도 버거운 시점에서 영입생 마르켈로와 비슷한 포지션을 놓고 다퉈야 하는 위태로운 상황에 직면했다.

사진=코번트리 SNS

제휴문의 ad@sportalkorea.co.kr"
20260130,맨체스터 유나이티드 결단 내렸다…'캐릭 성적과 관계없이 차기 감독 면접 진행',"사진=X


[포포투=박진우]

맨체스터 유나이티드는 마이클 캐릭 감독의 성적과는 별개로 감독 면접을 진행한다.

영국 '트리뷰나'는 30일(한국시간) 이적시장 전문가 벤 제이콥스 기자의 보도를 인용해 ""맨유는 캐릭 감독 체제와는 별개로 정식 감독 선임 절차를 계속해서 진행한다는 방침을 분명히 했다""고 전했다.

캐릭 감독 부임과 동시에 맨유는 환골탈태했다. 첫 번째 경기였던 맨체스터 시티전. 올드 트래포드에서 맨시티를 압도하며 2-0 완승을 거뒀다. 경기력은 물론 결과까지 잡으며 '반전의 서막'을 알렸다. 이어진 아스널전에서는 짜릿한 3-2 역전승까지 거두며 '2연승'을 달성했다.
리그 1, 2위를 달리는 '우승 후보'를 연달아 잡은 맨유. 현재 승점 38점으로 단독 4위를 달리고 있다. 맨유는 현실적으로 다음 시즌 유럽축구연맹(UEFA) 챔피언스리그(UCL) 진출권이 주어지는 4위 안으로 시즌을 마무리하고자 하는 목표를 다지고 있다.

전망은 좋다. 후벵 아모림 감독은 14개월 동안 분신과도 같은 3백 전술에 선수를 맞추려 했지만, 캐릭 감독은 달랐다. 오랫동안 맨유가 활용했던 4-2-3-1 포메이션을 다시 꺼내들며 선수들이 가장 편안한 환경에서 잠재력을 발휘할 수 있는 환경을 만들었다. 아모림 감독을 경질하고 캐릭 감독을 선임한 건 '신의 한 수'였다.

다만 캐릭 감독은 어디까지나 '임시 감독'이다. 임기는 이번 시즌 종료 시점까지. 다만 영국 현지에서는 캐릭 감독의 지도력을 높게 사, 그를 정식 감독으로 임명해야 한다는 목소리가 커지고 있다. 반면 '맨유 레전드' 로이 킨은 ""임시 감독과 맨유의 정식 감독은 완전히 다르다. 현재로서는 캐릭 감독은 경험이 충분치 않고, 축구 지식 역시 더 필요해 보인다""며 소신을 밝히기도 했다.

구단 수뇌부는 방침을 정했다. 캐릭 감독의 성적과 관계 없이, 일단 차기 감독 면접을 계속해서 진행하겠다는 내용이다. '트리뷰나'는 ""구단은 캐릭 감독이 임시로 팀을 맡는 동안, 향후 부임할 감독에게 안정감과 연속성을 제공해주길 기대하고 있다. 이 선임 작업은 철저하고 광범위하게 진행되고 있으며, 적임자를 찾기 위해 충분한 시간을 두고 검토 중이다""라고 설명했다.

다만 캐릭 감독에게 기회가 없는 건 아니다. 매체는 ""캐릭 감독에게도 판도를 바꿀 기회는 열려 있다. 시즌 종료까지 좋은 흐름을 이어간다면, 정식 감독 후보군에 확실히 이름을 올릴 수 있다는 평가다. 그럼에도 그의 성적과는 무관하게 여러 후보들이 면접 대상에 오를 가능성이 크다는 게 현지 전망이다""라고 덧붙였다. 

사진=게티이미지"
