date,title,content
20260211,"배신당한 손흥민의 눈물, 부앙가에게 '흥부 듀오'는 비즈니스였다…끝내 플루미넨시행 임박 ""이적료 220억""","[골닷컴] 배웅기 기자 = 손흥민(33)과 드니 부앙가(31·이상 로스앤젤레스 FC)의 '흥부 듀오'가 반년 만에 해체된다. 부앙가가 플루미넨시 이적을 눈앞에 뒀다.

브라질 매체 '지아리우 다 헤지앙'은 10일(이하 한국시간) ""올겨울 이적시장에 공격적으로 나서고 있는 플루미넨시가 새로운 시즌을 앞두고 또 하나의 강력한 보강을 추진하고 있다""며 ""구단은 부앙가 영입을 위해 이적료 1,500만 달러(약 218억 원)를 제안했다""고 보도했다.

플루미넨시는 올겨울 제메스·길헤르메 아라나·헤페르손 사바리노 영입을 마무리 지었고, 이제 부앙가에게 집중해 보강에 방점을 찍고자 한다. 매체는 ""부앙가 영입이 성사된다면 플루미넨시가 가장 기대하는 보강 중 하나가 될 것""이라며 ""그는 로스앤젤레스(LA) FC 통산 152경기 101골 42도움을 기록했다""고 설명했다.



부앙가는 올겨울 인터 마이애미 이적이 무산되며 LAFC와 갈등을 빚었다. 부앙가는 지난달 21일 사회관계망서비스(SNS)에 ""구단이 눈앞의 꿈을 막아버렸다""고 게시한 한 팬의 글을 공유해 논란이 됐다. 이에 스페인 매체 '마르카'는 지난달 24일 ""부앙가의 좌절감이 엿보이는 대목""이라며 ""그는 이적을 원했음에도 불구하고 LAFC가 허가하지 않은 데 분노했다""고 조명했다.

지금으로서는 플루미넨시 이적이 유력한 상황이다. 브라질 매체 '글로부'는 8일 ""플루미넨시가 존 아리아스(SE 파우메이라스) 영입에 실패하며 다시 부앙가에게 눈을 돌렸다. 구단과 부앙가는 개인 협상에서 합의에 도달했지만 LAFC의 강경한 태도가 걸림돌이 되고 있다""고 밝혔다.


부앙가는 2022년 여름 AS 생테티엔에서 LAFC로 이적하며 메이저리그사커(MLS) 무대에 발을 내디뎠고, 통산 152경기 101골 42도움을 폭발하며 팀 역대 최다 득점자에 이름을 올렸다. 지난해 여름 손흥민이 합류한 뒤에는 환상의 호흡을 보이며 LAFC의 2025 아우디 MLS컵(플레이오프·PO) 8강 진출을 이끌었다.

사진 = 더 선, 사회관계망서비스, 게티이미지"
20260211,"'손흥민 대통곡, 2부 강등각이다' 패패무무패패무무 토트넘, 뉴캐슬에 1-2 패 8경기 무승 수렁→리그 16위 추락→강등권 공포..'프랭크 경질 압박 최고 수위 도달'","로이터<저작권자(c) 연합뉴스, 무단 전재-재배포, AI 학습 및 활용 금지>
로이터 저작권자(c) 연합뉴스, 무단 전재-재배포, AI 학습 및 활용 금지>
AFP<저작권자(c) 연합뉴스, 무단 전재-재배포, AI 학습 및 활용 금지>
[스포츠조선 노주환 기자]EPL 토트넘의 리그 부진이 계속 이어졌다. 최근 8경기에서 승리를 거두지 못했다. 이번엔 홈에서 뉴캐슬에 졌다. 토트넘의 2부 리그 강등 공포가 현실화되고 있다. 토트넘 사령탑 토마스 프랭크 감독의 경질 목소리가 다시 힘을 받게 됐다.

토트넘이 11일(한국시각) 영국 런던 토트넘 홋스퍼 스타디움에서 벌어진 뉴캐슬과의 2025~2026시즌 잉글랜드 프리미어리그 26라운드 홈 경기서 1대2로 졌다. 토트넘은 승점 획득에 실패하면서 승점 29점에서 제자리 걸음, 리그 16위로 추락했다. 이날 첼시와 2대2로 비긴 리즈(승점 30)에 15위 자리를 내줬다. 17위는 한 경기를 덜 치른 노팅엄(승점 26)이고, 18위는 이날 맨유와 1대1로 비긴 웨스트햄(승점 24)이다. 토트넘과 불과 승점 5점 차이다. 토트넘은 최근 리그 8경기에서 승리를 거두지 못했다. 올해 들어 리그에서 승리가 없다. 토트넘이 리그 경기에서 마지막으로 승리한 게 작년 12월 19일 크리스털팰리스전(1대0)이다. 반면 뉴캐슬은 3연패를 끊었고, 승점 36점으로 리그 10위가 됐다.

로이터<저작권자(c) 연합뉴스, 무단 전재-재배포, AI 학습 및 활용 금지>
이번 시즌 1군에서 부상자가 속출한 상황인 토트넘은 이날 4-3-3 전형으로 나섰다. 최전방에 시몬스-솔란케-오도베르, 허리에 사르-비수마-갤러거, 포백에 스펜서-반 더 벤-드라구신-그레이, 골문에 비카리오를 배치했다. 교체카드로 텔, 팔리냐, 콜로 무아니를 썼다.

토트넘은 전반 추가 시간에 선제골을 내줬다. 뉴캐슬의 티아부가 골망을 흔들며 전반전을 1-0으로 앞선 채 마쳤다. 토트넘은 후반 19분 아치 그레이가 동점골(1-1)을 뽑았다. 하지만 4분 후 두번째골을 내주면 1-2로 끌려갔다. 뉴캐슬 제이콥 램지가 앤서니 고든의 도움을 받아 결승골을 터트렸다.

로이터<저작권자(c) 연합뉴스, 무단 전재-재배포, AI 학습 및 활용 금지>
토트넘은 동점골을 뽑기 위해 전체 라인을 올려 파상공세를 퍼부었다. 반면 뉴캐슬은 한골차 리드를 지키기 위해 교체 카드를 전부 쓰면서 공세를 막아냈다. 패배를 직감한 토트넘 팬들은 경기가 끝나기도 전에 경기장을 떠나는 모습이 중계 카메라에 포착되기도 했다. 경기장에선 토트넘을 향한 야유가 쏟아졌다. 결국 토트넘이 1대2로 졌다.

토트넘의 앞 길이 험난해보인다. 토트넘 선수단은 현재 '부상 병동'과 같다. 최근 수비수 우도기까지 햄스트링 부상으로 한달 이상 결장하게 됐다. 지난 맨유전에서 무모한 태클로 레드카드를 받았던 주장 로메로는 4경기 결장 징계를 받았다. 토트넘의 부상자 리스트에는 케빈 단소, 벤 데이비스, 페드로 포로, 우도기(이상 수비수), 벤탄쿠르, 베리발, 쿠두스(이상 미드필더), 히샬리송(공격수) 등이 포함돼 있다. 메디슨과 쿨루셉스키가 부상으로 팀에서 이탈한 건 오래된 얘기가 돼버렸다.

EPA<저작권자(c) 연합뉴스, 무단 전재-재배포, AI 학습 및 활용 금지>
토트넘의 향후 리그 일정도 살벌하다. 아스널(홈)-풀럼(원정)-크리스털팰리스(홈)-리버풀(원정)-노팅엄(홈) 순이다. 어느 한 경기 승리를 장담하기 어려운 상대들이다. 이런 중요한 경기들이 수두룩한데 로메로는 아스널, 풀럼, 크리스털전까지 집에서 TV로 경기를 봐야한다."
20260211,"오현규, 느닷 없는 날벼락? 9번 달고 환상 오버헤드킥 데뷔골 쐈는데…'레알 출신' 깜짝 영입설→베식타스 FW 경쟁 요동","(엑스포츠뉴스 이우진 기자) 튀르키예 무대에서 강렬한 데뷔골로 존재감을 알린 오현규(24)의 입지가 벌써부터 시험대에 오를 가능성이 제기됐다.

스페인 라리가 명문 레알 마드리드가 공격수 곤살로 가르시아(21)를 향한 거액 제안을 받은 가운데, 그 오퍼의 주인공으로 오현규의 소속팀 베식타스가 거론되면서다.

스페인 스포츠 전문 매체 '피차헤스'는 지난 9일(한국시간) ""레알 마드리드가 곤살로 가르시아를 향한 2500만 유로(약 433억원) 규모의 제안을 받았다""고 보도했다. 매체에 따르면 해당 오퍼는 튀르키예 쉬페르리그 명문 베식타스가 제시한 것으로, 레알은 즉각적인 수용 대신 내부 논의를 거쳐 신중하게 결정을 내릴 방침이다.

지난해 여름 2025 국제축구연맹(FIFA) 클럽월드컵에서 6경기 4골 1도움을 터뜨리는 대활약으로 전 세계 축구팬들의 관심을 한몸에 받은 공격수 가르시아는 올 시즌 1군과 카스티야(B팀)를 오가며 기회를 받았지만 확고한 주전 자리를 확보하지는 못했다. 그는 2025-2026시즌 라리가에서 단 4회 선발 출전 기회를 얻는 데 그쳤다.



레알은 브라질 특급 유망주 엔드릭을 비롯해 기존 주전 공격수인 킬리앙 음바페 등 공격 자원이 풍부한 상황이다.

'피차헤스'는 ""레알은 선수의 성장 가능성과 시장 가치, 그리고 스쿼드 재편 계획을 종합적으로 검토 중""이라며 ""단순히 금액만으로 판단하지는 않을 것""이라고 전했다.

특히 이번 이적설은 베식타스의 공격진 구상과도 직결된다. 베식타스는 최근 벨기에 헹크를 떠나 합류한 오현규를 중심으로 공격진 재편에 나선 상황이다. 오현규는 지난 5일 이적료 1400만 유로(약 241억원)에 베식타스에 입단했는데, 활약에 따른 옵션 100만 유로가 더해질 경우 총 이적료가 1500만 유로(약 258억원)까지 올라설 수 있는 구조다. 

이적료 1500만 유로를 기록한다면, 그는 베식타스 구단 역대 최고 이적료 영입 공동 3위에 오를 수 있다. 오현규가 합류하기 전에 애스턴 빌라(잉글랜드)로 떠난 타미 애이브러햄이 지난해 여름 발생시킨 금액과 동률이다. 



오현규는 지난 9일 튀르키예 이스탄불의 튀프라쉬 스타디움에서 열린 알란야스포르와의 2025-2026시즌 튀르키예 쉬페르리가 21라운드 홈 경기에서 후반 9분 환상적인 오버헤드킥 골로 확실한 데뷔전 임팩트를 남기기도 했다.

이적 직후 상징적인 등번호인 9번을 배정받은데다 멋진 데뷔골까지 작렬하며 기대를 한몸에 받고 있는 오현규지만, 최전방 스트라이커 주전 경쟁은 경쟁은 이제부터가 시작이다.



만약 가르시아 영입이 현실화될 경우, 베식타스는 젊은 공격수 두 명을 두고 본격적인 내부 경쟁 체제를 가동하게 된다.

이는 오현규 입장에서도 출전 시간 확보와 팀 내 입지 구축에 있어 변수로 작용할 수 있다. 현지 매체가 ""즉시 전력감으로 활용할 계획""이라고 언급한 만큼, 가르시아가 합류한다면 이는 단순한 로테이션 이상의 의미를 지닐 가능성이 크다.

결국 이번 2500만 유로 제안은 레알 마드리드의 미래 플랜뿐 아니라 베식타스에서 새 도전에 나선 오현규의 입지와도 맞물린 사안이다. 레알의 최종 선택 하나가 베식타스의 공격 구도는 물론 오현규의 커리어 설계까지 흔들 수 있다.



사진=베식타스 / 연합뉴스"
20260211,아스널 버리고 맨체스터 유나이티드 택했는데…주전 경쟁 밀려났다→'아직 더 성장해야 돼',"사진=게티이미지


[포포투=이종관]

올 시즌 맨체스터 유나이티드에서 에이든 헤븐의 미래는 그다지 밝지 않아 보인다.

맨유 소식을 전하는 '스트레티 뉴스'는 9일(한국시간) 글로벌 매체 '디 애슬래틱'을 인용해 ""맨유 팬들은 남은 시즌 동안 경기장에서 헤븐의 모습을 많이 보지 못할 수도 있다""라고 전했다.

2006년생, 잉글랜드 국적의 헤븐은 아스널이 기대하던 차세대 센터백 자원이었다. 웨스트햄 유나이티드 유스에서 성장한 그는 지난 2019년에 아스널 유스로 둥지를 옮겼다. 그리고 구단 아카데미 시스템을 단계적으로 밟으며 가파른 성장세를 보였다.

1군에 콜업된 것은 2023-24시즌이었다. 포르투와의 유럽축구연맹(UEFA) 챔피언스리그(UCL) 16강 1차전에서 교체 명단에 포함되며 큰 기대를 모았다. 비록 출전은 불발됐으나 구단 내부적으로 큰 기대를 가지고 있는 자원임을 확인할 수 있었다.

지난 시즌을 앞두곤 본격적인 1군 생활을 시작했다. 그리고 프레스턴 노스 엔드와의 잉글랜드풋볼리그컵(EFL컵) 경기에서 교체 출전하며 프로 데뷔전을 가졌다. 후반 35분에 투입돼 10분가량 그라운드를 누빈 그는 짧은 시간에도 안정감 있는 모습을 보여주며 자신의 가치를 증명했다.

지난겨울엔 맨유 유니폼을 입고 인상적인 활약을 펼쳤다. 지난 시즌 맨유에서의 기록은 7경기. 비록 부상으로 많은 경기를 소화하지는 못했으나 나올 때마다 안정적인 활약을 펼친 헤븐이었다.

올 시즌은 초반까지 주로 벤치를 지키던 헤븐. 반등을 꿈꾸고 있으나 쉽지 않아 보인다. '디 애슬래틱'의 로리 휘트웰 기자는 ""헤븐은 크리스마스 전후로 주전 멤버에 합류해 있었지만, 경기 수가 부족한 상황을 고려한다면 올 시즌에 많은 경기를 뛰지 못할 수도 있다. 그는 더 성장해야 하며, 맨유 측은 훈련을 통해 그 성장이 가능하다고 보고 있다""라고 예측했다."
20260211,"'HERE WE GO!' 직접 언급… ""클럽 레코드 갱신 가능"" 토트넘, '꿈의 타깃' 로저스 영입 노린다!","사진=토트넘홋스퍼 뉴스


[포포투=김호진]

토트넘 홋스퍼가 모건 로저스를 '꿈의 영입' 대상으로 설정했다.

영국 '팀토크'는 10일(한국시간) 유럽 축구 이적시장 전문가인 파브리시오 로마노를 인용해 ""토트넘 홋스퍼가 올여름 '꿈의 영입'으로 삼고 있는 선수를 공개했다.주인공은 모건 로저스""라고 보도했다.

이어 ""토트넘이 로저스 영입을 위해 2025년 여름 도미닉 솔란케 영입에 사용한 클럽 레코드 6,500만 파운드(약 1,300억원)을 넘어설 의지가 있다""고 덧붙였다.

로저스는 2002년생 잉글랜드 출신의 공격형 미드필더다. 웨스트 브롬위치 알비온 아카데미에서 성장했으며, 재능을 인정받아 맨체스터 시티 유스팀으로 이적했다. 2019년 성인팀으로 콜업돼 프로 데뷔했지만 꾸준한 출전 기회를 얻지 못했고, 여러 차례 임대를 거친 뒤2023년 여름 미들즈브러로 완전 이적했다.

사진=게티이미지


미들즈브러에서 주전으로 자리 잡은 그는 인상적인 활약을 펼치며 2024년 겨울 이적시장에 아스톤 빌라로 합류했다. 빌라 이적 후 폭발적인 성장세를 보이며 팀의 핵심 전력으로 자리 잡았고, 공격형 미드필더뿐 아니라 윙어로도 뛰며 전술적 유연성을 입증했다.올시즌 로저스는 모든 대회를 통틀어 10골 7도움을 기록하며 좋은 모습을 보이고 있다.

한편 로마노는 ""토트넘에게 로저스는 분명 '드림 타깃'이다. 하지만 지난여름에도 마찬가지였듯이, 당시 선수는 이적 불가 상태였고 토트넘은 영입을 진행할 수 없었다. 이제 다른 클럽들이 경쟁에 뛰어들지도 지켜봐야 한다. 아스널이나 다른 구단들의 움직임도 변수""라고 전했다.

사진=게티이미지"
20260211,"황희찬 이어 백승호 너 마저...홍명보호, 중원이 또 사라졌다","[OSEN=이인환 기자] 시간이 많지 않다. 2026 북중미 월드컵을 4개월 앞둔 홍명보호에 또 하나의 경고등이 켜졌다. 이번엔 중원의 축, 백승호다.

버밍엄 시티는 11일(한국시간) 세인트 앤드루스에서 열린 2025/26 EFL 챔피언십 32라운드에서 웨스트 브로미치와 0-0으로 비겼다. 승점 46, 10위. 순위 싸움은 이어갔지만 경기의 핵심은 따로 있었다.

4-2-3-1 포메이션의 수비형 미드필더로 선발 출전한 백승호가 전반 15분 만에 교체됐다. 전반 14분 경합 과정에서 왼쪽 어깨로 떨어졌다. 곧바로 통증을 호소했다. 유니폼 상의로 팔을 고정한 채 그라운드를 빠져나왔다. 교체는 불가피했다.

익숙한 장면이다. 지난해 11월 미들즈브러전에서도 같은 부위 부상으로 전반 5분 만에 교체됐다. 당시 그는 A매치 2연전에 불참했다. 반복되는 어깨 문제는 가볍게 넘길 사안이 아니다.

정확한 진단은 아직이다. 그러나 월드컵을 4개월 남겨둔 시점이라는 점에서 무게가 다르다. 대표팀 중원은 이미 얇아졌다. 박용우, 원두재가 장기 부상으로 이탈한 상태다. 홍명보 감독의 선택지는 줄어들고 있다.

설상가상, 공격진도 흔들렸다. 황희찬 역시 부상으로 멈췄다. 8일 첼시전에서 종아리를 다쳤다. 울버햄튼 롭 에드워즈 감독은 “수 주간 결장”을 공식화했다. 2주 뒤 재검 예정이지만 복귀 시점은 불투명하다.

중원과 공격의 동시 공백. 월드컵 본선을 준비하는 팀에 가장 꺼려지는 시나리오다. 전술은 사람 위에 설 수 없다. 체력과 가동률이 전제다.

백승호의 상태가 심각하지 않기를 바라는 수밖에 없다. 반복 부위라는 점이 변수다. 월드컵은 기다려주지 않는다. 홍명보호는 지금, 계산기를 다시 두드리고 있다.

/mcadoo@osen.co.kr"
20260211,"손흥민도 이런 대우 받아본 적 없다...6개월 만에 LAFC '레전드' 선언, 토트넘도 10년 만에 해준 벽화인데→2번째 벽화 공개 예정","사진=MLS
[스포츠조선 김대식 기자]미국에서 손흥민은 도대체 어느 정도의 존재인 걸까.

미국 메이저리그사커(MLS) 전문 기자인 파비안 렌켈은 10일(이하 한국시각) 개인 SNS를 통해 ""혹시 모르셨다면, LAFC가 코리아타운에 또 다른 손흥민 벽화를 공개할 예정이다. 이 벽화는 2026년 메인 유니폼 출시 기념 행사에서 독점 공개될 것""이라고 밝혔다.

LAFC는 지난 주 손흥민의 두 번째 벽화를 공개한다고 밝혔다. 구단은 ""2026시즌 유니폼을 착용한 손흥민이 그려진 대규모 벽화가 공개될 예정""이라며 ""이 벽화는 손흥민과 LAFC의 계약 기간 동안 남아있을 것""이라고 전했다.
<저작권자(c) 연합뉴스, 무단 전재-재배포, AI 학습 및 활용 금지>
손흥민은 지난 여름 이적시장을 통해서 LAFC 선수가 됐다. 유로파리그 우승 이후 토트넘을 떠나기로 결정했다. 수많은 선택지가 있었지만 손흥민은 자신의 마지막이 될 2026년 북중미 월드컵으로 인해 LAFC행을 선택했다. LAFC는 손흥민에게 매력적인 프로젝트를 제시했으며 MLS 역대 최고 이적료를 지불했다. 등번호 7번까지 안기면서 손흥민을 파격적으로 대우했다.

LAFC로 합류한 손흥민의 파급력은 막대했다. 손흥민이 영입되기 전까지 LAFC는 우승 후보로 고려되지 않던 팀이었다. 하지만 손흥민이 영입된 후 드니 부앙가와 함께 엄청난 호흡을 자랑하면서 LAFC는 단숨에 우승 후보가 됐다. LAFC는 하반기에 폭발적인 상승세를 달렸다. 흥부 듀오는 LAFC를 대표하는 아이콘이 됐다.
<저작권자(c) 연합뉴스, 무단 전재-재배포, AI 학습 및 활용 금지>
LAFC는 서부 콘퍼런스 플레이오프 2라운드에서 벤쿠버 화이트캡스에 승부차기 끝에 패배하면서 시즌을 마무리했지만 2026시즌을 충분히 기대하게 만들었다.

손흥민의 영향력은 경기장 바깥에서의 엄청났다. 일시적인 기록이었지만 손흥민은 이적 오피셜 후 유니폼 판매 전 세계 1위 선수에 등극한 적도 있다. SNS, 관중 등 LAFC는 갑자기 전 세계의 주목을 받는 팀으로 변했다. 이에 LAFC는 손흥민 벽화를 제작했다.

토트넘도 10년을 희생한 손흥민에게 팀을 떠난 후에야 만들어주는 벽화인데, LAFC는 곧바로 손흥민을 레전드 취급했다. 여기서 그치지 않고, LAFC는 두 번째 벽화까지 제작하기로 했다.
<저작권자(c) 연합뉴스, 무단 전재-재배포, AI 학습 및 활용 금지>
사실 이런 대우는 이례적이다. 손흥민은 아직 LAFC의 레전드가 아니다. 입단한 지 이제 6개월이 지났을 뿐이다. 그런 선수에게 벽화를, 그것도 두 작품이나 제작해주는 건 미국을 넘어서 유럽 축구계로 봐도 유례를 찾기 힘들다. 일반적으로 벽화는 그 구단의 역사를 빛낸 전설적인 선수에게 제작해준다는 의미를 지니고 있기 때문이다. LAFC는 손흥민은 일반적인 전설의 개념을 뛰어넘었다고 보는 것이다.

이제 LAFC를 상징하는 선수가 손흥민이 되어가고 있다는 의미다. 지금까지 LAFC를 상징했던 선수는 멕시코 국가대표 출신 카를로스 벨라였다. LAFC에 첫 우승을 선물한 선수다. 손흥민이 우승 상징성을 넘어서는 파격적인 대우를 받고 있다."
20260211,"맨체스터 유나이티드, 드디어 '애물단지' 처분할 기회다…""최고 기량 보여준다면 완전 이적 고려할 것""","사진=게티이미지


[포포투=이종관]

제이든 산초의 아스톤 빌라 완전 이적 가능성이 생겼다.

영국 '트리뷰나'는 11일(한국시간) ""빌라의 우나이 에메리 감독은 산초를 완전 이적으로 영입하는 거슬 진지하게 고려하고 있다""라고 전했다.

잉글랜드 국적의 공격수 산초는 맨체스터 유나이티드의 '문제아'다. 높은 이적료, 기대감에 비해 초라한 활약을 펼쳤고, 지난 2023-24시즌엔 에릭 텐 하흐 감독과 심각한 불화를 겪었기 때문. 당시 텐 하흐 감독은 산초의 명단 제외 이유를 묻자 그의 훈련 태도를 지적했다. 이를 전해 들은 산초가 공식 성명을 통해 억울함을 표했으나 갈등은 봉합되지 않았고 결국 1군 훈련에서 제외됐다.

결국 겨울 이적시장을 통해 '친정 팀' 도르트문트로 임대를 떠났고 준수한 활약을 펼친 채 맨유로 돌아왔다. 그러나 텐 하흐 감독과의 불화는 여전히 봉합되지 않았고 지난 시즌을 앞두고 의무 이적 옵션을 포함한 임대를 통해 첼시 유니폼을 입었다.

출발은 나쁘지 않았다. 엔조 마레스카 감독의 신임을 얻으며 공격포인트를 차곡히 쌓았다. 하지만 그것도 얼마 가지 않았고 아쉬운 활약을 펼치며 맨유로 돌아왔다. 지난 시즌 기록은 41경기 5골 10도움.

올 시즌을 앞두고 아스톤 빌라로 또다시 임대된 산초. 이렇다 할 활약을 펼치지 못하고 있지만 빌라의 에메리 감독은 그의 완전 이적을 고려 중이다. 매체에 따르면 에메리 감독은 ""산초는 전반기까지 좋은 모습을 보여주지 못했다. 하지만 그는 점점 나아지고 있다. 그가 최고의 기량을 보여준다면 우리 역시 그를 완전 영입할 것이다""라고 말한 것으로 드러났다.

사진=게티이미지"
