date,title,content
20260203,"""즉각 거절했다!"" 맨체스터 유나이티드, 초대형 악재, 마이클 캐릭도 별 수 없었다...""올드 트래퍼드행 무산, 해크니 잔류 결정""","[SPORTALKOREA] 박윤서 기자= 맨체스터 유나이티드 FC가 마이클 캐릭의 합류에도 헤이든 해크니를 영입하는 데 실패했다.

'맨체스터 이브닝 뉴스'는 2일(한국시간) ""맨유의 이적시장 타임라인은 분명해졌다. 캐릭이 가장 아끼는 선수에 오퍼를 건넸지만, 미들즈브러 FC는 즉각 거절했다""고 전했다.

2002년생 미드필더 해크니는 미들즈브러 유소년 아카데미 출신으로 미래가 기대되는 어린 자원이다.

중원 전역을 누빌 수 있는 멀티성에 뛰어난 기본기, 강인한 체력, 높은 전술 이해도를 지녔다는 평을 얻고 있다. 해크니가 본격적으로 스타덤에 오른 것은 캐릭의 지도를 받은 후부터다. 



미들즈브러 감독으로 일했던 캐릭은 해크니를 중용하며 ""이미 더 바랄 게 없다. 현실적이고 겸손하며 성실하고 배우길 주저하지 않는 선수""라고 평가했다.

캐릭이 맨유의 임시 사령탑으로 부임하며 해크니가 스승을 따라 이적할 수 있단 주장이 제기됐다. 다만 아직 정식 감독을 결정하지 않은 맨유는 겨울 이적시장을 통해 천문학적인 금액을 쏟길 주저했고, 해크니는 결국 잔류를 택했다.

매체는 ""맨유는 캐릭이 미들즈브러에서 일하며 눈여겨본 해크니에게 접촉했다. 이적시장 막바지 가능성을 엿보며 접근했지만, 올드 트래퍼드행은 무산됐다""라며 ""마감일엔 노팅엄 포레스트 FC가 영입을 추진했으나 해크니는 최종 잔류를 결정했다""고 설명했다.

사진=트랜스퍼 뉴스 라이브, 게티이미지코리아

제휴문의 ad@sportalkorea.co.kr"
20260203,"손흥민 죽다 살아났다 '초대형 희소식'...'흥부 듀오' 파트너 부앙가 LAFC 탈출 불가 ""아직 합의 없어""","사진=LAFC
[스포츠조선 김대식 기자]손흥민 파트너인 드니 부앙가는 현재로서는 LAFC를 떠날 것으로 예상되지 않는다.

미국 디 애슬래틱의 톰 보거트 기자는 2일(한국시간) 개인 SNS를 통해 속보라며 ""플루미넨세가 LAFC의 스타 부앙가 영입을 위해 약 1500만달러(약 217억원)를 제시했다. 31세의 부앙가는 미국 메이저리그사커(MLS) 최고의 선수 중 한 명이다. 작년 최우수선수(MVP) 최종 후보에 올랐고 3년 연속 베스트 11에 선정되었다""고 보도했다.

부앙가는 이번 겨울 이적시장에서 많은 구단들의 관심을 받고 있는 중이다. 리오넬 메시가 뛰고 있는 인터 마이애미에서도 부앙가를 영입하려고 정식 제안까지 넣었지만 LAFC는 우승 경쟁 구단에 에이스를 넘겨줄 수 없다고 판단했다. 이후 브라질 명문인 플루미넨시까지 부앙가에게 관심을 보이면서 부앙가가 LAFC를 떠날 수도 있다는 이야기가 계속해서 나오고 있다.

부앙가가 떠난다면 LAFC 선수단에게는 충격적인 일이 될 것이다. 손흥민 합류 이전 LAFC의 상징적인 에이스는 부앙가였다. 1996년 출범한 MLS 역사상 단 한 번도 없었던 '3시즌 연속 리그 20골' 기록을 세운 선수가 바로 부앙가다. 데뷔 시즌인 2023시즌부터 20골 7도움으로 단번에 에이스로 등극했다. 2024시즌 20골 10도움을 기록하며 팀 공격의 중심으로 확고히 자리 잡았다.
<저작권자(c) 연합뉴스, 무단 전재-재배포, AI 학습 및 활용 금지>
지난 시즌은 부앙가 커리어의 정점이었다. 리그 31경기에서 24골 7도움을 올리며 한때 메시와 득점왕 경쟁을 벌였다. 이전까지는 사실상 홀로 공격을 책임져야 했지만, 손흥민이 합류하면서 상황은 달라졌다. 수비의 집중 견제가 손흥민에게 분산되며 부앙가는 한층 자유로운 환경에서 자신의 결정력을 발휘할 수 있었다.

초반에는 두 선수의 포지션 중복을 우려하는 시선도 있었으나, 실제 경기에서는 역할 분담이 명확했다. 장면에 따라서는 손흥민과 해리 케인을 떠올리게 하는 연계가 나올 정도로 호흡은 안정적이었다. 이 시너지 속에서 부앙가는 결국 MLS 최초로 3시즌 연속 리그 20골이라는 기록을 완성했다.
<저작권자(c) 연합뉴스, 무단 전재-재배포, AI 학습 및 활용 금지>
흥부 듀오의 파괴력은 MLS에서 제어가 불가능한 수준이었다. LAFC가 흥부 듀오에 대한 의존도를 낮추고, 전체적인 포지션 밸런스를 올린다면 충분히 다가오는 시즌에 리그 우승에 도전할 수 있을 것처럼 보였다. 그러나 이러한 희망들은 에이스 중 한 명인 부앙가가 떠나면 모두 물거품이 되는 일이다.

시즌 개막을 코앞에 두고, 손흥민 홀로 공격을 이끌게 된다면 LAFC는 전력이 좋다고 평가할 수가 없다. 손흥민만 막으면 되는 원맨팀이 될 가능성이 농후했기 때문이다. 천만다행인지 아직까지는 LAFC와 플루미넨시의 합의는 없다.
<저작권자(c) 연합뉴스, 무단 전재-재배포, AI 학습 및 활용 금지>
존 소링턴 LAFC 단장은 ""우리는 구단에 좋은 가치를 보장해야 한다. 또한 그것이 팀 전력에 얼마나 큰 영향을 미치는지도 분석한다. 그리고 떠나는 선수를 대체할 자원이 있는지도 본다.

부앙가를 두고는 아무 일도 일어나지 않았다. 이 두 가지가 정해져야 하기 때문""이라고 밝혔다.

보거트 기자도 3일 후속 보도를 통해 ""소식통에 따르면, 루머에도 불구하고 플루미넨세와 LAFC는 스타 윙어 부앙가 영입에 대해 아직 합의에 이르지 못했다. 플루미넨세는 계속 노력하고 있지만 아직 아무런 성과가 없다""고 덧붙였다."
20260203,"韓 축구 유럽 이적 뜬다…'256억원' 독일 이어 잉글랜드도 불발, 오현규 튀르키예서 재도전 → 명문 베식타스행 유력","▲ 타미 에이브러햄의 이적 이후 스트라이커를 물색해온 베식타스가 새로운 골잡이를 찾았다. 베식타스는 헹크 소속의 24세 대한민국 국가대표 공격수 오현규를 두고 벨기에 구단과 모든 조건에 합의했다.


[스포티비뉴스=조용운 기자] 지난 여름 독일 분데스리가로 향하던 발걸음이 멈춰 선 데 이어 이번 겨울 기대를 모았던 잉글랜드 프리미어리그 입성마저 끝내 무산됐다.

유럽 빅리그의 높은 벽을 실감한 한국 축구의 차세대 골잡이 오현규(25, KRC헹크)가 튀르키예 무대로 행선지를 선회하며 새로운 돌파구 마련에 나선다.

3일(한국시간) 튀르키예 유력 매체 '파나틱'은 겨울 이적시장에서 전력 보강을 꾀하던 명문 베식타스가 오현규 영입에 사실상 합의했다고 전했다. 보도에 따르면 베식타스는 초기 제안했던 1,200만 유로(약 205억 원)가 거절당하자 보너스를 포함해 총액 1,500만 유로(약 256억 원) 규모의 수정 제안을 던져 헹크의 확답을 받아낸 것으로 알려졌다.

오현규에게 이번 튀르키예행은 분명 아쉬움이 남는 선택지다. 불과 반년 전만 해도 분데스리가 슈투트가르트 입성을 눈앞에 두고 있었다. 당시 헹크 구단 역대 최고 이적료인 2,800만 유로(약 478억 원)에 합의하며 화려한 빅리그 데뷔를 예고했지만, 메디컬 테스트 과정에서 8~9년 전 십자인대 부상 이력이 발목을 잡았다. 슈투트가르트의 갑작스러운 이적료 삭감 요구와 협상 결렬로 오현규에게 큰 트라우마로 남았다.

▲ 타미 에이브러햄의 이적 이후 스트라이커를 물색해온 베식타스가 새로운 골잡이를 찾았다. 베식타스는 헹크 소속의 24세 대한민국 국가대표 공격수 오현규를 두고 벨기에 구단과 모든 조건에 합의했다. ⓒ 벨기에 헹크


희망의 불씨는 이번 겨울 잉글랜드에서도 피어올랐다. 풀럼이 스트라이커 보강 명단에 오현규의 이름을 올리며 다시 한번 빅리그 진출의 기회가 찾아오는 듯했다. 그러나 풀럼은 1순위 타깃이었던 리카르도 페피(PSV 에인트호번) 영입에 실패한 뒤에도 2순위였던 오현규에게 적극적인 손을 내밀지 않았다.

풀럼의 외면 속에 리즈 유나이티드행도 막바지 진행되는 듯했다. 최종적으로 빅리그 입성은 다음으로 미루게 됐다. 실패의 아픔을 뒤로하고 오현규가 마주한 곳은 튀르키예의 거함 베식타스다. 리그 통산 16회 우승에 빛나는 명문이지만, 이번 시즌 5위에 머물며 자존심을 구기고 있어 오현규를 영입해 반등을 노린다는 복안이다.

튀르키예 언론에 이어 벨기에 현지 매체 'HLN'도 베식타스가 최대 1,700만 유로(약 290억 원)까지 이적료를 높여 헹크를 압박하고 있다며 막판 협상이 급진전되고 있음을 시사했다.

▲ 타미 에이브러햄의 이적 이후 스트라이커를 물색해온 베식타스가 새로운 골잡이를 찾았다. 베식타스는 헹크 소속의 24세 대한민국 국가대표 공격수 오현규를 두고 벨기에 구단과 모든 조건에 합의했다. ⓒ 벨기에 헹크


오현규의 커리어는 도전의 연속이었다. K리그 수원삼성에서 혜성처럼 등장해 스코틀랜드 셀틱을 거쳐 벨기에 헹크까지 유럽 무대에서 꾸준히 자신의 가치를 입증해 왔다. 특히 지난 시즌 공식전 12골을 터뜨린 데 이어 이번 시즌에도 리그와 유로파리그를 가리지 않고 날카로운 결정력을 과시했다.

비록 원했던 빅리그 입성은 다음으로 미뤄졌으나, 튀르키예라는 뜨거운 무대에서 다시 한번 자신의 존재감을 증명해야 하는 숙제를 안게 됐다. 2026년은 오현규에게 여러모로 도전의 시간이다. 튀르키예 리그는 거친 몸싸움과 열광적인 팬덤으로 유명해 공격수가 살아남기 녹록지 않은 환경이다.

시즌 도중에 새로운 팀에 적응해야 하는 숙제는 반년 뒤 북중미 월드컵과도 연계되어 있다. 헹크에서 순조로운 행보 속에 국가대표팀에서도 월드컵 출전이 장밋빛이었다. 지난해 후반기 A매치에서 곧잘 득점하면서 홍명보호 공격진에 한축을 담당하고 있다. 다만 베식타스에서 적응하지 못하면 실전 감각을 잃고 월드컵까지 놓칠 수 있다. 언제나 도전이었던 오현규에게 다시 시험대에 열렸다.

▲ 타미 에이브러햄의 이적 이후 스트라이커를 물색해온 베식타스가 새로운 골잡이를 찾았다. 베식타스는 헹크 소속의 24세 대한민국 국가대표 공격수 오현규를 두고 벨기에 구단과 모든 조건에 합의했다. ⓒ 벨기에 헹크"
20260203,"오현규, 공항 도착! 韓 축구사 초대형 이적 터진다! 최고 명문 '오피셜 공식발표' 임박…이스탄불서 메디컬 테스트→튀르키예 3대 강호와 사인","(엑스포츠뉴스 윤준석 기자) 대한민국 국가대표 공격수 오현규가 겨울 이적시장 막판, 결국 튀르키예 무대로 향한다.

벨기에와 튀르키예 복수 언론의 보도를 종합하면 오현규는 튀르키예 현지시간 기준으로 3일 오후 이스탄불로 이동해 메디컬 테스트를 받을 예정이며, 큰 변수가 없다면 이후 베식타스 이적이 공식 확정될 전망이다.

벨기에 매체 '보트발크란트'는 3일(한국시간) ""헹크는 오늘 중으로 오현규의 베식타스 이적을 마무리할 가능성이 크다""며 ""오현규는 이스탄불에서 메디컬 테스트를 받을 예정이며, 이미 튀르키예 명문과 개인 조건에 합의한 상태""라고 전했다.

이 매체는 ""헹크는 보너스를 포함해 약 1500만 유로(약 256억원)의 이적료를 받게 될 것""이라며 ""주전에서 밀려난 공격수치고는 여전히 상당한 금액""이라고 평가했다.

튀르키예 현지에서도 오현규의 이스탄불 입성은 기정사실로 받아들여지는 분위기다.

'비인 스포츠' 튀르키예판은 ""베식타스가 오현규를 오늘 저녁 이스탄불로 데려올 계획""이라고 보도한 후, 다수 튀르키예 매체들 역시 같은 시점을 언급하며 메디컬 테스트가 예정됐다고 전했다.



튀르키예 매체 '메디야노투'는 보다 구체적인 내용을 전했다.

해당 매체는 ""베식타스가 공격과 미드필드 보강을 동시에 마무리했다""며 ""헹크의 한국인 스트라이커 오현규와 괴즈테페의 미드필더 주니어 올라탄이 오늘 이스탄불로 향한다""고 보도했다.

매체는 ""베식타스 기술위원회의 승인과 함께 모든 단계에서 합의가 이뤄졌다""고 덧붙였다.

보도에 따르면 베식타스는 오현규 영입을 위해 초기 1200만 유로(약 205억원)규모의 제안을 제시했으나 헹크의 거절을 받았고, 이후 협상을 재개해 보너스를 포함한 총액 1500만 유로 수준으로 제안을 상향했다. 

이 과정에서 베식타스가 공격수 보강을 최우선 과제로 설정하고 협상 속도를 끌어올렸다고 전해졌다.



오현규의 이적이 급물살을 탄 배경에는 헹크에서의 입지 변화가 결정적으로 작용했다.

'보트발크란트'는 ""오현규는 시즌 초반 높은 기대 속에 출발했지만, 최근 몇 달 사이 공격수 서열에서 밀려났다""고 짚었다. 이어 ""니키 하옌 감독은 아론 비부를 1순위 스트라이커로 낙점했고, 헹크는 전통적으로 활용해온 타깃형 스트라이커 전술로 회귀하고 있다""고 분석했다.
헹크 입장에서 이번 이적이 사실상 오현규를 적정가격에 판매할 수 있는 마지막 적기라는 판단도 깔려 있는 것으로 알려졌다.

'보트발크란트'는 ""오현규가 시즌 내내 교체 자원으로 머물 경우 시장 가치가 급격히 하락할 수 있다는 점을 구단도 인지하고 있다""며 ""지금과 같은 조건이라면 매각이 합리적인 선택""이라고 전했다.

오현규 개인에게도 이번 이적은 또 하나의 전환점이다. 그는 지난여름 독일 분데스리가 슈투트가르트와 합의 직전까지 갔으나, 메디컬 테스트 과정에서 고교 시절 십자인대 부상 이력이 문제로 떠오르며 이적이 무산됐다.

이후 프리미어리그 풀럼, 리즈 유나이티드 등과 연결됐지만, 겨울 이적시장 내내 뚜렷한 진전은 없었다.

이런 상황 속, 베식타스는 이런 오현규를 즉시 전력감으로 판단한 것이다.

튀르키예 쉬페르리그 16회 우승에 빛나는 명문이지만, 올 시즌 리그 5위에 머물고 있고 주전 공격수 타미 에이브러햄의 이탈로 최전방 보강이 절실한 상황이다.



튀르키예 현지 언론은 오현규를 즉시 전력감으로 평가하면서도, 그의 커리어 이력과 신체 상태에 대해서는 비교적 냉정한 시선을 유지하고 있다.

스포츠 일간지 '포토막'은 ""베식타스가 타미 에이브러햄의 이탈 이후 찾던 유형의 스트라이커는 공중볼과 피지컬 경쟁이 가능한 선수였다""며 ""오현규는 186cm의 신체 조건과 박스 안 결정력을 갖춘 공격수로, 쉬페르리그 특유의 몸싸움 중심 축구에 빠르게 적응할 수 있는 자원""이라고 평가했다.

동시에 매체는 ""유럽 5대 리그 경험은 없지만, 벨기에와 스코틀랜드 무대에서 꾸준히 골을 기록해 왔다는 점이 베식타스의 선택을 이끌었다""고 덧붙였다.

종합 일간지 'T24' 역시 ""오현규는 스타 플레이어는 아니지만, 현재 베식타스가 처한 현실을 고려하면 가장 합리적인 선택지""라며 ""높은 이적료 부담 없이 즉각적인 전력 상승을 기대할 수 있는 공격수""라고 분석했다.



다만 튀르키예 언론 역시 이번 이적이 메디컬 테스트라는 마지막 관문을 완전히 통과해야만 최종 확정된다는 점을 분명히 하고 있다.

튀르키예 매체 '오르타치즈기'는 ""베식타스는 오현규 영입에 강한 의지를 보이고 있지만, 메디컬 테스트는 형식적인 절차가 아닐 것""이라며 ""구단 의료진은 과거 부상 이력까지 포함해 정밀 검사를 진행할 예정""이라고 전했다.

이어 ""모든 조건에 합의가 이뤄졌다고 하더라도, 메디컬 테스트 결과에 따라 최종 발표 시점이 달라질 수 있다""고 덧붙였다.

사진=헹크 / extra futbol X / zpor X / 연합뉴스"
20260203,"충격, '오피셜 발표 예정' 호날두 ""맨유에서 영광스럽게 은퇴하고 싶다"" 복귀 협상","[스포티비뉴스=박대성 기자] 크리스티아누 호날두(40, 알 나스르)가 또 맨체스터 유나이티드 카드를 만지고 있다.

영국 매체 '풋볼365'는 3일(한국시간) ""호날두가 올해 여름 맨체스터 유나이티드로 복귀하는 방안에 대해 구단과 논의하고 있다. 양측은 합의를 향해 진전하고 있다. 연봉까지 삭감할 각오""라고 알렸다.

이어 ""맨체스터 유나이티드는 사우디아라비아에서 시즌이 끝나길 바라고 있으며, 서류 작업을 마무리하고 지난 10년간 세계 축구계에서 가장 기대되는 복귀를 공식 발표할 예정이다""라고 보도했다.

호날두는 2003년 맨체스터 유나이티드에 합류해 알렉스 퍼거슨 감독 아래에서 세계 최고 선수가 됐다. 이후 레알 마드리드, 유벤투스를 거쳐 2021년 올레 군나르 솔샤르 감독이 지휘하는 맨체스터 유나이티드에 돌아왔다.



하지만 2022년 국제축구연맹(FIFA) 카타르 월드컵 기간에 유럽을 떠나 사우디아라비아 무대로 적을 옮겼다. 공교롭게도 유럽 커리어 마지막 팀이 맨체스터 유나이티드. 당시 팀을 지휘하고 있었던 에릭 텐 하흐 감독과 불화로 두 시즌을 채우지 못하고 붉은 유니폼을 벗었다.

사우디아라비아 알 나스르로 이적해 천문학적인 돈을 받으며 활약했지만 우승과 거리가 멀었다. 특히 지난 시즌 알 나스르는 사우디아라비아 프로리그에서 3위에 그친 데 이어 아시아축구연맹(AFC) 챔피언스리그 엘리트 4강에서 탈락했다.

호날두와 알 나스르의 작별 가능성이 있었지만 2027년 6월까지 계약을 연장하며 잔류하는 듯 보였고, 남은 2년 계약 기간 동안 최소 4억 9200만 파운드(약 8600억 원)에 달하는 메가톤급 계약을 체결했다.



그러나 최근 호날두와 알 나스르 사이에 또 이상 기류가 포착됐다. 호날두는 사우디아라비아 리야드에서 열린 알 리야드와의 리그 20라운드 원정 경기에 결장했다. 부상 등의 특별한 사유 없이 명단에서 빠졌다. 이는 호날두가 경기 전 구단에 출전 거부를 통보했기 때문. 포르투갈 매체 '사포' 등 현지 언론은 ""호날두는 알 나스르에서 경기를 뛰는 것을 거부했다. 호날두는 알 리야드 원정에 불참하기로 결정했다""며 체력 관리 차원이 아닌 구단과의 갈등 으로 결장했다는 걸 알렸다.

보도에 따르면, 호날두는 지난 3년간 알 나스르가 전력 보강을 위한 충분한 지원을 받지 못하고 있다고 판단, 지속적으로 불만을 품어왔다. 사우디 국부펀드(PIF)가 라이벌 팀인 알 힐랄의 경영권을 사우디 억만장자에게 매각한 후, 알 힐랄이 막대한 자금력을 바탕으로 리그를 독주한다고 생각했다. 사포는 ""최근 알 힐랄의 선수 영입이 이어진 것이 호날두를 더욱 분노하게 했다""고 전했다. 실제 알 나스르는 21세 이라크 출신 수비수 하예르 압둘카림만 영입한 반면 알 힐랄은 카림 벤제마를 포함한 여러 톱 플레이어를 데려왔다.

호날두의 보이콧 이후 이적설이 불거지고 있다. 알 나스르에 명시된 바이아웃 조항은 5천만 유로(약 855억 원). 최근 스타급 선수들을 수집하고 있는 미국메이저리그사커(MLS) 팀이 호날두에게 관심이다.



하지만 '풋볼365'에 따르면, 호날두는 ""꿈의 극장(맨체스터 유나이티드)에서 영광스럽게 선수 생활을 마무리하고 싶다""는 소망이 있는 것으로 파악됐다.

매체는 ""맨체스터 유나이티드는 2022년 호날두와 충격적인 결별이 오로지 텐 하흐 감독과 개인적인 갈등이라고 생각하고 있다. 이제 그런 국면이 끝난 만큼, 보드진은 호날두 수준의 선수가 제공할 수 있는 리더십과 득점력을 되찾기를 간절히 바라고 있다""라고 알렸다.

이어 ""호날두 측과 맨체스터 유나이티드 보드진 사이에 협상이 진행 중이다. 재정적인 이유보다는 스포츠적인 측면을 우선으로 하는 공감대를 형성하고 있다. 호날두 역시 맨체스터 유나이티드로 복귀할 수 있다면 재정적 삭감(연봉 삭감)을 감수할 생각이다. 현재 중동에서 받는 연봉을 대폭 삭감하는데 동의했다""라고 짚었다."
20260203,"""협상 진행 중"" 미쳤다! 호날두(맨체스터 유나이티드) 현실로? '전인미답 1,000골' 끝내 OT서 달성하나...""연봉 대폭 삭감"" 불사","[SPORTALKOREA] 황보동혁 기자= 크리스티아누 호날두(알 나스르)가 맨체스터 유나이티드로 돌아올지도 모른다. 

영국 축구 매체 '풋볼365'는 3일(한국시간) 스페인 '피차헤스'를 인용 ""호날두가 올여름 맨체스터 유나이티드 복귀를 두고 구단과 협상을 진행중이며 양측은 합의를 향해 점진적으로 진전을 이루고 있다""고 전했다.

보도에 따르면 호날두는 현재 소속팀 알 나스르를 떠나 유럽 무대로 돌아가길 원하고 있으며, 커리어의 마지막을 올드 트래퍼드에서 장식하는 것을 최우선 목표로 삼고 있다.



호날두는 2022년 말, 당시 맨유 감독이었던 에릭 텐 하흐와의 갈등 끝에 구단과 계약을 상호 해지하며 논란 속에 팀을 떠난 바 있다. 이후 그는 사우디아라비아로 향해 알 나스르 유니폼을 입었다.

풋볼 365는 ""맨유 내부에서는 호날두의 이탈이 감독 개인과의 갈등에서 비롯된 문제였다고 판단하고 있다""며 ""현재는 그 기술적 체제가 끝난 상황으로, 구단 수뇌부는 그의 리더십과 득점력을 다시 팀에 불어넣을 수 있다고 보고 있다""고 설명했다.

특히 눈길을 끄는 대목은 호날두가 복귀를 위해 대폭적인 연봉 삭감을 감수할 의지가 있다는 점이다.



매체는 ""호날두는 중동에서 받고 있는 초고액 연봉을 포기하고서라도 복귀를 원하고 있으며, 이번 협상은 재정적 조건보다 스포츠적 요소를 우선시하는 방향으로 진행되고 있다""고 전했다.

현재 호날두의 알 나스르 계약에는 약 5,000만 유로(약 854억 원) 규모의 바이아웃 조항이 포함돼 있으며 미국 메이저리그사커 구단들도 이에 관심을 보이고 있다. 그러나 매체는 ""호날두의 명확한 바람은 맨유 복귀""라고 강조했다.

맨유는 사우디 프로리그 시즌이 종료되는 시점을 기다린 뒤, 관련 절차를 마무리하고 계약을 공식 발표할 계획인 것으로 알려졌다. 풋볼365는 이를 두고 ""최근 10년 세계 축구에서 가장 큰 화제를 불러올 복귀가 될 수 있다""고 평가했다.



만약 호날두의 맨유 복귀가 현실화된다면, 쉽지는 않겠지만 올드 트래퍼드에서 통산 1,000골 달성이라는 대기록에 도전할 가능성도 열린다.

호날두는 알 나스르 이적 이후 공식전 127경기에서 111골 22도움을 기록 중이다. 2023/24시즌에는 리그 31경기 35골을 터뜨리며 사우디 프로페셔널리그 단일 시즌 최다 득점 신기록을 세웠고, 2024/25시즌에도 30경기 25골 3도움을 올리며 여전한 결정력을 과시했다.

이번 시즌 역시 흐름은 이어지고 있다. 현재까지 22경기에서 18골을 기록하며 통산 961호골에 도달했고, 이제 남은 목표는 단 39골이다. 시즌이 아직 절반가량 남아 있는 점을 감안하면, 사우디 무대에서 득점을 추가한 뒤 맨유에서 1,000골 고지를 밟는 시나리오도 결코 불가능해 보이지 않는다.

사진= SNS 갈무리, 게티이미지코리아 

제휴문의 ad@sportalkorea.co.kr"
