date,title,content
20260130,"'UCL 직후 30분간 이강인 영입 논의했다'…시메오네 감독, 아틀레티코 단장 만나 '경기장 회동'","사진=포스트 유나이티드


[포포투=박진우]

아틀레티코 마드리드는 아직 이강인 영입을 포기하지 않은 모양새다.

스페인 '트리뷰나'는 29일(이하 한국시간) 스페인 '카데나 세르' 보도를 인용해 ""아틀레티코의 마테우 알레마니 단장은 디에고 시메오네 감독과 구단의 이적 계획을 두고 논의를 진행했다""고 보도했다.

이번 시즌 파리 생제르맹(PSG)에서 존재감을 각인시킨 이강인. 겨울 이적시장에서 '뜨거운 감자'로 떠올랐다. 이강인은 시즌 초반 주전 선수들의 줄부상을 틈타 맹활약했지만, 여전히 PSG에서 벤치 신세를 면치 못할 것이라는 예상이다. 이에 이강인 역시 이적할 마음을 품은 것으로 알려졌다.

처음 알려진 건 아틀레티코의 러브콜이었다. 스페인 '마르카'는 ""최근 열흘 사이 아틀레티코 내부 테이블에 다시 오른 이강인은 여러 차례 이적시장마자 관심을 받았던 오랜 타깃이다. 이제는 상황이 무르익었다. PSG를 떠나려는 의지를 드러낸 가운데, 그의 에이전트들이 던진 신호를 알레마니 디렉터가 받아들이며 협상 구도가 본격화됐다""고 보도했다.

실제로 아틀레티코는 이강인에게 상당한 이적료를 투자할 마음이 있었다. 스페인 '아스'는 ""현재 이강인의 시장 가치는 2,500만 유로(약 428억 원) 수준으로 책정돼 있다. 아틀레티코는 이미 코너 갤러거와 라스파도리를 합쳐 6,000만 유로 이상에 매각해 자금을 확보한 상태다. 이에 따라 4,000만 유로(약 685억 원)를 웃도는 이적료도 충분히 감당할 수 있다는 계산이다. 구단은 시즌 종료 후 완전 이적 옵션이 포함된 임대 계약 역시 함께 검토하고 있다""고 설명했다.
다만 엔리케 감독과 PSG는 제안을 단호하게 거절했다. 프랑스 '레퀴프' 소속 로익 탄지 기자는 ""PSG는 이강인의 이적 가능성에 선을 긋고 있다. 엔리케 감독은 이강인을 잔류시키겠다는 의지가 확고한 상황이며, 향후 몇 주 내 계약 연장 협상이 시작될 가능성이 높은 것으로 전해진다""고 밝혔다. 엔리케 감독 입장에서는 로테이션으로 최고의 가치를 내고 있는 이강인을 굳이 매각할 필요가 없는 것.

그럼에도 아틀레티코는 여전히 영입 리스트에 이강인을 올려 놓고 있었다. 아틀레티코는 29일 홈에서 열린 2025-26시즌 유럽축구연맹(UEFA) 챔피언스리그(UCL) 리그 페이즈 최종전에서 보되/글림트에 1-2로 패배했다. 아틀레티코는 리그 페이즈 14위를 기록하며 16강 직행에 실패, 16강 플레이오프(PO)를 치르게 됐다.

알레마니 단장은 경기가 끝난 직후 시메오네 감독을 만났다. '트리뷰나'는 ""두 사람은 보되/글림트전 경기 직후 약 30분간 회동을 가졌다. 구스타보 로페스 수석코치 역시 자리에 동석했다. 알레마니 단장은 뮌헨에서 돌아온 뒤 현재 이적시장 상황을 상세히 공유한 것으로 전해진다""고 설명했다.

논의 속에는 이강인의 이름도 포함됐다. 매체는 ""회의에서는 여러 후보들이 논의됐다. PSG의 이강인, 아탈란타의 에데르송과 아데몰라 루크먼, 바이에른 뮌헨의 레온 고레츠카 등이 테이블에 올랐다. 알레마니 단장은 양보다 질을 강조하고 있는 반면, 시메오네 감독은 스쿼드 보강이 필요하다는 입장을 밝혀왔다""고 전했다."
20260130,"'이거 실화야?' 클롭, 결국 리버풀로 돌아온다… ""3월에 안필드로 복귀 예정, 상징적인 무대 될 것""","사진=게티이미지


[포포투=김호진]

위르겐 클롭이 안필드로 돌아온다.

영국 '미러'는 29일(한국시간) ""전설적인 전 리버풀 감독인 클롭이 오는 3월 열리는 자선 경기에서 보루시아 도르트문트와 맞붙는 리버풀 레전드 팀의 경기에서 케니 달글리시 경의 보조 코치로 벤치에 앉을 예정""이라고 보도했다.

이어 ""2024년 여름 리버풀을 떠난 클롭은 현재 재단의 명예 홍보대사를 맡고 있으며, 3월 28일 경기는 그가 다시 안필드로 돌아오는 상징적인 무대가 된다""고 덧붙였다.

클롭은 몰락한 명가로 불리던 리버풀을 다시 최정상 클럽으로 만들었다. 그는 리버풀의 오랜 숙원이었던 잉글랜드 프리미어리그(PL) 우승을 이뤄냈을 뿐 아니라 유럽축구연맹(UEFA) 챔피언스리그(UCL)와 국제축구연맹(FIFA) 클럽 월드컵 등 도전 가능한 거의 모든 주요 트로피를 들어 올리는데 성공했다.

사진=게티이미지


그는 2023-24시즌 종료 후 안필드를 떠나며 감독직에서 물러났다. 이후 레드불 그룹의 글로벌 축구 총책임자 직책을 맡으며 현재 RB 라이프치히, FC 레드불 잘츠부르크, 뉴욕 레드불스 등 전 세계 레드불 산하 구단들의 방향성을 총괄하고 있다.

한편 클롭의 현장 복귀 가능성은 현재로서는 크지 않아 보인다. 그는 과거 독일 매체 '빌트'와의 인터뷰에서 ""더 이상 감독을 맡고 싶지 않다. 지금은 나를 충분히 만족시키는 일과 강도 높은 업무를 하고 있다""며 지도자 복귀 의사가 없음을 분명히 했다.

또한 그는 현재의 삶에 대한 만족감도 드러냈다. ""예를 들어 아내 역시 지금 상황에 매우 만족하고 있다. 예전에는 세울 수 없던 계획들을 이제는 함께 이야기할 수 있기 때문""이라며 가족과의 시간을 언급했다.

사진=게티이미지"
20260130,"대체 아모림은 이런 선수 왜 안 썼을까...레전드까지 매료 ""정말 훌륭했다, 더 바랄 게 없어""","사진 = 로마노


[인터풋볼=박윤서 기자] 로이 킨이 코비 마이누를 칭찬했다.

맨체스터 유나이티드는 2월 1일 오후 11시(한국시간) 영국 맨체스터에 위치한 올드 트래포드에서 열리는 2025-26시즌 프리미어리그 24라운드에서 풀럼을 상대한다.

맨유는 직전 2경기 마이클 캐릭 임시 감독 체제에서 모두 승리를 거두면서 분위기 반전에 성공했다. 루벤 아모림 전임 감독이 경질된 후 대런 플레처 U-18 팀 감독이 지휘봉을 잡았는데 번리전 무승부, 브라이튼 앤 호브 알비온전(FA컵) 패배 등 쉽사리 나아지지 않았다. 이런 상황에서 팀에 합류한 캐릭 임시 감독은 뛰어난 전술적 능력과 경기력을 보여주면서 맨유를 탈바꿈시켰다.
맨유는 맨체스터 시티전에서 완벽한 경기력으로 2-0 승리를 거두더니 아스널 원정에서도 물러서지 않으면서 3-2로 제압했다. 아스널의 이번 시즌 첫 3실점 이상 경기였다. 캐릭 임시 감독이 바꾼 맨유에 기대감이 점점 커지고 있다.

2경기 연속 골을 넣은 브라이언 음뵈모와 패트릭 도르구, 공격형 미드필더로 돌아온 뒤 맹활약하고 있는 브루노 페르난데스 등 많은 선수들이 박수를 받고 있지만 그중에서도 마이누가 단연 최고다. 마이누는 3선 미드필더로 나서 2경기 모두 11km 이상 뛰었고 볼 키핑, 탈압박 등을 보여주면서 맨유 연계에 큰 힘이 되어주고 있다.



불과 몇 개월 전까지만 하더라도 마이누는 맨유를 떠날 생각이었다. 아모림 감독은 3-4-2-1 포메이션에서 두 명의 미드필더를 페르난데스와 카세미루로 기용했고 마이누는 페르난데스를 밀어내야 한다고 강조하며 마이누를 벤치에 앉혔다. 이 때문에 마이누는 나폴리 이적을 요청헀는데 아모림 감독이 거절하면서 이적은 무산됐다.

마이누는 오랜만에 돌아와 두 경기 연속 맹활약하면서 아모림 감독이 틀렸음을 증명하고 있다. 로이 킨은 ""더 바랄 게 없다. 정말 훌륭한 경기력이었다""라며 박수를 보냈다.

맨유도 마이누를 더 오래 붙잡아두려 한다. 맨시티전 이후 파브리시오 로마노 기자는 마이누가 이제 마음을 바꾸어 맨유에 잔류하고 싶어하며 맨유도 재계약을 추진 중이라고 전한 바 있다."
20260130,한때 마이누-가르나초와 뛴 황금세대였는데...맨체스터 유나이티드 완전히 떠난다→'완전 이적' 검토,"사진=게티이미지


[포포투=김아인]

리스 베넷이 맨체스터 유나이티드와 이별을 앞두고 있다.

맨유는 이번 겨울 이적시장 기간을 비교적 조용히 보내고 있다. 유럽 주요 이적시장이 다음 달 2일이면 마무리되는데 얼마 남지 않은 시간 영입을 하기 보다는 기존 자원들을 정리하는 데 힘쓰고 있다. 특히 유스 자원들 중 8명의 선수가 임대에서 복귀하거나 계약이 만료되면서, 이들의 새로운 행선지를 찾고 있다.

맨유를 완전히 떠날 것으로 보이는 선수 중 한 명은 2003년생의 베넷이다. 맨체스터에서 태어난 그는 어린 시절부터 맨유 유스팀에서 성장했다. 2021-22시즌에는 18세 이하 팀 주장을 맡아 FA 유스컵 우승을 이끌기도 했다. 당시 그는 팀의 핵심이었던 코비 마이누, 알레한드로 가르나초 못지 않은 활약을 펼치면서 결승전에서 선제골을 터뜨리며 맨유의 기대주가 되었다.

임대 생활을 전전하며 성인 무대에 데뷔헀다. 2023-24시즌 잉글랜드 리그 투(4부 리그) 소속 스톡포트 카운티로 떠나 리그 1경기에 출전했고, 지난 시즌 플릿우드 타운으로 옮겨 리그 35경기 1골 1도움을 올리면서 주전으로 도약했다. 성공적으로 경험을 쌓은 뒤 맨유에 돌아왔지만, 지난해 말에는 아버지의 갑작스러운 죽음으로 충격을 받기도 했다.

꾸준히 맨유 U-21팀에서 뛰었지만, 맨유를 완전히 떠날 가능성이 생겼다. 영국 '맨체스터 이브닝 뉴스'는 30일(한국시간) ""베넷이 1월 이적 시장 마감을 앞두고 플릿우드 타운 합류를 위한 협상을 진행 중이다. 지난 여름 이적 기회를 놓친 베넷은 이번 겨울 팀을 옮기기 위해 조기 협상에 돌입했다. 시즌 종료 후 완전 이적 조건이 포함된 임대 방식을 검토 중이지만, 겨울에 완전 이적하는 선택지도 고려하고 있다""고 전달했다.

맨유와의 이별이 곧 임박한 것으로 보인다. 현재 맨유와 플릿우드 측은 베넷의 셀온 조항에 대한 협상을 남겨 놨다고 전해진다. 아카데미 출신인 베넷의 이적을 통해 이적료 일부를 챙길 수 있는 조항이다. 

사진=게티이미지"
20260130,"'극적 변수' 고작 17억이 판 바꾼다! 韓 간판 ST 오현규, 프리미어리그행 급물살…""풀럼, 페피 협상 난관""","[SPORTALKOREA] 황보동혁 기자= 요즘 이적시장 기준으로는 비교적 작은 금액인 100만 유로(약 17억 원) 차이가, 오히려 오현규(KRC 헹크)의 풀럼 이적 가능성을 키우는 변수가 될 수 있다.

영국 매체 '스포츠 몰'은 30일(이하 한국시간) ""풀럼이 PSV 에인트호번 공격수 리카르도 페피 영입을 추진하는 과정에서 난관에 부딪혔다""고 보도했다.

매체는 ""양 구단 간 선수 평가액에서 약 100만 유로 차이가 발생하며 협상이 교착 상태에 빠졌고, PSV 역시 이적시장 마감 전까지 적절한 대체자를 확보하지 못할 경우 페피의 이적을 허용하는 데 소극적인 입장""이라고 전했다. 이어 ""선수 본인 또한 풀럼이 돌파구를 마련하지 못할 경우 올여름까지 PSV에 잔류하는 데 열려 있다""며, 현 시점에서 풀럼의 페피 영입 가능성이 점차 낮아지고 있음을 강조했다.



지난 27일 공신력 높은 글로벌 매체 '디 애슬레틱'은 ""풀럼이 페피 영입을 위해 3,800만 파운드(약 751억 원) 규모의 두 번째 제안을 제시하며 협상에 다시 나섰다""고 보도한 바 있다. 이는 기존에 알려진 2,800만 파운드(약 554억 원) 제안보다 1,000만 파운드(약 198억 원) 상향된 금액이었다.

그러나 이적시장 마감까지 닷새가량 남은 현 시점에서도 금액에 대한 이견이 좁혀지지 않았고, 선수 역시 이적에 적극적인 태도를 보이지 않으면서 상황은 한층 더 복잡해졌다.

PSV와 페피의 입장 역시 이해할 수 있는 대목이다. 월드컵을 앞둔 상황에서 무리한 이적보다는, 대회를 치른 뒤 더 높은 시장 평가를 받는 쪽이 합리적인 선택일 수 있기 때문이다.



이런 흐름 속에서 풀럼이 페피 영입에서 손을 뗄 경우, 자연스럽게 대안 카드로 분류된 오현규에게 기회가 돌아갈 가능성이 커진다.

실제로 '스카이스포츠'는 지난 26일 페피 협상 소식과 함께 ""풀럼이 헹크와 오현규 영입을 두고도 긍정적인 대화를 나눈 것으로 알려졌다""고 전했다. 이어 ""오현규는 이번 시즌 공식전 21경기에 선발 출전해 10골을 기록 중이며, 헹크와의 계약은 2028년 여름까지 남아 있다""고 덧붙였다. 이는 풀럼이 페피 영입이 무산될 경우 오현규를 현실적인 대안으로 고려하고 있음을 시사한다.

즉 PSV가 끝내 페피를 매각 불가 자원으로 분류할 경우, 풀럼은 이적시장 막판 오현규 영입에 나설 가능성도 배제할 수 없다.



풀럼은 장기적으로는 라울 히메네스의 대체자로 페피와 오현규를 모두 주시해 왔지만, 호드리구 무니즈의 복귀까지 시간이 필요한 만큼 당장 활용 가능한 공격수 보강이 절실한 상황이다.

현재 풀럼은 10승 4무 9패(승점 34)로 리그 7위에 위치해 있으며, UEFA 챔피언스리그 진출 마지노선인 4위 맨체스터 유나이티드와의 승점 차도 4점에 불과하다. 구단 입장에서는 겨울 이적시장에서 공격수 영입에 적극적으로 나설 수밖에 없는 이유다.

결과적으로 풀럼이 페피 영입에 더 이상 가망이 없다고 판단할 경우, 이적시장 막판 오현규 측과의 협상이 급물살을 탈 가능성도 충분하다.

사진= 팀토크, 게티이미지코리아  

제휴문의 ad@sportalkorea.co.kr"
20260130,"""정말 스페셜 원이다, 어떤 감독도 이런 일을 해낼 수 없다""…미친 무리뉴 매직! GK 극장골로 PO 진출, 팬들도 감탄","조세 무리뉴./게티이미지코리아

[마이데일리 = 김건호 기자] ""어떤 감독도 이런 일을 해낼 수는 없다.""

벤피카는 29일(한국시각) 포르투갈 리스본의 에스타디오 두 스포르트 리스본 에 벤피카에서 열린 2025-26시즌 유럽축구연맹(UEFA) 챔피언스리그(UCL) 리그페이즈 8차전 레알 마드리드와의 홈경기서 4-2로 승리했다.

벤피카는 3승 5패 승점 9점으로 24위 자리를 차지했다. 25위 마르세유, 26위 파포스 FC, 27위 위니옹 생질루아즈와 승점이 같았지만, 득실 차에서 앞서며 극적으로 16강 플레이오프에 진출했다.

상대는 레알 마드리드였다. 힘든 싸움이 예상됐다. 예상대로 킬리안 음바페에게 실점하며 끌려갔다. 하지만 안드레아스 셸데루프의 득점으로 균형을 맞춘 뒤 반젤리스 파블리디스의 골로 역전했다. 분위기를 탄 벤피카는 셸데루프의 골로 2점 차를 만들었다.

레알 마드리드가 음바페의 득점으로 1점 차까지 좁힌 상황이었다. 당시 골득실차 '-3'이었던 벤피카는 1골이 필요했다. 만약 1점 차로 승리하면 다득점에서 마르세유에 밀려 25위로 리그페이즈를 마치기 때문이었다.
아나톨리 트루빈./게티이미지코리아

후반 추가 시간 조세 무리뉴 감독이 승부수를 던졌다. 프리킥 기회에서 골키퍼 아나톨리 트루빈을 공격에 가담하라고 지시했다. 그 선택이 통했다. 트루빈이 헤더 슈팅으로 골망을 흔들었다. 벤피카가 24위로 올라간 순간이었다.

영국 '스포츠바이블'은 ""팬들은 소셜미디어(SNS)를 통해 빠르게 반응을 보였다""고 전했다.

팬들은 ""무리뉴는 정말 스페셜 원이다. 어떤 감독도 이런 일을 해낼 수는 없다"", ""트루빈이 스스로를 역사에 새겼다"", ""벤피카가 경기 막판 프리킥을 얻자, 무리뉴가 골키퍼에게 공격에 가담하라고 지시한다… 그리고 정말로 골키퍼가 득점한다. 축구는 순수한 시네마다""는 등의 반응을 보였다.

또 다른 팬들은 ""레알 마드리드 벤치 바로 앞에서의 무리뉴. 클래스다"", ""무리뉴는 25년 경력 동안 수많은 미친 장면들을 봐왔다. 경기 막판 골키퍼의 득점으로 팀을 UCL 토너먼트로 올려보내는 장면은 아마도 그중 가장 미친 순간일 것이다. 일생에 한 번 나올 순간이다""고 전했다.
조세 무리뉴./게티이미지코리아

한편, 레알 마드리드는 벤피카에 패배하며 9위로 리그페이즈를 마쳤다. 16강 직행에 실패했다. 16강 플레이오프에서 벤피카와 다시 만날 수 있다. 레알 마드리드는 23위 보되/글림트 또는 24위 벤피카와 16강 자리를 놓고 다툴 예정이다."
20260130,"손흥민 축하합니다! 전세계 2위! 진짜 대형사고 쳤다…토트넘, 축구단 EBITDA 맨유 다음이었다→SON 상품성 막대하네","(엑스포츠뉴스 나승우 기자) 손흥민(LAFC) 전 소속팀인 토트넘 홋스퍼가 재정적으로는 역대급 호황을 누린 것으로 나타났다.

미국 경제 전문지 포브스가 발표한 '2025년 세계에서 가장 수익성 높은 스포츠 팀' 순위에서 토트넘은 쟁쟁한 빅클럽들을 제치고 축구 클럽 중 전체 2위에 오르는 기염을 토했다.
미국 매체 보드룸은 29일(한국시간) 포브스의 보도 내용을 인용해 2025년 세계에서 가장 수익성 높은 스포츠 팀 순위를 나타낸 사진을 게시했다.

매체에 따르면 토트넘은 지난해 추정 EBITDA(이자비용, 세금, 감가상각비 차감 전 영업이익) 1억8400만 달러(약 2633억원)를 기록하며 전체 스포츠 팀 중 12위에 올랐다.



축구 종목으로 한정했을 때는 맨체스터 유나이티드(전체 11위)에 이어 전 세계 2위에 해당하는 놀라운 수치다.

맨유는 1억8500만 달러(약 2648억원)를 기록해 토트넘과 큰 차이를 보이지 않았다.

이번 집계의 기준이 된 2025년은 손흥민이 토트넘 유니폼을 입고 뛴 마지막 시즌이 포함된 해다. 손흥민은 2024-2025시즌까지 토트넘에서 활약한 후 여름 이적시장을 통해 미국 메이저리그사커(MLS) LAFC로 떠났다.

토트넘에 머물렀던 반 년 동안 손흥민이 토트넘의 수익 증대에 상당한 기여를 했을 것이라는 분석이 나온다.

토트넘은 손흥민을 중심으로 한 마케팅과 경기장 수익, 프리미엄 좌석 판매 호조 등에 힘입어 막대한 이익을 남긴 것으로 보인다.

특히 '북런던 라이벌' 아스널(1억7300만 달러, 전체 17위)을 제치고 더 높은 수익성을 기록하면서 다니엘 레비 전 회장의 철저한 비용 관리와 손흥민이라는 슈퍼스타의 존재감이 더욱 돋보였다.



한편, 전 세계에서 가장 돈을 많이 번 구단은 미국프로미식축구(NFL)의 댈러스 카우보이스였다. 카우보이스는 무려 6억2900만 달러(약 9004억원)의 영업이익을 기록하며 2위 골든스테이트 워리어스(NBA)를 2억 달러 이상 따돌리고 압도적인 1위를 차지했다.

이번 순위에서는 NFL(7팀)과 NBA(6팀)의 강세가 여전했으며, 축구계에서는 맨유와 토트넘, 아스널 등 프리미어리그 클럽 3곳만이 톱 20에 이름을 올렸다.

손흥민이 토트넘을 떠난 후에도 여전히 손흥민의 존재감을 엿볼 수 있는 자료였다. 손흥민은 토트넘을 세계에서 가장 돈 잘 버는 축구 클럽 중 하나로 만드는 밑거름이 됐다.

토트넘이 이 막대한 수익을 바탕으로 손흥민의 빈자리를 메우고 새로운 시대를 열 수 있을지 주목된다.

사진=보드룸 / 연합뉴스"
20260130,"""무리뉴 고마워!"" 벤피카 GK의 극장골→맨시티와 과르디올라가 웃었다…왜? ""레알이 동점골 넣었으면 16강 직행 못 했는데""","사진=Sporty TV


[인터풋볼=주대은 기자] 맨체스터 시티 펩 과르디올라 감독이 벤피카 조세 무리뉴 감독에게 감사한 마음을 전했다.

스포츠 매체 'ESPN'은 29일(이하 한국시간) ""맨시티 과르디올라 감독은 선수단이 라커룸에서 벤피카가 레알 마드리드를 상대로 거둔 극적인 승리의 마지막 몇 분을 지켜봤으며, 아나톨리 트루빈이 전방으로 올라간 뒤 네 번째 골을 넣었을 때 패닉에 빠졌다고 밝혔다""라고 보도했다.

벤피카는 29일 포르투갈 리스본에 위치한 이스타디우 다 루스에서 열린 2025-26시즌 유럽축구연맹(UEFA) 챔피언스리그(UCL) 리그 페이즈 최종전에서 레알 마드리드에 4-2로 승리했다.

이날 레알 마드리드가 전반 30분 터진 킬리안 음바페의 선제골로 리드를 잡았다. 벤피카가 빠르게 반격했다. 전반 36분 안데레아스 시엘데루프가 동점골을 뽑아냈다. 전반 추가시간 5분엔 반델리스 파블리디스가 득점하며 벤피카가 역전했다.

후반전 들어 벤피카가 격차를 벌렸다. 후반 9분 시엘데루프가 한 골을 추가했다. 레알 마드리드는 후반 13분 음바페의 득점으로 추격했다. 이후 레알 마드리드는 교체 카드를 활용하며 반전을 노렸으나 라울 아센시오, 호드리구가 퇴장당하며 수적 열세에 처했다.

벤피카가 승기를 잡았지만 16강 플레이오프 진출은 어려워 보였다. UCL 리그 페이즈에선 1위부터 8위까지 16강에 오른다. 9위부터 24위는 16강 플레이오프로 향한다. 벤피카는 2골 차 이상으로 승리해야 24위로 막차를 탈 수 있었다.



경기 종료 직전 기적이 일어났다. 후반 추가시간 8분 벤피카의 코너킥 상황에서 골키퍼 트루빈이 공격에 가담했다. 트루빈은 감각적인 헤더로 레알 마드리드 골망을 갈랐다. 4-2로 경기가 끝나며 벤피카가 극적으로 16강 플레이오프에 진출했다.

그런데 벤피카의 승리로 수혜를 입은 팀이 있었다. 과르디올라 감독이 이끄는 맨시티였다. 만약 경기 막바지 레알 마드리드가 동점골을 넣었다면, 맨시티는 UCL 리그 페이즈 9위 밖으로 밀려나는 상황이었다. 벤피카가 레알 마드리드를 잡으며 맨시티는 8위로 UCL 16강에 올랐다.

'ESPN'에 따르면 과르디올라 감독은 ""우리는 모두 거기(라커룸)에 있었다. 벤피카가 16강 플레이오프를 진출을 위해 골이 필요하다는 걸 몰랐다. 그래서 골키퍼가 올라갔을 때 '왜 올라가?'라고 말했다""라고 회상했다.

이어서 ""레알 마드리드가 동점골을 넣으면 우리는 16강에 직행할 수 없었다. 하지만 네 번째 골을 넣기 위한 무리뉴 감독의 좋은 전락이었다""라며 무리뉴 감독에게 감사 메시지를 보낼 거냐는 물음엔 ""물론이다""라고 답했다."
