date,title,content
20260104,"'손흥민 국대 박탈' 이 규정 있었으면 큰일 날 뻔...메시의 아르헨티나 파격 조치, 대표팀 '유럽 직행 금지'","사진=게티이미지


[포포투=김아인]

과거에 이 규정이 있었다면, 전 세계 축구팬들은 대한민국 레전드 손흥민도, 축구의 신 리오넬 메시도 보지 못했을 것이다.

영국 '스포츠 바이블'은 4일(힌국시간) ""아르헨티나가 하마터면 메시의 국가대표 자격이 박탈될 수도 있었던 파격적인 새 규정을 도입했다는 소식이 전해졌다. 최근 보도에 따르면, 아르헨티나 축구협회(AFA)는 앞으로 자국 클럽과 먼저 프로 계약을 체결하지 않고 유럽으로 떠나는 선수를 연령별 국가대표팀에 소집하지 않기로 했다""고 전달했다.
메시는 지난 2022 카타르 월드컵에서 축구 역사상 최고의 'GOAT(Greatest Of All Time, 역대 최고의 선수)로 거듭났다. 아르헨티나 국가대표팀과 함께 우승을 이끌면서 축구 선수로서 들 수 있는 모든 주요한 메이저 대회 트로피를 석권하는 새 역사를 썼다. 38세의 나이에도 여전히 건재한 그는 다가오는 2026 북중미 월드컵 진출까지 노리고 있다. 메시의 라스트 댄스가 될 가능성이 높다.

그런 메시를 하마터면 국가대표팀에서 보지 못할 수도 있었다. '스포츠 바이블'은 ""아르헨티나는 자국 구단에서 프로 계약을 맺기 전 유럽으로 이적하는 선수를 청소년 대표팀에 부르지 않을 것이다. 이는 유스 선수를 육성한 클럽의 이익을 보호하기 위한 '친권' 관련 규정에 따른 조치""라고 설명했다.

매체는 아르헨티나 축구협회 청소년 팀 디렉터인 하비에르 멘데스 카르티에의 발언을 전했다. 그는 ""협회 회장과 집행위원회의 결정에 따라, 우리는 선수를 길러낸 클럽의 이익을 보호하고자 한다. 이를 이해하지 못하고 부모의 권리를 이용해 이민(이적)을 선택하는 선수는 그 어떤 청소년 국가대표팀에도 소집되지 않을 것""이라고 강조했다.

수많은 걸출한 축구 스타를 배출하는 아르헨티나지만, 거대 자본을 앞세운 유럽 클럽들이 아르헨티나의 어린 재능들을 줄줄이 데려 가면서, 자국 클럽들이 정당한 보상을 받지 못하고 무너지는 것을 막겠다는 의지다. 만약 이 규정이 과거에 있었다면, 어린 나이에 아르헨티나를 떠나 바르셀로나와 계약했던 메시는 아르헨티나 청소년 대표팀에서 뛸 수 없었을 것이다. 현재의 우리가 아는 메시가 탄생했을 가능성도 낮다. 

이 규정은 대한민국 축구의 '레전드' 손흥민의 사례에 대입해 봐도 그 파격성이 여실히 드러난다. 만약 한국에 이와 같은 '자국 클럽 보호법'이 존재했다면, 10대 시절 동북고등학교를 떠나 독일 함부르크로 조기 유학을 떠났던 손흥민 역시 태극마크를 달 기회를 박탈당했을 가능성이 크다. 오늘날 전 세계가 열광하는 '월드클래스' 손흥민의 탄생 자체가 불가능했을지도 모른다는 뜻이다.

사진=게티이미지"
20260104,"""황소 또또 쓰러졌다"" 지독한 불운 황희찬, 128일만에 리그 2호골 폭발 후 '눈물의 부상 OUT'…울버햄튼, 웨스트햄 3-0 꺾고 '첫 승'[EPL 리뷰]","황희찬 4일 웨스트햄전 부상 장면. 출처=중계화면
황희찬 4일 웨스트햄전 부상 장면. 출처=중계화면
로이터연합뉴스
AP연합뉴스
[스포츠조선 윤진만 기자]'황소' 황희찬(울버햄튼)이 웃다가 울었다.

황희찬은 4일(한국시각) 영국 울버햄튼의 몰리뉴 스타디움에서 열린 웨스트햄 유나이티드와의 2025~2026시즌 잉글랜드 프리미어리그(EPL) 20라운드 홈 경기에서 시즌 2호골을 폭발했다.

전반 4분 욘 아리아스의 선제골을 도운 황희찬은 1-0으로 앞선 전반 31분 페널티킥으로 추가골을 갈랐다. 8월30일, 에버턴과의 EPL 3라운드(2대3 패)에서 시즌 마수걸이 골을 쏜 후 128일만에 골맛을 봤다. 올 시즌 리그 기록은 15경기 2골 1도움.

하지만 황희찬은 후반 16분 불의의 부상으로 예르겐 스트란드 라르센과 교체됐다. 지난해 12월31일 맨유전(1대1 무)에 이어 경기 도중 부상을 당했다. 2021년 울버햄튼에 입단한 이래 11번째 부상이 될 것으로 보인다. 올해 6월 2026년 북중미월드컵 본선을 준비 중인 홍명보호 입장에서도 웃지 못할 상황이다.

맨유전 부상 장면. 로이터연합뉴스
황희찬 4일 웨스트햄전 부상 장면. 출처=중계화면
'EPL 역대 최악의 팀' 오명을 쓴 울버햄튼은 황희찬의 1골 1도움 원맨쇼 활약에 힘입어 3대0 승리로 시즌 20경기만에 첫 승을 거머쥐었다. 1승 3무 16패 승점 6으로 강등권 탈출의 반등을 놨다. 같은 날 애스턴 빌라에 1대3으로 패한 17위 노팅엄 포레스트(승점 18)과의 승점차를 15에서 12로 좁혔다. 18위 웨스트햄(승점 14)과는 8점차다. 17위부터 20위까지 4팀 중에서 울버햄튼만 웃었다.

물러설 곳 없는 울버햄튼은 3-5-2 포메이션에서 황희찬과 톨루 아로코다레 투톱 카드를 꺼냈다. 잭슨 차추아, 아리아스, 주앙 고메스, 마테우스 마네, 우고 부에노로 미드필드진을 꾸렸다. 예르손 모스케라, 산티아고 부에노, 라디슬라프 크레이치로 스리백을 만들고, 호세 사가 골문을 지켰다.

'전 토트넘 사령탑' 누누 에스피리투 산투 감독이 이끄는 웨스트햄은 칼럼 윌슨이 공격 선봉을 맡고, 재로드 보웬, 마테우스 페르난데스, 크라이센시오 섬머빌로 공격 2선을 구축했다. 숭구투 마가사, 프레디 포츠가 중원을 꾸리고, 카일 워커 피터스, 콘스탄티노스 마브로파노스, 막시밀리안 킬먼, 올리 스칼레스가 포백을 만들었다. 알폰세 아레올라가 골키퍼 장갑을 꼈다.

로이터연합뉴스
로이터연합뉴스
로이터연합뉴스
울버햄튼은 전반 4분만에 '입장골'을 터뜨리며 앞서나갔다. 황희찬이 상대 진영 좌측에서 마네의 패스를 받아 페이크 동작으로 웨스트햄 수비수 마브로파노스의 타이밍을 빼앗았다. 그다음 문전을 향한 왼발 크로스로 아리아스의 선제골을 도왔다. 시즌 1호 도움.

29분, 마네가 웨스트햄 페널티 지역에서 마가사의 파울을 얻었다. 황희찬이 키커로 나서 골문 가운데 하단을 향한 오른발 슛으로 추가골을 뽑았다.

웨스트햄은 사정없이 흔들렸다. 전반 37분과 38분 울버햄튼 공격수 아로코다레의 연이은 헤더가 상대 골키퍼 선방에 막히며 무위에 그쳤다. 하지만 울버햄튼은 41분 마네가 부에노의 패스를 받아 3번째 골을 낚았다.

울버햄튼이 전반에만 3골을 터뜨리는 이례적인 상황 속 전반을 3-0으로 앞선 채 마쳤다.

로이터연합뉴스
후반 16분, 안타까운 일이 발생했다. 황희찬이 페널티 박스 안에서 쓰러졌다. 오른다리 부위에 부상이 발생한 것으로 보인다. 표정엔 극심한 고통이 묻어났다. 의료진과 소통 후 라르센과 교체가 결정났다. 절정의 퍼포먼스를 보이던 상황이어서 더 안타까운 부상이다.

황희찬은 61분을 뛰며 1골, 1도움을 비롯해 키패스 1개, 유효슈팅 1개, 인터셉트 1개, 리커버리 2개, 반칙 1개, 지상경합 7번 시도 2번 성공 등을 기록했다. 평점(소파스코어)은 올 시즌 개인 최고인 8.1점이다. 8.8점을 받은 마네 다음으로 높은 평점이다.

황희찬의 부상은 경기 결과에 영향을 미치지 않았다. 울버햄튼은 전반 3골 리드를 끝까지 지켜내며 3대0 쾌승을 따냈다."
20260104,황희찬에 ‘속수무책’ 당했다···‘손흥민 은사’ 강등권 탈출 위해 승리 간절했지만 ‘황소’ 대활약에 0-3 패,"누누 에스피리투 산투(왼쪽)이 이끄는 웨스트햄 유나이티드 FC가 황희찬의 울버햄튼 원더러스 FC에 완패했다. ESPN UK


토트넘 홋스퍼 감독으로 손흥민을 이끌었고 현재 웨스트햄 유나이티드 FC 를 지휘하는 감독이 ‘황소’ 황희찬에 무너졌다.

누누 에스피리투 산투 감독이 이끄는 웨스트햄은 4일(한국시간) 영국 울버햄튼에 있는 몰리뉴 스타디움에서 열린 2025-2026시즌 프리미어리그 20라운드 황희찬이 선발 출전한 울버핸튼 원더러스 FC에 0-3 패배했다.

웨스트햄은 이번 결과로 리그 3승 5무 12패 14승점으로 18위를 기록했다. 울버햄튼은 리그 20경기만에 첫 승리를 챙겼다. 1승 3무 16패 6승점으로 20위를 유지했다.

손흥민과 누누 에스피리투 산투 감독. Getty Images



누누 감독은 지난 2021년 토트넘 감독으로 당시 선수였던 손흥민과 인연이 있다. 이후 알 이티하드, 노팅엄 포레스트를 이끈 후 지난 9월 웨스트햄 지휘봉을 잡았다.

누누가 지휘하는 웨스트햄은 지금 비상이다. 19라운드 기준 리그 18위(강등권)에서 벗어나지 못하고 있다. 리그 최하위 울버햄튼전 반드시 승리가 필요했다. 하지만, 황희찬의 대활약에 속수무책으로 무너졌다.

울버햄튼 원더러스의 황희찬이 웨스트햄 유나이티드 FC 상대로 득점 후 기뻐하고 있다. 로이터연합뉴스


울버햄튼이 경기 초반 선취골을 터트렸다. 전반 4분 황희찬이 우측면에서 상대 페널티 박스 안으로 크로스를 올렸다. 이걸 존 아리아스가 중앙에서 오른발 슈팅으로 연결해 득점으로 만들었다.

리드를 잡은 울버햄튼은 경기 주도권도 잡고 상대를 몰아붙여 추가골을 만들었다. 전반 31분 마가사가 마테우스 마네에게 반칙을 범했다. 주심은 울버햄튼의 페널티 킥을 선언했다. 황희찬이 키커로 나왔다. 오른발 슈팅으로 골문 중앙으로 공을 넣어 울버햄튼에 2-0 리드를 안겨줬다.

울버햄튼의 공격은 멈추지 않았다. 전반 41분 마네가 페널티 박스 밖에서 오른발 슈팅을 시도했고 이게 왼쪽 아래 구석으로 빨려들어갔다. 울버햄튼의 압도적인 경기력을 보여줬고 전반전 3-0으로 마쳤다.

울버햄튼은 승기를 확실히 잡았다. 후반전은 공격보다 수비에 집중했다. 웨스트햄은 후반전이 시작하자마자 교체 카드 3장을 사용해 분위기 반전을 노렸다. 하지만, 이변 없이 울버햄트의 3-0 승리로 경기 종료됐다.

페널티 킥을 오른발로 처리하는 황희찬. 로이터연합뉴스


득점 후 울버햄튼 동료들과 기뻐하는 황희찬. 로이터연합뉴스


경기 후 글로벌 매체 ‘ESPN’의 공식 채널 ‘ESPN UK’는 “누누는 과거 울버햄튼의 감독이었다. 울버햄튼은 올 시즌 리그 첫 승리를 누누에게 해냈다”고 누누 감독과 울버햄튼의 인연을 주목했다.

누누 감독에 좌절을 안겨준 황희찬은 극찬을 받았다.

전 세계 축구 소식을 전하는 ‘원풋볼’은 “영국 현지 울버햄튼 팬들이 열광했다. 마네의 활약은 지난 시즌 팀 에이스였던 마테우스 쿠냐 같았다”며 “황희찬은 이번 시즌 보여준 활약 중 최고였다. 그는 지난 8월 카라바오컵 웨스트햄전에서도 페널티킥을 실축한 바 있다. 이번 경기에선 성공했다”고 전했다.

황희찬이 멋진 활약을 선보였지만, 문제가 발생했다. 이번 경기 후반 16분 부상 문제로 중간에 교체 아웃됐다. 경기가 끝난 지 얼마 지나지 않은 만큼, 아직 자세한 검진 결과는 나오지 않았다.

용환주 기자 dndhkr159@kyunghyang.com"
20260104,"충격 또 충격! 리오넬 메시(39·리버풀) 깜짝 이적 보인다!…""EPL 구단, 3개월 단기 임대 고려""","(엑스포츠뉴스 권동환 기자) '축구의 신' 리오넬 메시(인터 마이애미) 잉글리시 프리미어리그 명문 리버풀로 깜짝 이적할까.

스페인 매체 '스포르트'는 3일(한국시간) ""리오넬 메시, 리버풀의 3개월간의 꿈""이라며 메시의 리버풀 임대 이적 가능성을 보도했다.

매체는 ""영국 소식통에 따르면 리버풀은 1월 미국 메이저리그사커(MLS) 프리시즌 기간 동안 리오넬 메시를 단기 임대로 영입하는 것을 고려 중인 여러 유럽 클럽 중 하나""라고 설명했다.

이어 ""복잡한 영입 과정에도 불구하고, 여러 클럽들이 3월 MLS 개막 전에 메시의 영입을 추진하는 방안을 고려하고 있다""라며 ""리버풀은 그 목표를 추구하는 가장 강력한 팀 중 하나로 보인다""라고 덧붙였다.



추춘제인 프리미어리그와 달리 MLS는 춘추제로 운영되고 있어 현재 휴식기에 들어갔다.

모든 당사자가 합의에 이를 수 있다면 메시는 1월 겨울 이적시장 기간 동안 유럽 구단과 단기 임대 계약을 맺어 MLS 새 시즌 개막 전까지 다시 유럽 무대에서 뛸 수도 있다.

과거 티에리 앙리, 데이비드 베컴 등이 MLS에서 뛰다 유럽으로 단기 임대를 떠난 적이 있고, LAFC에서 뛰고 있는 손흥민도 겨울 이적시장을 앞두고 단기 임대설이 나왔다.

만약 메시가 경기 감각을 유지하기 위해 휴식기 동안 프리미어리그 명문 구단 리버풀로 임대를 떠난다면 엄청난 화제가 될 전망이다.



1987년생 메시는 올해로 39세가 됐지만 여전히 정상급 선수로 활약 중이다. 그는 2025시즌 마이애미 소속으로 35경기에 나와 35골 23도움을 올리는 엄청난 활약을 펼쳤다.

국제축구연맹(FIFA) 클럽월드컵 등 다른 대륙 대회를 포함하면 공식전 49경기 43골 26도움을 기록. 한 해에 무려 79개의 공격 포인트를 달성했다. 메시의 활약에 힘입어 마이애미는 창단 첫 MLS컵 우승을 차지했다.

단기 임대가 성사된다면 짧은 시간이지만 리버풀 공격진에 큰 힘이 될 전망이다. 지난 시즌 프리미어리그 우승을 차지했던 리버풀은 올시즌 기대에 살짝 미치지 못해 현재 4위에 자리 중인데, 메시가 가세하면 후반기 순위 반등을 기대해 볼 수 있다.

더불어 많은 팬들이 메시의 유니폼을 구매하거나 메시를 보기 위해 경기장을 찾는 등 상업적인 효과도 엄청난 것으로 예상된다.

사진=MLS / 연합뉴스"
20260104,"김민재(30·레알 마드리드) 핵폭탄급 이적설 터졌다!…6개월 임대+이적료 423억→""뮌헨이 레알에 역제안""","본지 사진 AI 합성물


(엑스포츠뉴스 윤준석 기자) 김민재의 이름이 다시 유럽 이적 시장의 중심에 올랐다.

이번에는 스페인이다.

바이에른 뮌헨에서의 입지가 흔들리고 있다는 평가, 그리고 몸값 하락이라는 조건이 맞물리며 레알 마드리드가 김민재의 이적 제안을 받았다는 소식이다.

김민재는 여러 구단 러브콜에 크게 관심 없는 눈치이긴 하다.

레알 마드리드 관련 스페인 매체 '데펜사 센트랄'은 4일(한국시간) ""레알 마드리드가 김민재를 2500만 유로(약 423억원)에 영입할 수 있다""라는 제목의 기사에서 ""김민재가 최근 레알 마드리드에 '제안됐다'""고 주장했다.

매체는 ""독일에서도 레알 마드리드가 겪고 있는 수비 위기가 주목받고 있으며, 뮌헨 수뇌부가 이를 활용해 김민재를 산티아고 베르나베우로 보내려 하고 있다""고 했다.



보도에 따르면 김민재는 뱅상 콩파니 감독 체제에서 여전히 유용한 선수로 평가받고 있지만, 주전 지위를 완전히 잃은 상황에서 더 이상의 가치 하락을 막기 위해 뮌헨이 매각에 열려 있다.

이런 상황 속에서 뮌헨 구단 수뇌부 측이 김민재를 여러 유럽 구단에 동시에 제안하고 있으며, 레알 역시 그중 하나라는 설명이다.

특히 ""바이에른 뮌헨은 김민재를 처분함으로써 레알 마드리드가 다요 우파메카노 영입을 고려하지 않도록 만드는, 이른바 '두 마리 토끼'를 잡으려 한다""고 주장했다.

독일 구단이 제시한 조건은 올해 1월 임대 이적 후, 오는 7월 2500만 유로에 의무 완전 이적하는 방식이다.
다만 나이가 걸림돌이라고 했다.

데펜사 센트랄은 ""레알 마드리드는 여름을 대비해 수비 보강 필요성을 인식하고 있지만, 29세라는 나이가 이 거래의 가장 큰 걸림돌""이라는 평가를 더했다.

또한 매체는 2023-2024시즌 유럽축구연맹(UEFA) 챔피언스리그 준결승에서 비니시우스 주니오르가 김민재가 튀어나온 틈을 타 빠르게 뒷공간을 침투해 골을 넣었던 장면을 언급하며, ""세계 최고 공격수들을 상대로 한 경기에서의 불안함이 레알 내부에 여전히 남아 있다""고 전했다.



하지만 스페인 측에서의 주장과 달리 독일 현지 보도는 김민재의 겨울 이적 가능성을 사실상 부정하고 있다.

뮌헨 소식을 전문적으로 전하는 '바바리안 풋볼 워크스'는 2일 ""김민재는 이번 겨울 뮌헨을 떠나지 않는다""고 단언했다.

이 매체는 '스카이스포츠' 독일의 플로리안 플레텐베르크 기자의 발언을 인용해 ""여러 구단의 관심에도 불구하고, 김민재가 겨울 이적 시장에서 팀을 떠날 가능성은 전혀 없다""고 전했다.

매체는 김민재가 지난 여름 요나단 타가 뮌헨으로 영입된 뒤 출전 시간이 줄어들은 틈을 타 페네르바체와 여러 세리에A 클럽이 관심을 보이고 있는 상황이라고 전했다.

이에 더해, 막스 에베를 뮌헨 단장은 회장단으로부터 선수단 총연봉 절감 압박을 받고 있으며, 고연봉 자원을 정리하고 상대적으로 비용 부담이 적은 선수들로 스쿼드를 구성하려는 흐름 속에서 김민재의 이름이 거론됐다는 설명도 더했다.



계약 상황 역시 즉각적인 이적을 어렵게 만든다는 해석도 덧붙였다.

김민재의 현재 계약은 2028년 6월까지 유효하다.

특히, 매체는 김민재의 현재 평가 가치로 추정되는 2500만 유로 수준이 2023년 여름 나폴리에서 뮌헨으로 이적할 당시의 5000만 유로(약 890억원)에 비해 크게 하락한 수치인 점을 들어 뮌헨이 성급한 판매를 원치 않는다고 설명했다.

또한 콤파니 감독의 입장도 김민재의 잔류 가능성을 높인다. 그는 지난 시즌 분데스리가 우승 과정에서 김민재를 핵심 수비수로 활용했다.

시즌 도중 주전급 선수를 대책 없이 내보내는 결정에 동의하기 어려운 상황이라는 점에서, 구단 내부에서도 겨울 이적은 현실성이 떨어진다는 평가가 지배적이다.



이런 상황 속에서, 김민재는 뮌헨 구단이 4일 공개한 선수단 훈련 장면에서 모습을 드러냈다. 

뮌헨은 지난해 12월 22일 하이덴하임전을 끝으로 전반기를 마친 뒤, 독일 리그 특유의 긴 겨울 휴식기에 들어갔다.

김민재는 이 기간 한국을 방문해 휴식과 몸 관리를 병행했고, 독일 복귀 직후 곧바로 팀 훈련에 합류한 것으로 알려졌다.

구단 공식 유튜브 채널을 통해 공개된 훈련 영상에서 그는 스트레칭과 러닝, 전술 훈련에 성실히 임했고, 자말 무시알라, 마이클 올리세 등과 함께 훈련장에 등장했다.

뮌헨에서의 커리어도 물론 중요하지만, 김민재는 올여름 한국 국가대표로서 월드컵을 앞두고 있다. 

이적설이 난무하는 가운데에서도 김민재의 현재 과제는 오직 컨디션 관리와 후반기 반등뿐이다. 현재로서는 안정적인 곳에서 컨디션을 유지하는 것이 우선 과제로 보인다.

사진=연합뉴스"
20260104,"충격 폭로! ""우린 XX 스퍼시해"" 손흥민 17년 무관 끊고 쫓겨나다니...존슨 강제 매각에 토트넘 '라커룸 반란' 조짐","사진=존슨 SNS


[포포투=김아인]

토트넘 홋스퍼 내부에서는 브레넌 존슨의 이적을 부정적인 시선으로 바라보고 있는 것으로 보인다.

토트넘은 3일(이하 한국시간) 구단 홈페이지를 통해 ""우리는 팰리스와 존슨 이적에 합의했다. 존슨의 노고와 헌신에 감사하며, 그의 앞길을 응원한다""고 공식 발표했다. 팰리스 역시 같은 날 ""우리는 토트넘으로부터 존슨을 영입했다. 구단 역대 최고 이적료를 기록했고,며 계약 기간은 4년 반이다""라고 밝혔다.

존슨은 노팅엄 포레스트 시절부터 '특급 유망주'로 주목받으며 팀의 승격을 이끌었던 에이스였다. 2023-24시즌 큰 기대를 받으며 토트넘에 5500만 유로(약 820억 원)에 합류한 그는 첫 시즌엔 프리미어리그(PL) 32경기 5골 10도움으로 기대만큼의 활약을 펼치지는 못했다.

사진=게티이미지


지난 시즌에도 수많은 비판을 받았지만, 토트넘 팬들에게는 잊지 못할 선물을 안겼다. 맨체스터 유나이티드와의 유럽축구연맹(UEFA) 유로파리그(UEL) 결승전에서 터뜨린 천금 같은 결승골로 그는 영웅이 됐다. 토트넘에 17년 만의 우승컵을 선사했고, '캡틴' 손흥민의 커리어 첫 메이저 우승을 완성하는 결정적인 순간이었다. 당시 존슨은 손흥민과의 셀카를 공개하며 ""우린 XX 스퍼시(토트넘을 조롱할 때 쓰이는 단어)해""라는 멘트를 날리기도 했다.

하지만 토마스 프랭크 감독 부임 이후 존슨의 입지는 급격히 흔들렸다. 모하메드 쿠두스 등 새로운 경쟁자들에게 밀려 벤치를 지키는 시간이 늘어났고, 이번 시즌 리그 선발 출전은 단 6회에 그쳤다. 결국 존슨은 4000만 유로(약 680억 원)라는 팰리스 구단 역대 최고 이적료를 기록하며 팀을 떠났다.

최근엔 토트넘에서 손흥민의 이별을 애틋해한 순간이 포착되기도 했다. 지난 12월 토트넘이 공개한 손흥민의 고별식 특별 영상에 나온 존슨은 손흥민이 고별전에서 마지막 연설을 하던 라커룸에서 혼자 눈물을 훔치고 있었다. 존슨은 손흥민을 향해 언제나 존경심을 숨기지 않았고, 손흥민이 직접 제작에 참여한 시그니처 축구화를 착용하기도 했었다. 

사진=스포츠 바이블


토트넘은 존슨을 강제로 내보내고 싶어했던 모양새다. 토트넘 소식에 정통한 알라스데어 골드 기자는 자신의 SNS를 통해 ""토마스 프랭크 감독과 파비오 파라티치 스포츠 디렉터는 존슨에게 클럽의 방향성은 다르게 나아갈 것이라고 말하면서, 존슨의 가치가 높을 때 매각해야 한다고 그가 전력 외 자원이 됐음을 통보했다""고 폭로했다.

또한 ""존슨은 지난 10년간 토트넘의 방출 선수 중 세 번째로 높은 금액을 기록하겠지만, 2년 반 전 노팅엄 포레스트에서 데려올 때 지불한 4,750만 파운드에 비하면 셀온 조항 등을 고려할 때 약 1,500만 파운드 정도 손해를 보는 셈이다. 결국 이 거래가 적절한 시기에 이루어진 옳은 결정인지는 여전히 의문이다""고 의견을 전했다.

존슨의 이적으로 선수단 내부 분위기는 심상치 않은 것으로 보인다. 골드 기자는 ""존슨을 매각하기로 한 결정은 그가 큰 인기를 누렸던 팀 라커룸 내에서 그리 환영받지 못하는 분위기다""고 내부 소식을 알렸다. 제임스 매디슨, 도미닉 솔란케, 미키 반 더 벤, 데스티니 우도기 등도 개인 SNS를 통해 존슨과 작별 인사를 나누며 아쉬워했다.

사진=매디슨 SNS"
