date,title,content
20260203,"2년 전 그렇게 모욕하더니 결국 무릎 꿇었다…""카세미루가 해설 그만두라고 해도 할 말 없다""","사진=게티이미지


[포포투=박진우]

제이미 캐러거가 과거 본인의 '카세미루 모욕 발언'을 뉘우쳤다.

맨체스터 유나이티드는 1일 오후 11시(한국시간) 영국 맨체스터에 위치한 올드 트래포드에서 열린 2025-26시즌 프리미어리그(PL) 24라운드에서 풀럼에 3-2로 승리했다. 이로써 맨유는 리그 3연승을 달성하며 승점 41점으로 4위로 도약했다.

'올드 트래포드 극장'을 만든 맨유. 승리의 중심에는 카세미루가 있었다. 시작부터 좋았다. 전반 16분 프리킥 상황, 브루노 페르난데스가 올린 크로스를 카세미루가 정확한 타점으로 헤더로 연결하며 1-0을 만들었다. 

'노룩 패스'로 환상 도움까지 만든 카세미루다. 후반 11분 카세미루가 박스 우측으로 라인을 깨고 들어가는 마테우스 쿠냐에게 완벽한 공간 패스를 내줬다. 상대 수비를 완벽하게 속이는 '노룩 패스'였다. 쿠냐는 각이 없는 상황에서도 강력한 오른발 슈팅으로 골망을 열었다.

이후 맨유는 후반 추가시간 직전 2-2로 동점을 허용했지만, 막판 베냐민 세슈코의 극장 역전골로 3-2로 승리했다. 승부를 가른 건 세슈코였지만, 경기 최우수선수(POTM)는 카세미루의 몫이었다. 카세미루는 이날 중원 장악력, 경기 조율 능력, 득점력, 패싱력까지 과시하며 '미드필더의 교과서' 면모를 발휘했다.

카세미루는 이번 시즌을 끝으로 맨유를 떠나지만, 아쉬움의 목소리가 계속해서 묻어 나온다. 영국 '골닷컴'은 ""맨유는 카세미루가 떠난 뒤 이런 퍼포먼스를 분명 그리워하게 될 것이다. 공수 전반에서 완벽에 가까운 지배력을 보여줬다""며 호평했다.

카세미루의 활약이 거듭될수록, 캐러거의 발언이 회자된다. 사실 카세미루는 지난 시즌 초반까지 최악의 경기력을 보여주며 방출 1순위로 거론되고 있었다. 당시 캐러거는 '스카이 스포츠'를 통해 ""이미 축구가 카세미루를 떠났다. 이 수준에서는 결단을 내려야 하고, 떠나야 한다. 그 정도 레벨의 선수라면 이런 경기력으로 본인을 이러한 상황에 몰아 넣어서는 안 된다""고 강하게 비판한 바 있다.

캐러거는 자신의 발언을 뉘우쳤다. ""이제는 그에게서 축구가 사라졌다고 말할 수는 없을 것 같다. 올 시즌 리그에서 보여주는 퍼포먼스를 보면 그렇다. 단순히 풀럼전만이 아니다. 솔직히 카세미루가 내게 '해설을 그만두는 게 낫지 않겠냐, 축구보다 해설이 먼저 떠난 것 같다'고 되받아쳐도 할 말이 없다. 그 정도로 다시 돌아올 수 있다는 걸 분명히 보여줬다. 지금의 그는 완전히 다른 선수처럼 보인다""라며 카세미루를 인정했다.

사진=게티이미지"
20260203,"""PL 너무 어려워요"" 日 축구 가슴 찢어진다...'우승 주역→5옵션 전락' 핵심 MF 벤치 신세, 겨울 이적도 없다","사진=게티이미지


[포포투=김아인]

다나카 아오의 벤치 신세가 계속되면서 프리미어리그(PL)에서의 미래가 연일 어두워지고 있다. 

다나카는 일본의 떠오르는 미드필더다. 가와사키 프론탈레에서 성장하면서 독일 2부 리그에 진출했고, 가능성을 인정받은 뒤 지난 2024-25시즌 잉글랜드 무대에 입성했다. 리즈 유나이티드로 이적하면서 단숨에 주전으로 거듭났고, 잉글랜드 챔피언십(2부 리그) 43경기 5골 2도움을 몰아치며 팀의 우승과 승격에 크게 기여했다. 다나카는 잉글랜드 풋볼리그(EFL) 올해의 팀에 선정되고, 구단 올해의 선수상까지 받으면서 리즈의 '복덩이'가 됐다.
하지만 꿈에 그리던 프리미어리그에서는 가시밭길이 시작됐다. 시즌 개막과 동시에 무릎 부상이라는 악재를 맞이하며 긴 공백을 가졌다. 그 사이 주전 경쟁에서 밀려나기 시작했다. 안톤 슈타흐와 션 롱스태프가 주전으로 낙점되며 출전 기회를 좀처럼 얻지 못했다. 다나카는 현재까지 리그 20경기에 출전했지만 선발은 단 7번에 그쳤고, 출전 시간도 한 경기당 약 37분에 불과했다.

다니엘 파르케 감독은 좀처럼 다나카에게 믿음을 주지 않고 있다. 다나카는 지난해 10월 웨스트햄 유나이티드전에서 오랜만에 선발 출전한 뒤 ""여전히 만족스럽지 않다. 매 순간 경기력을 더 끌어올려야 한다""고 자신을 자책하면서, ""프리미어리그에서 매번 완벽할 수는 없겠지만, 내 수준을 증명하기 위해 최선을 다할 것""이라고 다짐하기도 했다.

현지에서는 다나카가 시즌을 마치고 이적할 가능성도 점치고 있다. 리즈 소식을 전하는 'MOT 리즈 뉴스'는 1일(한국시간) ""지난 아스널전에서 롱스태프가 기용된 이유는 공중볼 위협에 대처하고자 높이를 더하기 위해서였다. 하지만 이는 다나카가 팀 내 우선순위에서 5번수로 밀려났다는 메시지를 보낸 것이기도 하다""라고 보도했다.

이어 ""지난 시즌 다나카의 활약은 인상적이었다. 그가 없었다면 리즈는 여전히 2부 무대에 있었을 것이다. 그만큼 현재 상황을 이해하기 어렵다. 당장 겨울에 팀을 떠나진 않겠지만, 여름에는 다른 클럽으로 향할 가능성이 높다""고 덧붙였다.

다나카의 입지가 줄어들수록 일본 국가대표팀에도 커다란 고민거리가 된다. 다나카는 최근 A매치 35경기에서 8골을 기록하며 모리야스 하지메호의 중원에서 입지를 넓혀가고 있었다. 하지만 소속팀에서의 출전 시간 부족이 장기화될 경우 경기 감각 저하로 이어져, 월드컵을 6개월 앞둔 일본 대표팀 전력에도 상당한 타격이 될 것으로 보인다.

사진=게티이미지"
20260203,"韓 축구 초대형 반전! ""이강인, 아틀레티코 직접 거절했다""…시메오네 러브콜 단칼 거부→PSG 'LEE 중심 재계약' 가속","[스포티비뉴스=박대현 기자] 올겨울 이강인이 직접 아틀레티코 마드리드행을 거절했다는 보도가 나온 가운데 현 소속팀 파리 생제르맹(PSG)은 재계약을 서두르고 있다.

PSG 소식을 전문으로 다루는 'paristeam'은 3일(이하 한국시간) ""최근 몇 주간 아틀레티코는 PSG 공격형 미드필더 이강인에게 큰 관심을 보였다. 실제 겨울 이적시장에서 강하게 영입을 추진했지만 여러 장애물에 가로막혔다""고 적었다.

""첫 장애물은 루이스 엔리케 감독이었다. 그는 자신의 선수를 보내지 않겠단 뜻을 분명히 했고 이후 파리 구단 수뇌부 역시 같은 입장을 취했다""면서 ""그리고 두 번째 장애물도 이제 밝혀졌다. 프랑스 유력지 '레키프'에 따르면 이강인은 본인이 직접 디에고 시메오네 감독이 이끄는 아틀레티코 접근을 거절했다. 지난해 여름 자신의 미래와 팀 내 입지에 대해 고민했던 것과 달리 한국 국가대표는 최근 몇 주 사이 완전히 다른 태도를 보이고 있다""고 귀띔했다.



이러한 변화는 경기력으로도 드러나고 있다.

포지션과 심경 변화 이후 이강인은 경기 운영과 결정적인 장면에서 한층 안정된 모습을 보여주고 있다. PSG는 이런 흐름을 긍정적으로 평가하며, 자연스럽게 재계약 논의 가능성까지 열어두고 있다. 현재 이강인의 계약은 2028년 6월까지지만 구단은 장기적인 프로젝트의 일환으로 계약 연장을 검토하는 분위기다.

레키프는 2일 ""PSG에는 이강인만큼 기술적으로 완성도가 높은 선수가 드물다""며 ""이번 겨울 이강인을 내보낸다는 선택은 상상하기 어려웠다. 구단은 계약 연장을 고려하고 있다""고 보도했다.

▲ 연합뉴스 / AFP


이강인의 가치는 최근 경기에서 더욱 분명해졌다.

PSG는 2일 프랑스 스트라스부르에서 열린 리그앙 원정 경기에서 수적 열세 속에서도 2-1 승리를 거뒀다. 이날 이강인은 부상 복귀 후 오랜만에 그라운드를 밟았다. 지난해 12월 FIFA 인터콘티넨탈컵 결승 이후 허벅지 부상으로 한 달 넘게 재활에 매진한 그는 제한된 출전 시간에도 경기 흐름을 바꾸는 존재감을 남겼다.

후반 중반 PSG는 핵심 수비 자원의 퇴장으로 위기에 몰렸지만 엔리케 감독은 후반 15분 이강인을 투입해 경기 균형을 잡았다. 이강인은 침착한 볼 소유와 탈압박으로 팀에 안정감을 제공했고, 결정적인 장면의 출발점이 됐다. 기록상 도움은 아니었지만 결승골 과정에서의 기점 역할은 분명했다.
투입 4분 만에 시도한 날카로운 유효 슈팅이 골키퍼 선방에 막혀 아쉬움을 삼켰다. 후반 36분엔 결승골의 시발점 노릇을 했다.

중앙선 부근에서 공을 잡은 이강인은 상대 수비진 압박을 가볍게 따돌렸다. 이어 오른쪽 측면의 워렌 자이르에메리에게 패스를 연결했다.

자이르에메리가 미끄러지면서 올린 크로스는 문전의 누누 멘데스에게 정확히 배달됐고 멘데스가 그대로 강력한 헤더로 골망을 흔들었다.



약 30분 남짓한 출전에도 수치가 인상적이었다.

패스 성공률 83%, 기회 창출 1회, 리커버리 4회, 드리블 성공률 100%, 크로스 성공 1회, 롱패스 성공 2회, 지상 볼 경합 성공률 100%로 훨훨 날았다. 축구 전문 통계 '풋몹'도 7.2점의 고평점을 부여하며 활약상을 인정했다.

레키프 역시 ""부상에서 돌아온 이강인이 경기 막판 결정적인 영향을 미쳤다""며 ""짧은 출전 시간에도 선발 선수보다 강한 인상을 남겼다""고 평가했다. 특히 상대 압박을 벗겨내며 전개한 장면을 두고 ""후반기 PSG의 중요한 자산이 될 수 있음을 보여줬다""고 덧붙였다.



올겨울 이강인은 실제 파리를 떠날 가능성이 있었다. 아틀레티코는 공격진 보강을 위해 적극적인 제안을 준비했고 이강인 역시 출전 시간과 스페인 무대 복귀를 두고 고민했던 것으로 알려졌다.

그러나 PSG는 '이적 불가' 방침을 분명히 했고 제시된 이적료 규모 또한 현실적인 협상으로 이어지지 않았다.

엔리케 감독은 경기 후 ""이강인은 강한 압박 속에서도 공을 지켜낼 수 있는 선수""라며 ""우리 전술에서 매우 중요한 요소를 담당하고 있다""고 평가했다. 이어 ""기복과 부상은 있었지만 우리는 그를 신뢰하고 있다""고 덧붙였다.

결국 아틀레티코는 다른 선택지로 방향을 틀었고 PSG는 이강인을 붙잡았다. 결과적으로 선택은 틀리지 않았다. 이강인은 복귀전에서 팀 승리에 기여하며 자신의 가치를 또 한 번 증명했다. 이제 관심은 재계약 논의가 실제 협상 테이블로 이어질지에 쏠린다. 이번 겨울 이강인의 이야기는 이적이 아닌 '잔류와 증명'으로 방향을 바꿨다."
20260203,"韓 막판 역전 드라마…역대급 공식발표 임박 ""오현규 메디컬테스트, 베식타시 합의 끝""","[스포티비뉴스=박대성 기자] 오현규(24, 헹크)가 겨울 이적 시장 막판 유니폼을 갈아 입을 전망이다. 튀르키예 무대로 적을 옮겨 새로운 도전에 나선다.

튀르키예 매체 파나틱은 3일(한국시간) ""겨울 이적시장에서 전력 보강을 꾀하던 베식타시가 오현규 영입에 사실상 합의했다""라고 알렸다. 포토막 등 다른 매체들도 ""베식타시가 오현규 영입과 관련해 헹크와 합의에 도달했다""라며 메디컬 테스트를 끝낸 뒤 베식타시로 이적할 것을 보도했다.

매체에 따르면, 베식타시는 오현규 영입을 위해 초기 1200만 유로(약 205억 원)를 제안했으나 헹크 측 거절로 결렬됐다. 이에 보너스를 포함해 총액 1500만 유로(약 256억 원) 규모로 제안을 상향했고, 결국 헹크의 확답을 받아냈다.

벨기에 매체 HLN은 ""베식타시가 최대 1700만 유로(약 290억 원)까지 이적료를 높여 헹크를 압박하고 있다. 이적은 분명 모든 당사자에게 최선의 해결책으로 보인다""라고 전했다.

오현규는 지난 여름 유럽 빅리그 이적을 앞두고 있었다. 독일 분데스리가 슈투트가르트와 협상 테이블에 앉았고 합의 직전까지 갔는데 막판에 불발됐다. 슈투트가르트는 메디컬 테스트 에서 고교 시절 십자인대 부상 이력을 걸고 넘어졌고, 이적료 삭감을 요구해 협상이 결렬됐다.



슈투트가르트 이적 불발 후, 꽤 마음 고생을 했고 헹크에서 전반기를 보냈다. 겨울 이적 시장이 열리자 프리미어리그 풀럼, 리즈 유나이티드 등과 연결됐는데 구체적인 협상까지 이어지지 못했다.

벨기에 매체 HLN은 ""헹크는 톨루 아로코다레를 울버햄튼으로 이적시킨 후 오현규 영입을 추진했짐만, 오현규는 독일 슈투트가르트 이적이 무산된 이후 최고의 기량을 되찾지 못했다""라고 설명했다. 실제 헹크에서 올 시즌 공식전 31경기 10골 3도움을 기록했는데, 그를 중용했던 토르스텐 핑크 감독이 경질된 후 출전 시간이 급격히 줄어들었다.

오현규를 원하는 베식타시는 튀르키예 쉬페르리그 16회 우승을 자랑하는 명문이지만 올 시즌 5위에 머물고 있다. 최근 주전 공격수 타미 에이브러햄이 팀을 떠나 대체자 영입이 시급했다.



튀르키예 현지 매체 오르타치즈기는 ""오랫동안 이적 명단에 올라 있던 오현규 영입을 위한 협상이 성공적으로 마무리됐다. 베식타시는 헹크와 합의에 도달했으며, 오현규 역시 베식타시 유니폼을 입고 싶다는 의사를 밝혔다""라고 전했다.

이어 ""이적은 조만간 공식 발표될 예정이며 오현규는 팀에 합류하기 위해 이스탄불에 도착할 예정""이라고 알렸다."
20260203,"'이적 합의' 쏘니, 어쩌나, 끝내 공식 입장도 뒤집었다...LAFC, 부앙가, 브라질 플루미넨세행 보도 등장, '손흥민 파트너' 이탈하나","[SPORTALKOREA] 박윤서 기자= 드니 부앙가가 로스앤젤레스 FC(LA FC)를 떠날 것이란 주장이 제기됐다.

주로 미국 프로축구 메이저리그사커(MLS) 소식을 전하는 '테리토리오 MLS'는 3일(한국시간) 브라질 매체 보도를 인용해 ""LA FC가 플루미넨세와 부앙가 이적에 합의했다""고 전했다.

앞서 MLS 소식에 정통한 톰 보거트 기자는 ""플루미넨시가 LA FC의 핵심 공격수 부앙가 영입을 위해 약 1,500만 달러(약 220억 원) 규모의 제안을 건넸다""고 설명했다.

이후 부앙가가 플루미넨세로 이적할 수 있단 주장이 쏟아졌다. 최근 부앙가는 리오넬 메시의 소속팀으로 잘 알려진 인터 마이애미 CF와 강력하게 연결됐다. 당시 부앙가는 이적 관련 보도가 흘러나오자, 공식적으론 잔류 의지를 밝혔다.



다만 이는 이적이 불발된 후 표면적인 입장일 뿐, 진짜 속내는 다르다는 이야기가 흘러나왔다. 실제로 당시 부앙가는 자신의 사회관계망서비스(SNS)를 통해 ""꿈에서 불과 몇 cm 떨어져 있었다. 그런데 클럽이 그 문을 닫아버렸다""라는 내용을 리트윗했다.

의미심장한 메시지를 게재한 부앙가는 곧 해당 게시글을 삭제했지만, 일파만파 퍼진 후였다. 부앙가는 이적을 포기하지 않은 것으로 알려졌다. LAFC 탈출을 위한 움직임을 가져가며 새로운 팀을 물색하고 있단 보도가 반복됐다.

테리토리오 MLS는 구체적인 이적료 지급 계획까지 밝히며 신빙성을 높였다. 매체에 따르면 플루미넨세는 먼저 600만 달러(약 87억 원)를 내고, 추후 900만 달러(약 130억 원)를 분할 지급하는 조건을 내건 것으로 확인됐다. 



만일 부앙가가 플루미넨세로 이적할 시 LA FC로선 그야말로 악재다. 지난해 손흥민을 영입하며 원대한 프로젝트를 기획하고 있는 구단이 핵심 공격수로 지목한 재능인 까닭이다.

사진=게티이미지코리아

제휴문의 ad@sportalkorea.co.kr"
20260203,"텐 하흐의 유산, 비행기 타기 직전에 이적 무산...'제2의 박지성' 부상에 맨유 탈출 실패","[인터풋볼=박윤서 기자] 타이렐 말라시아는 튀르키예 베식타스 이적을 눈앞에 두고 맨체스터 유나이티드로 돌아가야 했다.

2022-23시즌 에릭 텐 하흐 전임 감독의 부름을 받고 맨유에 합류한 말라시아. 첫 시즌은 루크 쇼의 백업 역할을 잘 수행하며 좋은 모습을 보였지만 2년 차부터 부상이 발목을 잡았다. 무릎 부상으로 수술을 진행했는데 수술 부위 합병증이 생겨 회복은 자꾸만 미뤄졌다. 2023-24시즌을 통째로 날렸고 2024-25시즌이 되어서야 맨유로 돌아왔지만 말라시아를 위한 자리는 없었다. 루벤 아모림 전 감독은 시즌 도중 말라시아를 PSV 아인트호벤으로 임대 이적시키기도 했는데 말라시아는 PSV에서도 벤치만 지키다가 다시 맨유로 왔다.

그 사이 마이클 캐릭 임시 감독이 지휘봉을 잡고 다시 포백으로 돌아갔고 쇼가 풀타임 주전으로 활약하고 있다. 말라시아는 맨유에 자리가 없어 이번 겨울 이적시장 이적을 시도했고 튀르키예 베식타스와 합의했다.



영국 '토크 스포츠'는 3일(한국시간) ""말라시아는 월요일에 베식타스 이적을 완료하기 위해 튀르키예행 비행기에 탑승하려던 참이었다. 그러나 제이슨 윌콕스 디렉터가 말라시아에게 맨유로 돌아오라고 지시했다""라고 전했다.

눈앞에서 무산된 이적. 이유는 패트릭 도르구의 부상이었다. 도르구는 아스널전 햄스트링 부상을 입어 최대 10주 결장할 것으로 알려졌다.

맨유로서는 어쩔 수 없는 선택이었다. 현재 쇼가 리그 전 경기 선발로 나서면서 왼쪽 풀백을 든든하게 채워주고 있으나 원체 부상이 잦은 선수라 언제 이탈할지 모른다. 도르구가 있었더라면 그래도 쇼의 부상에 대처가 가능했겠지만 도르구까지 빠지면서 불안감은 커진 상황. 도르구의 부상 공백을 최소화하기 위해 말라시아를 팀에 남겼다."
20260203,"[오피셜] 결국 황희찬과 이별 택했다...크리스탈 팰리스, 953억에 울버햄튼 ST 라르센 영입 완료","사진= 크리스탈 팰리스


[인터풋볼=김현수 기자] 예르겐 스트란드 라르센이 크리스탈 팰리스로 이적했다.

팰리스는 3일(한국시간) 구단 홈페이지를 통해 ""우리는 울버햄튼 원더러스에서 라르센을 클럽 역대 최고액으로 영입했다고 기쁜 마음으로 알린다. 노르웨이 국가대표 라르센과는 4년 6개월 계약을 체결했으며, 팰리스에서는 22번을 착용하게 됐다""라고 공식 발표했다.

2000년생, 노르웨이 국적의 스트라이커 라르센. 자국 리그 데뷔 후 네덜란드 리그를 거쳐 셀타 데 비고에서 빅리그 경쟁력을 보여줬다. 2023-24시즌 주전 공격수로 활약하며 리그 37경기 13골 3도움이라는 준수한 성적을 남겼다. 이후 울버햄튼의 부름을 받아 2024년 프리미어리그 무대를 밟았다.



프리미어리그에서도 기량은 변함없었다. 입단과 동시에 주전을 꿰찼고 공식전 38경기 14골 5도움을 기록했다. 이번 시즌에도 26경기 6골 2도움을 올리며 리그 최하위로 추락한 팀의 최전방을 묵묵히 지켰다.

이번 겨울 이적설이 무성했다. 올 시즌 강등이 확정적인 울버햄튼이 라르센을 고액에 매각해 내년 영입 자금을 마련할 것이라는 소문이 돌았는데 결국 현실이 됐다. 최전방 보강을 원하던 팰리스가 영입에 성공했다. 영국 'BBC'에 따르면 팰리스는 클럽 레코드인 4,800만 파운드(약 953억 원)를 투자한 것으로 알려졌다.

팰리스 스티브 패리시 구단주는 ""라르센이 우리와 함께 인상적인 여정을 이어가기로 선택한 것을 매우 기쁘게 생각하며, 셀허스트 파크(팰리스 홈구장)에서 그가 활약하는 모습을 기대하고 있다. 라르센은 앞으로 수년간 팀에 소중한 자산이 될 것이라 확신한다""라며 만족감을 드러냈다.

라르센은 팰리스 공식 홈페이지를 통해 ""팰리스에 오게 되어 정말 기쁘다. 오랫동안 꿈꿔왔던 일이었다. 나는 팀에 에너지와 골을 가져다주고, 클럽을 위해 최선을 다하려고 왔다""라며 소감을 밝혔다.

사진= 크리스탈 팰리스"
20260203,"'대충격 스왑딜' 탄생하나? ""레알 마드리드 벨링엄 가격 책정, 첼시 2100억 미드필더 포함 제안 받을 경우 수락할 수도""","엔소 페르난데스(왼쪽)와 주드 벨링엄./게티이미지코리아

[마이데일리 = 김건호 기자] 레알 마드리드가 주드 벨링엄의 가격을 책정했다는 충격적인 보도가 나왔다.

영국 '스포츠바이블'은 2일(한국시각) ""레알 마드리드는 벨링엄 영입을 원하는 잉글랜드 프리미어리그(PL)의 한 톱 클럽에 필요한 이적료를 정확히 전달한 것으로 전해졌다""고 전했다.

레알 마드리드는 2023년 7월 보루시아 도르트문트로부터 벨링엄을 영입했다. 당시 19세였던 벨링엄을 데려오기 위해 옵션 포함 1억 3390만 유로(약 2300억 원)를 썼다.
주드 벨링엄./게티이미지코리아

벨링엄은 레알 마드리드의 핵심 선수가 됐다. 이적 첫 시즌 42경기 23골 13도움을 마크한 그는 2024-25시즌 52경기 14골 13도움 그리고 올 시즌 34경기 7골 5도움이라는 성적을 남겼다. 현재 햄스트링을 다쳐 회복 중이다.

플로렌티노 페레스 레알 마드리드 회장은 벨링엄을 구단의 미래로 평가하고 있다. 하지만 판매할 가능성도 열려있는 것으로 보인다.

'스포츠바이블'은 ""'스포츠붐'의 보도에 따르면, 레알 마드리드는 장기적인 타깃인 엔소 페르난데스(첼시)를 마침내 영입할 수 있다면 벨링엄 매각도 고려할 의향이 있는 것으로 전해졌다""며 ""보도에 따르면 첼시의 소유주 그룹 블루코는 2026-27시즌이 시작되기 전 벨링엄 영입을 성사하길 희망하고 있다""고 했다.

계속해서 ""이에 따라 두 선수 모두가 포함된 거래를 논의할 기회가 양 구단에 열릴 수 있으며, 첼시가 페르난데스를 포함한 제안을 할 경우 페레스 회장과 레알 마드리드 수뇌부의 결단을 심각하게 시험할 수 있는 카드가 될 것으로 전해졌다""고 했다.

레알 마드리드와 첼시가 스왑딜을 진행할지는 모르지만, 만약 레알 마드리드가 벨링엄을 판다면 1억 2000만 파운드(약 2400억 원) 이상을 요구할 것으로 보인다.
엔소 페르난데스./게티이미지코리아

페르난데스의 몸값도 높을 것으로 보인다. 첼시는 2023년 1월 벤피카에 1억 600만 파운드(약 2100억 원)를 지급하고 페르난데스를 데려왔다. 2031년 6월 계약이 만료되는 그는 첼시 유니폼을 입고 150경기를 뛰었다.

'스포츠바이블'은 ""다만 레알 마드리드나 첼시가 페르난데스 혹은 벨링엄을 둘러싼 잠재적 거래를 본격적으로 추진하더라도, 두 선수 중 누가 이적에 열려 있을지는 아직 불확실하다""며 ""두 선수 모두 현재 소속 팀에서 자리를 잡았으며, 최근 몇 시즌 동안 구단의 성공에 핵심적인 역할을 해왔다""고 전했다.

이어 ""그럼에도 벨링엄에게 PL 복귀는 분명 매력적인 선택지가 될 수 있으며, 페르난데스에게 유럽에서 가장 성공적인 클럽으로의 이적 역시 충분히 끌릴 만한 제안이 될 수 있다""고 덧붙였다."
