date,title,content
20260219,‘굿바이 이강인’→“재계약 협상 중단” 6관왕 대역사 함께 달성한 엔리케 감독 “PSG 떠나 친정 바르셀로나 복귀 원해”,"프리시즌 투어를 위해 방한한 파리 생제르맹(PSG) 루이스 엔리케 감독이 3일 부산아시아드주경기장에서 열린 K리그1 전북 현대와의 쿠팡플레이 3차전 경기에서 이강인에게 지시하고 있다. 문재원 기자


26일 AC밀란(이탈리아)과의 유럽 챔피언스리그 홈경기에서 골을 넣으며 승리를 이끈 이강인(PSG)이 경기가 끝난 뒤 루이스 엔리케 감독의 축하를 받고 있다. AP연합뉴스


파리 생제르맹(PSG)과 루이스 엔리케의 재계약 협상이 중단됐다. 여기에 엔리케가 FC 바르셀로나 복귀를 원하고 있다는 주장이 나왔다.

스페인 매체 ‘피차헤스’는 19일(한국시간) 또 다른 스페인 언론 ‘엘 나시오날’ 내용을 인용 “엔리케 감독은 PSG와 재계약 협상을 중단하기로 했다”고 보도했다.

이어 “이 소식은 PSG를 흔들고 있다. 엔리케 감독의 결정은 바르셀로나 복귀를 향한 치밀한 계획으로 보인다”며 “바르셀로나 이사회는 한지 플릭 감독의 성적을 존중한다. 그러나 엔리케 감독을 그리워하고 있다. 그가 보여준 ‘유럽 트레블’이라는 눈부신 성과를 팬들도 잊을 수 없다. 이런 관심 속 엔리케 본인도 재계약 대신 친정으로 돌아가길 원한다”고 밝혔다.

루이스 엔리케 PSG 감독이 지난해 8월 UEFA 슈퍼컵 우승을 달성한 뒤 트로피를 들고 기뻐하고 있다. Getty Images코리아



엔리케 감독은 PSG와 다가오는 2027년 6월 30일까지 계약이다. 즉, 2026-2027시즌이 끝나면 팀을 떠난다. 엔리케는 1970년생 스페인 국적의 축구 선수 출신 감독이다. 선수 시절 스페인 대표 명문 구단 레알 마드리드와 FC 바르셀로나에서 활약한 특이한 이력을 가진 선수였다.

엔리케는 주 포지션인 측면 공격수 이외에도 미드필더 전 포지션과 세컨드 스트라이커, 최전방 공격수, 심지어 풀백도 소화했다. 강인한 투쟁심과 다양한 포지션을 섭렵하는 다재다능함으로 축구 팬들의 많은 사랑을 받았다.

은퇴 후 지도자의 길을 걸었다. 친정 바르셀로나 B팀을 시작으로 AS 로마, 셀타 비고, 바르셀로나(1군), 스페인 대표팀을 감독으로 지휘했다.

지도자로 이름을 세계에 각인시킨 건 바르셀로나 시절이다. 스페인 1부리그(라리가), 스페인 FA컵으로 불리는 국왕컵(코파 델 레이), 유럽축구연맹(UEFA) 챔피언스리그를 2014-2015시즌에 모두 우승해 유럽 트레블을 달성했다.

루이스 엔리케 감독이 바르셀로나 감독 시절인 2017년 5월 코파델레이 우승컵을 놓고 딸 자나와 기념 사진을 찍고 있다. 게티이미지



2015년 당시 UEFA 챔피언스리그 우승 후 바르셀로나 루이스 엔리케 감독이 깃발을 흔드는 자나를 보고 있다. AFP 자료사진


당시 UEFA 챔피언스리그 결승전은 아직도 화제다. 결승전은 독일 베를린에서 열렸다. 상대는 이탈리아 대표 명문 구단 유벤투스였다. 유벤투스는 세계 최고의 골키퍼 잔루이지 부폰을 필두로 레오나르도 보누치, 안드레아 바르찰리, 파티스 에브라의 철벽 수비라인과 클라우디오 마르키시오, 안드레아 피를로, 폴 포그바, 아르투로 비달이라는 역대급 허리 라인을 보유하고 있었다.

바르셀로나도 마찬가지다. 리오넬 메시, 루이스 수아레스, 네이마르까지 일명 ‘MSN’이라 불리는 축구 역사상 가장 위대한 공격 트리오가 있었다.
중원에는 안드레스 이니에스타, 이반 라키티치, 세르히오 부스케츠, 사비 에르난데스 등 유벤투스에 전혀 밀리지 않았다. 바르셀로나는 결승전에서 유벤투스를 3-1로 격파했다. 엔리케가 이끈 바르셀로나는 축구 역사 최초 ‘2회 트레블’을 달성한 팀이 됐다.

그리고 2023년 PSG 지휘봉을 잡았다. 이강인과 선수단을 이끌고 지난 시즌(2024-2025) PSG 구단 역사 첫 유럽 트레블을 해냈다. 한 번도 어려운 업적을 두 번이나 각자 다른 구단에서 해낸 그는 그야말로 명장이라는 칭호가 아깝지 않았다.

PSG로서는 이런 엔리케 감독을 놓치고 싶지 않을 것이다. 그러나 감독은 구단에 재계약을 고려하지 않고 있다고 통보한 것으로 알려졌다. 이강인은 2028년 6월 30일까지 PSG와 함께하는 것으로 알려졌다. 계약과 알려진 정보대로 진행되면 엔리케 감독이 이강인보다 먼저 PSG를 떠난다.

용환주 기자 dndhkr159@kyunghyang.com"
20260219,"""데 헤아와는 다르다""…맨유 GK 코치가 밝힌 라멘스의 차이, ""경험은 부족해도 훈련 태도는 최고""","사진=게티이미지


[포포투=김호진]

맨체스터 유나이티드의 새로운 골키퍼 센느 라멘스를 향한 긍정적인 평가가 이어지고 있다.

맨유 소식을 주로 다루는 '유나이티드 인 포커스'는 19일(한국시간) 맨유 골키퍼 코치인 스틸의 발언을 전했다. 그는 라멘스의 가장 큰 강점으로 '훈련 태도와 성장 의지'를 꼽았다.

스틸은 ""라멘스는 월요일부터 금요일까지 꾸준히 훈련에 매달리고 있다. 필요한 훈련을 반복적으로 소화하며 발전하고 있다. 코칭의 핵심은 같은 동작을 반복하되 다양한 방식으로 수행하는 것이다. 그는 지금 그 과정을 잘 따라가고 있다""고 평가했다.

이어 그는 라멘스와 구단 레전드 다비드 데 헤아의 차이로 '경험'을 짚었다. 라멘스가 맨유 이적 전까지 벨기에 리그에서만 활약한 반면, 데 헤아는 아틀레티코 마드리드 시절 유럽 대항전을 경험하며 유럽축구연맹(UEFA) 유로파리그(UEL) 우승까지 이뤄냈다는 점을 강조했다.

사진=게티이미지


스틸은 ""벨기에 리그에서 위협적인 장거리 슈팅을 시도하는 선수를 얼마나 떠올릴 수 있겠나. 하지만 잉글랜드 프리미어리그(PL)에서는 거의 모든 팀이 그런 선수를 보유하고 있다""고 설명했다.

이어 ""요즘은 인버티드 윙어도 많다. 벨기에 리그를 낮게 평가하는 것은 아니지만, 라멘스는 이제 완전히 다른 수준의 환경에 놓여 있다""고 덧붙였다.

그럼에도 라멘스는 빠르게 적응하고 있다. 2002년생 벨기에 출신인 그는 193cm의 큰 신장을 바탕으로 안정적인 선방 능력과 빠른 반사 신경을 갖췄다. 탄탄한 체격에도 유연한 움직임을 보여주며, 대표팀 선배 티보 쿠르투아를 연상시킨다는 평가와 함께 '제2의 쿠르투아'라는 별명도 얻었다.

약점으로 지적되던 롱킥 역시 점차 개선되고 있다는 평가다. 특히 짧은 패스를 활용한 빌드업과 수비 라인 컨트롤 능력까지 갖추며 현대 축구가 요구하는 골키퍼 유형에 가까운 모습을 보이고 있다.

현재 라멘스는 맨유에서 주전 골키퍼로 자리 잡았다. 이에 알렉스 퍼거슨 전 감독도 ""(라멘스에 대해) 좋은 신호들이 보인다. 몇 경기밖에 치르지 않았지만 인상적이다""라며 기대감을 드러냈다.

사진=게티이미지"
20260219,"반가우면서도 한편으론 씁쓸한 현지 전망 나왔다…“김민재, 프랑크푸르트전 타 대신 선발 가능성 커”","[골닷컴] 강동훈 기자 = 최근 들어서 빈센트 콤파니(39·벨기에) 감독으로부터 기회를 받지 못한 데다, ‘방출설’까지 나오면서 입지가 더 줄어든 ‘코리안 몬스터’ 김민재(29·바이에른 뮌헨)가 2경기 연속 출전 기회를 잡을 수도 있을 거란 전망이 나왔다.

19일(한국시간) 독일 매체 키커에 따르면 김민재는 오는 21일 알리안츠 아레나에서 펼쳐지는 아인트라흐트 프랑크푸르트전에서 선발 출전할 가능성이 크다. 김민재가 만약 아인트라흐트 프랑크푸르트전에서 스타팅 라인업에 이름을 올리게 되면 2경기 연속 선발 출전이다. 앞서 그는 지난 14일 베저슈타디온에서 끝난 베르더 브레멘전에서 풀타임을 소화했다.


매체는 “콤파니 감독은 조나탄 타가 현재 경고 4장을 받은 상태라 (출전정지 징계 위기에 있어) 아인트라흐트 프랑크푸르트전에서 휴식을 부여할 거로 보인다”며 “그나마 다행인 건 타의 경우 콤파니 감독 입장에서 대체하기 수월하다. 이미 올 시즌 정기적으로 센터백 로테이션을 가동하고 있기 때문”이라고 설명했다.

다만 김민재 입장에서 타를 대신해 아인트라흐트 프랑크푸르트전에 선발 출전하는 게 마냥 달갑지만은 않다. 현재 처한 상황을 놓고 보면 찬밥 더운밥 가릴 처지가 아니지만 경기의 중요성을 고려하면 여전히 콤파니 감독은 김민재 보다 타를 우선시하고 있다는 현실을 보여주기 때문이다.


콤파니 감독은 아인트라흐트 프랑크푸르트전보다 내달 1일 지그날 이두나 파크에서 열리는 보루시아 도르트문트전을 더 중요하게 생각하고 있다. 2위 보루시아 도르트문트(승점 51)가 승점 차를 어느새 6점까지 좁히면서 바짝 쫓아오고 있기 때문이다.

이에 보루시아 도르트문트전에 총력을 기울이고자 아인트라흐트 프랑크푸르트전은 일부 선수들에게 휴식을 부여하고, 또 경고 4장을 받고 있는 타와 조슈아 키미히, 레온 고레츠카 등도 최대한 아낄 거로 관측되고 있다. 김민재 입장에선 2경기 연속 선발 출전할 수 있는 기회지만 한편으로는 씁쓸한 감정이 들 법도 한 상황이다.

사진 = 게티이미지"
20260219,"""유니폼 팔이용인가"" 中 15억 열광했는데 굴욕...'울버햄튼 입성' 21세 유망주 벌써 '방출설' 제기","사진=소후 닷컴


[포포투=김아인]

중국 U-23 축구 대표팀의 주장 쉬빈이 프리미어리그(PL) 울버햄튼에 입성했지만, 중국 현지에서는 '유니폼 판매용 마케팅'이 아니냐는 비관적인 의견과 혹평을 쏟아내고 있다. 

2004년생인 쉬빈은 중국 축구계가 자랑하는 유망주다. 스페인 유학파 출신으로 광저우 FC 유스를 거쳐 프로에 데뷔한 그는 지난 시즌 칭다오 웨스트 코스트의 주축 미드필더로 활약하며 이름을 알렸다. 특히 2026 아시아축구연맹(AFC) U-23 아시안컵에서 주장 완장을 차고 중국을 22년 만에 결승으로 이끌며 유럽 스카우트들의 눈도장을 찍었다.
이런 활약으로 프리미어리그 입성이 성사됐다. 중국 자본인 푸싱 그룹을 모기업으로 둔 울버햄튼은 이전부터 쉬빈을 주시해왔고, 결국 지난 1일(이하 한국시간) 그의 영입을 전격 발표했다. 중국 팬들은 15억 인구를 대표하는 새로운 프리미어리거의 탄생에 크게 열광했다.

하지만 기쁨의 시간은 짧았다. 중국 '소후닷컴'에 따르면, 중국 팬들은 강등 위기에 처한 팀 상황에서 즉시 전력감이 아닌 중국 유망주를 영입한 것에 분노를 터뜨리고 있다. 매체는 ""이적 단 3일 만에 쉬빈은 '울버햄튼 100년 역사상 가장 수치스러운 계약'이라는 낙인이 찍혔다""고 이야기했다.

먼저 잉글랜드 현지 팬들이 쉬빈의 기술적 한계를 조목조목 지적하고 있다고 말했다. 일부 팬 포럼에서는 그의 경기 영상을 분석하며 ""턴이 너무 느리고 몸싸움을 두려워한다""거나 ""수비 범위가 팀 마스코트보다 좁다""는 비아냥이 쏟아졌다. 특히 ""우리는 중국 시장용 홍보 도구가 아니다""라는 게시글은 수만 건의 공감을 얻으며 구단의 상업적 행태를 비판하는 목소리에 힘을 실었다.

기록 면에서도 회의적인 시각이 지배적이다. 쉬빈이 아시안컵에서 기록한 경기당 12.5km의 활동량과 높은 패스 성공률에 대해, 현지 전문가들은 ""중국 리그보다 스프린트 횟수가 2.3배 많고 경합 강도가 47%나 높은 프리미어리그에서는 의미 없는 '공허한 통계'일 뿐""이라고 일축했다.

일각에서는 쉬빈이 잉글랜드 내 워크 퍼밋(취업 비자) 점수를 채우지 못해 하부 리그 임대지를 전전하다 결국 방출될 것이라는 비관적인 전망까지 내놓고 있다. 3부 리그격인 반즐리 FC 임대설이 나오고 있으나, 이마저도 유스팀(U-21)에 머물 것이라는 추측이 나오면서 중국 팬들의 우려도 깊어지는 모양새다.

사진=소후 닷컴"
20260219,손흥민 기립박수! 챔스 데뷔전부터 1골 3도움…프리시즌 안 뛰어도 완벽 → 이제 메시 대적하러 간다,"▲ CONCACAF 챔피언스컵은 1962년 출범해 올해로 61회를 맞은 북중미카리브해 지역 최고 권위의 클럽 대항전이다. 유럽의 UEFA 챔피언스리그, 아시아의 AFC 챔피언스리그 엘리트에 해당하는 무대다. 손흥민은 첫 데뷔전부터 1골 3도움을 올렸다. ⓒ LAFC


[스포티비뉴스=조용운 기자] 기립박수가 쏟아지는 광경은 그야말로 장관이었다. 2026년 새해의 포문을 여는 첫 공식전에서 손흥민(34, 로스앤젤레스FC)이 마수걸이 득점과 더불어 경이로운 도움 해트트릭을 폭발했다.

LAFC는 지난 18일 온두라스 산페드로술라에 위치한 프란시스코 모라산 스타디움에서 열린 2026 북중미카리브해축구연맹(CONCACAF) 챔피언스컵 1라운드 1차전 원정 경기에서 레알 에스파냐를 6-1로 대파했다.

북중미판 챔피언스리그로 불리는 이 대회는 우승 시 국제축구연맹(FIFA) 클럽 월드컵 출전권이 주어지는 최고 권위의 무대다. 2020년과 2023년 두 차례 준우승에 머물렀던 LAFC는 올해 손흥민을 앞세워 다시 한번 정상 탈환을 위한 첫발을 뗐다.
유럽챔피언스리그에서 숱한 경험을 했던 손흥민 입장에서는 색다른 북중미 챔피언스리그 데뷔전이었던 셈이다. 그런데도 첫 경기부터 가장 화려한 장면을 연출했다. 후반 17분 임무를 완수한 손흥민이 교체되어 나오자 경기장을 가득 메운 온두라스 팬들은 일제히 일어나 뜨거운 기립박수를 보냈다.

적군조차 매료시킨 손흥민의 품격에 현지 취재진도 감탄을 금치 못했다. 온두라스 매체 'TDTV'는 ""전반전에만 경기를 끝내버린 손흥민의 원맨쇼에 팬들은 열광했고, 그가 경기장을 빠져나가는 순간은 이번 대회 최고의 명장면이었다""고 극찬했다.

▲ CONCACAF 챔피언스컵은 1962년 출범해 올해로 61회를 맞은 북중미카리브해 지역 최고 권위의 클럽 대항전이다. 유럽의 UEFA 챔피언스리그, 아시아의 AFC 챔피언스리그 엘리트에 해당하는 무대다. 손흥민은 첫 데뷔전부터 1골 3도움을 올렸다. ⓒ연합뉴스/EPA


온두라스가 경외심을 표할 정도로 손흥민은 경기 초반부터 완벽한 승리를 설계했다. 전반 3분 드니 부앙가의 선제 페널티킥 골로 기선을 제압한 LAFC는 곧바로 손흥민의 패스를 가동했다. 전반 11분 중원에서 공을 잡은 손흥민은 수비수 대여섯 명의 시선을 한몸에 받으며 저돌적인 드리블로 공간을 창출했다. 이후 빈틈을 파고드는 다비드 마르티네스에게 자로 잰 듯한 침투 패스를 찔러 넣었고, 그대로 팀의 두 번째 골로 연결됐다.

직접 해결사로 나선 순간에도 자비는 없었다. 전반 22분 부앙가가 얻어낸 두 번째 페널티킥 상황에서 키커로 나선 손흥민은 골키퍼가 손쓸 수 없는 왼쪽 하단 구석으로 정교한 슈팅을 꽂아 넣어 2026년 시즌 1호 골을 신고했다. 예열을 마친 손흥민의 활약은 멈추지 않았다. 불과 2분 뒤인 전반 24분에도 상대 수비의 압박을 가볍게 벗겨낸 뒤 부앙가에게 완벽한 기회를 열어주며 자신의 두 번째 도움을 기록했다.

전반이 끝나기 전에 도움 해트트릭이라는 금자탑을 쌓았다. 전반 39분 왼쪽 측면에서 넘어온 크로스를 반대편 포스트에서 침착하게 잡아낸 손흥민은 욕심내지 않고 문전으로 날카로운 컷백을 내줬다. 이를 티모시 틸만이 감각적인 뒤꿈치 킥으로 마무리하며 전반에만 스코어를 5-0까지 벌리게 만들었다.

▲ CONCACAF 챔피언스컵은 1962년 출범해 올해로 61회를 맞은 북중미카리브해 지역 최고 권위의 클럽 대항전이다. 유럽의 UEFA 챔피언스리그, 아시아의 AFC 챔피언스리그 엘리트에 해당하는 무대다. 손흥민은 첫 데뷔전부터 1골 3도움을 올렸다. ⓒ연합뉴스/EPA


후반 들어 LAFC는 오는 22일로 예정된 인터 마이애미와의 미국프로축구 메이저리그사커(MLS) 개막전을 대비해 주축 선수들의 체력 안배에 집중했다. 손흥민은 62분간 그라운드를 누비며 패스 성공률 79%, 찬스 메이킹 5회, 빅 찬스 메이킹 3회라는 압도적인 지표를 남겼다.

축구 통계 매체 '풋몹'은 손흥민에게 평점 9.6점을 부여하며 만점에 가까운 평가를 내렸다. 프리시즌 결장으로 인한 팬들의 우려를 단 한 경기 만에 불식시킨 완벽한 경기였고, 상대 팬들조차 기립박수를 건넬 만큼 무결점 복귀전이었다.

이제 시선은 미국 본토로 향한다. 화려하게 예열을 마친 손흥민은 안방인 LA로 이동해 '축구의 신' 리오넬 메시와 운명의 맞대결을 펼친다. MLS 사무국은 새 시즌 개막전이자 리그를 대표하는 손흥민과 메시의 충돌을 기념해 특별히 7만 8천 석 대규모 건축물인 로스앤젤레스 메모리얼 콜리세움을 격전지로 택했다. 1932년과 1984년 하계 올림픽의 중심지였던 이 유서 깊은 장소에서 손흥민과 메시는 리그의 자존심을 건 승부를 벌이게 된다.

▲ CONCACAF 챔피언스컵은 1962년 출범해 올해로 61회를 맞은 북중미카리브해 지역 최고 권위의 클럽 대항전이다. 유럽의 UEFA 챔피언스리그, 아시아의 AFC 챔피언스리그 엘리트에 해당하는 무대다. 손흥민은 첫 데뷔전부터 1골 3도움을 올렸다. ⓒ연합뉴스/EPA"
20260219,“김민재 너무 비싸다” 韓 축구 ‘대충격’ 안길 토트넘 이적 무산→검증된 ‘PL 수비수’로 관심 전환 “매우 적극적”,"김민재. TAEGEUKCANUCK


토트넘 홋스퍼는 김민재 영입에 관심이 있지만, 이적료와 급여가 부담스러운 것 같다.

최근 김민재의 이적설이 큰 관심을 받았다. 독일 유력지 ‘빌트’는 “김민재는 빈센트 콤파니 감독 체제의 바이에른 뮌헨에서 안정적인 출전 기회를 받지 못하고 있다”며 “이런 상황을 인지하고 있는 첼시와 토트넘이 관심이 있다. 그를 영입 리스트에 올렸다”고 보도헀다.

하지만, 토트넘의 1순위는 김민재가 아닌 것 같다. 영국 매체 ‘팀 토크’는 19일(한국시간) 마테오 모레토 기자의 소식을 인용 “토트넘은 AFC 본머스의 수비수 마르코스 세네시 영입에 가장 큰 관심을 보이는 팀”이라고 보도했다.

이어 “세네시는 지금 본머스에서 매우 좋은 경기력을 보여주고 있다. 여러 프리미어리그(PL) 팀들도 영입을 고려하고 있다. 가장 적극적인 팀은 토트넘이다. 여기에 보루시아 도르트문트, 유벤투스도 제안을 준비 중”이라고 덧붙였다.

김민재 영입에 관심이 있는 것으로 알려진 첼시와 토트넘 홋스퍼. 365SCORES


토트넘 관점에서 세네시가 김민재보다 매력적일 수 있다. 가장 큰 건 이적료다.

독일 축구 이적시장 전문 사이트 ‘트랜스퍼마크트’에 따르면 세네시의 현재 추정 몸값은 2200만 유로(약 375억원)다. 또 다가오는 6월 30일 본머스와 계약이 종료된다. 재계약을 빨리 체결하지 않으면 자유 계약(FA)으로 이적료 0원에 풀릴 수 있는 엄청난 선수다.
본머스와 재계약을 피하고 있으면 이번 여름 매각이 필수다. 여기서 몸값이 더 하락할 가능성도 있다는 뜻이다. 반대로 김민재는 기본 이적료가 매우 비싸다.

김민재는 지난 2023-2024시즌 5000만 유로(약 862억원)라는 엄청난 이적료로 바이에른 유니폼을 입었다. 김민는 당시 이탈리아 세리에 A 우승과 올해의 수비수를 받은 최고의 선수였다. 전성기였던 만큼 바이에른도 그에 맞는 이적료를 투자했다.

지금은 다르다. 여전히 준수한 수비력을 보여주고 있지만, 소속팀에서 입지가 불안하다. 매번 이적시장에서 이적설이 나왔다. 그러나 다른 구단이 쉽게 김민재를 영입하지 못한 이유는 이적료 때문이다.

빌트 소속 축구 담당자 크리스티안 폴크와 토비 알트샤플은 지난해 10월 “뮌헨은 김민재를 판매 관련해 어떤 할인도 허용하지 않을 것이다. 5000만 유로를 투자해 그를 영입했으며, 이를 상당 부분 회수하길 원한다”라고 알렸다.

바이에른 뮌헨 김민재가 지난달 22일 유럽챔피언스리그 생질루아즈전에서 퇴장당한 뒤 아쉬운 표정으로 그라운드를 나서고 있다. AP연합뉴스


클뤼프 브뤼헤전에서 벤치에 앉아있는 김민재. 로이터연합뉴스


단순 몸값만 봐도 세네시의 두 배다. 여기에 선수가 원하는 연봉도 맞춰야 한다. 빌트의 스포츠 자매지 ‘스포르트 빌트’는 지난해 9월 뮌헨 선수들의 연봉을 추정치 조건으로 전부 공개했다.

김민재는 1700만 유로, 한화로 약 290억 원을 받는 것으로 드러났다. 독일 분데스리가에서 상위권에 속하는 급여다. 김민재가 받는 1700만 유로는 기본급은 아니다. 매체에 따르면 김민재의 기본 연봉은 1100만 유로(약 187억원)다. 여기에 매체는 15경기를 뛰면 보너스를 받게 되며, 경기 출전과 관련된 모든 보너스를 받으려면 매 시즌 47경기에 나서야 한다.

매체는 “유럽축구연맹(UEFA) 챔피언스리그와 독일축구협회(DFB) 포칼에서 4강에 오르는 것이 조건”이라고 설명했다. 보너스까지 합하면 세전 연봉이 300억 원 초과할 가능성이 크다. 즉, 김민재 영입을 진심으로 원하면, 넉넉하게 이적료 5000만 유로에 최대 연봉 300억 원을 지급할 능력이 있어야 한다.

토트넘은 이 조건이 너무 부담스러울 것이다. 괜히 세네시 영입에 가장 적극적인 팀이 아니다. 그는 김민재와 다르게 이미 PL에서 검증된 수비수다. 다가오는 여름 이적시장이 열려야 더 정확한 이야기가 나오겠지만, 현재까지 소식으로는 토트넘이 김민재 영입에 더 적극적으로 나올지 미지수다.

용환주 기자 dndhkr159@kyunghyang.com"
